play_id,half,time_remaining_half,secs_remaining,secs_remaining_absolute,description,home_score,away_score,score_diff,play_length,win_prob,naive_win_prob,home,away,home_time_out_remaining,away_time_out_remaining,home_favored_by,game_id,date
1,1,20:00,2400,2400,PLAY,0,0,0,29,0.5,0.5,Providence,Arkansas,4,4,NA,273202507,2007-11-16
2,1,19:31,2371,2371,Jonathan Kale missed Two Point Layup.,0,0,0,0,0.5,0.5,Providence,Arkansas,4,4,NA,273202507,2007-11-16
3,1,19:31,2371,2371,Steven Hill Defensive Rebound.,0,0,0,8,0.5,0.5,Providence,Arkansas,4,4,NA,273202507,2007-11-16
4,1,19:23,2363,2363,Patrick Beverley missed Two Point Layup.,0,0,0,0,0.5,0.5,Providence,Arkansas,4,4,NA,273202507,2007-11-16
5,1,19:23,2363,2363,Michael Washington Offensive Rebound.,0,0,0,0,0.5,0.5,Providence,Arkansas,4,4,NA,273202507,2007-11-16
6,1,19:23,2363,2363,Michael Washington missed Two Point Layup.,0,0,0,0,0.5,0.5,Providence,Arkansas,4,4,NA,273202507,2007-11-16
7,1,19:23,2363,2363,Geoff McDermott Defensive Rebound.,0,0,0,10,0.5,0.5,Providence,Arkansas,4,4,NA,273202507,2007-11-16
8,1,19:13,2353,2353,Foul on Jonathan Kale,0,0,0,15,0.5,0.5,Providence,Arkansas,4,4,NA,273202507,2007-11-16
9,1,18:58,2338,2338,Michael Washington missed Three Point Jumper.,0,0,0,0,0.5,0.5,Providence,Arkansas,4,4,NA,273202507,2007-11-16
10,1,18:58,2338,2338,Jeff Xavier Defensive Rebound.,0,0,0,8,0.5,0.5,Providence,Arkansas,4,4,NA,273202507,2007-11-16
11,1,18:50,2330,2330,Jeff Xavier missed Two Point Layup.,0,0,0,0,0.5,0.5,Providence,Arkansas,4,4,NA,273202507,2007-11-16
12,1,18:50,2330,2330,Geoff McDermott Offensive Rebound.,0,0,0,4,0.5,0.5,Providence,Arkansas,4,4,NA,273202507,2007-11-16
13,1,18:46,2326,2326,Geoff McDermott made Two Point Dunk Shot.,2,0,2,48,0.5456135467511029,0.5456135467511029,Providence,Arkansas,4,4,NA,273202507,2007-11-16
14,1,17:58,2278,2278,Foul on Gary Ervin,2,0,2,3,0.5466784441662067,0.5466784441662067,Providence,Arkansas,4,4,NA,273202507,2007-11-16
15,1,17:55,2275,2275,Foul on Sonny Weems,2,0,2,25,0.5467457551815094,0.5467457551815094,Providence,Arkansas,4,4,NA,273202507,2007-11-16
16,1,17:30,2250,2250,Jeff Xavier missed Two Point Layup.,2,0,2,0,0.5473096679130885,0.5473096679130885,Providence,Arkansas,4,4,NA,273202507,2007-11-16
17,1,17:30,2250,2250,Vincent Hunter Defensive Rebound.,2,0,2,8,0.5473096679130885,0.5473096679130885,Providence,Arkansas,4,4,NA,273202507,2007-11-16
18,1,17:22,2242,2242,Patrick Beverley missed Three Point Jumper.,2,0,2,0,0.5474911634847673,0.5474911634847673,Providence,Arkansas,4,4,NA,273202507,2007-11-16
19,1,17:22,2242,2242,Providence Offensive Rebound.,2,0,2,9,0.5474911634847673,0.5474911634847673,Providence,Arkansas,4,4,NA,273202507,2007-11-16
20,1,17:13,2233,2233,Stefan Welsh missed Two Point Layup.,2,0,2,0,0.5476958944832517,0.5476958944832517,Providence,Arkansas,4,4,NA,273202507,2007-11-16
21,1,17:13,2233,2233,Brian McKenzie Defensive Rebound.,2,0,2,13,0.5476958944832517,0.5476958944832517,Providence,Arkansas,4,4,NA,273202507,2007-11-16
22,1,17:00,2220,2220,Geoff McDermott missed Three Point Jumper.,2,0,2,0,0.5479925671944532,0.5479925671944532,Providence,Arkansas,4,4,NA,273202507,2007-11-16
23,1,17:00,2220,2220,Patrick Beverley Defensive Rebound.,2,0,2,27,0.5479925671944532,0.5479925671944532,Providence,Arkansas,4,4,NA,273202507,2007-11-16
24,1,16:33,2193,2193,Brian McKenzie missed Three Point Jumper.,2,0,2,0,0.5486118585662413,0.5486118585662413,Providence,Arkansas,4,4,NA,273202507,2007-11-16
25,1,16:33,2193,2193,Patrick Beverley Defensive Rebound.,2,0,2,7,0.5486118585662413,0.5486118585662413,Providence,Arkansas,4,4,NA,273202507,2007-11-16
26,1,16:26,2186,2186,Foul on Jonathan Kale,2,0,2,0,0.548773006408573,0.548773006408573,Providence,Arkansas,4,4,NA,273202507,2007-11-16
27,1,16:26,2186,2186,Patrick Beverley made Free Throw.,2,1,1,0,0.5244447916132549,0.5244447916132549,Providence,Arkansas,4,4,NA,273202507,2007-11-16
28,1,16:26,2186,2186,Patrick Beverley made Free Throw.,2,2,0,13,0.5,0.5,Providence,Arkansas,4,4,NA,273202507,2007-11-16
29,1,16:13,2173,2173,Foul on Vincent Hunter,2,2,0,0,0.5,0.5,Providence,Arkansas,4,4,NA,273202507,2007-11-16
30,1,16:13,2173,2173,Foul,2,2,0,0,0.5,0.5,Providence,Arkansas,4,4,NA,273202507,2007-11-16
31,1,16:13,2173,2173,Dwain Williams made Free Throw.,3,2,1,0,0.52459578324734,0.52459578324734,Providence,Arkansas,4,4,NA,273202507,2007-11-16
32,1,16:13,2173,2173,Dwain Williams made Free Throw.,4,2,2,26,0.5490728195846096,0.5490728195846096,Providence,Arkansas,4,4,NA,273202507,2007-11-16
33,1,15:47,2147,2147,Foul on Dwain Williams,4,2,2,0,0.5496753190846927,0.5496753190846927,Providence,Arkansas,4,4,NA,273202507,2007-11-16
34,1,15:47,2147,2147,Official TV Timeout.,4,2,2,29,0.5496753190846927,0.5496753190846927,Providence,Arkansas,4,4,NA,273202507,2007-11-16
35,1,15:18,2118,2118,Brian McKenzie missed Two Point Jumper.,4,2,2,0,0.550353713567204,0.550353713567204,Providence,Arkansas,4,4,NA,273202507,2007-11-16
36,1,15:18,2118,2118,Randall Hanke Offensive Rebound.,4,2,2,7,0.550353713567204,0.550353713567204,Providence,Arkansas,4,4,NA,273202507,2007-11-16
37,1,15:11,2111,2111,Randall Hanke made Two Point Layup.,6,2,4,15,0.6000161089931656,0.6000161089931656,Providence,Arkansas,4,4,NA,273202507,2007-11-16
38,1,14:56,2096,2096,Darian Townes made Two Point Jumper.,6,4,2,23,0.5508733395399744,0.5508733395399744,Providence,Arkansas,4,4,NA,273202507,2007-11-16
39,1,14:33,2073,2073,Foul on Vincent Hunter,6,4,2,0,0.5514216087612552,0.5514216087612552,Providence,Arkansas,4,4,NA,273202507,2007-11-16
40,1,14:33,2073,2073,Brian McKenzie made Free Throw.,7,4,3,0,0.5767935672383472,0.5767935672383472,Providence,Arkansas,4,4,NA,273202507,2007-11-16
41,1,14:33,2073,2073,Brian McKenzie missed Free Throw.,7,4,3,0,0.5767935672383472,0.5767935672383472,Providence,Arkansas,4,4,NA,273202507,2007-11-16
42,1,14:33,2073,2073,Charles Thomas Defensive Rebound.,7,4,3,10,0.5767935672383472,0.5767935672383472,Providence,Arkansas,4,4,NA,273202507,2007-11-16
43,1,14:23,2063,2063,Patrick Beverley missed Two Point Jumper.,7,4,3,0,0.5771489308068657,0.5771489308068657,Providence,Arkansas,4,4,NA,273202507,2007-11-16
44,1,14:23,2063,2063,Arkansas Offensive Rebound.,7,4,3,18,0.5771489308068657,0.5771489308068657,Providence,Arkansas,4,4,NA,273202507,2007-11-16
45,1,14:05,2045,2045,Jeff Xavier made Three Point Jumper.,10,4,6,19,0.6519078798373444,0.6519078798373444,Providence,Arkansas,4,4,NA,273202507,2007-11-16
46,1,13:46,2026,2026,Foul on Geoff McDermott,10,4,6,0,0.6531817175978573,0.6531817175978573,Providence,Arkansas,4,4,NA,273202507,2007-11-16
47,1,13:46,2026,2026,Steven Hill made Free Throw.,10,5,5,0,0.6289104202996048,0.6289104202996048,Providence,Arkansas,4,4,NA,273202507,2007-11-16
48,1,13:46,2026,2026,Steven Hill missed Free Throw.,10,5,5,0,0.6289104202996048,0.6289104202996048,Providence,Arkansas,4,4,NA,273202507,2007-11-16
49,1,13:46,2026,2026,Alex Kellogg Defensive Rebound.,10,5,5,18,0.6289104202996048,0.6289104202996048,Providence,Arkansas,4,4,NA,273202507,2007-11-16
50,1,13:28,2008,2008,Foul on Geoff McDermott,10,5,5,56,0.6299546360167523,0.6299546360167523,Providence,Arkansas,4,4,NA,273202507,2007-11-16
51,1,12:32,1952,1952,Randall Hanke missed Two Point Jumper.,10,5,5,0,0.6332603890021914,0.6332603890021914,Providence,Arkansas,4,4,NA,273202507,2007-11-16
52,1,12:32,1952,1952,Patrick Beverley Defensive Rebound.,10,5,5,9,0.6332603890021914,0.6332603890021914,Providence,Arkansas,4,4,NA,273202507,2007-11-16
53,1,12:23,1943,1943,Charles Thomas made Two Point Layup.,10,7,3,8,0.5815484293667335,0.5815484293667335,Providence,Arkansas,4,4,NA,273202507,2007-11-16
54,1,12:15,1935,1935,Providence Full Timeout.,10,7,3,9,0.5818517387594804,0.5818517387594804,Providence,Arkansas,3,4,NA,273202507,2007-11-16
55,1,12:06,1926,1926,Foul on Charles Thomas,10,7,3,12,0.5821943825929489,0.5821943825929489,Providence,Arkansas,3,4,NA,273202507,2007-11-16
56,1,11:54,1914,1914,Brian McKenzie missed Two Point Layup.,10,7,3,0,0.5826508122878031,0.5826508122878031,Providence,Arkansas,3,4,NA,273202507,2007-11-16
57,1,11:54,1914,1914,Arkansas Defensive Rebound.,10,7,3,2,0.5826508122878031,0.5826508122878031,Providence,Arkansas,3,4,NA,273202507,2007-11-16
58,1,11:52,1912,1912,Official TV Timeout.,10,7,3,26,0.582726803458281,0.582726803458281,Providence,Arkansas,3,4,NA,273202507,2007-11-16
59,1,11:26,1886,1886,Stefan Welsh made Three Point Jumper.,10,10,0,18,0.5,0.5,Providence,Arkansas,3,4,NA,273202507,2007-11-16
60,1,11:08,1868,1868,Geoff McDermott made Two Point Layup.,12,10,2,37,0.5565653187903247,0.5565653187903247,Providence,Arkansas,3,4,NA,273202507,2007-11-16
61,1,10:31,1831,1831,Stefan Welsh missed Three Point Jumper.,12,10,2,0,0.5575221447672736,0.5575221447672736,Providence,Arkansas,3,4,NA,273202507,2007-11-16
62,1,10:31,1831,1831,Geoff McDermott Defensive Rebound.,12,10,2,8,0.5575221447672736,0.5575221447672736,Providence,Arkansas,3,4,NA,273202507,2007-11-16
63,1,10:23,1823,1823,Dwain Williams missed Two Point Jumper.,12,10,2,0,0.5577305120306533,0.5577305120306533,Providence,Arkansas,3,4,NA,273202507,2007-11-16
64,1,10:23,1823,1823,Charles Thomas Defensive Rebound.,12,10,2,6,0.5577305120306533,0.5577305120306533,Providence,Arkansas,3,4,NA,273202507,2007-11-16
65,1,10:17,1817,1817,Gary Ervin missed Two Point Jumper.,12,10,2,0,0.5578872436572678,0.5578872436572678,Providence,Arkansas,3,4,NA,273202507,2007-11-16
66,1,10:17,1817,1817,Alex Kellogg Defensive Rebound.,12,10,2,7,0.5578872436572678,0.5578872436572678,Providence,Arkansas,3,4,NA,273202507,2007-11-16
67,1,10:10,1810,1810,Dwain Williams missed Three Point Jumper.,12,10,2,0,0.558070640203388,0.558070640203388,Providence,Arkansas,3,4,NA,273202507,2007-11-16
68,1,10:10,1810,1810,Michael Washington Defensive Rebound.,12,10,2,48,0.558070640203388,0.558070640203388,Providence,Arkansas,3,4,NA,273202507,2007-11-16
69,1,9:22,1762,1762,Foul on Brian McKenzie,12,10,2,13,0.55934807645382,0.55934807645382,Providence,Arkansas,3,4,NA,273202507,2007-11-16
70,1,9:09,1749,1749,Alex Kellogg made Two Point Layup.,14,10,4,20,0.6177243772979365,0.6177243772979365,Providence,Arkansas,3,4,NA,273202507,2007-11-16
71,1,8:49,1729,1729,Stefan Welsh missed Three Point Jumper.,14,10,4,0,0.6187799742081802,0.6187799742081802,Providence,Arkansas,3,4,NA,273202507,2007-11-16
72,1,8:49,1729,1729,Jonathan Kale Defensive Rebound.,14,10,4,11,0.6187799742081802,0.6187799742081802,Providence,Arkansas,3,4,NA,273202507,2007-11-16
73,1,8:38,1718,1718,Foul on Stefan Welsh,14,10,4,0,0.6193683122860825,0.6193683122860825,Providence,Arkansas,3,4,NA,273202507,2007-11-16
74,1,8:38,1718,1718,Jeff Xavier made Free Throw.,15,10,5,0,0.6476179250663648,0.6476179250663648,Providence,Arkansas,3,4,NA,273202507,2007-11-16
75,1,8:38,1718,1718,Jeff Xavier missed Free Throw.,15,10,5,0,0.6476179250663648,0.6476179250663648,Providence,Arkansas,3,4,NA,273202507,2007-11-16
76,1,8:38,1718,1718,Patrick Beverley Defensive Rebound.,15,10,5,5,0.6476179250663648,0.6476179250663648,Providence,Arkansas,3,4,NA,273202507,2007-11-16
77,1,8:33,1713,1713,Foul on Jeff Xavier,15,10,5,0,0.6479438575118139,0.6479438575118139,Providence,Arkansas,3,4,NA,273202507,2007-11-16
78,1,8:33,1713,1713,Patrick Beverley made Free Throw.,15,11,4,0,0.6196376959118937,0.6196376959118937,Providence,Arkansas,3,4,NA,273202507,2007-11-16
79,1,8:33,1713,1713,Patrick Beverley made Free Throw.,15,12,3,33,0.5904940283204375,0.5904940283204375,Providence,Arkansas,3,4,NA,273202507,2007-11-16
80,1,8:00,1680,1680,Darian Townes missed Two Point Layup.,15,12,3,0,0.5918828178459989,0.5918828178459989,Providence,Arkansas,3,4,NA,273202507,2007-11-16
81,1,8:00,1680,1680,Providence Defensive Rebound.,15,12,3,4,0.5918828178459989,0.5918828178459989,Providence,Arkansas,3,4,NA,273202507,2007-11-16
82,1,7:56,1676,1676,Official TV Timeout.,15,12,3,33,0.5920497996476484,0.5920497996476484,Providence,Arkansas,3,4,NA,273202507,2007-11-16
83,1,7:23,1643,1643,Geoff McDermott missed Two Point Jumper.,15,12,3,0,0.5933957748006476,0.5933957748006476,Providence,Arkansas,3,4,NA,273202507,2007-11-16
84,1,7:23,1643,1643,Michael Washington Defensive Rebound.,15,12,3,7,0.5933957748006476,0.5933957748006476,Providence,Arkansas,3,4,NA,273202507,2007-11-16
85,1,7:16,1636,1636,Sonny Weems made Two Point Layup.,15,14,1,0,0.5315564604334229,0.5315564604334229,Providence,Arkansas,3,4,NA,273202507,2007-11-16
86,1,7:16,1636,1636,Foul on Dwain Williams,15,14,1,0,0.5315564604334229,0.5315564604334229,Providence,Arkansas,3,4,NA,273202507,2007-11-16
87,1,7:16,1636,1636,Sonny Weems made Free Throw.,15,15,0,26,0.5,0.5,Providence,Arkansas,3,4,NA,273202507,2007-11-16
88,1,6:50,1610,1610,Sonny Weems missed Three Point Jumper.,15,15,0,0,0.5,0.5,Providence,Arkansas,3,4,NA,273202507,2007-11-16
89,1,6:50,1610,1610,Providence Defensive Rebound.,15,15,0,2,0.5,0.5,Providence,Arkansas,3,4,NA,273202507,2007-11-16
90,1,6:48,1608,1608,Foul on Michael Washington,15,15,0,0,0.5,0.5,Providence,Arkansas,3,4,NA,273202507,2007-11-16
91,1,6:48,1608,1608,Jonathan Kale made Free Throw.,16,15,1,0,0.531938158902778,0.531938158902778,Providence,Arkansas,3,4,NA,273202507,2007-11-16
92,1,6:48,1608,1608,Jonathan Kale made Free Throw.,17,15,2,14,0.5636167497625443,0.5636167497625443,Providence,Arkansas,3,4,NA,273202507,2007-11-16
93,1,6:34,1594,1594,Patrick Beverley made Two Point Jumper.,17,17,0,8,0.5,0.5,Providence,Arkansas,3,4,NA,273202507,2007-11-16
94,1,6:26,1586,1586,Foul on Michael Washington,17,17,0,0,0.5,0.5,Providence,Arkansas,3,4,NA,273202507,2007-11-16
95,1,6:26,1586,1586,Dwain Williams made Free Throw.,18,17,1,0,0.5322369983066569,0.5322369983066569,Providence,Arkansas,3,4,NA,273202507,2007-11-16
96,1,6:26,1586,1586,Dwain Williams made Free Throw.,19,17,2,9,0.5642070943841324,0.5642070943841324,Providence,Arkansas,3,4,NA,273202507,2007-11-16
97,1,6:17,1577,1577,Foul on Weyinmi Efejuku,19,17,2,2,0.5644495131902486,0.5644495131902486,Providence,Arkansas,3,4,NA,273202507,2007-11-16
98,1,6:15,1575,1575,Charles Thomas missed Free Throw.,19,17,2,0,0.5645035216796268,0.5645035216796268,Providence,Arkansas,3,4,NA,273202507,2007-11-16
99,1,6:15,1575,1575,Jonathan Kale Defensive Rebound.,19,17,2,14,0.5645035216796268,0.5645035216796268,Providence,Arkansas,3,4,NA,273202507,2007-11-16
100,1,6:01,1561,1561,Arkansas Full Timeout.,19,17,2,12,0.5648834878989789,0.5648834878989789,Providence,Arkansas,3,3,NA,273202507,2007-11-16
101,1,5:49,1549,1549,Steven Hill made Two Point Layup.,19,19,0,15,0.5,0.5,Providence,Arkansas,3,3,NA,273202507,2007-11-16
102,1,5:34,1534,1534,Jonathan Kale missed Two Point Layup.,19,19,0,4,0.5,0.5,Providence,Arkansas,3,3,NA,273202507,2007-11-16
103,1,5:30,1530,1530,Geoff McDermott Offensive Rebound.,19,19,0,2,0.5,0.5,Providence,Arkansas,3,3,NA,273202507,2007-11-16
104,1,5:28,1528,1528,Geoff McDermott made Two Point Layup.,21,19,2,4,0.5657991774203687,0.5657991774203687,Providence,Arkansas,3,3,NA,273202507,2007-11-16
105,1,5:24,1524,1524,Jeff Xavier made Three Point Jumper.,24,19,5,39,0.659930843548042,0.659930843548042,Providence,Arkansas,3,3,NA,273202507,2007-11-16
106,1,4:45,1485,1485,Jonathan Kale made Two Point Layup.,26,19,7,32,0.7200170794987923,0.7200170794987923,Providence,Arkansas,3,3,NA,273202507,2007-11-16
107,1,4:13,1453,1453,Geoff McDermott made Two Point Jumper.,28,19,9,22,0.7743409811053223,0.7743409811053223,Providence,Arkansas,3,3,NA,273202507,2007-11-16
108,1,3:51,1431,1431,Official TV Timeout.,28,19,9,15,0.7766236977814414,0.7766236977814414,Providence,Arkansas,3,3,NA,273202507,2007-11-16
109,1,3:36,1416,1416,Jeff Xavier missed Two Point Layup.,28,19,9,1,0.7781183191887701,0.7781183191887701,Providence,Arkansas,3,3,NA,273202507,2007-11-16
110,1,3:35,1415,1415,Jonathan Kale Offensive Rebound.,28,19,9,1,0.7782164628190318,0.7782164628190318,Providence,Arkansas,3,3,NA,273202507,2007-11-16
111,1,3:34,1414,1414,Jonathan Kale missed Two Point Layup.,28,19,9,1,0.7783144373740556,0.7783144373740556,Providence,Arkansas,3,3,NA,273202507,2007-11-16
112,1,3:33,1413,1413,Vincent Hunter Defensive Rebound.,28,19,9,8,0.7784122460383648,0.7784122460383648,Providence,Arkansas,3,3,NA,273202507,2007-11-16
113,1,3:25,1405,1405,Sonny Weems missed Three Point Jumper.,28,19,9,0,0.7791891241101659,0.7791891241101659,Providence,Arkansas,3,3,NA,273202507,2007-11-16
114,1,3:25,1405,1405,Sonny Weems Offensive Rebound.,28,19,9,33,0.7791891241101659,0.7791891241101659,Providence,Arkansas,3,3,NA,273202507,2007-11-16
115,1,2:52,1372,1372,Foul on Jeff Xavier,28,19,9,0,0.7823183359751497,0.7823183359751497,Providence,Arkansas,3,3,NA,273202507,2007-11-16
116,1,2:52,1372,1372,Patrick Beverley made Free Throw.,28,20,8,0,0.7571452446781346,0.7571452446781346,Providence,Arkansas,3,3,NA,273202507,2007-11-16
117,1,2:52,1372,1372,Patrick Beverley missed Free Throw.,28,20,8,0,0.7571452446781346,0.7571452446781346,Providence,Arkansas,3,3,NA,273202507,2007-11-16
118,1,2:52,1372,1372,Alex Kellogg Defensive Rebound.,28,20,8,29,0.7571452446781346,0.7571452446781346,Providence,Arkansas,3,3,NA,273202507,2007-11-16
119,1,2:23,1343,1343,Weyinmi Efejuku made Two Point Dunk Shot.,30,20,10,13,0.8083233548949357,0.8083233548949357,Providence,Arkansas,3,3,NA,273202507,2007-11-16
120,1,2:10,1330,1330,Foul on Jonathan Kale,28,20,8,0,0.7609315295752137,0.7609315295752137,Providence,Arkansas,3,3,NA,273202507,2007-11-16
121,1,2:10,1330,1330,Patrick Beverley made Free Throw.,30,21,9,0,0.786258378389036,0.786258378389036,Providence,Arkansas,3,3,NA,273202507,2007-11-16
122,1,2:10,1330,1330,Patrick Beverley made Free Throw.,30,22,8,18,0.7609315295752137,0.7609315295752137,Providence,Arkansas,3,3,NA,273202507,2007-11-16
123,1,1:52,1312,1312,Foul on Weyinmi Efejuku,30,22,8,7,0.762590767080205,0.762590767080205,Providence,Arkansas,3,3,NA,273202507,2007-11-16
124,1,1:45,1305,1305,Foul on Ray Hall,30,22,8,0,0.763247362025644,0.763247362025644,Providence,Arkansas,3,3,NA,273202507,2007-11-16
125,1,1:45,1305,1305,Charles Thomas made Free Throw.,30,23,7,0,0.7357987486017279,0.7357987486017279,Providence,Arkansas,3,3,NA,273202507,2007-11-16
126,1,1:45,1305,1305,Charles Thomas missed Free Throw.,30,23,7,0,0.7357987486017279,0.7357987486017279,Providence,Arkansas,3,3,NA,273202507,2007-11-16
127,1,1:45,1305,1305,Darian Townes Offensive Rebound.,30,23,7,8,0.7357987486017279,0.7357987486017279,Providence,Arkansas,3,3,NA,273202507,2007-11-16
128,1,1:37,1297,1297,Darian Townes made Two Point Tip Shot.,30,25,5,21,0.6757340039310207,0.6757340039310207,Providence,Arkansas,3,3,NA,273202507,2007-11-16
129,1,1:16,1276,1276,Foul on Weyinmi Efejuku,30,25,5,19,0.6772962422866732,0.6772962422866732,Providence,Arkansas,3,3,NA,273202507,2007-11-16
130,1,0:57,1257,1257,Dwain Williams missed Two Point Jumper.,30,25,5,0,0.6787822442474266,0.6787822442474266,Providence,Arkansas,3,3,NA,273202507,2007-11-16
131,1,0:57,1257,1257,Alex Kellogg Offensive Rebound.,30,25,5,15,0.6787822442474266,0.6787822442474266,Providence,Arkansas,3,3,NA,273202507,2007-11-16
132,1,0:42,1242,1242,Brian McKenzie made Two Point Jumper.,32,25,7,12,0.7418045286097618,0.7418045286097618,Providence,Arkansas,3,3,NA,273202507,2007-11-16
133,1,0:30,1230,1230,Darian Townes made Two Point Dunk Shot.,32,27,5,0,0.6810410224244821,0.6810410224244821,Providence,Arkansas,3,3,NA,273202507,2007-11-16
134,1,0:30,1230,1230,Foul on Geoff McDermott,32,27,5,0,0.6810410224244821,0.6810410224244821,Providence,Arkansas,3,3,NA,273202507,2007-11-16
135,1,0:30,1230,1230,Darian Townes made Free Throw.,32,28,4,23,0.6472214616941595,0.6472214616941595,Providence,Arkansas,3,3,NA,273202507,2007-11-16
136,1,0:07,1207,1207,Dwain Williams missed Three Point Jumper.,32,28,4,0,0.6489754549123071,0.6489754549123071,Providence,Arkansas,3,3,NA,273202507,2007-11-16
137,1,0:07,1207,1207,Ray Hall Offensive Rebound.,32,28,4,1,0.6489754549123071,0.6489754549123071,Providence,Arkansas,3,3,NA,273202507,2007-11-16
138,1,0:06,1206,1206,Ray Hall missed Two Point Tip Shot.,32,28,4,0,0.6490534395846368,0.6490534395846368,Providence,Arkansas,3,3,NA,273202507,2007-11-16
139,1,0:06,1206,1206,Providence Offensive Rebound.,32,28,4,5,0.6490534395846368,0.6490534395846368,Providence,Arkansas,3,3,NA,273202507,2007-11-16
140,1,0:01,1201,1201,Jeff Xavier missed Three Point Jumper.,32,28,4,0,0.649440775217143,0.649440775217143,Providence,Arkansas,3,3,NA,273202507,2007-11-16
141,1,0:01,1201,1201,null,32,28,4,1,0.649440775217143,0.649440775217143,Providence,Arkansas,3,3,NA,273202507,2007-11-16
142,1,0:00,1200,1200,End of the 1st Half.,32,28,4,0,0.6495177425372646,0.6495177425372646,Providence,Arkansas,3,3,NA,273202507,2007-11-16
143,2,20:00,1200,1200,PLAY,32,28,4,28,0.6495177425372646,0.6495177425372646,Providence,Arkansas,4,4,NA,273202507,2007-11-16
144,2,19:32,1172,1172,Patrick Beverley missed Two Point Layup.,32,28,4,0,0.6516168055755645,0.6516168055755645,Providence,Arkansas,4,4,NA,273202507,2007-11-16
145,2,19:32,1172,1172,Geoff McDermott Defensive Rebound.,32,28,4,7,0.6516168055755645,0.6516168055755645,Providence,Arkansas,4,4,NA,273202507,2007-11-16
146,2,19:25,1165,1165,Brian McKenzie missed Three Point Jumper.,32,28,4,0,0.6521283645844388,0.6521283645844388,Providence,Arkansas,4,4,NA,273202507,2007-11-16
147,2,19:25,1165,1165,Arkansas Defensive Rebound.,32,28,4,29,0.6521283645844388,0.6521283645844388,Providence,Arkansas,4,4,NA,273202507,2007-11-16
148,2,18:56,1136,1136,Foul on Jeff Xavier,32,28,4,5,0.6542192268636038,0.6542192268636038,Providence,Arkansas,4,4,NA,273202507,2007-11-16
149,2,18:51,1131,1131,Dwain Williams missed Two Point Layup.,32,28,4,0,0.6545779701122947,0.6545779701122947,Providence,Arkansas,4,4,NA,273202507,2007-11-16
150,2,18:51,1131,1131,Ray Hall Offensive Rebound.,32,28,4,2,0.6545779701122947,0.6545779701122947,Providence,Arkansas,4,4,NA,273202507,2007-11-16
151,2,18:49,1129,1129,Ray Hall missed Two Point Layup.,32,28,4,1,0.6547215308742119,0.6547215308742119,Providence,Arkansas,4,4,NA,273202507,2007-11-16
152,2,18:48,1128,1128,Arkansas Defensive Rebound.,32,28,4,10,0.6547933347042283,0.6547933347042283,Providence,Arkansas,4,4,NA,273202507,2007-11-16
153,2,18:38,1118,1118,Patrick Beverley missed Two Point Jumper.,32,28,4,0,0.6555128186475119,0.6555128186475119,Providence,Arkansas,4,4,NA,273202507,2007-11-16
154,2,18:38,1118,1118,Geoff McDermott Defensive Rebound.,32,28,4,20,0.6555128186475119,0.6555128186475119,Providence,Arkansas,4,4,NA,273202507,2007-11-16
155,2,18:18,1098,1098,Dwain Williams missed Three Point Jumper.,32,28,4,0,0.656967266490026,0.656967266490026,Providence,Arkansas,4,4,NA,273202507,2007-11-16
156,2,18:18,1098,1098,Brian McKenzie Offensive Rebound.,32,28,4,6,0.656967266490026,0.656967266490026,Providence,Arkansas,4,4,NA,273202507,2007-11-16
157,2,18:12,1092,1092,Brian McKenzie made Two Point Layup.,34,28,6,32,0.7266435857563123,0.7266435857563123,Providence,Arkansas,4,4,NA,273202507,2007-11-16
158,2,17:40,1060,1060,Jeff Xavier missed Two Point Jumper.,34,28,6,0,0.7298629936248189,0.7298629936248189,Providence,Arkansas,4,4,NA,273202507,2007-11-16
159,2,17:40,1060,1060,Sonny Weems Defensive Rebound.,34,28,6,8,0.7298629936248189,0.7298629936248189,Providence,Arkansas,4,4,NA,273202507,2007-11-16
160,2,17:32,1052,1052,Foul on Sonny Weems,34,28,6,18,0.7307004936712759,0.7307004936712759,Providence,Arkansas,4,4,NA,273202507,2007-11-16
161,2,17:14,1034,1034,Brian McKenzie made Two Point Layup.,36,28,8,0,0.7931668514129678,0.7931668514129678,Providence,Arkansas,4,4,NA,273202507,2007-11-16
162,2,17:14,1034,1034,Foul on Darian Townes,36,28,8,0,0.7931668514129678,0.7931668514129678,Providence,Arkansas,4,4,NA,273202507,2007-11-16
163,2,17:14,1034,1034,Brian McKenzie made Free Throw.,37,28,9,23,0.8193775950340019,0.8193775950340019,Providence,Arkansas,4,4,NA,273202507,2007-11-16
164,2,16:51,1011,1011,Gary Ervin made Three Point Jumper.,37,31,6,28,0.7352794747721078,0.7352794747721078,Providence,Arkansas,4,4,NA,273202507,2007-11-16
165,2,16:23,983,983,Geoff McDermott made Three Point Jumper.,40,31,9,38,0.8262466636926861,0.8262466636926861,Providence,Arkansas,4,4,NA,273202507,2007-11-16
166,2,15:45,945,945,Geoff McDermott missed Two Point Jumper.,40,31,9,0,0.8316684377057065,0.8316684377057065,Providence,Arkansas,4,4,NA,273202507,2007-11-16
167,2,15:45,945,945,Patrick Beverley Defensive Rebound.,40,31,9,8,0.8316684377057065,0.8316684377057065,Providence,Arkansas,4,4,NA,273202507,2007-11-16
168,2,15:37,937,937,Sonny Weems missed Two Point Jumper.,40,31,9,0,0.8326842305264037,0.8326842305264037,Providence,Arkansas,4,4,NA,273202507,2007-11-16
169,2,15:37,937,937,Charles Thomas Offensive Rebound.,40,31,9,5,0.8326842305264037,0.8326842305264037,Providence,Arkansas,4,4,NA,273202507,2007-11-16
170,2,15:32,932,932,Official TV Timeout.,40,31,9,53,0.8332984173963908,0.8332984173963908,Providence,Arkansas,4,4,NA,273202507,2007-11-16
171,2,14:39,879,879,Geoff McDermott missed Two Point Layup.,40,31,9,0,0.8391929764619321,0.8391929764619321,Providence,Arkansas,4,4,NA,273202507,2007-11-16
172,2,14:39,879,879,Sonny Weems Defensive Rebound.,40,31,9,7,0.8391929764619321,0.8391929764619321,Providence,Arkansas,4,4,NA,273202507,2007-11-16
173,2,14:32,872,872,Foul on Darian Townes,40,31,9,21,0.8399341472897632,0.8399341472897632,Providence,Arkansas,4,4,NA,273202507,2007-11-16
174,2,14:11,851,851,Brian McKenzie made Three Point Jumper.,43,31,12,21,0.9031522544638723,0.9031522544638723,Providence,Arkansas,4,4,NA,273202507,2007-11-16
175,2,13:50,830,830,Darian Townes made Two Point Layup.,43,33,10,20,0.8676603149270753,0.8676603149270753,Providence,Arkansas,4,4,NA,273202507,2007-11-16
176,2,13:30,810,810,Dwain Williams missed Three Point Jumper.,43,33,10,0,0.8700045019985546,0.8700045019985546,Providence,Arkansas,4,4,NA,273202507,2007-11-16
177,2,13:30,810,810,Darian Townes Defensive Rebound.,43,33,10,7,0.8700045019985546,0.8700045019985546,Providence,Arkansas,4,4,NA,273202507,2007-11-16
178,2,13:23,803,803,Patrick Beverley made Two Point Dunk Shot.,43,35,8,11,0.8215627269875969,0.8215627269875969,Providence,Arkansas,4,4,NA,273202507,2007-11-16
