play_id,half,time_remaining_half,secs_remaining,secs_remaining_absolute,description,home_score,away_score,score_diff,play_length,win_prob,naive_win_prob,home,away,home_time_out_remaining,away_time_out_remaining,home_favored_by,game_id,date
1,1,20:00,2400,2400,PLAY,0,0,0,19,0.5,0.5,Pittsburgh,Bradley,6,6,NA,264000006,2006-03-19
2,1,19:41,2381,2381,Daniel Ruffin Steal.,0,0,0,21,0.5,0.5,Pittsburgh,Bradley,6,6,NA,264000006,2006-03-19
3,1,19:20,2360,2360,Patrick Obryant made Two Point Jumper.,0,2,-2,17,0.4551249204640424,0.4551249204640424,Pittsburgh,Bradley,6,6,NA,264000006,2006-03-19
4,1,19:03,2343,2343,Daniel Ruffin Steal.,0,2,-2,6,0.45475749314437386,0.45475749314437386,Pittsburgh,Bradley,6,6,NA,264000006,2006-03-19
5,1,18:57,2337,2337,Foul on Antonio Graves,0,2,-2,0,0.4546269370703341,0.4546269370703341,Pittsburgh,Bradley,6,6,NA,264000006,2006-03-19
6,1,18:57,2337,2337,Marcellus Sommerville made Free Throw.,0,3,-3,0,0.43217335596304424,0.43217335596304424,Pittsburgh,Bradley,6,6,NA,264000006,2006-03-19
7,1,18:57,2337,2337,Marcellus Sommerville made Free Throw.,0,4,-4,22,0.4099950522271448,0.4099950522271448,Pittsburgh,Bradley,6,6,NA,264000006,2006-03-19
8,1,18:35,2315,2315,Aaron Gray missed Two Point Jumper.,0,4,-4,0,0.4090540661073587,0.4090540661073587,Pittsburgh,Bradley,6,6,NA,264000006,2006-03-19
9,1,18:35,2315,2315,Levon Kendall Offensive Rebound.,0,4,-4,8,0.4090540661073587,0.4090540661073587,Pittsburgh,Bradley,6,6,NA,264000006,2006-03-19
10,1,18:27,2307,2307,Foul on Tony Bennett,0,4,-4,34,0.40870937519989914,0.40870937519989914,Pittsburgh,Bradley,6,6,NA,264000006,2006-03-19
11,1,17:53,2273,2273,Tony Bennett missed Three Point Jumper.,0,4,-4,0,0.40723107319423285,0.40723107319423285,Pittsburgh,Bradley,6,6,NA,264000006,2006-03-19
12,1,17:53,2273,2273,Carl Krauser Defensive Rebound.,0,4,-4,26,0.40723107319423285,0.40723107319423285,Pittsburgh,Bradley,6,6,NA,264000006,2006-03-19
13,1,17:27,2247,2247,Marcellus Sommerville missed Two Point Jumper.,0,4,-4,0,0.406087851051211,0.406087851051211,Pittsburgh,Bradley,6,6,NA,264000006,2006-03-19
14,1,17:27,2247,2247,Aaron Gray Defensive Rebound.,0,4,-4,27,0.406087851051211,0.406087851051211,Pittsburgh,Bradley,6,6,NA,264000006,2006-03-19
15,1,17:00,2220,2220,Patrick Obryant missed Two Point Jumper.,0,4,-4,0,0.4048911176324924,0.4048911176324924,Pittsburgh,Bradley,6,6,NA,264000006,2006-03-19
16,1,17:00,2220,2220,Aaron Gray Defensive Rebound.,0,4,-4,19,0.4048911176324924,0.4048911176324924,Pittsburgh,Bradley,6,6,NA,264000006,2006-03-19
17,1,16:41,2201,2201,Aaron Gray missed Two Point Jumper.,0,4,-4,0,0.40404423285527197,0.40404423285527197,Pittsburgh,Bradley,6,6,NA,264000006,2006-03-19
18,1,16:41,2201,2201,Marcellus Sommerville Defensive Rebound.,0,4,-4,19,0.40404423285527197,0.40404423285527197,Pittsburgh,Bradley,6,6,NA,264000006,2006-03-19
19,1,16:22,2182,2182,Patrick Obryant made Two Point Jumper.,0,6,-6,18,0.3570342163763058,0.3570342163763058,Pittsburgh,Bradley,6,6,NA,264000006,2006-03-19
20,1,16:04,2164,2164,Ronald Ramon missed Two Point Jumper.,0,6,-6,0,0.3558789701107078,0.3558789701107078,Pittsburgh,Bradley,6,6,NA,264000006,2006-03-19
21,1,16:04,2164,2164,Bradley Defensive Rebound.,0,6,-6,23,0.3558789701107078,0.3558789701107078,Pittsburgh,Bradley,6,6,NA,264000006,2006-03-19
22,1,15:41,2141,2141,Patrick Obryant missed Two Point Jumper.,0,6,-6,0,0.35439610070279115,0.35439610070279115,Pittsburgh,Bradley,6,6,NA,264000006,2006-03-19
23,1,15:41,2141,2141,Carl Krauser Defensive Rebound.,0,6,-6,6,0.35439610070279115,0.35439610070279115,Pittsburgh,Bradley,6,6,NA,264000006,2006-03-19
24,1,15:35,2135,2135,Aaron Gray missed Two Point Layup.,0,6,-6,0,0.35400774320904577,0.35400774320904577,Pittsburgh,Bradley,6,6,NA,264000006,2006-03-19
25,1,15:35,2135,2135,Patrick Obryant Defensive Rebound.,0,6,-6,13,0.35400774320904577,0.35400774320904577,Pittsburgh,Bradley,6,6,NA,264000006,2006-03-19
26,1,15:22,2122,2122,Foul on Aaron Gray,0,6,-6,0,0.35316399200835646,0.35316399200835646,Pittsburgh,Bradley,6,6,NA,264000006,2006-03-19
27,1,15:22,2122,2122,Official TV Timeout.,0,6,-6,7,0.35316399200835646,0.35316399200835646,Pittsburgh,Bradley,6,6,NA,264000006,2006-03-19
28,1,15:15,2115,2115,Marcellus Sommerville missed Three Point Jumper.,0,6,-6,0,0.35270830298940703,0.35270830298940703,Pittsburgh,Bradley,6,6,NA,264000006,2006-03-19
29,1,15:15,2115,2115,Carl Krauser Defensive Rebound.,0,6,-6,15,0.35270830298940703,0.35270830298940703,Pittsburgh,Bradley,6,6,NA,264000006,2006-03-19
30,1,15:00,2100,2100,Foul on Zach Andrews,0,6,-6,0,0.35172845262983876,0.35172845262983876,Pittsburgh,Bradley,6,6,NA,264000006,2006-03-19
31,1,15:00,2100,2100,Aaron Gray made Free Throw.,1,6,-5,0,0.3753009314240041,0.3753009314240041,Pittsburgh,Bradley,6,6,NA,264000006,2006-03-19
32,1,15:00,2100,2100,Aaron Gray made Free Throw.,2,6,-4,12,0.39947970270338606,0.39947970270338606,Pittsburgh,Bradley,6,6,NA,264000006,2006-03-19
33,1,14:48,2088,2088,Tony Bennett missed Two Point Jumper.,2,6,-4,0,0.3989272995273099,0.3989272995273099,Pittsburgh,Bradley,6,6,NA,264000006,2006-03-19
34,1,14:48,2088,2088,Zach Andrews Offensive Rebound.,2,6,-4,9,0.3989272995273099,0.3989272995273099,Pittsburgh,Bradley,6,6,NA,264000006,2006-03-19
35,1,14:39,2079,2079,Zach Andrews missed Two Point Layup.,2,6,-4,0,0.3985113043618543,0.3985113043618543,Pittsburgh,Bradley,6,6,NA,264000006,2006-03-19
36,1,14:39,2079,2079,Antonio Graves Defensive Rebound.,2,6,-4,29,0.3985113043618543,0.3985113043618543,Pittsburgh,Bradley,6,6,NA,264000006,2006-03-19
37,1,14:10,2050,2050,Foul on Daniel Ruffin,2,6,-4,3,0.39716043060201,0.39716043060201,Pittsburgh,Bradley,6,6,NA,264000006,2006-03-19
38,1,14:07,2047,2047,Sam Young missed Two Point Jumper.,2,6,-4,0,0.3970197341967573,0.3970197341967573,Pittsburgh,Bradley,6,6,NA,264000006,2006-03-19
39,1,14:07,2047,2047,Bradley Defensive Rebound.,2,6,-4,1,0.3970197341967573,0.3970197341967573,Pittsburgh,Bradley,6,6,NA,264000006,2006-03-19
40,1,14:06,2046,2046,Foul on Levon Kendall,2,6,-4,15,0.39697279440654404,0.39697279440654404,Pittsburgh,Bradley,6,6,NA,264000006,2006-03-19
41,1,13:51,2031,2031,Zach Andrews made Two Point Dunk Shot.  Assisted by Tony Bennett.,2,8,-6,19,0.34715444833080616,0.34715444833080616,Pittsburgh,Bradley,6,6,NA,264000006,2006-03-19
42,1,13:32,2012,2012,Levance Fields missed Two Point Jumper.,2,8,-6,0,0.3458733051515204,0.3458733051515204,Pittsburgh,Bradley,6,6,NA,264000006,2006-03-19
43,1,13:32,2012,2012,Marcellus Sommerville Defensive Rebound.,2,8,-6,18,0.3458733051515204,0.3458733051515204,Pittsburgh,Bradley,6,6,NA,264000006,2006-03-19
44,1,13:14,1994,1994,Tony Bennett missed Two Point Jumper.,2,8,-6,0,0.34465000592827083,0.34465000592827083,Pittsburgh,Bradley,6,6,NA,264000006,2006-03-19
45,1,13:14,1994,1994,Lawrence Wright Offensive Rebound.,2,8,-6,2,0.34465000592827083,0.34465000592827083,Pittsburgh,Bradley,6,6,NA,264000006,2006-03-19
46,1,13:12,1992,1992,Lawrence Wright missed Two Point Layup.,2,8,-6,0,0.3445134870808168,0.3445134870808168,Pittsburgh,Bradley,6,6,NA,264000006,2006-03-19
47,1,13:12,1992,1992,Levon Kendall Defensive Rebound.,2,8,-6,23,0.3445134870808168,0.3445134870808168,Pittsburgh,Bradley,6,6,NA,264000006,2006-03-19
48,1,12:49,1969,1969,Antonio Graves missed Three Point Jumper.,2,8,-6,0,0.3429346117977029,0.3429346117977029,Pittsburgh,Bradley,6,6,NA,264000006,2006-03-19
49,1,12:49,1969,1969,Tony Bennett Defensive Rebound.,2,8,-6,34,0.3429346117977029,0.3429346117977029,Pittsburgh,Bradley,6,6,NA,264000006,2006-03-19
50,1,12:15,1935,1935,Lawrence Wright missed Two Point Jumper.,2,8,-6,0,0.34056908425786936,0.34056908425786936,Pittsburgh,Bradley,6,6,NA,264000006,2006-03-19
51,1,12:15,1935,1935,Lawrence Wright Offensive Rebound.,2,8,-6,4,0.34056908425786936,0.34056908425786936,Pittsburgh,Bradley,6,6,NA,264000006,2006-03-19
52,1,12:11,1931,1931,Lawrence Wright missed Two Point Jumper.,2,8,-6,1,0.3402881918903782,0.3402881918903782,Pittsburgh,Bradley,6,6,NA,264000006,2006-03-19
53,1,12:10,1930,1930,Lawrence Wright Offensive Rebound.,2,8,-6,1,0.34021788090756927,0.34021788090756927,Pittsburgh,Bradley,6,6,NA,264000006,2006-03-19
54,1,12:09,1929,1929,Lawrence Wright made Two Point Layup.,2,10,-8,3,0.2924497907327103,0.2924497907327103,Pittsburgh,Bradley,6,6,NA,264000006,2006-03-19
55,1,12:06,1926,1926,Pittsburgh Full Timeout.,2,10,-8,18,0.2921906586357105,0.2921906586357105,Pittsburgh,Bradley,5,6,NA,264000006,2006-03-19
56,1,11:48,1908,1908,Sam Young made Two Point Jumper.,4,10,-6,22,0.3386750240357693,0.3386750240357693,Pittsburgh,Bradley,5,6,NA,264000006,2006-03-19
57,1,11:26,1886,1886,Marcellus Sommerville made Two Point Layup.,4,12,-8,18,0.2887561038772947,0.2887561038772947,Pittsburgh,Bradley,5,6,NA,264000006,2006-03-19
58,1,11:08,1868,1868,Levance Fields missed Two Point Layup.,4,12,-8,0,0.28721759140575126,0.28721759140575126,Pittsburgh,Bradley,5,6,NA,264000006,2006-03-19
59,1,11:08,1868,1868,Pittsburgh Defensive Rebound.,4,12,-8,0,0.28721759140575126,0.28721759140575126,Pittsburgh,Bradley,5,6,NA,264000006,2006-03-19
60,1,11:08,1868,1868,Official TV Timeout.,4,12,-8,19,0.28721759140575126,0.28721759140575126,Pittsburgh,Bradley,5,6,NA,264000006,2006-03-19
61,1,10:49,1849,1849,Lawrence Wright made Two Point Jumper.,4,14,-10,20,0.241201876089477,0.241201876089477,Pittsburgh,Bradley,5,6,NA,264000006,2006-03-19
62,1,10:29,1829,1829,Ronald Ramon missed Two Point Jumper.,4,14,-10,0,0.23928315530647684,0.23928315530647684,Pittsburgh,Bradley,5,6,NA,264000006,2006-03-19
63,1,10:29,1829,1829,Bradley Defensive Rebound.,4,14,-10,20,0.23928315530647684,0.23928315530647684,Pittsburgh,Bradley,5,6,NA,264000006,2006-03-19
64,1,10:09,1809,1809,Foul on Carl Krauser,4,14,-10,0,0.2373597174400376,0.2373597174400376,Pittsburgh,Bradley,5,6,NA,264000006,2006-03-19
65,1,10:09,1809,1809,Lawrence Wright made Free Throw.,4,15,-11,0,0.21688188260006652,0.21688188260006652,Pittsburgh,Bradley,5,6,NA,264000006,2006-03-19
66,1,10:09,1809,1809,Lawrence Wright made Free Throw.,4,16,-12,25,0.1977127295870025,0.1977127295870025,Pittsburgh,Bradley,5,6,NA,264000006,2006-03-19
67,1,9:44,1784,1784,Aaron Gray made Two Point Jumper.  Assisted by Ronald Ramon.,6,16,-10,13,0.23494237508056176,0.23494237508056176,Pittsburgh,Bradley,5,6,NA,264000006,2006-03-19
68,1,9:31,1771,1771,Foul on Aaron Gray,6,16,-10,0,0.2336771772924223,0.2336771772924223,Pittsburgh,Bradley,5,6,NA,264000006,2006-03-19
69,1,9:31,1771,1771,Patrick Obryant made Free Throw.,6,17,-11,0,0.21308497556621422,0.21308497556621422,Pittsburgh,Bradley,5,6,NA,264000006,2006-03-19
70,1,9:31,1771,1771,Patrick Obryant made Free Throw.,6,18,-12,25,0.19384838024769588,0.19384838024769588,Pittsburgh,Bradley,5,6,NA,264000006,2006-03-19
71,1,9:06,1746,1746,Ronald Ramon made Three Point Jumper.  Assisted by Levon Kendall.,9,18,-9,14,0.25326490373560323,0.25326490373560323,Pittsburgh,Bradley,5,6,NA,264000006,2006-03-19
72,1,8:52,1732,1732,Tony Bennett missed Two Point Jumper.,9,18,-9,0,0.25193505662233356,0.25193505662233356,Pittsburgh,Bradley,5,6,NA,264000006,2006-03-19
73,1,8:52,1732,1732,Levance Fields Defensive Rebound.,9,18,-9,10,0.25193505662233356,0.25193505662233356,Pittsburgh,Bradley,5,6,NA,264000006,2006-03-19
74,1,8:42,1722,1722,Levon Kendall made Two Point Layup.,11,18,-7,11,0.2993435234138019,0.2993435234138019,Pittsburgh,Bradley,5,6,NA,264000006,2006-03-19
75,1,8:31,1711,1711,Foul on Levon Kendall,11,18,-7,0,0.29842241507805267,0.29842241507805267,Pittsburgh,Bradley,5,6,NA,264000006,2006-03-19
76,1,8:31,1711,1711,Patrick Obryant missed Free Throw.,11,18,-7,0,0.29842241507805267,0.29842241507805267,Pittsburgh,Bradley,5,6,NA,264000006,2006-03-19
77,1,8:31,1711,1711,Sam Young Defensive Rebound.,11,18,-7,16,0.29842241507805267,0.29842241507805267,Pittsburgh,Bradley,5,6,NA,264000006,2006-03-19
78,1,8:15,1695,1695,Antonio Graves missed Two Point Layup.,11,18,-7,0,0.2970671276024255,0.2970671276024255,Pittsburgh,Bradley,5,6,NA,264000006,2006-03-19
79,1,8:15,1695,1695,Doyle Hudson Offensive Rebound.,11,18,-7,18,0.2970671276024255,0.2970671276024255,Pittsburgh,Bradley,5,6,NA,264000006,2006-03-19
80,1,7:57,1677,1677,Foul on Tony Bennett,11,18,-7,0,0.2955379034140821,0.2955379034140821,Pittsburgh,Bradley,5,6,NA,264000006,2006-03-19
81,1,7:57,1677,1677,Official TV Timeout.,11,18,-7,0,0.2955379034140821,0.2955379034140821,Pittsburgh,Bradley,5,6,NA,264000006,2006-03-19
82,1,7:57,1677,1677,Pittsburgh Full Timeout.,11,18,-7,3,0.2955379034140821,0.2955379034140821,Pittsburgh,Bradley,4,6,NA,264000006,2006-03-19
83,1,7:54,1674,1674,Ronald Ramon missed Two Point Jumper.,11,18,-7,0,0.2952869794007095,0.2952869794007095,Pittsburgh,Bradley,4,6,NA,264000006,2006-03-19
84,1,7:54,1674,1674,Levance Fields Offensive Rebound.,11,18,-7,13,0.2952869794007095,0.2952869794007095,Pittsburgh,Bradley,4,6,NA,264000006,2006-03-19
85,1,7:41,1661,1661,Levance Fields made Three Point Jumper.  Assisted by Sam Young.,14,18,-4,16,0.377538964297781,0.377538964297781,Pittsburgh,Bradley,4,6,NA,264000006,2006-03-19
86,1,7:25,1645,1645,Zach Andrews missed Two Point Layup.,14,18,-4,0,0.37669857792189887,0.37669857792189887,Pittsburgh,Bradley,4,6,NA,264000006,2006-03-19
87,1,7:25,1645,1645,Doyle Hudson Defensive Rebound.,14,18,-4,10,0.37669857792189887,0.37669857792189887,Pittsburgh,Bradley,4,6,NA,264000006,2006-03-19
88,1,7:15,1635,1635,Antonio Graves missed Three Point Jumper.,14,18,-4,0,0.37617961892189133,0.37617961892189133,Pittsburgh,Bradley,4,6,NA,264000006,2006-03-19
89,1,7:15,1635,1635,Zach Andrews Defensive Rebound.,14,18,-4,12,0.37617961892189133,0.37617961892189133,Pittsburgh,Bradley,4,6,NA,264000006,2006-03-19
90,1,7:03,1623,1623,Daniel Ruffin missed Two Point Jumper.,14,18,-4,0,0.37556150681311473,0.37556150681311473,Pittsburgh,Bradley,4,6,NA,264000006,2006-03-19
91,1,7:03,1623,1623,Doyle Hudson Defensive Rebound.,14,18,-4,8,0.37556150681311473,0.37556150681311473,Pittsburgh,Bradley,4,6,NA,264000006,2006-03-19
92,1,6:55,1615,1615,Foul on Daniel Ruffin,14,18,-4,17,0.37515141272700603,0.37515141272700603,Pittsburgh,Bradley,4,6,NA,264000006,2006-03-19
93,1,6:38,1598,1598,Foul on JJ Tauai,14,18,-4,9,0.3742825094888457,0.3742825094888457,Pittsburgh,Bradley,4,6,NA,264000006,2006-03-19
94,1,6:29,1589,1589,Antonio Graves missed Three Point Jumper.,14,18,-4,0,0.37382253415405664,0.37382253415405664,Pittsburgh,Bradley,4,6,NA,264000006,2006-03-19
95,1,6:29,1589,1589,Lawrence Wright Defensive Rebound.,14,18,-4,10,0.37382253415405664,0.37382253415405664,Pittsburgh,Bradley,4,6,NA,264000006,2006-03-19
96,1,6:19,1579,1579,Foul on Antonio Graves,14,18,-4,0,0.3733103017289127,0.3733103017289127,Pittsburgh,Bradley,4,6,NA,264000006,2006-03-19
97,1,6:19,1579,1579,Will Franklin made Free Throw.,14,19,-5,0,0.3435414180970822,0.3435414180970822,Pittsburgh,Bradley,4,6,NA,264000006,2006-03-19
98,1,6:19,1579,1579,Will Franklin missed Free Throw.,14,19,-5,0,0.3435414180970822,0.3435414180970822,Pittsburgh,Bradley,4,6,NA,264000006,2006-03-19
99,1,6:19,1579,1579,Antonio Graves Defensive Rebound.,14,19,-5,17,0.3435414180970822,0.3435414180970822,Pittsburgh,Bradley,4,6,NA,264000006,2006-03-19
100,1,6:02,1562,1562,Sam Young made Two Point Jumper.  Assisted by Antonio Graves.,16,19,-3,15,0.403394266789726,0.403394266789726,Pittsburgh,Bradley,4,6,NA,264000006,2006-03-19
101,1,5:47,1547,1547,Foul on Antonio Graves,16,19,-3,0,0.4027897770977237,0.4027897770977237,Pittsburgh,Bradley,4,6,NA,264000006,2006-03-19
102,1,5:47,1547,1547,Lawrence Wright missed Free Throw.,16,19,-3,0,0.4027897770977237,0.4027897770977237,Pittsburgh,Bradley,4,6,NA,264000006,2006-03-19
103,1,5:47,1547,1547,Doyle Hudson Defensive Rebound.,16,19,-3,12,0.4027897770977237,0.4027897770977237,Pittsburgh,Bradley,4,6,NA,264000006,2006-03-19
104,1,5:35,1535,1535,Levance Fields made Two Point Jumper.,18,19,-1,24,0.467056643572941,0.467056643572941,Pittsburgh,Bradley,4,6,NA,264000006,2006-03-19
105,1,5:11,1511,1511,Patrick Obryant missed Two Point Dunk Shot.,18,19,-1,2,0.4667096826867264,0.4667096826867264,Pittsburgh,Bradley,4,6,NA,264000006,2006-03-19
106,1,5:09,1509,1509,Will Franklin Offensive Rebound.,18,19,-1,2,0.4666801657080645,0.4666801657080645,Pittsburgh,Bradley,4,6,NA,264000006,2006-03-19
107,1,5:07,1507,1507,Will Franklin made Three Point Jumper.  Assisted by Marcellus Sommerville.,18,22,-4,20,0.3694948178282831,0.3694948178282831,Pittsburgh,Bradley,4,6,NA,264000006,2006-03-19
108,1,4:47,1487,1487,Sam Young made Two Point Jumper.,20,22,-2,28,0.43299988023118985,0.43299988023118985,Pittsburgh,Bradley,4,6,NA,264000006,2006-03-19
109,1,4:19,1459,1459,Marcellus Sommerville missed Two Point Jumper.,20,22,-2,0,0.4321217318601722,0.4321217318601722,Pittsburgh,Bradley,4,6,NA,264000006,2006-03-19
110,1,4:19,1459,1459,Patrick Obryant Offensive Rebound.,20,22,-2,3,0.4321217318601722,0.4321217318601722,Pittsburgh,Bradley,4,6,NA,264000006,2006-03-19
111,1,4:16,1456,1456,Patrick Obryant made Two Point Tip Shot.,20,24,-4,16,0.3665156706100786,0.3665156706100786,Pittsburgh,Bradley,4,6,NA,264000006,2006-03-19
112,1,4:00,1440,1440,Levance Fields missed Three Point Jumper.,20,24,-4,0,0.36552386474245063,0.36552386474245063,Pittsburgh,Bradley,4,6,NA,264000006,2006-03-19
113,1,4:00,1440,1440,Marcellus Sommerville Defensive Rebound.,20,24,-4,11,0.36552386474245063,0.36552386474245063,Pittsburgh,Bradley,4,6,NA,264000006,2006-03-19
114,1,3:49,1429,1429,Foul on JJ Tauai,20,24,-4,0,0.3648583510055892,0.3648583510055892,Pittsburgh,Bradley,4,6,NA,264000006,2006-03-19
115,1,3:49,1429,1429,Official TV Timeout.,20,24,-4,12,0.3648583510055892,0.3648583510055892,Pittsburgh,Bradley,4,6,NA,264000006,2006-03-19
116,1,3:37,1417,1417,Levon Kendall made Two Point Jumper.  Assisted by Carl Krauser.,22,24,-2,19,0.43077170185741315,0.43077170185741315,Pittsburgh,Bradley,4,6,NA,264000006,2006-03-19
117,1,3:18,1398,1398,Patrick Obryant made Two Point Jumper.  Assisted by JJ Tauai.,22,26,-4,19,0.36304780850275326,0.36304780850275326,Pittsburgh,Bradley,4,6,NA,264000006,2006-03-19
118,1,2:59,1379,1379,Sam Young missed Two Point Jumper.,22,26,-4,0,0.3619678120180231,0.3619678120180231,Pittsburgh,Bradley,4,6,NA,264000006,2006-03-19
119,1,2:59,1379,1379,Pittsburgh Defensive Rebound.,22,26,-4,2,0.3619678120180231,0.3619678120180231,Pittsburgh,Bradley,4,6,NA,264000006,2006-03-19
120,1,2:57,1377,1377,Foul on Carl Krauser,22,26,-4,2,0.36185477537556715,0.36185477537556715,Pittsburgh,Bradley,4,6,NA,264000006,2006-03-19
121,1,2:55,1375,1375,Carl Krauser missed Three Point Jumper.,22,26,-4,0,0.3617418061495518,0.3617418061495518,Pittsburgh,Bradley,4,6,NA,264000006,2006-03-19
122,1,2:55,1375,1375,JJ Tauai Defensive Rebound.,22,26,-4,30,0.3617418061495518,0.3617418061495518,Pittsburgh,Bradley,4,6,NA,264000006,2006-03-19
123,1,2:25,1345,1345,Lawrence Wright missed Two Point Jumper.,22,26,-4,0,0.36004548417250487,0.36004548417250487,Pittsburgh,Bradley,4,6,NA,264000006,2006-03-19
124,1,2:25,1345,1345,Lawrence Wright Offensive Rebound.,22,26,-4,3,0.36004548417250487,0.36004548417250487,Pittsburgh,Bradley,4,6,NA,264000006,2006-03-19
125,1,2:22,1342,1342,Lawrence Wright missed Two Point Layup.,22,26,-4,0,0.3598746225346102,0.3598746225346102,Pittsburgh,Bradley,4,6,NA,264000006,2006-03-19
126,1,2:22,1342,1342,Lawrence Wright Offensive Rebound.,22,26,-4,2,0.3598746225346102,0.3598746225346102,Pittsburgh,Bradley,4,6,NA,264000006,2006-03-19
127,1,2:20,1340,1340,Lawrence Wright made Two Point Layup.,22,28,-6,17,0.2963779641795494,0.2963779641795494,Pittsburgh,Bradley,4,6,NA,264000006,2006-03-19
128,1,2:03,1323,1323,Ronald Ramon made Two Point Jumper.,24,28,-4,40,0.35878077415143356,0.35878077415143356,Pittsburgh,Bradley,4,6,NA,264000006,2006-03-19
129,1,1:23,1283,1283,Carl Krauser made Two Point Layup.,26,28,-2,15,0.42663797819554133,0.42663797819554133,Pittsburgh,Bradley,4,6,NA,264000006,2006-03-19
130,1,1:08,1268,1268,Patrick Obryant missed Two Point Jumper.,26,28,-2,0,0.42612515008119456,0.42612515008119456,Pittsburgh,Bradley,4,6,NA,264000006,2006-03-19
131,1,1:08,1268,1268,Danny Adams Offensive Rebound.,26,28,-2,12,0.42612515008119456,0.42612515008119456,Pittsburgh,Bradley,4,6,NA,264000006,2006-03-19
132,1,0:56,1256,1256,Will Franklin missed Two Point Jumper.,26,28,-2,0,0.42569928540880747,0.42569928540880747,Pittsburgh,Bradley,4,6,NA,264000006,2006-03-19
133,1,0:56,1256,1256,Patrick Obryant Offensive Rebound.,26,28,-2,1,0.42569928540880747,0.42569928540880747,Pittsburgh,Bradley,4,6,NA,264000006,2006-03-19
134,1,0:55,1255,1255,Patrick Obryant made Two Point Layup.,26,30,-4,27,0.3545414259002475,0.3545414259002475,Pittsburgh,Bradley,4,6,NA,264000006,2006-03-19
135,1,0:28,1228,1228,Levance Fields made Three Point Jumper.  Assisted by Carl Krauser.,29,30,-1,0,0.4621044931534604,0.4621044931534604,Pittsburgh,Bradley,4,6,NA,264000006,2006-03-19
136,1,0:28,1228,1228,Bradley Full Timeout.,29,30,-1,20,0.4621044931534604,0.4621044931534604,Pittsburgh,Bradley,4,5,NA,264000006,2006-03-19
137,1,0:08,1208,1208,Will Franklin missed Two Point Layup.,29,30,-1,0,0.46168801654526775,0.46168801654526775,Pittsburgh,Bradley,4,5,NA,264000006,2006-03-19
138,1,0:08,1208,1208,Levance Fields Defensive Rebound.,29,30,-1,8,0.46168801654526775,0.46168801654526775,Pittsburgh,Bradley,4,5,NA,264000006,2006-03-19
139,1,0:00,1200,1200,End of the 1st Half.,29,30,-1,0,0.4615187446422248,0.4615187446422248,Pittsburgh,Bradley,4,5,NA,264000006,2006-03-19
140,2,20:00,1200,1200,PLAY,29,30,-1,12,0.4615187446422248,0.4615187446422248,Pittsburgh,Bradley,4,5,NA,264000006,2006-03-19
141,2,19:48,1188,1188,Carl Krauser made Two Point Layup.,31,30,1,9,0.5387302470101494,0.5387302470101494,Pittsburgh,Bradley,4,5,NA,264000006,2006-03-19
142,2,19:39,1179,1179,Daniel Ruffin missed Three Point Jumper.,31,30,1,0,0.5389137399514871,0.5389137399514871,Pittsburgh,Bradley,4,5,NA,264000006,2006-03-19
143,2,19:39,1179,1179,Levon Kendall Defensive Rebound.,31,30,1,8,0.5389137399514871,0.5389137399514871,Pittsburgh,Bradley,4,5,NA,264000006,2006-03-19
144,2,19:31,1171,1171,Aaron Gray made Two Point Layup.,33,30,3,26,0.6153500340475311,0.6153500340475311,Pittsburgh,Bradley,4,5,NA,264000006,2006-03-19
145,2,19:05,1145,1145,Marcellus Sommerville missed Two Point Layup.,33,30,3,0,0.6168235353914926,0.6168235353914926,Pittsburgh,Bradley,4,5,NA,264000006,2006-03-19
146,2,19:05,1145,1145,Levon Kendall Defensive Rebound.,33,30,3,16,0.6168235353914926,0.6168235353914926,Pittsburgh,Bradley,4,5,NA,264000006,2006-03-19
147,2,18:49,1129,1129,Carl Krauser missed Three Point Jumper.,33,30,3,0,0.6177228594243718,0.6177228594243718,Pittsburgh,Bradley,4,5,NA,264000006,2006-03-19
148,2,18:49,1129,1129,Tony Bennett Defensive Rebound.,33,30,3,10,0.6177228594243718,0.6177228594243718,Pittsburgh,Bradley,4,5,NA,264000006,2006-03-19
149,2,18:39,1119,1119,Marcellus Sommerville made Two Point Layup.  Assisted by Daniel Ruffin.,33,32,1,12,0.5401037730413328,0.5401037730413328,Pittsburgh,Bradley,4,5,NA,264000006,2006-03-19
150,2,18:27,1107,1107,Aaron Gray missed Two Point Jumper.,33,32,1,0,0.5403427562146519,0.5403427562146519,Pittsburgh,Bradley,4,5,NA,264000006,2006-03-19
151,2,18:27,1107,1107,Marcellus Sommerville Defensive Rebound.,33,32,1,3,0.5403427562146519,0.5403427562146519,Pittsburgh,Bradley,4,5,NA,264000006,2006-03-19
152,2,18:24,1104,1104,Tony Bennett missed Three Point Jumper.,33,32,1,0,0.5404029344350949,0.5404029344350949,Pittsburgh,Bradley,4,5,NA,264000006,2006-03-19
153,2,18:24,1104,1104,Patrick Obryant Offensive Rebound.,33,32,1,23,0.5404029344350949,0.5404029344350949,Pittsburgh,Bradley,4,5,NA,264000006,2006-03-19
154,2,18:01,1081,1081,Foul on Carl Krauser,33,32,1,21,0.540872614689758,0.540872614689758,Pittsburgh,Bradley,4,5,NA,264000006,2006-03-19
155,2,17:40,1060,1060,Patrick Obryant made Two Point Layup.,33,34,-1,9,0.4586807960671205,0.4586807960671205,Pittsburgh,Bradley,4,5,NA,264000006,2006-03-19
156,2,17:31,1051,1051,Aaron Gray made Two Point Dunk Shot.  Assisted by Carl Krauser.,35,34,1,22,0.541517401623428,0.541517401623428,Pittsburgh,Bradley,4,5,NA,264000006,2006-03-19
157,2,17:09,1029,1029,Patrick Obryant missed Two Point Layup.,35,34,1,0,0.5420230677951058,0.5420230677951058,Pittsburgh,Bradley,4,5,NA,264000006,2006-03-19
158,2,17:09,1029,1029,Ronald Ramon Defensive Rebound.,35,34,1,7,0.5420230677951058,0.5420230677951058,Pittsburgh,Bradley,4,5,NA,264000006,2006-03-19
159,2,17:02,1022,1022,Foul on Daniel Ruffin,35,34,1,17,0.5421911365170808,0.5421911365170808,Pittsburgh,Bradley,4,5,NA,264000006,2006-03-19
160,2,16:45,1005,1005,Foul on Aaron Gray,35,34,1,0,0.5426158388572204,0.5426158388572204,Pittsburgh,Bradley,4,5,NA,264000006,2006-03-19
161,2,16:45,1005,1005,Marcellus Sommerville made Free Throw.,35,35,0,0,0.5,0.5,Pittsburgh,Bradley,4,5,NA,264000006,2006-03-19
162,2,16:45,1005,1005,Marcellus Sommerville made Free Throw.,35,36,-1,15,0.4573841611427797,0.4573841611427797,Pittsburgh,Bradley,4,5,NA,264000006,2006-03-19
163,2,16:30,990,990,Marcellus Sommerville missed Two Point Jumper.,35,36,-1,0,0.45698786236094535,0.45698786236094535,Pittsburgh,Bradley,4,5,NA,264000006,2006-03-19
164,2,16:30,990,990,Levon Kendall Defensive Rebound.,35,36,-1,25,0.45698786236094535,0.45698786236094535,Pittsburgh,Bradley,4,5,NA,264000006,2006-03-19
165,2,16:05,965,965,Patrick Obryant made Two Point Layup.  Assisted by JJ Tauai.,35,38,-3,30,0.3714531366426928,0.3714531366426928,Pittsburgh,Bradley,4,5,NA,264000006,2006-03-19
166,2,15:35,935,935,Foul on Patrick Obryant,35,38,-3,0,0.3692312153978319,0.3692312153978319,Pittsburgh,Bradley,4,5,NA,264000006,2006-03-19
167,2,15:35,935,935,Official TV Timeout.,35,38,-3,0,0.3692312153978319,0.3692312153978319,Pittsburgh,Bradley,4,5,NA,264000006,2006-03-19
168,2,15:35,935,935,Foul on Tony Bennett,35,38,-3,15,0.3692312153978319,0.3692312153978319,Pittsburgh,Bradley,4,5,NA,264000006,2006-03-19
169,2,15:20,920,920,Aaron Gray missed Two Point Layup.,35,38,-3,0,0.3682315708348779,0.3682315708348779,Pittsburgh,Bradley,4,5,NA,264000006,2006-03-19
