play_id,half,time_remaining_half,secs_remaining,secs_remaining_absolute,description,home_score,away_score,score_diff,play_length,win_prob,naive_win_prob,home,away,home_time_out_remaining,away_time_out_remaining,home_favored_by,game_id,date
1,1,20:00,2400,2400,PLAY,0,0,0,18,0.5,0.5,LIU Brooklyn,Hofstra,4,4,NA,400591777,2014-12-28
2,1,19:42,2382,2382,Martin Hermannsson missed Three Point Jumper.,0,0,0,0,0.5,0.5,LIU Brooklyn,Hofstra,4,4,NA,400591777,2014-12-28
3,1,19:42,2382,2382,Juan'ya Green Defensive Rebound.,0,0,0,9,0.5,0.5,LIU Brooklyn,Hofstra,4,4,NA,400591777,2014-12-28
4,1,19:33,2373,2373,Ameen Tanksley made Jumper. Assisted by Juan'ya Green.,0,2,-2,8,0.4554032958067534,0.4554032958067534,LIU Brooklyn,Hofstra,4,4,NA,400591777,2014-12-28
5,1,19:25,2365,2365,Martin Hermannsson made Layup.,2,2,0,27,0.5,0.5,LIU Brooklyn,Hofstra,4,4,NA,400591777,2014-12-28
6,1,18:58,2338,2338,Moussa Kone made Layup. Assisted by Ameen Tanksley.,2,4,-2,21,0.4546487271837898,0.4546487271837898,LIU Brooklyn,Hofstra,4,4,NA,400591777,2014-12-28
7,1,18:37,2317,2317,Gerrell Martin missed Three Point Jumper.,2,4,-2,0,0.4541886461494085,0.4541886461494085,LIU Brooklyn,Hofstra,4,4,NA,400591777,2014-12-28
8,1,18:37,2317,2317,Nura Zanna Offensive Rebound.,2,4,-2,3,0.4541886461494085,0.4541886461494085,LIU Brooklyn,Hofstra,4,4,NA,400591777,2014-12-28
9,1,18:34,2314,2314,Nura Zanna made Two Point Tip Shot.,4,4,0,15,0.5,0.5,LIU Brooklyn,Hofstra,4,4,NA,400591777,2014-12-28
10,1,18:19,2299,2299,Moussa Kone Turnover.,4,4,0,5,0.5,0.5,LIU Brooklyn,Hofstra,4,4,NA,400591777,2014-12-28
11,1,18:14,2294,2294,Foul on Malik Nichols.,4,4,0,9,0.5,0.5,LIU Brooklyn,Hofstra,4,4,NA,400591777,2014-12-28
12,1,18:05,2285,2285,Landon Atterberry missed Jumper.,4,4,0,0,0.5,0.5,LIU Brooklyn,Hofstra,4,4,NA,400591777,2014-12-28
13,1,18:05,2285,2285,Jamall Robinson Defensive Rebound.,4,4,0,19,0.5,0.5,LIU Brooklyn,Hofstra,4,4,NA,400591777,2014-12-28
14,1,17:46,2266,2266,Foul on Landon Atterberry.,4,4,0,0,0.5,0.5,LIU Brooklyn,Hofstra,4,4,NA,400591777,2014-12-28
15,1,17:46,2266,2266,Ameen Tanksley missed Free Throw.,4,4,0,0,0.5,0.5,LIU Brooklyn,Hofstra,4,4,NA,400591777,2014-12-28
16,1,17:46,2266,2266,Hofstra Deadball Team Rebound.,4,4,0,0,0.5,0.5,LIU Brooklyn,Hofstra,4,4,NA,400591777,2014-12-28
17,1,17:46,2266,2266,Ameen Tanksley made Free Throw.,4,5,-1,24,0.47647394856443914,0.47647394856443914,LIU Brooklyn,Hofstra,4,4,NA,400591777,2014-12-28
18,1,17:22,2242,2242,Joel Hernandez made Jumper. Assisted by Elvar Fridriksson.,6,5,1,21,0.5237993807318992,0.5237993807318992,LIU Brooklyn,Hofstra,4,4,NA,400591777,2014-12-28
19,1,17:01,2221,2221,Ameen Tanksley missed Three Point Jumper.,6,5,1,0,0.5240403011281468,0.5240403011281468,LIU Brooklyn,Hofstra,4,4,NA,400591777,2014-12-28
20,1,17:01,2221,2221,Nura Zanna Defensive Rebound.,6,5,1,23,0.5240403011281468,0.5240403011281468,LIU Brooklyn,Hofstra,4,4,NA,400591777,2014-12-28
21,1,16:38,2198,2198,Foul on Dion Nesmith.,6,5,1,0,0.5243057461322421,0.5243057461322421,LIU Brooklyn,Hofstra,4,4,NA,400591777,2014-12-28
22,1,16:38,2198,2198,Nura Zanna made Free Throw.,7,5,2,0,0.5484968903695424,0.5484968903695424,LIU Brooklyn,Hofstra,4,4,NA,400591777,2014-12-28
23,1,16:38,2198,2198,Nura Zanna missed Free Throw.,7,5,2,0,0.5484968903695424,0.5484968903695424,LIU Brooklyn,Hofstra,4,4,NA,400591777,2014-12-28
24,1,16:38,2198,2198,Jamall Robinson Defensive Rebound.,7,5,2,19,0.5484968903695424,0.5484968903695424,LIU Brooklyn,Hofstra,4,4,NA,400591777,2014-12-28
25,1,16:19,2179,2179,Juan'ya Green missed Jumper.,7,5,2,0,0.5489343624043685,0.5489343624043685,LIU Brooklyn,Hofstra,4,4,NA,400591777,2014-12-28
26,1,16:19,2179,2179,Dion Nesmith Offensive Rebound.,7,5,2,3,0.5489343624043685,0.5489343624043685,LIU Brooklyn,Hofstra,4,4,NA,400591777,2014-12-28
27,1,16:16,2176,2176,Dion Nesmith Turnover.,7,5,2,0,0.5490035742376568,0.5490035742376568,LIU Brooklyn,Hofstra,4,4,NA,400591777,2014-12-28
28,1,16:16,2176,2176,Joel Hernandez Turnover.,7,5,2,0,0.5490035742376568,0.5490035742376568,LIU Brooklyn,Hofstra,4,4,NA,400591777,2014-12-28
29,1,16:16,2176,2176,Juan'ya Green Steal.,7,5,2,0,0.5490035742376568,0.5490035742376568,LIU Brooklyn,Hofstra,4,4,NA,400591777,2014-12-28
30,1,16:16,2176,2176,Dion Nesmith made Layup.,7,7,0,0,0.5,0.5,LIU Brooklyn,Hofstra,4,4,NA,400591777,2014-12-28
31,1,16:16,2176,2176,Gerrell Martin missed Three Point Jumper.,7,7,0,0,0.5,0.5,LIU Brooklyn,Hofstra,4,4,NA,400591777,2014-12-28
32,1,16:16,2176,2176,Brian Bernardi Defensive Rebound.,7,7,0,0,0.5,0.5,LIU Brooklyn,Hofstra,4,4,NA,400591777,2014-12-28
33,1,16:16,2176,2176,Ameen Tanksley missed Three Point Jumper.,7,7,0,0,0.5,0.5,LIU Brooklyn,Hofstra,4,4,NA,400591777,2014-12-28
34,1,16:16,2176,2176,Nura Zanna Defensive Rebound.,7,7,0,44,0.5,0.5,LIU Brooklyn,Hofstra,4,4,NA,400591777,2014-12-28
35,1,15:32,2132,2132,Foul on Dion Nesmith.,7,7,0,0,0.5,0.5,LIU Brooklyn,Hofstra,4,4,NA,400591777,2014-12-28
36,1,15:32,2132,2132,Official TV Timeout,7,7,0,2,0.5,0.5,LIU Brooklyn,Hofstra,4,4,NA,400591777,2014-12-28
37,1,15:30,2130,2130,Joel Hernandez missed Layup.,7,7,0,0,0.5,0.5,LIU Brooklyn,Hofstra,4,4,NA,400591777,2014-12-28
38,1,15:30,2130,2130,Malik Nichols Block.,7,7,0,2,0.5,0.5,LIU Brooklyn,Hofstra,4,4,NA,400591777,2014-12-28
39,1,15:28,2128,2128,Malik Nichols Defensive Rebound.,7,7,0,16,0.5,0.5,LIU Brooklyn,Hofstra,4,4,NA,400591777,2014-12-28
40,1,15:12,2112,2112,Juan'ya Green missed Three Point Jumper.,7,7,0,0,0.5,0.5,LIU Brooklyn,Hofstra,4,4,NA,400591777,2014-12-28
41,1,15:12,2112,2112,Juan'ya Green Offensive Rebound.,7,7,0,11,0.5,0.5,LIU Brooklyn,Hofstra,4,4,NA,400591777,2014-12-28
42,1,15:01,2101,2101,Foul on Landon Atterberry.,7,7,0,0,0.5,0.5,LIU Brooklyn,Hofstra,4,4,NA,400591777,2014-12-28
43,1,15:01,2101,2101,Moussa Kone missed Free Throw.,7,7,0,0,0.5,0.5,LIU Brooklyn,Hofstra,4,4,NA,400591777,2014-12-28
44,1,15:01,2101,2101,Hofstra Deadball Team Rebound.,7,7,0,0,0.5,0.5,LIU Brooklyn,Hofstra,4,4,NA,400591777,2014-12-28
45,1,15:01,2101,2101,Moussa Kone missed Free Throw.,7,7,0,0,0.5,0.5,LIU Brooklyn,Hofstra,4,4,NA,400591777,2014-12-28
46,1,15:01,2101,2101,LIU Brooklyn Defensive Rebound.,7,7,0,2,0.5,0.5,LIU Brooklyn,Hofstra,4,4,NA,400591777,2014-12-28
47,1,14:59,2099,2099,Foul on Malik Nichols.,7,7,0,10,0.5,0.5,LIU Brooklyn,Hofstra,4,4,NA,400591777,2014-12-28
48,1,14:49,2089,2089,Elvar Fridriksson Turnover.,7,7,0,1,0.5,0.5,LIU Brooklyn,Hofstra,4,4,NA,400591777,2014-12-28
49,1,14:48,2088,2088,Jamall Robinson Steal.,7,7,0,8,0.5,0.5,LIU Brooklyn,Hofstra,4,4,NA,400591777,2014-12-28
50,1,14:40,2080,2080,Malik Nichols missed Layup.,7,7,0,0,0.5,0.5,LIU Brooklyn,Hofstra,4,4,NA,400591777,2014-12-28
51,1,14:40,2080,2080,Martin Hermannsson Defensive Rebound.,7,7,0,7,0.5,0.5,LIU Brooklyn,Hofstra,4,4,NA,400591777,2014-12-28
52,1,14:33,2073,2073,Martin Hermannsson missed Layup.,7,7,0,0,0.5,0.5,LIU Brooklyn,Hofstra,4,4,NA,400591777,2014-12-28
53,1,14:33,2073,2073,Moussa Kone Defensive Rebound.,7,7,0,23,0.5,0.5,LIU Brooklyn,Hofstra,4,4,NA,400591777,2014-12-28
54,1,14:10,2050,2050,Foul on Nura Zanna.,7,7,0,9,0.5,0.5,LIU Brooklyn,Hofstra,4,4,NA,400591777,2014-12-28
55,1,14:01,2041,2041,Moussa Kone missed Layup.,7,7,0,0,0.5,0.5,LIU Brooklyn,Hofstra,4,4,NA,400591777,2014-12-28
56,1,14:01,2041,2041,Nura Zanna Defensive Rebound.,7,7,0,10,0.5,0.5,LIU Brooklyn,Hofstra,4,4,NA,400591777,2014-12-28
57,1,13:51,2031,2031,Gerrell Martin missed Layup.,7,7,0,0,0.5,0.5,LIU Brooklyn,Hofstra,4,4,NA,400591777,2014-12-28
58,1,13:51,2031,2031,Ameen Tanksley Defensive Rebound.,7,7,0,10,0.5,0.5,LIU Brooklyn,Hofstra,4,4,NA,400591777,2014-12-28
59,1,13:41,2021,2021,Ameen Tanksley missed Three Point Jumper.,7,7,0,0,0.5,0.5,LIU Brooklyn,Hofstra,4,4,NA,400591777,2014-12-28
60,1,13:41,2021,2021,Trevin Woods Block.,7,7,0,3,0.5,0.5,LIU Brooklyn,Hofstra,4,4,NA,400591777,2014-12-28
61,1,13:38,2018,2018,Elvar Fridriksson Defensive Rebound.,7,7,0,13,0.5,0.5,LIU Brooklyn,Hofstra,4,4,NA,400591777,2014-12-28
62,1,13:25,2005,2005,Elvar Fridriksson missed Layup.,7,7,0,0,0.5,0.5,LIU Brooklyn,Hofstra,4,4,NA,400591777,2014-12-28
63,1,13:25,2005,2005,Juan'ya Green Defensive Rebound.,7,7,0,9,0.5,0.5,LIU Brooklyn,Hofstra,4,4,NA,400591777,2014-12-28
64,1,13:16,1996,1996,Juan'ya Green missed Jumper.,7,7,0,0,0.5,0.5,LIU Brooklyn,Hofstra,4,4,NA,400591777,2014-12-28
65,1,13:16,1996,1996,LIU Brooklyn Defensive Rebound.,7,7,0,3,0.5,0.5,LIU Brooklyn,Hofstra,4,4,NA,400591777,2014-12-28
66,1,13:13,1993,1993,Foul on Ameen Tanksley.,7,7,0,0,0.5,0.5,LIU Brooklyn,Hofstra,4,4,NA,400591777,2014-12-28
67,1,13:13,1993,1993,Joel Hernandez missed Jumper.,7,7,0,0,0.5,0.5,LIU Brooklyn,Hofstra,4,4,NA,400591777,2014-12-28
68,1,13:13,1993,1993,Ameen Tanksley Defensive Rebound.,7,7,0,19,0.5,0.5,LIU Brooklyn,Hofstra,4,4,NA,400591777,2014-12-28
69,1,12:54,1974,1974,Moussa Kone made Dunk. Assisted by Juan'ya Green.,7,9,-2,3,0.44615011928619763,0.44615011928619763,LIU Brooklyn,Hofstra,4,4,NA,400591777,2014-12-28
70,1,12:51,1971,1971,LIU Brooklyn  Timeout,7,9,-2,21,0.4460745911378282,0.4460745911378282,LIU Brooklyn,Hofstra,3,4,NA,400591777,2014-12-28
71,1,12:30,1950,1950,Joel Hernandez missed Jumper.,7,9,-2,0,0.4455423475571626,0.4455423475571626,LIU Brooklyn,Hofstra,3,4,NA,400591777,2014-12-28
72,1,12:30,1950,1950,Ameen Tanksley Defensive Rebound.,7,9,-2,8,0.4455423475571626,0.4455423475571626,LIU Brooklyn,Hofstra,3,4,NA,400591777,2014-12-28
73,1,12:22,1942,1942,Foul on Martin Hermannsson.,7,9,-2,15,0.44533791440284665,0.44533791440284665,LIU Brooklyn,Hofstra,3,4,NA,400591777,2014-12-28
74,1,12:07,1927,1927,Ameen Tanksley made Layup. Assisted by Moussa Kone.,7,11,-4,11,0.3912227411584688,0.3912227411584688,LIU Brooklyn,Hofstra,3,4,NA,400591777,2014-12-28
75,1,11:56,1916,1916,Gerrell Martin made Three Point Jumper. Assisted by Elvar Fridriksson.,10,11,-1,18,0.4722491952868305,0.4722491952868305,LIU Brooklyn,Hofstra,3,4,NA,400591777,2014-12-28
76,1,11:38,1898,1898,Jamall Robinson Turnover.,10,11,-1,0,0.4720156351671368,0.4720156351671368,LIU Brooklyn,Hofstra,3,4,NA,400591777,2014-12-28
77,1,11:38,1898,1898,Martin Hermannsson Steal.,10,11,-1,4,0.4720156351671368,0.4720156351671368,LIU Brooklyn,Hofstra,3,4,NA,400591777,2014-12-28
78,1,11:34,1894,1894,Gerrell Martin missed Layup.,10,11,-1,0,0.4719637560726225,0.4719637560726225,LIU Brooklyn,Hofstra,3,4,NA,400591777,2014-12-28
79,1,11:34,1894,1894,Ameen Tanksley Defensive Rebound.,10,11,-1,9,0.4719637560726225,0.4719637560726225,LIU Brooklyn,Hofstra,3,4,NA,400591777,2014-12-28
80,1,11:25,1885,1885,Juan'ya Green made Three Point Jumper.,10,14,-4,17,0.3891409223826989,0.3891409223826989,LIU Brooklyn,Hofstra,3,4,NA,400591777,2014-12-28
81,1,11:08,1868,1868,Foul on Moussa Kone.,10,14,-4,0,0.38829897261587415,0.38829897261587415,LIU Brooklyn,Hofstra,3,4,NA,400591777,2014-12-28
82,1,11:08,1868,1868,Official TV Timeout,10,14,-4,0,0.38829897261587415,0.38829897261587415,LIU Brooklyn,Hofstra,3,4,NA,400591777,2014-12-28
83,1,11:08,1868,1868,Elvar Fridriksson made Free Throw.,11,14,-3,0,0.4156027638080216,0.4156027638080216,LIU Brooklyn,Hofstra,3,4,NA,400591777,2014-12-28
84,1,11:08,1868,1868,Elvar Fridriksson missed Free Throw.,11,14,-3,0,0.4156027638080216,0.4156027638080216,LIU Brooklyn,Hofstra,3,4,NA,400591777,2014-12-28
85,1,11:08,1868,1868,Juan'ya Green Defensive Rebound.,11,14,-3,19,0.4156027638080216,0.4156027638080216,LIU Brooklyn,Hofstra,3,4,NA,400591777,2014-12-28
86,1,10:49,1849,1849,Ameen Tanksley made Layup. Assisted by Juan'ya Green.,11,16,-5,22,0.36053317602114016,0.36053317602114016,LIU Brooklyn,Hofstra,3,4,NA,400591777,2014-12-28
87,1,10:27,1827,1827,Chris Carter made Layup. Assisted by Martin Hermannsson.,13,16,-3,21,0.41403714544445563,0.41403714544445563,LIU Brooklyn,Hofstra,3,4,NA,400591777,2014-12-28
88,1,10:06,1806,1806,Ameen Tanksley missed Jumper.,13,16,-3,0,0.41322665809776477,0.41322665809776477,LIU Brooklyn,Hofstra,3,4,NA,400591777,2014-12-28
89,1,10:06,1806,1806,LIU Brooklyn Defensive Rebound.,13,16,-3,10,0.41322665809776477,0.41322665809776477,LIU Brooklyn,Hofstra,3,4,NA,400591777,2014-12-28
90,1,9:56,1796,1796,Trevin Woods missed Layup.,13,16,-3,0,0.41283783048871653,0.41283783048871653,LIU Brooklyn,Hofstra,3,4,NA,400591777,2014-12-28
91,1,9:56,1796,1796,Jamall Robinson Defensive Rebound.,13,16,-3,15,0.41283783048871653,0.41283783048871653,LIU Brooklyn,Hofstra,3,4,NA,400591777,2014-12-28
92,1,9:41,1781,1781,Ameen Tanksley made Three Point Jumper. Assisted by Brian Bernardi.,13,19,-6,27,0.3297447657615379,0.3297447657615379,LIU Brooklyn,Hofstra,3,4,NA,400591777,2014-12-28
93,1,9:14,1754,1754,Martin Hermannsson missed Three Point Jumper.,13,19,-6,0,0.3277913868136069,0.3277913868136069,LIU Brooklyn,Hofstra,3,4,NA,400591777,2014-12-28
94,1,9:14,1754,1754,Juan'ya Green Defensive Rebound.,13,19,-6,8,0.3277913868136069,0.3277913868136069,LIU Brooklyn,Hofstra,3,4,NA,400591777,2014-12-28
95,1,9:06,1746,1746,Foul on Martin Hermannsson.,13,19,-6,9,0.3272059068900757,0.3272059068900757,LIU Brooklyn,Hofstra,3,4,NA,400591777,2014-12-28
96,1,8:57,1737,1737,Jamall Robinson made Three Point Jumper. Assisted by Brian Bernardi.,13,22,-9,15,0.2524113520800245,0.2524113520800245,LIU Brooklyn,Hofstra,3,4,NA,400591777,2014-12-28
97,1,8:42,1722,1722,Elvar Fridriksson Turnover.,13,22,-9,17,0.25097768872723825,0.25097768872723825,LIU Brooklyn,Hofstra,3,4,NA,400591777,2014-12-28
98,1,8:25,1705,1705,Foul on Elvar Fridriksson.,13,22,-9,6,0.24933443168210076,0.24933443168210076,LIU Brooklyn,Hofstra,3,4,NA,400591777,2014-12-28
99,1,8:19,1699,1699,Ameen Tanksley made Layup. Assisted by Brian Bernardi.,13,24,-11,2,0.2057209616619486,0.2057209616619486,LIU Brooklyn,Hofstra,3,4,NA,400591777,2014-12-28
100,1,8:17,1697,1697,LIU Brooklyn  Timeout,13,24,-11,25,0.20551191379428985,0.20551191379428985,LIU Brooklyn,Hofstra,2,4,NA,400591777,2014-12-28
101,1,7:52,1672,1672,Elvar Fridriksson missed Three Point Jumper.,13,24,-11,0,0.20291814592096305,0.20291814592096305,LIU Brooklyn,Hofstra,2,4,NA,400591777,2014-12-28
102,1,7:52,1672,1672,LIU Brooklyn Offensive Rebound.,13,24,-11,4,0.20291814592096305,0.20291814592096305,LIU Brooklyn,Hofstra,2,4,NA,400591777,2014-12-28
103,1,7:48,1668,1668,Foul on Brian Bernardi.,13,24,-11,0,0.20251291075522335,0.20251291075522335,LIU Brooklyn,Hofstra,2,4,NA,400591777,2014-12-28
104,1,7:48,1668,1668,Official TV Timeout,13,24,-11,0,0.20251291075522335,0.20251291075522335,LIU Brooklyn,Hofstra,2,4,NA,400591777,2014-12-28
105,1,7:48,1668,1668,Nura Zanna made Free Throw.,14,24,-10,0,0.2233835469709722,0.2233835469709722,LIU Brooklyn,Hofstra,2,4,NA,400591777,2014-12-28
106,1,7:48,1668,1668,Nura Zanna missed Free Throw.,14,24,-10,0,0.2233835469709722,0.2233835469709722,LIU Brooklyn,Hofstra,2,4,NA,400591777,2014-12-28
107,1,7:48,1668,1668,Jamall Robinson Defensive Rebound.,14,24,-10,14,0.2233835469709722,0.2233835469709722,LIU Brooklyn,Hofstra,2,4,NA,400591777,2014-12-28
108,1,7:34,1654,1654,Juan'ya Green made Three Point Jumper.,14,27,-13,19,0.16381211497944997,0.16381211497944997,LIU Brooklyn,Hofstra,2,4,NA,400591777,2014-12-28
109,1,7:15,1635,1635,Nura Zanna made Layup. Assisted by Landon Atterberry.,16,27,-11,19,0.19925800861139764,0.19925800861139764,LIU Brooklyn,Hofstra,2,4,NA,400591777,2014-12-28
110,1,6:56,1616,1616,Brian Bernardi made Three Point Jumper. Assisted by Malik Nichols.,16,30,-14,18,0.14370352344300344,0.14370352344300344,LIU Brooklyn,Hofstra,2,4,NA,400591777,2014-12-28
111,1,6:38,1598,1598,Martin Hermannsson made Layup.,18,30,-12,22,0.17629346873591992,0.17629346873591992,LIU Brooklyn,Hofstra,2,4,NA,400591777,2014-12-28
112,1,6:16,1576,1576,Malik Nichols made Layup. Assisted by Brian Bernardi.,18,32,-14,28,0.13998070026192636,0.13998070026192636,LIU Brooklyn,Hofstra,2,4,NA,400591777,2014-12-28
113,1,5:48,1548,1548,Nura Zanna missed Layup.,18,32,-14,0,0.1373827673257739,0.1373827673257739,LIU Brooklyn,Hofstra,2,4,NA,400591777,2014-12-28
114,1,5:48,1548,1548,Elvar Fridriksson Offensive Rebound.,18,32,-14,8,0.1373827673257739,0.1373827673257739,LIU Brooklyn,Hofstra,2,4,NA,400591777,2014-12-28
115,1,5:40,1540,1540,Iverson Fleming missed Three Point Jumper.,18,32,-14,0,0.1366352776140136,0.1366352776140136,LIU Brooklyn,Hofstra,2,4,NA,400591777,2014-12-28
116,1,5:40,1540,1540,Martin Hermannsson Offensive Rebound.,18,32,-14,14,0.1366352776140136,0.1366352776140136,LIU Brooklyn,Hofstra,2,4,NA,400591777,2014-12-28
117,1,5:26,1526,1526,Foul on Martin Hermannsson.,18,32,-14,0,0.1353172947057955,0.1353172947057955,LIU Brooklyn,Hofstra,2,4,NA,400591777,2014-12-28
118,1,5:26,1526,1526,Martin Hermannsson Turnover.,18,32,-14,20,0.1353172947057955,0.1353172947057955,LIU Brooklyn,Hofstra,2,4,NA,400591777,2014-12-28
119,1,5:06,1506,1506,Eliel Gonzalez Turnover.,18,32,-14,7,0.13340506195790774,0.13340506195790774,LIU Brooklyn,Hofstra,2,4,NA,400591777,2014-12-28
120,1,4:59,1499,1499,Nura Zanna made Layup. Assisted by Trevon Woods.,20,32,-12,18,0.1667388395775806,0.1667388395775806,LIU Brooklyn,Hofstra,2,4,NA,400591777,2014-12-28
121,1,4:41,1481,1481,Brian Bernardi made Three Point Jumper. Assisted by Jamall Robinson.,20,35,-15,24,0.11631730861238092,0.11631730861238092,LIU Brooklyn,Hofstra,2,4,NA,400591777,2014-12-28
122,1,4:17,1457,1457,Elvar Fridriksson missed Three Point Jumper.,20,35,-15,0,0.11395320226914196,0.11395320226914196,LIU Brooklyn,Hofstra,2,4,NA,400591777,2014-12-28
123,1,4:17,1457,1457,Iverson Fleming Offensive Rebound.,20,35,-15,6,0.11395320226914196,0.11395320226914196,LIU Brooklyn,Hofstra,2,4,NA,400591777,2014-12-28
124,1,4:11,1451,1451,Nura Zanna Turnover.,20,35,-15,1,0.11334778843679093,0.11334778843679093,LIU Brooklyn,Hofstra,2,4,NA,400591777,2014-12-28
125,1,4:10,1450,1450,Juan'ya Green Steal.,20,35,-15,7,0.11324628455933035,0.11324628455933035,LIU Brooklyn,Hofstra,2,4,NA,400591777,2014-12-28
126,1,4:03,1443,1443,Brian Bernardi missed Three Point Jumper.,20,35,-15,0,0.11254271396107406,0.11254271396107406,LIU Brooklyn,Hofstra,2,4,NA,400591777,2014-12-28
127,1,4:03,1443,1443,Iverson Fleming Defensive Rebound.,20,35,-15,8,0.11254271396107406,0.11254271396107406,LIU Brooklyn,Hofstra,2,4,NA,400591777,2014-12-28
128,1,3:55,1435,1435,Trevon Woods missed Three Point Jumper.,20,35,-15,0,0.11175611430534829,0.11175611430534829,LIU Brooklyn,Hofstra,2,4,NA,400591777,2014-12-28
129,1,3:55,1435,1435,LIU Brooklyn Offensive Rebound.,20,35,-15,3,0.11175611430534829,0.11175611430534829,LIU Brooklyn,Hofstra,2,4,NA,400591777,2014-12-28
130,1,3:52,1432,1432,Foul on Moussa Kone.,20,35,-15,0,0.11146560462158894,0.11146560462158894,LIU Brooklyn,Hofstra,2,4,NA,400591777,2014-12-28
131,1,3:52,1432,1432,Official TV Timeout,20,35,-15,0,0.11146560462158894,0.11146560462158894,LIU Brooklyn,Hofstra,2,4,NA,400591777,2014-12-28
132,1,3:52,1432,1432,Nura Zanna made Free Throw.,21,35,-14,0,0.12592641822770068,0.12592641822770068,LIU Brooklyn,Hofstra,2,4,NA,400591777,2014-12-28
133,1,3:52,1432,1432,Nura Zanna made Free Throw.,22,35,-13,13,0.1419635408794791,0.1419635408794791,LIU Brooklyn,Hofstra,2,4,NA,400591777,2014-12-28
134,1,3:39,1419,1419,Jamall Robinson missed Three Point Jumper.,22,35,-13,0,0.14064741461526506,0.14064741461526506,LIU Brooklyn,Hofstra,2,4,NA,400591777,2014-12-28
135,1,3:39,1419,1419,Nura Zanna Defensive Rebound.,22,35,-13,11,0.14064741461526506,0.14064741461526506,LIU Brooklyn,Hofstra,2,4,NA,400591777,2014-12-28
136,1,3:28,1408,1408,Iverson Fleming missed Jumper.,22,35,-13,0,0.13956196144289884,0.13956196144289884,LIU Brooklyn,Hofstra,2,4,NA,400591777,2014-12-28
137,1,3:28,1408,1408,Juan'ya Green Defensive Rebound.,22,35,-13,7,0.13956196144289884,0.13956196144289884,LIU Brooklyn,Hofstra,2,4,NA,400591777,2014-12-28
138,1,3:21,1401,1401,Foul on Malik Nichols.,22,35,-13,0,0.13888249280845263,0.13888249280845263,LIU Brooklyn,Hofstra,2,4,NA,400591777,2014-12-28
139,1,3:21,1401,1401,Malik Nichols Turnover.,22,35,-13,14,0.13888249280845263,0.13888249280845263,LIU Brooklyn,Hofstra,2,4,NA,400591777,2014-12-28
140,1,3:07,1387,1387,Joel Hernandez missed Jumper.,22,35,-13,0,0.1375447432914009,0.1375447432914009,LIU Brooklyn,Hofstra,2,4,NA,400591777,2014-12-28
141,1,3:07,1387,1387,Andre Walker Block.,22,35,-13,1,0.1375447432914009,0.1375447432914009,LIU Brooklyn,Hofstra,2,4,NA,400591777,2014-12-28
142,1,3:06,1386,1386,Juan'ya Green Defensive Rebound.,22,35,-13,25,0.13745009455454868,0.13745009455454868,LIU Brooklyn,Hofstra,2,4,NA,400591777,2014-12-28
143,1,2:41,1361,1361,Brian Bernardi made Three Point Jumper. Assisted by Juan'ya Green.,22,38,-16,23,0.09237761407380755,0.09237761407380755,LIU Brooklyn,Hofstra,2,4,NA,400591777,2014-12-28
144,1,2:18,1338,1338,Elvar Fridriksson missed Layup.,22,38,-16,0,0.09049538857933749,0.09049538857933749,LIU Brooklyn,Hofstra,2,4,NA,400591777,2014-12-28
145,1,2:18,1338,1338,Andre Walker Block.,22,38,-16,1,0.09049538857933749,0.09049538857933749,LIU Brooklyn,Hofstra,2,4,NA,400591777,2014-12-28
146,1,2:17,1337,1337,Elvar Fridriksson Offensive Rebound.,22,38,-16,2,0.09041358007868415,0.09041358007868415,LIU Brooklyn,Hofstra,2,4,NA,400591777,2014-12-28
147,1,2:15,1335,1335,Joel Hernandez made Layup. Assisted by Elvar Fridriksson.,24,38,-14,0,0.11693671634231823,0.11693671634231823,LIU Brooklyn,Hofstra,2,4,NA,400591777,2014-12-28
148,1,2:15,1335,1335,Foul on Andre Walker.,24,38,-14,0,0.11693671634231823,0.11693671634231823,LIU Brooklyn,Hofstra,2,4,NA,400591777,2014-12-28
149,1,2:15,1335,1335,Joel Hernandez missed Free Throw.,24,38,-14,0,0.11693671634231823,0.11693671634231823,LIU Brooklyn,Hofstra,2,4,NA,400591777,2014-12-28
150,1,2:15,1335,1335,Andre Walker Defensive Rebound.,24,38,-14,23,0.11693671634231823,0.11693671634231823,LIU Brooklyn,Hofstra,2,4,NA,400591777,2014-12-28
151,1,1:52,1312,1312,Ameen Tanksley made Three Point Jumper. Assisted by Juan'ya Green.,24,41,-17,2,0.07729078850540999,0.07729078850540999,LIU Brooklyn,Hofstra,2,4,NA,400591777,2014-12-28
152,1,1:50,1310,1310,Hofstra  Timeout,24,41,-17,15,0.0771344759298381,0.0771344759298381,LIU Brooklyn,Hofstra,2,3,NA,400591777,2014-12-28
153,1,1:35,1295,1295,Elvar Fridriksson missed Three Point Jumper.,24,41,-17,0,0.07595212877769503,0.07595212877769503,LIU Brooklyn,Hofstra,2,3,NA,400591777,2014-12-28
154,1,1:35,1295,1295,Chris Carter Offensive Rebound.,24,41,-17,4,0.07595212877769503,0.07595212877769503,LIU Brooklyn,Hofstra,2,3,NA,400591777,2014-12-28
155,1,1:31,1291,1291,Foul on Andre Walker.,24,41,-17,0,0.0756333321987942,0.0756333321987942,LIU Brooklyn,Hofstra,2,3,NA,400591777,2014-12-28
156,1,1:31,1291,1291,Chris Carter made Free Throw.,25,41,-16,0,0.08659288934480285,0.08659288934480285,LIU Brooklyn,Hofstra,2,3,NA,400591777,2014-12-28
157,1,1:31,1291,1291,Chris Carter missed Free Throw.,25,41,-16,0,0.08659288934480285,0.08659288934480285,LIU Brooklyn,Hofstra,2,3,NA,400591777,2014-12-28
158,1,1:31,1291,1291,Andre Walker Defensive Rebound.,25,41,-16,3,0.08659288934480285,0.08659288934480285,LIU Brooklyn,Hofstra,2,3,NA,400591777,2014-12-28
159,1,1:28,1288,1288,Foul on Chris Carter.,25,41,-16,0,0.08633708446928168,0.08633708446928168,LIU Brooklyn,Hofstra,2,3,NA,400591777,2014-12-28
160,1,1:28,1288,1288,Andre Walker made Free Throw.,25,42,-17,0,0.07539311950377395,0.07539311950377395,LIU Brooklyn,Hofstra,2,3,NA,400591777,2014-12-28
161,1,1:28,1288,1288,Andre Walker made Free Throw.,25,43,-18,20,0.06573658604319003,0.06573658604319003,LIU Brooklyn,Hofstra,2,3,NA,400591777,2014-12-28
162,1,1:08,1268,1268,Joel Hernandez missed Layup.,25,43,-18,0,0.0642176798579236,0.0642176798579236,LIU Brooklyn,Hofstra,2,3,NA,400591777,2014-12-28
163,1,1:08,1268,1268,Chris Carter Offensive Rebound.,25,43,-18,3,0.0642176798579236,0.0642176798579236,LIU Brooklyn,Hofstra,2,3,NA,400591777,2014-12-28
164,1,1:05,1265,1265,Chris Carter missed Two Point Tip Shot.,25,43,-18,0,0.06398564410680857,0.06398564410680857,LIU Brooklyn,Hofstra,2,3,NA,400591777,2014-12-28
165,1,1:05,1265,1265,Andre Walker Defensive Rebound.,25,43,-18,25,0.06398564410680857,0.06398564410680857,LIU Brooklyn,Hofstra,2,3,NA,400591777,2014-12-28
166,1,0:40,1240,1240,Ameen Tanksley made Jumper.,25,45,-20,34,0.04659984535768416,0.04659984535768416,LIU Brooklyn,Hofstra,2,3,NA,400591777,2014-12-28
167,1,0:06,1206,1206,Iverson Fleming missed Three Point Jumper.,25,45,-20,0,0.04417543751131013,0.04417543751131013,LIU Brooklyn,Hofstra,2,3,NA,400591777,2014-12-28
168,1,0:06,1206,1206,Jamall Robinson Defensive Rebound.,25,45,-20,6,0.04417543751131013,0.04417543751131013,LIU Brooklyn,Hofstra,2,3,NA,400591777,2014-12-28
169,1,0:00,1200,1200,Brian Bernardi missed Three Point Jumper.,25,45,-20,0,0.04374696407708482,0.04374696407708482,LIU Brooklyn,Hofstra,2,3,NA,400591777,2014-12-28
170,1,0:00,1200,1200,Jamil Hood Block.,25,45,-20,0,0.04374696407708482,0.04374696407708482,LIU Brooklyn,Hofstra,2,3,NA,400591777,2014-12-28
171,1,0:00,1200,1200,LIU Brooklyn Defensive Rebound.,25,45,-20,0,0.04374696407708482,0.04374696407708482,LIU Brooklyn,Hofstra,2,3,NA,400591777,2014-12-28
172,1,0:00,1200,1200,End of 1st half,25,45,-20,0,0.04374696407708482,0.04374696407708482,LIU Brooklyn,Hofstra,2,3,NA,400591777,2014-12-28
173,2,20:00,1200,1200,PLAY,25,45,-20,28,0.04374696407708482,0.04374696407708482,LIU Brooklyn,Hofstra,3,4,NA,400591777,2014-12-28
174,2,19:32,1172,1172,Foul on Malik Nichols.,25,45,-20,1,0.0418557843474921,0.0418557843474921,LIU Brooklyn,Hofstra,3,4,NA,400591777,2014-12-28
175,2,19:31,1171,1171,Malik Nichols Turnover.,25,45,-20,15,0.04179105638045705,0.04179105638045705,LIU Brooklyn,Hofstra,3,4,NA,400591777,2014-12-28
176,2,19:16,1156,1156,Landon Atterberry made Three Point Jumper.,28,45,-17,20,0.06398607898631349,0.06398607898631349,LIU Brooklyn,Hofstra,3,4,NA,400591777,2014-12-28
177,2,18:56,1136,1136,Ameen Tanksley missed Three Point Jumper.,28,45,-17,0,0.06238821929131222,0.06238821929131222,LIU Brooklyn,Hofstra,3,4,NA,400591777,2014-12-28
178,2,18:56,1136,1136,Landon Atterberry Defensive Rebound.,28,45,-17,7,0.06238821929131222,0.06238821929131222,LIU Brooklyn,Hofstra,3,4,NA,400591777,2014-12-28
