play_id,half,time_remaining_half,secs_remaining,secs_remaining_absolute,description,home_score,away_score,score_diff,play_length,win_prob,naive_win_prob,home,away,home_time_out_remaining,away_time_out_remaining,home_favored_by,game_id,date
1,1,20:00,2400,2400,PLAY,0,0,0,14,0.5,0.5,Tennessee Tech,UT Martin,4,4,NA,290152635,2009-01-15
2,1,19:46,2386,2386,Delrico Lane made Two Point Layup.,0,2,-2,36,0.4556792914736857,0.4556792914736857,Tennessee Tech,UT Martin,4,4,NA,290152635,2009-01-15
3,1,19:10,2350,2350,Lester Hudson missed Two Point Jumper.,0,2,-2,0,0.4549092390044173,0.4549092390044173,Tennessee Tech,UT Martin,4,4,NA,290152635,2009-01-15
4,1,19:10,2350,2350,Olajide Hay Offensive Rebound.,0,2,-2,30,0.4549092390044173,0.4549092390044173,Tennessee Tech,UT Martin,4,4,NA,290152635,2009-01-15
5,1,18:40,2320,2320,Will Barnes missed Two Point Jumper.,0,2,-2,0,0.45425468392503904,0.45425468392503904,Tennessee Tech,UT Martin,4,4,NA,290152635,2009-01-15
6,1,18:40,2320,2320,Lester Hudson Defensive Rebound.,0,2,-2,4,0.45425468392503904,0.45425468392503904,Tennessee Tech,UT Martin,4,4,NA,290152635,2009-01-15
7,1,18:36,2316,2316,Marquis Weddle made Two Point Layup.,0,4,-4,10,0.40909706148952674,0.40909706148952674,Tennessee Tech,UT Martin,4,4,NA,290152635,2009-01-15
8,1,18:26,2306,2306,Alex Davis missed Two Point Jumper.,0,4,-4,0,0.4086661994248904,0.4086661994248904,Tennessee Tech,UT Martin,4,4,NA,290152635,2009-01-15
9,1,18:26,2306,2306,Tennessee-Martin Defensive Rebou.,0,4,-4,21,0.4086661994248904,0.4086661994248904,Tennessee Tech,UT Martin,4,4,NA,290152635,2009-01-15
10,1,18:05,2285,2285,Foul on Darnell Lindsay,0,4,-4,2,0.4077551598976451,0.4077551598976451,Tennessee Tech,UT Martin,4,4,NA,290152635,2009-01-15
11,1,18:03,2283,2283,Marquis Weddle missed Two Point Jumper.,0,4,-4,0,0.40766798050937575,0.40766798050937575,Tennessee Tech,UT Martin,4,4,NA,290152635,2009-01-15
12,1,18:03,2283,2283,Olajide Hay Offensive Rebound.,0,4,-4,5,0.40766798050937575,0.40766798050937575,Tennessee Tech,UT Martin,4,4,NA,290152635,2009-01-15
13,1,17:58,2278,2278,Olajide Hay missed Two Point Jumper.,0,4,-4,0,0.407449734304109,0.407449734304109,Tennessee Tech,UT Martin,4,4,NA,290152635,2009-01-15
14,1,17:58,2278,2278,Darnell Lindsay Defensive Rebound.,0,4,-4,0,0.407449734304109,0.407449734304109,Tennessee Tech,UT Martin,4,4,NA,290152635,2009-01-15
15,1,17:58,2278,2278,Frank Davis made Three Point Jumper.  Assisted by Darnell Lindsay.,3,4,-1,29,0.47660970179848494,0.47660970179848494,Tennessee Tech,UT Martin,4,4,NA,290152635,2009-01-15
16,1,17:29,2249,2249,Lester Hudson missed Two Point Jumper.,3,4,-1,0,0.47628057622372727,0.47628057622372727,Tennessee Tech,UT Martin,4,4,NA,290152635,2009-01-15
17,1,17:29,2249,2249,Daniel Northern Defensive Rebound.,3,4,-1,11,0.47628057622372727,0.47628057622372727,Tennessee Tech,UT Martin,4,4,NA,290152635,2009-01-15
18,1,17:18,2238,2238,Frank Davis made Two Point Jumper.,5,4,1,26,0.5238451522402601,0.5238451522402601,Tennessee Tech,UT Martin,4,4,NA,290152635,2009-01-15
19,1,16:52,2212,2212,Olajide Hay missed Two Point Jumper.,5,4,1,0,0.5241439908060583,0.5241439908060583,Tennessee Tech,UT Martin,4,4,NA,290152635,2009-01-15
20,1,16:52,2212,2212,Djero Riedewald Offensive Rebound.,5,4,1,2,0.5241439908060583,0.5241439908060583,Tennessee Tech,UT Martin,4,4,NA,290152635,2009-01-15
21,1,16:50,2210,2210,Djero Riedewald made Two Point Jumper.,5,6,-1,8,0.47583293443762664,0.47583293443762664,Tennessee Tech,UT Martin,4,4,NA,290152635,2009-01-15
22,1,16:42,2202,2202,Daniel Northern made Two Point Dunk Shot.  Assisted by Darnell Lindsay.,7,6,1,42,0.5242594764832842,0.5242594764832842,Tennessee Tech,UT Martin,4,4,NA,290152635,2009-01-15
23,1,16:00,2160,2160,Will Barnes made Two Point Jumper.,9,6,3,0,0.5737601383043379,0.5737601383043379,Tennessee Tech,UT Martin,4,4,NA,290152635,2009-01-15
24,1,16:00,2160,2160,Foul on Olajide Hay,9,6,3,0,0.5737601383043379,0.5737601383043379,Tennessee Tech,UT Martin,4,4,NA,290152635,2009-01-15
25,1,16:00,2160,2160,Will Barnes made Free Throw.,10,6,4,19,0.5977933026269484,0.5977933026269484,Tennessee Tech,UT Martin,4,4,NA,290152635,2009-01-15
26,1,15:41,2141,2141,Djero Riedewald made Two Point Jumper.,10,8,2,11,0.5498150985748921,0.5498150985748921,Tennessee Tech,UT Martin,4,4,NA,290152635,2009-01-15
27,1,15:30,2130,2130,Darnell Lindsay missed Three Point Jumper.,10,8,2,0,0.5500721316261907,0.5500721316261907,Tennessee Tech,UT Martin,4,4,NA,290152635,2009-01-15
28,1,15:30,2130,2130,Olajide Hay Defensive Rebound.,10,8,2,20,0.5500721316261907,0.5500721316261907,Tennessee Tech,UT Martin,4,4,NA,290152635,2009-01-15
29,1,15:10,2110,2110,Djero Riedewald missed Two Point Jumper.,10,8,2,0,0.5505421479818391,0.5505421479818391,Tennessee Tech,UT Martin,4,4,NA,290152635,2009-01-15
30,1,15:10,2110,2110,Frank Davis Defensive Rebound.,10,8,2,7,0.5505421479818391,0.5505421479818391,Tennessee Tech,UT Martin,4,4,NA,290152635,2009-01-15
31,1,15:03,2103,2103,Darnell Lindsay made Three Point Jumper.  Assisted by Frank Davis.,13,8,5,11,0.6245308343422337,0.6245308343422337,Tennessee Tech,UT Martin,4,4,NA,290152635,2009-01-15
32,1,14:52,2092,2092,Lester Hudson missed Three Point Jumper.,13,8,5,0,0.6251485720971559,0.6251485720971559,Tennessee Tech,UT Martin,4,4,NA,290152635,2009-01-15
33,1,14:52,2092,2092,Elijah Cunningh Muhammad Defensive Rebound.,13,8,5,10,0.6251485720971559,0.6251485720971559,Tennessee Tech,UT Martin,4,4,NA,290152635,2009-01-15
34,1,14:42,2082,2082,Frank Davis missed Three Point Jumper.,13,8,5,0,0.6257122963540896,0.6257122963540896,Tennessee Tech,UT Martin,4,4,NA,290152635,2009-01-15
35,1,14:42,2082,2082,Tennessee-Martin Defensive Rebou.,13,8,5,0,0.6257122963540896,0.6257122963540896,Tennessee Tech,UT Martin,4,4,NA,290152635,2009-01-15
36,1,14:42,2082,2082,Official TV Timeout.,13,8,5,21,0.6257122963540896,0.6257122963540896,Tennessee Tech,UT Martin,4,4,NA,290152635,2009-01-15
37,1,14:21,2061,2061,Foul on Djero Riedewald,13,8,5,5,0.6269031048629435,0.6269031048629435,Tennessee Tech,UT Martin,4,4,NA,290152635,2009-01-15
38,1,14:16,2056,2056,Darnell Lindsay made Three Point Jumper.  Assisted by Elijah Cunningh Muhammad.,16,8,8,26,0.6968359372615913,0.6968359372615913,Tennessee Tech,UT Martin,4,4,NA,290152635,2009-01-15
39,1,13:50,2030,2030,Marquis Weddle made Three Point Jumper.,16,11,5,7,0.6286795016727604,0.6286795016727604,Tennessee Tech,UT Martin,4,4,NA,290152635,2009-01-15
40,1,13:43,2023,2023,Foul on Lester Hudson,16,11,5,6,0.6290838749359045,0.6290838749359045,Tennessee Tech,UT Martin,4,4,NA,290152635,2009-01-15
41,1,13:37,2017,2017,Darnell Lindsay made Two Point Jumper.,18,11,7,17,0.6773653153596189,0.6773653153596189,Tennessee Tech,UT Martin,4,4,NA,290152635,2009-01-15
42,1,13:20,2000,2000,Lester Hudson made Two Point Jumper.  Assisted by Delrico Lane.,18,13,5,18,0.6304214768429788,0.6304214768429788,Tennessee Tech,UT Martin,4,4,NA,290152635,2009-01-15
43,1,13:02,1982,1982,Elijah Cunningh Muhammad made Two Point Layup.,20,13,7,17,0.6800473765875121,0.6800473765875121,Tennessee Tech,UT Martin,4,4,NA,290152635,2009-01-15
44,1,12:45,1965,1965,Olajide Hay missed Two Point Jumper.,20,13,7,7,0.6813642754758032,0.6813642754758032,Tennessee Tech,UT Martin,4,4,NA,290152635,2009-01-15
45,1,12:38,1958,1958,Daniel Northern Defensive Rebound.,20,13,7,7,0.6819093640056847,0.6819093640056847,Tennessee Tech,UT Martin,4,4,NA,290152635,2009-01-15
46,1,12:31,1951,1951,Marquis Weddle made Two Point Layup.,20,15,5,40,0.6333202566542294,0.6333202566542294,Tennessee Tech,UT Martin,4,4,NA,290152635,2009-01-15
47,1,11:51,1911,1911,Marquis Weddle missed Three Point Jumper.,20,15,5,0,0.6357324678714038,0.6357324678714038,Tennessee Tech,UT Martin,4,4,NA,290152635,2009-01-15
48,1,11:51,1911,1911,Benzor Simmons Offensive Rebound.,20,15,5,14,0.6357324678714038,0.6357324678714038,Tennessee Tech,UT Martin,4,4,NA,290152635,2009-01-15
49,1,11:37,1897,1897,Lester Hudson made Three Point Jumper.,20,18,2,27,0.555819652211619,0.555819652211619,Tennessee Tech,UT Martin,4,4,NA,290152635,2009-01-15
50,1,11:10,1870,1870,Official TV Timeout.,20,18,2,0,0.556513826701697,0.556513826701697,Tennessee Tech,UT Martin,4,4,NA,290152635,2009-01-15
51,1,11:10,1870,1870,Daniel Northern Block.,20,18,2,18,0.556513826701697,0.556513826701697,Tennessee Tech,UT Martin,4,4,NA,290152635,2009-01-15
52,1,10:52,1852,1852,Foul on Benzor Simmons,20,18,2,22,0.5569779435303803,0.5569779435303803,Tennessee Tech,UT Martin,4,4,NA,290152635,2009-01-15
53,1,10:30,1830,1830,Will Barnes made Three Point Jumper.,23,18,5,19,0.6406170009471788,0.6406170009471788,Tennessee Tech,UT Martin,4,4,NA,290152635,2009-01-15
54,1,10:11,1811,1811,Lester Hudson made Two Point Jumper.,23,20,3,19,0.5865796701071997,0.5865796701071997,Tennessee Tech,UT Martin,4,4,NA,290152635,2009-01-15
55,1,9:52,1792,1792,Kevin Murphy missed Two Point Jumper.,23,20,3,0,0.5873182943858248,0.5873182943858248,Tennessee Tech,UT Martin,4,4,NA,290152635,2009-01-15
56,1,9:52,1792,1792,Lester Hudson Defensive Rebound.,23,20,3,14,0.5873182943858248,0.5873182943858248,Tennessee Tech,UT Martin,4,4,NA,290152635,2009-01-15
57,1,9:38,1778,1778,Reuben (Ookie) Clayton made Two Point Layup.  Assisted by Lester Hudson.,23,22,1,18,0.5295619294968057,0.5295619294968057,Tennessee Tech,UT Martin,4,4,NA,290152635,2009-01-15
58,1,9:20,1760,1760,Will Barnes missed Two Point Jumper.,23,22,1,0,0.529806650400558,0.529806650400558,Tennessee Tech,UT Martin,4,4,NA,290152635,2009-01-15
59,1,9:20,1760,1760,Lester Hudson Defensive Rebound.,23,22,1,8,0.529806650400558,0.529806650400558,Tennessee Tech,UT Martin,4,4,NA,290152635,2009-01-15
60,1,9:12,1752,1752,Foul on Alfred Jones,23,22,1,0,0.5299164848900471,0.5299164848900471,Tennessee Tech,UT Martin,4,4,NA,290152635,2009-01-15
61,1,9:12,1752,1752,Reuben (Ookie) Clayton made Free Throw.,23,23,0,0,0.5,0.5,Tennessee Tech,UT Martin,4,4,NA,290152635,2009-01-15
62,1,9:12,1752,1752,Reuben (Ookie) Clayton made Free Throw.,23,24,-1,5,0.47008351510995294,0.47008351510995294,Tennessee Tech,UT Martin,4,4,NA,290152635,2009-01-15
63,1,9:07,1747,1747,Will Barnes made Two Point Layup.,25,24,1,7,0.5299854917413526,0.5299854917413526,Tennessee Tech,UT Martin,4,4,NA,290152635,2009-01-15
64,1,9:00,1740,1740,Reuben (Ookie) Clayton missed Three Point Jumper.,25,24,1,0,0.5300825886464002,0.5300825886464002,Tennessee Tech,UT Martin,4,4,NA,290152635,2009-01-15
65,1,9:00,1740,1740,Frank Davis Defensive Rebound.,25,24,1,7,0.5300825886464002,0.5300825886464002,Tennessee Tech,UT Martin,4,4,NA,290152635,2009-01-15
66,1,8:53,1733,1733,Will Barnes made Two Point Layup.  Assisted by Frank Davis.,27,24,3,16,0.5896706755804625,0.5896706755804625,Tennessee Tech,UT Martin,4,4,NA,290152635,2009-01-15
67,1,8:37,1717,1717,Reuben (Ookie) Clayton made Two Point Layup.  Assisted by Lester Hudson.,27,26,1,13,0.5304059361583805,0.5304059361583805,Tennessee Tech,UT Martin,4,4,NA,290152635,2009-01-15
68,1,8:24,1704,1704,Darnell Lindsay missed Two Point Jumper.,27,26,1,0,0.5305918842184905,0.5305918842184905,Tennessee Tech,UT Martin,4,4,NA,290152635,2009-01-15
69,1,8:24,1704,1704,Tennessee-Martin Defensive Rebou.,27,26,1,3,0.5305918842184905,0.5305918842184905,Tennessee Tech,UT Martin,4,4,NA,290152635,2009-01-15
70,1,8:21,1701,1701,Foul on Daniel Northern,27,26,1,14,0.5306351462888848,0.5306351462888848,Tennessee Tech,UT Martin,4,4,NA,290152635,2009-01-15
71,1,8:07,1687,1687,Foul on Delrico Lane,27,26,1,13,0.5308386897870919,0.5308386897870919,Tennessee Tech,UT Martin,4,4,NA,290152635,2009-01-15
72,1,7:54,1674,1674,Official TV Timeout.,27,26,1,13,0.5310259068173436,0.5310259068173436,Tennessee Tech,UT Martin,4,4,NA,290152635,2009-01-15
73,1,7:41,1661,1661,Lester Hudson missed Three Point Jumper.,27,26,1,0,0.531209824925366,0.531209824925366,Tennessee Tech,UT Martin,4,4,NA,290152635,2009-01-15
74,1,7:41,1661,1661,Daniel Northern Defensive Rebound.,27,26,1,34,0.531209824925366,0.531209824925366,Tennessee Tech,UT Martin,4,4,NA,290152635,2009-01-15
75,1,7:07,1627,1627,Alex Davis missed Two Point Jumper.,27,26,1,0,0.531679635896181,0.531679635896181,Tennessee Tech,UT Martin,4,4,NA,290152635,2009-01-15
76,1,7:07,1627,1627,Daniel Northern Offensive Rebound.,27,26,1,8,0.531679635896181,0.531679635896181,Tennessee Tech,UT Martin,4,4,NA,290152635,2009-01-15
77,1,6:59,1619,1619,Daniel Northern made Two Point Tip Shot.,29,26,3,13,0.5943503863889814,0.5943503863889814,Tennessee Tech,UT Martin,4,4,NA,290152635,2009-01-15
78,1,6:46,1606,1606,Foul on Alex Davis,29,26,3,0,0.5948634204203859,0.5948634204203859,Tennessee Tech,UT Martin,4,4,NA,290152635,2009-01-15
79,1,6:46,1606,1606,Olajide Hay made Free Throw.,29,27,2,0,0.5636703911818012,0.5636703911818012,Tennessee Tech,UT Martin,4,4,NA,290152635,2009-01-15
80,1,6:46,1606,1606,Olajide Hay made Free Throw.,29,28,1,27,0.5319653099882755,0.5319653099882755,Tennessee Tech,UT Martin,4,4,NA,290152635,2009-01-15
81,1,6:19,1579,1579,Lester Hudson missed Two Point Layup.,29,28,1,0,0.532332416226348,0.532332416226348,Tennessee Tech,UT Martin,4,4,NA,290152635,2009-01-15
82,1,6:19,1579,1579,Daniel Northern Defensive Rebound.,29,28,1,11,0.532332416226348,0.532332416226348,Tennessee Tech,UT Martin,4,4,NA,290152635,2009-01-15
83,1,6:08,1568,1568,Will Barnes missed Two Point Jumper.,29,28,1,0,0.5324830454584442,0.5324830454584442,Tennessee Tech,UT Martin,4,4,NA,290152635,2009-01-15
84,1,6:08,1568,1568,Kevin Murphy Offensive Rebound.,29,28,1,52,0.5324830454584442,0.5324830454584442,Tennessee Tech,UT Martin,4,4,NA,290152635,2009-01-15
85,1,5:16,1516,1516,Marquis Weddle missed Two Point Layup.,29,28,1,0,0.5332169615066026,0.5332169615066026,Tennessee Tech,UT Martin,4,4,NA,290152635,2009-01-15
86,1,5:16,1516,1516,Daniel Northern Defensive Rebound.,29,28,1,23,0.5332169615066026,0.5332169615066026,Tennessee Tech,UT Martin,4,4,NA,290152635,2009-01-15
87,1,4:53,1493,1493,Kevin Murphy missed Two Point Jumper.,29,28,1,0,0.5335598656971734,0.5335598656971734,Tennessee Tech,UT Martin,4,4,NA,290152635,2009-01-15
88,1,4:53,1493,1493,Delrico Lane Defensive Rebound.,29,28,1,10,0.5335598656971734,0.5335598656971734,Tennessee Tech,UT Martin,4,4,NA,290152635,2009-01-15
89,1,4:43,1483,1483,Lester Hudson made Two Point Layup.,29,30,-1,30,0.4662862652629678,0.4662862652629678,Tennessee Tech,UT Martin,4,4,NA,290152635,2009-01-15
90,1,4:13,1453,1453,Foul on Kevin Murphy,29,30,-1,13,0.4658038226549363,0.4658038226549363,Tennessee Tech,UT Martin,4,4,NA,290152635,2009-01-15
91,1,4:00,1440,1440,Reuben (Ookie) Clayton missed Two Point Jumper.,29,30,-1,0,0.46558773330647796,0.46558773330647796,Tennessee Tech,UT Martin,4,4,NA,290152635,2009-01-15
92,1,4:00,1440,1440,Alex Davis Defensive Rebound.,29,30,-1,13,0.46558773330647796,0.46558773330647796,Tennessee Tech,UT Martin,4,4,NA,290152635,2009-01-15
93,1,3:47,1427,1427,Darnell Lindsay missed Three Point Jumper.,29,30,-1,0,0.4653770962663276,0.4653770962663276,Tennessee Tech,UT Martin,4,4,NA,290152635,2009-01-15
94,1,3:47,1427,1427,Benzor Simmons Defensive Rebound.,29,30,-1,10,0.4653770962663276,0.4653770962663276,Tennessee Tech,UT Martin,4,4,NA,290152635,2009-01-15
95,1,3:37,1417,1417,Olajide Hay made Two Point Jumper.,29,32,-3,5,0.39698226812296283,0.39698226812296283,Tennessee Tech,UT Martin,4,4,NA,290152635,2009-01-15
96,1,3:32,1412,1412,Tennessee Tech 30 Second Timeout.,29,32,-3,8,0.3967557654624584,0.3967557654624584,Tennessee Tech,UT Martin,3,4,NA,290152635,2009-01-15
97,1,3:24,1404,1404,Elijah Cunningh Muhammad missed Two Point Jumper.,29,32,-3,0,0.39639647728798244,0.39639647728798244,Tennessee Tech,UT Martin,3,4,NA,290152635,2009-01-15
98,1,3:24,1404,1404,Alex Davis Offensive Rebound.,29,32,-3,4,0.39639647728798244,0.39639647728798244,Tennessee Tech,UT Martin,3,4,NA,290152635,2009-01-15
99,1,3:20,1400,1400,Alex Davis made Two Point Tip Shot.,31,32,-1,14,0.4649535383590408,0.4649535383590408,Tennessee Tech,UT Martin,3,4,NA,290152635,2009-01-15
100,1,3:06,1386,1386,Foul on Zach Bailey,31,32,-1,0,0.4647387830704231,0.4647387830704231,Tennessee Tech,UT Martin,3,4,NA,290152635,2009-01-15
101,1,3:06,1386,1386,Official TV Timeout.,31,32,-1,0,0.4647387830704231,0.4647387830704231,Tennessee Tech,UT Martin,3,4,NA,290152635,2009-01-15
102,1,3:06,1386,1386,Reuben (Ookie) Clayton missed Free Throw.,31,32,-1,0,0.4647387830704231,0.4647387830704231,Tennessee Tech,UT Martin,3,4,NA,290152635,2009-01-15
103,1,3:06,1386,1386,null,31,32,-1,0,0.4647387830704231,0.4647387830704231,Tennessee Tech,UT Martin,3,4,NA,290152635,2009-01-15
104,1,3:06,1386,1386,Reuben (Ookie) Clayton made Free Throw.,31,33,-2,14,0.4298265676490916,0.4298265676490916,Tennessee Tech,UT Martin,3,4,NA,290152635,2009-01-15
105,1,2:52,1372,1372,Zach Bailey made Two Point Jumper.,33,33,0,21,0.5,0.5,Tennessee Tech,UT Martin,3,4,NA,290152635,2009-01-15
106,1,2:31,1351,1351,Reuben (Ookie) Clayton missed Two Point Jumper.,33,33,0,0,0.5,0.5,Tennessee Tech,UT Martin,3,4,NA,290152635,2009-01-15
107,1,2:31,1351,1351,Daniel Northern Defensive Rebound.,33,33,0,20,0.5,0.5,Tennessee Tech,UT Martin,3,4,NA,290152635,2009-01-15
108,1,2:11,1331,1331,Elijah Cunningh Muhammad missed Three Point Jumper.,33,33,0,12,0.5,0.5,Tennessee Tech,UT Martin,3,4,NA,290152635,2009-01-15
109,1,1:59,1319,1319,Darnell Lindsay Offensive Rebound.,33,33,0,5,0.5,0.5,Tennessee Tech,UT Martin,3,4,NA,290152635,2009-01-15
110,1,1:54,1314,1314,Delrico Lane missed Three Point Jumper.,33,33,0,0,0.5,0.5,Tennessee Tech,UT Martin,3,4,NA,290152635,2009-01-15
111,1,1:54,1314,1314,Olajide Hay Offensive Rebound.,33,33,0,4,0.5,0.5,Tennessee Tech,UT Martin,3,4,NA,290152635,2009-01-15
112,1,1:50,1310,1310,Olajide Hay made Two Point Jumper.,33,35,-2,20,0.42751622830746183,0.42751622830746183,Tennessee Tech,UT Martin,3,4,NA,290152635,2009-01-15
113,1,1:30,1290,1290,Zach Bailey made Two Point Jumper.,35,35,0,16,0.5,0.5,Tennessee Tech,UT Martin,3,4,NA,290152635,2009-01-15
114,1,1:14,1274,1274,Lester Hudson made Two Point Layup.  Assisted by Delrico Lane.,35,37,-2,38,0.426332726798658,0.426332726798658,Tennessee Tech,UT Martin,3,4,NA,290152635,2009-01-15
115,1,0:36,1236,1236,Marquis Weddle missed Three Point Jumper.,35,37,-2,0,0.424953903596708,0.424953903596708,Tennessee Tech,UT Martin,3,4,NA,290152635,2009-01-15
116,1,0:36,1236,1236,Lester Hudson Offensive Rebound.,35,37,-2,6,0.424953903596708,0.424953903596708,Tennessee Tech,UT Martin,3,4,NA,290152635,2009-01-15
117,1,0:30,1230,1230,Tennessee-Martin Full Timeout.,35,37,-2,24,0.4247206676180144,0.4247206676180144,Tennessee Tech,UT Martin,3,3,NA,290152635,2009-01-15
118,1,0:06,1206,1206,Elijah Cunningh Muhammad made Two Point Layup.,37,37,0,6,0.5,0.5,Tennessee Tech,UT Martin,3,3,NA,290152635,2009-01-15
119,1,0:00,1200,1200,End of the 1st Half.,37,37,0,0,0.5,0.5,Tennessee Tech,UT Martin,3,3,NA,290152635,2009-01-15
120,2,20:00,1200,1200,PLAY,37,37,0,13,0.5,0.5,Tennessee Tech,UT Martin,4,4,NA,290152635,2009-01-15
121,2,19:47,1187,1187,Daniel Northern missed Two Point Jumper.,37,37,0,0,0.5,0.5,Tennessee Tech,UT Martin,4,4,NA,290152635,2009-01-15
122,2,19:47,1187,1187,Alex Davis Offensive Rebound.,37,37,0,8,0.5,0.5,Tennessee Tech,UT Martin,4,4,NA,290152635,2009-01-15
123,2,19:39,1179,1179,Alex Davis made Two Point Layup.  Assisted by Daniel Northern.,39,37,2,21,0.5773589079751501,0.5773589079751501,Tennessee Tech,UT Martin,4,4,NA,290152635,2009-01-15
124,2,19:18,1158,1158,Lester Hudson made Two Point Jumper.  Assisted by Marquis Weddle.,39,39,0,23,0.5,0.5,Tennessee Tech,UT Martin,4,4,NA,290152635,2009-01-15
125,2,18:55,1135,1135,Foul on Lester Hudson,39,39,0,7,0.5,0.5,Tennessee Tech,UT Martin,4,4,NA,290152635,2009-01-15
126,2,18:48,1128,1128,Djero Riedewald missed Two Point Jumper.,39,39,0,0,0.5,0.5,Tennessee Tech,UT Martin,4,4,NA,290152635,2009-01-15
127,2,18:48,1128,1128,Daniel Northern Block.,39,39,0,4,0.5,0.5,Tennessee Tech,UT Martin,4,4,NA,290152635,2009-01-15
128,2,18:44,1124,1124,Delrico Lane Offensive Rebound.,39,39,0,1,0.5,0.5,Tennessee Tech,UT Martin,4,4,NA,290152635,2009-01-15
129,2,18:43,1123,1123,Marquis Weddle made Three Point Jumper.  Assisted by Lester Hudson.,39,42,-3,17,0.3819393119034149,0.3819393119034149,Tennessee Tech,UT Martin,4,4,NA,290152635,2009-01-15
130,2,18:26,1106,1106,Alex Davis missed Two Point Jumper.,39,42,-3,0,0.3809755029945543,0.3809755029945543,Tennessee Tech,UT Martin,4,4,NA,290152635,2009-01-15
131,2,18:26,1106,1106,Daniel Northern Offensive Rebound.,39,42,-3,9,0.3809755029945543,0.3809755029945543,Tennessee Tech,UT Martin,4,4,NA,290152635,2009-01-15
132,2,18:17,1097,1097,Daniel Northern made Two Point Jumper.,41,42,-1,8,0.45945580303979533,0.45945580303979533,Tennessee Tech,UT Martin,4,4,NA,290152635,2009-01-15
133,2,18:09,1089,1089,Olajide Hay made Two Point Jumper.,41,44,-3,1,0.3799944867779903,0.3799944867779903,Tennessee Tech,UT Martin,4,4,NA,290152635,2009-01-15
134,2,18:08,1088,1088,Foul on Daniel Northern,41,44,-3,0,0.3799360426623326,0.3799360426623326,Tennessee Tech,UT Martin,4,4,NA,290152635,2009-01-15
135,2,18:08,1088,1088,Olajide Hay made Free Throw.,41,45,-4,9,0.3422928907482501,0.3422928907482501,Tennessee Tech,UT Martin,4,4,NA,290152635,2009-01-15
136,2,17:59,1079,1079,Alex Davis missed Two Point Jumper.,41,45,-4,0,0.34161714247027464,0.34161714247027464,Tennessee Tech,UT Martin,4,4,NA,290152635,2009-01-15
137,2,17:59,1079,1079,Djero Riedewald Defensive Rebound.,41,45,-4,6,0.34161714247027464,0.34161714247027464,Tennessee Tech,UT Martin,4,4,NA,290152635,2009-01-15
138,2,17:53,1073,1073,Marquis Weddle made Two Point Jumper.,41,47,-6,18,0.27146743315712846,0.27146743315712846,Tennessee Tech,UT Martin,4,4,NA,290152635,2009-01-15
139,2,17:35,1055,1055,Darnell Lindsay made Two Point Jumper.  Assisted by Frank Davis.,43,47,-4,8,0.3397556694736423,0.3397556694736423,Tennessee Tech,UT Martin,4,4,NA,290152635,2009-01-15
140,2,17:27,1047,1047,Marquis Weddle missed Three Point Jumper.,43,47,-4,0,0.3391117666316998,0.3391117666316998,Tennessee Tech,UT Martin,4,4,NA,290152635,2009-01-15
141,2,17:27,1047,1047,Tennessee Tech Defensive Rebound.,43,47,-4,17,0.3391117666316998,0.3391117666316998,Tennessee Tech,UT Martin,4,4,NA,290152635,2009-01-15
142,2,17:10,1030,1030,Frank Davis missed Three Point Jumper.,43,47,-4,0,0.3376963648570033,0.3376963648570033,Tennessee Tech,UT Martin,4,4,NA,290152635,2009-01-15
143,2,17:10,1030,1030,Delrico Lane Defensive Rebound.,43,47,-4,4,0.3376963648570033,0.3376963648570033,Tennessee Tech,UT Martin,4,4,NA,290152635,2009-01-15
144,2,17:06,1026,1026,Foul on Daniel Northern,43,47,-4,48,0.3373530619911868,0.3373530619911868,Tennessee Tech,UT Martin,4,4,NA,290152635,2009-01-15
145,2,16:18,978,978,Lester Hudson made Two Point Layup.,43,49,-6,18,0.260589694269612,0.260589694269612,Tennessee Tech,UT Martin,4,4,NA,290152635,2009-01-15
146,2,16:00,960,960,Will Barnes missed Three Point Jumper.,43,49,-6,0,0.2581960106387337,0.2581960106387337,Tennessee Tech,UT Martin,4,4,NA,290152635,2009-01-15
147,2,16:00,960,960,Delrico Lane Defensive Rebound.,43,49,-6,8,0.2581960106387337,0.2581960106387337,Tennessee Tech,UT Martin,4,4,NA,290152635,2009-01-15
148,2,15:52,952,952,Lester Hudson made Two Point Jumper.,43,51,-8,16,0.19558334189749357,0.19558334189749357,Tennessee Tech,UT Martin,4,4,NA,290152635,2009-01-15
149,2,15:36,936,936,Alex Davis missed Two Point Jumper.,43,51,-8,0,0.193526696717909,0.193526696717909,Tennessee Tech,UT Martin,4,4,NA,290152635,2009-01-15
150,2,15:36,936,936,Lester Hudson Defensive Rebound.,43,51,-8,5,0.193526696717909,0.193526696717909,Tennessee Tech,UT Martin,4,4,NA,290152635,2009-01-15
151,2,15:31,931,931,Marquis Weddle missed Two Point Jumper.,43,51,-8,0,0.19291753069269676,0.19291753069269676,Tennessee Tech,UT Martin,4,4,NA,290152635,2009-01-15
152,2,15:31,931,931,Bassey Inameti Block.,43,51,-8,0,0.19291753069269676,0.19291753069269676,Tennessee Tech,UT Martin,4,4,NA,290152635,2009-01-15
153,2,15:31,931,931,Tennessee Tech Defensive Rebound.,43,51,-8,7,0.19291753069269676,0.19291753069269676,Tennessee Tech,UT Martin,4,4,NA,290152635,2009-01-15
154,2,15:24,924,924,Lester Hudson missed Two Point Jumper.,43,51,-8,0,0.1920872868430405,0.1920872868430405,Tennessee Tech,UT Martin,4,4,NA,290152635,2009-01-15
155,2,15:24,924,924,Tennessee Tech Defensive Rebound.,43,51,-8,15,0.1920872868430405,0.1920872868430405,Tennessee Tech,UT Martin,4,4,NA,290152635,2009-01-15
156,2,15:09,909,909,Frank Davis missed Three Point Jumper.,43,51,-8,0,0.1903812209644597,0.1903812209644597,Tennessee Tech,UT Martin,4,4,NA,290152635,2009-01-15
157,2,15:09,909,909,Tennessee-Martin Defensive Rebou.,43,51,-8,20,0.1903812209644597,0.1903812209644597,Tennessee Tech,UT Martin,4,4,NA,290152635,2009-01-15
158,2,14:49,889,889,Olajide Hay made Two Point Jumper.  Assisted by Lester Hudson.,43,53,-10,36,0.13858426211720834,0.13858426211720834,Tennessee Tech,UT Martin,4,4,NA,290152635,2009-01-15
159,2,14:13,853,853,Lester Hudson missed Two Point Jumper.,43,53,-10,0,0.13484188621086232,0.13484188621086232,Tennessee Tech,UT Martin,4,4,NA,290152635,2009-01-15
160,2,14:13,853,853,Olajide Hay Offensive Rebound.,43,53,-10,4,0.13484188621086232,0.13484188621086232,Tennessee Tech,UT Martin,4,4,NA,290152635,2009-01-15
161,2,14:09,849,849,Olajide Hay made Two Point Jumper.,43,55,-12,8,0.09665620075982236,0.09665620075982236,Tennessee Tech,UT Martin,4,4,NA,290152635,2009-01-15
162,2,14:01,841,841,Elijah Cunningh Muhammad missed Three Point Jumper.,43,55,-12,0,0.09588160962488662,0.09588160962488662,Tennessee Tech,UT Martin,4,4,NA,290152635,2009-01-15
163,2,14:01,841,841,Elijah Cunningh Muhammad Offensive Rebound.,43,55,-12,14,0.09588160962488662,0.09588160962488662,Tennessee Tech,UT Martin,4,4,NA,290152635,2009-01-15
164,2,13:47,827,827,Darnell Lindsay made Three Point Jumper.  Assisted by Will Barnes.,46,55,-9,17,0.15511261461623915,0.15511261461623915,Tennessee Tech,UT Martin,4,4,NA,290152635,2009-01-15
165,2,13:30,810,810,Marquis Weddle missed Three Point Jumper.,46,55,-9,0,0.15304718521440328,0.15304718521440328,Tennessee Tech,UT Martin,4,4,NA,290152635,2009-01-15
