play_id,half,time_remaining_half,secs_remaining,secs_remaining_absolute,description,home_score,away_score,score_diff,play_length,win_prob,naive_win_prob,home,away,home_time_out_remaining,away_time_out_remaining,home_favored_by,game_id,date
1,1,20:00,2400,2400,PLAY,0,0,0,14,0.5,0.5,LSU,Florida,4,4,NA,260700099,2006-03-11
2,1,19:46,2386,2386,Lee Humphrey Steal.,0,0,0,6,0.5,0.5,LSU,Florida,4,4,NA,260700099,2006-03-11
3,1,19:40,2380,2380,Lee Humphrey made Three Point Jumper.  Assisted by Taurean Green.,0,3,-3,33,0.43354732727903655,0.43354732727903655,LSU,Florida,4,4,NA,260700099,2006-03-11
4,1,19:07,2347,2347,Tasmin Mitchell made Two Point Layup.,2,3,-1,18,0.47737591477232977,0.47737591477232977,LSU,Florida,4,4,NA,260700099,2006-03-11
5,1,18:49,2329,2329,Glen Davis missed Two Point Jumper.,2,3,-1,0,0.47717864708090213,0.47717864708090213,LSU,Florida,4,4,NA,260700099,2006-03-11
6,1,18:49,2329,2329,Joakim Noah Defensive Rebound.,2,3,-1,26,0.47717864708090213,0.47717864708090213,LSU,Florida,4,4,NA,260700099,2006-03-11
7,1,18:23,2303,2303,Joakim Noah made Two Point Dunk Shot.  Assisted by Al Horford.,2,5,-3,17,0.4310633909148448,0.4310633909148448,LSU,Florida,4,4,NA,260700099,2006-03-11
8,1,18:06,2286,2286,Darrel Mitchell made Two Point Layup.,4,5,-1,16,0.4766998354859127,0.4766998354859127,LSU,Florida,4,4,NA,260700099,2006-03-11
9,1,17:50,2270,2270,Corey Brewer made Three Point Jumper.  Assisted by Joakim Noah.,4,8,-4,27,0.40709968279574404,0.40709968279574404,LSU,Florida,4,4,NA,260700099,2006-03-11
10,1,17:23,2243,2243,Foul on Joakim Noah,4,8,-4,0,0.4059111228261333,0.4059111228261333,LSU,Florida,4,4,NA,260700099,2006-03-11
11,1,17:23,2243,2243,Darnell Lazare made Free Throw.,5,8,-3,0,0.4290639993474413,0.4290639993474413,LSU,Florida,4,4,NA,260700099,2006-03-11
12,1,17:23,2243,2243,Darnell Lazare made Free Throw.,6,8,-2,19,0.45253154916842514,0.45253154916842514,LSU,Florida,4,4,NA,260700099,2006-03-11
13,1,17:04,2224,2224,Lee Humphrey missed Three Point Jumper.,6,8,-2,0,0.452098830645754,0.452098830645754,LSU,Florida,4,4,NA,260700099,2006-03-11
14,1,17:04,2224,2224,Tasmin Mitchell Defensive Rebound.,6,8,-2,17,0.452098830645754,0.452098830645754,LSU,Florida,4,4,NA,260700099,2006-03-11
15,1,16:47,2207,2207,Darnell Lazare missed Two Point Layup.,6,8,-2,0,0.451709740701574,0.451709740701574,LSU,Florida,4,4,NA,260700099,2006-03-11
16,1,16:47,2207,2207,Glen Davis Offensive Rebound.,6,8,-2,3,0.451709740701574,0.451709740701574,LSU,Florida,4,4,NA,260700099,2006-03-11
17,1,16:44,2204,2204,Glen Davis missed Two Point Jumper.,6,8,-2,0,0.4516409099352638,0.4516409099352638,LSU,Florida,4,4,NA,260700099,2006-03-11
18,1,16:44,2204,2204,Tasmin Mitchell Offensive Rebound.,6,8,-2,3,0.4516409099352638,0.4516409099352638,LSU,Florida,4,4,NA,260700099,2006-03-11
19,1,16:41,2201,2201,Tasmin Mitchell made Two Point Tip Shot.,8,8,0,19,0.5,0.5,LSU,Florida,4,4,NA,260700099,2006-03-11
20,1,16:22,2182,2182,Corey Brewer missed Three Point Jumper.,8,8,0,0,0.5,0.5,LSU,Florida,4,4,NA,260700099,2006-03-11
21,1,16:22,2182,2182,Glen Davis Defensive Rebound.,8,8,0,15,0.5,0.5,LSU,Florida,4,4,NA,260700099,2006-03-11
22,1,16:07,2167,2167,Tasmin Mitchell missed Two Point Jumper.,8,8,0,0,0.5,0.5,LSU,Florida,4,4,NA,260700099,2006-03-11
23,1,16:07,2167,2167,Tasmin Mitchell Offensive Rebound.,8,8,0,9,0.5,0.5,LSU,Florida,4,4,NA,260700099,2006-03-11
24,1,15:58,2158,2158,Official TV Timeout.,8,8,0,4,0.5,0.5,LSU,Florida,4,4,NA,260700099,2006-03-11
25,1,15:54,2154,2154,Glen Davis made Two Point Jumper.,10,8,2,19,0.549512605802715,0.549512605802715,LSU,Florida,4,4,NA,260700099,2006-03-11
26,1,15:35,2135,2135,Lee Humphrey made Three Point Jumper.  Assisted by Walter Hodge.,10,11,-1,22,0.47495976850978017,0.47495976850978017,LSU,Florida,4,4,NA,260700099,2006-03-11
27,1,15:13,2113,2113,Darrel Mitchell made Two Point Layup.,12,11,1,13,0.525300322543142,0.525300322543142,LSU,Florida,4,4,NA,260700099,2006-03-11
28,1,15:00,2100,2100,Foul on Al Horford,12,11,1,19,0.5254550666804201,0.5254550666804201,LSU,Florida,4,4,NA,260700099,2006-03-11
29,1,14:41,2081,2081,Tasmin Mitchell made Two Point Layup.,14,11,3,5,0.576510362827849,0.576510362827849,LSU,Florida,4,4,NA,260700099,2006-03-11
30,1,14:36,2076,2076,Foul,14,11,3,0,0.5766872539992671,0.5766872539992671,LSU,Florida,4,4,NA,260700099,2006-03-11
31,1,14:36,2076,2076,Darrel Mitchell missed Free Throw.,14,11,3,0,0.5766872539992671,0.5766872539992671,LSU,Florida,4,4,NA,260700099,2006-03-11
32,1,14:36,2076,2076,LSU Defensive Rebound.,14,11,3,0,0.5766872539992671,0.5766872539992671,LSU,Florida,4,4,NA,260700099,2006-03-11
33,1,14:36,2076,2076,Darrel Mitchell made Free Throw.,15,11,4,32,0.6016276921538536,0.6016276921538536,LSU,Florida,4,4,NA,260700099,2006-03-11
34,1,14:04,2044,2044,Lee Humphrey missed Three Point Jumper.,15,11,4,0,0.6031211470294757,0.6031211470294757,LSU,Florida,4,4,NA,260700099,2006-03-11
35,1,14:04,2044,2044,Tasmin Mitchell Defensive Rebound.,15,11,4,6,0.6031211470294757,0.6031211470294757,LSU,Florida,4,4,NA,260700099,2006-03-11
36,1,13:58,2038,2038,Garrett Temple made Two Point Layup.  Assisted by Tasmin Mitchell.,17,11,6,27,0.6523760619857397,0.6523760619857397,LSU,Florida,4,4,NA,260700099,2006-03-11
37,1,13:31,2011,2011,Chris Richard made Two Point Jumper.  Assisted by Joakim Noah.,17,13,4,23,0.6046835176637574,0.6046835176637574,LSU,Florida,4,4,NA,260700099,2006-03-11
38,1,13:08,1988,1988,Foul on Adrian Moss,17,13,4,0,0.605786969619049,0.605786969619049,LSU,Florida,4,4,NA,260700099,2006-03-11
39,1,13:08,1988,1988,Darnell Lazare missed Free Throw.,17,13,4,0,0.605786969619049,0.605786969619049,LSU,Florida,4,4,NA,260700099,2006-03-11
40,1,13:08,1988,1988,LSU Defensive Rebound.,17,13,4,0,0.605786969619049,0.605786969619049,LSU,Florida,4,4,NA,260700099,2006-03-11
41,1,13:08,1988,1988,Darnell Lazare missed Free Throw.,17,13,4,0,0.605786969619049,0.605786969619049,LSU,Florida,4,4,NA,260700099,2006-03-11
42,1,13:08,1988,1988,Tasmin Mitchell Offensive Rebound.,17,13,4,8,0.605786969619049,0.605786969619049,LSU,Florida,4,4,NA,260700099,2006-03-11
43,1,13:00,1980,1980,Darrel Mitchell missed Three Point Jumper.,17,13,4,0,0.6061737389347245,0.6061737389347245,LSU,Florida,4,4,NA,260700099,2006-03-11
44,1,13:00,1980,1980,Chris Richard Defensive Rebound.,17,13,4,23,0.6061737389347245,0.6061737389347245,LSU,Florida,4,4,NA,260700099,2006-03-11
45,1,12:37,1957,1957,Taurean Green made Three Point Jumper.  Assisted by Chris Richard.,17,16,1,22,0.5272202052529502,0.5272202052529502,LSU,Florida,4,4,NA,260700099,2006-03-11
46,1,12:15,1935,1935,Garrett Temple missed Three Point Jumper.,17,16,1,0,0.5275038428410322,0.5275038428410322,LSU,Florida,4,4,NA,260700099,2006-03-11
47,1,12:15,1935,1935,Chris Richard Defensive Rebound.,17,16,1,26,0.5275038428410322,0.5275038428410322,LSU,Florida,4,4,NA,260700099,2006-03-11
48,1,11:49,1909,1909,Tasmin Mitchell Steal.,17,16,1,4,0.5278416688584938,0.5278416688584938,LSU,Florida,4,4,NA,260700099,2006-03-11
49,1,11:45,1905,1905,Taurean Green Steal.,17,16,1,22,0.527893567120556,0.527893567120556,LSU,Florida,4,4,NA,260700099,2006-03-11
50,1,11:23,1883,1883,Adrian Moss made Two Point Jumper.  Assisted by Walter Hodge.,17,18,-1,26,0.47182106150439523,0.47182106150439523,LSU,Florida,4,4,NA,260700099,2006-03-11
51,1,10:57,1857,1857,Tasmin Mitchell missed Three Point Jumper.,17,18,-1,0,0.4714831152810906,0.4714831152810906,LSU,Florida,4,4,NA,260700099,2006-03-11
52,1,10:57,1857,1857,Chris Richard Defensive Rebound.,17,18,-1,9,0.4714831152810906,0.4714831152810906,LSU,Florida,4,4,NA,260700099,2006-03-11
53,1,10:48,1848,1848,Adrian Moss made Two Point Layup.  Assisted by Taurean Green.,17,20,-3,3,0.4148411543563198,0.4148411543563198,LSU,Florida,4,4,NA,260700099,2006-03-11
54,1,10:45,1845,1845,Florida Full Timeout.,17,20,-3,19,0.41472661352295626,0.41472661352295626,LSU,Florida,3,4,NA,260700099,2006-03-11
55,1,10:26,1826,1826,Taurean Green Steal.,17,20,-3,1,0.4139987142200684,0.4139987142200684,LSU,Florida,3,4,NA,260700099,2006-03-11
56,1,10:25,1825,1825,Taurean Green made Two Point Layup.,17,22,-5,0,0.3590792607689839,0.3590792607689839,LSU,Florida,3,4,NA,260700099,2006-03-11
57,1,10:25,1825,1825,Foul on Tasmin Mitchell,17,22,-5,0,0.3590792607689839,0.3590792607689839,LSU,Florida,3,4,NA,260700099,2006-03-11
58,1,10:25,1825,1825,Official TV Timeout.,17,22,-5,0,0.3590792607689839,0.3590792607689839,LSU,Florida,3,4,NA,260700099,2006-03-11
59,1,10:25,1825,1825,Taurean Green made Free Throw.,17,23,-6,8,0.3328694946892326,0.3328694946892326,LSU,Florida,3,4,NA,260700099,2006-03-11
60,1,10:17,1817,1817,Glen Davis missed Two Point Layup.,17,23,-6,0,0.3323055579659795,0.3323055579659795,LSU,Florida,3,4,NA,260700099,2006-03-11
61,1,10:17,1817,1817,Magnum Rolle Offensive Rebound.,17,23,-6,0,0.3323055579659795,0.3323055579659795,LSU,Florida,3,4,NA,260700099,2006-03-11
62,1,10:17,1817,1817,Foul on Al Horford,17,23,-6,0,0.3323055579659795,0.3323055579659795,LSU,Florida,3,4,NA,260700099,2006-03-11
63,1,10:17,1817,1817,Magnum Rolle missed Free Throw.,17,23,-6,0,0.3323055579659795,0.3323055579659795,LSU,Florida,3,4,NA,260700099,2006-03-11
64,1,10:17,1817,1817,LSU Defensive Rebound.,17,23,-6,0,0.3323055579659795,0.3323055579659795,LSU,Florida,3,4,NA,260700099,2006-03-11
65,1,10:17,1817,1817,Magnum Rolle missed Free Throw.,17,23,-6,0,0.3323055579659795,0.3323055579659795,LSU,Florida,3,4,NA,260700099,2006-03-11
66,1,10:17,1817,1817,Joakim Noah Defensive Rebound.,17,23,-6,6,0.3323055579659795,0.3323055579659795,LSU,Florida,3,4,NA,260700099,2006-03-11
67,1,10:11,1811,1811,Magnum Rolle Steal.,17,23,-6,7,0.3318815498081475,0.3318815498081475,LSU,Florida,3,4,NA,260700099,2006-03-11
68,1,10:04,1804,1804,Tasmin Mitchell made Two Point Layup.  Assisted by Darrel Mitchell.,19,23,-4,17,0.38510158950377243,0.38510158950377243,LSU,Florida,3,4,NA,260700099,2006-03-11
69,1,9:47,1787,1787,Chris Richard missed Two Point Layup.,19,23,-4,0,0.3842383585701661,0.3842383585701661,LSU,Florida,3,4,NA,260700099,2006-03-11
70,1,9:47,1787,1787,Chris Richard Offensive Rebound.,19,23,-4,10,0.3842383585701661,0.3842383585701661,LSU,Florida,3,4,NA,260700099,2006-03-11
71,1,9:37,1777,1777,Joakim Noah missed Two Point Layup.,19,23,-4,2,0.383726655384583,0.383726655384583,LSU,Florida,3,4,NA,260700099,2006-03-11
72,1,9:35,1775,1775,Darrel Mitchell Defensive Rebound.,19,23,-4,12,0.3836239327482226,0.3836239327482226,LSU,Florida,3,4,NA,260700099,2006-03-11
73,1,9:23,1763,1763,Darrel Mitchell made Three Point Jumper.  Assisted by Ben Voogd.,22,23,-1,24,0.47023436143465774,0.47023436143465774,LSU,Florida,3,4,NA,260700099,2006-03-11
74,1,8:59,1739,1739,Taurean Green missed Three Point Jumper.,22,23,-1,0,0.46990349261311515,0.46990349261311515,LSU,Florida,3,4,NA,260700099,2006-03-11
75,1,8:59,1739,1739,Tasmin Mitchell Defensive Rebound.,22,23,-1,10,0.46990349261311515,0.46990349261311515,LSU,Florida,3,4,NA,260700099,2006-03-11
76,1,8:49,1729,1729,Darrel Mitchell missed Three Point Jumper.,22,23,-1,0,0.46976362301874747,0.46976362301874747,LSU,Florida,3,4,NA,260700099,2006-03-11
77,1,8:49,1729,1729,Florida Defensive Rebound.,22,23,-1,26,0.46976362301874747,0.46976362301874747,LSU,Florida,3,4,NA,260700099,2006-03-11
78,1,8:23,1703,1703,Corey Brewer made Two Point Layup.,22,25,-3,24,0.40908838111123297,0.40908838111123297,LSU,Florida,3,4,NA,260700099,2006-03-11
79,1,7:59,1679,1679,Darrel Mitchell missed Two Point Jumper.,22,25,-3,0,0.408075344540222,0.408075344540222,LSU,Florida,3,4,NA,260700099,2006-03-11
80,1,7:59,1679,1679,Joakim Noah Defensive Rebound.,22,25,-3,12,0.408075344540222,0.408075344540222,LSU,Florida,3,4,NA,260700099,2006-03-11
81,1,7:47,1667,1667,Corey Brewer missed Three Point Jumper.,22,25,-3,0,0.4075778975274836,0.4075778975274836,LSU,Florida,3,4,NA,260700099,2006-03-11
82,1,7:47,1667,1667,Chris Richard Offensive Rebound.,22,25,-3,4,0.4075778975274836,0.4075778975274836,LSU,Florida,3,4,NA,260700099,2006-03-11
83,1,7:43,1663,1663,Garrett Temple Steal.,22,25,-3,15,0.4074138250858979,0.4074138250858979,LSU,Florida,3,4,NA,260700099,2006-03-11
84,1,7:28,1648,1648,Garrett Temple missed Two Point Jumper.,22,25,-3,0,0.4068051340231543,0.4068051340231543,LSU,Florida,3,4,NA,260700099,2006-03-11
85,1,7:28,1648,1648,Lee Humphrey Defensive Rebound.,22,25,-3,13,0.4068051340231543,0.4068051340231543,LSU,Florida,3,4,NA,260700099,2006-03-11
86,1,7:15,1635,1635,Official TV Timeout.,22,25,-3,15,0.4062844499778993,0.4062844499778993,LSU,Florida,3,4,NA,260700099,2006-03-11
87,1,7:00,1620,1620,Foul on Garrett Temple,22,25,-3,0,0.40568915270468314,0.40568915270468314,LSU,Florida,3,4,NA,260700099,2006-03-11
88,1,7:00,1620,1620,Lee Humphrey missed Free Throw.,22,25,-3,0,0.40568915270468314,0.40568915270468314,LSU,Florida,3,4,NA,260700099,2006-03-11
89,1,7:00,1620,1620,Florida Defensive Rebound.,22,25,-3,0,0.40568915270468314,0.40568915270468314,LSU,Florida,3,4,NA,260700099,2006-03-11
90,1,7:00,1620,1620,Lee Humphrey missed Free Throw.,22,25,-3,0,0.40568915270468314,0.40568915270468314,LSU,Florida,3,4,NA,260700099,2006-03-11
91,1,7:00,1620,1620,Magnum Rolle Defensive Rebound.,22,25,-3,15,0.40568915270468314,0.40568915270468314,LSU,Florida,3,4,NA,260700099,2006-03-11
92,1,6:45,1605,1605,Darrel Mitchell made Three Point Jumper.  Assisted by Garrett Temple.,25,25,0,24,0.5,0.5,LSU,Florida,3,4,NA,260700099,2006-03-11
93,1,6:21,1581,1581,Taurean Green missed Three Point Jumper.,25,25,0,0,0.5,0.5,LSU,Florida,3,4,NA,260700099,2006-03-11
94,1,6:21,1581,1581,Garrett Temple Defensive Rebound.,25,25,0,6,0.5,0.5,LSU,Florida,3,4,NA,260700099,2006-03-11
95,1,6:15,1575,1575,Taurean Green Steal.,25,25,0,5,0.5,0.5,LSU,Florida,3,4,NA,260700099,2006-03-11
96,1,6:10,1570,1570,Taurean Green missed Two Point Jumper.,25,25,0,1,0.5,0.5,LSU,Florida,3,4,NA,260700099,2006-03-11
97,1,6:09,1569,1569,Garrett Temple Defensive Rebound.,25,25,0,4,0.5,0.5,LSU,Florida,3,4,NA,260700099,2006-03-11
98,1,6:05,1565,1565,Foul on Adrian Moss,25,25,0,0,0.5,0.5,LSU,Florida,3,4,NA,260700099,2006-03-11
99,1,6:05,1565,1565,Darrel Mitchell made Free Throw.,26,25,1,10,0.5325243121837794,0.5325243121837794,LSU,Florida,3,4,NA,260700099,2006-03-11
100,1,5:55,1555,1555,Darnell Lazare Steal.,26,25,1,5,0.5326625864243282,0.5326625864243282,LSU,Florida,3,4,NA,260700099,2006-03-11
101,1,5:50,1550,1550,Darnell Lazare made Two Point Layup.,28,25,3,7,0.5970886305947948,0.5970886305947948,LSU,Florida,3,4,NA,260700099,2006-03-11
102,1,5:43,1543,1543,Ben Voogd Steal.,28,25,3,15,0.5973729562093391,0.5973729562093391,LSU,Florida,3,4,NA,260700099,2006-03-11
103,1,5:28,1528,1528,Florida Full Timeout.,28,25,3,28,0.5979902433320406,0.5979902433320406,LSU,Florida,2,4,NA,260700099,2006-03-11
104,1,5:00,1500,1500,Corey Brewer missed Two Point Layup.,28,25,3,0,0.5991796821583484,0.5991796821583484,LSU,Florida,2,4,NA,260700099,2006-03-11
105,1,5:00,1500,1500,Glen Davis Defensive Rebound.,28,25,3,8,0.5991796821583484,0.5991796821583484,LSU,Florida,2,4,NA,260700099,2006-03-11
106,1,4:52,1492,1492,Tasmin Mitchell made Two Point Dunk Shot.  Assisted by Ben Voogd.,30,25,5,18,0.662065921714666,0.662065921714666,LSU,Florida,2,4,NA,260700099,2006-03-11
107,1,4:34,1474,1474,Foul on Darnell Lazare,30,25,5,13,0.6633230031084663,0.6633230031084663,LSU,Florida,2,4,NA,260700099,2006-03-11
108,1,4:21,1461,1461,Lee Humphrey missed Three Point Jumper.,30,25,5,0,0.6642610420963009,0.6642610420963009,LSU,Florida,2,4,NA,260700099,2006-03-11
109,1,4:21,1461,1461,Chris Richard Offensive Rebound.,30,25,5,4,0.6642610420963009,0.6642610420963009,LSU,Florida,2,4,NA,260700099,2006-03-11
110,1,4:17,1457,1457,Chris Richard made Two Point Layup.,30,27,3,17,0.6011349666626425,0.6011349666626425,LSU,Florida,2,4,NA,260700099,2006-03-11
111,1,4:00,1440,1440,Foul on Ben Voogd,30,27,3,23,0.6019510346718109,0.6019510346718109,LSU,Florida,2,4,NA,260700099,2006-03-11
112,1,3:37,1417,1417,Chris Richard made Two Point Layup.  Assisted by Joakim Noah.,30,29,1,24,0.5347816487510241,0.5347816487510241,LSU,Florida,2,4,NA,260700099,2006-03-11
113,1,3:13,1393,1393,Darnell Lazare made Two Point Layup.  Assisted by Tasmin Mitchell.,32,29,3,16,0.604092467246901,0.604092467246901,LSU,Florida,2,4,NA,260700099,2006-03-11
114,1,2:57,1377,1377,Foul on Glen Davis,32,29,3,0,0.6047967335748258,0.6047967335748258,LSU,Florida,2,4,NA,260700099,2006-03-11
115,1,2:57,1377,1377,Official TV Timeout.,32,29,3,0,0.6047967335748258,0.6047967335748258,LSU,Florida,2,4,NA,260700099,2006-03-11
116,1,2:57,1377,1377,Taurean Green made Free Throw.,32,30,2,0,0.5704436505936961,0.5704436505936961,LSU,Florida,2,4,NA,260700099,2006-03-11
117,1,2:57,1377,1377,Taurean Green made Free Throw.,32,31,1,12,0.5353983633018101,0.5353983633018101,LSU,Florida,2,4,NA,260700099,2006-03-11
118,1,2:45,1365,1365,Tasmin Mitchell made Three Point Jumper.  Assisted by Garrett Temple.,35,31,4,14,0.6388225376222332,0.6388225376222332,LSU,Florida,2,4,NA,260700099,2006-03-11
119,1,2:31,1351,1351,Joakim Noah made Two Point Layup.,35,33,2,20,0.5712233848382078,0.5712233848382078,LSU,Florida,2,4,NA,260700099,2006-03-11
120,1,2:11,1331,1331,Darnell Lazare made Two Point Layup.  Assisted by Darrel Mitchell.,37,33,4,16,0.6407558205945588,0.6407558205945588,LSU,Florida,2,4,NA,260700099,2006-03-11
121,1,1:55,1315,1315,Foul on Glen Davis,37,33,4,0,0.6416877916357523,0.6416877916357523,LSU,Florida,2,4,NA,260700099,2006-03-11
122,1,1:55,1315,1315,Joakim Noah missed Free Throw.,37,33,4,0,0.6416877916357523,0.6416877916357523,LSU,Florida,2,4,NA,260700099,2006-03-11
123,1,1:55,1315,1315,Florida Defensive Rebound.,37,33,4,0,0.6416877916357523,0.6416877916357523,LSU,Florida,2,4,NA,260700099,2006-03-11
124,1,1:55,1315,1315,Joakim Noah made Free Throw.,37,34,3,14,0.6075494161511354,0.6075494161511354,LSU,Florida,2,4,NA,260700099,2006-03-11
125,1,1:41,1301,1301,Glen Davis missed Two Point Jumper.,37,34,3,0,0.608199110865432,0.608199110865432,LSU,Florida,2,4,NA,260700099,2006-03-11
126,1,1:41,1301,1301,Taurean Green Defensive Rebound.,37,34,3,11,0.608199110865432,0.608199110865432,LSU,Florida,2,4,NA,260700099,2006-03-11
127,1,1:30,1290,1290,Taurean Green missed Three Point Jumper.,37,34,3,0,0.6087224303808586,0.6087224303808586,LSU,Florida,2,4,NA,260700099,2006-03-11
128,1,1:30,1290,1290,Joakim Noah Offensive Rebound.,37,34,3,5,0.6087224303808586,0.6087224303808586,LSU,Florida,2,4,NA,260700099,2006-03-11
129,1,1:25,1285,1285,Joakim Noah missed Two Point Jumper.,37,34,3,0,0.6089645966940835,0.6089645966940835,LSU,Florida,2,4,NA,260700099,2006-03-11
130,1,1:25,1285,1285,Glen Davis Defensive Rebound.,37,34,3,3,0.6089645966940835,0.6089645966940835,LSU,Florida,2,4,NA,260700099,2006-03-11
131,1,1:22,1282,1282,Foul on Walter Hodge,37,34,3,0,0.6091112902843044,0.6091112902843044,LSU,Florida,2,4,NA,260700099,2006-03-11
132,1,1:22,1282,1282,Darrel Mitchell made Free Throw.,38,34,4,0,0.6436949005352504,0.6436949005352504,LSU,Florida,2,4,NA,260700099,2006-03-11
133,1,1:22,1282,1282,Darrel Mitchell made Free Throw.,39,34,5,28,0.6768420754083765,0.6768420754083765,LSU,Florida,2,4,NA,260700099,2006-03-11
134,1,0:54,1254,1254,Foul on Tasmin Mitchell,39,34,5,13,0.6790241535028544,0.6790241535028544,LSU,Florida,2,4,NA,260700099,2006-03-11
135,1,0:41,1241,1241,Joakim Noah made Two Point Layup.,39,36,3,19,0.611241283310421,0.611241283310421,LSU,Florida,2,4,NA,260700099,2006-03-11
136,1,0:22,1222,1222,Tasmin Mitchell made Two Point Layup.  Assisted by Darrel Mitchell.,41,36,5,16,0.6817485646587755,0.6817485646587755,LSU,Florida,2,4,NA,260700099,2006-03-11
137,1,0:06,1206,1206,Foul on Darnell Lazare,41,36,5,3,0.6832182633759083,0.6832182633759083,LSU,Florida,2,4,NA,260700099,2006-03-11
138,1,0:03,1203,1203,Taurean Green made Free Throw.,41,37,4,0,0.6492863483699299,0.6492863483699299,LSU,Florida,2,4,NA,260700099,2006-03-11
139,1,0:03,1203,1203,Taurean Green made Free Throw.,41,38,3,3,0.6134714072603277,0.6134714072603277,LSU,Florida,2,4,NA,260700099,2006-03-11
140,1,0:00,1200,1200,End of the 1st Half.,41,38,3,0,0.6136521367497382,0.6136521367497382,LSU,Florida,2,4,NA,260700099,2006-03-11
141,2,20:00,1200,1200,PLAY,41,38,3,21,0.6136521367497382,0.6136521367497382,LSU,Florida,3,4,NA,260700099,2006-03-11
142,2,19:39,1179,1179,Tasmin Mitchell missed Three Point Jumper.,41,38,3,0,0.6148892324745647,0.6148892324745647,LSU,Florida,3,4,NA,260700099,2006-03-11
143,2,19:39,1179,1179,Joakim Noah Defensive Rebound.,41,38,3,9,0.6148892324745647,0.6148892324745647,LSU,Florida,3,4,NA,260700099,2006-03-11
144,2,19:30,1170,1170,Tasmin Mitchell Steal.,41,38,3,5,0.6154073158398975,0.6154073158398975,LSU,Florida,3,4,NA,260700099,2006-03-11
145,2,19:25,1165,1165,Darrel Mitchell made Two Point Jumper.,43,38,5,17,0.6868663941677959,0.6868663941677959,LSU,Florida,3,4,NA,260700099,2006-03-11
146,2,19:08,1148,1148,Al Horford made Two Point Layup.  Assisted by Corey Brewer.,43,40,3,24,0.6166547042303746,0.6166547042303746,LSU,Florida,3,4,NA,260700099,2006-03-11
147,2,18:44,1124,1124,Glen Davis made Two Point Jumper.,45,40,5,22,0.6903615885161296,0.6903615885161296,LSU,Florida,3,4,NA,260700099,2006-03-11
148,2,18:22,1102,1102,Corey Brewer made Two Point Jumper.,45,42,3,22,0.6192534268721425,0.6192534268721425,LSU,Florida,3,4,NA,260700099,2006-03-11
149,2,18:00,1080,1080,Darnell Lazare missed Two Point Jumper.,45,42,3,0,0.6205350562378058,0.6205350562378058,LSU,Florida,3,4,NA,260700099,2006-03-11
150,2,18:00,1080,1080,Al Horford Defensive Rebound.,45,42,3,15,0.6205350562378058,0.6205350562378058,LSU,Florida,3,4,NA,260700099,2006-03-11
151,2,17:45,1065,1065,Al Horford made Two Point Jumper.,45,44,1,30,0.5412109840560421,0.5412109840560421,LSU,Florida,3,4,NA,260700099,2006-03-11
152,2,17:15,1035,1035,Garrett Temple missed Three Point Jumper.,45,44,1,0,0.5418819064412675,0.5418819064412675,LSU,Florida,3,4,NA,260700099,2006-03-11
153,2,17:15,1035,1035,Taurean Green Defensive Rebound.,45,44,1,8,0.5418819064412675,0.5418819064412675,LSU,Florida,3,4,NA,260700099,2006-03-11
154,2,17:07,1027,1027,Al Horford missed Two Point Dunk Shot.,45,44,1,0,0.5420707069336158,0.5420707069336158,LSU,Florida,3,4,NA,260700099,2006-03-11
155,2,17:07,1027,1027,Darnell Lazare Defensive Rebound.,45,44,1,4,0.5420707069336158,0.5420707069336158,LSU,Florida,3,4,NA,260700099,2006-03-11
156,2,17:03,1023,1023,Foul on Corey Brewer,45,44,1,8,0.5421668956975656,0.5421668956975656,LSU,Florida,3,4,NA,260700099,2006-03-11
157,2,16:55,1015,1015,Darrel Mitchell missed Three Point Jumper.,45,44,1,0,0.5423630666011812,0.5423630666011812,LSU,Florida,3,4,NA,260700099,2006-03-11
158,2,16:55,1015,1015,Glen Davis Offensive Rebound.,45,44,1,5,0.5423630666011812,0.5423630666011812,LSU,Florida,3,4,NA,260700099,2006-03-11
159,2,16:50,1010,1010,Darrel Mitchell missed Two Point Layup.,45,44,1,0,0.5424883663200263,0.5424883663200263,LSU,Florida,3,4,NA,260700099,2006-03-11
160,2,16:50,1010,1010,Tasmin Mitchell Offensive Rebound.,45,44,1,2,0.5424883663200263,0.5424883663200263,LSU,Florida,3,4,NA,260700099,2006-03-11
161,2,16:48,1008,1008,Foul on Al Horford,45,44,1,0,0.5425390898677398,0.5425390898677398,LSU,Florida,3,4,NA,260700099,2006-03-11
162,2,16:48,1008,1008,Tasmin Mitchell made Free Throw.,46,44,2,0,0.5844667840936933,0.5844667840936933,LSU,Florida,3,4,NA,260700099,2006-03-11
163,2,16:48,1008,1008,Tasmin Mitchell made Free Throw.,47,44,3,14,0.62520633829215,0.62520633829215,LSU,Florida,3,4,NA,260700099,2006-03-11
164,2,16:34,994,994,Joakim Noah made Two Point Jumper.,47,46,1,0,0.5429043428331313,0.5429043428331313,LSU,Florida,3,4,NA,260700099,2006-03-11
165,2,16:34,994,994,Foul on Glen Davis,47,46,1,0,0.5429043428331313,0.5429043428331313,LSU,Florida,3,4,NA,260700099,2006-03-11
166,2,16:34,994,994,Joakim Noah missed Free Throw.,47,46,1,0,0.5429043428331313,0.5429043428331313,LSU,Florida,3,4,NA,260700099,2006-03-11
167,2,16:34,994,994,Glen Davis Defensive Rebound.,47,46,1,16,0.5429043428331313,0.5429043428331313,LSU,Florida,3,4,NA,260700099,2006-03-11
168,2,16:18,978,978,Joakim Noah Steal.,47,46,1,4,0.543345334845778,0.543345334845778,LSU,Florida,3,4,NA,260700099,2006-03-11
169,2,16:14,974,974,Taurean Green missed Two Point Layup.,47,46,1,0,0.5434598154266636,0.5434598154266636,LSU,Florida,3,4,NA,260700099,2006-03-11
170,2,16:14,974,974,Joakim Noah Offensive Rebound.,47,46,1,0,0.5434598154266636,0.5434598154266636,LSU,Florida,3,4,NA,260700099,2006-03-11
171,2,16:14,974,974,Joakim Noah made Two Point Dunk Shot.,47,48,-1,0,0.4565401845733365,0.4565401845733365,LSU,Florida,3,4,NA,260700099,2006-03-11
172,2,16:14,974,974,Foul on Darnell Lazare,47,48,-1,0,0.4565401845733365,0.4565401845733365,LSU,Florida,3,4,NA,260700099,2006-03-11
173,2,16:14,974,974,Joakim Noah missed Free Throw.,47,48,-1,0,0.4565401845733365,0.4565401845733365,LSU,Florida,3,4,NA,260700099,2006-03-11
174,2,16:14,974,974,Glen Davis Defensive Rebound.,47,48,-1,24,0.4565401845733365,0.4565401845733365,LSU,Florida,3,4,NA,260700099,2006-03-11
175,2,15:50,950,950,Darrel Mitchell missed Three Point Jumper.,47,48,-1,0,0.45587047651856705,0.45587047651856705,LSU,Florida,3,4,NA,260700099,2006-03-11
176,2,15:50,950,950,Darrel Mitchell Offensive Rebound.,47,48,-1,4,0.45587047651856705,0.45587047651856705,LSU,Florida,3,4,NA,260700099,2006-03-11
177,2,15:46,946,946,Foul on Joakim Noah,47,48,-1,0,0.4557667891265667,0.4557667891265667,LSU,Florida,3,4,NA,260700099,2006-03-11
178,2,15:46,946,946,Official TV Timeout.,47,48,-1,18,0.4557667891265667,0.4557667891265667,LSU,Florida,3,4,NA,260700099,2006-03-11
179,2,15:28,928,928,Foul on Chris Richard,47,48,-1,0,0.4553235458899246,0.4553235458899246,LSU,Florida,3,4,NA,260700099,2006-03-11
180,2,15:28,928,928,Glen Davis missed Free Throw.,47,48,-1,0,0.4553235458899246,0.4553235458899246,LSU,Florida,3,4,NA,260700099,2006-03-11
181,2,15:28,928,928,LSU Defensive Rebound.,47,48,-1,0,0.4553235458899246,0.4553235458899246,LSU,Florida,3,4,NA,260700099,2006-03-11
182,2,15:28,928,928,Glen Davis made Free Throw.,48,48,0,21,0.5,0.5,LSU,Florida,3,4,NA,260700099,2006-03-11
