play_id,half,time_remaining_half,secs_remaining,secs_remaining_absolute,description,home_score,away_score,score_diff,play_length,win_prob,naive_win_prob,home,away,home_time_out_remaining,away_time_out_remaining,home_favored_by,game_id,date
1,1,20:00,2400,2400,PLAY,0,0,0,21,0.5,0.5,Wisconsin,Ohio State,6,6,NA,270090275,2007-01-09
2,1,19:39,2379,2379,Ivan Harris missed Three Point Jumper.,0,0,0,0,0.5,0.5,Wisconsin,Ohio State,6,6,NA,270090275,2007-01-09
3,1,19:39,2379,2379,Greg Oden Offensive Rebound.,0,0,0,7,0.5,0.5,Wisconsin,Ohio State,6,6,NA,270090275,2007-01-09
4,1,19:32,2372,2372,Jamar Butler missed Three Point Jumper.,0,0,0,0,0.5,0.5,Wisconsin,Ohio State,6,6,NA,270090275,2007-01-09
5,1,19:32,2372,2372,Mike Conley Jr. Offensive Rebound.,0,0,0,5,0.5,0.5,Wisconsin,Ohio State,6,6,NA,270090275,2007-01-09
6,1,19:27,2367,2367,Ivan Harris missed Three Point Jumper.,0,0,0,0,0.5,0.5,Wisconsin,Ohio State,6,6,NA,270090275,2007-01-09
7,1,19:27,2367,2367,Kammron Taylor Defensive Rebound.,0,0,0,28,0.5,0.5,Wisconsin,Ohio State,6,6,NA,270090275,2007-01-09
8,1,18:59,2339,2339,Mike Conley Jr. Steal.,0,0,0,6,0.5,0.5,Wisconsin,Ohio State,6,6,NA,270090275,2007-01-09
9,1,18:53,2333,2333,Jamar Butler made Three Point Jumper.  Assisted by Ivan Harris.,0,3,-3,25,0.43204377801879046,0.43204377801879046,Wisconsin,Ohio State,6,6,NA,270090275,2007-01-09
10,1,18:28,2308,2308,Kammron Taylor made Three Point Jumper.  Assisted by Michael Flowers.,3,3,0,14,0.5,0.5,Wisconsin,Ohio State,6,6,NA,270090275,2007-01-09
11,1,18:14,2294,2294,Michael Flowers Steal.,3,3,0,5,0.5,0.5,Wisconsin,Ohio State,6,6,NA,270090275,2007-01-09
12,1,18:09,2289,2289,Michael Flowers made Two Point Layup.,5,3,2,16,0.5464323470136655,0.5464323470136655,Wisconsin,Ohio State,6,6,NA,270090275,2007-01-09
13,1,17:53,2273,2273,Ivan Harris made Three Point Jumper.  Assisted by Jamar Butler.,5,6,-1,47,0.47655321655577,0.47655321655577,Wisconsin,Ohio State,6,6,NA,270090275,2007-01-09
14,1,17:06,2226,2226,Alando Tucker missed Three Point Jumper.,5,6,-1,0,0.47601719558788597,0.47601719558788597,Wisconsin,Ohio State,6,6,NA,270090275,2007-01-09
15,1,17:06,2226,2226,Ron Lewis Defensive Rebound.,5,6,-1,9,0.47601719558788597,0.47601719558788597,Wisconsin,Ohio State,6,6,NA,270090275,2007-01-09
16,1,16:57,2217,2217,Ron Lewis missed Three Point Jumper.,5,6,-1,0,0.47591364482647425,0.47591364482647425,Wisconsin,Ohio State,6,6,NA,270090275,2007-01-09
17,1,16:57,2217,2217,Brian Butch Defensive Rebound.,5,6,-1,19,0.47591364482647425,0.47591364482647425,Wisconsin,Ohio State,6,6,NA,270090275,2007-01-09
18,1,16:38,2198,2198,Alando Tucker made Two Point Jumper.  Assisted by Jason Chappell.,7,6,1,41,0.5243057461322421,0.5243057461322421,Wisconsin,Ohio State,6,6,NA,270090275,2007-01-09
19,1,15:57,2157,2157,Michael Flowers missed Three Point Jumper.,7,6,1,0,0.5247822259103816,0.5247822259103816,Wisconsin,Ohio State,6,6,NA,270090275,2007-01-09
20,1,15:57,2157,2157,Ohio State Defensive Rebound.,7,6,1,0,0.5247822259103816,0.5247822259103816,Wisconsin,Ohio State,6,6,NA,270090275,2007-01-09
21,1,15:57,2157,2157,Official TV Timeout.,7,6,1,9,0.5247822259103816,0.5247822259103816,Wisconsin,Ohio State,6,6,NA,270090275,2007-01-09
22,1,15:48,2148,2148,David Lighty missed Two Point Layup.,7,6,1,0,0.5248875332213728,0.5248875332213728,Wisconsin,Ohio State,6,6,NA,270090275,2007-01-09
23,1,15:48,2148,2148,Alando Tucker Defensive Rebound.,7,6,1,9,0.5248875332213728,0.5248875332213728,Wisconsin,Ohio State,6,6,NA,270090275,2007-01-09
24,1,15:39,2139,2139,Foul on Ivan Harris,7,6,1,0,0.5249931715880842,0.5249931715880842,Wisconsin,Ohio State,6,6,NA,270090275,2007-01-09
25,1,15:39,2139,2139,Kammron Taylor made Free Throw.,8,6,2,0,0.5498617568700167,0.5498617568700167,Wisconsin,Ohio State,6,6,NA,270090275,2007-01-09
26,1,15:39,2139,2139,Kammron Taylor made Free Throw.,9,6,3,10,0.5744836413761442,0.5744836413761442,Wisconsin,Ohio State,6,6,NA,270090275,2007-01-09
27,1,15:29,2129,2129,Othello Hunter made Two Point Jumper.  Assisted by Jamar Butler.,9,8,1,36,0.5251109509496074,0.5251109509496074,Wisconsin,Ohio State,6,6,NA,270090275,2007-01-09
28,1,14:53,2093,2093,Kammron Taylor made Three Point Jumper.  Assisted by Alando Tucker.,12,8,4,36,0.6008422241274761,0.6008422241274761,Wisconsin,Ohio State,6,6,NA,270090275,2007-01-09
29,1,14:17,2057,2057,Jamar Butler made Three Point Jumper.,12,11,1,23,0.5259730242636912,0.5259730242636912,Wisconsin,Ohio State,6,6,NA,270090275,2007-01-09
30,1,13:54,2034,2034,Jason Chappell missed Two Point Jumper.,12,11,1,0,0.5262542647017093,0.5262542647017093,Wisconsin,Ohio State,6,6,NA,270090275,2007-01-09
31,1,13:54,2034,2034,Daequan Cook Defensive Rebound.,12,11,1,7,0.5262542647017093,0.5262542647017093,Wisconsin,Ohio State,6,6,NA,270090275,2007-01-09
32,1,13:47,2027,2027,Daequan Cook missed Two Point Layup.,12,11,1,6,0.526340483256421,0.526340483256421,Wisconsin,Ohio State,6,6,NA,270090275,2007-01-09
33,1,13:41,2021,2021,Daequan Cook Offensive Rebound.,12,11,1,2,0.5264146244831973,0.5264146244831973,Wisconsin,Ohio State,6,6,NA,270090275,2007-01-09
34,1,13:39,2019,2019,Daequan Cook missed Two Point Jumper.,12,11,1,0,0.5264393880571125,0.5264393880571125,Wisconsin,Ohio State,6,6,NA,270090275,2007-01-09
35,1,13:39,2019,2019,Wisconsin Defensive Rebound.,12,11,1,5,0.5264393880571125,0.5264393880571125,Wisconsin,Ohio State,6,6,NA,270090275,2007-01-09
36,1,13:34,2014,2014,Foul on David Lighty,12,11,1,14,0.5265014072900054,0.5265014072900054,Wisconsin,Ohio State,6,6,NA,270090275,2007-01-09
37,1,13:20,2000,2000,Foul on Daequan Cook,12,11,1,4,0.5266759152599936,0.5266759152599936,Wisconsin,Ohio State,6,6,NA,270090275,2007-01-09
38,1,13:16,1996,1996,Alando Tucker missed Two Point Jumper.,12,11,1,0,0.5267260105688514,0.5267260105688514,Wisconsin,Ohio State,6,6,NA,270090275,2007-01-09
39,1,13:16,1996,1996,David Lighty Defensive Rebound.,12,11,1,0,0.5267260105688514,0.5267260105688514,Wisconsin,Ohio State,6,6,NA,270090275,2007-01-09
40,1,13:16,1996,1996,Foul on Brian Butch,12,11,1,16,0.5267260105688514,0.5267260105688514,Wisconsin,Ohio State,6,6,NA,270090275,2007-01-09
41,1,13:00,1980,1980,Foul on Greg Stiemsma,12,11,1,4,0.5269274710676524,0.5269274710676524,Wisconsin,Ohio State,6,6,NA,270090275,2007-01-09
42,1,12:56,1976,1976,Foul on Greg Oden,12,11,1,19,0.5269781114547611,0.5269781114547611,Wisconsin,Ohio State,6,6,NA,270090275,2007-01-09
43,1,12:37,1957,1957,Kammron Taylor missed Three Point Jumper.,12,11,1,0,0.5272202052529502,0.5272202052529502,Wisconsin,Ohio State,6,6,NA,270090275,2007-01-09
44,1,12:37,1957,1957,Daequan Cook Defensive Rebound.,12,11,1,7,0.5272202052529502,0.5272202052529502,Wisconsin,Ohio State,6,6,NA,270090275,2007-01-09
45,1,12:30,1950,1950,David Lighty missed Three Point Jumper.,12,11,1,0,0.5273100595418571,0.5273100595418571,Wisconsin,Ohio State,6,6,NA,270090275,2007-01-09
46,1,12:30,1950,1950,Alando Tucker Defensive Rebound.,12,11,1,23,0.5273100595418571,0.5273100595418571,Wisconsin,Ohio State,6,6,NA,270090275,2007-01-09
47,1,12:07,1927,1927,Alando Tucker missed Two Point Jumper.,12,11,1,0,0.5276078533301112,0.5276078533301112,Wisconsin,Ohio State,6,6,NA,270090275,2007-01-09
48,1,12:07,1927,1927,Daequan Cook Defensive Rebound.,12,11,1,11,0.5276078533301112,0.5276078533301112,Wisconsin,Ohio State,6,6,NA,270090275,2007-01-09
49,1,11:56,1916,1916,Jamar Butler missed Three Point Jumper.,12,11,1,0,0.5277508047131695,0.5277508047131695,Wisconsin,Ohio State,6,6,NA,270090275,2007-01-09
50,1,11:56,1916,1916,Kammron Taylor Defensive Rebound.,12,11,1,13,0.5277508047131695,0.5277508047131695,Wisconsin,Ohio State,6,6,NA,270090275,2007-01-09
51,1,11:43,1903,1903,Alando Tucker missed Two Point Dunk Shot.,12,11,1,0,0.5279195116963304,0.5279195116963304,Wisconsin,Ohio State,6,6,NA,270090275,2007-01-09
52,1,11:43,1903,1903,Othello Hunter Defensive Rebound.,12,11,1,6,0.5279195116963304,0.5279195116963304,Wisconsin,Ohio State,6,6,NA,270090275,2007-01-09
53,1,11:37,1897,1897,Daequan Cook missed Three Point Jumper.,12,11,1,0,0.527997334658083,0.527997334658083,Wisconsin,Ohio State,6,6,NA,270090275,2007-01-09
54,1,11:37,1897,1897,David Lighty Offensive Rebound.,12,11,1,2,0.527997334658083,0.527997334658083,Wisconsin,Ohio State,6,6,NA,270090275,2007-01-09
55,1,11:35,1895,1895,Foul on Kammron Taylor,12,11,1,0,0.528023274127686,0.528023274127686,Wisconsin,Ohio State,6,6,NA,270090275,2007-01-09
56,1,11:35,1895,1895,Official TV Timeout.,12,11,1,1,0.528023274127686,0.528023274127686,Wisconsin,Ohio State,6,6,NA,270090275,2007-01-09
57,1,11:34,1894,1894,Ron Lewis missed Two Point Jumper.,12,11,1,0,0.5280362439273776,0.5280362439273776,Wisconsin,Ohio State,6,6,NA,270090275,2007-01-09
58,1,11:34,1894,1894,Othello Hunter Offensive Rebound.,12,11,1,26,0.5280362439273776,0.5280362439273776,Wisconsin,Ohio State,6,6,NA,270090275,2007-01-09
59,1,11:08,1868,1868,Marcus Landry made Two Point Layup.  Assisted by Joe Krabbenhoft.,14,11,3,12,0.5843972361919785,0.5843972361919785,Wisconsin,Ohio State,6,6,NA,270090275,2007-01-09
60,1,10:56,1856,1856,Mike Conley Jr. missed Two Point Jumper.,14,11,3,0,0.5848538250277832,0.5848538250277832,Wisconsin,Ohio State,6,6,NA,270090275,2007-01-09
61,1,10:56,1856,1856,Mike Conley Jr. Offensive Rebound.,14,11,3,8,0.5848538250277832,0.5848538250277832,Wisconsin,Ohio State,6,6,NA,270090275,2007-01-09
62,1,10:48,1848,1848,Foul on Greg Stiemsma,14,11,3,8,0.5851588456436801,0.5851588456436801,Wisconsin,Ohio State,6,6,NA,270090275,2007-01-09
63,1,10:40,1840,1840,Daequan Cook missed Two Point Jumper.,14,11,3,0,0.5854645035731838,0.5854645035731838,Wisconsin,Ohio State,6,6,NA,270090275,2007-01-09
64,1,10:40,1840,1840,Trevon Hughes Defensive Rebound.,14,11,3,16,0.5854645035731838,0.5854645035731838,Wisconsin,Ohio State,6,6,NA,270090275,2007-01-09
65,1,10:24,1824,1824,Trevon Hughes missed Three Point Jumper.,14,11,3,0,0.5860781932029631,0.5860781932029631,Wisconsin,Ohio State,6,6,NA,270090275,2007-01-09
66,1,10:24,1824,1824,Joe Krabbenhoft Offensive Rebound.,14,11,3,17,0.5860781932029631,0.5860781932029631,Wisconsin,Ohio State,6,6,NA,270090275,2007-01-09
67,1,10:07,1807,1807,Michael Flowers made Two Point Layup.,16,11,5,11,0.6420188734715883,0.6420188734715883,Wisconsin,Ohio State,6,6,NA,270090275,2007-01-09
68,1,9:56,1796,1796,Foul on Marcus Landry,16,11,5,0,0.642694191702288,0.642694191702288,Wisconsin,Ohio State,6,6,NA,270090275,2007-01-09
69,1,9:56,1796,1796,Greg Oden made Free Throw.,16,12,4,0,0.615303657390299,0.615303657390299,Wisconsin,Ohio State,6,6,NA,270090275,2007-01-09
70,1,9:56,1796,1796,Greg Oden missed Free Throw.,16,12,4,0,0.615303657390299,0.615303657390299,Wisconsin,Ohio State,6,6,NA,270090275,2007-01-09
71,1,9:56,1796,1796,Joe Krabbenhoft Defensive Rebound.,16,12,4,20,0.615303657390299,0.615303657390299,Wisconsin,Ohio State,6,6,NA,270090275,2007-01-09
72,1,9:36,1776,1776,Greg Oden missed Two Point Layup.,16,12,4,0,0.6163246894878874,0.6163246894878874,Wisconsin,Ohio State,6,6,NA,270090275,2007-01-09
73,1,9:36,1776,1776,Joe Krabbenhoft Defensive Rebound.,16,12,4,35,0.6163246894878874,0.6163246894878874,Wisconsin,Ohio State,6,6,NA,270090275,2007-01-09
74,1,9:01,1741,1741,Foul on Jason Chappell,16,12,4,0,0.6181445365300222,0.6181445365300222,Wisconsin,Ohio State,6,6,NA,270090275,2007-01-09
75,1,9:01,1741,1741,Greg Oden made Free Throw.,16,13,3,0,0.5893454354779577,0.5893454354779577,Wisconsin,Ohio State,6,6,NA,270090275,2007-01-09
76,1,9:01,1741,1741,Greg Oden missed Free Throw.,16,13,3,0,0.5893454354779577,0.5893454354779577,Wisconsin,Ohio State,6,6,NA,270090275,2007-01-09
77,1,9:01,1741,1741,Joe Krabbenhoft Defensive Rebound.,16,13,3,16,0.5893454354779577,0.5893454354779577,Wisconsin,Ohio State,6,6,NA,270090275,2007-01-09
78,1,8:45,1725,1725,Jason Chappell missed Two Point Jumper.,16,13,3,0,0.5899982022281737,0.5899982022281737,Wisconsin,Ohio State,6,6,NA,270090275,2007-01-09
79,1,8:45,1725,1725,Greg Oden Defensive Rebound.,16,13,3,11,0.5899982022281737,0.5899982022281737,Wisconsin,Ohio State,6,6,NA,270090275,2007-01-09
80,1,8:34,1714,1714,Ivan Harris missed Two Point Jumper.,16,13,3,0,0.5904524938423856,0.5904524938423856,Wisconsin,Ohio State,6,6,NA,270090275,2007-01-09
81,1,8:34,1714,1714,Trevon Hughes Defensive Rebound.,16,13,3,10,0.5904524938423856,0.5904524938423856,Wisconsin,Ohio State,6,6,NA,270090275,2007-01-09
82,1,8:24,1704,1704,Jason Chappell made Two Point Layup.,18,13,5,18,0.648534322061711,0.648534322061711,Wisconsin,Ohio State,6,6,NA,270090275,2007-01-09
83,1,8:06,1686,1686,Ron Lewis missed Two Point Layup.,18,13,5,0,0.64972927692674,0.64972927692674,Wisconsin,Ohio State,6,6,NA,270090275,2007-01-09
84,1,8:06,1686,1686,Brian Butch Defensive Rebound.,18,13,5,22,0.64972927692674,0.64972927692674,Wisconsin,Ohio State,6,6,NA,270090275,2007-01-09
85,1,7:44,1664,1664,Foul on Greg Oden,18,13,5,0,0.651164569988355,0.651164569988355,Wisconsin,Ohio State,6,6,NA,270090275,2007-01-09
86,1,7:44,1664,1664,Official TV Timeout.,18,13,5,0,0.651164569988355,0.651164569988355,Wisconsin,Ohio State,6,6,NA,270090275,2007-01-09
87,1,7:44,1664,1664,Jason Chappell made Free Throw.,19,13,6,0,0.6789595816947688,0.6789595816947688,Wisconsin,Ohio State,6,6,NA,270090275,2007-01-09
88,1,7:44,1664,1664,Jason Chappell missed Free Throw.,19,13,6,0,0.6789595816947688,0.6789595816947688,Wisconsin,Ohio State,6,6,NA,270090275,2007-01-09
89,1,7:44,1664,1664,Ron Lewis Defensive Rebound.,19,13,6,28,0.6789595816947688,0.6789595816947688,Wisconsin,Ohio State,6,6,NA,270090275,2007-01-09
90,1,7:16,1636,1636,Ron Lewis missed Two Point Jumper.,19,13,6,0,0.6809982258080992,0.6809982258080992,Wisconsin,Ohio State,6,6,NA,270090275,2007-01-09
91,1,7:16,1636,1636,Ivan Harris Offensive Rebound.,19,13,6,0,0.6809982258080992,0.6809982258080992,Wisconsin,Ohio State,6,6,NA,270090275,2007-01-09
92,1,7:16,1636,1636,Foul on Joe Krabbenhoft,19,13,6,0,0.6809982258080992,0.6809982258080992,Wisconsin,Ohio State,6,6,NA,270090275,2007-01-09
93,1,7:16,1636,1636,Ivan Harris made Free Throw.,19,14,5,0,0.652935837445998,0.652935837445998,Wisconsin,Ohio State,6,6,NA,270090275,2007-01-09
94,1,7:16,1636,1636,Ivan Harris made Free Throw.,19,15,4,19,0.6237686635860205,0.6237686635860205,Wisconsin,Ohio State,6,6,NA,270090275,2007-01-09
95,1,6:57,1617,1617,Foul on Daequan Cook,19,15,4,0,0.6247461749766384,0.6247461749766384,Wisconsin,Ohio State,6,6,NA,270090275,2007-01-09
96,1,6:57,1617,1617,Kammron Taylor made Free Throw.,20,15,5,0,0.654115373817457,0.654115373817457,Wisconsin,Ohio State,6,6,NA,270090275,2007-01-09
97,1,6:57,1617,1617,Kammron Taylor made Free Throw.,21,15,6,13,0.6823546818030182,0.6823546818030182,Wisconsin,Ohio State,6,6,NA,270090275,2007-01-09
98,1,6:44,1604,1604,Ivan Harris made Three Point Jumper.  Assisted by Jamar Butler.,21,18,3,49,0.5949422519695907,0.5949422519695907,Wisconsin,Ohio State,6,6,NA,270090275,2007-01-09
99,1,5:55,1555,1555,Michael Flowers made Two Point Layup.  Assisted by Jason Chappell.,23,18,5,15,0.6579525484026556,0.6579525484026556,Wisconsin,Ohio State,6,6,NA,270090275,2007-01-09
100,1,5:40,1540,1540,Ivan Harris missed Three Point Jumper.,23,18,5,0,0.6589010440387655,0.6589010440387655,Wisconsin,Ohio State,6,6,NA,270090275,2007-01-09
101,1,5:40,1540,1540,Mike Conley Jr. Offensive Rebound.,23,18,5,3,0.6589010440387655,0.6589010440387655,Wisconsin,Ohio State,6,6,NA,270090275,2007-01-09
102,1,5:37,1537,1537,Mike Conley Jr. missed Two Point Layup.,23,18,5,0,0.6590925682978487,0.6590925682978487,Wisconsin,Ohio State,6,6,NA,270090275,2007-01-09
103,1,5:37,1537,1537,Wisconsin Defensive Rebound.,23,18,5,10,0.6590925682978487,0.6590925682978487,Wisconsin,Ohio State,6,6,NA,270090275,2007-01-09
104,1,5:27,1527,1527,Alando Tucker missed Two Point Dunk Shot.,23,18,5,0,0.6597361141830707,0.6597361141830707,Wisconsin,Ohio State,6,6,NA,270090275,2007-01-09
105,1,5:27,1527,1527,Othello Hunter Defensive Rebound.,23,18,5,8,0.6597361141830707,0.6597361141830707,Wisconsin,Ohio State,6,6,NA,270090275,2007-01-09
106,1,5:19,1519,1519,Ron Lewis made Two Point Layup.,23,20,3,0,0.5983667448698702,0.5983667448698702,Wisconsin,Ohio State,6,6,NA,270090275,2007-01-09
107,1,5:19,1519,1519,Foul on Alando Tucker,23,20,3,0,0.5983667448698702,0.5983667448698702,Wisconsin,Ohio State,6,6,NA,270090275,2007-01-09
108,1,5:19,1519,1519,Ron Lewis made Free Throw.,23,21,2,17,0.5660557053299187,0.5660557053299187,Wisconsin,Ohio State,6,6,NA,270090275,2007-01-09
109,1,5:02,1502,1502,Foul on Othello Hunter,23,21,2,0,0.5665505490234393,0.5665505490234393,Wisconsin,Ohio State,6,6,NA,270090275,2007-01-09
110,1,5:02,1502,1502,Alando Tucker made Free Throw.,24,21,3,0,0.5990928370854987,0.5990928370854987,Wisconsin,Ohio State,6,6,NA,270090275,2007-01-09
111,1,5:02,1502,1502,Alando Tucker missed Free Throw.,24,21,3,0,0.5990928370854987,0.5990928370854987,Wisconsin,Ohio State,6,6,NA,270090275,2007-01-09
112,1,5:02,1502,1502,Ohio State Defensive Rebound.,24,21,3,7,0.5990928370854987,0.5990928370854987,Wisconsin,Ohio State,6,6,NA,270090275,2007-01-09
113,1,4:55,1495,1495,Foul on Joe Krabbenhoft,24,21,3,4,0.5993982149926522,0.5993982149926522,Wisconsin,Ohio State,6,6,NA,270090275,2007-01-09
114,1,4:51,1491,1491,Foul on Othello Hunter,24,21,3,29,0.5995745537783187,0.5995745537783187,Wisconsin,Ohio State,6,6,NA,270090275,2007-01-09
115,1,4:22,1462,1462,Alando Tucker made Two Point Jumper.,26,21,5,35,0.6641879168877305,0.6641879168877305,Wisconsin,Ohio State,6,6,NA,270090275,2007-01-09
116,1,3:47,1427,1427,Matt Terwilliger missed Two Point Jumper.,26,21,5,0,0.6667601854104888,0.6667601854104888,Wisconsin,Ohio State,6,6,NA,270090275,2007-01-09
117,1,3:47,1427,1427,Wisconsin Defensive Rebound.,26,21,5,0,0.6667601854104888,0.6667601854104888,Wisconsin,Ohio State,6,6,NA,270090275,2007-01-09
118,1,3:47,1427,1427,Foul on David Lighty,26,21,5,0,0.6667601854104888,0.6667601854104888,Wisconsin,Ohio State,6,6,NA,270090275,2007-01-09
119,1,3:47,1427,1427,Official TV Timeout.,26,21,5,0,0.6667601854104888,0.6667601854104888,Wisconsin,Ohio State,6,6,NA,270090275,2007-01-09
120,1,3:47,1427,1427,Joe Krabbenhoft made Free Throw.,27,21,6,0,0.6968371571663571,0.6968371571663571,Wisconsin,Ohio State,6,6,NA,270090275,2007-01-09
121,1,3:47,1427,1427,Joe Krabbenhoft made Free Throw.,28,21,7,26,0.7253178302052262,0.7253178302052262,Wisconsin,Ohio State,6,6,NA,270090275,2007-01-09
122,1,3:21,1401,1401,Matt Terwilliger made Two Point Layup.  Assisted by Mike Conley Jr..,28,23,5,26,0.6685801529032822,0.6685801529032822,Wisconsin,Ohio State,6,6,NA,270090275,2007-01-09
123,1,2:55,1375,1375,Foul on Ron Lewis,28,23,5,0,0.6703492808663359,0.6703492808663359,Wisconsin,Ohio State,6,6,NA,270090275,2007-01-09
124,1,2:55,1375,1375,Alando Tucker missed Free Throw.,28,23,5,0,0.6703492808663359,0.6703492808663359,Wisconsin,Ohio State,6,6,NA,270090275,2007-01-09
125,1,2:55,1375,1375,Wisconsin Defensive Rebound.,28,23,5,0,0.6703492808663359,0.6703492808663359,Wisconsin,Ohio State,6,6,NA,270090275,2007-01-09
126,1,2:55,1375,1375,Alando Tucker missed Free Throw.,28,23,5,0,0.6703492808663359,0.6703492808663359,Wisconsin,Ohio State,6,6,NA,270090275,2007-01-09
127,1,2:55,1375,1375,Mike Conley Jr. Defensive Rebound.,28,23,5,11,0.6703492808663359,0.6703492808663359,Wisconsin,Ohio State,6,6,NA,270090275,2007-01-09
128,1,2:44,1364,1364,Mike Conley Jr. missed Two Point Layup.,28,23,5,0,0.6710918163743989,0.6710918163743989,Wisconsin,Ohio State,6,6,NA,270090275,2007-01-09
129,1,2:44,1364,1364,Joe Krabbenhoft Defensive Rebound.,28,23,5,25,0.6710918163743989,0.6710918163743989,Wisconsin,Ohio State,6,6,NA,270090275,2007-01-09
130,1,2:19,1339,1339,Brian Butch missed Two Point Jumper.,28,23,5,0,0.6727864476602838,0.6727864476602838,Wisconsin,Ohio State,6,6,NA,270090275,2007-01-09
131,1,2:19,1339,1339,Ron Lewis Defensive Rebound.,28,23,5,5,0.6727864476602838,0.6727864476602838,Wisconsin,Ohio State,6,6,NA,270090275,2007-01-09
132,1,2:14,1334,1334,Mike Conley Jr. made Two Point Layup.  Assisted by Tanner Bronson.,28,25,3,24,0.6066905559232693,0.6066905559232693,Wisconsin,Ohio State,6,6,NA,270090275,2007-01-09
133,1,1:50,1310,1310,Othello Hunter missed Two Point Jumper.,30,23,7,0,0.7353566385071479,0.7353566385071479,Wisconsin,Ohio State,6,6,NA,270090275,2007-01-09
134,1,1:50,1310,1310,Alando Tucker Defensive Rebound.,30,23,7,15,0.7353566385071479,0.7353566385071479,Wisconsin,Ohio State,6,6,NA,270090275,2007-01-09
135,1,1:35,1295,1295,Marcus Landry missed Two Point Layup.,30,23,7,10,0.7366948730241477,0.7366948730241477,Wisconsin,Ohio State,6,6,NA,270090275,2007-01-09
136,1,1:25,1285,1285,Michael Flowers Defensive Rebound.,30,23,7,2,0.7376089915488621,0.7376089915488621,Wisconsin,Ohio State,6,6,NA,270090275,2007-01-09
137,1,1:23,1283,1283,Foul on Jamar Butler,30,23,7,0,0.7377941970137178,0.7377941970137178,Wisconsin,Ohio State,6,6,NA,270090275,2007-01-09
138,1,1:23,1283,1283,Kammron Taylor made Free Throw.,31,23,8,0,0.7653657601909466,0.7653657601909466,Wisconsin,Ohio State,6,6,NA,270090275,2007-01-09
139,1,1:23,1283,1283,Kammron Taylor missed Free Throw.,31,23,8,0,0.7653657601909466,0.7653657601909466,Wisconsin,Ohio State,6,6,NA,270090275,2007-01-09
140,1,1:23,1283,1283,Ivan Harris Defensive Rebound.,31,23,8,9,0.7653657601909466,0.7653657601909466,Wisconsin,Ohio State,6,6,NA,270090275,2007-01-09
141,1,1:14,1274,1274,Matt Terwilliger missed Two Point Jumper.,31,23,8,0,0.7662610293521007,0.7662610293521007,Wisconsin,Ohio State,6,6,NA,270090275,2007-01-09
142,1,1:14,1274,1274,Michael Flowers Defensive Rebound.,31,23,8,20,0.7662610293521007,0.7662610293521007,Wisconsin,Ohio State,6,6,NA,270090275,2007-01-09
143,1,0:54,1254,1254,Alando Tucker missed Two Point Layup.,31,23,8,0,0.7683228682664459,0.7683228682664459,Wisconsin,Ohio State,6,6,NA,270090275,2007-01-09
144,1,0:54,1254,1254,Matt Terwilliger Defensive Rebound.,31,23,8,7,0.7683228682664459,0.7683228682664459,Wisconsin,Ohio State,6,6,NA,270090275,2007-01-09
145,1,0:47,1247,1247,Ivan Harris made Three Point Jumper.  Assisted by Mike Conley Jr..,31,26,5,12,0.6795970198943516,0.6795970198943516,Wisconsin,Ohio State,6,6,NA,270090275,2007-01-09
146,1,0:35,1235,1235,Wisconsin 20 Second Timeout.,31,26,5,31,0.6806081734276322,0.6806081734276322,Wisconsin,Ohio State,6,5,NA,270090275,2007-01-09
147,1,0:04,1204,1204,Alando Tucker made Two Point Layup.,33,26,7,1,0.7459706172322522,0.7459706172322522,Wisconsin,Ohio State,6,5,NA,270090275,2007-01-09
148,1,0:03,1203,1203,Ron Lewis missed Three Point Jumper.,33,26,7,0,0.7460834076926617,0.7460834076926617,Wisconsin,Ohio State,6,5,NA,270090275,2007-01-09
149,1,0:03,1203,1203,Wisconsin Defensive Rebound.,33,26,7,3,0.7460834076926617,0.7460834076926617,Wisconsin,Ohio State,6,5,NA,270090275,2007-01-09
150,1,0:00,1200,1200,End of the 1st Half.,33,26,7,0,0.7464201950257411,0.7464201950257411,Wisconsin,Ohio State,6,5,NA,270090275,2007-01-09
151,2,20:00,1200,1200,PLAY,33,26,7,8,0.7464201950257411,0.7464201950257411,Wisconsin,Ohio State,6,5,NA,270090275,2007-01-09
152,2,19:52,1192,1192,Greg Oden missed Two Point Layup.,33,26,7,0,0.7473073483117204,0.7473073483117204,Wisconsin,Ohio State,6,5,NA,270090275,2007-01-09
153,2,19:52,1192,1192,Brian Butch Defensive Rebound.,33,26,7,14,0.7473073483117204,0.7473073483117204,Wisconsin,Ohio State,6,5,NA,270090275,2007-01-09
154,2,19:38,1178,1178,Brian Butch missed Two Point Layup.,33,26,7,0,0.7488264035641852,0.7488264035641852,Wisconsin,Ohio State,6,5,NA,270090275,2007-01-09
155,2,19:38,1178,1178,Ivan Harris Defensive Rebound.,33,26,7,12,0.7488264035641852,0.7488264035641852,Wisconsin,Ohio State,6,5,NA,270090275,2007-01-09
156,2,19:26,1166,1166,Ron Lewis made Three Point Jumper.  Assisted by Jamar Butler.,33,29,4,27,0.6520555229587459,0.6520555229587459,Wisconsin,Ohio State,6,5,NA,270090275,2007-01-09
157,2,18:59,1139,1139,Jason Chappell missed Two Point Layup.,33,29,4,2,0.6540039911006216,0.6540039911006216,Wisconsin,Ohio State,6,5,NA,270090275,2007-01-09
158,2,18:57,1137,1137,Brian Butch Offensive Rebound.,33,29,4,5,0.6541474856946272,0.6541474856946272,Wisconsin,Ohio State,6,5,NA,270090275,2007-01-09
159,2,18:52,1132,1132,Brian Butch missed Three Point Jumper.,33,29,4,0,0.6545062082573596,0.6545062082573596,Wisconsin,Ohio State,6,5,NA,270090275,2007-01-09
160,2,18:52,1132,1132,Ron Lewis Defensive Rebound.,33,29,4,11,0.6545062082573596,0.6545062082573596,Wisconsin,Ohio State,6,5,NA,270090275,2007-01-09
161,2,18:41,1121,1121,Foul on Brian Butch,33,29,4,4,0.6552966287205189,0.6552966287205189,Wisconsin,Ohio State,6,5,NA,270090275,2007-01-09
162,2,18:37,1117,1117,Marcus Landry Steal.,33,29,4,10,0.6555849656082006,0.6555849656082006,Wisconsin,Ohio State,6,5,NA,270090275,2007-01-09
163,2,18:27,1107,1107,Foul on Mike Conley Jr.,33,29,4,0,0.6563093638041018,0.6563093638041018,Wisconsin,Ohio State,6,5,NA,270090275,2007-01-09
164,2,18:27,1107,1107,Kammron Taylor made Free Throw.,34,29,5,0,0.6918138455141333,0.6918138455141333,Wisconsin,Ohio State,6,5,NA,270090275,2007-01-09
165,2,18:27,1107,1107,Kammron Taylor made Free Throw.,35,29,6,18,0.7251863638834635,0.7251863638834635,Wisconsin,Ohio State,6,5,NA,270090275,2007-01-09
166,2,18:09,1089,1089,Greg Oden missed Two Point Layup.,35,29,6,0,0.7269381858001617,0.7269381858001617,Wisconsin,Ohio State,6,5,NA,270090275,2007-01-09
167,2,18:09,1089,1089,Kammron Taylor Defensive Rebound.,35,29,6,17,0.7269381858001617,0.7269381858001617,Wisconsin,Ohio State,6,5,NA,270090275,2007-01-09
168,2,17:52,1072,1072,Mike Conley Jr. Steal.,35,29,6,1,0.7286336885195273,0.7286336885195273,Wisconsin,Ohio State,6,5,NA,270090275,2007-01-09
169,2,17:51,1071,1071,Mike Conley Jr. made Two Point Layup.,35,31,4,23,0.6589928652883598,0.6589928652883598,Wisconsin,Ohio State,6,5,NA,270090275,2007-01-09
170,2,17:28,1048,1048,Michael Flowers missed Three Point Jumper.,35,31,4,0,0.6608070192495599,0.6608070192495599,Wisconsin,Ohio State,6,5,NA,270090275,2007-01-09
171,2,17:28,1048,1048,Jason Chappell Offensive Rebound.,35,31,4,14,0.6608070192495599,0.6608070192495599,Wisconsin,Ohio State,6,5,NA,270090275,2007-01-09
