play_id,half,time_remaining_half,secs_remaining,secs_remaining_absolute,description,home_score,away_score,score_diff,play_length,win_prob,naive_win_prob,home,away,home_time_out_remaining,away_time_out_remaining,home_favored_by,game_id,date
1,1,20:00,2400,2400,PLAY,0,0,0,12,0.5,0.5,Arkansas,Texas,6,6,NA,300050008,2010-01-05
2,1,19:48,2388,2388,Damion James made Two Point Jumper.  Assisted by Avery Bradley.,0,2,-2,25,0.45572153375231284,0.45572153375231284,Arkansas,Texas,6,6,NA,300050008,2010-01-05
3,1,19:23,2363,2363,Marshawn Powell made Two Point Jumper.,2,2,0,12,0.5,0.5,Arkansas,Texas,6,6,NA,300050008,2010-01-05
4,1,19:11,2351,2351,Avery Bradley missed Two Point Layup.,2,2,0,0,0.5,0.5,Arkansas,Texas,6,6,NA,300050008,2010-01-05
5,1,19:11,2351,2351,Marshawn Powell Defensive Rebound.,2,2,0,15,0.5,0.5,Arkansas,Texas,6,6,NA,300050008,2010-01-05
6,1,18:56,2336,2336,Michael Washington missed Two Point Jumper.,2,2,0,0,0.5,0.5,Arkansas,Texas,6,6,NA,300050008,2010-01-05
7,1,18:56,2336,2336,Texas Defensive Rebound.,2,2,0,7,0.5,0.5,Arkansas,Texas,6,6,NA,300050008,2010-01-05
8,1,18:49,2329,2329,Dexter Pittman made Two Point Layup.,2,4,-2,26,0.4544521819541921,0.4544521819541921,Arkansas,Texas,6,6,NA,300050008,2010-01-05
9,1,18:23,2303,2303,Michael Washington missed Three Point Jumper.,2,4,-2,0,0.45387916821805385,0.45387916821805385,Arkansas,Texas,6,6,NA,300050008,2010-01-05
10,1,18:23,2303,2303,Damion James Defensive Rebound.,2,4,-2,8,0.45387916821805385,0.45387916821805385,Arkansas,Texas,6,6,NA,300050008,2010-01-05
11,1,18:15,2295,2295,Dogus Balbay missed Two Point Layup.,2,4,-2,0,0.4537013997188336,0.4537013997188336,Arkansas,Texas,6,6,NA,300050008,2010-01-05
12,1,18:15,2295,2295,Michael Washington Defensive Rebound.,2,4,-2,8,0.4537013997188336,0.4537013997188336,Arkansas,Texas,6,6,NA,300050008,2010-01-05
13,1,18:07,2287,2287,Rotnei Clarke missed Three Point Jumper.,2,4,-2,0,0.4535229929185476,0.4535229929185476,Arkansas,Texas,6,6,NA,300050008,2010-01-05
14,1,18:07,2287,2287,Jemal Farmer Offensive Rebound.,2,4,-2,11,0.4535229929185476,0.4535229929185476,Arkansas,Texas,6,6,NA,300050008,2010-01-05
15,1,17:56,2276,2276,Courtney Fortson missed Three Point Jumper.,2,4,-2,0,0.4532766908152387,0.4532766908152387,Arkansas,Texas,6,6,NA,300050008,2010-01-05
16,1,17:56,2276,2276,Damion James Defensive Rebound.,2,4,-2,8,0.4532766908152387,0.4532766908152387,Arkansas,Texas,6,6,NA,300050008,2010-01-05
17,1,17:48,2268,2268,Avery Bradley made Two Point Jumper.,2,6,-4,22,0.40701201021184025,0.40701201021184025,Arkansas,Texas,6,6,NA,300050008,2010-01-05
18,1,17:26,2246,2246,Foul on Dexter Pittman,2,6,-4,3,0.40604368878856145,0.40604368878856145,Arkansas,Texas,6,6,NA,300050008,2010-01-05
19,1,17:23,2243,2243,Marshawn Powell made Two Point Jumper.,4,6,-2,15,0.45253154916842514,0.45253154916842514,Arkansas,Texas,6,6,NA,300050008,2010-01-05
20,1,17:08,2228,2228,Dogus Balbay missed Two Point Jumper.,4,6,-2,0,0.45219012861582764,0.45219012861582764,Arkansas,Texas,6,6,NA,300050008,2010-01-05
21,1,17:08,2228,2228,Rotnei Clarke Defensive Rebound.,4,6,-2,10,0.45219012861582764,0.45219012861582764,Arkansas,Texas,6,6,NA,300050008,2010-01-05
22,1,16:58,2218,2218,Marshawn Powell made Two Point Jumper.,6,6,0,1,0.5,0.5,Arkansas,Texas,6,6,NA,300050008,2010-01-05
23,1,16:57,2217,2217,Foul on Alexis Wangmene,6,6,0,0,0.5,0.5,Arkansas,Texas,6,6,NA,300050008,2010-01-05
24,1,16:57,2217,2217,Marshawn Powell made Free Throw.,7,6,1,8,0.5240863551735258,0.5240863551735258,Arkansas,Texas,6,6,NA,300050008,2010-01-05
25,1,16:49,2209,2209,Damion James missed Three Point Jumper.,7,6,1,0,0.5241786072287725,0.5241786072287725,Arkansas,Texas,6,6,NA,300050008,2010-01-05
26,1,16:49,2209,2209,Courtney Fortson Defensive Rebound.,7,6,1,6,0.5241786072287725,0.5241786072287725,Arkansas,Texas,6,6,NA,300050008,2010-01-05
27,1,16:43,2203,2203,Rotnei Clarke made Three Point Jumper.  Assisted by Courtney Fortson.,10,6,4,17,0.595866462840868,0.595866462840868,Arkansas,Texas,6,6,NA,300050008,2010-01-05
28,1,16:26,2186,2186,Avery Bradley made Three Point Jumper.,10,9,1,17,0.5244447916132549,0.5244447916132549,Arkansas,Texas,6,6,NA,300050008,2010-01-05
29,1,16:09,2169,2169,Courtney Fortson missed Two Point Layup.,10,9,1,2,0.5246423096444954,0.5246423096444954,Arkansas,Texas,6,6,NA,300050008,2010-01-05
30,1,16:07,2167,2167,Dogus Balbay Defensive Rebound.,10,9,1,6,0.5246655909373422,0.5246655909373422,Arkansas,Texas,6,6,NA,300050008,2010-01-05
31,1,16:01,2161,2161,Foul on Marshawn Powell,10,9,1,0,0.5247355256734755,0.5247355256734755,Arkansas,Texas,6,6,NA,300050008,2010-01-05
32,1,16:01,2161,2161,Damion James missed Free Throw.,10,9,1,0,0.5247355256734755,0.5247355256734755,Arkansas,Texas,6,6,NA,300050008,2010-01-05
33,1,16:01,2161,2161,null,10,9,1,0,0.5247355256734755,0.5247355256734755,Arkansas,Texas,6,6,NA,300050008,2010-01-05
34,1,16:01,2161,2161,Damion James made Free Throw.,10,10,0,16,0.5,0.5,Arkansas,Texas,6,6,NA,300050008,2010-01-05
35,1,15:45,2145,2145,Jemal Farmer missed Two Point Layup.,10,10,0,0,0.5,0.5,Arkansas,Texas,6,6,NA,300050008,2010-01-05
36,1,15:45,2145,2145,Arkansas Offensive Rebound.,10,10,0,4,0.5,0.5,Arkansas,Texas,6,6,NA,300050008,2010-01-05
37,1,15:41,2141,2141,Official TV Timeout.,10,10,0,4,0.5,0.5,Arkansas,Texas,6,6,NA,300050008,2010-01-05
38,1,15:37,2137,2137,Foul on Dogus Balbay,10,10,0,0,0.5,0.5,Arkansas,Texas,6,6,NA,300050008,2010-01-05
39,1,15:37,2137,2137,Rotnei Clarke missed Free Throw.,10,10,0,0,0.5,0.5,Arkansas,Texas,6,6,NA,300050008,2010-01-05
40,1,15:37,2137,2137,null,10,10,0,0,0.5,0.5,Arkansas,Texas,6,6,NA,300050008,2010-01-05
41,1,15:37,2137,2137,Rotnei Clarke made Free Throw.,11,10,1,10,0.525016692989698,0.525016692989698,Arkansas,Texas,6,6,NA,300050008,2010-01-05
42,1,15:27,2127,2127,Gary Johnson made Two Point Jumper.,11,12,-1,28,0.47486544078988047,0.47486544078988047,Arkansas,Texas,6,6,NA,300050008,2010-01-05
43,1,14:59,2099,2099,Foul on Courtney Fortson,11,12,-1,0,0.4745329960623789,0.4745329960623789,Arkansas,Texas,6,6,NA,300050008,2010-01-05
44,1,14:59,2099,2099,Courtney Fortson Turnover.,11,12,-1,9,0.4745329960623789,0.4745329960623789,Arkansas,Texas,6,6,NA,300050008,2010-01-05
45,1,14:50,2090,2090,Dexter Pittman missed Two Point Jumper.,11,12,-1,0,0.47442533718173074,0.47442533718173074,Arkansas,Texas,6,6,NA,300050008,2010-01-05
46,1,14:50,2090,2090,Marshawn Powell Defensive Rebound.,11,12,-1,12,0.47442533718173074,0.47442533718173074,Arkansas,Texas,6,6,NA,300050008,2010-01-05
47,1,14:38,2078,2078,Rotnei Clarke made Three Point Jumper.,14,12,2,12,0.5513019628263349,0.5513019628263349,Arkansas,Texas,6,6,NA,300050008,2010-01-05
48,1,14:26,2066,2066,Foul on Courtney Fortson,14,12,2,4,0.5515895536493832,0.5515895536493832,Arkansas,Texas,6,6,NA,300050008,2010-01-05
49,1,14:22,2062,2062,Jordan Hamilton made Three Point Jumper.,14,15,-1,30,0.4740877131146207,0.4740877131146207,Arkansas,Texas,6,6,NA,300050008,2010-01-05
50,1,13:52,2032,2032,Michael Washington made Two Point Dunk Shot.  Assisted by Rotnei Clarke.,16,15,1,10,0.5262788681676853,0.5262788681676853,Arkansas,Texas,6,6,NA,300050008,2010-01-05
51,1,13:42,2022,2022,J'Covan Brown made Two Point Jumper.,16,17,-1,15,0.47359774791775133,0.47359774791775133,Arkansas,Texas,6,6,NA,300050008,2010-01-05
52,1,13:27,2007,2007,Rotnei Clarke made Two Point Layup.,18,17,1,2,0.5265885022689188,0.5265885022689188,Arkansas,Texas,6,6,NA,300050008,2010-01-05
53,1,13:25,2005,2005,Foul on Dexter Pittman,18,17,1,0,0.5266134447036247,0.5266134447036247,Arkansas,Texas,6,6,NA,300050008,2010-01-05
54,1,13:25,2005,2005,Rotnei Clarke made Free Throw.,19,17,2,8,0.5530765182302504,0.5530765182302504,Arkansas,Texas,6,6,NA,300050008,2010-01-05
55,1,13:17,1997,1997,J'Covan Brown missed Two Point Jumper.,19,17,2,0,0.5532748836115552,0.5532748836115552,Arkansas,Texas,6,6,NA,300050008,2010-01-05
56,1,13:17,1997,1997,Dexter Pittman Offensive Rebound.,19,17,2,8,0.5532748836115552,0.5532748836115552,Arkansas,Texas,6,6,NA,300050008,2010-01-05
57,1,13:09,1989,1989,Dexter Pittman made Two Point Layup.,19,19,0,14,0.5,0.5,Arkansas,Texas,6,6,NA,300050008,2010-01-05
58,1,12:55,1975,1975,Foul on Dogus Balbay,19,19,0,3,0.5,0.5,Arkansas,Texas,6,6,NA,300050008,2010-01-05
59,1,12:52,1972,1972,Michael Washington missed Two Point Jumper.,19,19,0,0,0.5,0.5,Arkansas,Texas,6,6,NA,300050008,2010-01-05
60,1,12:52,1972,1972,Jordan Hamilton Defensive Rebound.,19,19,0,9,0.5,0.5,Arkansas,Texas,6,6,NA,300050008,2010-01-05
61,1,12:43,1963,1963,Dexter Pittman missed Two Point Layup.,19,19,0,0,0.5,0.5,Arkansas,Texas,6,6,NA,300050008,2010-01-05
62,1,12:43,1963,1963,Michael Washington Block.,19,19,0,1,0.5,0.5,Arkansas,Texas,6,6,NA,300050008,2010-01-05
63,1,12:42,1962,1962,Gary Johnson Offensive Rebound.,19,19,0,0,0.5,0.5,Arkansas,Texas,6,6,NA,300050008,2010-01-05
64,1,12:42,1962,1962,Foul on Michael Washington,19,19,0,0,0.5,0.5,Arkansas,Texas,6,6,NA,300050008,2010-01-05
65,1,12:42,1962,1962,Gary Johnson missed Free Throw.,19,19,0,0,0.5,0.5,Arkansas,Texas,6,6,NA,300050008,2010-01-05
66,1,12:42,1962,1962,null,19,19,0,0,0.5,0.5,Arkansas,Texas,6,6,NA,300050008,2010-01-05
67,1,12:42,1962,1962,Gary Johnson made Free Throw.,19,20,-1,12,0.4728437558121363,0.4728437558121363,Arkansas,Texas,6,6,NA,300050008,2010-01-05
68,1,12:30,1950,1950,Foul on Damion James,19,20,-1,0,0.4726899404581429,0.4726899404581429,Arkansas,Texas,6,6,NA,300050008,2010-01-05
69,1,12:30,1950,1950,Marshawn Powell missed Free Throw.,19,20,-1,0,0.4726899404581429,0.4726899404581429,Arkansas,Texas,6,6,NA,300050008,2010-01-05
70,1,12:30,1950,1950,null,19,20,-1,0,0.4726899404581429,0.4726899404581429,Arkansas,Texas,6,6,NA,300050008,2010-01-05
71,1,12:30,1950,1950,Marshawn Powell made Free Throw.,20,20,0,14,0.5,0.5,Arkansas,Texas,6,6,NA,300050008,2010-01-05
72,1,12:16,1936,1936,Jordan Hamilton missed Three Point Jumper.,20,20,0,0,0.5,0.5,Arkansas,Texas,6,6,NA,300050008,2010-01-05
73,1,12:16,1936,1936,Justin Mason Offensive Rebound.,20,20,0,11,0.5,0.5,Arkansas,Texas,6,6,NA,300050008,2010-01-05
74,1,12:05,1925,1925,J'Covan Brown missed Two Point Layup.,20,20,0,0,0.5,0.5,Arkansas,Texas,6,6,NA,300050008,2010-01-05
75,1,12:05,1925,1925,Alexis Wangmene Offensive Rebound.,20,20,0,2,0.5,0.5,Arkansas,Texas,6,6,NA,300050008,2010-01-05
76,1,12:03,1923,1923,Alexis Wangmene made Two Point Layup.,20,22,-2,27,0.4448490488474231,0.4448490488474231,Arkansas,Texas,6,6,NA,300050008,2010-01-05
77,1,11:36,1896,1896,Courtney Fortson made Two Point Layup.,22,22,0,13,0.5,0.5,Arkansas,Texas,6,6,NA,300050008,2010-01-05
78,1,11:23,1883,1883,Jordan Hamilton missed Three Point Jumper.,22,22,0,0,0.5,0.5,Arkansas,Texas,6,6,NA,300050008,2010-01-05
79,1,11:23,1883,1883,Courtney Fortson Defensive Rebound.,22,22,0,7,0.5,0.5,Arkansas,Texas,6,6,NA,300050008,2010-01-05
80,1,11:16,1876,1876,Stefan Welsh missed Three Point Jumper.,22,22,0,0,0.5,0.5,Arkansas,Texas,6,6,NA,300050008,2010-01-05
81,1,11:16,1876,1876,J'Covan Brown Defensive Rebound.,22,22,0,9,0.5,0.5,Arkansas,Texas,6,6,NA,300050008,2010-01-05
82,1,11:07,1867,1867,Damion James made Two Point Layup.  Assisted by Justin Mason.,22,24,-2,21,0.44340892914977953,0.44340892914977953,Arkansas,Texas,6,6,NA,300050008,2010-01-05
83,1,10:46,1846,1846,Courtney Fortson made Two Point Layup.,24,24,0,14,0.5,0.5,Arkansas,Texas,6,6,NA,300050008,2010-01-05
84,1,10:32,1832,1832,Official TV Timeout.,24,24,0,7,0.5,0.5,Arkansas,Texas,6,6,NA,300050008,2010-01-05
85,1,10:25,1825,1825,Dexter Pittman Turnover.,24,24,0,1,0.5,0.5,Arkansas,Texas,6,6,NA,300050008,2010-01-05
86,1,10:24,1824,1824,Stephen Cox Steal.,24,24,0,12,0.5,0.5,Arkansas,Texas,6,6,NA,300050008,2010-01-05
87,1,10:12,1812,1812,Foul on Avery Bradley,24,24,0,0,0.5,0.5,Arkansas,Texas,6,6,NA,300050008,2010-01-05
88,1,10:12,1812,1812,Stefan Welsh made Free Throw.,25,24,1,0,0.5291074000864612,0.5291074000864612,Arkansas,Texas,6,6,NA,300050008,2010-01-05
89,1,10:12,1812,1812,Stefan Welsh made Free Throw.,26,24,2,14,0.5580181787143008,0.5580181787143008,Arkansas,Texas,6,6,NA,300050008,2010-01-05
90,1,9:58,1798,1798,Foul on Stephen Cox,26,24,2,0,0.5583865401768822,0.5583865401768822,Arkansas,Texas,6,6,NA,300050008,2010-01-05
91,1,9:58,1798,1798,Damion James missed Free Throw.,26,24,2,0,0.5583865401768822,0.5583865401768822,Arkansas,Texas,6,6,NA,300050008,2010-01-05
92,1,9:58,1798,1798,null,26,24,2,0,0.5583865401768822,0.5583865401768822,Arkansas,Texas,6,6,NA,300050008,2010-01-05
93,1,9:58,1798,1798,Damion James made Free Throw.,26,25,1,8,0.5292934739580989,0.5292934739580989,Arkansas,Texas,6,6,NA,300050008,2010-01-05
94,1,9:50,1790,1790,Courtney Fortson made Two Point Layup.,28,25,3,13,0.5873964912493371,0.5873964912493371,Arkansas,Texas,6,6,NA,300050008,2010-01-05
95,1,9:37,1777,1777,Dexter Pittman made Two Point Dunk Shot.,28,27,1,21,0.5295754431710045,0.5295754431710045,Arkansas,Texas,6,6,NA,300050008,2010-01-05
96,1,9:16,1756,1756,Marshawn Powell missed Three Point Jumper.,28,27,1,0,0.5298614808173907,0.5298614808173907,Arkansas,Texas,6,6,NA,300050008,2010-01-05
97,1,9:16,1756,1756,Damion James Defensive Rebound.,28,27,1,12,0.5298614808173907,0.5298614808173907,Arkansas,Texas,6,6,NA,300050008,2010-01-05
98,1,9:04,1744,1744,Dexter Pittman made Two Point Jumper.,28,29,-1,21,0.46997296615547884,0.46997296615547884,Arkansas,Texas,6,6,NA,300050008,2010-01-05
99,1,8:43,1723,1723,Courtney Fortson made Three Point Jumper.,31,29,2,20,0.56041964125898,0.56041964125898,Arkansas,Texas,6,6,NA,300050008,2010-01-05
100,1,8:23,1703,1703,Justin Mason Turnover.,31,29,2,1,0.5609840737456568,0.5609840737456568,Arkansas,Texas,6,6,NA,300050008,2010-01-05
101,1,8:22,1702,1702,Marshawn Powell Steal.,31,29,2,3,0.5610125927338407,0.5610125927338407,Arkansas,Texas,6,6,NA,300050008,2010-01-05
102,1,8:19,1699,1699,Rotnei Clarke made Two Point Layup.,33,29,4,0,0.6203988554604486,0.6203988554604486,Arkansas,Texas,6,6,NA,300050008,2010-01-05
103,1,8:19,1699,1699,Foul on Justin Mason,33,29,4,0,0.6203988554604486,0.6203988554604486,Arkansas,Texas,6,6,NA,300050008,2010-01-05
104,1,8:19,1699,1699,Rotnei Clarke missed Free Throw.,33,29,4,0,0.6203988554604486,0.6203988554604486,Arkansas,Texas,6,6,NA,300050008,2010-01-05
105,1,8:19,1699,1699,Damion James Defensive Rebound.,33,29,4,13,0.6203988554604486,0.6203988554604486,Arkansas,Texas,6,6,NA,300050008,2010-01-05
106,1,8:06,1686,1686,Damion James missed Two Point Jumper.,33,29,4,0,0.621114063916299,0.621114063916299,Arkansas,Texas,6,6,NA,300050008,2010-01-05
107,1,8:06,1686,1686,Marshawn Powell Defensive Rebound.,33,29,4,8,0.621114063916299,0.621114063916299,Arkansas,Texas,6,6,NA,300050008,2010-01-05
108,1,7:58,1678,1678,Delvon Johnson made Two Point Layup.,35,29,6,7,0.6779138071973402,0.6779138071973402,Arkansas,Texas,6,6,NA,300050008,2010-01-05
109,1,7:51,1671,1671,Jai Lucas missed Two Point Layup.,35,29,6,0,0.6784393191307959,0.6784393191307959,Arkansas,Texas,6,6,NA,300050008,2010-01-05
110,1,7:51,1671,1671,Alexis Wangmene Offensive Rebound.,35,29,6,4,0.6784393191307959,0.6784393191307959,Arkansas,Texas,6,6,NA,300050008,2010-01-05
111,1,7:47,1667,1667,Damion James made Two Point Layup.,35,31,4,16,0.6221419666586717,0.6221419666586717,Arkansas,Texas,6,6,NA,300050008,2010-01-05
112,1,7:31,1651,1651,Foul on Delvon Johnson,35,31,4,0,0.6229878937954086,0.6229878937954086,Arkansas,Texas,6,6,NA,300050008,2010-01-05
113,1,7:31,1651,1651,Delvon Johnson Turnover.,35,31,4,2,0.6229878937954086,0.6229878937954086,Arkansas,Texas,6,6,NA,300050008,2010-01-05
114,1,7:29,1649,1649,Official TV Timeout.,35,31,4,16,0.6230926020775627,0.6230926020775627,Arkansas,Texas,6,6,NA,300050008,2010-01-05
115,1,7:13,1633,1633,Avery Bradley made Two Point Jumper.  Assisted by Alexis Wangmene.,35,33,2,30,0.5629438071582088,0.5629438071582088,Arkansas,Texas,6,6,NA,300050008,2010-01-05
116,1,6:43,1603,1603,Foul on Alexis Wangmene,35,33,2,0,0.5637508401185388,0.5637508401185388,Arkansas,Texas,6,6,NA,300050008,2010-01-05
117,1,6:43,1603,1603,Marshawn Powell made Free Throw.,36,33,3,0,0.5949816644461958,0.5949816644461958,Arkansas,Texas,6,6,NA,300050008,2010-01-05
118,1,6:43,1603,1603,Marshawn Powell made Free Throw.,37,33,4,10,0.6254620834865046,0.6254620834865046,Arkansas,Texas,6,6,NA,300050008,2010-01-05
119,1,6:33,1593,1593,Texas 30 Second Timeout.,37,33,4,6,0.6259729594833395,0.6259729594833395,Arkansas,Texas,5,6,NA,300050008,2010-01-05
120,1,6:27,1587,1587,Jai Lucas made Two Point Jumper.,37,35,2,8,0.5641802106938592,0.5641802106938592,Arkansas,Texas,5,6,NA,300050008,2010-01-05
121,1,6:19,1579,1579,Courtney Fortson Turnover.,37,35,2,12,0.5643955598077249,0.5643955598077249,Arkansas,Texas,5,6,NA,300050008,2010-01-05
122,1,6:07,1567,1567,Jai Lucas Turnover.,37,35,2,1,0.5647201933328097,0.5647201933328097,Arkansas,Texas,5,6,NA,300050008,2010-01-05
123,1,6:06,1566,1566,Stefan Welsh Steal.,37,35,2,3,0.5647473579619368,0.5647473579619368,Arkansas,Texas,5,6,NA,300050008,2010-01-05
124,1,6:03,1563,1563,Courtney Fortson missed Two Point Dunk Shot.,37,35,2,0,0.5648289724015181,0.5648289724015181,Arkansas,Texas,5,6,NA,300050008,2010-01-05
125,1,6:03,1563,1563,Avery Bradley Block.,37,35,2,0,0.5648289724015181,0.5648289724015181,Arkansas,Texas,5,6,NA,300050008,2010-01-05
126,1,6:03,1563,1563,Arkansas Offensive Rebound.,37,35,2,12,0.5648289724015181,0.5648289724015181,Arkansas,Texas,5,6,NA,300050008,2010-01-05
127,1,5:51,1551,1551,Marshawn Powell missed Two Point Jumper.,37,35,2,0,0.5651574981270215,0.5651574981270215,Arkansas,Texas,5,6,NA,300050008,2010-01-05
128,1,5:51,1551,1551,Avery Bradley Defensive Rebound.,37,35,2,8,0.5651574981270215,0.5651574981270215,Arkansas,Texas,5,6,NA,300050008,2010-01-05
129,1,5:43,1543,1543,Jai Lucas made Three Point Jumper.  Assisted by Avery Bradley.,37,38,-1,16,0.4671697235858243,0.4671697235858243,Arkansas,Texas,5,6,NA,300050008,2010-01-05
130,1,5:27,1527,1527,Courtney Fortson missed Two Point Jumper.,37,38,-1,0,0.4669423703625333,0.4669423703625333,Arkansas,Texas,5,6,NA,300050008,2010-01-05
131,1,5:27,1527,1527,Dexter Pittman Defensive Rebound.,37,38,-1,11,0.4669423703625333,0.4669423703625333,Arkansas,Texas,5,6,NA,300050008,2010-01-05
132,1,5:16,1516,1516,Delvon Johnson Block.,37,38,-1,0,0.4667830384933974,0.4667830384933974,Arkansas,Texas,5,6,NA,300050008,2010-01-05
133,1,5:16,1516,1516,Jordan Hamilton missed Two Point Layup.,37,38,-1,0,0.4667830384933974,0.4667830384933974,Arkansas,Texas,5,6,NA,300050008,2010-01-05
134,1,5:16,1516,1516,Texas Offensive Rebound.,37,38,-1,8,0.4667830384933974,0.4667830384933974,Arkansas,Texas,5,6,NA,300050008,2010-01-05
135,1,5:08,1508,1508,Jordan Hamilton missed Three Point Jumper.,37,38,-1,0,0.4666653686958037,0.4666653686958037,Arkansas,Texas,5,6,NA,300050008,2010-01-05
136,1,5:08,1508,1508,Gary Johnson Offensive Rebound.,37,38,-1,4,0.4666653686958037,0.4666653686958037,Arkansas,Texas,5,6,NA,300050008,2010-01-05
137,1,5:04,1504,1504,Gary Johnson made Two Point Layup.,37,40,-3,11,0.4009936928029703,0.4009936928029703,Arkansas,Texas,5,6,NA,300050008,2010-01-05
138,1,4:53,1493,1493,Arkansas 30 Second Timeout.,37,40,-3,21,0.4005137873325576,0.4005137873325576,Arkansas,Texas,5,5,NA,300050008,2010-01-05
139,1,4:32,1472,1472,Marshawn Powell made Two Point Jumper.,39,40,-1,18,0.4661131988898126,0.4661131988898126,Arkansas,Texas,5,5,NA,300050008,2010-01-05
140,1,4:14,1454,1454,Jordan Hamilton Turnover.,39,40,-1,1,0.46582045923575116,0.46582045923575116,Arkansas,Texas,5,5,NA,300050008,2010-01-05
141,1,4:13,1453,1453,Jemal Farmer Steal.,39,40,-1,21,0.4658038226549363,0.4658038226549363,Arkansas,Texas,5,5,NA,300050008,2010-01-05
142,1,3:52,1432,1432,Courtney Fortson missed Three Point Jumper.,39,40,-1,0,0.46545749047817964,0.46545749047817964,Arkansas,Texas,5,5,NA,300050008,2010-01-05
143,1,3:52,1432,1432,Damion James Defensive Rebound.,39,40,-1,4,0.46545749047817964,0.46545749047817964,Arkansas,Texas,5,5,NA,300050008,2010-01-05
144,1,3:48,1428,1428,Foul on Jemal Farmer,39,40,-1,0,0.4653931170250793,0.4653931170250793,Arkansas,Texas,5,5,NA,300050008,2010-01-05
145,1,3:48,1428,1428,Damion James made Free Throw.,39,41,-2,0,0.43111622490188006,0.43111622490188006,Arkansas,Texas,5,5,NA,300050008,2010-01-05
146,1,3:48,1428,1428,Damion James made Free Throw.,39,42,-3,15,0.39748684697140607,0.39748684697140607,Arkansas,Texas,5,5,NA,300050008,2010-01-05
147,1,3:33,1413,1413,Courtney Fortson missed Two Point Layup.,39,42,-3,0,0.3968009376307712,0.3968009376307712,Arkansas,Texas,5,5,NA,300050008,2010-01-05
148,1,3:33,1413,1413,Delvon Johnson Offensive Rebound.,39,42,-3,2,0.3968009376307712,0.3968009376307712,Arkansas,Texas,5,5,NA,300050008,2010-01-05
149,1,3:31,1411,1411,Delvon Johnson made Two Point Layup.,41,42,-1,0,0.46512424741662284,0.46512424741662284,Arkansas,Texas,5,5,NA,300050008,2010-01-05
150,1,3:31,1411,1411,Foul on Damion James,41,42,-1,0,0.46512424741662284,0.46512424741662284,Arkansas,Texas,5,5,NA,300050008,2010-01-05
151,1,3:31,1411,1411,Delvon Johnson missed Free Throw.,41,42,-1,0,0.46512424741662284,0.46512424741662284,Arkansas,Texas,5,5,NA,300050008,2010-01-05
152,1,3:31,1411,1411,Gary Johnson Defensive Rebound.,41,42,-1,22,0.46512424741662284,0.46512424741662284,Arkansas,Texas,5,5,NA,300050008,2010-01-05
153,1,3:09,1389,1389,Jai Lucas made Two Point Jumper.,41,44,-3,31,0.39573086638909866,0.39573086638909866,Arkansas,Texas,5,5,NA,300050008,2010-01-05
154,1,2:38,1358,1358,Marshawn Powell missed Two Point Jumper.,41,44,-3,0,0.3943704081327692,0.3943704081327692,Arkansas,Texas,5,5,NA,300050008,2010-01-05
155,1,2:38,1358,1358,Jordan Hamilton Defensive Rebound.,41,44,-3,9,0.3943704081327692,0.3943704081327692,Arkansas,Texas,5,5,NA,300050008,2010-01-05
156,1,2:29,1349,1349,Gary Johnson made Two Point Layup.  Assisted by Jai Lucas.,41,46,-5,22,0.3278939833387823,0.3278939833387823,Arkansas,Texas,5,5,NA,300050008,2010-01-05
157,1,2:07,1327,1327,Rotnei Clarke made Two Point Jumper.,43,46,-3,12,0.3929955765939615,0.3929955765939615,Arkansas,Texas,5,5,NA,300050008,2010-01-05
158,1,1:55,1315,1315,Jai Lucas Turnover.,43,46,-3,2,0.39245058384886455,0.39245058384886455,Arkansas,Texas,5,5,NA,300050008,2010-01-05
159,1,1:53,1313,1313,Marshawn Powell Steal.,43,46,-3,4,0.392358763045517,0.392358763045517,Arkansas,Texas,5,5,NA,300050008,2010-01-05
160,1,1:49,1309,1309,Stefan Welsh missed Three Point Jumper.,43,46,-3,0,0.3921741733782847,0.3921741733782847,Arkansas,Texas,5,5,NA,300050008,2010-01-05
161,1,1:49,1309,1309,Arkansas Offensive Rebound.,43,46,-3,2,0.3921741733782847,0.3921741733782847,Arkansas,Texas,5,5,NA,300050008,2010-01-05
162,1,1:47,1307,1307,Courtney Fortson made Three Point Jumper.,46,46,0,16,0.5,0.5,Arkansas,Texas,5,5,NA,300050008,2010-01-05
163,1,1:31,1291,1291,Gary Johnson missed Two Point Layup.,46,46,0,0,0.5,0.5,Arkansas,Texas,5,5,NA,300050008,2010-01-05
164,1,1:31,1291,1291,Dexter Pittman Offensive Rebound.,46,46,0,3,0.5,0.5,Arkansas,Texas,5,5,NA,300050008,2010-01-05
165,1,1:28,1288,1288,Dexter Pittman made Two Point Layup.,46,48,-2,22,0.42680461553122595,0.42680461553122595,Arkansas,Texas,5,5,NA,300050008,2010-01-05
166,1,1:06,1266,1266,Rotnei Clarke missed Three Point Jumper.,46,48,-2,0,0.4260551899019354,0.4260551899019354,Arkansas,Texas,5,5,NA,300050008,2010-01-05
167,1,1:06,1266,1266,Gary Johnson Defensive Rebound.,46,48,-2,9,0.4260551899019354,0.4260551899019354,Arkansas,Texas,5,5,NA,300050008,2010-01-05
168,1,0:57,1257,1257,Foul on Stefan Welsh,46,48,-2,0,0.42573534938916746,0.42573534938916746,Arkansas,Texas,5,5,NA,300050008,2010-01-05
169,1,0:57,1257,1257,Jordan Hamilton missed Free Throw.,46,48,-2,0,0.42573534938916746,0.42573534938916746,Arkansas,Texas,5,5,NA,300050008,2010-01-05
170,1,0:57,1257,1257,Stefan Welsh Defensive Rebound.,46,48,-2,35,0.42573534938916746,0.42573534938916746,Arkansas,Texas,5,5,NA,300050008,2010-01-05
171,1,0:22,1222,1222,Rotnei Clarke made Two Point Jumper.,48,48,0,15,0.5,0.5,Arkansas,Texas,5,5,NA,300050008,2010-01-05
172,1,0:07,1207,1207,Jordan Hamilton Turnover.,48,48,0,0,0.5,0.5,Arkansas,Texas,5,5,NA,300050008,2010-01-05
173,1,0:07,1207,1207,Stefan Welsh Steal.,48,48,0,4,0.5,0.5,Arkansas,Texas,5,5,NA,300050008,2010-01-05
174,1,0:03,1203,1203,Courtney Fortson missed Three Point Jumper.,48,48,0,0,0.5,0.5,Arkansas,Texas,5,5,NA,300050008,2010-01-05
175,1,0:03,1203,1203,null,48,48,0,3,0.5,0.5,Arkansas,Texas,5,5,NA,300050008,2010-01-05
176,1,0:00,1200,1200,End of the 1st Half.,48,48,0,0,0.5,0.5,Arkansas,Texas,5,5,NA,300050008,2010-01-05
177,2,20:00,1200,1200,PLAY,48,48,0,16,0.5,0.5,Arkansas,Texas,5,5,NA,300050008,2010-01-05
178,2,19:44,1184,1184,Michael Washington missed Two Point Jumper.,48,48,0,0,0.5,0.5,Arkansas,Texas,5,5,NA,300050008,2010-01-05
179,2,19:44,1184,1184,Damion James Defensive Rebound.,48,48,0,8,0.5,0.5,Arkansas,Texas,5,5,NA,300050008,2010-01-05
180,2,19:36,1176,1176,Dexter Pittman made Two Point Dunk Shot.  Assisted by Dogus Balbay.,48,50,-2,0,0.42252199137953295,0.42252199137953295,Arkansas,Texas,5,5,NA,300050008,2010-01-05
181,2,19:36,1176,1176,Foul on Michael Washington,48,50,-2,0,0.42252199137953295,0.42252199137953295,Arkansas,Texas,5,5,NA,300050008,2010-01-05
182,2,19:36,1176,1176,Dexter Pittman made Free Throw.,48,51,-3,19,0.3849374070098033,0.3849374070098033,Arkansas,Texas,5,5,NA,300050008,2010-01-05
183,2,19:17,1157,1157,Rotnei Clarke missed Three Point Jumper.,48,51,-3,0,0.3838531596911178,0.3838531596911178,Arkansas,Texas,5,5,NA,300050008,2010-01-05
184,2,19:17,1157,1157,Dexter Pittman Defensive Rebound.,48,51,-3,15,0.3838531596911178,0.3838531596911178,Arkansas,Texas,5,5,NA,300050008,2010-01-05
185,2,19:02,1142,1142,Dogus Balbay Turnover.,48,51,-3,22,0.3830077746022579,0.3830077746022579,Arkansas,Texas,5,5,NA,300050008,2010-01-05
186,2,18:40,1120,1120,Jemal Farmer missed Two Point Jumper.,48,51,-3,0,0.3817700612721519,0.3817700612721519,Arkansas,Texas,5,5,NA,300050008,2010-01-05
187,2,18:40,1120,1120,Damion James Defensive Rebound.,48,51,-3,11,0.3817700612721519,0.3817700612721519,Arkansas,Texas,5,5,NA,300050008,2010-01-05
