play_id,half,time_remaining_half,secs_remaining,secs_remaining_absolute,description,home_score,away_score,score_diff,play_length,win_prob,naive_win_prob,home,away,home_time_out_remaining,away_time_out_remaining,home_favored_by,game_id,date
1,1,20:00,2400,2400,PLAY,0,0,0,22,0.5,0.5,Baylor,Iowa State,4,4,NA,280120239,2008-01-12
2,1,19:38,2378,2378,Craig Brackins missed Two Point Jumper.,0,0,0,0,0.5,0.5,Baylor,Iowa State,4,4,NA,280120239,2008-01-12
3,1,19:38,2378,2378,Iowa State Offensive Rebound.,0,0,0,5,0.5,0.5,Baylor,Iowa State,4,4,NA,280120239,2008-01-12
4,1,19:33,2373,2373,Jiri Hubalek missed Two Point Jumper.,0,0,0,0,0.5,0.5,Baylor,Iowa State,4,4,NA,280120239,2008-01-12
5,1,19:33,2373,2373,Kevin Rogers Defensive Rebound.,0,0,0,16,0.5,0.5,Baylor,Iowa State,4,4,NA,280120239,2008-01-12
6,1,19:17,2357,2357,Henry Dugat missed Two Point Jumper.,0,0,0,0,0.5,0.5,Baylor,Iowa State,4,4,NA,280120239,2008-01-12
7,1,19:17,2357,2357,Jiri Hubalek Defensive Rebound.,0,0,0,19,0.5,0.5,Baylor,Iowa State,4,4,NA,280120239,2008-01-12
8,1,18:58,2338,2338,Jiri Hubalek missed Two Point Layup.,0,0,0,0,0.5,0.5,Baylor,Iowa State,4,4,NA,280120239,2008-01-12
9,1,18:58,2338,2338,Jiri Hubalek Offensive Rebound.,0,0,0,3,0.5,0.5,Baylor,Iowa State,4,4,NA,280120239,2008-01-12
10,1,18:55,2335,2335,Foul on Jiri Hubalek,0,0,0,15,0.5,0.5,Baylor,Iowa State,4,4,NA,280120239,2008-01-12
11,1,18:40,2320,2320,Kevin Rogers made Two Point Jumper.,2,0,2,13,0.545745316074961,0.545745316074961,Baylor,Iowa State,4,4,NA,280120239,2008-01-12
12,1,18:27,2307,2307,Foul on Kevin Rogers,2,0,2,17,0.5460321953134282,0.5460321953134282,Baylor,Iowa State,4,4,NA,280120239,2008-01-12
13,1,18:10,2290,2290,Henry Dugat missed Two Point Jumper.,2,0,2,0,0.5464100314401936,0.5464100314401936,Baylor,Iowa State,4,4,NA,280120239,2008-01-12
14,1,18:10,2290,2290,Jiri Hubalek Defensive Rebound.,2,0,2,19,0.5464100314401936,0.5464100314401936,Baylor,Iowa State,4,4,NA,280120239,2008-01-12
15,1,17:51,2271,2271,Jiri Hubalek made Two Point Layup.,2,2,0,1,0.5,0.5,Baylor,Iowa State,4,4,NA,280120239,2008-01-12
16,1,17:50,2270,2270,Foul on Josh Lomers,2,2,0,0,0.5,0.5,Baylor,Iowa State,4,4,NA,280120239,2008-01-12
17,1,17:50,2270,2270,Jiri Hubalek made Free Throw.,2,3,-1,13,0.4765192710882224,0.4765192710882224,Baylor,Iowa State,4,4,NA,280120239,2008-01-12
18,1,17:37,2257,2257,Henry Dugat made Three Point Jumper.,5,3,2,30,0.5471512577612353,0.5471512577612353,Baylor,Iowa State,4,4,NA,280120239,2008-01-12
19,1,17:07,2227,2227,Bryan Petersen missed Two Point Jumper.,5,3,2,0,0.5478326863301047,0.5478326863301047,Baylor,Iowa State,4,4,NA,280120239,2008-01-12
20,1,17:07,2227,2227,Henry Dugat Defensive Rebound.,5,3,2,0,0.5478326863301047,0.5478326863301047,Baylor,Iowa State,4,4,NA,280120239,2008-01-12
21,1,17:07,2227,2227,Foul on Bryan Petersen,5,3,2,0,0.5478326863301047,0.5478326863301047,Baylor,Iowa State,4,4,NA,280120239,2008-01-12
22,1,17:07,2227,2227,Henry Dugat made Free Throw.,6,3,3,0,0.5714761792196995,0.5714761792196995,Baylor,Iowa State,4,4,NA,280120239,2008-01-12
23,1,17:07,2227,2227,Henry Dugat made Free Throw.,7,3,4,14,0.5947977961671022,0.5947977961671022,Baylor,Iowa State,4,4,NA,280120239,2008-01-12
24,1,16:53,2213,2213,Foul on Wesley Johnson,7,3,4,0,0.5954204863854143,0.5954204863854143,Baylor,Iowa State,4,4,NA,280120239,2008-01-12
25,1,16:53,2213,2213,Kevin Rogers made Free Throw.,8,3,5,0,0.6184618015703488,0.6184618015703488,Baylor,Iowa State,4,4,NA,280120239,2008-01-12
26,1,16:53,2213,2213,Kevin Rogers made Free Throw.,9,3,6,24,0.6409821150800418,0.6409821150800418,Baylor,Iowa State,4,4,NA,280120239,2008-01-12
27,1,16:29,2189,2189,Craig Brackins missed Two Point Jumper.,9,3,6,0,0.6425171362015442,0.6425171362015442,Baylor,Iowa State,4,4,NA,280120239,2008-01-12
28,1,16:29,2189,2189,Henry Dugat Defensive Rebound.,9,3,6,17,0.6425171362015442,0.6425171362015442,Baylor,Iowa State,4,4,NA,280120239,2008-01-12
29,1,16:12,2172,2172,Henry Dugat missed Two Point Jumper.,9,3,6,0,0.6436072648286494,0.6436072648286494,Baylor,Iowa State,4,4,NA,280120239,2008-01-12
30,1,16:12,2172,2172,Kevin Rogers Offensive Rebound.,9,3,6,0,0.6436072648286494,0.6436072648286494,Baylor,Iowa State,4,4,NA,280120239,2008-01-12
31,1,16:12,2172,2172,Kevin Rogers made Two Point Layup.,11,3,8,5,0.6874176003840284,0.6874176003840284,Baylor,Iowa State,4,4,NA,280120239,2008-01-12
32,1,16:07,2167,2167,Diante Garrett missed Two Point Jumper.,11,3,8,0,0.6878184723339954,0.6878184723339954,Baylor,Iowa State,4,4,NA,280120239,2008-01-12
33,1,16:07,2167,2167,Curtis Jerrells Defensive Rebound.,11,3,8,2,0.6878184723339954,0.6878184723339954,Baylor,Iowa State,4,4,NA,280120239,2008-01-12
34,1,16:05,2165,2165,Foul on Jiri Hubalek,11,3,8,11,0.6879789139401994,0.6879789139401994,Baylor,Iowa State,4,4,NA,280120239,2008-01-12
35,1,15:54,2154,2154,Aaron Bruce missed Two Point Layup.,11,3,8,0,0.6888624414968159,0.6888624414968159,Baylor,Iowa State,4,4,NA,280120239,2008-01-12
36,1,15:54,2154,2154,Diante Garrett Defensive Rebound.,11,3,8,9,0.6888624414968159,0.6888624414968159,Baylor,Iowa State,4,4,NA,280120239,2008-01-12
37,1,15:45,2145,2145,Wesley Johnson missed Three Point Jumper.,11,3,8,0,0.689586778589086,0.689586778589086,Baylor,Iowa State,4,4,NA,280120239,2008-01-12
38,1,15:45,2145,2145,Henry Dugat Defensive Rebound.,11,3,8,19,0.689586778589086,0.689586778589086,Baylor,Iowa State,4,4,NA,280120239,2008-01-12
39,1,15:26,2126,2126,Aaron Bruce missed Three Point Jumper.,11,3,8,0,0.6911205760223713,0.6911205760223713,Baylor,Iowa State,4,4,NA,280120239,2008-01-12
40,1,15:26,2126,2126,Rahshon Clark Defensive Rebound.,11,3,8,16,0.6911205760223713,0.6911205760223713,Baylor,Iowa State,4,4,NA,280120239,2008-01-12
41,1,15:10,2110,2110,Wesley Johnson missed Two Point Jumper.,11,3,8,0,0.6924174955816009,0.6924174955816009,Baylor,Iowa State,4,4,NA,280120239,2008-01-12
42,1,15:10,2110,2110,Aaron Bruce Defensive Rebound.,11,3,8,9,0.6924174955816009,0.6924174955816009,Baylor,Iowa State,4,4,NA,280120239,2008-01-12
43,1,15:01,2101,2101,Curtis Jerrells missed Three Point Jumper.,11,3,8,0,0.6931493076252296,0.6931493076252296,Baylor,Iowa State,4,4,NA,280120239,2008-01-12
44,1,15:01,2101,2101,Wesley Johnson Defensive Rebound.,11,3,8,9,0.6931493076252296,0.6931493076252296,Baylor,Iowa State,4,4,NA,280120239,2008-01-12
45,1,14:52,2092,2092,Rahshon Clark made Two Point Layup.,11,5,6,0,0.648796093793076,0.648796093793076,Baylor,Iowa State,4,4,NA,280120239,2008-01-12
46,1,14:52,2092,2092,Foul on Kevin Rogers,11,5,6,0,0.648796093793076,0.648796093793076,Baylor,Iowa State,4,4,NA,280120239,2008-01-12
47,1,14:52,2092,2092,Official TV Timeout.,11,5,6,19,0.648796093793076,0.648796093793076,Baylor,Iowa State,4,4,NA,280120239,2008-01-12
48,1,14:33,2073,2073,Rahshon Clark made Free Throw.,11,6,5,7,0.6262214581998076,0.6262214581998076,Baylor,Iowa State,4,4,NA,280120239,2008-01-12
49,1,14:26,2066,2066,Demond Carter made Three Point Jumper.,14,6,8,56,0.6960124662697538,0.6960124662697538,Baylor,Iowa State,4,4,NA,280120239,2008-01-12
50,1,13:30,2010,2010,Rahshon Clark missed Three Point Jumper.,14,6,8,0,0.7006586713646552,0.7006586713646552,Baylor,Iowa State,4,4,NA,280120239,2008-01-12
51,1,13:30,2010,2010,Henry Dugat Defensive Rebound.,14,6,8,6,0.7006586713646552,0.7006586713646552,Baylor,Iowa State,4,4,NA,280120239,2008-01-12
52,1,13:24,2004,2004,Alex Thompson missed Two Point Jumper.,14,6,8,1,0.7011617990539618,0.7011617990539618,Baylor,Iowa State,4,4,NA,280120239,2008-01-12
53,1,13:23,2003,2003,Mamadou Diene Defensive Rebound.,14,6,8,18,0.7012457605105905,0.7012457605105905,Baylor,Iowa State,4,4,NA,280120239,2008-01-12
54,1,13:05,1985,1985,LaceDarius Dunn missed Two Point Jumper.,14,6,8,0,0.7027624146276797,0.7027624146276797,Baylor,Iowa State,4,4,NA,280120239,2008-01-12
55,1,13:05,1985,1985,Baylor Offensive Rebound.,14,6,8,16,0.7027624146276797,0.7027624146276797,Baylor,Iowa State,4,4,NA,280120239,2008-01-12
56,1,12:49,1969,1969,Mamadou Diene missed Two Point Layup.,14,6,8,0,0.7041193400015773,0.7041193400015773,Baylor,Iowa State,4,4,NA,280120239,2008-01-12
57,1,12:49,1969,1969,Curtis Jerrells Offensive Rebound.,14,6,8,8,0.7041193400015773,0.7041193400015773,Baylor,Iowa State,4,4,NA,280120239,2008-01-12
58,1,12:41,1961,1961,Delbert Simpson missed Two Point Jumper.,14,6,8,1,0.7048010224284424,0.7048010224284424,Baylor,Iowa State,4,4,NA,280120239,2008-01-12
59,1,12:40,1960,1960,Bryan Petersen Defensive Rebound.,14,6,8,14,0.7048863869091847,0.7048863869091847,Baylor,Iowa State,4,4,NA,280120239,2008-01-12
60,1,12:26,1946,1946,Wesley Johnson missed Two Point Jumper.,14,6,8,0,0.7060851561468031,0.7060851561468031,Baylor,Iowa State,4,4,NA,280120239,2008-01-12
61,1,12:26,1946,1946,Alex Thompson Offensive Rebound.,14,6,8,9,0.7060851561468031,0.7060851561468031,Baylor,Iowa State,4,4,NA,280120239,2008-01-12
62,1,12:17,1937,1937,Alex Thompson missed Two Point Layup.,14,6,8,0,0.7068594779847691,0.7068594779847691,Baylor,Iowa State,4,4,NA,280120239,2008-01-12
63,1,12:17,1937,1937,Alex Thompson Offensive Rebound.,14,6,8,10,0.7068594779847691,0.7068594779847691,Baylor,Iowa State,4,4,NA,280120239,2008-01-12
64,1,12:07,1927,1927,Foul on Mamadou Diene,14,6,8,0,0.7077229949453061,0.7077229949453061,Baylor,Iowa State,4,4,NA,280120239,2008-01-12
65,1,12:07,1927,1927,Diante Garrett made Free Throw.,14,7,7,0,0.6843438312902609,0.6843438312902609,Baylor,Iowa State,4,4,NA,280120239,2008-01-12
66,1,12:07,1927,1927,Diante Garrett missed Free Throw.,14,7,7,0,0.6843438312902609,0.6843438312902609,Baylor,Iowa State,4,4,NA,280120239,2008-01-12
67,1,12:07,1927,1927,Mamadou Diene Defensive Rebound.,14,7,7,28,0.6843438312902609,0.6843438312902609,Baylor,Iowa State,4,4,NA,280120239,2008-01-12
68,1,11:39,1899,1899,Demond Carter missed Three Point Jumper.,14,7,7,0,0.6865453575648589,0.6865453575648589,Baylor,Iowa State,4,4,NA,280120239,2008-01-12
69,1,11:39,1899,1899,Rahshon Clark Defensive Rebound.,14,7,7,14,0.6865453575648589,0.6865453575648589,Baylor,Iowa State,4,4,NA,280120239,2008-01-12
70,1,11:25,1885,1885,Diante Garrett made Two Point Jumper.,14,9,5,7,0.6372980292225877,0.6372980292225877,Baylor,Iowa State,4,4,NA,280120239,2008-01-12
71,1,11:18,1878,1878,Foul on Bryan Petersen,14,9,5,5,0.6377192408456538,0.6377192408456538,Baylor,Iowa State,4,4,NA,280120239,2008-01-12
72,1,11:13,1873,1873,LaceDarius Dunn missed Two Point Jumper.,14,9,5,0,0.6380201681050249,0.6380201681050249,Baylor,Iowa State,4,4,NA,280120239,2008-01-12
73,1,11:13,1873,1873,null,14,9,5,22,0.6380201681050249,0.6380201681050249,Baylor,Iowa State,4,4,NA,280120239,2008-01-12
74,1,10:51,1851,1851,Wesley Johnson made Two Point Layup.,14,11,3,20,0.5850443944335846,0.5850443944335846,Baylor,Iowa State,4,4,NA,280120239,2008-01-12
75,1,10:31,1831,1831,Delbert Simpson missed Two Point Jumper.,14,11,3,0,0.5858092743194963,0.5858092743194963,Baylor,Iowa State,4,4,NA,280120239,2008-01-12
76,1,10:31,1831,1831,Wesley Johnson Defensive Rebound.,14,11,3,12,0.5858092743194963,0.5858092743194963,Baylor,Iowa State,4,4,NA,280120239,2008-01-12
77,1,10:19,1819,1819,Sean Haluska missed Three Point Jumper.,14,11,3,0,0.586270734612061,0.586270734612061,Baylor,Iowa State,4,4,NA,280120239,2008-01-12
78,1,10:19,1819,1819,Wesley Johnson Offensive Rebound.,14,11,3,0,0.586270734612061,0.586270734612061,Baylor,Iowa State,4,4,NA,280120239,2008-01-12
79,1,10:19,1819,1819,Wesley Johnson missed Two Point Layup.,14,11,3,0,0.586270734612061,0.586270734612061,Baylor,Iowa State,4,4,NA,280120239,2008-01-12
80,1,10:19,1819,1819,Alex Thompson Offensive Rebound.,14,11,3,0,0.586270734612061,0.586270734612061,Baylor,Iowa State,4,4,NA,280120239,2008-01-12
81,1,10:19,1819,1819,Alex Thompson made Two Point Layup.,14,13,1,0,0.5290148550206016,0.5290148550206016,Baylor,Iowa State,4,4,NA,280120239,2008-01-12
82,1,10:19,1819,1819,Baylor Full Timeout.,14,13,1,15,0.5290148550206016,0.5290148550206016,Baylor,Iowa State,3,4,NA,280120239,2008-01-12
83,1,10:04,1804,1804,Curtis Jerrells missed Two Point Layup.,14,13,1,0,0.5292135580942247,0.5292135580942247,Baylor,Iowa State,3,4,NA,280120239,2008-01-12
84,1,10:04,1804,1804,Diante Garrett Defensive Rebound.,14,13,1,19,0.5292135580942247,0.5292135580942247,Baylor,Iowa State,3,4,NA,280120239,2008-01-12
85,1,9:45,1785,1785,Demond Carter missed Two Point Layup.,14,13,1,0,0.5294675855787017,0.5294675855787017,Baylor,Iowa State,3,4,NA,280120239,2008-01-12
86,1,9:45,1785,1785,Sean Haluska Defensive Rebound.,14,13,1,19,0.5294675855787017,0.5294675855787017,Baylor,Iowa State,3,4,NA,280120239,2008-01-12
87,1,9:26,1766,1766,Diante Garrett missed Two Point Layup.,14,13,1,0,0.529724719528124,0.529724719528124,Baylor,Iowa State,3,4,NA,280120239,2008-01-12
88,1,9:26,1766,1766,Curtis Jerrells Defensive Rebound.,14,13,1,0,0.529724719528124,0.529724719528124,Baylor,Iowa State,3,4,NA,280120239,2008-01-12
89,1,9:26,1766,1766,Curtis Jerrells made Two Point Layup.,16,13,3,32,0.5883425426209263,0.5883425426209263,Baylor,Iowa State,3,4,NA,280120239,2008-01-12
90,1,8:54,1734,1734,Josh Lomers missed Two Point Jumper.,16,13,3,0,0.5896298978570124,0.5896298978570124,Baylor,Iowa State,3,4,NA,280120239,2008-01-12
91,1,8:54,1734,1734,Rahshon Clark Defensive Rebound.,16,13,3,18,0.5896298978570124,0.5896298978570124,Baylor,Iowa State,3,4,NA,280120239,2008-01-12
92,1,8:36,1716,1716,Wesley Johnson made Two Point Jumper.,16,15,1,12,0.5304201544339168,0.5304201544339168,Baylor,Iowa State,3,4,NA,280120239,2008-01-12
93,1,8:24,1704,1704,Curtis Jerrells missed Two Point Jumper.,16,15,1,0,0.5305918842184905,0.5305918842184905,Baylor,Iowa State,3,4,NA,280120239,2008-01-12
94,1,8:24,1704,1704,Mark Shepherd Offensive Rebound.,16,15,1,0,0.5305918842184905,0.5305918842184905,Baylor,Iowa State,3,4,NA,280120239,2008-01-12
95,1,8:24,1704,1704,Foul on Sean Haluska,16,15,1,5,0.5305918842184905,0.5305918842184905,Baylor,Iowa State,3,4,NA,280120239,2008-01-12
96,1,8:19,1699,1699,Aaron Bruce made Three Point Jumper.,19,15,4,15,0.6203988554604486,0.6203988554604486,Baylor,Iowa State,3,4,NA,280120239,2008-01-12
97,1,8:04,1684,1684,Wesley Johnson made Two Point Jumper.,19,17,2,12,0.5615297099129639,0.5615297099129639,Baylor,Iowa State,3,4,NA,280120239,2008-01-12
98,1,7:52,1672,1672,Aaron Bruce missed Two Point Jumper.,19,17,2,0,0.5618701387645372,0.5618701387645372,Baylor,Iowa State,3,4,NA,280120239,2008-01-12
99,1,7:52,1672,1672,null,19,17,2,4,0.5618701387645372,0.5618701387645372,Baylor,Iowa State,3,4,NA,280120239,2008-01-12
100,1,7:48,1668,1668,Foul on Josh Lomers,19,17,2,29,0.561982358897591,0.561982358897591,Baylor,Iowa State,3,4,NA,280120239,2008-01-12
101,1,7:19,1639,1639,Wesley Johnson missed Three Point Jumper.,19,17,2,0,0.5627810774110841,0.5627810774110841,Baylor,Iowa State,3,4,NA,280120239,2008-01-12
102,1,7:19,1639,1639,Aaron Bruce Defensive Rebound.,19,17,2,7,0.5627810774110841,0.5627810774110841,Baylor,Iowa State,3,4,NA,280120239,2008-01-12
103,1,7:12,1632,1632,Foul on Diante Garrett,19,17,2,2,0.5629708675309129,0.5629708675309129,Baylor,Iowa State,3,4,NA,280120239,2008-01-12
104,1,7:10,1630,1630,Aaron Bruce missed Free Throw.,19,17,2,0,0.5630249406636559,0.5630249406636559,Baylor,Iowa State,3,4,NA,280120239,2008-01-12
105,1,7:10,1630,1630,Craig Brackins Defensive Rebound.,19,17,2,30,0.5630249406636559,0.5630249406636559,Baylor,Iowa State,3,4,NA,280120239,2008-01-12
106,1,6:40,1600,1600,Wesley Johnson missed Two Point Jumper.,19,17,2,0,0.5638312862407475,0.5638312862407475,Baylor,Iowa State,3,4,NA,280120239,2008-01-12
107,1,6:40,1600,1600,Henry Dugat Defensive Rebound.,19,17,2,56,0.5638312862407475,0.5638312862407475,Baylor,Iowa State,3,4,NA,280120239,2008-01-12
108,1,5:44,1544,1544,Henry Dugat missed Two Point Layup.,19,17,2,0,0.5653509298705144,0.5653509298705144,Baylor,Iowa State,3,4,NA,280120239,2008-01-12
109,1,5:44,1544,1544,Diante Garrett Defensive Rebound.,19,17,2,8,0.5653509298705144,0.5653509298705144,Baylor,Iowa State,3,4,NA,280120239,2008-01-12
110,1,5:36,1536,1536,Craig Brackins made Three Point Jumper.,19,20,-1,12,0.46707084094761714,0.46707084094761714,Baylor,Iowa State,3,4,NA,280120239,2008-01-12
111,1,5:24,1524,1524,LaceDarius Dunn missed Two Point Jumper.,19,20,-1,0,0.4668991816267446,0.4668991816267446,Baylor,Iowa State,3,4,NA,280120239,2008-01-12
112,1,5:24,1524,1524,Wesley Johnson Defensive Rebound.,19,20,-1,11,0.4668991816267446,0.4668991816267446,Baylor,Iowa State,3,4,NA,280120239,2008-01-12
113,1,5:13,1513,1513,Craig Brackins made Three Point Jumper.,19,23,-4,16,0.36982643173143404,0.36982643173143404,Baylor,Iowa State,3,4,NA,280120239,2008-01-12
114,1,4:57,1497,1497,Demond Carter made Three Point Jumper.,22,23,-1,21,0.4665008221178921,0.4665008221178921,Baylor,Iowa State,3,4,NA,280120239,2008-01-12
115,1,4:36,1476,1476,Wesley Johnson made Two Point Jumper.,22,25,-3,14,0.3997513081732286,0.3997513081732286,Baylor,Iowa State,3,4,NA,280120239,2008-01-12
116,1,4:22,1462,1462,Mamadou Diene missed Two Point Jumper.,22,25,-3,3,0.39910203497334307,0.39910203497334307,Baylor,Iowa State,3,4,NA,280120239,2008-01-12
117,1,4:19,1459,1459,Wesley Johnson Defensive Rebound.,22,25,-3,23,0.39896017050871213,0.39896017050871213,Baylor,Iowa State,3,4,NA,280120239,2008-01-12
118,1,3:56,1436,1436,Diante Garrett made Two Point Layup.,22,27,-5,8,0.3338887179211872,0.3338887179211872,Baylor,Iowa State,3,4,NA,280120239,2008-01-12
119,1,3:48,1428,1428,LaceDarius Dunn made Two Point Layup.,24,27,-3,12,0.39748684697140607,0.39748684697140607,Baylor,Iowa State,3,4,NA,280120239,2008-01-12
120,1,3:36,1416,1416,Rahshon Clark missed Three Point Jumper.,24,27,-3,0,0.3969368363875747,0.3969368363875747,Baylor,Iowa State,3,4,NA,280120239,2008-01-12
121,1,3:36,1416,1416,Henry Dugat Defensive Rebound.,24,27,-3,13,0.3969368363875747,0.3969368363875747,Baylor,Iowa State,3,4,NA,280120239,2008-01-12
122,1,3:23,1403,1403,LaceDarius Dunn missed Two Point Jumper.,24,27,-3,0,0.3963518061381954,0.3963518061381954,Baylor,Iowa State,3,4,NA,280120239,2008-01-12
123,1,3:23,1403,1403,null,24,27,-3,1,0.3963518061381954,0.3963518061381954,Baylor,Iowa State,3,4,NA,280120239,2008-01-12
124,1,3:22,1402,1402,Henry Dugat made Three Point Jumper.,27,27,0,14,0.5,0.5,Baylor,Iowa State,3,4,NA,280120239,2008-01-12
125,1,3:08,1388,1388,Diante Garrett missed Two Point Jumper.,27,27,0,0,0.5,0.5,Baylor,Iowa State,3,4,NA,280120239,2008-01-12
126,1,3:08,1388,1388,Henry Dugat Defensive Rebound.,27,27,0,13,0.5,0.5,Baylor,Iowa State,3,4,NA,280120239,2008-01-12
127,1,2:55,1375,1375,Henry Dugat missed Two Point Layup.,27,27,0,0,0.5,0.5,Baylor,Iowa State,3,4,NA,280120239,2008-01-12
128,1,2:55,1375,1375,Curtis Jerrells Defensive Rebound.,27,27,0,1,0.5,0.5,Baylor,Iowa State,3,4,NA,280120239,2008-01-12
129,1,2:54,1374,1374,Henry Dugat missed Two Point Layup.,27,27,0,5,0.5,0.5,Baylor,Iowa State,3,4,NA,280120239,2008-01-12
130,1,2:49,1369,1369,Diante Garrett Defensive Rebound.,27,27,0,2,0.5,0.5,Baylor,Iowa State,3,4,NA,280120239,2008-01-12
131,1,2:47,1367,1367,Craig Brackins made Three Point Jumper.,27,30,-3,22,0.39476500218726407,0.39476500218726407,Baylor,Iowa State,3,4,NA,280120239,2008-01-12
132,1,2:25,1345,1345,Demond Carter made Two Point Layup.,29,30,-1,25,0.46411388959020294,0.46411388959020294,Baylor,Iowa State,3,4,NA,280120239,2008-01-12
133,1,2:00,1320,1320,Craig Brackins made Three Point Jumper.,29,33,-4,10,0.3586057159782127,0.3586057159782127,Baylor,Iowa State,3,4,NA,280120239,2008-01-12
134,1,1:50,1310,1310,Curtis Jerrells missed Three Point Jumper.,29,33,-4,0,0.3580163270779545,0.3580163270779545,Baylor,Iowa State,3,4,NA,280120239,2008-01-12
135,1,1:50,1310,1310,Sean Haluska Defensive Rebound.,29,33,-4,16,0.3580163270779545,0.3580163270779545,Baylor,Iowa State,3,4,NA,280120239,2008-01-12
136,1,1:34,1294,1294,Craig Brackins missed Three Point Jumper.,29,33,-4,0,0.3570509589584564,0.3570509589584564,Baylor,Iowa State,3,4,NA,280120239,2008-01-12
137,1,1:34,1294,1294,Rahshon Clark Offensive Rebound.,29,33,-4,5,0.3570509589584564,0.3570509589584564,Baylor,Iowa State,3,4,NA,280120239,2008-01-12
138,1,1:29,1289,1289,Wesley Johnson missed Two Point Layup.,29,33,-4,0,0.35674267576301516,0.35674267576301516,Baylor,Iowa State,3,4,NA,280120239,2008-01-12
139,1,1:29,1289,1289,Rahshon Clark Offensive Rebound.,29,33,-4,6,0.35674267576301516,0.35674267576301516,Baylor,Iowa State,3,4,NA,280120239,2008-01-12
140,1,1:23,1283,1283,Rahshon Clark made Two Point Layup.,29,35,-6,27,0.29178211080127575,0.29178211080127575,Baylor,Iowa State,3,4,NA,280120239,2008-01-12
141,1,0:56,1256,1256,Craig Brackins made Two Point Layup.,29,37,-8,2,0.23188821865305023,0.23188821865305023,Baylor,Iowa State,3,4,NA,280120239,2008-01-12
142,1,0:54,1254,1254,Foul on Mamadou Diene,29,37,-8,0,0.23167713173355406,0.23167713173355406,Baylor,Iowa State,3,4,NA,280120239,2008-01-12
143,1,0:54,1254,1254,Craig Brackins made Free Throw.,29,38,-9,9,0.2060791452238799,0.2060791452238799,Baylor,Iowa State,3,4,NA,280120239,2008-01-12
144,1,0:45,1245,1245,Foul on Sean Haluska,29,38,-9,0,0.20508207744675966,0.20508207744675966,Baylor,Iowa State,3,4,NA,280120239,2008-01-12
145,1,0:45,1245,1245,Curtis Jerrells missed Free Throw.,29,38,-9,0,0.20508207744675966,0.20508207744675966,Baylor,Iowa State,3,4,NA,280120239,2008-01-12
146,1,0:45,1245,1245,Mark Shepherd Offensive Rebound.,29,38,-9,5,0.20508207744675966,0.20508207744675966,Baylor,Iowa State,3,4,NA,280120239,2008-01-12
147,1,0:40,1240,1240,Curtis Jerrells missed Two Point Layup.,29,38,-9,0,0.20451724544571317,0.20451724544571317,Baylor,Iowa State,3,4,NA,280120239,2008-01-12
148,1,0:40,1240,1240,Wesley Johnson Defensive Rebound.,29,38,-9,36,0.20451724544571317,0.20451724544571317,Baylor,Iowa State,3,4,NA,280120239,2008-01-12
149,1,0:04,1204,1204,Curtis Jerrells made Two Point Layup.,31,38,-7,4,0.25402938276774784,0.25402938276774784,Baylor,Iowa State,3,4,NA,280120239,2008-01-12
150,1,0:00,1200,1200,End of the 1st Half.,31,38,-7,0,0.2535798049742589,0.2535798049742589,Baylor,Iowa State,3,4,NA,280120239,2008-01-12
151,2,20:00,1200,1200,PLAY,31,38,-7,8,0.2535798049742589,0.2535798049742589,Baylor,Iowa State,4,4,NA,280120239,2008-01-12
152,2,19:52,1192,1192,Curtis Jerrells made Two Point Layup.,33,38,-5,14,0.3155060682828801,0.3155060682828801,Baylor,Iowa State,4,4,NA,280120239,2008-01-12
153,2,19:38,1178,1178,Jiri Hubalek missed Three Point Jumper.,33,38,-5,0,0.3142640273138082,0.3142640273138082,Baylor,Iowa State,4,4,NA,280120239,2008-01-12
154,2,19:38,1178,1178,Kevin Rogers Defensive Rebound.,33,38,-5,16,0.3142640273138082,0.3142640273138082,Baylor,Iowa State,4,4,NA,280120239,2008-01-12
155,2,19:22,1162,1162,Aaron Bruce missed Three Point Jumper.,33,38,-5,0,0.312875154850051,0.312875154850051,Baylor,Iowa State,4,4,NA,280120239,2008-01-12
156,2,19:22,1162,1162,Iowa State Defensive Rebound.,33,38,-5,25,0.312875154850051,0.312875154850051,Baylor,Iowa State,4,4,NA,280120239,2008-01-12
157,2,18:57,1137,1137,Jiri Hubalek missed Two Point Layup.,33,38,-5,0,0.3107424610882491,0.3107424610882491,Baylor,Iowa State,4,4,NA,280120239,2008-01-12
158,2,18:57,1137,1137,Josh Lomers Defensive Rebound.,33,38,-5,30,0.3107424610882491,0.3107424610882491,Baylor,Iowa State,4,4,NA,280120239,2008-01-12
159,2,18:27,1107,1107,Sean Haluska missed Two Point Jumper.,33,38,-5,7,0.3081861544858667,0.3081861544858667,Baylor,Iowa State,4,4,NA,280120239,2008-01-12
160,2,18:20,1100,1100,Kevin Rogers Defensive Rebound.,33,38,-5,10,0.3075823787190401,0.3075823787190401,Baylor,Iowa State,4,4,NA,280120239,2008-01-12
161,2,18:10,1090,1090,Henry Dugat made Two Point Jumper.,35,38,-3,23,0.3800528387643868,0.3800528387643868,Baylor,Iowa State,4,4,NA,280120239,2008-01-12
162,2,17:47,1067,1067,Foul on Josh Lomers,35,38,-3,9,0.3786840529510994,0.3786840529510994,Baylor,Iowa State,4,4,NA,280120239,2008-01-12
163,2,17:38,1058,1058,Craig Brackins made Two Point Jumper.,35,40,-5,28,0.30382438678390017,0.30382438678390017,Baylor,Iowa State,4,4,NA,280120239,2008-01-12
164,2,17:10,1030,1030,Kevin Rogers missed Three Point Jumper.,35,40,-5,0,0.30111979128970295,0.30111979128970295,Baylor,Iowa State,4,4,NA,280120239,2008-01-12
165,2,17:10,1030,1030,Bryan Petersen Defensive Rebound.,35,40,-5,19,0.30111979128970295,0.30111979128970295,Baylor,Iowa State,4,4,NA,280120239,2008-01-12
166,2,16:51,1011,1011,Rahshon Clark missed Two Point Jumper.,35,40,-5,0,0.29915742550330054,0.29915742550330054,Baylor,Iowa State,4,4,NA,280120239,2008-01-12
167,2,16:51,1011,1011,Kevin Rogers Defensive Rebound.,35,40,-5,8,0.29915742550330054,0.29915742550330054,Baylor,Iowa State,4,4,NA,280120239,2008-01-12
168,2,16:43,1003,1003,Foul on Rahshon Clark,35,40,-5,1,0.29829512157172194,0.29829512157172194,Baylor,Iowa State,4,4,NA,280120239,2008-01-12
169,2,16:42,1002,1002,Kevin Rogers missed Two Point Jumper.,35,40,-5,0,0.2981857210677512,0.2981857210677512,Baylor,Iowa State,4,4,NA,280120239,2008-01-12
170,2,16:42,1002,1002,Jiri Hubalek Defensive Rebound.,35,40,-5,17,0.2981857210677512,0.2981857210677512,Baylor,Iowa State,4,4,NA,280120239,2008-01-12
171,2,16:25,985,985,Wesley Johnson missed Two Point Jumper.,35,40,-5,0,0.29626764366124836,0.29626764366124836,Baylor,Iowa State,4,4,NA,280120239,2008-01-12
172,2,16:25,985,985,Kevin Rogers Defensive Rebound.,35,40,-5,27,0.29626764366124836,0.29626764366124836,Baylor,Iowa State,4,4,NA,280120239,2008-01-12
173,2,15:58,958,958,Jiri Hubalek made Two Point Jumper.,35,42,-7,20,0.22568973053579455,0.22568973053579455,Baylor,Iowa State,4,4,NA,280120239,2008-01-12
174,2,15:38,938,938,Foul on Craig Brackins,35,42,-7,1,0.22314014468860896,0.22314014468860896,Baylor,Iowa State,4,4,NA,280120239,2008-01-12
175,2,15:37,937,937,Kevin Rogers made Free Throw.,36,42,-6,0,0.25543203796484243,0.25543203796484243,Baylor,Iowa State,4,4,NA,280120239,2008-01-12
176,2,15:37,937,937,Kevin Rogers made Free Throw.,37,42,-5,11,0.29079216979609346,0.29079216979609346,Baylor,Iowa State,4,4,NA,280120239,2008-01-12
177,2,15:26,926,926,Craig Brackins made Two Point Layup.,37,44,-7,15,0.22172907732062674,0.22172907732062674,Baylor,Iowa State,4,4,NA,280120239,2008-01-12
