play_id,half,time_remaining_half,secs_remaining,secs_remaining_absolute,description,home_score,away_score,score_diff,play_length,win_prob,naive_win_prob,home,away,home_time_out_remaining,away_time_out_remaining,home_favored_by,game_id,date
178,2,15:11,911,911,Aaron Bruce made Two Point Jumper.,39,44,-5,18,0.2882687743672249,0.2882687743672249,Baylor,Iowa State,4,4,NA,280120239,2008-01-12
179,2,14:53,893,893,Iowa State Full Timeout.,39,44,-5,22,0.28663158202901007,0.28663158202901007,Baylor,Iowa State,4,3,NA,280120239,2008-01-12
180,2,14:31,871,871,Kevin Rogers made Two Point Layup.,41,44,-3,0,0.365205244751937,0.365205244751937,Baylor,Iowa State,4,3,NA,280120239,2008-01-12
181,2,14:31,871,871,Foul on Wesley Johnson,41,44,-3,0,0.365205244751937,0.365205244751937,Baylor,Iowa State,4,3,NA,280120239,2008-01-12
182,2,14:31,871,871,Kevin Rogers made Free Throw.,42,44,-2,30,0.40888866493516696,0.40888866493516696,Baylor,Iowa State,4,3,NA,280120239,2008-01-12
183,2,14:01,841,841,Kevin Rogers missed Two Point Layup.,42,44,-2,15,0.40758102800626095,0.40758102800626095,Baylor,Iowa State,4,3,NA,280120239,2008-01-12
184,2,13:46,826,826,Diante Garrett missed Two Point Layup.,42,44,-2,0,0.4068802306990718,0.4068802306990718,Baylor,Iowa State,4,3,NA,280120239,2008-01-12
185,2,13:46,826,826,Kevin Rogers Defensive Rebound.,42,44,-2,1,0.4068802306990718,0.4068802306990718,Baylor,Iowa State,4,3,NA,280120239,2008-01-12
186,2,13:45,825,825,Craig Brackins Defensive Rebound.,42,44,-2,14,0.4068319235447444,0.4068319235447444,Baylor,Iowa State,4,3,NA,280120239,2008-01-12
187,2,13:31,811,811,Aaron Bruce made Two Point Jumper.,44,44,0,20,0.5,0.5,Baylor,Iowa State,4,3,NA,280120239,2008-01-12
188,2,13:11,791,791,Rahshon Clark missed Three Point Jumper.,44,44,0,0,0.5,0.5,Baylor,Iowa State,4,3,NA,280120239,2008-01-12
189,2,13:11,791,791,Henry Dugat Defensive Rebound.,44,44,0,10,0.5,0.5,Baylor,Iowa State,4,3,NA,280120239,2008-01-12
190,2,13:01,781,781,Aaron Bruce made Three Point Jumper.,47,44,3,19,0.6411908743523543,0.6411908743523543,Baylor,Iowa State,4,3,NA,280120239,2008-01-12
191,2,12:42,762,762,Foul on Henry Dugat,47,44,3,4,0.6429795982025609,0.6429795982025609,Baylor,Iowa State,4,3,NA,280120239,2008-01-12
192,2,12:38,758,758,Henry Dugat made Two Point Layup.,49,44,5,0,0.727797679483552,0.727797679483552,Baylor,Iowa State,4,3,NA,280120239,2008-01-12
193,2,12:38,758,758,Foul on Diante Garrett,49,44,5,5,0.727797679483552,0.727797679483552,Baylor,Iowa State,4,3,NA,280120239,2008-01-12
194,2,12:33,753,753,Iowa State Full Timeout.,49,44,5,0,0.7285483890484034,0.7285483890484034,Baylor,Iowa State,4,2,NA,280120239,2008-01-12
195,2,12:33,753,753,Henry Dugat missed Free Throw.,49,44,5,0,0.7285483890484034,0.7285483890484034,Baylor,Iowa State,4,2,NA,280120239,2008-01-12
196,2,12:33,753,753,Wesley Johnson Defensive Rebound.,49,44,5,16,0.7285483890484034,0.7285483890484034,Baylor,Iowa State,4,2,NA,280120239,2008-01-12
197,2,12:17,737,737,Foul on Mamadou Diene,49,44,5,3,0.7311183160943175,0.7311183160943175,Baylor,Iowa State,4,2,NA,280120239,2008-01-12
198,2,12:14,734,734,Jiri Hubalek made Free Throw.,49,45,4,0,0.6904720769312495,0.6904720769312495,Baylor,Iowa State,4,2,NA,280120239,2008-01-12
199,2,12:14,734,734,Jiri Hubalek made Free Throw.,49,46,3,12,0.6460555289554031,0.6460555289554031,Baylor,Iowa State,4,2,NA,280120239,2008-01-12
200,2,12:02,722,722,Kevin Rogers made Two Point Jumper.,51,46,5,22,0.7336960410075496,0.7336960410075496,Baylor,Iowa State,4,2,NA,280120239,2008-01-12
201,2,11:40,700,700,Official TV Timeout.,49,46,3,14,0.6498679023654729,0.6498679023654729,Baylor,Iowa State,4,2,NA,280120239,2008-01-12
202,2,11:26,686,686,Kevin Rogers made Two Point Layup.,53,46,7,36,0.8110752784002231,0.8110752784002231,Baylor,Iowa State,4,2,NA,280120239,2008-01-12
203,2,10:50,650,650,Henry Dugat made Three Point Jumper.,56,46,10,44,0.8937739533321196,0.8937739533321196,Baylor,Iowa State,4,2,NA,280120239,2008-01-12
204,2,10:06,606,606,Demond Carter made Three Point Jumper.,59,46,13,6,0.9455532035551606,0.9455532035551606,Baylor,Iowa State,4,2,NA,280120239,2008-01-12
205,2,10:00,600,600,Iowa State Full Timeout.,59,46,13,41,0.9462523135935662,0.9462523135935662,Baylor,Iowa State,4,1,NA,280120239,2008-01-12
206,2,9:19,559,559,Kevin Rogers missed Two Point Jumper.,59,46,13,0,0.9517835586784117,0.9517835586784117,Baylor,Iowa State,4,1,NA,280120239,2008-01-12
207,2,9:19,559,559,Jiri Hubalek Defensive Rebound.,59,46,13,16,0.9517835586784117,0.9517835586784117,Baylor,Iowa State,4,1,NA,280120239,2008-01-12
208,2,9:03,543,543,Foul on Mamadou Diene,59,46,13,12,0.9542669977521284,0.9542669977521284,Baylor,Iowa State,4,1,NA,280120239,2008-01-12
209,2,8:51,531,531,Foul on Demond Carter,59,46,13,13,0.9558696019623595,0.9558696019623595,Baylor,Iowa State,4,1,NA,280120239,2008-01-12
210,2,8:38,518,518,Alex Thompson missed Two Point Jumper.,59,46,13,0,0.9573725938399615,0.9573725938399615,Baylor,Iowa State,4,1,NA,280120239,2008-01-12
211,2,8:38,518,518,LaceDarius Dunn Defensive Rebound.,59,46,13,25,0.9573725938399615,0.9573725938399615,Baylor,Iowa State,4,1,NA,280120239,2008-01-12
212,2,8:13,493,493,Foul on Rahshon Clark,59,46,13,3,0.9599602841688822,0.9599602841688822,Baylor,Iowa State,4,1,NA,280120239,2008-01-12
213,2,8:10,490,490,Foul on Josh Lomers,59,46,13,23,0.9602681719388169,0.9602681719388169,Baylor,Iowa State,4,1,NA,280120239,2008-01-12
214,2,7:47,467,467,LaceDarius Dunn missed Three Point Jumper.,59,46,13,0,0.9627916488476981,0.9627916488476981,Baylor,Iowa State,4,1,NA,280120239,2008-01-12
215,2,7:47,467,467,Mark Shepherd Offensive Rebound.,59,46,13,1,0.9627916488476981,0.9627916488476981,Baylor,Iowa State,4,1,NA,280120239,2008-01-12
216,2,7:46,466,466,Official TV Timeout.,59,46,13,22,0.9629111905145984,0.9629111905145984,Baylor,Iowa State,4,1,NA,280120239,2008-01-12
217,2,7:24,444,444,Curtis Jerrells missed Two Point Jumper.,59,46,13,0,0.9658427363824321,0.9658427363824321,Baylor,Iowa State,4,1,NA,280120239,2008-01-12
218,2,7:24,444,444,Craig Brackins Defensive Rebound.,59,46,13,25,0.9658427363824321,0.9658427363824321,Baylor,Iowa State,4,1,NA,280120239,2008-01-12
219,2,6:59,419,419,Foul on Henry Dugat,59,46,13,0,0.9697910059486542,0.9697910059486542,Baylor,Iowa State,4,1,NA,280120239,2008-01-12
220,2,6:59,419,419,Wesley Johnson made Free Throw.,59,47,12,0,0.9609132007029451,0.9609132007029451,Baylor,Iowa State,4,1,NA,280120239,2008-01-12
221,2,6:59,419,419,Wesley Johnson missed Free Throw.,59,47,12,0,0.9609132007029451,0.9609132007029451,Baylor,Iowa State,4,1,NA,280120239,2008-01-12
222,2,6:59,419,419,null,59,47,12,0,0.9609132007029451,0.9609132007029451,Baylor,Iowa State,4,1,NA,280120239,2008-01-12
223,2,6:59,419,419,Wesley Johnson missed Free Throw.,59,47,12,0,0.9609132007029451,0.9609132007029451,Baylor,Iowa State,4,1,NA,280120239,2008-01-12
224,2,6:59,419,419,Cory Johnson Offensive Rebound.,59,47,12,2,0.9609132007029451,0.9609132007029451,Baylor,Iowa State,4,1,NA,280120239,2008-01-12
225,2,6:57,417,417,Foul on Kevin Rogers,59,47,12,0,0.9612598988136729,0.9612598988136729,Baylor,Iowa State,4,1,NA,280120239,2008-01-12
226,2,6:57,417,417,Wesley Johnson made Free Throw.,59,48,11,0,0.9499675209337796,0.9499675209337796,Baylor,Iowa State,4,1,NA,280120239,2008-01-12
227,2,6:57,417,417,Wesley Johnson made Free Throw.,59,49,10,33,0.9356040301210694,0.9356040301210694,Baylor,Iowa State,4,1,NA,280120239,2008-01-12
228,2,6:24,384,384,Craig Brackins made Three Point Jumper.,59,52,7,3,0.876363549789256,0.876363549789256,Baylor,Iowa State,4,1,NA,280120239,2008-01-12
229,2,6:21,381,381,Baylor Full Timeout.,59,52,7,4,0.8772105046412088,0.8772105046412088,Baylor,Iowa State,3,1,NA,280120239,2008-01-12
230,2,6:17,377,377,Aaron Bruce missed Two Point Jumper.,59,52,7,0,0.8783488618836292,0.8783488618836292,Baylor,Iowa State,3,1,NA,280120239,2008-01-12
231,2,6:17,377,377,Bryan Petersen Defensive Rebound.,59,52,7,9,0.8783488618836292,0.8783488618836292,Baylor,Iowa State,3,1,NA,280120239,2008-01-12
232,2,6:08,368,368,Bryan Petersen missed Three Point Jumper.,59,52,7,0,0.8809691611822218,0.8809691611822218,Baylor,Iowa State,3,1,NA,280120239,2008-01-12
233,2,6:08,368,368,Kevin Rogers Defensive Rebound.,59,52,7,15,0.8809691611822218,0.8809691611822218,Baylor,Iowa State,3,1,NA,280120239,2008-01-12
234,2,5:53,353,353,Kevin Rogers missed Two Point Jumper.,59,52,7,0,0.8856224708553957,0.8856224708553957,Baylor,Iowa State,3,1,NA,280120239,2008-01-12
235,2,5:53,353,353,Mamadou Diene Offensive Rebound.,59,52,7,19,0.8856224708553957,0.8856224708553957,Baylor,Iowa State,3,1,NA,280120239,2008-01-12
236,2,5:34,334,334,Craig Brackins made Two Point Dunk Shot.,59,54,5,28,0.8190843233277281,0.8190843233277281,Baylor,Iowa State,3,1,NA,280120239,2008-01-12
237,2,5:06,306,306,Curtis Jerrells made Two Point Jumper.,61,54,7,17,0.9038866189270177,0.9038866189270177,Baylor,Iowa State,3,1,NA,280120239,2008-01-12
238,2,4:49,289,289,Diante Garrett made Two Point Layup.,61,56,5,22,0.835380078298692,0.835380078298692,Baylor,Iowa State,3,1,NA,280120239,2008-01-12
239,2,4:27,267,267,Curtis Jerrells missed Three Point Jumper.,61,56,5,0,0.8327155792429773,0.8327155792429773,Baylor,Iowa State,3,1,NA,280120239,2008-01-12
240,2,4:27,267,267,Bryan Petersen Defensive Rebound.,61,56,5,16,0.8327155792429773,0.8327155792429773,Baylor,Iowa State,3,1,NA,280120239,2008-01-12
241,2,4:11,251,251,Cory Johnson missed Two Point Jumper.,61,56,5,0,0.8294131434744783,0.8294131434744783,Baylor,Iowa State,3,1,NA,280120239,2008-01-12
242,2,4:11,251,251,Henry Dugat Defensive Rebound.,61,56,5,9,0.8294131434744783,0.8294131434744783,Baylor,Iowa State,3,1,NA,280120239,2008-01-12
243,2,4:02,242,242,Henry Dugat missed Three Point Jumper.,61,56,5,0,0.8281837470632057,0.8281837470632057,Baylor,Iowa State,3,1,NA,280120239,2008-01-12
244,2,4:02,242,242,Cory Johnson Defensive Rebound.,61,56,5,20,0.8281837470632057,0.8281837470632057,Baylor,Iowa State,3,1,NA,280120239,2008-01-12
245,2,3:42,222,222,Cory Johnson missed Two Point Layup.,61,56,5,0,0.8299535541237678,0.8299535541237678,Baylor,Iowa State,3,1,NA,280120239,2008-01-12
246,2,3:42,222,222,Mamadou Diene Defensive Rebound.,61,56,5,31,0.8299535541237678,0.8299535541237678,Baylor,Iowa State,3,1,NA,280120239,2008-01-12
247,2,3:11,191,191,Curtis Jerrells made Two Point Layup.,63,56,7,10,0.9219589338418707,0.9219589338418707,Baylor,Iowa State,3,1,NA,280120239,2008-01-12
248,2,3:01,181,181,Wesley Johnson missed Two Point Jumper.,63,56,7,0,0.931852092833149,0.931852092833149,Baylor,Iowa State,3,1,NA,280120239,2008-01-12
249,2,3:01,181,181,Aaron Bruce Defensive Rebound.,63,56,7,32,0.931852092833149,0.931852092833149,Baylor,Iowa State,3,1,NA,280120239,2008-01-12
250,2,2:29,149,149,Aaron Bruce missed Two Point Layup.,63,56,7,0,0.9579639042367195,0.9579639042367195,Baylor,Iowa State,3,1,NA,280120239,2008-01-12
251,2,2:29,149,149,Craig Brackins Defensive Rebound.,63,56,7,4,0.9579639042367195,0.9579639042367195,Baylor,Iowa State,3,1,NA,280120239,2008-01-12
252,2,2:25,145,145,Official TV Timeout.,63,56,7,15,0.9607783534616383,0.9607783534616383,Baylor,Iowa State,3,1,NA,280120239,2008-01-12
253,2,2:10,130,130,Foul on Jiri Hubalek,63,56,7,0,0.9705303389510329,0.9705303389510329,Baylor,Iowa State,3,1,NA,280120239,2008-01-12
254,2,2:10,130,130,Mamadou Diene made Free Throw.,64,56,8,0,0.9819020518908254,0.9819020518908254,Baylor,Iowa State,3,1,NA,280120239,2008-01-12
255,2,2:10,130,130,Mamadou Diene made Free Throw.,65,56,9,14,0.9889356891764846,0.9889356891764846,Baylor,Iowa State,3,1,NA,280120239,2008-01-12
256,2,1:56,116,116,Jiri Hubalek missed Three Point Jumper.,65,56,9,0,0.9926383933048804,0.9926383933048804,Baylor,Iowa State,3,1,NA,280120239,2008-01-12
257,2,1:56,116,116,Craig Brackins Offensive Rebound.,65,56,9,2,0.9926383933048804,0.9926383933048804,Baylor,Iowa State,3,1,NA,280120239,2008-01-12
258,2,1:54,114,114,Craig Brackins missed Two Point Jumper.,65,56,9,1,0.9930909484840735,0.9930909484840735,Baylor,Iowa State,3,1,NA,280120239,2008-01-12
259,2,1:53,113,113,Kevin Rogers Defensive Rebound.,65,56,9,21,0.9933102256973604,0.9933102256973604,Baylor,Iowa State,3,1,NA,280120239,2008-01-12
260,2,1:32,92,92,Aaron Bruce made Two Point Jumper.,67,56,11,12,0.9991347056602206,0.9991347056602206,Baylor,Iowa State,3,1,NA,280120239,2008-01-12
261,2,1:20,80,80,Craig Brackins missed Three Point Jumper.,67,56,11,0,0.9995253476929828,0.9995253476929828,Baylor,Iowa State,3,1,NA,280120239,2008-01-12
262,2,1:20,80,80,Iowa State Offensive Rebound.,67,56,11,5,0.9995253476929828,0.9995253476929828,Baylor,Iowa State,3,1,NA,280120239,2008-01-12
263,2,1:15,75,75,Wesley Johnson missed Three Point Jumper.,67,56,11,0,0.9996353126192246,0.9996353126192246,Baylor,Iowa State,3,1,NA,280120239,2008-01-12
264,2,1:15,75,75,Jiri Hubalek Offensive Rebound.,67,56,11,7,0.9996353126192246,0.9996353126192246,Baylor,Iowa State,3,1,NA,280120239,2008-01-12
265,2,1:08,68,68,Jiri Hubalek made Two Point Layup.,67,58,9,0,0.9988805622095024,0.9988805622095024,Baylor,Iowa State,3,1,NA,280120239,2008-01-12
266,2,1:08,68,68,Iowa State Full Timeout.,67,58,9,32,0.9988805622095024,0.9988805622095024,Baylor,Iowa State,3,0,NA,280120239,2008-01-12
267,2,0:36,36,36,Curtis Jerrells missed Two Point Layup.,67,58,9,0,0.9997767159160386,0.9997767159160386,Baylor,Iowa State,3,0,NA,280120239,2008-01-12
268,2,0:36,36,36,Curtis Jerrells Offensive Rebound.,67,58,9,0,0.9997767159160386,0.9997767159160386,Baylor,Iowa State,3,0,NA,280120239,2008-01-12
269,2,0:36,36,36,Curtis Jerrells made Two Point Layup.,69,61,8,6,0.9994319590091987,0.9994319590091987,Baylor,Iowa State,3,0,NA,280120239,2008-01-12
270,2,0:30,30,30,Craig Brackins made Three Point Jumper.,67,61,6,1,0.9970651653895116,0.9970651653895116,Baylor,Iowa State,3,0,NA,280120239,2008-01-12
271,2,0:29,29,29,Foul on Richard Hurd,70,61,9,1,0.9998491364267251,0.9998491364267251,Baylor,Iowa State,3,0,NA,280120239,2008-01-12
272,2,0:28,28,28,Aaron Bruce made Free Throw.,70,61,9,0,0.9998574876294023,0.9998574876294023,Baylor,Iowa State,3,0,NA,280120239,2008-01-12
273,2,0:28,28,28,Aaron Bruce made Free Throw.,71,61,10,7,0.99994672192996,0.99994672192996,Baylor,Iowa State,3,0,NA,280120239,2008-01-12
274,2,0:21,21,21,Craig Brackins made Three Point Jumper.,71,64,7,2,0.999256091480364,0.999256091480364,Baylor,Iowa State,3,0,NA,280120239,2008-01-12
275,2,0:19,19,19,Foul on Diante Garrett,71,64,7,1,0.9993217888798495,0.9993217888798495,Baylor,Iowa State,3,0,NA,280120239,2008-01-12
276,2,0:18,18,18,Demond Carter made Free Throw.,72,64,8,0,0.9997731619232068,0.9997731619232068,Baylor,Iowa State,3,0,NA,280120239,2008-01-12
277,2,0:18,18,18,Demond Carter missed Free Throw.,72,64,8,0,0.9997731619232068,0.9997731619232068,Baylor,Iowa State,3,0,NA,280120239,2008-01-12
278,2,0:18,18,18,Rahshon Clark Defensive Rebound.,72,64,8,5,0.9997731619232068,0.9997731619232068,Baylor,Iowa State,3,0,NA,280120239,2008-01-12
279,2,0:13,13,13,Craig Brackins made Three Point Jumper.,72,67,5,8,0.9955704200149512,0.9955704200149512,Baylor,Iowa State,3,0,NA,280120239,2008-01-12
280,2,0:05,5,5,Demond Carter made Two Point Layup.,74,67,7,3,0.9996570472257066,0.9996570472257066,Baylor,Iowa State,3,0,NA,280120239,2008-01-12
281,2,0:02,2,2,null,74,67,7,2,0.9997054994279811,0.9997054994279811,Baylor,Iowa State,3,0,NA,280120239,2008-01-12
282,2,0:00,0,0,End Game,74,67,7,0,1,1,Baylor,Iowa State,3,0,NA,280120239,2008-01-12
