play_id,half,time_remaining_half,secs_remaining,secs_remaining_absolute,description,home_score,away_score,score_diff,play_length,win_prob,naive_win_prob,home,away,home_time_out_remaining,away_time_out_remaining,home_favored_by,game_id,date
1,1,20:00,2400,2400,PLAY,0,0,0,9,0.5,0.5,BYU,New Mexico,6,6,NA,310700252,2011-03-11
2,1,19:51,2391,2391,Drew Gordon missed Jumper.,0,0,0,0,0.5,0.5,BYU,New Mexico,6,6,NA,310700252,2011-03-11
3,1,19:51,2391,2391,Jackson Emery Defensive Rebound.,0,0,0,10,0.5,0.5,BYU,New Mexico,6,6,NA,310700252,2011-03-11
4,1,19:41,2381,2381,Noah Hartsock missed Jumper.,0,0,0,0,0.5,0.5,BYU,New Mexico,6,6,NA,310700252,2011-03-11
5,1,19:41,2381,2381,Brigham Young Offensive Rebound.,0,0,0,16,0.5,0.5,BYU,New Mexico,6,6,NA,310700252,2011-03-11
6,1,19:25,2365,2365,Jimmer Fredette missed Jumper.,0,0,0,0,0.5,0.5,BYU,New Mexico,6,6,NA,310700252,2011-03-11
7,1,19:25,2365,2365,Kyle Collinsworth Offensive Rebound.,0,0,0,12,0.5,0.5,BYU,New Mexico,6,6,NA,310700252,2011-03-11
8,1,19:13,2353,2353,Jackson Emery missed Three Point Jumper.,0,0,0,0,0.5,0.5,BYU,New Mexico,6,6,NA,310700252,2011-03-11
9,1,19:13,2353,2353,Charles Abouo Offensive Rebound.,0,0,0,7,0.5,0.5,BYU,New Mexico,6,6,NA,310700252,2011-03-11
10,1,19:06,2346,2346,Jimmer Fredette made Layup.,2,0,2,36,0.5451773968607259,0.5451773968607259,BYU,New Mexico,6,6,NA,310700252,2011-03-11
11,1,18:30,2310,2310,Foul on Jimmer Fredette,2,0,2,8,0.5459658291288992,0.5459658291288992,BYU,New Mexico,6,6,NA,310700252,2011-03-11
12,1,18:22,2302,2302,Kendall Williams made Three Point Jumper.  Assisted by Dairese Gary.,2,3,-1,11,0.4768791578380667,0.4768791578380667,BYU,New Mexico,6,6,NA,310700252,2011-03-11
13,1,18:11,2291,2291,Jimmer Fredette made Jumper.,4,3,1,10,0.5232439877846887,0.5232439877846887,BYU,New Mexico,6,6,NA,310700252,2011-03-11
14,1,18:01,2281,2281,A.J. Hardeman made Layup.  Assisted by Dairese Gary.,4,5,-1,5,0.4766435374630905,0.4766435374630905,BYU,New Mexico,6,6,NA,310700252,2011-03-11
15,1,17:56,2276,2276,Jimmer Fredette made Three Point Jumper.,7,5,2,26,0.5467233091847613,0.5467233091847613,BYU,New Mexico,6,6,NA,310700252,2011-03-11
16,1,17:30,2250,2250,A.J. Hardeman missed Jumper.,7,5,2,0,0.5473096679130885,0.5473096679130885,BYU,New Mexico,6,6,NA,310700252,2011-03-11
17,1,17:30,2250,2250,Jackson Emery Defensive Rebound.,7,5,2,12,0.5473096679130885,0.5473096679130885,BYU,New Mexico,6,6,NA,310700252,2011-03-11
18,1,17:18,2238,2238,Jimmer Fredette made Three Point Jumper.,10,5,5,18,0.6171018578559682,0.6171018578559682,BYU,New Mexico,6,6,NA,310700252,2011-03-11
19,1,17:00,2220,2220,Drew Gordon missed Layup.,10,5,5,0,0.6180802389217519,0.6180802389217519,BYU,New Mexico,6,6,NA,310700252,2011-03-11
20,1,17:00,2220,2220,Noah Hartsock Block.,10,5,5,3,0.6180802389217519,0.6180802389217519,BYU,New Mexico,6,6,NA,310700252,2011-03-11
21,1,16:57,2217,2217,Drew Gordon Offensive Rebound.,10,5,5,1,0.6182436970186944,0.6182436970186944,BYU,New Mexico,6,6,NA,310700252,2011-03-11
22,1,16:56,2216,2216,Foul on Kyle Collinsworth,10,5,5,1,0.618298206224493,0.618298206224493,BYU,New Mexico,6,6,NA,310700252,2011-03-11
23,1,16:55,2215,2215,Drew Gordon missed Free Throw.,10,5,5,0,0.6183527268036805,0.6183527268036805,BYU,New Mexico,6,6,NA,310700252,2011-03-11
24,1,16:55,2215,2215,null,10,5,5,0,0.6183527268036805,0.6183527268036805,BYU,New Mexico,6,6,NA,310700252,2011-03-11
25,1,16:55,2215,2215,Drew Gordon made Free Throw.,10,6,4,9,0.5953314058987561,0.5953314058987561,BYU,New Mexico,6,6,NA,310700252,2011-03-11
26,1,16:46,2206,2206,Jimmer Fredette missed Jumper.,10,6,4,0,0.5957325727086845,0.5957325727086845,BYU,New Mexico,6,6,NA,310700252,2011-03-11
27,1,16:46,2206,2206,Drew Gordon Defensive Rebound.,10,6,4,11,0.5957325727086845,0.5957325727086845,BYU,New Mexico,6,6,NA,310700252,2011-03-11
28,1,16:35,2195,2195,Foul on Jackson Emery,10,6,4,22,0.596223883198557,0.596223883198557,BYU,New Mexico,6,6,NA,310700252,2011-03-11
29,1,16:13,2173,2173,Dairese Gary missed Layup.,10,6,4,0,0.5972092644660071,0.5972092644660071,BYU,New Mexico,6,6,NA,310700252,2011-03-11
30,1,16:13,2173,2173,Charles Abouo Defensive Rebound.,10,6,4,9,0.5972092644660071,0.5972092644660071,BYU,New Mexico,6,6,NA,310700252,2011-03-11
31,1,16:04,2164,2164,Charles Abouo made Jumper.  Assisted by Jackson Emery.,12,6,6,17,0.6441210298892922,0.6441210298892922,BYU,New Mexico,6,6,NA,310700252,2011-03-11
32,1,15:47,2147,2147,Drew Gordon made Layup.,12,8,4,15,0.5983795776971534,0.5983795776971534,BYU,New Mexico,6,6,NA,310700252,2011-03-11
33,1,15:32,2132,2132,Noah Hartsock missed Jumper.,12,8,4,0,0.5990590511625028,0.5990590511625028,BYU,New Mexico,6,6,NA,310700252,2011-03-11
34,1,15:32,2132,2132,A.J. Hardeman Defensive Rebound.,12,8,4,22,0.5990590511625028,0.5990590511625028,BYU,New Mexico,6,6,NA,310700252,2011-03-11
35,1,15:10,2110,2110,Foul on Charles Abouo,12,8,4,0,0.6000618603830782,0.6000618603830782,BYU,New Mexico,6,6,NA,310700252,2011-03-11
36,1,15:10,2110,2110,Official TV Timeout.,12,8,4,0,0.6000618603830782,0.6000618603830782,BYU,New Mexico,6,6,NA,310700252,2011-03-11
37,1,15:10,2110,2110,A.J. Hardeman made Free Throw.,12,9,3,0,0.5754914317380757,0.5754914317380757,BYU,New Mexico,6,6,NA,310700252,2011-03-11
38,1,15:10,2110,2110,A.J. Hardeman made Free Throw.,12,10,2,15,0.5505421479818391,0.5505421479818391,BYU,New Mexico,6,6,NA,310700252,2011-03-11
39,1,14:55,2095,2095,Foul on Dairese Gary,12,10,2,7,0.5508970677165204,0.5508970677165204,BYU,New Mexico,6,6,NA,310700252,2011-03-11
40,1,14:48,2088,2088,Jackson Emery missed Jumper.,12,10,2,0,0.5510634392815655,0.5510634392815655,BYU,New Mexico,6,6,NA,310700252,2011-03-11
41,1,14:48,2088,2088,Drew Gordon Defensive Rebound.,12,10,2,17,0.5510634392815655,0.5510634392815655,BYU,New Mexico,6,6,NA,310700252,2011-03-11
42,1,14:31,2071,2071,Phillip McDonald made Dunk.,12,12,0,4,0.5,0.5,BYU,New Mexico,6,6,NA,310700252,2011-03-11
43,1,14:27,2067,2067,Jimmer Fredette made Jumper.,14,12,2,17,0.5515655296841933,0.5515655296841933,BYU,New Mexico,6,6,NA,310700252,2011-03-11
44,1,14:10,2050,2050,Phillip McDonald made Three Point Jumper.  Assisted by Kendall Williams.,14,15,-1,16,0.4739417061143947,0.4739417061143947,BYU,New Mexico,6,6,NA,310700252,2011-03-11
45,1,13:54,2034,2034,Foul on A.J. Hardeman,14,15,-1,5,0.4737457352982908,0.4737457352982908,BYU,New Mexico,6,6,NA,310700252,2011-03-11
46,1,13:49,2029,2029,Jimmer Fredette missed Three Point Jumper.,14,15,-1,0,0.4736841811083096,0.4736841811083096,BYU,New Mexico,6,6,NA,310700252,2011-03-11
47,1,13:49,2029,2029,Charles Abouo Offensive Rebound.,14,15,-1,3,0.4736841811083096,0.4736841811083096,BYU,New Mexico,6,6,NA,310700252,2011-03-11
48,1,13:46,2026,2026,Foul on Phillip McDonald,14,15,-1,1,0.4736471753455028,0.4736471753455028,BYU,New Mexico,6,6,NA,310700252,2011-03-11
49,1,13:45,2025,2025,Noah Hartsock made Jumper.  Assisted by Jackson Emery.,16,15,1,17,0.526365172219088,0.526365172219088,BYU,New Mexico,6,6,NA,310700252,2011-03-11
50,1,13:28,2008,2008,Dairese Gary missed Layup.,16,15,1,1,0.5265760407951462,0.5265760407951462,BYU,New Mexico,6,6,NA,310700252,2011-03-11
51,1,13:27,2007,2007,Noah Hartsock Block.,16,15,1,1,0.5265885022689188,0.5265885022689188,BYU,New Mexico,6,6,NA,310700252,2011-03-11
52,1,13:26,2006,2006,Cameron Bairstow Offensive Rebound.,16,15,1,3,0.5266009702327366,0.5266009702327366,BYU,New Mexico,6,6,NA,310700252,2011-03-11
53,1,13:23,2003,2003,Cameron Bairstow missed Layup.,16,15,1,0,0.5266384132347128,0.5266384132347128,BYU,New Mexico,6,6,NA,310700252,2011-03-11
54,1,13:23,2003,2003,Charles Abouo Defensive Rebound.,16,15,1,4,0.5266384132347128,0.5266384132347128,BYU,New Mexico,6,6,NA,310700252,2011-03-11
55,1,13:19,1999,1999,Jackson Emery missed Three Point Jumper.,16,15,1,0,0.5266884291308235,0.5266884291308235,BYU,New Mexico,6,6,NA,310700252,2011-03-11
56,1,13:19,1999,1999,Dairese Gary Defensive Rebound.,16,15,1,7,0.5266884291308235,0.5266884291308235,BYU,New Mexico,6,6,NA,310700252,2011-03-11
57,1,13:12,1992,1992,Dairese Gary missed Three Point Jumper.,16,15,1,0,0.5267762127146647,0.5267762127146647,BYU,New Mexico,6,6,NA,310700252,2011-03-11
58,1,13:12,1992,1992,Jackson Emery Defensive Rebound.,16,15,1,13,0.5267762127146647,0.5267762127146647,BYU,New Mexico,6,6,NA,310700252,2011-03-11
59,1,12:59,1979,1979,Noah Hartsock made Layup.  Assisted by Jimmer Fredette.,18,15,3,22,0.5802000895021867,0.5802000895021867,BYU,New Mexico,6,6,NA,310700252,2011-03-11
60,1,12:37,1957,1957,Kendall Williams missed Three Point Jumper.,18,15,3,0,0.5810209106794497,0.5810209106794497,BYU,New Mexico,6,6,NA,310700252,2011-03-11
61,1,12:37,1957,1957,Noah Hartsock Defensive Rebound.,18,15,3,5,0.5810209106794497,0.5810209106794497,BYU,New Mexico,6,6,NA,310700252,2011-03-11
62,1,12:32,1952,1952,Charles Abouo missed Jumper.,18,15,3,0,0.581208838164924,0.581208838164924,BYU,New Mexico,6,6,NA,310700252,2011-03-11
63,1,12:32,1952,1952,Drew Gordon Defensive Rebound.,18,15,3,27,0.581208838164924,0.581208838164924,BYU,New Mexico,6,6,NA,310700252,2011-03-11
64,1,12:05,1925,1925,Phillip McDonald made Three Point Jumper.  Assisted by Kendall Williams.,18,18,0,16,0.5,0.5,BYU,New Mexico,6,6,NA,310700252,2011-03-11
65,1,11:49,1909,1909,Noah Hartsock missed Layup.,18,18,0,0,0.5,0.5,BYU,New Mexico,6,6,NA,310700252,2011-03-11
66,1,11:49,1909,1909,Logan Magnusson Offensive Rebound.,18,18,0,1,0.5,0.5,BYU,New Mexico,6,6,NA,310700252,2011-03-11
67,1,11:48,1908,1908,Logan Magnusson Turnover.,18,18,0,1,0.5,0.5,BYU,New Mexico,6,6,NA,310700252,2011-03-11
68,1,11:47,1907,1907,Official TV Timeout.,18,18,0,14,0.5,0.5,BYU,New Mexico,6,6,NA,310700252,2011-03-11
69,1,11:33,1893,1893,Kendall Williams missed Three Point Jumper.,18,18,0,0,0.5,0.5,BYU,New Mexico,6,6,NA,310700252,2011-03-11
70,1,11:33,1893,1893,Cameron Bairstow Offensive Rebound.,18,18,0,6,0.5,0.5,BYU,New Mexico,6,6,NA,310700252,2011-03-11
71,1,11:27,1887,1887,Cameron Bairstow made Layup.,18,20,-2,11,0.44392337373482016,0.44392337373482016,BYU,New Mexico,6,6,NA,310700252,2011-03-11
72,1,11:16,1876,1876,Jimmer Fredette missed Three Point Jumper.,18,20,-2,0,0.4436405643716033,0.4436405643716033,BYU,New Mexico,6,6,NA,310700252,2011-03-11
73,1,11:16,1876,1876,Cameron Bairstow Defensive Rebound.,18,20,-2,14,0.4436405643716033,0.4436405643716033,BYU,New Mexico,6,6,NA,310700252,2011-03-11
74,1,11:02,1862,1862,A.J. Hardeman made Jumper.  Assisted by Dairese Gary.,18,22,-4,4,0.3880014679664803,0.3880014679664803,BYU,New Mexico,6,6,NA,310700252,2011-03-11
75,1,10:58,1858,1858,Brigham Young Full Timeout.,18,22,-4,2,0.3878029783446608,0.3878029783446608,BYU,New Mexico,6,5,NA,310700252,2011-03-11
76,1,10:56,1856,1856,Jackson Emery missed Three Point Jumper.,18,22,-4,0,0.3877036805301339,0.3877036805301339,BYU,New Mexico,6,5,NA,310700252,2011-03-11
77,1,10:56,1856,1856,null,18,22,-4,3,0.3877036805301339,0.3877036805301339,BYU,New Mexico,6,5,NA,310700252,2011-03-11
78,1,10:53,1853,1853,Foul on Logan Magnusson,18,22,-4,22,0.38755466095210456,0.38755466095210456,BYU,New Mexico,6,5,NA,310700252,2011-03-11
79,1,10:31,1831,1831,Dairese Gary Turnover.,18,22,-4,9,0.3864584542324567,0.3864584542324567,BYU,New Mexico,6,5,NA,310700252,2011-03-11
80,1,10:22,1822,1822,Jimmer Fredette made Jumper.,20,22,-2,28,0.4422433943341241,0.4422433943341241,BYU,New Mexico,6,5,NA,310700252,2011-03-11
81,1,9:54,1794,1794,A.J. Hardeman missed Layup.,20,22,-2,0,0.4415076995759691,0.4415076995759691,BYU,New Mexico,6,5,NA,310700252,2011-03-11
82,1,9:54,1794,1794,Noah Hartsock Defensive Rebound.,20,22,-2,7,0.4415076995759691,0.4415076995759691,BYU,New Mexico,6,5,NA,310700252,2011-03-11
83,1,9:47,1787,1787,Logan Magnusson missed Three Point Jumper.,20,22,-2,0,0.4413220202407996,0.4413220202407996,BYU,New Mexico,6,5,NA,310700252,2011-03-11
84,1,9:47,1787,1787,Dairese Gary Defensive Rebound.,20,22,-2,16,0.4413220202407996,0.4413220202407996,BYU,New Mexico,6,5,NA,310700252,2011-03-11
85,1,9:31,1771,1771,Cameron Bairstow made Jumper.  Assisted by Tony Snell.,20,24,-4,18,0.3834180870121141,0.3834180870121141,BYU,New Mexico,6,5,NA,310700252,2011-03-11
86,1,9:13,1753,1753,Jackson Emery made Jumper.,22,24,-2,20,0.4404077085130537,0.4404077085130537,BYU,New Mexico,6,5,NA,310700252,2011-03-11
87,1,8:53,1733,1733,Tony Snell missed Three Point Jumper.,22,24,-2,0,0.4398585628516246,0.4398585628516246,BYU,New Mexico,6,5,NA,310700252,2011-03-11
88,1,8:53,1733,1733,Jimmer Fredette Defensive Rebound.,22,24,-2,8,0.4398585628516246,0.4398585628516246,BYU,New Mexico,6,5,NA,310700252,2011-03-11
89,1,8:45,1725,1725,Jimmer Fredette made Three Point Jumper.,25,24,1,36,0.5302926829629471,0.5302926829629471,BYU,New Mexico,6,5,NA,310700252,2011-03-11
90,1,8:09,1689,1689,Dairese Gary made Jumper.,25,26,-1,7,0.46919044411514405,0.46919044411514405,BYU,New Mexico,6,5,NA,310700252,2011-03-11
91,1,8:02,1682,1682,Jimmer Fredette made Three Point Jumper.,28,26,2,24,0.561586866013264,0.561586866013264,BYU,New Mexico,6,5,NA,310700252,2011-03-11
92,1,7:38,1658,1658,Jamal Fenton missed Three Point Jumper.,28,26,2,0,0.5622604916319712,0.5622604916319712,BYU,New Mexico,6,5,NA,310700252,2011-03-11
93,1,7:38,1658,1658,A.J. Hardeman Offensive Rebound.,28,26,2,4,0.5622604916319712,0.5622604916319712,BYU,New Mexico,6,5,NA,310700252,2011-03-11
94,1,7:34,1654,1654,A.J. Hardeman made Layup.,28,28,0,15,0.5,0.5,BYU,New Mexico,6,5,NA,310700252,2011-03-11
95,1,7:19,1639,1639,Noah Hartsock Turnover.,28,28,0,0,0.5,0.5,BYU,New Mexico,6,5,NA,310700252,2011-03-11
96,1,7:19,1639,1639,Official TV Timeout.,28,28,0,10,0.5,0.5,BYU,New Mexico,6,5,NA,310700252,2011-03-11
97,1,7:09,1629,1629,Drew Gordon made Jumper.  Assisted by Dairese Gary.,28,30,-2,24,0.4369480454900342,0.4369480454900342,BYU,New Mexico,6,5,NA,310700252,2011-03-11
98,1,6:45,1605,1605,Jimmer Fredette made Jumper.,30,30,0,24,0.5,0.5,BYU,New Mexico,6,5,NA,310700252,2011-03-11
99,1,6:21,1581,1581,Jamal Fenton Turnover.,30,30,0,0,0.5,0.5,BYU,New Mexico,6,5,NA,310700252,2011-03-11
100,1,6:21,1581,1581,Foul on Jamal Fenton,30,30,0,15,0.5,0.5,BYU,New Mexico,6,5,NA,310700252,2011-03-11
101,1,6:06,1566,1566,Jimmer Fredette made Jumper.,32,30,2,23,0.5647473579619368,0.5647473579619368,BYU,New Mexico,6,5,NA,310700252,2011-03-11
102,1,5:43,1543,1543,Jamal Fenton made Three Point Jumper.,32,33,-1,12,0.4671697235858243,0.4671697235858243,BYU,New Mexico,6,5,NA,310700252,2011-03-11
103,1,5:31,1531,1531,Jimmer Fredette missed Three Point Jumper.,32,33,-1,0,0.4669996648941544,0.4669996648941544,BYU,New Mexico,6,5,NA,310700252,2011-03-11
104,1,5:31,1531,1531,Drew Gordon Defensive Rebound.,32,33,-1,10,0.4669996648941544,0.4669996648941544,BYU,New Mexico,6,5,NA,310700252,2011-03-11
105,1,5:21,1521,1521,Phillip McDonald Turnover.,32,33,-1,2,0.4668557979464423,0.4668557979464423,BYU,New Mexico,6,5,NA,310700252,2011-03-11
106,1,5:19,1519,1519,Jackson Emery Steal.,32,33,-1,3,0.4668267635341371,0.4668267635341371,BYU,New Mexico,6,5,NA,310700252,2011-03-11
107,1,5:16,1516,1516,Jimmer Fredette made Layup.  Assisted by Jackson Emery.,34,33,1,30,0.5332169615066026,0.5332169615066026,BYU,New Mexico,6,5,NA,310700252,2011-03-11
108,1,4:46,1486,1486,Jamal Fenton Turnover.,34,33,1,1,0.5336672410489377,0.5336672410489377,BYU,New Mexico,6,5,NA,310700252,2011-03-11
109,1,4:45,1485,1485,Jackson Emery Steal.,34,33,1,3,0.5336827065022101,0.5336827065022101,BYU,New Mexico,6,5,NA,310700252,2011-03-11
110,1,4:42,1482,1482,Kyle Collinsworth made Dunk.  Assisted by Jackson Emery.,36,33,3,7,0.5999765069109699,0.5999765069109699,BYU,New Mexico,6,5,NA,310700252,2011-03-11
111,1,4:35,1475,1475,New Mexico Full Timeout.,36,33,3,23,0.6002943985071719,0.6002943985071719,BYU,New Mexico,5,5,NA,310700252,2011-03-11
112,1,4:12,1452,1452,Drew Gordon made Jumper.  Assisted by Dairese Gary.,36,35,1,13,0.5342128550427648,0.5342128550427648,BYU,New Mexico,5,5,NA,310700252,2011-03-11
113,1,3:59,1439,1439,Charles Abouo missed Three Point Jumper.,36,35,1,0,0.534428662413107,0.534428662413107,BYU,New Mexico,5,5,NA,310700252,2011-03-11
114,1,3:59,1439,1439,Drew Gordon Defensive Rebound.,36,35,1,29,0.534428662413107,0.534428662413107,BYU,New Mexico,5,5,NA,310700252,2011-03-11
115,1,3:30,1410,1410,Dairese Gary missed Three Point Jumper.,36,35,1,0,0.5348913629138277,0.5348913629138277,BYU,New Mexico,5,5,NA,310700252,2011-03-11
116,1,3:30,1410,1410,Drew Gordon Offensive Rebound.,36,35,1,6,0.5348913629138277,0.5348913629138277,BYU,New Mexico,5,5,NA,310700252,2011-03-11
117,1,3:24,1404,1404,Drew Gordon Turnover.,36,35,1,3,0.5349846276175885,0.5349846276175885,BYU,New Mexico,5,5,NA,310700252,2011-03-11
118,1,3:21,1401,1401,Official TV Timeout.,36,35,1,12,0.5350310266147678,0.5350310266147678,BYU,New Mexico,5,5,NA,310700252,2011-03-11
119,1,3:09,1389,1389,Kyle Collinsworth made Layup.,38,35,3,0,0.6042691336109013,0.6042691336109013,BYU,New Mexico,5,5,NA,310700252,2011-03-11
120,1,3:09,1389,1389,Foul on A.J. Hardeman,38,35,3,0,0.6042691336109013,0.6042691336109013,BYU,New Mexico,5,5,NA,310700252,2011-03-11
121,1,3:09,1389,1389,Kyle Collinsworth made Free Throw.,39,35,4,12,0.6374654838114278,0.6374654838114278,BYU,New Mexico,5,5,NA,310700252,2011-03-11
122,1,2:57,1377,1377,Phillip McDonald missed Three Point Jumper.,39,35,4,0,0.6381452246244329,0.6381452246244329,BYU,New Mexico,5,5,NA,310700252,2011-03-11
123,1,2:57,1377,1377,Jimmer Fredette Defensive Rebound.,39,35,4,7,0.6381452246244329,0.6381452246244329,BYU,New Mexico,5,5,NA,310700252,2011-03-11
124,1,2:50,1370,1370,Jimmer Fredette made Jumper.,41,35,6,17,0.7013117484268417,0.7013117484268417,BYU,New Mexico,5,5,NA,310700252,2011-03-11
125,1,2:33,1353,1353,Dairese Gary made Jumper.,41,37,4,17,0.6395005608175873,0.6395005608175873,BYU,New Mexico,5,5,NA,310700252,2011-03-11
126,1,2:16,1336,1336,Jackson Emery missed Three Point Jumper.,41,37,4,0,0.6404684049850021,0.6404684049850021,BYU,New Mexico,5,5,NA,310700252,2011-03-11
127,1,2:16,1336,1336,Charles Abouo Offensive Rebound.,41,37,4,9,0.6404684049850021,0.6404684049850021,BYU,New Mexico,5,5,NA,310700252,2011-03-11
128,1,2:07,1327,1327,Jimmer Fredette made Three Point Jumper.,44,37,7,29,0.7338780129044157,0.7338780129044157,BYU,New Mexico,5,5,NA,310700252,2011-03-11
129,1,1:38,1298,1298,Dairese Gary made Three Point Jumper.  Assisted by Kendall Williams.,44,40,4,13,0.6427048071749161,0.6427048071749161,BYU,New Mexico,5,5,NA,310700252,2011-03-11
130,1,1:25,1285,1285,Jimmer Fredette made Layup.,46,40,6,19,0.7080483264794263,0.7080483264794263,BYU,New Mexico,5,5,NA,310700252,2011-03-11
131,1,1:06,1266,1266,Kendall Williams missed Three Point Jumper.,46,40,6,0,0.7096929078592094,0.7096929078592094,BYU,New Mexico,5,5,NA,310700252,2011-03-11
132,1,1:06,1266,1266,Kyle Collinsworth Defensive Rebound.,46,40,6,1,0.7096929078592094,0.7096929078592094,BYU,New Mexico,5,5,NA,310700252,2011-03-11
133,1,1:05,1265,1265,Foul on Phillip McDonald,46,40,6,12,0.7097816922985415,0.7097816922985415,BYU,New Mexico,5,5,NA,310700252,2011-03-11
134,1,0:53,1253,1253,Kyle Collinsworth missed Layup.,46,40,6,0,0.7108663892737404,0.7108663892737404,BYU,New Mexico,5,5,NA,310700252,2011-03-11
135,1,0:53,1253,1253,Noah Hartsock Offensive Rebound.,46,40,6,6,0.7108663892737404,0.7108663892737404,BYU,New Mexico,5,5,NA,310700252,2011-03-11
136,1,0:47,1247,1247,Foul on Cameron Bairstow,46,40,6,0,0.7114228654239397,0.7114228654239397,BYU,New Mexico,5,5,NA,310700252,2011-03-11
137,1,0:47,1247,1247,Noah Hartsock missed Free Throw.,46,40,6,0,0.7114228654239397,0.7114228654239397,BYU,New Mexico,5,5,NA,310700252,2011-03-11
138,1,0:47,1247,1247,null,46,40,6,0,0.7114228654239397,0.7114228654239397,BYU,New Mexico,5,5,NA,310700252,2011-03-11
139,1,0:47,1247,1247,Noah Hartsock made Free Throw.,47,40,7,7,0.741290865917344,0.741290865917344,BYU,New Mexico,5,5,NA,310700252,2011-03-11
140,1,0:40,1240,1240,Dairese Gary made Layup.,47,42,5,28,0.6801822273590818,0.6801822273590818,BYU,New Mexico,5,5,NA,310700252,2011-03-11
141,1,0:12,1212,1212,Jimmer Fredette missed Jumper.,47,42,5,0,0.6826603011780678,0.6826603011780678,BYU,New Mexico,5,5,NA,310700252,2011-03-11
142,1,0:12,1212,1212,Kyle Collinsworth Offensive Rebound.,47,42,5,7,0.6826603011780678,0.6826603011780678,BYU,New Mexico,5,5,NA,310700252,2011-03-11
143,1,0:05,1205,1205,Charles Abouo missed Three Point Jumper.,47,42,5,0,0.6833106746353144,0.6833106746353144,BYU,New Mexico,5,5,NA,310700252,2011-03-11
144,1,0:05,1205,1205,Drew Gordon Block.,47,42,5,0,0.6833106746353144,0.6833106746353144,BYU,New Mexico,5,5,NA,310700252,2011-03-11
145,1,0:05,1205,1205,Jamal Fenton Defensive Rebound.,47,42,5,5,0.6833106746353144,0.6833106746353144,BYU,New Mexico,5,5,NA,310700252,2011-03-11
146,1,0:00,1200,1200,End of the 1st Half.,47,42,5,0,0.6837696278036713,0.6837696278036713,BYU,New Mexico,5,5,NA,310700252,2011-03-11
147,2,20:00,1200,1200,PLAY,47,42,5,16,0.6837696278036713,0.6837696278036713,BYU,New Mexico,5,5,NA,310700252,2011-03-11
148,2,19:44,1184,1184,Jimmer Fredette missed Jumper.,47,42,5,0,0.685207256592678,0.685207256592678,BYU,New Mexico,5,5,NA,310700252,2011-03-11
149,2,19:44,1184,1184,Drew Gordon Defensive Rebound.,47,42,5,17,0.685207256592678,0.685207256592678,BYU,New Mexico,5,5,NA,310700252,2011-03-11
150,2,19:27,1167,1167,A.J. Hardeman made Layup.  Assisted by Drew Gordon.,47,44,3,0,0.6155787834576356,0.6155787834576356,BYU,New Mexico,5,5,NA,310700252,2011-03-11
151,2,19:27,1167,1167,Foul on Charles Abouo,47,44,3,0,0.6155787834576356,0.6155787834576356,BYU,New Mexico,5,5,NA,310700252,2011-03-11
152,2,19:27,1167,1167,A.J. Hardeman missed Free Throw.,47,44,3,0,0.6155787834576356,0.6155787834576356,BYU,New Mexico,5,5,NA,310700252,2011-03-11
153,2,19:27,1167,1167,Kyle Collinsworth Defensive Rebound.,47,44,3,15,0.6155787834576356,0.6155787834576356,BYU,New Mexico,5,5,NA,310700252,2011-03-11
154,2,19:12,1152,1152,Noah Hartsock missed Jumper.,47,44,3,1,0.6164292859832927,0.6164292859832927,BYU,New Mexico,5,5,NA,310700252,2011-03-11
155,2,19:11,1151,1151,Kendall Williams Defensive Rebound.,47,44,3,16,0.6164856795808575,0.6164856795808575,BYU,New Mexico,5,5,NA,310700252,2011-03-11
156,2,18:55,1135,1135,Drew Gordon missed Jumper.,47,44,3,1,0.6173855801884942,0.6173855801884942,BYU,New Mexico,5,5,NA,310700252,2011-03-11
157,2,18:54,1134,1134,A.J. Hardeman Offensive Rebound.,47,44,3,16,0.6174417729423894,0.6174417729423894,BYU,New Mexico,5,5,NA,310700252,2011-03-11
158,2,18:38,1118,1118,New Mexico Turnover.,47,44,3,17,0.6183429323797338,0.6183429323797338,BYU,New Mexico,5,5,NA,310700252,2011-03-11
159,2,18:21,1101,1101,Jackson Emery missed Jumper.,47,44,3,0,0.6193108226158225,0.6193108226158225,BYU,New Mexico,5,5,NA,310700252,2011-03-11
160,2,18:21,1101,1101,Kyle Collinsworth Offensive Rebound.,47,44,3,6,0.6193108226158225,0.6193108226158225,BYU,New Mexico,5,5,NA,310700252,2011-03-11
161,2,18:15,1095,1095,Kyle Collinsworth made Layup.,49,44,5,13,0.692851787391721,0.692851787391721,BYU,New Mexico,5,5,NA,310700252,2011-03-11
162,2,18:02,1082,1082,Jamal Fenton missed Three Point Jumper.,49,44,5,0,0.6939946937133286,0.6939946937133286,BYU,New Mexico,5,5,NA,310700252,2011-03-11
163,2,18:02,1082,1082,New Mexico Offensive Rebound.,49,44,5,24,0.6939946937133286,0.6939946937133286,BYU,New Mexico,5,5,NA,310700252,2011-03-11
164,2,17:38,1058,1058,Phillip McDonald Turnover.,49,44,5,2,0.6961756132160999,0.6961756132160999,BYU,New Mexico,5,5,NA,310700252,2011-03-11
165,2,17:36,1056,1056,Charles Abouo Steal.,49,44,5,10,0.6963624557918254,0.6963624557918254,BYU,New Mexico,5,5,NA,310700252,2011-03-11
166,2,17:26,1046,1046,Foul on Kendall Williams,49,44,5,10,0.6973104299386256,0.6973104299386256,BYU,New Mexico,5,5,NA,310700252,2011-03-11
167,2,17:16,1036,1036,Jimmer Fredette missed Jumper.,49,44,5,0,0.6982833498580442,0.6982833498580442,BYU,New Mexico,5,5,NA,310700252,2011-03-11
168,2,17:16,1036,1036,Drew Gordon Defensive Rebound.,49,44,5,9,0.6982833498580442,0.6982833498580442,BYU,New Mexico,5,5,NA,310700252,2011-03-11
169,2,17:07,1027,1027,Kendall Williams made Three Point Jumper.  Assisted by Jamal Fenton.,49,47,2,31,0.5835498991686662,0.5835498991686662,BYU,New Mexico,5,5,NA,310700252,2011-03-11
170,2,16:36,996,996,Jimmer Fredette missed Jumper.,49,47,2,0,0.5850771901300336,0.5850771901300336,BYU,New Mexico,5,5,NA,310700252,2011-03-11
171,2,16:36,996,996,New Mexico Defensive Rebound.,49,47,2,31,0.5850771901300336,0.5850771901300336,BYU,New Mexico,5,5,NA,310700252,2011-03-11
172,2,16:05,965,965,Jamal Fenton missed Jumper.,49,47,2,0,0.5867772752205871,0.5867772752205871,BYU,New Mexico,5,5,NA,310700252,2011-03-11
173,2,16:05,965,965,Drew Gordon Offensive Rebound.,49,47,2,3,0.5867772752205871,0.5867772752205871,BYU,New Mexico,5,5,NA,310700252,2011-03-11
174,2,16:02,962,962,Drew Gordon made Layup.,49,49,0,18,0.5,0.5,BYU,New Mexico,5,5,NA,310700252,2011-03-11
175,2,15:44,944,944,Kyle Collinsworth Turnover.,49,49,0,3,0.5,0.5,BYU,New Mexico,5,5,NA,310700252,2011-03-11
176,2,15:41,941,941,Jamal Fenton Steal.,49,49,0,6,0.5,0.5,BYU,New Mexico,5,5,NA,310700252,2011-03-11
177,2,15:35,935,935,Phillip McDonald missed Three Point Jumper.,49,49,0,0,0.5,0.5,BYU,New Mexico,5,5,NA,310700252,2011-03-11
178,2,15:35,935,935,Noah Hartsock Defensive Rebound.,49,49,0,7,0.5,0.5,BYU,New Mexico,5,5,NA,310700252,2011-03-11
179,2,15:28,928,928,Jackson Emery missed Three Point Jumper.,49,49,0,0,0.5,0.5,BYU,New Mexico,5,5,NA,310700252,2011-03-11
180,2,15:28,928,928,Kendall Williams Defensive Rebound.,49,49,0,6,0.5,0.5,BYU,New Mexico,5,5,NA,310700252,2011-03-11
181,2,15:22,922,922,Kendall Williams missed Layup.,49,49,0,1,0.5,0.5,BYU,New Mexico,5,5,NA,310700252,2011-03-11
182,2,15:21,921,921,Charles Abouo Defensive Rebound.,49,49,0,1,0.5,0.5,BYU,New Mexico,5,5,NA,310700252,2011-03-11
183,2,15:20,920,920,Foul on Drew Gordon,49,49,0,1,0.5,0.5,BYU,New Mexico,5,5,NA,310700252,2011-03-11
184,2,15:19,919,919,Official TV Timeout.,49,49,0,11,0.5,0.5,BYU,New Mexico,5,5,NA,310700252,2011-03-11
185,2,15:08,908,908,Jimmer Fredette Turnover.,49,49,0,22,0.5,0.5,BYU,New Mexico,5,5,NA,310700252,2011-03-11
