play_id,half,time_remaining_half,secs_remaining,secs_remaining_absolute,description,home_score,away_score,score_diff,play_length,win_prob,naive_win_prob,home,away,home_time_out_remaining,away_time_out_remaining,home_favored_by,game_id,date
1,1,20:00,2400,2400,PLAY,0,0,0,25,0.5,0.5,UTEP,Houston,6,6,NA,260562638,2006-02-25
2,1,19:35,2375,2375,Sam Anderson missed Two Point Layup.,0,0,0,0,0.5,0.5,UTEP,Houston,6,6,NA,260562638,2006-02-25
3,1,19:35,2375,2375,Jason Williams Defensive Rebound.,0,0,0,13,0.5,0.5,UTEP,Houston,6,6,NA,260562638,2006-02-25
4,1,19:22,2362,2362,Oliver Lafayette made Two Point Layup.,0,2,-2,28,0.4551678976921304,0.4551678976921304,UTEP,Houston,6,6,NA,260562638,2006-02-25
5,1,18:54,2334,2334,Stefon Jackson missed Three Point Jumper.,0,2,-2,0,0.4545614938352706,0.4545614938352706,UTEP,Houston,6,6,NA,260562638,2006-02-25
6,1,18:54,2334,2334,Lanny Smith Defensive Rebound.,0,2,-2,20,0.4545614938352706,0.4545614938352706,UTEP,Houston,6,6,NA,260562638,2006-02-25
7,1,18:34,2314,2314,Ramon Dyer missed Two Point Jumper.,0,2,-2,0,0.4541225081930918,0.4541225081930918,UTEP,Houston,6,6,NA,260562638,2006-02-25
8,1,18:34,2314,2314,Lanny Smith Offensive Rebound.,0,2,-2,1,0.4541225081930918,0.4541225081930918,UTEP,Houston,6,6,NA,260562638,2006-02-25
9,1,18:33,2313,2313,Lanny Smith missed Three Point Jumper.,0,2,-2,0,0.4541004401909216,0.4541004401909216,UTEP,Houston,6,6,NA,260562638,2006-02-25
10,1,18:33,2313,2313,Will Kimble Defensive Rebound.,0,2,-2,21,0.4541004401909216,0.4541004401909216,UTEP,Houston,6,6,NA,260562638,2006-02-25
11,1,18:12,2292,2292,Kevin Henderson made Two Point Jumper.,2,2,0,20,0.5,0.5,UTEP,Houston,6,6,NA,260562638,2006-02-25
12,1,17:52,2272,2272,Oliver Lafayette missed Three Point Jumper.,2,2,0,0,0.5,0.5,UTEP,Houston,6,6,NA,260562638,2006-02-25
13,1,17:52,2272,2272,Will Kimble Defensive Rebound.,2,2,0,10,0.5,0.5,UTEP,Houston,6,6,NA,260562638,2006-02-25
14,1,17:42,2262,2262,Edgar Moreno made Three Point Jumper.,5,2,3,7,0.570298014037633,0.570298014037633,UTEP,Houston,6,6,NA,260562638,2006-02-25
15,1,17:35,2255,2255,Houston Full Timeout.,5,2,3,17,0.5705325919819826,0.5705325919819826,UTEP,Houston,5,6,NA,260562638,2006-02-25
16,1,17:18,2238,2238,Lanny Smith missed Three Point Jumper.,5,2,3,0,0.5711045362677699,0.5711045362677699,UTEP,Houston,5,6,NA,260562638,2006-02-25
17,1,17:18,2238,2238,Edgar Moreno Defensive Rebound.,5,2,3,15,0.5711045362677699,0.5711045362677699,UTEP,Houston,5,6,NA,260562638,2006-02-25
18,1,17:03,2223,2223,Jason Williams missed Two Point Layup.,5,2,3,0,0.5716116011849327,0.5716116011849327,UTEP,Houston,5,6,NA,260562638,2006-02-25
19,1,17:03,2223,2223,Ramon Dyer Defensive Rebound.,5,2,3,19,0.5716116011849327,0.5716116011849327,UTEP,Houston,5,6,NA,260562638,2006-02-25
20,1,16:44,2204,2204,Oliver Lafayette missed Three Point Jumper.,5,2,3,0,0.5722566941444102,0.5722566941444102,UTEP,Houston,5,6,NA,260562638,2006-02-25
21,1,16:44,2204,2204,Will Kimble Defensive Rebound.,5,2,3,18,0.5722566941444102,0.5722566941444102,UTEP,Houston,5,6,NA,260562638,2006-02-25
22,1,16:26,2186,2186,Jason Williams missed Two Point Layup.,5,2,3,0,0.572870280824908,0.572870280824908,UTEP,Houston,5,6,NA,260562638,2006-02-25
23,1,16:26,2186,2186,Sam Anderson Defensive Rebound.,5,2,3,3,0.572870280824908,0.572870280824908,UTEP,Houston,5,6,NA,260562638,2006-02-25
24,1,16:23,2183,2183,Foul on Will Kimble,5,2,3,20,0.5729727438081019,0.5729727438081019,UTEP,Houston,5,6,NA,260562638,2006-02-25
25,1,16:03,2163,2163,Oliver Lafayette made Three Point Jumper.,5,5,0,13,0.5,0.5,UTEP,Houston,5,6,NA,260562638,2006-02-25
26,1,15:50,2150,2150,Ramon Dyer made Two Point Dunk Shot.,5,7,-2,34,0.4503944624143455,0.4503944624143455,UTEP,Houston,5,6,NA,260562638,2006-02-25
27,1,15:16,2116,2116,Foul on Brian Latham,5,7,-2,0,0.4495992322531265,0.4495992322531265,UTEP,Houston,5,6,NA,260562638,2006-02-25
28,1,15:16,2116,2116,Official TV Timeout.,5,7,-2,0,0.4495992322531265,0.4495992322531265,UTEP,Houston,5,6,NA,260562638,2006-02-25
29,1,15:16,2116,2116,Stefon Jackson made Free Throw.,6,7,-1,0,0.47473527386265885,0.47473527386265885,UTEP,Houston,5,6,NA,260562638,2006-02-25
30,1,15:16,2116,2116,Stefon Jackson missed Free Throw.,6,7,-1,0,0.47473527386265885,0.47473527386265885,UTEP,Houston,5,6,NA,260562638,2006-02-25
31,1,15:16,2116,2116,Sam Anderson Defensive Rebound.,6,7,-1,10,0.47473527386265885,0.47473527386265885,UTEP,Houston,5,6,NA,260562638,2006-02-25
32,1,15:06,2106,2106,Foul on Brian Latham,6,7,-1,7,0.47461645444133904,0.47461645444133904,UTEP,Houston,5,6,NA,260562638,2006-02-25
33,1,14:59,2099,2099,Kevin Henderson missed Two Point Layup.,6,7,-1,0,0.4745329960623789,0.4745329960623789,UTEP,Houston,5,6,NA,260562638,2006-02-25
34,1,14:59,2099,2099,Will Kimble Offensive Rebound.,6,7,-1,2,0.4745329960623789,0.4745329960623789,UTEP,Houston,5,6,NA,260562638,2006-02-25
35,1,14:57,2097,2097,Will Kimble made Two Point Tip Shot.,8,7,1,12,0.5254908932370859,0.5254908932370859,UTEP,Houston,5,6,NA,260562638,2006-02-25
36,1,14:45,2085,2085,Lanny Smith made Three Point Jumper.,8,10,-2,26,0.44886510981327055,0.44886510981327055,UTEP,Houston,5,6,NA,260562638,2006-02-25
37,1,14:19,2059,2059,Foul on Ramon Dyer,8,10,-2,0,0.4482419770620249,0.4482419770620249,UTEP,Houston,5,6,NA,260562638,2006-02-25
38,1,14:19,2059,2059,Jason Williams made Free Throw.,9,10,-1,0,0.4740512874837421,0.4740512874837421,UTEP,Houston,5,6,NA,260562638,2006-02-25
39,1,14:19,2059,2059,Jason Williams made Free Throw.,10,10,0,20,0.5,0.5,UTEP,Houston,5,6,NA,260562638,2006-02-25
40,1,13:59,2039,2039,Oliver Lafayette missed Three Point Jumper.,10,10,0,0,0.5,0.5,UTEP,Houston,5,6,NA,260562638,2006-02-25
41,1,13:59,2039,2039,UTEP Defensive Rebound.,10,10,0,2,0.5,0.5,UTEP,Houston,5,6,NA,260562638,2006-02-25
42,1,13:57,2037,2037,Foul on Jahmar Thorpe,10,10,0,35,0.5,0.5,UTEP,Houston,5,6,NA,260562638,2006-02-25
43,1,13:22,2002,2002,Jahmar Thorpe missed Two Point Jumper.,10,10,0,0,0.5,0.5,UTEP,Houston,5,6,NA,260562638,2006-02-25
44,1,13:22,2002,2002,UTEP Defensive Rebound.,10,10,0,2,0.5,0.5,UTEP,Houston,5,6,NA,260562638,2006-02-25
45,1,13:20,2000,2000,Foul on Ramon Dyer,10,10,0,18,0.5,0.5,UTEP,Houston,5,6,NA,260562638,2006-02-25
46,1,13:02,1982,1982,Foul on Brian Latham,10,10,0,5,0.5,0.5,UTEP,Houston,5,6,NA,260562638,2006-02-25
47,1,12:57,1977,1977,Jason Williams made Two Point Jumper.,12,10,2,31,0.5537744765316269,0.5537744765316269,UTEP,Houston,5,6,NA,260562638,2006-02-25
48,1,12:26,1946,1946,Lanny Smith missed Two Point Jumper.,12,10,2,0,0.554559751376137,0.554559751376137,UTEP,Houston,5,6,NA,260562638,2006-02-25
49,1,12:26,1946,1946,Houston Defensive Rebound.,12,10,2,2,0.554559751376137,0.554559751376137,UTEP,Houston,5,6,NA,260562638,2006-02-25
50,1,12:24,1944,1944,Oliver Lafayette missed Two Point Jumper.,12,10,2,0,0.5546108889427448,0.5546108889427448,UTEP,Houston,5,6,NA,260562638,2006-02-25
51,1,12:24,1944,1944,Edgar Moreno Defensive Rebound.,12,10,2,17,0.5546108889427448,0.5546108889427448,UTEP,Houston,5,6,NA,260562638,2006-02-25
52,1,12:07,1927,1927,Sam Anderson missed Two Point Jumper.,12,10,2,0,0.555047878106275,0.555047878106275,UTEP,Houston,5,6,NA,260562638,2006-02-25
53,1,12:07,1927,1927,Jahmar Thorpe Offensive Rebound.,12,10,2,0,0.555047878106275,0.555047878106275,UTEP,Houston,5,6,NA,260562638,2006-02-25
54,1,12:07,1927,1927,Foul on Maurice Thomas,12,10,2,0,0.555047878106275,0.555047878106275,UTEP,Houston,5,6,NA,260562638,2006-02-25
55,1,12:07,1927,1927,Jahmar Thorpe made Free Throw.,12,11,1,0,0.5276078533301112,0.5276078533301112,UTEP,Houston,5,6,NA,260562638,2006-02-25
56,1,12:07,1927,1927,Jahmar Thorpe made Free Throw.,12,12,0,15,0.5,0.5,UTEP,Houston,5,6,NA,260562638,2006-02-25
57,1,11:52,1912,1912,Jason Williams made Two Point Jumper.,14,12,2,19,0.5554340691067196,0.5554340691067196,UTEP,Houston,5,6,NA,260562638,2006-02-25
58,1,11:33,1893,1893,Jahmar Thorpe made Three Point Jumper.,14,15,-1,36,0.4719507861261333,0.4719507861261333,UTEP,Houston,5,6,NA,260562638,2006-02-25
59,1,10:57,1857,1857,Official TV Timeout.,14,15,-1,14,0.4714831152810906,0.4714831152810906,UTEP,Houston,5,6,NA,260562638,2006-02-25
60,1,10:43,1843,1843,Chris Lawson missed Three Point Jumper.,14,15,-1,0,0.47130038577566674,0.47130038577566674,UTEP,Houston,5,6,NA,260562638,2006-02-25
61,1,10:43,1843,1843,Will Kimble Defensive Rebound.,14,15,-1,23,0.47130038577566674,0.47130038577566674,UTEP,Houston,5,6,NA,260562638,2006-02-25
62,1,10:20,1820,1820,Foul on Sam Anderson,14,15,-1,3,0.47099834121014167,0.47099834121014167,UTEP,Houston,5,6,NA,260562638,2006-02-25
63,1,10:17,1817,1817,Jason Williams made Three Point Jumper.,17,15,2,16,0.5578872436572678,0.5578872436572678,UTEP,Houston,5,6,NA,260562638,2006-02-25
64,1,10:01,1801,1801,Jahmar Thorpe made Two Point Dunk Shot.,17,17,0,16,0.5,0.5,UTEP,Houston,5,6,NA,260562638,2006-02-25
65,1,9:45,1785,1785,Jason Williams missed Two Point Jumper.,17,17,0,0,0.5,0.5,UTEP,Houston,5,6,NA,260562638,2006-02-25
66,1,9:45,1785,1785,Chris Lawson Defensive Rebound.,17,17,0,19,0.5,0.5,UTEP,Houston,5,6,NA,260562638,2006-02-25
67,1,9:26,1766,1766,Miguel Ayala missed Three Point Jumper.,17,17,0,0,0.5,0.5,UTEP,Houston,5,6,NA,260562638,2006-02-25
68,1,9:26,1766,1766,Jason Williams Offensive Rebound.,17,17,0,19,0.5,0.5,UTEP,Houston,5,6,NA,260562638,2006-02-25
69,1,9:07,1747,1747,Miguel Ayala made Three Point Jumper.,20,17,3,16,0.5891029374258591,0.5891029374258591,UTEP,Houston,5,6,NA,260562638,2006-02-25
70,1,8:51,1731,1731,Oliver Lafayette made Two Point Jumper.,20,19,1,13,0.5302083019752006,0.5302083019752006,UTEP,Houston,5,6,NA,260562638,2006-02-25
71,1,8:38,1718,1718,Foul on Edgar Moreno,20,19,1,21,0.5303917317582819,0.5303917317582819,UTEP,Houston,5,6,NA,260562638,2006-02-25
72,1,8:17,1697,1697,Ramon Dyer made Three Point Jumper.,20,22,-2,16,0.43884436774536145,0.43884436774536145,UTEP,Houston,5,6,NA,260562638,2006-02-25
73,1,8:01,1681,1681,Stefon Jackson missed Two Point Jumper.,20,22,-2,0,0.43838462108117643,0.43838462108117643,UTEP,Houston,5,6,NA,260562638,2006-02-25
74,1,8:01,1681,1681,Oliver Lafayette Defensive Rebound.,20,22,-2,12,0.43838462108117643,0.43838462108117643,UTEP,Houston,5,6,NA,260562638,2006-02-25
75,1,7:49,1669,1669,Official TV Timeout.,20,22,-2,33,0.4380456413367831,0.4380456413367831,UTEP,Houston,5,6,NA,260562638,2006-02-25
76,1,7:16,1636,1636,Jason Williams missed Two Point Jumper.,20,22,-2,0,0.4371374757034874,0.4371374757034874,UTEP,Houston,5,6,NA,260562638,2006-02-25
77,1,7:16,1636,1636,Houston Defensive Rebound.,20,22,-2,56,0.4371374757034874,0.4371374757034874,UTEP,Houston,5,6,NA,260562638,2006-02-25
78,1,6:20,1580,1580,Jason Williams missed Two Point Jumper.,20,22,-2,0,0.43563139757227176,0.43563139757227176,UTEP,Houston,5,6,NA,260562638,2006-02-25
79,1,6:20,1580,1580,Chris Lawson Defensive Rebound.,20,22,-2,12,0.43563139757227176,0.43563139757227176,UTEP,Houston,5,6,NA,260562638,2006-02-25
80,1,6:08,1568,1568,Ramon Dyer made Three Point Jumper.,20,25,-5,10,0.34285947493293767,0.34285947493293767,UTEP,Houston,5,6,NA,260562638,2006-02-25
81,1,5:58,1558,1558,Kevin Henderson missed Three Point Jumper.,20,25,-5,0,0.342235556164438,0.342235556164438,UTEP,Houston,5,6,NA,260562638,2006-02-25
82,1,5:58,1558,1558,UTEP Defensive Rebound.,20,25,-5,8,0.342235556164438,0.342235556164438,UTEP,Houston,5,6,NA,260562638,2006-02-25
83,1,5:50,1550,1550,Foul on Darrius Brannon,20,25,-5,0,0.34173284426254524,0.34173284426254524,UTEP,Houston,5,6,NA,260562638,2006-02-25
84,1,5:50,1550,1550,Will Kimble made Free Throw.,21,25,-4,0,0.37180869869593247,0.37180869869593247,UTEP,Houston,5,6,NA,260562638,2006-02-25
85,1,5:50,1550,1550,Will Kimble missed Free Throw.,21,25,-4,0,0.37180869869593247,0.37180869869593247,UTEP,Houston,5,6,NA,260562638,2006-02-25
86,1,5:50,1550,1550,Stefon Jackson Offensive Rebound.,21,25,-4,8,0.37180869869593247,0.37180869869593247,UTEP,Houston,5,6,NA,260562638,2006-02-25
87,1,5:42,1542,1542,Will Kimble missed Two Point Jumper.,21,25,-4,0,0.3713878689489837,0.3713878689489837,UTEP,Houston,5,6,NA,260562638,2006-02-25
88,1,5:42,1542,1542,Ramon Dyer Defensive Rebound.,21,25,-4,26,0.3713878689489837,0.3713878689489837,UTEP,Houston,5,6,NA,260562638,2006-02-25
89,1,5:16,1516,1516,Ramon Dyer missed Three Point Jumper.,21,25,-4,0,0.3699910200156768,0.3699910200156768,UTEP,Houston,5,6,NA,260562638,2006-02-25
90,1,5:16,1516,1516,Kevin Henderson Defensive Rebound.,21,25,-4,8,0.3699910200156768,0.3699910200156768,UTEP,Houston,5,6,NA,260562638,2006-02-25
91,1,5:08,1508,1508,Foul on Stefon Jackson,21,25,-4,11,0.36955031921924963,0.36955031921924963,UTEP,Houston,5,6,NA,260562638,2006-02-25
92,1,4:57,1497,1497,Lanny Smith missed Three Point Jumper.,21,25,-4,0,0.36893439534950084,0.36893439534950084,UTEP,Houston,5,6,NA,260562638,2006-02-25
93,1,4:57,1497,1497,Maurice Thomas Defensive Rebound.,21,25,-4,14,0.36893439534950084,0.36893439534950084,UTEP,Houston,5,6,NA,260562638,2006-02-25
94,1,4:43,1483,1483,Stefon Jackson missed Three Point Jumper.,21,25,-4,0,0.3681318755319342,0.3681318755319342,UTEP,Houston,5,6,NA,260562638,2006-02-25
95,1,4:43,1483,1483,Ramon Dyer Defensive Rebound.,21,25,-4,24,0.3681318755319342,0.3681318755319342,UTEP,Houston,5,6,NA,260562638,2006-02-25
96,1,4:19,1459,1459,Ramon Dyer missed Three Point Jumper.,21,25,-4,0,0.36670015809774387,0.36670015809774387,UTEP,Houston,5,6,NA,260562638,2006-02-25
97,1,4:19,1459,1459,Houston Defensive Rebound.,21,25,-4,4,0.36670015809774387,0.36670015809774387,UTEP,Houston,5,6,NA,260562638,2006-02-25
98,1,4:15,1455,1455,Foul on Stefon Jackson,21,25,-4,3,0.3664538835096488,0.3664538835096488,UTEP,Houston,5,6,NA,260562638,2006-02-25
99,1,4:12,1452,1452,Jahmar Thorpe made Two Point Jumper.,21,27,-6,37,0.3052557948009557,0.3052557948009557,UTEP,Houston,5,6,NA,260562638,2006-02-25
100,1,3:35,1415,1415,Kevin Henderson made Two Point Jumper.,23,27,-4,8,0.3640306309440788,0.3640306309440788,UTEP,Houston,5,6,NA,260562638,2006-02-25
101,1,3:27,1407,1407,Official TV Timeout.,23,27,-4,29,0.36356556901434633,0.36356556901434633,UTEP,Houston,5,6,NA,260562638,2006-02-25
102,1,2:58,1378,1378,Edgar Moreno missed Two Point Layup.,23,27,-4,0,0.3619112843602141,0.3619112843602141,UTEP,Houston,5,6,NA,260562638,2006-02-25
103,1,2:58,1378,1378,Oliver Lafayette Defensive Rebound.,23,27,-4,12,0.3619112843602141,0.3619112843602141,UTEP,Houston,5,6,NA,260562638,2006-02-25
104,1,2:46,1366,1366,Chris Lawson missed Two Point Layup.,23,27,-4,0,0.3612338890398025,0.3612338890398025,UTEP,Houston,5,6,NA,260562638,2006-02-25
105,1,2:46,1366,1366,UTEP Defensive Rebound.,23,27,-4,2,0.3612338890398025,0.3612338890398025,UTEP,Houston,5,6,NA,260562638,2006-02-25
106,1,2:44,1364,1364,Foul on Jahmar Thorpe,23,27,-4,0,0.3611210307779102,0.3611210307779102,UTEP,Houston,5,6,NA,260562638,2006-02-25
107,1,2:44,1364,1364,Miguel Ayala made Free Throw.,24,27,-3,0,0.39463354224349684,0.39463354224349684,UTEP,Houston,5,6,NA,260562638,2006-02-25
108,1,2:44,1364,1364,Miguel Ayala made Free Throw.,25,27,-2,18,0.42916691321159245,0.42916691321159245,UTEP,Houston,5,6,NA,260562638,2006-02-25
109,1,2:26,1346,1346,Jahmar Thorpe missed Two Point Jumper.,25,27,-2,0,0.4286258230819935,0.4286258230819935,UTEP,Houston,5,6,NA,260562638,2006-02-25
110,1,2:26,1346,1346,Miguel Ayala Defensive Rebound.,25,27,-2,13,0.4286258230819935,0.4286258230819935,UTEP,Houston,5,6,NA,260562638,2006-02-25
111,1,2:13,1333,1333,Kevin Henderson made Two Point Jumper.,27,27,0,21,0.5,0.5,UTEP,Houston,5,6,NA,260562638,2006-02-25
112,1,1:52,1312,1312,Lanny Smith missed Two Point Jumper.,27,27,0,0,0.5,0.5,UTEP,Houston,5,6,NA,260562638,2006-02-25
113,1,1:52,1312,1312,Jason Williams Defensive Rebound.,27,27,0,18,0.5,0.5,UTEP,Houston,5,6,NA,260562638,2006-02-25
114,1,1:34,1294,1294,Oliver Lafayette missed Three Point Jumper.,27,27,0,0,0.5,0.5,UTEP,Houston,5,6,NA,260562638,2006-02-25
115,1,1:34,1294,1294,Will Kimble Defensive Rebound.,27,27,0,5,0.5,0.5,UTEP,Houston,5,6,NA,260562638,2006-02-25
116,1,1:29,1289,1289,Foul on Chris Lawson,27,27,0,0,0.5,0.5,UTEP,Houston,5,6,NA,260562638,2006-02-25
117,1,1:29,1289,1289,Will Kimble made Free Throw.,28,27,1,0,0.5367790810008528,0.5367790810008528,UTEP,Houston,5,6,NA,260562638,2006-02-25
118,1,1:29,1289,1289,Will Kimble made Free Throw.,29,27,2,14,0.5731622952208199,0.5731622952208199,UTEP,Houston,5,6,NA,260562638,2006-02-25
119,1,1:15,1275,1275,Lanny Smith missed Three Point Jumper.,29,27,2,0,0.5736330030156834,0.5736330030156834,UTEP,Houston,5,6,NA,260562638,2006-02-25
120,1,1:15,1275,1275,Edgar Moreno Defensive Rebound.,29,27,2,23,0.5736330030156834,0.5736330030156834,UTEP,Houston,5,6,NA,260562638,2006-02-25
121,1,0:52,1252,1252,Edgar Moreno missed Two Point Jumper.,29,27,2,0,0.5744460673606648,0.5744460673606648,UTEP,Houston,5,6,NA,260562638,2006-02-25
122,1,0:52,1252,1252,Jason Williams Offensive Rebound.,29,27,2,11,0.5744460673606648,0.5744460673606648,UTEP,Houston,5,6,NA,260562638,2006-02-25
123,1,0:41,1241,1241,UTEP Full Timeout.,29,27,2,18,0.5748552562656751,0.5748552562656751,UTEP,Houston,5,5,NA,260562638,2006-02-25
124,1,0:23,1223,1223,Foul on Lanny Smith,29,27,2,0,0.5755575300958228,0.5755575300958228,UTEP,Houston,5,5,NA,260562638,2006-02-25
125,1,0:23,1223,1223,Kevin Henderson made Free Throw.,30,27,3,0,0.6122652364083959,0.6122652364083959,UTEP,Houston,5,5,NA,260562638,2006-02-25
126,1,0:23,1223,1223,Kevin Henderson made Free Throw.,31,27,4,18,0.6477412756690643,0.6477412756690643,UTEP,Houston,5,5,NA,260562638,2006-02-25
127,1,0:05,1205,1205,Foul on Miguel Ayala,31,27,4,3,0.649131248360961,0.649131248360961,UTEP,Houston,5,5,NA,260562638,2006-02-25
128,1,0:02,1202,1202,Miguel Ayala missed Three Point Jumper.,31,27,4,0,0.649363644672055,0.649363644672055,UTEP,Houston,5,5,NA,260562638,2006-02-25
129,1,0:02,1202,1202,Houston Defensive Rebound.,31,27,4,2,0.649363644672055,0.649363644672055,UTEP,Houston,5,5,NA,260562638,2006-02-25
130,1,0:00,1200,1200,End of the 1st Half.,31,27,4,0,0.6495177425372646,0.6495177425372646,UTEP,Houston,5,5,NA,260562638,2006-02-25
131,2,20:00,1200,1200,PLAY,31,27,4,11,0.6495177425372646,0.6495177425372646,UTEP,Houston,5,5,NA,260562638,2006-02-25
132,2,19:49,1189,1189,Jason Williams made Two Point Layup.,33,27,6,37,0.7172569525956486,0.7172569525956486,UTEP,Houston,5,5,NA,260562638,2006-02-25
133,2,19:12,1152,1152,Brian Latham missed Three Point Jumper.,33,27,6,0,0.7208816793668602,0.7208816793668602,UTEP,Houston,5,5,NA,260562638,2006-02-25
134,2,19:12,1152,1152,Stefon Jackson Defensive Rebound.,33,27,6,30,0.7208816793668602,0.7208816793668602,UTEP,Houston,5,5,NA,260562638,2006-02-25
135,2,18:42,1122,1122,Kevin Henderson missed Two Point Jumper.,33,27,6,0,0.7237475659927155,0.7237475659927155,UTEP,Houston,5,5,NA,260562638,2006-02-25
136,2,18:42,1122,1122,Ramon Dyer Defensive Rebound.,33,27,6,13,0.7237475659927155,0.7237475659927155,UTEP,Houston,5,5,NA,260562638,2006-02-25
137,2,18:29,1109,1109,Brian Latham made Two Point Layup.,33,29,4,0,0.6561639995233887,0.6561639995233887,UTEP,Houston,5,5,NA,260562638,2006-02-25
138,2,18:29,1109,1109,Foul on Edgar Moreno,33,29,4,0,0.6561639995233887,0.6561639995233887,UTEP,Houston,5,5,NA,260562638,2006-02-25
139,2,18:29,1109,1109,Brian Latham missed Free Throw.,33,29,4,0,0.6561639995233887,0.6561639995233887,UTEP,Houston,5,5,NA,260562638,2006-02-25
140,2,18:29,1109,1109,Will Kimble Defensive Rebound.,33,29,4,23,0.6561639995233887,0.6561639995233887,UTEP,Houston,5,5,NA,260562638,2006-02-25
141,2,18:06,1086,1086,Foul on Jahmar Thorpe,33,29,4,0,0.6578563981476865,0.6578563981476865,UTEP,Houston,5,5,NA,260562638,2006-02-25
142,2,18:06,1086,1086,Jason Williams made Free Throw.,34,29,5,0,0.6936406268606925,0.6936406268606925,UTEP,Houston,5,5,NA,260562638,2006-02-25
143,2,18:06,1086,1086,Jason Williams made Free Throw.,35,29,6,18,0.7272340364304489,0.7272340364304489,UTEP,Houston,5,5,NA,260562638,2006-02-25
144,2,17:48,1068,1068,Lanny Smith missed Two Point Jumper.,35,29,6,0,0.7290401247306533,0.7290401247306533,UTEP,Houston,5,5,NA,260562638,2006-02-25
145,2,17:48,1068,1068,Jason Williams Defensive Rebound.,35,29,6,49,0.7290401247306533,0.7290401247306533,UTEP,Houston,5,5,NA,260562638,2006-02-25
146,2,16:59,1019,1019,Kevin Henderson missed Three Point Jumper.,35,29,6,0,0.7343430157954569,0.7343430157954569,UTEP,Houston,5,5,NA,260562638,2006-02-25
147,2,16:59,1019,1019,Ramon Dyer Defensive Rebound.,35,29,6,12,0.7343430157954569,0.7343430157954569,UTEP,Houston,5,5,NA,260562638,2006-02-25
148,2,16:47,1007,1007,Lanny Smith missed Two Point Jumper.,35,29,6,0,0.7357565613406836,0.7357565613406836,UTEP,Houston,5,5,NA,260562638,2006-02-25
149,2,16:47,1007,1007,Stefon Jackson Defensive Rebound.,35,29,6,19,0.7357565613406836,0.7357565613406836,UTEP,Houston,5,5,NA,260562638,2006-02-25
150,2,16:28,988,988,Foul on Stefon Jackson,35,29,6,23,0.7381097000961511,0.7381097000961511,UTEP,Houston,5,5,NA,260562638,2006-02-25
151,2,16:05,965,965,Ramon Dyer made Three Point Jumper.,35,32,3,27,0.6285468633573071,0.6285468633573071,UTEP,Houston,5,5,NA,260562638,2006-02-25
152,2,15:38,938,938,Official TV Timeout.,35,32,3,2,0.630561332878253,0.630561332878253,UTEP,Houston,5,5,NA,260562638,2006-02-25
153,2,15:36,936,936,Foul on Sam Anderson,35,32,3,20,0.6306999429139066,0.6306999429139066,UTEP,Houston,5,5,NA,260562638,2006-02-25
154,2,15:16,916,916,Edgar Moreno missed Three Point Jumper.,35,32,3,0,0.6320259920538343,0.6320259920538343,UTEP,Houston,5,5,NA,260562638,2006-02-25
155,2,15:16,916,916,Oliver Lafayette Defensive Rebound.,35,32,3,7,0.6320259920538343,0.6320259920538343,UTEP,Houston,5,5,NA,260562638,2006-02-25
156,2,15:09,909,909,Oliver Lafayette made Three Point Jumper.,35,35,0,23,0.5,0.5,UTEP,Houston,5,5,NA,260562638,2006-02-25
157,2,14:46,886,886,Will Kimble missed Two Point Jumper.,35,35,0,2,0.5,0.5,UTEP,Houston,5,5,NA,260562638,2006-02-25
158,2,14:44,884,884,Ramon Dyer Defensive Rebound.,35,35,0,9,0.5,0.5,UTEP,Houston,5,5,NA,260562638,2006-02-25
159,2,14:35,875,875,Oliver Lafayette made Three Point Jumper.,35,38,-3,25,0.3654486781233497,0.3654486781233497,UTEP,Houston,5,5,NA,260562638,2006-02-25
160,2,14:10,850,850,Kevin Henderson missed Three Point Jumper.,35,38,-3,0,0.3639035490079873,0.3639035490079873,UTEP,Houston,5,5,NA,260562638,2006-02-25
161,2,14:10,850,850,Ramon Dyer Defensive Rebound.,35,38,-3,15,0.3639035490079873,0.3639035490079873,UTEP,Houston,5,5,NA,260562638,2006-02-25
162,2,13:55,835,835,Oliver Lafayette made Two Point Jumper.,35,40,-5,9,0.28134764425349934,0.28134764425349934,UTEP,Houston,5,5,NA,260562638,2006-02-25
163,2,13:46,826,826,UTEP Full Timeout.,35,40,-5,0,0.2804574375651646,0.2804574375651646,UTEP,Houston,5,4,NA,260562638,2006-02-25
164,2,13:46,826,826,Foul,35,40,-5,0,0.2804574375651646,0.2804574375651646,UTEP,Houston,5,4,NA,260562638,2006-02-25
165,2,13:46,826,826,Oliver Lafayette missed Free Throw.,35,40,-5,0,0.2804574375651646,0.2804574375651646,UTEP,Houston,5,4,NA,260562638,2006-02-25
166,2,13:46,826,826,Houston Defensive Rebound.,35,40,-5,0,0.2804574375651646,0.2804574375651646,UTEP,Houston,5,4,NA,260562638,2006-02-25
167,2,13:46,826,826,Oliver Lafayette missed Free Throw.,35,40,-5,0,0.2804574375651646,0.2804574375651646,UTEP,Houston,5,4,NA,260562638,2006-02-25
168,2,13:46,826,826,Houston Defensive Rebound.,35,40,-5,7,0.2804574375651646,0.2804574375651646,UTEP,Houston,5,4,NA,260562638,2006-02-25
169,2,13:39,819,819,Foul on Lanny Smith,35,40,-5,0,0.2797410409964508,0.2797410409964508,UTEP,Houston,5,4,NA,260562638,2006-02-25
170,2,13:39,819,819,Miguel Ayala made Free Throw.,36,40,-4,0,0.31938550796767134,0.31938550796767134,UTEP,Houston,5,4,NA,260562638,2006-02-25
171,2,13:39,819,819,Miguel Ayala made Free Throw.,37,40,-3,13,0.3618259181562054,0.3618259181562054,UTEP,Houston,5,4,NA,260562638,2006-02-25
172,2,13:26,806,806,Oliver Lafayette missed Three Point Jumper.,37,40,-3,0,0.36086512596984965,0.36086512596984965,UTEP,Houston,5,4,NA,260562638,2006-02-25
173,2,13:26,806,806,Miguel Ayala Defensive Rebound.,37,40,-3,11,0.36086512596984965,0.36086512596984965,UTEP,Houston,5,4,NA,260562638,2006-02-25
174,2,13:15,795,795,Jason Williams made Three Point Jumper.,40,40,0,7,0.5,0.5,UTEP,Houston,5,4,NA,260562638,2006-02-25
175,2,13:08,788,788,Houston Full Timeout.,40,40,0,18,0.5,0.5,UTEP,Houston,4,4,NA,260562638,2006-02-25
176,2,12:50,770,770,Ramon Dyer missed Three Point Jumper.,40,40,0,0,0.5,0.5,UTEP,Houston,4,4,NA,260562638,2006-02-25
177,2,12:50,770,770,Edgar Moreno Defensive Rebound.,40,40,0,22,0.5,0.5,UTEP,Houston,4,4,NA,260562638,2006-02-25
178,2,12:28,748,748,Edgar Moreno missed Two Point Layup.,40,40,0,4,0.5,0.5,UTEP,Houston,4,4,NA,260562638,2006-02-25
179,2,12:24,744,744,Houston Defensive Rebound.,40,40,0,11,0.5,0.5,UTEP,Houston,4,4,NA,260562638,2006-02-25
180,2,12:13,733,733,Brian Latham missed Two Point Layup.,40,40,0,0,0.5,0.5,UTEP,Houston,4,4,NA,260562638,2006-02-25
181,2,12:13,733,733,Jason Williams Defensive Rebound.,40,40,0,20,0.5,0.5,UTEP,Houston,4,4,NA,260562638,2006-02-25
182,2,11:53,713,713,Kevin Henderson missed Two Point Jumper.,40,40,0,0,0.5,0.5,UTEP,Houston,4,4,NA,260562638,2006-02-25
183,2,11:53,713,713,Jason Williams Offensive Rebound.,40,40,0,19,0.5,0.5,UTEP,Houston,4,4,NA,260562638,2006-02-25
184,2,11:34,694,694,Miguel Ayala made Three Point Jumper.,43,40,3,23,0.6504607075683512,0.6504607075683512,UTEP,Houston,4,4,NA,260562638,2006-02-25
185,2,11:11,671,671,Oliver Lafayette made Two Point Jumper.,43,42,1,24,0.5523518987565235,0.5523518987565235,UTEP,Houston,4,4,NA,260562638,2006-02-25
186,2,10:47,647,647,Ramon Dyer made Three Point Jumper.,43,45,-2,22,0.3948922890778918,0.3948922890778918,UTEP,Houston,4,4,NA,260562638,2006-02-25
187,2,10:25,625,625,Foul on Kevin Henderson,43,45,-2,0,0.3933926371899241,0.3933926371899241,UTEP,Houston,4,4,NA,260562638,2006-02-25
188,2,10:25,625,625,Official TV Timeout.,43,45,-2,0,0.3933926371899241,0.3933926371899241,UTEP,Houston,4,4,NA,260562638,2006-02-25
189,2,10:25,625,625,Ramon Dyer made Free Throw.,43,46,-3,0,0.3430773574113254,0.3430773574113254,UTEP,Houston,4,4,NA,260562638,2006-02-25
