play_id,half,time_remaining_half,secs_remaining,secs_remaining_absolute,description,home_score,away_score,score_diff,play_length,win_prob,naive_win_prob,home,away,home_time_out_remaining,away_time_out_remaining,home_favored_by,game_id,date
190,2,10:25,625,625,Ramon Dyer made Free Throw.,43,47,-4,19,0.29605664518162084,0.29605664518162084,UTEP,Houston,4,4,NA,260562638,2006-02-25
191,2,10:06,606,606,Edgar Moreno made Two Point Layup.,45,47,-2,39,0.39194091736114245,0.39194091736114245,UTEP,Houston,4,4,NA,260562638,2006-02-25
192,2,9:27,567,567,Oliver Lafayette missed Three Point Jumper.,45,47,-2,0,0.3881933868349289,0.3881933868349289,UTEP,Houston,4,4,NA,260562638,2006-02-25
193,2,9:27,567,567,UTEP Defensive Rebound.,45,47,-2,21,0.3881933868349289,0.3881933868349289,UTEP,Houston,4,4,NA,260562638,2006-02-25
194,2,9:06,546,546,Kevin Henderson missed Two Point Jumper.,45,47,-2,0,0.3856004096711528,0.3856004096711528,UTEP,Houston,4,4,NA,260562638,2006-02-25
195,2,9:06,546,546,Ramon Dyer Defensive Rebound.,45,47,-2,8,0.3856004096711528,0.3856004096711528,UTEP,Houston,4,4,NA,260562638,2006-02-25
196,2,8:58,538,538,Oliver Lafayette missed Three Point Jumper.,45,47,-2,0,0.384643160263557,0.384643160263557,UTEP,Houston,4,4,NA,260562638,2006-02-25
197,2,8:58,538,538,Oliver Lafayette Offensive Rebound.,45,47,-2,18,0.384643160263557,0.384643160263557,UTEP,Houston,4,4,NA,260562638,2006-02-25
198,2,8:40,520,520,Ramon Dyer missed Three Point Jumper.,45,47,-2,0,0.38274908851978334,0.38274908851978334,UTEP,Houston,4,4,NA,260562638,2006-02-25
199,2,8:40,520,520,Jahmar Thorpe Offensive Rebound.,45,47,-2,22,0.38274908851978334,0.38274908851978334,UTEP,Houston,4,4,NA,260562638,2006-02-25
200,2,8:18,498,498,Brian Latham missed Three Point Jumper.,45,47,-2,0,0.3806603338280721,0.3806603338280721,UTEP,Houston,4,4,NA,260562638,2006-02-25
201,2,8:18,498,498,Stefon Jackson Defensive Rebound.,45,47,-2,22,0.3806603338280721,0.3806603338280721,UTEP,Houston,4,4,NA,260562638,2006-02-25
202,2,7:56,476,476,Miguel Ayala missed Three Point Jumper.,45,47,-2,0,0.3784505684381414,0.3784505684381414,UTEP,Houston,4,4,NA,260562638,2006-02-25
203,2,7:56,476,476,Jason Williams Offensive Rebound.,45,47,-2,3,0.3784505684381414,0.3784505684381414,UTEP,Houston,4,4,NA,260562638,2006-02-25
204,2,7:53,473,473,Jason Williams made Two Point Tip Shot.,47,47,0,0,0.5,0.5,UTEP,Houston,4,4,NA,260562638,2006-02-25
205,2,7:53,473,473,Foul on Lanny Smith,47,47,0,0,0.5,0.5,UTEP,Houston,4,4,NA,260562638,2006-02-25
206,2,7:53,473,473,Official TV Timeout.,47,47,0,0,0.5,0.5,UTEP,Houston,4,4,NA,260562638,2006-02-25
207,2,7:53,473,473,Jason Williams missed Free Throw.,47,47,0,0,0.5,0.5,UTEP,Houston,4,4,NA,260562638,2006-02-25
208,2,7:53,473,473,Ramon Dyer Defensive Rebound.,47,47,0,14,0.5,0.5,UTEP,Houston,4,4,NA,260562638,2006-02-25
209,2,7:39,459,459,Foul on Jahmar Thorpe,47,47,0,19,0.5,0.5,UTEP,Houston,4,4,NA,260562638,2006-02-25
210,2,7:20,440,440,Jason Williams missed Two Point Jumper.,47,47,0,0,0.5,0.5,UTEP,Houston,4,4,NA,260562638,2006-02-25
211,2,7:20,440,440,Lanny Smith Defensive Rebound.,47,47,0,12,0.5,0.5,UTEP,Houston,4,4,NA,260562638,2006-02-25
212,2,7:08,428,428,Oliver Lafayette missed Three Point Jumper.,47,47,0,0,0.5,0.5,UTEP,Houston,4,4,NA,260562638,2006-02-25
213,2,7:08,428,428,Maurice Thomas Defensive Rebound.,47,47,0,18,0.5,0.5,UTEP,Houston,4,4,NA,260562638,2006-02-25
214,2,6:50,410,410,Miguel Ayala made Two Point Layup.,49,47,2,20,0.6319327100829653,0.6319327100829653,UTEP,Houston,4,4,NA,260562638,2006-02-25
215,2,6:30,390,390,Oliver Lafayette made Two Point Jumper.,49,49,0,16,0.5,0.5,UTEP,Houston,4,4,NA,260562638,2006-02-25
216,2,6:14,374,374,Stefon Jackson made Two Point Layup.,51,49,2,29,0.638102822949975,0.638102822949975,UTEP,Houston,4,4,NA,260562638,2006-02-25
217,2,5:45,345,345,Will Kimble made Two Point Jumper.,53,49,4,9,0.7658245912549276,0.7658245912549276,UTEP,Houston,4,4,NA,260562638,2006-02-25
218,2,5:36,336,336,Lanny Smith missed Three Point Jumper.,53,49,4,0,0.7691801050575933,0.7691801050575933,UTEP,Houston,4,4,NA,260562638,2006-02-25
219,2,5:36,336,336,Houston Defensive Rebound.,53,49,4,14,0.7691801050575933,0.7691801050575933,UTEP,Houston,4,4,NA,260562638,2006-02-25
220,2,5:22,322,322,Oliver Lafayette missed Two Point Jumper.,53,49,4,0,0.7750384346846437,0.7750384346846437,UTEP,Houston,4,4,NA,260562638,2006-02-25
221,2,5:22,322,322,Will Kimble Defensive Rebound.,53,49,4,2,0.7750384346846437,0.7750384346846437,UTEP,Houston,4,4,NA,260562638,2006-02-25
222,2,5:20,320,320,Sam Anderson missed Two Point Jumper.,53,49,4,0,0.7759458905641907,0.7759458905641907,UTEP,Houston,4,4,NA,260562638,2006-02-25
223,2,5:20,320,320,Stefon Jackson Defensive Rebound.,53,49,4,14,0.7759458905641907,0.7759458905641907,UTEP,Houston,4,4,NA,260562638,2006-02-25
224,2,5:06,306,306,Foul on Sam Anderson,53,49,4,0,0.7825640840408896,0.7825640840408896,UTEP,Houston,4,4,NA,260562638,2006-02-25
225,2,5:06,306,306,Edgar Moreno missed Free Throw.,53,49,4,0,0.7825640840408896,0.7825640840408896,UTEP,Houston,4,4,NA,260562638,2006-02-25
226,2,5:06,306,306,UTEP Defensive Rebound.,53,49,4,0,0.7825640840408896,0.7825640840408896,UTEP,Houston,4,4,NA,260562638,2006-02-25
227,2,5:06,306,306,Edgar Moreno made Free Throw.,54,49,5,10,0.8321356924737466,0.8321356924737466,UTEP,Houston,4,4,NA,260562638,2006-02-25
228,2,4:56,296,296,Foul on Miguel Ayala,54,49,5,0,0.8348232789985344,0.8348232789985344,UTEP,Houston,4,4,NA,260562638,2006-02-25
229,2,4:56,296,296,Houston Full Timeout.,54,49,5,2,0.8348232789985344,0.8348232789985344,UTEP,Houston,3,4,NA,260562638,2006-02-25
230,2,4:54,294,294,Lanny Smith made Three Point Jumper.,54,52,2,22,0.6567460244255955,0.6567460244255955,UTEP,Houston,3,4,NA,260562638,2006-02-25
231,2,4:32,272,272,Miguel Ayala made Three Point Jumper.,57,52,5,13,0.8336984162854664,0.8336984162854664,UTEP,Houston,3,4,NA,260562638,2006-02-25
232,2,4:19,259,259,Foul on Stefon Jackson,57,52,5,13,0.8310052626029227,0.8310052626029227,UTEP,Houston,3,4,NA,260562638,2006-02-25
233,2,4:06,246,246,Lanny Smith missed Three Point Jumper.,57,52,5,0,0.8286277520063664,0.8286277520063664,UTEP,Houston,3,4,NA,260562638,2006-02-25
234,2,4:06,246,246,Sam Anderson Offensive Rebound.,57,52,5,4,0.8286277520063664,0.8286277520063664,UTEP,Houston,3,4,NA,260562638,2006-02-25
235,2,4:02,242,242,Foul on Will Kimble,57,52,5,0,0.8281837470632057,0.8281837470632057,UTEP,Houston,3,4,NA,260562638,2006-02-25
236,2,4:02,242,242,Sam Anderson made Free Throw.,57,53,4,0,0.7787242857790659,0.7787242857790659,UTEP,Houston,3,4,NA,260562638,2006-02-25
237,2,4:02,242,242,Sam Anderson made Free Throw.,57,54,3,13,0.7198435425302546,0.7198435425302546,UTEP,Houston,3,4,NA,260562638,2006-02-25
238,2,3:49,229,229,Foul on Oliver Lafayette,57,54,3,0,0.720037774507312,0.720037774507312,UTEP,Houston,3,4,NA,260562638,2006-02-25
239,2,3:49,229,229,Official TV Timeout.,57,54,3,0,0.720037774507312,0.720037774507312,UTEP,Houston,3,4,NA,260562638,2006-02-25
240,2,3:49,229,229,Will Kimble missed Free Throw.,57,54,3,0,0.720037774507312,0.720037774507312,UTEP,Houston,3,4,NA,260562638,2006-02-25
241,2,3:49,229,229,UTEP Defensive Rebound.,57,54,3,0,0.720037774507312,0.720037774507312,UTEP,Houston,3,4,NA,260562638,2006-02-25
242,2,3:49,229,229,Will Kimble made Free Throw.,58,54,4,20,0.7789455313960615,0.7789455313960615,UTEP,Houston,3,4,NA,260562638,2006-02-25
243,2,3:29,209,209,Sam Anderson missed Three Point Jumper.,58,54,4,0,0.786598789756779,0.786598789756779,UTEP,Houston,3,4,NA,260562638,2006-02-25
244,2,3:29,209,209,Oliver Lafayette Offensive Rebound.,58,54,4,5,0.786598789756779,0.786598789756779,UTEP,Houston,3,4,NA,260562638,2006-02-25
245,2,3:24,204,204,Oliver Lafayette missed Two Point Jumper.,58,54,4,0,0.7903200451157407,0.7903200451157407,UTEP,Houston,3,4,NA,260562638,2006-02-25
246,2,3:24,204,204,Stefon Jackson Defensive Rebound.,58,54,4,25,0.7903200451157407,0.7903200451157407,UTEP,Houston,3,4,NA,260562638,2006-02-25
247,2,2:59,179,179,Jason Williams missed Two Point Jumper.,58,54,4,0,0.8192826775292665,0.8192826775292665,UTEP,Houston,3,4,NA,260562638,2006-02-25
248,2,2:59,179,179,Lanny Smith Defensive Rebound.,58,54,4,20,0.8192826775292665,0.8192826775292665,UTEP,Houston,3,4,NA,260562638,2006-02-25
249,2,2:39,159,159,Lanny Smith missed Two Point Jumper.,58,54,4,0,0.8440850815210622,0.8440850815210622,UTEP,Houston,3,4,NA,260562638,2006-02-25
250,2,2:39,159,159,Houston Defensive Rebound.,58,54,4,7,0.8440850815210622,0.8440850815210622,UTEP,Houston,3,4,NA,260562638,2006-02-25
251,2,2:32,152,152,Ramon Dyer made Three Point Jumper.,58,57,1,12,0.608044049140897,0.608044049140897,UTEP,Houston,3,4,NA,260562638,2006-02-25
252,2,2:20,140,140,UTEP Full Timeout.,58,57,1,23,0.6154684702287646,0.6154684702287646,UTEP,Houston,3,3,NA,260562638,2006-02-25
253,2,1:57,117,117,Kevin Henderson made Three Point Jumper.,61,57,4,13,0.8971196403848772,0.8971196403848772,UTEP,Houston,3,3,NA,260562638,2006-02-25
254,2,1:44,104,104,Lanny Smith made Two Point Layup.,61,59,2,0,0.7649157168185727,0.7649157168185727,UTEP,Houston,3,3,NA,260562638,2006-02-25
255,2,1:44,104,104,Foul on Will Kimble,61,59,2,0,0.7649157168185727,0.7649157168185727,UTEP,Houston,3,3,NA,260562638,2006-02-25
256,2,1:44,104,104,Lanny Smith made Free Throw.,61,60,1,22,0.6433446733019577,0.6433446733019577,UTEP,Houston,3,3,NA,260562638,2006-02-25
257,2,1:22,82,82,Foul on Brian Latham,61,60,1,0,0.6651502239660979,0.6651502239660979,UTEP,Houston,3,3,NA,260562638,2006-02-25
258,2,1:22,82,82,Will Kimble missed Free Throw.,61,60,1,0,0.6651502239660979,0.6651502239660979,UTEP,Houston,3,3,NA,260562638,2006-02-25
259,2,1:22,82,82,Ramon Dyer Defensive Rebound.,61,60,1,33,0.6651502239660979,0.6651502239660979,UTEP,Houston,3,3,NA,260562638,2006-02-25
260,2,0:49,49,49,Lanny Smith missed Two Point Jumper.,61,60,1,0,0.7020917340231612,0.7020917340231612,UTEP,Houston,3,3,NA,260562638,2006-02-25
261,2,0:49,49,49,Will Kimble Defensive Rebound.,61,60,1,4,0.7020917340231612,0.7020917340231612,UTEP,Houston,3,3,NA,260562638,2006-02-25
262,2,0:45,45,45,Foul on Lanny Smith,61,60,1,0,0.7068788910482673,0.7068788910482673,UTEP,Houston,3,3,NA,260562638,2006-02-25
263,2,0:45,45,45,Will Kimble made Free Throw.,62,60,2,0,0.8532781515154971,0.8532781515154971,UTEP,Houston,3,3,NA,260562638,2006-02-25
264,2,0:45,45,45,Will Kimble made Free Throw.,63,60,3,19,0.9334429554452127,0.9334429554452127,UTEP,Houston,3,3,NA,260562638,2006-02-25
265,2,0:26,26,26,Oliver Lafayette missed Three Point Jumper.,63,60,3,0,0.9521275880889845,0.9521275880889845,UTEP,Houston,3,3,NA,260562638,2006-02-25
266,2,0:26,26,26,Will Kimble Defensive Rebound.,63,60,3,3,0.9521275880889845,0.9521275880889845,UTEP,Houston,3,3,NA,260562638,2006-02-25
267,2,0:23,23,23,Foul on Jahmar Thorpe,63,60,3,0,0.954692519920652,0.954692519920652,UTEP,Houston,3,3,NA,260562638,2006-02-25
268,2,0:23,23,23,Will Kimble made Free Throw.,64,60,4,0,0.983108178118838,0.983108178118838,UTEP,Houston,3,3,NA,260562638,2006-02-25
269,2,0:23,23,23,Will Kimble made Free Throw.,65,60,5,0,0.9938176910562189,0.9938176910562189,UTEP,Houston,3,3,NA,260562638,2006-02-25
270,2,0:23,23,23,Houston Full Timeout.,65,60,5,8,0.9938176910562189,0.9938176910562189,UTEP,Houston,2,3,NA,260562638,2006-02-25
271,2,0:15,15,15,Brian Latham made Three Point Jumper.,65,63,2,1,0.8945836042239772,0.8945836042239772,UTEP,Houston,2,3,NA,260562638,2006-02-25
272,2,0:14,14,14,Houston Full Timeout.,65,63,2,1,0.8958722919593005,0.8958722919593005,UTEP,Houston,1,3,NA,260562638,2006-02-25
273,2,0:13,13,13,Foul on Chris Lawson,65,63,2,0,0.8971548885029107,0.8971548885029107,UTEP,Houston,1,3,NA,260562638,2006-02-25
274,2,0:13,13,13,Miguel Ayala made Free Throw.,66,63,3,0,0.9626374017851668,0.9626374017851668,UTEP,Houston,1,3,NA,260562638,2006-02-25
275,2,0:13,13,13,Miguel Ayala made Free Throw.,67,63,4,5,0.9870293270859739,0.9870293270859739,UTEP,Houston,1,3,NA,260562638,2006-02-25
276,2,0:08,8,8,Lanny Smith missed Three Point Jumper.,67,63,4,0,0.9887112925767356,0.9887112925767356,UTEP,Houston,1,3,NA,260562638,2006-02-25
277,2,0:08,8,8,Oliver Lafayette Offensive Rebound.,67,63,4,1,0.9887112925767356,0.9887112925767356,UTEP,Houston,1,3,NA,260562638,2006-02-25
278,2,0:07,7,7,Oliver Lafayette missed Two Point Jumper.,67,63,4,0,0.9890254881298493,0.9890254881298493,UTEP,Houston,1,3,NA,260562638,2006-02-25
279,2,0:07,7,7,Jason Williams Defensive Rebound.,67,63,4,6,0.9890254881298493,0.9890254881298493,UTEP,Houston,1,3,NA,260562638,2006-02-25
280,2,0:01,1,1,Foul on Chris Lawson,67,63,4,0,0.9907597515972705,0.9907597515972705,UTEP,Houston,1,3,NA,260562638,2006-02-25
281,2,0:01,1,1,Jason Williams made Free Throw.,68,63,5,0,0.9971100707139258,0.9971100707139258,UTEP,Houston,1,3,NA,260562638,2006-02-25
282,2,0:01,1,1,Jason Williams made Free Throw.,69,63,6,1,0.9991001254907949,0.9991001254907949,UTEP,Houston,1,3,NA,260562638,2006-02-25
283,2,0:00,0,0,End Game,69,63,6,0,1,1,UTEP,Houston,1,3,NA,260562638,2006-02-25
