play_id,half,time_remaining_half,secs_remaining,secs_remaining_absolute,description,home_score,away_score,score_diff,play_length,win_prob,naive_win_prob,home,away,home_time_out_remaining,away_time_out_remaining,home_favored_by,game_id,date
1,1,20:00,2400,2400,PLAY,0,0,0,22,0.5,0.5,Nevada,Stanislaus State,4,4,NA,273652440,2007-12-31
2,1,19:38,2378,2378,Foul on Terry Johnson,0,0,0,0,0.5,0.5,Nevada,Stanislaus State,4,4,NA,273652440,2007-12-31
3,1,19:38,2378,2378,JaVale McGee made Free Throw.,1,0,1,0,0.5222893388630724,0.5222893388630724,Nevada,Stanislaus State,4,4,NA,273652440,2007-12-31
4,1,19:38,2378,2378,JaVale McGee missed Free Throw.,1,0,1,0,0.5222893388630724,0.5222893388630724,Nevada,Stanislaus State,4,4,NA,273652440,2007-12-31
5,1,19:38,2378,2378,Scott Behrs Defensive Rebound.,1,0,1,10,0.5222893388630724,0.5222893388630724,Nevada,Stanislaus State,4,4,NA,273652440,2007-12-31
6,1,19:28,2368,2368,Scott Behrs missed Two Point Jumper.,1,0,1,0,0.5223965953861575,0.5223965953861575,Nevada,Stanislaus State,4,4,NA,273652440,2007-12-31
7,1,19:28,2368,2368,Stanislaus State Offensive Rebou.,1,0,1,2,0.5223965953861575,0.5223965953861575,Nevada,Stanislaus State,4,4,NA,273652440,2007-12-31
8,1,19:26,2366,2366,Scott Behrs missed Three Point Jumper.,1,0,1,1,0.5224181316854085,0.5224181316854085,Nevada,Stanislaus State,4,4,NA,273652440,2007-12-31
9,1,19:25,2365,2365,Marcelus Kemp Defensive Rebound.,1,0,1,6,0.5224289102880342,0.5224289102880342,Nevada,Stanislaus State,4,4,NA,273652440,2007-12-31
10,1,19:19,2359,2359,Heath Colvin Steal.,1,0,1,2,0.5224937265852554,0.5224937265852554,Nevada,Stanislaus State,4,4,NA,273652440,2007-12-31
11,1,19:17,2357,2357,Heath Colvin made Two Point Layup.  Assisted by Scott Behrs.,1,2,-1,34,0.47748461349816307,0.47748461349816307,Nevada,Stanislaus State,4,4,NA,273652440,2007-12-31
12,1,18:43,2323,2323,Matt LaGrone made Two Point Jumper.  Assisted by Armon Johnson.,3,2,1,19,0.5228875473071123,0.5228875473071123,Nevada,Stanislaus State,4,4,NA,273652440,2007-12-31
13,1,18:24,2304,2304,Duane Jones missed Three Point Jumper.,3,2,1,0,0.5230985195738199,0.5230985195738199,Nevada,Stanislaus State,4,4,NA,273652440,2007-12-31
14,1,18:24,2304,2304,Marcelus Kemp Defensive Rebound.,3,2,1,5,0.5230985195738199,0.5230985195738199,Nevada,Stanislaus State,4,4,NA,273652440,2007-12-31
15,1,18:19,2299,2299,Marcelus Kemp made Two Point Jumper.,5,2,3,19,0.569068399832925,0.569068399832925,Nevada,Stanislaus State,4,4,NA,273652440,2007-12-31
16,1,18:00,2280,2280,Heath Colvin missed Two Point Jumper.,5,2,3,0,0.5696975480563956,0.5696975480563956,Nevada,Stanislaus State,4,4,NA,273652440,2007-12-31
17,1,18:00,2280,2280,JaVale McGee Defensive Rebound.,5,2,3,9,0.5696975480563956,0.5696975480563956,Nevada,Stanislaus State,4,4,NA,273652440,2007-12-31
18,1,17:51,2271,2271,Brandon Fields missed Two Point Layup.,5,2,3,0,0.5699972718782212,0.5699972718782212,Nevada,Stanislaus State,4,4,NA,273652440,2007-12-31
19,1,17:51,2271,2271,Terry Johnson Defensive Rebound.,5,2,3,12,0.5699972718782212,0.5699972718782212,Nevada,Stanislaus State,4,4,NA,273652440,2007-12-31
20,1,17:39,2259,2259,Scott Behrs missed Three Point Jumper.,5,2,3,0,0.5703984778225291,0.5703984778225291,Nevada,Stanislaus State,4,4,NA,273652440,2007-12-31
21,1,17:39,2259,2259,Matt LaGrone Defensive Rebound.,5,2,3,9,0.5703984778225291,0.5703984778225291,Nevada,Stanislaus State,4,4,NA,273652440,2007-12-31
22,1,17:30,2250,2250,Armon Johnson made Two Point Jumper.,7,2,5,0,0.6164521127449056,0.6164521127449056,Nevada,Stanislaus State,4,4,NA,273652440,2007-12-31
23,1,17:30,2250,2250,Foul on Duane Jones,7,2,5,0,0.6164521127449056,0.6164521127449056,Nevada,Stanislaus State,4,4,NA,273652440,2007-12-31
24,1,17:30,2250,2250,Armon Johnson missed Free Throw.,7,2,5,0,0.6164521127449056,0.6164521127449056,Nevada,Stanislaus State,4,4,NA,273652440,2007-12-31
25,1,17:30,2250,2250,JaVale McGee Offensive Rebound.,7,2,5,4,0.6164521127449056,0.6164521127449056,Nevada,Stanislaus State,4,4,NA,273652440,2007-12-31
26,1,17:26,2246,2246,JaVale McGee made Two Point Jumper.,9,2,7,8,0.6605180693441508,0.6605180693441508,Nevada,Stanislaus State,4,4,NA,273652440,2007-12-31
27,1,17:18,2238,2238,Calvin Westbrook missed Three Point Jumper.,9,2,7,0,0.6610935226942992,0.6610935226942992,Nevada,Stanislaus State,4,4,NA,273652440,2007-12-31
28,1,17:18,2238,2238,Matt LaGrone Defensive Rebound.,9,2,7,2,0.6610935226942992,0.6610935226942992,Nevada,Stanislaus State,4,4,NA,273652440,2007-12-31
29,1,17:16,2236,2236,Marcelus Kemp made Two Point Jumper.  Assisted by Armon Johnson.,11,2,9,5,0.7026405359332039,0.7026405359332039,Nevada,Stanislaus State,4,4,NA,273652440,2007-12-31
30,1,17:11,2231,2231,Stanislaus State 20 Second Timeout.,11,2,9,12,0.7030725613622842,0.7030725613622842,Nevada,Stanislaus State,4,3,NA,273652440,2007-12-31
31,1,16:59,2219,2219,Rick Cardoso made Two Point Layup.  Assisted by Heath Colvin.,11,4,7,16,0.6624639744653497,0.6624639744653497,Nevada,Stanislaus State,4,3,NA,273652440,2007-12-31
32,1,16:43,2203,2203,Matt LaGrone made Two Point Layup.  Assisted by Marcelus Kemp.,13,4,9,17,0.7054963617467002,0.7054963617467002,Nevada,Stanislaus State,4,3,NA,273652440,2007-12-31
33,1,16:26,2186,2186,Foul on Brandon Fields,13,4,9,0,0.7069702897650955,0.7069702897650955,Nevada,Stanislaus State,4,3,NA,273652440,2007-12-31
34,1,16:26,2186,2186,Duane Jones made Free Throw.,13,5,8,0,0.686295634141988,0.686295634141988,Nevada,Stanislaus State,4,3,NA,273652440,2007-12-31
35,1,16:26,2186,2186,Duane Jones made Free Throw.,13,6,7,16,0.6648537914690626,0.6648537914690626,Nevada,Stanislaus State,4,3,NA,273652440,2007-12-31
36,1,16:10,2170,2170,Marcelus Kemp missed Two Point Jumper.,13,6,7,0,0.6660153229891113,0.6660153229891113,Nevada,Stanislaus State,4,3,NA,273652440,2007-12-31
37,1,16:10,2170,2170,JaVale McGee Offensive Rebound.,13,6,7,3,0.6660153229891113,0.6660153229891113,Nevada,Stanislaus State,4,3,NA,273652440,2007-12-31
38,1,16:07,2167,2167,JaVale McGee missed Two Point Dunk Shot.,13,6,7,0,0.6662332863321478,0.6662332863321478,Nevada,Stanislaus State,4,3,NA,273652440,2007-12-31
39,1,16:07,2167,2167,JaVale McGee Offensive Rebound.,13,6,7,3,0.6662332863321478,0.6662332863321478,Nevada,Stanislaus State,4,3,NA,273652440,2007-12-31
40,1,16:04,2164,2164,Heath Colvin Steal.,13,6,7,16,0.6664513914832957,0.6664513914832957,Nevada,Stanislaus State,4,3,NA,273652440,2007-12-31
41,1,15:48,2148,2148,Rick Cardoso made Two Point Jumper.  Assisted by Duane Jones.,13,8,5,14,0.6220273784098609,0.6220273784098609,Nevada,Stanislaus State,4,3,NA,273652440,2007-12-31
42,1,15:34,2134,2134,Brandon Fields made Two Point Layup.  Assisted by Matt LaGrone.,15,8,7,15,0.6686408125853904,0.6686408125853904,Nevada,Stanislaus State,4,3,NA,273652440,2007-12-31
43,1,15:19,2119,2119,Scott Behrs made Three Point Jumper.  Assisted by Duane Jones.,15,11,4,9,0.5996506876673924,0.5996506876673924,Nevada,Stanislaus State,4,3,NA,273652440,2007-12-31
44,1,15:10,2110,2110,Official TV Timeout.,15,11,4,13,0.6000618603830782,0.6000618603830782,Nevada,Stanislaus State,4,3,NA,273652440,2007-12-31
45,1,14:57,2097,2097,Duane Jones made Two Point Jumper.,15,13,2,21,0.5508496210603158,0.5508496210603158,Nevada,Stanislaus State,4,3,NA,273652440,2007-12-31
46,1,14:36,2076,2076,Marcelus Kemp made Two Point Jumper.  Assisted by Malik Cooke.,17,13,4,12,0.6016276921538536,0.6016276921538536,Nevada,Stanislaus State,4,3,NA,273652440,2007-12-31
47,1,14:24,2064,2064,Duane Jones made Three Point Jumper.  Assisted by Chris Hayes.,17,16,1,2,0.525888030926191,0.525888030926191,Nevada,Stanislaus State,4,3,NA,273652440,2007-12-31
48,1,14:22,2062,2062,Nevada 20 Second Timeout.,17,16,1,11,0.5259122868853792,0.5259122868853792,Nevada,Stanislaus State,4,2,NA,273652440,2007-12-31
49,1,14:11,2051,2051,Foul on Terry Johnson,17,16,1,24,0.5260460953741875,0.5260460953741875,Nevada,Stanislaus State,4,2,NA,273652440,2007-12-31
50,1,13:47,2027,2027,Rick Cardoso missed Two Point Jumper.,17,16,1,1,0.526340483256421,0.526340483256421,Nevada,Stanislaus State,4,2,NA,273652440,2007-12-31
51,1,13:46,2026,2026,Marcelus Kemp Defensive Rebound.,17,16,1,8,0.5263528246544972,0.5263528246544972,Nevada,Stanislaus State,4,2,NA,273652440,2007-12-31
52,1,13:38,2018,2018,Marcelus Kemp made Two Point Jumper.,19,16,3,19,0.5787680061771149,0.5787680061771149,Nevada,Stanislaus State,4,2,NA,273652440,2007-12-31
53,1,13:19,1999,1999,Rick Cardoso missed Two Point Jumper.,19,16,3,0,0.5794621409675412,0.5794621409675412,Nevada,Stanislaus State,4,2,NA,273652440,2007-12-31
54,1,13:19,1999,1999,JaVale McGee Defensive Rebound.,19,16,3,7,0.5794621409675412,0.5794621409675412,Nevada,Stanislaus State,4,2,NA,273652440,2007-12-31
55,1,13:12,1992,1992,Marcelus Kemp missed Three Point Jumper.,19,16,3,0,0.5797195545264839,0.5797195545264839,Nevada,Stanislaus State,4,2,NA,273652440,2007-12-31
56,1,13:12,1992,1992,Rick Cardoso Defensive Rebound.,19,16,3,17,0.5797195545264839,0.5797195545264839,Nevada,Stanislaus State,4,2,NA,273652440,2007-12-31
57,1,12:55,1975,1975,Rick Cardoso made Two Point Layup.  Assisted by Duane Jones.,19,18,1,25,0.5269907890532686,0.5269907890532686,Nevada,Stanislaus State,4,2,NA,273652440,2007-12-31
58,1,12:30,1950,1950,Demarshay Johnson missed Two Point Jumper.,19,18,1,0,0.5273100595418571,0.5273100595418571,Nevada,Stanislaus State,4,2,NA,273652440,2007-12-31
59,1,12:30,1950,1950,JaVale McGee Offensive Rebound.,19,18,1,0,0.5273100595418571,0.5273100595418571,Nevada,Stanislaus State,4,2,NA,273652440,2007-12-31
60,1,12:30,1950,1950,Foul on Chris Hayes,19,18,1,0,0.5273100595418571,0.5273100595418571,Nevada,Stanislaus State,4,2,NA,273652440,2007-12-31
61,1,12:30,1950,1950,JaVale McGee made Free Throw.,20,18,2,0,0.5544576524428375,0.5544576524428375,Nevada,Stanislaus State,4,2,NA,273652440,2007-12-31
62,1,12:30,1950,1950,JaVale McGee made Free Throw.,21,18,3,10,0.5812841552338529,0.5812841552338529,Nevada,Stanislaus State,4,2,NA,273652440,2007-12-31
63,1,12:20,1940,1940,Malik Cooke Steal.,21,18,3,13,0.5816620089641811,0.5816620089641811,Nevada,Stanislaus State,4,2,NA,273652440,2007-12-31
64,1,12:07,1927,1927,Brandon Fields made Two Point Jumper.  Assisted by Demarshay Johnson.,23,18,5,14,0.6347662425970636,0.6347662425970636,Nevada,Stanislaus State,4,2,NA,273652440,2007-12-31
65,1,11:53,1913,1913,Duane Jones missed Two Point Jumper.,23,18,5,0,0.6356118535653895,0.6356118535653895,Nevada,Stanislaus State,4,2,NA,273652440,2007-12-31
66,1,11:53,1913,1913,Duane Jones Offensive Rebound.,23,18,5,6,0.6356118535653895,0.6356118535653895,Nevada,Stanislaus State,4,2,NA,273652440,2007-12-31
67,1,11:47,1907,1907,Duane Jones missed Two Point Jumper.,23,18,5,0,0.6359735848978677,0.6359735848978677,Nevada,Stanislaus State,4,2,NA,273652440,2007-12-31
68,1,11:47,1907,1907,Malik Cooke Defensive Rebound.,23,18,5,10,0.6359735848978677,0.6359735848978677,Nevada,Stanislaus State,4,2,NA,273652440,2007-12-31
69,1,11:37,1897,1897,Malik Cooke missed Three Point Jumper.,23,18,5,0,0.6365758609465011,0.6365758609465011,Nevada,Stanislaus State,4,2,NA,273652440,2007-12-31
70,1,11:37,1897,1897,David Ellis Offensive Rebound.,23,18,5,9,0.6365758609465011,0.6365758609465011,Nevada,Stanislaus State,4,2,NA,273652440,2007-12-31
71,1,11:28,1888,1888,Demarshay Johnson made Two Point Dunk Shot.  Assisted by Lyndale Burleson.,25,18,7,12,0.68740712281824,0.68740712281824,Nevada,Stanislaus State,4,2,NA,273652440,2007-12-31
72,1,11:16,1876,1876,Brandon Fields Steal.,25,18,7,4,0.6883463176509409,0.6883463176509409,Nevada,Stanislaus State,4,2,NA,273652440,2007-12-31
73,1,11:12,1872,1872,Lyndale Burleson made Three Point Jumper.  Assisted by Brandon Fields.,28,18,10,38,0.7565918183627506,0.7565918183627506,Nevada,Stanislaus State,4,2,NA,273652440,2007-12-31
74,1,10:34,1834,1834,Duane Jones missed Two Point Layup.,28,18,10,0,0.7602368891737407,0.7602368891737407,Nevada,Stanislaus State,4,2,NA,273652440,2007-12-31
75,1,10:34,1834,1834,Lyndale Burleson Defensive Rebound.,28,18,10,1,0.7602368891737407,0.7602368891737407,Nevada,Stanislaus State,4,2,NA,273652440,2007-12-31
76,1,10:33,1833,1833,Foul on Demarshay Johnson,28,18,10,0,0.7603328598563159,0.7603328598563159,Nevada,Stanislaus State,4,2,NA,273652440,2007-12-31
77,1,10:33,1833,1833,Official TV Timeout.,28,18,10,25,0.7603328598563159,0.7603328598563159,Nevada,Stanislaus State,4,2,NA,273652440,2007-12-31
78,1,10:08,1808,1808,Heath Colvin missed Two Point Jumper.,28,18,10,1,0.7627366543246825,0.7627366543246825,Nevada,Stanislaus State,4,2,NA,273652440,2007-12-31
79,1,10:07,1807,1807,Matt LaGrone Defensive Rebound.,28,18,10,18,0.7628330489617402,0.7628330489617402,Nevada,Stanislaus State,4,2,NA,273652440,2007-12-31
80,1,9:49,1789,1789,J.R. Cassita made Three Point Jumper.  Assisted by Scott Behrs.,28,21,7,44,0.6951992655772931,0.6951992655772931,Nevada,Stanislaus State,4,2,NA,273652440,2007-12-31
81,1,9:05,1745,1745,J.R. Cassita missed Three Point Jumper.,28,21,7,0,0.6987558667568223,0.6987558667568223,Nevada,Stanislaus State,4,2,NA,273652440,2007-12-31
82,1,9:05,1745,1745,Malik Cooke Defensive Rebound.,28,21,7,7,0.6987558667568223,0.6987558667568223,Nevada,Stanislaus State,4,2,NA,273652440,2007-12-31
83,1,8:58,1738,1738,Brandon Fields made Three Point Jumper.,31,21,10,21,0.7695685602993798,0.7695685602993798,Nevada,Stanislaus State,4,2,NA,273652440,2007-12-31
84,1,8:37,1717,1717,Casey Fletcher missed Two Point Layup.,31,21,10,0,0.7716655923618526,0.7716655923618526,Nevada,Stanislaus State,4,2,NA,273652440,2007-12-31
85,1,8:37,1717,1717,Matt LaGrone Defensive Rebound.,31,21,10,9,0.7716655923618526,0.7716655923618526,Nevada,Stanislaus State,4,2,NA,273652440,2007-12-31
86,1,8:28,1708,1708,Brandon Fields made Three Point Jumper.  Assisted by Matt LaGrone.,34,21,13,10,0.830583397030067,0.830583397030067,Nevada,Stanislaus State,4,2,NA,273652440,2007-12-31
87,1,8:18,1698,1698,Scott Behrs missed Three Point Jumper.,34,21,13,0,0.8316393908953384,0.8316393908953384,Nevada,Stanislaus State,4,2,NA,273652440,2007-12-31
88,1,8:18,1698,1698,Matt LaGrone Defensive Rebound.,34,21,13,16,0.8316393908953384,0.8316393908953384,Nevada,Stanislaus State,4,2,NA,273652440,2007-12-31
89,1,8:02,1682,1682,Foul on Casey Fletcher,34,21,13,0,0.833332375421656,0.833332375421656,Nevada,Stanislaus State,4,2,NA,273652440,2007-12-31
90,1,8:02,1682,1682,Matt LaGrone made Free Throw.,35,21,14,0,0.849825540619972,0.849825540619972,Nevada,Stanislaus State,4,2,NA,273652440,2007-12-31
91,1,8:02,1682,1682,Matt LaGrone made Free Throw.,36,21,15,21,0.864951070637424,0.864951070637424,Nevada,Stanislaus State,4,2,NA,273652440,2007-12-31
92,1,7:41,1661,1661,Justin Clardy made Three Point Jumper.  Assisted by Rick Cardoso.,36,24,12,19,0.8175777214868598,0.8175777214868598,Nevada,Stanislaus State,4,2,NA,273652440,2007-12-31
93,1,7:22,1642,1642,Official TV Timeout.,36,24,12,42,0.8194683461891803,0.8194683461891803,Nevada,Stanislaus State,4,2,NA,273652440,2007-12-31
94,1,6:40,1600,1600,Duane Jones Steal.,36,24,12,11,0.8235164207934446,0.8235164207934446,Nevada,Stanislaus State,4,2,NA,273652440,2007-12-31
95,1,6:29,1589,1589,Rick Cardoso missed Three Point Jumper.,36,24,12,0,0.8245607420914514,0.8245607420914514,Nevada,Stanislaus State,4,2,NA,273652440,2007-12-31
96,1,6:29,1589,1589,Marcelus Kemp Defensive Rebound.,36,24,12,3,0.8245607420914514,0.8245607420914514,Nevada,Stanislaus State,4,2,NA,273652440,2007-12-31
97,1,6:26,1586,1586,Foul on Casey Fletcher,36,24,12,17,0.8248451708175287,0.8248451708175287,Nevada,Stanislaus State,4,2,NA,273652440,2007-12-31
98,1,6:09,1569,1569,Demarshay Johnson missed Two Point Jumper.,36,24,12,0,0.8264571021701547,0.8264571021701547,Nevada,Stanislaus State,4,2,NA,273652440,2007-12-31
99,1,6:09,1569,1569,JaVale McGee Offensive Rebound.,36,24,12,2,0.8264571021701547,0.8264571021701547,Nevada,Stanislaus State,4,2,NA,273652440,2007-12-31
100,1,6:07,1567,1567,JaVale McGee made Two Point Layup.,38,24,14,25,0.8608525678215917,0.8608525678215917,Nevada,Stanislaus State,4,2,NA,273652440,2007-12-31
101,1,5:42,1542,1542,Marcelus Kemp missed Three Point Jumper.,38,24,14,0,0.8631775175105739,0.8631775175105739,Nevada,Stanislaus State,4,2,NA,273652440,2007-12-31
102,1,5:42,1542,1542,Calvin Westbrook Offensive Rebound.,38,24,14,5,0.8631775175105739,0.8631775175105739,Nevada,Stanislaus State,4,2,NA,273652440,2007-12-31
103,1,5:37,1537,1537,Rick Cardoso missed Two Point Layup.,38,24,14,0,0.8636459905548367,0.8636459905548367,Nevada,Stanislaus State,4,2,NA,273652440,2007-12-31
104,1,5:37,1537,1537,Rick Cardoso Offensive Rebound.,38,24,14,0,0.8636459905548367,0.8636459905548367,Nevada,Stanislaus State,4,2,NA,273652440,2007-12-31
105,1,5:37,1537,1537,Rick Cardoso missed Two Point Layup.,38,24,14,0,0.8636459905548367,0.8636459905548367,Nevada,Stanislaus State,4,2,NA,273652440,2007-12-31
106,1,5:37,1537,1537,Rick Cardoso Offensive Rebound.,38,24,14,0,0.8636459905548367,0.8636459905548367,Nevada,Stanislaus State,4,2,NA,273652440,2007-12-31
107,1,5:37,1537,1537,Calvin Westbrook made Three Point Jumper.,38,27,11,2,0.8100533135121876,0.8100533135121876,Nevada,Stanislaus State,4,2,NA,273652440,2007-12-31
108,1,5:35,1535,1535,JaVale McGee made Two Point Dunk Shot.,40,27,13,5,0.8475534463799917,0.8475534463799917,Nevada,Stanislaus State,4,2,NA,273652440,2007-12-31
109,1,5:30,1530,1530,Rick Cardoso missed Two Point Jumper.,40,27,13,0,0.84803377514633,0.84803377514633,Nevada,Stanislaus State,4,2,NA,273652440,2007-12-31
110,1,5:30,1530,1530,JaVale McGee Defensive Rebound.,40,27,13,3,0.84803377514633,0.84803377514633,Nevada,Stanislaus State,4,2,NA,273652440,2007-12-31
111,1,5:27,1527,1527,Demarshay Johnson made Two Point Dunk Shot.,42,27,15,3,0.8793570257773553,0.8793570257773553,Nevada,Stanislaus State,4,2,NA,273652440,2007-12-31
112,1,5:24,1524,1524,Duane Jones missed Three Point Jumper.,42,27,15,0,0.8796328708501557,0.8796328708501557,Nevada,Stanislaus State,4,2,NA,273652440,2007-12-31
113,1,5:24,1524,1524,Ray Kraemer Defensive Rebound.,42,27,15,58,0.8796328708501557,0.8796328708501557,Nevada,Stanislaus State,4,2,NA,273652440,2007-12-31
114,1,4:26,1466,1466,Foul on Duane Jones,42,27,15,0,0.8851498678542216,0.8851498678542216,Nevada,Stanislaus State,4,2,NA,273652440,2007-12-31
115,1,4:26,1466,1466,Marcelus Kemp made Free Throw.,43,27,16,0,0.8982811820142138,0.8982811820142138,Nevada,Stanislaus State,4,2,NA,273652440,2007-12-31
116,1,4:26,1466,1466,Marcelus Kemp made Free Throw.,44,27,17,17,0.9100636828503516,0.9100636828503516,Nevada,Stanislaus State,4,2,NA,273652440,2007-12-31
117,1,4:09,1449,1449,Heath Colvin missed Two Point Jumper.,44,27,17,0,0.9116176069013695,0.9116176069013695,Nevada,Stanislaus State,4,2,NA,273652440,2007-12-31
118,1,4:09,1449,1449,Heath Colvin Offensive Rebound.,44,27,17,1,0.9116176069013695,0.9116176069013695,Nevada,Stanislaus State,4,2,NA,273652440,2007-12-31
119,1,4:08,1448,1448,Heath Colvin missed Three Point Jumper.,44,27,17,0,0.9117096198536402,0.9117096198536402,Nevada,Stanislaus State,4,2,NA,273652440,2007-12-31
120,1,4:08,1448,1448,Malik Cooke Defensive Rebound.,44,27,17,15,0.9117096198536402,0.9117096198536402,Nevada,Stanislaus State,4,2,NA,273652440,2007-12-31
121,1,3:53,1433,1433,JaVale McGee made Two Point Layup.  Assisted by Malik Cooke.,46,27,19,8,0.9326536089251399,0.9326536089251399,Nevada,Stanislaus State,4,2,NA,273652440,2007-12-31
122,1,3:45,1425,1425,Calvin Westbrook missed Two Point Jumper.,46,27,19,0,0.9332674562558567,0.9332674562558567,Nevada,Stanislaus State,4,2,NA,273652440,2007-12-31
123,1,3:45,1425,1425,Malik Cooke Defensive Rebound.,46,27,19,7,0.9332674562558567,0.9332674562558567,Nevada,Stanislaus State,4,2,NA,273652440,2007-12-31
124,1,3:38,1418,1418,Official TV Timeout.,46,27,19,9,0.9337935718401091,0.9337935718401091,Nevada,Stanislaus State,4,2,NA,273652440,2007-12-31
125,1,3:29,1409,1409,Heath Colvin made Two Point Layup.,46,29,17,14,0.9150985481371691,0.9150985481371691,Nevada,Stanislaus State,4,2,NA,273652440,2007-12-31
126,1,3:15,1395,1395,Brandon Fields missed Three Point Jumper.,46,29,17,0,0.9162407932665315,0.9162407932665315,Nevada,Stanislaus State,4,2,NA,273652440,2007-12-31
127,1,3:15,1395,1395,JaVale McGee Offensive Rebound.,46,29,17,4,0.9162407932665315,0.9162407932665315,Nevada,Stanislaus State,4,2,NA,273652440,2007-12-31
128,1,3:11,1391,1391,JaVale McGee missed Two Point Layup.,46,29,17,0,0.9165619501932507,0.9165619501932507,Nevada,Stanislaus State,4,2,NA,273652440,2007-12-31
129,1,3:11,1391,1391,Scott Behrs Defensive Rebound.,46,29,17,4,0.9165619501932507,0.9165619501932507,Nevada,Stanislaus State,4,2,NA,273652440,2007-12-31
130,1,3:07,1387,1387,Calvin Westbrook made Two Point Layup.  Assisted by Scott Behrs.,46,31,15,22,0.8926662854123868,0.8926662854123868,Nevada,Stanislaus State,4,2,NA,273652440,2007-12-31
131,1,2:45,1365,1365,JaVale McGee made Two Point Jumper.  Assisted by Brandon Fields.,48,31,17,9,0.9186088165369397,0.9186088165369397,Nevada,Stanislaus State,4,2,NA,273652440,2007-12-31
132,1,2:36,1356,1356,Scott Behrs missed Three Point Jumper.,48,31,17,0,0.9193062925309138,0.9193062925309138,Nevada,Stanislaus State,4,2,NA,273652440,2007-12-31
133,1,2:36,1356,1356,Armon Johnson Defensive Rebound.,48,31,17,5,0.9193062925309138,0.9193062925309138,Nevada,Stanislaus State,4,2,NA,273652440,2007-12-31
134,1,2:31,1351,1351,Armon Johnson made Three Point Jumper.,51,31,20,23,0.9462642207353801,0.9462642207353801,Nevada,Stanislaus State,4,2,NA,273652440,2007-12-31
135,1,2:08,1328,1328,Foul on Lyndale Burleson,51,31,20,0,0.9476976313963673,0.9476976313963673,Nevada,Stanislaus State,4,2,NA,273652440,2007-12-31
136,1,2:08,1328,1328,Scott Behrs made Free Throw.,51,32,19,0,0.9400343290043461,0.9400343290043461,Nevada,Stanislaus State,4,2,NA,273652440,2007-12-31
137,1,2:08,1328,1328,Scott Behrs made Free Throw.,51,33,18,18,0.9313295654333194,0.9313295654333194,Nevada,Stanislaus State,4,2,NA,273652440,2007-12-31
138,1,1:50,1310,1310,David Ellis made Two Point Jumper.  Assisted by Malik Cooke.,53,33,20,22,0.9488224825428356,0.9488224825428356,Nevada,Stanislaus State,4,2,NA,273652440,2007-12-31
139,1,1:28,1288,1288,Calvin Westbrook made Two Point Jumper.,53,35,18,27,0.93426341395681,0.93426341395681,Nevada,Stanislaus State,4,2,NA,273652440,2007-12-31
140,1,1:01,1261,1261,Foul on Calvin Westbrook,53,35,18,0,0.9363256311039004,0.9363256311039004,Nevada,Stanislaus State,4,2,NA,273652440,2007-12-31
141,1,1:01,1261,1261,Armon Johnson made Free Throw.,54,35,19,0,0.9446702195216221,0.9446702195216221,Nevada,Stanislaus State,4,2,NA,273652440,2007-12-31
142,1,1:01,1261,1261,Armon Johnson missed Free Throw.,54,35,19,0,0.9446702195216221,0.9446702195216221,Nevada,Stanislaus State,4,2,NA,273652440,2007-12-31
143,1,1:01,1261,1261,Scott Behrs Defensive Rebound.,54,35,19,9,0.9446702195216221,0.9446702195216221,Nevada,Stanislaus State,4,2,NA,273652440,2007-12-31
144,1,0:52,1252,1252,Calvin Westbrook missed Three Point Jumper.,54,35,19,0,0.9453258146849931,0.9453258146849931,Nevada,Stanislaus State,4,2,NA,273652440,2007-12-31
145,1,0:52,1252,1252,David Ellis Defensive Rebound.,54,35,19,20,0.9453258146849931,0.9453258146849931,Nevada,Stanislaus State,4,2,NA,273652440,2007-12-31
146,1,0:32,1232,1232,Malik Cooke missed Three Point Jumper.,54,35,19,0,0.946822941310985,0.946822941310985,Nevada,Stanislaus State,4,2,NA,273652440,2007-12-31
147,1,0:32,1232,1232,Demarshay Johnson Offensive Rebound.,54,35,19,3,0.946822941310985,0.946822941310985,Nevada,Stanislaus State,4,2,NA,273652440,2007-12-31
148,1,0:29,1229,1229,Demarshay Johnson made Two Point Layup.,56,35,21,28,0.9603665879224991,0.9603665879224991,Nevada,Stanislaus State,4,2,NA,273652440,2007-12-31
149,1,0:01,1201,1201,Duane Jones missed Three Point Jumper.,56,35,21,1,0.9622051709243387,0.9622051709243387,Nevada,Stanislaus State,4,2,NA,273652440,2007-12-31
150,1,0:00,1200,1200,Nevada Defensive Rebound.,56,35,21,0,0.9622696665818932,0.9622696665818932,Nevada,Stanislaus State,4,2,NA,273652440,2007-12-31
151,1,0:00,1200,1200,End of the 1st Half.,56,35,21,0,0.9622696665818932,0.9622696665818932,Nevada,Stanislaus State,4,2,NA,273652440,2007-12-31
152,2,20:00,1200,1200,PLAY,56,35,21,11,0.9622696665818932,0.9622696665818932,Nevada,Stanislaus State,4,3,NA,273652440,2007-12-31
153,2,19:49,1189,1189,Brandon Fields missed Three Point Jumper.,56,35,21,0,0.9629643232673041,0.9629643232673041,Nevada,Stanislaus State,4,3,NA,273652440,2007-12-31
154,2,19:49,1189,1189,Matt LaGrone Offensive Rebound.,56,35,21,6,0.9629643232673041,0.9629643232673041,Nevada,Stanislaus State,4,3,NA,273652440,2007-12-31
155,2,19:43,1183,1183,Foul on JaVale McGee,56,35,21,15,0.9633326384676235,0.9633326384676235,Nevada,Stanislaus State,4,3,NA,273652440,2007-12-31
156,2,19:28,1168,1168,Duane Jones missed Two Point Layup.,56,35,21,0,0.9642251473485465,0.9642251473485465,Nevada,Stanislaus State,4,3,NA,273652440,2007-12-31
157,2,19:28,1168,1168,Nevada Defensive Rebound.,56,35,21,15,0.9642251473485465,0.9642251473485465,Nevada,Stanislaus State,4,3,NA,273652440,2007-12-31
158,2,19:13,1153,1153,JaVale McGee missed Two Point Layup.,56,35,21,0,0.9650838987291875,0.9650838987291875,Nevada,Stanislaus State,4,3,NA,273652440,2007-12-31
159,2,19:13,1153,1153,Nevada Offensive Rebound.,56,35,21,5,0.9650838987291875,0.9650838987291875,Nevada,Stanislaus State,4,3,NA,273652440,2007-12-31
160,2,19:08,1148,1148,Foul on Scott Behrs,56,35,21,0,0.9653640005379063,0.9653640005379063,Nevada,Stanislaus State,4,3,NA,273652440,2007-12-31
161,2,19:08,1148,1148,JaVale McGee made Free Throw.,57,35,22,0,0.9702887902594018,0.9702887902594018,Nevada,Stanislaus State,4,3,NA,273652440,2007-12-31
162,2,19:08,1148,1148,JaVale McGee made Free Throw.,58,35,23,6,0.9745318125118972,0.9745318125118972,Nevada,Stanislaus State,4,3,NA,273652440,2007-12-31
163,2,19:02,1142,1142,Heath Colvin made Two Point Layup.  Assisted by Duane Jones.,58,37,21,19,0.9656966898810712,0.9656966898810712,Nevada,Stanislaus State,4,3,NA,273652440,2007-12-31
