play_id,half,time_remaining_half,secs_remaining,secs_remaining_absolute,description,home_score,away_score,score_diff,play_length,win_prob,naive_win_prob,home,away,home_time_out_remaining,away_time_out_remaining,home_favored_by,game_id,date
1,1,20:00,2400,2400,PLAY,0,0,0,27,0.5,0.5,Clemson,Miami,6,6,NA,280580228,2008-02-27
2,1,19:33,2373,2373,James Mays missed Two Point Jumper.,0,0,0,0,0.5,0.5,Clemson,Miami,6,6,NA,280580228,2008-02-27
3,1,19:33,2373,2373,Sam Perry Offensive Rebound.,0,0,0,3,0.5,0.5,Clemson,Miami,6,6,NA,280580228,2008-02-27
4,1,19:30,2370,2370,Sam Perry missed Two Point Layup.,0,0,0,0,0.5,0.5,Clemson,Miami,6,6,NA,280580228,2008-02-27
5,1,19:30,2370,2370,James Mays Offensive Rebound.,0,0,0,3,0.5,0.5,Clemson,Miami,6,6,NA,280580228,2008-02-27
6,1,19:27,2367,2367,James Mays made Two Point Layup.,2,0,2,61,0.5447248964309589,0.5447248964309589,Clemson,Miami,6,6,NA,280580228,2008-02-27
7,1,18:26,2306,2306,Foul on James Dews,2,0,2,8,0.5460543386548282,0.5460543386548282,Clemson,Miami,6,6,NA,280580228,2008-02-27
8,1,18:18,2298,2298,Trevor Booker missed Two Point Layup.,2,0,2,0,0.546231860846261,0.546231860846261,Clemson,Miami,6,6,NA,280580228,2008-02-27
9,1,18:18,2298,2298,Jimmy Graham Defensive Rebound.,2,0,2,3,0.546231860846261,0.546231860846261,Clemson,Miami,6,6,NA,280580228,2008-02-27
10,1,18:15,2295,2295,Foul on Sam Perry,2,0,2,6,0.5462986002811664,0.5462986002811664,Clemson,Miami,6,6,NA,280580228,2008-02-27
11,1,18:09,2289,2289,James Dews missed Two Point Layup.,2,0,2,0,0.5464323470136655,0.5464323470136655,Clemson,Miami,6,6,NA,280580228,2008-02-27
12,1,18:09,2289,2289,James Mays Defensive Rebound.,2,0,2,61,0.5464323470136655,0.5464323470136655,Clemson,Miami,6,6,NA,280580228,2008-02-27
13,1,17:08,2228,2228,K.C. Rivers made Three Point Jumper.  Assisted by Cliff Hammonds.,5,0,5,19,0.6176448830241921,0.6176448830241921,Clemson,Miami,6,6,NA,280580228,2008-02-27
14,1,16:49,2209,2209,James Mays made Two Point Jumper.  Assisted by K.C. Rivers.,7,0,7,50,0.6631870729998225,0.6631870729998225,Clemson,Miami,6,6,NA,280580228,2008-02-27
15,1,15:59,2159,2159,James Mays made Three Point Jumper.  Assisted by K.C. Rivers.,10,0,10,24,0.7293180422247615,0.7293180422247615,Clemson,Miami,6,6,NA,280580228,2008-02-27
16,1,15:35,2135,2135,Lance Hurdle made Two Point Jumper.,10,2,8,11,0.6903932262651092,0.6903932262651092,Clemson,Miami,6,6,NA,280580228,2008-02-27
17,1,15:24,2124,2124,Foul on Trevor Booker,10,2,8,0,0.6912824160862694,0.6912824160862694,Clemson,Miami,6,6,NA,280580228,2008-02-27
18,1,15:24,2124,2124,Official TV Timeout.,10,2,8,41,0.6912824160862694,0.6912824160862694,Clemson,Miami,6,6,NA,280580228,2008-02-27
19,1,14:43,2083,2083,Demontez Stitt made Two Point Jumper.,12,2,10,34,0.7363823306420858,0.7363823306420858,Clemson,Miami,6,6,NA,280580228,2008-02-27
20,1,14:09,2049,2049,Jack McClinton made Two Point Layup.,12,4,8,18,0.6974139005057979,0.6974139005057979,Clemson,Miami,6,6,NA,280580228,2008-02-27
21,1,13:51,2031,2031,Foul on Jimmy Graham,12,4,8,0,0.6989061382951868,0.6989061382951868,Clemson,Miami,6,6,NA,280580228,2008-02-27
22,1,13:51,2031,2031,Raymond Sykes made Free Throw.,13,4,9,0,0.7205831787469349,0.7205831787469349,Clemson,Miami,6,6,NA,280580228,2008-02-27
23,1,13:51,2031,2031,Raymond Sykes made Free Throw.,14,4,10,2,0.7412773110651912,0.7412773110651912,Clemson,Miami,6,6,NA,280580228,2008-02-27
24,1,13:49,2029,2029,Foul on Demontez Stitt,14,4,10,20,0.7414668132400253,0.7414668132400253,Clemson,Miami,6,6,NA,280580228,2008-02-27
25,1,13:29,2009,2009,Foul on David Potter,14,4,10,5,0.7433673788050336,0.7433673788050336,Clemson,Miami,6,6,NA,280580228,2008-02-27
26,1,13:24,2004,2004,Dwayne Collins made Two Point Jumper.,14,6,8,7,0.7011617990539618,0.7011617990539618,Clemson,Miami,6,6,NA,280580228,2008-02-27
27,1,13:17,1997,1997,Terrence Oglesby made Three Point Jumper.  Assisted by Cliff Hammonds.,17,6,11,14,0.7643202995334908,0.7643202995334908,Clemson,Miami,6,6,NA,280580228,2008-02-27
28,1,13:03,1983,1983,Brian Asbury missed Two Point Jumper.,17,6,11,0,0.7657170990295498,0.7657170990295498,Clemson,Miami,6,6,NA,280580228,2008-02-27
29,1,13:03,1983,1983,Dwayne Collins Offensive Rebound.,17,6,11,25,0.7657170990295498,0.7657170990295498,Clemson,Miami,6,6,NA,280580228,2008-02-27
30,1,12:38,1958,1958,Foul on Sam Perry,17,6,11,1,0.7682238604069157,0.7682238604069157,Clemson,Miami,6,6,NA,280580228,2008-02-27
31,1,12:37,1957,1957,Cliff Hammonds Steal.,17,6,11,1,0.7683244778645428,0.7683244778645428,Clemson,Miami,6,6,NA,280580228,2008-02-27
32,1,12:36,1956,1956,K.C. Rivers made Three Point Jumper.  Assisted by Cliff Hammonds.,20,6,14,21,0.8215024174137858,0.8215024174137858,Clemson,Miami,6,6,NA,280580228,2008-02-27
33,1,12:15,1935,1935,Jack McClinton missed Two Point Jumper.,20,6,14,0,0.8237221030877291,0.8237221030877291,Clemson,Miami,6,6,NA,280580228,2008-02-27
34,1,12:15,1935,1935,Dwayne Collins Offensive Rebound.,20,6,14,3,0.8237221030877291,0.8237221030877291,Clemson,Miami,6,6,NA,280580228,2008-02-27
35,1,12:12,1932,1932,Dwayne Collins missed Two Point Layup.,20,6,14,0,0.8240396666682389,0.8240396666682389,Clemson,Miami,6,6,NA,280580228,2008-02-27
36,1,12:12,1932,1932,K.C. Rivers Defensive Rebound.,20,6,14,8,0.8240396666682389,0.8240396666682389,Clemson,Miami,6,6,NA,280580228,2008-02-27
37,1,12:04,1924,1924,Foul on Jimmy Graham,20,6,14,0,0.8248855905766707,0.8248855905766707,Clemson,Miami,6,6,NA,280580228,2008-02-27
38,1,12:04,1924,1924,Cliff Hammonds missed Free Throw.,20,6,14,0,0.8248855905766707,0.8248855905766707,Clemson,Miami,6,6,NA,280580228,2008-02-27
39,1,12:04,1924,1924,null,20,6,14,0,0.8248855905766707,0.8248855905766707,Clemson,Miami,6,6,NA,280580228,2008-02-27
40,1,12:04,1924,1924,Cliff Hammonds made Free Throw.,21,6,15,9,0.840305854044786,0.840305854044786,Clemson,Miami,6,6,NA,280580228,2008-02-27
41,1,11:55,1915,1915,Official TV Timeout.,21,6,15,56,0.8412479142034561,0.8412479142034561,Clemson,Miami,6,6,NA,280580228,2008-02-27
42,1,10:59,1859,1859,Lance Hurdle missed Three Point Jumper.,21,6,15,0,0.8470053144495919,0.8470053144495919,Clemson,Miami,6,6,NA,280580228,2008-02-27
43,1,10:59,1859,1859,Trevor Booker Defensive Rebound.,21,6,15,21,0.8470053144495919,0.8470053144495919,Clemson,Miami,6,6,NA,280580228,2008-02-27
44,1,10:38,1838,1838,Terrence Oglesby made Three Point Jumper.,24,6,18,13,0.8882881778361335,0.8882881778361335,Clemson,Miami,6,6,NA,280580228,2008-02-27
45,1,10:25,1825,1825,Foul on Terrence Oglesby,24,6,18,16,0.8895060504360147,0.8895060504360147,Clemson,Miami,6,6,NA,280580228,2008-02-27
46,1,10:09,1809,1809,James Dews made Two Point Jumper.,24,8,16,26,0.8661728558460682,0.8661728558460682,Clemson,Miami,6,6,NA,280580228,2008-02-27
47,1,9:43,1783,1783,Jerai Grant missed Two Point Jumper.,24,8,16,1,0.8687374986074038,0.8687374986074038,Clemson,Miami,6,6,NA,280580228,2008-02-27
48,1,9:42,1782,1782,Jerai Grant Offensive Rebound.,24,8,16,11,0.8688361063972695,0.8688361063972695,Clemson,Miami,6,6,NA,280580228,2008-02-27
49,1,9:31,1771,1771,David Potter missed Two Point Jumper.,24,8,16,0,0.8699210296804244,0.8699210296804244,Clemson,Miami,6,6,NA,280580228,2008-02-27
50,1,9:31,1771,1771,Anthony King Defensive Rebound.,24,8,16,8,0.8699210296804244,0.8699210296804244,Clemson,Miami,6,6,NA,280580228,2008-02-27
51,1,9:23,1763,1763,Brian Asbury made Three Point Jumper.  Assisted by Lance Hurdle.,24,11,13,25,0.8248625356242272,0.8248625356242272,Clemson,Miami,6,6,NA,280580228,2008-02-27
52,1,8:58,1738,1738,Cliff Hammonds made Three Point Jumper.,27,11,16,19,0.8731832899581384,0.8731832899581384,Clemson,Miami,6,6,NA,280580228,2008-02-27
53,1,8:39,1719,1719,Dwayne Collins missed Two Point Jumper.,27,11,16,0,0.875071063465534,0.875071063465534,Clemson,Miami,6,6,NA,280580228,2008-02-27
54,1,8:39,1719,1719,Cliff Hammonds Defensive Rebound.,27,11,16,10,0.875071063465534,0.875071063465534,Clemson,Miami,6,6,NA,280580228,2008-02-27
55,1,8:29,1709,1709,Cliff Hammonds missed Three Point Jumper.,27,11,16,0,0.8760686101599017,0.8760686101599017,Clemson,Miami,6,6,NA,280580228,2008-02-27
56,1,8:29,1709,1709,David Potter Offensive Rebound.,27,11,16,30,0.8760686101599017,0.8760686101599017,Clemson,Miami,6,6,NA,280580228,2008-02-27
57,1,7:59,1679,1679,Official TV Timeout.,27,11,16,23,0.879065835937854,0.879065835937854,Clemson,Miami,6,6,NA,280580228,2008-02-27
58,1,7:36,1656,1656,Lance Hurdle missed Two Point Jumper.,27,11,16,0,0.8812714340688487,0.8812714340688487,Clemson,Miami,6,6,NA,280580228,2008-02-27
59,1,7:36,1656,1656,Anthony King Offensive Rebound.,27,11,16,6,0.8812714340688487,0.8812714340688487,Clemson,Miami,6,6,NA,280580228,2008-02-27
60,1,7:30,1650,1650,Demontez Stitt Steal.,27,11,16,16,0.88183168785999555,0.88183168785999555,Clemson,Miami,6,6,NA,280580228,2008-02-27
61,1,7:14,1634,1634,Foul on David Potter,27,11,16,0,0.883300571842921,0.883300571842921,Clemson,Miami,6,6,NA,280580228,2008-02-27
62,1,7:14,1634,1634,Lance Hurdle missed Free Throw.,27,11,16,0,0.883300571842921,0.883300571842921,Clemson,Miami,6,6,NA,280580228,2008-02-27
63,1,7:14,1634,1634,null,27,11,16,0,0.883300571842921,0.883300571842921,Clemson,Miami,6,6,NA,280580228,2008-02-27
64,1,7:14,1634,1634,Lance Hurdle made Free Throw.,27,12,15,7,0.8696151060526162,0.8696151060526162,Clemson,Miami,6,6,NA,280580228,2008-02-27
65,1,7:07,1627,1627,K.C. Rivers made Three Point Jumper.  Assisted by Demontez Stitt.,30,12,18,27,0.9075426704415647,0.9075426704415647,Clemson,Miami,6,6,NA,280580228,2008-02-27
66,1,6:40,1600,1600,James Dews missed Two Point Jumper.,30,12,18,2,0.9097456681021595,0.9097456681021595,Clemson,Miami,6,6,NA,280580228,2008-02-27
67,1,6:38,1598,1598,Miami (FL) Offensive Rebound.,30,12,18,8,0.9099067116630768,0.9099067116630768,Clemson,Miami,6,6,NA,280580228,2008-02-27
68,1,6:30,1590,1590,Anthony King missed Two Point Jumper.,30,12,18,0,0.9105487594545432,0.9105487594545432,Clemson,Miami,6,6,NA,280580228,2008-02-27
69,1,6:30,1590,1590,K.C. Rivers Defensive Rebound.,30,12,18,12,0.9105487594545432,0.9105487594545432,Clemson,Miami,6,6,NA,280580228,2008-02-27
70,1,6:18,1578,1578,Foul on Eddie Rios,30,12,18,0,0.9115068711223964,0.9115068711223964,Clemson,Miami,6,6,NA,280580228,2008-02-27
71,1,6:18,1578,1578,Trevor Booker made Free Throw.,31,12,19,0,0.9214157072452919,0.9214157072452919,Clemson,Miami,6,6,NA,280580228,2008-02-27
72,1,6:18,1578,1578,Trevor Booker missed Free Throw.,31,12,19,0,0.9214157072452919,0.9214157072452919,Clemson,Miami,6,6,NA,280580228,2008-02-27
73,1,6:18,1578,1578,Dwayne Collins Defensive Rebound.,31,12,19,18,0.9214157072452919,0.9214157072452919,Clemson,Miami,6,6,NA,280580228,2008-02-27
74,1,6:00,1560,1560,James Mays Steal.,31,12,19,5,0.9227711772260085,0.9227711772260085,Clemson,Miami,6,6,NA,280580228,2008-02-27
75,1,5:55,1555,1555,Trevor Booker made Two Point Layup.,33,12,21,25,0.9397759671126997,0.9397759671126997,Clemson,Miami,6,6,NA,280580228,2008-02-27
76,1,5:30,1530,1530,Foul on James Mays,33,12,21,0,0.941435088522101,0.941435088522101,Clemson,Miami,6,6,NA,280580228,2008-02-27
77,1,5:30,1530,1530,Anthony King missed Free Throw.,33,12,21,0,0.941435088522101,0.941435088522101,Clemson,Miami,6,6,NA,280580228,2008-02-27
78,1,5:30,1530,1530,null,33,12,21,0,0.941435088522101,0.941435088522101,Clemson,Miami,6,6,NA,280580228,2008-02-27
79,1,5:30,1530,1530,Anthony King made Free Throw.,33,13,20,12,0.9337033079222302,0.9337033079222302,Clemson,Miami,6,6,NA,280580228,2008-02-27
80,1,5:18,1518,1518,Trevor Booker missed Two Point Jumper.,33,13,20,0,0.9345594093130197,0.9345594093130197,Clemson,Miami,6,6,NA,280580228,2008-02-27
81,1,5:18,1518,1518,James Dews Defensive Rebound.,33,13,20,13,0.9345594093130197,0.9345594093130197,Clemson,Miami,6,6,NA,280580228,2008-02-27
82,1,5:05,1505,1505,Anthony King missed Two Point Jumper.,33,13,20,0,0.935493726677924,0.935493726677924,Clemson,Miami,6,6,NA,280580228,2008-02-27
83,1,5:05,1505,1505,Dwayne Collins Offensive Rebound.,33,13,20,10,0.935493726677924,0.935493726677924,Clemson,Miami,6,6,NA,280580228,2008-02-27
84,1,4:55,1495,1495,Eddie Rios made Two Point Layup.,33,15,18,21,0.9181708379539539,0.9181708379539539,Clemson,Miami,6,6,NA,280580228,2008-02-27
85,1,4:34,1474,1474,Trevor Booker missed Two Point Jumper.,33,15,18,0,0.9199226821492378,0.9199226821492378,Clemson,Miami,6,6,NA,280580228,2008-02-27
86,1,4:34,1474,1474,Dwayne Collins Defensive Rebound.,33,15,18,11,0.9199226821492378,0.9199226821492378,Clemson,Miami,6,6,NA,280580228,2008-02-27
87,1,4:23,1463,1463,Eddie Rios made Two Point Jumper.,33,17,16,19,0.8985663947310936,0.8985663947310936,Clemson,Miami,6,6,NA,280580228,2008-02-27
88,1,4:04,1444,1444,Trevor Booker missed Two Point Jumper.,33,17,16,0,0.9003960337011253,0.9003960337011253,Clemson,Miami,6,6,NA,280580228,2008-02-27
89,1,4:04,1444,1444,Raymond Sykes Offensive Rebound.,33,17,16,3,0.9003960337011253,0.9003960337011253,Clemson,Miami,6,6,NA,280580228,2008-02-27
90,1,4:01,1441,1441,Raymond Sykes missed Two Point Layup.,33,17,16,0,0.9006811460540417,0.9006811460540417,Clemson,Miami,6,6,NA,280580228,2008-02-27
91,1,4:01,1441,1441,Anthony King Defensive Rebound.,33,17,16,10,0.9006811460540417,0.9006811460540417,Clemson,Miami,6,6,NA,280580228,2008-02-27
92,1,3:51,1431,1431,Dwayne Collins made Two Point Dunk Shot.  Assisted by Eddie Rios.,33,19,14,3,0.8741734968969382,0.8741734968969382,Clemson,Miami,6,6,NA,280580228,2008-02-27
93,1,3:48,1428,1428,Clemson 30 Second Timeout.,33,19,14,13,0.874471737310984,0.874471737310984,Clemson,Miami,6,5,NA,280580228,2008-02-27
94,1,3:35,1415,1415,Raymond Sykes made Two Point Layup.,35,19,16,20,0.9030558657319462,0.9030558657319462,Clemson,Miami,6,5,NA,280580228,2008-02-27
95,1,3:15,1395,1395,Official TV Timeout.,35,19,16,15,0.9047891159571432,0.9047891159571432,Clemson,Miami,6,5,NA,280580228,2008-02-27
96,1,3:00,1380,1380,Demontez Stitt made Two Point Jumper.,37,19,18,20,0.9275499097475606,0.9275499097475606,Clemson,Miami,6,5,NA,280580228,2008-02-27
97,1,2:40,1360,1360,Eddie Rios missed Two Point Layup.,37,19,18,2,0.929015468011028,0.929015468011028,Clemson,Miami,6,5,NA,280580228,2008-02-27
98,1,2:38,1358,1358,K.C. Rivers Defensive Rebound.,37,19,18,3,0.929160704924944,0.929160704924944,Clemson,Miami,6,5,NA,280580228,2008-02-27
99,1,2:35,1355,1355,Foul on Brian Asbury,37,19,18,7,0.9293782577113147,0.9293782577113147,Clemson,Miami,6,5,NA,280580228,2008-02-27
100,1,2:28,1348,1348,Demontez Stitt made Two Point Layup.,39,19,20,30,0.9464516225962107,0.9464516225962107,Clemson,Miami,6,5,NA,280580228,2008-02-27
101,1,1:58,1318,1318,Anthony King made Two Point Dunk Shot.  Assisted by Jack McClinton.,39,21,18,17,0.9320545235512151,0.9320545235512151,Clemson,Miami,6,5,NA,280580228,2008-02-27
102,1,1:41,1301,1301,Cliff Hammonds missed Three Point Jumper.,39,21,18,0,0.9332981007643274,0.9332981007643274,Clemson,Miami,6,5,NA,280580228,2008-02-27
103,1,1:41,1301,1301,Miami (FL) Defensive Rebound.,39,21,18,18,0.9332981007643274,0.9332981007643274,Clemson,Miami,6,5,NA,280580228,2008-02-27
104,1,1:23,1283,1283,Jack McClinton missed Two Point Layup.,39,21,18,1,0.9346389271010077,0.9346389271010077,Clemson,Miami,6,5,NA,280580228,2008-02-27
105,1,1:22,1282,1282,Eddie Rios Offensive Rebound.,39,21,18,2,0.9347143443327932,0.9347143443327932,Clemson,Miami,6,5,NA,280580228,2008-02-27
106,1,1:20,1280,1280,Eddie Rios made Three Point Jumper.,39,24,15,29,0.9020273965893298,0.9020273965893298,Clemson,Miami,6,5,NA,280580228,2008-02-27
107,1,0:51,1251,1251,Anthony King Steal.,39,24,15,2,0.9047567832900734,0.9047567832900734,Clemson,Miami,6,5,NA,280580228,2008-02-27
108,1,0:49,1249,1249,Foul on Raymond Hicks,39,24,15,16,0.9049511316894461,0.9049511316894461,Clemson,Miami,6,5,NA,280580228,2008-02-27
109,1,0:33,1233,1233,Demontez Stitt made Two Point Layup.  Assisted by Cliff Hammonds.,41,24,17,5,0.9292369551851669,0.9292369551851669,Clemson,Miami,6,5,NA,280580228,2008-02-27
110,1,0:28,1228,1228,Miami (FL) 30 Second Timeout.,41,24,17,20,0.929684019576639,0.929684019576639,Clemson,Miami,6,4,NA,280580228,2008-02-27
111,1,0:08,1208,1208,Eddie Rios missed Two Point Jumper.,41,24,17,0,0.9315235460395539,0.9315235460395539,Clemson,Miami,6,4,NA,280580228,2008-02-27
112,1,0:08,1208,1208,James Mays Defensive Rebound.,41,24,17,8,0.9315235460395539,0.9315235460395539,Clemson,Miami,6,4,NA,280580228,2008-02-27
113,1,0:00,1200,1200,End of the 1st Half.,41,24,17,0,0.9322584459832474,0.9322584459832474,Clemson,Miami,6,4,NA,280580228,2008-02-27
114,2,20:00,1200,1200,PLAY,41,24,17,8,0.9322584459832474,0.9322584459832474,Clemson,Miami,6,4,NA,280580228,2008-02-27
115,2,19:52,1192,1192,Dwayne Collins made Two Point Dunk Shot.  Assisted by Anthony King.,41,26,15,21,0.910805142299641,0.910805142299641,Clemson,Miami,6,4,NA,280580228,2008-02-27
116,2,19:31,1171,1171,Trevor Booker missed Two Point Layup.,41,26,15,0,0.9128775877656304,0.9128775877656304,Clemson,Miami,6,4,NA,280580228,2008-02-27
117,2,19:31,1171,1171,Anthony King Defensive Rebound.,41,26,15,8,0.9128775877656304,0.9128775877656304,Clemson,Miami,6,4,NA,280580228,2008-02-27
118,2,19:23,1163,1163,James Dews missed Three Point Jumper.,41,26,15,0,0.913641763830414,0.913641763830414,Clemson,Miami,6,4,NA,280580228,2008-02-27
119,2,19:23,1163,1163,Dwayne Collins Offensive Rebound.,41,26,15,32,0.913641763830414,0.913641763830414,Clemson,Miami,6,4,NA,280580228,2008-02-27
120,2,18:51,1131,1131,Foul on Dwayne Collins,41,26,15,0,0.9166050642086555,0.9166050642086555,Clemson,Miami,6,4,NA,280580228,2008-02-27
121,2,18:51,1131,1131,James Mays made Free Throw.,42,26,16,0,0.9280353669446347,0.9280353669446347,Clemson,Miami,6,4,NA,280580228,2008-02-27
122,2,18:51,1131,1131,James Mays missed Free Throw.,42,26,16,0,0.9280353669446347,0.9280353669446347,Clemson,Miami,6,4,NA,280580228,2008-02-27
123,2,18:51,1131,1131,Dwayne Collins Defensive Rebound.,42,26,16,10,0.9280353669446347,0.9280353669446347,Clemson,Miami,6,4,NA,280580228,2008-02-27
124,2,18:41,1121,1121,Anthony King made Two Point Layup.,42,28,14,10,0.904513565874801,0.904513565874801,Clemson,Miami,6,4,NA,280580228,2008-02-27
125,2,18:31,1111,1111,Foul on Anthony King,42,28,14,0,0.9054762612667204,0.9054762612667204,Clemson,Miami,6,4,NA,280580228,2008-02-27
126,2,18:31,1111,1111,Sam Perry missed Free Throw.,42,28,14,0,0.9054762612667204,0.9054762612667204,Clemson,Miami,6,4,NA,280580228,2008-02-27
127,2,18:31,1111,1111,null,42,28,14,0,0.9054762612667204,0.9054762612667204,Clemson,Miami,6,4,NA,280580228,2008-02-27
128,2,18:31,1111,1111,Sam Perry made Free Throw.,43,28,15,14,0.9184155122022829,0.9184155122022829,Clemson,Miami,6,4,NA,280580228,2008-02-27
129,2,18:17,1097,1097,Lance Hurdle missed Two Point Jumper.,43,28,15,0,0.9196798265623901,0.9196798265623901,Clemson,Miami,6,4,NA,280580228,2008-02-27
130,2,18:17,1097,1097,Sam Perry Defensive Rebound.,43,28,15,10,0.9196798265623901,0.9196798265623901,Clemson,Miami,6,4,NA,280580228,2008-02-27
131,2,18:07,1087,1087,K.C. Rivers missed Three Point Jumper.,43,28,15,0,0.9205863794197806,0.9205863794197806,Clemson,Miami,6,4,NA,280580228,2008-02-27
132,2,18:07,1087,1087,James Mays Offensive Rebound.,43,28,15,7,0.9205863794197806,0.9205863794197806,Clemson,Miami,6,4,NA,280580228,2008-02-27
133,2,18:00,1080,1080,K.C. Rivers missed Two Point Jumper.,43,28,15,0,0.9212243317594034,0.9212243317594034,Clemson,Miami,6,4,NA,280580228,2008-02-27
134,2,18:00,1080,1080,Dwayne Collins Defensive Rebound.,43,28,15,21,0.9212243317594034,0.9212243317594034,Clemson,Miami,6,4,NA,280580228,2008-02-27
135,2,17:39,1059,1059,Foul on Cliff Hammonds,43,28,15,11,0.9231641667237258,0.9231641667237258,Clemson,Miami,6,4,NA,280580228,2008-02-27
136,2,17:28,1048,1048,Jack McClinton missed Three Point Jumper.,43,28,15,0,0.9242012030338822,0.9242012030338822,Clemson,Miami,6,4,NA,280580228,2008-02-27
137,2,17:28,1048,1048,Anthony King Offensive Rebound.,43,28,15,6,0.9242012030338822,0.9242012030338822,Clemson,Miami,6,4,NA,280580228,2008-02-27
138,2,17:22,1042,1042,James Dews made Two Point Jumper.,43,30,13,11,0.8979376250230775,0.8979376250230775,Clemson,Miami,6,4,NA,280580228,2008-02-27
139,2,17:11,1031,1031,Trevor Booker missed Two Point Layup.,43,30,13,0,0.8991565059630752,0.8991565059630752,Clemson,Miami,6,4,NA,280580228,2008-02-27
140,2,17:11,1031,1031,Eddie Rios Defensive Rebound.,43,30,13,9,0.8991565059630752,0.8991565059630752,Clemson,Miami,6,4,NA,280580228,2008-02-27
141,2,17:02,1022,1022,Foul on K.C. Rivers,43,30,13,0,0.9001748329546719,0.9001748329546719,Clemson,Miami,6,4,NA,280580228,2008-02-27
142,2,17:02,1022,1022,James Dews made Free Throw.,43,31,12,0,0.8839112683446126,0.8839112683446126,Clemson,Miami,6,4,NA,280580228,2008-02-27
143,2,17:02,1022,1022,James Dews made Free Throw.,43,32,11,13,0.8653942484135371,0.8653942484135371,Clemson,Miami,6,4,NA,280580228,2008-02-27
144,2,16:49,1009,1009,David Potter missed Three Point Jumper.,43,32,11,0,0.8670507115451347,0.8670507115451347,Clemson,Miami,6,4,NA,280580228,2008-02-27
145,2,16:49,1009,1009,James Dews Defensive Rebound.,43,32,11,10,0.8670507115451347,0.8670507115451347,Clemson,Miami,6,4,NA,280580228,2008-02-27
146,2,16:39,999,999,Dwayne Collins made Two Point Dunk Shot.  Assisted by Jack McClinton.,43,34,9,8,0.8239812162287616,0.8239812162287616,Clemson,Miami,6,4,NA,280580228,2008-02-27
147,2,16:31,991,991,Clemson 30 Second Timeout.,43,34,9,16,0.8251000838103341,0.8251000838103341,Clemson,Miami,6,3,NA,280580228,2008-02-27
148,2,16:15,975,975,Foul on Eddie Rios,43,34,9,17,0.8274222432006684,0.8274222432006684,Clemson,Miami,6,3,NA,280580228,2008-02-27
149,2,15:58,958,958,Cliff Hammonds made Three Point Jumper.  Assisted by K.C. Rivers.,46,34,12,25,0.8921979261062103,0.8921979261062103,Clemson,Miami,6,3,NA,280580228,2008-02-27
150,2,15:33,933,933,Eddie Rios made Three Point Jumper.  Assisted by Dwayne Collins.,46,37,9,33,0.8331767643306995,0.8331767643306995,Clemson,Miami,6,3,NA,280580228,2008-02-27
151,2,15:00,900,900,K.C. Rivers made Two Point Jumper.  Assisted by Cliff Hammonds.,48,37,11,13,0.8807116774093452,0.8807116774093452,Clemson,Miami,6,3,NA,280580228,2008-02-27
152,2,14:47,887,887,Jimmy Graham made Two Point Layup.,48,39,9,14,0.8383442556020577,0.8383442556020577,Clemson,Miami,6,3,NA,280580228,2008-02-27
153,2,14:33,873,873,Raymond Sykes made Two Point Layup.  Assisted by David Potter.,50,39,11,18,0.8834136829918753,0.8834136829918753,Clemson,Miami,6,3,NA,280580228,2008-02-27
154,2,14:15,855,855,Official TV Timeout.,50,39,11,28,0.8852081757735801,0.8852081757735801,Clemson,Miami,6,3,NA,280580228,2008-02-27
155,2,13:47,827,827,James Dews made Three Point Jumper.  Assisted by Eddie Rios.,50,42,8,25,0.8185735392414725,0.8185735392414725,Clemson,Miami,6,3,NA,280580228,2008-02-27
156,2,13:22,802,802,Foul on James Dews,50,42,8,5,0.821694864446192,0.821694864446192,Clemson,Miami,6,3,NA,280580228,2008-02-27
157,2,13:17,797,797,James Mays made Two Point Layup.,52,42,10,20,0.8716441173069542,0.8716441173069542,Clemson,Miami,6,3,NA,280580228,2008-02-27
158,2,12:57,777,777,Jimmy Graham missed Two Point Jumper.,52,42,10,0,0.8743874681486842,0.8743874681486842,Clemson,Miami,6,3,NA,280580228,2008-02-27
159,2,12:57,777,777,Terrence Oglesby Defensive Rebound.,52,42,10,11,0.8743874681486842,0.8743874681486842,Clemson,Miami,6,3,NA,280580228,2008-02-27
160,2,12:46,766,766,Foul on Jimmy Graham,52,42,10,19,0.8760270333185556,0.8760270333185556,Clemson,Miami,6,3,NA,280580228,2008-02-27
161,2,12:27,747,747,Jack McClinton made Two Point Jumper.,52,44,8,10,0.8302202562823073,0.8302202562823073,Clemson,Miami,6,3,NA,280580228,2008-02-27
162,2,12:17,737,737,Terrence Oglesby missed Three Point Jumper.,52,44,8,0,0.8320863230085371,0.8320863230085371,Clemson,Miami,6,3,NA,280580228,2008-02-27
163,2,12:17,737,737,Anthony King Defensive Rebound.,52,44,8,9,0.8320863230085371,0.8320863230085371,Clemson,Miami,6,3,NA,280580228,2008-02-27
164,2,12:08,728,728,Raymond Hicks missed Two Point Layup.,52,44,8,0,0.8338562421489151,0.8338562421489151,Clemson,Miami,6,3,NA,280580228,2008-02-27
165,2,12:08,728,728,Cliff Hammonds Defensive Rebound.,52,44,8,8,0.8338562421489151,0.8338562421489151,Clemson,Miami,6,3,NA,280580228,2008-02-27
166,2,12:00,720,720,Demontez Stitt missed Two Point Layup.,52,44,8,0,0.8353765515716539,0.8353765515716539,Clemson,Miami,6,3,NA,280580228,2008-02-27
167,2,12:00,720,720,Brian Asbury Defensive Rebound.,52,44,8,17,0.8353765515716539,0.8353765515716539,Clemson,Miami,6,3,NA,280580228,2008-02-27
168,2,11:43,703,703,Jack McClinton missed Three Point Jumper.,52,44,8,0,0.8383044578108679,0.8383044578108679,Clemson,Miami,6,3,NA,280580228,2008-02-27
169,2,11:43,703,703,Cliff Hammonds Defensive Rebound.,52,44,8,8,0.8383044578108679,0.8383044578108679,Clemson,Miami,6,3,NA,280580228,2008-02-27
170,2,11:35,695,695,Official TV Timeout.,52,44,8,23,0.8395695365747424,0.8395695365747424,Clemson,Miami,6,3,NA,280580228,2008-02-27
171,2,11:12,672,672,Jack McClinton made Two Point Layup.  Assisted by Eddie Rios.,52,46,6,11,0.7790717087741845,0.7790717087741845,Clemson,Miami,6,3,NA,280580228,2008-02-27
172,2,11:01,661,661,Foul on Brian Asbury,52,46,6,2,0.7805832081008186,0.7805832081008186,Clemson,Miami,6,3,NA,280580228,2008-02-27
173,2,10:59,659,659,Foul on Sam Perry,52,46,6,8,0.7808574195496293,0.7808574195496293,Clemson,Miami,6,3,NA,280580228,2008-02-27
174,2,10:51,651,651,Jack McClinton made Three Point Jumper.  Assisted by Eddie Rios.,52,49,3,14,0.6544275871606349,0.6544275871606349,Clemson,Miami,6,3,NA,280580228,2008-02-27
175,2,10:37,637,637,K.C. Rivers missed Two Point Jumper.,52,49,3,0,0.655738307039938,0.655738307039938,Clemson,Miami,6,3,NA,280580228,2008-02-27
176,2,10:37,637,637,Anthony King Defensive Rebound.,52,49,3,22,0.655738307039938,0.655738307039938,Clemson,Miami,6,3,NA,280580228,2008-02-27
177,2,10:15,615,615,David Potter Steal.,52,49,3,0,0.6579719183889152,0.6579719183889152,Clemson,Miami,6,3,NA,280580228,2008-02-27
178,2,10:15,615,615,Foul on Eddie Rios,52,49,3,0,0.6579719183889152,0.6579719183889152,Clemson,Miami,6,3,NA,280580228,2008-02-27
