play_id,half,time_remaining_half,secs_remaining,secs_remaining_absolute,description,home_score,away_score,score_diff,play_length,win_prob,naive_win_prob,home,away,home_time_out_remaining,away_time_out_remaining,home_favored_by,game_id,date
179,2,10:15,615,615,David Potter made Free Throw.,53,49,4,0,0.7052363638501313,0.7052363638501313,Clemson,Miami,6,3,NA,280580228,2008-02-27
180,2,10:15,615,615,David Potter made Free Throw.,54,49,5,8,0.7484662647948557,0.7484662647948557,Clemson,Miami,6,3,NA,280580228,2008-02-27
181,2,10:07,607,607,Jack McClinton made Two Point Jumper.,54,51,3,14,0.6588626473273629,0.6588626473273629,Clemson,Miami,6,3,NA,280580228,2008-02-27
182,2,9:53,593,593,Foul on Raymond Hicks,54,51,3,0,0.6605549344975736,0.6605549344975736,Clemson,Miami,6,3,NA,280580228,2008-02-27
183,2,9:53,593,593,Sam Perry made Free Throw.,55,51,4,0,0.7084134236240673,0.7084134236240673,Clemson,Miami,6,3,NA,280580228,2008-02-27
184,2,9:53,593,593,Sam Perry made Free Throw.,56,51,5,28,0.7520570699057594,0.7520570699057594,Clemson,Miami,6,3,NA,280580228,2008-02-27
185,2,9:25,565,565,Foul on Sam Perry,56,51,5,0,0.7576220646227245,0.7576220646227245,Clemson,Miami,6,3,NA,280580228,2008-02-27
186,2,9:25,565,565,Jimmy Graham made Free Throw.,56,52,4,0,0.7133579601933832,0.7133579601933832,Clemson,Miami,6,3,NA,280580228,2008-02-27
187,2,9:25,565,565,Jimmy Graham made Free Throw.,56,53,3,12,0.6645889344419768,0.6645889344419768,Clemson,Miami,6,3,NA,280580228,2008-02-27
188,2,9:13,553,553,James Mays missed Two Point Layup.,56,53,3,0,0.6666431988780795,0.6666431988780795,Clemson,Miami,6,3,NA,280580228,2008-02-27
189,2,9:13,553,553,Dwayne Collins Defensive Rebound.,56,53,3,24,0.6666431988780795,0.6666431988780795,Clemson,Miami,6,3,NA,280580228,2008-02-27
190,2,8:49,529,529,Jack McClinton missed Two Point Jumper.,56,53,3,0,0.670636362491879,0.670636362491879,Clemson,Miami,6,3,NA,280580228,2008-02-27
191,2,8:49,529,529,Brian Asbury Offensive Rebound.,56,53,3,5,0.670636362491879,0.670636362491879,Clemson,Miami,6,3,NA,280580228,2008-02-27
192,2,8:44,524,524,Foul on David Potter,56,53,3,8,0.6713551681176607,0.6713551681176607,Clemson,Miami,6,3,NA,280580228,2008-02-27
193,2,8:36,516,516,Jack McClinton missed Three Point Jumper.,56,53,3,0,0.6724552629689952,0.6724552629689952,Clemson,Miami,6,3,NA,280580228,2008-02-27
194,2,8:36,516,516,David Potter Defensive Rebound.,56,53,3,29,0.6724552629689952,0.6724552629689952,Clemson,Miami,6,3,NA,280580228,2008-02-27
195,2,8:07,487,487,Cliff Hammonds made Three Point Jumper.,59,53,6,17,0.8136345849035961,0.8136345849035961,Clemson,Miami,6,3,NA,280580228,2008-02-27
196,2,7:50,470,470,Dwayne Collins made Two Point Dunk Shot.  Assisted by Eddie Rios.,59,55,4,14,0.7306655198967821,0.7306655198967821,Clemson,Miami,6,3,NA,280580228,2008-02-27
197,2,7:36,456,456,David Potter missed Three Point Jumper.,59,55,4,0,0.7336170546716553,0.7336170546716553,Clemson,Miami,6,3,NA,280580228,2008-02-27
198,2,7:36,456,456,Jimmy Graham Defensive Rebound.,59,55,4,9,0.7336170546716553,0.7336170546716553,Clemson,Miami,6,3,NA,280580228,2008-02-27
199,2,7:27,447,447,Foul on Cliff Hammonds,59,55,4,0,0.7358021244043058,0.7358021244043058,Clemson,Miami,6,3,NA,280580228,2008-02-27
200,2,7:27,447,447,Official TV Timeout.,59,55,4,0,0.7358021244043058,0.7358021244043058,Clemson,Miami,6,3,NA,280580228,2008-02-27
201,2,7:27,447,447,Jack McClinton made Free Throw.,59,56,3,0,0.6831307740620025,0.6831307740620025,Clemson,Miami,6,3,NA,280580228,2008-02-27
202,2,7:27,447,447,Jack McClinton made Free Throw.,59,57,2,16,0.6253060005374815,0.6253060005374815,Clemson,Miami,6,3,NA,280580228,2008-02-27
203,2,7:11,431,431,Raymond Sykes missed Two Point Jumper.,59,57,2,0,0.6280795741843767,0.6280795741843767,Clemson,Miami,6,3,NA,280580228,2008-02-27
204,2,7:11,431,431,Jimmy Graham Defensive Rebound.,59,57,2,22,0.6280795741843767,0.6280795741843767,Clemson,Miami,6,3,NA,280580228,2008-02-27
205,2,6:49,409,409,Jack McClinton made Three Point Jumper.  Assisted by James Dews.,59,60,-1,26,0.43275240021330674,0.43275240021330674,Clemson,Miami,6,3,NA,280580228,2008-02-27
206,2,6:23,383,383,Cliff Hammonds made Two Point Jumper.  Assisted by Trevor Booker.,61,60,1,20,0.5695826149668936,0.5695826149668936,Clemson,Miami,6,3,NA,280580228,2008-02-27
207,2,6:03,363,363,Jack McClinton missed Two Point Jumper.,61,60,1,2,0.5715087419297312,0.5715087419297312,Clemson,Miami,6,3,NA,280580228,2008-02-27
208,2,6:01,361,361,K.C. Rivers Defensive Rebound.,61,60,1,3,0.5717162390494734,0.5717162390494734,Clemson,Miami,6,3,NA,280580228,2008-02-27
209,2,5:58,358,358,Foul on Jack McClinton,61,60,1,0,0.5720340932137669,0.5720340932137669,Clemson,Miami,6,3,NA,280580228,2008-02-27
210,2,5:58,358,358,K.C. Rivers made Free Throw.,62,60,2,0,0.6411387607882293,0.6411387607882293,Clemson,Miami,6,3,NA,280580228,2008-02-27
211,2,5:58,358,358,K.C. Rivers made Free Throw.,63,60,3,31,0.7048424816599355,0.7048424816599355,Clemson,Miami,6,3,NA,280580228,2008-02-27
212,2,5:27,327,327,Jack McClinton missed Three Point Jumper.,63,60,3,0,0.7147066322039818,0.7147066322039818,Clemson,Miami,6,3,NA,280580228,2008-02-27
213,2,5:27,327,327,James Mays Defensive Rebound.,63,60,3,17,0.7147066322039818,0.7147066322039818,Clemson,Miami,6,3,NA,280580228,2008-02-27
214,2,5:10,310,310,K.C. Rivers made Three Point Jumper.  Assisted by Cliff Hammonds.,66,60,6,18,0.8704858504417667,0.8704858504417667,Clemson,Miami,6,3,NA,280580228,2008-02-27
215,2,4:52,292,292,Foul on Trevor Booker,66,60,6,0,0.8752299608274392,0.8752299608274392,Clemson,Miami,6,3,NA,280580228,2008-02-27
216,2,4:52,292,292,Dwayne Collins made Free Throw.,66,61,5,0,0.8352559650118562,0.8352559650118562,Clemson,Miami,6,3,NA,280580228,2008-02-27
217,2,4:52,292,292,Dwayne Collins missed Free Throw.,66,61,5,0,0.8352559650118562,0.8352559650118562,Clemson,Miami,6,3,NA,280580228,2008-02-27
218,2,4:52,292,292,Trevor Booker Defensive Rebound.,66,61,5,15,0.8352559650118562,0.8352559650118562,Clemson,Miami,6,3,NA,280580228,2008-02-27
219,2,4:37,277,277,Foul on Jack McClinton,66,61,5,0,0.8345209974782171,0.8345209974782171,Clemson,Miami,6,3,NA,280580228,2008-02-27
220,2,4:37,277,277,Trevor Booker missed Free Throw.,66,61,5,0,0.8345209974782171,0.8345209974782171,Clemson,Miami,6,3,NA,280580228,2008-02-27
221,2,4:37,277,277,null,66,61,5,0,0.8345209974782171,0.8345209974782171,Clemson,Miami,6,3,NA,280580228,2008-02-27
222,2,4:37,277,277,Trevor Booker made Free Throw.,67,61,6,13,0.874529604528951,0.874529604528951,Clemson,Miami,6,3,NA,280580228,2008-02-27
223,2,4:24,264,264,James Dews made Two Point Layup.  Assisted by Eddie Rios.,67,63,4,14,0.7825111780680142,0.7825111780680142,Clemson,Miami,6,3,NA,280580228,2008-02-27
224,2,4:10,250,250,Sam Perry made Two Point Dunk Shot.  Assisted by James Mays.,69,63,6,20,0.8694714568118904,0.8694714568118904,Clemson,Miami,6,3,NA,280580228,2008-02-27
225,2,3:50,230,230,Foul on Sam Perry,69,63,6,0,0.8685510078023324,0.8685510078023324,Clemson,Miami,6,3,NA,280580228,2008-02-27
226,2,3:50,230,230,Official TV Timeout.,69,63,6,0,0.8685510078023324,0.8685510078023324,Clemson,Miami,6,3,NA,280580228,2008-02-27
227,2,3:50,230,230,Eddie Rios missed Free Throw.,69,63,6,0,0.8685510078023324,0.8685510078023324,Clemson,Miami,6,3,NA,280580228,2008-02-27
228,2,3:50,230,230,Clemson Defensive Rebound.,69,63,6,10,0.8685510078023324,0.8685510078023324,Clemson,Miami,6,3,NA,280580228,2008-02-27
229,2,3:40,220,220,Foul on Jimmy Graham,69,63,6,0,0.8707941151763672,0.8707941151763672,Clemson,Miami,6,3,NA,280580228,2008-02-27
230,2,3:40,220,220,K.C. Rivers made Free Throw.,70,63,7,0,0.902559982911524,0.902559982911524,Clemson,Miami,6,3,NA,280580228,2008-02-27
231,2,3:40,220,220,K.C. Rivers made Free Throw.,71,63,8,16,0.9271692526714184,0.9271692526714184,Clemson,Miami,6,3,NA,280580228,2008-02-27
232,2,3:24,204,204,James Dews missed Two Point Jumper.,71,63,8,0,0.9342393651309612,0.9342393651309612,Clemson,Miami,6,3,NA,280580228,2008-02-27
233,2,3:24,204,204,Cliff Hammonds Defensive Rebound.,71,63,8,22,0.9342393651309612,0.9342393651309612,Clemson,Miami,6,3,NA,280580228,2008-02-27
234,2,3:02,182,182,Foul on Eddie Rios,71,63,8,0,0.9513057088044775,0.9513057088044775,Clemson,Miami,6,3,NA,280580228,2008-02-27
235,2,3:02,182,182,Demontez Stitt made Free Throw.,72,63,9,0,0.9659014806946677,0.9659014806946677,Clemson,Miami,6,3,NA,280580228,2008-02-27
236,2,3:02,182,182,Demontez Stitt missed Free Throw.,72,63,9,0,0.9659014806946677,0.9659014806946677,Clemson,Miami,6,3,NA,280580228,2008-02-27
237,2,3:02,182,182,Jack McClinton Defensive Rebound.,72,63,9,8,0.9659014806946677,0.9659014806946677,Clemson,Miami,6,3,NA,280580228,2008-02-27
238,2,2:54,174,174,Jack McClinton made Two Point Jumper.,72,65,7,4,0.9381967972955967,0.9381967972955967,Clemson,Miami,6,3,NA,280580228,2008-02-27
239,2,2:50,170,170,Miami (FL) 30 Second Timeout.,72,65,7,15,0.9416404939897423,0.9416404939897423,Clemson,Miami,6,2,NA,280580228,2008-02-27
240,2,2:35,155,155,Foul on Anthony King,72,65,7,0,0.9535730847225026,0.9535730847225026,Clemson,Miami,6,2,NA,280580228,2008-02-27
241,2,2:35,155,155,James Mays missed Free Throw.,72,65,7,0,0.9535730847225026,0.9535730847225026,Clemson,Miami,6,2,NA,280580228,2008-02-27
242,2,2:35,155,155,null,72,65,7,0,0.9535730847225026,0.9535730847225026,Clemson,Miami,6,2,NA,280580228,2008-02-27
243,2,2:35,155,155,James Mays missed Free Throw.,72,65,7,0,0.9535730847225026,0.9535730847225026,Clemson,Miami,6,2,NA,280580228,2008-02-27
244,2,2:35,155,155,Brian Asbury Defensive Rebound.,72,65,7,10,0.9535730847225026,0.9535730847225026,Clemson,Miami,6,2,NA,280580228,2008-02-27
245,2,2:25,145,145,Eddie Rios missed Two Point Jumper.,72,65,7,0,0.9607783534616383,0.9607783534616383,Clemson,Miami,6,2,NA,280580228,2008-02-27
246,2,2:25,145,145,Demontez Stitt Defensive Rebound.,72,65,7,27,0.9607783534616383,0.9607783534616383,Clemson,Miami,6,2,NA,280580228,2008-02-27
247,2,1:58,118,118,Foul on Dwayne Collins,72,65,7,0,0.9773713357784517,0.9773713357784517,Clemson,Miami,6,2,NA,280580228,2008-02-27
248,2,1:58,118,118,Trevor Booker made Free Throw.,73,65,8,0,0.9866605350854477,0.9866605350854477,Clemson,Miami,6,2,NA,280580228,2008-02-27
249,2,1:58,118,118,Trevor Booker missed Free Throw.,73,65,8,0,0.9866605350854477,0.9866605350854477,Clemson,Miami,6,2,NA,280580228,2008-02-27
250,2,1:58,118,118,Dwayne Collins Defensive Rebound.,73,65,8,9,0.9866605350854477,0.9866605350854477,Clemson,Miami,6,2,NA,280580228,2008-02-27
251,2,1:49,109,109,Jack McClinton missed Two Point Jumper.,73,65,8,0,0.9896820987630285,0.9896820987630285,Clemson,Miami,6,2,NA,280580228,2008-02-27
252,2,1:49,109,109,Demontez Stitt Defensive Rebound.,73,65,8,27,0.9896820987630285,0.9896820987630285,Clemson,Miami,6,2,NA,280580228,2008-02-27
253,2,1:22,82,82,Foul on Dwayne Collins,73,65,8,0,0.9958917741181347,0.9958917741181347,Clemson,Miami,6,2,NA,280580228,2008-02-27
254,2,1:22,82,82,Trevor Booker missed Free Throw.,73,65,8,0,0.9958917741181347,0.9958917741181347,Clemson,Miami,6,2,NA,280580228,2008-02-27
255,2,1:22,82,82,null,73,65,8,0,0.9958917741181347,0.9958917741181347,Clemson,Miami,6,2,NA,280580228,2008-02-27
256,2,1:22,82,82,Trevor Booker made Free Throw.,74,65,9,10,0.9979276100436592,0.9979276100436592,Clemson,Miami,6,2,NA,280580228,2008-02-27
257,2,1:12,72,72,Eddie Rios made Two Point Layup.,74,67,7,2,0.9941855527312995,0.9941855527312995,Clemson,Miami,6,2,NA,280580228,2008-02-27
258,2,1:10,70,70,Miami (FL) 30 Second Timeout.,74,67,7,5,0.9945813368900183,0.9945813368900183,Clemson,Miami,6,1,NA,280580228,2008-02-27
259,2,1:05,65,65,Foul on Anthony King,74,67,7,0,0.9954708939197109,0.9954708939197109,Clemson,Miami,6,1,NA,280580228,2008-02-27
260,2,1:05,65,65,K.C. Rivers made Free Throw.,75,67,8,0,0.9978986584866816,0.9978986584866816,Clemson,Miami,6,1,NA,280580228,2008-02-27
261,2,1:05,65,65,K.C. Rivers missed Free Throw.,75,67,8,0,0.9978986584866816,0.9978986584866816,Clemson,Miami,6,1,NA,280580228,2008-02-27
262,2,1:05,65,65,Jimmy Graham Defensive Rebound.,75,67,8,13,0.9978986584866816,0.9978986584866816,Clemson,Miami,6,1,NA,280580228,2008-02-27
263,2,0:52,52,52,James Dews missed Three Point Jumper.,75,67,8,1,0.9987987135349736,0.9987987135349736,Clemson,Miami,6,1,NA,280580228,2008-02-27
264,2,0:51,51,51,Miami (FL) Offensive Rebound.,75,67,8,5,0.9988512354551384,0.9988512354551384,Clemson,Miami,6,1,NA,280580228,2008-02-27
265,2,0:46,46,46,Jimmy Graham missed Three Point Jumper.,75,67,8,0,0.9990850750059551,0.9990850750059551,Clemson,Miami,6,1,NA,280580228,2008-02-27
266,2,0:46,46,46,Trevor Booker Defensive Rebound.,75,67,8,3,0.9990850750059551,0.9990850750059551,Clemson,Miami,6,1,NA,280580228,2008-02-27
267,2,0:43,43,43,Foul on James Dews,75,67,8,0,0.9992046605148502,0.9992046605148502,Clemson,Miami,6,1,NA,280580228,2008-02-27
268,2,0:43,43,43,Trevor Booker made Free Throw.,76,67,9,0,0.9996738865566699,0.9996738865566699,Clemson,Miami,6,1,NA,280580228,2008-02-27
269,2,0:43,43,43,Trevor Booker made Free Throw.,77,67,10,7,0.9998663205789873,0.9998663205789873,Clemson,Miami,6,1,NA,280580228,2008-02-27
270,2,0:36,36,36,Jack McClinton missed Two Point Layup.,77,67,10,0,0.9999122504408098,0.9999122504408098,Clemson,Miami,6,1,NA,280580228,2008-02-27
271,2,0:36,36,36,Trevor Booker Defensive Rebound.,77,67,10,4,0.9999122504408098,0.9999122504408098,Clemson,Miami,6,1,NA,280580228,2008-02-27
272,2,0:32,32,32,Foul on Eddie Rios,77,67,10,0,0.999931478275363,0.999931478275363,Clemson,Miami,6,1,NA,280580228,2008-02-27
273,2,0:32,32,32,David Potter made Free Throw.,78,67,11,0,0.9999737316713603,0.9999737316713603,Clemson,Miami,6,1,NA,280580228,2008-02-27
274,2,0:32,32,32,David Potter made Free Throw.,79,67,12,5,0.9999899300971531,0.9999899300971531,Clemson,Miami,6,1,NA,280580228,2008-02-27
275,2,0:27,27,27,Jack McClinton missed Three Point Jumper.,79,67,12,0,0.9999931011043236,0.9999931011043236,Clemson,Miami,6,1,NA,280580228,2008-02-27
276,2,0:27,27,27,Miami (FL) Offensive Rebound.,79,67,12,7,0.9999931011043236,0.9999931011043236,Clemson,Miami,6,1,NA,280580228,2008-02-27
277,2,0:20,20,20,Brian Asbury made Two Point Layup.,79,69,10,20,0.9999681873658404,0.9999681873658404,Clemson,Miami,6,1,NA,280580228,2008-02-27
278,2,0:00,0,0,End Game,79,69,10,0,1,1,Clemson,Miami,6,1,NA,280580228,2008-02-27
