play_id,half,time_remaining_half,secs_remaining,secs_remaining_absolute,description,home_score,away_score,score_diff,play_length,win_prob,naive_win_prob,home,away,home_time_out_remaining,away_time_out_remaining,home_favored_by,game_id,date
1,1,20:00,2400,2400,PLAY,0,0,0,17,0.5,0.5,Nebraska,Creighton,6,6,NA,263220158,2006-11-18
2,1,19:43,2383,2383,Sek Henry made Two Point Jumper.  Assisted by Charles Richardson Jr..,2,0,2,11,0.5443841825587584,0.5443841825587584,Nebraska,Creighton,6,6,NA,263220158,2006-11-18
3,1,19:32,2372,2372,Dane Watts made Two Point Layup.  Assisted by Nick Bahe.,2,2,0,33,0.5,0.5,Nebraska,Creighton,6,6,NA,263220158,2006-11-18
4,1,18:59,2339,2339,Aleks Maric missed Two Point Jumper.,2,2,0,0,0.5,0.5,Nebraska,Creighton,6,6,NA,263220158,2006-11-18
5,1,18:59,2339,2339,Aleks Maric Offensive Rebound.,2,2,0,26,0.5,0.5,Nebraska,Creighton,6,6,NA,263220158,2006-11-18
6,1,18:33,2313,2313,Anthony Tolliver missed Two Point Jumper.,2,2,0,0,0.5,0.5,Nebraska,Creighton,6,6,NA,263220158,2006-11-18
7,1,18:33,2313,2313,Charles Richardson Jr. Defensive Rebound.,2,2,0,8,0.5,0.5,Nebraska,Creighton,6,6,NA,263220158,2006-11-18
8,1,18:25,2305,2305,Aleks Maric missed Two Point Jumper.,2,2,0,0,0.5,0.5,Nebraska,Creighton,6,6,NA,263220158,2006-11-18
9,1,18:25,2305,2305,Anthony Tolliver Defensive Rebound.,2,2,0,22,0.5,0.5,Nebraska,Creighton,6,6,NA,263220158,2006-11-18
10,1,18:03,2283,2283,Anthony Tolliver made Two Point Jumper.  Assisted by Nick Bahe.,2,4,-2,22,0.4534335585723665,0.4534335585723665,Nebraska,Creighton,6,6,NA,263220158,2006-11-18
11,1,17:41,2261,2261,Ryan Anderson made Two Point Jumper.,4,4,0,19,0.5,0.5,Nebraska,Creighton,6,6,NA,263220158,2006-11-18
12,1,17:22,2242,2242,Nick Bahe missed Three Point Jumper.,4,4,0,0,0.5,0.5,Nebraska,Creighton,6,6,NA,263220158,2006-11-18
13,1,17:22,2242,2242,Jamel White Defensive Rebound.,4,4,0,10,0.5,0.5,Nebraska,Creighton,6,6,NA,263220158,2006-11-18
14,1,17:12,2232,2232,Foul on Anthony Tolliver,4,4,0,7,0.5,0.5,Nebraska,Creighton,6,6,NA,263220158,2006-11-18
15,1,17:05,2225,2225,Sek Henry missed Three Point Jumper.,4,4,0,0,0.5,0.5,Nebraska,Creighton,6,6,NA,263220158,2006-11-18
16,1,17:05,2225,2225,Dane Watts Defensive Rebound.,4,4,0,15,0.5,0.5,Nebraska,Creighton,6,6,NA,263220158,2006-11-18
17,1,16:50,2210,2210,Nate Funk missed Two Point Jumper.,4,4,0,0,0.5,0.5,Nebraska,Creighton,6,6,NA,263220158,2006-11-18
18,1,16:50,2210,2210,Nick Porter Offensive Rebound.,4,4,0,0,0.5,0.5,Nebraska,Creighton,6,6,NA,263220158,2006-11-18
19,1,16:50,2210,2210,Nick Porter missed Two Point Tip Shot.,4,4,0,0,0.5,0.5,Nebraska,Creighton,6,6,NA,263220158,2006-11-18
20,1,16:50,2210,2210,Ryan Anderson Defensive Rebound.,4,4,0,7,0.5,0.5,Nebraska,Creighton,6,6,NA,263220158,2006-11-18
21,1,16:43,2203,2203,Foul on Ty Morrison,4,4,0,37,0.5,0.5,Nebraska,Creighton,6,6,NA,263220158,2006-11-18
22,1,16:06,2166,2166,Charles Richardson Jr. made Three Point Jumper.  Assisted by Jamel White.,7,4,3,24,0.5735543170849603,0.5735543170849603,Nebraska,Creighton,6,6,NA,263220158,2006-11-18
23,1,15:42,2142,2142,Foul on Ty Morrison,7,4,3,0,0.5743799751788942,0.5743799751788942,Nebraska,Creighton,6,6,NA,263220158,2006-11-18
24,1,15:42,2142,2142,Official TV Timeout.,7,4,3,32,0.5743799751788942,0.5743799751788942,Nebraska,Creighton,6,6,NA,263220158,2006-11-18
25,1,15:10,2110,2110,Isacc Miles missed Three Point Jumper.,7,4,3,0,0.5754914317380757,0.5754914317380757,Nebraska,Creighton,6,6,NA,263220158,2006-11-18
26,1,15:10,2110,2110,Anthony Tolliver Offensive Rebound.,7,4,3,0,0.5754914317380757,0.5754914317380757,Nebraska,Creighton,6,6,NA,263220158,2006-11-18
27,1,15:10,2110,2110,Anthony Tolliver made Two Point Tip Shot.,7,6,1,30,0.5253359611048554,0.5253359611048554,Nebraska,Creighton,6,6,NA,263220158,2006-11-18
28,1,14:40,2080,2080,Foul on Brice Nengsu,7,6,1,2,0.5256947665647138,0.5256947665647138,Nebraska,Creighton,6,6,NA,263220158,2006-11-18
29,1,14:38,2078,2078,Jamel White missed Three Point Jumper.,7,6,1,0,0.5257188497269558,0.5257188497269558,Nebraska,Creighton,6,6,NA,263220158,2006-11-18
30,1,14:38,2078,2078,Dane Watts Defensive Rebound.,7,6,1,33,0.5257188497269558,0.5257188497269558,Nebraska,Creighton,6,6,NA,263220158,2006-11-18
31,1,14:05,2045,2045,Ryan Anderson made Two Point Jumper.,9,6,3,22,0.5777925352308955,0.5777925352308955,Nebraska,Creighton,6,6,NA,263220158,2006-11-18
32,1,13:43,2023,2023,Anthony Tolliver made Two Point Jumper.  Assisted by Dane Watts.,9,8,1,19,0.5263898859159339,0.5263898859159339,Nebraska,Creighton,6,6,NA,263220158,2006-11-18
33,1,13:24,2004,2004,Ryan Anderson made Three Point Jumper.  Assisted by Jamel White.,12,8,4,12,0.605018041627282,0.605018041627282,Nebraska,Creighton,6,6,NA,263220158,2006-11-18
34,1,13:12,1992,1992,Nate Funk made Three Point Jumper.  Assisted by Isacc Miles.,12,11,1,25,0.5267762127146647,0.5267762127146647,Nebraska,Creighton,6,6,NA,263220158,2006-11-18
35,1,12:47,1967,1967,Foul on Jim Ledsome,12,11,1,27,0.5270924645208734,0.5270924645208734,Nebraska,Creighton,6,6,NA,263220158,2006-11-18
36,1,12:20,1940,1940,Sek Henry missed Two Point Jumper.,12,11,1,0,0.5274390583629032,0.5274390583629032,Nebraska,Creighton,6,6,NA,263220158,2006-11-18
37,1,12:20,1940,1940,Nate Funk Defensive Rebound.,12,11,1,6,0.5274390583629032,0.5274390583629032,Nebraska,Creighton,6,6,NA,263220158,2006-11-18
38,1,12:14,1934,1934,Brice Nengsu made Three Point Jumper.  Assisted by Nate Funk.,12,14,-2,26,0.4451325315912412,0.4451325315912412,Nebraska,Creighton,6,6,NA,263220158,2006-11-18
39,1,11:48,1908,1908,Jay-R Strowbridge made Three Point Jumper.  Assisted by Charles Richardson Jr..,15,14,1,21,0.5278546447569822,0.5278546447569822,Nebraska,Creighton,6,6,NA,263220158,2006-11-18
40,1,11:27,1887,1887,Anthony Tolliver missed Three Point Jumper.,15,14,1,0,0.5281270409839967,0.5281270409839967,Nebraska,Creighton,6,6,NA,263220158,2006-11-18
41,1,11:27,1887,1887,Ryan Anderson Defensive Rebound.,15,14,1,27,0.5281270409839967,0.5281270409839967,Nebraska,Creighton,6,6,NA,263220158,2006-11-18
42,1,11:00,1860,1860,Jay-R Strowbridge made Three Point Jumper.  Assisted by Charles Richardson Jr..,18,14,4,0,0.6120977599592489,0.6120977599592489,Nebraska,Creighton,6,6,NA,263220158,2006-11-18
43,1,11:00,1860,1860,Creighton Full Timeout.,18,14,4,26,0.6120977599592489,0.6120977599592489,Nebraska,Creighton,5,6,NA,263220158,2006-11-18
44,1,10:34,1834,1834,Official TV Timeout.,18,14,4,52,0.6133916498775163,0.6133916498775163,Nebraska,Creighton,5,6,NA,263220158,2006-11-18
45,1,9:42,1782,1782,Pierce Hibma missed Three Point Jumper.,18,14,4,0,0.6160171035267608,0.6160171035267608,Nebraska,Creighton,5,6,NA,263220158,2006-11-18
46,1,9:42,1782,1782,Isacc Miles Offensive Rebound.,18,14,4,10,0.6160171035267608,0.6160171035267608,Nebraska,Creighton,5,6,NA,263220158,2006-11-18
47,1,9:32,1772,1772,Charles Richardson Jr. Steal.,18,14,4,4,0.61653040077531,0.61653040077531,Nebraska,Creighton,5,6,NA,263220158,2006-11-18
48,1,9:28,1768,1768,Nick Porter Steal.,18,14,4,0,0.6167366567731744,0.6167366567731744,Nebraska,Creighton,5,6,NA,263220158,2006-11-18
49,1,9:28,1768,1768,Nick Porter made Two Point Layup.,18,16,2,14,0.5591861864946767,0.5591861864946767,Nebraska,Creighton,5,6,NA,263220158,2006-11-18
50,1,9:14,1754,1754,Aleks Maric made Two Point Layup.  Assisted by Jamel White.,20,16,4,29,0.6174631083087059,0.6174631083087059,Nebraska,Creighton,5,6,NA,263220158,2006-11-18
51,1,8:45,1725,1725,Nick Bahe missed Three Point Jumper.,20,16,4,0,0.6189932462265295,0.6189932462265295,Nebraska,Creighton,5,6,NA,263220158,2006-11-18
52,1,8:45,1725,1725,Chris Balham Defensive Rebound.,20,16,4,6,0.6189932462265295,0.6189932462265295,Nebraska,Creighton,5,6,NA,263220158,2006-11-18
53,1,8:39,1719,1719,Foul on Anthony Tolliver,20,16,4,11,0.619314585196126,0.619314585196126,Nebraska,Creighton,5,6,NA,263220158,2006-11-18
54,1,8:28,1708,1708,Foul on Aleks Maric,20,16,4,14,0.6199083525223932,0.6199083525223932,Nebraska,Creighton,5,6,NA,263220158,2006-11-18
55,1,8:14,1694,1694,Nate Funk made Three Point Jumper.  Assisted by Nick Porter.,20,19,1,31,0.5307366237454462,0.5307366237454462,Nebraska,Creighton,5,6,NA,263220158,2006-11-18
56,1,7:43,1663,1663,Foul on Chris Balham,20,19,1,0,0.5311817203704111,0.5311817203704111,Nebraska,Creighton,5,6,NA,263220158,2006-11-18
57,1,7:43,1663,1663,Official TV Timeout.,20,19,1,16,0.5311817203704111,0.5311817203704111,Nebraska,Creighton,5,6,NA,263220158,2006-11-18
58,1,7:27,1647,1647,Foul on Aleks Maric,20,19,1,3,0.5314048937596322,0.5314048937596322,Nebraska,Creighton,5,6,NA,263220158,2006-11-18
59,1,7:24,1644,1644,Nate Funk made Two Point Jumper.,20,21,-1,29,0.4685536400444692,0.4685536400444692,Nebraska,Creighton,5,6,NA,263220158,2006-11-18
60,1,6:55,1615,1615,Foul on Dane Watts,20,21,-1,25,0.4681569280907135,0.4681569280907135,Nebraska,Creighton,5,6,NA,263220158,2006-11-18
61,1,6:30,1590,1590,Jay-R Strowbridge missed Three Point Jumper.,20,21,-1,0,0.4678174178809524,0.4678174178809524,Nebraska,Creighton,5,6,NA,263220158,2006-11-18
62,1,6:30,1590,1590,Dane Watts Defensive Rebound.,20,21,-1,13,0.4678174178809524,0.4678174178809524,Nebraska,Creighton,5,6,NA,263220158,2006-11-18
63,1,6:17,1577,1577,Nate Funk made Three Point Jumper.  Assisted by Nick Porter.,20,24,-4,25,0.3732076237525992,0.3732076237525992,Nebraska,Creighton,5,6,NA,263220158,2006-11-18
64,1,5:52,1552,1552,Ryan Anderson made Two Point Jumper.  Assisted by Jamel White.,22,24,-2,0,0.4348700192752589,0.4348700192752589,Nebraska,Creighton,5,6,NA,263220158,2006-11-18
65,1,5:52,1552,1552,Foul on Nick Porter,22,24,-2,0,0.4348700192752589,0.4348700192752589,Nebraska,Creighton,5,6,NA,263220158,2006-11-18
66,1,5:52,1552,1552,Ryan Anderson missed Free Throw.,22,24,-2,0,0.4348700192752589,0.4348700192752589,Nebraska,Creighton,5,6,NA,263220158,2006-11-18
67,1,5:52,1552,1552,Dane Watts Defensive Rebound.,22,24,-2,16,0.4348700192752589,0.4348700192752589,Nebraska,Creighton,5,6,NA,263220158,2006-11-18
68,1,5:36,1536,1536,Nate Funk missed Two Point Jumper.,22,24,-2,0,0.43442609677021293,0.43442609677021293,Nebraska,Creighton,5,6,NA,263220158,2006-11-18
69,1,5:36,1536,1536,Nick Porter Offensive Rebound.,22,24,-2,5,0.43442609677021293,0.43442609677021293,Nebraska,Creighton,5,6,NA,263220158,2006-11-18
70,1,5:31,1531,1531,Nick Porter missed Two Point Jumper.,22,24,-2,0,0.4342855875824481,0.4342855875824481,Nebraska,Creighton,5,6,NA,263220158,2006-11-18
71,1,5:31,1531,1531,Ty Morrison Offensive Rebound.,22,24,-2,66,0.4342855875824481,0.4342855875824481,Nebraska,Creighton,5,6,NA,263220158,2006-11-18
72,1,4:25,1465,1465,Charles Richardson Jr. made Two Point Jumper.,24,24,0,22,0.5,0.5,Nebraska,Creighton,5,6,NA,263220158,2006-11-18
73,1,4:03,1443,1443,Dane Watts missed Three Point Jumper.,24,24,0,0,0.5,0.5,Nebraska,Creighton,5,6,NA,263220158,2006-11-18
74,1,4:03,1443,1443,Charles Richardson Jr. Defensive Rebound.,24,24,0,20,0.5,0.5,Nebraska,Creighton,5,6,NA,263220158,2006-11-18
75,1,3:43,1423,1423,Ryan Anderson made Two Point Jumper.  Assisted by Charles Richardson Jr..,26,24,2,35,0.5690411497105754,0.5690411497105754,Nebraska,Creighton,5,6,NA,263220158,2006-11-18
76,1,3:08,1388,1388,Isacc Miles made Three Point Jumper.  Assisted by Pierce Hibma.,26,27,-1,10,0.4647693352785394,0.4647693352785394,Nebraska,Creighton,5,6,NA,263220158,2006-11-18
77,1,2:58,1378,1378,Foul on Isacc Miles,26,27,-1,0,0.4646168543525624,0.4646168543525624,Nebraska,Creighton,5,6,NA,263220158,2006-11-18
78,1,2:58,1378,1378,Official TV Timeout.,26,27,-1,0,0.4646168543525624,0.4646168543525624,Nebraska,Creighton,5,6,NA,263220158,2006-11-18
79,1,2:58,1378,1378,Charles Richardson Jr. missed Free Throw.,26,27,-1,0,0.4646168543525624,0.4646168543525624,Nebraska,Creighton,5,6,NA,263220158,2006-11-18
80,1,2:58,1378,1378,Dane Watts Defensive Rebound.,26,27,-1,23,0.4646168543525624,0.4646168543525624,Nebraska,Creighton,5,6,NA,263220158,2006-11-18
81,1,2:35,1355,1355,Dane Watts made Two Point Layup.  Assisted by Brice Nengsu.,26,29,-3,25,0.3942386579304592,0.3942386579304592,Nebraska,Creighton,5,6,NA,263220158,2006-11-18
82,1,2:10,1330,1330,Jamel White missed Two Point Jumper.,26,29,-3,0,0.3931304141835511,0.3931304141835511,Nebraska,Creighton,5,6,NA,263220158,2006-11-18
83,1,2:10,1330,1330,Dane Watts Defensive Rebound.,26,29,-3,22,0.3931304141835511,0.3931304141835511,Nebraska,Creighton,5,6,NA,263220158,2006-11-18
84,1,1:48,1308,1308,Foul on Jamel White,26,29,-3,49,0.3921278203038004,0.3921278203038004,Nebraska,Creighton,5,6,NA,263220158,2006-11-18
85,1,0:59,1259,1259,Ryan Anderson made Two Point Jumper.,28,29,-1,11,0.4626970978351408,0.4626970978351408,Nebraska,Creighton,5,6,NA,263220158,2006-11-18
86,1,0:48,1248,1248,Nate Funk missed Three Point Jumper.,28,29,-1,0,0.46249352365000934,0.46249352365000934,Nebraska,Creighton,5,6,NA,263220158,2006-11-18
87,1,0:48,1248,1248,Brice Nengsu Offensive Rebound.,28,29,-1,0,0.46249352365000934,0.46249352365000934,Nebraska,Creighton,5,6,NA,263220158,2006-11-18
88,1,0:48,1248,1248,Brice Nengsu missed Two Point Tip Shot.,28,29,-1,0,0.46249352365000934,0.46249352365000934,Nebraska,Creighton,5,6,NA,263220158,2006-11-18
89,1,0:48,1248,1248,Dane Watts Offensive Rebound.,28,29,-1,0,0.46249352365000934,0.46249352365000934,Nebraska,Creighton,5,6,NA,263220158,2006-11-18
90,1,0:48,1248,1248,Dane Watts missed Two Point Tip Shot.,28,29,-1,0,0.46249352365000934,0.46249352365000934,Nebraska,Creighton,5,6,NA,263220158,2006-11-18
91,1,0:48,1248,1248,Nate Funk Offensive Rebound.,28,29,-1,8,0.46249352365000934,0.46249352365000934,Nebraska,Creighton,5,6,NA,263220158,2006-11-18
92,1,0:40,1240,1240,Foul on Jamel White,28,29,-1,0,0.4623409855902041,0.4623409855902041,Nebraska,Creighton,5,6,NA,263220158,2006-11-18
93,1,0:40,1240,1240,Nate Funk made Free Throw.,28,30,-2,0,0.42510682558951524,0.42510682558951524,Nebraska,Creighton,5,6,NA,263220158,2006-11-18
94,1,0:40,1240,1240,Nate Funk made Free Throw.,28,31,-3,7,0.3887034161158233,0.3887034161158233,Nebraska,Creighton,5,6,NA,263220158,2006-11-18
95,1,0:33,1233,1233,Creighton Full Timeout.,28,31,-3,25,0.38831121651612033,0.38831121651612033,Nebraska,Creighton,4,6,NA,263220158,2006-11-18
96,1,0:08,1208,1208,Ryan Anderson missed Three Point Jumper.,28,31,-3,0,0.3868324106993999,0.3868324106993999,Nebraska,Creighton,4,6,NA,263220158,2006-11-18
97,1,0:08,1208,1208,Dane Watts Defensive Rebound.,28,31,-3,7,0.3868324106993999,0.3868324106993999,Nebraska,Creighton,4,6,NA,263220158,2006-11-18
98,1,0:01,1201,1201,Nate Funk missed Three Point Jumper.,28,31,-3,0,0.38640798088719136,0.38640798088719136,Nebraska,Creighton,4,6,NA,263220158,2006-11-18
99,1,0:01,1201,1201,Nebraska Defensive Rebound.,28,31,-3,1,0.38640798088719136,0.38640798088719136,Nebraska,Creighton,4,6,NA,263220158,2006-11-18
100,1,0:00,1200,1200,End of the 1st Half.,28,31,-3,0,0.38634786325026177,0.38634786325026177,Nebraska,Creighton,4,6,NA,263220158,2006-11-18
101,2,20:00,1200,1200,PLAY,28,31,-3,16,0.38634786325026177,0.38634786325026177,Nebraska,Creighton,4,6,NA,263220158,2006-11-18
102,2,19:44,1184,1184,Dane Watts missed Three Point Jumper.,28,31,-3,0,0.38540136399841457,0.38540136399841457,Nebraska,Creighton,4,6,NA,263220158,2006-11-18
103,2,19:44,1184,1184,Aleks Maric Defensive Rebound.,28,31,-3,23,0.38540136399841457,0.38540136399841457,Nebraska,Creighton,4,6,NA,263220158,2006-11-18
104,2,19:21,1161,1161,Aleks Maric made Two Point Jumper.  Assisted by Charles Richardson Jr..,30,31,-1,14,0.4607254875201245,0.4607254875201245,Nebraska,Creighton,4,6,NA,263220158,2006-11-18
105,2,19:07,1147,1147,Anthony Tolliver missed Two Point Jumper.,30,31,-1,0,0.4604485354055376,0.4604485354055376,Nebraska,Creighton,4,6,NA,263220158,2006-11-18
106,2,19:07,1147,1147,Charles Richardson Jr. Defensive Rebound.,30,31,-1,27,0.4604485354055376,0.4604485354055376,Nebraska,Creighton,4,6,NA,263220158,2006-11-18
107,2,18:40,1120,1120,Dane Watts missed Two Point Jumper.,30,31,-1,0,0.45991604080643717,0.45991604080643717,Nebraska,Creighton,4,6,NA,263220158,2006-11-18
108,2,18:40,1120,1120,Aleks Maric Defensive Rebound.,30,31,-1,53,0.45991604080643717,0.45991604080643717,Nebraska,Creighton,4,6,NA,263220158,2006-11-18
109,2,17:47,1067,1067,Foul on Charles Richardson Jr.,30,31,-1,0,0.4588319511798032,0.4588319511798032,Nebraska,Creighton,4,6,NA,263220158,2006-11-18
110,2,17:47,1067,1067,Nick Porter made Free Throw.,30,32,-2,0,0.4182183194252806,0.4182183194252806,Nebraska,Creighton,4,6,NA,263220158,2006-11-18
111,2,17:47,1067,1067,Nick Porter made Free Throw.,30,33,-3,10,0.3786840529510994,0.3786840529510994,Nebraska,Creighton,4,6,NA,263220158,2006-11-18
112,2,17:37,1057,1057,Jamel White made Two Point Jumper.,32,33,-1,6,0.4586152324047573,0.4586152324047573,Nebraska,Creighton,4,6,NA,263220158,2006-11-18
113,2,17:31,1051,1051,Foul on Anthony Tolliver,32,33,-1,0,0.458482598376572,0.458482598376572,Nebraska,Creighton,4,6,NA,263220158,2006-11-18
114,2,17:31,1051,1051,Aleks Maric made Two Point Jumper.  Assisted by Sek Henry.,34,33,1,36,0.541517401623428,0.541517401623428,Nebraska,Creighton,4,6,NA,263220158,2006-11-18
115,2,16:55,1015,1015,Anthony Tolliver missed Three Point Jumper.,34,33,1,0,0.5423630666011812,0.5423630666011812,Nebraska,Creighton,4,6,NA,263220158,2006-11-18
116,2,16:55,1015,1015,Aleks Maric Defensive Rebound.,34,33,1,9,0.5423630666011812,0.5423630666011812,Nebraska,Creighton,4,6,NA,263220158,2006-11-18
117,2,16:46,1006,1006,Charles Richardson Jr. made Two Point Layup.,36,33,3,0,0.6253509968288866,0.6253509968288866,Nebraska,Creighton,4,6,NA,263220158,2006-11-18
118,2,16:46,1006,1006,Foul on Pierce Hibma,36,33,3,0,0.6253509968288866,0.6253509968288866,Nebraska,Creighton,4,6,NA,263220158,2006-11-18
119,2,16:46,1006,1006,Charles Richardson Jr. made Free Throw.,37,33,4,33,0.6644297850878392,0.6644297850878392,Nebraska,Creighton,4,6,NA,263220158,2006-11-18
120,2,16:13,973,973,Nick Porter missed Three Point Jumper.,37,33,4,0,0.6676514613734916,0.6676514613734916,Nebraska,Creighton,4,6,NA,263220158,2006-11-18
121,2,16:13,973,973,Jamel White Defensive Rebound.,37,33,4,5,0.6676514613734916,0.6676514613734916,Nebraska,Creighton,4,6,NA,263220158,2006-11-18
122,2,16:08,968,968,Foul on Nick Porter,37,33,4,22,0.6681721237644146,0.6681721237644146,Nebraska,Creighton,4,6,NA,263220158,2006-11-18
123,2,15:46,946,946,Jamel White made Three Point Jumper.  Assisted by Charles Richardson Jr..,40,33,7,17,0.7758730363919829,0.7758730363919829,Nebraska,Creighton,4,6,NA,263220158,2006-11-18
124,2,15:29,929,929,Isacc Miles made Three Point Jumper.  Assisted by Nate Funk.,40,36,4,36,0.6718031729657888,0.6718031729657888,Nebraska,Creighton,4,6,NA,263220158,2006-11-18
125,2,14:53,893,893,Official TV Timeout.,40,36,4,1,0.6746824246279629,0.6746824246279629,Nebraska,Creighton,4,6,NA,263220158,2006-11-18
126,2,14:52,892,892,Aleks Maric made Two Point Dunk Shot.  Assisted by Jamel White.,42,36,6,34,0.7492630477372121,0.7492630477372121,Nebraska,Creighton,4,6,NA,263220158,2006-11-18
127,2,14:18,858,858,Brice Nengsu missed Three Point Jumper.,42,36,6,0,0.7526106830717647,0.7526106830717647,Nebraska,Creighton,4,6,NA,263220158,2006-11-18
128,2,14:18,858,858,Anthony Tolliver Offensive Rebound.,42,36,6,7,0.7526106830717647,0.7526106830717647,Nebraska,Creighton,4,6,NA,263220158,2006-11-18
129,2,14:11,851,851,Nate Funk made Three Point Jumper.  Assisted by Isacc Miles.,42,39,3,28,0.6360331191451486,0.6360331191451486,Nebraska,Creighton,4,6,NA,263220158,2006-11-18
130,2,13:43,823,823,Sek Henry missed Three Point Jumper.,42,39,3,0,0.6378907750046982,0.6378907750046982,Nebraska,Creighton,4,6,NA,263220158,2006-11-18
131,2,13:43,823,823,Dane Watts Defensive Rebound.,42,39,3,26,0.6378907750046982,0.6378907750046982,Nebraska,Creighton,4,6,NA,263220158,2006-11-18
132,2,13:17,797,797,Isacc Miles made Three Point Jumper.,42,42,0,20,0.5,0.5,Nebraska,Creighton,4,6,NA,263220158,2006-11-18
133,2,12:57,777,777,Ryan Anderson made Three Point Jumper.  Assisted by Sek Henry.,45,42,3,18,0.6415496621649602,0.6415496621649602,Nebraska,Creighton,4,6,NA,263220158,2006-11-18
134,2,12:39,759,759,Anthony Tolliver missed Two Point Jumper.,45,42,3,0,0.6432826441443475,0.6432826441443475,Nebraska,Creighton,4,6,NA,263220158,2006-11-18
135,2,12:39,759,759,Ryan Anderson Defensive Rebound.,45,42,3,6,0.6432826441443475,0.6432826441443475,Nebraska,Creighton,4,6,NA,263220158,2006-11-18
136,2,12:33,753,753,Foul on Sek Henry,45,42,3,11,0.6439069352831082,0.6439069352831082,Nebraska,Creighton,4,6,NA,263220158,2006-11-18
137,2,12:22,742,742,Nate Funk missed Two Point Jumper.,45,42,3,0,0.6451177570386407,0.6451177570386407,Nebraska,Creighton,4,6,NA,263220158,2006-11-18
138,2,12:22,742,742,Aleks Maric Defensive Rebound.,45,42,3,8,0.6451177570386407,0.6451177570386407,Nebraska,Creighton,4,6,NA,263220158,2006-11-18
139,2,12:14,734,734,Jamel White missed Three Point Jumper.,45,42,3,0,0.6460555289554031,0.6460555289554031,Nebraska,Creighton,4,6,NA,263220158,2006-11-18
140,2,12:14,734,734,Nate Funk Defensive Rebound.,45,42,3,17,0.6460555289554031,0.6460555289554031,Nebraska,Creighton,4,6,NA,263220158,2006-11-18
141,2,11:57,717,717,Anthony Tolliver made Two Point Jumper.  Assisted by Josh Dotzler.,45,44,1,29,0.5507059170209166,0.5507059170209166,Nebraska,Creighton,4,6,NA,263220158,2006-11-18
142,2,11:28,688,688,Aleks Maric made Two Point Jumper.,47,44,3,17,0.6510371819144165,0.6510371819144165,Nebraska,Creighton,4,6,NA,263220158,2006-11-18
143,2,11:11,671,671,Nate Funk made Two Point Jumper.  Assisted by Josh Dotzler.,47,46,1,22,0.5523518987565235,0.5523518987565235,Nebraska,Creighton,4,6,NA,263220158,2006-11-18
144,2,10:49,649,649,Jamel White missed Two Point Jumper.,47,46,1,0,0.5530802656998836,0.5530802656998836,Nebraska,Creighton,4,6,NA,263220158,2006-11-18
145,2,10:49,649,649,Dane Watts Defensive Rebound.,47,46,1,5,0.5530802656998836,0.5530802656998836,Nebraska,Creighton,4,6,NA,263220158,2006-11-18
146,2,10:44,644,644,Nate Funk missed Three Point Jumper.,47,46,1,0,0.5532494455777598,0.5532494455777598,Nebraska,Creighton,4,6,NA,263220158,2006-11-18
147,2,10:44,644,644,Charles Richardson Jr. Defensive Rebound.,47,46,1,8,0.5532494455777598,0.5532494455777598,Nebraska,Creighton,4,6,NA,263220158,2006-11-18
148,2,10:36,636,636,Foul on Josh Dotzler,47,46,1,0,0.5535262415708168,0.5535262415708168,Nebraska,Creighton,4,6,NA,263220158,2006-11-18
149,2,10:36,636,636,Official TV Timeout.,47,46,1,49,0.5535262415708168,0.5535262415708168,Nebraska,Creighton,4,6,NA,263220158,2006-11-18
150,2,9:47,587,587,Brice Nengsu missed Three Point Jumper.,47,46,1,0,0.5555425416679692,0.5555425416679692,Nebraska,Creighton,4,6,NA,263220158,2006-11-18
151,2,9:47,587,587,Nick Porter Offensive Rebound.,47,46,1,17,0.5555425416679692,0.5555425416679692,Nebraska,Creighton,4,6,NA,263220158,2006-11-18
152,2,9:30,570,570,Pierce Hibma missed Three Point Jumper.,47,46,1,0,0.5564460823154982,0.5564460823154982,Nebraska,Creighton,4,6,NA,263220158,2006-11-18
153,2,9:30,570,570,Brice Nengsu Offensive Rebound.,47,46,1,17,0.5564460823154982,0.5564460823154982,Nebraska,Creighton,4,6,NA,263220158,2006-11-18
154,2,9:13,553,553,Foul on Pierce Hibma,47,46,1,8,0.5574979821026458,0.5574979821026458,Nebraska,Creighton,4,6,NA,263220158,2006-11-18
155,2,9:05,545,545,Foul on Anthony Tolliver,47,46,1,5,0.5580335217556641,0.5580335217556641,Nebraska,Creighton,4,6,NA,263220158,2006-11-18
156,2,9:00,540,540,Charles Richardson Jr. made Three Point Jumper.  Assisted by Paul Velander.,50,46,4,25,0.7186590096750158,0.7186590096750158,Nebraska,Creighton,4,6,NA,263220158,2006-11-18
157,2,8:35,515,515,Dane Watts missed Three Point Jumper.,50,46,4,0,0.7231006258497041,0.7231006258497041,Nebraska,Creighton,4,6,NA,263220158,2006-11-18
158,2,8:35,515,515,Aleks Maric Defensive Rebound.,50,46,4,43,0.7231006258497041,0.7231006258497041,Nebraska,Creighton,4,6,NA,263220158,2006-11-18
159,2,7:52,472,472,Dane Watts missed Two Point Jumper.,50,46,4,0,0.730280717431327,0.730280717431327,Nebraska,Creighton,4,6,NA,263220158,2006-11-18
160,2,7:52,472,472,Ryan Anderson Defensive Rebound.,50,46,4,9,0.730280717431327,0.730280717431327,Nebraska,Creighton,4,6,NA,263220158,2006-11-18
161,2,7:43,463,463,Dane Watts Steal.,50,46,4,0,0.7320806130529189,0.7320806130529189,Nebraska,Creighton,4,6,NA,263220158,2006-11-18
162,2,7:43,463,463,Foul on Josh Dotzler,50,46,4,0,0.7320806130529189,0.7320806130529189,Nebraska,Creighton,4,6,NA,263220158,2006-11-18
163,2,7:43,463,463,Official TV Timeout.,50,46,4,23,0.7320806130529189,0.7320806130529189,Nebraska,Creighton,4,6,NA,263220158,2006-11-18
164,2,7:20,440,440,Aleks Maric missed Two Point Jumper.,50,46,4,0,0.7376883853372899,0.7376883853372899,Nebraska,Creighton,4,6,NA,263220158,2006-11-18
165,2,7:20,440,440,Anthony Tolliver Defensive Rebound.,50,46,4,28,0.7376883853372899,0.7376883853372899,Nebraska,Creighton,4,6,NA,263220158,2006-11-18
166,2,6:52,412,412,Creighton Full Timeout.,50,46,4,6,0.746123851961776,0.746123851961776,Nebraska,Creighton,3,6,NA,263220158,2006-11-18
167,2,6:46,406,406,Foul on Jamel White,50,46,4,0,0.7478071899562382,0.7478071899562382,Nebraska,Creighton,3,6,NA,263220158,2006-11-18
168,2,6:46,406,406,Nick Porter made Free Throw.,50,47,3,0,0.6932193442524559,0.6932193442524559,Nebraska,Creighton,3,6,NA,263220158,2006-11-18
169,2,6:46,406,406,Nick Porter made Free Throw.,50,48,2,9,0.6326205671677834,0.6326205671677834,Nebraska,Creighton,3,6,NA,263220158,2006-11-18
170,2,6:37,397,397,Foul on Pierce Hibma,50,48,2,0,0.6341451930559543,0.6341451930559543,Nebraska,Creighton,3,6,NA,263220158,2006-11-18
171,2,6:37,397,397,Ryan Anderson made Free Throw.,51,48,3,0,0.6953098215112866,0.6953098215112866,Nebraska,Creighton,3,6,NA,263220158,2006-11-18
172,2,6:37,397,397,Ryan Anderson made Free Throw.,52,48,4,27,0.7502756146252284,0.7502756146252284,Nebraska,Creighton,3,6,NA,263220158,2006-11-18
173,2,6:10,370,370,Nick Porter made Two Point Jumper.,52,50,2,37,0.6388301490862524,0.6388301490862524,Nebraska,Creighton,3,6,NA,263220158,2006-11-18
