play_id,half,time_remaining_half,secs_remaining,secs_remaining_absolute,description,home_score,away_score,score_diff,play_length,win_prob,naive_win_prob,home,away,home_time_out_remaining,away_time_out_remaining,home_favored_by,game_id,date
1,1,20:00,2400,2400,PLAY,0,0,0,41,0.5,0.5,DePaul,Marquette,4,4,NA,270450305,2007-02-14
2,1,19:19,2359,2359,Draelon Burns missed Three Point Jumper.,0,0,0,0,0.5,0.5,DePaul,Marquette,4,4,NA,270450305,2007-02-14
3,1,19:19,2359,2359,Ousmane Barro Defensive Rebound.,0,0,0,9,0.5,0.5,DePaul,Marquette,4,4,NA,270450305,2007-02-14
4,1,19:10,2350,2350,Dominic James made Two Point Jumper.,0,2,-2,34,0.4549092390044173,0.4549092390044173,DePaul,Marquette,4,4,NA,270450305,2007-02-14
5,1,18:36,2316,2316,Jerel McNeal made Two Point Layup.,0,4,-4,0,0.40909706148952674,0.40909706148952674,DePaul,Marquette,4,4,NA,270450305,2007-02-14
6,1,18:36,2316,2316,Foul on Draelon Burns,0,4,-4,0,0.40909706148952674,0.40909706148952674,DePaul,Marquette,4,4,NA,270450305,2007-02-14
7,1,18:36,2316,2316,Jerel McNeal made Free Throw.,0,5,-5,11,0.3870749869751312,0.3870749869751312,DePaul,Marquette,4,4,NA,270450305,2007-02-14
8,1,18:25,2305,2305,Lorenzo Thompson made Two Point Jumper.,2,5,-3,36,0.4311291960698376,0.4311291960698376,DePaul,Marquette,4,4,NA,270450305,2007-02-14
9,1,17:49,2269,2269,Jabari Currie missed Three Point Jumper.,2,5,-3,0,0.4299359825185363,0.4299359825185363,DePaul,Marquette,4,4,NA,270450305,2007-02-14
10,1,17:49,2269,2269,Lazar Hayward Defensive Rebound.,2,5,-3,8,0.4299359825185363,0.4299359825185363,DePaul,Marquette,4,4,NA,270450305,2007-02-14
11,1,17:41,2261,2261,Wesley Matthews missed Two Point Layup.,2,5,-3,0,0.4296685097944087,0.4296685097944087,DePaul,Marquette,4,4,NA,270450305,2007-02-14
12,1,17:41,2261,2261,Lorenzo Thompson Defensive Rebound.,2,5,-3,7,0.4296685097944087,0.4296685097944087,DePaul,Marquette,4,4,NA,270450305,2007-02-14
13,1,17:34,2254,2254,Sammy Mejia made Three Point Jumper.,5,5,0,9,0.5,0.5,DePaul,Marquette,4,4,NA,270450305,2007-02-14
14,1,17:25,2245,2245,Foul on Lorenzo Thompson,5,5,0,0,0.5,0.5,DePaul,Marquette,4,4,NA,270450305,2007-02-14
15,1,17:25,2245,2245,Dominic James made Free Throw.,5,6,-1,0,0.4762349092179088,0.4762349092179088,DePaul,Marquette,4,4,NA,270450305,2007-02-14
16,1,17:25,2245,2245,Dominic James missed Free Throw.,5,6,-1,0,0.4762349092179088,0.4762349092179088,DePaul,Marquette,4,4,NA,270450305,2007-02-14
17,1,17:25,2245,2245,Wilson Chandler Defensive Rebound.,5,6,-1,22,0.4762349092179088,0.4762349092179088,DePaul,Marquette,4,4,NA,270450305,2007-02-14
18,1,17:03,2223,2223,Jerel McNeal made Two Point Layup.,5,8,-3,14,0.4283883988150674,0.4283883988150674,DePaul,Marquette,4,4,NA,270450305,2007-02-14
19,1,16:49,2209,2209,Foul on Sammy Mejia,5,8,-3,17,0.4279133452371713,0.4279133452371713,DePaul,Marquette,4,4,NA,270450305,2007-02-14
20,1,16:32,2192,2192,Lazar Hayward missed Two Point Layup.,5,8,-3,0,0.4273344834071913,0.4273344834071913,DePaul,Marquette,4,4,NA,270450305,2007-02-14
21,1,16:32,2192,2192,Keith Butler Defensive Rebound.,5,8,-3,20,0.4273344834071913,0.4273344834071913,DePaul,Marquette,4,4,NA,270450305,2007-02-14
22,1,16:12,2172,2172,Wilson Chandler missed Two Point Jumper.,5,8,-3,0,0.4266511374356508,0.4266511374356508,DePaul,Marquette,4,4,NA,270450305,2007-02-14
23,1,16:12,2172,2172,Jerel McNeal Defensive Rebound.,5,8,-3,9,0.4266511374356508,0.4266511374356508,DePaul,Marquette,4,4,NA,270450305,2007-02-14
24,1,16:03,2163,2163,Wesley Matthews missed Three Point Jumper.,5,8,-3,0,0.42634282019557657,0.42634282019557657,DePaul,Marquette,4,4,NA,270450305,2007-02-14
25,1,16:03,2163,2163,Keith Butler Defensive Rebound.,5,8,-3,3,0.42634282019557657,0.42634282019557657,DePaul,Marquette,4,4,NA,270450305,2007-02-14
26,1,16:00,2160,2160,Foul on Wesley Matthews,5,8,-3,13,0.4262398616956621,0.4262398616956621,DePaul,Marquette,4,4,NA,270450305,2007-02-14
27,1,15:47,2147,2147,Wilson Chandler missed Three Point Jumper.,5,8,-3,0,0.42579256894767775,0.42579256894767775,DePaul,Marquette,4,4,NA,270450305,2007-02-14
28,1,15:47,2147,2147,Dominic James Defensive Rebound.,5,8,-3,13,0.42579256894767775,0.42579256894767775,DePaul,Marquette,4,4,NA,270450305,2007-02-14
29,1,15:34,2134,2134,Jamil Lott made Two Point Jumper.,5,10,-5,17,0.3771976132597388,0.3771976132597388,DePaul,Marquette,4,4,NA,270450305,2007-02-14
30,1,15:17,2117,2117,Sammy Mejia missed Two Point Layup.,5,10,-5,0,0.3762519560912016,0.3762519560912016,DePaul,Marquette,4,4,NA,270450305,2007-02-14
31,1,15:17,2117,2117,Sammy Mejia Offensive Rebound.,5,10,-5,3,0.3762519560912016,0.3762519560912016,DePaul,Marquette,4,4,NA,270450305,2007-02-14
32,1,15:14,2114,2114,Sammy Mejia missed Two Point Tip Shot.,5,10,-5,0,0.37608452877612114,0.37608452877612114,DePaul,Marquette,4,4,NA,270450305,2007-02-14
33,1,15:14,2114,2114,Marquette Defensive Rebound.,5,10,-5,1,0.37608452877612114,0.37608452877612114,DePaul,Marquette,4,4,NA,270450305,2007-02-14
34,1,15:13,2113,2113,Official TV Timeout.,5,10,-5,17,0.3760286821733362,0.3760286821733362,DePaul,Marquette,4,4,NA,270450305,2007-02-14
35,1,14:56,2096,2096,Dominic James missed Two Point Layup.,5,10,-5,0,0.375076340860444,0.375076340860444,DePaul,Marquette,4,4,NA,270450305,2007-02-14
36,1,14:56,2096,2096,Marquette Offensive Rebound.,5,10,-5,0,0.375076340860444,0.375076340860444,DePaul,Marquette,4,4,NA,270450305,2007-02-14
37,1,14:56,2096,2096,Foul on Keith Butler,5,10,-5,4,0.375076340860444,0.375076340860444,DePaul,Marquette,4,4,NA,270450305,2007-02-14
38,1,14:52,2092,2092,Jerel McNeal missed Three Point Jumper.,5,10,-5,0,0.37485142790284404,0.37485142790284404,DePaul,Marquette,4,4,NA,270450305,2007-02-14
39,1,14:52,2092,2092,Cliff Clinkscales Defensive Rebound.,5,10,-5,7,0.37485142790284404,0.37485142790284404,DePaul,Marquette,4,4,NA,270450305,2007-02-14
40,1,14:45,2085,2085,Cliff Clinkscales made Two Point Jumper.,7,10,-3,11,0.42363088582115915,0.42363088582115915,DePaul,Marquette,4,4,NA,270450305,2007-02-14
41,1,14:34,2074,2074,Wesley Matthews missed Two Point Layup.,7,10,-3,0,0.42324188549994607,0.42324188549994607,DePaul,Marquette,4,4,NA,270450305,2007-02-14
42,1,14:34,2074,2074,Sammy Mejia Defensive Rebound.,7,10,-3,6,0.42324188549994607,0.42324188549994607,DePaul,Marquette,4,4,NA,270450305,2007-02-14
43,1,14:28,2068,2068,Wilson Chandler made Two Point Dunk Shot.,9,10,-1,23,0.47416041489824323,0.47416041489824323,DePaul,Marquette,4,4,NA,270450305,2007-02-14
44,1,14:05,2045,2045,Foul on Jabari Currie,9,10,-1,6,0.473880626850835,0.473880626850835,DePaul,Marquette,4,4,NA,270450305,2007-02-14
45,1,13:59,2039,2039,Dominic James missed Three Point Jumper.,9,10,-1,0,0.47380713873167757,0.47380713873167757,DePaul,Marquette,4,4,NA,270450305,2007-02-14
46,1,13:59,2039,2039,Marcus Heard Defensive Rebound.,9,10,-1,19,0.47380713873167757,0.47380713873167757,DePaul,Marquette,4,4,NA,270450305,2007-02-14
47,1,13:40,2020,2020,Karron Clarke made Three Point Jumper.,12,10,2,51,0.5527067674932231,0.5527067674932231,DePaul,Marquette,4,4,NA,270450305,2007-02-14
48,1,12:49,1969,1969,Foul on Dominic James,12,10,2,0,0.5539758302751209,0.5539758302751209,DePaul,Marquette,4,4,NA,270450305,2007-02-14
49,1,12:49,1969,1969,Draelon Burns made Free Throw.,13,10,3,0,0.580571982196121,0.580571982196121,DePaul,Marquette,4,4,NA,270450305,2007-02-14
50,1,12:49,1969,1969,Draelon Burns made Free Throw.,14,10,4,13,0.6067081308366806,0.6067081308366806,DePaul,Marquette,4,4,NA,270450305,2007-02-14
51,1,12:36,1956,1956,Jerel McNeal made Two Point Jumper.,14,12,2,25,0.5543049405536468,0.5543049405536468,DePaul,Marquette,4,4,NA,270450305,2007-02-14
52,1,12:11,1931,1931,Sammy Mejia missed Two Point Jumper.,14,12,2,0,0.5549447352680729,0.5549447352680729,DePaul,Marquette,4,4,NA,270450305,2007-02-14
53,1,12:11,1931,1931,Marcus Heard Offensive Rebound.,14,12,2,4,0.5549447352680729,0.5549447352680729,DePaul,Marquette,4,4,NA,270450305,2007-02-14
54,1,12:07,1927,1927,Marcus Heard made Two Point Layup.,16,12,4,16,0.6087772588415313,0.6087772588415313,DePaul,Marquette,4,4,NA,270450305,2007-02-14
55,1,11:51,1911,1911,Dominic James made Two Point Jumper.,16,14,2,19,0.555459787815079,0.555459787815079,DePaul,Marquette,4,4,NA,270450305,2007-02-14
56,1,11:32,1892,1892,Marcus Heard made Three Point Jumper.,19,14,5,14,0.6368768076375445,0.6368768076375445,DePaul,Marquette,4,4,NA,270450305,2007-02-14
57,1,11:18,1878,1878,Ousmane Barro missed Two Point Jumper.,19,14,5,0,0.6377192408456538,0.6377192408456538,DePaul,Marquette,4,4,NA,270450305,2007-02-14
58,1,11:18,1878,1878,Dan Fitzgerald Offensive Rebound.,19,14,5,13,0.6377192408456538,0.6377192408456538,DePaul,Marquette,4,4,NA,270450305,2007-02-14
59,1,11:05,1865,1865,Official TV Timeout.,19,14,5,7,0.6385018825339781,0.6385018825339781,DePaul,Marquette,4,4,NA,270450305,2007-02-14
60,1,10:58,1858,1858,Jerel McNeal missed Two Point Layup.,19,14,5,0,0.6389237403033098,0.6389237403033098,DePaul,Marquette,4,4,NA,270450305,2007-02-14
61,1,10:58,1858,1858,Jerel McNeal Offensive Rebound.,19,14,5,2,0.6389237403033098,0.6389237403033098,DePaul,Marquette,4,4,NA,270450305,2007-02-14
62,1,10:56,1856,1856,Jerel McNeal missed Two Point Layup.,19,14,5,0,0.6390443505328853,0.6390443505328853,DePaul,Marquette,4,4,NA,270450305,2007-02-14
63,1,10:56,1856,1856,Dwight Burke Offensive Rebound.,19,14,5,3,0.6390443505328853,0.6390443505328853,DePaul,Marquette,4,4,NA,270450305,2007-02-14
64,1,10:53,1853,1853,Dwight Burke missed Two Point Tip Shot.,19,14,5,0,0.63922534272341,0.63922534272341,DePaul,Marquette,4,4,NA,270450305,2007-02-14
65,1,10:53,1853,1853,Dwight Burke Offensive Rebound.,19,14,5,0,0.63922534272341,0.63922534272341,DePaul,Marquette,4,4,NA,270450305,2007-02-14
66,1,10:53,1853,1853,Foul on Marcus Heard,19,14,5,0,0.63922534272341,0.63922534272341,DePaul,Marquette,4,4,NA,270450305,2007-02-14
67,1,10:53,1853,1853,Dwight Burke missed Free Throw.,19,14,5,0,0.63922534272341,0.63922534272341,DePaul,Marquette,4,4,NA,270450305,2007-02-14
68,1,10:53,1853,1853,null,19,14,5,0,0.63922534272341,0.63922534272341,DePaul,Marquette,4,4,NA,270450305,2007-02-14
69,1,10:53,1853,1853,Dwight Burke missed Free Throw.,19,14,5,0,0.63922534272341,0.63922534272341,DePaul,Marquette,4,4,NA,270450305,2007-02-14
70,1,10:53,1853,1853,Lazar Hayward Offensive Rebound.,19,14,5,21,0.63922534272341,0.63922534272341,DePaul,Marquette,4,4,NA,270450305,2007-02-14
71,1,10:32,1832,1832,Draelon Burns missed Two Point Layup.,19,14,5,0,0.640495643290806,0.640495643290806,DePaul,Marquette,4,4,NA,270450305,2007-02-14
72,1,10:32,1832,1832,Lazar Hayward Defensive Rebound.,19,14,5,7,0.640495643290806,0.640495643290806,DePaul,Marquette,4,4,NA,270450305,2007-02-14
73,1,10:25,1825,1825,Jerel McNeal missed Three Point Jumper.,19,14,5,0,0.6409207392310161,0.6409207392310161,DePaul,Marquette,4,4,NA,270450305,2007-02-14
74,1,10:25,1825,1825,Wesley Matthews Offensive Rebound.,19,14,5,26,0.6409207392310161,0.6409207392310161,DePaul,Marquette,4,4,NA,270450305,2007-02-14
75,1,9:59,1799,1799,Draelon Burns missed Three Point Jumper.,19,14,5,0,0.6425096589751662,0.6425096589751662,DePaul,Marquette,4,4,NA,270450305,2007-02-14
76,1,9:59,1799,1799,Wesley Matthews Defensive Rebound.,19,14,5,12,0.6425096589751662,0.6425096589751662,DePaul,Marquette,4,4,NA,270450305,2007-02-14
77,1,9:47,1787,1787,Jerel McNeal made Two Point Layup.,19,16,3,17,0.5875139596205512,0.5875139596205512,DePaul,Marquette,4,4,NA,270450305,2007-02-14
78,1,9:30,1770,1770,Foul on Lazar Hayward,19,16,3,9,0.5881838159738149,0.5881838159738149,DePaul,Marquette,4,4,NA,270450305,2007-02-14
79,1,9:21,1761,1761,Sammy Mejia made Two Point Layup.,21,16,5,27,0.6448702892483151,0.6448702892483151,DePaul,Marquette,4,4,NA,270450305,2007-02-14
80,1,8:54,1734,1734,Dominic James made Three Point Jumper.,21,19,2,25,0.5601137551935602,0.5601137551935602,DePaul,Marquette,4,4,NA,270450305,2007-02-14
81,1,8:29,1709,1709,Wilson Chandler made Two Point Jumper.,23,19,4,8,0.6198541176592861,0.6198541176592861,DePaul,Marquette,4,4,NA,270450305,2007-02-14
82,1,8:21,1701,1701,Dominic James missed Two Point Layup.,23,19,4,0,0.620289477874783,0.620289477874783,DePaul,Marquette,4,4,NA,270450305,2007-02-14
83,1,8:21,1701,1701,DePaul Defensive Rebound.,23,19,4,19,0.620289477874783,0.620289477874783,DePaul,Marquette,4,4,NA,270450305,2007-02-14
84,1,8:02,1682,1682,Marcus Heard made Two Point Layup.,25,19,6,30,0.6776109626030262,0.6776109626030262,DePaul,Marquette,4,4,NA,270450305,2007-02-14
85,1,7:32,1652,1652,Official TV Timeout.,25,19,6,25,0.6798407032196302,0.6798407032196302,DePaul,Marquette,4,4,NA,270450305,2007-02-14
86,1,7:07,1627,1627,Wilson Chandler missed Two Point Jumper.,25,19,6,0,0.6816426637455257,0.6816426637455257,DePaul,Marquette,4,4,NA,270450305,2007-02-14
87,1,7:07,1627,1627,Wesley Matthews Defensive Rebound.,25,19,6,2,0.6816426637455257,0.6816426637455257,DePaul,Marquette,4,4,NA,270450305,2007-02-14
88,1,7:05,1625,1625,Foul on Wilson Chandler,25,19,6,1,0.6817853638303693,0.6817853638303693,DePaul,Marquette,4,4,NA,270450305,2007-02-14
89,1,7:04,1624,1624,Wesley Matthews made Free Throw.,25,20,5,0,0.6536822099297468,0.6536822099297468,DePaul,Marquette,4,4,NA,270450305,2007-02-14
90,1,7:04,1624,1624,Wesley Matthews missed Free Throw.,25,20,5,0,0.6536822099297468,0.6536822099297468,DePaul,Marquette,4,4,NA,270450305,2007-02-14
91,1,7:04,1624,1624,Draelon Burns Defensive Rebound.,25,20,5,6,0.6536822099297468,0.6536822099297468,DePaul,Marquette,4,4,NA,270450305,2007-02-14
92,1,6:58,1618,1618,Wilson Chandler made Two Point Layup.,27,20,7,36,0.7092341573492061,0.7092341573492061,DePaul,Marquette,4,4,NA,270450305,2007-02-14
93,1,6:22,1582,1582,Wesley Matthews missed Three Point Jumper.,27,20,7,0,0.7120624329506158,0.7120624329506158,DePaul,Marquette,4,4,NA,270450305,2007-02-14
94,1,6:22,1582,1582,Ousmane Barro Offensive Rebound.,27,20,7,10,0.7120624329506158,0.7120624329506158,DePaul,Marquette,4,4,NA,270450305,2007-02-14
95,1,6:12,1572,1572,Dan Fitzgerald made Two Point Jumper.,27,22,5,45,0.6568920966971669,0.6568920966971669,DePaul,Marquette,4,4,NA,270450305,2007-02-14
96,1,5:27,1527,1527,Dominic James missed Three Point Jumper.,27,22,5,0,0.6597361141830707,0.6597361141830707,DePaul,Marquette,4,4,NA,270450305,2007-02-14
97,1,5:27,1527,1527,Draelon Burns Defensive Rebound.,27,22,5,24,0.6597361141830707,0.6597361141830707,DePaul,Marquette,4,4,NA,270450305,2007-02-14
98,1,5:03,1503,1503,Jabari Currie made Two Point Layup.,29,22,7,1,0.7184625788394533,0.7184625788394533,DePaul,Marquette,4,4,NA,270450305,2007-02-14
99,1,5:02,1502,1502,Foul on Jamil Lott,29,22,7,0,0.718547665005663,0.718547665005663,DePaul,Marquette,4,4,NA,270450305,2007-02-14
100,1,5:02,1502,1502,Jabari Currie made Free Throw.,30,22,8,15,0.7448183078441887,0.7448183078441887,DePaul,Marquette,4,4,NA,270450305,2007-02-14
101,1,4:47,1487,1487,Foul on David Cubillan,30,22,8,0,0.7462077928969975,0.7462077928969975,DePaul,Marquette,4,4,NA,270450305,2007-02-14
102,1,4:47,1487,1487,Marquette Full Timeout.,30,22,8,0,0.7462077928969975,0.7462077928969975,DePaul,Marquette,3,4,NA,270450305,2007-02-14
103,1,4:47,1487,1487,Wilson Chandler missed Free Throw.,30,22,8,0,0.7462077928969975,0.7462077928969975,DePaul,Marquette,3,4,NA,270450305,2007-02-14
104,1,4:47,1487,1487,null,30,22,8,0,0.7462077928969975,0.7462077928969975,DePaul,Marquette,3,4,NA,270450305,2007-02-14
105,1,4:47,1487,1487,Wilson Chandler made Free Throw.,31,22,9,22,0.7708821990263708,0.7708821990263708,DePaul,Marquette,3,4,NA,270450305,2007-02-14
106,1,4:25,1465,1465,Dominic James missed Three Point Jumper.,31,22,9,0,0.7730935001622736,0.7730935001622736,DePaul,Marquette,3,4,NA,270450305,2007-02-14
107,1,4:25,1465,1465,Karron Clarke Defensive Rebound.,31,22,9,6,0.7730935001622736,0.7730935001622736,DePaul,Marquette,3,4,NA,270450305,2007-02-14
108,1,4:19,1459,1459,Dan Fitzgerald made Three Point Jumper.,31,25,6,30,0.694151261457709,0.694151261457709,DePaul,Marquette,3,4,NA,270450305,2007-02-14
109,1,3:49,1429,1429,Karron Clarke missed Three Point Jumper.,31,25,6,0,0.696673750408251,0.696673750408251,DePaul,Marquette,3,4,NA,270450305,2007-02-14
110,1,3:49,1429,1429,Dominic James Defensive Rebound.,31,25,6,13,0.696673750408251,0.696673750408251,DePaul,Marquette,3,4,NA,270450305,2007-02-14
111,1,3:36,1416,1416,Draelon Burns made Three Point Jumper.,34,25,9,7,0.7781183191887701,0.7781183191887701,DePaul,Marquette,3,4,NA,270450305,2007-02-14
112,1,3:29,1409,1409,Foul on Draelon Burns,34,25,9,0,0.77880188533861,0.77880188533861,DePaul,Marquette,3,4,NA,270450305,2007-02-14
113,1,3:29,1409,1409,Official TV Timeout.,34,25,9,0,0.77880188533861,0.77880188533861,DePaul,Marquette,3,4,NA,270450305,2007-02-14
114,1,3:29,1409,1409,Wesley Matthews made Free Throw.,34,26,8,0,0.7537739713126022,0.7537739713126022,DePaul,Marquette,3,4,NA,270450305,2007-02-14
115,1,3:29,1409,1409,Wesley Matthews made Free Throw.,34,27,7,9,0.7269072268958341,0.7269072268958341,DePaul,Marquette,3,4,NA,270450305,2007-02-14
116,1,3:20,1400,1400,Marcus Heard missed Three Point Jumper.,34,27,7,0,0.7276857830855252,0.7276857830855252,DePaul,Marquette,3,4,NA,270450305,2007-02-14
117,1,3:20,1400,1400,Wilson Chandler Offensive Rebound.,34,27,7,9,0.7276857830855252,0.7276857830855252,DePaul,Marquette,3,4,NA,270450305,2007-02-14
118,1,3:11,1391,1391,Karron Clarke made Two Point Layup.,36,27,9,6,0.7805284615875857,0.7805284615875857,DePaul,Marquette,3,4,NA,270450305,2007-02-14
119,1,3:05,1385,1385,Dan Fitzgerald made Three Point Jumper.,36,30,6,18,0.7001567754686275,0.7001567754686275,DePaul,Marquette,3,4,NA,270450305,2007-02-14
120,1,2:47,1367,1367,Jerel McNeal made Two Point Dunk Shot.,36,32,4,2,0.638709687422706,0.638709687422706,DePaul,Marquette,3,4,NA,270450305,2007-02-14
121,1,2:45,1365,1365,DePaul Full Timeout.,36,32,4,17,0.6388225376222332,0.6388225376222332,DePaul,Marquette,3,3,NA,270450305,2007-02-14
122,1,2:28,1348,1348,Wilson Chandler made Two Point Layup.,38,32,6,18,0.7030032478323914,0.7030032478323914,DePaul,Marquette,3,3,NA,270450305,2007-02-14
123,1,2:10,1330,1330,Dominic James missed Two Point Jumper.,38,32,6,0,0.7044012177932808,0.7044012177932808,DePaul,Marquette,3,3,NA,270450305,2007-02-14
124,1,2:10,1330,1330,Wilson Chandler Defensive Rebound.,38,32,6,14,0.7044012177932808,0.7044012177932808,DePaul,Marquette,3,3,NA,270450305,2007-02-14
125,1,1:56,1316,1316,Foul on Karron Clarke,38,32,6,13,0.7055070362997802,0.7055070362997802,DePaul,Marquette,3,3,NA,270450305,2007-02-14
126,1,1:43,1303,1303,Dan Fitzgerald missed Three Point Jumper.,38,32,6,0,0.7065546897800921,0.7065546897800921,DePaul,Marquette,3,3,NA,270450305,2007-02-14
127,1,1:43,1303,1303,Dan Fitzgerald Offensive Rebound.,38,32,6,19,0.7065546897800921,0.7065546897800921,DePaul,Marquette,3,3,NA,270450305,2007-02-14
128,1,1:24,1284,1284,Ousmane Barro missed Two Point Layup.,38,32,6,0,0.7081330103559508,0.7081330103559508,DePaul,Marquette,3,3,NA,270450305,2007-02-14
129,1,1:24,1284,1284,Marcus Heard Defensive Rebound.,38,32,6,23,0.7081330103559508,0.7081330103559508,DePaul,Marquette,3,3,NA,270450305,2007-02-14
130,1,1:01,1261,1261,Sammy Mejia missed Three Point Jumper.,38,32,6,0,0.7101392414926759,0.7101392414926759,DePaul,Marquette,3,3,NA,270450305,2007-02-14
131,1,1:01,1261,1261,Dan Fitzgerald Defensive Rebound.,38,32,6,10,0.7101392414926759,0.7101392414926759,DePaul,Marquette,3,3,NA,270450305,2007-02-14
132,1,0:51,1251,1251,Jerel McNeal missed Two Point Jumper.,38,32,6,0,0.7110507925631111,0.7110507925631111,DePaul,Marquette,3,3,NA,270450305,2007-02-14
133,1,0:51,1251,1251,Wilson Chandler Defensive Rebound.,38,32,6,7,0.7110507925631111,0.7110507925631111,DePaul,Marquette,3,3,NA,270450305,2007-02-14
134,1,0:44,1244,1244,Jabari Currie made Two Point Layup.,40,32,8,7,0.7693961476205816,0.7693961476205816,DePaul,Marquette,3,3,NA,270450305,2007-02-14
135,1,0:37,1237,1237,Foul on Marcus Heard,40,32,8,0,0.7701660661249853,0.7701660661249853,DePaul,Marquette,3,3,NA,270450305,2007-02-14
136,1,0:37,1237,1237,Dominic James made Free Throw.,40,33,7,0,0.7423259460807395,0.7423259460807395,DePaul,Marquette,3,3,NA,270450305,2007-02-14
137,1,0:37,1237,1237,Dominic James missed Free Throw.,40,33,7,0,0.7423259460807395,0.7423259460807395,DePaul,Marquette,3,3,NA,270450305,2007-02-14
138,1,0:37,1237,1237,Marcus Heard Defensive Rebound.,40,33,7,28,0.7423259460807395,0.7423259460807395,DePaul,Marquette,3,3,NA,270450305,2007-02-14
139,1,0:09,1209,1209,Jabari Currie missed Three Point Jumper.,40,33,7,0,0.7454025326099278,0.7454025326099278,DePaul,Marquette,3,3,NA,270450305,2007-02-14
140,1,0:09,1209,1209,Ousmane Barro Defensive Rebound.,40,33,7,8,0.7454025326099278,0.7454025326099278,DePaul,Marquette,3,3,NA,270450305,2007-02-14
141,1,0:01,1201,1201,Sammy Mejia missed Three Point Jumper.,40,33,7,0,0.7463081927719248,0.7463081927719248,DePaul,Marquette,3,3,NA,270450305,2007-02-14
142,1,0:01,1201,1201,null,40,33,7,1,0.7463081927719248,0.7463081927719248,DePaul,Marquette,3,3,NA,270450305,2007-02-14
143,1,0:00,1200,1200,End of the 1st Half.,40,33,7,0,0.7464201950257411,0.7464201950257411,DePaul,Marquette,3,3,NA,270450305,2007-02-14
144,2,20:00,1200,1200,PLAY,40,33,7,18,0.7464201950257411,0.7464201950257411,DePaul,Marquette,4,4,NA,270450305,2007-02-14
145,2,19:42,1182,1182,Jerel McNeal made Two Point Layup.,40,35,5,18,0.6853840531166835,0.6853840531166835,DePaul,Marquette,4,4,NA,270450305,2007-02-14
146,2,19:24,1164,1164,Draelon Burns made Two Point Jumper.,42,35,7,18,0.750311657238087,0.750311657238087,DePaul,Marquette,4,4,NA,270450305,2007-02-14
147,2,19:06,1146,1146,Dominic James missed Two Point Layup.,42,35,7,0,0.7521878516945639,0.7521878516945639,DePaul,Marquette,4,4,NA,270450305,2007-02-14
148,2,19:06,1146,1146,Dominic James Offensive Rebound.,42,35,7,15,0.7521878516945639,0.7521878516945639,DePaul,Marquette,4,4,NA,270450305,2007-02-14
149,2,18:51,1131,1131,Dominic James made Two Point Jumper.,42,37,5,18,0.6897668871162481,0.6897668871162481,DePaul,Marquette,4,4,NA,270450305,2007-02-14
150,2,18:33,1113,1113,Wilson Chandler missed Two Point Layup.,42,37,5,0,0.6912994213498522,0.6912994213498522,DePaul,Marquette,4,4,NA,270450305,2007-02-14
151,2,18:33,1113,1113,Draelon Burns Offensive Rebound.,42,37,5,15,0.6912994213498522,0.6912994213498522,DePaul,Marquette,4,4,NA,270450305,2007-02-14
152,2,18:18,1098,1098,Draelon Burns missed Two Point Jumper.,42,37,5,0,0.6925909722842625,0.6925909722842625,DePaul,Marquette,4,4,NA,270450305,2007-02-14
153,2,18:18,1098,1098,Lazar Hayward Defensive Rebound.,42,37,5,13,0.6925909722842625,0.6925909722842625,DePaul,Marquette,4,4,NA,270450305,2007-02-14
154,2,18:05,1085,1085,Jerel McNeal missed Two Point Layup.,42,37,5,0,0.6937289291596819,0.6937289291596819,DePaul,Marquette,4,4,NA,270450305,2007-02-14
155,2,18:05,1085,1085,Lazar Hayward Offensive Rebound.,42,37,5,3,0.6937289291596819,0.6937289291596819,DePaul,Marquette,4,4,NA,270450305,2007-02-14
156,2,18:02,1082,1082,Lazar Hayward missed Two Point Tip Shot.,42,37,5,0,0.6939946937133286,0.6939946937133286,DePaul,Marquette,4,4,NA,270450305,2007-02-14
157,2,18:02,1082,1082,Marquette Offensive Rebound.,42,37,5,2,0.6939946937133286,0.6939946937133286,DePaul,Marquette,4,4,NA,270450305,2007-02-14
158,2,18:00,1080,1080,Foul on Cliff Clinkscales,42,37,5,0,0.6941726129867419,0.6941726129867419,DePaul,Marquette,4,4,NA,270450305,2007-02-14
159,2,18:00,1080,1080,Dominic James missed Free Throw.,42,37,5,0,0.6941726129867419,0.6941726129867419,DePaul,Marquette,4,4,NA,270450305,2007-02-14
160,2,18:00,1080,1080,null,42,37,5,0,0.6941726129867419,0.6941726129867419,DePaul,Marquette,4,4,NA,270450305,2007-02-14
161,2,18:00,1080,1080,Dominic James made Free Throw.,42,38,4,33,0.6583072537216603,0.6583072537216603,DePaul,Marquette,4,4,NA,270450305,2007-02-14
162,2,17:27,1047,1047,Cliff Clinkscales missed Two Point Jumper.,42,38,4,0,0.6608882333683003,0.6608882333683003,DePaul,Marquette,4,4,NA,270450305,2007-02-14
163,2,17:27,1047,1047,Wesley Matthews Defensive Rebound.,42,38,4,8,0.6608882333683003,0.6608882333683003,DePaul,Marquette,4,4,NA,270450305,2007-02-14
164,2,17:19,1039,1039,Foul on Wesley Matthews,42,38,4,11,0.6615458709061123,0.6615458709061123,DePaul,Marquette,4,4,NA,270450305,2007-02-14
165,2,17:08,1028,1028,Draelon Burns missed Three Point Jumper.,42,38,4,0,0.6624747679566267,0.6624747679566267,DePaul,Marquette,4,4,NA,270450305,2007-02-14
166,2,17:08,1028,1028,Wilson Chandler Offensive Rebound.,42,38,4,19,0.6624747679566267,0.6624747679566267,DePaul,Marquette,4,4,NA,270450305,2007-02-14
167,2,16:49,1009,1009,Foul on Jerel McNeal,42,38,4,14,0.6641548959588939,0.6641548959588939,DePaul,Marquette,4,4,NA,270450305,2007-02-14
168,2,16:35,995,995,Wilson Chandler missed Three Point Jumper.,42,38,4,0,0.6654620782530389,0.6654620782530389,DePaul,Marquette,4,4,NA,270450305,2007-02-14
169,2,16:35,995,995,Karron Clarke Offensive Rebound.,42,38,4,5,0.6654620782530389,0.6654620782530389,DePaul,Marquette,4,4,NA,270450305,2007-02-14
170,2,16:30,990,990,Karron Clarke missed Two Point Jumper.,42,38,4,0,0.6659445398028806,0.6659445398028806,DePaul,Marquette,4,4,NA,270450305,2007-02-14
171,2,16:30,990,990,DePaul Offensive Rebound.,42,38,4,1,0.6659445398028806,0.6659445398028806,DePaul,Marquette,4,4,NA,270450305,2007-02-14
172,2,16:29,989,989,Foul on Lazar Hayward,42,38,4,7,0.6660420636355389,0.6660420636355389,DePaul,Marquette,4,4,NA,270450305,2007-02-14
173,2,16:22,982,982,Foul on Dominic James,42,38,4,0,0.6667346328322975,0.6667346328322975,DePaul,Marquette,4,4,NA,270450305,2007-02-14
174,2,16:22,982,982,Sammy Mejia made Free Throw.,43,38,5,0,0.7040828057208548,0.7040828057208548,DePaul,Marquette,4,4,NA,270450305,2007-02-14
175,2,16:22,982,982,Sammy Mejia missed Free Throw.,43,38,5,0,0.7040828057208548,0.7040828057208548,DePaul,Marquette,4,4,NA,270450305,2007-02-14
176,2,16:22,982,982,Ousmane Barro Defensive Rebound.,43,38,5,14,0.7040828057208548,0.7040828057208548,DePaul,Marquette,4,4,NA,270450305,2007-02-14
