play_id,half,time_remaining_half,secs_remaining,secs_remaining_absolute,description,home_score,away_score,score_diff,play_length,win_prob,naive_win_prob,home,away,home_time_out_remaining,away_time_out_remaining,home_favored_by,game_id,date
1,1,20:00,2400,2400,PLAY,0,0,0,21,0.5,0.5,Iona,Quinnipiac,4,4,NA,400842021,2016-02-15
2,1,19:39,2379,2379,Chaise Daniels made Jumper. Assisted by James Ford Jr.,0,2,-2,14,0.45553098113171275,0.45553098113171275,Iona,Quinnipiac,4,4,NA,400842021,2016-02-15
3,1,19:25,2365,2365,Ibn Muhammad missed Three Point Jumper.,0,2,-2,0,0.45523226214346435,0.45523226214346435,Iona,Quinnipiac,4,4,NA,400842021,2016-02-15
4,1,19:25,2365,2365,Quinnipiac Defensive Rebound.,0,2,-2,17,0.45523226214346435,0.45523226214346435,Iona,Quinnipiac,4,4,NA,400842021,2016-02-15
5,1,19:08,2348,2348,James Ford Jr missed Layup.,0,2,-2,0,0.45486594659906016,0.45486594659906016,Iona,Quinnipiac,4,4,NA,400842021,2016-02-15
6,1,19:08,2348,2348,Deyshonee Much Defensive Rebound.,0,2,-2,7,0.45486594659906016,0.45486594659906016,Iona,Quinnipiac,4,4,NA,400842021,2016-02-15
7,1,19:01,2341,2341,Ibn Muhammad Turnover.,0,2,-2,1,0.45471402389215027,0.45471402389215027,Iona,Quinnipiac,4,4,NA,400842021,2016-02-15
8,1,19:00,2340,2340,Daniel Harris Steal.,0,2,-2,15,0.4546922706473648,0.4546922706473648,Iona,Quinnipiac,4,4,NA,400842021,2016-02-15
9,1,18:45,2325,2325,Foul on Deyshonee Much.,0,2,-2,16,0.4543645204002807,0.4543645204002807,Iona,Quinnipiac,4,4,NA,400842021,2016-02-15
10,1,18:29,2309,2309,Daniel Harris made Three Point Jumper. Assisted by Giovanni McLean.,0,5,-5,26,0.38670526359674323,0.38670526359674323,Iona,Quinnipiac,4,4,NA,400842021,2016-02-15
11,1,18:03,2283,2283,Ibn Muhammad made Three Point Jumper. Assisted by Deyshonee Much.,3,5,-2,15,0.4534335585723665,0.4534335585723665,Iona,Quinnipiac,4,4,NA,400842021,2016-02-15
12,1,17:48,2268,2268,Chaise Daniels missed Jumper.,3,5,-2,0,0.45309687598260123,0.45309687598260123,Iona,Quinnipiac,4,4,NA,400842021,2016-02-15
13,1,17:48,2268,2268,A.J. English Defensive Rebound.,3,5,-2,7,0.45309687598260123,0.45309687598260123,Iona,Quinnipiac,4,4,NA,400842021,2016-02-15
14,1,17:41,2261,2261,Ibn Muhammad missed Three Point Jumper.,3,5,-2,0,0.4529390880246341,0.4529390880246341,Iona,Quinnipiac,4,4,NA,400842021,2016-02-15
15,1,17:41,2261,2261,James Ford Jr Defensive Rebound.,3,5,-2,11,0.4529390880246341,0.4529390880246341,Iona,Quinnipiac,4,4,NA,400842021,2016-02-15
16,1,17:30,2250,2250,Foul on Ibn Muhammad.,3,5,-2,18,0.4526903320869115,0.4526903320869115,Iona,Quinnipiac,4,4,NA,400842021,2016-02-15
17,1,17:12,2232,2232,Chaise Daniels Turnover.,3,5,-2,0,0.4522813233554353,0.4522813233554353,Iona,Quinnipiac,4,4,NA,400842021,2016-02-15
18,1,17:12,2232,2232,Foul on Chaise Daniels.,3,5,-2,9,0.4522813233554353,0.4522813233554353,Iona,Quinnipiac,4,4,NA,400842021,2016-02-15
19,1,17:03,2223,2223,A.J. English missed Three Point Jumper.,3,5,-2,0,0.45207599041727337,0.45207599041727337,Iona,Quinnipiac,4,4,NA,400842021,2016-02-15
20,1,17:03,2223,2223,Donovan Smith Defensive Rebound.,3,5,-2,21,0.45207599041727337,0.45207599041727337,Iona,Quinnipiac,4,4,NA,400842021,2016-02-15
21,1,16:42,2202,2202,Abdulai Bundu missed Dunk.,3,5,-2,1,0.45159499670939535,0.45159499670939535,Iona,Quinnipiac,4,4,NA,400842021,2016-02-15
22,1,16:41,2201,2201,Jordan Washington Block.,3,5,-2,1,0.45157203243936533,0.45157203243936533,Iona,Quinnipiac,4,4,NA,400842021,2016-02-15
23,1,16:40,2200,2200,Ibn Muhammad Defensive Rebound.,3,5,-2,18,0.4515490631345577,0.4515490631345577,Iona,Quinnipiac,4,4,NA,400842021,2016-02-15
24,1,16:22,2182,2182,Deyshonee Much made Jumper.,5,5,0,19,0.5,0.5,Iona,Quinnipiac,4,4,NA,400842021,2016-02-15
25,1,16:03,2163,2163,Donovan Smith Turnover.,5,5,0,21,0.5,0.5,Iona,Quinnipiac,4,4,NA,400842021,2016-02-15
26,1,15:42,2142,2142,Aaron Rountree missed Layup.,5,5,0,0,0.5,0.5,Iona,Quinnipiac,4,4,NA,400842021,2016-02-15
27,1,15:42,2142,2142,Donovan Smith Block.,5,5,0,2,0.5,0.5,Iona,Quinnipiac,4,4,NA,400842021,2016-02-15
28,1,15:40,2140,2140,James Ford Jr Defensive Rebound.,5,5,0,4,0.5,0.5,Iona,Quinnipiac,4,4,NA,400842021,2016-02-15
29,1,15:36,2136,2136,Abdulai Bundu made Layup. Assisted by James Ford Jr.,5,7,-2,22,0.450068193702164,0.450068193702164,Iona,Quinnipiac,4,4,NA,400842021,2016-02-15
30,1,15:14,2114,2114,Foul on Daniel Harris.,5,7,-2,0,0.449552141969799,0.449552141969799,Iona,Quinnipiac,4,4,NA,400842021,2016-02-15
31,1,15:14,2114,2114,Official TV Timeout,5,7,-2,0,0.449552141969799,0.449552141969799,Iona,Quinnipiac,4,4,NA,400842021,2016-02-15
32,1,15:14,2114,2114,Deyshonee Much missed Free Throw.,5,7,-2,0,0.449552141969799,0.449552141969799,Iona,Quinnipiac,4,4,NA,400842021,2016-02-15
33,1,15:14,2114,2114,Iona Deadball Team Rebound.,5,7,-2,0,0.449552141969799,0.449552141969799,Iona,Quinnipiac,4,4,NA,400842021,2016-02-15
34,1,15:14,2114,2114,Deyshonee Much made Free Throw.,6,7,-1,21,0.474711547586715,0.474711547586715,Iona,Quinnipiac,4,4,NA,400842021,2016-02-15
35,1,14:53,2093,2093,Daniel Harris missed Three Point Jumper.,6,7,-1,0,0.47446126854642284,0.47446126854642284,Iona,Quinnipiac,4,4,NA,400842021,2016-02-15
36,1,14:53,2093,2093,Ibn Muhammad Defensive Rebound.,6,7,-1,21,0.47446126854642284,0.47446126854642284,Iona,Quinnipiac,4,4,NA,400842021,2016-02-15
37,1,14:32,2072,2072,Isaiah Williams made Three Point Jumper. Assisted by Ibn Muhammad.,9,7,2,15,0.5514455692172431,0.5514455692172431,Iona,Quinnipiac,4,4,NA,400842021,2016-02-15
38,1,14:17,2057,2057,James Ford Jr made Three Point Jumper. Assisted by Samuel Dingba.,9,10,-1,11,0.4740269757363088,0.4740269757363088,Iona,Quinnipiac,4,4,NA,400842021,2016-02-15
39,1,14:06,2046,2046,Isaiah Williams made Three Point Jumper. Assisted by Ibn Muhammad.,12,10,2,20,0.5520723249003605,0.5520723249003605,Iona,Quinnipiac,4,4,NA,400842021,2016-02-15
40,1,13:46,2026,2026,Daniel Harris missed Three Point Jumper.,12,10,2,0,0.5525596446359,0.5525596446359,Iona,Quinnipiac,4,4,NA,400842021,2016-02-15
41,1,13:46,2026,2026,Samuel Dingba Offensive Rebound.,12,10,2,4,0.5525596446359,0.5525596446359,Iona,Quinnipiac,4,4,NA,400842021,2016-02-15
42,1,13:42,2022,2022,Samuel Dingba made Dunk.,12,12,0,11,0.5,0.5,Iona,Quinnipiac,4,4,NA,400842021,2016-02-15
43,1,13:31,2011,2011,Isaiah Williams missed Three Point Jumper.,12,12,0,0,0.5,0.5,Iona,Quinnipiac,4,4,NA,400842021,2016-02-15
44,1,13:31,2011,2011,Donovan Smith Defensive Rebound.,12,12,0,16,0.5,0.5,Iona,Quinnipiac,4,4,NA,400842021,2016-02-15
45,1,13:15,1995,1995,Donovan Smith missed Jumper.,12,12,0,0,0.5,0.5,Iona,Quinnipiac,4,4,NA,400842021,2016-02-15
46,1,13:15,1995,1995,Isaiah Williams Defensive Rebound.,12,12,0,11,0.5,0.5,Iona,Quinnipiac,4,4,NA,400842021,2016-02-15
47,1,13:04,1984,1984,A.J. English Turnover.,12,12,0,21,0.5,0.5,Iona,Quinnipiac,4,4,NA,400842021,2016-02-15
48,1,12:43,1963,1963,Foul on Jordan Washington.,12,12,0,0,0.5,0.5,Iona,Quinnipiac,4,4,NA,400842021,2016-02-15
49,1,12:43,1963,1963,Chaise Daniels made Free Throw.,12,13,-1,0,0.4728565261893283,0.4728565261893283,Iona,Quinnipiac,4,4,NA,400842021,2016-02-15
50,1,12:43,1963,1963,Chaise Daniels missed Free Throw.,12,13,-1,0,0.4728565261893283,0.4728565261893283,Iona,Quinnipiac,4,4,NA,400842021,2016-02-15
51,1,12:43,1963,1963,Isaiah Williams Defensive Rebound.,12,13,-1,18,0.4728565261893283,0.4728565261893283,Iona,Quinnipiac,4,4,NA,400842021,2016-02-15
52,1,12:25,1945,1945,A.J. English missed Layup.,12,13,-1,0,0.4726255353614977,0.4726255353614977,Iona,Quinnipiac,4,4,NA,400842021,2016-02-15
53,1,12:25,1945,1945,Chaise Daniels Block.,12,13,-1,0,0.4726255353614977,0.4726255353614977,Iona,Quinnipiac,4,4,NA,400842021,2016-02-15
54,1,12:25,1945,1945,Iona Offensive Rebound.,12,13,-1,7,0.4726255353614977,0.4726255353614977,Iona,Quinnipiac,4,4,NA,400842021,2016-02-15
55,1,12:18,1938,1938,A.J. English missed Three Point Jumper.,12,13,-1,0,0.4725350508553408,0.4725350508553408,Iona,Quinnipiac,4,4,NA,400842021,2016-02-15
56,1,12:18,1938,1938,Giovanni McLean Defensive Rebound.,12,13,-1,8,0.4725350508553408,0.4725350508553408,Iona,Quinnipiac,4,4,NA,400842021,2016-02-15
57,1,12:10,1930,1930,Giovanni McLean missed Three Point Jumper.,12,13,-1,0,0.47243117980132204,0.47243117980132204,Iona,Quinnipiac,4,4,NA,400842021,2016-02-15
58,1,12:10,1930,1930,Jordan Washington Defensive Rebound.,12,13,-1,10,0.47243117980132204,0.47243117980132204,Iona,Quinnipiac,4,4,NA,400842021,2016-02-15
59,1,12:00,1920,1920,Jordan Washington made Jumper. Assisted by Rickey McGill.,14,13,1,14,0.5276988496941237,0.5276988496941237,Iona,Quinnipiac,4,4,NA,400842021,2016-02-15
60,1,11:46,1906,1906,Chaise Daniels made Jumper. Assisted by Giovanni McLean.,14,15,-1,14,0.4721194061896508,0.4721194061896508,Iona,Quinnipiac,4,4,NA,400842021,2016-02-15
61,1,11:32,1892,1892,Jordan Washington missed Jumper.,14,15,-1,0,0.4719378159551945,0.4719378159551945,Iona,Quinnipiac,4,4,NA,400842021,2016-02-15
62,1,11:32,1892,1892,Isaiah Williams Offensive Rebound.,14,15,-1,7,0.4719378159551945,0.4719378159551945,Iona,Quinnipiac,4,4,NA,400842021,2016-02-15
63,1,11:25,1885,1885,Isaiah Williams made Layup. Assisted by Rickey McGill.,16,15,1,9,0.5281529880485364,0.5281529880485364,Iona,Quinnipiac,4,4,NA,400842021,2016-02-15
64,1,11:16,1876,1876,Foul on A.J. English.,16,15,1,0,0.5282698006654232,0.5282698006654232,Iona,Quinnipiac,4,4,NA,400842021,2016-02-15
65,1,11:16,1876,1876,Official TV Timeout,16,15,1,20,0.5282698006654232,0.5282698006654232,Iona,Quinnipiac,4,4,NA,400842021,2016-02-15
66,1,10:56,1856,1856,Foul on Ryden Hines.,16,15,1,1,0.5285299146784808,0.5285299146784808,Iona,Quinnipiac,4,4,NA,400842021,2016-02-15
67,1,10:55,1855,1855,Andrew Robinson made Layup. Assisted by Giovanni McLean.,16,17,-1,32,0.4714570522650251,0.4714570522650251,Iona,Quinnipiac,4,4,NA,400842021,2016-02-15
68,1,10:23,1823,1823,Deyshonee Much Turnover.,16,17,-1,0,0.4710378948697002,0.4710378948697002,Iona,Quinnipiac,4,4,NA,400842021,2016-02-15
69,1,10:23,1823,1823,Foul on Deyshonee Much.,16,17,-1,28,0.4710378948697002,0.4710378948697002,Iona,Quinnipiac,4,4,NA,400842021,2016-02-15
70,1,9:55,1795,1795,Daniel Harris made Three Point Jumper.,16,20,-4,18,0.38464556779568737,0.38464556779568737,Iona,Quinnipiac,4,4,NA,400842021,2016-02-15
71,1,9:37,1777,1777,Foul on Daniel Harris.,16,20,-4,2,0.383726655384583,0.383726655384583,Iona,Quinnipiac,4,4,NA,400842021,2016-02-15
72,1,9:35,1775,1775,A.J. English Turnover.,16,20,-4,13,0.3836239327482226,0.3836239327482226,Iona,Quinnipiac,4,4,NA,400842021,2016-02-15
73,1,9:22,1762,1762,Foul on Ryden Hines.,16,20,-4,0,0.3829528975834532,0.3829528975834532,Iona,Quinnipiac,4,4,NA,400842021,2016-02-15
74,1,9:22,1762,1762,Ayron Hutton made Free Throw.,16,21,-5,0,0.3551925509794285,0.3551925509794285,Iona,Quinnipiac,4,4,NA,400842021,2016-02-15
75,1,9:22,1762,1762,Ayron Hutton made Free Throw.,16,22,-6,27,0.32837364502203287,0.32837364502203287,Iona,Quinnipiac,4,4,NA,400842021,2016-02-15
76,1,8:55,1735,1735,Aaron Rountree made Jumper. Assisted by A.J. English.,18,22,-4,25,0.3815385484584747,0.3815385484584747,Iona,Quinnipiac,4,4,NA,400842021,2016-02-15
77,1,8:30,1710,1710,Chaise Daniels missed Layup.,18,22,-4,0,0.3802000651497727,0.3802000651497727,Iona,Quinnipiac,4,4,NA,400842021,2016-02-15
78,1,8:30,1710,1710,Aaron Rountree Block.,18,22,-4,2,0.3802000651497727,0.3802000651497727,Iona,Quinnipiac,4,4,NA,400842021,2016-02-15
79,1,8:28,1708,1708,Ayron Hutton Offensive Rebound.,18,22,-4,0,0.3800916474776068,0.3800916474776068,Iona,Quinnipiac,4,4,NA,400842021,2016-02-15
80,1,8:28,1708,1708,Ayron Hutton Turnover.,18,22,-4,14,0.3800916474776068,0.3800916474776068,Iona,Quinnipiac,4,4,NA,400842021,2016-02-15
81,1,8:14,1694,1694,Rickey McGill missed Jumper.,18,22,-4,0,0.3793267351509305,0.3793267351509305,Iona,Quinnipiac,4,4,NA,400842021,2016-02-15
82,1,8:14,1694,1694,Giovanni McLean Defensive Rebound.,18,22,-4,9,0.3793267351509305,0.3793267351509305,Iona,Quinnipiac,4,4,NA,400842021,2016-02-15
83,1,8:05,1685,1685,Ayron Hutton made Three Point Jumper. Assisted by James Ford Jr.,18,25,-7,11,0.2962129889851206,0.2962129889851206,Iona,Quinnipiac,4,4,NA,400842021,2016-02-15
84,1,7:54,1674,1674,Ibn Muhammad missed Three Point Jumper.,18,25,-7,0,0.2952869794007095,0.2952869794007095,Iona,Quinnipiac,4,4,NA,400842021,2016-02-15
85,1,7:54,1674,1674,Ayron Hutton Defensive Rebound.,18,25,-7,17,0.2952869794007095,0.2952869794007095,Iona,Quinnipiac,4,4,NA,400842021,2016-02-15
86,1,7:37,1657,1657,Abdulai Bundu missed Layup.,18,25,-7,0,0.2938854527806277,0.2938854527806277,Iona,Quinnipiac,4,4,NA,400842021,2016-02-15
87,1,7:37,1657,1657,Ibn Muhammad Defensive Rebound.,18,25,-7,6,0.2938854527806277,0.2938854527806277,Iona,Quinnipiac,4,4,NA,400842021,2016-02-15
88,1,7:31,1651,1651,Ibn Muhammad made Layup.,20,25,-5,0,0.34800677234145855,0.34800677234145855,Iona,Quinnipiac,4,4,NA,400842021,2016-02-15
89,1,7:31,1651,1651,Foul on Ayron Hutton.,20,25,-5,0,0.34800677234145855,0.34800677234145855,Iona,Quinnipiac,4,4,NA,400842021,2016-02-15
90,1,7:31,1651,1651,Official TV Timeout,20,25,-5,0,0.34800677234145855,0.34800677234145855,Iona,Quinnipiac,4,4,NA,400842021,2016-02-15
91,1,7:31,1651,1651,Ibn Muhammad made Free Throw.,21,25,-4,18,0.3770121062045914,0.3770121062045914,Iona,Quinnipiac,4,4,NA,400842021,2016-02-15
92,1,7:13,1633,1633,Ayron Hutton missed Three Point Jumper.,21,25,-4,0,0.37607629039528506,0.37607629039528506,Iona,Quinnipiac,4,4,NA,400842021,2016-02-15
93,1,7:13,1633,1633,Isaiah Williams Defensive Rebound.,21,25,-4,13,0.37607629039528506,0.37607629039528506,Iona,Quinnipiac,4,4,NA,400842021,2016-02-15
94,1,7:00,1620,1620,Jordan Washington missed Layup.,21,25,-4,0,0.37540757472987163,0.37540757472987163,Iona,Quinnipiac,4,4,NA,400842021,2016-02-15
95,1,7:00,1620,1620,Jahaad Proctor Offensive Rebound.,21,25,-4,2,0.37540757472987163,0.37540757472987163,Iona,Quinnipiac,4,4,NA,400842021,2016-02-15
96,1,6:58,1618,1618,Jahaad Proctor made Layup.,23,25,-2,11,0.4366517256120925,0.4366517256120925,Iona,Quinnipiac,4,4,NA,400842021,2016-02-15
97,1,6:47,1607,1607,Donovan Smith Turnover.,23,25,-2,1,0.43635642828675875,0.43635642828675875,Iona,Quinnipiac,4,4,NA,400842021,2016-02-15
98,1,6:46,1606,1606,Ibn Muhammad Steal.,23,25,-2,7,0.4363296088181988,0.4363296088181988,Iona,Quinnipiac,4,4,NA,400842021,2016-02-15
99,1,6:39,1599,1599,Ibn Muhammad made Three Point Jumper. Assisted by Isaiah Williams.,26,25,1,17,0.5320603267215861,0.5320603267215861,Iona,Quinnipiac,4,4,NA,400842021,2016-02-15
100,1,6:22,1582,1582,Abdulai Bundu made Jumper. Assisted by Ayron Hutton.,26,27,-1,7,0.4677085111062768,0.4677085111062768,Iona,Quinnipiac,4,4,NA,400842021,2016-02-15
101,1,6:15,1575,1575,Ibn Muhammad made Jumper.,28,27,1,16,0.5323870792824279,0.5323870792824279,Iona,Quinnipiac,4,4,NA,400842021,2016-02-15
102,1,5:59,1559,1559,Ayron Hutton Turnover.,28,27,1,10,0.5326071342057177,0.5326071342057177,Iona,Quinnipiac,4,4,NA,400842021,2016-02-15
103,1,5:49,1549,1549,Jordan Washington missed Layup.,28,27,1,0,0.5327461649580855,0.5327461649580855,Iona,Quinnipiac,4,4,NA,400842021,2016-02-15
104,1,5:49,1549,1549,Isaiah Williams Offensive Rebound.,28,27,1,1,0.5327461649580855,0.5327461649580855,Iona,Quinnipiac,4,4,NA,400842021,2016-02-15
105,1,5:48,1548,1548,Foul on James Ford Jr.,28,27,1,3,0.5327601449252958,0.5327601449252958,Iona,Quinnipiac,4,4,NA,400842021,2016-02-15
106,1,5:45,1545,1545,Isaiah Williams missed Three Point Jumper.,28,27,1,0,0.5328021763907467,0.5328021763907467,Iona,Quinnipiac,4,4,NA,400842021,2016-02-15
107,1,5:45,1545,1545,Abdulai Bundu Defensive Rebound.,28,27,1,20,0.5328021763907467,0.5328021763907467,Iona,Quinnipiac,4,4,NA,400842021,2016-02-15
108,1,5:25,1525,1525,James Ford Jr made Three Point Jumper. Assisted by Chaise Daniels.,28,30,-2,33,0.43411569514217063,0.43411569514217063,Iona,Quinnipiac,4,4,NA,400842021,2016-02-15
109,1,4:52,1492,1492,Jordan Washington made Layup. Assisted by Jahaad Proctor.,30,30,0,15,0.5,0.5,Iona,Quinnipiac,4,4,NA,400842021,2016-02-15
110,1,4:37,1477,1477,Giovanni McLean missed Three Point Jumper.,30,30,0,0,0.5,0.5,Iona,Quinnipiac,4,4,NA,400842021,2016-02-15
111,1,4:37,1477,1477,Jordan Washington Defensive Rebound.,30,30,0,11,0.5,0.5,Iona,Quinnipiac,4,4,NA,400842021,2016-02-15
112,1,4:26,1466,1466,Aaron Rountree missed Layup.,30,30,0,0,0.5,0.5,Iona,Quinnipiac,4,4,NA,400842021,2016-02-15
113,1,4:26,1466,1466,Ayron Hutton Defensive Rebound.,30,30,0,8,0.5,0.5,Iona,Quinnipiac,4,4,NA,400842021,2016-02-15
114,1,4:18,1458,1458,Giovanni McLean missed Layup.,30,30,0,0,0.5,0.5,Iona,Quinnipiac,4,4,NA,400842021,2016-02-15
115,1,4:18,1458,1458,Aaron Rountree Defensive Rebound.,30,30,0,1,0.5,0.5,Iona,Quinnipiac,4,4,NA,400842021,2016-02-15
116,1,4:17,1457,1457,Foul on Abdulai Bundu.,30,30,0,14,0.5,0.5,Iona,Quinnipiac,4,4,NA,400842021,2016-02-15
117,1,4:03,1443,1443,Ibn Muhammad missed Three Point Jumper.,30,30,0,0,0.5,0.5,Iona,Quinnipiac,4,4,NA,400842021,2016-02-15
118,1,4:03,1443,1443,Samuel Dingba Defensive Rebound.,30,30,0,15,0.5,0.5,Iona,Quinnipiac,4,4,NA,400842021,2016-02-15
119,1,3:48,1428,1428,Chaise Daniels missed Jumper.,30,30,0,0,0.5,0.5,Iona,Quinnipiac,4,4,NA,400842021,2016-02-15
120,1,3:48,1428,1428,Aaron Rountree Defensive Rebound.,30,30,0,22,0.5,0.5,Iona,Quinnipiac,4,4,NA,400842021,2016-02-15
121,1,3:26,1406,1406,Official TV Timeout,30,30,0,1,0.5,0.5,Iona,Quinnipiac,4,4,NA,400842021,2016-02-15
122,1,3:25,1405,1405,A.J. English missed Three Point Jumper.,30,30,0,0,0.5,0.5,Iona,Quinnipiac,4,4,NA,400842021,2016-02-15
123,1,3:25,1405,1405,Jordan Washington Offensive Rebound.,30,30,0,3,0.5,0.5,Iona,Quinnipiac,4,4,NA,400842021,2016-02-15
124,1,3:22,1402,1402,Foul on James Ford Jr.,30,30,0,0,0.5,0.5,Iona,Quinnipiac,4,4,NA,400842021,2016-02-15
125,1,3:22,1402,1402,Jordan Washington made Free Throw.,31,30,1,0,0.5350155762619505,0.5350155762619505,Iona,Quinnipiac,4,4,NA,400842021,2016-02-15
126,1,3:22,1402,1402,Jordan Washington made Free Throw.,32,30,2,15,0.5696893706003575,0.5696893706003575,Iona,Quinnipiac,4,4,NA,400842021,2016-02-15
127,1,3:07,1387,1387,Dimitri Floras missed Jumper.,32,30,2,0,0.5701433403888259,0.5701433403888259,Iona,Quinnipiac,4,4,NA,400842021,2016-02-15
128,1,3:07,1387,1387,Jordan Washington Defensive Rebound.,32,30,2,8,0.5701433403888259,0.5701433403888259,Iona,Quinnipiac,4,4,NA,400842021,2016-02-15
129,1,2:59,1379,1379,Jahaad Proctor made Layup. Assisted by Jordan Washington.,34,30,4,19,0.6380321879819769,0.6380321879819769,Iona,Quinnipiac,4,4,NA,400842021,2016-02-15
130,1,2:40,1360,1360,Samuel Dingba missed Jumper.,34,30,4,0,0.6391047812479429,0.6391047812479429,Iona,Quinnipiac,4,4,NA,400842021,2016-02-15
131,1,2:40,1360,1360,Jordan Washington Defensive Rebound.,34,30,4,15,0.6391047812479429,0.6391047812479429,Iona,Quinnipiac,4,4,NA,400842021,2016-02-15
132,1,2:25,1345,1345,Jordan Washington Turnover.,34,30,4,0,0.6399545158274951,0.6399545158274951,Iona,Quinnipiac,4,4,NA,400842021,2016-02-15
133,1,2:25,1345,1345,Foul on Jordan Washington.,34,30,4,11,0.6399545158274951,0.6399545158274951,Iona,Quinnipiac,4,4,NA,400842021,2016-02-15
134,1,2:14,1334,1334,Chaise Daniels made Layup. Assisted by Ayron Hutton.,34,32,2,8,0.5717385953178746,0.5717385953178746,Iona,Quinnipiac,4,4,NA,400842021,2016-02-15
135,1,2:06,1326,1326,Jahaad Proctor missed Three Point Jumper.,34,32,2,0,0.5719841566532281,0.5719841566532281,Iona,Quinnipiac,4,4,NA,400842021,2016-02-15
136,1,2:06,1326,1326,Chaise Daniels Defensive Rebound.,34,32,2,25,0.5719841566532281,0.5719841566532281,Iona,Quinnipiac,4,4,NA,400842021,2016-02-15
137,1,1:41,1301,1301,Andrew Robinson missed Three Point Jumper.,34,32,2,0,0.5727709695768035,0.5727709695768035,Iona,Quinnipiac,4,4,NA,400842021,2016-02-15
138,1,1:41,1301,1301,Ayron Hutton Offensive Rebound.,34,32,2,6,0.5727709695768035,0.5727709695768035,Iona,Quinnipiac,4,4,NA,400842021,2016-02-15
139,1,1:35,1295,1295,Foul on A.J. English.,34,32,2,0,0.5729653468025023,0.5729653468025023,Iona,Quinnipiac,4,4,NA,400842021,2016-02-15
140,1,1:35,1295,1295,Giovanni McLean made Free Throw.,34,33,1,0,0.5366790011320641,0.5366790011320641,Iona,Quinnipiac,4,4,NA,400842021,2016-02-15
141,1,1:35,1295,1295,Giovanni McLean made Free Throw.,34,34,0,20,0.5,0.5,Iona,Quinnipiac,4,4,NA,400842021,2016-02-15
142,1,1:15,1275,1275,Rickey McGill missed Layup.,34,34,0,0,0.5,0.5,Iona,Quinnipiac,4,4,NA,400842021,2016-02-15
143,1,1:15,1275,1275,Chaise Daniels Defensive Rebound.,34,34,0,13,0.5,0.5,Iona,Quinnipiac,4,4,NA,400842021,2016-02-15
144,1,1:02,1262,1262,Giovanni McLean missed Three Point Jumper.,34,34,0,0,0.5,0.5,Iona,Quinnipiac,4,4,NA,400842021,2016-02-15
145,1,1:02,1262,1262,Chaise Daniels Offensive Rebound.,34,34,0,4,0.5,0.5,Iona,Quinnipiac,4,4,NA,400842021,2016-02-15
146,1,0:58,1258,1258,Quinnipiac  Timeout,34,34,0,14,0.5,0.5,Iona,Quinnipiac,3,4,NA,400842021,2016-02-15
147,1,0:44,1244,1244,Ayron Hutton Turnover.,34,34,0,2,0.5,0.5,Iona,Quinnipiac,3,4,NA,400842021,2016-02-15
148,1,0:42,1242,1242,Jahaad Proctor Steal.,34,34,0,0,0.5,0.5,Iona,Quinnipiac,3,4,NA,400842021,2016-02-15
149,1,0:42,1242,1242,Foul on Giovanni McLean.,34,34,0,0,0.5,0.5,Iona,Quinnipiac,3,4,NA,400842021,2016-02-15
150,1,0:42,1242,1242,Jahaad Proctor made Free Throw.,35,34,1,0,0.5376205092909178,0.5376205092909178,Iona,Quinnipiac,3,4,NA,400842021,2016-02-15
151,1,0:42,1242,1242,Jahaad Proctor missed Free Throw.,35,34,1,0,0.5376205092909178,0.5376205092909178,Iona,Quinnipiac,3,4,NA,400842021,2016-02-15
152,1,0:42,1242,1242,Chaise Daniels Defensive Rebound.,35,34,1,8,0.5376205092909178,0.5376205092909178,Iona,Quinnipiac,3,4,NA,400842021,2016-02-15
153,1,0:34,1234,1234,Ayron Hutton missed Three Point Jumper.,35,34,1,0,0.5377760668385998,0.5377760668385998,Iona,Quinnipiac,3,4,NA,400842021,2016-02-15
154,1,0:34,1234,1234,Jahaad Proctor Defensive Rebound.,35,34,1,13,0.5377760668385998,0.5377760668385998,Iona,Quinnipiac,3,4,NA,400842021,2016-02-15
155,1,0:21,1221,1221,Ibn Muhammad made Layup.,37,34,3,20,0.6123829135101257,0.6123829135101257,Iona,Quinnipiac,3,4,NA,400842021,2016-02-15
156,1,0:01,1201,1201,Andrew Robinson missed Three Point Jumper.,37,34,3,0,0.6135920191128087,0.6135920191128087,Iona,Quinnipiac,3,4,NA,400842021,2016-02-15
157,1,0:01,1201,1201,Jahaad Proctor Defensive Rebound.,37,34,3,1,0.6135920191128087,0.6135920191128087,Iona,Quinnipiac,3,4,NA,400842021,2016-02-15
158,1,0:00,1200,1200,End of 1st half,37,34,3,0,0.6136521367497382,0.6136521367497382,Iona,Quinnipiac,3,4,NA,400842021,2016-02-15
159,2,20:00,1200,1200,PLAY,37,34,3,19,0.6136521367497382,0.6136521367497382,Iona,Quinnipiac,4,4,NA,400842021,2016-02-15
160,2,19:41,1181,1181,Abdulai Bundu made Layup. Assisted by Giovanni McLean.,37,36,1,10,0.5388731744235915,0.5388731744235915,Iona,Quinnipiac,4,4,NA,400842021,2016-02-15
161,2,19:31,1171,1171,Isaiah Williams missed Three Point Jumper.,37,36,1,0,0.5390749521306997,0.5390749521306997,Iona,Quinnipiac,4,4,NA,400842021,2016-02-15
162,2,19:31,1171,1171,Giovanni McLean Defensive Rebound.,37,36,1,9,0.5390749521306997,0.5390749521306997,Iona,Quinnipiac,4,4,NA,400842021,2016-02-15
163,2,19:22,1162,1162,Daniel Harris Turnover.,37,36,1,1,0.5392546368731765,0.5392546368731765,Iona,Quinnipiac,4,4,NA,400842021,2016-02-15
164,2,19:21,1161,1161,A.J. English Steal.,37,36,1,5,0.5392745124798755,0.5392745124798755,Iona,Quinnipiac,4,4,NA,400842021,2016-02-15
165,2,19:16,1156,1156,Isaiah Williams made Layup. Assisted by Deyshonee Much.,39,36,3,11,0.6162033996069546,0.6162033996069546,Iona,Quinnipiac,4,4,NA,400842021,2016-02-15
166,2,19:05,1145,1145,James Ford Jr Turnover.,39,36,3,12,0.6168235353914926,0.6168235353914926,Iona,Quinnipiac,4,4,NA,400842021,2016-02-15
167,2,18:53,1133,1133,A.J. English Turnover.,39,36,3,2,0.6174979713006514,0.6174979713006514,Iona,Quinnipiac,4,4,NA,400842021,2016-02-15
168,2,18:51,1131,1131,Giovanni McLean Steal.,39,36,3,2,0.6176103925605467,0.6176103925605467,Iona,Quinnipiac,4,4,NA,400842021,2016-02-15
169,2,18:49,1129,1129,Giovanni McLean made Layup.,39,38,1,0,0.5399061128761613,0.5399061128761613,Iona,Quinnipiac,4,4,NA,400842021,2016-02-15
170,2,18:49,1129,1129,Foul on Ibn Muhammad.,39,38,1,0,0.5399061128761613,0.5399061128761613,Iona,Quinnipiac,4,4,NA,400842021,2016-02-15
171,2,18:49,1129,1129,Giovanni McLean made Free Throw.,39,39,0,17,0.5,0.5,Iona,Quinnipiac,4,4,NA,400842021,2016-02-15
172,2,18:32,1112,1112,A.J. English Turnover.,39,39,0,24,0.5,0.5,Iona,Quinnipiac,4,4,NA,400842021,2016-02-15
173,2,18:08,1088,1088,Foul on Jordan Washington.,39,39,0,0,0.5,0.5,Iona,Quinnipiac,4,4,NA,400842021,2016-02-15
174,2,18:08,1088,1088,Chaise Daniels missed Free Throw.,39,39,0,0,0.5,0.5,Iona,Quinnipiac,4,4,NA,400842021,2016-02-15
175,2,18:08,1088,1088,Quinnipiac Deadball Team Rebound.,39,39,0,0,0.5,0.5,Iona,Quinnipiac,4,4,NA,400842021,2016-02-15
176,2,18:08,1088,1088,Chaise Daniels missed Free Throw.,39,39,0,0,0.5,0.5,Iona,Quinnipiac,4,4,NA,400842021,2016-02-15
177,2,18:08,1088,1088,A.J. English Defensive Rebound.,39,39,0,23,0.5,0.5,Iona,Quinnipiac,4,4,NA,400842021,2016-02-15
178,2,17:45,1065,1065,Ibn Muhammad missed Jumper.,39,39,0,0,0.5,0.5,Iona,Quinnipiac,4,4,NA,400842021,2016-02-15
179,2,17:45,1065,1065,Iona Offensive Rebound.,39,39,0,9,0.5,0.5,Iona,Quinnipiac,4,4,NA,400842021,2016-02-15
180,2,17:36,1056,1056,Ibn Muhammad missed Three Point Jumper.,39,39,0,0,0.5,0.5,Iona,Quinnipiac,4,4,NA,400842021,2016-02-15
181,2,17:36,1056,1056,James Ford Jr Defensive Rebound.,39,39,0,14,0.5,0.5,Iona,Quinnipiac,4,4,NA,400842021,2016-02-15
182,2,17:22,1042,1042,Abdulai Bundu made Layup. Assisted by Giovanni McLean.,39,41,-2,11,0.4171361413531615,0.4171361413531615,Iona,Quinnipiac,4,4,NA,400842021,2016-02-15
183,2,17:11,1031,1031,Isaiah Williams missed Three Point Jumper.,39,41,-2,0,0.4166360861414005,0.4166360861414005,Iona,Quinnipiac,4,4,NA,400842021,2016-02-15
184,2,17:11,1031,1031,James Ford Jr Defensive Rebound.,39,41,-2,8,0.4166360861414005,0.4166360861414005,Iona,Quinnipiac,4,4,NA,400842021,2016-02-15
