play_id,half,time_remaining_half,secs_remaining,secs_remaining_absolute,description,home_score,away_score,score_diff,play_length,win_prob,naive_win_prob,home,away,home_time_out_remaining,away_time_out_remaining,home_favored_by,game_id,date
1,1,20:00,2400,2400,PLAY,0,0,0,20,0.5,0.5,Wichita State,Northern Iowa,4,4,NA,290452724,2009-02-14
2,1,19:40,2380,2380,Ramon Clemente made Two Point Jumper.  Assisted by Clevin Hannah.,2,0,2,18,0.5444477880633797,0.5444477880633797,Wichita State,Northern Iowa,4,4,NA,290452724,2009-02-14
3,1,19:22,2362,2362,Jordan Eglseder made Two Point Layup.  Assisted by Kwadzo Ahelegbe.,2,2,0,20,0.5,0.5,Wichita State,Northern Iowa,4,4,NA,290452724,2009-02-14
4,1,19:02,2342,2342,Toure' Murry made Two Point Layup.  Assisted by Ramon Clemente.,4,2,2,17,0.5452642352579568,0.5452642352579568,Wichita State,Northern Iowa,4,4,NA,290452724,2009-02-14
5,1,18:45,2325,2325,Jordan Eglseder made Two Point Layup.  Assisted by Adam Koch.,4,4,0,18,0.5,0.5,Wichita State,Northern Iowa,4,4,NA,290452724,2009-02-14
6,1,18:27,2307,2307,Ramon Clemente missed Two Point Jumper.,4,4,0,0,0.5,0.5,Wichita State,Northern Iowa,4,4,NA,290452724,2009-02-14
7,1,18:27,2307,2307,Jordan Eglseder Defensive Rebound.,4,4,0,9,0.5,0.5,Wichita State,Northern Iowa,4,4,NA,290452724,2009-02-14
8,1,18:18,2298,2298,Johnny Moran missed Two Point Jumper.,4,4,0,0,0.5,0.5,Wichita State,Northern Iowa,4,4,NA,290452724,2009-02-14
9,1,18:18,2298,2298,Ramon Clemente Defensive Rebound.,4,4,0,18,0.5,0.5,Wichita State,Northern Iowa,4,4,NA,290452724,2009-02-14
10,1,18:00,2280,2280,Clevin Hannah made Three Point Jumper.  Assisted by Toure' Murry.,7,4,3,37,0.5696975480563956,0.5696975480563956,Wichita State,Northern Iowa,4,4,NA,290452724,2009-02-14
11,1,17:23,2243,2243,Jordan Eglseder made Three Point Jumper.  Assisted by Adam Koch.,7,7,0,30,0.5,0.5,Wichita State,Northern Iowa,4,4,NA,290452724,2009-02-14
12,1,16:53,2213,2213,A.J. Hawkins missed Two Point Jumper.,7,7,0,0,0.5,0.5,Wichita State,Northern Iowa,4,4,NA,290452724,2009-02-14
13,1,16:53,2213,2213,Jordan Eglseder Defensive Rebound.,7,7,0,1,0.5,0.5,Wichita State,Northern Iowa,4,4,NA,290452724,2009-02-14
14,1,16:52,2212,2212,Foul on Ramon Clemente,7,7,0,13,0.5,0.5,Wichita State,Northern Iowa,4,4,NA,290452724,2009-02-14
15,1,16:39,2199,2199,Kwadzo Ahelegbe missed Two Point Jumper.,7,7,0,0,0.5,0.5,Wichita State,Northern Iowa,4,4,NA,290452724,2009-02-14
16,1,16:39,2199,2199,Ramon Clemente Defensive Rebound.,7,7,0,11,0.5,0.5,Wichita State,Northern Iowa,4,4,NA,290452724,2009-02-14
17,1,16:28,2188,2188,Ramon Clemente made Two Point Jumper.  Assisted by A.J. Hawkins.,9,7,2,23,0.548726942141186,0.548726942141186,Wichita State,Northern Iowa,4,4,NA,290452724,2009-02-14
18,1,16:05,2165,2165,Adam Koch missed Three Point Jumper.,9,7,2,0,0.549257676240743,0.549257676240743,Wichita State,Northern Iowa,4,4,NA,290452724,2009-02-14
19,1,16:05,2165,2165,Toure' Murry Defensive Rebound.,9,7,2,29,0.549257676240743,0.549257676240743,Wichita State,Northern Iowa,4,4,NA,290452724,2009-02-14
20,1,15:36,2136,2136,J.T. Durley made Two Point Jumper.,11,7,4,18,0.5988775325607937,0.5988775325607937,Wichita State,Northern Iowa,4,4,NA,290452724,2009-02-14
21,1,15:18,2118,2118,Foul on Toure' Murry,11,7,4,0,0.5996963085804932,0.5996963085804932,Wichita State,Northern Iowa,4,4,NA,290452724,2009-02-14
22,1,15:18,2118,2118,Kwadzo Ahelegbe made Free Throw.,11,8,3,0,0.5752123586433557,0.5752123586433557,Wichita State,Northern Iowa,4,4,NA,290452724,2009-02-14
23,1,15:18,2118,2118,Kwadzo Ahelegbe missed Free Throw.,11,8,3,0,0.5752123586433557,0.5752123586433557,Wichita State,Northern Iowa,4,4,NA,290452724,2009-02-14
24,1,15:18,2118,2118,J.T. Durley Defensive Rebound.,11,8,3,13,0.5752123586433557,0.5752123586433557,Wichita State,Northern Iowa,4,4,NA,290452724,2009-02-14
25,1,15:05,2105,2105,Clevin Hannah made Three Point Jumper.,14,8,6,25,0.6479444073033158,0.6479444073033158,Wichita State,Northern Iowa,4,4,NA,290452724,2009-02-14
26,1,14:40,2080,2080,Jordan Eglseder Turnover.,14,8,6,1,0.6495855880612839,0.6495855880612839,Wichita State,Northern Iowa,4,4,NA,290452724,2009-02-14
27,1,14:39,2079,2079,A.J. Hawkins Steal.,14,8,6,0,0.649651527967279,0.649651527967279,Wichita State,Northern Iowa,4,4,NA,290452724,2009-02-14
28,1,14:39,2079,2079,Foul on Jordan Eglseder,14,8,6,20,0.649651527967279,0.649651527967279,Wichita State,Northern Iowa,4,4,NA,290452724,2009-02-14
29,1,14:19,2059,2059,Clevin Hannah Turnover.,14,8,6,1,0.6509753248433197,0.6509753248433197,Wichita State,Northern Iowa,4,4,NA,290452724,2009-02-14
30,1,14:18,2058,2058,Lucas O'Rear Steal.,14,8,6,24,0.6510417710667683,0.6510417710667683,Wichita State,Northern Iowa,4,4,NA,290452724,2009-02-14
31,1,13:54,2034,2034,Adam Koch made Two Point Layup.,14,10,4,0,0.6035921074657498,0.6035921074657498,Wichita State,Northern Iowa,4,4,NA,290452724,2009-02-14
32,1,13:54,2034,2034,Foul on Ramon Clemente,14,10,4,0,0.6035921074657498,0.6035921074657498,Wichita State,Northern Iowa,4,4,NA,290452724,2009-02-14
33,1,13:54,2034,2034,Adam Koch made Free Throw.,14,11,3,31,0.5781884500995216,0.5781884500995216,Wichita State,Northern Iowa,4,4,NA,290452724,2009-02-14
34,1,13:23,2003,2003,Toure' Murry made Two Point Layup.  Assisted by Clevin Hannah.,16,11,5,30,0.6302462094067853,0.6302462094067853,Wichita State,Northern Iowa,4,4,NA,290452724,2009-02-14
35,1,12:53,1973,1973,Travis Brown missed Three Point Jumper.,16,11,5,0,0.6320101397408582,0.6320101397408582,Wichita State,Northern Iowa,4,4,NA,290452724,2009-02-14
36,1,12:53,1973,1973,Aaron Ellis Defensive Rebound.,16,11,5,9,0.6320101397408582,0.6320101397408582,Wichita State,Northern Iowa,4,4,NA,290452724,2009-02-14
37,1,12:44,1964,1964,Clevin Hannah made Three Point Jumper.  Assisted by Toure' Murry.,19,11,8,21,0.7045451354181178,0.7045451354181178,Wichita State,Northern Iowa,4,4,NA,290452724,2009-02-14
38,1,12:23,1943,1943,Travis Brown missed Two Point Jumper.,19,11,8,0,0.7063429387278931,0.7063429387278931,Wichita State,Northern Iowa,4,4,NA,290452724,2009-02-14
39,1,12:23,1943,1943,Clevin Hannah Defensive Rebound.,19,11,8,5,0.7063429387278931,0.7063429387278931,Wichita State,Northern Iowa,4,4,NA,290452724,2009-02-14
40,1,12:18,1938,1938,Clevin Hannah Turnover.,19,11,8,13,0.7067732973550798,0.7067732973550798,Wichita State,Northern Iowa,4,4,NA,290452724,2009-02-14
41,1,12:05,1925,1925,Kerwin Dunham missed Two Point Jumper.,19,11,8,0,0.7078956575302539,0.7078956575302539,Wichita State,Northern Iowa,4,4,NA,290452724,2009-02-14
42,1,12:05,1925,1925,Aaron Ellis Defensive Rebound.,19,11,8,9,0.7078956575302539,0.7078956575302539,Wichita State,Northern Iowa,4,4,NA,290452724,2009-02-14
43,1,11:56,1916,1916,Graham Hatch made Three Point Jumper.  Assisted by Clevin Hannah.,22,11,11,27,0.7724665595411268,0.7724665595411268,Wichita State,Northern Iowa,4,4,NA,290452724,2009-02-14
44,1,11:29,1889,1889,Ali Farokhmanesh Turnover.,22,11,11,26,0.7751725756211432,0.7751725756211432,Wichita State,Northern Iowa,4,4,NA,290452724,2009-02-14
45,1,11:03,1863,1863,Foul on Adam Koch,22,11,11,15,0.7777595759117788,0.7777595759117788,Wichita State,Northern Iowa,4,4,NA,290452724,2009-02-14
46,1,10:48,1848,1848,Garrett Stutz missed Two Point Jumper.,22,11,11,0,0.7792477618868209,0.7792477618868209,Wichita State,Northern Iowa,4,4,NA,290452724,2009-02-14
47,1,10:48,1848,1848,Ali Farokhmanesh Defensive Rebound.,22,11,11,8,0.7792477618868209,0.7792477618868209,Wichita State,Northern Iowa,4,4,NA,290452724,2009-02-14
48,1,10:40,1840,1840,Kwadzo Ahelegbe missed Two Point Layup.,22,11,11,0,0.7800410270949509,0.7800410270949509,Wichita State,Northern Iowa,4,4,NA,290452724,2009-02-14
49,1,10:40,1840,1840,David Kyles Defensive Rebound.,22,11,11,26,0.7800410270949509,0.7800410270949509,Wichita State,Northern Iowa,4,4,NA,290452724,2009-02-14
50,1,10:14,1814,1814,Garrett Stutz made Two Point Layup.,24,11,13,28,0.8196409589600314,0.8196409589600314,Wichita State,Northern Iowa,4,4,NA,290452724,2009-02-14
51,1,9:46,1786,1786,Foul on David Kyles,24,11,13,2,0.8225018861569429,0.8225018861569429,Wichita State,Northern Iowa,4,4,NA,290452724,2009-02-14
52,1,9:44,1784,1784,Ali Farokhmanesh missed Three Point Jumper.,24,11,13,0,0.8227066733205528,0.8227066733205528,Wichita State,Northern Iowa,4,4,NA,290452724,2009-02-14
53,1,9:44,1784,1784,Kwadzo Ahelegbe Offensive Rebound.,24,11,13,9,0.8227066733205528,0.8227066733205528,Wichita State,Northern Iowa,4,4,NA,290452724,2009-02-14
54,1,9:35,1775,1775,Foul on Graham Hatch,24,11,13,6,0.8236292639176829,0.8236292639176829,Wichita State,Northern Iowa,4,4,NA,290452724,2009-02-14
55,1,9:29,1769,1769,Foul on Garrett Stutz,24,11,13,0,0.8242454051214385,0.8242454051214385,Wichita State,Northern Iowa,4,4,NA,290452724,2009-02-14
56,1,9:29,1769,1769,Jordan Eglseder made Free Throw.,24,12,12,0,0.8063560570912829,0.8063560570912829,Wichita State,Northern Iowa,4,4,NA,290452724,2009-02-14
57,1,9:29,1769,1769,Jordan Eglseder missed Free Throw.,24,12,12,0,0.8063560570912829,0.8063560570912829,Wichita State,Northern Iowa,4,4,NA,290452724,2009-02-14
58,1,9:29,1769,1769,Aaron Ellis Defensive Rebound.,24,12,12,37,0.8063560570912829,0.8063560570912829,Wichita State,Northern Iowa,4,4,NA,290452724,2009-02-14
59,1,8:52,1732,1732,Reggie Chamberlain made Two Point Jumper.,26,12,14,14,0.8446103834200264,0.8446103834200264,Wichita State,Northern Iowa,4,4,NA,290452724,2009-02-14
60,1,8:38,1718,1718,Kwadzo Ahelegbe missed Two Point Layup.,26,12,14,0,0.8460613392780679,0.8460613392780679,Wichita State,Northern Iowa,4,4,NA,290452724,2009-02-14
61,1,8:38,1718,1718,Graham Hatch Defensive Rebound.,26,12,14,11,0.8460613392780679,0.8460613392780679,Wichita State,Northern Iowa,4,4,NA,290452724,2009-02-14
62,1,8:27,1707,1707,Reggie Chamberlain missed Three Point Jumper.,26,12,14,0,0.847207361671634,0.847207361671634,Wichita State,Northern Iowa,4,4,NA,290452724,2009-02-14
63,1,8:27,1707,1707,Kwadzo Ahelegbe Defensive Rebound.,26,12,14,10,0.847207361671634,0.847207361671634,Wichita State,Northern Iowa,4,4,NA,290452724,2009-02-14
64,1,8:17,1697,1697,Johnny Moran missed Three Point Jumper.,26,12,14,0,0.84825427187474,0.84825427187474,Wichita State,Northern Iowa,4,4,NA,290452724,2009-02-14
65,1,8:17,1697,1697,Kwadzo Ahelegbe Offensive Rebound.,26,12,14,0,0.84825427187474,0.84825427187474,Wichita State,Northern Iowa,4,4,NA,290452724,2009-02-14
66,1,8:17,1697,1697,Foul on Reggie Chamberlain,26,12,14,0,0.84825427187474,0.84825427187474,Wichita State,Northern Iowa,4,4,NA,290452724,2009-02-14
67,1,8:17,1697,1697,Kwadzo Ahelegbe made Free Throw.,26,13,13,0,0.8317453103249605,0.8317453103249605,Wichita State,Northern Iowa,4,4,NA,290452724,2009-02-14
68,1,8:17,1697,1697,Kwadzo Ahelegbe missed Free Throw.,26,13,13,0,0.8317453103249605,0.8317453103249605,Wichita State,Northern Iowa,4,4,NA,290452724,2009-02-14
69,1,8:17,1697,1697,Graham Hatch Defensive Rebound.,26,13,13,15,0.8317453103249605,0.8317453103249605,Wichita State,Northern Iowa,4,4,NA,290452724,2009-02-14
70,1,8:02,1682,1682,Reggie Chamberlain made Three Point Jumper.  Assisted by Toure' Murry.,29,13,16,16,0.8787704834681707,0.8787704834681707,Wichita State,Northern Iowa,4,4,NA,290452724,2009-02-14
71,1,7:46,1666,1666,Kwadzo Ahelegbe missed Two Point Layup.,29,13,16,0,0.8803245068063713,0.8803245068063713,Wichita State,Northern Iowa,4,4,NA,290452724,2009-02-14
72,1,7:46,1666,1666,Garrett Stutz Block.,29,13,16,2,0.8803245068063713,0.8803245068063713,Wichita State,Northern Iowa,4,4,NA,290452724,2009-02-14
73,1,7:44,1664,1664,Toure' Murry Defensive Rebound.,29,13,16,4,0.8805152874232538,0.8805152874232538,Wichita State,Northern Iowa,4,4,NA,290452724,2009-02-14
74,1,7:40,1660,1660,Toure' Murry missed Three Point Jumper.,29,13,16,0,0.8808947222324863,0.8808947222324863,Wichita State,Northern Iowa,4,4,NA,290452724,2009-02-14
75,1,7:40,1660,1660,Kwadzo Ahelegbe Defensive Rebound.,29,13,16,7,0.8808947222324863,0.8808947222324863,Wichita State,Northern Iowa,4,4,NA,290452724,2009-02-14
76,1,7:33,1653,1653,Kwadzo Ahelegbe Turnover.,29,13,16,36,0.8815522613450258,0.8815522613450258,Wichita State,Northern Iowa,4,4,NA,290452724,2009-02-14
77,1,6:57,1617,1617,Toure' Murry missed Two Point Jumper.,29,13,16,0,0.8848284607483451,0.8848284607483451,Wichita State,Northern Iowa,4,4,NA,290452724,2009-02-14
78,1,6:57,1617,1617,Johnny Moran Defensive Rebound.,29,13,16,13,0.8848284607483451,0.8848284607483451,Wichita State,Northern Iowa,4,4,NA,290452724,2009-02-14
79,1,6:44,1604,1604,Johnny Moran missed Three Point Jumper.,29,13,16,0,0.8859797876658402,0.8859797876658402,Wichita State,Northern Iowa,4,4,NA,290452724,2009-02-14
80,1,6:44,1604,1604,Reggie Chamberlain Defensive Rebound.,29,13,16,17,0.8859797876658402,0.8859797876658402,Wichita State,Northern Iowa,4,4,NA,290452724,2009-02-14
81,1,6:27,1587,1587,Toure' Murry Turnover.,29,13,16,17,0.8874704267847097,0.8874704267847097,Wichita State,Northern Iowa,4,4,NA,290452724,2009-02-14
82,1,6:10,1570,1570,Lucas O'Rear missed Two Point Jumper.,29,13,16,0,0.88895213130791,0.88895213130791,Wichita State,Northern Iowa,4,4,NA,290452724,2009-02-14
83,1,6:10,1570,1570,Aaron Ellis Defensive Rebound.,29,13,16,15,0.88895213130791,0.88895213130791,Wichita State,Northern Iowa,4,4,NA,290452724,2009-02-14
84,1,5:55,1555,1555,Garrett Stutz Turnover.,29,13,16,1,0.8902587359542529,0.8902587359542529,Wichita State,Northern Iowa,4,4,NA,290452724,2009-02-14
85,1,5:54,1554,1554,Adam Koch Steal.,29,13,16,16,0.8903459606771263,0.8903459606771263,Wichita State,Northern Iowa,4,4,NA,290452724,2009-02-14
86,1,5:38,1538,1538,Adam Koch made Two Point Layup.,29,15,14,0,0.8635521708692605,0.8635521708692605,Wichita State,Northern Iowa,4,4,NA,290452724,2009-02-14
87,1,5:38,1538,1538,Foul on Mantas Griskenas,29,15,14,0,0.8635521708692605,0.8635521708692605,Wichita State,Northern Iowa,4,4,NA,290452724,2009-02-14
88,1,5:38,1538,1538,Adam Koch made Free Throw.,29,16,13,13,0.8472661831100097,0.8472661831100097,Wichita State,Northern Iowa,4,4,NA,290452724,2009-02-14
89,1,5:25,1525,1525,Foul on Adam Koch,29,16,13,7,0.8485162292418197,0.8485162292418197,Wichita State,Northern Iowa,4,4,NA,290452724,2009-02-14
90,1,5:18,1518,1518,Garrett Stutz made Three Point Jumper.  Assisted by Mantas Griskenas.,32,16,16,22,0.8935137622845801,0.8935137622845801,Wichita State,Northern Iowa,4,4,NA,290452724,2009-02-14
91,1,4:56,1496,1496,Jordan Eglseder missed Two Point Jumper.,32,16,16,0,0.8954945107675358,0.8954945107675358,Wichita State,Northern Iowa,4,4,NA,290452724,2009-02-14
92,1,4:56,1496,1496,A.J. Hawkins Defensive Rebound.,32,16,16,11,0.8954945107675358,0.8954945107675358,Wichita State,Northern Iowa,4,4,NA,290452724,2009-02-14
93,1,4:45,1485,1485,Foul on Ali Farokhmanesh,32,16,16,0,0.8965033737155196,0.8965033737155196,Wichita State,Northern Iowa,4,4,NA,290452724,2009-02-14
94,1,4:45,1485,1485,Toure' Murry made Free Throw.,33,16,17,0,0.9083704307155256,0.9083704307155256,Wichita State,Northern Iowa,4,4,NA,290452724,2009-02-14
95,1,4:45,1485,1485,Toure' Murry made Free Throw.,34,16,18,0,0.9189997359434825,0.9189997359434825,Wichita State,Northern Iowa,4,4,NA,290452724,2009-02-14
96,1,4:45,1485,1485,Toure' Murry made Free Throw.,35,16,19,10,0.928493074075897,0.928493074075897,Wichita State,Northern Iowa,4,4,NA,290452724,2009-02-14
97,1,4:35,1475,1475,Travis Brown made Three Point Jumper.  Assisted by Kwadzo Ahelegbe.,35,19,16,24,0.8974331239740736,0.8974331239740736,Wichita State,Northern Iowa,4,4,NA,290452724,2009-02-14
98,1,4:11,1451,1451,Toure' Murry missed Three Point Jumper.,35,19,16,0,0.8997206685718516,0.8997206685718516,Wichita State,Northern Iowa,4,4,NA,290452724,2009-02-14
99,1,4:11,1451,1451,Travis Brown Defensive Rebound.,35,19,16,13,0.8997206685718516,0.8997206685718516,Wichita State,Northern Iowa,4,4,NA,290452724,2009-02-14
100,1,3:58,1438,1438,Lucas O'Rear made Two Point Layup.  Assisted by Johnny Moran.,35,21,14,38,0.8734685823500047,0.8734685823500047,Wichita State,Northern Iowa,4,4,NA,290452724,2009-02-14
101,1,3:20,1400,1400,Clevin Hannah missed Two Point Jumper.,35,21,14,0,0.8771620191052212,0.8771620191052212,Wichita State,Northern Iowa,4,4,NA,290452724,2009-02-14
102,1,3:20,1400,1400,Travis Brown Block.,35,21,14,0,0.8771620191052212,0.8771620191052212,Wichita State,Northern Iowa,4,4,NA,290452724,2009-02-14
103,1,3:20,1400,1400,Northern Iowa Defensive Rebound.,35,21,14,16,0.8771620191052212,0.8771620191052212,Wichita State,Northern Iowa,4,4,NA,290452724,2009-02-14
104,1,3:04,1384,1384,Kwadzo Ahelegbe missed Two Point Jumper.,35,21,14,0,0.8786416274332238,0.8786416274332238,Wichita State,Northern Iowa,4,4,NA,290452724,2009-02-14
105,1,3:04,1384,1384,Johnny Moran Offensive Rebound.,35,21,14,5,0.8786416274332238,0.8786416274332238,Wichita State,Northern Iowa,4,4,NA,290452724,2009-02-14
106,1,2:59,1379,1379,Johnny Moran made Two Point Jumper.,35,23,12,22,0.8456000693293808,0.8456000693293808,Wichita State,Northern Iowa,4,4,NA,290452724,2009-02-14
107,1,2:37,1357,1357,Foul on Lucas O'Rear,35,23,12,2,0.8476964605319726,0.8476964605319726,Wichita State,Northern Iowa,4,4,NA,290452724,2009-02-14
108,1,2:35,1355,1355,J.T. Durley made Two Point Layup.,37,23,14,29,0.8812657675885441,0.8812657675885441,Wichita State,Northern Iowa,4,4,NA,290452724,2009-02-14
109,1,2:06,1326,1326,Kwadzo Ahelegbe missed Two Point Layup.,37,23,14,0,0.8838759353177394,0.8838759353177394,Wichita State,Northern Iowa,4,4,NA,290452724,2009-02-14
110,1,2:06,1326,1326,Wichita State Defensive Rebound.,37,23,14,12,0.8838759353177394,0.8838759353177394,Wichita State,Northern Iowa,4,4,NA,290452724,2009-02-14
111,1,1:54,1314,1314,Foul on Travis Brown,37,23,14,16,0.8849676784173826,0.8849676784173826,Wichita State,Northern Iowa,4,4,NA,290452724,2009-02-14
112,1,1:38,1298,1298,J.T. Durley made Two Point Jumper.,39,23,16,24,0.9128143594557923,0.9128143594557923,Wichita State,Northern Iowa,4,4,NA,290452724,2009-02-14
113,1,1:14,1274,1274,Travis Brown missed Two Point Layup.,39,23,16,0,0.9148725948703909,0.9148725948703909,Wichita State,Northern Iowa,4,4,NA,290452724,2009-02-14
114,1,1:14,1274,1274,Aaron Ellis Defensive Rebound.,39,23,16,6,0.9148725948703909,0.9148725948703909,Wichita State,Northern Iowa,4,4,NA,290452724,2009-02-14
115,1,1:08,1268,1268,Foul on Travis Brown,39,23,16,13,0.9153999384719842,0.9153999384719842,Wichita State,Northern Iowa,4,4,NA,290452724,2009-02-14
116,1,0:55,1255,1255,Aaron Ellis missed Free Throw.,39,23,16,0,0.9165633359429892,0.9165633359429892,Wichita State,Northern Iowa,4,4,NA,290452724,2009-02-14
117,1,0:55,1255,1255,Travis Brown Defensive Rebound.,39,23,16,0,0.9165633359429892,0.9165633359429892,Wichita State,Northern Iowa,4,4,NA,290452724,2009-02-14
118,1,0:55,1255,1255,Johnny Moran missed Two Point Layup.,39,23,16,0,0.9165633359429892,0.9165633359429892,Wichita State,Northern Iowa,4,4,NA,290452724,2009-02-14
119,1,0:55,1255,1255,A.J. Hawkins Defensive Rebound.,39,23,16,2,0.9165633359429892,0.9165633359429892,Wichita State,Northern Iowa,4,4,NA,290452724,2009-02-14
120,1,0:53,1253,1253,Graham Hatch missed Two Point Jumper.,39,23,16,0,0.9167450312228775,0.9167450312228775,Wichita State,Northern Iowa,4,4,NA,290452724,2009-02-14
121,1,0:53,1253,1253,Travis Brown Defensive Rebound.,39,23,16,20,0.9167450312228775,0.9167450312228775,Wichita State,Northern Iowa,4,4,NA,290452724,2009-02-14
122,1,0:33,1233,1233,Foul on J.T. Durley,39,23,16,0,0.918605922257799,0.918605922257799,Wichita State,Northern Iowa,4,4,NA,290452724,2009-02-14
123,1,0:33,1233,1233,Johnny Moran made Free Throw.,39,24,15,0,0.9065383831662678,0.9065383831662678,Wichita State,Northern Iowa,4,4,NA,290452724,2009-02-14
124,1,0:33,1233,1233,Johnny Moran made Free Throw.,39,25,14,27,0.8928903171715394,0.8928903171715394,Wichita State,Northern Iowa,4,4,NA,290452724,2009-02-14
125,1,0:06,1206,1206,Clevin Hannah made Three Point Jumper.,42,25,17,6,0.9317091332862611,0.9317091332862611,Wichita State,Northern Iowa,4,4,NA,290452724,2009-02-14
126,1,0:00,1200,1200,Kerwin Dunham missed Three Point Jumper.,42,25,17,0,0.9322584459832474,0.9322584459832474,Wichita State,Northern Iowa,4,4,NA,290452724,2009-02-14
127,1,0:00,1200,1200,Wichita State Defensive Rebound.,42,25,17,0,0.9322584459832474,0.9322584459832474,Wichita State,Northern Iowa,4,4,NA,290452724,2009-02-14
128,1,0:00,1200,1200,End of the 1st Half.,42,25,17,0,0.9322584459832474,0.9322584459832474,Wichita State,Northern Iowa,4,4,NA,290452724,2009-02-14
129,2,20:00,1200,1200,PLAY,42,25,17,19,0.9322584459832474,0.9322584459832474,Wichita State,Northern Iowa,4,4,NA,290452724,2009-02-14
130,2,19:41,1181,1181,J.T. Durley missed Two Point Jumper.,42,25,17,0,0.9339321296764358,0.9339321296764358,Wichita State,Northern Iowa,4,4,NA,290452724,2009-02-14
131,2,19:41,1181,1181,Johnny Moran Defensive Rebound.,42,25,17,17,0.9339321296764358,0.9339321296764358,Wichita State,Northern Iowa,4,4,NA,290452724,2009-02-14
132,2,19:24,1164,1164,Adam Koch Turnover.,42,25,17,17,0.9353599232107745,0.9353599232107745,Wichita State,Northern Iowa,4,4,NA,290452724,2009-02-14
133,2,19:07,1147,1147,Toure' Murry Turnover.,42,25,17,5,0.936738687293675,0.936738687293675,Wichita State,Northern Iowa,4,4,NA,290452724,2009-02-14
134,2,19:02,1142,1142,Adam Koch Steal.,42,25,17,14,0.9371370807479837,0.9371370807479837,Wichita State,Northern Iowa,4,4,NA,290452724,2009-02-14
135,2,18:48,1128,1128,Foul on J.T. Durley,42,25,17,0,0.9382399896124729,0.9382399896124729,Wichita State,Northern Iowa,4,4,NA,290452724,2009-02-14
136,2,18:48,1128,1128,Jordan Eglseder made Free Throw.,42,26,16,0,0.9282894420988594,0.9282894420988594,Wichita State,Northern Iowa,4,4,NA,290452724,2009-02-14
137,2,18:48,1128,1128,Jordan Eglseder missed Free Throw.,42,26,16,0,0.9282894420988594,0.9282894420988594,Wichita State,Northern Iowa,4,4,NA,290452724,2009-02-14
138,2,18:48,1128,1128,A.J. Hawkins Defensive Rebound.,42,26,16,15,0.9282894420988594,0.9282894420988594,Wichita State,Northern Iowa,4,4,NA,290452724,2009-02-14
139,2,18:33,1113,1113,Foul on Adam Koch,42,26,16,11,0.9295530521492221,0.9295530521492221,Wichita State,Northern Iowa,4,4,NA,290452724,2009-02-14
140,2,18:22,1102,1102,A.J. Hawkins Turnover.,42,26,16,25,0.9304763660211232,0.9304763660211232,Wichita State,Northern Iowa,4,4,NA,290452724,2009-02-14
141,2,17:57,1077,1077,Jordan Eglseder missed Two Point Layup.,42,26,16,0,0.9325842441622678,0.9325842441622678,Wichita State,Northern Iowa,4,4,NA,290452724,2009-02-14
142,2,17:57,1077,1077,A.J. Hawkins Block.,42,26,16,1,0.9325842441622678,0.9325842441622678,Wichita State,Northern Iowa,4,4,NA,290452724,2009-02-14
143,2,17:56,1076,1076,Jordan Eglseder Offensive Rebound.,42,26,16,1,0.9326692235007357,0.9326692235007357,Wichita State,Northern Iowa,4,4,NA,290452724,2009-02-14
144,2,17:55,1075,1075,Jordan Eglseder made Two Point Layup.,42,28,14,8,0.9089651870238403,0.9089651870238403,Wichita State,Northern Iowa,4,4,NA,290452724,2009-02-14
145,2,17:47,1067,1067,A.J. Hawkins made Two Point Layup.  Assisted by Clevin Hannah.,44,28,16,0,0.9334375422765409,0.9334375422765409,Wichita State,Northern Iowa,4,4,NA,290452724,2009-02-14
146,2,17:47,1067,1067,Foul on Kwadzo Ahelegbe,44,28,16,4,0.9334375422765409,0.9334375422765409,Wichita State,Northern Iowa,4,4,NA,290452724,2009-02-14
147,2,17:43,1063,1063,A.J. Hawkins made Free Throw.,45,28,17,21,0.9433033029678848,0.9433033029678848,Wichita State,Northern Iowa,4,4,NA,290452724,2009-02-14
148,2,17:22,1042,1042,Foul on A.J. Hawkins,45,28,17,0,0.9449868335471225,0.9449868335471225,Wichita State,Northern Iowa,4,4,NA,290452724,2009-02-14
149,2,17:22,1042,1042,Adam Koch made Free Throw.,45,29,16,0,0.9356152753374807,0.9356152753374807,Wichita State,Northern Iowa,4,4,NA,290452724,2009-02-14
150,2,17:22,1042,1042,Adam Koch made Free Throw.,45,30,15,32,0.9247743469070614,0.9247743469070614,Wichita State,Northern Iowa,4,4,NA,290452724,2009-02-14
151,2,16:50,1010,1010,A.J. Hawkins missed Three Point Jumper.,45,30,15,0,0.927939795451253,0.927939795451253,Wichita State,Northern Iowa,4,4,NA,290452724,2009-02-14
152,2,16:50,1010,1010,Clevin Hannah Offensive Rebound.,45,30,15,22,0.927939795451253,0.927939795451253,Wichita State,Northern Iowa,4,4,NA,290452724,2009-02-14
153,2,16:28,988,988,Ramon Clemente missed Two Point Jumper.,45,30,15,0,0.930242272884639,0.930242272884639,Wichita State,Northern Iowa,4,4,NA,290452724,2009-02-14
154,2,16:28,988,988,Lucas O'Rear Defensive Rebound.,45,30,15,11,0.930242272884639,0.930242272884639,Wichita State,Northern Iowa,4,4,NA,290452724,2009-02-14
155,2,16:17,977,977,Jordan Eglseder made Two Point Layup.,45,32,13,20,0.9056054413170026,0.9056054413170026,Wichita State,Northern Iowa,4,4,NA,290452724,2009-02-14
156,2,15:57,957,957,J.T. Durley missed Two Point Layup.,45,32,13,0,0.9081235284570984,0.9081235284570984,Wichita State,Northern Iowa,4,4,NA,290452724,2009-02-14
157,2,15:57,957,957,Jordan Eglseder Block.,45,32,13,2,0.9081235284570984,0.9081235284570984,Wichita State,Northern Iowa,4,4,NA,290452724,2009-02-14
158,2,15:55,955,955,Wichita State Offensive Rebound.,45,32,13,10,0.908359669993467,0.908359669993467,Wichita State,Northern Iowa,4,4,NA,290452724,2009-02-14
159,2,15:45,945,945,Clevin Hannah made Two Point Jumper.,47,32,15,14,0.9347770742875956,0.9347770742875956,Wichita State,Northern Iowa,4,4,NA,290452724,2009-02-14
160,2,15:31,931,931,Kwadzo Ahelegbe Turnover.,47,32,15,0,0.9360418208893013,0.9360418208893013,Wichita State,Northern Iowa,4,4,NA,290452724,2009-02-14
161,2,15:31,931,931,Clevin Hannah Steal.,47,32,15,12,0.9360418208893013,0.9360418208893013,Wichita State,Northern Iowa,4,4,NA,290452724,2009-02-14
162,2,15:19,919,919,J.T. Durley missed Two Point Jumper.,47,32,15,0,0.9370529087973792,0.9370529087973792,Wichita State,Northern Iowa,4,4,NA,290452724,2009-02-14
163,2,15:19,919,919,Jordan Eglseder Defensive Rebound.,47,32,15,19,0.9370529087973792,0.9370529087973792,Wichita State,Northern Iowa,4,4,NA,290452724,2009-02-14
