play_id,half,time_remaining_half,secs_remaining,secs_remaining_absolute,description,home_score,away_score,score_diff,play_length,win_prob,naive_win_prob,home,away,home_time_out_remaining,away_time_out_remaining,home_favored_by,game_id,date
1,1,20:00,2400,2400,PLAY,0,0,0,14,0.5,0.5,Texas,Villanova,6,6,NA,260140251,2006-01-14
2,1,19:46,2386,2386,LaMarcus Aldridge made Two Point Jumper.,2,0,2,17,0.5443207085263143,0.5443207085263143,Texas,Villanova,6,6,NA,260140251,2006-01-14
3,1,19:29,2369,2369,Randy Foye made Three Point Jumper.  Assisted by Kyle Lowry.,2,3,-1,25,0.477614162257752,0.477614162257752,Texas,Villanova,6,6,NA,260140251,2006-01-14
4,1,19:04,2344,2344,Randy Foye made Three Point Jumper.,2,6,-4,23,0.41029219917368803,0.41029219917368803,Texas,Villanova,6,6,NA,260140251,2006-01-14
5,1,18:41,2321,2321,Randy Foye Steal.,2,6,-4,3,0.4093117278015457,0.4093117278015457,Texas,Villanova,6,6,NA,260140251,2006-01-14
6,1,18:38,2318,2318,P.J. Tucker Steal.,2,6,-4,0,0.4091829904482382,0.4091829904482382,Texas,Villanova,6,6,NA,260140251,2006-01-14
7,1,18:38,2318,2318,LaMarcus Aldridge made Two Point Layup.  Assisted by JD Lewis.,4,6,-2,0,0.4542106699426587,0.4542106699426587,Texas,Villanova,6,6,NA,260140251,2006-01-14
8,1,18:38,2318,2318,Foul on Will Sheridan,4,6,-2,0,0.4542106699426587,0.4542106699426587,Texas,Villanova,6,6,NA,260140251,2006-01-14
9,1,18:38,2318,2318,LaMarcus Aldridge missed Free Throw.,4,6,-2,0,0.4542106699426587,0.4542106699426587,Texas,Villanova,6,6,NA,260140251,2006-01-14
10,1,18:38,2318,2318,Randy Foye Defensive Rebound.,4,6,-2,9,0.4542106699426587,0.4542106699426587,Texas,Villanova,6,6,NA,260140251,2006-01-14
11,1,18:29,2309,2309,Randy Foye missed Three Point Jumper.,4,6,-2,0,0.45401205950216367,0.45401205950216367,Texas,Villanova,6,6,NA,260140251,2006-01-14
12,1,18:29,2309,2309,Daniel Gibson Defensive Rebound.,4,6,-2,7,0.45401205950216367,0.45401205950216367,Texas,Villanova,6,6,NA,260140251,2006-01-14
13,1,18:22,2302,2302,Daniel Gibson made Two Point Layup.,6,6,0,39,0.5,0.5,Texas,Villanova,6,6,NA,260140251,2006-01-14
14,1,17:43,2263,2263,Mike Nardi missed Three Point Jumper.,6,6,0,0,0.5,0.5,Texas,Villanova,6,6,NA,260140251,2006-01-14
15,1,17:43,2263,2263,Daniel Gibson Defensive Rebound.,6,6,0,5,0.5,0.5,Texas,Villanova,6,6,NA,260140251,2006-01-14
16,1,17:38,2258,2258,Kenton Paulino missed Three Point Jumper.,6,6,0,0,0.5,0.5,Texas,Villanova,6,6,NA,260140251,2006-01-14
17,1,17:38,2258,2258,Texas Defensive Rebound.,6,6,0,12,0.5,0.5,Texas,Villanova,6,6,NA,260140251,2006-01-14
18,1,17:26,2246,2246,Kyle Lowry Steal.,6,6,0,2,0.5,0.5,Texas,Villanova,6,6,NA,260140251,2006-01-14
19,1,17:24,2244,2244,Kyle Lowry made Two Point Layup.,6,8,-2,0,0.4525542545819073,0.4525542545819073,Texas,Villanova,6,6,NA,260140251,2006-01-14
20,1,17:24,2244,2244,Foul on Daniel Gibson,6,8,-2,0,0.4525542545819073,0.4525542545819073,Texas,Villanova,6,6,NA,260140251,2006-01-14
21,1,17:24,2244,2244,Kyle Lowry missed Free Throw.,6,8,-2,0,0.4525542545819073,0.4525542545819073,Texas,Villanova,6,6,NA,260140251,2006-01-14
22,1,17:24,2244,2244,P.J. Tucker Defensive Rebound.,6,8,-2,11,0.4525542545819073,0.4525542545819073,Texas,Villanova,6,6,NA,260140251,2006-01-14
23,1,17:13,2233,2233,LaMarcus Aldridge missed Two Point Jumper.,6,8,-2,0,0.4523041055167482,0.4523041055167482,Texas,Villanova,6,6,NA,260140251,2006-01-14
24,1,17:13,2233,2233,Kyle Lowry Defensive Rebound.,6,8,-2,18,0.4523041055167482,0.4523041055167482,Texas,Villanova,6,6,NA,260140251,2006-01-14
25,1,16:55,2215,2215,Randy Foye missed Two Point Layup.,6,8,-2,2,0.45189305018148956,0.45189305018148956,Texas,Villanova,6,6,NA,260140251,2006-01-14
26,1,16:53,2213,2213,Kenton Paulino Defensive Rebound.,6,8,-2,3,0.45184725637842443,0.45184725637842443,Texas,Villanova,6,6,NA,260140251,2006-01-14
27,1,16:50,2210,2210,Foul on Mike Nardi,6,8,-2,3,0.45177852332157903,0.45177852332157903,Texas,Villanova,6,6,NA,260140251,2006-01-14
28,1,16:47,2207,2207,Daniel Gibson missed Three Point Jumper.,6,8,-2,0,0.451709740701574,0.451709740701574,Texas,Villanova,6,6,NA,260140251,2006-01-14
29,1,16:47,2207,2207,Texas Defensive Rebound.,6,8,-2,3,0.451709740701574,0.451709740701574,Texas,Villanova,6,6,NA,260140251,2006-01-14
30,1,16:44,2204,2204,Foul on Daniel Gibson,6,8,-2,17,0.4516409099352638,0.4516409099352638,Texas,Villanova,6,6,NA,260140251,2006-01-14
31,1,16:27,2187,2187,LaMarcus Aldridge Steal.,6,8,-2,17,0.451250027875351,0.451250027875351,Texas,Villanova,6,6,NA,260140251,2006-01-14
32,1,16:10,2170,2170,Kenton Paulino missed Three Point Jumper.,6,8,-2,0,0.4508579029700246,0.4508579029700246,Texas,Villanova,6,6,NA,260140251,2006-01-14
33,1,16:10,2170,2170,Villanova Defensive Rebound.,6,8,-2,2,0.4508579029700246,0.4508579029700246,Texas,Villanova,6,6,NA,260140251,2006-01-14
34,1,16:08,2168,2168,Foul on P.J. Tucker,6,8,-2,18,0.45081169315445313,0.45081169315445313,Texas,Villanova,6,6,NA,260140251,2006-01-14
35,1,15:50,2150,2150,Allan Ray missed Three Point Jumper.,6,8,-2,0,0.4503944624143455,0.4503944624143455,Texas,Villanova,6,6,NA,260140251,2006-01-14
36,1,15:50,2150,2150,Jason Fraser Offensive Rebound.,6,8,-2,6,0.4503944624143455,0.4503944624143455,Texas,Villanova,6,6,NA,260140251,2006-01-14
37,1,15:44,2144,2144,Official TV Timeout.,6,8,-2,18,0.450254827554741,0.450254827554741,Texas,Villanova,6,6,NA,260140251,2006-01-14
38,1,15:26,2126,2126,Kyle Lowry Steal.,6,8,-2,2,0.449834147485996,0.449834147485996,Texas,Villanova,6,6,NA,260140251,2006-01-14
39,1,15:24,2124,2124,Kyle Lowry missed Two Point Layup.,6,8,-2,0,0.44978723503534246,0.44978723503534246,Texas,Villanova,6,6,NA,260140251,2006-01-14
40,1,15:24,2124,2124,Kenton Paulino Defensive Rebound.,6,8,-2,17,0.44978723503534246,0.44978723503534246,Texas,Villanova,6,6,NA,260140251,2006-01-14
41,1,15:07,2107,2107,Foul on Randy Foye,6,8,-2,0,0.44938703778548716,0.44938703778548716,Texas,Villanova,6,6,NA,260140251,2006-01-14
42,1,15:07,2107,2107,Daniel Gibson missed Two Point Jumper.,6,8,-2,0,0.44938703778548716,0.44938703778548716,Texas,Villanova,6,6,NA,260140251,2006-01-14
43,1,15:07,2107,2107,Villanova Defensive Rebound.,6,8,-2,18,0.44938703778548716,0.44938703778548716,Texas,Villanova,6,6,NA,260140251,2006-01-14
44,1,14:49,2089,2089,Allan Ray missed Two Point Jumper.,6,8,-2,0,0.4489603577119606,0.4489603577119606,Texas,Villanova,6,6,NA,260140251,2006-01-14
45,1,14:49,2089,2089,Kenton Paulino Defensive Rebound.,6,8,-2,27,0.4489603577119606,0.4489603577119606,Texas,Villanova,6,6,NA,260140251,2006-01-14
46,1,14:22,2062,2062,Kenton Paulino made Two Point Jumper.,8,8,0,25,0.5,0.5,Texas,Villanova,6,6,NA,260140251,2006-01-14
47,1,13:57,2037,2037,Randy Foye missed Three Point Jumper.,8,8,0,0,0.5,0.5,Texas,Villanova,6,6,NA,260140251,2006-01-14
48,1,13:57,2037,2037,LaMarcus Aldridge Defensive Rebound.,8,8,0,12,0.5,0.5,Texas,Villanova,6,6,NA,260140251,2006-01-14
49,1,13:45,2025,2025,P.J. Tucker missed Two Point Layup.,8,8,0,0,0.5,0.5,Texas,Villanova,6,6,NA,260140251,2006-01-14
50,1,13:45,2025,2025,Brad Buckman Offensive Rebound.,8,8,0,1,0.5,0.5,Texas,Villanova,6,6,NA,260140251,2006-01-14
51,1,13:44,2024,2024,Brad Buckman made Two Point Layup.,10,8,2,0,0.5526086370731056,0.5526086370731056,Texas,Villanova,6,6,NA,260140251,2006-01-14
52,1,13:44,2024,2024,Foul on Jason Fraser,10,8,2,0,0.5526086370731056,0.5526086370731056,Texas,Villanova,6,6,NA,260140251,2006-01-14
53,1,13:44,2024,2024,Brad Buckman missed Free Throw.,10,8,2,0,0.5526086370731056,0.5526086370731056,Texas,Villanova,6,6,NA,260140251,2006-01-14
54,1,13:44,2024,2024,Jason Fraser Defensive Rebound.,10,8,2,23,0.5526086370731056,0.5526086370731056,Texas,Villanova,6,6,NA,260140251,2006-01-14
55,1,13:21,2001,2001,Jason Fraser missed Two Point Layup.,10,8,2,0,0.5531755979271487,0.5531755979271487,Texas,Villanova,6,6,NA,260140251,2006-01-14
56,1,13:21,2001,2001,Brad Buckman Defensive Rebound.,10,8,2,28,0.5531755979271487,0.5531755979271487,Texas,Villanova,6,6,NA,260140251,2006-01-14
57,1,12:53,1973,1973,Daniel Gibson missed Two Point Jumper.,10,8,2,0,0.5538750429448416,0.5538750429448416,Texas,Villanova,6,6,NA,260140251,2006-01-14
58,1,12:53,1973,1973,Jason Fraser Defensive Rebound.,10,8,2,32,0.5538750429448416,0.5538750429448416,Texas,Villanova,6,6,NA,260140251,2006-01-14
59,1,12:21,1941,1941,Mike Nardi missed Three Point Jumper.,10,8,2,0,0.5546877061653551,0.5546877061653551,Texas,Villanova,6,6,NA,260140251,2006-01-14
60,1,12:21,1941,1941,Daniel Gibson Defensive Rebound.,10,8,2,15,0.5546877061653551,0.5546877061653551,Texas,Villanova,6,6,NA,260140251,2006-01-14
61,1,12:06,1926,1926,Brad Buckman made Two Point Layup.,12,8,4,29,0.6088269714665259,0.6088269714665259,Texas,Villanova,6,6,NA,260140251,2006-01-14
62,1,11:37,1897,1897,Allan Ray missed Three Point Jumper.,12,8,4,0,0.6102650344383029,0.6102650344383029,Texas,Villanova,6,6,NA,260140251,2006-01-14
63,1,11:37,1897,1897,Brad Buckman Defensive Rebound.,12,8,4,13,0.6102650344383029,0.6102650344383029,Texas,Villanova,6,6,NA,260140251,2006-01-14
64,1,11:24,1884,1884,Daniel Gibson missed Three Point Jumper.,12,8,4,0,0.6109085812400424,0.6109085812400424,Texas,Villanova,6,6,NA,260140251,2006-01-14
65,1,11:24,1884,1884,Shane Clark Defensive Rebound.,12,8,4,16,0.6109085812400424,0.6109085812400424,Texas,Villanova,6,6,NA,260140251,2006-01-14
66,1,11:08,1868,1868,Allan Ray missed Three Point Jumper.,12,8,4,0,0.6117010273841258,0.6117010273841258,Texas,Villanova,6,6,NA,260140251,2006-01-14
67,1,11:08,1868,1868,Randy Foye Offensive Rebound.,12,8,4,5,0.6117010273841258,0.6117010273841258,Texas,Villanova,6,6,NA,260140251,2006-01-14
68,1,11:03,1863,1863,Randy Foye missed Two Point Jumper.,12,8,4,0,0.6119489300005184,0.6119489300005184,Texas,Villanova,6,6,NA,260140251,2006-01-14
69,1,11:03,1863,1863,Shane Clark Offensive Rebound.,12,8,4,7,0.6119489300005184,0.6119489300005184,Texas,Villanova,6,6,NA,260140251,2006-01-14
70,1,10:56,1856,1856,Official TV Timeout.,12,8,4,50,0.6122963194698661,0.6122963194698661,Texas,Villanova,6,6,NA,260140251,2006-01-14
71,1,10:06,1806,1806,Shane Clark missed Two Point Jumper.,12,8,4,0,0.6147973524782013,0.6147973524782013,Texas,Villanova,6,6,NA,260140251,2006-01-14
72,1,10:06,1806,1806,LaMarcus Aldridge Defensive Rebound.,12,8,4,0,0.6147973524782013,0.6147973524782013,Texas,Villanova,6,6,NA,260140251,2006-01-14
73,1,10:06,1806,1806,Foul on Dante Cunningham,12,8,4,25,0.6147973524782013,0.6147973524782013,Texas,Villanova,6,6,NA,260140251,2006-01-14
74,1,9:41,1781,1781,P.J. Tucker missed Two Point Jumper.,12,8,4,0,0.6160682882700095,0.6160682882700095,Texas,Villanova,6,6,NA,260140251,2006-01-14
75,1,9:41,1781,1781,LaMarcus Aldridge Offensive Rebound.,12,8,4,4,0.6160682882700095,0.6160682882700095,Texas,Villanova,6,6,NA,260140251,2006-01-14
76,1,9:37,1777,1777,LaMarcus Aldridge missed Two Point Layup.,12,8,4,0,0.616273344615417,0.616273344615417,Texas,Villanova,6,6,NA,260140251,2006-01-14
77,1,9:37,1777,1777,Dante Cunningham Defensive Rebound.,12,8,4,28,0.616273344615417,0.616273344615417,Texas,Villanova,6,6,NA,260140251,2006-01-14
78,1,9:09,1749,1749,Kyle Lowry missed Two Point Jumper.,12,8,4,0,0.6177243772979365,0.6177243772979365,Texas,Villanova,6,6,NA,260140251,2006-01-14
79,1,9:09,1749,1749,P.J. Tucker Defensive Rebound.,12,8,4,7,0.6177243772979365,0.6177243772979365,Texas,Villanova,6,6,NA,260140251,2006-01-14
80,1,9:02,1742,1742,Daniel Gibson missed Three Point Jumper.,12,8,4,0,0.6180918693293256,0.6180918693293256,Texas,Villanova,6,6,NA,260140251,2006-01-14
81,1,9:02,1742,1742,Kyle Lowry Defensive Rebound.,12,8,4,20,0.6180918693293256,0.6180918693293256,Texas,Villanova,6,6,NA,260140251,2006-01-14
82,1,8:42,1722,1722,AJ Abrams missed Two Point Jumper.,12,8,4,0,0.6191536980813787,0.6191536980813787,Texas,Villanova,6,6,NA,260140251,2006-01-14
83,1,8:42,1722,1722,Brad Buckman Offensive Rebound.,12,8,4,3,0.6191536980813787,0.6191536980813787,Texas,Villanova,6,6,NA,260140251,2006-01-14
84,1,8:39,1719,1719,Brad Buckman made Two Point Layup.,14,8,6,22,0.6747964973088836,0.6747964973088836,Texas,Villanova,6,6,NA,260140251,2006-01-14
85,1,8:17,1697,1697,Jason Fraser made Two Point Dunk Shot.  Assisted by Kyle Lowry.,14,10,4,17,0.6205084525844143,0.6205084525844143,Texas,Villanova,6,6,NA,260140251,2006-01-14
86,1,8:00,1680,1680,P.J. Tucker missed Two Point Layup.,14,10,4,2,0.6214418002995874,0.6214418002995874,Texas,Villanova,6,6,NA,260140251,2006-01-14
87,1,7:58,1678,1678,Kyle Lowry Defensive Rebound.,14,10,4,5,0.6215503717930533,0.6215503717930533,Texas,Villanova,6,6,NA,260140251,2006-01-14
88,1,7:53,1673,1673,Foul on Daniel Gibson,14,10,4,0,0.621820405835026,0.621820405835026,Texas,Villanova,6,6,NA,260140251,2006-01-14
89,1,7:53,1673,1673,Official TV Timeout.,14,10,4,0,0.621820405835026,0.621820405835026,Texas,Villanova,6,6,NA,260140251,2006-01-14
90,1,7:53,1673,1673,Allan Ray made Free Throw.,14,11,3,0,0.592174407743181,0.592174407743181,Texas,Villanova,6,6,NA,260140251,2006-01-14
91,1,7:53,1673,1673,Allan Ray made Free Throw.,14,12,2,7,0.5618419905853336,0.5618419905853336,Texas,Villanova,6,6,NA,260140251,2006-01-14
92,1,7:46,1666,1666,Kyle Lowry Steal.,14,12,2,3,0.5620382530342561,0.5620382530342561,Texas,Villanova,6,6,NA,260140251,2006-01-14
93,1,7:43,1663,1663,Foul on LaMarcus Aldridge,14,12,2,0,0.5621218365722349,0.5621218365722349,Texas,Villanova,6,6,NA,260140251,2006-01-14
94,1,7:43,1663,1663,Kyle Lowry made Free Throw.,14,13,1,0,0.5311817203704111,0.5311817203704111,Texas,Villanova,6,6,NA,260140251,2006-01-14
95,1,7:43,1663,1663,Kyle Lowry made Free Throw.,14,14,0,12,0.5,0.5,Texas,Villanova,6,6,NA,260140251,2006-01-14
96,1,7:31,1651,1651,AJ Abrams missed Three Point Jumper.,14,14,0,0,0.5,0.5,Texas,Villanova,6,6,NA,260140251,2006-01-14
97,1,7:31,1651,1651,Jason Fraser Defensive Rebound.,14,14,0,23,0.5,0.5,Texas,Villanova,6,6,NA,260140251,2006-01-14
98,1,7:08,1628,1628,Allan Ray missed Three Point Jumper.,14,14,0,0,0.5,0.5,Texas,Villanova,6,6,NA,260140251,2006-01-14
99,1,7:08,1628,1628,Dante Cunningham Offensive Rebound.,14,14,0,3,0.5,0.5,Texas,Villanova,6,6,NA,260140251,2006-01-14
100,1,7:05,1625,1625,Foul on P.J. Tucker,14,14,0,17,0.5,0.5,Texas,Villanova,6,6,NA,260140251,2006-01-14
101,1,6:48,1608,1608,Mike Nardi made Three Point Jumper.  Assisted by Randy Foye.,14,17,-3,23,0.40521542523694876,0.40521542523694876,Texas,Villanova,6,6,NA,260140251,2006-01-14
102,1,6:25,1585,1585,Foul on Mike Nardi,14,17,-3,0,0.4043083335958776,0.4043083335958776,Texas,Villanova,6,6,NA,260140251,2006-01-14
103,1,6:25,1585,1585,AJ Abrams made Free Throw.,15,17,-2,0,0.4357660130236273,0.4357660130236273,Texas,Villanova,6,6,NA,260140251,2006-01-14
104,1,6:25,1585,1585,AJ Abrams made Free Throw.,16,17,-1,18,0.4677493867077535,0.4677493867077535,Texas,Villanova,6,6,NA,260140251,2006-01-14
105,1,6:07,1567,1567,Villanova Full Timeout.,16,17,-1,9,0.4675032089225179,0.4675032089225179,Texas,Villanova,5,6,NA,260140251,2006-01-14
106,1,5:58,1558,1558,Kenton Paulino Steal.,16,17,-1,2,0.4673790215152715,0.4673790215152715,Texas,Villanova,5,6,NA,260140251,2006-01-14
107,1,5:56,1556,1556,Kenton Paulino missed Three Point Jumper.,16,17,-1,0,0.4673512956803404,0.4673512956803404,Texas,Villanova,5,6,NA,260140251,2006-01-14
108,1,5:56,1556,1556,P.J. Tucker Offensive Rebound.,16,17,-1,3,0.4673512956803404,0.4673512956803404,Texas,Villanova,5,6,NA,260140251,2006-01-14
109,1,5:53,1553,1553,P.J. Tucker made Two Point Tip Shot.,18,17,1,21,0.5326903903799105,0.5326903903799105,Texas,Villanova,5,6,NA,260140251,2006-01-14
110,1,5:32,1532,1532,Randy Foye missed Three Point Jumper.,18,17,1,0,0.5329860615105957,0.5329860615105957,Texas,Villanova,5,6,NA,260140251,2006-01-14
111,1,5:32,1532,1532,Dante Cunningham Offensive Rebound.,18,17,1,4,0.5329860615105957,0.5329860615105957,Texas,Villanova,5,6,NA,260140251,2006-01-14
112,1,5:28,1528,1528,Dante Cunningham made Two Point Layup.,18,19,-1,24,0.4669567245665355,0.4669567245665355,Texas,Villanova,5,6,NA,260140251,2006-01-14
113,1,5:04,1504,1504,Foul on Kyle Lowry,18,19,-1,0,0.46660591743049,0.46660591743049,Texas,Villanova,5,6,NA,260140251,2006-01-14
114,1,5:04,1504,1504,Connor Atchley missed Free Throw.,18,19,-1,0,0.46660591743049,0.46660591743049,Texas,Villanova,5,6,NA,260140251,2006-01-14
115,1,5:04,1504,1504,Will Sheridan Defensive Rebound.,18,19,-1,10,0.46660591743049,0.46660591743049,Texas,Villanova,5,6,NA,260140251,2006-01-14
116,1,4:54,1494,1494,Kyle Lowry made Two Point Layup.  Assisted by Will Sheridan.,18,21,-3,27,0.4005578287073773,0.4005578287073773,Texas,Villanova,5,6,NA,260140251,2006-01-14
117,1,4:27,1467,1467,Allan Ray Steal.,18,21,-3,4,0.3993362842478114,0.3993362842478114,Texas,Villanova,5,6,NA,260140251,2006-01-14
118,1,4:23,1463,1463,Allan Ray missed Two Point Layup.,18,21,-3,0,0.39914910189969244,0.39914910189969244,Texas,Villanova,5,6,NA,260140251,2006-01-14
119,1,4:23,1463,1463,Allan Ray Offensive Rebound.,18,21,-3,5,0.39914910189969244,0.39914910189969244,Texas,Villanova,5,6,NA,260140251,2006-01-14
120,1,4:18,1458,1458,Randy Foye missed Three Point Jumper.,18,21,-3,0,0.3989126585284047,0.3989126585284047,Texas,Villanova,5,6,NA,260140251,2006-01-14
121,1,4:18,1458,1458,Dante Cunningham Offensive Rebound.,18,21,-3,5,0.3989126585284047,0.3989126585284047,Texas,Villanova,5,6,NA,260140251,2006-01-14
122,1,4:13,1453,1453,Allan Ray made Three Point Jumper.  Assisted by Kyle Lowry.,18,24,-6,10,0.30534108662003623,0.30534108662003623,Texas,Villanova,5,6,NA,260140251,2006-01-14
123,1,4:03,1443,1443,Texas Full Timeout.,18,24,-6,16,0.3044891779924284,0.3044891779924284,Texas,Villanova,5,5,NA,260140251,2006-01-14
124,1,3:47,1427,1427,Kenton Paulino made Three Point Jumper.,21,24,-3,24,0.3974405842161685,0.3974405842161685,Texas,Villanova,5,5,NA,260140251,2006-01-14
125,1,3:23,1403,1403,Official TV Timeout.,21,24,-3,21,0.3963518061381954,0.3963518061381954,Texas,Villanova,5,5,NA,260140251,2006-01-14
126,1,3:02,1382,1382,LaMarcus Aldridge missed Two Point Jumper.,21,24,-3,0,0.3954227530911518,0.3954227530911518,Texas,Villanova,5,5,NA,260140251,2006-01-14
127,1,3:02,1382,1382,Mike Williams Offensive Rebound.,21,24,-3,3,0.3954227530911518,0.3954227530911518,Texas,Villanova,5,5,NA,260140251,2006-01-14
128,1,2:59,1379,1379,Mike Williams missed Two Point Layup.,21,24,-3,0,0.3952910157911924,0.3952910157911924,Texas,Villanova,5,5,NA,260140251,2006-01-14
129,1,2:59,1379,1379,Villanova Defensive Rebound.,21,24,-3,15,0.3952910157911924,0.3952910157911924,Texas,Villanova,5,5,NA,260140251,2006-01-14
130,1,2:44,1364,1364,Randy Foye missed Two Point Layup.,21,24,-3,0,0.39463354224349684,0.39463354224349684,Texas,Villanova,5,5,NA,260140251,2006-01-14
131,1,2:44,1364,1364,P.J. Tucker Defensive Rebound.,21,24,-3,4,0.39463354224349684,0.39463354224349684,Texas,Villanova,5,5,NA,260140251,2006-01-14
132,1,2:40,1360,1360,AJ Abrams missed Three Point Jumper.,21,24,-3,0,0.39445816438426,0.39445816438426,Texas,Villanova,5,5,NA,260140251,2006-01-14
133,1,2:40,1360,1360,Allan Ray Defensive Rebound.,21,24,-3,21,0.39445816438426,0.39445816438426,Texas,Villanova,5,5,NA,260140251,2006-01-14
134,1,2:19,1339,1339,Kenton Paulino made Three Point Jumper.  Assisted by AJ Abrams.,24,24,0,30,0.5,0.5,Texas,Villanova,5,5,NA,260140251,2006-01-14
135,1,1:49,1309,1309,Allan Ray missed Three Point Jumper.,24,24,0,0,0.5,0.5,Texas,Villanova,5,5,NA,260140251,2006-01-14
136,1,1:49,1309,1309,Jason Fraser Offensive Rebound.,24,24,0,7,0.5,0.5,Texas,Villanova,5,5,NA,260140251,2006-01-14
137,1,1:42,1302,1302,Jason Fraser made Two Point Layup.,24,26,-2,37,0.42726119118958705,0.42726119118958705,Texas,Villanova,5,5,NA,260140251,2006-01-14
138,1,1:05,1265,1265,Shane Clark missed Two Point Jumper.,24,26,-2,0,0.4260200615218906,0.4260200615218906,Texas,Villanova,5,5,NA,260140251,2006-01-14
139,1,1:05,1265,1265,P.J. Tucker Defensive Rebound.,24,26,-2,33,0.4260200615218906,0.4260200615218906,Texas,Villanova,5,5,NA,260140251,2006-01-14
140,1,0:32,1232,1232,Kenton Paulino missed Two Point Layup.,24,26,-2,0,0.42479893683050085,0.42479893683050085,Texas,Villanova,5,5,NA,260140251,2006-01-14
141,1,0:32,1232,1232,Dante Cunningham Defensive Rebound.,24,26,-2,27,0.42479893683050085,0.42479893683050085,Texas,Villanova,5,5,NA,260140251,2006-01-14
142,1,0:05,1205,1205,Allan Ray missed Two Point Layup.,24,26,-2,0,0.42369788789132345,0.42369788789132345,Texas,Villanova,5,5,NA,260140251,2006-01-14
143,1,0:05,1205,1205,Texas Defensive Rebound.,24,26,-2,5,0.42369788789132345,0.42369788789132345,Texas,Villanova,5,5,NA,260140251,2006-01-14
144,1,0:00,1200,1200,End of the 1st Half.,24,26,-2,0,0.4234906714856242,0.4234906714856242,Texas,Villanova,5,5,NA,260140251,2006-01-14
145,2,20:00,1200,1200,PLAY,24,26,-2,9,0.4234906714856242,0.4234906714856242,Texas,Villanova,5,5,NA,260140251,2006-01-14
146,2,19:51,1191,1191,Mike Nardi missed Three Point Jumper.,24,26,-2,0,0.42312280303897476,0.42312280303897476,Texas,Villanova,5,5,NA,260140251,2006-01-14
147,2,19:51,1191,1191,Kenton Paulino Defensive Rebound.,24,26,-2,21,0.42312280303897476,0.42312280303897476,Texas,Villanova,5,5,NA,260140251,2006-01-14
148,2,19:30,1170,1170,LaMarcus Aldridge missed Two Point Jumper.,24,26,-2,0,0.422285129980549,0.422285129980549,Texas,Villanova,5,5,NA,260140251,2006-01-14
149,2,19:30,1170,1170,Mike Nardi Defensive Rebound.,24,26,-2,6,0.422285129980549,0.422285129980549,Texas,Villanova,5,5,NA,260140251,2006-01-14
150,2,19:24,1164,1164,Allan Ray missed Three Point Jumper.,24,26,-2,0,0.42204981466030844,0.42204981466030844,Texas,Villanova,5,5,NA,260140251,2006-01-14
151,2,19:24,1164,1164,Kenton Paulino Defensive Rebound.,24,26,-2,17,0.42204981466030844,0.42204981466030844,Texas,Villanova,5,5,NA,260140251,2006-01-14
152,2,19:07,1147,1147,P.J. Tucker missed Two Point Jumper.,24,26,-2,0,0.4213889615712744,0.4213889615712744,Texas,Villanova,5,5,NA,260140251,2006-01-14
153,2,19:07,1147,1147,Will Sheridan Defensive Rebound.,24,26,-2,14,0.4213889615712744,0.4213889615712744,Texas,Villanova,5,5,NA,260140251,2006-01-14
154,2,18:53,1133,1133,Foul on Mike Williams,24,26,-2,0,0.4208476808555709,0.4208476808555709,Texas,Villanova,5,5,NA,260140251,2006-01-14
155,2,18:53,1133,1133,Will Sheridan made Free Throw.,24,27,-3,0,0.38250202869934846,0.38250202869934846,Texas,Villanova,5,5,NA,260140251,2006-01-14
156,2,18:53,1133,1133,Will Sheridan made Free Throw.,24,28,-4,18,0.34556554453054034,0.34556554453054034,Texas,Villanova,5,5,NA,260140251,2006-01-14
157,2,18:35,1115,1115,Foul on Kyle Lowry,24,28,-4,15,0.3442706002963602,0.3442706002963602,Texas,Villanova,5,5,NA,260140251,2006-01-14
158,2,18:20,1100,1100,Kyle Lowry Steal.,24,28,-4,3,0.34317951743952047,0.34317951743952047,Texas,Villanova,5,5,NA,260140251,2006-01-14
159,2,18:17,1097,1097,Mike Nardi missed Three Point Jumper.,24,28,-4,0,0.3429592043869802,0.3429592043869802,Texas,Villanova,5,5,NA,260140251,2006-01-14
160,2,18:17,1097,1097,Mike Williams Defensive Rebound.,24,28,-4,12,0.3429592043869802,0.3429592043869802,Texas,Villanova,5,5,NA,260140251,2006-01-14
161,2,18:05,1085,1085,Foul on Will Sheridan,24,28,-4,8,0.3420687766349569,0.3420687766349569,Texas,Villanova,5,5,NA,260140251,2006-01-14
162,2,17:57,1077,1077,Daniel Gibson missed Two Point Layup.,24,28,-4,0,0.3414655178436248,0.3414655178436248,Texas,Villanova,5,5,NA,260140251,2006-01-14
163,2,17:57,1077,1077,Mike Nardi Defensive Rebound.,24,28,-4,4,0.3414655178436248,0.3414655178436248,Texas,Villanova,5,5,NA,260140251,2006-01-14
164,2,17:53,1073,1073,Kyle Lowry missed Two Point Layup.,24,28,-4,3,0.34116053318851935,0.34116053318851935,Texas,Villanova,5,5,NA,260140251,2006-01-14
165,2,17:50,1070,1070,P.J. Tucker Defensive Rebound.,24,28,-4,5,0.34093020053475304,0.34093020053475304,Texas,Villanova,5,5,NA,260140251,2006-01-14
166,2,17:45,1065,1065,LaMarcus Aldridge made Two Point Layup.  Assisted by P.J. Tucker.,26,28,-2,23,0.4181341775962585,0.4181341775962585,Texas,Villanova,5,5,NA,260140251,2006-01-14
167,2,17:22,1042,1042,Allan Ray missed Three Point Jumper.,26,28,-2,0,0.4171361413531615,0.4171361413531615,Texas,Villanova,5,5,NA,260140251,2006-01-14
168,2,17:22,1042,1042,Texas Defensive Rebound.,26,28,-2,11,0.4171361413531615,0.4171361413531615,Texas,Villanova,5,5,NA,260140251,2006-01-14
169,2,17:11,1031,1031,Daniel Gibson missed Two Point Layup.,26,28,-2,0,0.4166360861414005,0.4166360861414005,Texas,Villanova,5,5,NA,260140251,2006-01-14
170,2,17:11,1031,1031,Mike Nardi Defensive Rebound.,26,28,-2,6,0.4166360861414005,0.4166360861414005,Texas,Villanova,5,5,NA,260140251,2006-01-14
171,2,17:05,1025,1025,Randy Foye made Two Point Layup.  Assisted by Allan Ray.,26,30,-4,34,0.3372665821591066,0.3372665821591066,Texas,Villanova,5,5,NA,260140251,2006-01-14
172,2,16:31,991,991,LaMarcus Aldridge missed Two Point Jumper.,26,30,-4,0,0.3341526371624293,0.3341526371624293,Texas,Villanova,5,5,NA,260140251,2006-01-14
173,2,16:31,991,991,Allan Ray Defensive Rebound.,26,30,-4,10,0.3341526371624293,0.3341526371624293,Texas,Villanova,5,5,NA,260140251,2006-01-14
174,2,16:21,981,981,Randy Foye missed Three Point Jumper.,26,30,-4,0,0.33316498699790054,0.33316498699790054,Texas,Villanova,5,5,NA,260140251,2006-01-14
175,2,16:21,981,981,Villanova Defensive Rebound.,26,30,-4,23,0.33316498699790054,0.33316498699790054,Texas,Villanova,5,5,NA,260140251,2006-01-14
176,2,15:58,958,958,P.J. Tucker made Two Point Jumper.,28,30,-2,21,0.41284130803882985,0.41284130803882985,Texas,Villanova,5,5,NA,260140251,2006-01-14
177,2,15:37,937,937,Allan Ray made Two Point Layup.,28,32,-4,11,0.32888511604566173,0.32888511604566173,Texas,Villanova,5,5,NA,260140251,2006-01-14
178,2,15:26,926,926,Foul on Allan Ray,28,32,-4,0,0.32794456490267015,0.32794456490267015,Texas,Villanova,5,5,NA,260140251,2006-01-14
179,2,15:26,926,926,Official TV Timeout.,28,32,-4,30,0.32794456490267015,0.32794456490267015,Texas,Villanova,5,5,NA,260140251,2006-01-14
180,2,14:56,896,896,P.J. Tucker Steal.,28,32,-4,30,0.32554872431825493,0.32554872431825493,Texas,Villanova,5,5,NA,260140251,2006-01-14
