play_id,half,time_remaining_half,secs_remaining,secs_remaining_absolute,description,home_score,away_score,score_diff,play_length,win_prob,naive_win_prob,home,away,home_time_out_remaining,away_time_out_remaining,home_favored_by,game_id,date
1,1,20:00,2400,2400,PLAY,0,0,0,35,0.5,0.5,Arizona State,Oregon State,4,4,NA,270130009,2007-01-13
2,1,19:25,2365,2365,Marcel Jones missed Three Point Jumper.,0,0,0,0,0.5,0.5,Arizona State,Oregon State,4,4,NA,270130009,2007-01-13
3,1,19:25,2365,2365,Christian Polk Defensive Rebound.,0,0,0,22,0.5,0.5,Arizona State,Oregon State,4,4,NA,270130009,2007-01-13
4,1,19:03,2343,2343,Christian Polk made Two Point Jumper.,2,0,2,38,0.5452425068556261,0.5452425068556261,Arizona State,Oregon State,4,4,NA,270130009,2007-01-13
5,1,18:25,2305,2305,Christian Polk missed Two Point Jumper.,2,0,2,0,0.5460764925484636,0.5460764925484636,Arizona State,Oregon State,4,4,NA,270130009,2007-01-13
6,1,18:25,2305,2305,Kyle Jeffers Defensive Rebound.,2,0,2,10,0.5460764925484636,0.5460764925484636,Arizona State,Oregon State,4,4,NA,270130009,2007-01-13
7,1,18:15,2295,2295,Sasa Cuic made Two Point Jumper.,2,2,0,35,0.5,0.5,Arizona State,Oregon State,4,4,NA,270130009,2007-01-13
8,1,17:40,2260,2260,Kyle Jeffers made Two Point Jumper.,2,4,-2,30,0.45291651372509034,0.45291651372509034,Arizona State,Oregon State,4,4,NA,270130009,2007-01-13
9,1,17:10,2230,2230,Serge Angounou made Two Point Jumper.,4,4,0,22,0.5,0.5,Arizona State,Oregon State,4,4,NA,270130009,2007-01-13
10,1,16:48,2208,2208,Foul on Jeff Pendergraph,4,4,0,0,0.5,0.5,Arizona State,Oregon State,4,4,NA,270130009,2007-01-13
11,1,16:48,2208,2208,Marcel Jones made Free Throw.,4,5,-1,0,0.47580984828110745,0.47580984828110745,Arizona State,Oregon State,4,4,NA,270130009,2007-01-13
12,1,16:48,2208,2208,Marcel Jones made Free Throw.,4,6,-2,14,0.45173267366113046,0.45173267366113046,Arizona State,Oregon State,4,4,NA,270130009,2007-01-13
13,1,16:34,2194,2194,Serge Angounou missed Three Point Jumper.,4,6,-2,0,0.4514111445131579,0.4514111445131579,Arizona State,Oregon State,4,4,NA,270130009,2007-01-13
14,1,16:34,2194,2194,Serge Angounou Offensive Rebound.,4,6,-2,9,0.4514111445131579,0.4514111445131579,Arizona State,Oregon State,4,4,NA,270130009,2007-01-13
15,1,16:25,2185,2185,Christian Polk made Three Point Jumper.,7,6,1,18,0.5244563937823086,0.5244563937823086,Arizona State,Oregon State,4,4,NA,270130009,2007-01-13
16,1,16:07,2167,2167,Sasa Cuic missed Three Point Jumper.,7,6,1,0,0.5246655909373422,0.5246655909373422,Arizona State,Oregon State,4,4,NA,270130009,2007-01-13
17,1,16:07,2167,2167,Marcel Jones Offensive Rebound.,7,6,1,3,0.5246655909373422,0.5246655909373422,Arizona State,Oregon State,4,4,NA,270130009,2007-01-13
18,1,16:04,2164,2164,Foul on Jeff Pendergraph,7,6,1,1,0.5247005411416555,0.5247005411416555,Arizona State,Oregon State,4,4,NA,270130009,2007-01-13
19,1,16:03,2163,2163,Sasa Cuic missed Three Point Jumper.,7,6,1,0,0.5247121988153477,0.5247121988153477,Arizona State,Oregon State,4,4,NA,270130009,2007-01-13
20,1,16:03,2163,2163,Serge Angounou Defensive Rebound.,7,6,1,28,0.5247121988153477,0.5247121988153477,Arizona State,Oregon State,4,4,NA,270130009,2007-01-13
21,1,15:35,2135,2135,Foul on Antwi Atuahene,7,6,1,1,0.5250402314902198,0.5250402314902198,Arizona State,Oregon State,4,4,NA,270130009,2007-01-13
22,1,15:34,2134,2134,Official TV Timeout.,7,6,1,8,0.5250520071952085,0.5250520071952085,Arizona State,Oregon State,4,4,NA,270130009,2007-01-13
23,1,15:26,2126,2126,Foul on Wesley Washington,7,6,1,38,0.5251463699997507,0.5251463699997507,Arizona State,Oregon State,4,4,NA,270130009,2007-01-13
24,1,14:48,2088,2088,Antwi Atuahene missed Two Point Jumper.,7,6,1,0,0.5255986424134269,0.5255986424134269,Arizona State,Oregon State,4,4,NA,270130009,2007-01-13
25,1,14:48,2088,2088,Oregon State Defensive Rebound.,7,6,1,32,0.5255986424134269,0.5255986424134269,Arizona State,Oregon State,4,4,NA,270130009,2007-01-13
26,1,14:16,2056,2056,Christian Polk made Three Point Jumper.,10,6,4,40,0.6025587243344606,0.6025587243344606,Arizona State,Oregon State,4,4,NA,270130009,2007-01-13
27,1,13:36,2016,2016,Angelo Tsagarakis missed Three Point Jumper.,10,6,4,0,0.6044452561239052,0.6044452561239052,Arizona State,Oregon State,4,4,NA,270130009,2007-01-13
28,1,13:36,2016,2016,Sasa Cuic Offensive Rebound.,10,6,4,0,0.6044452561239052,0.6044452561239052,Arizona State,Oregon State,4,4,NA,270130009,2007-01-13
29,1,13:36,2016,2016,Sasa Cuic made Two Point Layup.,10,8,2,22,0.5528050937553622,0.5528050937553622,Arizona State,Oregon State,4,4,NA,270130009,2007-01-13
30,1,13:14,1994,1994,Josh Tarver made Two Point Dunk Shot.,10,10,0,24,0.5,0.5,Arizona State,Oregon State,4,4,NA,270130009,2007-01-13
31,1,12:50,1970,1970,Derek Glasser made Two Point Layup.,12,10,2,21,0.5539506126150489,0.5539506126150489,Arizona State,Oregon State,4,4,NA,270130009,2007-01-13
32,1,12:29,1949,1949,Josh Tarver missed Three Point Jumper.,12,10,2,0,0.5544831552342676,0.5544831552342676,Arizona State,Oregon State,4,4,NA,270130009,2007-01-13
33,1,12:29,1949,1949,Antwi Atuahene Defensive Rebound.,12,10,2,33,0.5544831552342676,0.5544831552342676,Arizona State,Oregon State,4,4,NA,270130009,2007-01-13
34,1,11:56,1916,1916,Christian Polk missed Three Point Jumper.,12,10,2,0,0.5553311657182827,0.5553311657182827,Arizona State,Oregon State,4,4,NA,270130009,2007-01-13
35,1,11:56,1916,1916,Allen Morill Offensive Rebound.,12,10,2,21,0.5553311657182827,0.5553311657182827,Arizona State,Oregon State,4,4,NA,270130009,2007-01-13
36,1,11:35,1895,1895,Jerren Shipp made Two Point Layup.,14,10,4,23,0.6103640524229491,0.6103640524229491,Arizona State,Oregon State,4,4,NA,270130009,2007-01-13
37,1,11:12,1872,1872,Marcel Jones made Two Point Jumper.,14,12,2,24,0.5564623496308995,0.5564623496308995,Arizona State,Oregon State,4,4,NA,270130009,2007-01-13
38,1,10:48,1848,1848,Jeff Pendergraph missed Two Point Jumper.,14,12,2,0,0.5570813358575178,0.5570813358575178,Arizona State,Oregon State,4,4,NA,270130009,2007-01-13
39,1,10:48,1848,1848,Jerren Shipp Offensive Rebound.,14,12,2,4,0.5570813358575178,0.5570813358575178,Arizona State,Oregon State,4,4,NA,270130009,2007-01-13
40,1,10:44,1844,1844,Jerren Shipp missed Two Point Layup.,14,12,2,3,0.5571848422813509,0.5571848422813509,Arizona State,Oregon State,4,4,NA,270130009,2007-01-13
41,1,10:41,1841,1841,Arizona State Defensive Rebound.,14,12,2,2,0.5572625528804956,0.5572625528804956,Arizona State,Oregon State,4,4,NA,270130009,2007-01-13
42,1,10:39,1839,1839,Official TV Timeout.,14,12,2,29,0.5573144007142591,0.5573144007142591,Arizona State,Oregon State,4,4,NA,270130009,2007-01-13
43,1,10:10,1810,1810,Sasa Cuic missed Two Point Jumper.,14,12,2,0,0.558070640203388,0.558070640203388,Arizona State,Oregon State,4,4,NA,270130009,2007-01-13
44,1,10:10,1810,1810,Jeff Pendergraph Defensive Rebound.,14,12,2,26,0.558070640203388,0.558070640203388,Arizona State,Oregon State,4,4,NA,270130009,2007-01-13
45,1,9:44,1784,1784,Foul on Angelo Tsagarakis,14,12,2,3,0.5587578006611388,0.5587578006611388,Arizona State,Oregon State,4,4,NA,270130009,2007-01-13
46,1,9:41,1781,1781,Foul on Jack McGillis,14,12,2,14,0.5588377739524277,0.5588377739524277,Arizona State,Oregon State,4,4,NA,270130009,2007-01-13
47,1,9:27,1767,1767,Foul on Christian Polk,14,12,2,0,0.5592131188211865,0.5592131188211865,Arizona State,Oregon State,4,4,NA,270130009,2007-01-13
48,1,9:27,1767,1767,Allen Morill missed Free Throw.,14,12,2,4,0.5592131188211865,0.5592131188211865,Arizona State,Oregon State,4,4,NA,270130009,2007-01-13
49,1,9:23,1763,1763,Kyle Jeffers Defensive Rebound.,14,12,2,26,0.5593210449516063,0.5593210449516063,Arizona State,Oregon State,4,4,NA,270130009,2007-01-13
50,1,8:57,1737,1737,Jack McGillis missed Two Point Jumper.,14,12,2,0,0.5600308561056404,0.5600308561056404,Arizona State,Oregon State,4,4,NA,270130009,2007-01-13
51,1,8:57,1737,1737,Marcel Jones Offensive Rebound.,14,12,2,6,0.5600308561056404,0.5600308561056404,Arizona State,Oregon State,4,4,NA,270130009,2007-01-13
52,1,8:51,1731,1731,Marcel Jones made Two Point Tip Shot.,14,14,0,14,0.5,0.5,Arizona State,Oregon State,4,4,NA,270130009,2007-01-13
53,1,8:37,1717,1717,Allen Morill made Free Throw.,15,14,1,29,0.5304059361583805,0.5304059361583805,Arizona State,Oregon State,4,4,NA,270130009,2007-01-13
54,1,8:08,1688,1688,Christian Polk missed Two Point Layup.,15,14,1,0,0.5308241345200851,0.5308241345200851,Arizona State,Oregon State,4,4,NA,270130009,2007-01-13
55,1,8:08,1688,1688,Kyle Jeffers Defensive Rebound.,15,14,1,0,0.5308241345200851,0.5308241345200851,Arizona State,Oregon State,4,4,NA,270130009,2007-01-13
56,1,8:08,1688,1688,Christian Polk missed Three Point Jumper.,15,14,1,0,0.5308241345200851,0.5308241345200851,Arizona State,Oregon State,4,4,NA,270130009,2007-01-13
57,1,8:08,1688,1688,Jack McGillis Defensive Rebound.,15,14,1,5,0.5308241345200851,0.5308241345200851,Arizona State,Oregon State,4,4,NA,270130009,2007-01-13
58,1,8:03,1683,1683,Marcel Jones missed Three Point Jumper.,15,14,1,0,0.5308966826705475,0.5308966826705475,Arizona State,Oregon State,4,4,NA,270130009,2007-01-13
59,1,8:03,1683,1683,Derek Glasser Defensive Rebound.,15,14,1,8,0.5308966826705475,0.5308966826705475,Arizona State,Oregon State,4,4,NA,270130009,2007-01-13
60,1,7:55,1675,1675,Jerren Shipp made Two Point Layup.,17,14,3,0,0.592091394173237,0.592091394173237,Arizona State,Oregon State,4,4,NA,270130009,2007-01-13
61,1,7:55,1675,1675,Oregon State Full Timeout.,17,14,3,6,0.592091394173237,0.592091394173237,Arizona State,Oregon State,3,4,NA,270130009,2007-01-13
62,1,7:49,1669,1669,Jack McGillis made Three Point Jumper.,17,17,0,30,0.5,0.5,Arizona State,Oregon State,3,4,NA,270130009,2007-01-13
63,1,7:19,1639,1639,Jerren Shipp missed Two Point Layup.,17,17,0,2,0.5,0.5,Arizona State,Oregon State,3,4,NA,270130009,2007-01-13
64,1,7:17,1637,1637,Wesley Washington Defensive Rebound.,17,17,0,0,0.5,0.5,Arizona State,Oregon State,3,4,NA,270130009,2007-01-13
65,1,7:17,1637,1637,Jack McGillis missed Two Point Jumper.,17,17,0,0,0.5,0.5,Arizona State,Oregon State,3,4,NA,270130009,2007-01-13
66,1,7:17,1637,1637,Serge Angounou Defensive Rebound.,17,17,0,25,0.5,0.5,Arizona State,Oregon State,3,4,NA,270130009,2007-01-13
67,1,6:52,1612,1612,Jeff Pendergraph made Two Point Dunk Shot.,19,17,2,1,0.5635094262892736,0.5635094262892736,Arizona State,Oregon State,3,4,NA,270130009,2007-01-13
68,1,6:51,1611,1611,Official TV Timeout.,19,17,2,12,0.56353626359315,0.56353626359315,Arizona State,Oregon State,3,4,NA,270130009,2007-01-13
69,1,6:39,1599,1599,Foul on Sasa Cuic,19,17,2,10,0.5638581035199477,0.5638581035199477,Arizona State,Oregon State,3,4,NA,270130009,2007-01-13
70,1,6:29,1589,1589,Derek Glasser missed Three Point Jumper.,19,17,2,0,0.5641264678520037,0.5641264678520037,Arizona State,Oregon State,3,4,NA,270130009,2007-01-13
71,1,6:29,1589,1589,Wesley Washington Defensive Rebound.,19,17,2,8,0.5641264678520037,0.5641264678520037,Arizona State,Oregon State,3,4,NA,270130009,2007-01-13
72,1,6:21,1581,1581,Sasa Cuic made Three Point Jumper.,19,20,-1,15,0.467694874775941,0.467694874775941,Arizona State,Oregon State,3,4,NA,270130009,2007-01-13
73,1,6:06,1566,1566,Derek Glasser made Two Point Layup.,21,20,1,24,0.5325105465611225,0.5325105465611225,Arizona State,Oregon State,3,4,NA,270130009,2007-01-13
74,1,5:42,1542,1542,Marcel Jones made Two Point Layup.,21,22,-1,22,0.4671556490372108,0.4671556490372108,Arizona State,Oregon State,3,4,NA,270130009,2007-01-13
75,1,5:20,1520,1520,Jeff Pendergraph made Two Point Dunk Shot.,23,22,1,23,0.5331587078810258,0.5331587078810258,Arizona State,Oregon State,3,4,NA,270130009,2007-01-13
76,1,4:57,1497,1497,Foul on Serge Angounou,23,22,1,0,0.5334991778821079,0.5334991778821079,Arizona State,Oregon State,3,4,NA,270130009,2007-01-13
77,1,4:57,1497,1497,Sasa Cuic made Free Throw.,23,23,0,0,0.5,0.5,Arizona State,Oregon State,3,4,NA,270130009,2007-01-13
78,1,4:57,1497,1497,Sasa Cuic made Free Throw.,23,24,-1,15,0.4665008221178921,0.4665008221178921,Arizona State,Oregon State,3,4,NA,270130009,2007-01-13
79,1,4:42,1482,1482,Antwi Atuahene missed Two Point Layup.,23,24,-1,0,0.46627070193339,0.46627070193339,Arizona State,Oregon State,3,4,NA,270130009,2007-01-13
80,1,4:42,1482,1482,Jeff Pendergraph Offensive Rebound.,23,24,-1,2,0.46627070193339,0.46627070193339,Arizona State,Oregon State,3,4,NA,270130009,2007-01-13
81,1,4:40,1480,1480,Jeff Pendergraph made Two Point Layup.,25,24,1,20,0.533760524520124,0.533760524520124,Arizona State,Oregon State,3,4,NA,270130009,2007-01-13
82,1,4:20,1460,1460,Vojin Svilar made Three Point Jumper.,25,27,-2,13,0.4321540693808393,0.4321540693808393,Arizona State,Oregon State,3,4,NA,270130009,2007-01-13
83,1,4:07,1447,1447,Derek Glasser made Two Point Jumper.,27,27,0,17,0.5,0.5,Arizona State,Oregon State,3,4,NA,270130009,2007-01-13
84,1,3:50,1430,1430,Vojin Svilar missed Three Point Jumper.,27,27,0,0,0.5,0.5,Arizona State,Oregon State,3,4,NA,270130009,2007-01-13
85,1,3:50,1430,1430,Jeff Pendergraph Defensive Rebound.,27,27,0,8,0.5,0.5,Arizona State,Oregon State,3,4,NA,270130009,2007-01-13
86,1,3:42,1422,1422,Derek Glasser missed Two Point Layup.,27,27,0,5,0.5,0.5,Arizona State,Oregon State,3,4,NA,270130009,2007-01-13
87,1,3:37,1417,1417,Jerren Shipp Offensive Rebound.,27,27,0,0,0.5,0.5,Arizona State,Oregon State,3,4,NA,270130009,2007-01-13
88,1,3:37,1417,1417,Foul on Vojin Svilar,27,27,0,2,0.5,0.5,Arizona State,Oregon State,3,4,NA,270130009,2007-01-13
89,1,3:35,1415,1415,Official TV Timeout.,27,27,0,38,0.5,0.5,Arizona State,Oregon State,3,4,NA,270130009,2007-01-13
90,1,2:57,1377,1377,Antwi Atuahene missed Two Point Jumper.,27,27,0,0,0.5,0.5,Arizona State,Oregon State,3,4,NA,270130009,2007-01-13
91,1,2:57,1377,1377,Jeff Pendergraph Offensive Rebound.,27,27,0,0,0.5,0.5,Arizona State,Oregon State,3,4,NA,270130009,2007-01-13
92,1,2:57,1377,1377,Foul on Marcel Jones,27,27,0,0,0.5,0.5,Arizona State,Oregon State,3,4,NA,270130009,2007-01-13
93,1,2:57,1377,1377,Jeff Pendergraph made Free Throw.,28,27,1,0,0.5353983633018101,0.5353983633018101,Arizona State,Oregon State,3,4,NA,270130009,2007-01-13
94,1,2:57,1377,1377,Jeff Pendergraph made Free Throw.,29,27,2,10,0.5704436505936961,0.5704436505936961,Arizona State,Oregon State,3,4,NA,270130009,2007-01-13
95,1,2:47,1367,1367,Foul on Christian Polk,29,27,2,12,0.5707432174975559,0.5707432174975559,Arizona State,Oregon State,3,4,NA,270130009,2007-01-13
96,1,2:35,1355,1355,Marcel Jones missed Two Point Jumper.,29,27,2,0,0.5711030741531837,0.5711030741531837,Arizona State,Oregon State,3,4,NA,270130009,2007-01-13
97,1,2:35,1355,1355,Kyle Jeffers Offensive Rebound.,29,27,2,20,0.5711030741531837,0.5711030741531837,Arizona State,Oregon State,3,4,NA,270130009,2007-01-13
98,1,2:15,1335,1335,Marcel Jones missed Two Point Jumper.,29,27,2,0,0.5717080631534686,0.5717080631534686,Arizona State,Oregon State,3,4,NA,270130009,2007-01-13
99,1,2:15,1335,1335,Christian Polk Defensive Rebound.,29,27,2,30,0.5717080631534686,0.5717080631534686,Arizona State,Oregon State,3,4,NA,270130009,2007-01-13
100,1,1:45,1305,1305,Foul on Marcel Jones,29,27,2,0,0.5726427109396428,0.5726427109396428,Arizona State,Oregon State,3,4,NA,270130009,2007-01-13
101,1,1:45,1305,1305,Christian Polk made Free Throw.,30,27,3,0,0.6080117548283195,0.6080117548283195,Arizona State,Oregon State,3,4,NA,270130009,2007-01-13
102,1,1:45,1305,1305,Christian Polk made Free Throw.,31,27,4,38,0.6422821510353673,0.6422821510353673,Arizona State,Oregon State,3,4,NA,270130009,2007-01-13
103,1,1:07,1267,1267,Antwi Atuahene missed Two Point Layup.,31,27,4,0,0.6446586795451911,0.6446586795451911,Arizona State,Oregon State,3,4,NA,270130009,2007-01-13
104,1,1:07,1267,1267,Marcel Jones Defensive Rebound.,31,27,4,9,0.6446586795451911,0.6446586795451911,Arizona State,Oregon State,3,4,NA,270130009,2007-01-13
105,1,0:58,1258,1258,Derek Glasser missed Two Point Jumper.,31,27,4,0,0.6452560051007403,0.6452560051007403,Arizona State,Oregon State,3,4,NA,270130009,2007-01-13
106,1,0:58,1258,1258,Serge Angounou Offensive Rebound.,31,27,4,6,0.6452560051007403,0.6452560051007403,Arizona State,Oregon State,3,4,NA,270130009,2007-01-13
107,1,0:52,1252,1252,Serge Angounou missed Two Point Layup.,31,27,4,0,0.6456629519977736,0.6456629519977736,Arizona State,Oregon State,3,4,NA,270130009,2007-01-13
108,1,0:52,1252,1252,Serge Angounou Offensive Rebound.,31,27,4,0,0.6456629519977736,0.6456629519977736,Arizona State,Oregon State,3,4,NA,270130009,2007-01-13
109,1,0:52,1252,1252,Foul on Kyle Jeffers,31,27,4,5,0.6456629519977736,0.6456629519977736,Arizona State,Oregon State,3,4,NA,270130009,2007-01-13
110,1,0:47,1247,1247,Serge Angounou missed Free Throw.,31,27,4,0,0.6460077294874157,0.6460077294874157,Arizona State,Oregon State,3,4,NA,270130009,2007-01-13
111,1,0:47,1247,1247,Allen Morill Offensive Rebound.,31,27,4,13,0.6460077294874157,0.6460077294874157,Arizona State,Oregon State,3,4,NA,270130009,2007-01-13
112,1,0:34,1234,1234,Antwi Atuahene missed Three Point Jumper.,31,27,4,0,0.6469298387857294,0.6469298387857294,Arizona State,Oregon State,3,4,NA,270130009,2007-01-13
113,1,0:34,1234,1234,Jerren Shipp Offensive Rebound.,31,27,4,3,0.6469298387857294,0.6469298387857294,Arizona State,Oregon State,3,4,NA,270130009,2007-01-13
114,1,0:31,1231,1231,Serge Angounou missed Two Point Jumper.,31,27,4,0,0.6471481937448226,0.6471481937448226,Arizona State,Oregon State,3,4,NA,270130009,2007-01-13
115,1,0:31,1231,1231,Jerren Shipp Offensive Rebound.,31,27,4,8,0.6471481937448226,0.6471481937448226,Arizona State,Oregon State,3,4,NA,270130009,2007-01-13
116,1,0:23,1223,1223,Allen Morill made Two Point Layup.,33,27,6,18,0.7137542788753677,0.7137542788753677,Arizona State,Oregon State,3,4,NA,270130009,2007-01-13
117,1,0:05,1205,1205,Arizona State Full Timeout.,33,27,6,4,0.7156192112395022,0.7156192112395022,Arizona State,Oregon State,3,3,NA,270130009,2007-01-13
118,1,0:01,1201,1201,Derek Glasser missed Two Point Jumper.,33,27,6,0,0.7160339662966757,0.7160339662966757,Arizona State,Oregon State,3,3,NA,270130009,2007-01-13
119,1,0:01,1201,1201,Oregon State Defensive Rebound.,33,27,6,1,0.7160339662966757,0.7160339662966757,Arizona State,Oregon State,3,3,NA,270130009,2007-01-13
120,1,0:00,1200,1200,End of the 1st Half.,33,27,6,0,0.7161370692370593,0.7161370692370593,Arizona State,Oregon State,3,3,NA,270130009,2007-01-13
121,2,20:00,1200,1200,PLAY,33,27,6,13,0.7161370692370593,0.7161370692370593,Arizona State,Oregon State,4,4,NA,270130009,2007-01-13
122,2,19:47,1187,1187,Marcel Jones missed Two Point Layup.,33,27,6,0,0.7174579700037191,0.7174579700037191,Arizona State,Oregon State,4,4,NA,270130009,2007-01-13
123,2,19:47,1187,1187,Oregon State Defensive Rebound.,33,27,6,0,0.7174579700037191,0.7174579700037191,Arizona State,Oregon State,4,4,NA,270130009,2007-01-13
124,2,19:47,1187,1187,Foul on Antwi Atuahene,33,27,6,23,0.7174579700037191,0.7174579700037191,Arizona State,Oregon State,4,4,NA,270130009,2007-01-13
125,2,19:24,1164,1164,Serge Angounou missed Three Point Jumper.,33,27,6,0,0.7197240028608644,0.7197240028608644,Arizona State,Oregon State,4,4,NA,270130009,2007-01-13
126,2,19:24,1164,1164,Jeff Pendergraph Offensive Rebound.,33,27,6,13,0.7197240028608644,0.7197240028608644,Arizona State,Oregon State,4,4,NA,270130009,2007-01-13
127,2,19:11,1151,1151,Christian Polk missed Three Point Jumper.,33,27,6,0,0.7209776525104177,0.7209776525104177,Arizona State,Oregon State,4,4,NA,270130009,2007-01-13
128,2,19:11,1151,1151,Jeff Pendergraph Offensive Rebound.,33,27,6,16,0.7209776525104177,0.7209776525104177,Arizona State,Oregon State,4,4,NA,270130009,2007-01-13
129,2,18:55,1135,1135,Foul on Kyle Jeffers,33,27,6,1,0.7225071244470839,0.7225071244470839,Arizona State,Oregon State,4,4,NA,270130009,2007-01-13
130,2,18:54,1134,1134,Christian Polk missed Three Point Jumper.,33,27,6,0,0.7226025034143473,0.7226025034143473,Arizona State,Oregon State,4,4,NA,270130009,2007-01-13
131,2,18:54,1134,1134,Marcel Jones Defensive Rebound.,33,27,6,9,0.7226025034143473,0.7226025034143473,Arizona State,Oregon State,4,4,NA,270130009,2007-01-13
132,2,18:45,1125,1125,Marcel Jones missed Two Point Layup.,33,27,6,0,0.7234610646302783,0.7234610646302783,Arizona State,Oregon State,4,4,NA,270130009,2007-01-13
133,2,18:45,1125,1125,Oregon State Defensive Rebound.,33,27,6,1,0.7234610646302783,0.7234610646302783,Arizona State,Oregon State,4,4,NA,270130009,2007-01-13
134,2,18:44,1124,1124,Foul on Kyle Jeffers,33,27,6,6,0.723556536791153,0.723556536791153,Arizona State,Oregon State,4,4,NA,270130009,2007-01-13
135,2,18:38,1118,1118,Antwi Atuahene missed Two Point Layup.,33,27,6,0,0.7241300545940493,0.7241300545940493,Arizona State,Oregon State,4,4,NA,270130009,2007-01-13
136,2,18:38,1118,1118,Jeff Pendergraph Offensive Rebound.,33,27,6,4,0.7241300545940493,0.7241300545940493,Arizona State,Oregon State,4,4,NA,270130009,2007-01-13
137,2,18:34,1114,1114,Jeff Pendergraph made Two Point Layup.,35,27,8,29,0.7840254577277883,0.7840254577277883,Arizona State,Oregon State,4,4,NA,270130009,2007-01-13
138,2,18:05,1085,1085,Roeland Schaftenaar missed Three Point Jumper.,35,27,8,0,0.7872079702595427,0.7872079702595427,Arizona State,Oregon State,4,4,NA,270130009,2007-01-13
139,2,18:05,1085,1085,Jeff Pendergraph Defensive Rebound.,35,27,8,2,0.7872079702595427,0.7872079702595427,Arizona State,Oregon State,4,4,NA,270130009,2007-01-13
140,2,18:03,1083,1083,Christian Polk missed Two Point Layup.,35,27,8,0,0.7874312355357866,0.7874312355357866,Arizona State,Oregon State,4,4,NA,270130009,2007-01-13
141,2,18:03,1083,1083,Antwi Atuahene Offensive Rebound.,35,27,8,0,0.7874312355357866,0.7874312355357866,Arizona State,Oregon State,4,4,NA,270130009,2007-01-13
142,2,18:03,1083,1083,Antwi Atuahene missed Two Point Layup.,35,27,8,0,0.7874312355357866,0.7874312355357866,Arizona State,Oregon State,4,4,NA,270130009,2007-01-13
143,2,18:03,1083,1083,Josh Tarver Defensive Rebound.,35,27,8,23,0.7874312355357866,0.7874312355357866,Arizona State,Oregon State,4,4,NA,270130009,2007-01-13
144,2,17:40,1060,1060,Marcel Jones made Two Point Layup.,35,29,6,19,0.7298629936248189,0.7298629936248189,Arizona State,Oregon State,4,4,NA,270130009,2007-01-13
145,2,17:21,1041,1041,Serge Angounou missed Two Point Jumper.,35,29,6,0,0.7318787905101527,0.7318787905101527,Arizona State,Oregon State,4,4,NA,270130009,2007-01-13
146,2,17:21,1041,1041,Roeland Schaftenaar Defensive Rebound.,35,29,6,0,0.7318787905101527,0.7318787905101527,Arizona State,Oregon State,4,4,NA,270130009,2007-01-13
147,2,17:21,1041,1041,Foul on Antwi Atuahene,35,29,6,23,0.7318787905101527,0.7318787905101527,Arizona State,Oregon State,4,4,NA,270130009,2007-01-13
148,2,16:58,1018,1018,Jack McGillis made Two Point Layup.,35,31,4,9,0.6633463640001346,0.6633463640001346,Arizona State,Oregon State,4,4,NA,270130009,2007-01-13
149,2,16:49,1009,1009,Derek Glasser missed Three Point Jumper.,35,31,4,0,0.6641548959588939,0.6641548959588939,Arizona State,Oregon State,4,4,NA,270130009,2007-01-13
150,2,16:49,1009,1009,Roeland Schaftenaar Defensive Rebound.,35,31,4,16,0.6641548959588939,0.6641548959588939,Arizona State,Oregon State,4,4,NA,270130009,2007-01-13
151,2,16:33,993,993,Sasa Cuic missed Two Point Layup.,35,31,4,0,0.6656540404338502,0.6656540404338502,Arizona State,Oregon State,4,4,NA,270130009,2007-01-13
152,2,16:33,993,993,Roeland Schaftenaar Offensive Rebound.,35,31,4,1,0.6656540404338502,0.6656540404338502,Arizona State,Oregon State,4,4,NA,270130009,2007-01-13
153,2,16:32,992,992,Roeland Schaftenaar missed Two Point Layup.,35,31,4,0,0.6657505304713511,0.6657505304713511,Arizona State,Oregon State,4,4,NA,270130009,2007-01-13
154,2,16:32,992,992,Serge Angounou Defensive Rebound.,35,31,4,7,0.6657505304713511,0.6657505304713511,Arizona State,Oregon State,4,4,NA,270130009,2007-01-13
155,2,16:25,985,985,Foul on Kyle Jeffers,35,31,4,28,0.6664356729299381,0.6664356729299381,Arizona State,Oregon State,4,4,NA,270130009,2007-01-13
156,2,15:57,957,957,Wesley Washington made Two Point Layup.,35,33,2,5,0.5872119604963634,0.5872119604963634,Arizona State,Oregon State,4,4,NA,270130009,2007-01-13
157,2,15:52,952,952,Derek Glasser missed Two Point Layup.,35,33,2,1,0.5874739850985888,0.5874739850985888,Arizona State,Oregon State,4,4,NA,270130009,2007-01-13
158,2,15:51,951,951,Oregon State Defensive Rebound.,35,33,2,3,0.5875255538817862,0.5875255538817862,Arizona State,Oregon State,4,4,NA,270130009,2007-01-13
159,2,15:48,948,948,Foul on Jeff Pendergraph,35,33,2,6,0.587678658581135,0.587678658581135,Arizona State,Oregon State,4,4,NA,270130009,2007-01-13
160,2,15:42,942,942,Official TV Timeout.,35,33,2,22,0.5879780134404895,0.5879780134404895,Arizona State,Oregon State,4,4,NA,270130009,2007-01-13
161,2,15:20,920,920,Jack McGillis missed Three Point Jumper.,35,33,2,0,0.5890099179219168,0.5890099179219168,Arizona State,Oregon State,4,4,NA,270130009,2007-01-13
162,2,15:20,920,920,Serge Angounou Defensive Rebound.,35,33,2,8,0.5890099179219168,0.5890099179219168,Arizona State,Oregon State,4,4,NA,270130009,2007-01-13
163,2,15:12,912,912,Serge Angounou missed Two Point Jumper.,35,33,2,0,0.5893651769210692,0.5893651769210692,Arizona State,Oregon State,4,4,NA,270130009,2007-01-13
164,2,15:12,912,912,Jack McGillis Defensive Rebound.,35,33,2,27,0.5893651769210692,0.5893651769210692,Arizona State,Oregon State,4,4,NA,270130009,2007-01-13
165,2,14:45,885,885,Sasa Cuic made Two Point Jumper.,35,35,0,20,0.5,0.5,Arizona State,Oregon State,4,4,NA,270130009,2007-01-13
166,2,14:25,865,865,Antwi Atuahene made Two Point Layup.,37,35,2,23,0.5913664608539815,0.5913664608539815,Arizona State,Oregon State,4,4,NA,270130009,2007-01-13
167,2,14:02,842,842,Josh Tarver missed Three Point Jumper.,37,35,2,0,0.5923736646239279,0.5923736646239279,Arizona State,Oregon State,4,4,NA,270130009,2007-01-13
168,2,14:02,842,842,Angelo Tsagarakis Offensive Rebound.,37,35,2,5,0.5923736646239279,0.5923736646239279,Arizona State,Oregon State,4,4,NA,270130009,2007-01-13
