play_id,half,time_remaining_half,secs_remaining,secs_remaining_absolute,description,home_score,away_score,score_diff,play_length,win_prob,naive_win_prob,home,away,home_time_out_remaining,away_time_out_remaining,home_favored_by,game_id,date
1,1,20:00,2400,2400,PLAY,0,0,0,7,0.5,0.5,Kansas,UCLA,6,6,NA,274000015,2007-03-24
2,1,19:53,2393,2393,Arron Afflalo missed Two Point Layup.,0,0,0,0,0.5,0.5,Kansas,UCLA,6,6,NA,274000015,2007-03-24
3,1,19:53,2393,2393,Arron Afflalo Offensive Rebound.,0,0,0,5,0.5,0.5,Kansas,UCLA,6,6,NA,274000015,2007-03-24
4,1,19:48,2388,2388,Arron Afflalo made Two Point Jumper.,0,2,-2,13,0.45572153375231284,0.45572153375231284,Kansas,UCLA,6,6,NA,274000015,2007-03-24
5,1,19:35,2375,2375,Sasha Kaun missed Two Point Layup.,0,2,-2,5,0.45544591446758104,0.45544591446758104,Kansas,UCLA,6,6,NA,274000015,2007-03-24
6,1,19:30,2370,2370,Josh Shipp Defensive Rebound.,0,2,-2,10,0.4553392623404728,0.4553392623404728,Kansas,UCLA,6,6,NA,274000015,2007-03-24
7,1,19:20,2360,2360,Josh Shipp missed Two Point Layup.,0,2,-2,0,0.4551249204640424,0.4551249204640424,Kansas,UCLA,6,6,NA,274000015,2007-03-24
8,1,19:20,2360,2360,Brandon Rush Defensive Rebound.,0,2,-2,7,0.4551249204640424,0.4551249204640424,Kansas,UCLA,6,6,NA,274000015,2007-03-24
9,1,19:13,2353,2353,Foul on Arron Afflalo,0,2,-2,7,0.45497408096351394,0.45497408096351394,Kansas,UCLA,6,6,NA,274000015,2007-03-24
10,1,19:06,2346,2346,Brandon Rush missed Two Point Layup.,0,2,-2,0,0.4548226031392742,0.4548226031392742,Kansas,UCLA,6,6,NA,274000015,2007-03-24
11,1,19:06,2346,2346,Kansas Offensive Rebound.,0,2,-2,7,0.4548226031392742,0.4548226031392742,Kansas,UCLA,6,6,NA,274000015,2007-03-24
12,1,18:59,2339,2339,Foul on Lorenzo Mata,0,2,-2,0,0.4546705050603555,0.4546705050603555,Kansas,UCLA,6,6,NA,274000015,2007-03-24
13,1,18:59,2339,2339,Brandon Rush made Free Throw.,1,2,-1,0,0.47728848947087554,0.47728848947087554,Kansas,UCLA,6,6,NA,274000015,2007-03-24
14,1,18:59,2339,2339,Brandon Rush made Free Throw.,2,2,0,9,0.5,0.5,Kansas,UCLA,6,6,NA,274000015,2007-03-24
15,1,18:50,2330,2330,Julian Wright Defensive Rebound.,2,2,0,0,0.5,0.5,Kansas,UCLA,6,6,NA,274000015,2007-03-24
16,1,18:50,2330,2330,Arron Afflalo missed Three Point Jumper.,2,2,0,24,0.5,0.5,Kansas,UCLA,6,6,NA,274000015,2007-03-24
17,1,18:26,2306,2306,Darren Collison made Two Point Layup.,2,4,-2,13,0.4539456613451718,0.4539456613451718,Kansas,UCLA,6,6,NA,274000015,2007-03-24
18,1,18:13,2293,2293,Sasha Kaun made Two Point Dunk Shot.,4,4,0,24,0.5,0.5,Kansas,UCLA,6,6,NA,274000015,2007-03-24
19,1,17:49,2269,2269,Luc Richard Mbah a Moute made Two Point Jumper.,4,6,-2,7,0.4531193833259757,0.4531193833259757,Kansas,UCLA,6,6,NA,274000015,2007-03-24
20,1,17:42,2262,2262,Foul on Darren Collison,4,6,-2,24,0.452961654138631,0.452961654138631,Kansas,UCLA,6,6,NA,274000015,2007-03-24
21,1,17:18,2238,2238,Julian Wright made Two Point Jumper.,6,6,0,23,0.5,0.5,Kansas,UCLA,6,6,NA,274000015,2007-03-24
22,1,16:55,2215,2215,Foul on Mario Chalmers,6,6,0,16,0.5,0.5,Kansas,UCLA,6,6,NA,274000015,2007-03-24
23,1,16:39,2199,2199,Arron Afflalo made Three Point Jumper.,6,9,-3,18,0.427573083497328,0.427573083497328,Kansas,UCLA,6,6,NA,274000015,2007-03-24
24,1,16:21,2181,2181,Brandon Rush made Two Point Layup.,8,9,-1,5,0.47549717588611884,0.47549717588611884,Kansas,UCLA,6,6,NA,274000015,2007-03-24
25,1,16:16,2176,2176,Arron Afflalo missed Three Point Jumper.,8,9,-1,0,0.47543909122141503,0.47543909122141503,Kansas,UCLA,6,6,NA,274000015,2007-03-24
26,1,16:16,2176,2176,Kansas Defensive Rebound.,8,9,-1,16,0.47543909122141503,0.47543909122141503,Kansas,UCLA,6,6,NA,274000015,2007-03-24
27,1,16:00,2160,2160,Julian Wright made Two Point Layup.,10,9,1,28,0.5247471948920313,0.5247471948920313,Kansas,UCLA,6,6,NA,274000015,2007-03-24
28,1,15:32,2132,2132,Brandon Rush missed Two Point Jumper.,10,9,1,0,0.5250755715999145,0.5250755715999145,Kansas,UCLA,6,6,NA,274000015,2007-03-24
29,1,15:32,2132,2132,Russell Robinson Offensive Rebound.,10,9,1,7,0.5250755715999145,0.5250755715999145,Kansas,UCLA,6,6,NA,274000015,2007-03-24
30,1,15:25,2125,2125,Russell Robinson made Two Point Layup.,12,9,3,0,0.5749688454359582,0.5749688454359582,Kansas,UCLA,6,6,NA,274000015,2007-03-24
31,1,15:25,2125,2125,UCLA Full Timeout.,12,9,3,33,0.5749688454359582,0.5749688454359582,Kansas,UCLA,5,6,NA,274000015,2007-03-24
32,1,14:52,2092,2092,Darren Collison missed Two Point Jumper.,12,9,3,0,0.5761224842926601,0.5761224842926601,Kansas,UCLA,5,6,NA,274000015,2007-03-24
33,1,14:52,2092,2092,Darrell Arthur Defensive Rebound.,12,9,3,19,0.5761224842926601,0.5761224842926601,Kansas,UCLA,5,6,NA,274000015,2007-03-24
34,1,14:33,2073,2073,Official TV Timeout.,12,9,3,37,0.5767935672383472,0.5767935672383472,Kansas,UCLA,5,6,NA,274000015,2007-03-24
35,1,13:56,2036,2036,Darrell Arthur missed Two Point Jumper.,12,9,3,0,0.5781163148708798,0.5781163148708798,Kansas,UCLA,5,6,NA,274000015,2007-03-24
36,1,13:56,2036,2036,Alfred Aboya Defensive Rebound.,12,9,3,52,0.5781163148708798,0.5781163148708798,Kansas,UCLA,5,6,NA,274000015,2007-03-24
37,1,13:04,1984,1984,Sherron Collins missed Two Point Jumper.,12,9,3,5,0.5800148818043652,0.5800148818043652,Kansas,UCLA,5,6,NA,274000015,2007-03-24
38,1,12:59,1979,1979,Michael Roll Defensive Rebound.,12,9,3,3,0.5802000895021867,0.5802000895021867,Kansas,UCLA,5,6,NA,274000015,2007-03-24
39,1,12:56,1976,1976,Darren Collison made Two Point Layup.,12,11,1,19,0.5269781114547611,0.5269781114547611,Kansas,UCLA,5,6,NA,274000015,2007-03-24
40,1,12:37,1957,1957,Foul on Sherron Collins,12,11,1,11,0.5272202052529502,0.5272202052529502,Kansas,UCLA,5,6,NA,274000015,2007-03-24
41,1,12:26,1946,1946,Josh Shipp missed Three Point Jumper.,12,11,1,0,0.5273615685969871,0.5273615685969871,Kansas,UCLA,5,6,NA,274000015,2007-03-24
42,1,12:26,1946,1946,Darnell Jackson Defensive Rebound.,12,11,1,9,0.5273615685969871,0.5273615685969871,Kansas,UCLA,5,6,NA,274000015,2007-03-24
43,1,12:17,1937,1937,Darrell Arthur made Two Point Layup.,14,11,3,18,0.5817757819839845,0.5817757819839845,Kansas,UCLA,5,6,NA,274000015,2007-03-24
44,1,11:59,1919,1919,Official TV Timeout.,14,11,3,25,0.5824607430877299,0.5824607430877299,Kansas,UCLA,5,6,NA,274000015,2007-03-24
45,1,11:34,1894,1894,Arron Afflalo missed Three Point Jumper.,14,11,3,0,0.5834101258970105,0.5834101258970105,Kansas,UCLA,5,6,NA,274000015,2007-03-24
46,1,11:34,1894,1894,Alfred Aboya Offensive Rebound.,14,11,3,5,0.5834101258970105,0.5834101258970105,Kansas,UCLA,5,6,NA,274000015,2007-03-24
47,1,11:29,1889,1889,Alfred Aboya missed Two Point Layup.,14,11,3,0,0.5835998553847677,0.5835998553847677,Kansas,UCLA,5,6,NA,274000015,2007-03-24
48,1,11:29,1889,1889,Alfred Aboya Offensive Rebound.,14,11,3,18,0.5835998553847677,0.5835998553847677,Kansas,UCLA,5,6,NA,274000015,2007-03-24
49,1,11:11,1871,1871,Darnell Jackson made Two Point Jumper.,16,11,5,12,0.6381405650906712,0.6381405650906712,Kansas,UCLA,5,6,NA,274000015,2007-03-24
50,1,10:59,1859,1859,Darren Collison made Three Point Jumper.,16,14,2,17,0.5567972519698614,0.5567972519698614,Kansas,UCLA,5,6,NA,274000015,2007-03-24
51,1,10:42,1842,1842,Luc Richard Mbah a Moute made Two Point Jumper.,16,16,0,14,0.5,0.5,Kansas,UCLA,5,6,NA,274000015,2007-03-24
52,1,10:28,1828,1828,Darnell Jackson made Two Point Dunk Shot.,18,16,2,16,0.5576002052439307,0.5576002052439307,Kansas,UCLA,5,6,NA,274000015,2007-03-24
53,1,10:12,1812,1812,Foul on Sherron Collins,18,16,2,30,0.5580181787143008,0.5580181787143008,Kansas,UCLA,5,6,NA,274000015,2007-03-24
54,1,9:42,1782,1782,Russell Robinson made Two Point Layup.,20,16,4,35,0.6160171035267608,0.6160171035267608,Kansas,UCLA,5,6,NA,274000015,2007-03-24
55,1,9:07,1747,1747,Russell Robinson missed Two Point Layup.,20,16,4,0,0.6178291674594755,0.6178291674594755,Kansas,UCLA,5,6,NA,274000015,2007-03-24
56,1,9:07,1747,1747,null,20,16,4,1,0.6178291674594755,0.6178291674594755,Kansas,UCLA,5,6,NA,274000015,2007-03-24
57,1,9:06,1746,1746,Foul on Darnell Jackson,20,16,4,27,0.6178816242361526,0.6178816242361526,Kansas,UCLA,5,6,NA,274000015,2007-03-24
58,1,8:39,1719,1719,Josh Shipp made Three Point Jumper.,20,19,1,8,0.53037754115616,0.53037754115616,Kansas,UCLA,5,6,NA,274000015,2007-03-24
59,1,8:31,1711,1711,Russell Westbrook made Two Point Dunk Shot.,20,21,-1,5,0.46950854334579023,0.46950854334579023,Kansas,UCLA,5,6,NA,274000015,2007-03-24
60,1,8:26,1706,1706,Kansas Full Timeout.,20,21,-1,13,0.46943688262116656,0.46943688262116656,Kansas,UCLA,5,5,NA,274000015,2007-03-24
61,1,8:13,1693,1693,Sasha Kaun made Two Point Layup.,22,21,1,13,0.5307511825321546,0.5307511825321546,Kansas,UCLA,5,5,NA,274000015,2007-03-24
62,1,8:00,1680,1680,Julian Wright missed Two Point Jumper.,22,21,1,0,0.5309399454357937,0.5309399454357937,Kansas,UCLA,5,5,NA,274000015,2007-03-24
63,1,8:00,1680,1680,Alfred Aboya Defensive Rebound.,22,21,1,6,0.5309399454357937,0.5309399454357937,Kansas,UCLA,5,5,NA,274000015,2007-03-24
64,1,7:54,1674,1674,Foul on Sasha Kaun,22,21,1,0,0.5310259068173436,0.5310259068173436,Kansas,UCLA,5,5,NA,274000015,2007-03-24
65,1,7:54,1674,1674,Official TV Timeout.,22,21,1,0,0.5310259068173436,0.5310259068173436,Kansas,UCLA,5,5,NA,274000015,2007-03-24
66,1,7:54,1674,1674,Lorenzo Mata missed Free Throw.,22,21,1,0,0.5310259068173436,0.5310259068173436,Kansas,UCLA,5,5,NA,274000015,2007-03-24
67,1,7:54,1674,1674,null,22,21,1,0,0.5310259068173436,0.5310259068173436,Kansas,UCLA,5,5,NA,274000015,2007-03-24
68,1,7:54,1674,1674,Lorenzo Mata missed Free Throw.,22,21,1,0,0.5310259068173436,0.5310259068173436,Kansas,UCLA,5,5,NA,274000015,2007-03-24
69,1,7:54,1674,1674,UCLA Offensive Rebound.,22,21,1,22,0.5310259068173436,0.5310259068173436,Kansas,UCLA,5,5,NA,274000015,2007-03-24
70,1,7:32,1652,1652,Luc Richard Mbah a Moute missed Three Point Jumper.,22,21,1,0,0.5313355377461423,0.5313355377461423,Kansas,UCLA,5,5,NA,274000015,2007-03-24
71,1,7:32,1652,1652,Brandon Rush Defensive Rebound.,22,21,1,9,0.5313355377461423,0.5313355377461423,Kansas,UCLA,5,5,NA,274000015,2007-03-24
72,1,7:23,1643,1643,Sasha Kaun missed Two Point Layup.,22,21,1,0,0.5314601591004722,0.5314601591004722,Kansas,UCLA,5,5,NA,274000015,2007-03-24
73,1,7:23,1643,1643,Russell Robinson Offensive Rebound.,22,21,1,16,0.5314601591004722,0.5314601591004722,Kansas,UCLA,5,5,NA,274000015,2007-03-24
74,1,7:07,1627,1627,Brandon Rush made Two Point Jumper.,24,21,3,28,0.594033617428088,0.594033617428088,Kansas,UCLA,5,5,NA,274000015,2007-03-24
75,1,6:39,1599,1599,Luc Richard Mbah a Moute missed Two Point Layup.,24,21,3,0,0.5951393109579236,0.5951393109579236,Kansas,UCLA,5,5,NA,274000015,2007-03-24
76,1,6:39,1599,1599,Alfred Aboya Offensive Rebound.,24,21,3,38,0.5951393109579236,0.5951393109579236,Kansas,UCLA,5,5,NA,274000015,2007-03-24
77,1,6:01,1561,1561,Julian Wright missed Two Point Dunk Shot.,24,21,3,0,0.5966457828145045,0.5966457828145045,Kansas,UCLA,5,5,NA,274000015,2007-03-24
78,1,6:01,1561,1561,Sasha Kaun Offensive Rebound.,24,21,3,5,0.5966457828145045,0.5966457828145045,Kansas,UCLA,5,5,NA,274000015,2007-03-24
79,1,5:56,1556,1556,Brandon Rush made Three Point Jumper.,27,21,6,1,0.6866890472645911,0.6866890472645911,Kansas,UCLA,5,5,NA,274000015,2007-03-24
80,1,5:55,1555,1555,UCLA Full Timeout.,27,21,6,22,0.6867610305385978,0.6867610305385978,Kansas,UCLA,4,5,NA,274000015,2007-03-24
81,1,5:33,1533,1533,Arron Afflalo missed Three Point Jumper.,27,21,6,0,0.6883621745877787,0.6883621745877787,Kansas,UCLA,4,5,NA,274000015,2007-03-24
82,1,5:33,1533,1533,Lorenzo Mata Offensive Rebound.,27,21,6,19,0.6883621745877787,0.6883621745877787,Kansas,UCLA,4,5,NA,274000015,2007-03-24
83,1,5:14,1514,1514,Josh Shipp missed Three Point Jumper.,27,21,6,0,0.6897794849680392,0.6897794849680392,Kansas,UCLA,4,5,NA,274000015,2007-03-24
84,1,5:14,1514,1514,Brandon Rush Defensive Rebound.,27,21,6,12,0.6897794849680392,0.6897794849680392,Kansas,UCLA,4,5,NA,274000015,2007-03-24
85,1,5:02,1502,1502,Foul on Russell Robinson,27,21,6,4,0.6906956154187862,0.6906956154187862,Kansas,UCLA,4,5,NA,274000015,2007-03-24
86,1,4:58,1498,1498,Josh Shipp missed Two Point Layup.,27,21,6,0,0.6910051108101845,0.6910051108101845,Kansas,UCLA,4,5,NA,274000015,2007-03-24
87,1,4:58,1498,1498,Josh Shipp Offensive Rebound.,27,21,6,1,0.6910051108101845,0.6910051108101845,Kansas,UCLA,4,5,NA,274000015,2007-03-24
88,1,4:57,1497,1497,Foul on Darrell Arthur,27,21,6,0,0.691082825581152,0.691082825581152,Kansas,UCLA,4,5,NA,274000015,2007-03-24
89,1,4:57,1497,1497,Josh Shipp made Free Throw.,27,22,5,0,0.661724518318221,0.661724518318221,Kansas,UCLA,4,5,NA,274000015,2007-03-24
90,1,4:57,1497,1497,Josh Shipp made Free Throw.,27,23,4,13,0.6310656046504992,0.6310656046504992,Kansas,UCLA,4,5,NA,274000015,2007-03-24
91,1,4:44,1484,1484,Mario Chalmers missed Two Point Jumper.,27,23,4,0,0.6318100579581188,0.6318100579581188,Kansas,UCLA,4,5,NA,274000015,2007-03-24
92,1,4:44,1484,1484,Josh Shipp Defensive Rebound.,27,23,4,16,0.6318100579581188,0.6318100579581188,Kansas,UCLA,4,5,NA,274000015,2007-03-24
93,1,4:28,1468,1468,Brandon Rush missed Two Point Layup.,27,23,4,0,0.6327540116807752,0.6327540116807752,Kansas,UCLA,4,5,NA,274000015,2007-03-24
94,1,4:28,1468,1468,Darnell Jackson Offensive Rebound.,27,23,4,1,0.6327540116807752,0.6327540116807752,Kansas,UCLA,4,5,NA,274000015,2007-03-24
95,1,4:27,1467,1467,Darnell Jackson made Two Point Dunk Shot.,29,23,6,0,0.6934849570754132,0.6934849570754132,Kansas,UCLA,4,5,NA,274000015,2007-03-24
96,1,4:27,1467,1467,Foul on Lorenzo Mata,29,23,6,0,0.6934849570754132,0.6934849570754132,Kansas,UCLA,4,5,NA,274000015,2007-03-24
97,1,4:27,1467,1467,Darnell Jackson missed Free Throw.,29,23,6,0,0.6934849570754132,0.6934849570754132,Kansas,UCLA,4,5,NA,274000015,2007-03-24
98,1,4:27,1467,1467,Arron Afflalo Defensive Rebound.,29,23,6,16,0.6934849570754132,0.6934849570754132,Kansas,UCLA,4,5,NA,274000015,2007-03-24
99,1,4:11,1451,1451,Michael Roll made Three Point Jumper.,29,26,3,18,0.6014231388214079,0.6014231388214079,Kansas,UCLA,4,5,NA,274000015,2007-03-24
100,1,3:53,1433,1433,Brandon Rush missed Two Point Jumper.,29,26,3,0,0.6022805496051395,0.6022805496051395,Kansas,UCLA,4,5,NA,274000015,2007-03-24
101,1,3:53,1433,1433,Luc Richard Mbah a Moute Defensive Rebound.,29,26,3,16,0.6022805496051395,0.6022805496051395,Kansas,UCLA,4,5,NA,274000015,2007-03-24
102,1,3:37,1417,1417,Alfred Aboya made Two Point Layup.,29,28,1,14,0.5347816487510241,0.5347816487510241,Kansas,UCLA,4,5,NA,274000015,2007-03-24
103,1,3:23,1403,1403,Foul on Alfred Aboya,29,28,1,0,0.5350001100927972,0.5350001100927972,Kansas,UCLA,4,5,NA,274000015,2007-03-24
104,1,3:23,1403,1403,Official TV Timeout.,29,28,1,6,0.5350001100927972,0.5350001100927972,Kansas,UCLA,4,5,NA,274000015,2007-03-24
105,1,3:17,1397,1397,Foul on Brandon Rush,29,28,1,23,0.5350926796567569,0.5350926796567569,Kansas,UCLA,4,5,NA,274000015,2007-03-24
106,1,2:54,1374,1374,Arron Afflalo made Two Point Jumper.,29,30,-1,23,0.46455600323378965,0.46455600323378965,Kansas,UCLA,4,5,NA,274000015,2007-03-24
107,1,2:31,1351,1351,Brandon Rush missed Two Point Jumper.,29,30,-1,0,0.4642058012664251,0.4642058012664251,Kansas,UCLA,4,5,NA,274000015,2007-03-24
108,1,2:31,1351,1351,Kansas Offensive Rebound.,29,30,-1,30,0.4642058012664251,0.4642058012664251,Kansas,UCLA,4,5,NA,274000015,2007-03-24
109,1,2:01,1321,1321,Brandon Rush missed Two Point Layup.,29,30,-1,0,0.46374083618519774,0.46374083618519774,Kansas,UCLA,4,5,NA,274000015,2007-03-24
110,1,2:01,1321,1321,Luc Richard Mbah a Moute Defensive Rebound.,29,30,-1,7,0.46374083618519774,0.46374083618519774,Kansas,UCLA,4,5,NA,274000015,2007-03-24
111,1,1:54,1314,1314,Arron Afflalo made Two Point Layup.,29,32,-3,3,0.39240471178580727,0.39240471178580727,Kansas,UCLA,4,5,NA,274000015,2007-03-24
112,1,1:51,1311,1311,Kansas Full Timeout.,29,32,-3,14,0.39226662994597034,0.39226662994597034,Kansas,UCLA,4,4,NA,274000015,2007-03-24
113,1,1:37,1297,1297,Mario Chalmers missed Two Point Layup.,29,32,-3,0,0.3916120160448172,0.3916120160448172,Kansas,UCLA,4,4,NA,274000015,2007-03-24
114,1,1:37,1297,1297,Darnell Jackson Offensive Rebound.,29,32,-3,4,0.3916120160448172,0.3916120160448172,Kansas,UCLA,4,4,NA,274000015,2007-03-24
115,1,1:33,1293,1293,Foul on Luc Richard Mbah a Moute,29,32,-3,0,0.3914215367508182,0.3914215367508182,Kansas,UCLA,4,4,NA,274000015,2007-03-24
116,1,1:33,1293,1293,Darnell Jackson missed Free Throw.,29,32,-3,0,0.3914215367508182,0.3914215367508182,Kansas,UCLA,4,4,NA,274000015,2007-03-24
117,1,1:33,1293,1293,null,29,32,-3,0,0.3914215367508182,0.3914215367508182,Kansas,UCLA,4,4,NA,274000015,2007-03-24
118,1,1:33,1293,1293,Darnell Jackson missed Free Throw.,29,32,-3,0,0.3914215367508182,0.3914215367508182,Kansas,UCLA,4,4,NA,274000015,2007-03-24
119,1,1:33,1293,1293,Arron Afflalo Defensive Rebound.,29,32,-3,30,0.3914215367508182,0.3914215367508182,Kansas,UCLA,4,4,NA,274000015,2007-03-24
120,1,1:03,1263,1263,Darren Collison missed Three Point Jumper.,29,32,-3,0,0.38993276526181136,0.38993276526181136,Kansas,UCLA,4,4,NA,274000015,2007-03-24
121,1,1:03,1263,1263,Mario Chalmers Defensive Rebound.,29,32,-3,6,0.38993276526181136,0.38993276526181136,Kansas,UCLA,4,4,NA,274000015,2007-03-24
122,1,0:57,1257,1257,Brandon Rush made Two Point Dunk Shot.,31,32,-1,13,0.4626605904634737,0.4626605904634737,Kansas,UCLA,4,4,NA,274000015,2007-03-24
123,1,0:44,1244,1244,Foul on Alfred Aboya,31,32,-1,15,0.46241774615577314,0.46241774615577314,Kansas,UCLA,4,4,NA,274000015,2007-03-24
124,1,0:29,1229,1229,Mario Chalmers missed Two Point Jumper.,31,32,-1,0,0.4621245700976711,0.4621245700976711,Kansas,UCLA,4,4,NA,274000015,2007-03-24
125,1,0:29,1229,1229,Mario Chalmers Offensive Rebound.,31,32,-1,4,0.4621245700976711,0.4621245700976711,Kansas,UCLA,4,4,NA,274000015,2007-03-24
126,1,0:25,1225,1225,Russell Robinson missed Two Point Layup.,31,32,-1,0,0.46204384487746236,0.46204384487746236,Kansas,UCLA,4,4,NA,274000015,2007-03-24
127,1,0:25,1225,1225,Luc Richard Mbah a Moute Defensive Rebound.,31,32,-1,23,0.46204384487746236,0.46204384487746236,Kansas,UCLA,4,4,NA,274000015,2007-03-24
128,1,0:02,1202,1202,Josh Shipp made Three Point Jumper.,31,35,-4,2,0.35063635532794507,0.35063635532794507,Kansas,UCLA,4,4,NA,274000015,2007-03-24
129,1,0:00,1200,1200,End of the 1st Half.,31,35,-4,0,0.3504822574627354,0.3504822574627354,Kansas,UCLA,4,4,NA,274000015,2007-03-24
130,2,20:00,1200,1200,PLAY,31,35,-4,32,0.3504822574627354,0.3504822574627354,Kansas,UCLA,4,4,NA,274000015,2007-03-24
131,2,19:28,1168,1168,Lorenzo Mata missed Two Point Jumper.,31,35,-4,0,0.3480903885335947,0.3480903885335947,Kansas,UCLA,4,4,NA,274000015,2007-03-24
132,2,19:28,1168,1168,Julian Wright Defensive Rebound.,31,35,-4,17,0.3480903885335947,0.3480903885335947,Kansas,UCLA,4,4,NA,274000015,2007-03-24
133,2,19:11,1151,1151,Foul on Lorenzo Mata,31,35,-4,49,0.3468583578420259,0.3468583578420259,Kansas,UCLA,4,4,NA,274000015,2007-03-24
134,2,18:22,1102,1102,Darren Collison missed Two Point Jumper.,31,35,-4,0,0.34332595181613607,0.34332595181613607,Kansas,UCLA,4,4,NA,274000015,2007-03-24
135,2,18:22,1102,1102,Julian Wright Defensive Rebound.,31,35,-4,17,0.34332595181613607,0.34332595181613607,Kansas,UCLA,4,4,NA,274000015,2007-03-24
136,2,18:05,1085,1085,Mario Chalmers missed Two Point Jumper.,31,35,-4,0,0.3420687766349569,0.3420687766349569,Kansas,UCLA,4,4,NA,274000015,2007-03-24
137,2,18:05,1085,1085,Josh Shipp Defensive Rebound.,31,35,-4,4,0.3420687766349569,0.3420687766349569,Kansas,UCLA,4,4,NA,274000015,2007-03-24
138,2,18:01,1081,1081,Arron Afflalo made Two Point Layup.,31,37,-6,23,0.27226987030430405,0.27226987030430405,Kansas,UCLA,4,4,NA,274000015,2007-03-24
139,2,17:38,1058,1058,Brandon Rush missed Two Point Jumper.,31,37,-6,0,0.2699290638375667,0.2699290638375667,Kansas,UCLA,4,4,NA,274000015,2007-03-24
140,2,17:38,1058,1058,Julian Wright Offensive Rebound.,31,37,-6,4,0.2699290638375667,0.2699290638375667,Kansas,UCLA,4,4,NA,274000015,2007-03-24
141,2,17:34,1054,1054,Julian Wright missed Two Point Layup.,31,37,-6,0,0.26951033803270963,0.26951033803270963,Kansas,UCLA,4,4,NA,274000015,2007-03-24
142,2,17:34,1054,1054,Mario Chalmers Offensive Rebound.,31,37,-6,3,0.26951033803270963,0.26951033803270963,Kansas,UCLA,4,4,NA,274000015,2007-03-24
143,2,17:31,1051,1051,Mario Chalmers made Two Point Layup.,33,37,-4,54,0.3394353591143091,0.3394353591143091,Kansas,UCLA,4,4,NA,274000015,2007-03-24
144,2,16:37,997,997,Arron Afflalo made Three Point Jumper.,33,40,-7,2,0.23111397710678674,0.23111397710678674,Kansas,UCLA,4,4,NA,274000015,2007-03-24
145,2,16:35,995,995,Kansas Full Timeout.,33,40,-7,30,0.23084784952092344,0.23084784952092344,Kansas,UCLA,4,3,NA,274000015,2007-03-24
146,2,16:05,965,965,Russell Robinson missed Two Point Layup.,33,40,-7,0,0.22665345279728047,0.22665345279728047,Kansas,UCLA,4,3,NA,274000015,2007-03-24
147,2,16:05,965,965,Alfred Aboya Defensive Rebound.,33,40,-7,8,0.22665345279728047,0.22665345279728047,Kansas,UCLA,4,3,NA,274000015,2007-03-24
148,2,15:57,957,957,Josh Shipp missed Two Point Dunk Shot.,33,40,-7,0,0.2255553477452613,0.2255553477452613,Kansas,UCLA,4,3,NA,274000015,2007-03-24
149,2,15:57,957,957,Lorenzo Mata Offensive Rebound.,33,40,-7,5,0.2255553477452613,0.2255553477452613,Kansas,UCLA,4,3,NA,274000015,2007-03-24
150,2,15:52,952,952,Lorenzo Mata made Two Point Layup.,33,42,-9,15,0.16925771535979278,0.16925771535979278,Kansas,UCLA,4,3,NA,274000015,2007-03-24
151,2,15:37,937,937,Julian Wright made Two Point Layup.,35,42,-7,32,0.22301955671811396,0.22301955671811396,Kansas,UCLA,4,3,NA,274000015,2007-03-24
152,2,15:05,905,905,Foul on Josh Shipp,35,42,-7,0,0.2194110077470746,0.2194110077470746,Kansas,UCLA,4,3,NA,274000015,2007-03-24
153,2,15:05,905,905,Official TV Timeout.,35,42,-7,0,0.2194110077470746,0.2194110077470746,Kansas,UCLA,4,3,NA,274000015,2007-03-24
154,2,15:05,905,905,Julian Wright missed Free Throw.,35,42,-7,0,0.2194110077470746,0.2194110077470746,Kansas,UCLA,4,3,NA,274000015,2007-03-24
155,2,15:05,905,905,null,35,42,-7,0,0.2194110077470746,0.2194110077470746,Kansas,UCLA,4,3,NA,274000015,2007-03-24
156,2,15:05,905,905,Julian Wright missed Free Throw.,35,42,-7,0,0.2194110077470746,0.2194110077470746,Kansas,UCLA,4,3,NA,274000015,2007-03-24
157,2,15:05,905,905,Arron Afflalo Defensive Rebound.,35,42,-7,15,0.2194110077470746,0.2194110077470746,Kansas,UCLA,4,3,NA,274000015,2007-03-24
158,2,14:50,890,890,Foul on Russell Robinson,35,42,-7,23,0.2178299199596315,0.2178299199596315,Kansas,UCLA,4,3,NA,274000015,2007-03-24
159,2,14:27,867,867,Russell Westbrook made Two Point Layup.,35,44,-9,23,0.1595353467619542,0.1595353467619542,Kansas,UCLA,4,3,NA,274000015,2007-03-24
160,2,14:04,844,844,Foul on Alfred Aboya,35,44,-9,18,0.15704778471731723,0.15704778471731723,Kansas,UCLA,4,3,NA,274000015,2007-03-24
161,2,13:46,826,826,Brandon Rush missed Two Point Jumper.,35,44,-9,0,0.15499513335243414,0.15499513335243414,Kansas,UCLA,4,3,NA,274000015,2007-03-24
162,2,13:46,826,826,Darrell Arthur Offensive Rebound.,35,44,-9,4,0.15499513335243414,0.15499513335243414,Kansas,UCLA,4,3,NA,274000015,2007-03-24
163,2,13:42,822,822,Darrell Arthur missed Two Point Layup.,35,44,-9,0,0.15452052467964147,0.15452052467964147,Kansas,UCLA,4,3,NA,274000015,2007-03-24
164,2,13:42,822,822,Russell Westbrook Defensive Rebound.,35,44,-9,18,0.15452052467964147,0.15452052467964147,Kansas,UCLA,4,3,NA,274000015,2007-03-24
165,2,13:24,804,804,Arron Afflalo made Two Point Layup.,35,46,-11,4,0.1092570407511417,0.1092570407511417,Kansas,UCLA,4,3,NA,274000015,2007-03-24
166,2,13:20,800,800,Kansas Full Timeout.,35,46,-11,10,0.10877397941764434,0.10877397941764434,Kansas,UCLA,4,2,NA,274000015,2007-03-24
167,2,13:10,790,790,Brandon Rush made Three Point Jumper.,38,46,-8,31,0.17666424348922485,0.17666424348922485,Kansas,UCLA,4,2,NA,274000015,2007-03-24
168,2,12:39,759,759,Brandon Rush missed Three Point Jumper.,38,46,-8,0,0.17187814638304494,0.17187814638304494,Kansas,UCLA,4,2,NA,274000015,2007-03-24
169,2,12:39,759,759,Lorenzo Mata Defensive Rebound.,38,46,-8,65,0.17187814638304494,0.17187814638304494,Kansas,UCLA,4,2,NA,274000015,2007-03-24
170,2,11:34,694,694,Luc Richard Mbah a Moute missed Three Point Jumper.,38,46,-8,0,0.16027638181176593,0.16027638181176593,Kansas,UCLA,4,2,NA,274000015,2007-03-24
171,2,11:34,694,694,Darnell Jackson Defensive Rebound.,38,46,-8,4,0.16027638181176593,0.16027638181176593,Kansas,UCLA,4,2,NA,274000015,2007-03-24
172,2,11:30,690,690,Sherron Collins missed Two Point Jumper.,38,46,-8,0,0.15966795694940655,0.15966795694940655,Kansas,UCLA,4,2,NA,274000015,2007-03-24
173,2,11:30,690,690,Sherron Collins Offensive Rebound.,38,46,-8,1,0.15966795694940655,0.15966795694940655,Kansas,UCLA,4,2,NA,274000015,2007-03-24
174,2,11:29,689,689,Official TV Timeout.,38,46,-8,16,0.159517700001523,0.159517700001523,Kansas,UCLA,4,2,NA,274000015,2007-03-24
175,2,11:13,673,673,Foul on Brandon Rush,38,46,-8,0,0.15719057883002807,0.15719057883002807,Kansas,UCLA,4,2,NA,274000015,2007-03-24
176,2,11:13,673,673,Michael Roll missed Free Throw.,38,46,-8,0,0.15719057883002807,0.15719057883002807,Kansas,UCLA,4,2,NA,274000015,2007-03-24
177,2,11:13,673,673,null,38,46,-8,0,0.15719057883002807,0.15719057883002807,Kansas,UCLA,4,2,NA,274000015,2007-03-24
178,2,11:13,673,673,Michael Roll missed Free Throw.,38,46,-8,0,0.15719057883002807,0.15719057883002807,Kansas,UCLA,4,2,NA,274000015,2007-03-24
179,2,11:13,673,673,Brandon Rush Defensive Rebound.,38,46,-8,8,0.15719057883002807,0.15719057883002807,Kansas,UCLA,4,2,NA,274000015,2007-03-24
180,2,11:05,665,665,Sherron Collins missed Three Point Jumper.,38,46,-8,0,0.15606195081590984,0.15606195081590984,Kansas,UCLA,4,2,NA,274000015,2007-03-24
181,2,11:05,665,665,Luc Richard Mbah a Moute Defensive Rebound.,38,46,-8,13,0.15606195081590984,0.15606195081590984,Kansas,UCLA,4,2,NA,274000015,2007-03-24
182,2,10:52,652,652,Brandon Rush made Two Point Jumper.,40,46,-6,22,0.21817957831743126,0.21817957831743126,Kansas,UCLA,4,2,NA,274000015,2007-03-24
183,2,10:30,630,630,Luc Richard Mbah a Moute missed Two Point Jumper.,40,46,-6,0,0.21504713293852226,0.21504713293852226,Kansas,UCLA,4,2,NA,274000015,2007-03-24
