play_id,half,time_remaining_half,secs_remaining,secs_remaining_absolute,description,home_score,away_score,score_diff,play_length,win_prob,naive_win_prob,home,away,home_time_out_remaining,away_time_out_remaining,home_favored_by,game_id,date
1,1,20:00,2400,2400,PLAY,0,0,0,18,0.5,0.5,UC Irvine,CSU Fullerton,6,6,NA,300410300,2010-02-10
2,1,19:42,2382,2382,Bryce Webster made Two Point Jumper.  Assisted by Gerard Anderson.,0,2,-2,39,0.45559463014409923,0.45559463014409923,UC Irvine,CSU Fullerton,6,6,NA,300410300,2010-02-10
3,1,19:03,2343,2343,Michael Hunter made Two Point Jumper.  Assisted by Patrick Rembert.,2,2,0,38,0.5,0.5,UC Irvine,CSU Fullerton,6,6,NA,300410300,2010-02-10
4,1,18:25,2305,2305,Gerard Anderson missed Two Point Layup.,2,2,0,0,0.5,0.5,UC Irvine,CSU Fullerton,6,6,NA,300410300,2010-02-10
5,1,18:25,2305,2305,Eric Wise Defensive Rebound.,2,2,0,9,0.5,0.5,UC Irvine,CSU Fullerton,6,6,NA,300410300,2010-02-10
6,1,18:16,2296,2296,Michael Hunter missed Three Point Jumper.,2,2,0,0,0.5,0.5,UC Irvine,CSU Fullerton,6,6,NA,300410300,2010-02-10
7,1,18:16,2296,2296,Gerard Anderson Defensive Rebound.,2,2,0,9,0.5,0.5,UC Irvine,CSU Fullerton,6,6,NA,300410300,2010-02-10
8,1,18:07,2287,2287,Bryce Webster missed Two Point Jumper.,2,2,0,0,0.5,0.5,UC Irvine,CSU Fullerton,6,6,NA,300410300,2010-02-10
9,1,18:07,2287,2287,Zack Atkinson Defensive Rebound.,2,2,0,17,0.5,0.5,UC Irvine,CSU Fullerton,6,6,NA,300410300,2010-02-10
10,1,17:50,2270,2270,Zack Atkinson missed Two Point Jumper.,2,2,0,0,0.5,0.5,UC Irvine,CSU Fullerton,6,6,NA,300410300,2010-02-10
11,1,17:50,2270,2270,Gerard Anderson Defensive Rebound.,2,2,0,13,0.5,0.5,UC Irvine,CSU Fullerton,6,6,NA,300410300,2010-02-10
12,1,17:37,2257,2257,Aaron Thompson made Two Point Jumper.  Assisted by Gerard Anderson.,2,4,-2,29,0.4528487422387647,0.4528487422387647,UC Irvine,CSU Fullerton,6,6,NA,300410300,2010-02-10
13,1,17:08,2228,2228,Eric Wise missed Two Point Jumper.,2,4,-2,0,0.45219012861582764,0.45219012861582764,UC Irvine,CSU Fullerton,6,6,NA,300410300,2010-02-10
14,1,17:08,2228,2228,Gerard Anderson Defensive Rebound.,2,4,-2,6,0.45219012861582764,0.45219012861582764,UC Irvine,CSU Fullerton,6,6,NA,300410300,2010-02-10
15,1,17:02,2222,2222,Gerard Anderson Turnover.,2,4,-2,0,0.4520531439994127,0.4520531439994127,UC Irvine,CSU Fullerton,6,6,NA,300410300,2010-02-10
16,1,17:02,2222,2222,Foul on Gerard Anderson,2,4,-2,21,0.4520531439994127,0.4520531439994127,UC Irvine,CSU Fullerton,6,6,NA,300410300,2010-02-10
17,1,16:41,2201,2201,Darren Moore made Three Point Jumper.  Assisted by Eric Wise.,5,4,1,31,0.5242710400022217,0.5242710400022217,UC Irvine,CSU Fullerton,6,6,NA,300410300,2010-02-10
18,1,16:10,2170,2170,Jer'Vaughn Johnson missed Two Point Jumper.,5,4,1,0,0.5246306745998974,0.5246306745998974,UC Irvine,CSU Fullerton,6,6,NA,300410300,2010-02-10
19,1,16:10,2170,2170,Michael Hunter Defensive Rebound.,5,4,1,19,0.5246306745998974,0.5246306745998974,UC Irvine,CSU Fullerton,6,6,NA,300410300,2010-02-10
20,1,15:51,2151,2151,Darren Moore Turnover.,5,4,1,0,0.524852394614474,0.524852394614474,UC Irvine,CSU Fullerton,6,6,NA,300410300,2010-02-10
21,1,15:51,2151,2151,Foul on Darren Moore,5,4,1,1,0.524852394614474,0.524852394614474,UC Irvine,CSU Fullerton,6,6,NA,300410300,2010-02-10
22,1,15:50,2150,2150,Official TV Timeout.,5,4,1,15,0.5248641034247604,0.5248641034247604,UC Irvine,CSU Fullerton,6,6,NA,300410300,2010-02-10
23,1,15:35,2135,2135,Gerard Anderson missed Two Point Jumper.,5,4,1,0,0.5250402314902198,0.5250402314902198,UC Irvine,CSU Fullerton,6,6,NA,300410300,2010-02-10
24,1,15:35,2135,2135,Aaron Thompson Offensive Rebound.,5,4,1,3,0.5250402314902198,0.5250402314902198,UC Irvine,CSU Fullerton,6,6,NA,300410300,2010-02-10
25,1,15:32,2132,2132,Aaron Thompson made Two Point Dunk Shot.,5,6,-1,22,0.47492442840008553,0.47492442840008553,UC Irvine,CSU Fullerton,6,6,NA,300410300,2010-02-10
26,1,15:10,2110,2110,Patrick Rembert missed Two Point Jumper.,5,6,-1,0,0.4746640388951447,0.4746640388951447,UC Irvine,CSU Fullerton,6,6,NA,300410300,2010-02-10
27,1,15:10,2110,2110,Bryce Webster Defensive Rebound.,5,6,-1,17,0.4746640388951447,0.4746640388951447,UC Irvine,CSU Fullerton,6,6,NA,300410300,2010-02-10
28,1,14:53,2093,2093,Aaron Thompson missed Three Point Jumper.,5,6,-1,0,0.47446126854642284,0.47446126854642284,UC Irvine,CSU Fullerton,6,6,NA,300410300,2010-02-10
29,1,14:53,2093,2093,UC Irvine Defensive Rebound.,5,6,-1,30,0.47446126854642284,0.47446126854642284,UC Irvine,CSU Fullerton,6,6,NA,300410300,2010-02-10
30,1,14:23,2063,2063,Eric Wise made Two Point Jumper.  Assisted by Derrick Strings.,7,6,1,23,0.5259001561376713,0.5259001561376713,UC Irvine,CSU Fullerton,6,6,NA,300410300,2010-02-10
31,1,14:00,2040,2040,Devon Peltier missed Two Point Jumper.,7,6,1,0,0.5261805984850774,0.5261805984850774,UC Irvine,CSU Fullerton,6,6,NA,300410300,2010-02-10
32,1,14:00,2040,2040,Darren Moore Defensive Rebound.,7,6,1,1,0.5261805984850774,0.5261805984850774,UC Irvine,CSU Fullerton,6,6,NA,300410300,2010-02-10
33,1,13:59,2039,2039,Foul on Bryce Webster,7,6,1,20,0.5261928612683224,0.5261928612683224,UC Irvine,CSU Fullerton,6,6,NA,300410300,2010-02-10
34,1,13:39,2019,2019,Eric Wise made Two Point Jumper.,9,6,3,2,0.5787316529930603,0.5787316529930603,UC Irvine,CSU Fullerton,6,6,NA,300410300,2010-02-10
35,1,13:37,2017,2017,Jacques Streeter Turnover.,9,6,3,12,0.5788043770931707,0.5788043770931707,UC Irvine,CSU Fullerton,6,6,NA,300410300,2010-02-10
36,1,13:25,2005,2005,Darren Moore missed Two Point Jumper.,9,6,3,0,0.579242228814988,0.579242228814988,UC Irvine,CSU Fullerton,6,6,NA,300410300,2010-02-10
37,1,13:25,2005,2005,Orane Chin Defensive Rebound.,9,6,3,17,0.579242228814988,0.579242228814988,UC Irvine,CSU Fullerton,6,6,NA,300410300,2010-02-10
38,1,13:08,1988,1988,Aaron Thompson made Three Point Jumper.  Assisted by Devon Peltier.,9,9,0,22,0.5,0.5,UC Irvine,CSU Fullerton,6,6,NA,300410300,2010-02-10
39,1,12:46,1966,1966,Foul on Aaron Thompson,9,9,0,30,0.5,0.5,UC Irvine,CSU Fullerton,6,6,NA,300410300,2010-02-10
40,1,12:16,1936,1936,Zack Atkinson missed Two Point Jumper.,9,9,0,0,0.5,0.5,UC Irvine,CSU Fullerton,6,6,NA,300410300,2010-02-10
41,1,12:16,1936,1936,Devon Peltier Defensive Rebound.,9,9,0,18,0.5,0.5,UC Irvine,CSU Fullerton,6,6,NA,300410300,2010-02-10
42,1,11:58,1918,1918,Devon Peltier missed Three Point Jumper.,9,9,0,0,0.5,0.5,UC Irvine,CSU Fullerton,6,6,NA,300410300,2010-02-10
43,1,11:58,1918,1918,Pavol Losonsky Defensive Rebound.,9,9,0,9,0.5,0.5,UC Irvine,CSU Fullerton,6,6,NA,300410300,2010-02-10
44,1,11:49,1909,1909,Derrick Strings missed Three Point Jumper.,9,9,0,0,0.5,0.5,UC Irvine,CSU Fullerton,6,6,NA,300410300,2010-02-10
45,1,11:49,1909,1909,Jer'Vaughn Johnson Defensive Rebound.,9,9,0,8,0.5,0.5,UC Irvine,CSU Fullerton,6,6,NA,300410300,2010-02-10
46,1,11:41,1901,1901,Orane Chin missed Two Point Jumper.,9,9,0,0,0.5,0.5,UC Irvine,CSU Fullerton,6,6,NA,300410300,2010-02-10
47,1,11:41,1901,1901,Zack Atkinson Defensive Rebound.,9,9,0,32,0.5,0.5,UC Irvine,CSU Fullerton,6,6,NA,300410300,2010-02-10
48,1,11:09,1869,1869,Pavol Losonsky missed Two Point Jumper.,9,9,0,0,0.5,0.5,UC Irvine,CSU Fullerton,6,6,NA,300410300,2010-02-10
49,1,11:09,1869,1869,Orane Chin Defensive Rebound.,9,9,0,1,0.5,0.5,UC Irvine,CSU Fullerton,6,6,NA,300410300,2010-02-10
50,1,11:08,1868,1868,Foul on Zack Atkinson,9,9,0,1,0.5,0.5,UC Irvine,CSU Fullerton,6,6,NA,300410300,2010-02-10
51,1,11:07,1867,1867,Official TV Timeout.,9,9,0,28,0.5,0.5,UC Irvine,CSU Fullerton,6,6,NA,300410300,2010-02-10
52,1,10:39,1839,1839,Orane Chin missed Two Point Jumper.,9,9,0,0,0.5,0.5,UC Irvine,CSU Fullerton,6,6,NA,300410300,2010-02-10
53,1,10:39,1839,1839,Zack Atkinson Block.,9,9,0,1,0.5,0.5,UC Irvine,CSU Fullerton,6,6,NA,300410300,2010-02-10
54,1,10:38,1838,1838,Cal State Fullerton Offensive Re.,9,9,0,5,0.5,0.5,UC Irvine,CSU Fullerton,6,6,NA,300410300,2010-02-10
55,1,10:33,1833,1833,Jacques Streeter missed Two Point Jumper.,9,9,0,0,0.5,0.5,UC Irvine,CSU Fullerton,6,6,NA,300410300,2010-02-10
56,1,10:33,1833,1833,null,9,9,0,24,0.5,0.5,UC Irvine,CSU Fullerton,6,6,NA,300410300,2010-02-10
57,1,10:09,1809,1809,Foul on Aaron Thompson,9,9,0,0,0.5,0.5,UC Irvine,CSU Fullerton,6,6,NA,300410300,2010-02-10
58,1,10:09,1809,1809,Michael Hunter missed Free Throw.,9,9,0,0,0.5,0.5,UC Irvine,CSU Fullerton,6,6,NA,300410300,2010-02-10
59,1,10:09,1809,1809,null,9,9,0,0,0.5,0.5,UC Irvine,CSU Fullerton,6,6,NA,300410300,2010-02-10
60,1,10:09,1809,1809,Michael Hunter made Free Throw.,10,9,1,20,0.5291471583727971,0.5291471583727971,UC Irvine,CSU Fullerton,6,6,NA,300410300,2010-02-10
61,1,9:49,1789,1789,Gerard Anderson Turnover.,10,9,1,0,0.5294138657886375,0.5294138657886375,UC Irvine,CSU Fullerton,6,6,NA,300410300,2010-02-10
62,1,9:49,1789,1789,Foul on Gerard Anderson,10,9,1,14,0.5294138657886375,0.5294138657886375,UC Irvine,CSU Fullerton,6,6,NA,300410300,2010-02-10
63,1,9:35,1775,1775,Zack Atkinson made Two Point Dunk Shot.  Assisted by Michael Hunter.,12,9,3,16,0.5879860242513557,0.5879860242513557,UC Irvine,CSU Fullerton,6,6,NA,300410300,2010-02-10
64,1,9:19,1759,1759,Orane Chin made Two Point Layup.  Assisted by Devon Peltier.,12,11,1,10,0.5298203419958217,0.5298203419958217,UC Irvine,CSU Fullerton,6,6,NA,300410300,2010-02-10
65,1,9:09,1749,1749,Darren Moore missed Two Point Jumper.,12,11,1,0,0.5299578548902364,0.5299578548902364,UC Irvine,CSU Fullerton,6,6,NA,300410300,2010-02-10
66,1,9:09,1749,1749,Gerard Anderson Defensive Rebound.,12,11,1,19,0.5299578548902364,0.5299578548902364,UC Irvine,CSU Fullerton,6,6,NA,300410300,2010-02-10
67,1,8:50,1730,1730,Devon Peltier missed Three Point Jumper.,12,11,1,0,0.5302223330440571,0.5302223330440571,UC Irvine,CSU Fullerton,6,6,NA,300410300,2010-02-10
68,1,8:50,1730,1730,Bryce Webster Offensive Rebound.,12,11,1,14,0.5302223330440571,0.5302223330440571,UC Irvine,CSU Fullerton,6,6,NA,300410300,2010-02-10
69,1,8:36,1716,1716,Devon Peltier made Three Point Jumper.  Assisted by Gerard Anderson.,12,14,-2,20,0.43938406363819593,0.43938406363819593,UC Irvine,CSU Fullerton,6,6,NA,300410300,2010-02-10
70,1,8:16,1696,1696,Pavol Losonsky missed Two Point Jumper.,12,14,-2,0,0.43881566986097503,0.43881566986097503,UC Irvine,CSU Fullerton,6,6,NA,300410300,2010-02-10
71,1,8:16,1696,1696,Gerard Anderson Defensive Rebound.,12,14,-2,9,0.43881566986097503,0.43881566986097503,UC Irvine,CSU Fullerton,6,6,NA,300410300,2010-02-10
72,1,8:07,1687,1687,Devon Peltier made Three Point Jumper.  Assisted by Gerard Anderson.,12,17,-5,3,0.35033712364989256,0.35033712364989256,UC Irvine,CSU Fullerton,6,6,NA,300410300,2010-02-10
73,1,8:04,1684,1684,UC Irvine 30 Second Timeout.,12,17,-5,14,0.35013825007386695,0.35013825007386695,UC Irvine,CSU Fullerton,6,5,NA,300410300,2010-02-10
74,1,7:50,1670,1670,Darren Moore made Two Point Layup.,14,17,-3,27,0.4077014985477022,0.4077014985477022,UC Irvine,CSU Fullerton,6,5,NA,300410300,2010-02-10
75,1,7:23,1643,1643,Orane Chin made Two Point Layup.,14,19,-5,17,0.3475024902871497,0.3475024902871497,UC Irvine,CSU Fullerton,6,5,NA,300410300,2010-02-10
76,1,7:06,1626,1626,Eric Wise missed Two Point Jumper.,14,19,-5,0,0.3464418140217413,0.3464418140217413,UC Irvine,CSU Fullerton,6,5,NA,300410300,2010-02-10
77,1,7:06,1626,1626,Bryce Webster Defensive Rebound.,14,19,-5,10,0.3464418140217413,0.3464418140217413,UC Irvine,CSU Fullerton,6,5,NA,300410300,2010-02-10
78,1,6:56,1616,1616,Orane Chin missed Two Point Jumper.,14,19,-5,0,0.34582284575371014,0.34582284575371014,UC Irvine,CSU Fullerton,6,5,NA,300410300,2010-02-10
79,1,6:56,1616,1616,Zack Atkinson Block.,14,19,-5,1,0.34582284575371014,0.34582284575371014,UC Irvine,CSU Fullerton,6,5,NA,300410300,2010-02-10
80,1,6:55,1615,1615,Gerard Anderson Offensive Rebound.,14,19,-5,3,0.34576108660436666,0.34576108660436666,UC Irvine,CSU Fullerton,6,5,NA,300410300,2010-02-10
81,1,6:52,1612,1612,Gerard Anderson made Two Point Layup.,14,21,-7,22,0.29029319892931504,0.29029319892931504,UC Irvine,CSU Fullerton,6,5,NA,300410300,2010-02-10
82,1,6:30,1590,1590,Eric Wise made Two Point Jumper.  Assisted by Darren Moore.,16,21,-5,0,0.3442203757649223,0.3442203757649223,UC Irvine,CSU Fullerton,6,5,NA,300410300,2010-02-10
83,1,6:30,1590,1590,Foul on Orane Chin,16,21,-5,0,0.3442203757649223,0.3442203757649223,UC Irvine,CSU Fullerton,6,5,NA,300410300,2010-02-10
84,1,6:30,1590,1590,Official TV Timeout.,16,21,-5,0,0.3442203757649223,0.3442203757649223,UC Irvine,CSU Fullerton,6,5,NA,300410300,2010-02-10
85,1,6:30,1590,1590,Eric Wise made Free Throw.,17,21,-4,14,0.37387367579679637,0.37387367579679637,UC Irvine,CSU Fullerton,6,5,NA,300410300,2010-02-10
86,1,6:16,1576,1576,Jer'Vaughn Johnson missed Two Point Jumper.,17,21,-4,0,0.3731562491513981,0.3731562491513981,UC Irvine,CSU Fullerton,6,5,NA,300410300,2010-02-10
87,1,6:16,1576,1576,Eric Wise Defensive Rebound.,17,21,-4,18,0.3731562491513981,0.3731562491513981,UC Irvine,CSU Fullerton,6,5,NA,300410300,2010-02-10
88,1,5:58,1558,1558,Eric Wise missed Two Point Jumper.,17,21,-4,0,0.37222621910240133,0.37222621910240133,UC Irvine,CSU Fullerton,6,5,NA,300410300,2010-02-10
89,1,5:58,1558,1558,Jamel McGuire Defensive Rebound.,17,21,-4,11,0.37222621910240133,0.37222621910240133,UC Irvine,CSU Fullerton,6,5,NA,300410300,2010-02-10
90,1,5:47,1547,1547,Orane Chin missed Two Point Jumper.,17,21,-4,0,0.3716513033945313,0.3716513033945313,UC Irvine,CSU Fullerton,6,5,NA,300410300,2010-02-10
91,1,5:47,1547,1547,Darren Moore Defensive Rebound.,17,21,-4,12,0.3716513033945313,0.3716513033945313,UC Irvine,CSU Fullerton,6,5,NA,300410300,2010-02-10
92,1,5:35,1535,1535,Michael Hunter missed Three Point Jumper.,17,21,-4,0,0.37101651812761693,0.37101651812761693,UC Irvine,CSU Fullerton,6,5,NA,300410300,2010-02-10
93,1,5:35,1535,1535,Jer'Vaughn Johnson Defensive Rebound.,17,21,-4,23,0.37101651812761693,0.37101651812761693,UC Irvine,CSU Fullerton,6,5,NA,300410300,2010-02-10
94,1,5:12,1512,1512,Devon Peltier missed Three Point Jumper.,17,21,-4,0,0.36977139179168356,0.36977139179168356,UC Irvine,CSU Fullerton,6,5,NA,300410300,2010-02-10
95,1,5:12,1512,1512,Orane Chin Offensive Rebound.,17,21,-4,1,0.36977139179168356,0.36977139179168356,UC Irvine,CSU Fullerton,6,5,NA,300410300,2010-02-10
96,1,5:11,1511,1511,Foul on Zack Atkinson,17,21,-4,9,0.3697162615797871,0.3697162615797871,UC Irvine,CSU Fullerton,6,5,NA,300410300,2010-02-10
97,1,5:02,1502,1502,Jamel McGuire Turnover.,17,21,-4,14,0.36921586098251286,0.36921586098251286,UC Irvine,CSU Fullerton,6,5,NA,300410300,2010-02-10
98,1,4:48,1488,1488,Patrick Rembert missed Two Point Jumper.,17,21,-4,0,0.3684210339206283,0.3684210339206283,UC Irvine,CSU Fullerton,6,5,NA,300410300,2010-02-10
99,1,4:48,1488,1488,Devon Peltier Defensive Rebound.,17,21,-4,5,0.3684210339206283,0.3684210339206283,UC Irvine,CSU Fullerton,6,5,NA,300410300,2010-02-10
100,1,4:43,1483,1483,Foul on Jonas Lalehzadeh,17,21,-4,0,0.3681318755319342,0.3681318755319342,UC Irvine,CSU Fullerton,6,5,NA,300410300,2010-02-10
101,1,4:43,1483,1483,Jamel McGuire made Free Throw.,17,22,-5,0,0.33731124595055595,0.33731124595055595,UC Irvine,CSU Fullerton,6,5,NA,300410300,2010-02-10
102,1,4:43,1483,1483,Jamel McGuire missed Free Throw.,17,22,-5,0,0.33731124595055595,0.33731124595055595,UC Irvine,CSU Fullerton,6,5,NA,300410300,2010-02-10
103,1,4:43,1483,1483,Orane Chin Offensive Rebound.,17,22,-5,11,0.33731124595055595,0.33731124595055595,UC Irvine,CSU Fullerton,6,5,NA,300410300,2010-02-10
104,1,4:32,1472,1472,Aaron Thompson Turnover.,17,22,-5,21,0.33653441545588614,0.33653441545588614,UC Irvine,CSU Fullerton,6,5,NA,300410300,2010-02-10
105,1,4:11,1451,1451,Foul on Jer'Vaughn Johnson,17,22,-5,0,0.33499833528655604,0.33499833528655604,UC Irvine,CSU Fullerton,6,5,NA,300410300,2010-02-10
106,1,4:11,1451,1451,Eric Wise missed Free Throw.,17,22,-5,0,0.33499833528655604,0.33499833528655604,UC Irvine,CSU Fullerton,6,5,NA,300410300,2010-02-10
107,1,4:11,1451,1451,null,17,22,-5,0,0.33499833528655604,0.33499833528655604,UC Irvine,CSU Fullerton,6,5,NA,300410300,2010-02-10
108,1,4:11,1451,1451,Eric Wise made Free Throw.,18,22,-4,13,0.36620525234806584,0.36620525234806584,UC Irvine,CSU Fullerton,6,5,NA,300410300,2010-02-10
109,1,3:58,1438,1438,Devon Peltier missed Two Point Jumper.,18,22,-4,0,0.3654017424380529,0.3654017424380529,UC Irvine,CSU Fullerton,6,5,NA,300410300,2010-02-10
110,1,3:58,1438,1438,Darren Moore Defensive Rebound.,18,22,-4,15,0.3654017424380529,0.3654017424380529,UC Irvine,CSU Fullerton,6,5,NA,300410300,2010-02-10
111,1,3:43,1423,1423,Darren Moore missed Three Point Jumper.,18,22,-4,0,0.3645012181050987,0.3645012181050987,UC Irvine,CSU Fullerton,6,5,NA,300410300,2010-02-10
112,1,3:43,1423,1423,Aaron Thompson Defensive Rebound.,18,22,-4,11,0.3645012181050987,0.3645012181050987,UC Irvine,CSU Fullerton,6,5,NA,300410300,2010-02-10
113,1,3:32,1412,1412,Orane Chin made Two Point Dunk Shot.  Assisted by Jer'Vaughn Johnson.,18,24,-6,22,0.3019556447191385,0.3019556447191385,UC Irvine,CSU Fullerton,6,5,NA,300410300,2010-02-10
114,1,3:10,1390,1390,Foul on Jer'Vaughn Johnson,18,24,-6,0,0.3002302506750338,0.3002302506750338,UC Irvine,CSU Fullerton,6,5,NA,300410300,2010-02-10
115,1,3:10,1390,1390,Official TV Timeout.,18,24,-6,0,0.3002302506750338,0.3002302506750338,UC Irvine,CSU Fullerton,6,5,NA,300410300,2010-02-10
116,1,3:10,1390,1390,Eric Wise made Free Throw.,19,24,-5,0,0.33066740061447397,0.33066740061447397,UC Irvine,CSU Fullerton,6,5,NA,300410300,2010-02-10
117,1,3:10,1390,1390,Eric Wise made Free Throw.,20,24,-4,28,0.3625913694567498,0.3625913694567498,UC Irvine,CSU Fullerton,6,5,NA,300410300,2010-02-10
118,1,2:42,1362,1362,Bryce Webster made Two Point Layup.  Assisted by Aaron Thompson.,20,26,-6,15,0.298073880691556,0.298073880691556,UC Irvine,CSU Fullerton,6,5,NA,300410300,2010-02-10
119,1,2:27,1347,1347,Adam Folker missed Two Point Jumper.,20,26,-6,0,0.296919577063366,0.296919577063366,UC Irvine,CSU Fullerton,6,5,NA,300410300,2010-02-10
120,1,2:27,1347,1347,Jacques Streeter Defensive Rebound.,20,26,-6,13,0.296919577063366,0.296919577063366,UC Irvine,CSU Fullerton,6,5,NA,300410300,2010-02-10
121,1,2:14,1334,1334,Orane Chin missed Two Point Jumper.,20,26,-6,0,0.29591135028213666,0.29591135028213666,UC Irvine,CSU Fullerton,6,5,NA,300410300,2010-02-10
122,1,2:14,1334,1334,Cal State Fullerton Offensive Re.,20,26,-6,2,0.29591135028213666,0.29591135028213666,UC Irvine,CSU Fullerton,6,5,NA,300410300,2010-02-10
123,1,2:12,1332,1332,Orane Chin Turnover.,20,26,-6,14,0.29575522834836887,0.29575522834836887,UC Irvine,CSU Fullerton,6,5,NA,300410300,2010-02-10
124,1,1:58,1318,1318,Eric Wise missed Two Point Jumper.,20,26,-6,0,0.2946522181676971,0.2946522181676971,UC Irvine,CSU Fullerton,6,5,NA,300410300,2010-02-10
125,1,1:58,1318,1318,Aaron Thompson Defensive Rebound.,20,26,-6,8,0.2946522181676971,0.2946522181676971,UC Irvine,CSU Fullerton,6,5,NA,300410300,2010-02-10
126,1,1:50,1310,1310,Jacques Streeter missed Two Point Jumper.,20,26,-6,0,0.2940122568175611,0.2940122568175611,UC Irvine,CSU Fullerton,6,5,NA,300410300,2010-02-10
127,1,1:50,1310,1310,Eric Wise Defensive Rebound.,20,26,-6,23,0.2940122568175611,0.2940122568175611,UC Irvine,CSU Fullerton,6,5,NA,300410300,2010-02-10
128,1,1:27,1287,1287,Patrick Rembert made Two Point Jumper.,22,26,-4,23,0.3566183864971937,0.3566183864971937,UC Irvine,CSU Fullerton,6,5,NA,300410300,2010-02-10
129,1,1:04,1264,1264,Orane Chin made Two Point Dunk Shot.  Assisted by Jacques Streeter.,22,28,-6,33,0.2901292844059129,0.2901292844059129,UC Irvine,CSU Fullerton,6,5,NA,300410300,2010-02-10
130,1,0:31,1231,1231,Eric Wise made Two Point Layup.,24,28,-4,6,0.3528518062551774,0.3528518062551774,UC Irvine,CSU Fullerton,6,5,NA,300410300,2010-02-10
131,1,0:25,1225,1225,Cal State Fullerton 30 Second Timeout.,24,28,-4,23,0.3524084988000507,0.3524084988000507,UC Irvine,CSU Fullerton,6,4,NA,300410300,2010-02-10
132,1,0:02,1202,1202,Aaron Thompson missed Two Point Jumper.,24,28,-4,0,0.35063635532794507,0.35063635532794507,UC Irvine,CSU Fullerton,6,4,NA,300410300,2010-02-10
133,1,0:02,1202,1202,Jonas Lalehzadeh Block.,24,28,-4,1,0.35063635532794507,0.35063635532794507,UC Irvine,CSU Fullerton,6,4,NA,300410300,2010-02-10
134,1,0:01,1201,1201,Eric Wise Defensive Rebound.,24,28,-4,1,0.35055922478285695,0.35055922478285695,UC Irvine,CSU Fullerton,6,4,NA,300410300,2010-02-10
135,1,0:00,1200,1200,End of the 1st Half.,24,28,-4,0,0.3504822574627354,0.3504822574627354,UC Irvine,CSU Fullerton,6,4,NA,300410300,2010-02-10
136,2,20:00,1200,1200,PLAY,24,28,-4,21,0.3504822574627354,0.3504822574627354,UC Irvine,CSU Fullerton,6,4,NA,300410300,2010-02-10
137,2,19:39,1179,1179,Jer'Vaughn Johnson Turnover.,24,28,-4,0,0.34889917553413036,0.34889917553413036,UC Irvine,CSU Fullerton,6,4,NA,300410300,2010-02-10
138,2,19:39,1179,1179,Patrick Rembert Steal.,24,28,-4,10,0.34889917553413036,0.34889917553413036,UC Irvine,CSU Fullerton,6,4,NA,300410300,2010-02-10
139,2,19:29,1169,1169,Foul on Jer'Vaughn Johnson,24,28,-4,0,0.3481634633946635,0.3481634633946635,UC Irvine,CSU Fullerton,6,4,NA,300410300,2010-02-10
140,2,19:29,1169,1169,Eric Wise missed Free Throw.,24,28,-4,0,0.3481634633946635,0.3481634633946635,UC Irvine,CSU Fullerton,6,4,NA,300410300,2010-02-10
141,2,19:29,1169,1169,null,24,28,-4,0,0.3481634633946635,0.3481634633946635,UC Irvine,CSU Fullerton,6,4,NA,300410300,2010-02-10
142,2,19:29,1169,1169,Eric Wise made Free Throw.,25,28,-3,23,0.38453546662633836,0.38453546662633836,UC Irvine,CSU Fullerton,6,4,NA,300410300,2010-02-10
143,2,19:06,1146,1146,Foul on Eric Wise,25,28,-3,0,0.383232723394682,0.383232723394682,UC Irvine,CSU Fullerton,6,4,NA,300410300,2010-02-10
144,2,19:06,1146,1146,Bryce Webster made Free Throw.,25,29,-4,0,0.3464986280928887,0.3464986280928887,UC Irvine,CSU Fullerton,6,4,NA,300410300,2010-02-10
145,2,19:06,1146,1146,Bryce Webster missed Free Throw.,25,29,-4,0,0.3464986280928887,0.3464986280928887,UC Irvine,CSU Fullerton,6,4,NA,300410300,2010-02-10
146,2,19:06,1146,1146,Zack Atkinson Defensive Rebound.,25,29,-4,22,0.3464986280928887,0.3464986280928887,UC Irvine,CSU Fullerton,6,4,NA,300410300,2010-02-10
147,2,18:44,1124,1124,Zack Atkinson missed Two Point Jumper.,25,29,-4,0,0.34491923625887044,0.34491923625887044,UC Irvine,CSU Fullerton,6,4,NA,300410300,2010-02-10
148,2,18:44,1124,1124,Jacques Streeter Defensive Rebound.,25,29,-4,10,0.34491923625887044,0.34491923625887044,UC Irvine,CSU Fullerton,6,4,NA,300410300,2010-02-10
149,2,18:34,1114,1114,Gerard Anderson Turnover.,25,29,-4,0,0.3441983082662802,0.3441983082662802,UC Irvine,CSU Fullerton,6,4,NA,300410300,2010-02-10
150,2,18:34,1114,1114,Darren Moore Steal.,25,29,-4,23,0.3441983082662802,0.3441983082662802,UC Irvine,CSU Fullerton,6,4,NA,300410300,2010-02-10
151,2,18:11,1091,1091,Michael Hunter Turnover.,25,29,-4,2,0.3425159565078259,0.3425159565078259,UC Irvine,CSU Fullerton,6,4,NA,300410300,2010-02-10
152,2,18:09,1089,1089,Aaron Thompson Steal.,25,29,-4,1,0.3423673592607245,0.3423673592607245,UC Irvine,CSU Fullerton,6,4,NA,300410300,2010-02-10
153,2,18:08,1088,1088,Foul on Patrick Rembert,25,29,-4,0,0.3422928907482501,0.3422928907482501,UC Irvine,CSU Fullerton,6,4,NA,300410300,2010-02-10
154,2,18:08,1088,1088,Aaron Thompson made Free Throw.,25,30,-5,0,0.30653556584780967,0.30653556584780967,UC Irvine,CSU Fullerton,6,4,NA,300410300,2010-02-10
155,2,18:08,1088,1088,Aaron Thompson made Free Throw.,25,31,-6,15,0.2729633404627093,0.2729633404627093,UC Irvine,CSU Fullerton,6,4,NA,300410300,2010-02-10
156,2,17:53,1073,1073,Eric Wise Turnover.,25,31,-6,2,0.27146743315712846,0.27146743315712846,UC Irvine,CSU Fullerton,6,4,NA,300410300,2010-02-10
157,2,17:51,1071,1071,Bryce Webster Steal.,25,31,-6,18,0.27126499793430586,0.27126499793430586,UC Irvine,CSU Fullerton,6,4,NA,300410300,2010-02-10
158,2,17:33,1053,1053,Jer'Vaughn Johnson Turnover.,25,31,-6,1,0.2694050470981334,0.2694050470981334,UC Irvine,CSU Fullerton,6,4,NA,300410300,2010-02-10
159,2,17:32,1052,1052,Eric Wise Steal.,25,31,-6,4,0.2692995063287241,0.2692995063287241,UC Irvine,CSU Fullerton,6,4,NA,300410300,2010-02-10
160,2,17:28,1048,1048,Patrick Rembert made Two Point Jumper.,27,31,-4,17,0.33919298075044024,0.33919298075044024,UC Irvine,CSU Fullerton,6,4,NA,300410300,2010-02-10
161,2,17:11,1031,1031,Jer'Vaughn Johnson missed Two Point Jumper.,27,31,-4,0,0.33778154814694694,0.33778154814694694,UC Irvine,CSU Fullerton,6,4,NA,300410300,2010-02-10
162,2,17:11,1031,1031,Zack Atkinson Defensive Rebound.,27,31,-4,14,0.33778154814694694,0.33778154814694694,UC Irvine,CSU Fullerton,6,4,NA,300410300,2010-02-10
163,2,16:57,1017,1017,Darren Moore missed Two Point Jumper.,27,31,-4,0,0.3365649604331093,0.3365649604331093,UC Irvine,CSU Fullerton,6,4,NA,300410300,2010-02-10
164,2,16:57,1017,1017,Jer'Vaughn Johnson Defensive Rebound.,27,31,-4,12,0.3365649604331093,0.3365649604331093,UC Irvine,CSU Fullerton,6,4,NA,300410300,2010-02-10
165,2,16:45,1005,1005,Gerard Anderson missed Three Point Jumper.,27,31,-4,0,0.33547796761009274,0.33547796761009274,UC Irvine,CSU Fullerton,6,4,NA,300410300,2010-02-10
166,2,16:45,1005,1005,Darren Moore Defensive Rebound.,27,31,-4,14,0.33547796761009274,0.33547796761009274,UC Irvine,CSU Fullerton,6,4,NA,300410300,2010-02-10
167,2,16:31,991,991,Eric Wise missed Two Point Jumper.,27,31,-4,0,0.3341526371624293,0.3341526371624293,UC Irvine,CSU Fullerton,6,4,NA,300410300,2010-02-10
168,2,16:31,991,991,Zack Atkinson Offensive Rebound.,27,31,-4,13,0.3341526371624293,0.3341526371624293,UC Irvine,CSU Fullerton,6,4,NA,300410300,2010-02-10
169,2,16:18,978,978,Michael Hunter made Three Point Jumper.  Assisted by Patrick Rembert.,30,31,-1,15,0.4566546651542221,0.4566546651542221,UC Irvine,CSU Fullerton,6,4,NA,300410300,2010-02-10
170,2,16:03,963,963,Devon Peltier missed Three Point Jumper.,30,31,-1,0,0.4562230653066891,0.4562230653066891,UC Irvine,CSU Fullerton,6,4,NA,300410300,2010-02-10
171,2,16:03,963,963,Michael Hunter Defensive Rebound.,30,31,-1,4,0.4562230653066891,0.4562230653066891,UC Irvine,CSU Fullerton,6,4,NA,300410300,2010-02-10
