play_id,half,time_remaining_half,secs_remaining,secs_remaining_absolute,description,home_score,away_score,score_diff,play_length,win_prob,naive_win_prob,home,away,home_time_out_remaining,away_time_out_remaining,home_favored_by,game_id,date
1,1,20:00,2400,2400,PLAY,0,0,0,19,0.5,0.5,UTSA,Southern Miss,6,6,NA,400919506,2017-02-09
2,1,19:41,2381,2381,Kevin Holland missed Three Point Jumper.,0,0,0,0,0.5,0.5,UTSA,Southern Miss,6,6,NA,400919506,2017-02-09
3,1,19:41,2381,2381,Jeff Beverly Defensive Rebound.,0,0,0,23,0.5,0.5,UTSA,Southern Miss,6,6,NA,400919506,2017-02-09
4,1,19:18,2358,2358,Byron Frohnen made Layup. Assisted by Jeff Beverly.,2,0,2,27,0.5449181103473372,0.5449181103473372,UTSA,Southern Miss,6,6,NA,400919506,2017-02-09
5,1,18:51,2331,2331,Foul on Lucas O'Brien.,2,0,2,0,0.5455040576359357,0.5455040576359357,UTSA,Southern Miss,6,6,NA,400919506,2017-02-09
6,1,18:51,2331,2331,Cortez Edwards made Free Throw.,2,1,1,0,0.5227993357199084,0.5227993357199084,UTSA,Southern Miss,6,6,NA,400919506,2017-02-09
7,1,18:51,2331,2331,Cortez Edwards missed Free Throw.,2,1,1,0,0.5227993357199084,0.5227993357199084,UTSA,Southern Miss,6,6,NA,400919506,2017-02-09
8,1,18:51,2331,2331,Jeff Beverly Defensive Rebound.,2,1,1,14,0.5227993357199084,0.5227993357199084,UTSA,Southern Miss,6,6,NA,400919506,2017-02-09
9,1,18:37,2317,2317,Jeff Beverly missed Three Point Jumper.,2,1,1,0,0.5229539514536978,0.5229539514536978,UTSA,Southern Miss,6,6,NA,400919506,2017-02-09
10,1,18:37,2317,2317,Cortez Edwards Defensive Rebound.,2,1,1,17,0.5229539514536978,0.5229539514536978,UTSA,Southern Miss,6,6,NA,400919506,2017-02-09
11,1,18:20,2300,2300,Quinton Campbell made Jumper. Assisted by Cortez Edwards.,2,3,-1,30,0.4768568141568248,0.4768568141568248,UTSA,Southern Miss,6,6,NA,400919506,2017-02-09
12,1,17:50,2270,2270,Byron Frohnen missed Three Point Jumper.,2,3,-1,0,0.4765192710882224,0.4765192710882224,UTSA,Southern Miss,6,6,NA,400919506,2017-02-09
13,1,17:50,2270,2270,Cortez Edwards Defensive Rebound.,2,3,-1,16,0.4765192710882224,0.4765192710882224,UTSA,Southern Miss,6,6,NA,400919506,2017-02-09
14,1,17:34,2254,2254,Quinton Campbell missed Jumper.,2,3,-1,0,0.47633757254891607,0.47633757254891607,UTSA,Southern Miss,6,6,NA,400919506,2017-02-09
15,1,17:34,2254,2254,Giovanni De Nicolao Defensive Rebound.,2,3,-1,10,0.47633757254891607,0.47633757254891607,UTSA,Southern Miss,6,6,NA,400919506,2017-02-09
16,1,17:24,2244,2244,Giovanni De Nicolao missed Layup.,2,3,-1,0,0.4762234829712621,0.4762234829712621,UTSA,Southern Miss,6,6,NA,400919506,2017-02-09
17,1,17:24,2244,2244,Kevin Holland Defensive Rebound.,2,3,-1,12,0.4762234829712621,0.4762234829712621,UTSA,Southern Miss,6,6,NA,400919506,2017-02-09
18,1,17:12,2232,2232,Cortez Edwards Turnover.,2,3,-1,0,0.4760860834024592,0.4760860834024592,UTSA,Southern Miss,6,6,NA,400919506,2017-02-09
19,1,17:12,2232,2232,Giovanni De Nicolao Steal.,2,3,-1,9,0.4760860834024592,0.4760860834024592,UTSA,Southern Miss,6,6,NA,400919506,2017-02-09
20,1,17:03,2223,2223,Byron Frohnen Turnover.,2,3,-1,23,0.4759827071616885,0.4759827071616885,UTSA,Southern Miss,6,6,NA,400919506,2017-02-09
21,1,16:40,2200,2200,Raheem Watts made Three Point Jumper. Assisted by Quinton Campbell.,2,6,-4,14,0.4039995677486693,0.4039995677486693,UTSA,Southern Miss,6,6,NA,400919506,2017-02-09
22,1,16:26,2186,2186,Jeff Beverly missed Jumper.,2,6,-4,0,0.40337341088223816,0.40337341088223816,UTSA,Southern Miss,6,6,NA,400919506,2017-02-09
23,1,16:26,2186,2186,Cortez Edwards Defensive Rebound.,2,6,-4,16,0.40337341088223816,0.40337341088223816,UTSA,Southern Miss,6,6,NA,400919506,2017-02-09
24,1,16:10,2170,2170,Raheem Watts made Three Point Jumper. Assisted by Robert Thomas III.,2,9,-7,23,0.3339846770108887,0.3339846770108887,UTSA,Southern Miss,6,6,NA,400919506,2017-02-09
25,1,15:47,2147,2147,Giovanni De Nicolao missed Jumper.,2,9,-7,0,0.3323098754041007,0.3323098754041007,UTSA,Southern Miss,6,6,NA,400919506,2017-02-09
26,1,15:47,2147,2147,Quinton Campbell Defensive Rebound.,2,9,-7,11,0.3323098754041007,0.3323098754041007,UTSA,Southern Miss,6,6,NA,400919506,2017-02-09
27,1,15:36,2136,2136,Kevin Holland missed Three Point Jumper.,2,9,-7,0,0.33150564989247777,0.33150564989247777,UTSA,Southern Miss,6,6,NA,400919506,2017-02-09
28,1,15:36,2136,2136,Lucas O'Brien Defensive Rebound.,2,9,-7,14,0.33150564989247777,0.33150564989247777,UTSA,Southern Miss,6,6,NA,400919506,2017-02-09
29,1,15:22,2122,2122,Jeff Beverly missed Jumper.,2,9,-7,0,0.3304787977106669,0.3304787977106669,UTSA,Southern Miss,6,6,NA,400919506,2017-02-09
30,1,15:22,2122,2122,Kevin Holland Defensive Rebound.,2,9,-7,7,0.3304787977106669,0.3304787977106669,UTSA,Southern Miss,6,6,NA,400919506,2017-02-09
31,1,15:15,2115,2115,Raheem Watts made Jumper. Assisted by Cortez Edwards.,2,11,-9,20,0.28684976590728606,0.28684976590728606,UTSA,Southern Miss,6,6,NA,400919506,2017-02-09
32,1,14:55,2095,2095,Jeff Beverly made Jumper. Assisted by Gino Littles.,4,11,-7,29,0.3284871232134195,0.3284871232134195,UTSA,Southern Miss,6,6,NA,400919506,2017-02-09
33,1,14:26,2066,2066,Raheem Watts Turnover.,4,11,-7,0,0.32632955348106696,0.32632955348106696,UTSA,Southern Miss,6,6,NA,400919506,2017-02-09
34,1,14:26,2066,2066,Official TV Timeout,4,11,-7,30,0.32632955348106696,0.32632955348106696,UTSA,Southern Miss,6,6,NA,400919506,2017-02-09
35,1,13:56,2036,2036,Gino Littles made Three Point Jumper. Assisted by Austin Karrer.,7,11,-4,22,0.3965022533771168,0.3965022533771168,UTSA,Southern Miss,6,6,NA,400919506,2017-02-09
36,1,13:34,2014,2014,Quinton Campbell Turnover.,7,11,-4,12,0.3954595070586404,0.3954595070586404,UTSA,Southern Miss,6,6,NA,400919506,2017-02-09
37,1,13:22,2002,2002,Byron Frohnen made Jumper. Assisted by Gino Littles.,9,11,-2,27,0.44684919122501826,0.44684919122501826,UTSA,Southern Miss,6,6,NA,400919506,2017-02-09
38,1,12:55,1975,1975,Raheem Watts missed Three Point Jumper.,9,11,-2,0,0.44617526774321387,0.44617526774321387,UTSA,Southern Miss,6,6,NA,400919506,2017-02-09
39,1,12:55,1975,1975,Cortez Edwards Offensive Rebound.,9,11,-2,5,0.44617526774321387,0.44617526774321387,UTSA,Southern Miss,6,6,NA,400919506,2017-02-09
40,1,12:50,1970,1970,Michael Ramey missed Three Point Jumper.,9,11,-2,0,0.4460493873849512,0.4460493873849512,UTSA,Southern Miss,6,6,NA,400919506,2017-02-09
41,1,12:50,1970,1970,Jeff Beverly Defensive Rebound.,9,11,-2,16,0.4460493873849512,0.4460493873849512,UTSA,Southern Miss,6,6,NA,400919506,2017-02-09
42,1,12:34,1954,1954,Nick Allen made Three Point Jumper. Assisted by Jeff Beverly.,12,11,1,21,0.5272586698477552,0.5272586698477552,UTSA,Southern Miss,6,6,NA,400919506,2017-02-09
43,1,12:13,1933,1933,D'Angelo Richardson made Three Point Jumper. Assisted by Cortez Edwards.,12,14,-2,18,0.4451067911198845,0.4451067911198845,UTSA,Southern Miss,6,6,NA,400919506,2017-02-09
44,1,11:55,1915,1915,Jeff Beverly missed Three Point Jumper.,12,14,-2,0,0.4446431038436045,0.4446431038436045,UTSA,Southern Miss,6,6,NA,400919506,2017-02-09
45,1,11:55,1915,1915,UT San Antonio Offensive Rebound.,12,14,-2,2,0.4446431038436045,0.4446431038436045,UTSA,Southern Miss,6,6,NA,400919506,2017-02-09
46,1,11:53,1913,1913,Official TV Timeout,12,14,-2,11,0.44459165230326636,0.44459165230326636,UTSA,Southern Miss,6,6,NA,400919506,2017-02-09
47,1,11:42,1902,1902,Nick Allen missed Three Point Jumper.,12,14,-2,0,0.4443088399978549,0.4443088399978549,UTSA,Southern Miss,6,6,NA,400919506,2017-02-09
48,1,11:42,1902,1902,Austin Karrer Offensive Rebound.,12,14,-2,17,0.4443088399978549,0.4443088399978549,UTSA,Southern Miss,6,6,NA,400919506,2017-02-09
49,1,11:25,1885,1885,Nick Allen made Layup.,14,14,0,0,0.5,0.5,UTSA,Southern Miss,6,6,NA,400919506,2017-02-09
50,1,11:25,1885,1885,Foul on Bilal Abdur-Rahim.,14,14,0,0,0.5,0.5,UTSA,Southern Miss,6,6,NA,400919506,2017-02-09
51,1,11:25,1885,1885,Nick Allen made Free Throw.,15,14,1,22,0.5281529880485364,0.5281529880485364,UTSA,Southern Miss,6,6,NA,400919506,2017-02-09
52,1,11:03,1863,1863,Bilal Abdur-Rahim Turnover.,15,14,1,0,0.5284387656502132,0.5284387656502132,UTSA,Southern Miss,6,6,NA,400919506,2017-02-09
53,1,11:03,1863,1863,Giovanni De Nicolao Steal.,15,14,1,13,0.5284387656502132,0.5284387656502132,UTSA,Southern Miss,6,6,NA,400919506,2017-02-09
54,1,10:50,1850,1850,Nick Allen made Three Point Jumper. Assisted by Giovanni De Nicolao.,18,14,4,15,0.6125944530911264,0.6125944530911264,UTSA,Southern Miss,6,6,NA,400919506,2017-02-09
55,1,10:35,1835,1835,Josh Conley Turnover.,18,14,4,0,0.6133417170819088,0.6133417170819088,UTSA,Southern Miss,6,6,NA,400919506,2017-02-09
56,1,10:35,1835,1835,Giovanni De Nicolao Steal.,18,14,4,11,0.6133417170819088,0.6133417170819088,UTSA,Southern Miss,6,6,NA,400919506,2017-02-09
57,1,10:24,1824,1824,Lucas O'Brien missed Three Point Jumper.,18,14,4,0,0.6138919090707735,0.6138919090707735,UTSA,Southern Miss,6,6,NA,400919506,2017-02-09
58,1,10:24,1824,1824,Nick Allen Offensive Rebound.,18,14,4,3,0.6138919090707735,0.6138919090707735,UTSA,Southern Miss,6,6,NA,400919506,2017-02-09
59,1,10:21,1821,1821,Foul on Raheem Watts.,18,14,4,5,0.6140423435420265,0.6140423435420265,UTSA,Southern Miss,6,6,NA,400919506,2017-02-09
60,1,10:16,1816,1816,Giovanni De Nicolao missed Three Point Jumper.,18,14,4,0,0.6142934684937315,0.6142934684937315,UTSA,Southern Miss,6,6,NA,400919506,2017-02-09
61,1,10:16,1816,1816,Nick Allen Offensive Rebound.,18,14,4,20,0.6142934684937315,0.6142934684937315,UTSA,Southern Miss,6,6,NA,400919506,2017-02-09
62,1,9:56,1796,1796,Nick Allen Turnover.,18,14,4,30,0.615303657390299,0.615303657390299,UTSA,Southern Miss,6,6,NA,400919506,2017-02-09
63,1,9:26,1766,1766,Cortez Edwards missed Three Point Jumper.,18,14,4,0,0.6168399947991066,0.6168399947991066,UTSA,Southern Miss,6,6,NA,400919506,2017-02-09
64,1,9:26,1766,1766,UT San Antonio Defensive Rebound.,18,14,4,15,0.6168399947991066,0.6168399947991066,UTSA,Southern Miss,6,6,NA,400919506,2017-02-09
65,1,9:11,1751,1751,Giovanni De Nicolao missed Jumper.,18,14,4,0,0.6176197497490395,0.6176197497490395,UTSA,Southern Miss,6,6,NA,400919506,2017-02-09
66,1,9:11,1751,1751,Kevin Holland Defensive Rebound.,18,14,4,8,0.6176197497490395,0.6176197497490395,UTSA,Southern Miss,6,6,NA,400919506,2017-02-09
67,1,9:03,1743,1743,Foul on Giovanni De Nicolao.,18,14,4,0,0.6180392447856745,0.6180392447856745,UTSA,Southern Miss,6,6,NA,400919506,2017-02-09
68,1,9:03,1743,1743,Quinton Campbell made Free Throw.,18,15,3,0,0.5892644693788318,0.5892644693788318,UTSA,Southern Miss,6,6,NA,400919506,2017-02-09
69,1,9:03,1743,1743,Quinton Campbell made Free Throw.,18,16,2,18,0.559865704705386,0.559865704705386,UTSA,Southern Miss,6,6,NA,400919506,2017-02-09
70,1,8:45,1725,1725,Giovanni De Nicolao missed Three Point Jumper.,18,16,2,0,0.5603637953895624,0.5603637953895624,UTSA,Southern Miss,6,6,NA,400919506,2017-02-09
71,1,8:45,1725,1725,Raheem Watts Defensive Rebound.,18,16,2,16,0.5603637953895624,0.5603637953895624,UTSA,Southern Miss,6,6,NA,400919506,2017-02-09
72,1,8:29,1709,1709,Eddie Davis III missed Jumper.,18,16,2,0,0.5608135694543185,0.5608135694543185,UTSA,Southern Miss,6,6,NA,400919506,2017-02-09
73,1,8:29,1709,1709,Lucas O'Brien Defensive Rebound.,18,16,2,6,0.5608135694543185,0.5608135694543185,UTSA,Southern Miss,6,6,NA,400919506,2017-02-09
74,1,8:23,1703,1703,Foul on Raheem Watts.,18,16,2,0,0.5609840737456568,0.5609840737456568,UTSA,Southern Miss,6,6,NA,400919506,2017-02-09
75,1,8:23,1703,1703,Gino Littles missed Free Throw.,18,16,2,0,0.5609840737456568,0.5609840737456568,UTSA,Southern Miss,6,6,NA,400919506,2017-02-09
76,1,8:23,1703,1703,UT San Antonio Deadball Team Rebound.,18,16,2,0,0.5609840737456568,0.5609840737456568,UTSA,Southern Miss,6,6,NA,400919506,2017-02-09
77,1,8:23,1703,1703,Gino Littles missed Free Throw.,18,16,2,0,0.5609840737456568,0.5609840737456568,UTSA,Southern Miss,6,6,NA,400919506,2017-02-09
78,1,8:23,1703,1703,Raheem Watts Defensive Rebound.,18,16,2,18,0.5609840737456568,0.5609840737456568,UTSA,Southern Miss,6,6,NA,400919506,2017-02-09
79,1,8:05,1685,1685,Cortez Edwards missed Three Point Jumper.,18,16,2,0,0.5615010656287555,0.5615010656287555,UTSA,Southern Miss,6,6,NA,400919506,2017-02-09
80,1,8:05,1685,1685,Lucas O'Brien Defensive Rebound.,18,16,2,16,0.5615010656287555,0.5615010656287555,UTSA,Southern Miss,6,6,NA,400919506,2017-02-09
81,1,7:49,1669,1669,Byron Frohnen made Layup. Assisted by Giovanni De Nicolao.,20,16,4,24,0.6220350677502837,0.6220350677502837,UTSA,Southern Miss,6,6,NA,400919506,2017-02-09
82,1,7:25,1645,1645,Kevin Holland missed Three Point Jumper.,20,16,4,0,0.623301422078101,0.623301422078101,UTSA,Southern Miss,6,6,NA,400919506,2017-02-09
83,1,7:25,1645,1645,Giovanni De Nicolao Defensive Rebound.,20,16,4,15,0.623301422078101,0.623301422078101,UTSA,Southern Miss,6,6,NA,400919506,2017-02-09
84,1,7:10,1630,1630,Gino Littles missed Jumper.,20,16,4,0,0.6240784518393223,0.6240784518393223,UTSA,Southern Miss,6,6,NA,400919506,2017-02-09
85,1,7:10,1630,1630,Kevin Holland Defensive Rebound.,20,16,4,11,0.6240784518393223,0.6240784518393223,UTSA,Southern Miss,6,6,NA,400919506,2017-02-09
86,1,6:59,1619,1619,Quinton Campbell missed Layup.,20,16,4,0,0.6246436940548385,0.6246436940548385,UTSA,Southern Miss,6,6,NA,400919506,2017-02-09
87,1,6:59,1619,1619,Lucas O'Brien Block.,20,16,4,1,0.6246436940548385,0.6246436940548385,UTSA,Southern Miss,6,6,NA,400919506,2017-02-09
88,1,6:58,1618,1618,Giovanni De Nicolao Defensive Rebound.,20,16,4,6,0.6246949436117167,0.6246949436117167,UTSA,Southern Miss,6,6,NA,400919506,2017-02-09
89,1,6:52,1612,1612,Jeff Beverly missed Jumper.,20,16,4,0,0.6250020951618517,0.6250020951618517,UTSA,Southern Miss,6,6,NA,400919506,2017-02-09
90,1,6:52,1612,1612,Gino Littles Offensive Rebound.,20,16,4,6,0.6250020951618517,0.6250020951618517,UTSA,Southern Miss,6,6,NA,400919506,2017-02-09
91,1,6:46,1606,1606,Gino Littles missed Jumper.,20,16,4,0,0.6253088153575529,0.6253088153575529,UTSA,Southern Miss,6,6,NA,400919506,2017-02-09
92,1,6:46,1606,1606,Cortez Edwards Defensive Rebound.,20,16,4,10,0.6253088153575529,0.6253088153575529,UTSA,Southern Miss,6,6,NA,400919506,2017-02-09
93,1,6:36,1596,1596,Foul on Giovanni De Nicolao.,20,16,4,0,0.6258196634483154,0.6258196634483154,UTSA,Southern Miss,6,6,NA,400919506,2017-02-09
94,1,6:36,1596,1596,Raheem Watts made Free Throw.,20,17,3,0,0.5952575645806943,0.5952575645806943,UTSA,Southern Miss,6,6,NA,400919506,2017-02-09
95,1,6:36,1596,1596,Raheem Watts made Free Throw.,20,18,2,10,0.5639385686636278,0.5639385686636278,UTSA,Southern Miss,6,6,NA,400919506,2017-02-09
96,1,6:26,1586,1586,Austin Karrer missed Jumper.,20,18,2,0,0.5642070943841324,0.5642070943841324,UTSA,Southern Miss,6,6,NA,400919506,2017-02-09
97,1,6:26,1586,1586,D'Angelo Richardson Defensive Rebound.,20,18,2,8,0.5642070943841324,0.5642070943841324,UTSA,Southern Miss,6,6,NA,400919506,2017-02-09
98,1,6:18,1578,1578,D'Angelo Richardson missed Layup.,20,18,2,0,0.5644225298813833,0.5644225298813833,UTSA,Southern Miss,6,6,NA,400919506,2017-02-09
99,1,6:18,1578,1578,Byron Frohnen Defensive Rebound.,20,18,2,26,0.5644225298813833,0.5644225298813833,UTSA,Southern Miss,6,6,NA,400919506,2017-02-09
100,1,5:52,1552,1552,Jeff Beverly made Jumper.,22,18,4,13,0.6280866313511098,0.6280866313511098,UTSA,Southern Miss,6,6,NA,400919506,2017-02-09
101,1,5:39,1539,1539,Foul on Jeff Beverly.,22,18,4,3,0.6287709018954263,0.6287709018954263,UTSA,Southern Miss,6,6,NA,400919506,2017-02-09
102,1,5:36,1536,1536,Bilal Abdur-Rahim made Jumper. Assisted by D'Angelo Richardson.,22,20,2,22,0.5655739032297871,0.5655739032297871,UTSA,Southern Miss,6,6,NA,400919506,2017-02-09
103,1,5:14,1514,1514,Byron Frohnen made Layup. Assisted by Jeff Beverly.,24,20,4,10,0.6301186175913214,0.6301186175913214,UTSA,Southern Miss,6,6,NA,400919506,2017-02-09
104,1,5:04,1504,1504,Michael Ramey missed Layup.,24,20,4,0,0.6306722622711065,0.6306722622711065,UTSA,Southern Miss,6,6,NA,400919506,2017-02-09
105,1,5:04,1504,1504,Byron Frohnen Defensive Rebound.,24,20,4,13,0.6306722622711065,0.6306722622711065,UTSA,Southern Miss,6,6,NA,400919506,2017-02-09
106,1,4:51,1491,1491,Gino Littles missed Three Point Jumper.,24,20,4,0,0.6314068519975058,0.6314068519975058,UTSA,Southern Miss,6,6,NA,400919506,2017-02-09
107,1,4:51,1491,1491,Nick Allen Offensive Rebound.,24,20,4,4,0.6314068519975058,0.6314068519975058,UTSA,Southern Miss,6,6,NA,400919506,2017-02-09
108,1,4:47,1487,1487,Nick Allen missed Layup.,24,20,4,0,0.6316365649272278,0.6316365649272278,UTSA,Southern Miss,6,6,NA,400919506,2017-02-09
109,1,4:47,1487,1487,Cortez Edwards Defensive Rebound.,24,20,4,8,0.6316365649272278,0.6316365649272278,UTSA,Southern Miss,6,6,NA,400919506,2017-02-09
110,1,4:39,1479,1479,Quinton Campbell Turnover.,24,20,4,18,0.6321015946834977,0.6321015946834977,UTSA,Southern Miss,6,6,NA,400919506,2017-02-09
111,1,4:21,1461,1461,Gino Littles missed Jumper.,24,20,4,0,0.633177568510581,0.633177568510581,UTSA,Southern Miss,6,6,NA,400919506,2017-02-09
112,1,4:21,1461,1461,Quinton Campbell Defensive Rebound.,24,20,4,11,0.633177568510581,0.633177568510581,UTSA,Southern Miss,6,6,NA,400919506,2017-02-09
113,1,4:10,1450,1450,Foul on Nick Allen.,24,20,4,7,0.6338572810785399,0.6338572810785399,UTSA,Southern Miss,6,6,NA,400919506,2017-02-09
114,1,4:03,1443,1443,Robert Thomas III missed Three Point Jumper.,24,20,4,0,0.634291953889353,0.634291953889353,UTSA,Southern Miss,6,6,NA,400919506,2017-02-09
115,1,4:03,1443,1443,Austin Karrer Defensive Rebound.,24,20,4,7,0.634291953889353,0.634291953889353,UTSA,Southern Miss,6,6,NA,400919506,2017-02-09
116,1,3:56,1436,1436,Foul on Robert Thomas III.,24,20,4,0,0.6347198649195845,0.6347198649195845,UTSA,Southern Miss,6,6,NA,400919506,2017-02-09
117,1,3:56,1436,1436,Official TV Timeout,24,20,4,0,0.6347198649195845,0.6347198649195845,UTSA,Southern Miss,6,6,NA,400919506,2017-02-09
118,1,3:56,1436,1436,Austin Karrer made Free Throw.,25,20,5,0,0.6661112820788128,0.6661112820788128,UTSA,Southern Miss,6,6,NA,400919506,2017-02-09
119,1,3:56,1436,1436,Austin Karrer made Free Throw.,26,20,6,24,0.6960966488656634,0.6960966488656634,UTSA,Southern Miss,6,6,NA,400919506,2017-02-09
120,1,3:32,1412,1412,D'Angelo Richardson missed Three Point Jumper.,26,20,6,0,0.6980443552808615,0.6980443552808615,UTSA,Southern Miss,6,6,NA,400919506,2017-02-09
121,1,3:32,1412,1412,Gino Littles Defensive Rebound.,26,20,6,28,0.6980443552808615,0.6980443552808615,UTSA,Southern Miss,6,6,NA,400919506,2017-02-09
122,1,3:04,1384,1384,George Willborn III made Jumper.,28,20,8,18,0.7560633626239566,0.7560633626239566,UTSA,Southern Miss,6,6,NA,400919506,2017-02-09
123,1,2:46,1366,1366,Bilal Abdur-Rahim made Layup. Assisted by Cortez Edwards.,28,22,6,20,0.7016189490360021,0.7016189490360021,UTSA,Southern Miss,6,6,NA,400919506,2017-02-09
124,1,2:26,1346,1346,Jeff Beverly Turnover.,28,22,6,1,0.7031576427138829,0.7031576427138829,UTSA,Southern Miss,6,6,NA,400919506,2017-02-09
125,1,2:25,1345,1345,Cortez Edwards Steal.,28,22,6,3,0.7032349096001385,0.7032349096001385,UTSA,Southern Miss,6,6,NA,400919506,2017-02-09
126,1,2:22,1342,1342,Bilal Abdur-Rahim made Layup. Assisted by Cortez Edwards.,28,24,4,11,0.6401253774653898,0.6401253774653898,UTSA,Southern Miss,6,6,NA,400919506,2017-02-09
127,1,2:11,1331,1331,Jeff Beverly Turnover.,28,24,4,0,0.6407558205945588,0.6407558205945588,UTSA,Southern Miss,6,6,NA,400919506,2017-02-09
128,1,2:11,1331,1331,Robert Thomas III Steal.,28,24,4,21,0.6407558205945588,0.6407558205945588,UTSA,Southern Miss,6,6,NA,400919506,2017-02-09
129,1,1:50,1310,1310,Quinton Campbell missed Jumper.,28,24,4,0,0.6419836729220455,0.6419836729220455,UTSA,Southern Miss,6,6,NA,400919506,2017-02-09
130,1,1:50,1310,1310,Bilal Abdur-Rahim Offensive Rebound.,28,24,4,7,0.6419836729220455,0.6419836729220455,UTSA,Southern Miss,6,6,NA,400919506,2017-02-09
131,1,1:43,1303,1303,Quinton Campbell made Three Point Jumper. Assisted by Kevin Holland.,28,27,1,28,0.5365475889077026,0.5365475889077026,UTSA,Southern Miss,6,6,NA,400919506,2017-02-09
132,1,1:15,1275,1275,Jeff Beverly missed Jumper.,28,27,1,0,0.537018308236849,0.537018308236849,UTSA,Southern Miss,6,6,NA,400919506,2017-02-09
133,1,1:15,1275,1275,Bilal Abdur-Rahim Defensive Rebound.,28,27,1,6,0.537018308236849,0.537018308236849,UTSA,Southern Miss,6,6,NA,400919506,2017-02-09
134,1,1:09,1269,1269,Bilal Abdur-Rahim Turnover.,28,27,1,0,0.5371235343452395,0.5371235343452395,UTSA,Southern Miss,6,6,NA,400919506,2017-02-09
135,1,1:09,1269,1269,UT San Antonio  Timeout,28,27,1,17,0.5371235343452395,0.5371235343452395,UTSA,Southern Miss,6,5,NA,400919506,2017-02-09
136,1,0:52,1252,1252,Nick Allen missed Jumper.,28,27,1,0,0.5374316506897497,0.5374316506897497,UTSA,Southern Miss,6,5,NA,400919506,2017-02-09
137,1,0:52,1252,1252,Cortez Edwards Defensive Rebound.,28,27,1,12,0.5374316506897497,0.5374316506897497,UTSA,Southern Miss,6,5,NA,400919506,2017-02-09
138,1,0:40,1240,1240,Southern Miss  Timeout,28,27,1,9,0.5376590144097959,0.5376590144097959,UTSA,Southern Miss,6,4,NA,400919506,2017-02-09
139,1,0:31,1231,1231,Kevin Holland Turnover.,28,27,1,1,0.5378354818088573,0.5378354818088573,UTSA,Southern Miss,6,4,NA,400919506,2017-02-09
140,1,0:30,1230,1230,Nick Allen Steal.,28,27,1,21,0.5378554217190384,0.5378554217190384,UTSA,Southern Miss,6,4,NA,400919506,2017-02-09
141,1,0:09,1209,1209,Byron Frohnen Turnover.,28,27,1,1,0.5382906187011293,0.5382906187011293,UTSA,Southern Miss,6,4,NA,400919506,2017-02-09
142,1,0:08,1208,1208,Cortez Edwards Steal.,28,27,1,1,0.5383119834547322,0.5383119834547322,UTSA,Southern Miss,6,4,NA,400919506,2017-02-09
143,1,0:07,1207,1207,Foul on Lucas O'Brien.,28,27,1,5,0.5383333008966255,0.5383333008966255,UTSA,Southern Miss,6,4,NA,400919506,2017-02-09
144,1,0:02,1202,1202,Foul on George Willborn III.,28,27,1,0,0.5384392022206768,0.5384392022206768,UTSA,Southern Miss,6,4,NA,400919506,2017-02-09
145,1,0:02,1202,1202,Cortez Edwards missed Free Throw.,28,27,1,0,0.5384392022206768,0.5384392022206768,UTSA,Southern Miss,6,4,NA,400919506,2017-02-09
146,1,0:02,1202,1202,Southern Miss Deadball Team Rebound.,28,27,1,0,0.5384392022206768,0.5384392022206768,UTSA,Southern Miss,6,4,NA,400919506,2017-02-09
147,1,0:02,1202,1202,Cortez Edwards made Free Throw.,28,28,0,2,0.5,0.5,UTSA,Southern Miss,6,4,NA,400919506,2017-02-09
148,1,0:00,1200,1200,End of 1st half,28,28,0,0,0.5,0.5,UTSA,Southern Miss,6,4,NA,400919506,2017-02-09
149,2,20:00,1200,1200,PLAY,28,28,0,11,0.5,0.5,UTSA,Southern Miss,6,4,NA,400919506,2017-02-09
150,2,19:49,1189,1189,Giovanni De Nicolao missed Three Point Jumper.,28,28,0,0,0.5,0.5,UTSA,Southern Miss,6,4,NA,400919506,2017-02-09
151,2,19:49,1189,1189,Jeff Beverly Offensive Rebound.,28,28,0,3,0.5,0.5,UTSA,Southern Miss,6,4,NA,400919506,2017-02-09
152,2,19:46,1186,1186,Jeff Beverly made Layup.,30,28,2,23,0.5770790200854459,0.5770790200854459,UTSA,Southern Miss,6,4,NA,400919506,2017-02-09
153,2,19:23,1163,1163,Cortez Edwards made Jumper.,30,30,0,20,0.5,0.5,UTSA,Southern Miss,6,4,NA,400919506,2017-02-09
154,2,19:03,1143,1143,Jeff Beverly made Jumper.,32,30,2,14,0.5787657755281814,0.5787657755281814,UTSA,Southern Miss,6,4,NA,400919506,2017-02-09
155,2,18:49,1129,1129,Raheem Watts missed Jumper.,32,30,2,0,0.5793070405874436,0.5793070405874436,UTSA,Southern Miss,6,4,NA,400919506,2017-02-09
156,2,18:49,1129,1129,Byron Frohnen Defensive Rebound.,32,30,2,16,0.5793070405874436,0.5793070405874436,UTSA,Southern Miss,6,4,NA,400919506,2017-02-09
157,2,18:33,1113,1113,Giovanni De Nicolao missed Jumper.,32,30,2,0,0.5799286487915525,0.5799286487915525,UTSA,Southern Miss,6,4,NA,400919506,2017-02-09
158,2,18:33,1113,1113,Lucas O'Brien Offensive Rebound.,32,30,2,15,0.5799286487915525,0.5799286487915525,UTSA,Southern Miss,6,4,NA,400919506,2017-02-09
159,2,18:18,1098,1098,Foul on Quinton Campbell.,32,30,2,4,0.5805189662343905,0.5805189662343905,UTSA,Southern Miss,6,4,NA,400919506,2017-02-09
160,2,18:14,1094,1094,Jeff Beverly missed Jumper.,32,30,2,0,0.5806782081759659,0.5806782081759659,UTSA,Southern Miss,6,4,NA,400919506,2017-02-09
161,2,18:14,1094,1094,Raheem Watts Defensive Rebound.,32,30,2,25,0.5806782081759659,0.5806782081759659,UTSA,Southern Miss,6,4,NA,400919506,2017-02-09
162,2,17:49,1069,1069,Cortez Edwards missed Three Point Jumper.,32,30,2,0,0.5816979142722571,0.5816979142722571,UTSA,Southern Miss,6,4,NA,400919506,2017-02-09
163,2,17:49,1069,1069,Gino Littles Defensive Rebound.,32,30,2,13,0.5816979142722571,0.5816979142722571,UTSA,Southern Miss,6,4,NA,400919506,2017-02-09
164,2,17:36,1056,1056,Lucas O'Brien missed Three Point Jumper.,32,30,2,0,0.5822493909492018,0.5822493909492018,UTSA,Southern Miss,6,4,NA,400919506,2017-02-09
165,2,17:36,1056,1056,Kevin Holland Defensive Rebound.,32,30,2,13,0.5822493909492018,0.5822493909492018,UTSA,Southern Miss,6,4,NA,400919506,2017-02-09
166,2,17:23,1043,1043,Foul on Byron Frohnen.,32,30,2,0,0.5828191864270778,0.5828191864270778,UTSA,Southern Miss,6,4,NA,400919506,2017-02-09
167,2,17:23,1043,1043,Raheem Watts made Free Throw.,32,31,1,0,0.5416975867879851,0.5416975867879851,UTSA,Southern Miss,6,4,NA,400919506,2017-02-09
168,2,17:23,1043,1043,Raheem Watts made Free Throw.,32,32,0,19,0.5,0.5,UTSA,Southern Miss,6,4,NA,400919506,2017-02-09
169,2,17:04,1024,1024,Giovanni De Nicolao missed Layup.,32,32,0,0,0.5,0.5,UTSA,Southern Miss,6,4,NA,400919506,2017-02-09
170,2,17:04,1024,1024,Kevin Holland Defensive Rebound.,32,32,0,23,0.5,0.5,UTSA,Southern Miss,6,4,NA,400919506,2017-02-09
171,2,16:41,1001,1001,Kevin Holland missed Layup.,32,32,0,0,0.5,0.5,UTSA,Southern Miss,6,4,NA,400919506,2017-02-09
172,2,16:41,1001,1001,Lucas O'Brien Block.,32,32,0,0,0.5,0.5,UTSA,Southern Miss,6,4,NA,400919506,2017-02-09
173,2,16:41,1001,1001,Southern Miss Offensive Rebound.,32,32,0,4,0.5,0.5,UTSA,Southern Miss,6,4,NA,400919506,2017-02-09
174,2,16:37,997,997,Quinton Campbell made Three Point Jumper. Assisted by Cortez Edwards.,32,35,-3,22,0.37398551027969906,0.37398551027969906,UTSA,Southern Miss,6,4,NA,400919506,2017-02-09
