play_id,half,time_remaining_half,secs_remaining,secs_remaining_absolute,description,home_score,away_score,score_diff,play_length,win_prob,naive_win_prob,home,away,home_time_out_remaining,away_time_out_remaining,home_favored_by,game_id,date
1,1,20:00,2400,2400,PLAY,0,0,0,13,0.5,0.5,Washington State,Oregon,4,4,NA,280730265,2008-03-13
2,1,19:47,2387,2387,Taylor Rochestie made Two Point Jumper.,2,0,2,31,0.5442995799775542,0.5442995799775542,Washington State,Oregon,4,4,NA,280730265,2008-03-13
3,1,19:16,2356,2356,Foul on Malik Hairston,2,0,2,8,0.5449611943204852,0.5449611943204852,Washington State,Oregon,4,4,NA,280730265,2008-03-13
4,1,19:08,2348,2348,Robbie Cowgill missed Two Point Jumper.,2,0,2,0,0.5451340534009399,0.5451340534009399,Washington State,Oregon,4,4,NA,280730265,2008-03-13
5,1,19:08,2348,2348,Malik Hairston Defensive Rebound.,2,0,2,9,0.5451340534009399,0.5451340534009399,Washington State,Oregon,4,4,NA,280730265,2008-03-13
6,1,18:59,2339,2339,Maarty Leunen missed Three Point Jumper.,2,0,2,0,0.5453294949396444,0.5453294949396444,Washington State,Oregon,4,4,NA,280730265,2008-03-13
7,1,18:59,2339,2339,Taylor Rochestie Defensive Rebound.,2,0,2,14,0.5453294949396444,0.5453294949396444,Washington State,Oregon,4,4,NA,280730265,2008-03-13
8,1,18:45,2325,2325,Taylor Rochestie made Three Point Jumper.,5,0,5,34,0.6124514094550819,0.6124514094550819,Washington State,Oregon,4,4,NA,280730265,2008-03-13
9,1,18:11,2291,2291,Tajuan Porter made Three Point Jumper.,5,3,2,35,0.546387725577138,0.546387725577138,Washington State,Oregon,4,4,NA,280730265,2008-03-13
10,1,17:36,2256,2256,Derrick Low made Three Point Jumper.  Assisted by Kyle Weaver.,8,3,5,3,0.6161280761992316,0.6161280761992316,Washington State,Oregon,4,4,NA,280730265,2008-03-13
11,1,17:33,2253,2253,Oregon 30 Second Timeout.,8,3,5,22,0.6162900219067821,0.6162900219067821,Washington State,Oregon,3,4,NA,280730265,2008-03-13
12,1,17:11,2231,2231,Maarty Leunen made Two Point Jumper.,8,5,3,0,0.571340903168176,0.571340903168176,Washington State,Oregon,3,4,NA,280730265,2008-03-13
13,1,17:11,2231,2231,Foul on Aron Baynes,8,5,3,0,0.571340903168176,0.571340903168176,Washington State,Oregon,3,4,NA,280730265,2008-03-13
14,1,17:11,2231,2231,Maarty Leunen missed Free Throw.,8,5,3,0,0.571340903168176,0.571340903168176,Washington State,Oregon,3,4,NA,280730265,2008-03-13
15,1,17:11,2231,2231,Derrick Low Defensive Rebound.,8,5,3,29,0.571340903168176,0.571340903168176,Washington State,Oregon,3,4,NA,280730265,2008-03-13
16,1,16:42,2202,2202,Derrick Low missed Two Point Layup.,8,5,3,0,0.5723247616780326,0.5723247616780326,Washington State,Oregon,3,4,NA,280730265,2008-03-13
17,1,16:42,2202,2202,Malik Hairston Defensive Rebound.,8,5,3,14,0.5723247616780326,0.5723247616780326,Washington State,Oregon,3,4,NA,280730265,2008-03-13
18,1,16:28,2188,2188,Tajuan Porter missed Three Point Jumper.,8,5,3,0,0.5728020015994195,0.5728020015994195,Washington State,Oregon,3,4,NA,280730265,2008-03-13
19,1,16:28,2188,2188,Daven Harmeling Defensive Rebound.,8,5,3,12,0.5728020015994195,0.5728020015994195,Washington State,Oregon,3,4,NA,280730265,2008-03-13
20,1,16:16,2176,2176,Kyle Weaver made Two Point Layup.,10,5,5,24,0.620486538992012,0.620486538992012,Washington State,Oregon,3,4,NA,280730265,2008-03-13
21,1,15:52,2152,2152,Bryce Taylor missed Two Point Jumper.,10,5,5,0,0.6218065407611573,0.6218065407611573,Washington State,Oregon,3,4,NA,280730265,2008-03-13
22,1,15:52,2152,2152,Bryce Taylor Offensive Rebound.,10,5,5,19,0.6218065407611573,0.6218065407611573,Washington State,Oregon,3,4,NA,280730265,2008-03-13
23,1,15:33,2133,2133,Daven Harmeling made Two Point Layup.,12,5,7,26,0.6687140721409836,0.6687140721409836,Washington State,Oregon,3,4,NA,280730265,2008-03-13
24,1,15:07,2107,2107,Foul on Bryce Taylor,12,5,7,0,0.6706257665895119,0.6706257665895119,Washington State,Oregon,3,4,NA,280730265,2008-03-13
25,1,15:07,2107,2107,Official TV Timeout.,12,5,7,0,0.6706257665895119,0.6706257665895119,Washington State,Oregon,3,4,NA,280730265,2008-03-13
26,1,15:07,2107,2107,Kyle Weaver made Free Throw.,13,5,8,0,0.6926612436867073,0.6926612436867073,Washington State,Oregon,3,4,NA,280730265,2008-03-13
27,1,15:07,2107,2107,Kyle Weaver made Free Throw.,14,5,9,30,0.713851547465921,0.713851547465921,Washington State,Oregon,3,4,NA,280730265,2008-03-13
28,1,14:37,2077,2077,Foul on Tajuan Porter,14,5,9,23,0.7164929458268391,0.7164929458268391,Washington State,Oregon,3,4,NA,280730265,2008-03-13
29,1,14:14,2054,2054,Foul on Drew Viney,14,5,9,7,0.7185315357979488,0.7185315357979488,Washington State,Oregon,3,4,NA,280730265,2008-03-13
30,1,14:07,2047,2047,Robbie Cowgill made Two Point Dunk Shot.,16,5,11,20,0.7593685686383168,0.7593685686383168,Washington State,Oregon,3,4,NA,280730265,2008-03-13
31,1,13:47,2027,2027,Tajuan Porter missed Three Point Jumper.,16,5,11,0,0.7613427483956762,0.7613427483956762,Washington State,Oregon,3,4,NA,280730265,2008-03-13
32,1,13:47,2027,2027,Daven Harmeling Defensive Rebound.,16,5,11,23,0.7613427483956762,0.7613427483956762,Washington State,Oregon,3,4,NA,280730265,2008-03-13
33,1,13:24,2004,2004,Derrick Low missed Two Point Layup.,16,5,11,0,0.7636236854789532,0.7636236854789532,Washington State,Oregon,3,4,NA,280730265,2008-03-13
34,1,13:24,2004,2004,Maarty Leunen Defensive Rebound.,16,5,11,5,0.7636236854789532,0.7636236854789532,Washington State,Oregon,3,4,NA,280730265,2008-03-13
35,1,13:19,1999,1999,Foul on Kyle Weaver,16,5,11,0,0.7641211477778365,0.7641211477778365,Washington State,Oregon,3,4,NA,280730265,2008-03-13
36,1,13:19,1999,1999,LeKendric Longmire missed Free Throw.,16,5,11,0,0.7641211477778365,0.7641211477778365,Washington State,Oregon,3,4,NA,280730265,2008-03-13
37,1,13:19,1999,1999,null,16,5,11,0,0.7641211477778365,0.7641211477778365,Washington State,Oregon,3,4,NA,280730265,2008-03-13
38,1,13:19,1999,1999,LeKendric Longmire made Free Throw.,16,6,10,21,0.7443215891980225,0.7443215891980225,Washington State,Oregon,3,4,NA,280730265,2008-03-13
39,1,12:58,1978,1978,Foul on Malik Hairston,16,6,10,11,0.7463344539219667,0.7463344539219667,Washington State,Oregon,3,4,NA,280730265,2008-03-13
40,1,12:47,1967,1967,Kyle Weaver missed Two Point Layup.,16,6,10,0,0.7473939072142287,0.7473939072142287,Washington State,Oregon,3,4,NA,280730265,2008-03-13
41,1,12:47,1967,1967,Joevan Catron Defensive Rebound.,16,6,10,21,0.7473939072142287,0.7473939072142287,Washington State,Oregon,3,4,NA,280730265,2008-03-13
42,1,12:26,1946,1946,Kyle Weaver missed Three Point Jumper.,16,6,10,0,0.74942673567412,0.74942673567412,Washington State,Oregon,3,4,NA,280730265,2008-03-13
43,1,12:26,1946,1946,Malik Hairston Defensive Rebound.,16,6,10,23,0.74942673567412,0.74942673567412,Washington State,Oregon,3,4,NA,280730265,2008-03-13
44,1,12:03,1923,1923,Kamyron Brown made Two Point Jumper.,16,8,8,31,0.7080682011820075,0.7080682011820075,Washington State,Oregon,3,4,NA,280730265,2008-03-13
45,1,11:32,1892,1892,Aron Baynes made Two Point Layup.,18,8,10,9,0.7546684930712895,0.7546684930712895,Washington State,Oregon,3,4,NA,280730265,2008-03-13
46,1,11:23,1883,1883,Maarty Leunen missed Two Point Jumper.,18,8,10,0,0.7555348567003325,0.7555348567003325,Washington State,Oregon,3,4,NA,280730265,2008-03-13
47,1,11:23,1883,1883,Kyle Weaver Defensive Rebound.,18,8,10,26,0.7555348567003325,0.7555348567003325,Washington State,Oregon,3,4,NA,280730265,2008-03-13
48,1,10:57,1857,1857,Taylor Rochestie made Two Point Jumper.,20,8,12,15,0.7974282227853499,0.7974282227853499,Washington State,Oregon,3,4,NA,280730265,2008-03-13
49,1,10:42,1842,1842,Foul on Aron Baynes,20,8,12,0,0.798947201128561,0.798947201128561,Washington State,Oregon,3,4,NA,280730265,2008-03-13
50,1,10:42,1842,1842,Official TV Timeout.,20,8,12,0,0.798947201128561,0.798947201128561,Washington State,Oregon,3,4,NA,280730265,2008-03-13
51,1,10:42,1842,1842,Malik Hairston made Free Throw.,20,9,11,0,0.7798427155207698,0.7798427155207698,Washington State,Oregon,3,4,NA,280730265,2008-03-13
52,1,10:42,1842,1842,Malik Hairston made Free Throw.,20,10,10,22,0.7594694075594922,0.7594694075594922,Washington State,Oregon,3,4,NA,280730265,2008-03-13
53,1,10:20,1820,1820,Robbie Cowgill missed Two Point Jumper.,20,10,10,0,0.7615815534960187,0.7615815534960187,Washington State,Oregon,3,4,NA,280730265,2008-03-13
54,1,10:20,1820,1820,Mitch Platt Defensive Rebound.,20,10,10,48,0.7615815534960187,0.7615815534960187,Washington State,Oregon,3,4,NA,280730265,2008-03-13
55,1,9:32,1772,1772,Derrick Low missed Three Point Jumper.,20,10,10,0,0.7662252638150767,0.7662252638150767,Washington State,Oregon,3,4,NA,280730265,2008-03-13
56,1,9:32,1772,1772,Washington State Offensive Rebou.,20,10,10,19,0.7662252638150767,0.7662252638150767,Washington State,Oregon,3,4,NA,280730265,2008-03-13
57,1,9:13,1753,1753,Foul on Bryce Taylor,20,10,10,10,0.7680864818169705,0.7680864818169705,Washington State,Oregon,3,4,NA,280730265,2008-03-13
58,1,9:03,1743,1743,Derrick Low made Two Point Layup.  Assisted by Caleb Forrest.,22,10,12,0,0.8090273145492878,0.8090273145492878,Washington State,Oregon,3,4,NA,280730265,2008-03-13
59,1,9:03,1743,1743,Foul on LeKendric Longmire,22,10,12,0,0.8090273145492878,0.8090273145492878,Washington State,Oregon,3,4,NA,280730265,2008-03-13
60,1,9:03,1743,1743,Derrick Low missed Free Throw.,22,10,12,0,0.8090273145492878,0.8090273145492878,Washington State,Oregon,3,4,NA,280730265,2008-03-13
61,1,9:03,1743,1743,Joevan Catron Defensive Rebound.,22,10,12,5,0.8090273145492878,0.8090273145492878,Washington State,Oregon,3,4,NA,280730265,2008-03-13
62,1,8:58,1738,1738,Bryce Taylor missed Three Point Jumper.,22,10,12,0,0.8095443198579747,0.8095443198579747,Washington State,Oregon,3,4,NA,280730265,2008-03-13
63,1,8:58,1738,1738,Washington State Defensive Rebou.,22,10,12,46,0.8095443198579747,0.8095443198579747,Washington State,Oregon,3,4,NA,280730265,2008-03-13
64,1,8:12,1692,1692,Tajuan Porter missed Two Point Jumper.,22,10,12,0,0.8143647013775206,0.8143647013775206,Washington State,Oregon,3,4,NA,280730265,2008-03-13
65,1,8:12,1692,1692,Caleb Forrest Defensive Rebound.,22,10,12,33,0.8143647013775206,0.8143647013775206,Washington State,Oregon,3,4,NA,280730265,2008-03-13
66,1,7:39,1659,1659,Official TV Timeout.,22,10,12,4,0.8177791628028704,0.8177791628028704,Washington State,Oregon,3,4,NA,280730265,2008-03-13
67,1,7:35,1655,1655,Taylor Rochestie made Two Point Layup.,24,10,14,20,0.8525502165240432,0.8525502165240432,Washington State,Oregon,3,4,NA,280730265,2008-03-13
68,1,7:15,1635,1635,Maarty Leunen made Three Point Jumper.  Assisted by LeKendric Longmire.,24,13,11,19,0.8007419913886024,0.8007419913886024,Washington State,Oregon,3,4,NA,280730265,2008-03-13
69,1,6:56,1616,1616,Robbie Cowgill made Two Point Dunk Shot.,26,13,13,25,0.8398851846855633,0.8398851846855633,Washington State,Oregon,3,4,NA,280730265,2008-03-13
70,1,6:31,1591,1591,Bryce Taylor made Two Point Jumper.  Assisted by Joevan Catron.,26,15,11,33,0.8049294470579613,0.8049294470579613,Washington State,Oregon,3,4,NA,280730265,2008-03-13
71,1,5:58,1558,1558,Derrick Low made Three Point Jumper.,29,15,14,16,0.8616870558717754,0.8616870558717754,Washington State,Oregon,3,4,NA,280730265,2008-03-13
72,1,5:42,1542,1542,Maarty Leunen missed Three Point Jumper.,29,15,14,0,0.8631775175105739,0.8631775175105739,Washington State,Oregon,3,4,NA,280730265,2008-03-13
73,1,5:42,1542,1542,Derrick Low Defensive Rebound.,29,15,14,22,0.8631775175105739,0.8631775175105739,Washington State,Oregon,3,4,NA,280730265,2008-03-13
74,1,5:20,1520,1520,Foul on Joevan Catron,29,15,14,0,0.865252305207374,0.865252305207374,Washington State,Oregon,3,4,NA,280730265,2008-03-13
75,1,5:20,1520,1520,Caleb Forrest missed Free Throw.,29,15,14,0,0.865252305207374,0.865252305207374,Washington State,Oregon,3,4,NA,280730265,2008-03-13
76,1,5:20,1520,1520,Churchill Odia Defensive Rebound.,29,15,14,7,0.865252305207374,0.865252305207374,Washington State,Oregon,3,4,NA,280730265,2008-03-13
77,1,5:13,1513,1513,Malik Hairston made Two Point Layup.,29,17,12,26,0.8318624185612784,0.8318624185612784,Washington State,Oregon,3,4,NA,280730265,2008-03-13
78,1,4:47,1487,1487,Robbie Cowgill missed Two Point Layup.,29,17,12,0,0.8344821600176027,0.8344821600176027,Washington State,Oregon,3,4,NA,280730265,2008-03-13
79,1,4:47,1487,1487,Robbie Cowgill Offensive Rebound.,29,17,12,3,0.8344821600176027,0.8344821600176027,Washington State,Oregon,3,4,NA,280730265,2008-03-13
80,1,4:44,1484,1484,Robbie Cowgill made Two Point Layup.,31,17,14,9,0.8687514823276095,0.8687514823276095,Washington State,Oregon,3,4,NA,280730265,2008-03-13
81,1,4:35,1475,1475,Malik Hairston missed Three Point Jumper.,31,17,14,0,0.8696531662443282,0.8696531662443282,Washington State,Oregon,3,4,NA,280730265,2008-03-13
82,1,4:35,1475,1475,Taylor Rochestie Defensive Rebound.,31,17,14,29,0.8696531662443282,0.8696531662443282,Washington State,Oregon,3,4,NA,280730265,2008-03-13
83,1,4:06,1446,1446,Caleb Forrest missed Two Point Layup.,31,17,14,0,0.8726462495225146,0.8726462495225146,Washington State,Oregon,3,4,NA,280730265,2008-03-13
84,1,4:06,1446,1446,Churchill Odia Defensive Rebound.,31,17,14,5,0.8726462495225146,0.8726462495225146,Washington State,Oregon,3,4,NA,280730265,2008-03-13
85,1,4:01,1441,1441,Malik Hairston made Three Point Jumper.  Assisted by Churchill Odia.,31,20,11,33,0.8199207888455166,0.8199207888455166,Washington State,Oregon,3,4,NA,280730265,2008-03-13
86,1,3:28,1408,1408,Derrick Low made Three Point Jumper.  Assisted by Taylor Rochestie.,34,20,14,5,0.8764085346811687,0.8764085346811687,Washington State,Oregon,3,4,NA,280730265,2008-03-13
87,1,3:23,1403,1403,Official TV Timeout.,34,20,14,9,0.8768806812891237,0.8768806812891237,Washington State,Oregon,3,4,NA,280730265,2008-03-13
88,1,3:14,1394,1394,Foul on Maarty Leunen,34,20,14,0,0.8777207075167809,0.8777207075167809,Washington State,Oregon,3,4,NA,280730265,2008-03-13
89,1,3:14,1394,1394,Robbie Cowgill made Free Throw.,35,20,15,0,0.8920455604945491,0.8920455604945491,Washington State,Oregon,3,4,NA,280730265,2008-03-13
90,1,3:14,1394,1394,Robbie Cowgill made Free Throw.,36,20,16,14,0.904874149996955,0.904874149996955,Washington State,Oregon,3,4,NA,280730265,2008-03-13
91,1,3:00,1380,1380,Bryce Taylor made Two Point Jumper.  Assisted by Churchill Odia.,36,22,14,31,0.8790069918472739,0.8790069918472739,Washington State,Oregon,3,4,NA,280730265,2008-03-13
92,1,2:29,1349,1349,Kyle Weaver made Three Point Jumper.,39,22,17,52,0.919846817738005,0.919846817738005,Washington State,Oregon,3,4,NA,280730265,2008-03-13
93,1,1:37,1297,1297,Taylor Rochestie missed Two Point Layup.,39,22,17,0,0.9238890763961523,0.9238890763961523,Washington State,Oregon,3,4,NA,280730265,2008-03-13
94,1,1:37,1297,1297,Kyle Weaver Offensive Rebound.,39,22,17,5,0.9238890763961523,0.9238890763961523,Washington State,Oregon,3,4,NA,280730265,2008-03-13
95,1,1:32,1292,1292,Kyle Weaver made Two Point Jumper.,41,22,19,18,0.9424826716268848,0.9424826716268848,Washington State,Oregon,3,4,NA,280730265,2008-03-13
96,1,1:14,1274,1274,Foul on Kyle Weaver,41,22,19,7,0.9437406959270415,0.9437406959270415,Washington State,Oregon,3,4,NA,280730265,2008-03-13
97,1,1:07,1267,1267,Maarty Leunen missed Three Point Jumper.,41,22,19,0,0.9442387819001635,0.9442387819001635,Washington State,Oregon,3,4,NA,280730265,2008-03-13
98,1,1:07,1267,1267,Daven Harmeling Defensive Rebound.,41,22,19,21,0.9442387819001635,0.9442387819001635,Washington State,Oregon,3,4,NA,280730265,2008-03-13
99,1,0:46,1246,1246,Foul on LeKendric Longmire,41,22,19,0,0.9457688874664666,0.9457688874664666,Washington State,Oregon,3,4,NA,280730265,2008-03-13
100,1,0:46,1246,1246,Nikola Koprivica missed Free Throw.,41,22,19,0,0.9457688874664666,0.9457688874664666,Washington State,Oregon,3,4,NA,280730265,2008-03-13
101,1,0:46,1246,1246,null,41,22,19,0,0.9457688874664666,0.9457688874664666,Washington State,Oregon,3,4,NA,280730265,2008-03-13
102,1,0:46,1246,1246,Nikola Koprivica made Free Throw.,42,22,20,12,0.9529881889291324,0.9529881889291324,Washington State,Oregon,3,4,NA,280730265,2008-03-13
103,1,0:34,1234,1234,Malik Hairston missed Two Point Jumper.,42,22,20,0,0.9538167887354274,0.9538167887354274,Washington State,Oregon,3,4,NA,280730265,2008-03-13
104,1,0:34,1234,1234,Malik Hairston Offensive Rebound.,42,22,20,0,0.9538167887354274,0.9538167887354274,Washington State,Oregon,3,4,NA,280730265,2008-03-13
105,1,0:34,1234,1234,Foul on Nikola Koprivica,42,22,20,3,0.9538167887354274,0.9538167887354274,Washington State,Oregon,3,4,NA,280730265,2008-03-13
106,1,0:31,1231,1231,Malik Hairston made Two Point Jumper.,42,24,18,28,0.9387377438242193,0.9387377438242193,Washington State,Oregon,3,4,NA,280730265,2008-03-13
107,1,0:03,1203,1203,LeKendric Longmire made Three Point Jumper.,42,27,15,3,0.909672202214679,0.909672202214679,Washington State,Oregon,3,4,NA,280730265,2008-03-13
108,1,0:00,1200,1200,End of the 1st Half.,42,27,15,0,0.9099848741674551,0.9099848741674551,Washington State,Oregon,3,4,NA,280730265,2008-03-13
109,2,20:00,1200,1200,PLAY,42,27,15,26,0.9099848741674551,0.9099848741674551,Washington State,Oregon,4,4,NA,280730265,2008-03-13
110,2,19:34,1174,1174,Foul on Robbie Cowgill,42,27,15,0,0.912587786173853,0.912587786173853,Washington State,Oregon,4,4,NA,280730265,2008-03-13
111,2,19:34,1174,1174,Bryce Taylor made Free Throw.,42,28,14,0,0.8992820464923981,0.8992820464923981,Washington State,Oregon,4,4,NA,280730265,2008-03-13
112,2,19:34,1174,1174,Bryce Taylor made Free Throw.,42,29,13,35,0.8842079159719262,0.8842079159719262,Washington State,Oregon,4,4,NA,280730265,2008-03-13
113,2,18:59,1139,1139,Taylor Rochestie made Two Point Layup.,44,29,15,35,0.9158747841160788,0.9158747841160788,Washington State,Oregon,4,4,NA,280730265,2008-03-13
114,2,18:24,1104,1104,Bryce Taylor made Two Point Jumper.,44,31,13,22,0.8914407991331771,0.8914407991331771,Washington State,Oregon,4,4,NA,280730265,2008-03-13
115,2,18:02,1082,1082,Foul on Bryce Taylor,44,31,13,7,0.8936939202032682,0.8936939202032682,Washington State,Oregon,4,4,NA,280730265,2008-03-13
116,2,17:55,1075,1075,Bryce Taylor missed Three Point Jumper.,44,31,13,0,0.8944196719521756,0.8944196719521756,Washington State,Oregon,4,4,NA,280730265,2008-03-13
117,2,17:55,1075,1075,Maarty Leunen Offensive Rebound.,44,31,13,2,0.8944196719521756,0.8944196719521756,Washington State,Oregon,4,4,NA,280730265,2008-03-13
118,2,17:53,1073,1073,Foul on Robbie Cowgill,44,31,13,0,0.8946280889909893,0.8946280889909893,Washington State,Oregon,4,4,NA,280730265,2008-03-13
119,2,17:53,1073,1073,Maarty Leunen made Free Throw.,44,32,12,0,0.8780808224210666,0.8780808224210666,Washington State,Oregon,4,4,NA,280730265,2008-03-13
120,2,17:53,1073,1073,Maarty Leunen made Free Throw.,44,33,11,17,0.8593435757678857,0.8593435757678857,Washington State,Oregon,4,4,NA,280730265,2008-03-13
121,2,17:36,1056,1056,Derrick Low made Two Point Layup.,46,33,13,7,0.8964225766370102,0.8964225766370102,Washington State,Oregon,4,4,NA,280730265,2008-03-13
122,2,17:29,1049,1049,Foul on Derrick Low,46,33,13,15,0.897175387053418,0.897175387053418,Washington State,Oregon,4,4,NA,280730265,2008-03-13
123,2,17:14,1034,1034,Malik Hairston made Two Point Dunk Shot.,46,35,11,29,0.8639117000677105,0.8639117000677105,Washington State,Oregon,4,4,NA,280730265,2008-03-13
124,2,16:45,1005,1005,Derrick Low made Two Point Layup.  Assisted by Kyle Weaver.,48,35,13,26,0.9021560094466798,0.9021560094466798,Washington State,Oregon,4,4,NA,280730265,2008-03-13
125,2,16:19,979,979,Aron Baynes missed Two Point Layup.,48,35,13,0,0.9053507230937125,0.9053507230937125,Washington State,Oregon,4,4,NA,280730265,2008-03-13
126,2,16:19,979,979,Aron Baynes Offensive Rebound.,48,35,13,4,0.9053507230937125,0.9053507230937125,Washington State,Oregon,4,4,NA,280730265,2008-03-13
127,2,16:15,975,975,Aron Baynes made Two Point Layup.,50,35,15,14,0.9316582619265875,0.9316582619265875,Washington State,Oregon,4,4,NA,280730265,2008-03-13
128,2,16:01,961,961,Malik Hairston missed Two Point Jumper.,50,35,15,0,0.9331889446719815,0.9331889446719815,Washington State,Oregon,4,4,NA,280730265,2008-03-13
129,2,16:01,961,961,Aron Baynes Defensive Rebound.,50,35,15,14,0.9331889446719815,0.9331889446719815,Washington State,Oregon,4,4,NA,280730265,2008-03-13
130,2,15:47,947,947,Derrick Low missed Two Point Layup.,50,35,15,0,0.9345875849675664,0.9345875849675664,Washington State,Oregon,4,4,NA,280730265,2008-03-13
131,2,15:47,947,947,Robbie Cowgill Offensive Rebound.,50,35,15,20,0.9345875849675664,0.9345875849675664,Washington State,Oregon,4,4,NA,280730265,2008-03-13
132,2,15:27,927,927,Official TV Timeout.,50,35,15,36,0.9363855051710928,0.9363855051710928,Washington State,Oregon,4,4,NA,280730265,2008-03-13
133,2,14:51,891,891,LeKendric Longmire missed Two Point Layup.,50,35,15,0,0.9392335637642043,0.9392335637642043,Washington State,Oregon,4,4,NA,280730265,2008-03-13
134,2,14:51,891,891,Robbie Cowgill Defensive Rebound.,50,35,15,7,0.9392335637642043,0.9392335637642043,Washington State,Oregon,4,4,NA,280730265,2008-03-13
135,2,14:44,884,884,Foul on Churchill Odia,50,35,15,0,0.9397544374897208,0.9397544374897208,Washington State,Oregon,4,4,NA,280730265,2008-03-13
136,2,14:44,884,884,Taylor Rochestie made Free Throw.,51,35,16,0,0.9493258251121234,0.9493258251121234,Washington State,Oregon,4,4,NA,280730265,2008-03-13
137,2,14:44,884,884,Taylor Rochestie made Free Throw.,52,35,17,13,0.9574454368950209,0.9574454368950209,Washington State,Oregon,4,4,NA,280730265,2008-03-13
138,2,14:31,871,871,LeKendric Longmire made Two Point Jumper.  Assisted by Maarty Leunen.,52,37,15,34,0.9407109387691289,0.9407109387691289,Washington State,Oregon,4,4,NA,280730265,2008-03-13
139,2,13:57,837,837,Aron Baynes made Two Point Layup.  Assisted by Derrick Low.,54,37,17,46,0.9602742522795413,0.9602742522795413,Washington State,Oregon,4,4,NA,280730265,2008-03-13
140,2,13:11,791,791,Derrick Low missed Three Point Jumper.,54,37,17,0,0.9633342996627015,0.9633342996627015,Washington State,Oregon,4,4,NA,280730265,2008-03-13
141,2,13:11,791,791,Malik Hairston Defensive Rebound.,54,37,17,17,0.9633342996627015,0.9633342996627015,Washington State,Oregon,4,4,NA,280730265,2008-03-13
142,2,12:54,774,774,Maarty Leunen made Two Point Layup.,54,39,15,0,0.9486543647835565,0.9486543647835565,Washington State,Oregon,4,4,NA,280730265,2008-03-13
143,2,12:54,774,774,Foul on Robbie Cowgill,54,39,15,0,0.9486543647835565,0.9486543647835565,Washington State,Oregon,4,4,NA,280730265,2008-03-13
144,2,12:54,774,774,Maarty Leunen missed Free Throw.,54,39,15,0,0.9486543647835565,0.9486543647835565,Washington State,Oregon,4,4,NA,280730265,2008-03-13
145,2,12:54,774,774,Daven Harmeling Defensive Rebound.,54,39,15,32,0.9486543647835565,0.9486543647835565,Washington State,Oregon,4,4,NA,280730265,2008-03-13
146,2,12:22,742,742,Taylor Rochestie missed Two Point Jumper.,54,39,15,0,0.9520397490057642,0.9520397490057642,Washington State,Oregon,4,4,NA,280730265,2008-03-13
147,2,12:22,742,742,Caleb Forrest Offensive Rebound.,54,39,15,3,0.9520397490057642,0.9520397490057642,Washington State,Oregon,4,4,NA,280730265,2008-03-13
148,2,12:19,739,739,Caleb Forrest missed Two Point Layup.,54,39,15,0,0.9523835227674462,0.9523835227674462,Washington State,Oregon,4,4,NA,280730265,2008-03-13
149,2,12:19,739,739,Churchill Odia Defensive Rebound.,54,39,15,5,0.9523835227674462,0.9523835227674462,Washington State,Oregon,4,4,NA,280730265,2008-03-13
150,2,12:14,734,734,Maarty Leunen missed Three Point Jumper.,54,39,15,0,0.9529668342377214,0.9529668342377214,Washington State,Oregon,4,4,NA,280730265,2008-03-13
151,2,12:14,734,734,Bryce Taylor Offensive Rebound.,54,39,15,13,0.9529668342377214,0.9529668342377214,Washington State,Oregon,4,4,NA,280730265,2008-03-13
152,2,12:01,721,721,LeKendric Longmire missed Three Point Jumper.,54,39,15,0,0.954475094519167,0.954475094519167,Washington State,Oregon,4,4,NA,280730265,2008-03-13
153,2,12:01,721,721,Maarty Leunen Offensive Rebound.,54,39,15,4,0.954475094519167,0.954475094519167,Washington State,Oregon,4,4,NA,280730265,2008-03-13
154,2,11:57,717,717,Maarty Leunen made Two Point Dunk Shot.,54,41,13,1,0.9337518281439346,0.9337518281439346,Washington State,Oregon,4,4,NA,280730265,2008-03-13
155,2,11:56,716,716,Oregon Full Timeout.,54,41,13,26,0.9338826683277199,0.9338826683277199,Washington State,Oregon,3,4,NA,280730265,2008-03-13
156,2,11:30,690,690,Tajuan Porter made Three Point Jumper.  Assisted by Churchill Odia.,54,44,10,40,0.8885362372882968,0.8885362372882968,Washington State,Oregon,3,4,NA,280730265,2008-03-13
157,2,10:50,650,650,Derrick Low missed Three Point Jumper.,54,44,10,0,0.8937739533321196,0.8937739533321196,Washington State,Oregon,3,4,NA,280730265,2008-03-13
158,2,10:50,650,650,null,54,44,10,4,0.8937739533321196,0.8937739533321196,Washington State,Oregon,3,4,NA,280730265,2008-03-13
159,2,10:46,646,646,Foul on Maarty Leunen,54,44,10,0,0.8942904971321373,0.8942904971321373,Washington State,Oregon,3,4,NA,280730265,2008-03-13
160,2,10:46,646,646,Official TV Timeout.,54,44,10,1,0.8942904971321373,0.8942904971321373,Washington State,Oregon,3,4,NA,280730265,2008-03-13
161,2,10:45,645,645,Foul on LeKendric Longmire,54,44,10,0,0.8944202052674468,0.8944202052674468,Washington State,Oregon,3,4,NA,280730265,2008-03-13
162,2,10:45,645,645,Kyle Weaver made Free Throw.,55,44,11,0,0.9129643911354909,0.9129643911354909,Washington State,Oregon,3,4,NA,280730265,2008-03-13
163,2,10:45,645,645,Kyle Weaver made Free Throw.,56,44,12,14,0.9285117817526045,0.9285117817526045,Washington State,Oregon,3,4,NA,280730265,2008-03-13
164,2,10:31,631,631,Foul on Derrick Low,56,44,12,0,0.9300709538193662,0.9300709538193662,Washington State,Oregon,3,4,NA,280730265,2008-03-13
165,2,10:31,631,631,Tajuan Porter made Free Throw.,56,45,11,0,0.9146773526189185,0.9146773526189185,Washington State,Oregon,3,4,NA,280730265,2008-03-13
166,2,10:31,631,631,Tajuan Porter made Free Throw.,56,46,10,0,0.8962730502133172,0.8962730502133172,Washington State,Oregon,3,4,NA,280730265,2008-03-13
