play_id,half,time_remaining_half,secs_remaining,secs_remaining_absolute,description,home_score,away_score,score_diff,play_length,win_prob,naive_win_prob,home,away,home_time_out_remaining,away_time_out_remaining,home_favored_by,game_id,date
1,1,20:00,2400,2400,PLAY,0,0,0,12,0.5,0.5,Montana,Eastern Washington,4,4,NA,270340149,2007-02-03
2,1,19:48,2388,2388,Rodney Stuckey made Two Point Jumper.,0,2,-2,23,0.45572153375231284,0.45572153375231284,Montana,Eastern Washington,4,4,NA,270340149,2007-02-03
3,1,19:25,2365,2365,Andrew Strait made Two Point Jumper.  Assisted by Matt Martin.,2,2,0,13,0.5,0.5,Montana,Eastern Washington,4,4,NA,270340149,2007-02-03
4,1,19:12,2352,2352,Andrew Strait Steal.,2,2,0,28,0.5,0.5,Montana,Eastern Washington,4,4,NA,270340149,2007-02-03
5,1,18:44,2324,2324,Rodney Stuckey made Two Point Jumper.,2,4,-2,23,0.4543425759993232,0.4543425759993232,Montana,Eastern Washington,4,4,NA,270340149,2007-02-03
6,1,18:21,2301,2301,Matt Dlouhy made Three Point Jumper.  Assisted by Matt Martin.,5,4,1,9,0.5231320113790872,0.5231320113790872,Montana,Eastern Washington,4,4,NA,270340149,2007-02-03
7,1,18:12,2292,2292,Rodney Stuckey made Three Point Jumper.,5,7,-2,21,0.45363457052289796,0.45363457052289796,Montana,Eastern Washington,4,4,NA,270340149,2007-02-03
8,1,17:51,2271,2271,Jordan Hasquet made Two Point Jumper.  Assisted by Matt Martin.,7,7,0,19,0.5,0.5,Montana,Eastern Washington,4,4,NA,270340149,2007-02-03
9,1,17:32,2252,2252,Foul on Rodney Stuckey,7,7,0,0,0.5,0.5,Montana,Eastern Washington,4,4,NA,270340149,2007-02-03
10,1,17:32,2252,2252,Matt Martin made Free Throw.,8,7,1,0,0.523685214139179,0.523685214139179,Montana,Eastern Washington,4,4,NA,270340149,2007-02-03
11,1,17:32,2252,2252,Matt Martin made Free Throw.,9,7,2,18,0.5472643690441272,0.5472643690441272,Montana,Eastern Washington,4,4,NA,270340149,2007-02-03
12,1,17:14,2234,2234,Marcus Hinton missed Two Point Layup.,9,7,2,1,0.5476731190364036,0.5476731190364036,Montana,Eastern Washington,4,4,NA,270340149,2007-02-03
13,1,17:13,2233,2233,Marcus Hinton Offensive Rebound.,9,7,2,1,0.5476958944832517,0.5476958944832517,Montana,Eastern Washington,4,4,NA,270340149,2007-02-03
14,1,17:12,2232,2232,Foul on Matt Dlouhy,9,7,2,0,0.5477186766445648,0.5477186766445648,Montana,Eastern Washington,4,4,NA,270340149,2007-02-03
15,1,17:12,2232,2232,Marcus Hinton made Free Throw.,9,8,1,0,0.5239139165975408,0.5239139165975408,Montana,Eastern Washington,4,4,NA,270340149,2007-02-03
16,1,17:12,2232,2232,Marcus Hinton made Free Throw.,9,9,0,18,0.5,0.5,Montana,Eastern Washington,4,4,NA,270340149,2007-02-03
17,1,16:54,2214,2214,Cameron Rundles missed Two Point Jumper.,9,9,0,0,0.5,0.5,Montana,Eastern Washington,4,4,NA,270340149,2007-02-03
18,1,16:54,2214,2214,Jordan Hasquet Offensive Rebound.,9,9,0,3,0.5,0.5,Montana,Eastern Washington,4,4,NA,270340149,2007-02-03
19,1,16:51,2211,2211,Jordan Hasquet made Two Point Jumper.,11,9,2,6,0.5481985600824828,0.5481985600824828,Montana,Eastern Washington,4,4,NA,270340149,2007-02-03
20,1,16:45,2205,2205,Rodney Stuckey missed Three Point Jumper.,11,9,2,0,0.5483361412138311,0.5483361412138311,Montana,Eastern Washington,4,4,NA,270340149,2007-02-03
21,1,16:45,2205,2205,Matt Dlouhy Defensive Rebound.,11,9,2,9,0.5483361412138311,0.5483361412138311,Montana,Eastern Washington,4,4,NA,270340149,2007-02-03
22,1,16:36,2196,2196,Cameron Rundles made Two Point Layup.,13,9,4,18,0.5961791766315144,0.5961791766315144,Montana,Eastern Washington,4,4,NA,270340149,2007-02-03
23,1,16:18,2178,2178,Paul Butorac missed Two Point Jumper.,13,9,4,0,0.5969850319212389,0.5969850319212389,Montana,Eastern Washington,4,4,NA,270340149,2007-02-03
24,1,16:18,2178,2178,Cameron Rundles Defensive Rebound.,13,9,4,9,0.5969850319212389,0.5969850319212389,Montana,Eastern Washington,4,4,NA,270340149,2007-02-03
25,1,16:09,2169,2169,Jordan Hasquet made Three Point Jumper.  Assisted by Cameron Rundles.,16,9,7,3,0.6660879618410799,0.6660879618410799,Montana,Eastern Washington,4,4,NA,270340149,2007-02-03
26,1,16:06,2166,2166,Eastern Washington Full Timeout.,16,9,7,14,0.6663059721641955,0.6663059721641955,Montana,Eastern Washington,3,4,NA,270340149,2007-02-03
27,1,15:52,2152,2152,Rodney Stuckey missed Two Point Jumper.,16,9,7,0,0.6673252821298172,0.6673252821298172,Montana,Eastern Washington,3,4,NA,270340149,2007-02-03
28,1,15:52,2152,2152,Jordan Hasquet Defensive Rebound.,16,9,7,7,0.6673252821298172,0.6673252821298172,Montana,Eastern Washington,3,4,NA,270340149,2007-02-03
29,1,15:45,2145,2145,Jordan Hasquet made Three Point Jumper.  Assisted by Matt Dlouhy.,19,9,10,22,0.7306130600634273,0.7306130600634273,Montana,Eastern Washington,3,4,NA,270340149,2007-02-03
30,1,15:23,2123,2123,Paul Butorac made Two Point Jumper.  Assisted by Rodney Stuckey.,19,11,8,22,0.6913633649193783,0.6913633649193783,Montana,Eastern Washington,3,4,NA,270340149,2007-02-03
31,1,15:01,2101,2101,Jordan Hasquet made Two Point Jumper.  Assisted by Matt Dlouhy.,21,11,10,20,0.7347008158901108,0.7347008158901108,Montana,Eastern Washington,3,4,NA,270340149,2007-02-03
32,1,14:41,2081,2081,Paul Butorac missed Three Point Jumper.,21,11,10,0,0.7365695417008148,0.7365695417008148,Montana,Eastern Washington,3,4,NA,270340149,2007-02-03
33,1,14:41,2081,2081,Andrew Strait Defensive Rebound.,21,11,10,20,0.7365695417008148,0.7365695417008148,Montana,Eastern Washington,3,4,NA,270340149,2007-02-03
34,1,14:21,2061,2061,Cameron Rundles missed Three Point Jumper.,21,11,10,0,0.7384460869593881,0.7384460869593881,Montana,Eastern Washington,3,4,NA,270340149,2007-02-03
35,1,14:21,2061,2061,Matt Penoncello Defensive Rebound.,21,11,10,8,0.7384460869593881,0.7384460869593881,Montana,Eastern Washington,3,4,NA,270340149,2007-02-03
36,1,14:13,2053,2053,Matt Penoncello missed Two Point Jumper.,21,11,10,0,0.7391990745426892,0.7391990745426892,Montana,Eastern Washington,3,4,NA,270340149,2007-02-03
37,1,14:13,2053,2053,Matt Penoncello Offensive Rebound.,21,11,10,15,0.7391990745426892,0.7391990745426892,Montana,Eastern Washington,3,4,NA,270340149,2007-02-03
38,1,13:58,2038,2038,Kellen Williams missed Three Point Jumper.,21,11,10,0,0.7406148186744372,0.7406148186744372,Montana,Eastern Washington,3,4,NA,270340149,2007-02-03
39,1,13:58,2038,2038,Matt Dlouhy Defensive Rebound.,21,11,10,19,0.7406148186744372,0.7406148186744372,Montana,Eastern Washington,3,4,NA,270340149,2007-02-03
40,1,13:39,2019,2019,Jordan Hasquet missed Three Point Jumper.,21,11,10,0,0.7424158174494672,0.7424158174494672,Montana,Eastern Washington,3,4,NA,270340149,2007-02-03
41,1,13:39,2019,2019,Andrew Strait Offensive Rebound.,21,11,10,9,0.7424158174494672,0.7424158174494672,Montana,Eastern Washington,3,4,NA,270340149,2007-02-03
42,1,13:30,2010,2010,Foul on Michael Taylor,21,11,10,0,0.7432721049673542,0.7432721049673542,Montana,Eastern Washington,3,4,NA,270340149,2007-02-03
43,1,13:30,2010,2010,Official TV Timeout.,21,11,10,2,0.7432721049673542,0.7432721049673542,Montana,Eastern Washington,3,4,NA,270340149,2007-02-03
44,1,13:28,2008,2008,Matt Martin missed Three Point Jumper.,21,11,10,0,0.7434626791343195,0.7434626791343195,Montana,Eastern Washington,3,4,NA,270340149,2007-02-03
45,1,13:28,2008,2008,Jordan Hasquet Offensive Rebound.,21,11,10,10,0.7434626791343195,0.7434626791343195,Montana,Eastern Washington,3,4,NA,270340149,2007-02-03
46,1,13:18,1998,1998,Matt Dlouhy missed Three Point Jumper.,21,11,10,0,0.7444171594277255,0.7444171594277255,Montana,Eastern Washington,3,4,NA,270340149,2007-02-03
47,1,13:18,1998,1998,Matt Martin Offensive Rebound.,21,11,10,4,0.7444171594277255,0.7444171594277255,Montana,Eastern Washington,3,4,NA,270340149,2007-02-03
48,1,13:14,1994,1994,Foul on Kellen Williams,21,11,10,26,0.7447997160916398,0.7447997160916398,Montana,Eastern Washington,3,4,NA,270340149,2007-02-03
49,1,12:48,1968,1968,Brandon Moore made Two Point Jumper.  Assisted by Matt Penoncello.,21,13,8,0,0.7042044311947012,0.7042044311947012,Montana,Eastern Washington,3,4,NA,270340149,2007-02-03
50,1,12:48,1968,1968,Foul on Kyle Sharp,21,13,8,0,0.7042044311947012,0.7042044311947012,Montana,Eastern Washington,3,4,NA,270340149,2007-02-03
51,1,12:48,1968,1968,Brandon Moore made Free Throw.,21,14,7,27,0.6811311784377959,0.6811311784377959,Montana,Eastern Washington,3,4,NA,270340149,2007-02-03
52,1,12:21,1941,1941,Matt Dlouhy missed Three Point Jumper.,21,14,7,0,0.6832402714070321,0.6832402714070321,Montana,Eastern Washington,3,4,NA,270340149,2007-02-03
53,1,12:21,1941,1941,Kyle Sharp Offensive Rebound.,21,14,7,33,0.6832402714070321,0.6832402714070321,Montana,Eastern Washington,3,4,NA,270340149,2007-02-03
54,1,11:48,1908,1908,Jordan Hasquet missed Two Point Layup.,21,14,7,0,0.685839234887184,0.685839234887184,Montana,Eastern Washington,3,4,NA,270340149,2007-02-03
55,1,11:48,1908,1908,Kyle Sharp Offensive Rebound.,21,14,7,3,0.685839234887184,0.685839234887184,Montana,Eastern Washington,3,4,NA,270340149,2007-02-03
56,1,11:45,1905,1905,Kyle Sharp missed Two Point Layup.,21,14,7,2,0.6860747371428143,0.6860747371428143,Montana,Eastern Washington,3,4,NA,270340149,2007-02-03
57,1,11:43,1903,1903,Paul Butorac Defensive Rebound.,21,14,7,5,0.6862316643978315,0.6862316643978315,Montana,Eastern Washington,3,4,NA,270340149,2007-02-03
58,1,11:38,1898,1898,Matt Penoncello made Two Point Layup.,21,16,5,21,0.6365156595338292,0.6365156595338292,Montana,Eastern Washington,3,4,NA,270340149,2007-02-03
59,1,11:17,1877,1877,Foul on Rodney Stuckey,21,16,5,0,0.6377794202723023,0.6377794202723023,Montana,Eastern Washington,3,4,NA,270340149,2007-02-03
60,1,11:17,1877,1877,Official TV Timeout.,21,16,5,0,0.6377794202723023,0.6377794202723023,Montana,Eastern Washington,3,4,NA,270340149,2007-02-03
61,1,11:17,1877,1877,Matt Dlouhy made Free Throw.,22,16,6,0,0.6634902308642311,0.6634902308642311,Montana,Eastern Washington,3,4,NA,270340149,2007-02-03
62,1,11:17,1877,1877,Matt Dlouhy made Free Throw.,23,16,7,15,0.6882680691004559,0.6882680691004559,Montana,Eastern Washington,3,4,NA,270340149,2007-02-03
63,1,11:02,1862,1862,Foul on Kyle Sharp,23,16,7,0,0.6894418792658296,0.6894418792658296,Montana,Eastern Washington,3,4,NA,270340149,2007-02-03
64,1,11:02,1862,1862,Paul Butorac missed Free Throw.,23,16,7,0,0.6894418792658296,0.6894418792658296,Montana,Eastern Washington,3,4,NA,270340149,2007-02-03
65,1,11:02,1862,1862,null,23,16,7,0,0.6894418792658296,0.6894418792658296,Montana,Eastern Washington,3,4,NA,270340149,2007-02-03
66,1,11:02,1862,1862,Paul Butorac made Free Throw.,23,17,6,15,0.664537501778383,0.664537501778383,Montana,Eastern Washington,3,4,NA,270340149,2007-02-03
67,1,10:47,1847,1847,Andrew Strait missed Two Point Jumper.,23,17,6,0,0.6655863756452651,0.6655863756452651,Montana,Eastern Washington,3,4,NA,270340149,2007-02-03
68,1,10:47,1847,1847,Paul Butorac Defensive Rebound.,23,17,6,7,0.6655863756452651,0.6655863756452651,Montana,Eastern Washington,3,4,NA,270340149,2007-02-03
69,1,10:40,1840,1840,Matt Penoncello missed Three Point Jumper.,23,17,6,0,0.6660767872441826,0.6660767872441826,Montana,Eastern Washington,3,4,NA,270340149,2007-02-03
70,1,10:40,1840,1840,Ryan Staudacher Defensive Rebound.,23,17,6,22,0.6660767872441826,0.6660767872441826,Montana,Eastern Washington,3,4,NA,270340149,2007-02-03
71,1,10:18,1818,1818,Stuart Mayes missed Three Point Jumper.,23,17,6,0,0.667623865259822,0.667623865259822,Montana,Eastern Washington,3,4,NA,270340149,2007-02-03
72,1,10:18,1818,1818,Brandon Moore Defensive Rebound.,23,17,6,24,0.667623865259822,0.667623865259822,Montana,Eastern Washington,3,4,NA,270340149,2007-02-03
73,1,9:54,1794,1794,Brandon Moore made Two Point Jumper.,23,19,4,15,0.6154052344181464,0.6154052344181464,Montana,Eastern Washington,3,4,NA,270340149,2007-02-03
74,1,9:39,1779,1779,Stuart Mayes made Two Point Layup.,25,19,6,0,0.6703988400927152,0.6703988400927152,Montana,Eastern Washington,3,4,NA,270340149,2007-02-03
75,1,9:39,1779,1779,Foul on Omar Krayem,25,19,6,0,0.6703988400927152,0.6703988400927152,Montana,Eastern Washington,3,4,NA,270340149,2007-02-03
76,1,9:39,1779,1779,Stuart Mayes missed Free Throw.,25,19,6,0,0.6703988400927152,0.6703988400927152,Montana,Eastern Washington,3,4,NA,270340149,2007-02-03
77,1,9:39,1779,1779,Paul Butorac Defensive Rebound.,25,19,6,22,0.6703988400927152,0.6703988400927152,Montana,Eastern Washington,3,4,NA,270340149,2007-02-03
78,1,9:17,1757,1757,Foul on Stuart Mayes,25,19,6,0,0.6719898995260315,0.6719898995260315,Montana,Eastern Washington,3,4,NA,270340149,2007-02-03
79,1,9:17,1757,1757,Omar Krayem made Free Throw.,25,20,5,0,0.6451220867290216,0.6451220867290216,Montana,Eastern Washington,3,4,NA,270340149,2007-02-03
80,1,9:17,1757,1757,Omar Krayem missed Free Throw.,25,20,5,0,0.6451220867290216,0.6451220867290216,Montana,Eastern Washington,3,4,NA,270340149,2007-02-03
81,1,9:17,1757,1757,Mike Chavez Defensive Rebound.,25,20,5,28,0.6451220867290216,0.6451220867290216,Montana,Eastern Washington,3,4,NA,270340149,2007-02-03
82,1,8:49,1729,1729,Foul on Ryan Staudacher,25,20,5,6,0.6469059148735038,0.6469059148735038,Montana,Eastern Washington,3,4,NA,270340149,2007-02-03
83,1,8:43,1723,1723,Foul on Mike Chavez,25,20,5,20,0.6472934416793046,0.6472934416793046,Montana,Eastern Washington,3,4,NA,270340149,2007-02-03
84,1,8:23,1703,1703,Matt Penoncello missed Three Point Jumper.,25,20,5,0,0.6486002381319425,0.6486002381319425,Montana,Eastern Washington,3,4,NA,270340149,2007-02-03
85,1,8:23,1703,1703,Mike Chavez Defensive Rebound.,25,20,5,9,0.6486002381319425,0.6486002381319425,Montana,Eastern Washington,3,4,NA,270340149,2007-02-03
86,1,8:14,1694,1694,Foul on Rhett Humphrey,25,20,5,0,0.6491963584629329,0.6491963584629329,Montana,Eastern Washington,3,4,NA,270340149,2007-02-03
87,1,8:14,1694,1694,Matt Dlouhy missed Free Throw.,25,20,5,0,0.6491963584629329,0.6491963584629329,Montana,Eastern Washington,3,4,NA,270340149,2007-02-03
88,1,8:14,1694,1694,null,25,20,5,0,0.6491963584629329,0.6491963584629329,Montana,Eastern Washington,3,4,NA,270340149,2007-02-03
89,1,8:14,1694,1694,Matt Dlouhy made Free Throw.,26,20,6,10,0.6766918928964923,0.6766918928964923,Montana,Eastern Washington,3,4,NA,270340149,2007-02-03
90,1,8:04,1684,1684,Omar Krayem made Two Point Layup.,26,22,4,19,0.6212236547652163,0.6212236547652163,Montana,Eastern Washington,3,4,NA,270340149,2007-02-03
91,1,7:45,1665,1665,Rhett Humphrey Steal.,26,22,4,10,0.622248588705112,0.622248588705112,Montana,Eastern Washington,3,4,NA,270340149,2007-02-03
92,1,7:35,1655,1655,Omar Krayem made Three Point Jumper.,26,25,1,21,0.5312937646375118,0.5312937646375118,Montana,Eastern Washington,3,4,NA,270340149,2007-02-03
93,1,7:14,1634,1634,Andrew Strait missed Two Point Layup.,26,25,1,2,0.5315838892646139,0.5315838892646139,Montana,Eastern Washington,3,4,NA,270340149,2007-02-03
94,1,7:12,1632,1632,Andrew Strait Offensive Rebound.,26,25,1,3,0.5316112839754575,0.5316112839754575,Montana,Eastern Washington,3,4,NA,270340149,2007-02-03
95,1,7:09,1629,1629,Andrew Strait missed Two Point Layup.,26,25,1,0,0.5316523168728163,0.5316523168728163,Montana,Eastern Washington,3,4,NA,270340149,2007-02-03
96,1,7:09,1629,1629,Omar Krayem Defensive Rebound.,26,25,1,7,0.5316523168728163,0.5316523168728163,Montana,Eastern Washington,3,4,NA,270340149,2007-02-03
97,1,7:02,1622,1622,Foul on Matt Martin,26,25,1,0,0.5317478226305178,0.5317478226305178,Montana,Eastern Washington,3,4,NA,270340149,2007-02-03
98,1,7:02,1622,1622,Official TV Timeout.,26,25,1,0,0.5317478226305178,0.5317478226305178,Montana,Eastern Washington,3,4,NA,270340149,2007-02-03
99,1,7:02,1622,1622,Kellen Williams made Free Throw.,26,26,0,0,0.5,0.5,Montana,Eastern Washington,3,4,NA,270340149,2007-02-03
100,1,7:02,1622,1622,Kellen Williams made Free Throw.,26,27,-1,23,0.4682521773694822,0.4682521773694822,Montana,Eastern Washington,3,4,NA,270340149,2007-02-03
101,1,6:39,1599,1599,Foul on Kellen Williams,26,27,-1,0,0.4679396732784139,0.4679396732784139,Montana,Eastern Washington,3,4,NA,270340149,2007-02-03
102,1,6:39,1599,1599,Jordan Hasquet made Free Throw.,27,27,0,0,0.5,0.5,Montana,Eastern Washington,3,4,NA,270340149,2007-02-03
103,1,6:39,1599,1599,Jordan Hasquet made Free Throw.,28,27,1,15,0.5320603267215861,0.5320603267215861,Montana,Eastern Washington,3,4,NA,270340149,2007-02-03
104,1,6:24,1584,1584,Omar Krayem missed Three Point Jumper.,28,27,1,0,0.5322642332022972,0.5322642332022972,Montana,Eastern Washington,3,4,NA,270340149,2007-02-03
105,1,6:24,1584,1584,Jordan Hasquet Defensive Rebound.,28,27,1,29,0.5322642332022972,0.5322642332022972,Montana,Eastern Washington,3,4,NA,270340149,2007-02-03
106,1,5:55,1555,1555,Paul Butorac made Two Point Jumper.,28,29,-1,19,0.46733741357567177,0.46733741357567177,Montana,Eastern Washington,3,4,NA,270340149,2007-02-03
107,1,5:36,1536,1536,Mike Chavez missed Two Point Layup.,28,29,-1,0,0.46707084094761714,0.46707084094761714,Montana,Eastern Washington,3,4,NA,270340149,2007-02-03
108,1,5:36,1536,1536,Matt Dlouhy Offensive Rebound.,28,29,-1,1,0.46707084094761714,0.46707084094761714,Montana,Eastern Washington,3,4,NA,270340149,2007-02-03
109,1,5:35,1535,1535,Foul on Michael Taylor,28,29,-1,0,0.467056643572941,0.467056643572941,Montana,Eastern Washington,3,4,NA,270340149,2007-02-03
110,1,5:35,1535,1535,Matt Dlouhy made Free Throw.,29,29,0,0,0.5,0.5,Montana,Eastern Washington,3,4,NA,270340149,2007-02-03
111,1,5:35,1535,1535,Matt Dlouhy made Free Throw.,30,29,1,5,0.532943356427059,0.532943356427059,Montana,Eastern Washington,3,4,NA,270340149,2007-02-03
112,1,5:30,1530,1530,Foul on Bryan Ellis,30,29,1,0,0.5330146284419034,0.5330146284419034,Montana,Eastern Washington,3,4,NA,270340149,2007-02-03
113,1,5:30,1530,1530,Omar Krayem made Free Throw.,30,30,0,0,0.5,0.5,Montana,Eastern Washington,3,4,NA,270340149,2007-02-03
114,1,5:30,1530,1530,Omar Krayem made Free Throw.,30,31,-1,11,0.4669853715580966,0.4669853715580966,Montana,Eastern Washington,3,4,NA,270340149,2007-02-03
115,1,5:19,1519,1519,Foul on Omar Krayem,30,31,-1,0,0.4668267635341371,0.4668267635341371,Montana,Eastern Washington,3,4,NA,270340149,2007-02-03
116,1,5:19,1519,1519,Bryan Ellis made Free Throw.,31,31,0,0,0.5,0.5,Montana,Eastern Washington,3,4,NA,270340149,2007-02-03
117,1,5:19,1519,1519,Bryan Ellis made Free Throw.,32,31,1,26,0.5331732364658628,0.5331732364658628,Montana,Eastern Washington,3,4,NA,270340149,2007-02-03
118,1,4:53,1493,1493,Foul on Jordan Hasquet,32,31,1,0,0.5335598656971734,0.5335598656971734,Montana,Eastern Washington,3,4,NA,270340149,2007-02-03
119,1,4:53,1493,1493,Brandon Moore made Free Throw.,32,32,0,0,0.5,0.5,Montana,Eastern Washington,3,4,NA,270340149,2007-02-03
120,1,4:53,1493,1493,Brandon Moore made Free Throw.,32,33,-1,15,0.4664401343028266,0.4664401343028266,Montana,Eastern Washington,3,4,NA,270340149,2007-02-03
121,1,4:38,1478,1478,Matt Dlouhy missed Three Point Jumper.,32,33,-1,0,0.4662081141405863,0.4662081141405863,Montana,Eastern Washington,3,4,NA,270340149,2007-02-03
122,1,4:38,1478,1478,Brandon Moore Defensive Rebound.,32,33,-1,19,0.4662081141405863,0.4662081141405863,Montana,Eastern Washington,3,4,NA,270340149,2007-02-03
123,1,4:19,1459,1459,Rhett Humphrey made Three Point Jumper.  Assisted by Brandon Moore.,32,36,-4,23,0.36670015809774387,0.36670015809774387,Montana,Eastern Washington,3,4,NA,270340149,2007-02-03
124,1,3:56,1436,1436,Jordan Hasquet made Three Point Jumper.  Assisted by Cameron Rundles.,35,36,-1,25,0.46552235211869186,0.46552235211869186,Montana,Eastern Washington,3,4,NA,270340149,2007-02-03
125,1,3:31,1411,1411,Rhett Humphrey missed Three Point Jumper.,35,36,-1,0,0.46512424741662284,0.46512424741662284,Montana,Eastern Washington,3,4,NA,270340149,2007-02-03
126,1,3:31,1411,1411,Jordan Hasquet Defensive Rebound.,35,36,-1,11,0.46512424741662284,0.46512424741662284,Montana,Eastern Washington,3,4,NA,270340149,2007-02-03
127,1,3:20,1400,1400,Foul on Jordan Hasquet,35,36,-1,0,0.4649535383590408,0.4649535383590408,Montana,Eastern Washington,3,4,NA,270340149,2007-02-03
128,1,3:20,1400,1400,Official TV Timeout.,35,36,-1,37,0.4649535383590408,0.4649535383590408,Montana,Eastern Washington,3,4,NA,270340149,2007-02-03
129,1,2:43,1363,1363,Andrew Strait made Two Point Layup.  Assisted by Matt Dlouhy.,37,36,1,0,0.5356112576811393,0.5356112576811393,Montana,Eastern Washington,3,4,NA,270340149,2007-02-03
130,1,2:43,1363,1363,Foul on Paul Butorac,37,36,1,0,0.5356112576811393,0.5356112576811393,Montana,Eastern Washington,3,4,NA,270340149,2007-02-03
131,1,2:43,1363,1363,Andrew Strait missed Free Throw.,37,36,1,0,0.5356112576811393,0.5356112576811393,Montana,Eastern Washington,3,4,NA,270340149,2007-02-03
132,1,2:43,1363,1363,Brandon Moore Defensive Rebound.,37,36,1,7,0.5356112576811393,0.5356112576811393,Montana,Eastern Washington,3,4,NA,270340149,2007-02-03
133,1,2:36,1356,1356,Foul on Andrew Strait,37,36,1,0,0.5357178617267888,0.5357178617267888,Montana,Eastern Washington,3,4,NA,270340149,2007-02-03
134,1,2:36,1356,1356,Marcus Hinton made Free Throw.,37,37,0,0,0.5,0.5,Montana,Eastern Washington,3,4,NA,270340149,2007-02-03
135,1,2:36,1356,1356,Marcus Hinton made Free Throw.,37,38,-1,33,0.4642821382732112,0.4642821382732112,Montana,Eastern Washington,3,4,NA,270340149,2007-02-03
136,1,2:03,1323,1323,Marcus Hinton missed Two Point Jumper.,37,38,-1,0,0.46377235481420864,0.46377235481420864,Montana,Eastern Washington,3,4,NA,270340149,2007-02-03
137,1,2:03,1323,1323,Paul Butorac Offensive Rebound.,37,38,-1,3,0.46377235481420864,0.46377235481420864,Montana,Eastern Washington,3,4,NA,270340149,2007-02-03
138,1,2:00,1320,1320,Paul Butorac made Two Point Tip Shot.,37,40,-3,26,0.392678842914457,0.392678842914457,Montana,Eastern Washington,3,4,NA,270340149,2007-02-03
139,1,1:34,1294,1294,Mike Chavez missed Three Point Jumper.,37,40,-3,0,0.39146931202874896,0.39146931202874896,Montana,Eastern Washington,3,4,NA,270340149,2007-02-03
140,1,1:34,1294,1294,Matt Dlouhy Offensive Rebound.,37,40,-3,3,0.39146931202874896,0.39146931202874896,Montana,Eastern Washington,3,4,NA,270340149,2007-02-03
141,1,1:31,1291,1291,Foul on Marcus Hinton,37,40,-3,0,0.39132566693702214,0.39132566693702214,Montana,Eastern Washington,3,4,NA,270340149,2007-02-03
142,1,1:31,1291,1291,Matt Dlouhy made Free Throw.,38,40,-2,0,0.42690365271849967,0.42690365271849967,Montana,Eastern Washington,3,4,NA,270340149,2007-02-03
143,1,1:31,1291,1291,Matt Dlouhy made Free Throw.,39,40,-1,20,0.46325443160363156,0.46325443160363156,Montana,Eastern Washington,3,4,NA,270340149,2007-02-03
144,1,1:11,1271,1271,Marcus Hinton made Two Point Layup.,39,42,-3,8,0.39034121276721656,0.39034121276721656,Montana,Eastern Washington,3,4,NA,270340149,2007-02-03
145,1,1:03,1263,1263,Montana Full Timeout.,39,42,-3,28,0.38993276526181136,0.38993276526181136,Montana,Eastern Washington,3,3,NA,270340149,2007-02-03
146,1,0:35,1235,1235,Andrew Strait missed Two Point Jumper.,39,42,-3,0,0.3884241971897994,0.3884241971897994,Montana,Eastern Washington,3,3,NA,270340149,2007-02-03
147,1,0:35,1235,1235,Montana Offensive Rebound.,39,42,-3,1,0.3884241971897994,0.3884241971897994,Montana,Eastern Washington,3,3,NA,270340149,2007-02-03
148,1,0:34,1234,1234,Bryan Ellis missed Three Point Jumper.,39,42,-3,0,0.38836780058870346,0.38836780058870346,Montana,Eastern Washington,3,3,NA,270340149,2007-02-03
149,1,0:34,1234,1234,Stuart Mayes Offensive Rebound.,39,42,-3,3,0.38836780058870346,0.38836780058870346,Montana,Eastern Washington,3,3,NA,270340149,2007-02-03
150,1,0:31,1231,1231,Stuart Mayes made Two Point Tip Shot.,41,42,-1,31,0.46216451819114257,0.46216451819114257,Montana,Eastern Washington,3,3,NA,270340149,2007-02-03
151,1,0:00,1200,1200,End of the 1st Half.,41,42,-1,0,0.4615187446422248,0.4615187446422248,Montana,Eastern Washington,3,3,NA,270340149,2007-02-03
152,2,20:00,1200,1200,PLAY,41,42,-1,18,0.4615187446422248,0.4615187446422248,Montana,Eastern Washington,4,4,NA,270340149,2007-02-03
153,2,19:42,1182,1182,Matt Dlouhy missed Two Point Layup.,41,42,-1,0,0.4611471514484879,0.4611471514484879,Montana,Eastern Washington,4,4,NA,270340149,2007-02-03
154,2,19:42,1182,1182,Andrew Strait Offensive Rebound.,41,42,-1,3,0.4611471514484879,0.4611471514484879,Montana,Eastern Washington,4,4,NA,270340149,2007-02-03
155,2,19:39,1179,1179,Andrew Strait made Two Point Layup.,43,42,1,18,0.5389137399514871,0.5389137399514871,Montana,Eastern Washington,4,4,NA,270340149,2007-02-03
156,2,19:21,1161,1161,Rodney Stuckey made Two Point Layup.,43,44,-1,17,0.4607254875201245,0.4607254875201245,Montana,Eastern Washington,4,4,NA,270340149,2007-02-03
157,2,19:04,1144,1144,Cameron Rundles missed Three Point Jumper.,43,44,-1,0,0.4603894019325894,0.4603894019325894,Montana,Eastern Washington,4,4,NA,270340149,2007-02-03
158,2,19:04,1144,1144,Matt Dlouhy Offensive Rebound.,43,44,-1,8,0.4603894019325894,0.4603894019325894,Montana,Eastern Washington,4,4,NA,270340149,2007-02-03
159,2,18:56,1136,1136,Andrew Strait made Two Point Layup.  Assisted by Matt Martin.,45,44,1,13,0.5397681679429107,0.5397681679429107,Montana,Eastern Washington,4,4,NA,270340149,2007-02-03
160,2,18:43,1123,1123,Matt Martin Steal.,45,44,1,22,0.5400245895643967,0.5400245895643967,Montana,Eastern Washington,4,4,NA,270340149,2007-02-03
161,2,18:21,1101,1101,Cameron Rundles made Two Point Jumper.  Assisted by Matt Martin.,47,44,3,38,0.6193108226158225,0.6193108226158225,Montana,Eastern Washington,4,4,NA,270340149,2007-02-03
162,2,17:43,1063,1063,Andrew Strait missed Two Point Jumper.,47,44,3,0,0.6215605854862549,0.6215605854862549,Montana,Eastern Washington,4,4,NA,270340149,2007-02-03
163,2,17:43,1063,1063,Kellen Williams Defensive Rebound.,47,44,3,10,0.6215605854862549,0.6215605854862549,Montana,Eastern Washington,4,4,NA,270340149,2007-02-03
164,2,17:33,1053,1053,Foul on Matt Dlouhy,47,44,3,0,0.6221823638071873,0.6221823638071873,Montana,Eastern Washington,4,4,NA,270340149,2007-02-03
165,2,17:33,1053,1053,Foul on Matt Dlouhy,47,44,3,0,0.6221823638071873,0.6221823638071873,Montana,Eastern Washington,4,4,NA,270340149,2007-02-03
