play_id,half,time_remaining_half,secs_remaining,secs_remaining_absolute,description,home_score,away_score,score_diff,play_length,win_prob,naive_win_prob,home,away,home_time_out_remaining,away_time_out_remaining,home_favored_by,game_id,date
166,2,17:33,1053,1053,Foul on Matt Dlouhy,47,44,3,0,0.6221823638071873,0.6221823638071873,Montana,Eastern Washington,4,4,NA,270340149,2007-02-03
167,2,17:33,1053,1053,Rodney Stuckey made Free Throw.,47,45,2,0,0.5823791508049622,0.5823791508049622,Montana,Eastern Washington,4,4,NA,270340149,2007-02-03
168,2,17:33,1053,1053,Rodney Stuckey made Free Throw.,47,46,1,17,0.5414729607477611,0.5414729607477611,Montana,Eastern Washington,4,4,NA,270340149,2007-02-03
169,2,17:16,1036,1036,Matt Martin missed Three Point Jumper.,47,46,1,0,0.541858628540527,0.541858628540527,Montana,Eastern Washington,4,4,NA,270340149,2007-02-03
170,2,17:16,1036,1036,Michael Taylor Defensive Rebound.,47,46,1,13,0.541858628540527,0.541858628540527,Montana,Eastern Washington,4,4,NA,270340149,2007-02-03
171,2,17:03,1023,1023,Rodney Stuckey missed Two Point Jumper.,47,46,1,0,0.5421668956975656,0.5421668956975656,Montana,Eastern Washington,4,4,NA,270340149,2007-02-03
172,2,17:03,1023,1023,Rodney Stuckey Offensive Rebound.,47,46,1,4,0.5421668956975656,0.5421668956975656,Montana,Eastern Washington,4,4,NA,270340149,2007-02-03
173,2,16:59,1019,1019,Rodney Stuckey made Two Point Layup.,47,48,-1,9,0.45773566549998235,0.45773566549998235,Montana,Eastern Washington,4,4,NA,270340149,2007-02-03
174,2,16:50,1010,1010,Foul on Michael Taylor,47,48,-1,1,0.4575116336799737,0.4575116336799737,Montana,Eastern Washington,4,4,NA,270340149,2007-02-03
175,2,16:49,1009,1009,Cameron Rundles made Three Point Jumper.,50,48,2,17,0.5844170624955853,0.5844170624955853,Montana,Eastern Washington,4,4,NA,270340149,2007-02-03
176,2,16:32,992,992,Marcus Hinton missed Two Point Layup.,50,48,2,0,0.5852865353705452,0.5852865353705452,Montana,Eastern Washington,4,4,NA,270340149,2007-02-03
177,2,16:32,992,992,Jordan Hasquet Defensive Rebound.,50,48,2,13,0.5852865353705452,0.5852865353705452,Montana,Eastern Washington,4,4,NA,270340149,2007-02-03
178,2,16:19,979,979,Andrew Strait missed Two Point Jumper.,50,48,2,3,0.5859885926243179,0.5859885926243179,Montana,Eastern Washington,4,4,NA,270340149,2007-02-03
179,2,16:16,976,976,Rodney Stuckey Defensive Rebound.,50,48,2,6,0.5861555239728773,0.5861555239728773,Montana,Eastern Washington,4,4,NA,270340149,2007-02-03
180,2,16:10,970,970,Kellen Williams made Two Point Layup.  Assisted by Rodney Stuckey.,50,50,0,26,0.5,0.5,Montana,Eastern Washington,4,4,NA,270340149,2007-02-03
181,2,15:44,944,944,Foul on Kellen Williams,50,50,0,0,0.5,0.5,Montana,Eastern Washington,4,4,NA,270340149,2007-02-03
182,2,15:44,944,944,Official TV Timeout.,50,50,0,4,0.5,0.5,Montana,Eastern Washington,4,4,NA,270340149,2007-02-03
183,2,15:40,940,940,Foul on Rodney Stuckey,50,50,0,11,0.5,0.5,Montana,Eastern Washington,4,4,NA,270340149,2007-02-03
184,2,15:29,929,929,Foul on Andrew Strait,50,50,0,12,0.5,0.5,Montana,Eastern Washington,4,4,NA,270340149,2007-02-03
185,2,15:17,917,917,Rodney Stuckey missed Three Point Jumper.,50,50,0,0,0.5,0.5,Montana,Eastern Washington,4,4,NA,270340149,2007-02-03
186,2,15:17,917,917,Cameron Rundles Defensive Rebound.,50,50,0,9,0.5,0.5,Montana,Eastern Washington,4,4,NA,270340149,2007-02-03
187,2,15:08,908,908,Andrew Strait made Two Point Jumper.  Assisted by Matt Martin.,52,50,2,17,0.5895398725267599,0.5895398725267599,Montana,Eastern Washington,4,4,NA,270340149,2007-02-03
188,2,14:51,891,891,Rodney Stuckey made Two Point Layup.  Assisted by Paul Butorac.,52,52,0,15,0.5,0.5,Montana,Eastern Washington,4,4,NA,270340149,2007-02-03
189,2,14:36,876,876,Matt Martin missed Two Point Jumper.,52,52,0,0,0.5,0.5,Montana,Eastern Washington,4,4,NA,270340149,2007-02-03
190,2,14:36,876,876,Jordan Hasquet Offensive Rebound.,52,52,0,4,0.5,0.5,Montana,Eastern Washington,4,4,NA,270340149,2007-02-03
191,2,14:32,872,872,Foul on Rhett Humphrey,52,52,0,7,0.5,0.5,Montana,Eastern Washington,4,4,NA,270340149,2007-02-03
192,2,14:25,865,865,Stuart Mayes missed Three Point Jumper.,52,52,0,0,0.5,0.5,Montana,Eastern Washington,4,4,NA,270340149,2007-02-03
193,2,14:25,865,865,Jordan Hasquet Offensive Rebound.,52,52,0,3,0.5,0.5,Montana,Eastern Washington,4,4,NA,270340149,2007-02-03
194,2,14:22,862,862,Jordan Hasquet made Two Point Tip Shot.,54,52,2,12,0.5914948580353234,0.5914948580353234,Montana,Eastern Washington,4,4,NA,270340149,2007-02-03
195,2,14:10,850,850,Paul Butorac made Two Point Dunk Shot.  Assisted by Rodney Stuckey.,54,54,0,23,0.5,0.5,Montana,Eastern Washington,4,4,NA,270340149,2007-02-03
196,2,13:47,827,827,Cameron Rundles made Two Point Jumper.,56,54,2,19,0.5930716785543344,0.5930716785543344,Montana,Eastern Washington,4,4,NA,270340149,2007-02-03
197,2,13:28,808,808,Paul Butorac missed Two Point Layup.,56,54,2,0,0.5940261384397535,0.5940261384397535,Montana,Eastern Washington,4,4,NA,270340149,2007-02-03
198,2,13:28,808,808,Marcus Hinton Offensive Rebound.,56,54,2,4,0.5940261384397535,0.5940261384397535,Montana,Eastern Washington,4,4,NA,270340149,2007-02-03
199,2,13:24,804,804,Rodney Stuckey missed Three Point Jumper.,56,54,2,0,0.5942393326298346,0.5942393326298346,Montana,Eastern Washington,4,4,NA,270340149,2007-02-03
200,2,13:24,804,804,Bryan Ellis Defensive Rebound.,56,54,2,8,0.5942393326298346,0.5942393326298346,Montana,Eastern Washington,4,4,NA,270340149,2007-02-03
201,2,13:16,796,796,Jordan Hasquet made Three Point Jumper.  Assisted by Andrew Strait.,59,54,5,16,0.7227954744188415,0.7227954744188415,Montana,Eastern Washington,4,4,NA,270340149,2007-02-03
202,2,13:00,780,780,Eastern Washington Full Timeout.,59,54,5,11,0.7247615269704947,0.7247615269704947,Montana,Eastern Washington,3,4,NA,270340149,2007-02-03
203,2,12:49,769,769,Foul on Kyle Sharp,59,54,5,12,0.7262274969301056,0.7262274969301056,Montana,Eastern Washington,3,4,NA,270340149,2007-02-03
204,2,12:37,757,757,Matt Penoncello made Three Point Jumper.  Assisted by Rodney Stuckey.,59,57,2,10,0.5971707589605687,0.5971707589605687,Montana,Eastern Washington,3,4,NA,270340149,2007-02-03
205,2,12:27,747,747,Stuart Mayes made Three Point Jumper.  Assisted by Cameron Rundles.,62,57,5,32,0.7294814297973601,0.7294814297973601,Montana,Eastern Washington,3,4,NA,270340149,2007-02-03
206,2,11:55,715,715,Paul Butorac made Two Point Jumper.  Assisted by Rodney Stuckey.,62,59,3,0,0.6482928367048543,0.6482928367048543,Montana,Eastern Washington,3,4,NA,270340149,2007-02-03
207,2,11:55,715,715,Foul on Cameron Rundles,62,59,3,0,0.6482928367048543,0.6482928367048543,Montana,Eastern Washington,3,4,NA,270340149,2007-02-03
208,2,11:55,715,715,Official TV Timeout.,62,59,3,0,0.6482928367048543,0.6482928367048543,Montana,Eastern Washington,3,4,NA,270340149,2007-02-03
209,2,11:55,715,715,Paul Butorac made Free Throw.,62,60,2,26,0.600535229781105,0.600535229781105,Montana,Eastern Washington,3,4,NA,270340149,2007-02-03
210,2,11:29,689,689,Matt Dlouhy missed Three Point Jumper.,62,60,2,0,0.6023952216245158,0.6023952216245158,Montana,Eastern Washington,3,4,NA,270340149,2007-02-03
211,2,11:29,689,689,Paul Butorac Defensive Rebound.,62,60,2,18,0.6023952216245158,0.6023952216245158,Montana,Eastern Washington,3,4,NA,270340149,2007-02-03
212,2,11:11,671,671,Rodney Stuckey missed Two Point Jumper.,62,60,2,0,0.6035683891510212,0.6035683891510212,Montana,Eastern Washington,3,4,NA,270340149,2007-02-03
213,2,11:11,671,671,Kyle Sharp Defensive Rebound.,62,60,2,1,0.6035683891510212,0.6035683891510212,Montana,Eastern Washington,3,4,NA,270340149,2007-02-03
214,2,11:10,670,670,Foul on Paul Butorac,62,60,2,17,0.6036323272566905,0.6036323272566905,Montana,Eastern Washington,3,4,NA,270340149,2007-02-03
215,2,10:53,653,653,Stuart Mayes made Two Point Layup.,64,60,4,31,0.7006366992943975,0.7006366992943975,Montana,Eastern Washington,3,4,NA,270340149,2007-02-03
216,2,10:22,622,622,Paul Butorac made Two Point Dunk Shot.  Assisted by Rodney Stuckey.,64,62,2,15,0.6068248477205334,0.6068248477205334,Montana,Eastern Washington,3,4,NA,270340149,2007-02-03
217,2,10:07,607,607,Stuart Mayes missed Three Point Jumper.,64,62,2,0,0.6079778080994711,0.6079778080994711,Montana,Eastern Washington,3,4,NA,270340149,2007-02-03
218,2,10:07,607,607,Matt Dlouhy Offensive Rebound.,64,62,2,4,0.6079778080994711,0.6079778080994711,Montana,Eastern Washington,3,4,NA,270340149,2007-02-03
219,2,10:03,603,603,Foul on Matt Penoncello,64,62,2,0,0.6083066085062183,0.6083066085062183,Montana,Eastern Washington,3,4,NA,270340149,2007-02-03
220,2,10:03,603,603,Matt Dlouhy made Free Throw.,65,62,3,0,0.659327666899458,0.659327666899458,Montana,Eastern Washington,3,4,NA,270340149,2007-02-03
221,2,10:03,603,603,Matt Dlouhy made Free Throw.,66,62,4,14,0.7069049697944811,0.7069049697944811,Montana,Eastern Washington,3,4,NA,270340149,2007-02-03
222,2,9:49,589,589,Omar Krayem made Two Point Jumper.,66,64,2,22,0.6095425412562356,0.6095425412562356,Montana,Eastern Washington,3,4,NA,270340149,2007-02-03
223,2,9:27,567,567,Matt Dlouhy missed Two Point Jumper.,66,64,2,0,0.6118066131650711,0.6118066131650711,Montana,Eastern Washington,3,4,NA,270340149,2007-02-03
224,2,9:27,567,567,Brandon Moore Defensive Rebound.,66,64,2,7,0.6118066131650711,0.6118066131650711,Montana,Eastern Washington,3,4,NA,270340149,2007-02-03
225,2,9:20,560,560,Jordan Hasquet Steal.,66,64,2,9,0.6126243729030989,0.6126243729030989,Montana,Eastern Washington,3,4,NA,270340149,2007-02-03
226,2,9:11,551,551,Andrew Strait made Two Point Layup.  Assisted by Matt Dlouhy.,68,64,4,1,0.7163118756618977,0.7163118756618977,Montana,Eastern Washington,3,4,NA,270340149,2007-02-03
227,2,9:10,550,550,Foul on Matt Penoncello,68,64,4,0,0.7165368459220158,0.7165368459220158,Montana,Eastern Washington,3,4,NA,270340149,2007-02-03
228,2,9:10,550,550,Andrew Strait missed Free Throw.,68,64,4,0,0.7165368459220158,0.7165368459220158,Montana,Eastern Washington,3,4,NA,270340149,2007-02-03
229,2,9:10,550,550,Brandon Moore Defensive Rebound.,68,64,4,8,0.7165368459220158,0.7165368459220158,Montana,Eastern Washington,3,4,NA,270340149,2007-02-03
230,2,9:02,542,542,Foul on Matt Martin,68,64,4,7,0.7182551060632127,0.7182551060632127,Montana,Eastern Washington,3,4,NA,270340149,2007-02-03
231,2,8:55,535,535,Omar Krayem missed Three Point Jumper.,68,64,4,0,0.7196296710900537,0.7196296710900537,Montana,Eastern Washington,3,4,NA,270340149,2007-02-03
232,2,8:55,535,535,Cameron Rundles Defensive Rebound.,68,64,4,27,0.7196296710900537,0.7196296710900537,Montana,Eastern Washington,3,4,NA,270340149,2007-02-03
233,2,8:28,508,508,Cameron Rundles missed Two Point Jumper.,68,64,4,0,0.724224673253511,0.724224673253511,Montana,Eastern Washington,3,4,NA,270340149,2007-02-03
234,2,8:28,508,508,Paul Butorac Defensive Rebound.,68,64,4,7,0.724224673253511,0.724224673253511,Montana,Eastern Washington,3,4,NA,270340149,2007-02-03
235,2,8:21,501,501,Foul on Andrew Strait,68,64,4,0,0.7253368267247017,0.7253368267247017,Montana,Eastern Washington,3,4,NA,270340149,2007-02-03
236,2,8:21,501,501,Rodney Stuckey missed Free Throw.,68,64,4,0,0.7253368267247017,0.7253368267247017,Montana,Eastern Washington,3,4,NA,270340149,2007-02-03
237,2,8:21,501,501,Jordan Hasquet Defensive Rebound.,68,64,4,15,0.7253368267247017,0.7253368267247017,Montana,Eastern Washington,3,4,NA,270340149,2007-02-03
238,2,8:06,486,486,Andrew Strait made Two Point Jumper.  Assisted by Jordan Hasquet.,70,64,6,19,0.8138277524097407,0.8138277524097407,Montana,Eastern Washington,3,4,NA,270340149,2007-02-03
239,2,7:47,467,467,Official TV Timeout.,70,64,6,19,0.8178017893538115,0.8178017893538115,Montana,Eastern Washington,3,4,NA,270340149,2007-02-03
240,2,7:28,448,448,Jordan Hasquet made Two Point Jumper.,72,64,8,22,0.8855324233704066,0.8855324233704066,Montana,Eastern Washington,3,4,NA,270340149,2007-02-03
241,2,7:06,426,426,Foul on Mike Chavez,72,64,8,0,0.89211139082969515,0.89211139082969515,Montana,Eastern Washington,3,4,NA,270340149,2007-02-03
242,2,7:06,426,426,Paul Butorac missed Free Throw.,72,64,8,0,0.89211139082969515,0.89211139082969515,Montana,Eastern Washington,3,4,NA,270340149,2007-02-03
243,2,7:06,426,426,null,72,64,8,0,0.89211139082969515,0.89211139082969515,Montana,Eastern Washington,3,4,NA,270340149,2007-02-03
244,2,7:06,426,426,Paul Butorac missed Free Throw.,72,64,8,0,0.89211139082969515,0.89211139082969515,Montana,Eastern Washington,3,4,NA,270340149,2007-02-03
245,2,7:06,426,426,Jordan Hasquet Defensive Rebound.,72,64,8,16,0.89211139082969515,0.89211139082969515,Montana,Eastern Washington,3,4,NA,270340149,2007-02-03
246,2,6:50,410,410,Matt Martin made Three Point Jumper.  Assisted by Matt Dlouhy.,75,64,11,10,0.9513321345649194,0.9513321345649194,Montana,Eastern Washington,3,4,NA,270340149,2007-02-03
247,2,6:40,400,400,Eastern Washington Full Timeout.,75,64,11,14,0.9531684273003286,0.9531684273003286,Montana,Eastern Washington,2,4,NA,270340149,2007-02-03
248,2,6:26,386,386,Foul on Mike Chavez,75,64,11,0,0.9556127417823346,0.9556127417823346,Montana,Eastern Washington,2,4,NA,270340149,2007-02-03
249,2,6:26,386,386,Brandon Moore made Free Throw.,75,65,10,0,0.942152881163108,0.942152881163108,Montana,Eastern Washington,2,4,NA,270340149,2007-02-03
250,2,6:26,386,386,Brandon Moore made Free Throw.,75,66,9,15,0.9249321155827656,0.9249321155827656,Montana,Eastern Washington,2,4,NA,270340149,2007-02-03
251,2,6:11,371,371,Omar Krayem Steal.,75,66,9,5,0.9284239124833227,0.9284239124833227,Montana,Eastern Washington,2,4,NA,270340149,2007-02-03
252,2,6:06,366,366,Rodney Stuckey missed Two Point Jumper.,75,66,9,0,0.929620343736262,0.929620343736262,Montana,Eastern Washington,2,4,NA,270340149,2007-02-03
253,2,6:06,366,366,Cameron Rundles Defensive Rebound.,75,66,9,12,0.929620343736262,0.929620343736262,Montana,Eastern Washington,2,4,NA,270340149,2007-02-03
254,2,5:54,354,354,Montana Full Timeout.,75,66,9,14,0.9326086692870414,0.9326086692870414,Montana,Eastern Washington,2,3,NA,270340149,2007-02-03
255,2,5:40,340,340,Jordan Hasquet missed Three Point Jumper.,75,66,9,0,0.9363733145523959,0.9363733145523959,Montana,Eastern Washington,2,3,NA,270340149,2007-02-03
256,2,5:40,340,340,Brandon Moore Defensive Rebound.,75,66,9,8,0.9363733145523959,0.9363733145523959,Montana,Eastern Washington,2,3,NA,270340149,2007-02-03
257,2,5:32,332,332,Omar Krayem missed Two Point Jumper.,75,66,9,0,0.9386871114970151,0.9386871114970151,Montana,Eastern Washington,2,3,NA,270340149,2007-02-03
258,2,5:32,332,332,Eastern Washington Offensive Reb.,75,66,9,2,0.9386871114970151,0.9386871114970151,Montana,Eastern Washington,2,3,NA,270340149,2007-02-03
259,2,5:30,330,330,Michael Taylor made Three Point Jumper.  Assisted by Rodney Stuckey.,75,69,6,26,0.8612795856735871,0.8612795856735871,Montana,Eastern Washington,2,3,NA,270340149,2007-02-03
260,2,5:04,304,304,Foul on Michael Taylor,75,69,6,0,0.8729624689590989,0.8729624689590989,Montana,Eastern Washington,2,3,NA,270340149,2007-02-03
261,2,5:04,304,304,Matt Martin made Free Throw.,76,69,7,0,0.9045335916070342,0.9045335916070342,Montana,Eastern Washington,2,3,NA,270340149,2007-02-03
262,2,5:04,304,304,Matt Martin made Free Throw.,77,69,8,27,0.9288977708271448,0.9288977708271448,Montana,Eastern Washington,2,3,NA,270340149,2007-02-03
263,2,4:37,277,277,Foul on Matt Martin,77,69,8,0,0.9301386920873754,0.9301386920873754,Montana,Eastern Washington,2,3,NA,270340149,2007-02-03
264,2,4:37,277,277,Michael Taylor made Free Throw.,77,70,7,0,0.9059552370472503,0.9059552370472503,Montana,Eastern Washington,2,3,NA,270340149,2007-02-03
265,2,4:37,277,277,Michael Taylor made Free Throw.,77,71,6,28,0.874529604528951,0.874529604528951,Montana,Eastern Washington,2,3,NA,270340149,2007-02-03
266,2,4:09,249,249,Rodney Stuckey Steal.,77,71,6,1,0.869311589384295,0.869311589384295,Montana,Eastern Washington,2,3,NA,270340149,2007-02-03
267,2,4:08,248,248,Eastern Washington Full Timeout.,77,71,6,19,0.869159810718717,0.869159810718717,Montana,Eastern Washington,1,3,NA,270340149,2007-02-03
268,2,3:49,229,229,Marcus Hinton made Three Point Jumper.  Assisted by Kellen Williams.,77,74,3,34,0.720037774507312,0.720037774507312,Montana,Eastern Washington,1,3,NA,270340149,2007-02-03
269,2,3:15,195,195,Jordan Hasquet made Two Point Jumper.,79,74,5,18,0.8488976477844373,0.8488976477844373,Montana,Eastern Washington,1,3,NA,270340149,2007-02-03
270,2,2:57,177,177,Foul on Stuart Mayes,79,74,5,0,0.8710925708284287,0.8710925708284287,Montana,Eastern Washington,1,3,NA,270340149,2007-02-03
271,2,2:57,177,177,Official TV Timeout.,79,74,5,0,0.8710925708284287,0.8710925708284287,Montana,Eastern Washington,1,3,NA,270340149,2007-02-03
272,2,2:57,177,177,Rodney Stuckey made Free Throw.,79,75,4,0,0.8217901038783516,0.8217901038783516,Montana,Eastern Washington,1,3,NA,270340149,2007-02-03
273,2,2:57,177,177,Rodney Stuckey made Free Throw.,79,76,3,3,0.7588513253365499,0.7588513253365499,Montana,Eastern Washington,1,3,NA,270340149,2007-02-03
274,2,2:54,174,174,Foul on Marcus Hinton,79,76,3,0,0.7623698321978384,0.7623698321978384,Montana,Eastern Washington,1,3,NA,270340149,2007-02-03
275,2,2:54,174,174,Bryan Ellis made Free Throw.,80,76,4,0,0.8255322345368348,0.8255322345368348,Montana,Eastern Washington,1,3,NA,270340149,2007-02-03
276,2,2:54,174,174,Bryan Ellis missed Free Throw.,80,76,4,0,0.8255322345368348,0.8255322345368348,Montana,Eastern Washington,1,3,NA,270340149,2007-02-03
277,2,2:54,174,174,Rodney Stuckey Defensive Rebound.,80,76,4,14,0.8255322345368348,0.8255322345368348,Montana,Eastern Washington,1,3,NA,270340149,2007-02-03
278,2,2:40,160,160,Foul on Stuart Mayes,80,76,4,0,0.8428494636782052,0.8428494636782052,Montana,Eastern Washington,1,3,NA,270340149,2007-02-03
279,2,2:40,160,160,Rodney Stuckey made Free Throw.,80,77,3,0,0.7789724190758391,0.7789724190758391,Montana,Eastern Washington,1,3,NA,270340149,2007-02-03
280,2,2:40,160,160,Rodney Stuckey made Free Throw.,80,78,2,30,0.6984214274071798,0.6984214274071798,Montana,Eastern Washington,1,3,NA,270340149,2007-02-03
281,2,2:10,130,130,Matt Dlouhy missed Three Point Jumper.,80,78,2,0,0.7307484574599653,0.7307484574599653,Montana,Eastern Washington,1,3,NA,270340149,2007-02-03
282,2,2:10,130,130,Jordan Hasquet Offensive Rebound.,80,78,2,4,0.7307484574599653,0.7307484574599653,Montana,Eastern Washington,1,3,NA,270340149,2007-02-03
283,2,2:06,126,126,Jordan Hasquet missed Two Point Jumper.,80,78,2,0,0.7355909108126285,0.7355909108126285,Montana,Eastern Washington,1,3,NA,270340149,2007-02-03
284,2,2:06,126,126,Brandon Moore Defensive Rebound.,80,78,2,23,0.7355909108126285,0.7355909108126285,Montana,Eastern Washington,1,3,NA,270340149,2007-02-03
285,2,1:43,103,103,Michael Taylor missed Three Point Jumper.,80,78,2,0,0.7663598677580039,0.7663598677580039,Montana,Eastern Washington,1,3,NA,270340149,2007-02-03
286,2,1:43,103,103,Stuart Mayes Defensive Rebound.,80,78,2,11,0.7663598677580039,0.7663598677580039,Montana,Eastern Washington,1,3,NA,270340149,2007-02-03
287,2,1:32,92,92,Montana Full Timeout.,80,78,2,36,0.7828078086985532,0.7828078086985532,Montana,Eastern Washington,1,2,NA,270340149,2007-02-03
288,2,0:56,56,56,Rodney Stuckey missed Two Point Jumper.,80,78,2,0,0.8370805484676724,0.8370805484676724,Montana,Eastern Washington,1,2,NA,270340149,2007-02-03
289,2,0:56,56,56,Andrew Strait Defensive Rebound.,80,78,2,17,0.8370805484676724,0.8370805484676724,Montana,Eastern Washington,1,2,NA,270340149,2007-02-03
290,2,0:39,39,39,Montana Full Timeout.,80,78,2,16,0.8619651488265819,0.8619651488265819,Montana,Eastern Washington,1,1,NA,270340149,2007-02-03
291,2,0:23,23,23,Foul on Brandon Moore,80,78,2,0,0.884110487845532,0.884110487845532,Montana,Eastern Washington,1,1,NA,270340149,2007-02-03
292,2,0:23,23,23,Bryan Ellis missed Free Throw.,80,78,2,0,0.884110487845532,0.884110487845532,Montana,Eastern Washington,1,1,NA,270340149,2007-02-03
293,2,0:23,23,23,null,80,78,2,0,0.884110487845532,0.884110487845532,Montana,Eastern Washington,1,1,NA,270340149,2007-02-03
294,2,0:23,23,23,Bryan Ellis made Free Throw.,81,78,3,7,0.954692519920652,0.954692519920652,Montana,Eastern Washington,1,1,NA,270340149,2007-02-03
295,2,0:16,16,16,Rodney Stuckey missed Two Point Layup.,81,78,3,0,0.9603490921001517,0.9603490921001517,Montana,Eastern Washington,1,1,NA,270340149,2007-02-03
296,2,0:16,16,16,Matt Dlouhy Defensive Rebound.,81,78,3,2,0.9603490921001517,0.9603490921001517,Montana,Eastern Washington,1,1,NA,270340149,2007-02-03
297,2,0:14,14,14,Foul on Michael Taylor,81,78,3,0,0.9618843639125265,0.9618843639125265,Montana,Eastern Washington,1,1,NA,270340149,2007-02-03
298,2,0:14,14,14,Matt Dlouhy made Free Throw.,82,78,4,0,0.9866705395591697,0.9866705395591697,Montana,Eastern Washington,1,1,NA,270340149,2007-02-03
299,2,0:14,14,14,Matt Dlouhy made Free Throw.,83,78,5,8,0.9954153640975865,0.9954153640975865,Montana,Eastern Washington,1,1,NA,270340149,2007-02-03
300,2,0:06,6,6,Marcus Hinton missed Two Point Layup.,83,78,5,0,0.9965374199946047,0.9965374199946047,Montana,Eastern Washington,1,1,NA,270340149,2007-02-03
301,2,0:06,6,6,Stuart Mayes Defensive Rebound.,83,78,5,2,0.9965374199946047,0.9965374199946047,Montana,Eastern Washington,1,1,NA,270340149,2007-02-03
302,2,0:04,4,4,Foul on Marcus Hinton,83,78,5,0,0.9967776226618401,0.9967776226618401,Montana,Eastern Washington,1,1,NA,270340149,2007-02-03
303,2,0:04,4,4,Stuart Mayes made Free Throw.,84,78,6,0,0.9989742346489092,0.9989742346489092,Montana,Eastern Washington,1,1,NA,270340149,2007-02-03
304,2,0:04,4,4,Stuart Mayes made Free Throw.,85,78,7,4,0.9996739623594854,0.9996739623594854,Montana,Eastern Washington,1,1,NA,270340149,2007-02-03
305,2,0:00,0,0,End Game,85,78,7,0,1,1,Montana,Eastern Washington,1,1,NA,270340149,2007-02-03
306,2,0:00,0,0,Rodney Stuckey missed Three Point Jumper.,85,78,7,0,1,1,Montana,Eastern Washington,1,1,NA,270340149,2007-02-03
307,2,0:00,0,0,null,85,78,7,0,1,1,Montana,Eastern Washington,1,1,NA,270340149,2007-02-03
