play_id,half,time_remaining_half,secs_remaining,secs_remaining_absolute,description,home_score,away_score,score_diff,play_length,win_prob,naive_win_prob,home,away,home_time_out_remaining,away_time_out_remaining,home_favored_by,game_id,date
1,1,20:00,2400,2400,PLAY,0,0,0,31,0.5,0.5,Arizona,Oregon,6,6,NA,280050012,2008-01-05
2,1,19:29,2369,2369,Jawann McClellan missed Three Point Jumper.,0,0,0,0,0.5,0.5,Arizona,Oregon,6,6,NA,280050012,2008-01-05
3,1,19:29,2369,2369,Bryce Taylor Defensive Rebound.,0,0,0,8,0.5,0.5,Arizona,Oregon,6,6,NA,280050012,2008-01-05
4,1,19:21,2361,2361,Churchill Odia missed Three Point Jumper.,0,0,0,0,0.5,0.5,Arizona,Oregon,6,6,NA,280050012,2008-01-05
5,1,19:21,2361,2361,Jawann McClellan Defensive Rebound.,0,0,0,24,0.5,0.5,Arizona,Oregon,6,6,NA,280050012,2008-01-05
6,1,18:57,2337,2337,Chase Budinger missed Three Point Jumper.,0,0,0,0,0.5,0.5,Arizona,Oregon,6,6,NA,280050012,2008-01-05
7,1,18:57,2337,2337,Jordan Hill Offensive Rebound.,0,0,0,4,0.5,0.5,Arizona,Oregon,6,6,NA,280050012,2008-01-05
8,1,18:53,2333,2333,Jordan Hill made Two Point Layup.,2,0,2,12,0.5454603446991073,0.5454603446991073,Arizona,Oregon,6,6,NA,280050012,2008-01-05
9,1,18:41,2321,2321,Malik Hairston made Two Point Layup.,2,2,0,17,0.5,0.5,Arizona,Oregon,6,6,NA,280050012,2008-01-05
10,1,18:24,2304,2304,Nic Wise missed Two Point Layup.,2,2,0,0,0.5,0.5,Arizona,Oregon,6,6,NA,280050012,2008-01-05
11,1,18:24,2304,2304,Malik Hairston Defensive Rebound.,2,2,0,44,0.5,0.5,Arizona,Oregon,6,6,NA,280050012,2008-01-05
12,1,17:40,2260,2260,Malik Hairston made Two Point Jumper.,2,4,-2,24,0.45291651372509034,0.45291651372509034,Arizona,Oregon,6,6,NA,280050012,2008-01-05
13,1,17:16,2236,2236,Nic Wise made Two Point Jumper.,4,4,0,19,0.5,0.5,Arizona,Oregon,6,6,NA,280050012,2008-01-05
14,1,16:57,2217,2217,Bryce Taylor made Two Point Layup.,4,6,-2,20,0.45193882090682996,0.45193882090682996,Arizona,Oregon,6,6,NA,280050012,2008-01-05
15,1,16:37,2197,2197,Bryce Taylor missed Three Point Jumper.,4,6,-2,0,0.45148012553608485,0.45148012553608485,Arizona,Oregon,6,6,NA,280050012,2008-01-05
16,1,16:37,2197,2197,Bret Brielmaier Defensive Rebound.,4,6,-2,21,0.45148012553608485,0.45148012553608485,Arizona,Oregon,6,6,NA,280050012,2008-01-05
17,1,16:16,2176,2176,Bret Brielmaier missed Two Point Layup.,4,6,-2,0,0.45099642576234333,0.45099642576234333,Arizona,Oregon,6,6,NA,280050012,2008-01-05
18,1,16:16,2176,2176,Maarty Leunen Defensive Rebound.,4,6,-2,9,0.45099642576234333,0.45099642576234333,Arizona,Oregon,6,6,NA,280050012,2008-01-05
19,1,16:07,2167,2167,Bryce Taylor missed Two Point Layup.,4,6,-2,0,0.4507885773459459,0.4507885773459459,Arizona,Oregon,6,6,NA,280050012,2008-01-05
20,1,16:07,2167,2167,Churchill Odia Offensive Rebound.,4,6,-2,4,0.4507885773459459,0.4507885773459459,Arizona,Oregon,6,6,NA,280050012,2008-01-05
21,1,16:03,2163,2163,Malik Hairston missed Three Point Jumper.,4,6,-2,0,0.45069604065537827,0.45069604065537827,Arizona,Oregon,6,6,NA,280050012,2008-01-05
22,1,16:03,2163,2163,Maarty Leunen Offensive Rebound.,4,6,-2,11,0.45069604065537827,0.45069604065537827,Arizona,Oregon,6,6,NA,280050012,2008-01-05
23,1,15:52,2152,2152,Maarty Leunen made Two Point Layup.,4,8,-4,2,0.40184619018168427,0.40184619018168427,Arizona,Oregon,6,6,NA,280050012,2008-01-05
24,1,15:50,2150,2150,Arizona Full Timeout.,4,8,-4,25,0.4017559252852223,0.4017559252852223,Arizona,Oregon,5,6,NA,280050012,2008-01-05
25,1,15:25,2125,2125,Chase Budinger made Two Point Jumper.,6,8,-2,5,0.4498106956225497,0.4498106956225497,Arizona,Oregon,5,6,NA,280050012,2008-01-05
26,1,15:20,2120,2120,Official TV Timeout.,6,8,-2,17,0.4496933047773432,0.4496933047773432,Arizona,Oregon,5,6,NA,280050012,2008-01-05
27,1,15:03,2103,2103,Chase Budinger made Three Point Jumper.,9,8,1,18,0.5254192842743747,0.5254192842743747,Arizona,Oregon,5,6,NA,280050012,2008-01-05
28,1,14:45,2085,2085,Foul on Jordan Hill,9,8,1,4,0.5256346501751078,0.5256346501751078,Arizona,Oregon,5,6,NA,280050012,2008-01-05
29,1,14:41,2081,2081,Malik Hairston missed Two Point Jumper.,9,8,1,0,0.5256827328619077,0.5256827328619077,Arizona,Oregon,5,6,NA,280050012,2008-01-05
30,1,14:41,2081,2081,Churchill Odia Offensive Rebound.,9,8,1,5,0.5256827328619077,0.5256827328619077,Arizona,Oregon,5,6,NA,280050012,2008-01-05
31,1,14:36,2076,2076,Bryce Taylor made Three Point Jumper.,9,11,-2,22,0.44865020993472177,0.44865020993472177,Arizona,Oregon,5,6,NA,280050012,2008-01-05
32,1,14:14,2054,2054,Jawann McClellan made Three Point Jumper.,12,11,1,37,0.5260095342158724,0.5260095342158724,Arizona,Oregon,5,6,NA,280050012,2008-01-05
33,1,13:37,2017,2017,Chase Budinger made Two Point Jumper.,14,11,3,15,0.5788043770931707,0.5788043770931707,Arizona,Oregon,5,6,NA,280050012,2008-01-05
34,1,13:22,2002,2002,Bryce Taylor made Three Point Jumper.,14,14,0,6,0.5,0.5,Arizona,Oregon,5,6,NA,280050012,2008-01-05
35,1,13:16,1996,1996,Foul on Frantz Dorsainvil,14,14,0,7,0.5,0.5,Arizona,Oregon,5,6,NA,280050012,2008-01-05
36,1,13:09,1989,1989,Chase Budinger made Three Point Jumper.,17,14,3,12,0.5798301585044262,0.5798301585044262,Arizona,Oregon,5,6,NA,280050012,2008-01-05
37,1,12:57,1977,1977,Bryce Taylor made Three Point Jumper.,17,17,0,25,0.5,0.5,Arizona,Oregon,5,6,NA,280050012,2008-01-05
38,1,12:32,1952,1952,Nic Wise missed Three Point Jumper.,17,17,0,0,0.5,0.5,Arizona,Oregon,5,6,NA,280050012,2008-01-05
39,1,12:32,1952,1952,Maarty Leunen Defensive Rebound.,17,17,0,10,0.5,0.5,Arizona,Oregon,5,6,NA,280050012,2008-01-05
40,1,12:22,1942,1942,Frantz Dorsainvil missed Two Point Jumper.,17,17,0,0,0.5,0.5,Arizona,Oregon,5,6,NA,280050012,2008-01-05
41,1,12:22,1942,1942,Frantz Dorsainvil Offensive Rebound.,17,17,0,2,0.5,0.5,Arizona,Oregon,5,6,NA,280050012,2008-01-05
42,1,12:20,1940,1940,Frantz Dorsainvil missed Two Point Layup.,17,17,0,0,0.5,0.5,Arizona,Oregon,5,6,NA,280050012,2008-01-05
43,1,12:20,1940,1940,Oregon Offensive Rebound.,17,17,0,9,0.5,0.5,Arizona,Oregon,5,6,NA,280050012,2008-01-05
44,1,12:11,1931,1931,Frantz Dorsainvil made Two Point Layup.,17,19,-2,0,0.4450552647319271,0.4450552647319271,Arizona,Oregon,5,6,NA,280050012,2008-01-05
45,1,12:11,1931,1931,Foul on Jordan Hill,17,19,-2,0,0.4450552647319271,0.4450552647319271,Arizona,Oregon,5,6,NA,280050012,2008-01-05
46,1,12:11,1931,1931,Frantz Dorsainvil missed Free Throw.,17,19,-2,0,0.4450552647319271,0.4450552647319271,Arizona,Oregon,5,6,NA,280050012,2008-01-05
47,1,12:11,1931,1931,Chase Budinger Defensive Rebound.,17,19,-2,14,0.4450552647319271,0.4450552647319271,Arizona,Oregon,5,6,NA,280050012,2008-01-05
48,1,11:57,1917,1917,Jawann McClellan missed Two Point Jumper.,17,19,-2,0,0.4446945680369782,0.4446945680369782,Arizona,Oregon,5,6,NA,280050012,2008-01-05
49,1,11:57,1917,1917,Chase Budinger Offensive Rebound.,17,19,-2,5,0.4446945680369782,0.4446945680369782,Arizona,Oregon,5,6,NA,280050012,2008-01-05
50,1,11:52,1912,1912,Chase Budinger made Two Point Layup.,19,19,0,9,0.5,0.5,Arizona,Oregon,5,6,NA,280050012,2008-01-05
51,1,11:43,1903,1903,Foul on Daniel Dillon,19,19,0,0,0.5,0.5,Arizona,Oregon,5,6,NA,280050012,2008-01-05
52,1,11:43,1903,1903,Official TV Timeout.,19,19,0,0,0.5,0.5,Arizona,Oregon,5,6,NA,280050012,2008-01-05
53,1,11:43,1903,1903,Maarty Leunen made Free Throw.,19,20,-1,0,0.47208048830366944,0.47208048830366944,Arizona,Oregon,5,6,NA,280050012,2008-01-05
54,1,11:43,1903,1903,Maarty Leunen made Free Throw.,19,21,-2,25,0.44433454131455286,0.44433454131455286,Arizona,Oregon,5,6,NA,280050012,2008-01-05
55,1,11:18,1878,1878,Tajuan Porter made Two Point Jumper.,19,23,-4,23,0.38879435770712584,0.38879435770712584,Arizona,Oregon,5,6,NA,280050012,2008-01-05
56,1,10:55,1855,1855,Foul on Frantz Dorsainvil,19,23,-4,1,0.3876540173449324,0.3876540173449324,Arizona,Oregon,5,6,NA,280050012,2008-01-05
57,1,10:54,1854,1854,Chase Budinger missed Three Point Jumper.,19,23,-4,0,0.3876043442500068,0.3876043442500068,Arizona,Oregon,5,6,NA,280050012,2008-01-05
58,1,10:54,1854,1854,Kamyron Brown Defensive Rebound.,19,23,-4,22,0.3876043442500068,0.3876043442500068,Arizona,Oregon,5,6,NA,280050012,2008-01-05
59,1,10:32,1832,1832,Foul on Bryce Taylor,19,23,-4,0,0.3865084360716648,0.3865084360716648,Arizona,Oregon,5,6,NA,280050012,2008-01-05
60,1,10:32,1832,1832,Daniel Dillon made Free Throw.,20,23,-3,0,0.41422908569997857,0.41422908569997857,Arizona,Oregon,5,6,NA,280050012,2008-01-05
61,1,10:32,1832,1832,Daniel Dillon made Free Throw.,21,23,-2,15,0.44250385571185863,0.44250385571185863,Arizona,Oregon,5,6,NA,280050012,2008-01-05
62,1,10:17,1817,1817,Malik Hairston made Two Point Jumper.,21,25,-4,0,0.3857567979387695,0.3857567979387695,Arizona,Oregon,5,6,NA,280050012,2008-01-05
63,1,10:17,1817,1817,Foul on Daniel Dillon,21,25,-4,0,0.3857567979387695,0.3857567979387695,Arizona,Oregon,5,6,NA,280050012,2008-01-05
64,1,10:17,1817,1817,Malik Hairston made Free Throw.,21,26,-5,19,0.35859216555121826,0.35859216555121826,Arizona,Oregon,5,6,NA,280050012,2008-01-05
65,1,9:58,1798,1798,Fendi Onobun made Two Point Jumper.,23,26,-3,10,0.4129157620872268,0.4129157620872268,Arizona,Oregon,5,6,NA,280050012,2008-01-05
66,1,9:48,1788,1788,Tajuan Porter missed Three Point Jumper.,23,26,-3,0,0.4125252198787567,0.4125252198787567,Arizona,Oregon,5,6,NA,280050012,2008-01-05
67,1,9:48,1788,1788,Chase Budinger Defensive Rebound.,23,26,-3,5,0.4125252198787567,0.4125252198787567,Arizona,Oregon,5,6,NA,280050012,2008-01-05
68,1,9:43,1783,1783,Jawann McClellan missed Two Point Jumper.,23,26,-3,0,0.412329083399423,0.412329083399423,Arizona,Oregon,5,6,NA,280050012,2008-01-05
69,1,9:43,1783,1783,Tajuan Porter Defensive Rebound.,23,26,-3,8,0.412329083399423,0.412329083399423,Arizona,Oregon,5,6,NA,280050012,2008-01-05
70,1,9:35,1775,1775,Churchill Odia made Three Point Jumper.,23,29,-6,2,0.3293134585656841,0.3293134585656841,Arizona,Oregon,5,6,NA,280050012,2008-01-05
71,1,9:33,1773,1773,Arizona Full Timeout.,23,29,-6,26,0.3291693567711609,0.3291693567711609,Arizona,Oregon,4,6,NA,280050012,2008-01-05
72,1,9:07,1747,1747,Jamelle Horne missed Two Point Layup.,23,29,-6,0,0.3272792748757018,0.3272792748757018,Arizona,Oregon,4,6,NA,280050012,2008-01-05
73,1,9:07,1747,1747,Maarty Leunen Defensive Rebound.,23,29,-6,12,0.3272792748757018,0.3272792748757018,Arizona,Oregon,4,6,NA,280050012,2008-01-05
74,1,8:55,1735,1735,Tajuan Porter missed Two Point Jumper.,23,29,-6,1,0.3263952462914194,0.3263952462914194,Arizona,Oregon,4,6,NA,280050012,2008-01-05
75,1,8:54,1734,1734,Maarty Leunen Offensive Rebound.,23,29,-6,0,0.3263212113937064,0.3263212113937064,Arizona,Oregon,4,6,NA,280050012,2008-01-05
76,1,8:54,1734,1734,Foul on Chase Budinger,23,29,-6,3,0.3263212113937064,0.3263212113937064,Arizona,Oregon,4,6,NA,280050012,2008-01-05
77,1,8:51,1731,1731,Foul on Fendi Onobun,23,29,-6,3,0.3260987566548157,0.3260987566548157,Arizona,Oregon,4,6,NA,280050012,2008-01-05
78,1,8:48,1728,1728,Maarty Leunen made Two Point Dunk Shot.,23,31,-8,27,0.2750404712482596,0.2750404712482596,Arizona,Oregon,4,6,NA,280050012,2008-01-05
79,1,8:21,1701,1701,Chase Budinger missed Two Point Jumper.,23,31,-8,0,0.27258350911392454,0.27258350911392454,Arizona,Oregon,4,6,NA,280050012,2008-01-05
80,1,8:21,1701,1701,Fendi Onobun Offensive Rebound.,23,31,-8,3,0.27258350911392454,0.27258350911392454,Arizona,Oregon,4,6,NA,280050012,2008-01-05
81,1,8:18,1698,1698,Fendi Onobun made Two Point Dunk Shot.,25,31,-6,8,0.32361429574860845,0.32361429574860845,Arizona,Oregon,4,6,NA,280050012,2008-01-05
82,1,8:10,1690,1690,Malik Hairston made Three Point Jumper.,25,34,-9,0,0.24786654305428796,0.24786654305428796,Arizona,Oregon,4,6,NA,280050012,2008-01-05
83,1,8:10,1690,1690,Arizona Full Timeout.,25,34,-9,18,0.24786654305428796,0.24786654305428796,Arizona,Oregon,3,6,NA,280050012,2008-01-05
84,1,7:52,1672,1672,Chase Budinger missed Three Point Jumper.,25,34,-9,0,0.24612272414286396,0.24612272414286396,Arizona,Oregon,3,6,NA,280050012,2008-01-05
85,1,7:52,1672,1672,Malik Hairston Defensive Rebound.,25,34,-9,14,0.24612272414286396,0.24612272414286396,Arizona,Oregon,3,6,NA,280050012,2008-01-05
86,1,7:38,1658,1658,Malik Hairston made Two Point Jumper.,25,36,-11,11,0.2015110583279583,0.2015110583279583,Arizona,Oregon,3,6,NA,280050012,2008-01-05
87,1,7:27,1647,1647,Official TV Timeout.,25,36,-11,0,0.2004255555519182,0.2004255555519182,Arizona,Oregon,3,6,NA,280050012,2008-01-05
88,1,7:27,1647,1647,Foul on Churchill Odia,25,36,-11,13,0.2004255555519182,0.2004255555519182,Arizona,Oregon,3,6,NA,280050012,2008-01-05
89,1,7:14,1634,1634,Nic Wise missed Two Point Jumper.,25,36,-11,0,0.19916139118888285,0.19916139118888285,Arizona,Oregon,3,6,NA,280050012,2008-01-05
90,1,7:14,1634,1634,Maarty Leunen Defensive Rebound.,25,36,-11,26,0.19916139118888285,0.19916139118888285,Arizona,Oregon,3,6,NA,280050012,2008-01-05
91,1,6:48,1608,1608,Tajuan Porter missed Two Point Jumper.,25,36,-11,0,0.19667686340367846,0.19667686340367846,Arizona,Oregon,3,6,NA,280050012,2008-01-05
92,1,6:48,1608,1608,Nic Wise Defensive Rebound.,25,36,-11,34,0.19667686340367846,0.19667686340367846,Arizona,Oregon,3,6,NA,280050012,2008-01-05
93,1,6:14,1574,1574,Kamyron Brown made Two Point Layup.,25,38,-13,12,0.15614389384870497,0.15614389384870497,Arizona,Oregon,3,6,NA,280050012,2008-01-05
94,1,6:02,1562,1562,Jamelle Horne missed Three Point Jumper.,25,38,-13,0,0.15501255825266297,0.15501255825266297,Arizona,Oregon,3,6,NA,280050012,2008-01-05
95,1,6:02,1562,1562,Oregon Defensive Rebound.,25,38,-13,19,0.15501255825266297,0.15501255825266297,Arizona,Oregon,3,6,NA,280050012,2008-01-05
96,1,5:43,1543,1543,Malik Hairston made Three Point Jumper.,25,41,-16,8,0.10869265645713719,0.10869265645713719,Arizona,Oregon,3,6,NA,280050012,2008-01-05
97,1,5:35,1535,1535,Arizona Full Timeout.,25,41,-16,23,0.10799048846513205,0.10799048846513205,Arizona,Oregon,2,6,NA,280050012,2008-01-05
98,1,5:12,1512,1512,Foul on Jawann McClellan,25,41,-16,36,0.10595035436611504,0.10595035436611504,Arizona,Oregon,2,6,NA,280050012,2008-01-05
99,1,4:36,1476,1476,Jawann McClellan missed Three Point Jumper.,25,41,-16,0,0.10266042739801132,0.10266042739801132,Arizona,Oregon,2,6,NA,280050012,2008-01-05
100,1,4:36,1476,1476,Bret Brielmaier Offensive Rebound.,25,41,-16,3,0.10266042739801132,0.10266042739801132,Arizona,Oregon,2,6,NA,280050012,2008-01-05
101,1,4:33,1473,1473,Foul on Malik Hairston,25,41,-16,0,0.1023793749407999,0.1023793749407999,Arizona,Oregon,2,6,NA,280050012,2008-01-05
102,1,4:33,1473,1473,Bret Brielmaier missed Free Throw.,25,41,-16,0,0.1023793749407999,0.1023793749407999,Arizona,Oregon,2,6,NA,280050012,2008-01-05
103,1,4:33,1473,1473,null,25,41,-16,0,0.1023793749407999,0.1023793749407999,Arizona,Oregon,2,6,NA,280050012,2008-01-05
104,1,4:33,1473,1473,Bret Brielmaier missed Free Throw.,25,41,-16,0,0.1023793749407999,0.1023793749407999,Arizona,Oregon,2,6,NA,280050012,2008-01-05
105,1,4:33,1473,1473,Bryce Taylor Defensive Rebound.,25,41,-16,10,0.1023793749407999,0.1023793749407999,Arizona,Oregon,2,6,NA,280050012,2008-01-05
106,1,4:23,1463,1463,Tajuan Porter made Three Point Jumper.,25,44,-19,32,0.06975830696850405,0.06975830696850405,Arizona,Oregon,2,6,NA,280050012,2008-01-05
107,1,3:51,1431,1431,Chase Budinger made Two Point Layup.,27,44,-17,8,0.08676888402420391,0.08676888402420391,Arizona,Oregon,2,6,NA,280050012,2008-01-05
108,1,3:43,1423,1423,Malik Hairston made Two Point Layup.,27,46,-19,5,0.06658122402823029,0.06658122402823029,Arizona,Oregon,2,6,NA,280050012,2008-01-05
109,1,3:38,1418,1418,Arizona Full Timeout.,27,46,-19,9,0.0662064281598909,0.0662064281598909,Arizona,Oregon,1,6,NA,280050012,2008-01-05
110,1,3:29,1409,1409,Chase Budinger missed Three Point Jumper.,27,46,-19,0,0.0655434883067208,0.0655434883067208,Arizona,Oregon,1,6,NA,280050012,2008-01-05
111,1,3:29,1409,1409,Tajuan Porter Defensive Rebound.,27,46,-19,13,0.0655434883067208,0.0655434883067208,Arizona,Oregon,1,6,NA,280050012,2008-01-05
112,1,3:16,1396,1396,Official TV Timeout.,27,46,-19,14,0.06460902571087578,0.06460902571087578,Arizona,Oregon,1,6,NA,280050012,2008-01-05
113,1,3:02,1382,1382,Daniel Dillon missed Three Point Jumper.,27,46,-19,0,0.06362743845607272,0.06362743845607272,Arizona,Oregon,1,6,NA,280050012,2008-01-05
114,1,3:02,1382,1382,Tajuan Porter Defensive Rebound.,27,46,-19,11,0.06362743845607272,0.06362743845607272,Arizona,Oregon,1,6,NA,280050012,2008-01-05
115,1,2:51,1371,1371,Malik Hairston missed Three Point Jumper.,27,46,-19,0,0.06286995009850231,0.06286995009850231,Arizona,Oregon,1,6,NA,280050012,2008-01-05
116,1,2:51,1371,1371,Nic Wise Defensive Rebound.,27,46,-19,24,0.06286995009850231,0.06286995009850231,Arizona,Oregon,1,6,NA,280050012,2008-01-05
117,1,2:27,1347,1347,Jawann McClellan missed Two Point Jumper.,27,46,-19,1,0.061243510164501816,0.061243510164501816,Arizona,Oregon,1,6,NA,280050012,2008-01-05
118,1,2:26,1346,1346,Jawann McClellan Offensive Rebound.,27,46,-19,1,0.06117619552816118,0.06117619552816118,Arizona,Oregon,1,6,NA,280050012,2008-01-05
119,1,2:25,1345,1345,Jawann McClellan made Two Point Layup.,29,46,-17,0,0.0798447244192303,0.0798447244192303,Arizona,Oregon,1,6,NA,280050012,2008-01-05
120,1,2:25,1345,1345,Foul on Bryce Taylor,29,46,-17,0,0.0798447244192303,0.0798447244192303,Arizona,Oregon,1,6,NA,280050012,2008-01-05
121,1,2:25,1345,1345,Jawann McClellan made Free Throw.,30,46,-16,23,0.09106773992461915,0.09106773992461915,Arizona,Oregon,1,6,NA,280050012,2008-01-05
122,1,2:02,1322,1322,Kamyron Brown missed Two Point Layup.,30,46,-16,0,0.08918291486907785,0.08918291486907785,Arizona,Oregon,1,6,NA,280050012,2008-01-05
123,1,2:02,1322,1322,Chase Budinger Defensive Rebound.,30,46,-16,7,0.08918291486907785,0.08918291486907785,Arizona,Oregon,1,6,NA,280050012,2008-01-05
124,1,1:55,1315,1315,Foul on Daniel Dillon,30,46,-16,40,0.08860494930017823,0.08860494930017823,Arizona,Oregon,1,6,NA,280050012,2008-01-05
125,1,1:15,1275,1275,Chase Budinger made Two Point Layup.,32,46,-14,8,0.1113697510262538,0.1113697510262538,Arizona,Oregon,1,6,NA,280050012,2008-01-05
126,1,1:07,1267,1267,Foul on Fendi Onobun,32,46,-14,0,0.11058812508982986,0.11058812508982986,Arizona,Oregon,1,6,NA,280050012,2008-01-05
127,1,1:07,1267,1267,Kamyron Brown made Free Throw.,32,47,-15,0,0.09676842087749642,0.09676842087749642,Arizona,Oregon,1,6,NA,280050012,2008-01-05
128,1,1:07,1267,1267,Kamyron Brown made Free Throw.,32,48,-16,30,0.08451160571916708,0.08451160571916708,Arizona,Oregon,1,6,NA,280050012,2008-01-05
129,1,0:37,1237,1237,Chase Budinger made Two Point Layup.,34,48,-14,0,0.10753355329610267,0.10753355329610267,Arizona,Oregon,1,6,NA,280050012,2008-01-05
130,1,0:37,1237,1237,Foul on Churchill Odia,34,48,-14,0,0.10753355329610267,0.10753355329610267,Arizona,Oregon,1,6,NA,280050012,2008-01-05
131,1,0:37,1237,1237,Oregon Full Timeout.,34,48,-14,0,0.10753355329610267,0.10753355329610267,Arizona,Oregon,1,5,NA,280050012,2008-01-05
132,1,0:37,1237,1237,Chase Budinger made Free Throw.,35,48,-13,36,0.12292373222782851,0.12292373222782851,Arizona,Oregon,1,5,NA,280050012,2008-01-05
133,1,0:01,1201,1201,Nic Wise made Two Point Layup.,37,48,-11,1,0.15504074534562381,0.15504074534562381,Arizona,Oregon,1,5,NA,280050012,2008-01-05
134,1,0:00,1200,1200,End of the 1st Half.,37,48,-11,0,0.15491898598161316,0.15491898598161316,Arizona,Oregon,1,5,NA,280050012,2008-01-05
135,2,20:00,1200,1200,PLAY,37,48,-11,37,0.15491898598161316,0.15491898598161316,Arizona,Oregon,1,5,NA,280050012,2008-01-05
136,2,19:23,1163,1163,Maarty Leunen missed Three Point Jumper.,37,48,-11,0,0.15060226391120707,0.15060226391120707,Arizona,Oregon,1,5,NA,280050012,2008-01-05
137,2,19:23,1163,1163,Daniel Dillon Defensive Rebound.,37,48,-11,44,0.15060226391120707,0.15060226391120707,Arizona,Oregon,1,5,NA,280050012,2008-01-05
138,2,18:39,1119,1119,Malik Hairston missed Two Point Jumper.,37,48,-11,0,0.145745818302674,0.145745818302674,Arizona,Oregon,1,5,NA,280050012,2008-01-05
139,2,18:39,1119,1119,Malik Hairston Offensive Rebound.,37,48,-11,0,0.145745818302674,0.145745818302674,Arizona,Oregon,1,5,NA,280050012,2008-01-05
140,2,18:39,1119,1119,Foul on Jordan Hill,37,48,-11,0,0.145745818302674,0.145745818302674,Arizona,Oregon,1,5,NA,280050012,2008-01-05
141,2,18:39,1119,1119,Malik Hairston missed Free Throw.,37,48,-11,0,0.145745818302674,0.145745818302674,Arizona,Oregon,1,5,NA,280050012,2008-01-05
142,2,18:39,1119,1119,null,37,48,-11,0,0.145745818302674,0.145745818302674,Arizona,Oregon,1,5,NA,280050012,2008-01-05
143,2,18:39,1119,1119,Malik Hairston made Free Throw.,37,49,-12,18,0.1268474526946551,0.1268474526946551,Arizona,Oregon,1,5,NA,280050012,2008-01-05
144,2,18:21,1101,1101,Foul on Churchill Odia,37,49,-12,0,0.12493591538923068,0.12493591538923068,Arizona,Oregon,1,5,NA,280050012,2008-01-05
145,2,18:21,1101,1101,Chase Budinger made Free Throw.,38,49,-11,0,0.1437744382023626,0.1437744382023626,Arizona,Oregon,1,5,NA,280050012,2008-01-05
146,2,18:21,1101,1101,Chase Budinger made Free Throw.,39,49,-10,12,0.16491819019837314,0.16491819019837314,Arizona,Oregon,1,5,NA,280050012,2008-01-05
147,2,18:09,1089,1089,Kamyron Brown made Two Point Layup.,39,51,-12,26,0.12365260673981561,0.12365260673981561,Arizona,Oregon,1,5,NA,280050012,2008-01-05
148,2,17:43,1063,1063,Jordan Hill made Two Point Layup.,41,51,-10,10,0.16057922662972107,0.16057922662972107,Arizona,Oregon,1,5,NA,280050012,2008-01-05
149,2,17:33,1053,1053,Maarty Leunen made Three Point Jumper.,41,54,-13,19,0.10325588893124965,0.10325588893124965,Arizona,Oregon,1,5,NA,280050012,2008-01-05
150,2,17:14,1034,1034,Jawann McClellan missed Three Point Jumper.,41,54,-13,0,0.10117861424821378,0.10117861424821378,Arizona,Oregon,1,5,NA,280050012,2008-01-05
151,2,17:14,1034,1034,Kamyron Brown Defensive Rebound.,41,54,-13,8,0.10117861424821378,0.10117861424821378,Arizona,Oregon,1,5,NA,280050012,2008-01-05
152,2,17:06,1026,1026,Kamyron Brown missed Three Point Jumper.,41,54,-13,0,0.10028021755138355,0.10028021755138355,Arizona,Oregon,1,5,NA,280050012,2008-01-05
153,2,17:06,1026,1026,Daniel Dillon Defensive Rebound.,41,54,-13,13,0.10028021755138355,0.10028021755138355,Arizona,Oregon,1,5,NA,280050012,2008-01-05
154,2,16:53,1013,1013,Jordan Hill missed Two Point Layup.,41,54,-13,0,0.09878615149649761,0.09878615149649761,Arizona,Oregon,1,5,NA,280050012,2008-01-05
155,2,16:53,1013,1013,Maarty Leunen Defensive Rebound.,41,54,-13,20,0.09878615149649761,0.09878615149649761,Arizona,Oregon,1,5,NA,280050012,2008-01-05
156,2,16:33,993,993,Bryce Taylor missed Three Point Jumper.,41,54,-13,0,0.09639570496186427,0.09639570496186427,Arizona,Oregon,1,5,NA,280050012,2008-01-05
157,2,16:33,993,993,Chase Budinger Defensive Rebound.,41,54,-13,7,0.09639570496186427,0.09639570496186427,Arizona,Oregon,1,5,NA,280050012,2008-01-05
158,2,16:26,986,986,Nic Wise made Two Point Layup.,43,54,-11,11,0.12987404274660785,0.12987404274660785,Arizona,Oregon,1,5,NA,280050012,2008-01-05
159,2,16:15,975,975,Oregon Full Timeout.,43,54,-11,26,0.12833140384788838,0.12833140384788838,Arizona,Oregon,1,4,NA,280050012,2008-01-05
160,2,15:49,949,949,Kamyron Brown made Two Point Layup.,43,56,-13,28,0.09094997288815558,0.09094997288815558,Arizona,Oregon,1,4,NA,280050012,2008-01-05
161,2,15:21,921,921,Nic Wise made Three Point Jumper.,46,56,-10,37,0.14204112212531397,0.14204112212531397,Arizona,Oregon,1,4,NA,280050012,2008-01-05
162,2,14:44,884,884,Bryce Taylor missed Three Point Jumper.,46,56,-10,1,0.1380644623847283,0.1380644623847283,Arizona,Oregon,1,4,NA,280050012,2008-01-05
163,2,14:43,883,883,Chase Budinger Defensive Rebound.,46,56,-10,2,0.13796078698217543,0.13796078698217543,Arizona,Oregon,1,4,NA,280050012,2008-01-05
164,2,14:41,881,881,Foul on Malik Hairston,46,56,-10,0,0.1377536437528479,0.1377536437528479,Arizona,Oregon,1,4,NA,280050012,2008-01-05
165,2,14:41,881,881,Official TV Timeout.,46,56,-10,32,0.1377536437528479,0.1377536437528479,Arizona,Oregon,1,4,NA,280050012,2008-01-05
166,2,14:09,849,849,Jordan Hill made Two Point Jumper.,48,56,-8,19,0.18392744603335093,0.18392744603335093,Arizona,Oregon,1,4,NA,280050012,2008-01-05
167,2,13:50,830,830,Maarty Leunen made Two Point Layup.,48,58,-10,26,0.13233968507292476,0.13233968507292476,Arizona,Oregon,1,4,NA,280050012,2008-01-05
168,2,13:24,804,804,Chase Budinger made Two Point Layup.,50,58,-8,33,0.17856873977208323,0.17856873977208323,Arizona,Oregon,1,4,NA,280050012,2008-01-05
169,2,12:51,771,771,Kamyron Brown missed Two Point Layup.,50,58,-8,0,0.17383313420949517,0.17383313420949517,Arizona,Oregon,1,4,NA,280050012,2008-01-05
170,2,12:51,771,771,Jordan Hill Defensive Rebound.,50,58,-8,14,0.17383313420949517,0.17383313420949517,Arizona,Oregon,1,4,NA,280050012,2008-01-05
171,2,12:37,757,757,Jordan Hill missed Two Point Dunk Shot.,50,58,-8,0,0.1715386765084985,0.1715386765084985,Arizona,Oregon,1,4,NA,280050012,2008-01-05
172,2,12:37,757,757,Jordan Hill Offensive Rebound.,50,58,-8,2,0.1715386765084985,0.1715386765084985,Arizona,Oregon,1,4,NA,280050012,2008-01-05
173,2,12:35,755,755,Jordan Hill made Two Point Layup.,52,58,-6,5,0.23453380055315534,0.23453380055315534,Arizona,Oregon,1,4,NA,280050012,2008-01-05
174,2,12:30,750,750,Oregon Full Timeout.,52,58,-6,20,0.23370111028665497,0.23370111028665497,Arizona,Oregon,1,3,NA,280050012,2008-01-05
175,2,12:10,730,730,Tajuan Porter missed Three Point Jumper.,52,58,-6,0,0.2300977379453397,0.2300977379453397,Arizona,Oregon,1,3,NA,280050012,2008-01-05
176,2,12:10,730,730,Maarty Leunen Offensive Rebound.,52,58,-6,3,0.2300977379453397,0.2300977379453397,Arizona,Oregon,1,3,NA,280050012,2008-01-05
177,2,12:07,727,727,Maarty Leunen made Two Point Layup.,52,60,-8,23,0.16594795234099238,0.16594795234099238,Arizona,Oregon,1,3,NA,280050012,2008-01-05
178,2,11:44,704,704,Jordan Hill missed Two Point Layup.,52,60,-8,0,0.16185811743540313,0.16185811743540313,Arizona,Oregon,1,3,NA,280050012,2008-01-05
179,2,11:44,704,704,Maarty Leunen Defensive Rebound.,52,60,-8,5,0.16185811743540313,0.16185811743540313,Arizona,Oregon,1,3,NA,280050012,2008-01-05
180,2,11:39,699,699,Kamyron Brown made Two Point Layup.,52,62,-10,23,0.11274589661732938,0.11274589661732938,Arizona,Oregon,1,3,NA,280050012,2008-01-05
