play_id,half,time_remaining_half,secs_remaining,secs_remaining_absolute,description,home_score,away_score,score_diff,play_length,win_prob,naive_win_prob,home,away,home_time_out_remaining,away_time_out_remaining,home_favored_by,game_id,date
1,1,20:00,2400,2400,PLAY,0,0,0,30,0.5,0.5,San José St,Hawai'i,6,6,NA,290590023,2009-02-28
2,1,19:30,2370,2370,C.J. Webster made Two Point Jumper.,2,0,2,21,0.5446607376595273,0.5446607376595273,San José St,Hawai'i,6,6,NA,290590023,2009-02-28
3,1,19:09,2349,2349,Hiram Thompson missed Two Point Jumper.,2,0,2,0,0.5451124007901187,0.5451124007901187,San José St,Hawai'i,6,6,NA,290590023,2009-02-28
4,1,19:09,2349,2349,Chris Oakes Defensive Rebound.,2,0,2,11,0.5451124007901187,0.5451124007901187,San José St,Hawai'i,6,6,NA,290590023,2009-02-28
5,1,18:58,2338,2338,Robert Owens missed Three Point Jumper.,2,0,2,0,0.5453512728162102,0.5453512728162102,San José St,Hawai'i,6,6,NA,290590023,2009-02-28
6,1,18:58,2338,2338,Kareem Nitoto Defensive Rebound.,2,0,2,8,0.5453512728162102,0.5453512728162102,San José St,Hawai'i,6,6,NA,290590023,2009-02-28
7,1,18:50,2330,2330,Foul on Chris Oakes,2,0,2,0,0.5455259319330696,0.5455259319330696,San José St,Hawai'i,6,6,NA,290590023,2009-02-28
8,1,18:50,2330,2330,Bill Amis made Free Throw.,2,1,1,0,0.5228103413139579,0.5228103413139579,San José St,Hawai'i,6,6,NA,290590023,2009-02-28
9,1,18:50,2330,2330,Bill Amis made Free Throw.,2,2,0,16,0.5,0.5,San José St,Hawai'i,6,6,NA,290590023,2009-02-28
10,1,18:34,2314,2314,Chris Oakes Turnover.,2,2,0,17,0.5,0.5,San José St,Hawai'i,6,6,NA,290590023,2009-02-28
11,1,18:17,2297,2297,Foul on Roderick Flemings,2,2,0,0,0.5,0.5,San José St,Hawai'i,6,6,NA,290590023,2009-02-28
12,1,18:17,2297,2297,Roderick Flemings Turnover.,2,2,0,14,0.5,0.5,San José St,Hawai'i,6,6,NA,290590023,2009-02-28
13,1,18:03,2283,2283,Justin Graham Turnover.,2,2,0,1,0.5,0.5,San José St,Hawai'i,6,6,NA,290590023,2009-02-28
14,1,18:02,2282,2282,Kareem Nitoto Steal.,2,2,0,8,0.5,0.5,San José St,Hawai'i,6,6,NA,290590023,2009-02-28
15,1,17:54,2274,2274,Hiram Thompson missed Three Point Jumper.,2,2,0,0,0.5,0.5,San José St,Hawai'i,6,6,NA,290590023,2009-02-28
16,1,17:54,2274,2274,Chris Oakes Defensive Rebound.,2,2,0,11,0.5,0.5,San José St,Hawai'i,6,6,NA,290590023,2009-02-28
17,1,17:43,2263,2263,Adrian Oliver missed Two Point Jumper.,2,2,0,0,0.5,0.5,San José St,Hawai'i,6,6,NA,290590023,2009-02-28
18,1,17:43,2263,2263,Bill Amis Defensive Rebound.,2,2,0,22,0.5,0.5,San José St,Hawai'i,6,6,NA,290590023,2009-02-28
19,1,17:21,2241,2241,Hiram Thompson made Three Point Jumper.  Assisted by Paul Campbell.,2,5,-3,26,0.42899661567395236,0.42899661567395236,San José St,Hawai'i,6,6,NA,290590023,2009-02-28
20,1,16:55,2215,2215,C.J. Webster made Two Point Jumper.,4,5,-1,21,0.4758905994922459,0.4758905994922459,San José St,Hawai'i,6,6,NA,290590023,2009-02-28
21,1,16:34,2194,2194,Bill Amis missed Two Point Jumper.,4,5,-1,0,0.4756479436731543,0.4756479436731543,San José St,Hawai'i,6,6,NA,290590023,2009-02-28
22,1,16:34,2194,2194,Paul Campbell Offensive Rebound.,4,5,-1,5,0.4756479436731543,0.4756479436731543,San José St,Hawai'i,6,6,NA,290590023,2009-02-28
23,1,16:29,2189,2189,Bill Amis made Two Point Jumper.  Assisted by Paul Campbell.,4,7,-3,20,0.4272321289499767,0.4272321289499767,San José St,Hawai'i,6,6,NA,290590023,2009-02-28
24,1,16:09,2169,2169,Justin Graham Turnover.,4,7,-3,13,0.4265484511850659,0.4265484511850659,San José St,Hawai'i,6,6,NA,290590023,2009-02-28
25,1,15:56,2156,2156,Foul on Roderick Flemings,4,7,-3,0,0.42610243240420215,0.42610243240420215,San José St,Hawai'i,6,6,NA,290590023,2009-02-28
26,1,15:56,2156,2156,Roderick Flemings Turnover.,4,7,-3,0,0.42610243240420215,0.42610243240420215,San José St,Hawai'i,6,6,NA,290590023,2009-02-28
27,1,15:56,2156,2156,Official TV Timeout.,4,7,-3,33,0.42610243240420215,0.42610243240420215,San José St,Hawai'i,6,6,NA,290590023,2009-02-28
28,1,15:23,2123,2123,Adrian Oliver missed Two Point Jumper.,4,7,-3,0,0.4249616426561243,0.4249616426561243,San José St,Hawai'i,6,6,NA,290590023,2009-02-28
29,1,15:23,2123,2123,Hiram Thompson Defensive Rebound.,4,7,-3,24,0.4249616426561243,0.4249616426561243,San José St,Hawai'i,6,6,NA,290590023,2009-02-28
30,1,14:59,2099,2099,Roderick Flemings missed Two Point Jumper.,4,7,-3,0,0.42412345328782564,0.42412345328782564,San José St,Hawai'i,6,6,NA,290590023,2009-02-28
31,1,14:59,2099,2099,C.J. Webster Defensive Rebound.,4,7,-3,11,0.42412345328782564,0.42412345328782564,San José St,Hawai'i,6,6,NA,290590023,2009-02-28
32,1,14:48,2088,2088,Robert Owens made Three Point Jumper.  Assisted by Justin Graham.,7,7,0,16,0.5,0.5,San José St,Hawai'i,6,6,NA,290590023,2009-02-28
33,1,14:32,2072,2072,Bill Amis missed Two Point Jumper.,7,7,0,0,0.5,0.5,San José St,Hawai'i,6,6,NA,290590023,2009-02-28
34,1,14:32,2072,2072,Robert Owens Defensive Rebound.,7,7,0,6,0.5,0.5,San José St,Hawai'i,6,6,NA,290590023,2009-02-28
35,1,14:26,2066,2066,Robert Owens Turnover.,7,7,0,1,0.5,0.5,San José St,Hawai'i,6,6,NA,290590023,2009-02-28
36,1,14:25,2065,2065,Bill Amis Steal.,7,7,0,20,0.5,0.5,San José St,Hawai'i,6,6,NA,290590023,2009-02-28
37,1,14:05,2045,2045,Hiram Thompson missed Two Point Layup.,7,7,0,0,0.5,0.5,San José St,Hawai'i,6,6,NA,290590023,2009-02-28
38,1,14:05,2045,2045,Robert Owens Defensive Rebound.,7,7,0,29,0.5,0.5,San José St,Hawai'i,6,6,NA,290590023,2009-02-28
39,1,13:36,2016,2016,Robert Owens missed Three Point Jumper.,7,7,0,0,0.5,0.5,San José St,Hawai'i,6,6,NA,290590023,2009-02-28
40,1,13:36,2016,2016,Chris Oakes Offensive Rebound.,7,7,0,2,0.5,0.5,San José St,Hawai'i,6,6,NA,290590023,2009-02-28
41,1,13:34,2014,2014,Chris Oakes made Two Point Layup.,9,7,2,18,0.5528543309949765,0.5528543309949765,San José St,Hawai'i,6,6,NA,290590023,2009-02-28
42,1,13:16,1996,1996,Roderick Flemings made Two Point Layup.,9,9,0,0,0.5,0.5,San José St,Hawai'i,6,6,NA,290590023,2009-02-28
43,1,13:16,1996,1996,Foul on Justin Graham,9,9,0,0,0.5,0.5,San José St,Hawai'i,6,6,NA,290590023,2009-02-28
44,1,13:16,1996,1996,Roderick Flemings missed Free Throw.,9,9,0,0,0.5,0.5,San José St,Hawai'i,6,6,NA,290590023,2009-02-28
45,1,13:16,1996,1996,C.J. Webster Defensive Rebound.,9,9,0,14,0.5,0.5,San José St,Hawai'i,6,6,NA,290590023,2009-02-28
46,1,13:02,1982,1982,Foul on C.J. Webster,9,9,0,0,0.5,0.5,San José St,Hawai'i,6,6,NA,290590023,2009-02-28
47,1,13:02,1982,1982,C.J. Webster Turnover.,9,9,0,16,0.5,0.5,San José St,Hawai'i,6,6,NA,290590023,2009-02-28
48,1,12:46,1966,1966,Kareem Nitoto Turnover.,9,9,0,17,0.5,0.5,San José St,Hawai'i,6,6,NA,290590023,2009-02-28
49,1,12:29,1949,1949,C.J. Webster missed Two Point Jumper.,9,9,0,0,0.5,0.5,San José St,Hawai'i,6,6,NA,290590023,2009-02-28
50,1,12:29,1949,1949,Brandon Adams Defensive Rebound.,9,9,0,18,0.5,0.5,San José St,Hawai'i,6,6,NA,290590023,2009-02-28
51,1,12:11,1931,1931,Kareem Nitoto made Two Point Layup.  Assisted by Roderick Flemings.,9,11,-2,29,0.4450552647319271,0.4450552647319271,San José St,Hawai'i,6,6,NA,290590023,2009-02-28
52,1,11:42,1902,1902,Foul on Bill Amis,9,11,-2,0,0.4443088399978549,0.4443088399978549,San José St,Hawai'i,6,6,NA,290590023,2009-02-28
53,1,11:42,1902,1902,Official TV Timeout.,9,11,-2,0,0.4443088399978549,0.4443088399978549,San José St,Hawai'i,6,6,NA,290590023,2009-02-28
54,1,11:42,1902,1902,Tim Pierce made Free Throw.,10,11,-1,0,0.4720675168827789,0.4720675168827789,San José St,Hawai'i,6,6,NA,290590023,2009-02-28
55,1,11:42,1902,1902,Tim Pierce missed Free Throw.,10,11,-1,0,0.4720675168827789,0.4720675168827789,San José St,Hawai'i,6,6,NA,290590023,2009-02-28
56,1,11:42,1902,1902,Bill Amis Defensive Rebound.,10,11,-1,28,0.4720675168827789,0.4720675168827789,San José St,Hawai'i,6,6,NA,290590023,2009-02-28
57,1,11:14,1874,1874,Brandon Adams missed Two Point Jumper.,10,11,-1,0,0.47170422597965794,0.47170422597965794,San José St,Hawai'i,6,6,NA,290590023,2009-02-28
58,1,11:14,1874,1874,San Jose State Defensive Rebound.,10,11,-1,16,0.47170422597965794,0.47170422597965794,San José St,Hawai'i,6,6,NA,290590023,2009-02-28
59,1,10:58,1858,1858,Devonte Thomas made Two Point Jumper.  Assisted by Adrian Oliver.,12,11,1,20,0.5285038577786433,0.5285038577786433,San José St,Hawai'i,6,6,NA,290590023,2009-02-28
60,1,10:38,1838,1838,Kareem Nitoto Turnover.,12,11,1,16,0.5287650587312349,0.5287650587312349,San José St,Hawai'i,6,6,NA,290590023,2009-02-28
61,1,10:22,1822,1822,Adrian Oliver made Two Point Jumper.  Assisted by Devonte Thomas.,14,11,3,8,0.5861551620920435,0.5861551620920435,San José St,Hawai'i,6,6,NA,290590023,2009-02-28
62,1,10:14,1814,1814,Bill Amis made Two Point Layup.  Assisted by Hiram Thompson.,14,13,1,26,0.5290809272471098,0.5290809272471098,San José St,Hawai'i,6,6,NA,290590023,2009-02-28
63,1,9:48,1788,1788,Devonte Thomas made Two Point Jumper.  Assisted by Tim Pierce.,16,13,3,33,0.5874747801212433,0.5874747801212433,San José St,Hawai'i,6,6,NA,290590023,2009-02-28
64,1,9:15,1755,1755,Hiram Thompson made Three Point Jumper.,16,16,0,13,0.5,0.5,San José St,Hawai'i,6,6,NA,290590023,2009-02-28
65,1,9:02,1742,1742,Tim Pierce made Three Point Jumper.  Assisted by Adrian Oliver.,19,16,3,17,0.5893049355659337,0.5893049355659337,San José St,Hawai'i,6,6,NA,290590023,2009-02-28
66,1,8:45,1725,1725,Foul on Brandon Adams,19,16,3,0,0.5899982022281737,0.5899982022281737,San José St,Hawai'i,6,6,NA,290590023,2009-02-28
67,1,8:45,1725,1725,Brandon Adams Turnover.,19,16,3,22,0.5899982022281737,0.5899982022281737,San José St,Hawai'i,6,6,NA,290590023,2009-02-28
68,1,8:23,1703,1703,Devonte Thomas made Two Point Jumper.,21,16,5,23,0.6486002381319425,0.6486002381319425,San José St,Hawai'i,6,6,NA,290590023,2009-02-28
69,1,8:00,1680,1680,Hiram Thompson made Two Point Jumper.  Assisted by Brandon Adams.,21,18,3,4,0.5918828178459989,0.5918828178459989,San José St,Hawai'i,6,6,NA,290590023,2009-02-28
70,1,7:56,1676,1676,Official TV Timeout.,21,18,3,15,0.5920497996476484,0.5920497996476484,San José St,Hawai'i,6,6,NA,290590023,2009-02-28
71,1,7:41,1661,1661,Adrian Oliver made Two Point Jumper.  Assisted by C.J. Webster.,23,18,5,14,0.6513569235575013,0.6513569235575013,San José St,Hawai'i,6,6,NA,290590023,2009-02-28
72,1,7:27,1647,1647,Brandon Adams made Two Point Jumper.,23,20,3,0,0.5932351187206281,0.5932351187206281,San José St,Hawai'i,6,6,NA,290590023,2009-02-28
73,1,7:27,1647,1647,Foul on Tim Pierce,23,20,3,0,0.5932351187206281,0.5932351187206281,San José St,Hawai'i,6,6,NA,290590023,2009-02-28
74,1,7:27,1647,1647,Brandon Adams missed Free Throw.,23,20,3,0,0.5932351187206281,0.5932351187206281,San José St,Hawai'i,6,6,NA,290590023,2009-02-28
75,1,7:27,1647,1647,Tim Pierce Defensive Rebound.,23,20,3,20,0.5932351187206281,0.5932351187206281,San José St,Hawai'i,6,6,NA,290590023,2009-02-28
76,1,7:07,1627,1627,Justin Graham missed Two Point Jumper.,23,20,3,0,0.594033617428088,0.594033617428088,San José St,Hawai'i,6,6,NA,290590023,2009-02-28
77,1,7:07,1627,1627,Bill Amis Block.,23,20,3,2,0.594033617428088,0.594033617428088,San José St,Hawai'i,6,6,NA,290590023,2009-02-28
78,1,7:05,1625,1625,Adhar Mayen Defensive Rebound.,23,20,3,10,0.59411291541535,0.59411291541535,San José St,Hawai'i,6,6,NA,290590023,2009-02-28
79,1,6:55,1615,1615,Leroy Lutu Turnover.,23,20,3,16,0.5945084117707827,0.5945084117707827,San José St,Hawai'i,6,6,NA,290590023,2009-02-28
80,1,6:39,1599,1599,C.J. Webster missed Two Point Jumper.,23,20,3,0,0.5951393109579236,0.5951393109579236,San José St,Hawai'i,6,6,NA,290590023,2009-02-28
81,1,6:39,1599,1599,Adhar Mayen Defensive Rebound.,23,20,3,10,0.5951393109579236,0.5951393109579236,San José St,Hawai'i,6,6,NA,290590023,2009-02-28
82,1,6:29,1589,1589,Bill Amis missed Two Point Jumper.,23,20,3,0,0.5955336822059514,0.5955336822059514,San José St,Hawai'i,6,6,NA,290590023,2009-02-28
83,1,6:29,1589,1589,Justin Graham Defensive Rebound.,23,20,3,14,0.5955336822059514,0.5955336822059514,San José St,Hawai'i,6,6,NA,290590023,2009-02-28
84,1,6:15,1575,1575,Foul on Bill Amis,23,20,3,10,0.596087661457109,0.596087661457109,San José St,Hawai'i,6,6,NA,290590023,2009-02-28
85,1,6:05,1565,1565,C.J. Webster made Two Point Layup.  Assisted by Justin Graham.,25,20,5,19,0.6573272434263856,0.6573272434263856,San José St,Hawai'i,6,6,NA,290590023,2009-02-28
86,1,5:46,1546,1546,Hiram Thompson missed Two Point Jumper.,25,20,5,0,0.6585199193539275,0.6585199193539275,San José St,Hawai'i,6,6,NA,290590023,2009-02-28
87,1,5:46,1546,1546,Bill Amis Offensive Rebound.,25,20,5,20,0.6585199193539275,0.6585199193539275,San José St,Hawai'i,6,6,NA,290590023,2009-02-28
88,1,5:26,1526,1526,Brandon Adams made Two Point Layup.  Assisted by Kareem Nitoto.,25,22,3,20,0.5980734817822355,0.5980734817822355,San José St,Hawai'i,6,6,NA,290590023,2009-02-28
89,1,5:06,1506,1506,Adrian Oliver Turnover.,25,22,3,17,0.5989200862087086,0.5989200862087086,San José St,Hawai'i,6,6,NA,290590023,2009-02-28
90,1,4:49,1489,1489,Paul Campbell missed Two Point Jumper.,25,22,3,0,0.5996632445972285,0.5996632445972285,San José St,Hawai'i,6,6,NA,290590023,2009-02-28
91,1,4:49,1489,1489,Justin Graham Defensive Rebound.,25,22,3,14,0.5996632445972285,0.5996632445972285,San José St,Hawai'i,6,6,NA,290590023,2009-02-28
92,1,4:35,1475,1475,C.J. Webster missed Two Point Jumper.,25,22,3,0,0.6002943985071719,0.6002943985071719,San José St,Hawai'i,6,6,NA,290590023,2009-02-28
93,1,4:35,1475,1475,Brandon Adams Defensive Rebound.,25,22,3,2,0.6002943985071719,0.6002943985071719,San José St,Hawai'i,6,6,NA,290590023,2009-02-28
94,1,4:33,1473,1473,Foul on Justin Graham,25,22,3,26,0.6003861124982801,0.6003861124982801,San José St,Hawai'i,6,6,NA,290590023,2009-02-28
95,1,4:07,1447,1447,Foul on Robert Owens,25,22,3,0,0.6016165623572215,0.6016165623572215,San José St,Hawai'i,6,6,NA,290590023,2009-02-28
96,1,4:07,1447,1447,Kareem Nitoto made Free Throw.,25,23,2,0,0.5682717913918622,0.5682717913918622,San José St,Hawai'i,6,6,NA,290590023,2009-02-28
97,1,4:07,1447,1447,Kareem Nitoto missed Free Throw.,25,23,2,0,0.5682717913918622,0.5682717913918622,San José St,Hawai'i,6,6,NA,290590023,2009-02-28
98,1,4:07,1447,1447,Chris Oakes Defensive Rebound.,25,23,2,8,0.5682717913918622,0.5682717913918622,San José St,Hawai'i,6,6,NA,290590023,2009-02-28
99,1,3:59,1439,1439,Adrian Oliver made Two Point Jumper.,27,23,4,15,0.6345372617031436,0.6345372617031436,San José St,Hawai'i,6,6,NA,290590023,2009-02-28
100,1,3:44,1424,1424,Adhar Mayen made Two Point Jumper.,27,25,2,19,0.5690097824007856,0.5690097824007856,San José St,Hawai'i,6,6,NA,290590023,2009-02-28
101,1,3:25,1405,1405,Official TV Timeout.,27,25,2,4,0.5695978286753738,0.5695978286753738,San José St,Hawai'i,6,6,NA,290590023,2009-02-28
102,1,3:21,1401,1401,Foul on Oliver Caballero,27,25,2,0,0.5697198201547135,0.5697198201547135,San José St,Hawai'i,6,6,NA,290590023,2009-02-28
103,1,3:21,1401,1401,Oliver Caballero Turnover.,27,25,2,21,0.5697198201547135,0.5697198201547135,San José St,Hawai'i,6,6,NA,290590023,2009-02-28
104,1,3:00,1380,1380,Paul Campbell Turnover.,27,25,2,1,0.5703536794667341,0.5703536794667341,San José St,Hawai'i,6,6,NA,290590023,2009-02-28
105,1,2:59,1379,1379,Chris Oakes Steal.,27,25,2,8,0.5703836788824832,0.5703836788824832,San José St,Hawai'i,6,6,NA,290590023,2009-02-28
106,1,2:51,1371,1371,Tim Pierce missed Three Point Jumper.,27,25,2,0,0.57062341820926,0.57062341820926,San José St,Hawai'i,6,6,NA,290590023,2009-02-28
107,1,2:51,1371,1371,Adhar Mayen Defensive Rebound.,27,25,2,18,0.57062341820926,0.57062341820926,San José St,Hawai'i,6,6,NA,290590023,2009-02-28
108,1,2:33,1353,1353,Roderick Flemings made Two Point Jumper.  Assisted by Kareem Nitoto.,27,27,0,16,0.5,0.5,San José St,Hawai'i,6,6,NA,290590023,2009-02-28
109,1,2:17,1337,1337,Foul on Paul Campbell,27,27,0,16,0.5,0.5,San José St,Hawai'i,6,6,NA,290590023,2009-02-28
110,1,2:01,1321,1321,Robert Owens missed Three Point Jumper.,27,27,0,0,0.5,0.5,San José St,Hawai'i,6,6,NA,290590023,2009-02-28
111,1,2:01,1321,1321,Roderick Flemings Defensive Rebound.,27,27,0,7,0.5,0.5,San José St,Hawai'i,6,6,NA,290590023,2009-02-28
112,1,1:54,1314,1314,Brandon Adams Turnover.,27,27,0,14,0.5,0.5,San José St,Hawai'i,6,6,NA,290590023,2009-02-28
113,1,1:40,1300,1300,C.J. Webster made Two Point Jumper.,29,27,2,19,0.5728031960130557,0.5728031960130557,San José St,Hawai'i,6,6,NA,290590023,2009-02-28
114,1,1:21,1281,1281,Roderick Flemings made Two Point Jumper.  Assisted by Kareem Nitoto.,29,29,0,10,0.5,0.5,San José St,Hawai'i,6,6,NA,290590023,2009-02-28
115,1,1:11,1271,1271,San Jose State 30 Second Timeout.,29,29,0,15,0.5,0.5,San José St,Hawai'i,6,5,NA,290590023,2009-02-28
116,1,0:56,1256,1256,Adrian Oliver made Two Point Jumper.,31,29,2,8,0.5743007145911925,0.5743007145911925,San José St,Hawai'i,6,5,NA,290590023,2009-02-28
117,1,0:48,1248,1248,Hawaii 30 Second Timeout.,31,29,2,13,0.5745932208924053,0.5745932208924053,San José St,Hawai'i,6,4,NA,290590023,2009-02-28
118,1,0:35,1235,1235,Foul on John Williams,31,29,2,0,0.5750846440170064,0.5750846440170064,San José St,Hawai'i,6,4,NA,290590023,2009-02-28
119,1,0:35,1235,1235,Roderick Flemings made Free Throw.,31,30,1,0,0.5377563951423993,0.5377563951423993,San José St,Hawai'i,6,4,NA,290590023,2009-02-28
120,1,0:35,1235,1235,Roderick Flemings made Free Throw.,31,31,0,31,0.5,0.5,San José St,Hawai'i,6,4,NA,290590023,2009-02-28
121,1,0:04,1204,1204,Adrian Oliver missed Three Point Jumper.,31,31,0,0,0.5,0.5,San José St,Hawai'i,6,4,NA,290590023,2009-02-28
122,1,0:04,1204,1204,Conrad Fitzgerald Defensive Rebound.,31,31,0,4,0.5,0.5,San José St,Hawai'i,6,4,NA,290590023,2009-02-28
123,1,0:00,1200,1200,End of the 1st Half.,31,31,0,0,0.5,0.5,San José St,Hawai'i,6,4,NA,290590023,2009-02-28
124,2,20:00,1200,1200,PLAY,31,31,0,27,0.5,0.5,San José St,Hawai'i,6,4,NA,290590023,2009-02-28
125,2,19:33,1173,1173,Justin Graham missed Two Point Jumper.,31,31,0,0,0.5,0.5,San José St,Hawai'i,6,4,NA,290590023,2009-02-28
126,2,19:33,1173,1173,Hiram Thompson Defensive Rebound.,31,31,0,26,0.5,0.5,San José St,Hawai'i,6,4,NA,290590023,2009-02-28
127,2,19:07,1147,1147,Hiram Thompson made Three Point Jumper.  Assisted by Roderick Flemings.,31,34,-3,21,0.383288999802295,0.383288999802295,San José St,Hawai'i,6,4,NA,290590023,2009-02-28
128,2,18:46,1126,1126,Foul on Paul Campbell,31,34,-3,0,0.3821083209792706,0.3821083209792706,San José St,Hawai'i,6,4,NA,290590023,2009-02-28
129,2,18:46,1126,1126,Adrian Oliver made Free Throw.,32,34,-2,0,0.4205768001642287,0.4205768001642287,San José St,Hawai'i,6,4,NA,290590023,2009-02-28
130,2,18:46,1126,1126,Adrian Oliver made Free Throw.,33,34,-1,21,0.46003468643677187,0.46003468643677187,San José St,Hawai'i,6,4,NA,290590023,2009-02-28
131,2,18:25,1105,1105,Bill Amis made Two Point Jumper.,33,36,-3,31,0.3809183646557049,0.3809183646557049,San José St,Hawai'i,6,4,NA,290590023,2009-02-28
132,2,17:54,1074,1074,C.J. Webster made Two Point Jumper.,35,36,-1,18,0.45898073682958834,0.45898073682958834,San José St,Hawai'i,6,4,NA,290590023,2009-02-28
133,2,17:36,1056,1056,Roderick Flemings missed Two Point Jumper.,35,36,-1,0,0.45859326849932336,0.45859326849932336,San José St,Hawai'i,6,4,NA,290590023,2009-02-28
134,2,17:36,1056,1056,Paul Campbell Offensive Rebound.,35,36,-1,2,0.45859326849932336,0.45859326849932336,San José St,Hawai'i,6,4,NA,290590023,2009-02-28
135,2,17:34,1054,1054,Foul on Adrian Oliver,35,36,-1,2,0.4585491725999451,0.4585491725999451,San José St,Hawai'i,6,4,NA,290590023,2009-02-28
136,2,17:32,1052,1052,Bill Amis missed Two Point Jumper.,35,36,-1,0,0.45850484807005426,0.45850484807005426,San José St,Hawai'i,6,4,NA,290590023,2009-02-28
137,2,17:32,1052,1052,C.J. Webster Defensive Rebound.,35,36,-1,2,0.45850484807005426,0.45850484807005426,San José St,Hawai'i,6,4,NA,290590023,2009-02-28
138,2,17:30,1050,1050,C.J. Webster Turnover.,35,36,-1,2,0.45846028949499806,0.45846028949499806,San José St,Hawai'i,6,4,NA,290590023,2009-02-28
139,2,17:28,1048,1048,Bill Amis made Two Point Jumper.  Assisted by Hiram Thompson.,35,38,-3,16,0.3775008421932302,0.3775008421932302,San José St,Hawai'i,6,4,NA,290590023,2009-02-28
140,2,17:12,1032,1032,Foul on Paul Campbell,35,38,-3,14,0.3764573673210853,0.3764573673210853,San José St,Hawai'i,6,4,NA,290590023,2009-02-28
141,2,16:58,1018,1018,Devonte Thomas made Two Point Layup.,37,38,-1,13,0.45771110541112126,0.45771110541112126,San José St,Hawai'i,6,4,NA,290590023,2009-02-28
142,2,16:45,1005,1005,Roderick Flemings missed Two Point Layup.,37,38,-1,0,0.4573841611427797,0.4573841611427797,San José St,Hawai'i,6,4,NA,290590023,2009-02-28
143,2,16:45,1005,1005,Robert Owens Defensive Rebound.,37,38,-1,14,0.4573841611427797,0.4573841611427797,San José St,Hawai'i,6,4,NA,290590023,2009-02-28
144,2,16:31,991,991,Adrian Oliver made Two Point Jumper.,39,38,1,30,0.5429850399988106,0.5429850399988106,San José St,Hawai'i,6,4,NA,290590023,2009-02-28
145,2,16:01,961,961,Kareem Nitoto made Two Point Jumper.  Assisted by Hiram Thompson.,39,40,-1,15,0.4561671576254298,0.4561671576254298,San José St,Hawai'i,6,4,NA,290590023,2009-02-28
146,2,15:46,946,946,Justin Graham made Two Point Layup.,41,40,1,7,0.5442332108734333,0.5442332108734333,San José St,Hawai'i,6,4,NA,290590023,2009-02-28
147,2,15:39,939,939,Foul on Adrian Oliver,41,40,1,0,0.5444098417881136,0.5444098417881136,San José St,Hawai'i,6,4,NA,290590023,2009-02-28
148,2,15:39,939,939,Official TV Timeout.,41,40,1,13,0.5444098417881136,0.5444098417881136,San José St,Hawai'i,6,4,NA,290590023,2009-02-28
149,2,15:26,926,926,Roderick Flemings made Two Point Jumper.  Assisted by Kareem Nitoto.,41,42,-1,20,0.4552763359464209,0.4552763359464209,San José St,Hawai'i,6,4,NA,290590023,2009-02-28
150,2,15:06,906,906,Chris Oakes missed Two Point Jumper.,41,42,-1,0,0.4548208178059809,0.4548208178059809,San José St,Hawai'i,6,4,NA,290590023,2009-02-28
151,2,15:06,906,906,Kareem Nitoto Defensive Rebound.,41,42,-1,19,0.4548208178059809,0.4548208178059809,San José St,Hawai'i,6,4,NA,290590023,2009-02-28
152,2,14:47,887,887,Kareem Nitoto made Two Point Jumper.,41,44,-3,17,0.3661769191547764,0.3661769191547764,San José St,Hawai'i,6,4,NA,290590023,2009-02-28
153,2,14:30,870,870,Adrian Oliver made Two Point Jumper.,43,44,-1,20,0.45403801100445346,0.45403801100445346,San José St,Hawai'i,6,4,NA,290590023,2009-02-28
154,2,14:10,850,850,Roderick Flemings made Two Point Dunk Shot.  Assisted by Kareem Nitoto.,43,46,-3,8,0.3639035490079873,0.3639035490079873,San José St,Hawai'i,6,4,NA,290590023,2009-02-28
155,2,14:02,842,842,San Jose State 30 Second Timeout.,43,46,-3,15,0.36339011835399465,0.36339011835399465,San José St,Hawai'i,6,3,NA,290590023,2009-02-28
156,2,13:47,827,827,Foul on Hiram Thompson,43,46,-3,11,0.3623873463076471,0.3623873463076471,San José St,Hawai'i,6,3,NA,290590023,2009-02-28
157,2,13:36,816,816,Devonte Thomas Turnover.,43,46,-3,13,0.36160982412589665,0.36160982412589665,San José St,Hawai'i,6,3,NA,290590023,2009-02-28
158,2,13:23,803,803,Foul on Tim Pierce,43,46,-3,0,0.3606338340869814,0.3606338340869814,San José St,Hawai'i,6,3,NA,290590023,2009-02-28
159,2,13:23,803,803,Roderick Flemings made Free Throw.,43,47,-4,0,0.317889987520558,0.317889987520558,San José St,Hawai'i,6,3,NA,290590023,2009-02-28
160,2,13:23,803,803,Roderick Flemings made Free Throw.,43,48,-5,14,0.2780094433946055,0.2780094433946055,San José St,Hawai'i,6,3,NA,290590023,2009-02-28
161,2,13:09,789,789,Adrian Oliver made Two Point Jumper.,45,48,-3,15,0.3595005521202124,0.3595005521202124,San José St,Hawai'i,6,3,NA,290590023,2009-02-28
162,2,12:54,774,774,Brandon Adams missed Two Point Layup.,45,48,-3,0,0.35817524575581827,0.35817524575581827,San José St,Hawai'i,6,3,NA,290590023,2009-02-28
163,2,12:54,774,774,C.J. Webster Defensive Rebound.,45,48,-3,8,0.35817524575581827,0.35817524575581827,San José St,Hawai'i,6,3,NA,290590023,2009-02-28
164,2,12:46,766,766,Justin Graham made Two Point Layup.,47,48,-1,11,0.45127181889342527,0.45127181889342527,San José St,Hawai'i,6,3,NA,290590023,2009-02-28
165,2,12:35,755,755,Bill Amis Turnover.,47,48,-1,7,0.45087212946038546,0.45087212946038546,San José St,Hawai'i,6,3,NA,290590023,2009-02-28
166,2,12:28,748,748,Foul on Brandon Adams,47,48,-1,7,0.4506020341242074,0.4506020341242074,San José St,Hawai'i,6,3,NA,290590023,2009-02-28
167,2,12:21,741,741,Chris Oakes missed Two Point Dunk Shot.,47,48,-1,0,0.45031888350509447,0.45031888350509447,San José St,Hawai'i,6,3,NA,290590023,2009-02-28
168,2,12:21,741,741,Chris Oakes Offensive Rebound.,47,48,-1,2,0.45031888350509447,0.45031888350509447,San José St,Hawai'i,6,3,NA,290590023,2009-02-28
169,2,12:19,739,739,Chris Oakes made Two Point Layup.,49,48,1,21,0.5497645093967024,0.5497645093967024,San José St,Hawai'i,6,3,NA,290590023,2009-02-28
170,2,11:58,718,718,Bill Amis missed Two Point Jumper.,49,48,1,0,0.5506653371500158,0.5506653371500158,San José St,Hawai'i,6,3,NA,290590023,2009-02-28
171,2,11:58,718,718,Hiram Thompson Offensive Rebound.,49,48,1,6,0.5506653371500158,0.5506653371500158,San José St,Hawai'i,6,3,NA,290590023,2009-02-28
172,2,11:52,712,712,Kareem Nitoto missed Three Point Jumper.,49,48,1,0,0.5509046344121711,0.5509046344121711,San José St,Hawai'i,6,3,NA,290590023,2009-02-28
173,2,11:52,712,712,Chris Oakes Defensive Rebound.,49,48,1,10,0.5509046344121711,0.5509046344121711,San José St,Hawai'i,6,3,NA,290590023,2009-02-28
174,2,11:42,702,702,Adrian Oliver missed Two Point Jumper.,49,48,1,0,0.5512833451996001,0.5512833451996001,San José St,Hawai'i,6,3,NA,290590023,2009-02-28
175,2,11:42,702,702,Bill Amis Defensive Rebound.,49,48,1,6,0.5512833451996001,0.5512833451996001,San José St,Hawai'i,6,3,NA,290590023,2009-02-28
176,2,11:36,696,696,Kareem Nitoto missed Two Point Layup.,49,48,1,0,0.5515004236643994,0.5515004236643994,San José St,Hawai'i,6,3,NA,290590023,2009-02-28
177,2,11:36,696,696,Chris Oakes Defensive Rebound.,49,48,1,11,0.5515004236643994,0.5515004236643994,San José St,Hawai'i,6,3,NA,290590023,2009-02-28
