play_id,half,time_remaining_half,secs_remaining,secs_remaining_absolute,description,home_score,away_score,score_diff,play_length,win_prob,naive_win_prob,home,away,home_time_out_remaining,away_time_out_remaining,home_favored_by,game_id,date
1,1,20:00,2400,2400,PLAY,0,0,0,28,0.5,0.5,Charlotte,UNC Greensboro,4,4,NA,283192429,2008-11-14
2,1,19:32,2372,2372,Lamont Mack made Three Point Jumper.  Assisted by DiJuan Harris.,3,0,3,24,0.5667055204091812,0.5667055204091812,Charlotte,UNC Greensboro,4,4,NA,283192429,2008-11-14
3,1,19:08,2348,2348,DeAngelo Jackson missed Two Point Jumper.,3,0,3,0,0.5674717857605485,0.5674717857605485,Charlotte,UNC Greensboro,4,4,NA,283192429,2008-11-14
4,1,19:08,2348,2348,Pete Brown Offensive Rebound.,3,0,3,4,0.5674717857605485,0.5674717857605485,Charlotte,UNC Greensboro,4,4,NA,283192429,2008-11-14
5,1,19:04,2344,2344,Pete Brown missed Two Point Jumper.,3,0,3,0,0.5676005697509393,0.5676005697509393,Charlotte,UNC Greensboro,4,4,NA,283192429,2008-11-14
6,1,19:04,2344,2344,Charlie Coley Defensive Rebound.,3,0,3,12,0.5676005697509393,0.5676005697509393,Charlotte,UNC Greensboro,4,4,NA,283192429,2008-11-14
7,1,18:52,2332,2332,DeAngelo Jackson made Two Point Jumper.,3,2,1,21,0.5227883361633022,0.5227883361633022,Charlotte,UNC Greensboro,4,4,NA,283192429,2008-11-14
8,1,18:31,2311,2311,Foul on Pete Brown,3,2,1,0,0.5230205596670452,0.5230205596670452,Charlotte,UNC Greensboro,4,4,NA,283192429,2008-11-14
9,1,18:31,2311,2311,DiJuan Harris made Free Throw.,4,2,2,0,0.5459437285227066,0.5459437285227066,Charlotte,UNC Greensboro,4,4,NA,283192429,2008-11-14
10,1,18:31,2311,2311,DiJuan Harris made Free Throw.,5,2,3,44,0.5686737568993776,0.5686737568993776,Charlotte,UNC Greensboro,4,4,NA,283192429,2008-11-14
11,1,17:47,2267,2267,Daniel Oliver missed Two Point Jumper.,5,2,3,0,0.5701308127442787,0.5701308127442787,Charlotte,UNC Greensboro,4,4,NA,283192429,2008-11-14
12,1,17:47,2267,2267,Lamont Mack Defensive Rebound.,5,2,3,16,0.5701308127442787,0.5701308127442787,Charlotte,UNC Greensboro,4,4,NA,283192429,2008-11-14
13,1,17:31,2251,2251,Foul on Ben Stywall,5,2,3,0,0.5706668871886571,0.5706668871886571,Charlotte,UNC Greensboro,4,4,NA,283192429,2008-11-14
14,1,17:31,2251,2251,An'Juan Wilderness made Free Throw.,6,2,4,0,0.593735634626751,0.593735634626751,Charlotte,UNC Greensboro,4,4,NA,283192429,2008-11-14
15,1,17:31,2251,2251,An'Juan Wilderness made Free Throw.,7,2,5,18,0.6163980665546902,0.6163980665546902,Charlotte,UNC Greensboro,4,4,NA,283192429,2008-11-14
16,1,17:13,2233,2233,Damian Eargle missed Two Point Layup.,7,2,5,2,0.6173732010302534,0.6173732010302534,Charlotte,UNC Greensboro,4,4,NA,283192429,2008-11-14
17,1,17:11,2231,2231,An'Juan Wilderness Defensive Rebound.,7,2,5,9,0.6174818340682185,0.6174818340682185,Charlotte,UNC Greensboro,4,4,NA,283192429,2008-11-14
18,1,17:02,2222,2222,Lamont Mack missed Two Point Layup.,7,2,5,0,0.617971326071389,0.617971326071389,Charlotte,UNC Greensboro,4,4,NA,283192429,2008-11-14
19,1,17:02,2222,2222,Rashad Coleman Offensive Rebound.,7,2,5,4,0.617971326071389,0.617971326071389,Charlotte,UNC Greensboro,4,4,NA,283192429,2008-11-14
20,1,16:58,2218,2218,Rashad Coleman made Two Point Dunk Shot.,9,2,7,16,0.6625362334214253,0.6625362334214253,Charlotte,UNC Greensboro,4,4,NA,283192429,2008-11-14
21,1,16:42,2202,2202,Damian Eargle made Two Point Layup.  Assisted by Daniel Oliver.,9,4,5,8,0.6190624711173541,0.6190624711173541,Charlotte,UNC Greensboro,4,4,NA,283192429,2008-11-14
22,1,16:34,2194,2194,Foul on An'Juan Wilderness,9,4,5,15,0.6195000597994478,0.6195000597994478,Charlotte,UNC Greensboro,4,4,NA,283192429,2008-11-14
23,1,16:19,2179,2179,Foul on Charlie Coley,9,4,5,0,0.6203219646060996,0.6203219646060996,Charlotte,UNC Greensboro,4,4,NA,283192429,2008-11-14
24,1,16:19,2179,2179,Elhanan Bone made Free Throw.,9,5,4,0,0.5969402036873175,0.5969402036873175,Charlotte,UNC Greensboro,4,4,NA,283192429,2008-11-14
25,1,16:19,2179,2179,Elhanan Bone made Free Throw.,9,6,3,5,0.5731094402425919,0.5731094402425919,Charlotte,UNC Greensboro,4,4,NA,283192429,2008-11-14
26,1,16:14,2174,2174,Phil Jones missed Two Point Layup.,9,6,3,0,0.5732804309210933,0.5732804309210933,Charlotte,UNC Greensboro,4,4,NA,283192429,2008-11-14
27,1,16:14,2174,2174,An'Juan Wilderness Offensive Rebound.,9,6,3,25,0.5732804309210933,0.5732804309210933,Charlotte,UNC Greensboro,4,4,NA,283192429,2008-11-14
28,1,15:49,2149,2149,Phil Jones made Two Point Layup.  Assisted by DiJuan Harris.,11,6,5,19,0.6219721448464608,0.6219721448464608,Charlotte,UNC Greensboro,4,4,NA,283192429,2008-11-14
29,1,15:30,2130,2130,Elhanan Bone missed Two Point Layup.,11,6,5,0,0.6230244310212453,0.6230244310212453,Charlotte,UNC Greensboro,4,4,NA,283192429,2008-11-14
30,1,15:30,2130,2130,Montel Smith Offensive Rebound.,11,6,5,8,0.6230244310212453,0.6230244310212453,Charlotte,UNC Greensboro,4,4,NA,283192429,2008-11-14
31,1,15:22,2122,2122,Pete Brown missed Two Point Jumper.,11,6,5,0,0.6234693688430759,0.6234693688430759,Charlotte,UNC Greensboro,4,4,NA,283192429,2008-11-14
32,1,15:22,2122,2122,Charles Dewhurst Defensive Rebound.,11,6,5,15,0.6234693688430759,0.6234693688430759,Charlotte,UNC Greensboro,4,4,NA,283192429,2008-11-14
33,1,15:07,2107,2107,Charlie Coley missed Three Point Jumper.,11,6,5,0,0.6243067964349346,0.6243067964349346,Charlotte,UNC Greensboro,4,4,NA,283192429,2008-11-14
34,1,15:07,2107,2107,Elhanan Bone Defensive Rebound.,11,6,5,8,0.6243067964349346,0.6243067964349346,Charlotte,UNC Greensboro,4,4,NA,283192429,2008-11-14
35,1,14:59,2099,2099,Mikko Koivisto made Three Point Jumper.  Assisted by Montel Smith.,11,9,2,11,0.5508022130575281,0.5508022130575281,Charlotte,UNC Greensboro,4,4,NA,283192429,2008-11-14
36,1,14:48,2088,2088,Rashad Coleman missed Three Point Jumper.,11,9,2,0,0.5510634392815655,0.5510634392815655,Charlotte,UNC Greensboro,4,4,NA,283192429,2008-11-14
37,1,14:48,2088,2088,Phil Jones Offensive Rebound.,11,9,2,2,0.5510634392815655,0.5510634392815655,Charlotte,UNC Greensboro,4,4,NA,283192429,2008-11-14
38,1,14:46,2086,2086,Foul on Pete Brown,11,9,2,0,0.5511110631973942,0.5511110631973942,Charlotte,UNC Greensboro,4,4,NA,283192429,2008-11-14
39,1,14:46,2086,2086,Official TV Timeout.,11,9,2,1,0.5511110631973942,0.5511110631973942,Charlotte,UNC Greensboro,4,4,NA,283192429,2008-11-14
40,1,14:45,2085,2085,Foul on Damian Eargle,11,9,2,0,0.5511348901867295,0.5511348901867295,Charlotte,UNC Greensboro,4,4,NA,283192429,2008-11-14
41,1,14:45,2085,2085,Lamont Mack missed Free Throw.,11,9,2,0,0.5511348901867295,0.5511348901867295,Charlotte,UNC Greensboro,4,4,NA,283192429,2008-11-14
42,1,14:45,2085,2085,null,11,9,2,0,0.5511348901867295,0.5511348901867295,Charlotte,UNC Greensboro,4,4,NA,283192429,2008-11-14
43,1,14:45,2085,2085,Lamont Mack made Free Throw.,12,9,3,10,0.5763691141788408,0.5763691141788408,Charlotte,UNC Greensboro,4,4,NA,283192429,2008-11-14
44,1,14:35,2075,2075,Charles Dewhurst Steal.,12,9,3,4,0.5767226767699644,0.5767226767699644,Charlotte,UNC Greensboro,4,4,NA,283192429,2008-11-14
45,1,14:31,2071,2071,Lamont Mack missed Three Point Jumper.,12,9,3,0,0.5768645179347631,0.5768645179347631,Charlotte,UNC Greensboro,4,4,NA,283192429,2008-11-14
46,1,14:31,2071,2071,Ben Stywall Defensive Rebound.,12,9,3,10,0.5768645179347631,0.5768645179347631,Charlotte,UNC Greensboro,4,4,NA,283192429,2008-11-14
47,1,14:21,2061,2061,Kendall Toney missed Three Point Jumper.,12,9,3,0,0.5772201884972024,0.5772201884972024,Charlotte,UNC Greensboro,4,4,NA,283192429,2008-11-14
48,1,14:21,2061,2061,DeAngelo Jackson Offensive Rebound.,12,9,3,35,0.5772201884972024,0.5772201884972024,Charlotte,UNC Greensboro,4,4,NA,283192429,2008-11-14
49,1,13:46,2026,2026,Ian Andersen missed Two Point Jumper.,12,9,3,0,0.5784776731286738,0.5784776731286738,Charlotte,UNC Greensboro,4,4,NA,283192429,2008-11-14
50,1,13:46,2026,2026,Ben Stywall Defensive Rebound.,12,9,3,35,0.5784776731286738,0.5784776731286738,Charlotte,UNC Greensboro,4,4,NA,283192429,2008-11-14
51,1,13:11,1991,1991,Foul on Gaby Ngoundjo,12,9,3,6,0.5797564034649262,0.5797564034649262,Charlotte,UNC Greensboro,4,4,NA,283192429,2008-11-14
52,1,13:05,1985,1985,Foul on Charles Dewhurst,12,9,3,15,0.5799778985854955,0.5799778985854955,Charlotte,UNC Greensboro,4,4,NA,283192429,2008-11-14
53,1,12:50,1970,1970,Foul on Ben Stywall,12,9,3,15,0.580534703277135,0.580534703277135,Charlotte,UNC Greensboro,4,4,NA,283192429,2008-11-14
54,1,12:35,1955,1955,Foul on Elhanan Bone,12,9,3,2,0.5810960193102671,0.5810960193102671,Charlotte,UNC Greensboro,4,4,NA,283192429,2008-11-14
55,1,12:33,1953,1953,Ian Andersen missed Three Point Jumper.,12,9,3,0,0.5811712110282169,0.5811712110282169,Charlotte,UNC Greensboro,4,4,NA,283192429,2008-11-14
56,1,12:33,1953,1953,Elhanan Bone Defensive Rebound.,12,9,3,17,0.5811712110282169,0.5811712110282169,Charlotte,UNC Greensboro,4,4,NA,283192429,2008-11-14
57,1,12:16,1936,1936,Lamont Mack missed Two Point Layup.,12,9,3,0,0.5818137495302403,0.5818137495302403,Charlotte,UNC Greensboro,4,4,NA,283192429,2008-11-14
58,1,12:16,1936,1936,Lamont Mack Offensive Rebound.,12,9,3,4,0.5818137495302403,0.5818137495302403,Charlotte,UNC Greensboro,4,4,NA,283192429,2008-11-14
59,1,12:12,1932,1932,Foul on Elhanan Bone,12,9,3,0,0.5819658370238904,0.5819658370238904,Charlotte,UNC Greensboro,4,4,NA,283192429,2008-11-14
60,1,12:12,1932,1932,Lamont Mack made Free Throw.,13,9,4,0,0.6085285997252844,0.6085285997252844,Charlotte,UNC Greensboro,4,4,NA,283192429,2008-11-14
61,1,12:12,1932,1932,Lamont Mack made Free Throw.,14,9,5,9,0.634463660199752,0.634463660199752,Charlotte,UNC Greensboro,4,4,NA,283192429,2008-11-14
62,1,12:03,1923,1923,Mikko Koivisto missed Two Point Layup.,14,9,5,0,0.6350081086992205,0.6350081086992205,Charlotte,UNC Greensboro,4,4,NA,283192429,2008-11-14
63,1,12:03,1923,1923,Charlotte Defensive Rebound.,14,9,5,16,0.6350081086992205,0.6350081086992205,Charlotte,UNC Greensboro,4,4,NA,283192429,2008-11-14
64,1,11:47,1907,1907,Lamont Mack made Two Point Layup.,16,9,7,22,0.6859177511137005,0.6859177511137005,Charlotte,UNC Greensboro,4,4,NA,283192429,2008-11-14
65,1,11:25,1885,1885,Charlie Coley Steal.,16,9,7,0,0.6876419815869681,0.6876419815869681,Charlotte,UNC Greensboro,4,4,NA,283192429,2008-11-14
66,1,11:25,1885,1885,Official TV Timeout.,16,9,7,24,0.6876419815869681,0.6876419815869681,Charlotte,UNC Greensboro,4,4,NA,283192429,2008-11-14
67,1,11:01,1861,1861,An'Juan Wilderness missed Two Point Layup.,16,9,7,0,0.6895201578890727,0.6895201578890727,Charlotte,UNC Greensboro,4,4,NA,283192429,2008-11-14
68,1,11:01,1861,1861,Rashad Coleman Offensive Rebound.,16,9,7,3,0.6895201578890727,0.6895201578890727,Charlotte,UNC Greensboro,4,4,NA,283192429,2008-11-14
69,1,10:58,1858,1858,Rashad Coleman made Two Point Layup.,18,9,9,21,0.7363829204689012,0.7363829204689012,Charlotte,UNC Greensboro,4,4,NA,283192429,2008-11-14
70,1,10:37,1837,1837,Foul on Charlie Coley,18,9,9,0,0.7383016699486222,0.7383016699486222,Charlotte,UNC Greensboro,4,4,NA,283192429,2008-11-14
71,1,10:37,1837,1837,Ben Stywall made Free Throw.,18,10,8,0,0.7154331717598716,0.7154331717598716,Charlotte,UNC Greensboro,4,4,NA,283192429,2008-11-14
72,1,10:37,1837,1837,Ben Stywall made Free Throw.,18,11,7,18,0.6914015947685437,0.6914015947685437,Charlotte,UNC Greensboro,4,4,NA,283192429,2008-11-14
73,1,10:19,1819,1819,Rashad Coleman missed Two Point Layup.,18,11,7,0,0.6928185911128718,0.6928185911128718,Charlotte,UNC Greensboro,4,4,NA,283192429,2008-11-14
74,1,10:19,1819,1819,Kendall Toney Defensive Rebound.,18,11,7,7,0.6928185911128718,0.6928185911128718,Charlotte,UNC Greensboro,4,4,NA,283192429,2008-11-14
75,1,10:12,1812,1812,Landon Clement made Three Point Jumper.  Assisted by Ben Stywall.,18,14,4,18,0.6144947501645892,0.6144947501645892,Charlotte,UNC Greensboro,4,4,NA,283192429,2008-11-14
76,1,9:54,1794,1794,An'Juan Wilderness made Two Point Layup.,20,14,6,19,0.6693255303821953,0.6693255303821953,Charlotte,UNC Greensboro,4,4,NA,283192429,2008-11-14
77,1,9:35,1775,1775,Kendall Toney missed Three Point Jumper.,20,14,6,0,0.6706865414343159,0.6706865414343159,Charlotte,UNC Greensboro,4,4,NA,283192429,2008-11-14
78,1,9:35,1775,1775,DiJuan Harris Defensive Rebound.,20,14,6,16,0.6706865414343159,0.6706865414343159,Charlotte,UNC Greensboro,4,4,NA,283192429,2008-11-14
79,1,9:19,1759,1759,Lamont Mack missed Two Point Jumper.,20,14,6,0,0.6718443369251405,0.6718443369251405,Charlotte,UNC Greensboro,4,4,NA,283192429,2008-11-14
80,1,9:19,1759,1759,Ben Stywall Defensive Rebound.,20,14,6,11,0.6718443369251405,0.6718443369251405,Charlotte,UNC Greensboro,4,4,NA,283192429,2008-11-14
81,1,9:08,1748,1748,Landon Clement missed Three Point Jumper.,20,14,6,0,0.672647410199511,0.672647410199511,Charlotte,UNC Greensboro,4,4,NA,283192429,2008-11-14
82,1,9:08,1748,1748,Ben Stywall Offensive Rebound.,20,14,6,4,0.672647410199511,0.672647410199511,Charlotte,UNC Greensboro,4,4,NA,283192429,2008-11-14
83,1,9:04,1744,1744,Foul on Ian Andersen,20,14,6,6,0.6729409898145096,0.6729409898145096,Charlotte,UNC Greensboro,4,4,NA,283192429,2008-11-14
84,1,8:58,1738,1738,Kendall Toney missed Two Point Layup.,20,14,6,0,0.6733829936699746,0.6733829936699746,Charlotte,UNC Greensboro,4,4,NA,283192429,2008-11-14
85,1,8:58,1738,1738,DeAngelo Jackson Offensive Rebound.,20,14,6,3,0.6733829936699746,0.6733829936699746,Charlotte,UNC Greensboro,4,4,NA,283192429,2008-11-14
86,1,8:55,1735,1735,DeAngelo Jackson missed Two Point Layup.,20,14,6,0,0.6736047537085805,0.6736047537085805,Charlotte,UNC Greensboro,4,4,NA,283192429,2008-11-14
87,1,8:55,1735,1735,UNC Greensboro Offensive Rebound.,20,14,6,37,0.6736047537085805,0.6736047537085805,Charlotte,UNC Greensboro,4,4,NA,283192429,2008-11-14
88,1,8:18,1698,1698,DiJuan Harris missed Two Point Jumper.,20,14,6,0,0.6763857042513916,0.6763857042513916,Charlotte,UNC Greensboro,4,4,NA,283192429,2008-11-14
89,1,8:18,1698,1698,UNC Greensboro Defensive Rebound.,20,14,6,22,0.6763857042513916,0.6763857042513916,Charlotte,UNC Greensboro,4,4,NA,283192429,2008-11-14
90,1,7:56,1676,1676,Landon Clement missed Three Point Jumper.,20,14,6,0,0.6780645186678619,0.6780645186678619,Charlotte,UNC Greensboro,4,4,NA,283192429,2008-11-14
91,1,7:56,1676,1676,Charles Dewhurst Defensive Rebound.,20,14,6,15,0.6780645186678619,0.6780645186678619,Charlotte,UNC Greensboro,4,4,NA,283192429,2008-11-14
92,1,7:41,1661,1661,Gaby Ngoundjo missed Two Point Jumper.,20,14,6,0,0.6791810697871079,0.6791810697871079,Charlotte,UNC Greensboro,4,4,NA,283192429,2008-11-14
93,1,7:41,1661,1661,Mikko Koivisto Defensive Rebound.,20,14,6,13,0.6791810697871079,0.6791810697871079,Charlotte,UNC Greensboro,4,4,NA,283192429,2008-11-14
94,1,7:28,1648,1648,Daniel Oliver missed Three Point Jumper.,20,14,6,0,0.6801317509833652,0.6801317509833652,Charlotte,UNC Greensboro,4,4,NA,283192429,2008-11-14
95,1,7:28,1648,1648,Elhanan Bone Offensive Rebound.,20,14,6,5,0.6801317509833652,0.6801317509833652,Charlotte,UNC Greensboro,4,4,NA,283192429,2008-11-14
96,1,7:23,1643,1643,Charles Dewhurst Steal.,20,14,6,12,0.6804939212147533,0.6804939212147533,Charlotte,UNC Greensboro,4,4,NA,283192429,2008-11-14
97,1,7:11,1631,1631,Charles Dewhurst made Two Point Jumper.,22,14,8,17,0.7336755860061421,0.7336755860061421,Charlotte,UNC Greensboro,4,4,NA,283192429,2008-11-14
98,1,6:54,1614,1614,Landon Clement made Three Point Jumper.  Assisted by Mikko Koivisto.,22,17,5,10,0.6543006525151589,0.6543006525151589,Charlotte,UNC Greensboro,4,4,NA,283192429,2008-11-14
99,1,6:44,1604,1604,Ian Andersen missed Three Point Jumper.,22,17,5,0,0.6549172166991724,0.6549172166991724,Charlotte,UNC Greensboro,4,4,NA,283192429,2008-11-14
100,1,6:44,1604,1604,An'Juan Wilderness Offensive Rebound.,22,17,5,7,0.6549172166991724,0.6549172166991724,Charlotte,UNC Greensboro,4,4,NA,283192429,2008-11-14
101,1,6:37,1597,1597,Foul on Elhanan Bone,22,17,5,0,0.65534836188932,0.65534836188932,Charlotte,UNC Greensboro,4,4,NA,283192429,2008-11-14
102,1,6:37,1597,1597,Official TV Timeout.,22,17,5,0,0.65534836188932,0.65534836188932,Charlotte,UNC Greensboro,4,4,NA,283192429,2008-11-14
103,1,6:37,1597,1597,An'Juan Wilderness made Free Throw.,23,17,6,0,0.6837716285842684,0.6837716285842684,Charlotte,UNC Greensboro,4,4,NA,283192429,2008-11-14
104,1,6:37,1597,1597,An'Juan Wilderness missed Free Throw.,23,17,6,0,0.6837716285842684,0.6837716285842684,Charlotte,UNC Greensboro,4,4,NA,283192429,2008-11-14
105,1,6:37,1597,1597,Damian Eargle Defensive Rebound.,23,17,6,59,0.6837716285842684,0.6837716285842684,Charlotte,UNC Greensboro,4,4,NA,283192429,2008-11-14
106,1,5:38,1538,1538,Charles Dewhurst made Two Point Layup.,25,17,8,34,0.741609285945112,0.741609285945112,Charlotte,UNC Greensboro,4,4,NA,283192429,2008-11-14
107,1,5:04,1504,1504,Kendall Toney missed Two Point Jumper.,25,17,8,0,0.7446356730952393,0.7446356730952393,Charlotte,UNC Greensboro,4,4,NA,283192429,2008-11-14
108,1,5:04,1504,1504,Damian Eargle Offensive Rebound.,25,17,8,20,0.7446356730952393,0.7446356730952393,Charlotte,UNC Greensboro,4,4,NA,283192429,2008-11-14
109,1,4:44,1484,1484,Lamont Mack missed Two Point Jumper.,25,17,8,0,0.7464901439671936,0.7464901439671936,Charlotte,UNC Greensboro,4,4,NA,283192429,2008-11-14
110,1,4:44,1484,1484,Charles Dewhurst Offensive Rebound.,25,17,8,2,0.7464901439671936,0.7464901439671936,Charlotte,UNC Greensboro,4,4,NA,283192429,2008-11-14
111,1,4:42,1482,1482,Foul on Damian Eargle,25,17,8,0,0.7466792538074447,0.7466792538074447,Charlotte,UNC Greensboro,4,4,NA,283192429,2008-11-14
112,1,4:42,1482,1482,Charles Dewhurst made Free Throw.,26,17,9,0,0.7713767871221229,0.7713767871221229,Charlotte,UNC Greensboro,4,4,NA,283192429,2008-11-14
113,1,4:42,1482,1482,Charles Dewhurst made Free Throw.,27,17,10,28,0.7943296767205635,0.7943296767205635,Charlotte,UNC Greensboro,4,4,NA,283192429,2008-11-14
114,1,4:14,1454,1454,Ben Stywall missed Three Point Jumper.,27,17,10,0,0.7972698175223626,0.7972698175223626,Charlotte,UNC Greensboro,4,4,NA,283192429,2008-11-14
115,1,4:14,1454,1454,Phil Jones Defensive Rebound.,27,17,10,8,0.7972698175223626,0.7972698175223626,Charlotte,UNC Greensboro,4,4,NA,283192429,2008-11-14
116,1,4:06,1446,1446,Rashad Coleman made Three Point Jumper.  Assisted by DiJuan Harris.,30,17,13,3,0.8565704905205872,0.8565704905205872,Charlotte,UNC Greensboro,4,4,NA,283192429,2008-11-14
117,1,4:03,1443,1443,UNC Greensboro 30 Second Timeout.,30,17,13,19,0.8568893333717921,0.8568893333717921,Charlotte,UNC Greensboro,4,3,NA,283192429,2008-11-14
118,1,3:44,1424,1424,Mikko Koivisto made Three Point Jumper.,30,20,10,22,0.8004423215025146,0.8004423215025146,Charlotte,UNC Greensboro,4,3,NA,283192429,2008-11-14
119,1,3:22,1402,1402,Foul on Lamont Mack,30,20,10,0,0.8026467656447673,0.8026467656447673,Charlotte,UNC Greensboro,4,3,NA,283192429,2008-11-14
120,1,3:22,1402,1402,Official TV Timeout.,30,20,10,25,0.8026467656447673,0.8026467656447673,Charlotte,UNC Greensboro,4,3,NA,283192429,2008-11-14
121,1,2:57,1377,1377,Landon Clement missed Three Point Jumper.,30,20,10,0,0.8050729188244733,0.8050729188244733,Charlotte,UNC Greensboro,4,3,NA,283192429,2008-11-14
122,1,2:57,1377,1377,Daniel Oliver Offensive Rebound.,30,20,10,8,0.8050729188244733,0.8050729188244733,Charlotte,UNC Greensboro,4,3,NA,283192429,2008-11-14
123,1,2:49,1369,1369,Mikko Koivisto missed Three Point Jumper.,30,20,10,0,0.805839280527538,0.805839280527538,Charlotte,UNC Greensboro,4,3,NA,283192429,2008-11-14
124,1,2:49,1369,1369,Lamont Mack Defensive Rebound.,30,20,10,8,0.805839280527538,0.805839280527538,Charlotte,UNC Greensboro,4,3,NA,283192429,2008-11-14
125,1,2:41,1361,1361,Phil Jones made Two Point Dunk Shot.  Assisted by Charles Dewhurst.,32,20,12,25,0.8473165853711268,0.8473165853711268,Charlotte,UNC Greensboro,4,3,NA,283192429,2008-11-14
126,1,2:16,1336,1336,Landon Clement made Three Point Jumper.  Assisted by Mikko Koivisto.,32,23,9,24,0.7856910354913657,0.7856910354913657,Charlotte,UNC Greensboro,4,3,NA,283192429,2008-11-14
127,1,1:52,1312,1312,Foul on DeAngelo Jackson,32,23,9,0,0.7879818525777409,0.7879818525777409,Charlotte,UNC Greensboro,4,3,NA,283192429,2008-11-14
128,1,1:52,1312,1312,Phil Jones made Free Throw.,33,23,10,0,0.8113292024079726,0.8113292024079726,Charlotte,UNC Greensboro,4,3,NA,283192429,2008-11-14
129,1,1:52,1312,1312,Phil Jones made Free Throw.,34,23,11,26,0.8326515705959948,0.8326515705959948,Charlotte,UNC Greensboro,4,3,NA,283192429,2008-11-14
130,1,1:26,1286,1286,Foul on DiJuan Harris,34,23,11,0,0.8352696671860874,0.8352696671860874,Charlotte,UNC Greensboro,4,3,NA,283192429,2008-11-14
131,1,1:26,1286,1286,Daniel Oliver made Free Throw.,34,24,10,0,0.8139462835293458,0.8139462835293458,Charlotte,UNC Greensboro,4,3,NA,283192429,2008-11-14
132,1,1:26,1286,1286,Daniel Oliver made Free Throw.,34,25,9,9,0.790554833289498,0.790554833289498,Charlotte,UNC Greensboro,4,3,NA,283192429,2008-11-14
133,1,1:17,1277,1277,An'Juan Wilderness made Two Point Layup.  Assisted by DiJuan Harris.,36,25,11,14,0.8362047394512117,0.8362047394512117,Charlotte,UNC Greensboro,4,3,NA,283192429,2008-11-14
134,1,1:03,1263,1263,Foul on Damian Eargle,36,25,11,18,0.8376955853427241,0.8376955853427241,Charlotte,UNC Greensboro,4,3,NA,283192429,2008-11-14
135,1,0:45,1245,1245,Lamont Mack missed Three Point Jumper.,36,25,11,0,0.8396870755817054,0.8396870755817054,Charlotte,UNC Greensboro,4,3,NA,283192429,2008-11-14
136,1,0:45,1245,1245,An'Juan Wilderness Offensive Rebound.,36,25,11,4,0.8396870755817054,0.8396870755817054,Charlotte,UNC Greensboro,4,3,NA,283192429,2008-11-14
137,1,0:41,1241,1241,Lamont Mack made Two Point Layup.  Assisted by DiJuan Harris.,38,25,13,4,0.8766385258920922,0.8766385258920922,Charlotte,UNC Greensboro,4,3,NA,283192429,2008-11-14
138,1,0:37,1237,1237,Foul on Damian Eargle,38,25,13,0,0.8770762677721715,0.8770762677721715,Charlotte,UNC Greensboro,4,3,NA,283192429,2008-11-14
139,1,0:37,1237,1237,Lamont Mack made Free Throw.,39,25,14,0,0.8924664467038973,0.8924664467038973,Charlotte,UNC Greensboro,4,3,NA,283192429,2008-11-14
140,1,0:37,1237,1237,Lamont Mack made Free Throw.,40,25,15,0,0.9061359710121887,0.9061359710121887,Charlotte,UNC Greensboro,4,3,NA,283192429,2008-11-14
141,1,0:37,1237,1237,Charlotte 30 Second Timeout.,40,25,15,26,0.9061359710121887,0.9061359710121887,Charlotte,UNC Greensboro,4,2,NA,283192429,2008-11-14
142,1,0:11,1211,1211,Foul on DiJuan Harris,40,25,15,0,0.9088240585823532,0.9088240585823532,Charlotte,UNC Greensboro,4,2,NA,283192429,2008-11-14
143,1,0:11,1211,1211,Landon Clement Steal.,40,25,15,0,0.9088240585823532,0.9088240585823532,Charlotte,UNC Greensboro,4,2,NA,283192429,2008-11-14
144,1,0:11,1211,1211,Landon Clement made Free Throw.,40,26,14,0,0.8953009393905591,0.8953009393905591,Charlotte,UNC Greensboro,4,2,NA,283192429,2008-11-14
145,1,0:11,1211,1211,Landon Clement made Free Throw.,40,27,13,8,0.8800368388856047,0.8800368388856047,Charlotte,UNC Greensboro,4,2,NA,283192429,2008-11-14
146,1,0:03,1203,1203,Ian Andersen missed Three Point Jumper.,40,27,13,0,0.8809741083872257,0.8809741083872257,Charlotte,UNC Greensboro,4,2,NA,283192429,2008-11-14
147,1,0:03,1203,1203,Landon Clement Defensive Rebound.,40,27,13,3,0.8809741083872257,0.8809741083872257,Charlotte,UNC Greensboro,4,2,NA,283192429,2008-11-14
148,1,0:00,1200,1200,End of the 1st Half.,40,27,13,0,0.881320024494264,0.881320024494264,Charlotte,UNC Greensboro,4,2,NA,283192429,2008-11-14
149,2,20:00,1200,1200,PLAY,40,27,13,30,0.881320024494264,0.881320024494264,Charlotte,UNC Greensboro,4,3,NA,283192429,2008-11-14
150,2,19:30,1170,1170,DiJuan Harris Steal.,40,27,13,4,0.8846374381057053,0.8846374381057053,Charlotte,UNC Greensboro,4,3,NA,283192429,2008-11-14
151,2,19:26,1166,1166,Rashad Coleman made Two Point Dunk Shot.  Assisted by An'Juan Wilderness.,42,27,15,17,0.9133565962053584,0.9133565962053584,Charlotte,UNC Greensboro,4,3,NA,283192429,2008-11-14
152,2,19:09,1149,1149,Landon Clement missed Two Point Jumper.,42,27,15,0,0.9149534397260788,0.9149534397260788,Charlotte,UNC Greensboro,4,3,NA,283192429,2008-11-14
153,2,19:09,1149,1149,DiJuan Harris Defensive Rebound.,42,27,15,19,0.9149534397260788,0.9149534397260788,Charlotte,UNC Greensboro,4,3,NA,283192429,2008-11-14
154,2,18:50,1130,1130,An'Juan Wilderness missed Two Point Layup.,42,27,15,0,0.9166960159760563,0.9166960159760563,Charlotte,UNC Greensboro,4,3,NA,283192429,2008-11-14
155,2,18:50,1130,1130,Charlie Coley Offensive Rebound.,42,27,15,5,0.9166960159760563,0.9166960159760563,Charlotte,UNC Greensboro,4,3,NA,283192429,2008-11-14
156,2,18:45,1125,1125,Rashad Coleman missed Three Point Jumper.,42,27,15,0,0.9171498834449688,0.9171498834449688,Charlotte,UNC Greensboro,4,3,NA,283192429,2008-11-14
157,2,18:45,1125,1125,Ben Stywall Defensive Rebound.,42,27,15,8,0.9171498834449688,0.9171498834449688,Charlotte,UNC Greensboro,4,3,NA,283192429,2008-11-14
158,2,18:37,1117,1117,Mikko Koivisto missed Two Point Layup.,42,27,15,0,0.9178737256324062,0.9178737256324062,Charlotte,UNC Greensboro,4,3,NA,283192429,2008-11-14
159,2,18:37,1117,1117,Mikko Koivisto Offensive Rebound.,42,27,15,5,0.9178737256324062,0.9178737256324062,Charlotte,UNC Greensboro,4,3,NA,283192429,2008-11-14
160,2,18:32,1112,1112,Mikko Koivisto made Three Point Jumper.,42,30,12,31,0.8738950026903272,0.8738950026903272,Charlotte,UNC Greensboro,4,3,NA,283192429,2008-11-14
161,2,18:01,1081,1081,An'Juan Wilderness missed Three Point Jumper.,42,30,12,0,0.8772102402502535,0.8772102402502535,Charlotte,UNC Greensboro,4,3,NA,283192429,2008-11-14
162,2,18:01,1081,1081,Charlie Coley Offensive Rebound.,42,30,12,3,0.8772102402502535,0.8772102402502535,Charlotte,UNC Greensboro,4,3,NA,283192429,2008-11-14
163,2,17:58,1078,1078,Charlie Coley missed Two Point Jumper.,42,30,12,0,0.8775357168791795,0.8775357168791795,Charlotte,UNC Greensboro,4,3,NA,283192429,2008-11-14
164,2,17:58,1078,1078,Lamont Mack Offensive Rebound.,42,30,12,5,0.8775357168791795,0.8775357168791795,Charlotte,UNC Greensboro,4,3,NA,283192429,2008-11-14
