play_id,half,time_remaining_half,secs_remaining,secs_remaining_absolute,description,home_score,away_score,score_diff,play_length,win_prob,naive_win_prob,home,away,home_time_out_remaining,away_time_out_remaining,home_favored_by,game_id,date
1,1,20:00,2400,2400,PLAY,0,0,0,13,0.5,0.5,Rice,Southern,4,4,NA,313210242,2011-11-17
2,1,19:47,2387,2387,Connor Frizzelle missed Three Point Jumper.,0,0,0,0,0.5,0.5,Rice,Southern,4,4,NA,313210242,2011-11-17
3,1,19:47,2387,2387,Jameel Grace Defensive Rebound.,0,0,0,18,0.5,0.5,Rice,Southern,4,4,NA,313210242,2011-11-17
4,1,19:29,2369,2369,Michael Celestine made Three Point Jumper.  Assisted by Quinton Doggett.,0,3,-3,24,0.43319932076689005,0.43319932076689005,Rice,Southern,4,4,NA,313210242,2011-11-17
5,1,19:05,2345,2345,Lucas Kuipers made Three Point Jumper.  Assisted by Arsalan Kazemi.,3,3,0,15,0.5,0.5,Rice,Southern,4,4,NA,313210242,2011-11-17
6,1,18:50,2330,2330,Quinton Doggett missed Jumper.,3,3,0,0,0.5,0.5,Rice,Southern,4,4,NA,313210242,2011-11-17
7,1,18:50,2330,2330,Arsalan Kazemi Defensive Rebound.,3,3,0,7,0.5,0.5,Rice,Southern,4,4,NA,313210242,2011-11-17
8,1,18:43,2323,2323,Foul on Frederick Coleman,3,3,0,14,0.5,0.5,Rice,Southern,4,4,NA,313210242,2011-11-17
9,1,18:29,2309,2309,Lucas Kuipers missed Three Point Jumper.,3,3,0,0,0.5,0.5,Rice,Southern,4,4,NA,313210242,2011-11-17
10,1,18:29,2309,2309,Frederick Coleman Defensive Rebound.,3,3,0,11,0.5,0.5,Rice,Southern,4,4,NA,313210242,2011-11-17
11,1,18:18,2298,2298,Michael Celestine missed Jumper.,3,3,0,0,0.5,0.5,Rice,Southern,4,4,NA,313210242,2011-11-17
12,1,18:18,2298,2298,Arsalan Kazemi Defensive Rebound.,3,3,0,7,0.5,0.5,Rice,Southern,4,4,NA,313210242,2011-11-17
13,1,18:11,2291,2291,Tamir Jackson missed Three Point Jumper.,3,3,0,0,0.5,0.5,Rice,Southern,4,4,NA,313210242,2011-11-17
14,1,18:11,2291,2291,Quinton Doggett Defensive Rebound.,3,3,0,28,0.5,0.5,Rice,Southern,4,4,NA,313210242,2011-11-17
15,1,17:43,2263,2263,Michael Celestine missed Jumper.,3,3,0,0,0.5,0.5,Rice,Southern,4,4,NA,313210242,2011-11-17
16,1,17:43,2263,2263,Lucas Kuipers Block.,3,3,0,1,0.5,0.5,Rice,Southern,4,4,NA,313210242,2011-11-17
17,1,17:42,2262,2262,Lucas Kuipers Defensive Rebound.,3,3,0,4,0.5,0.5,Rice,Southern,4,4,NA,313210242,2011-11-17
18,1,17:38,2258,2258,Jarelle Reischel made Jumper.,5,3,2,19,0.5471286592204017,0.5471286592204017,Rice,Southern,4,4,NA,313210242,2011-11-17
19,1,17:19,2239,2239,Derick Beltran made Jumper.  Assisted by Jameel Grace.,5,5,0,17,0.5,0.5,Rice,Southern,4,4,NA,313210242,2011-11-17
20,1,17:02,2222,2222,Tamir Jackson made Jumper.,7,5,2,5,0.5479468560005873,0.5479468560005873,Rice,Southern,4,4,NA,313210242,2011-11-17
21,1,16:57,2217,2217,Frederick Coleman Turnover.,7,5,2,1,0.5480611790931701,0.5480611790931701,Rice,Southern,4,4,NA,313210242,2011-11-17
22,1,16:56,2216,2216,Tamir Jackson Steal.,7,5,2,2,0.548084061544881,0.548084061544881,Rice,Southern,4,4,NA,313210242,2011-11-17
23,1,16:54,2214,2214,Arsalan Kazemi missed Jumper.,7,5,2,0,0.5481298438615707,0.5481298438615707,Rice,Southern,4,4,NA,313210242,2011-11-17
24,1,16:54,2214,2214,Lucas Kuipers Offensive Rebound.,7,5,2,4,0.5481298438615707,0.5481298438615707,Rice,Southern,4,4,NA,313210242,2011-11-17
25,1,16:50,2210,2210,Lucas Kuipers missed Jumper.,7,5,2,0,0.548221476678421,0.548221476678421,Rice,Southern,4,4,NA,313210242,2011-11-17
26,1,16:50,2210,2210,Tamir Jackson Offensive Rebound.,7,5,2,4,0.548221476678421,0.548221476678421,Rice,Southern,4,4,NA,313210242,2011-11-17
27,1,16:46,2206,2206,Tamir Jackson made Three Point Jumper.,10,5,5,27,0.6188439027113399,0.6188439027113399,Rice,Southern,4,4,NA,313210242,2011-11-17
28,1,16:19,2179,2179,Quinton Doggett made Jumper.  Assisted by Jameel Grace.,10,7,3,28,0.5731094402425919,0.5731094402425919,Rice,Southern,4,4,NA,313210242,2011-11-17
29,1,15:51,2151,2151,Tamir Jackson made Layup.,12,7,5,10,0.6218617260981661,0.6218617260981661,Rice,Southern,4,4,NA,313210242,2011-11-17
30,1,15:41,2141,2141,Quinton Doggett missed Jumper.,12,7,5,0,0.6224144719794179,0.6224144719794179,Rice,Southern,4,4,NA,313210242,2011-11-17
31,1,15:41,2141,2141,Frederick Coleman Offensive Rebound.,12,7,5,17,0.6224144719794179,0.6224144719794179,Rice,Southern,4,4,NA,313210242,2011-11-17
32,1,15:24,2124,2124,Frederick Coleman made Layup.  Assisted by Quinton Doggett.,12,9,3,16,0.5750035951095774,0.5750035951095774,Rice,Southern,4,4,NA,313210242,2011-11-17
33,1,15:08,2108,2108,Connor Frizzelle missed Jumper.,12,9,3,0,0.575561331505119,0.575561331505119,Rice,Southern,4,4,NA,313210242,2011-11-17
34,1,15:08,2108,2108,Quinton Doggett Defensive Rebound.,12,9,3,10,0.575561331505119,0.575561331505119,Rice,Southern,4,4,NA,313210242,2011-11-17
35,1,14:58,2098,2098,Foul on Jarelle Reischel,12,9,3,0,0.5759116389021492,0.5759116389021492,Rice,Southern,4,4,NA,313210242,2011-11-17
36,1,14:58,2098,2098,Official TV Timeout.,12,9,3,0,0.5759116389021492,0.5759116389021492,Rice,Southern,4,4,NA,313210242,2011-11-17
37,1,14:58,2098,2098,Derick Beltran made Free Throw.,12,10,2,0,0.5508259122440117,0.5508259122440117,Rice,Southern,4,4,NA,313210242,2011-11-17
38,1,14:58,2098,2098,Derick Beltran made Free Throw.,12,11,1,15,0.5254789461174939,0.5254789461174939,Rice,Southern,4,4,NA,313210242,2011-11-17
39,1,14:43,2083,2083,Foul on Derick Beltran,12,11,1,0,0.52565868112771,0.52565868112771,Rice,Southern,4,4,NA,313210242,2011-11-17
40,1,14:43,2083,2083,Arsalan Kazemi missed Free Throw.,12,11,1,0,0.52565868112771,0.52565868112771,Rice,Southern,4,4,NA,313210242,2011-11-17
41,1,14:43,2083,2083,null,12,11,1,0,0.52565868112771,0.52565868112771,Rice,Southern,4,4,NA,313210242,2011-11-17
42,1,14:43,2083,2083,Arsalan Kazemi made Free Throw.,13,11,2,23,0.5511825743958096,0.5511825743958096,Rice,Southern,4,4,NA,313210242,2011-11-17
43,1,14:20,2060,2060,Jameel Grace made Jumper.  Assisted by Michael Celestine.,13,13,0,28,0.5,0.5,Rice,Southern,4,4,NA,313210242,2011-11-17
44,1,13:52,2032,2032,Tamir Jackson made Jumper.,15,13,2,18,0.5524129552090024,0.5524129552090024,Rice,Southern,4,4,NA,313210242,2011-11-17
45,1,13:34,2014,2014,Derick Beltran made Jumper.,15,15,0,14,0.5,0.5,Rice,Southern,4,4,NA,313210242,2011-11-17
46,1,13:20,2000,2000,Lucas Kuipers made Layup.  Assisted by Arsalan Kazemi.,17,15,2,27,0.5532003999535374,0.5532003999535374,Rice,Southern,4,4,NA,313210242,2011-11-17
47,1,12:53,1973,1973,Quinton Doggett made Jumper.,17,17,0,15,0.5,0.5,Rice,Southern,4,4,NA,313210242,2011-11-17
48,1,12:38,1958,1958,Lucas Kuipers made Three Point Jumper.  Assisted by Arsalan Kazemi.,20,17,3,10,0.580983387401631,0.580983387401631,Rice,Southern,4,4,NA,313210242,2011-11-17
49,1,12:28,1948,1948,Foul on Arsalan Kazemi,20,17,3,22,0.5813595563501156,0.5813595563501156,Rice,Southern,4,4,NA,313210242,2011-11-17
50,1,12:06,1926,1926,Jameel Grace made Three Point Jumper.  Assisted by Derick Beltran.,20,20,0,22,0.5,0.5,Rice,Southern,4,4,NA,313210242,2011-11-17
51,1,11:44,1904,1904,Foul on Arsalan Kazemi,20,20,0,0,0.5,0.5,Rice,Southern,4,4,NA,313210242,2011-11-17
52,1,11:44,1904,1904,Arsalan Kazemi Turnover.,20,20,0,0,0.5,0.5,Rice,Southern,4,4,NA,313210242,2011-11-17
53,1,11:44,1904,1904,Official TV Timeout.,20,20,0,13,0.5,0.5,Rice,Southern,4,4,NA,313210242,2011-11-17
54,1,11:31,1891,1891,Russell Hill missed Three Point Jumper.,20,20,0,0,0.5,0.5,Rice,Southern,4,4,NA,313210242,2011-11-17
55,1,11:31,1891,1891,Rice Defensive Rebound.,20,20,0,26,0.5,0.5,Rice,Southern,4,4,NA,313210242,2011-11-17
56,1,11:05,1865,1865,Julian DeBose missed Jumper.,20,20,0,0,0.5,0.5,Rice,Southern,4,4,NA,313210242,2011-11-17
57,1,11:05,1865,1865,Julian DeBose Offensive Rebound.,20,20,0,4,0.5,0.5,Rice,Southern,4,4,NA,313210242,2011-11-17
58,1,11:01,1861,1861,Julian DeBose made Layup.,22,20,2,21,0.5567456771006288,0.5567456771006288,Rice,Southern,4,4,NA,313210242,2011-11-17
59,1,10:40,1840,1840,Cameron Monroe missed Jumper.,22,20,2,0,0.5572884726183811,0.5572884726183811,Rice,Southern,4,4,NA,313210242,2011-11-17
60,1,10:40,1840,1840,J.R. Reynolds Block.,22,20,2,1,0.5572884726183811,0.5572884726183811,Rice,Southern,4,4,NA,313210242,2011-11-17
61,1,10:39,1839,1839,David Chadwick Defensive Rebound.,22,20,2,9,0.5573144007142591,0.5573144007142591,Rice,Southern,4,4,NA,313210242,2011-11-17
62,1,10:30,1830,1830,J.R. Reynolds missed Three Point Jumper.,22,20,2,0,0.5575481549841094,0.5575481549841094,Rice,Southern,4,4,NA,313210242,2011-11-17
63,1,10:30,1830,1830,Derick Beltran Defensive Rebound.,22,20,2,10,0.5575481549841094,0.5575481549841094,Rice,Southern,4,4,NA,313210242,2011-11-17
64,1,10:20,1820,1820,Jameel Grace made Three Point Jumper.  Assisted by Cameron Monroe.,22,23,-1,16,0.47099834121014167,0.47099834121014167,Rice,Southern,4,4,NA,313210242,2011-11-17
65,1,10:04,1804,1804,Lucas Kuipers missed Three Point Jumper.,22,23,-1,0,0.4707864419057754,0.4707864419057754,Rice,Southern,4,4,NA,313210242,2011-11-17
66,1,10:04,1804,1804,Jameel Grace Defensive Rebound.,22,23,-1,12,0.4707864419057754,0.4707864419057754,Rice,Southern,4,4,NA,313210242,2011-11-17
67,1,9:52,1792,1792,Quinton Doggett missed Jumper.,22,23,-1,0,0.47062633668484394,0.47062633668484394,Rice,Southern,4,4,NA,313210242,2011-11-17
68,1,9:52,1792,1792,David Chadwick Defensive Rebound.,22,23,-1,19,0.47062633668484394,0.47062633668484394,Rice,Southern,4,4,NA,313210242,2011-11-17
69,1,9:33,1773,1773,David Chadwick missed Jumper.,22,23,-1,0,0.4703704091017177,0.4703704091017177,Rice,Southern,4,4,NA,313210242,2011-11-17
70,1,9:33,1773,1773,Russell Hill Defensive Rebound.,22,23,-1,7,0.4703704091017177,0.4703704091017177,Rice,Southern,4,4,NA,313210242,2011-11-17
71,1,9:26,1766,1766,Cameron Monroe missed Jumper.,22,23,-1,0,0.470275280471876,0.470275280471876,Rice,Southern,4,4,NA,313210242,2011-11-17
72,1,9:26,1766,1766,Julian DeBose Block.,22,23,-1,2,0.470275280471876,0.470275280471876,Rice,Southern,4,4,NA,313210242,2011-11-17
73,1,9:24,1764,1764,David Chadwick Defensive Rebound.,22,23,-1,5,0.4702480113212606,0.4702480113212606,Rice,Southern,4,4,NA,313210242,2011-11-17
74,1,9:19,1759,1759,Tamir Jackson made Three Point Jumper.  Assisted by J.R. Reynolds.,25,23,2,18,0.559429293330432,0.559429293330432,Rice,Southern,4,4,NA,313210242,2011-11-17
75,1,9:01,1741,1741,Foul on J.R. Reynolds,25,23,2,0,0.559920660776407,0.559920660776407,Rice,Southern,4,4,NA,313210242,2011-11-17
76,1,9:01,1741,1741,Cameron Monroe missed Free Throw.,25,23,2,0,0.559920660776407,0.559920660776407,Rice,Southern,4,4,NA,313210242,2011-11-17
77,1,9:01,1741,1741,null,25,23,2,0,0.559920660776407,0.559920660776407,Rice,Southern,4,4,NA,313210242,2011-11-17
78,1,9:01,1741,1741,Cameron Monroe made Free Throw.,25,24,1,11,0.5300686819994131,0.5300686819994131,Rice,Southern,4,4,NA,313210242,2011-11-17
79,1,8:50,1730,1730,Dylan Ennis made Three Point Jumper.  Assisted by Tamir Jackson.,28,24,4,26,0.618726772838221,0.618726772838221,Rice,Southern,4,4,NA,313210242,2011-11-17
80,1,8:24,1704,1704,Foul on Dylan Ennis,28,24,4,7,0.6201258181825495,0.6201258181825495,Rice,Southern,4,4,NA,313210242,2011-11-17
81,1,8:17,1697,1697,Russell Hill missed Jumper.,28,24,4,0,0.6205084525844143,0.6205084525844143,Rice,Southern,4,4,NA,313210242,2011-11-17
82,1,8:17,1697,1697,Seth Gearhart Defensive Rebound.,28,24,4,12,0.6205084525844143,0.6205084525844143,Rice,Southern,4,4,NA,313210242,2011-11-17
83,1,8:05,1685,1685,David Chadwick missed Jumper.,28,24,4,0,0.6211689033900076,0.6211689033900076,Rice,Southern,4,4,NA,313210242,2011-11-17
84,1,8:05,1685,1685,Russell Hill Defensive Rebound.,28,24,4,20,0.6211689033900076,0.6211689033900076,Rice,Southern,4,4,NA,313210242,2011-11-17
85,1,7:45,1665,1665,Derick Beltran Turnover.,28,24,4,1,0.622248588705112,0.622248588705112,Rice,Southern,4,4,NA,313210242,2011-11-17
86,1,7:44,1664,1664,David Chadwick Steal.,28,24,4,5,0.6223017985219527,0.6223017985219527,Rice,Southern,4,4,NA,313210242,2011-11-17
87,1,7:39,1659,1659,Dylan Ennis made Three Point Jumper.  Assisted by Julian DeBose.,31,24,7,18,0.7059513110105142,0.7059513110105142,Rice,Southern,4,4,NA,313210242,2011-11-17
88,1,7:21,1641,1641,Cameron Monroe missed Jumper.,31,24,7,0,0.7074072042519296,0.7074072042519296,Rice,Southern,4,4,NA,313210242,2011-11-17
89,1,7:21,1641,1641,Frederick Coleman Offensive Rebound.,31,24,7,5,0.7074072042519296,0.7074072042519296,Rice,Southern,4,4,NA,313210242,2011-11-17
90,1,7:16,1636,1636,Frederick Coleman missed Jumper.,31,24,7,0,0.7078069919219596,0.7078069919219596,Rice,Southern,4,4,NA,313210242,2011-11-17
91,1,7:16,1636,1636,Dylan Ennis Defensive Rebound.,31,24,7,6,0.7078069919219596,0.7078069919219596,Rice,Southern,4,4,NA,313210242,2011-11-17
92,1,7:10,1630,1630,Dylan Ennis missed Three Point Jumper.,31,24,7,0,0.7082845998291963,0.7082845998291963,Rice,Southern,4,4,NA,313210242,2011-11-17
93,1,7:10,1630,1630,Jameel Grace Defensive Rebound.,31,24,7,19,0.7082845998291963,0.7082845998291963,Rice,Southern,4,4,NA,313210242,2011-11-17
94,1,6:51,1611,1611,Russell Hill made Jumper.,31,26,5,16,0.6544857621852754,0.6544857621852754,Rice,Southern,4,4,NA,313210242,2011-11-17
95,1,6:35,1595,1595,Foul on Russell Hill,31,26,5,0,0.6554715491223534,0.6554715491223534,Rice,Southern,4,4,NA,313210242,2011-11-17
96,1,6:35,1595,1595,Official TV Timeout.,31,26,5,4,0.6554715491223534,0.6554715491223534,Rice,Southern,4,4,NA,313210242,2011-11-17
97,1,6:31,1591,1591,Connor Frizzelle missed Three Point Jumper.,31,26,5,0,0.6557179920192546,0.6557179920192546,Rice,Southern,4,4,NA,313210242,2011-11-17
98,1,6:31,1591,1591,Julian DeBose Offensive Rebound.,31,26,5,6,0.6557179920192546,0.6557179920192546,Rice,Southern,4,4,NA,313210242,2011-11-17
99,1,6:25,1585,1585,Julian DeBose made Jumper.,33,26,7,23,0.7118267341799492,0.7118267341799492,Rice,Southern,4,4,NA,313210242,2011-11-17
100,1,6:02,1562,1562,Jameel Grace missed Jumper.,33,26,7,0,0.7136405355242537,0.7136405355242537,Rice,Southern,4,4,NA,313210242,2011-11-17
101,1,6:02,1562,1562,Dylan Ennis Defensive Rebound.,33,26,7,12,0.7136405355242537,0.7136405355242537,Rice,Southern,4,4,NA,313210242,2011-11-17
102,1,5:50,1550,1550,Ahmad Ibrahim missed Jumper.,33,26,7,0,0.7145965287852271,0.7145965287852271,Rice,Southern,4,4,NA,313210242,2011-11-17
103,1,5:50,1550,1550,Frederick Coleman Defensive Rebound.,33,26,7,4,0.7145965287852271,0.7145965287852271,Rice,Southern,4,4,NA,313210242,2011-11-17
104,1,5:46,1546,1546,Foul on Julian DeBose,33,26,7,16,0.7149173066755878,0.7149173066755878,Rice,Southern,4,4,NA,313210242,2011-11-17
105,1,5:30,1530,1530,Foul on Julian DeBose,33,26,7,0,0.716213589973791,0.716213589973791,Rice,Southern,4,4,NA,313210242,2011-11-17
106,1,5:30,1530,1530,Derick Beltran made Free Throw.,33,27,6,0,0.6885835587192296,0.6885835587192296,Rice,Southern,4,4,NA,313210242,2011-11-17
107,1,5:30,1530,1530,Derick Beltran made Free Throw.,33,28,5,9,0.6595421789910721,0.6595421789910721,Rice,Southern,4,4,NA,313210242,2011-11-17
108,1,5:21,1521,1521,Seth Gearhart made Three Point Jumper.  Assisted by Tamir Jackson.,36,28,8,21,0.7431054127961209,0.7431054127961209,Rice,Southern,4,4,NA,313210242,2011-11-17
109,1,5:00,1500,1500,Michael Celestine missed Jumper.,36,28,8,0,0.7450015345827096,0.7450015345827096,Rice,Southern,4,4,NA,313210242,2011-11-17
110,1,5:00,1500,1500,Rice Defensive Rebound.,36,28,8,13,0.7450015345827096,0.7450015345827096,Rice,Southern,4,4,NA,313210242,2011-11-17
111,1,4:47,1487,1487,Connor Frizzelle missed Jumper.,36,28,8,0,0.7462077928969975,0.7462077928969975,Rice,Southern,4,4,NA,313210242,2011-11-17
112,1,4:47,1487,1487,Rice Offensive Rebound.,36,28,8,5,0.7462077928969975,0.7462077928969975,Rice,Southern,4,4,NA,313210242,2011-11-17
113,1,4:42,1482,1482,Michael Celestine made Jumper.,36,30,6,38,0.6922659874375408,0.6922659874375408,Rice,Southern,4,4,NA,313210242,2011-11-17
114,1,4:04,1444,1444,Connor Frizzelle missed Three Point Jumper.,36,30,6,0,0.6954263687075768,0.6954263687075768,Rice,Southern,4,4,NA,313210242,2011-11-17
115,1,4:04,1444,1444,Ahmad Ibrahim Offensive Rebound.,36,30,6,11,0.6954263687075768,0.6954263687075768,Rice,Southern,4,4,NA,313210242,2011-11-17
116,1,3:53,1433,1433,Foul on Frederick Coleman,36,30,6,0,0.6963449951168891,0.6963449951168891,Rice,Southern,4,4,NA,313210242,2011-11-17
117,1,3:53,1433,1433,Official TV Timeout.,36,30,6,0,0.6963449951168891,0.6963449951168891,Rice,Southern,4,4,NA,313210242,2011-11-17
118,1,3:53,1433,1433,Dylan Ennis missed Free Throw.,36,30,6,0,0.6963449951168891,0.6963449951168891,Rice,Southern,4,4,NA,313210242,2011-11-17
119,1,3:53,1433,1433,null,36,30,6,0,0.6963449951168891,0.6963449951168891,Rice,Southern,4,4,NA,313210242,2011-11-17
120,1,3:53,1433,1433,Dylan Ennis made Free Throw.,37,30,7,31,0.7247762369972092,0.7247762369972092,Rice,Southern,4,4,NA,313210242,2011-11-17
121,1,3:22,1402,1402,Jameel Grace missed Jumper.,37,30,7,0,0.7275135374786544,0.7275135374786544,Rice,Southern,4,4,NA,313210242,2011-11-17
122,1,3:22,1402,1402,Dylan Ennis Block.,37,30,7,2,0.7275135374786544,0.7275135374786544,Rice,Southern,4,4,NA,313210242,2011-11-17
123,1,3:20,1400,1400,Quinton Doggett Offensive Rebound.,37,30,7,3,0.7276857830855252,0.7276857830855252,Rice,Southern,4,4,NA,313210242,2011-11-17
124,1,3:17,1397,1397,Quinton Doggett made Jumper.,37,32,5,9,0.6688546682123504,0.6688546682123504,Rice,Southern,4,4,NA,313210242,2011-11-17
125,1,3:08,1388,1388,Foul on Cameron Monroe,37,32,5,0,0.6694686591249911,0.6694686591249911,Rice,Southern,4,4,NA,313210242,2011-11-17
126,1,3:08,1388,1388,Tamir Jackson made Free Throw.,38,32,6,0,0.6999247267128001,0.6999247267128001,Rice,Southern,4,4,NA,313210242,2011-11-17
127,1,3:08,1388,1388,Tamir Jackson missed Free Throw.,38,32,6,0,0.6999247267128001,0.6999247267128001,Rice,Southern,4,4,NA,313210242,2011-11-17
128,1,3:08,1388,1388,Derick Beltran Defensive Rebound.,38,32,6,19,0.6999247267128001,0.6999247267128001,Rice,Southern,4,4,NA,313210242,2011-11-17
129,1,2:49,1369,1369,Michael Celestine missed Three Point Jumper.,38,32,6,0,0.701388560054227,0.701388560054227,Rice,Southern,4,4,NA,313210242,2011-11-17
130,1,2:49,1369,1369,Dylan Ennis Defensive Rebound.,38,32,6,8,0.701388560054227,0.701388560054227,Rice,Southern,4,4,NA,313210242,2011-11-17
131,1,2:41,1361,1361,Foul on Cameron Monroe,38,32,6,0,0.7020029256095539,0.7020029256095539,Rice,Southern,4,4,NA,313210242,2011-11-17
132,1,2:41,1361,1361,Tamir Jackson made Free Throw.,39,32,7,0,0.7309922928989023,0.7309922928989023,Rice,Southern,4,4,NA,313210242,2011-11-17
133,1,2:41,1361,1361,Tamir Jackson missed Free Throw.,39,32,7,0,0.7309922928989023,0.7309922928989023,Rice,Southern,4,4,NA,313210242,2011-11-17
134,1,2:41,1361,1361,null,39,32,7,0,0.7309922928989023,0.7309922928989023,Rice,Southern,4,4,NA,313210242,2011-11-17
135,1,2:41,1361,1361,Tamir Jackson made Free Throw.,40,32,8,10,0.7581331882103345,0.7581331882103345,Rice,Southern,4,4,NA,313210242,2011-11-17
136,1,2:31,1351,1351,Cameron Monroe Turnover.,40,32,8,0,0.7590315091877954,0.7590315091877954,Rice,Southern,4,4,NA,313210242,2011-11-17
137,1,2:31,1351,1351,Tamir Jackson Steal.,40,32,8,4,0.7590315091877954,0.7590315091877954,Rice,Southern,4,4,NA,313210242,2011-11-17
138,1,2:27,1347,1347,Ahmad Ibrahim Turnover.,40,32,8,2,0.7593915546901102,0.7593915546901102,Rice,Southern,4,4,NA,313210242,2011-11-17
139,1,2:25,1345,1345,Derick Beltran Steal.,40,32,8,3,0.7595718218524076,0.7595718218524076,Rice,Southern,4,4,NA,313210242,2011-11-17
140,1,2:22,1342,1342,Foul on Connor Frizzelle,40,32,8,0,0.7598425915969854,0.7598425915969854,Rice,Southern,4,4,NA,313210242,2011-11-17
141,1,2:22,1342,1342,Michael Celestine made Free Throw.,40,33,7,0,0.7325971483692415,0.7325971483692415,Rice,Southern,4,4,NA,313210242,2011-11-17
142,1,2:22,1342,1342,Michael Celestine missed Free Throw.,40,33,7,0,0.7325971483692415,0.7325971483692415,Rice,Southern,4,4,NA,313210242,2011-11-17
143,1,2:22,1342,1342,Michael Celestine Offensive Rebound.,40,33,7,6,0.7325971483692415,0.7325971483692415,Rice,Southern,4,4,NA,313210242,2011-11-17
144,1,2:16,1336,1336,Derick Beltran missed Jumper.,40,33,7,0,0.7331074292033977,0.7331074292033977,Rice,Southern,4,4,NA,313210242,2011-11-17
145,1,2:16,1336,1336,Quinton Doggett Offensive Rebound.,40,33,7,1,0.7331074292033977,0.7331074292033977,Rice,Southern,4,4,NA,313210242,2011-11-17
146,1,2:15,1335,1335,Foul on Lucas Kuipers,40,33,7,0,0.7331927191030617,0.7331927191030617,Rice,Southern,4,4,NA,313210242,2011-11-17
147,1,2:15,1335,1335,Quinton Doggett made Free Throw.,40,34,6,0,0.7040107042918414,0.7040107042918414,Rice,Southern,4,4,NA,313210242,2011-11-17
148,1,2:15,1335,1335,Quinton Doggett made Free Throw.,40,35,5,16,0.6730601645623122,0.6730601645623122,Rice,Southern,4,4,NA,313210242,2011-11-17
149,1,1:59,1319,1319,Dylan Ennis missed Jumper.,40,35,5,0,0.6741672802996929,0.6741672802996929,Rice,Southern,4,4,NA,313210242,2011-11-17
150,1,1:59,1319,1319,Jameel Grace Defensive Rebound.,40,35,5,8,0.6741672802996929,0.6741672802996929,Rice,Southern,4,4,NA,313210242,2011-11-17
151,1,1:51,1311,1311,Quinton Doggett made Jumper.  Assisted by Cameron Monroe.,40,37,3,19,0.6077333700540296,0.6077333700540296,Rice,Southern,4,4,NA,313210242,2011-11-17
152,1,1:32,1292,1292,Tamir Jackson made Jumper.,42,37,5,4,0.6760992986652161,0.6760992986652161,Rice,Southern,4,4,NA,313210242,2011-11-17
153,1,1:28,1288,1288,Jameel Grace Turnover.,42,37,5,0,0.6763943841618215,0.6763943841618215,Rice,Southern,4,4,NA,313210242,2011-11-17
154,1,1:28,1288,1288,Dylan Ennis Steal.,42,37,5,6,0.6763943841618215,0.6763943841618215,Rice,Southern,4,4,NA,313210242,2011-11-17
155,1,1:22,1282,1282,Foul on Michael Celestine,42,37,5,0,0.6768420754083765,0.6768420754083765,Rice,Southern,4,4,NA,313210242,2011-11-17
156,1,1:22,1282,1282,Dylan Ennis made Free Throw.,43,37,6,0,0.7083029653362832,0.7083029653362832,Rice,Southern,4,4,NA,313210242,2011-11-17
157,1,1:22,1282,1282,Dylan Ennis made Free Throw.,44,37,7,24,0.7378871137951227,0.7378871137951227,Rice,Southern,4,4,NA,313210242,2011-11-17
158,1,0:58,1258,1258,Derick Beltran made Jumper.,44,39,5,23,0.678702073510611,0.678702073510611,Rice,Southern,4,4,NA,313210242,2011-11-17
159,1,0:35,1235,1235,Foul on Jameel Grace,44,39,5,0,0.6806081734276322,0.6806081734276322,Rice,Southern,4,4,NA,313210242,2011-11-17
160,1,0:35,1235,1235,Dylan Ennis made Free Throw.,45,39,6,0,0.7125665079416067,0.7125665079416067,Rice,Southern,4,4,NA,313210242,2011-11-17
161,1,0:35,1235,1235,Dylan Ennis made Free Throw.,46,39,7,34,0.7425367505654806,0.7425367505654806,Rice,Southern,4,4,NA,313210242,2011-11-17
162,1,0:01,1201,1201,Jameel Grace Turnover.,46,39,7,1,0.7463081927719248,0.7463081927719248,Rice,Southern,4,4,NA,313210242,2011-11-17
163,1,0:00,1200,1200,End of the 1st Half.,46,39,7,0,0.7464201950257411,0.7464201950257411,Rice,Southern,4,4,NA,313210242,2011-11-17
164,2,20:00,1200,1200,PLAY,46,39,7,30,0.7464201950257411,0.7464201950257411,Rice,Southern,4,4,NA,313210242,2011-11-17
165,2,19:30,1170,1170,Foul on Jarelle Reischel,46,39,7,15,0.7496786069198403,0.7496786069198403,Rice,Southern,4,4,NA,313210242,2011-11-17
166,2,19:15,1155,1155,Frederick Coleman made Jumper.,46,41,5,12,0.6877251713842873,0.6877251713842873,Rice,Southern,4,4,NA,313210242,2011-11-17
167,2,19:03,1143,1143,Foul on Quinton Doggett,46,41,5,17,0.6887478917648818,0.6887478917648818,Rice,Southern,4,4,NA,313210242,2011-11-17
168,2,18:46,1126,1126,Jarelle Reischel missed Jumper.,46,41,5,0,0.6901915697979993,0.6901915697979993,Rice,Southern,4,4,NA,313210242,2011-11-17
169,2,18:46,1126,1126,Frederick Coleman Defensive Rebound.,46,41,5,7,0.6901915697979993,0.6901915697979993,Rice,Southern,4,4,NA,313210242,2011-11-17
170,2,18:39,1119,1119,Jameel Grace Turnover.,46,41,5,15,0.690787202306434,0.690787202306434,Rice,Southern,4,4,NA,313210242,2011-11-17
171,2,18:24,1104,1104,Foul on Jameel Grace,46,41,5,2,0.6920720784082816,0.6920720784082816,Rice,Southern,4,4,NA,313210242,2011-11-17
172,2,18:22,1102,1102,Lucas Kuipers missed Jumper.,46,41,5,0,0.6922446642668082,0.6922446642668082,Rice,Southern,4,4,NA,313210242,2011-11-17
173,2,18:22,1102,1102,Michael Celestine Defensive Rebound.,46,41,5,16,0.6922446642668082,0.6922446642668082,Rice,Southern,4,4,NA,313210242,2011-11-17
174,2,18:06,1086,1086,Quinton Doggett Turnover.,46,41,5,0,0.6936406268606925,0.6936406268606925,Rice,Southern,4,4,NA,313210242,2011-11-17
175,2,18:06,1086,1086,Lucas Kuipers Steal.,46,41,5,11,0.6936406268606925,0.6936406268606925,Rice,Southern,4,4,NA,313210242,2011-11-17
176,2,17:55,1075,1075,Jarelle Reischel missed Three Point Jumper.,46,41,5,0,0.6946201754462424,0.6946201754462424,Rice,Southern,4,4,NA,313210242,2011-11-17
177,2,17:55,1075,1075,Lucas Kuipers Offensive Rebound.,46,41,5,4,0.6946201754462424,0.6946201754462424,Rice,Southern,4,4,NA,313210242,2011-11-17
178,2,17:51,1071,1071,Lucas Kuipers Turnover.,46,41,5,1,0.694981253861646,0.694981253861646,Rice,Southern,4,4,NA,313210242,2011-11-17
179,2,17:50,1070,1070,Michael Celestine Steal.,46,41,5,16,0.6950719674125875,0.6950719674125875,Rice,Southern,4,4,NA,313210242,2011-11-17
180,2,17:34,1054,1054,Foul on Frederick Coleman,46,41,5,0,0.6965501864249019,0.6965501864249019,Rice,Southern,4,4,NA,313210242,2011-11-17
181,2,17:34,1054,1054,Frederick Coleman Turnover.,46,41,5,20,0.6965501864249019,0.6965501864249019,Rice,Southern,4,4,NA,313210242,2011-11-17
182,2,17:14,1034,1034,Lucas Kuipers missed Three Point Jumper.,46,41,5,0,0.6984811672258355,0.6984811672258355,Rice,Southern,4,4,NA,313210242,2011-11-17
183,2,17:14,1034,1034,Derick Beltran Defensive Rebound.,46,41,5,7,0.6984811672258355,0.6984811672258355,Rice,Southern,4,4,NA,313210242,2011-11-17
184,2,17:07,1027,1027,Derick Beltran made Jumper.,46,43,3,19,0.6238788675779064,0.6238788675779064,Rice,Southern,4,4,NA,313210242,2011-11-17
185,2,16:48,1008,1008,Foul on Frederick Coleman,46,43,3,14,0.62520633829215,0.62520633829215,Rice,Southern,4,4,NA,313210242,2011-11-17
186,2,16:34,994,994,Connor Frizzelle made Jumper.,48,43,5,29,0.7027029144394314,0.7027029144394314,Rice,Southern,4,4,NA,313210242,2011-11-17
