play_id,half,time_remaining_half,secs_remaining,secs_remaining_absolute,description,home_score,away_score,score_diff,play_length,win_prob,naive_win_prob,home,away,home_time_out_remaining,away_time_out_remaining,home_favored_by,game_id,date
1,1,20:00,2400,2400,PLAY,0,0,0,19,0.5,0.5,Miami,Wake Forest,6,6,NA,270062390,2007-01-06
2,1,19:41,2381,2381,Jack McClinton missed Two Point Jumper.,0,0,0,0,0.5,0.5,Miami,Wake Forest,6,6,NA,270062390,2007-01-06
3,1,19:41,2381,2381,Jack McClinton Offensive Rebound.,0,0,0,4,0.5,0.5,Miami,Wake Forest,6,6,NA,270062390,2007-01-06
4,1,19:37,2377,2377,Denis Clemente made Two Point Jumper.,2,0,2,5,0.5445115236168748,0.5445115236168748,Miami,Wake Forest,6,6,NA,270062390,2007-01-06
5,1,19:32,2372,2372,Harvey Hale missed Two Point Layup.,2,0,2,0,0.5446180346713736,0.5446180346713736,Miami,Wake Forest,6,6,NA,270062390,2007-01-06
6,1,19:32,2372,2372,Dwyane Collins Defensive Rebound.,2,0,2,7,0.5446180346713736,0.5446180346713736,Miami,Wake Forest,6,6,NA,270062390,2007-01-06
7,1,19:25,2365,2365,Jack McClinton missed Three Point Jumper.,2,0,2,0,0.5447677378565356,0.5447677378565356,Miami,Wake Forest,6,6,NA,270062390,2007-01-06
8,1,19:25,2365,2365,Harvey Hale Defensive Rebound.,2,0,2,10,0.5447677378565356,0.5447677378565356,Miami,Wake Forest,6,6,NA,270062390,2007-01-06
9,1,19:15,2355,2355,Jamie Skeen missed Three Point Jumper.,2,0,2,0,0.5449827561110013,0.5449827561110013,Miami,Wake Forest,6,6,NA,270062390,2007-01-06
10,1,19:15,2355,2355,Miami (FL) Defensive Rebound.,2,0,2,30,0.5449827561110013,0.5449827561110013,Miami,Wake Forest,6,6,NA,270062390,2007-01-06
11,1,18:45,2325,2325,Anthony Harris made Two Point Layup.,4,0,4,0,0.5905169181512908,0.5905169181512908,Miami,Wake Forest,6,6,NA,270062390,2007-01-06
12,1,18:45,2325,2325,Foul on Anthony Harris,4,0,4,11,0.5905169181512908,0.5905169181512908,Miami,Wake Forest,6,6,NA,270062390,2007-01-06
13,1,18:34,2314,2314,Ishmael Smith made Three Point Jumper.,4,3,1,25,0.5229872304077562,0.5229872304077562,Miami,Wake Forest,6,6,NA,270062390,2007-01-06
14,1,18:09,2289,2289,Denis Clemente missed Three Point Jumper.,4,3,1,0,0.5232664437104748,0.5232664437104748,Miami,Wake Forest,6,6,NA,270062390,2007-01-06
15,1,18:09,2289,2289,Harvey Hale Defensive Rebound.,4,3,1,9,0.5232664437104748,0.5232664437104748,Miami,Wake Forest,6,6,NA,270062390,2007-01-06
16,1,18:00,2280,2280,Ishmael Smith missed Two Point Layup.,4,3,1,0,0.5233677364068907,0.5233677364068907,Miami,Wake Forest,6,6,NA,270062390,2007-01-06
17,1,18:00,2280,2280,Denis Clemente Defensive Rebound.,4,3,1,13,0.5233677364068907,0.5233677364068907,Miami,Wake Forest,6,6,NA,270062390,2007-01-06
18,1,17:47,2267,2267,Jack McClinton missed Three Point Jumper.,4,3,1,0,0.5235147142514571,0.5235147142514571,Miami,Wake Forest,6,6,NA,270062390,2007-01-06
19,1,17:47,2267,2267,Jack McClinton Offensive Rebound.,4,3,1,3,0.5235147142514571,0.5235147142514571,Miami,Wake Forest,6,6,NA,270062390,2007-01-06
20,1,17:44,2264,2264,Foul on Ishmael Smith,4,3,1,0,0.5235487387520344,0.5235487387520344,Miami,Wake Forest,6,6,NA,270062390,2007-01-06
21,1,17:44,2264,2264,Dwyane Collins made Free Throw.,5,3,2,0,0.5469932384002621,0.5469932384002621,Miami,Wake Forest,6,6,NA,270062390,2007-01-06
22,1,17:44,2264,2264,Dwyane Collins missed Free Throw.,5,3,2,0,0.5469932384002621,0.5469932384002621,Miami,Wake Forest,6,6,NA,270062390,2007-01-06
23,1,17:44,2264,2264,Miami (FL) Defensive Rebound.,5,3,2,5,0.5469932384002621,0.5469932384002621,Miami,Wake Forest,6,6,NA,270062390,2007-01-06
24,1,17:39,2259,2259,Jack McClinton missed Two Point Layup.,5,3,2,2,0.5471060687074408,0.5471060687074408,Miami,Wake Forest,6,6,NA,270062390,2007-01-06
25,1,17:37,2257,2257,L.D. Williams Defensive Rebound.,5,3,2,6,0.5471512577612353,0.5471512577612353,Miami,Wake Forest,6,6,NA,270062390,2007-01-06
26,1,17:31,2251,2251,L.D. Williams missed Two Point Layup.,5,3,2,0,0.5472870146485976,0.5472870146485976,Miami,Wake Forest,6,6,NA,270062390,2007-01-06
27,1,17:31,2251,2251,Kyle Visser Offensive Rebound.,5,3,2,3,0.5472870146485976,0.5472870146485976,Miami,Wake Forest,6,6,NA,270062390,2007-01-06
28,1,17:28,2248,2248,Kyle Visser missed Two Point Layup.,5,3,2,0,0.5473549972119557,0.5473549972119557,Miami,Wake Forest,6,6,NA,270062390,2007-01-06
29,1,17:28,2248,2248,Jack McClinton Defensive Rebound.,5,3,2,10,0.5473549972119557,0.5473549972119557,Miami,Wake Forest,6,6,NA,270062390,2007-01-06
30,1,17:18,2238,2238,Denis Clemente made Three Point Jumper.,8,3,5,9,0.6171018578559682,0.6171018578559682,Miami,Wake Forest,6,6,NA,270062390,2007-01-06
31,1,17:09,2229,2229,Harvey Hale missed Three Point Jumper.,8,3,5,0,0.6175905202901149,0.6175905202901149,Miami,Wake Forest,6,6,NA,270062390,2007-01-06
32,1,17:09,2229,2229,Dwyane Collins Defensive Rebound.,8,3,5,15,0.6175905202901149,0.6175905202901149,Miami,Wake Forest,6,6,NA,270062390,2007-01-06
33,1,16:54,2214,2214,Dwyane Collins made Two Point Jumper.,10,3,7,29,0.6628253852428388,0.6628253852428388,Miami,Wake Forest,6,6,NA,270062390,2007-01-06
34,1,16:25,2185,2185,Anthony Harris made Three Point Jumper.,13,3,10,36,0.7269170981316885,0.7269170981316885,Miami,Wake Forest,6,6,NA,270062390,2007-01-06
35,1,15:49,2149,2149,Official TV Timeout.,13,3,10,13,0.7302428124239754,0.7302428124239754,Miami,Wake Forest,6,6,NA,270062390,2007-01-06
36,1,15:36,2136,2136,Anthony Harris missed Three Point Jumper.,13,3,10,0,0.7314468760810724,0.7314468760810724,Miami,Wake Forest,6,6,NA,270062390,2007-01-06
37,1,15:36,2136,2136,Kyle Visser Defensive Rebound.,13,3,10,23,0.7314468760810724,0.7314468760810724,Miami,Wake Forest,6,6,NA,270062390,2007-01-06
38,1,15:13,2113,2113,Denis Clemente missed Two Point Layup.,13,3,10,0,0.7335829925796059,0.7335829925796059,Miami,Wake Forest,6,6,NA,270062390,2007-01-06
39,1,15:13,2113,2113,Anthony Harris Offensive Rebound.,13,3,10,1,0.7335829925796059,0.7335829925796059,Miami,Wake Forest,6,6,NA,270062390,2007-01-06
40,1,15:12,2112,2112,Foul on Ishmael Smith,13,3,10,0,0.7336760527010444,0.7336760527010444,Miami,Wake Forest,6,6,NA,270062390,2007-01-06
41,1,15:12,2112,2112,Anthony Harris missed Free Throw.,13,3,10,0,0.7336760527010444,0.7336760527010444,Miami,Wake Forest,6,6,NA,270062390,2007-01-06
42,1,15:12,2112,2112,Miami (FL) Defensive Rebound.,13,3,10,0,0.7336760527010444,0.7336760527010444,Miami,Wake Forest,6,6,NA,270062390,2007-01-06
43,1,15:12,2112,2112,Anthony Harris missed Free Throw.,13,3,10,0,0.7336760527010444,0.7336760527010444,Miami,Wake Forest,6,6,NA,270062390,2007-01-06
44,1,15:12,2112,2112,L.D. Williams Defensive Rebound.,13,3,10,14,0.7336760527010444,0.7336760527010444,Miami,Wake Forest,6,6,NA,270062390,2007-01-06
45,1,14:58,2098,2098,Foul on Jimmy Graham,13,3,10,0,0.7349806583527384,0.7349806583527384,Miami,Wake Forest,6,6,NA,270062390,2007-01-06
46,1,14:58,2098,2098,Shamaine Dukes missed Free Throw.,13,3,10,0,0.7349806583527384,0.7349806583527384,Miami,Wake Forest,6,6,NA,270062390,2007-01-06
47,1,14:58,2098,2098,Wake Forest Defensive Rebound.,13,3,10,0,0.7349806583527384,0.7349806583527384,Miami,Wake Forest,6,6,NA,270062390,2007-01-06
48,1,14:58,2098,2098,Shamaine Dukes missed Free Throw.,13,3,10,0,0.7349806583527384,0.7349806583527384,Miami,Wake Forest,6,6,NA,270062390,2007-01-06
49,1,14:58,2098,2098,Raymond Hicks Defensive Rebound.,13,3,10,28,0.7349806583527384,0.7349806583527384,Miami,Wake Forest,6,6,NA,270062390,2007-01-06
50,1,14:30,2070,2070,Denis Clemente made Three Point Jumper.,16,3,13,23,0.7930805620682667,0.7930805620682667,Miami,Wake Forest,6,6,NA,270062390,2007-01-06
51,1,14:07,2047,2047,Anthony Gurley missed Three Point Jumper.,16,3,13,0,0.7954621244692184,0.7954621244692184,Miami,Wake Forest,6,6,NA,270062390,2007-01-06
52,1,14:07,2047,2047,Shamaine Dukes Offensive Rebound.,16,3,13,16,0.7954621244692184,0.7954621244692184,Miami,Wake Forest,6,6,NA,270062390,2007-01-06
53,1,13:51,2031,2031,Kyle Visser made Two Point Layup.,16,5,11,47,0.7609472510680065,0.7609472510680065,Miami,Wake Forest,6,6,NA,270062390,2007-01-06
54,1,13:04,1984,1984,Foul on Michael Drum,16,5,11,0,0.7656171659990433,0.7656171659990433,Miami,Wake Forest,6,6,NA,270062390,2007-01-06
55,1,13:04,1984,1984,Jack McClinton made Free Throw.,17,5,12,0,0.784373562437622,0.784373562437622,Miami,Wake Forest,6,6,NA,270062390,2007-01-06
56,1,13:04,1984,1984,Jack McClinton made Free Throw.,18,5,13,17,0.8020171259479222,0.8020171259479222,Miami,Wake Forest,6,6,NA,270062390,2007-01-06
57,1,12:47,1967,1967,Anthony Gurley missed Three Point Jumper.,18,5,13,0,0.8037958066983052,0.8037958066983052,Miami,Wake Forest,6,6,NA,270062390,2007-01-06
58,1,12:47,1967,1967,Brian Asbury Defensive Rebound.,18,5,13,8,0.8037958066983052,0.8037958066983052,Miami,Wake Forest,6,6,NA,270062390,2007-01-06
59,1,12:39,1959,1959,Jack McClinton made Three Point Jumper.,21,5,16,3,0.8509629399769303,0.8509629399769303,Miami,Wake Forest,6,6,NA,270062390,2007-01-06
60,1,12:36,1956,1956,Wake Forest Full Timeout.,21,5,16,17,0.851275447423831,0.851275447423831,Miami,Wake Forest,5,6,NA,270062390,2007-01-06
61,1,12:19,1939,1939,Foul on Michael Drum,21,5,16,5,0.853046341574032,0.853046341574032,Miami,Wake Forest,5,6,NA,270062390,2007-01-06
62,1,12:14,1934,1934,Foul on Keaton Copeland,21,5,16,9,0.8535672212415509,0.8535672212415509,Miami,Wake Forest,5,6,NA,270062390,2007-01-06
63,1,12:05,1925,1925,Ishmael Smith missed Three Point Jumper.,21,5,16,0,0.8545038349905922,0.8545038349905922,Miami,Wake Forest,5,6,NA,270062390,2007-01-06
64,1,12:05,1925,1925,Jamie Skeen Offensive Rebound.,21,5,16,8,0.8545038349905922,0.8545038349905922,Miami,Wake Forest,5,6,NA,270062390,2007-01-06
65,1,11:57,1917,1917,Ishmael Smith missed Two Point Layup.,21,5,16,0,0.8553315824778666,0.8553315824778666,Miami,Wake Forest,5,6,NA,270062390,2007-01-06
66,1,11:57,1917,1917,Wake Forest Defensive Rebound.,21,5,16,6,0.8553315824778666,0.8553315824778666,Miami,Wake Forest,5,6,NA,270062390,2007-01-06
67,1,11:51,1911,1911,Official TV Timeout.,21,5,16,24,0.8559492726358487,0.8559492726358487,Miami,Wake Forest,5,6,NA,270062390,2007-01-06
68,1,11:27,1887,1887,Foul on Michael Drum,21,5,16,23,0.858396241320333,0.858396241320333,Miami,Wake Forest,5,6,NA,270062390,2007-01-06
69,1,11:04,1864,1864,Jack McClinton missed Two Point Jumper.,21,5,16,0,0.8607115102180737,0.8607115102180737,Miami,Wake Forest,5,6,NA,270062390,2007-01-06
70,1,11:04,1864,1864,Jamie Skeen Defensive Rebound.,21,5,16,10,0.8607115102180737,0.8607115102180737,Miami,Wake Forest,5,6,NA,270062390,2007-01-06
71,1,10:54,1854,1854,Foul on Jimmy Graham,21,5,16,1,0.8617109616661843,0.8617109616661843,Miami,Wake Forest,5,6,NA,270062390,2007-01-06
72,1,10:53,1853,1853,Harvey Hale missed Three Point Jumper.,21,5,16,0,0.8618107035882971,0.8618107035882971,Miami,Wake Forest,5,6,NA,270062390,2007-01-06
73,1,10:53,1853,1853,Anthony Harris Defensive Rebound.,21,5,16,12,0.8618107035882971,0.8618107035882971,Miami,Wake Forest,5,6,NA,270062390,2007-01-06
74,1,10:41,1841,1841,Anthony Harris missed Two Point Layup.,21,5,16,0,0.8630050636574483,0.8630050636574483,Miami,Wake Forest,5,6,NA,270062390,2007-01-06
75,1,10:41,1841,1841,Kyle Visser Defensive Rebound.,21,5,16,14,0.8630050636574483,0.8630050636574483,Miami,Wake Forest,5,6,NA,270062390,2007-01-06
76,1,10:27,1827,1827,Kyle Visser made Two Point Layup.,21,7,14,29,0.8348966949799702,0.8348966949799702,Miami,Wake Forest,5,6,NA,270062390,2007-01-06
77,1,9:58,1798,1798,Foul on Harvey Hale,21,7,14,6,0.8378497357495759,0.8378497357495759,Miami,Wake Forest,5,6,NA,270062390,2007-01-06
78,1,9:52,1792,1792,Denis Clemente missed Three Point Jumper.,21,7,14,0,0.8384609936822892,0.8384609936822892,Miami,Wake Forest,5,6,NA,270062390,2007-01-06
79,1,9:52,1792,1792,Raymond Hicks Offensive Rebound.,21,7,14,5,0.8384609936822892,0.8384609936822892,Miami,Wake Forest,5,6,NA,270062390,2007-01-06
80,1,9:47,1787,1787,Miami (FL) Full Timeout.,21,7,14,12,0.8389706397164034,0.8389706397164034,Miami,Wake Forest,5,5,NA,270062390,2007-01-06
81,1,9:35,1775,1775,Jack McClinton missed Two Point Layup.,21,7,14,0,0.8401951640920506,0.8401951640920506,Miami,Wake Forest,5,5,NA,270062390,2007-01-06
82,1,9:35,1775,1775,Raymond Hicks Offensive Rebound.,21,7,14,9,0.8401951640920506,0.8401951640920506,Miami,Wake Forest,5,5,NA,270062390,2007-01-06
83,1,9:26,1766,1766,Foul on Harvey Hale,21,7,14,0,0.8411152340230188,0.8411152340230188,Miami,Wake Forest,5,5,NA,270062390,2007-01-06
84,1,9:26,1766,1766,Anthony Harris missed Free Throw.,21,7,14,0,0.8411152340230188,0.8411152340230188,Miami,Wake Forest,5,5,NA,270062390,2007-01-06
85,1,9:26,1766,1766,L.D. Williams Defensive Rebound.,21,7,14,13,0.8411152340230188,0.8411152340230188,Miami,Wake Forest,5,5,NA,270062390,2007-01-06
86,1,9:13,1753,1753,Jamie Skeen missed Three Point Jumper.,21,7,14,0,0.8424475407454832,0.8424475407454832,Miami,Wake Forest,5,5,NA,270062390,2007-01-06
87,1,9:13,1753,1753,Anthony Harris Defensive Rebound.,21,7,14,38,0.8424475407454832,0.8424475407454832,Miami,Wake Forest,5,5,NA,270062390,2007-01-06
88,1,8:35,1715,1715,Ishmael Smith made Two Point Jumper.,21,9,12,26,0.8119389846245387,0.8119389846245387,Miami,Wake Forest,5,5,NA,270062390,2007-01-06
89,1,8:09,1689,1689,Anthony Harris missed Two Point Layup.,21,9,12,2,0.814683520857308,0.814683520857308,Miami,Wake Forest,5,5,NA,270062390,2007-01-06
90,1,8:07,1687,1687,Ishmael Smith Defensive Rebound.,21,9,12,5,0.8148953592520465,0.8148953592520465,Miami,Wake Forest,5,5,NA,270062390,2007-01-06
91,1,8:02,1682,1682,Ishmael Smith missed Two Point Jumper.,21,9,12,0,0.8154212470632345,0.8154212470632345,Miami,Wake Forest,5,5,NA,270062390,2007-01-06
92,1,8:02,1682,1682,L.D. Williams Offensive Rebound.,21,9,12,5,0.8154212470632345,0.8154212470632345,Miami,Wake Forest,5,5,NA,270062390,2007-01-06
93,1,7:57,1677,1677,L.D. Williams missed Two Point Layup.,21,9,12,0,0.815942058510225,0.815942058510225,Miami,Wake Forest,5,5,NA,270062390,2007-01-06
94,1,7:57,1677,1677,Jack McClinton Defensive Rebound.,21,9,12,10,0.815942058510225,0.815942058510225,Miami,Wake Forest,5,5,NA,270062390,2007-01-06
95,1,7:47,1667,1667,L.D. Williams made Two Point Dunk Shot.,21,11,10,16,0.7767149804359581,0.7767149804359581,Miami,Wake Forest,5,5,NA,270062390,2007-01-06
96,1,7:31,1651,1651,Jack McClinton missed Two Point Jumper.,21,11,10,0,0.7782719649677357,0.7782719649677357,Miami,Wake Forest,5,5,NA,270062390,2007-01-06
97,1,7:31,1651,1651,Kyle Visser Defensive Rebound.,21,11,10,13,0.7782719649677357,0.7782719649677357,Miami,Wake Forest,5,5,NA,270062390,2007-01-06
98,1,7:18,1638,1638,Kyle Visser made Two Point Jumper.,21,13,8,30,0.7330726563486258,0.7330726563486258,Miami,Wake Forest,5,5,NA,270062390,2007-01-06
99,1,6:48,1608,1608,Raymond Hicks missed Two Point Jumper.,21,13,8,0,0.7356371706031829,0.7356371706031829,Miami,Wake Forest,5,5,NA,270062390,2007-01-06
100,1,6:48,1608,1608,Harvey Hale Defensive Rebound.,21,13,8,18,0.7356371706031829,0.7356371706031829,Miami,Wake Forest,5,5,NA,270062390,2007-01-06
101,1,6:30,1590,1590,Kyle Visser missed Two Point Jumper.,21,13,8,0,0.7371617166734473,0.7371617166734473,Miami,Wake Forest,5,5,NA,270062390,2007-01-06
102,1,6:30,1590,1590,Raymond Hicks Defensive Rebound.,21,13,8,30,0.7371617166734473,0.7371617166734473,Miami,Wake Forest,5,5,NA,270062390,2007-01-06
103,1,6:00,1560,1560,Dwyane Collins made Two Point Layup.,23,13,10,13,0.7867731685764249,0.7867731685764249,Miami,Wake Forest,5,5,NA,270062390,2007-01-06
104,1,5:47,1547,1547,L.D. Williams missed Three Point Jumper.,23,13,10,0,0.787989340569761,0.787989340569761,Miami,Wake Forest,5,5,NA,270062390,2007-01-06
105,1,5:47,1547,1547,Denis Clemente Defensive Rebound.,23,13,10,11,0.787989340569761,0.787989340569761,Miami,Wake Forest,5,5,NA,270062390,2007-01-06
106,1,5:36,1536,1536,Foul on L.D. Williams,23,13,10,0,0.7890278787349078,0.7890278787349078,Miami,Wake Forest,5,5,NA,270062390,2007-01-06
107,1,5:36,1536,1536,Official TV Timeout.,23,13,10,0,0.7890278787349078,0.7890278787349078,Miami,Wake Forest,5,5,NA,270062390,2007-01-06
108,1,5:36,1536,1536,Dwyane Collins made Free Throw.,24,13,11,0,0.8101497066992914,0.8101497066992914,Miami,Wake Forest,5,5,NA,270062390,2007-01-06
109,1,5:36,1536,1536,Dwyane Collins made Free Throw.,25,13,12,18,0.8296135344840682,0.8296135344840682,Miami,Wake Forest,5,5,NA,270062390,2007-01-06
110,1,5:18,1518,1518,James Dews missed Three Point Jumper.,25,13,12,0,0.8313688098888316,0.8313688098888316,Miami,Wake Forest,5,5,NA,270062390,2007-01-06
111,1,5:18,1518,1518,Brian Asbury Offensive Rebound.,25,13,12,2,0.8313688098888316,0.8313688098888316,Miami,Wake Forest,5,5,NA,270062390,2007-01-06
112,1,5:16,1516,1516,Foul on Shamaine Dukes,25,13,12,0,0.8315659055820109,0.8315659055820109,Miami,Wake Forest,5,5,NA,270062390,2007-01-06
113,1,5:16,1516,1516,Brian Asbury made Free Throw.,26,13,13,0,0.8493906547647385,0.8493906547647385,Miami,Wake Forest,5,5,NA,270062390,2007-01-06
114,1,5:16,1516,1516,Brian Asbury made Free Throw.,27,13,14,23,0.8656338740170162,0.8656338740170162,Miami,Wake Forest,5,5,NA,270062390,2007-01-06
115,1,4:53,1493,1493,Anthony Gurley made Two Point Jumper.,27,15,12,20,0.8338689248911522,0.8338689248911522,Miami,Wake Forest,5,5,NA,270062390,2007-01-06
116,1,4:33,1473,1473,Brian Asbury made Two Point Jumper.,29,15,14,15,0.8698552422168305,0.8698552422168305,Miami,Wake Forest,5,5,NA,270062390,2007-01-06
117,1,4:18,1458,1458,Foul on Dwyane Collins,29,15,14,3,0.8713919955244998,0.8713919955244998,Miami,Wake Forest,5,5,NA,270062390,2007-01-06
118,1,4:15,1455,1455,Cameron Stanley missed Three Point Jumper.,29,15,14,0,0.8717040627073507,0.8717040627073507,Miami,Wake Forest,5,5,NA,270062390,2007-01-06
119,1,4:15,1455,1455,Kyle Visser Offensive Rebound.,29,15,14,16,0.8717040627073507,0.8717040627073507,Miami,Wake Forest,5,5,NA,270062390,2007-01-06
120,1,3:59,1439,1439,Anthony Gurley missed Three Point Jumper.,29,15,14,0,0.8733667985852039,0.8733667985852039,Miami,Wake Forest,5,5,NA,270062390,2007-01-06
121,1,3:59,1439,1439,Dwyane Collins Defensive Rebound.,29,15,14,10,0.8733667985852039,0.8733667985852039,Miami,Wake Forest,5,5,NA,270062390,2007-01-06
122,1,3:49,1429,1429,Official TV Timeout.,29,15,14,29,0.8743725712397447,0.8743725712397447,Miami,Wake Forest,5,5,NA,270062390,2007-01-06
123,1,3:20,1400,1400,Kyle Visser made Two Point Layup.,29,17,12,22,0.8435645882837404,0.8435645882837404,Miami,Wake Forest,5,5,NA,270062390,2007-01-06
124,1,2:58,1378,1378,Brian Asbury missed Two Point Jumper.,29,17,12,0,0.8456959180387601,0.8456959180387601,Miami,Wake Forest,5,5,NA,270062390,2007-01-06
125,1,2:58,1378,1378,Michael Drum Defensive Rebound.,29,17,12,3,0.8456959180387601,0.8456959180387601,Miami,Wake Forest,5,5,NA,270062390,2007-01-06
126,1,2:55,1375,1375,Foul on James Dews,29,17,12,9,0.8459830337718592,0.8459830337718592,Miami,Wake Forest,5,5,NA,270062390,2007-01-06
127,1,2:46,1366,1366,Kyle Visser made Two Point Layup.,29,19,10,24,0.8061260334044086,0.8061260334044086,Miami,Wake Forest,5,5,NA,270062390,2007-01-06
128,1,2:22,1342,1342,Anthony Harris missed Two Point Layup.,29,19,10,0,0.8084191712535349,0.8084191712535349,Miami,Wake Forest,5,5,NA,270062390,2007-01-06
129,1,2:22,1342,1342,Jack McClinton Offensive Rebound.,29,19,10,21,0.8084191712535349,0.8084191712535349,Miami,Wake Forest,5,5,NA,270062390,2007-01-06
130,1,2:01,1321,1321,Anthony Harris missed Two Point Layup.,29,19,10,0,0.8104469653818227,0.8104469653818227,Miami,Wake Forest,5,5,NA,270062390,2007-01-06
131,1,2:01,1321,1321,Kyle Visser Defensive Rebound.,29,19,10,30,0.8104469653818227,0.8104469653818227,Miami,Wake Forest,5,5,NA,270062390,2007-01-06
132,1,1:31,1291,1291,Jack McClinton made Two Point Layup.,31,19,12,16,0.8540808283966538,0.8540808283966538,Miami,Wake Forest,5,5,NA,270062390,2007-01-06
133,1,1:15,1275,1275,Cameron Stanley missed Two Point Jumper.,31,19,12,0,0.85571367335895,0.85571367335895,Miami,Wake Forest,5,5,NA,270062390,2007-01-06
134,1,1:15,1275,1275,Kyle Visser Offensive Rebound.,31,19,12,1,0.85571367335895,0.85571367335895,Miami,Wake Forest,5,5,NA,270062390,2007-01-06
135,1,1:14,1274,1274,Kyle Visser missed Two Point Layup.,31,19,12,0,0.8558174448941908,0.8558174448941908,Miami,Wake Forest,5,5,NA,270062390,2007-01-06
136,1,1:14,1274,1274,Kyle Visser Offensive Rebound.,31,19,12,1,0.8558174448941908,0.8558174448941908,Miami,Wake Forest,5,5,NA,270062390,2007-01-06
137,1,1:13,1273,1273,Foul on Anthony Harris,31,19,12,0,0.8559214334194662,0.8559214334194662,Miami,Wake Forest,5,5,NA,270062390,2007-01-06
138,1,1:13,1273,1273,Kyle Visser missed Free Throw.,31,19,12,0,0.8559214334194662,0.8559214334194662,Miami,Wake Forest,5,5,NA,270062390,2007-01-06
139,1,1:13,1273,1273,Wake Forest Defensive Rebound.,31,19,12,0,0.8559214334194662,0.8559214334194662,Miami,Wake Forest,5,5,NA,270062390,2007-01-06
140,1,1:13,1273,1273,Kyle Visser made Free Throw.,31,20,11,18,0.8366259678059791,0.8366259678059791,Miami,Wake Forest,5,5,NA,270062390,2007-01-06
141,1,0:55,1255,1255,Keaton Copeland made Two Point Layup.,33,20,13,34,0.8751400765994949,0.8751400765994949,Miami,Wake Forest,5,5,NA,270062390,2007-01-06
142,1,0:21,1221,1221,Anthony Gurley missed Three Point Jumper.,33,20,13,0,0.8788735301530176,0.8788735301530176,Miami,Wake Forest,5,5,NA,270062390,2007-01-06
143,1,0:21,1221,1221,Brian Asbury Defensive Rebound.,33,20,13,21,0.8788735301530176,0.8788735301530176,Miami,Wake Forest,5,5,NA,270062390,2007-01-06
144,1,0:00,1200,1200,End of the 1st Half.,33,20,13,0,0.881320024494264,0.881320024494264,Miami,Wake Forest,5,5,NA,270062390,2007-01-06
145,2,20:00,1200,1200,PLAY,33,20,13,22,0.881320024494264,0.881320024494264,Miami,Wake Forest,5,5,NA,270062390,2007-01-06
146,2,19:38,1178,1178,Foul on Dwyane Collins,33,20,13,28,0.8837749339442965,0.8837749339442965,Miami,Wake Forest,5,5,NA,270062390,2007-01-06
147,2,19:10,1150,1150,Jack McClinton missed Three Point Jumper.,33,20,13,0,0.8867419349530191,0.8867419349530191,Miami,Wake Forest,5,5,NA,270062390,2007-01-06
148,2,19:10,1150,1150,Miami (FL) Defensive Rebound.,33,20,13,17,0.8867419349530191,0.8867419349530191,Miami,Wake Forest,5,5,NA,270062390,2007-01-06
149,2,18:53,1133,1133,Foul on Keaton Copeland,33,20,13,23,0.8884905409698719,0.8884905409698719,Miami,Wake Forest,5,5,NA,270062390,2007-01-06
150,2,18:30,1110,1110,L.D. Williams missed Two Point Jumper.,33,20,13,0,0.8908306348832925,0.8908306348832925,Miami,Wake Forest,5,5,NA,270062390,2007-01-06
151,2,18:30,1110,1110,Keaton Copeland Defensive Rebound.,33,20,13,31,0.8908306348832925,0.8908306348832925,Miami,Wake Forest,5,5,NA,270062390,2007-01-06
152,2,17:59,1079,1079,Ishmael Smith missed Three Point Jumper.,33,20,13,0,0.8940042849598614,0.8940042849598614,Miami,Wake Forest,5,5,NA,270062390,2007-01-06
153,2,17:59,1079,1079,Kyle Visser Offensive Rebound.,33,20,13,5,0.8940042849598614,0.8940042849598614,Miami,Wake Forest,5,5,NA,270062390,2007-01-06
154,2,17:54,1074,1074,Kyle Visser made Two Point Tip Shot.,33,22,11,24,0.8592304584211325,0.8592304584211325,Miami,Wake Forest,5,5,NA,270062390,2007-01-06
155,2,17:30,1050,1050,Keaton Copeland missed Two Point Layup.,33,22,11,0,0.8619962327359396,0.8619962327359396,Miami,Wake Forest,5,5,NA,270062390,2007-01-06
156,2,17:30,1050,1050,L.D. Williams Defensive Rebound.,33,22,11,14,0.8619962327359396,0.8619962327359396,Miami,Wake Forest,5,5,NA,270062390,2007-01-06
157,2,17:16,1036,1036,Jack McClinton missed Two Point Layup.,33,22,11,0,0.8636686175824293,0.8636686175824293,Miami,Wake Forest,5,5,NA,270062390,2007-01-06
158,2,17:16,1036,1036,Anthony Gurley Defensive Rebound.,33,22,11,10,0.8636686175824293,0.8636686175824293,Miami,Wake Forest,5,5,NA,270062390,2007-01-06
159,2,17:06,1026,1026,Kyle Visser missed Two Point Layup.,33,22,11,0,0.864895341145327,0.864895341145327,Miami,Wake Forest,5,5,NA,270062390,2007-01-06
160,2,17:06,1026,1026,Miami (FL) Defensive Rebound.,33,22,11,0,0.864895341145327,0.864895341145327,Miami,Wake Forest,5,5,NA,270062390,2007-01-06
161,2,17:06,1026,1026,Foul on L.D. Williams,33,22,11,35,0.864895341145327,0.864895341145327,Miami,Wake Forest,5,5,NA,270062390,2007-01-06
162,2,16:31,991,991,Anthony Gurley made Two Point Layup.,33,24,9,23,0.8251000838103341,0.8251000838103341,Miami,Wake Forest,5,5,NA,270062390,2007-01-06
163,2,16:08,968,968,Anthony Harris made Three Point Jumper.,36,24,12,12,0.8908825974579444,0.8908825974579444,Miami,Wake Forest,5,5,NA,270062390,2007-01-06
164,2,15:56,956,956,Anthony Gurley missed Three Point Jumper.,36,24,12,0,0.8924506078331362,0.8924506078331362,Miami,Wake Forest,5,5,NA,270062390,2007-01-06
165,2,15:56,956,956,Miami (FL) Defensive Rebound.,36,24,12,2,0.8924506078331362,0.8924506078331362,Miami,Wake Forest,5,5,NA,270062390,2007-01-06
166,2,15:54,954,954,Official TV Timeout.,36,24,12,16,0.8927000449048293,0.8927000449048293,Miami,Wake Forest,5,5,NA,270062390,2007-01-06
167,2,15:38,938,938,Anthony Harris missed Three Point Jumper.,36,24,12,0,0.8945895052540901,0.8945895052540901,Miami,Wake Forest,5,5,NA,270062390,2007-01-06
168,2,15:38,938,938,Kyle Visser Defensive Rebound.,36,24,12,41,0.8945895052540901,0.8945895052540901,Miami,Wake Forest,5,5,NA,270062390,2007-01-06
169,2,14:57,897,897,Brian Asbury made Three Point Jumper.,39,24,15,29,0.9387814826642215,0.9387814826642215,Miami,Wake Forest,5,5,NA,270062390,2007-01-06
170,2,14:28,868,868,Michael Drum made Three Point Jumper.,39,27,12,25,0.9015467106354991,0.9015467106354991,Miami,Wake Forest,5,5,NA,270062390,2007-01-06
171,2,14:03,843,843,Jack McClinton made Three Point Jumper.,42,27,15,18,0.9427836938468976,0.9427836938468976,Miami,Wake Forest,5,5,NA,270062390,2007-01-06
172,2,13:45,825,825,Foul on Anthony Harris,42,27,15,0,0.9441746150008821,0.9441746150008821,Miami,Wake Forest,5,5,NA,270062390,2007-01-06
173,2,13:45,825,825,Ishmael Smith missed Free Throw.,42,27,15,0,0.9441746150008821,0.9441746150008821,Miami,Wake Forest,5,5,NA,270062390,2007-01-06
174,2,13:45,825,825,Wake Forest Defensive Rebound.,42,27,15,0,0.9441746150008821,0.9441746150008821,Miami,Wake Forest,5,5,NA,270062390,2007-01-06
