play_id,half,time_remaining_half,secs_remaining,secs_remaining_absolute,description,home_score,away_score,score_diff,play_length,win_prob,naive_win_prob,home,away,home_time_out_remaining,away_time_out_remaining,home_favored_by,game_id,date
1,1,20:00,2400,2400,PLAY,0,0,0,12,0.5,0.5,Texas,Iowa,4,4,NA,253260251,2005-11-22
2,1,19:48,2388,2388,Daniel Gibson missed Three Point Jumper.,0,0,0,0,0.5,0.5,Texas,Iowa,4,4,NA,253260251,2005-11-22
3,1,19:48,2388,2388,Greg Brunner Defensive Rebound.,0,0,0,33,0.5,0.5,Texas,Iowa,4,4,NA,253260251,2005-11-22
4,1,19:15,2355,2355,Kenton Paulino missed Two Point Jumper.,0,0,0,0,0.5,0.5,Texas,Iowa,4,4,NA,253260251,2005-11-22
5,1,19:15,2355,2355,Jeff Horner Defensive Rebound.,0,0,0,24,0.5,0.5,Texas,Iowa,4,4,NA,253260251,2005-11-22
6,1,18:51,2331,2331,Greg Brunner missed Two Point Jumper.,0,0,0,0,0.5,0.5,Texas,Iowa,4,4,NA,253260251,2005-11-22
7,1,18:51,2331,2331,Erek Hansen Offensive Rebound.,0,0,0,3,0.5,0.5,Texas,Iowa,4,4,NA,253260251,2005-11-22
8,1,18:48,2328,2328,Foul on LaMarcus Aldridge,0,0,0,6,0.5,0.5,Texas,Iowa,4,4,NA,253260251,2005-11-22
9,1,18:42,2322,2322,Daniel Gibson Steal.,0,0,0,2,0.5,0.5,Texas,Iowa,4,4,NA,253260251,2005-11-22
10,1,18:40,2320,2320,Daniel Gibson missed Three Point Jumper.,0,0,0,0,0.5,0.5,Texas,Iowa,4,4,NA,253260251,2005-11-22
11,1,18:40,2320,2320,Brad Buckman Offensive Rebound.,0,0,0,5,0.5,0.5,Texas,Iowa,4,4,NA,253260251,2005-11-22
12,1,18:35,2315,2315,Brad Buckman made Two Point Dunk Shot.,2,0,2,25,0.5458554347780128,0.5458554347780128,Texas,Iowa,4,4,NA,253260251,2005-11-22
13,1,18:10,2290,2290,Mike Henderson missed Two Point Layup.,2,0,2,2,0.5464100314401936,0.5464100314401936,Texas,Iowa,4,4,NA,253260251,2005-11-22
14,1,18:08,2288,2288,Adam Haluska Offensive Rebound.,2,0,2,4,0.5464546722449519,0.5464546722449519,Texas,Iowa,4,4,NA,253260251,2005-11-22
15,1,18:04,2284,2284,Adam Haluska missed Two Point Jumper.,2,0,2,0,0.5465440686962537,0.5465440686962537,Texas,Iowa,4,4,NA,253260251,2005-11-22
16,1,18:04,2284,2284,Greg Brunner Offensive Rebound.,2,0,2,0,0.5465440686962537,0.5465440686962537,Texas,Iowa,4,4,NA,253260251,2005-11-22
17,1,18:04,2284,2284,Greg Brunner made Two Point Tip Shot.,2,2,0,0,0.5,0.5,Texas,Iowa,4,4,NA,253260251,2005-11-22
18,1,18:04,2284,2284,Foul on Brad Buckman,2,2,0,0,0.5,0.5,Texas,Iowa,4,4,NA,253260251,2005-11-22
19,1,18:04,2284,2284,Greg Brunner missed Free Throw.,2,2,0,0,0.5,0.5,Texas,Iowa,4,4,NA,253260251,2005-11-22
20,1,18:04,2284,2284,Iowa Defensive Rebound.,2,2,0,16,0.5,0.5,Texas,Iowa,4,4,NA,253260251,2005-11-22
21,1,17:48,2268,2268,Doug Thomas missed Two Point Jumper.,2,2,0,0,0.5,0.5,Texas,Iowa,4,4,NA,253260251,2005-11-22
22,1,17:48,2268,2268,P.J. Tucker Defensive Rebound.,2,2,0,11,0.5,0.5,Texas,Iowa,4,4,NA,253260251,2005-11-22
23,1,17:37,2257,2257,Jeff Horner Defensive Rebound.,2,2,0,5,0.5,0.5,Texas,Iowa,4,4,NA,253260251,2005-11-22
24,1,17:32,2252,2252,P.J. Tucker Defensive Rebound.,2,2,0,5,0.5,0.5,Texas,Iowa,4,4,NA,253260251,2005-11-22
25,1,17:27,2247,2247,P.J. Tucker missed Two Point Jumper.,2,2,0,0,0.5,0.5,Texas,Iowa,4,4,NA,253260251,2005-11-22
26,1,17:27,2247,2247,Iowa Defensive Rebound.,2,2,0,25,0.5,0.5,Texas,Iowa,4,4,NA,253260251,2005-11-22
27,1,17:02,2222,2222,Adam Haluska made Two Point Layup.  Assisted by Greg Brunner.,2,4,-2,7,0.4520531439994127,0.4520531439994127,Texas,Iowa,4,4,NA,253260251,2005-11-22
28,1,16:55,2215,2215,Mike Henderson Steal.,2,4,-2,13,0.45189305018148956,0.45189305018148956,Texas,Iowa,4,4,NA,253260251,2005-11-22
29,1,16:42,2202,2202,Foul on LaMarcus Aldridge,2,4,-2,5,0.45159499670939535,0.45159499670939535,Texas,Iowa,4,4,NA,253260251,2005-11-22
30,1,16:37,2197,2197,Adam Haluska made Three Point Jumper.,2,7,-5,6,0.38066410369058673,0.38066410369058673,Texas,Iowa,4,4,NA,253260251,2005-11-22
31,1,16:31,2191,2191,Foul on Erek Hansen,2,7,-5,7,0.3803356996362228,0.3803356996362228,Texas,Iowa,4,4,NA,253260251,2005-11-22
32,1,16:24,2184,2184,Daniel Gibson missed Three Point Jumper.,2,7,-5,0,0.37995219123601714,0.37995219123601714,Texas,Iowa,4,4,NA,253260251,2005-11-22
33,1,16:24,2184,2184,Mike Henderson Defensive Rebound.,2,7,-5,11,0.37995219123601714,0.37995219123601714,Texas,Iowa,4,4,NA,253260251,2005-11-22
34,1,16:13,2173,2173,Adam Haluska made Two Point Layup.  Assisted by Mike Henderson.,2,9,-7,24,0.3342025537461047,0.3342025537461047,Texas,Iowa,4,4,NA,253260251,2005-11-22
35,1,15:49,2149,2149,Kenton Paulino made Three Point Jumper.  Assisted by Daniel Gibson.,5,9,-4,28,0.4017107717729217,0.4017107717729217,Texas,Iowa,4,4,NA,253260251,2005-11-22
36,1,15:21,2121,2121,Jeff Horner missed Three Point Jumper.,5,9,-4,0,0.4004405061444931,0.4004405061444931,Texas,Iowa,4,4,NA,253260251,2005-11-22
37,1,15:21,2121,2121,Mike Williams Defensive Rebound.,5,9,-4,13,0.4004405061444931,0.4004405061444931,Texas,Iowa,4,4,NA,253260251,2005-11-22
38,1,15:08,2108,2108,Foul on Jeff Horner,5,9,-4,0,0.3998465869944874,0.3998465869944874,Texas,Iowa,4,4,NA,253260251,2005-11-22
39,1,15:08,2108,2108,Official TV Timeout.,5,9,-4,0,0.3998465869944874,0.3998465869944874,Texas,Iowa,4,4,NA,253260251,2005-11-22
40,1,15:08,2108,2108,P.J. Tucker made Free Throw.,6,9,-3,0,0.4244386684948811,0.4244386684948811,Texas,Iowa,4,4,NA,253260251,2005-11-22
41,1,15:08,2108,2108,P.J. Tucker made Free Throw.,7,9,-2,11,0.4494106518129116,0.4494106518129116,Texas,Iowa,4,4,NA,253260251,2005-11-22
42,1,14:57,2097,2097,Adam Haluska made Two Point Jumper.,7,11,-4,34,0.3993418386531157,0.3993418386531157,Texas,Iowa,4,4,NA,253260251,2005-11-22
43,1,14:23,2063,2063,Jeff Horner missed Two Point Layup.,7,11,-4,0,0.39776802029077646,0.39776802029077646,Texas,Iowa,4,4,NA,253260251,2005-11-22
44,1,14:23,2063,2063,Mike Williams Offensive Rebound.,7,11,-4,0,0.39776802029077646,0.39776802029077646,Texas,Iowa,4,4,NA,253260251,2005-11-22
45,1,14:23,2063,2063,Mike Williams made Two Point Layup.,9,11,-2,13,0.44833831010879094,0.44833831010879094,Texas,Iowa,4,4,NA,253260251,2005-11-22
46,1,14:10,2050,2050,Alex Thompson missed Two Point Jumper.,9,11,-2,0,0.4480245846669113,0.4480245846669113,Texas,Iowa,4,4,NA,253260251,2005-11-22
47,1,14:10,2050,2050,Doug Thomas Offensive Rebound.,9,11,-2,4,0.4480245846669113,0.4480245846669113,Texas,Iowa,4,4,NA,253260251,2005-11-22
48,1,14:06,2046,2046,Doug Thomas missed Two Point Jumper.,9,11,-2,0,0.44792767509963954,0.44792767509963954,Texas,Iowa,4,4,NA,253260251,2005-11-22
49,1,14:06,2046,2046,Mike Henderson Offensive Rebound.,9,11,-2,12,0.44792767509963954,0.44792767509963954,Texas,Iowa,4,4,NA,253260251,2005-11-22
50,1,13:54,2034,2034,Daniel Gibson missed Three Point Jumper.,9,11,-2,0,0.44763584619598756,0.44763584619598756,Texas,Iowa,4,4,NA,253260251,2005-11-22
51,1,13:54,2034,2034,Iowa Defensive Rebound.,9,11,-2,0,0.44763584619598756,0.44763584619598756,Texas,Iowa,4,4,NA,253260251,2005-11-22
52,1,13:54,2034,2034,Foul on Mike Williams,9,11,-2,23,0.44763584619598756,0.44763584619598756,Texas,Iowa,4,4,NA,253260251,2005-11-22
53,1,13:31,2011,2011,Foul on Doug Thomas,9,11,-2,15,0.4470717197588073,0.4470717197588073,Texas,Iowa,4,4,NA,253260251,2005-11-22
54,1,13:16,1996,1996,LaMarcus Aldridge made Two Point Jumper.,11,11,0,12,0.5,0.5,Texas,Iowa,4,4,NA,253260251,2005-11-22
55,1,13:04,1984,1984,Doug Thomas made Two Point Jumper.  Assisted by Tony Freeman.,11,13,-2,24,0.44640098952027063,0.44640098952027063,Texas,Iowa,4,4,NA,253260251,2005-11-22
56,1,12:40,1960,1960,Foul on Jeff Horner,11,13,-2,10,0.4457965794687324,0.4457965794687324,Texas,Iowa,4,4,NA,253260251,2005-11-22
57,1,12:30,1950,1950,LaMarcus Aldridge missed Two Point Jumper.,11,13,-2,0,0.4455423475571626,0.4455423475571626,Texas,Iowa,4,4,NA,253260251,2005-11-22
58,1,12:30,1950,1950,P.J. Tucker Offensive Rebound.,11,13,-2,3,0.4455423475571626,0.4455423475571626,Texas,Iowa,4,4,NA,253260251,2005-11-22
59,1,12:27,1947,1947,P.J. Tucker missed Two Point Jumper.,11,13,-2,0,0.4454657953323223,0.4454657953323223,Texas,Iowa,4,4,NA,253260251,2005-11-22
60,1,12:27,1947,1947,Carlton Reed Defensive Rebound.,11,13,-2,12,0.4454657953323223,0.4454657953323223,Texas,Iowa,4,4,NA,253260251,2005-11-22
61,1,12:15,1935,1935,Adam Haluska missed Three Point Jumper.,11,13,-2,0,0.44515825695845757,0.44515825695845757,Texas,Iowa,4,4,NA,253260251,2005-11-22
62,1,12:15,1935,1935,LaMarcus Aldridge Defensive Rebound.,11,13,-2,5,0.44515825695845757,0.44515825695845757,Texas,Iowa,4,4,NA,253260251,2005-11-22
63,1,12:10,1930,1930,Foul on P.J. Tucker,11,13,-2,11,0.4450294787489211,0.4450294787489211,Texas,Iowa,4,4,NA,253260251,2005-11-22
64,1,11:59,1919,1919,Alex Thompson missed Two Point Dunk Shot.,11,13,-2,0,0.44474604611454244,0.44474604611454244,Texas,Iowa,4,4,NA,253260251,2005-11-22
65,1,11:59,1919,1919,AJ Abrams Defensive Rebound.,11,13,-2,5,0.44474604611454244,0.44474604611454244,Texas,Iowa,4,4,NA,253260251,2005-11-22
66,1,11:54,1914,1914,LaMarcus Aldridge made Two Point Dunk Shot.  Assisted by AJ Abrams.,13,13,0,19,0.5,0.5,Texas,Iowa,4,4,NA,253260251,2005-11-22
67,1,11:35,1895,1895,Adam Haluska made Three Point Jumper.  Assisted by Doug Thomas.,13,16,-3,39,0.4166278204378641,0.4166278204378641,Texas,Iowa,4,4,NA,253260251,2005-11-22
68,1,10:56,1856,1856,Daniel Gibson made Two Point Jumper.,15,16,-1,16,0.4714700853215193,0.4714700853215193,Texas,Iowa,4,4,NA,253260251,2005-11-22
69,1,10:40,1840,1840,Adam Haluska missed Two Point Jumper.,15,16,-1,0,0.4712611320099359,0.4712611320099359,Texas,Iowa,4,4,NA,253260251,2005-11-22
70,1,10:40,1840,1840,Daniel Gibson Defensive Rebound.,15,16,-1,11,0.4712611320099359,0.4712611320099359,Texas,Iowa,4,4,NA,253260251,2005-11-22
71,1,10:29,1829,1829,P.J. Tucker made Two Point Layup.,17,16,1,24,0.5288831484756331,0.5288831484756331,Texas,Iowa,4,4,NA,253260251,2005-11-22
72,1,10:05,1805,1805,Foul on AJ Abrams,17,16,1,0,0.529200264196867,0.529200264196867,Texas,Iowa,4,4,NA,253260251,2005-11-22
73,1,10:05,1805,1805,Official TV Timeout.,17,16,1,15,0.529200264196867,0.529200264196867,Texas,Iowa,4,4,NA,253260251,2005-11-22
74,1,9:50,1790,1790,Tony Freeman missed Three Point Jumper.,17,16,1,0,0.5294004567725273,0.5294004567725273,Texas,Iowa,4,4,NA,253260251,2005-11-22
75,1,9:50,1790,1790,Connor Atchley Defensive Rebound.,17,16,1,19,0.5294004567725273,0.5294004567725273,Texas,Iowa,4,4,NA,253260251,2005-11-22
76,1,9:31,1771,1771,Greg Brunner Steal.,17,16,1,31,0.5296567216656624,0.5296567216656624,Texas,Iowa,4,4,NA,253260251,2005-11-22
77,1,9:00,1740,1740,Greg Brunner missed Two Point Jumper.,17,16,1,0,0.5300825886464002,0.5300825886464002,Texas,Iowa,4,4,NA,253260251,2005-11-22
78,1,9:00,1740,1740,P.J. Tucker Defensive Rebound.,17,16,1,19,0.5300825886464002,0.5300825886464002,Texas,Iowa,4,4,NA,253260251,2005-11-22
79,1,8:41,1721,1721,Connor Atchley missed Three Point Jumper.,17,16,1,0,0.5303492010359951,0.5303492010359951,Texas,Iowa,4,4,NA,253260251,2005-11-22
80,1,8:41,1721,1721,P.J. Tucker Offensive Rebound.,17,16,1,3,0.5303492010359951,0.5303492010359951,Texas,Iowa,4,4,NA,253260251,2005-11-22
81,1,8:38,1718,1718,P.J. Tucker missed Two Point Jumper.,17,16,1,0,0.5303917317582819,0.5303917317582819,Texas,Iowa,4,4,NA,253260251,2005-11-22
82,1,8:38,1718,1718,Tony Freeman Defensive Rebound.,17,16,1,8,0.5303917317582819,0.5303917317582819,Texas,Iowa,4,4,NA,253260251,2005-11-22
83,1,8:30,1710,1710,Adam Haluska made Three Point Jumper.,17,19,-2,26,0.4392147477409531,0.4392147477409531,Texas,Iowa,4,4,NA,253260251,2005-11-22
84,1,8:04,1684,1684,Craig Winder missed Three Point Jumper.,17,19,-2,0,0.43847029008703603,0.43847029008703603,Texas,Iowa,4,4,NA,253260251,2005-11-22
85,1,8:04,1684,1684,LaMarcus Aldridge Offensive Rebound.,17,19,-2,14,0.43847029008703603,0.43847029008703603,Texas,Iowa,4,4,NA,253260251,2005-11-22
86,1,7:50,1670,1670,Foul on Connor Atchley,17,19,-2,0,0.4380736777408742,0.4380736777408742,Texas,Iowa,4,4,NA,253260251,2005-11-22
87,1,7:50,1670,1670,Official TV Timeout.,17,19,-2,12,0.4380736777408742,0.4380736777408742,Texas,Iowa,4,4,NA,253260251,2005-11-22
88,1,7:38,1658,1658,Foul on LaMarcus Aldridge,17,19,-2,0,0.4377395083680287,0.4377395083680287,Texas,Iowa,4,4,NA,253260251,2005-11-22
89,1,7:38,1658,1658,Jeff Horner made Free Throw.,17,20,-3,0,0.4072098337500521,0.4072098337500521,Texas,Iowa,4,4,NA,253260251,2005-11-22
90,1,7:38,1658,1658,Jeff Horner made Free Throw.,17,21,-4,27,0.3773802935622134,0.3773802935622134,Texas,Iowa,4,4,NA,253260251,2005-11-22
91,1,7:11,1631,1631,P.J. Tucker made Two Point Jumper.,19,21,-2,17,0.4370020881483216,0.4370020881483216,Texas,Iowa,4,4,NA,253260251,2005-11-22
92,1,6:54,1614,1614,Adam Haluska missed Two Point Layup.,19,21,-2,0,0.43654426444487016,0.43654426444487016,Texas,Iowa,4,4,NA,253260251,2005-11-22
93,1,6:54,1614,1614,Greg Brunner Offensive Rebound.,19,21,-2,2,0.43654426444487016,0.43654426444487016,Texas,Iowa,4,4,NA,253260251,2005-11-22
94,1,6:52,1612,1612,Greg Brunner missed Two Point Tip Shot.,19,21,-2,0,0.43649057371072647,0.43649057371072647,Texas,Iowa,4,4,NA,253260251,2005-11-22
95,1,6:52,1612,1612,Mike Williams Defensive Rebound.,19,21,-2,28,0.43649057371072647,0.43649057371072647,Texas,Iowa,4,4,NA,253260251,2005-11-22
96,1,6:24,1584,1584,Erek Hansen made Two Point Jumper.  Assisted by Jeff Horner.,19,23,-4,23,0.37356662910538363,0.37356662910538363,Texas,Iowa,4,4,NA,253260251,2005-11-22
97,1,6:01,1561,1561,Foul on Greg Brunner,19,23,-4,11,0.3723820427110241,0.3723820427110241,Texas,Iowa,4,4,NA,253260251,2005-11-22
98,1,5:50,1550,1550,LaMarcus Aldridge missed Two Point Jumper.,19,23,-4,0,0.37180869869593247,0.37180869869593247,Texas,Iowa,4,4,NA,253260251,2005-11-22
99,1,5:50,1550,1550,P.J. Tucker Offensive Rebound.,19,23,-4,6,0.37180869869593247,0.37180869869593247,Texas,Iowa,4,4,NA,253260251,2005-11-22
100,1,5:44,1544,1544,Jeff Horner Steal.,19,23,-4,4,0.3714934151812325,0.3714934151812325,Texas,Iowa,4,4,NA,253260251,2005-11-22
101,1,5:40,1540,1540,Jeff Horner missed Three Point Jumper.,19,23,-4,0,0.3712820832756395,0.3712820832756395,Texas,Iowa,4,4,NA,253260251,2005-11-22
102,1,5:40,1540,1540,LaMarcus Aldridge Defensive Rebound.,19,23,-4,9,0.3712820832756395,0.3712820832756395,Texas,Iowa,4,4,NA,253260251,2005-11-22
103,1,5:31,1531,1531,Kenton Paulino missed Three Point Jumper.,19,23,-4,0,0.37080286650116684,0.37080286650116684,Texas,Iowa,4,4,NA,253260251,2005-11-22
104,1,5:31,1531,1531,Greg Brunner Defensive Rebound.,19,23,-4,2,0.37080286650116684,0.37080286650116684,Texas,Iowa,4,4,NA,253260251,2005-11-22
105,1,5:29,1529,1529,Foul on Greg Brunner,19,23,-4,3,0.3706956185086026,0.3706956185086026,Texas,Iowa,4,4,NA,253260251,2005-11-22
106,1,5:26,1526,1526,Adam Haluska Steal.,19,23,-4,11,0.3705341959657353,0.3705341959657353,Texas,Iowa,4,4,NA,253260251,2005-11-22
107,1,5:15,1515,1515,Greg Brunner missed Two Point Layup.,19,23,-4,0,0.369936244833351,0.369936244833351,Texas,Iowa,4,4,NA,253260251,2005-11-22
108,1,5:15,1515,1515,Iowa Defensive Rebound.,19,23,-4,14,0.369936244833351,0.369936244833351,Texas,Iowa,4,4,NA,253260251,2005-11-22
109,1,5:01,1501,1501,Doug Thomas made Two Point Jumper.  Assisted by Jeff Horner.,19,25,-6,39,0.30922721258831726,0.30922721258831726,Texas,Iowa,4,4,NA,253260251,2005-11-22
110,1,4:22,1462,1462,Erek Hansen missed Two Point Jumper.,19,25,-6,0,0.3060999881619132,0.3060999881619132,Texas,Iowa,4,4,NA,253260251,2005-11-22
111,1,4:22,1462,1462,Texas Defensive Rebound.,19,25,-6,9,0.3060999881619132,0.3060999881619132,Texas,Iowa,4,4,NA,253260251,2005-11-22
112,1,4:13,1453,1453,Erek Hansen Steal.,19,25,-6,3,0.30534108662003623,0.30534108662003623,Texas,Iowa,4,4,NA,253260251,2005-11-22
113,1,4:10,1450,1450,Jeff Horner missed Two Point Jumper.,19,25,-6,0,0.3050846138788344,0.3050846138788344,Texas,Iowa,4,4,NA,253260251,2005-11-22
114,1,4:10,1450,1450,Doug Thomas Offensive Rebound.,19,25,-6,35,0.3050846138788344,0.3050846138788344,Texas,Iowa,4,4,NA,253260251,2005-11-22
115,1,3:35,1415,1415,Doug Thomas made Two Point Jumper.  Assisted by Jeff Horner.,19,27,-8,21,0.24678656677316055,0.24678656677316055,Texas,Iowa,4,4,NA,253260251,2005-11-22
116,1,3:14,1394,1394,Official TV Timeout.,19,27,-8,17,0.24484502000264807,0.24484502000264807,Texas,Iowa,4,4,NA,253260251,2005-11-22
117,1,2:57,1377,1377,Adam Haluska missed Two Point Jumper.,19,27,-8,0,0.2433047455426852,0.2433047455426852,Texas,Iowa,4,4,NA,253260251,2005-11-22
118,1,2:57,1377,1377,LaMarcus Aldridge Defensive Rebound.,19,27,-8,26,0.2433047455426852,0.2433047455426852,Texas,Iowa,4,4,NA,253260251,2005-11-22
119,1,2:31,1351,1351,Daniel Gibson made Three Point Jumper.  Assisted by P.J. Tucker.,22,27,-5,19,0.3280295449982147,0.3280295449982147,Texas,Iowa,4,4,NA,253260251,2005-11-22
120,1,2:12,1332,1332,Jeff Horner made Two Point Jumper.,22,29,-7,22,0.26655094171868576,0.26655094171868576,Texas,Iowa,4,4,NA,253260251,2005-11-22
121,1,1:50,1310,1310,Daniel Gibson missed Three Point Jumper.,22,29,-7,0,0.2646433614928521,0.2646433614928521,Texas,Iowa,4,4,NA,253260251,2005-11-22
122,1,1:50,1310,1310,Adam Haluska Defensive Rebound.,22,29,-7,27,0.2646433614928521,0.2646433614928521,Texas,Iowa,4,4,NA,253260251,2005-11-22
123,1,1:23,1283,1283,Mike Williams Steal.,22,29,-7,14,0.26220580298628215,0.26220580298628215,Texas,Iowa,4,4,NA,253260251,2005-11-22
124,1,1:09,1269,1269,LaMarcus Aldridge missed Two Point Jumper.,22,29,-7,0,0.26088470558415494,0.26088470558415494,Texas,Iowa,4,4,NA,253260251,2005-11-22
125,1,1:09,1269,1269,Mike Henderson Defensive Rebound.,22,29,-7,8,0.26088470558415494,0.26088470558415494,Texas,Iowa,4,4,NA,253260251,2005-11-22
126,1,1:01,1261,1261,Foul on P.J. Tucker,22,29,-7,0,0.26010867340194765,0.26010867340194765,Texas,Iowa,4,4,NA,253260251,2005-11-22
127,1,1:01,1261,1261,Mike Henderson made Free Throw.,22,30,-8,0,0.2324109779302949,0.2324109779302949,Texas,Iowa,4,4,NA,253260251,2005-11-22
128,1,1:01,1261,1261,Mike Henderson made Free Throw.,22,31,-9,7,0.20683816547214143,0.20683816547214143,Texas,Iowa,4,4,NA,253260251,2005-11-22
129,1,0:54,1254,1254,LaMarcus Aldridge made Two Point Dunk Shot.  Assisted by Daniel Gibson.,24,31,-7,0,0.25941580032363115,0.25941580032363115,Texas,Iowa,4,4,NA,253260251,2005-11-22
130,1,0:54,1254,1254,Foul on Erek Hansen,24,31,-7,0,0.25941580032363115,0.25941580032363115,Texas,Iowa,4,4,NA,253260251,2005-11-22
131,1,0:54,1254,1254,LaMarcus Aldridge missed Free Throw.,24,31,-7,0,0.25941580032363115,0.25941580032363115,Texas,Iowa,4,4,NA,253260251,2005-11-22
132,1,0:54,1254,1254,Erek Hansen Defensive Rebound.,24,31,-7,1,0.25941580032363115,0.25941580032363115,Texas,Iowa,4,4,NA,253260251,2005-11-22
133,1,0:53,1253,1253,Iowa Full Timeout.,24,31,-7,34,0.2593157117719718,0.2593157117719718,Texas,Iowa,3,4,NA,253260251,2005-11-22
134,1,0:19,1219,1219,AJ Abrams missed Three Point Jumper.,24,31,-7,0,0.2557282062537758,0.2557282062537758,Texas,Iowa,3,4,NA,253260251,2005-11-22
135,1,0:19,1219,1219,Doug Thomas Defensive Rebound.,24,31,-7,11,0.2557282062537758,0.2557282062537758,Texas,Iowa,3,4,NA,253260251,2005-11-22
136,1,0:08,1208,1208,Alex Thompson missed Two Point Jumper.,24,31,-7,0,0.25448328670322573,0.25448328670322573,Texas,Iowa,3,4,NA,253260251,2005-11-22
137,1,0:08,1208,1208,Alex Thompson Offensive Rebound.,24,31,-7,8,0.25448328670322573,0.25448328670322573,Texas,Iowa,3,4,NA,253260251,2005-11-22
138,1,0:00,1200,1200,End of the 1st Half.,24,31,-7,0,0.2535798049742589,0.2535798049742589,Texas,Iowa,3,4,NA,253260251,2005-11-22
139,2,20:00,1200,1200,PLAY,24,31,-7,28,0.2535798049742589,0.2535798049742589,Texas,Iowa,4,4,NA,253260251,2005-11-22
140,2,19:32,1172,1172,Adam Haluska missed Two Point Layup.,24,31,-7,1,0.2505335132368553,0.2505335132368553,Texas,Iowa,4,4,NA,253260251,2005-11-22
141,2,19:31,1171,1171,Kenton Paulino Defensive Rebound.,24,31,-7,7,0.2504273799077408,0.2504273799077408,Texas,Iowa,4,4,NA,253260251,2005-11-22
142,2,19:24,1164,1164,Kenton Paulino made Two Point Layup.,26,31,-5,19,0.3130473687303197,0.3130473687303197,Texas,Iowa,4,4,NA,253260251,2005-11-22
143,2,19:05,1145,1145,Adam Haluska missed Three Point Jumper.,26,31,-5,0,0.3114221661748439,0.3114221661748439,Texas,Iowa,4,4,NA,253260251,2005-11-22
144,2,19:05,1145,1145,Mike Henderson Offensive Rebound.,26,31,-5,5,0.3114221661748439,0.3114221661748439,Texas,Iowa,4,4,NA,253260251,2005-11-22
145,2,19:00,1140,1140,Mike Henderson missed Two Point Jumper.,26,31,-5,0,0.31099720786276847,0.31099720786276847,Texas,Iowa,4,4,NA,253260251,2005-11-22
146,2,19:00,1140,1140,Iowa Defensive Rebound.,26,31,-5,11,0.31099720786276847,0.31099720786276847,Texas,Iowa,4,4,NA,253260251,2005-11-22
147,2,18:49,1129,1129,P.J. Tucker missed Two Point Jumper.,26,31,-5,0,0.3100632877167338,0.3100632877167338,Texas,Iowa,4,4,NA,253260251,2005-11-22
148,2,18:49,1129,1129,Erek Hansen Defensive Rebound.,26,31,-5,12,0.3100632877167338,0.3100632877167338,Texas,Iowa,4,4,NA,253260251,2005-11-22
149,2,18:37,1117,1117,Foul on Kenton Paulino,26,31,-5,6,0.3090422646465221,0.3090422646465221,Texas,Iowa,4,4,NA,253260251,2005-11-22
150,2,18:31,1111,1111,Foul on Brad Buckman,26,31,-5,0,0.30852937961629484,0.30852937961629484,Texas,Iowa,4,4,NA,253260251,2005-11-22
151,2,18:31,1111,1111,Greg Brunner missed Free Throw.,26,31,-5,0,0.30852937961629484,0.30852937961629484,Texas,Iowa,4,4,NA,253260251,2005-11-22
152,2,18:31,1111,1111,Iowa Defensive Rebound.,26,31,-5,0,0.30852937961629484,0.30852937961629484,Texas,Iowa,4,4,NA,253260251,2005-11-22
153,2,18:31,1111,1111,Greg Brunner made Free Throw.,26,32,-6,17,0.275198671498944,0.275198671498944,Texas,Iowa,4,4,NA,253260251,2005-11-22
154,2,18:14,1094,1094,P.J. Tucker missed Two Point Layup.,26,32,-6,0,0.2735521614211906,0.2735521614211906,Texas,Iowa,4,4,NA,253260251,2005-11-22
155,2,18:14,1094,1094,Erek Hansen Defensive Rebound.,26,32,-6,5,0.2735521614211906,0.2735521614211906,Texas,Iowa,4,4,NA,253260251,2005-11-22
156,2,18:09,1089,1089,Adam Haluska missed Three Point Jumper.,26,32,-6,0,0.2730618141998383,0.2730618141998383,Texas,Iowa,4,4,NA,253260251,2005-11-22
157,2,18:09,1089,1089,Kenton Paulino Defensive Rebound.,26,32,-6,3,0.2730618141998383,0.2730618141998383,Texas,Iowa,4,4,NA,253260251,2005-11-22
158,2,18:06,1086,1086,Foul on Adam Haluska,26,32,-6,14,0.2727659635695511,0.2727659635695511,Texas,Iowa,4,4,NA,253260251,2005-11-22
159,2,17:52,1072,1072,Brad Buckman made Three Point Jumper.,29,32,-3,17,0.37898684868660776,0.37898684868660776,Texas,Iowa,4,4,NA,253260251,2005-11-22
160,2,17:35,1055,1055,Daniel Gibson Steal.,29,32,-3,5,0.3779432162154039,0.3779432162154039,Texas,Iowa,4,4,NA,253260251,2005-11-22
161,2,17:30,1050,1050,Foul on Daniel Gibson,29,32,-3,17,0.3776280567824182,0.3776280567824182,Texas,Iowa,4,4,NA,253260251,2005-11-22
162,2,17:13,1033,1033,LaMarcus Aldridge made Two Point Dunk Shot.,31,32,-1,14,0.4580713270411348,0.4580713270411348,Texas,Iowa,4,4,NA,253260251,2005-11-22
163,2,16:59,1019,1019,Jeff Horner missed Three Point Jumper.,31,32,-1,0,0.45773566549998235,0.45773566549998235,Texas,Iowa,4,4,NA,253260251,2005-11-22
164,2,16:59,1019,1019,Greg Brunner Offensive Rebound.,31,32,-1,5,0.45773566549998235,0.45773566549998235,Texas,Iowa,4,4,NA,253260251,2005-11-22
165,2,16:54,1014,1014,Greg Brunner missed Two Point Layup.,31,32,-1,0,0.45761204322681726,0.45761204322681726,Texas,Iowa,4,4,NA,253260251,2005-11-22
166,2,16:54,1014,1014,Erek Hansen Offensive Rebound.,31,32,-1,3,0.45761204322681726,0.45761204322681726,Texas,Iowa,4,4,NA,253260251,2005-11-22
167,2,16:51,1011,1011,Erek Hansen made Two Point Dunk Shot.,31,34,-3,14,0.3750088161163571,0.3750088161163571,Texas,Iowa,4,4,NA,253260251,2005-11-22
168,2,16:37,997,997,Brad Buckman missed Three Point Jumper.,31,34,-3,0,0.37398551027969906,0.37398551027969906,Texas,Iowa,4,4,NA,253260251,2005-11-22
169,2,16:37,997,997,Adam Haluska Defensive Rebound.,31,34,-3,7,0.37398551027969906,0.37398551027969906,Texas,Iowa,4,4,NA,253260251,2005-11-22
170,2,16:30,990,990,Adam Haluska made Two Point Jumper.,31,36,-5,14,0.2968435445052121,0.2968435445052121,Texas,Iowa,4,4,NA,253260251,2005-11-22
171,2,16:16,976,976,LaMarcus Aldridge missed Two Point Dunk Shot.,31,36,-5,4,0.2952049312853515,0.2952049312853515,Texas,Iowa,4,4,NA,253260251,2005-11-22
172,2,16:12,972,972,Adam Haluska Defensive Rebound.,31,36,-5,15,0.29472145331066524,0.29472145331066524,Texas,Iowa,4,4,NA,253260251,2005-11-22
173,2,15:57,957,957,LaMarcus Aldridge Steal.,31,36,-5,8,0.2929438738464906,0.2929438738464906,Texas,Iowa,4,4,NA,253260251,2005-11-22
174,2,15:49,949,949,P.J. Tucker missed Two Point Jumper.,31,36,-5,0,0.29205599971405155,0.29205599971405155,Texas,Iowa,4,4,NA,253260251,2005-11-22
175,2,15:49,949,949,LaMarcus Aldridge Offensive Rebound.,31,36,-5,0,0.29205599971405155,0.29205599971405155,Texas,Iowa,4,4,NA,253260251,2005-11-22
176,2,15:49,949,949,Foul on Erek Hansen,31,36,-5,0,0.29205599971405155,0.29205599971405155,Texas,Iowa,4,4,NA,253260251,2005-11-22
177,2,15:49,949,949,Official TV Timeout.,31,36,-5,0,0.29205599971405155,0.29205599971405155,Texas,Iowa,4,4,NA,253260251,2005-11-22
178,2,15:49,949,949,LaMarcus Aldridge made Free Throw.,32,36,-4,0,0.32996672816758077,0.32996672816758077,Texas,Iowa,4,4,NA,253260251,2005-11-22
179,2,15:49,949,949,LaMarcus Aldridge made Free Throw.,33,36,-3,20,0.37022500585082563,0.37022500585082563,Texas,Iowa,4,4,NA,253260251,2005-11-22
180,2,15:29,929,929,Jeff Horner made Three Point Jumper.  Assisted by Adam Haluska.,33,39,-6,28,0.25454296936288096,0.25454296936288096,Texas,Iowa,4,4,NA,253260251,2005-11-22
181,2,15:01,901,901,Daniel Gibson made Three Point Jumper.  Assisted by Kenton Paulino.,36,39,-3,8,0.3670328084590885,0.3670328084590885,Texas,Iowa,4,4,NA,253260251,2005-11-22
182,2,14:53,893,893,Doug Thomas made Two Point Layup.  Assisted by Jeff Horner.,36,41,-5,13,0.28663158202901007,0.28663158202901007,Texas,Iowa,4,4,NA,253260251,2005-11-22
183,2,14:40,880,880,LaMarcus Aldridge made Two Point Jumper.,38,41,-3,24,0.36575219406396603,0.36575219406396603,Texas,Iowa,4,4,NA,253260251,2005-11-22
184,2,14:16,856,856,Doug Thomas made Two Point Jumper.,38,43,-5,19,0.28332027694895123,0.28332027694895123,Texas,Iowa,4,4,NA,253260251,2005-11-22
