play_id,half,time_remaining_half,secs_remaining,secs_remaining_absolute,description,home_score,away_score,score_diff,play_length,win_prob,naive_win_prob,home,away,home_time_out_remaining,away_time_out_remaining,home_favored_by,game_id,date
1,1,20:00,2400,2400,PLAY,0,0,0,21,0.5,0.5,New Mexico,San José St,4,4,NA,400505587,2014-02-01
2,1,19:39,2379,2379,Matt Pollard missed Jumper.,0,0,0,0,0.5,0.5,New Mexico,San José St,4,4,NA,400505587,2014-02-01
3,1,19:39,2379,2379,Hugh Greenwood Defensive Rebound.,0,0,0,17,0.5,0.5,New Mexico,San José St,4,4,NA,400505587,2014-02-01
4,1,19:22,2362,2362,Alex Kirk made Jumper. Assisted by Kendall Williams.,2,0,2,34,0.5448321023078697,0.5448321023078697,New Mexico,San José St,4,4,NA,400505587,2014-02-01
5,1,18:48,2328,2328,Jaleel Williams missed Three Point Jumper.,2,0,2,0,0.5455697159214952,0.5455697159214952,New Mexico,San José St,4,4,NA,400505587,2014-02-01
6,1,18:48,2328,2328,Hugh Greenwood Defensive Rebound.,2,0,2,14,0.5455697159214952,0.5455697159214952,New Mexico,San José St,4,4,NA,400505587,2014-02-01
7,1,18:34,2314,2314,Cameron Bairstow made Jumper. Assisted by Deshawn Delaney.,4,0,4,40,0.5909889497370904,0.5909889497370904,New Mexico,San José St,4,4,NA,400505587,2014-02-01
8,1,17:54,2274,2274,Isaac Thornton made Three Point Jumper.,4,3,1,12,0.523435477271786,0.523435477271786,New Mexico,San José St,4,4,NA,400505587,2014-02-01
9,1,17:42,2262,2262,Alex Kirk missed Layup.,4,3,1,0,0.5235714431572539,0.5235714431572539,New Mexico,San José St,4,4,NA,400505587,2014-02-01
10,1,17:42,2262,2262,Jalen James Defensive Rebound.,4,3,1,30,0.5235714431572539,0.5235714431572539,New Mexico,San José St,4,4,NA,400505587,2014-02-01
11,1,17:12,2232,2232,Jalen James Turnover.,4,3,1,1,0.5239139165975408,0.5239139165975408,New Mexico,San José St,4,4,NA,400505587,2014-02-01
12,1,17:11,2231,2231,Hugh Greenwood Steal.,4,3,1,4,0.5239253894801664,0.5239253894801664,New Mexico,San José St,4,4,NA,400505587,2014-02-01
13,1,17:07,2227,2227,Cameron Bairstow made Layup. Assisted by Hugh Greenwood.,6,3,3,25,0.5714761792196995,0.5714761792196995,New Mexico,San José St,4,4,NA,400505587,2014-02-01
14,1,16:42,2202,2202,Brandon Mitchell missed Three Point Jumper.,6,3,3,0,0.5723247616780326,0.5723247616780326,New Mexico,San José St,4,4,NA,400505587,2014-02-01
15,1,16:42,2202,2202,Kendall Williams Defensive Rebound.,6,3,3,13,0.5723247616780326,0.5723247616780326,New Mexico,San José St,4,4,NA,400505587,2014-02-01
16,1,16:29,2189,2189,Foul on Matt Pollard.,6,3,3,0,0.5727678710500234,0.5727678710500234,New Mexico,San José St,4,4,NA,400505587,2014-02-01
17,1,16:29,2189,2189,Deshawn Delaney made Free Throw.,7,3,4,0,0.596492286615425,0.596492286615425,New Mexico,San José St,4,4,NA,400505587,2014-02-01
18,1,16:29,2189,2189,Deshawn Delaney made Free Throw.,8,3,5,20,0.6197738351937863,0.6197738351937863,New Mexico,San José St,4,4,NA,400505587,2014-02-01
19,1,16:09,2169,2169,Jalen James Turnover.,8,3,5,0,0.6208707641250961,0.6208707641250961,New Mexico,San José St,4,4,NA,400505587,2014-02-01
20,1,16:09,2169,2169,Alex Kirk Steal.,8,3,5,20,0.6208707641250961,0.6208707641250961,New Mexico,San José St,4,4,NA,400505587,2014-02-01
21,1,15:49,2149,2149,Alex Kirk made Jumper. Assisted by Deshawn Delaney.,10,3,7,7,0.667544135254528,0.667544135254528,New Mexico,San José St,4,4,NA,400505587,2014-02-01
22,1,15:42,2142,2142,San Jose St  Timeout,10,3,7,21,0.6680554089170966,0.6680554089170966,New Mexico,San José St,4,3,NA,400505587,2014-02-01
23,1,15:21,2121,2121,Chris Cunningham missed Layup.,10,3,7,0,0.669594696121205,0.669594696121205,New Mexico,San José St,4,3,NA,400505587,2014-02-01
24,1,15:21,2121,2121,Alex Kirk Defensive Rebound.,10,3,7,8,0.669594696121205,0.669594696121205,New Mexico,San José St,4,3,NA,400505587,2014-02-01
25,1,15:13,2113,2113,Alex Kirk made Layup. Assisted by Hugh Greenwood.,12,3,9,0,0.7133254490388509,0.7133254490388509,New Mexico,San José St,4,3,NA,400505587,2014-02-01
26,1,15:13,2113,2113,Foul on Rashad Muhammad.,12,3,9,1,0.7133254490388509,0.7133254490388509,New Mexico,San José St,4,3,NA,400505587,2014-02-01
27,1,15:12,2112,2112,Official TV Timeout,12,3,9,0,0.7134130846028811,0.7134130846028811,New Mexico,San José St,4,3,NA,400505587,2014-02-01
28,1,15:12,2112,2112,Alex Kirk made Free Throw.,13,3,10,12,0.7336760527010444,0.7336760527010444,New Mexico,San José St,4,3,NA,400505587,2014-02-01
29,1,15:00,2100,2100,Rashad Muhammad missed Three Point Jumper.,13,3,10,0,0.7347940790748325,0.7347940790748325,New Mexico,San José St,4,3,NA,400505587,2014-02-01
30,1,15:00,2100,2100,Hugh Greenwood Defensive Rebound.,13,3,10,3,0.7347940790748325,0.7347940790748325,New Mexico,San José St,4,3,NA,400505587,2014-02-01
31,1,14:57,2097,2097,Foul on Chris Cunningham.,13,3,10,9,0.7350739746536468,0.7350739746536468,New Mexico,San José St,4,3,NA,400505587,2014-02-01
32,1,14:48,2088,2088,Kendall Williams made Jumper.,15,3,12,35,0.7737853353237641,0.7737853353237641,New Mexico,San José St,4,3,NA,400505587,2014-02-01
33,1,14:13,2053,2053,Rashad Muhammad missed Three Point Jumper.,15,3,12,0,0.7773296108838599,0.7773296108838599,New Mexico,San José St,4,3,NA,400505587,2014-02-01
34,1,14:13,2053,2053,Cameron Bairstow Defensive Rebound.,15,3,12,13,0.7773296108838599,0.7773296108838599,New Mexico,San José St,4,3,NA,400505587,2014-02-01
35,1,14:00,2040,2040,Cullen Neal missed Three Point Jumper.,15,3,12,0,0.77865044741567,0.77865044741567,New Mexico,San José St,4,3,NA,400505587,2014-02-01
36,1,14:00,2040,2040,San Jose St Defensive Rebound.,15,3,12,24,0.77865044741567,0.77865044741567,New Mexico,San José St,4,3,NA,400505587,2014-02-01
37,1,13:36,2016,2016,Jalen James missed Jumper.,15,3,12,0,0.7810961621781481,0.7810961621781481,New Mexico,San José St,4,3,NA,400505587,2014-02-01
38,1,13:36,2016,2016,New Mexico Defensive Rebound.,15,3,12,14,0.7810961621781481,0.7810961621781481,New Mexico,San José St,4,3,NA,400505587,2014-02-01
39,1,13:22,2002,2002,Cameron Bairstow missed Jumper.,15,3,12,0,0.782527574972198,0.782527574972198,New Mexico,San José St,4,3,NA,400505587,2014-02-01
40,1,13:22,2002,2002,Jalen James Defensive Rebound.,15,3,12,16,0.782527574972198,0.782527574972198,New Mexico,San José St,4,3,NA,400505587,2014-02-01
41,1,13:06,1986,1986,Jaleel Williams missed Three Point Jumper.,15,3,12,0,0.7841681283538685,0.7841681283538685,New Mexico,San José St,4,3,NA,400505587,2014-02-01
42,1,13:06,1986,1986,Kendall Williams Defensive Rebound.,15,3,12,5,0.7841681283538685,0.7841681283538685,New Mexico,San José St,4,3,NA,400505587,2014-02-01
43,1,13:01,1981,1981,Cameron Bairstow made Dunk. Assisted by Kendall Williams.,17,3,14,15,0.8188667947452111,0.8188667947452111,New Mexico,San José St,4,3,NA,400505587,2014-02-01
44,1,12:46,1966,1966,Jalen James made Three Point Jumper. Assisted by Chris Cunningham.,17,6,11,21,0.7674198982042699,0.7674198982042699,New Mexico,San José St,4,3,NA,400505587,2014-02-01
45,1,12:25,1945,1945,Deshawn Delaney made Three Point Jumper. Assisted by Kendall Williams.,20,6,14,22,0.8226644125971843,0.8226644125971843,New Mexico,San José St,4,3,NA,400505587,2014-02-01
46,1,12:03,1923,1923,Foul on Chris Cunningham.,20,6,14,0,0.8249910418608775,0.8249910418608775,New Mexico,San José St,4,3,NA,400505587,2014-02-01
47,1,12:03,1923,1923,Chris Cunningham Turnover.,20,6,14,16,0.8249910418608775,0.8249910418608775,New Mexico,San José St,4,3,NA,400505587,2014-02-01
48,1,11:47,1907,1907,Obij Aget missed Jumper.,20,6,14,0,0.8266696240358901,0.8266696240358901,New Mexico,San José St,4,3,NA,400505587,2014-02-01
49,1,11:47,1907,1907,Jalen James Defensive Rebound.,20,6,14,12,0.8266696240358901,0.8266696240358901,New Mexico,San José St,4,3,NA,400505587,2014-02-01
50,1,11:35,1895,1895,Chris Cunningham made Three Point Jumper. Assisted by Jaleel Williams.,20,9,11,15,0.7745733556617298,0.7745733556617298,New Mexico,San José St,4,3,NA,400505587,2014-02-01
51,1,11:20,1880,1880,Official TV Timeout,20,9,11,14,0.7760696203868143,0.7760696203868143,New Mexico,San José St,4,3,NA,400505587,2014-02-01
52,1,11:06,1866,1866,Cameron Bairstow made Layup.,22,9,13,39,0.8143274279218262,0.8143274279218262,New Mexico,San José St,4,3,NA,400505587,2014-02-01
53,1,10:27,1827,1827,San Jose St  Turnover.,22,9,13,15,0.81831452390502,0.81831452390502,New Mexico,San José St,4,3,NA,400505587,2014-02-01
54,1,10:12,1812,1812,Cleveland Thomas Turnover.,22,9,13,24,0.8198450606644136,0.8198450606644136,New Mexico,San José St,4,3,NA,400505587,2014-02-01
55,1,9:48,1788,1788,Jaleel Williams made Jumper.,22,11,11,11,0.785211379994527,0.785211379994527,New Mexico,San José St,4,3,NA,400505587,2014-02-01
56,1,9:37,1777,1777,Merv Lindsay missed Three Point Jumper.,22,11,11,0,0.7863126280879462,0.7863126280879462,New Mexico,San José St,4,3,NA,400505587,2014-02-01
57,1,9:37,1777,1777,Rashad Muhammad Defensive Rebound.,22,11,11,38,0.7863126280879462,0.7863126280879462,New Mexico,San José St,4,3,NA,400505587,2014-02-01
58,1,8:59,1739,1739,D.J. Brown missed Three Point Jumper.,22,11,11,0,0.790153206108166,0.790153206108166,New Mexico,San José St,4,3,NA,400505587,2014-02-01
59,1,8:59,1739,1739,Merv Lindsay Defensive Rebound.,22,11,11,11,0.790153206108166,0.790153206108166,New Mexico,San José St,4,3,NA,400505587,2014-02-01
60,1,8:48,1728,1728,Foul on Isaac Thornton.,22,11,11,6,0.7912780875238282,0.7912780875238282,New Mexico,San José St,4,3,NA,400505587,2014-02-01
61,1,8:42,1722,1722,Cullen Neal missed Three Point Jumper.,22,11,11,0,0.7918945890199797,0.7918945890199797,New Mexico,San José St,4,3,NA,400505587,2014-02-01
62,1,8:42,1722,1722,Cleveland Thomas Offensive Rebound.,22,11,11,2,0.7918945890199797,0.7918945890199797,New Mexico,San José St,4,3,NA,400505587,2014-02-01
63,1,8:40,1720,1720,Matt Pollard Block.,22,11,11,0,0.7921005725260326,0.7921005725260326,New Mexico,San José St,4,3,NA,400505587,2014-02-01
64,1,8:40,1720,1720,Cameron Bairstow missed Layup.,22,11,11,1,0.7921005725260326,0.7921005725260326,New Mexico,San José St,4,3,NA,400505587,2014-02-01
65,1,8:39,1719,1719,Matt Pollard Defensive Rebound.,22,11,11,1,0.7922036569034215,0.7922036569034215,New Mexico,San José St,4,3,NA,400505587,2014-02-01
66,1,8:38,1718,1718,Cleveland Thomas missed Layup.,22,11,11,0,0.7923068036378619,0.7923068036378619,New Mexico,San José St,4,3,NA,400505587,2014-02-01
67,1,8:38,1718,1718,Chris Cunningham Defensive Rebound.,22,11,11,4,0.7923068036378619,0.7923068036378619,New Mexico,San José St,4,3,NA,400505587,2014-02-01
68,1,8:34,1714,1714,Isaac Thornton made Layup. Assisted by Chris Cunningham.,22,13,9,0,0.7497930434634539,0.7497930434634539,New Mexico,San José St,4,3,NA,400505587,2014-02-01
69,1,8:34,1714,1714,Foul on Kendall Williams.,22,13,9,0,0.7497930434634539,0.7497930434634539,New Mexico,San José St,4,3,NA,400505587,2014-02-01
70,1,8:34,1714,1714,Isaac Thornton made Free Throw.,22,14,8,31,0.7262270114533889,0.7262270114533889,New Mexico,San José St,4,3,NA,400505587,2014-02-01
71,1,8:03,1683,1683,Rashad Muhammad made Layup. Assisted by Isaac Thornton.,22,16,6,0,0.6775349466245136,0.6775349466245136,New Mexico,San José St,4,3,NA,400505587,2014-02-01
72,1,8:03,1683,1683,Kendall Williams made Three Point Jumper.,25,16,9,23,0.7528181777667261,0.7528181777667261,New Mexico,San José St,4,3,NA,400505587,2014-02-01
73,1,7:40,1660,1660,Rashad Muhammad missed Three Point Jumper.,25,16,9,0,0.7550117961891841,0.7550117961891841,New Mexico,San José St,4,3,NA,400505587,2014-02-01
74,1,7:40,1660,1660,Cleveland Thomas Defensive Rebound.,25,16,9,13,0.7550117961891841,0.7550117961891841,New Mexico,San José St,4,3,NA,400505587,2014-02-01
75,1,7:27,1647,1647,Cleveland Thomas made Three Point Jumper. Assisted by Kendall Williams.,28,16,12,19,0.8189755192813947,0.8189755192813947,New Mexico,San José St,4,3,NA,400505587,2014-02-01
76,1,7:08,1628,1628,Kendall Williams Steal.,28,16,12,0,0.820833404987627,0.820833404987627,New Mexico,San José St,4,3,NA,400505587,2014-02-01
77,1,7:08,1628,1628,Isaac Thornton Turnover.,28,16,12,0,0.820833404987627,0.820833404987627,New Mexico,San José St,4,3,NA,400505587,2014-02-01
78,1,7:08,1628,1628,Foul on Rashad Muhammad.,28,16,12,1,0.820833404987627,0.820833404987627,New Mexico,San José St,4,3,NA,400505587,2014-02-01
79,1,7:07,1627,1627,Official TV Timeout,28,16,12,11,0.8209301733812321,0.8209301733812321,New Mexico,San José St,4,3,NA,400505587,2014-02-01
80,1,6:56,1616,1616,Foul on Isaac Thornton.,28,16,12,0,0.8219893023155742,0.8219893023155742,New Mexico,San José St,4,3,NA,400505587,2014-02-01
81,1,6:56,1616,1616,Kendall Williams missed Free Throw.,28,16,12,0,0.8219893023155742,0.8219893023155742,New Mexico,San José St,4,3,NA,400505587,2014-02-01
82,1,6:56,1616,1616,New Mexico Deadball Team Rebound.,28,16,12,0,0.8219893023155742,0.8219893023155742,New Mexico,San José St,4,3,NA,400505587,2014-02-01
83,1,6:56,1616,1616,Kendall Williams missed Free Throw.,28,16,12,0,0.8219893023155742,0.8219893023155742,New Mexico,San José St,4,3,NA,400505587,2014-02-01
84,1,6:56,1616,1616,Brandon Mitchell Defensive Rebound.,28,16,12,10,0.8219893023155742,0.8219893023155742,New Mexico,San José St,4,3,NA,400505587,2014-02-01
85,1,6:46,1606,1606,Rashad Muhammad missed Layup.,28,16,12,0,0.8229452052411088,0.8229452052411088,New Mexico,San José St,4,3,NA,400505587,2014-02-01
86,1,6:46,1606,1606,Cullen Neal Defensive Rebound.,28,16,12,1,0.8229452052411088,0.8229452052411088,New Mexico,San José St,4,3,NA,400505587,2014-02-01
87,1,6:45,1605,1605,Foul on Brandon Mitchell.,28,16,12,0,0.8230405111795324,0.8230405111795324,New Mexico,San José St,4,3,NA,400505587,2014-02-01
88,1,6:45,1605,1605,Cullen Neal made Free Throw.,29,16,13,0,0.8409314595294869,0.8409314595294869,New Mexico,San José St,4,3,NA,400505587,2014-02-01
89,1,6:45,1605,1605,Cullen Neal made Free Throw.,30,16,14,11,0.8573271526809034,0.8573271526809034,New Mexico,San José St,4,3,NA,400505587,2014-02-01
90,1,6:34,1594,1594,Rashad Muhammad made Jumper. Assisted by Isaac Thornton.,30,18,12,13,0.8240864022653492,0.8240864022653492,New Mexico,San José St,4,3,NA,400505587,2014-02-01
91,1,6:21,1581,1581,Kendall Williams missed Jumper.,30,18,12,0,0.825319089717733,0.825319089717733,New Mexico,San José St,4,3,NA,400505587,2014-02-01
92,1,6:21,1581,1581,Cameron Bairstow Offensive Rebound.,30,18,12,7,0.825319089717733,0.825319089717733,New Mexico,San José St,4,3,NA,400505587,2014-02-01
93,1,6:14,1574,1574,Cleveland Thomas made Three Point Jumper. Assisted by Cullen Neal.,33,18,15,10,0.8750944376838149,0.8750944376838149,New Mexico,San José St,4,3,NA,400505587,2014-02-01
94,1,6:04,1564,1564,Jalen James made Three Point Jumper. Assisted by Rashad Muhammad.,33,21,12,13,0.826932100342196,0.826932100342196,New Mexico,San José St,4,3,NA,400505587,2014-02-01
95,1,5:51,1551,1551,Hugh Greenwood missed Three Point Jumper.,33,21,12,0,0.8281714890285258,0.8281714890285258,New Mexico,San José St,4,3,NA,400505587,2014-02-01
96,1,5:51,1551,1551,Rashad Muhammad Defensive Rebound.,33,21,12,27,0.8281714890285258,0.8281714890285258,New Mexico,San José St,4,3,NA,400505587,2014-02-01
97,1,5:24,1524,1524,Foul on Deshawn Delaney.,33,21,12,11,0.8307801605500004,0.8307801605500004,New Mexico,San José St,4,3,NA,400505587,2014-02-01
98,1,5:13,1513,1513,Chris Cunningham missed Three Point Jumper.,33,21,12,0,0.8318624185612784,0.8318624185612784,New Mexico,San José St,4,3,NA,400505587,2014-02-01
99,1,5:13,1513,1513,Kendall Williams Defensive Rebound.,33,21,12,14,0.8318624185612784,0.8318624185612784,New Mexico,San José St,4,3,NA,400505587,2014-02-01
100,1,4:59,1499,1499,Hugh Greenwood missed Three Point Jumper.,33,21,12,0,0.8332611604224194,0.8332611604224194,New Mexico,San José St,4,3,NA,400505587,2014-02-01
101,1,4:59,1499,1499,Hugh Greenwood Offensive Rebound.,33,21,12,4,0.8332611604224194,0.8332611604224194,New Mexico,San José St,4,3,NA,400505587,2014-02-01
102,1,4:55,1495,1495,Deshawn Delaney made Dunk. Assisted by Hugh Greenwood.,35,21,14,15,0.8676653384366245,0.8676653384366245,New Mexico,San José St,4,3,NA,400505587,2014-02-01
103,1,4:40,1480,1480,Foul on Hugh Greenwood.,35,21,14,15,0.8691507151434009,0.8691507151434009,New Mexico,San José St,4,3,NA,400505587,2014-02-01
104,1,4:25,1465,1465,Jaleel Williams made Three Point Jumper. Assisted by Isaac Thornton.,35,24,11,17,0.8173171666498681,0.8173171666498681,New Mexico,San José St,4,3,NA,400505587,2014-02-01
105,1,4:08,1448,1448,Alex Kirk missed Jumper.,35,24,11,0,0.8191622591257302,0.8191622591257302,New Mexico,San José St,4,3,NA,400505587,2014-02-01
106,1,4:08,1448,1448,Jaleel Williams Defensive Rebound.,35,24,11,37,0.8191622591257302,0.8191622591257302,New Mexico,San José St,4,3,NA,400505587,2014-02-01
107,1,3:31,1411,1411,Chris Cunningham missed Layup.,35,24,11,0,0.823032420570888,0.823032420570888,New Mexico,San José St,4,3,NA,400505587,2014-02-01
108,1,3:31,1411,1411,Cameron Bairstow Defensive Rebound.,35,24,11,8,0.823032420570888,0.823032420570888,New Mexico,San José St,4,3,NA,400505587,2014-02-01
109,1,3:23,1403,1403,Alex Kirk made Dunk. Assisted by Hugh Greenwood.,37,24,13,17,0.8609241802293708,0.8609241802293708,New Mexico,San José St,4,3,NA,400505587,2014-02-01
110,1,3:06,1386,1386,Foul on Hugh Greenwood.,37,24,13,0,0.8625499054454513,0.8625499054454513,New Mexico,San José St,4,3,NA,400505587,2014-02-01
111,1,3:06,1386,1386,Official TV Timeout,37,24,13,28,0.8625499054454513,0.8625499054454513,New Mexico,San José St,4,3,NA,400505587,2014-02-01
112,1,2:38,1358,1358,Chris Cunningham missed Jumper.,37,24,13,0,0.8651692142140507,0.8651692142140507,New Mexico,San José St,4,3,NA,400505587,2014-02-01
113,1,2:38,1358,1358,Alex Kirk Block.,37,24,13,3,0.8651692142140507,0.8651692142140507,New Mexico,San José St,4,3,NA,400505587,2014-02-01
114,1,2:35,1355,1355,Cameron Bairstow Defensive Rebound.,37,24,13,14,0.8654478252206597,0.8654478252206597,New Mexico,San José St,4,3,NA,400505587,2014-02-01
115,1,2:21,1341,1341,Alex Kirk missed Jumper.,37,24,13,0,0.866748089842262,0.866748089842262,New Mexico,San José St,4,3,NA,400505587,2014-02-01
116,1,2:21,1341,1341,Deshawn Delaney Offensive Rebound.,37,24,13,17,0.866748089842262,0.866748089842262,New Mexico,San José St,4,3,NA,400505587,2014-02-01
117,1,2:04,1324,1324,Cameron Bairstow missed Layup.,37,24,13,0,0.8683356600228528,0.8683356600228528,New Mexico,San José St,4,3,NA,400505587,2014-02-01
118,1,2:04,1324,1324,Cameron Bairstow Offensive Rebound.,37,24,13,3,0.8683356600228528,0.8683356600228528,New Mexico,San José St,4,3,NA,400505587,2014-02-01
119,1,2:01,1321,1321,Cameron Bairstow missed Two Point Tip Shot.,37,24,13,0,0.8686177531096643,0.8686177531096643,New Mexico,San José St,4,3,NA,400505587,2014-02-01
120,1,2:01,1321,1321,Brandon Mitchell Defensive Rebound.,37,24,13,25,0.8686177531096643,0.8686177531096643,New Mexico,San José St,4,3,NA,400505587,2014-02-01
121,1,1:36,1296,1296,Jalen James missed Three Point Jumper.,37,24,13,0,0.8710051332944979,0.8710051332944979,New Mexico,San José St,4,3,NA,400505587,2014-02-01
122,1,1:36,1296,1296,Matt Pollard Offensive Rebound.,37,24,13,29,0.8710051332944979,0.8710051332944979,New Mexico,San José St,4,3,NA,400505587,2014-02-01
123,1,1:07,1267,1267,D.J. Brown missed Three Point Jumper.,37,24,13,0,0.8738940991397428,0.8738940991397428,New Mexico,San José St,4,3,NA,400505587,2014-02-01
124,1,1:07,1267,1267,Cameron Bairstow Defensive Rebound.,37,24,13,11,0.8738940991397428,0.8738940991397428,New Mexico,San José St,4,3,NA,400505587,2014-02-01
125,1,0:56,1256,1256,Deshawn Delaney missed Three Point Jumper.,37,24,13,0,0.8750349496099505,0.8750349496099505,New Mexico,San José St,4,3,NA,400505587,2014-02-01
126,1,0:56,1256,1256,Jalen James Defensive Rebound.,37,24,13,7,0.8750349496099505,0.8750349496099505,New Mexico,San José St,4,3,NA,400505587,2014-02-01
127,1,0:49,1249,1249,Foul on Alex Kirk.,37,24,13,0,0.8757760559596283,0.8757760559596283,New Mexico,San José St,4,3,NA,400505587,2014-02-01
128,1,0:49,1249,1249,Jalen James made Free Throw.,37,25,12,0,0.8584884424489737,0.8584884424489737,New Mexico,San José St,4,3,NA,400505587,2014-02-01
129,1,0:49,1249,1249,Jalen James missed Free Throw.,37,25,12,0,0.8584884424489737,0.8584884424489737,New Mexico,San José St,4,3,NA,400505587,2014-02-01
130,1,0:49,1249,1249,Alex Kirk Defensive Rebound.,37,25,12,10,0.8584884424489737,0.8584884424489737,New Mexico,San José St,4,3,NA,400505587,2014-02-01
131,1,0:39,1239,1239,Kendall Williams missed Three Point Jumper.,37,25,12,0,0.859602992155123,0.859602992155123,New Mexico,San José St,4,3,NA,400505587,2014-02-01
132,1,0:39,1239,1239,Jalen James Defensive Rebound.,37,25,12,10,0.859602992155123,0.859602992155123,New Mexico,San José St,4,3,NA,400505587,2014-02-01
133,1,0:29,1229,1229,Jalen James Turnover.,37,25,12,1,0.8607472213731772,0.8607472213731772,New Mexico,San José St,4,3,NA,400505587,2014-02-01
134,1,0:28,1228,1228,Kendall Williams Steal.,37,25,12,27,0.8608633574253376,0.8608633574253376,New Mexico,San José St,4,3,NA,400505587,2014-02-01
135,1,0:01,1201,1201,Deshawn Delaney missed Three Point Jumper.,37,25,12,0,0.8640972714819471,0.8640972714819471,New Mexico,San José St,4,3,NA,400505587,2014-02-01
136,1,0:01,1201,1201,D.J. Brown Defensive Rebound.,37,25,12,1,0.8640972714819471,0.8640972714819471,New Mexico,San José St,4,3,NA,400505587,2014-02-01
137,1,0:00,1200,1200,End of 1st half,37,25,12,0,0.8642163350891481,0.8642163350891481,New Mexico,San José St,4,3,NA,400505587,2014-02-01
138,2,20:00,1200,1200,PLAY,37,25,12,17,0.8642163350891481,0.8642163350891481,New Mexico,San José St,4,4,NA,400505587,2014-02-01
139,2,19:43,1183,1183,Jaleel Williams missed Three Point Jumper.,37,25,12,0,0.8661943574363167,0.8661943574363167,New Mexico,San José St,4,4,NA,400505587,2014-02-01
140,2,19:43,1183,1183,Hugh Greenwood Defensive Rebound.,37,25,12,14,0.8661943574363167,0.8661943574363167,New Mexico,San José St,4,4,NA,400505587,2014-02-01
141,2,19:29,1169,1169,Foul on Jaleel Williams.,37,25,12,0,0.8677678555819546,0.8677678555819546,New Mexico,San José St,4,4,NA,400505587,2014-02-01
142,2,19:29,1169,1169,Cameron Bairstow missed Free Throw.,37,25,12,0,0.8677678555819546,0.8677678555819546,New Mexico,San José St,4,4,NA,400505587,2014-02-01
143,2,19:29,1169,1169,New Mexico Deadball Team Rebound.,37,25,12,0,0.8677678555819546,0.8677678555819546,New Mexico,San José St,4,4,NA,400505587,2014-02-01
144,2,19:29,1169,1169,Cameron Bairstow missed Free Throw.,37,25,12,0,0.8677678555819546,0.8677678555819546,New Mexico,San José St,4,4,NA,400505587,2014-02-01
145,2,19:29,1169,1169,Jaleel Williams Defensive Rebound.,37,25,12,24,0.8677678555819546,0.8677678555819546,New Mexico,San José St,4,4,NA,400505587,2014-02-01
146,2,19:05,1145,1145,Matt Pollard missed Jumper.,37,25,12,0,0.8703830015658692,0.8703830015658692,New Mexico,San José St,4,4,NA,400505587,2014-02-01
147,2,19:05,1145,1145,Deshawn Delaney Defensive Rebound.,37,25,12,6,0.8703830015658692,0.8703830015658692,New Mexico,San José St,4,4,NA,400505587,2014-02-01
148,2,18:59,1139,1139,Alex Kirk made Dunk. Assisted by Hugh Greenwood.,39,25,14,25,0.9027711621921997,0.9027711621921997,New Mexico,San José St,4,4,NA,400505587,2014-02-01
149,2,18:34,1114,1114,Brandon Mitchell Turnover.,39,25,14,1,0.9051875700291135,0.9051875700291135,New Mexico,San José St,4,4,NA,400505587,2014-02-01
150,2,18:33,1113,1113,Deshawn Delaney Steal.,39,25,14,11,0.9052838032732645,0.9052838032732645,New Mexico,San José St,4,4,NA,400505587,2014-02-01
151,2,18:22,1102,1102,Cameron Bairstow missed Jumper.,39,25,14,0,0.9063427907450334,0.9063427907450334,New Mexico,San José St,4,4,NA,400505587,2014-02-01
152,2,18:22,1102,1102,Isaac Thornton Defensive Rebound.,39,25,14,24,0.9063427907450334,0.9063427907450334,New Mexico,San José St,4,4,NA,400505587,2014-02-01
153,2,17:58,1078,1078,Jalen James missed Layup.,39,25,14,0,0.9086709907053577,0.9086709907053577,New Mexico,San José St,4,4,NA,400505587,2014-02-01
154,2,17:58,1078,1078,Cameron Bairstow Defensive Rebound.,39,25,14,14,0.9086709907053577,0.9086709907053577,New Mexico,San José St,4,4,NA,400505587,2014-02-01
155,2,17:44,1064,1064,Hugh Greenwood missed Jumper.,39,25,14,0,0.9100525772204977,0.9100525772204977,New Mexico,San José St,4,4,NA,400505587,2014-02-01
156,2,17:44,1064,1064,Jalen James Defensive Rebound.,39,25,14,12,0.9100525772204977,0.9100525772204977,New Mexico,San José St,4,4,NA,400505587,2014-02-01
157,2,17:32,1052,1052,Jalen James Turnover.,39,25,14,1,0.9112574090599218,0.9112574090599218,New Mexico,San José St,4,4,NA,400505587,2014-02-01
158,2,17:31,1051,1051,Kendall Williams Steal.,39,25,14,1,0.911358815204395,0.911358815204395,New Mexico,San José St,4,4,NA,400505587,2014-02-01
159,2,17:30,1050,1050,Foul on Jalen James.,39,25,14,0,0.9114603868277782,0.9114603868277782,New Mexico,San José St,4,4,NA,400505587,2014-02-01
160,2,17:30,1050,1050,Kendall Williams missed Free Throw.,39,25,14,0,0.9114603868277782,0.9114603868277782,New Mexico,San José St,4,4,NA,400505587,2014-02-01
161,2,17:30,1050,1050,New Mexico Deadball Team Rebound.,39,25,14,0,0.9114603868277782,0.9114603868277782,New Mexico,San José St,4,4,NA,400505587,2014-02-01
162,2,17:30,1050,1050,Kendall Williams made Free Throw.,40,25,15,20,0.9240113799892983,0.9240113799892983,New Mexico,San José St,4,4,NA,400505587,2014-02-01
163,2,17:10,1030,1030,Jaleel Williams missed Three Point Jumper.,40,25,15,0,0.9259386082450141,0.9259386082450141,New Mexico,San José St,4,4,NA,400505587,2014-02-01
164,2,17:10,1030,1030,Alex Kirk Defensive Rebound.,40,25,15,12,0.9259386082450141,0.9259386082450141,New Mexico,San José St,4,4,NA,400505587,2014-02-01
165,2,16:58,1018,1018,Kendall Williams Turnover.,40,25,15,24,0.9271295409062389,0.9271295409062389,New Mexico,San José St,4,4,NA,400505587,2014-02-01
166,2,16:34,994,994,Foul on Cameron Bairstow.,40,25,15,0,0.9296029915954903,0.9296029915954903,New Mexico,San José St,4,4,NA,400505587,2014-02-01
