play_id,half,time_remaining_half,secs_remaining,secs_remaining_absolute,description,home_score,away_score,score_diff,play_length,win_prob,naive_win_prob,home,away,home_time_out_remaining,away_time_out_remaining,home_favored_by,game_id,date
1,1,20:00,2400,2400,PLAY,0,0,0,12,0.5,0.5,Texas,Colorado,4,4,NA,260070251,2006-01-07
2,1,19:48,2388,2388,P.J. Tucker missed Two Point Jumper.,0,0,0,0,0.5,0.5,Texas,Colorado,4,4,NA,260070251,2006-01-07
3,1,19:48,2388,2388,Andy Osborn Defensive Rebound.,0,0,0,30,0.5,0.5,Texas,Colorado,4,4,NA,260070251,2006-01-07
4,1,19:18,2358,2358,Chris Copeland missed Two Point Layup.,0,0,0,10,0.5,0.5,Texas,Colorado,4,4,NA,260070251,2006-01-07
5,1,19:08,2348,2348,Brad Buckman Defensive Rebound.,0,0,0,7,0.5,0.5,Texas,Colorado,4,4,NA,260070251,2006-01-07
6,1,19:01,2341,2341,Kenton Paulino missed Three Point Jumper.,0,0,0,0,0.5,0.5,Texas,Colorado,4,4,NA,260070251,2006-01-07
7,1,19:01,2341,2341,P.J. Tucker Offensive Rebound.,0,0,0,7,0.5,0.5,Texas,Colorado,4,4,NA,260070251,2006-01-07
8,1,18:54,2334,2334,P.J. Tucker missed Two Point Layup.,0,0,0,0,0.5,0.5,Texas,Colorado,4,4,NA,260070251,2006-01-07
9,1,18:54,2334,2334,Texas Defensive Rebound.,0,0,0,2,0.5,0.5,Texas,Colorado,4,4,NA,260070251,2006-01-07
10,1,18:52,2332,2332,LaMarcus Aldridge made Two Point Jumper.  Assisted by Kenton Paulino.,2,0,2,18,0.5454821952070623,0.5454821952070623,Texas,Colorado,4,4,NA,260070251,2006-01-07
11,1,18:34,2314,2314,LaMarcus Aldridge Steal.,2,0,2,6,0.5458774918069081,0.5458774918069081,Texas,Colorado,4,4,NA,260070251,2006-01-07
12,1,18:28,2308,2308,Daniel Gibson missed Two Point Layup.,2,0,2,0,0.5460100625768887,0.5460100625768887,Texas,Colorado,4,4,NA,260070251,2006-01-07
13,1,18:28,2308,2308,Chris Copeland Defensive Rebound.,2,0,2,10,0.5460100625768887,0.5460100625768887,Texas,Colorado,4,4,NA,260070251,2006-01-07
14,1,18:18,2298,2298,Richard Roby missed Three Point Jumper.,2,0,2,0,0.546231860846261,0.546231860846261,Texas,Colorado,4,4,NA,260070251,2006-01-07
15,1,18:18,2298,2298,P.J. Tucker Defensive Rebound.,2,0,2,11,0.546231860846261,0.546231860846261,Texas,Colorado,4,4,NA,260070251,2006-01-07
16,1,18:07,2287,2287,LaMarcus Aldridge made Two Point Jumper.  Assisted by Brad Buckman.,4,0,4,16,0.5921577300198443,0.5921577300198443,Texas,Colorado,4,4,NA,260070251,2006-01-07
17,1,17:51,2271,2271,Jayson Obazuaye missed Three Point Jumper.,4,0,4,0,0.5928565045035783,0.5928565045035783,Texas,Colorado,4,4,NA,260070251,2006-01-07
18,1,17:51,2271,2271,Andy Osborn Offensive Rebound.,4,0,4,6,0.5928565045035783,0.5928565045035783,Texas,Colorado,4,4,NA,260070251,2006-01-07
19,1,17:45,2265,2265,Chris Copeland missed Two Point Jumper.,4,0,4,0,0.593119615057748,0.593119615057748,Texas,Colorado,4,4,NA,260070251,2006-01-07
20,1,17:45,2265,2265,Brad Buckman Defensive Rebound.,4,0,4,11,0.593119615057748,0.593119615057748,Texas,Colorado,4,4,NA,260070251,2006-01-07
21,1,17:34,2254,2254,LaMarcus Aldridge made Two Point Jumper.,6,0,6,6,0.6383760782397434,0.6383760782397434,Texas,Colorado,4,4,NA,260070251,2006-01-07
22,1,17:28,2248,2248,Colorado Full Timeout.,6,0,6,26,0.6387558522326415,0.6387558522326415,Texas,Colorado,3,4,NA,260070251,2006-01-07
23,1,17:02,2222,2222,Marcus Hall missed Two Point Jumper.,6,0,6,0,0.6404080576134128,0.6404080576134128,Texas,Colorado,3,4,NA,260070251,2006-01-07
24,1,17:02,2222,2222,P.J. Tucker Defensive Rebound.,6,0,6,25,0.6404080576134128,0.6404080576134128,Texas,Colorado,3,4,NA,260070251,2006-01-07
25,1,16:37,2197,2197,Foul on Daniel Gibson,6,0,6,11,0.6420048640253054,0.6420048640253054,Texas,Colorado,3,4,NA,260070251,2006-01-07
26,1,16:26,2186,2186,Andy Osborn missed Three Point Jumper.,6,0,6,0,0.6427093701999151,0.6427093701999151,Texas,Colorado,3,4,NA,260070251,2006-01-07
27,1,16:26,2186,2186,LaMarcus Aldridge Defensive Rebound.,6,0,6,4,0.6427093701999151,0.6427093701999151,Texas,Colorado,3,4,NA,260070251,2006-01-07
28,1,16:22,2182,2182,P.J. Tucker missed Two Point Jumper.,6,0,6,0,0.6429657836236942,0.6429657836236942,Texas,Colorado,3,4,NA,260070251,2006-01-07
29,1,16:22,2182,2182,Jayson Obazuaye Defensive Rebound.,6,0,6,16,0.6429657836236942,0.6429657836236942,Texas,Colorado,3,4,NA,260070251,2006-01-07
30,1,16:06,2166,2166,Foul on Andy Osborn,6,0,6,0,0.6439924996490257,0.6439924996490257,Texas,Colorado,3,4,NA,260070251,2006-01-07
31,1,16:06,2166,2166,Brad Buckman made Free Throw.,7,0,7,1,0.6663059721641955,0.6663059721641955,Texas,Colorado,3,4,NA,260070251,2006-01-07
32,1,16:05,2165,2165,Brad Buckman made Free Throw.,8,0,8,11,0.6879789139401994,0.6879789139401994,Texas,Colorado,3,4,NA,260070251,2006-01-07
33,1,15:54,2154,2154,Julius Ashby missed Two Point Jumper.,8,0,8,0,0.6888624414968159,0.6888624414968159,Texas,Colorado,3,4,NA,260070251,2006-01-07
34,1,15:54,2154,2154,Brad Buckman Defensive Rebound.,8,0,8,7,0.6888624414968159,0.6888624414968159,Texas,Colorado,3,4,NA,260070251,2006-01-07
35,1,15:47,2147,2147,Daniel Gibson missed Three Point Jumper.,8,0,8,0,0.6894256976369034,0.6894256976369034,Texas,Colorado,3,4,NA,260070251,2006-01-07
36,1,15:47,2147,2147,Andy Osborn Defensive Rebound.,8,0,8,11,0.6894256976369034,0.6894256976369034,Texas,Colorado,3,4,NA,260070251,2006-01-07
37,1,15:36,2136,2136,Andy Osborn made Two Point Layup.,8,2,6,7,0.6459274847868975,0.6459274847868975,Texas,Colorado,3,4,NA,260070251,2006-01-07
38,1,15:29,2129,2129,Kenton Paulino made Three Point Jumper.  Assisted by P.J. Tucker.,11,2,9,31,0.7119257609840559,0.7119257609840559,Texas,Colorado,3,4,NA,260070251,2006-01-07
39,1,14:58,2098,2098,Dominique Coleman missed Three Point Jumper.,11,2,9,0,0.7146420102087014,0.7146420102087014,Texas,Colorado,3,4,NA,260070251,2006-01-07
40,1,14:58,2098,2098,Texas Defensive Rebound.,11,2,9,3,0.7146420102087014,0.7146420102087014,Texas,Colorado,3,4,NA,260070251,2006-01-07
41,1,14:55,2095,2095,Official TV Timeout.,11,2,9,60,0.7149058595468922,0.7149058595468922,Texas,Colorado,3,4,NA,260070251,2006-01-07
42,1,13:55,2035,2035,Daniel Gibson missed Three Point Jumper.,11,2,9,0,0.720225382286153,0.720225382286153,Texas,Colorado,3,4,NA,260070251,2006-01-07
43,1,13:55,2035,2035,P.J. Tucker Offensive Rebound.,11,2,9,13,0.720225382286153,0.720225382286153,Texas,Colorado,3,4,NA,260070251,2006-01-07
44,1,13:42,2022,2022,Daniel Gibson missed Three Point Jumper.,11,2,9,0,0.7213898025560439,0.7213898025560439,Texas,Colorado,3,4,NA,260070251,2006-01-07
45,1,13:42,2022,2022,Martane Freeman Defensive Rebound.,11,2,9,12,0.7213898025560439,0.7213898025560439,Texas,Colorado,3,4,NA,260070251,2006-01-07
46,1,13:30,2010,2010,Chris Copeland made Two Point Layup.,11,4,7,13,0.6778987092595555,0.6778987092595555,Texas,Colorado,3,4,NA,260070251,2006-01-07
47,1,13:17,1997,1997,Brad Buckman missed Three Point Jumper.,11,4,7,0,0.6788932456112302,0.6788932456112302,Texas,Colorado,3,4,NA,260070251,2006-01-07
48,1,13:17,1997,1997,Julius Ashby Defensive Rebound.,11,4,7,29,0.6788932456112302,0.6788932456112302,Texas,Colorado,3,4,NA,260070251,2006-01-07
49,1,12:48,1968,1968,Marcus Hall made Two Point Layup.,11,6,5,11,0.632306627093513,0.632306627093513,Texas,Colorado,3,4,NA,260070251,2006-01-07
50,1,12:37,1957,1957,Foul on Julius Ashby,11,6,5,15,0.6329615091190671,0.6329615091190671,Texas,Colorado,3,4,NA,260070251,2006-01-07
51,1,12:22,1942,1942,AJ Abrams made Two Point Jumper.,13,6,7,25,0.6831616983921132,0.6831616983921132,Texas,Colorado,3,4,NA,260070251,2006-01-07
52,1,11:57,1917,1917,Chris Copeland made Two Point Layup.,13,8,5,7,0.6353704989477953,0.6353704989477953,Texas,Colorado,3,4,NA,260070251,2006-01-07
53,1,11:50,1910,1910,Foul on Marcus Hall,13,8,5,0,0.6357927605357296,0.6357927605357296,Texas,Colorado,3,4,NA,260070251,2006-01-07
54,1,11:50,1910,1910,Official TV Timeout.,13,8,5,16,0.6357927605357296,0.6357927605357296,Texas,Colorado,3,4,NA,260070251,2006-01-07
55,1,11:34,1894,1894,Glean Eddy missed Three Point Jumper.,13,8,5,0,0.6367564396003823,0.6367564396003823,Texas,Colorado,3,4,NA,260070251,2006-01-07
56,1,11:34,1894,1894,Texas Defensive Rebound.,13,8,5,17,0.6367564396003823,0.6367564396003823,Texas,Colorado,3,4,NA,260070251,2006-01-07
57,1,11:17,1877,1877,LaMarcus Aldridge missed Two Point Jumper.,13,8,5,0,0.6377794202723023,0.6377794202723023,Texas,Colorado,3,4,NA,260070251,2006-01-07
58,1,11:17,1877,1877,Connor Atchley Offensive Rebound.,13,8,5,2,0.6377794202723023,0.6377794202723023,Texas,Colorado,3,4,NA,260070251,2006-01-07
59,1,11:15,1875,1875,Connor Atchley made Two Point Layup.,15,8,7,44,0.6884245649873151,0.6884245649873151,Texas,Colorado,3,4,NA,260070251,2006-01-07
60,1,10:31,1831,1831,Julius Ashby missed Two Point Jumper.,15,8,7,0,0.6918732009063256,0.6918732009063256,Texas,Colorado,3,4,NA,260070251,2006-01-07
61,1,10:31,1831,1831,Martane Freeman Offensive Rebound.,15,8,7,0,0.6918732009063256,0.6918732009063256,Texas,Colorado,3,4,NA,260070251,2006-01-07
62,1,10:31,1831,1831,Martane Freeman missed Two Point Tip Shot.,15,8,7,0,0.6918732009063256,0.6918732009063256,Texas,Colorado,3,4,NA,260070251,2006-01-07
63,1,10:31,1831,1831,Martane Freeman Offensive Rebound.,15,8,7,0,0.6918732009063256,0.6918732009063256,Texas,Colorado,3,4,NA,260070251,2006-01-07
64,1,10:31,1831,1831,Martane Freeman missed Two Point Tip Shot.,15,8,7,0,0.6918732009063256,0.6918732009063256,Texas,Colorado,3,4,NA,260070251,2006-01-07
65,1,10:31,1831,1831,LaMarcus Aldridge Defensive Rebound.,15,8,7,16,0.6918732009063256,0.6918732009063256,Texas,Colorado,3,4,NA,260070251,2006-01-07
66,1,10:15,1815,1815,Connor Atchley missed Three Point Jumper.,15,8,7,0,0.6931344715503758,0.6931344715503758,Texas,Colorado,3,4,NA,260070251,2006-01-07
67,1,10:15,1815,1815,Julius Ashby Defensive Rebound.,15,8,7,11,0.6931344715503758,0.6931344715503758,Texas,Colorado,3,4,NA,260070251,2006-01-07
68,1,10:04,1804,1804,AJ Abrams Steal.,15,8,7,4,0.6940054080014234,0.6940054080014234,Texas,Colorado,3,4,NA,260070251,2006-01-07
69,1,10:00,1800,1800,AJ Abrams missed Two Point Layup.,15,8,7,0,0.6943230201027285,0.6943230201027285,Texas,Colorado,3,4,NA,260070251,2006-01-07
70,1,10:00,1800,1800,P.J. Tucker Offensive Rebound.,15,8,7,3,0.6943230201027285,0.6943230201027285,Texas,Colorado,3,4,NA,260070251,2006-01-07
71,1,9:57,1797,1797,P.J. Tucker made Two Point Tip Shot.,17,8,9,14,0.7419744540729075,0.7419744540729075,Texas,Colorado,3,4,NA,260070251,2006-01-07
72,1,9:43,1783,1783,Martane Freeman missed Two Point Jumper.,17,8,9,0,0.7432703101699489,0.7432703101699489,Texas,Colorado,3,4,NA,260070251,2006-01-07
73,1,9:43,1783,1783,Julius Ashby Offensive Rebound.,17,8,9,4,0.7432703101699489,0.7432703101699489,Texas,Colorado,3,4,NA,260070251,2006-01-07
74,1,9:39,1779,1779,Marcus Hall missed Three Point Jumper.,17,8,9,0,0.7436418897324124,0.7436418897324124,Texas,Colorado,3,4,NA,260070251,2006-01-07
75,1,9:39,1779,1779,AJ Abrams Defensive Rebound.,17,8,9,14,0.7436418897324124,0.7436418897324124,Texas,Colorado,3,4,NA,260070251,2006-01-07
76,1,9:25,1765,1765,P.J. Tucker made Two Point Layup.  Assisted by Daniel Gibson.,19,8,11,6,0.7875187708134262,0.7875187708134262,Texas,Colorado,3,4,NA,260070251,2006-01-07
77,1,9:19,1759,1759,Colorado Full Timeout.,19,8,11,24,0.7881239747427143,0.7881239747427143,Texas,Colorado,2,4,NA,260070251,2006-01-07
78,1,8:55,1735,1735,Chris Copeland missed Two Point Layup.,19,8,11,0,0.790561477889693,0.790561477889693,Texas,Colorado,2,4,NA,260070251,2006-01-07
79,1,8:55,1735,1735,Colorado Defensive Rebound.,19,8,11,23,0.790561477889693,0.790561477889693,Texas,Colorado,2,4,NA,260070251,2006-01-07
80,1,8:32,1712,1712,Chris Copeland missed Three Point Jumper.,19,8,11,0,0.7929270189281958,0.7929270189281958,Texas,Colorado,2,4,NA,260070251,2006-01-07
81,1,8:32,1712,1712,Martane Freeman Offensive Rebound.,19,8,11,5,0.7929270189281958,0.7929270189281958,Texas,Colorado,2,4,NA,260070251,2006-01-07
82,1,8:27,1707,1707,Martane Freeman made Two Point Tip Shot.,19,10,9,14,0.750471159440458,0.750471159440458,Texas,Colorado,2,4,NA,260070251,2006-01-07
83,1,8:13,1693,1693,AJ Abrams made Three Point Jumper.  Assisted by LaMarcus Aldridge.,22,10,12,10,0.8142585177584964,0.8142585177584964,Texas,Colorado,2,4,NA,260070251,2006-01-07
84,1,8:03,1683,1683,Martane Freeman missed Three Point Jumper.,22,10,12,0,0.8153164844281892,0.8153164844281892,Texas,Colorado,2,4,NA,260070251,2006-01-07
85,1,8:03,1683,1683,LaMarcus Aldridge Defensive Rebound.,22,10,12,10,0.8153164844281892,0.8153164844281892,Texas,Colorado,2,4,NA,260070251,2006-01-07
86,1,7:53,1673,1673,Kenton Paulino made Two Point Layup.,24,10,14,7,0.8507489639828872,0.8507489639828872,Texas,Colorado,2,4,NA,260070251,2006-01-07
87,1,7:46,1666,1666,Chris Copeland made Two Point Jumper.,24,12,12,17,0.8170713229461355,0.8170713229461355,Texas,Colorado,2,4,NA,260070251,2006-01-07
88,1,7:29,1649,1649,P.J. Tucker made Two Point Jumper.  Assisted by Brad Buckman.,26,12,14,18,0.8531388417195469,0.8531388417195469,Texas,Colorado,2,4,NA,260070251,2006-01-07
89,1,7:11,1631,1631,Andy Osborn missed Three Point Jumper.,26,12,14,0,0.85487571963919,0.85487571963919,Texas,Colorado,2,4,NA,260070251,2006-01-07
90,1,7:11,1631,1631,Texas Defensive Rebound.,26,12,14,3,0.85487571963919,0.85487571963919,Texas,Colorado,2,4,NA,260070251,2006-01-07
91,1,7:08,1628,1628,Official TV Timeout.,26,12,14,23,0.8551615543641717,0.8551615543641717,Texas,Colorado,2,4,NA,260070251,2006-01-07
92,1,6:45,1605,1605,LaMarcus Aldridge missed Two Point Jumper.,26,12,14,0,0.8573271526809034,0.8573271526809034,Texas,Colorado,2,4,NA,260070251,2006-01-07
93,1,6:45,1605,1605,Brad Buckman Offensive Rebound.,26,12,14,20,0.8573271526809034,0.8573271526809034,Texas,Colorado,2,4,NA,260070251,2006-01-07
94,1,6:25,1585,1585,Jayson Obazuaye missed Two Point Layup.,26,12,14,0,0.8591859600412345,0.8591859600412345,Texas,Colorado,2,4,NA,260070251,2006-01-07
95,1,6:25,1585,1585,P.J. Tucker Defensive Rebound.,26,12,14,1,0.8591859600412345,0.8591859600412345,Texas,Colorado,2,4,NA,260070251,2006-01-07
96,1,6:24,1584,1584,Foul on Jayson Obazuaye,26,12,14,8,0.8592785976411058,0.8592785976411058,Texas,Colorado,2,4,NA,260070251,2006-01-07
97,1,6:16,1576,1576,Brad Buckman missed Two Point Layup.,26,12,14,3,0.8600192997380737,0.8600192997380737,Texas,Colorado,2,4,NA,260070251,2006-01-07
98,1,6:13,1573,1573,Jayson Obazuaye Defensive Rebound.,26,12,14,6,0.8602969993861146,0.8602969993861146,Texas,Colorado,2,4,NA,260070251,2006-01-07
99,1,6:07,1567,1567,Andy Osborn missed Two Point Jumper.,26,12,14,0,0.8608525678215917,0.8608525678215917,Texas,Colorado,2,4,NA,260070251,2006-01-07
100,1,6:07,1567,1567,Martane Freeman Offensive Rebound.,26,12,14,7,0.8608525678215917,0.8608525678215917,Texas,Colorado,2,4,NA,260070251,2006-01-07
101,1,6:00,1560,1560,Martane Freeman made Two Point Layup.,26,14,12,15,0.8273126779518979,0.8273126779518979,Texas,Colorado,2,4,NA,260070251,2006-01-07
102,1,5:45,1545,1545,LaMarcus Aldridge missed Two Point Jumper.,26,14,12,0,0.8287464669964708,0.8287464669964708,Texas,Colorado,2,4,NA,260070251,2006-01-07
103,1,5:45,1545,1545,Chris Copeland Defensive Rebound.,26,14,12,5,0.8287464669964708,0.8287464669964708,Texas,Colorado,2,4,NA,260070251,2006-01-07
104,1,5:40,1540,1540,Foul on Chris Copeland,26,14,12,8,0.8292274260823087,0.8292274260823087,Texas,Colorado,2,4,NA,260070251,2006-01-07
105,1,5:32,1532,1532,AJ Abrams made Three Point Jumper.  Assisted by Kenton Paulino.,29,14,15,24,0.8788987287082299,0.8788987287082299,Texas,Colorado,2,4,NA,260070251,2006-01-07
106,1,5:08,1508,1508,Jayson Obazuaye missed Two Point Jumper.,29,14,15,0,0.8811168439997419,0.8811168439997419,Texas,Colorado,2,4,NA,260070251,2006-01-07
107,1,5:08,1508,1508,P.J. Tucker Defensive Rebound.,29,14,15,7,0.8811168439997419,0.8811168439997419,Texas,Colorado,2,4,NA,260070251,2006-01-07
108,1,5:01,1501,1501,Foul on Jayson Obazuaye,29,14,15,0,0.8817738785422705,0.8817738785422705,Texas,Colorado,2,4,NA,260070251,2006-01-07
109,1,5:01,1501,1501,P.J. Tucker made Free Throw.,30,14,16,0,0.8950403064614323,0.8950403064614323,Texas,Colorado,2,4,NA,260070251,2006-01-07
110,1,5:01,1501,1501,P.J. Tucker made Free Throw.,31,14,17,16,0.906975127113457,0.906975127113457,Texas,Colorado,2,4,NA,260070251,2006-01-07
111,1,4:45,1485,1485,Martane Freeman made Two Point Layup.  Assisted by Richard Roby.,31,16,15,26,0.8832968555642521,0.8832968555642521,Texas,Colorado,2,4,NA,260070251,2006-01-07
112,1,4:19,1459,1459,P.J. Tucker missed Two Point Jumper.,31,16,15,0,0.8858463409987932,0.8858463409987932,Texas,Colorado,2,4,NA,260070251,2006-01-07
113,1,4:19,1459,1459,Marcus Hall Defensive Rebound.,31,16,15,7,0.8858463409987932,0.8858463409987932,Texas,Colorado,2,4,NA,260070251,2006-01-07
114,1,4:12,1452,1452,Richard Roby missed Three Point Jumper.,31,16,15,0,0.8865508814309936,0.8865508814309936,Texas,Colorado,2,4,NA,260070251,2006-01-07
115,1,4:12,1452,1452,Texas Defensive Rebound.,31,16,15,10,0.8865508814309936,0.8865508814309936,Texas,Colorado,2,4,NA,260070251,2006-01-07
116,1,4:02,1442,1442,LaMarcus Aldridge missed Two Point Layup.,31,16,15,0,0.8875565982255655,0.8875565982255655,Texas,Colorado,2,4,NA,260070251,2006-01-07
117,1,4:02,1442,1442,Richard Roby Defensive Rebound.,31,16,15,15,0.8875565982255655,0.8875565982255655,Texas,Colorado,2,4,NA,260070251,2006-01-07
118,1,3:47,1427,1427,Official TV Timeout.,31,16,15,8,0.8890135280801488,0.8890135280801488,Texas,Colorado,2,4,NA,260070251,2006-01-07
119,1,3:39,1419,1419,Foul on AJ Abrams,31,16,15,16,0.8897679353345219,0.8897679353345219,Texas,Colorado,2,4,NA,260070251,2006-01-07
120,1,3:23,1403,1403,AJ Abrams Steal.,31,16,15,15,0.8912377343098352,0.8912377343098352,Texas,Colorado,2,4,NA,260070251,2006-01-07
121,1,3:08,1388,1388,Daniel Gibson made Three Point Jumper.  Assisted by AJ Abrams.,34,16,18,22,0.926954254816724,0.926954254816724,Texas,Colorado,2,4,NA,260070251,2006-01-07
122,1,2:46,1366,1366,Richard Roby made Three Point Jumper.  Assisted by Martane Freeman.,34,19,15,18,0.8944994113239297,0.8944994113239297,Texas,Colorado,2,4,NA,260070251,2006-01-07
123,1,2:28,1348,1348,Daniel Gibson missed Three Point Jumper.,34,19,15,2,0.8960513571540699,0.8960513571540699,Texas,Colorado,2,4,NA,260070251,2006-01-07
124,1,2:26,1346,1346,Daniel Gibson Offensive Rebound.,34,19,15,2,0.8962234499876306,0.8962234499876306,Texas,Colorado,2,4,NA,260070251,2006-01-07
125,1,2:24,1344,1344,Daniel Gibson missed Two Point Layup.,34,19,15,0,0.8963955521383072,0.8963955521383072,Texas,Colorado,2,4,NA,260070251,2006-01-07
126,1,2:24,1344,1344,Daniel Gibson Offensive Rebound.,34,19,15,0,0.8963955521383072,0.8963955521383072,Texas,Colorado,2,4,NA,260070251,2006-01-07
127,1,2:24,1344,1344,Kenton Paulino made Two Point Layup.,36,19,17,14,0.9202323667678587,0.9202323667678587,Texas,Colorado,2,4,NA,260070251,2006-01-07
128,1,2:10,1330,1330,Richard Roby missed Three Point Jumper.,36,19,17,0,0.9213122073839652,0.9213122073839652,Texas,Colorado,2,4,NA,260070251,2006-01-07
129,1,2:10,1330,1330,AJ Abrams Defensive Rebound.,36,19,17,7,0.9213122073839652,0.9213122073839652,Texas,Colorado,2,4,NA,260070251,2006-01-07
130,1,2:03,1323,1323,Kenton Paulino made Three Point Jumper.  Assisted by AJ Abrams.,39,19,20,20,0.9480092921810562,0.9480092921810562,Texas,Colorado,2,4,NA,260070251,2006-01-07
131,1,1:43,1303,1303,Marcus Hall made Three Point Jumper.  Assisted by Richard Roby.,39,22,17,23,0.9234149219749365,0.9234149219749365,Texas,Colorado,2,4,NA,260070251,2006-01-07
132,1,1:20,1280,1280,Foul on Julius Ashby,39,22,17,0,0.925252525720372,0.925252525720372,Texas,Colorado,2,4,NA,260070251,2006-01-07
133,1,1:20,1280,1280,LaMarcus Aldridge made Free Throw.,40,22,18,0,0.9348655064746555,0.9348655064746555,Texas,Colorado,2,4,NA,260070251,2006-01-07
134,1,1:20,1280,1280,LaMarcus Aldridge made Free Throw.,41,22,19,28,0.9433179357758792,0.9433179357758792,Texas,Colorado,2,4,NA,260070251,2006-01-07
135,1,0:52,1252,1252,Richard Roby missed Two Point Layup.,41,22,19,0,0.9453258146849931,0.9453258146849931,Texas,Colorado,2,4,NA,260070251,2006-01-07
136,1,0:52,1252,1252,JD Lewis Defensive Rebound.,41,22,19,31,0.9453258146849931,0.9453258146849931,Texas,Colorado,2,4,NA,260070251,2006-01-07
137,1,0:21,1221,1221,Richard Roby missed Two Point Layup.,41,22,19,0,0.9476724242003647,0.9476724242003647,Texas,Colorado,2,4,NA,260070251,2006-01-07
138,1,0:21,1221,1221,Richard Roby Offensive Rebound.,41,22,19,2,0.9476724242003647,0.9476724242003647,Texas,Colorado,2,4,NA,260070251,2006-01-07
139,1,0:19,1219,1219,Foul on Brad Buckman,41,22,19,2,0.9478289970160413,0.9478289970160413,Texas,Colorado,2,4,NA,260070251,2006-01-07
140,1,0:17,1217,1217,Foul on Brad Buckman,41,22,19,0,0.9479862393092773,0.9479862393092773,Texas,Colorado,2,4,NA,260070251,2006-01-07
141,1,0:17,1217,1217,Richard Roby made Free Throw.,41,23,18,0,0.9399162334365331,0.9399162334365331,Texas,Colorado,2,4,NA,260070251,2006-01-07
142,1,0:17,1217,1217,Richard Roby made Free Throw.,41,24,17,9,0.9306857034414179,0.9306857034414179,Texas,Colorado,2,4,NA,260070251,2006-01-07
143,1,0:08,1208,1208,P.J. Tucker made Two Point Layup.,43,24,19,4,0.9487013369230155,0.9487013369230155,Texas,Colorado,2,4,NA,260070251,2006-01-07
144,1,0:04,1204,1204,Martane Freeman missed Two Point Layup.,43,24,19,0,0.9490166397965217,0.9490166397965217,Texas,Colorado,2,4,NA,260070251,2006-01-07
145,1,0:04,1204,1204,Colorado Defensive Rebound.,43,24,19,2,0.9490166397965217,0.9490166397965217,Texas,Colorado,2,4,NA,260070251,2006-01-07
146,1,0:02,1202,1202,Texas Full Timeout.,43,24,19,2,0.9491726089419549,0.9491726089419549,Texas,Colorado,2,3,NA,260070251,2006-01-07
147,1,0:00,1200,1200,End of the 1st Half.,43,24,19,0,0.9493274924441191,0.9493274924441191,Texas,Colorado,2,3,NA,260070251,2006-01-07
148,2,20:00,1200,1200,PLAY,43,24,19,13,0.9493274924441191,0.9493274924441191,Texas,Colorado,3,4,NA,260070251,2006-01-07
149,2,19:47,1187,1187,Kenton Paulino Steal.,43,24,19,7,0.9503095804143049,0.9503095804143049,Texas,Colorado,3,4,NA,260070251,2006-01-07
150,2,19:40,1180,1180,LaMarcus Aldridge made Two Point Dunk Shot.  Assisted by Brad Buckman.,45,24,21,18,0.9635142341372958,0.9635142341372958,Texas,Colorado,3,4,NA,260070251,2006-01-07
151,2,19:22,1162,1162,Jayson Obazuaye missed Two Point Jumper.,45,24,21,0,0.9645722516518883,0.9645722516518883,Texas,Colorado,3,4,NA,260070251,2006-01-07
152,2,19:22,1162,1162,P.J. Tucker Defensive Rebound.,45,24,21,23,0.9645722516518883,0.9645722516518883,Texas,Colorado,3,4,NA,260070251,2006-01-07
153,2,18:59,1139,1139,P.J. Tucker missed Two Point Jumper.,45,24,21,0,0.9658617622696054,0.9658617622696054,Texas,Colorado,3,4,NA,260070251,2006-01-07
154,2,18:59,1139,1139,LaMarcus Aldridge Offensive Rebound.,45,24,21,0,0.9658617622696054,0.9658617622696054,Texas,Colorado,3,4,NA,260070251,2006-01-07
155,2,18:59,1139,1139,Foul on Chris Copeland,45,24,21,0,0.9658617622696054,0.9658617622696054,Texas,Colorado,3,4,NA,260070251,2006-01-07
156,2,18:59,1139,1139,Richard Roby made Three Point Jumper.  Assisted by Jayson Obazuaye.,45,27,18,0,0.9460933789271149,0.9460933789271149,Texas,Colorado,3,4,NA,260070251,2006-01-07
157,2,18:59,1139,1139,LaMarcus Aldridge missed Two Point Jumper.,45,27,18,0,0.9460933789271149,0.9460933789271149,Texas,Colorado,3,4,NA,260070251,2006-01-07
158,2,18:59,1139,1139,Daniel Gibson Offensive Rebound.,45,27,18,0,0.9460933789271149,0.9460933789271149,Texas,Colorado,3,4,NA,260070251,2006-01-07
159,2,18:59,1139,1139,Daniel Gibson made Two Point Tip Shot.  Assisted by Jayson Obazuaye.,47,27,20,0,0.9602059760223562,0.9602059760223562,Texas,Colorado,3,4,NA,260070251,2006-01-07
160,2,18:59,1139,1139,Richard Roby missed Two Point Jumper.,47,27,20,0,0.9602059760223562,0.9602059760223562,Texas,Colorado,3,4,NA,260070251,2006-01-07
161,2,18:59,1139,1139,P.J. Tucker Defensive Rebound.,47,27,20,2,0.9602059760223562,0.9602059760223562,Texas,Colorado,3,4,NA,260070251,2006-01-07
162,2,18:57,1137,1137,LaMarcus Aldridge made Two Point Layup.  Assisted by Brad Buckman.,49,27,22,0,0.9708371267140545,0.9708371267140545,Texas,Colorado,3,4,NA,260070251,2006-01-07
163,2,18:57,1137,1137,Foul on Julius Ashby,49,27,22,55,0.9708371267140545,0.9708371267140545,Texas,Colorado,3,4,NA,260070251,2006-01-07
164,2,18:02,1082,1082,LaMarcus Aldridge made Free Throw.,50,27,23,16,0.9773959911688941,0.9773959911688941,Texas,Colorado,3,4,NA,260070251,2006-01-07
165,2,17:46,1066,1066,Martane Freeman made Two Point Layup.,50,29,21,6,0.9697568606534053,0.9697568606534053,Texas,Colorado,3,4,NA,260070251,2006-01-07
166,2,17:40,1060,1060,Daniel Gibson made Three Point Jumper.  Assisted by Kenton Paulino.,53,29,24,27,0.9815797073346562,0.9815797073346562,Texas,Colorado,3,4,NA,260070251,2006-01-07
167,2,17:13,1033,1033,Foul on LaMarcus Aldridge,53,29,24,1,0.982615307908897,0.982615307908897,Texas,Colorado,3,4,NA,260070251,2006-01-07
168,2,17:12,1032,1032,Martane Freeman missed Free Throw.,53,29,24,0,0.9826540599680951,0.9826540599680951,Texas,Colorado,3,4,NA,260070251,2006-01-07
169,2,17:12,1032,1032,Colorado Defensive Rebound.,53,29,24,0,0.9826540599680951,0.9826540599680951,Texas,Colorado,3,4,NA,260070251,2006-01-07
170,2,17:12,1032,1032,Martane Freeman made Free Throw.,53,30,23,1,0.9795416681057466,0.9795416681057466,Texas,Colorado,3,4,NA,260070251,2006-01-07
171,2,17:11,1031,1031,Daniel Gibson made Three Point Jumper.  Assisted by LaMarcus Aldridge.,56,30,26,19,0.9875778568057998,0.9875778568057998,Texas,Colorado,3,4,NA,260070251,2006-01-07
172,2,16:52,1012,1012,Martane Freeman made Two Point Dunk Shot.  Assisted by Richard Roby.,56,32,24,0,0.983436842835655,0.983436842835655,Texas,Colorado,3,4,NA,260070251,2006-01-07
173,2,16:52,1012,1012,Foul on Brad Buckman,56,32,24,1,0.983436842835655,0.983436842835655,Texas,Colorado,3,4,NA,260070251,2006-01-07
174,2,16:51,1011,1011,Martane Freeman made Free Throw.,56,33,23,10,0.9804692550097382,0.9804692550097382,Texas,Colorado,3,4,NA,260070251,2006-01-07
175,2,16:41,1001,1001,Foul on Martane Freeman,56,33,23,7,0.9809189399772315,0.9809189399772315,Texas,Colorado,3,4,NA,260070251,2006-01-07
