play_id,half,time_remaining_half,secs_remaining,secs_remaining_absolute,description,home_score,away_score,score_diff,play_length,win_prob,naive_win_prob,home,away,home_time_out_remaining,away_time_out_remaining,home_favored_by,game_id,date
183,2,19:14,1154,1154,Dartmouth Defensive Rebound.,47,39,8,5,0.7796874655431166,0.7796874655431166,Dartmouth,VMI,3,4,NA,273142678,2007-11-10
184,2,19:09,1149,1149,Foul on J.T. Piribek,47,39,8,8,0.7802332737757088,0.7802332737757088,Dartmouth,VMI,3,4,NA,273142678,2007-11-10
185,2,19:01,1141,1141,DeVon Mosley missed Three Point Jumper.,47,39,8,0,0.7811027027251467,0.7811027027251467,Dartmouth,VMI,3,4,NA,273142678,2007-11-10
186,2,19:01,1141,1141,Alex Barnett Offensive Rebound.,47,39,8,38,0.7811027027251467,0.7811027027251467,Dartmouth,VMI,3,4,NA,273142678,2007-11-10
187,2,18:23,1103,1103,Christian Hunter missed Two Point Jumper.,47,39,8,0,0.7852228515386459,0.7852228515386459,Dartmouth,VMI,3,4,NA,273142678,2007-11-10
188,2,18:23,1103,1103,Alex Barnett Defensive Rebound.,47,39,8,0,0.7852228515386459,0.7852228515386459,Dartmouth,VMI,3,4,NA,273142678,2007-11-10
189,2,18:23,1103,1103,Michael Giovacchini missed Three Point Jumper.,47,39,8,0,0.7852228515386459,0.7852228515386459,Dartmouth,VMI,3,4,NA,273142678,2007-11-10
190,2,18:23,1103,1103,Alex Barnett Offensive Rebound.,47,39,8,1,0.7852228515386459,0.7852228515386459,Dartmouth,VMI,3,4,NA,273142678,2007-11-10
191,2,18:22,1102,1102,Alex Barnett made Two Point Dunk Shot.,49,39,10,0,0.8349700251226577,0.8349700251226577,Dartmouth,VMI,3,4,NA,273142678,2007-11-10
192,2,18:22,1102,1102,Foul on Travis Holmes,49,39,10,35,0.8349700251226577,0.8349700251226577,Dartmouth,VMI,3,4,NA,273142678,2007-11-10
193,2,17:47,1067,1067,Willie Bell Steal.,49,39,10,2,0.8389529858278493,0.8389529858278493,Dartmouth,VMI,3,4,NA,273142678,2007-11-10
194,2,17:45,1065,1065,Christian Hunter made Three Point Jumper.  Assisted by Willie Bell.,49,42,7,16,0.7607018507182527,0.7607018507182527,Dartmouth,VMI,3,4,NA,273142678,2007-11-10
195,2,17:29,1049,1049,DeVon Mosley made Two Point Jumper.,51,42,9,29,0.8175290346018674,0.8175290346018674,Dartmouth,VMI,3,4,NA,273142678,2007-11-10
196,2,17:00,1020,1020,Robby Pride made Three Point Jumper.  Assisted by DeVon Mosley.,54,42,12,9,0.884152731107174,0.884152731107174,Dartmouth,VMI,3,4,NA,273142678,2007-11-10
197,2,16:51,1011,1011,Christian Hunter made Two Point Jumper.,54,44,10,7,0.8458774851026145,0.8458774851026145,Dartmouth,VMI,3,4,NA,273142678,2007-11-10
198,2,16:44,1004,1004,Michael Giovacchini missed Two Point Jumper.,54,44,10,0,0.8468126022434944,0.8468126022434944,Dartmouth,VMI,3,4,NA,273142678,2007-11-10
199,2,16:44,1004,1004,Alex Barnett Offensive Rebound.,54,44,10,3,0.8468126022434944,0.8468126022434944,Dartmouth,VMI,3,4,NA,273142678,2007-11-10
200,2,16:41,1001,1001,Foul on Willie Bell,54,44,10,9,0.8472190056788539,0.8472190056788539,Dartmouth,VMI,3,4,NA,273142678,2007-11-10
201,2,16:32,992,992,Alex Barnett made Free Throw.,55,44,11,19,0.8693047332439535,0.8693047332439535,Dartmouth,VMI,3,4,NA,273142678,2007-11-10
202,2,16:13,973,973,Alex Barnett missed Free Throw.,55,44,11,0,0.8719543922225195,0.8719543922225195,Dartmouth,VMI,3,4,NA,273142678,2007-11-10
203,2,16:13,973,973,Reggie Williams Defensive Rebound.,55,44,11,2,0.8719543922225195,0.8719543922225195,Dartmouth,VMI,3,4,NA,273142678,2007-11-10
204,2,16:11,971,971,Austin Kenon missed Three Point Jumper.,55,44,11,0,0.872241862006061,0.872241862006061,Dartmouth,VMI,3,4,NA,273142678,2007-11-10
205,2,16:11,971,971,Alex Barnett Defensive Rebound.,55,44,11,1,0.872241862006061,0.872241862006061,Dartmouth,VMI,3,4,NA,273142678,2007-11-10
206,2,16:10,970,970,Clive Weeden missed Two Point Jumper.,55,44,11,0,0.872386229113269,0.872386229113269,Dartmouth,VMI,3,4,NA,273142678,2007-11-10
207,2,16:10,970,970,Willie Bell Defensive Rebound.,55,44,11,9,0.872386229113269,0.872386229113269,Dartmouth,VMI,3,4,NA,273142678,2007-11-10
208,2,16:01,961,961,Travis Holmes missed Two Point Layup.,55,44,11,0,0.8736483099454606,0.8736483099454606,Dartmouth,VMI,3,4,NA,273142678,2007-11-10
209,2,16:01,961,961,Reggie Williams Offensive Rebound.,55,44,11,5,0.8736483099454606,0.8736483099454606,Dartmouth,VMI,3,4,NA,273142678,2007-11-10
210,2,15:56,956,956,Reggie Williams made Two Point Layup.,55,46,9,4,0.8301958221310165,0.8301958221310165,Dartmouth,VMI,3,4,NA,273142678,2007-11-10
211,2,15:52,952,952,Official TV Timeout.,55,46,9,2,0.8307422846402072,0.8307422846402072,Dartmouth,VMI,3,4,NA,273142678,2007-11-10
212,2,15:50,950,950,Christian Hunter missed Three Point Jumper.,55,46,9,0,0.8310107012420193,0.8310107012420193,Dartmouth,VMI,3,4,NA,273142678,2007-11-10
213,2,15:50,950,950,Michael Giovacchini Defensive Rebound.,55,46,9,5,0.8310107012420193,0.8310107012420193,Dartmouth,VMI,3,4,NA,273142678,2007-11-10
214,2,15:45,945,945,DeVon Mosley made Two Point Jumper.  Assisted by Michael Giovacchini.,57,46,11,9,0.8757187500777055,0.8757187500777055,Dartmouth,VMI,3,4,NA,273142678,2007-11-10
215,2,15:36,936,936,Foul on Michael Giovacchini,57,46,11,9,0.8768006704042661,0.8768006704042661,Dartmouth,VMI,3,4,NA,273142678,2007-11-10
216,2,15:27,927,927,Austin Kenon missed Three Point Jumper.,57,46,11,0,0.8778332418103765,0.8778332418103765,Dartmouth,VMI,3,4,NA,273142678,2007-11-10
217,2,15:27,927,927,Willie Bell Offensive Rebound.,57,46,11,3,0.8778332418103765,0.8778332418103765,Dartmouth,VMI,3,4,NA,273142678,2007-11-10
218,2,15:24,924,924,Foul on Clive Weeden,57,46,11,5,0.8781678197497252,0.8781678197497252,Dartmouth,VMI,3,4,NA,273142678,2007-11-10
219,2,15:19,919,919,Reggie Williams made Two Point Layup.  Assisted by Christian Hunter.,57,48,9,19,0.834831965250762,0.834831965250762,Dartmouth,VMI,3,4,NA,273142678,2007-11-10
220,2,15:00,900,900,Robby Pride missed Three Point Jumper.,57,48,9,0,0.8369487600025095,0.8369487600025095,Dartmouth,VMI,3,4,NA,273142678,2007-11-10
221,2,15:00,900,900,Willie Bell Defensive Rebound.,57,48,9,11,0.8369487600025095,0.8369487600025095,Dartmouth,VMI,3,4,NA,273142678,2007-11-10
222,2,14:49,889,889,Reggie Williams made Two Point Dunk Shot.,57,50,7,27,0.7822742429725402,0.7822742429725402,Dartmouth,VMI,3,4,NA,273142678,2007-11-10
223,2,14:22,862,862,Adam Powers made Two Point Layup.  Assisted by Michael Giovacchini.,59,50,9,10,0.8409974247045078,0.8409974247045078,Dartmouth,VMI,3,4,NA,273142678,2007-11-10
224,2,14:12,852,852,Foul on Adam Powers,59,50,9,3,0.8420744585285436,0.8420744585285436,Dartmouth,VMI,3,4,NA,273142678,2007-11-10
225,2,14:09,849,849,Foul on Marlon Sanders,59,50,9,0,0.8424016402077507,0.8424016402077507,Dartmouth,VMI,3,4,NA,273142678,2007-11-10
226,2,14:09,849,849,Reggie Williams made Free Throw.,59,51,8,0,0.8160725539666491,0.8160725539666491,Dartmouth,VMI,3,4,NA,273142678,2007-11-10
227,2,14:09,849,849,Reggie Williams made Free Throw.,59,52,7,0,0.786459826787098,0.786459826787098,Dartmouth,VMI,3,4,NA,273142678,2007-11-10
228,2,14:09,849,849,Reggie Williams made Free Throw.,59,53,6,19,0.7535193906375872,0.7535193906375872,Dartmouth,VMI,3,4,NA,273142678,2007-11-10
229,2,13:50,830,830,Foul on Reggie Williams,59,53,6,0,0.7555170882699185,0.7555170882699185,Dartmouth,VMI,3,4,NA,273142678,2007-11-10
230,2,13:50,830,830,DeVon Mosley made Free Throw.,60,53,7,0,0.7885654334114365,0.7885654334114365,Dartmouth,VMI,3,4,NA,273142678,2007-11-10
231,2,13:50,830,830,DeVon Mosley made Free Throw.,61,53,8,8,0.8182212733444644,0.8182212733444644,Dartmouth,VMI,3,4,NA,273142678,2007-11-10
232,2,13:42,822,822,Reggie Williams made Two Point Jumper.,61,55,6,9,0.7564015671916972,0.7564015671916972,Dartmouth,VMI,3,4,NA,273142678,2007-11-10
233,2,13:33,813,813,Adam Powers made Two Point Jumper.  Assisted by Michael Giovacchini.,63,55,8,13,0.8202768862039848,0.8202768862039848,Dartmouth,VMI,3,4,NA,273142678,2007-11-10
234,2,13:20,800,800,Hunter Houston missed Three Point Jumper.,63,55,8,0,0.8219611839325319,0.8219611839325319,Dartmouth,VMI,3,4,NA,273142678,2007-11-10
235,2,13:20,800,800,Chavis Holmes Offensive Rebound.,63,55,8,3,0.8219611839325319,0.8219611839325319,Dartmouth,VMI,3,4,NA,273142678,2007-11-10
236,2,13:17,797,797,Chavis Holmes made Two Point Layup.,63,57,6,5,0.7593912010464099,0.7593912010464099,Dartmouth,VMI,3,4,NA,273142678,2007-11-10
237,2,13:12,792,792,Michael Giovacchini missed Two Point Jumper.,63,57,6,0,0.7600379436279872,0.7600379436279872,Dartmouth,VMI,3,4,NA,273142678,2007-11-10
238,2,13:12,792,792,Chavis Holmes Defensive Rebound.,63,57,6,12,0.7600379436279872,0.7600379436279872,Dartmouth,VMI,3,4,NA,273142678,2007-11-10
239,2,13:00,780,780,Reggie Williams missed Three Point Jumper.,63,57,6,0,0.7616679320107834,0.7616679320107834,Dartmouth,VMI,3,4,NA,273142678,2007-11-10
240,2,13:00,780,780,Christian Hunter Offensive Rebound.,63,57,6,3,0.7616679320107834,0.7616679320107834,Dartmouth,VMI,3,4,NA,273142678,2007-11-10
241,2,12:57,777,777,Christian Hunter made Two Point Layup.,63,59,4,13,0.6848451463252406,0.6848451463252406,Dartmouth,VMI,3,4,NA,273142678,2007-11-10
242,2,12:44,764,764,Dartmouth Full Timeout.,63,59,4,8,0.6863849750448061,0.6863849750448061,Dartmouth,VMI,2,4,NA,273142678,2007-11-10
243,2,12:36,756,756,Michael Giovacchini made Three Point Jumper.  Assisted by DeVon Mosley.,66,59,7,13,0.7988256889076141,0.7988256889076141,Dartmouth,VMI,2,4,NA,273142678,2007-11-10
244,2,12:23,743,743,Foul on Michael Giovacchini,66,59,7,5,0.8011265093789313,0.8011265093789313,Dartmouth,VMI,2,4,NA,273142678,2007-11-10
245,2,12:18,738,738,Foul on Johnathan Ball,66,59,7,6,0.8020610479240263,0.8020610479240263,Dartmouth,VMI,2,4,NA,273142678,2007-11-10
246,2,12:12,732,732,Foul on Adam Powers,66,59,7,0,0.8032205445819257,0.8032205445819257,Dartmouth,VMI,2,4,NA,273142678,2007-11-10
247,2,12:12,732,732,Willie Bell made Free Throw.,66,60,6,0,0.769521380226401,0.769521380226401,Dartmouth,VMI,2,4,NA,273142678,2007-11-10
248,2,12:12,732,732,Willie Bell missed Free Throw.,66,60,6,0,0.769521380226401,0.769521380226401,Dartmouth,VMI,2,4,NA,273142678,2007-11-10
249,2,12:12,732,732,Alex Barnett Defensive Rebound.,66,60,6,20,0.769521380226401,0.769521380226401,Dartmouth,VMI,2,4,NA,273142678,2007-11-10
250,2,11:52,712,712,DeVon Mosley missed Three Point Jumper.,66,60,6,0,0.7731104761343943,0.7731104761343943,Dartmouth,VMI,2,4,NA,273142678,2007-11-10
251,2,11:52,712,712,Virginia Military Defensive Rebo.,66,60,6,2,0.7731104761343943,0.7731104761343943,Dartmouth,VMI,2,4,NA,273142678,2007-11-10
252,2,11:50,710,710,Foul on Alex Barnett,66,60,6,0,0.7734405770647529,0.7734405770647529,Dartmouth,VMI,2,4,NA,273142678,2007-11-10
253,2,11:50,710,710,Official TV Timeout.,66,60,6,0,0.7734405770647529,0.7734405770647529,Dartmouth,VMI,2,4,NA,273142678,2007-11-10
254,2,11:50,710,710,Willie Bell missed Free Throw.,66,60,6,0,0.7734405770647529,0.7734405770647529,Dartmouth,VMI,2,4,NA,273142678,2007-11-10
255,2,11:50,710,710,Alex Barnett Defensive Rebound.,66,60,6,23,0.7734405770647529,0.7734405770647529,Dartmouth,VMI,2,4,NA,273142678,2007-11-10
256,2,11:27,687,687,Alex Barnett missed Two Point Jumper.,66,60,6,0,0.7769598142188859,0.7769598142188859,Dartmouth,VMI,2,4,NA,273142678,2007-11-10
257,2,11:27,687,687,Elgin Fitzgerald Offensive Rebound.,66,60,6,6,0.7769598142188859,0.7769598142188859,Dartmouth,VMI,2,4,NA,273142678,2007-11-10
258,2,11:21,681,681,Elgin Fitzgerald made Two Point Layup.,68,60,8,15,0.8416616185469851,0.8416616185469851,Dartmouth,VMI,2,4,NA,273142678,2007-11-10
259,2,11:06,666,666,Travis Holmes made Two Point Jumper.,68,62,6,17,0.7798976565307123,0.7798976565307123,Dartmouth,VMI,2,4,NA,273142678,2007-11-10
260,2,10:49,649,649,Michael Giovacchini missed Three Point Jumper.,68,62,6,0,0.7822360280749421,0.7822360280749421,Dartmouth,VMI,2,4,NA,273142678,2007-11-10
261,2,10:49,649,649,Chavis Holmes Defensive Rebound.,68,62,6,10,0.7822360280749421,0.7822360280749421,Dartmouth,VMI,2,4,NA,273142678,2007-11-10
262,2,10:39,639,639,Chavis Holmes missed Three Point Jumper.,68,62,6,0,0.7836434730590164,0.7836434730590164,Dartmouth,VMI,2,4,NA,273142678,2007-11-10
263,2,10:39,639,639,Elgin Fitzgerald Defensive Rebound.,68,62,6,7,0.7836434730590164,0.7836434730590164,Dartmouth,VMI,2,4,NA,273142678,2007-11-10
264,2,10:32,632,632,DeVon Mosley made Two Point Jumper.,70,62,8,8,0.8486463893755146,0.8486463893755146,Dartmouth,VMI,2,4,NA,273142678,2007-11-10
265,2,10:24,624,624,Austin Kenon made Two Point Jumper.,70,64,6,26,0.7858563003912632,0.7858563003912632,Dartmouth,VMI,2,4,NA,273142678,2007-11-10
266,2,9:58,598,598,Alex Barnett made Two Point Jumper.  Assisted by Michael Giovacchini.,72,64,8,16,0.8542017187868101,0.8542017187868101,Dartmouth,VMI,2,4,NA,273142678,2007-11-10
267,2,9:42,582,582,Foul on Alex Barnett,72,64,8,0,0.8572811293596847,0.8572811293596847,Dartmouth,VMI,2,4,NA,273142678,2007-11-10
268,2,9:42,582,582,Reggie Williams made Free Throw.,72,65,7,0,0.8276093333677762,0.8276093333677762,Dartmouth,VMI,2,4,NA,273142678,2007-11-10
269,2,9:42,582,582,Reggie Williams missed Free Throw.,72,65,7,0,0.8276093333677762,0.8276093333677762,Dartmouth,VMI,2,4,NA,273142678,2007-11-10
270,2,9:42,582,582,Marlon Sanders Defensive Rebound.,72,65,7,34,0.8276093333677762,0.8276093333677762,Dartmouth,VMI,2,4,NA,273142678,2007-11-10
271,2,9:08,548,548,Elgin Fitzgerald missed Two Point Jumper.,72,65,7,0,0.8357174798071845,0.8357174798071845,Dartmouth,VMI,2,4,NA,273142678,2007-11-10
272,2,9:08,548,548,Reggie Williams Defensive Rebound.,72,65,7,14,0.8357174798071845,0.8357174798071845,Dartmouth,VMI,2,4,NA,273142678,2007-11-10
273,2,8:54,534,534,Christian Hunter Steal.,72,65,7,6,0.8390565489677313,0.8390565489677313,Dartmouth,VMI,2,4,NA,273142678,2007-11-10
274,2,8:48,528,528,Joey Cantafio missed Two Point Jumper.,72,65,7,0,0.8403311928951092,0.8403311928951092,Dartmouth,VMI,2,4,NA,273142678,2007-11-10
275,2,8:48,528,528,Virginia Military Offensive Rebo.,72,65,7,12,0.8403311928951092,0.8403311928951092,Dartmouth,VMI,2,4,NA,273142678,2007-11-10
276,2,8:36,516,516,Foul on Quinn Brownfield,72,65,7,21,0.84269151312955,0.84269151312955,Dartmouth,VMI,2,4,NA,273142678,2007-11-10
277,2,8:15,495,495,Marlon Sanders missed Two Point Jumper.,72,65,7,0,0.8465573231530469,0.8465573231530469,Dartmouth,VMI,2,4,NA,273142678,2007-11-10
278,2,8:15,495,495,Clive Weeden Offensive Rebound.,72,65,7,4,0.8465573231530469,0.8465573231530469,Dartmouth,VMI,2,4,NA,273142678,2007-11-10
279,2,8:11,491,491,Foul on Quinn Brownfield,72,65,7,23,0.8473002748767702,0.8473002748767702,Dartmouth,VMI,2,4,NA,273142678,2007-11-10
280,2,7:48,468,468,Reggie Williams Steal.,72,65,7,4,0.8519528307291913,0.8519528307291913,Dartmouth,VMI,2,4,NA,273142678,2007-11-10
281,2,7:44,464,464,DeVon Mosley Steal.,72,65,7,11,0.8528639609572666,0.8528639609572666,Dartmouth,VMI,2,4,NA,273142678,2007-11-10
282,2,7:33,453,453,Robby Pride missed Three Point Jumper.,72,65,7,0,0.8555880940741384,0.8555880940741384,Dartmouth,VMI,2,4,NA,273142678,2007-11-10
283,2,7:33,453,453,Chavis Holmes Defensive Rebound.,72,65,7,8,0.8555880940741384,0.8555880940741384,Dartmouth,VMI,2,4,NA,273142678,2007-11-10
284,2,7:25,445,445,Reggie Williams missed Three Point Jumper.,72,65,7,0,0.8578023250785641,0.8578023250785641,Dartmouth,VMI,2,4,NA,273142678,2007-11-10
285,2,7:25,445,445,Marlon Sanders Defensive Rebound.,72,65,7,11,0.8578023250785641,0.8578023250785641,Dartmouth,VMI,2,4,NA,273142678,2007-11-10
286,2,7:14,434,434,Elgin Fitzgerald made Two Point Jumper.,74,65,9,13,0.9126961100161282,0.9126961100161282,Dartmouth,VMI,2,4,NA,273142678,2007-11-10
287,2,7:01,421,421,Chavis Holmes missed Two Point Jumper.,74,65,9,0,0.9164100481939543,0.9164100481939543,Dartmouth,VMI,2,4,NA,273142678,2007-11-10
288,2,7:01,421,421,Marlon Sanders Defensive Rebound.,74,65,9,8,0.9164100481939543,0.9164100481939543,Dartmouth,VMI,2,4,NA,273142678,2007-11-10
289,2,6:53,413,413,DeVon Mosley made Two Point Layup.,76,65,11,13,0.9507568812182555,0.9507568812182555,Dartmouth,VMI,2,4,NA,273142678,2007-11-10
290,2,6:40,400,400,Christian Hunter made Three Point Jumper.,76,68,8,14,0.8994784461819401,0.8994784461819401,Dartmouth,VMI,2,4,NA,273142678,2007-11-10
291,2,6:26,386,386,Elgin Fitzgerald made Two Point Layup.,78,68,10,8,0.942152881163108,0.942152881163108,Dartmouth,VMI,2,4,NA,273142678,2007-11-10
292,2,6:18,378,378,Foul on Clive Weeden,78,68,10,0,0.9437633463801727,0.9437633463801727,Dartmouth,VMI,2,4,NA,273142678,2007-11-10
293,2,6:18,378,378,Official TV Timeout.,78,68,10,0,0.9437633463801727,0.9437633463801727,Dartmouth,VMI,2,4,NA,273142678,2007-11-10
294,2,6:18,378,378,Chavis Holmes made Free Throw.,78,69,9,0,0.9267819287641668,0.9267819287641668,Dartmouth,VMI,2,4,NA,273142678,2007-11-10
295,2,6:18,378,378,Chavis Holmes made Free Throw.,78,70,8,32,0.9051878871683064,0.9051878871683064,Dartmouth,VMI,2,4,NA,273142678,2007-11-10
296,2,5:46,346,346,Marlon Sanders missed Three Point Jumper.,78,70,8,0,0.9141823610222503,0.9141823610222503,Dartmouth,VMI,2,4,NA,273142678,2007-11-10
297,2,5:46,346,346,Elgin Fitzgerald Offensive Rebound.,78,70,8,7,0.9141823610222503,0.9141823610222503,Dartmouth,VMI,2,4,NA,273142678,2007-11-10
298,2,5:39,339,339,Elgin Fitzgerald missed Two Point Layup.,78,70,8,0,0.9164013749232114,0.9164013749232114,Dartmouth,VMI,2,4,NA,273142678,2007-11-10
299,2,5:39,339,339,Marlon Sanders Offensive Rebound.,78,70,8,3,0.9164013749232114,0.9164013749232114,Dartmouth,VMI,2,4,NA,273142678,2007-11-10
300,2,5:36,336,336,Marlon Sanders made Two Point Layup.,80,70,10,17,0.952988856680769,0.952988856680769,Dartmouth,VMI,2,4,NA,273142678,2007-11-10
301,2,5:19,319,319,Reggie Williams made Two Point Layup.,80,72,8,0,0.9234162256291648,0.9234162256291648,Dartmouth,VMI,2,4,NA,273142678,2007-11-10
302,2,5:19,319,319,Foul on Marlon Sanders,80,72,8,0,0.9234162256291648,0.9234162256291648,Dartmouth,VMI,2,4,NA,273142678,2007-11-10
303,2,5:19,319,319,Reggie Williams missed Free Throw.,80,72,8,0,0.9234162256291648,0.9234162256291648,Dartmouth,VMI,2,4,NA,273142678,2007-11-10
304,2,5:19,319,319,Elgin Fitzgerald Defensive Rebound.,80,72,8,12,0.9234162256291648,0.9234162256291648,Dartmouth,VMI,2,4,NA,273142678,2007-11-10
305,2,5:07,307,307,Reggie Williams Steal.,80,72,8,2,0.9280153776570887,0.9280153776570887,Dartmouth,VMI,2,4,NA,273142678,2007-11-10
306,2,5:05,305,305,Reggie Williams made Two Point Layup.  Assisted by Willie Bell.,80,74,6,25,0.8726201393681622,0.8726201393681622,Dartmouth,VMI,2,4,NA,273142678,2007-11-10
307,2,4:40,280,280,Elgin Fitzgerald missed Two Point Jumper.,80,74,6,0,0.8748961187015603,0.8748961187015603,Dartmouth,VMI,2,4,NA,273142678,2007-11-10
308,2,4:40,280,280,Austin Kenon Defensive Rebound.,80,74,6,17,0.8748961187015603,0.8748961187015603,Dartmouth,VMI,2,4,NA,273142678,2007-11-10
309,2,4:23,263,263,Travis Holmes made Two Point Layup.,80,76,4,20,0.7823016929504202,0.7823016929504202,Dartmouth,VMI,2,4,NA,273142678,2007-11-10
310,2,4:03,243,243,Robby Pride made Three Point Jumper.  Assisted by Elgin Fitzgerald.,83,76,7,13,0.9005049702271387,0.9005049702271387,Dartmouth,VMI,2,4,NA,273142678,2007-11-10
311,2,3:50,230,230,Willie Bell missed Two Point Layup.,83,76,7,0,0.9005104063934649,0.9005104063934649,Dartmouth,VMI,2,4,NA,273142678,2007-11-10
312,2,3:50,230,230,Elgin Fitzgerald Defensive Rebound.,83,76,7,1,0.9005104063934649,0.9005104063934649,Dartmouth,VMI,2,4,NA,273142678,2007-11-10
313,2,3:49,229,229,Elgin Fitzgerald missed Free Throw.,83,76,7,0,0.9006243361931183,0.9006243361931183,Dartmouth,VMI,2,4,NA,273142678,2007-11-10
314,2,3:49,229,229,Foul on Willie Bell,83,76,7,0,0.9006243361931183,0.9006243361931183,Dartmouth,VMI,2,4,NA,273142678,2007-11-10
315,2,3:49,229,229,Elgin Fitzgerald made Free Throw.,84,76,8,0,0.925467515883006,0.925467515883006,Dartmouth,VMI,2,4,NA,273142678,2007-11-10
316,2,3:49,229,229,Official TV Timeout.,84,76,8,1,0.925467515883006,0.925467515883006,Dartmouth,VMI,2,4,NA,273142678,2007-11-10
317,2,3:48,228,228,Reggie Williams Defensive Rebound.,84,76,8,4,0.9255845379375671,0.9255845379375671,Dartmouth,VMI,2,4,NA,273142678,2007-11-10
318,2,3:44,224,224,Reggie Williams made Two Point Dunk Shot.,84,78,6,22,0.8696199224542785,0.8696199224542785,Dartmouth,VMI,2,4,NA,273142678,2007-11-10
319,2,3:22,202,202,Elgin Fitzgerald missed Two Point Jumper.,84,78,6,0,0.8814125469920588,0.8814125469920588,Dartmouth,VMI,2,4,NA,273142678,2007-11-10
320,2,3:22,202,202,Willie Bell Defensive Rebound.,84,78,6,9,0.8814125469920588,0.8814125469920588,Dartmouth,VMI,2,4,NA,273142678,2007-11-10
321,2,3:13,193,193,Reggie Williams missed Three Point Jumper.,84,78,6,0,0.8902290815573519,0.8902290815573519,Dartmouth,VMI,2,4,NA,273142678,2007-11-10
322,2,3:13,193,193,Robby Pride Defensive Rebound.,84,78,6,7,0.8902290815573519,0.8902290815573519,Dartmouth,VMI,2,4,NA,273142678,2007-11-10
323,2,3:06,186,186,Robby Pride made Free Throw.,85,78,7,0,0.927035731304426,0.927035731304426,Dartmouth,VMI,2,4,NA,273142678,2007-11-10
324,2,3:06,186,186,Foul on Willie Bell,85,78,7,0,0.927035731304426,0.927035731304426,Dartmouth,VMI,2,4,NA,273142678,2007-11-10
325,2,3:06,186,186,Robby Pride made Free Throw.,86,78,8,10,0.9481013336592419,0.9481013336592419,Dartmouth,VMI,2,4,NA,273142678,2007-11-10
326,2,2:56,176,176,Reggie Williams missed Two Point Layup.,86,78,8,0,0.955814163328126,0.955814163328126,Dartmouth,VMI,2,4,NA,273142678,2007-11-10
327,2,2:56,176,176,Reggie Williams Offensive Rebound.,86,78,8,1,0.955814163328126,0.955814163328126,Dartmouth,VMI,2,4,NA,273142678,2007-11-10
328,2,2:55,175,175,Foul on Johnathan Ball,86,78,8,0,0.9565338941080012,0.9565338941080012,Dartmouth,VMI,2,4,NA,273142678,2007-11-10
329,2,2:55,175,175,Reggie Williams made Free Throw.,86,79,7,0,0.9373162161305812,0.9373162161305812,Dartmouth,VMI,2,4,NA,273142678,2007-11-10
330,2,2:55,175,175,Reggie Williams missed Free Throw.,86,79,7,0,0.9373162161305812,0.9373162161305812,Dartmouth,VMI,2,4,NA,273142678,2007-11-10
331,2,2:55,175,175,Alex Barnett Defensive Rebound.,86,79,7,6,0.9373162161305812,0.9373162161305812,Dartmouth,VMI,2,4,NA,273142678,2007-11-10
332,2,2:49,169,169,Reggie Williams Steal.,86,79,7,1,0.9424826347071724,0.9424826347071724,Dartmouth,VMI,2,4,NA,273142678,2007-11-10
333,2,2:48,168,168,Reggie Williams missed Two Point Layup.,86,79,7,0,0.9433175817533558,0.9433175817533558,Dartmouth,VMI,2,4,NA,273142678,2007-11-10
334,2,2:48,168,168,Austin Kenon Offensive Rebound.,86,79,7,0,0.9433175817533558,0.9433175817533558,Dartmouth,VMI,2,4,NA,273142678,2007-11-10
335,2,2:48,168,168,Foul on Michael Giovacchini,86,79,7,0,0.9433175817533558,0.9433175817533558,Dartmouth,VMI,2,4,NA,273142678,2007-11-10
336,2,2:48,168,168,Austin Kenon made Free Throw.,86,80,6,0,0.9176043274925769,0.9176043274925769,Dartmouth,VMI,2,4,NA,273142678,2007-11-10
337,2,2:48,168,168,Austin Kenon made Free Throw.,86,81,5,32,0.8816895391139155,0.8816895391139155,Dartmouth,VMI,2,4,NA,273142678,2007-11-10
338,2,2:16,136,136,DeVon Mosley made Three Point Jumper.,89,81,8,20,0.9792144360363656,0.9792144360363656,Dartmouth,VMI,2,4,NA,273142678,2007-11-10
339,2,1:56,116,116,Willie Bell made Two Point Layup.  Assisted by Travis Holmes.,89,83,6,1,0.9633637244391814,0.9633637244391814,Dartmouth,VMI,2,4,NA,273142678,2007-11-10
340,2,1:55,115,115,Virginia Military 20 Second Timeout.,89,83,6,7,0.9641041509903427,0.9641041509903427,Dartmouth,VMI,2,3,NA,273142678,2007-11-10
341,2,1:48,108,108,DeVon Mosley missed Two Point Layup.,89,83,6,0,0.9690962598333681,0.9690962598333681,Dartmouth,VMI,2,3,NA,273142678,2007-11-10
342,2,1:48,108,108,Robby Pride Offensive Rebound.,89,83,6,9,0.9690962598333681,0.9690962598333681,Dartmouth,VMI,2,3,NA,273142678,2007-11-10
343,2,1:39,99,99,Foul on Willie Bell,89,83,6,0,0.974983386562986,0.974983386562986,Dartmouth,VMI,2,3,NA,273142678,2007-11-10
344,2,1:39,99,99,Alex Barnett missed Free Throw.,89,83,6,0,0.974983386562986,0.974983386562986,Dartmouth,VMI,2,3,NA,273142678,2007-11-10
345,2,1:39,99,99,Travis Holmes Defensive Rebound.,89,83,6,9,0.974983386562986,0.974983386562986,Dartmouth,VMI,2,3,NA,273142678,2007-11-10
346,2,1:30,90,90,Alex Barnett Steal.,89,83,6,0,0.9801552346518647,0.9801552346518647,Dartmouth,VMI,2,3,NA,273142678,2007-11-10
347,2,1:30,90,90,Foul on Travis Holmes,89,83,6,0,0.9801552346518647,0.9801552346518647,Dartmouth,VMI,2,3,NA,273142678,2007-11-10
348,2,1:30,90,90,Marlon Sanders made Free Throw.,90,83,7,0,0.9895405253120368,0.9895405253120368,Dartmouth,VMI,2,3,NA,273142678,2007-11-10
349,2,1:30,90,90,Marlon Sanders missed Free Throw.,90,83,7,0,0.9895405253120368,0.9895405253120368,Dartmouth,VMI,2,3,NA,273142678,2007-11-10
350,2,1:30,90,90,Marlon Sanders Offensive Rebound.,90,83,7,8,0.9895405253120368,0.9895405253120368,Dartmouth,VMI,2,3,NA,273142678,2007-11-10
351,2,1:22,82,82,Alex Barnett made Two Point Layup.  Assisted by Michael Giovacchini.,92,83,9,10,0.9979276100436592,0.9979276100436592,Dartmouth,VMI,2,3,NA,273142678,2007-11-10
352,2,1:12,72,72,Christian Hunter missed Three Point Jumper.,92,83,9,0,0.998655785666953,0.998655785666953,Dartmouth,VMI,2,3,NA,273142678,2007-11-10
353,2,1:12,72,72,DeVon Mosley Defensive Rebound.,92,83,9,5,0.998655785666953,0.998655785666953,Dartmouth,VMI,2,3,NA,273142678,2007-11-10
354,2,1:07,67,67,Foul on Reggie Williams,92,83,9,0,0.9989311956882677,0.9989311956882677,Dartmouth,VMI,2,3,NA,273142678,2007-11-10
355,2,1:07,67,67,DeVon Mosley made Free Throw.,93,83,10,0,0.9994998796257678,0.9994998796257678,Dartmouth,VMI,2,3,NA,273142678,2007-11-10
356,2,1:07,67,67,DeVon Mosley made Free Throw.,94,83,11,0,0.9997660519835996,0.9997660519835996,Dartmouth,VMI,2,3,NA,273142678,2007-11-10
357,2,1:07,67,67,Dartmouth 20 Second Timeout.,94,83,11,10,0.9997660519835996,0.9997660519835996,Dartmouth,VMI,1,3,NA,273142678,2007-11-10
358,2,0:57,57,57,Travis Holmes missed Three Point Jumper.,94,83,11,0,0.9998692143181528,0.9998692143181528,Dartmouth,VMI,1,3,NA,273142678,2007-11-10
359,2,0:57,57,57,Dartmouth Defensive Rebound.,94,83,11,4,0.9998692143181528,0.9998692143181528,Dartmouth,VMI,1,3,NA,273142678,2007-11-10
