play_id,half,time_remaining_half,secs_remaining,secs_remaining_absolute,description,home_score,away_score,score_diff,play_length,win_prob,naive_win_prob,home,away,home_time_out_remaining,away_time_out_remaining,home_favored_by,game_id,date
1,1,20:00,2400,2400,PLAY,0,0,0,13,0.5,0.5,Dartmouth,VMI,4,4,NA,273142678,2007-11-10
2,1,19:47,2387,2387,Alex Barnett missed Two Point Jumper.,0,0,0,0,0.5,0.5,Dartmouth,VMI,4,4,NA,273142678,2007-11-10
3,1,19:47,2387,2387,Johnathan Ball Offensive Rebound.,0,0,0,5,0.5,0.5,Dartmouth,VMI,4,4,NA,273142678,2007-11-10
4,1,19:42,2382,2382,Johnathan Ball made Two Point Jumper.,2,0,2,17,0.5444053698559008,0.5444053698559008,Dartmouth,VMI,4,4,NA,273142678,2007-11-10
5,1,19:25,2365,2365,Travis Holmes missed Two Point Jumper.,2,0,2,0,0.5447677378565356,0.5447677378565356,Dartmouth,VMI,4,4,NA,273142678,2007-11-10
6,1,19:25,2365,2365,Alex Barnett Defensive Rebound.,2,0,2,13,0.5447677378565356,0.5447677378565356,Dartmouth,VMI,4,4,NA,273142678,2007-11-10
7,1,19:12,2352,2352,Marlon Sanders missed Two Point Layup.,2,0,2,0,0.5450475200660853,0.5450475200660853,Dartmouth,VMI,4,4,NA,273142678,2007-11-10
8,1,19:12,2352,2352,Marlon Sanders Offensive Rebound.,2,0,2,3,0.5450475200660853,0.5450475200660853,Dartmouth,VMI,4,4,NA,273142678,2007-11-10
9,1,19:09,2349,2349,Foul on Travis Holmes,2,0,2,0,0.5451124007901187,0.5451124007901187,Dartmouth,VMI,4,4,NA,273142678,2007-11-10
10,1,19:09,2349,2349,Marlon Sanders missed Free Throw.,2,0,2,0,0.5451124007901187,0.5451124007901187,Dartmouth,VMI,4,4,NA,273142678,2007-11-10
11,1,19:09,2349,2349,null,2,0,2,0,0.5451124007901187,0.5451124007901187,Dartmouth,VMI,4,4,NA,273142678,2007-11-10
12,1,19:09,2349,2349,Marlon Sanders made Free Throw.,3,0,3,4,0.5674396361560966,0.5674396361560966,Dartmouth,VMI,4,4,NA,273142678,2007-11-10
13,1,19:05,2345,2345,Travis Holmes missed Two Point Jumper.,3,0,3,0,0.5675683460752833,0.5675683460752833,Dartmouth,VMI,4,4,NA,273142678,2007-11-10
14,1,19:05,2345,2345,Dartmouth Defensive Rebound.,3,0,3,2,0.5675683460752833,0.5675683460752833,Dartmouth,VMI,4,4,NA,273142678,2007-11-10
15,1,19:03,2343,2343,Foul on Quinn Brownfield,3,0,3,4,0.5676328117471199,0.5676328117471199,Dartmouth,VMI,4,4,NA,273142678,2007-11-10
16,1,18:59,2339,2339,DeVon Mosley made Two Point Jumper.,5,0,5,14,0.611718827180813,0.611718827180813,Dartmouth,VMI,4,4,NA,273142678,2007-11-10
17,1,18:45,2325,2325,Chavis Holmes missed Two Point Jumper.,5,0,5,0,0.6124514094550819,0.6124514094550819,Dartmouth,VMI,4,4,NA,273142678,2007-11-10
18,1,18:45,2325,2325,Virginia Military Offensive Rebo.,5,0,5,16,0.6124514094550819,0.6124514094550819,Dartmouth,VMI,4,4,NA,273142678,2007-11-10
19,1,18:29,2309,2309,Christian Hunter missed Three Point Jumper.,5,0,5,0,0.6132947364032567,0.6132947364032567,Dartmouth,VMI,4,4,NA,273142678,2007-11-10
20,1,18:29,2309,2309,Alex Barnett Defensive Rebound.,5,0,5,7,0.6132947364032567,0.6132947364032567,Dartmouth,VMI,4,4,NA,273142678,2007-11-10
21,1,18:22,2302,2302,Foul on Quinn Brownfield,5,0,5,0,0.6136656052935398,0.6136656052935398,Dartmouth,VMI,4,4,NA,273142678,2007-11-10
22,1,18:22,2302,2302,DeVon Mosley made Free Throw.,6,0,6,0,0.6353634824231277,0.6353634824231277,Dartmouth,VMI,4,4,NA,273142678,2007-11-10
23,1,18:22,2302,2302,DeVon Mosley made Free Throw.,7,0,7,9,0.6565248106957076,0.6565248106957076,Dartmouth,VMI,4,4,NA,273142678,2007-11-10
24,1,18:13,2293,2293,Foul on Johnathan Ball,7,0,7,7,0.6571617776549756,0.6571617776549756,Dartmouth,VMI,4,4,NA,273142678,2007-11-10
25,1,18:06,2286,2286,J.T. Piribek made Two Point Jumper.,7,2,5,32,0.6145173679655145,0.6145173679655145,Dartmouth,VMI,4,4,NA,273142678,2007-11-10
26,1,17:34,2254,2254,Michael Giovacchini missed Three Point Jumper.,7,2,5,0,0.6162360237068002,0.6162360237068002,Dartmouth,VMI,4,4,NA,273142678,2007-11-10
27,1,17:34,2254,2254,Chavis Holmes Defensive Rebound.,7,2,5,13,0.6162360237068002,0.6162360237068002,Dartmouth,VMI,4,4,NA,273142678,2007-11-10
28,1,17:21,2241,2241,Chavis Holmes made Two Point Layup.  Assisted by Christian Hunter.,7,4,3,15,0.5710033843260475,0.5710033843260475,Dartmouth,VMI,4,4,NA,273142678,2007-11-10
29,1,17:06,2226,2226,Foul on Willie Bell,7,4,3,0,0.5715100212274645,0.5715100212274645,Dartmouth,VMI,4,4,NA,273142678,2007-11-10
30,1,17:06,2226,2226,Alex Barnett made Free Throw.,8,4,4,0,0.5948422040029784,0.5948422040029784,Dartmouth,VMI,4,4,NA,273142678,2007-11-10
31,1,17:06,2226,2226,Alex Barnett made Free Throw.,9,4,5,30,0.6177536470971274,0.6177536470971274,Dartmouth,VMI,4,4,NA,273142678,2007-11-10
32,1,16:36,2196,2196,Chavis Holmes missed Two Point Jumper.,9,4,5,0,0.6193906086965474,0.6193906086965474,Dartmouth,VMI,4,4,NA,273142678,2007-11-10
33,1,16:36,2196,2196,Virginia Military Offensive Rebo.,9,4,5,14,0.6193906086965474,0.6193906086965474,Dartmouth,VMI,4,4,NA,273142678,2007-11-10
34,1,16:22,2182,2182,Hunter Houston missed Three Point Jumper.,9,4,5,0,0.620157450118268,0.620157450118268,Dartmouth,VMI,4,4,NA,273142678,2007-11-10
35,1,16:22,2182,2182,Willie Bell Offensive Rebound.,9,4,5,4,0.620157450118268,0.620157450118268,Dartmouth,VMI,4,4,NA,273142678,2007-11-10
36,1,16:18,2178,2178,Willie Bell made Two Point Jumper.,9,6,3,17,0.5731436279598284,0.5731436279598284,Dartmouth,VMI,4,4,NA,273142678,2007-11-10
37,1,16:01,2161,2161,Marlon Sanders missed Three Point Jumper.,9,6,3,0,0.5737258080799493,0.5737258080799493,Dartmouth,VMI,4,4,NA,273142678,2007-11-10
38,1,16:01,2161,2161,Hunter Houston Defensive Rebound.,9,6,3,11,0.5737258080799493,0.5737258080799493,Dartmouth,VMI,4,4,NA,273142678,2007-11-10
39,1,15:50,2150,2150,Austin Kenon made Three Point Jumper.  Assisted by Chavis Holmes.,9,9,0,7,0.5,0.5,Dartmouth,VMI,4,4,NA,273142678,2007-11-10
40,1,15:43,2143,2143,Dartmouth 20 Second Timeout.,9,9,0,5,0.5,0.5,Dartmouth,VMI,3,4,NA,273142678,2007-11-10
41,1,15:38,2138,2138,Alex Barnett missed Two Point Layup.,9,9,0,1,0.5,0.5,Dartmouth,VMI,3,4,NA,273142678,2007-11-10
42,1,15:37,2137,2137,Dartmouth Offensive Rebound.,9,9,0,10,0.5,0.5,Dartmouth,VMI,3,4,NA,273142678,2007-11-10
43,1,15:27,2127,2127,Marlon Sanders missed Two Point Jumper.,9,9,0,0,0.5,0.5,Dartmouth,VMI,3,4,NA,273142678,2007-11-10
44,1,15:27,2127,2127,Austin Kenon Defensive Rebound.,9,9,0,23,0.5,0.5,Dartmouth,VMI,3,4,NA,273142678,2007-11-10
45,1,15:04,2104,2104,Marlon Sanders made Two Point Layup.,11,9,2,6,0.5506838603985946,0.5506838603985946,Dartmouth,VMI,3,4,NA,273142678,2007-11-10
46,1,14:58,2098,2098,Willie Bell made Two Point Layup.,11,11,0,7,0.5,0.5,Dartmouth,VMI,3,4,NA,273142678,2007-11-10
47,1,14:51,2091,2091,Travis Holmes Steal.,11,11,0,2,0.5,0.5,Dartmouth,VMI,3,4,NA,273142678,2007-11-10
48,1,14:49,2089,2089,Dartmouth 20 Second Timeout.,11,11,0,15,0.5,0.5,Dartmouth,VMI,2,4,NA,273142678,2007-11-10
49,1,14:34,2074,2074,Adam Powers missed Two Point Jumper.,11,11,0,0,0.5,0.5,Dartmouth,VMI,2,4,NA,273142678,2007-11-10
50,1,14:34,2074,2074,Alex Barnett Offensive Rebound.,11,11,0,5,0.5,0.5,Dartmouth,VMI,2,4,NA,273142678,2007-11-10
51,1,14:29,2069,2069,Alex Barnett made Two Point Jumper.,13,11,2,10,0.5515175137260641,0.5515175137260641,Dartmouth,VMI,2,4,NA,273142678,2007-11-10
52,1,14:19,2059,2059,Willie Bell made Three Point Jumper.  Assisted by Christian Hunter.,13,14,-1,13,0.4740512874837421,0.4740512874837421,Dartmouth,VMI,2,4,NA,273142678,2007-11-10
53,1,14:06,2046,2046,DeVon Mosley missed Three Point Jumper.,13,14,-1,0,0.4738928543211952,0.4738928543211952,Dartmouth,VMI,2,4,NA,273142678,2007-11-10
54,1,14:06,2046,2046,Virginia Military Defensive Rebo.,13,14,-1,2,0.4738928543211952,0.4738928543211952,Dartmouth,VMI,2,4,NA,273142678,2007-11-10
55,1,14:04,2044,2044,Austin Kenon missed Three Point Jumper.,13,14,-1,0,0.4738683935375802,0.4738683935375802,Dartmouth,VMI,2,4,NA,273142678,2007-11-10
56,1,14:04,2044,2044,Adam Powers Defensive Rebound.,13,14,-1,3,0.4738683935375802,0.4738683935375802,Dartmouth,VMI,2,4,NA,273142678,2007-11-10
57,1,14:01,2041,2041,Alex Barnett made Two Point Jumper.  Assisted by Marlon Sanders.,15,14,1,12,0.5261683416298986,0.5261683416298986,Dartmouth,VMI,2,4,NA,273142678,2007-11-10
58,1,13:49,2029,2029,Travis Holmes missed Two Point Layup.,15,14,1,6,0.5263158188916903,0.5263158188916903,Dartmouth,VMI,2,4,NA,273142678,2007-11-10
59,1,13:43,2023,2023,Robby Pride Defensive Rebound.,15,14,1,2,0.5263898859159339,0.5263898859159339,Dartmouth,VMI,2,4,NA,273142678,2007-11-10
60,1,13:41,2021,2021,Foul on Joey Cantafio,15,14,1,0,0.5264146244831973,0.5264146244831973,Dartmouth,VMI,2,4,NA,273142678,2007-11-10
61,1,13:41,2021,2021,Foul on Marlon Sanders,15,14,1,49,0.5264146244831973,0.5264146244831973,Dartmouth,VMI,2,4,NA,273142678,2007-11-10
62,1,12:52,1972,1972,Foul on Adam Powers,15,14,1,0,0.5270288641252185,0.5270288641252185,Dartmouth,VMI,2,4,NA,273142678,2007-11-10
63,1,12:52,1972,1972,Willie Bell made Free Throw.,15,15,0,0,0.5,0.5,Dartmouth,VMI,2,4,NA,273142678,2007-11-10
64,1,12:52,1972,1972,Willie Bell missed Free Throw.,15,15,0,0,0.5,0.5,Dartmouth,VMI,2,4,NA,273142678,2007-11-10
65,1,12:52,1972,1972,Chavis Holmes Offensive Rebound.,15,15,0,14,0.5,0.5,Dartmouth,VMI,2,4,NA,273142678,2007-11-10
66,1,12:38,1958,1958,Brandon Ware Steal.,15,15,0,4,0.5,0.5,Dartmouth,VMI,2,4,NA,273142678,2007-11-10
67,1,12:34,1954,1954,Robby Pride missed Three Point Jumper.,15,15,0,0,0.5,0.5,Dartmouth,VMI,2,4,NA,273142678,2007-11-10
68,1,12:34,1954,1954,Clive Weeden Offensive Rebound.,15,15,0,5,0.5,0.5,Dartmouth,VMI,2,4,NA,273142678,2007-11-10
69,1,12:29,1949,1949,Clive Weeden made Two Point Layup.,17,15,2,12,0.5544831552342676,0.5544831552342676,Dartmouth,VMI,2,4,NA,273142678,2007-11-10
70,1,12:17,1937,1937,J.T. Piribek missed Two Point Layup.,17,15,2,0,0.5547903374866949,0.5547903374866949,Dartmouth,VMI,2,4,NA,273142678,2007-11-10
71,1,12:17,1937,1937,Austin Kenon Offensive Rebound.,17,15,2,2,0.5547903374866949,0.5547903374866949,Dartmouth,VMI,2,4,NA,273142678,2007-11-10
72,1,12:15,1935,1935,Willie Bell missed Two Point Jumper.,17,15,2,0,0.5548417430415424,0.5548417430415424,Dartmouth,VMI,2,4,NA,273142678,2007-11-10
73,1,12:15,1935,1935,Clive Weeden Defensive Rebound.,17,15,2,9,0.5548417430415424,0.5548417430415424,Dartmouth,VMI,2,4,NA,273142678,2007-11-10
74,1,12:06,1926,1926,Joey Cantafio Steal.,17,15,2,0,0.5550736534985536,0.5550736534985536,Dartmouth,VMI,2,4,NA,273142678,2007-11-10
75,1,12:06,1926,1926,Foul on Adam Powers,17,15,2,8,0.5550736534985536,0.5550736534985536,Dartmouth,VMI,2,4,NA,273142678,2007-11-10
76,1,11:58,1918,1918,Christian Hunter missed Three Point Jumper.,17,15,2,0,0.5552796947367151,0.5552796947367151,Dartmouth,VMI,2,4,NA,273142678,2007-11-10
77,1,11:58,1918,1918,Dartmouth Defensive Rebound.,17,15,2,7,0.5552796947367151,0.5552796947367151,Dartmouth,VMI,2,4,NA,273142678,2007-11-10
78,1,11:51,1911,1911,Official TV Timeout.,17,15,2,10,0.555459787815079,0.555459787815079,Dartmouth,VMI,2,4,NA,273142678,2007-11-10
79,1,11:41,1901,1901,Hunter Houston missed Three Point Jumper.,17,15,2,0,0.5557168601555263,0.5557168601555263,Dartmouth,VMI,2,4,NA,273142678,2007-11-10
80,1,11:41,1901,1901,Alex Barnett Defensive Rebound.,17,15,2,9,0.5557168601555263,0.5557168601555263,Dartmouth,VMI,2,4,NA,273142678,2007-11-10
81,1,11:32,1892,1892,Foul on Hunter Houston,17,15,2,14,0.5559481345600445,0.5559481345600445,Dartmouth,VMI,2,4,NA,273142678,2007-11-10
82,1,11:18,1878,1878,Alex Barnett made Two Point Jumper.  Assisted by Robby Pride.,19,15,4,11,0.6112056422928742,0.6112056422928742,Dartmouth,VMI,2,4,NA,273142678,2007-11-10
83,1,11:07,1867,1867,Travis Holmes made Two Point Jumper.,19,17,2,12,0.5565910708502205,0.5565910708502205,Dartmouth,VMI,2,4,NA,273142678,2007-11-10
84,1,10:55,1855,1855,Robby Pride made Two Point Layup.  Assisted by Michael Giovacchini.,21,17,4,0,0.6123459826550677,0.6123459826550677,Dartmouth,VMI,2,4,NA,273142678,2007-11-10
85,1,10:55,1855,1855,Foul on J.T. Piribek,21,17,4,0,0.6123459826550677,0.6123459826550677,Dartmouth,VMI,2,4,NA,273142678,2007-11-10
86,1,10:55,1855,1855,Robby Pride missed Free Throw.,21,17,4,0,0.6123459826550677,0.6123459826550677,Dartmouth,VMI,2,4,NA,273142678,2007-11-10
87,1,10:55,1855,1855,Alex Barnett Offensive Rebound.,21,17,4,0,0.6123459826550677,0.6123459826550677,Dartmouth,VMI,2,4,NA,273142678,2007-11-10
88,1,10:55,1855,1855,Johnathan Ball made Two Point Jumper.  Assisted by Michael Giovacchini.,23,17,6,0,0.6650266926222506,0.6650266926222506,Dartmouth,VMI,2,4,NA,273142678,2007-11-10
89,1,10:55,1855,1855,Foul on Robby Pride,23,17,6,12,0.6650266926222506,0.6650266926222506,Dartmouth,VMI,2,4,NA,273142678,2007-11-10
90,1,10:43,1843,1843,Chavis Holmes missed Two Point Layup.,23,17,6,0,0.665866522330796,0.665866522330796,Dartmouth,VMI,2,4,NA,273142678,2007-11-10
91,1,10:43,1843,1843,Michael Giovacchini Defensive Rebound.,23,17,6,3,0.665866522330796,0.665866522330796,Dartmouth,VMI,2,4,NA,273142678,2007-11-10
92,1,10:40,1840,1840,Robby Pride missed Two Point Layup.,23,17,6,2,0.6660767872441826,0.6660767872441826,Dartmouth,VMI,2,4,NA,273142678,2007-11-10
93,1,10:38,1838,1838,Christian Hunter Defensive Rebound.,23,17,6,2,0.6662170437134195,0.6662170437134195,Dartmouth,VMI,2,4,NA,273142678,2007-11-10
94,1,10:36,1836,1836,Travis Holmes missed Three Point Jumper.,23,17,6,0,0.66635736786108,0.66635736786108,Dartmouth,VMI,2,4,NA,273142678,2007-11-10
95,1,10:36,1836,1836,Virginia Military Offensive Rebo.,23,17,6,32,0.66635736786108,0.66635736786108,Dartmouth,VMI,2,4,NA,273142678,2007-11-10
96,1,10:04,1804,1804,Foul on Alex Barnett,23,17,6,0,0.6686143978318136,0.6686143978318136,Dartmouth,VMI,2,4,NA,273142678,2007-11-10
97,1,10:04,1804,1804,Travis Holmes made Free Throw.,23,18,5,0,0.642202703114832,0.642202703114832,Dartmouth,VMI,2,4,NA,273142678,2007-11-10
98,1,10:04,1804,1804,Travis Holmes made Free Throw.,23,19,4,14,0.6148984104962276,0.6148984104962276,Dartmouth,VMI,2,4,NA,273142678,2007-11-10
99,1,9:50,1790,1790,Travis Holmes missed Three Point Jumper.,23,19,4,0,0.6156087230631022,0.6156087230631022,Dartmouth,VMI,2,4,NA,273142678,2007-11-10
100,1,9:50,1790,1790,Willie Bell Offensive Rebound.,23,19,4,19,0.6156087230631022,0.6156087230631022,Dartmouth,VMI,2,4,NA,273142678,2007-11-10
101,1,9:31,1771,1771,Alex Barnett Steal.,23,19,4,0,0.616581912987886,0.616581912987886,Dartmouth,VMI,2,4,NA,273142678,2007-11-10
102,1,9:31,1771,1771,Alex Barnett made Two Point Layup.,25,19,6,35,0.6709749166385175,0.6709749166385175,Dartmouth,VMI,2,4,NA,273142678,2007-11-10
103,1,8:56,1736,1736,Willie Bell Steal.,25,19,6,0,0.6735307765102028,0.6735307765102028,Dartmouth,VMI,2,4,NA,273142678,2007-11-10
104,1,8:56,1736,1736,Virginia Military 20 Second Timeout.,25,19,6,12,0.6735307765102028,0.6735307765102028,Dartmouth,VMI,2,3,NA,273142678,2007-11-10
105,1,8:44,1724,1724,Willie Bell made Two Point Layup.,25,21,4,10,0.6190466822901606,0.6190466822901606,Dartmouth,VMI,2,3,NA,273142678,2007-11-10
106,1,8:34,1714,1714,Johnathan Ball made Two Point Layup.  Assisted by Marlon Sanders.,27,21,6,10,0.6751721947828667,0.6751721947828667,Dartmouth,VMI,2,3,NA,273142678,2007-11-10
107,1,8:24,1704,1704,Foul on Alex Barnett,27,21,6,0,0.675928567494425,0.675928567494425,Dartmouth,VMI,2,3,NA,273142678,2007-11-10
108,1,8:24,1704,1704,Chavis Holmes made Free Throw.,27,22,5,0,0.648534322061711,0.648534322061711,Dartmouth,VMI,2,3,NA,273142678,2007-11-10
109,1,8:24,1704,1704,Chavis Holmes made Free Throw.,27,23,4,33,0.6201258181825495,0.6201258181825495,Dartmouth,VMI,2,3,NA,273142678,2007-11-10
110,1,7:51,1671,1671,Michael Giovacchini made Three Point Jumper.  Assisted by Marlon Sanders.,30,23,7,11,0.7049627963854463,0.7049627963854463,Dartmouth,VMI,2,3,NA,273142678,2007-11-10
111,1,7:40,1660,1660,Marlon Sanders Steal.,30,23,7,6,0.7058695395055339,0.7058695395055339,Dartmouth,VMI,2,3,NA,273142678,2007-11-10
112,1,7:34,1654,1654,Marlon Sanders made Two Point Layup.,32,23,9,21,0.7555719007423372,0.7555719007423372,Dartmouth,VMI,2,3,NA,273142678,2007-11-10
113,1,7:13,1633,1633,Willie Bell made Two Point Jumper.  Assisted by Christian Hunter.,32,25,7,16,0.7080460679096371,0.7080460679096371,Dartmouth,VMI,2,3,NA,273142678,2007-11-10
114,1,6:57,1617,1617,DeVon Mosley missed Two Point Layup.,32,25,7,2,0.709313012793206,0.709313012793206,Dartmouth,VMI,2,3,NA,273142678,2007-11-10
115,1,6:55,1615,1615,Austin Kenon Defensive Rebound.,32,25,7,11,0.7094706210984119,0.7094706210984119,Dartmouth,VMI,2,3,NA,273142678,2007-11-10
116,1,6:44,1604,1604,DeVon Mosley Steal.,32,25,7,1,0.7103355544415711,0.7103355544415711,Dartmouth,VMI,2,3,NA,273142678,2007-11-10
117,1,6:43,1603,1603,Foul on Austin Kenon,32,25,7,0,0.7104140688531113,0.7104140688531113,Dartmouth,VMI,2,3,NA,273142678,2007-11-10
118,1,6:43,1603,1603,Official TV Timeout.,32,25,7,0,0.7104140688531113,0.7104140688531113,Dartmouth,VMI,2,3,NA,273142678,2007-11-10
119,1,6:43,1603,1603,DeVon Mosley made Free Throw.,33,25,8,0,0.7360610686449504,0.7360610686449504,Dartmouth,VMI,2,3,NA,273142678,2007-11-10
120,1,6:43,1603,1603,DeVon Mosley made Free Throw.,34,25,9,14,0.7602033607772349,0.7602033607772349,Dartmouth,VMI,2,3,NA,273142678,2007-11-10
121,1,6:29,1589,1589,Chavis Holmes missed Three Point Jumper.,34,25,9,0,0.7614541549047765,0.7614541549047765,Dartmouth,VMI,2,3,NA,273142678,2007-11-10
122,1,6:29,1589,1589,Clive Weeden Defensive Rebound.,34,25,9,31,0.7614541549047765,0.7614541549047765,Dartmouth,VMI,2,3,NA,273142678,2007-11-10
123,1,5:58,1558,1558,Michael Giovacchini made Three Point Jumper.  Assisted by Marlon Sanders.,37,25,12,21,0.8275031993635494,0.8275031993635494,Dartmouth,VMI,2,3,NA,273142678,2007-11-10
124,1,5:37,1537,1537,Hunter Houston made Three Point Jumper.  Assisted by Chavis Holmes.,37,28,9,12,0.7661423558948894,0.7661423558948894,Dartmouth,VMI,2,3,NA,273142678,2007-11-10
125,1,5:25,1525,1525,Clive Weeden made Two Point Layup.  Assisted by Marlon Sanders.,39,28,11,23,0.811216197882591,0.811216197882591,Dartmouth,VMI,2,3,NA,273142678,2007-11-10
126,1,5:02,1502,1502,Marlon Sanders Steal.,39,28,11,7,0.8134903650627827,0.8134903650627827,Dartmouth,VMI,2,3,NA,273142678,2007-11-10
127,1,4:55,1495,1495,Foul on Marlon Sanders,39,28,11,20,0.8141967549100071,0.8141967549100071,Dartmouth,VMI,2,3,NA,273142678,2007-11-10
128,1,4:35,1475,1475,Foul on Adam Powers,39,28,11,0,0.816258873185519,0.816258873185519,Dartmouth,VMI,2,3,NA,273142678,2007-11-10
129,1,4:35,1475,1475,Willie Bell made Free Throw.,39,29,10,0,0.7950501257690249,0.7950501257690249,Dartmouth,VMI,2,3,NA,273142678,2007-11-10
130,1,4:35,1475,1475,Willie Bell missed Free Throw.,39,29,10,0,0.7950501257690249,0.7950501257690249,Dartmouth,VMI,2,3,NA,273142678,2007-11-10
131,1,4:35,1475,1475,Clive Weeden Defensive Rebound.,39,29,10,28,0.7950501257690249,0.7950501257690249,Dartmouth,VMI,2,3,NA,273142678,2007-11-10
132,1,4:07,1447,1447,Clive Weeden missed Two Point Layup.,39,29,10,0,0.7980285194910052,0.7980285194910052,Dartmouth,VMI,2,3,NA,273142678,2007-11-10
133,1,4:07,1447,1447,Willie Bell Defensive Rebound.,39,29,10,14,0.7980285194910052,0.7980285194910052,Dartmouth,VMI,2,3,NA,273142678,2007-11-10
134,1,3:53,1433,1433,Foul on Robby Pride,39,29,10,1,0.79951326293453,0.79951326293453,Dartmouth,VMI,2,3,NA,273142678,2007-11-10
135,1,3:52,1432,1432,Official TV Timeout.,39,29,10,0,0.7996174061675112,0.7996174061675112,Dartmouth,VMI,2,3,NA,273142678,2007-11-10
136,1,3:52,1432,1432,Travis Holmes made Free Throw.,39,30,9,0,0.7765224125211911,0.7765224125211911,Dartmouth,VMI,2,3,NA,273142678,2007-11-10
137,1,3:52,1432,1432,Travis Holmes made Free Throw.,39,31,8,50,0.751592526921774,0.751592526921774,Dartmouth,VMI,2,3,NA,273142678,2007-11-10
138,1,3:02,1382,1382,Chavis Holmes missed Three Point Jumper.,39,31,8,0,0.7562441786092368,0.7562441786092368,Dartmouth,VMI,2,3,NA,273142678,2007-11-10
139,1,3:02,1382,1382,Brandon Ware Defensive Rebound.,39,31,8,6,0.7562441786092368,0.7562441786092368,Dartmouth,VMI,2,3,NA,273142678,2007-11-10
140,1,2:56,1376,1376,Michael Giovacchini missed Three Point Jumper.,39,31,8,0,0.7567853277077223,0.7567853277077223,Dartmouth,VMI,2,3,NA,273142678,2007-11-10
141,1,2:56,1376,1376,Quinn Brownfield Defensive Rebound.,39,31,8,11,0.7567853277077223,0.7567853277077223,Dartmouth,VMI,2,3,NA,273142678,2007-11-10
142,1,2:45,1365,1365,Foul on Clive Weeden,39,31,8,0,0.7577740980461145,0.7577740980461145,Dartmouth,VMI,2,3,NA,273142678,2007-11-10
143,1,2:45,1365,1365,Chavis Holmes missed Free Throw.,39,31,8,0,0.7577740980461145,0.7577740980461145,Dartmouth,VMI,2,3,NA,273142678,2007-11-10
144,1,2:45,1365,1365,null,39,31,8,0,0.7577740980461145,0.7577740980461145,Dartmouth,VMI,2,3,NA,273142678,2007-11-10
145,1,2:45,1365,1365,Chavis Holmes missed Free Throw.,39,31,8,0,0.7577740980461145,0.7577740980461145,Dartmouth,VMI,2,3,NA,273142678,2007-11-10
146,1,2:45,1365,1365,Johnathan Ball Defensive Rebound.,39,31,8,24,0.7577740980461145,0.7577740980461145,Dartmouth,VMI,2,3,NA,273142678,2007-11-10
147,1,2:21,1341,1341,Brandon Ware missed Two Point Jumper.,39,31,8,0,0.7599329578354905,0.7599329578354905,Dartmouth,VMI,2,3,NA,273142678,2007-11-10
148,1,2:21,1341,1341,Travis Holmes Defensive Rebound.,39,31,8,2,0.7599329578354905,0.7599329578354905,Dartmouth,VMI,2,3,NA,273142678,2007-11-10
149,1,2:19,1339,1339,Foul on Johnathan Ball,39,31,8,0,0.7601138716468687,0.7601138716468687,Dartmouth,VMI,2,3,NA,273142678,2007-11-10
150,1,2:19,1339,1339,Travis Holmes made Free Throw.,39,32,7,0,0.7328519920846566,0.7328519920846566,Dartmouth,VMI,2,3,NA,273142678,2007-11-10
151,1,2:19,1339,1339,Travis Holmes made Free Throw.,39,33,6,6,0.703699636431796,0.703699636431796,Dartmouth,VMI,2,3,NA,273142678,2007-11-10
152,1,2:13,1333,1333,Johnathan Ball missed Two Point Layup.,39,33,6,0,0.7041666713657879,0.7041666713657879,Dartmouth,VMI,2,3,NA,273142678,2007-11-10
153,1,2:13,1333,1333,Clive Weeden Offensive Rebound.,39,33,6,5,0.7041666713657879,0.7041666713657879,Dartmouth,VMI,2,3,NA,273142678,2007-11-10
154,1,2:08,1328,1328,DeVon Mosley missed Three Point Jumper.,39,33,6,0,0.7045580074394389,0.7045580074394389,Dartmouth,VMI,2,3,NA,273142678,2007-11-10
155,1,2:08,1328,1328,Virginia Military Defensive Rebo.,39,33,6,0,0.7045580074394389,0.7045580074394389,Dartmouth,VMI,2,3,NA,273142678,2007-11-10
156,1,2:08,1328,1328,Foul on Johnathan Ball,39,33,6,0,0.7045580074394389,0.7045580074394389,Dartmouth,VMI,2,3,NA,273142678,2007-11-10
157,1,2:08,1328,1328,Chavis Holmes made Free Throw.,39,34,5,0,0.6735418698851705,0.6735418698851705,Dartmouth,VMI,2,3,NA,273142678,2007-11-10
158,1,2:08,1328,1328,Chavis Holmes made Free Throw.,39,35,4,1,0.6409290510519209,0.6409290510519209,Dartmouth,VMI,2,3,NA,273142678,2007-11-10
159,1,2:07,1327,1327,Travis Holmes Steal.,39,35,4,0,0.640986935491634,0.640986935491634,Dartmouth,VMI,2,3,NA,273142678,2007-11-10
160,1,2:07,1327,1327,Foul on Michael Giovacchini,39,35,4,0,0.640986935491634,0.640986935491634,Dartmouth,VMI,2,3,NA,273142678,2007-11-10
161,1,2:07,1327,1327,Travis Holmes made Free Throw.,39,36,3,0,0.6070044234060387,0.6070044234060387,Dartmouth,VMI,2,3,NA,273142678,2007-11-10
162,1,2:07,1327,1327,Travis Holmes made Free Throw.,39,37,2,6,0.571953325734305,0.571953325734305,Dartmouth,VMI,2,3,NA,273142678,2007-11-10
163,1,2:01,1321,1321,Foul on DeVon Mosley,39,37,2,20,0.5721389555107412,0.5721389555107412,Dartmouth,VMI,2,3,NA,273142678,2007-11-10
164,1,1:41,1301,1301,Chavis Holmes missed Three Point Jumper.,39,37,2,0,0.5727709695768035,0.5727709695768035,Dartmouth,VMI,2,3,NA,273142678,2007-11-10
165,1,1:41,1301,1301,Elgin Fitzgerald Defensive Rebound.,39,37,2,1,0.5727709695768035,0.5727709695768035,Dartmouth,VMI,2,3,NA,273142678,2007-11-10
166,1,1:40,1300,1300,Foul on J.T. Piribek,39,37,2,0,0.5728031960130557,0.5728031960130557,Dartmouth,VMI,2,3,NA,273142678,2007-11-10
167,1,1:40,1300,1300,Elgin Fitzgerald made Free Throw.,40,37,3,0,0.608246183430483,0.608246183430483,Dartmouth,VMI,2,3,NA,273142678,2007-11-10
168,1,1:40,1300,1300,Elgin Fitzgerald made Free Throw.,41,37,4,25,0.6425834487611141,0.6425834487611141,Dartmouth,VMI,2,3,NA,273142678,2007-11-10
169,1,1:15,1275,1275,Chavis Holmes made Two Point Jumper.,41,39,2,13,0.5736330030156834,0.5736330030156834,Dartmouth,VMI,2,3,NA,273142678,2007-11-10
170,1,1:02,1262,1262,Elgin Fitzgerald made Two Point Jumper.,43,39,4,13,0.6449886454197721,0.6449886454197721,Dartmouth,VMI,2,3,NA,273142678,2007-11-10
171,1,0:49,1249,1249,Willie Bell missed Two Point Jumper.,43,39,4,0,0.6458691858907205,0.6458691858907205,Dartmouth,VMI,2,3,NA,273142678,2007-11-10
172,1,0:49,1249,1249,Elgin Fitzgerald Defensive Rebound.,43,39,4,11,0.6458691858907205,0.6458691858907205,Dartmouth,VMI,2,3,NA,273142678,2007-11-10
173,1,0:38,1238,1238,DeVon Mosley made Two Point Jumper.,45,39,6,38,0.7122766099880236,0.7122766099880236,Dartmouth,VMI,2,3,NA,273142678,2007-11-10
174,1,0:00,1200,1200,Michael Giovacchini Steal.,45,39,6,0,0.7161370692370593,0.7161370692370593,Dartmouth,VMI,2,3,NA,273142678,2007-11-10
175,1,0:00,1200,1200,End of the 1st Half.,45,39,6,0,0.7161370692370593,0.7161370692370593,Dartmouth,VMI,2,3,NA,273142678,2007-11-10
176,2,20:00,1200,1200,PLAY,45,39,6,21,0.7161370692370593,0.7161370692370593,Dartmouth,VMI,3,4,NA,273142678,2007-11-10
177,2,19:39,1179,1179,Elgin Fitzgerald missed Two Point Layup.,45,39,6,0,0.71825500594475,0.71825500594475,Dartmouth,VMI,3,4,NA,273142678,2007-11-10
178,2,19:39,1179,1179,Alex Barnett Offensive Rebound.,45,39,6,3,0.71825500594475,0.71825500594475,Dartmouth,VMI,3,4,NA,273142678,2007-11-10
179,2,19:36,1176,1176,Alex Barnett made Two Point Jumper.,47,39,8,17,0.7772506022703277,0.7772506022703277,Dartmouth,VMI,3,4,NA,273142678,2007-11-10
180,2,19:19,1159,1159,Chavis Holmes missed Two Point Jumper.,47,39,8,0,0.7791392299356834,0.7791392299356834,Dartmouth,VMI,3,4,NA,273142678,2007-11-10
181,2,19:19,1159,1159,Reggie Williams Offensive Rebound.,47,39,8,5,0.7791392299356834,0.7791392299356834,Dartmouth,VMI,3,4,NA,273142678,2007-11-10
182,2,19:14,1154,1154,Reggie Williams missed Two Point Jumper.,47,39,8,0,0.7796874655431166,0.7796874655431166,Dartmouth,VMI,3,4,NA,273142678,2007-11-10
