play_id,half,time_remaining_half,secs_remaining,secs_remaining_absolute,description,home_score,away_score,score_diff,play_length,win_prob,naive_win_prob,home,away,home_time_out_remaining,away_time_out_remaining,home_favored_by,game_id,date
360,2,0:53,53,53,Michael Giovacchini made Two Point Layup.  Assisted by Alex Barnett.,96,83,13,9,0.9999806504412616,0.9999806504412616,Dartmouth,VMI,1,3,NA,273142678,2007-11-10
361,2,0:44,44,44,Adam Lonon missed Two Point Layup.,96,83,13,1,0.9999900655941579,0.9999900655941579,Dartmouth,VMI,1,3,NA,273142678,2007-11-10
362,2,0:43,43,43,Dartmouth Offensive Rebound.,96,83,13,0,0.9999907964494131,0.9999907964494131,Dartmouth,VMI,1,3,NA,273142678,2007-11-10
363,2,0:43,43,43,Hunter Houston missed Three Point Jumper.,96,83,13,0,0.9999907964494131,0.9999907964494131,Dartmouth,VMI,1,3,NA,273142678,2007-11-10
364,2,0:43,43,43,Alex Barnett Defensive Rebound.,96,83,13,4,0.9999907964494131,0.9999907964494131,Dartmouth,VMI,1,3,NA,273142678,2007-11-10
365,2,0:39,39,39,Austin Kenon Steal.,96,83,13,1,0.9999932509777615,0.9999932509777615,Dartmouth,VMI,1,3,NA,273142678,2007-11-10
366,2,0:38,38,38,Foul on Marlon Sanders,96,83,13,6,0.9999937613174793,0.9999937613174793,Dartmouth,VMI,1,3,NA,273142678,2007-11-10
367,2,0:32,32,32,Travis Holmes made Free Throw.,96,84,12,0,0.9999899300971531,0.9999899300971531,Dartmouth,VMI,1,3,NA,273142678,2007-11-10
368,2,0:32,32,32,Travis Holmes made Free Throw.,96,85,11,8,0.9999737316713603,0.9999737316713603,Dartmouth,VMI,1,3,NA,273142678,2007-11-10
369,2,0:24,24,24,Brandon Ware made Two Point Layup.  Assisted by Michael Giovacchini.,98,85,13,9,0.99999800316638765,0.99999800316638765,Dartmouth,VMI,1,3,NA,273142678,2007-11-10
370,2,0:15,15,15,Travis Holmes made Two Point Layup.  Assisted by Christian Hunter.,98,87,11,15,0.9999922003273956,0.9999922003273956,Dartmouth,VMI,1,3,NA,273142678,2007-11-10
371,2,0:00,0,0,End Game,98,87,11,0,1,1,Dartmouth,VMI,1,3,NA,273142678,2007-11-10
