play_id,half,time_remaining_half,secs_remaining,secs_remaining_absolute,description,home_score,away_score,score_diff,play_length,win_prob,naive_win_prob,home,away,home_time_out_remaining,away_time_out_remaining,home_favored_by,game_id,date
181,2,12:52,772,772,Howard Crawford missed Two Point Jumper.,35,32,3,0,0.6420110867528704,0.6420110867528704,Marshall,UAB,4,3,NA,280190276,2008-01-19
182,2,12:52,772,772,Darryl Merthie Defensive Rebound.,35,32,3,7,0.6420110867528704,0.6420110867528704,Marshall,UAB,4,3,NA,280190276,2008-01-19
183,2,12:45,765,765,Pierre-Marie Altidor-Cespedes missed Three Point Jumper.,35,32,3,0,0.6426824290926816,0.6426824290926816,Marshall,UAB,4,3,NA,280190276,2008-01-19
184,2,12:45,765,765,Marshall Offensive Rebound.,35,32,3,5,0.6426824290926816,0.6426824290926816,Marshall,UAB,4,3,NA,280190276,2008-01-19
185,2,12:40,760,760,Tyler Wilkerson made Three Point Jumper.  Assisted by Pierre-Marie Altidor-Cespedes.,38,32,6,24,0.7646590559195625,0.7646590559195625,Marshall,UAB,4,3,NA,280190276,2008-01-19
186,2,12:16,736,736,Channing Toney missed Three Point Jumper.,38,32,6,0,0.7687736763161107,0.7687736763161107,Marshall,UAB,4,3,NA,280190276,2008-01-19
187,2,12:16,736,736,Lawrence Kinnard Offensive Rebound.,38,32,6,31,0.7687736763161107,0.7687736763161107,Marshall,UAB,4,3,NA,280190276,2008-01-19
188,2,11:45,705,705,Ed Berrios missed Three Point Jumper.,38,32,6,0,0.7742464087209303,0.7742464087209303,Marshall,UAB,4,3,NA,280190276,2008-01-19
189,2,11:45,705,705,Tyler Wilkerson Defensive Rebound.,38,32,6,27,0.7742464087209303,0.7742464087209303,Marshall,UAB,4,3,NA,280190276,2008-01-19
190,2,11:18,678,678,Official TV Timeout.,38,32,6,14,0.7782375111834305,0.7782375111834305,Marshall,UAB,4,3,NA,280190276,2008-01-19
191,2,11:04,664,664,Foul on Matt Walls,38,32,6,0,0.78017199406408555,0.78017199406408555,Marshall,UAB,4,3,NA,280190276,2008-01-19
192,2,11:04,664,664,Lawrence Kinnard missed Three Point Jumper.,38,32,6,0,0.78017199406408555,0.78017199406408555,Marshall,UAB,4,3,NA,280190276,2008-01-19
193,2,11:04,664,664,Tyler Wilkerson Defensive Rebound.,38,32,6,8,0.78017199406408555,0.78017199406408555,Marshall,UAB,4,3,NA,280190276,2008-01-19
194,2,10:56,656,656,Darryl Merthie missed Two Point Jumper.,38,32,6,0,0.7812692897086712,0.7812692897086712,Marshall,UAB,4,3,NA,280190276,2008-01-19
195,2,10:56,656,656,Ed Berrios Defensive Rebound.,38,32,6,2,0.7812692897086712,0.7812692897086712,Marshall,UAB,4,3,NA,280190276,2008-01-19
196,2,10:54,654,654,Foul on Tyler Wilkerson,38,32,6,32,0.7815444996905394,0.7815444996905394,Marshall,UAB,4,3,NA,280190276,2008-01-19
197,2,10:22,622,622,Robert Vaden made Three Point Jumper.,38,35,3,20,0.657230707168229,0.657230707168229,Marshall,UAB,4,3,NA,280190276,2008-01-19
198,2,10:02,602,602,Foul on Frank Holmes,38,35,3,1,0.6594461255210966,0.6594461255210966,Marshall,UAB,4,3,NA,280190276,2008-01-19
199,2,10:01,601,601,Foul on Lawrence Kinnard,38,35,3,0,0.6595654943992184,0.6595654943992184,Marshall,UAB,4,3,NA,280190276,2008-01-19
200,2,10:01,601,601,Matt Walls missed Free Throw.,38,35,3,0,0.6595654943992184,0.6595654943992184,Marshall,UAB,4,3,NA,280190276,2008-01-19
201,2,10:01,601,601,null,38,35,3,0,0.6595654943992184,0.6595654943992184,Marshall,UAB,4,3,NA,280190276,2008-01-19
202,2,10:01,601,601,Matt Walls missed Free Throw.,38,35,3,0,0.6595654943992184,0.6595654943992184,Marshall,UAB,4,3,NA,280190276,2008-01-19
203,2,10:01,601,601,null,38,35,3,0,0.6595654943992184,0.6595654943992184,Marshall,UAB,4,3,NA,280190276,2008-01-19
204,2,10:01,601,601,Matt Walls missed Free Throw.,38,35,3,0,0.6595654943992184,0.6595654943992184,Marshall,UAB,4,3,NA,280190276,2008-01-19
205,2,10:01,601,601,Reggie Huffman Defensive Rebound.,38,35,3,13,0.6595654943992184,0.6595654943992184,Marshall,UAB,4,3,NA,280190276,2008-01-19
206,2,9:48,588,588,Foul on Jeremy Mayfield,38,35,3,19,0.6612066355036472,0.6612066355036472,Marshall,UAB,4,3,NA,280190276,2008-01-19
207,2,9:29,569,569,Darryl Merthie missed Two Point Jumper.,38,35,3,0,0.6639510915693374,0.6639510915693374,Marshall,UAB,4,3,NA,280190276,2008-01-19
208,2,9:29,569,569,Reggie Huffman Defensive Rebound.,38,35,3,9,0.6639510915693374,0.6639510915693374,Marshall,UAB,4,3,NA,280190276,2008-01-19
209,2,9:20,560,560,Jeremy Mayfield made Two Point Layup.  Assisted by Ed Berrios.,38,37,1,23,0.5570451802408178,0.5570451802408178,Marshall,UAB,4,3,NA,280190276,2008-01-19
210,2,8:57,537,537,Darryl Merthie missed Two Point Jumper.,38,37,1,0,0.5585263230832301,0.5585263230832301,Marshall,UAB,4,3,NA,280190276,2008-01-19
211,2,8:57,537,537,Tirrell Baines Offensive Rebound.,38,37,1,4,0.5585263230832301,0.5585263230832301,Marshall,UAB,4,3,NA,280190276,2008-01-19
212,2,8:53,533,533,Tirrell Baines made Two Point Jumper.,40,37,3,32,0.6700386546712866,0.6700386546712866,Marshall,UAB,4,3,NA,280190276,2008-01-19
213,2,8:21,501,501,Darryl Merthie Steal.,40,37,3,27,0.6744360519610074,0.6744360519610074,Marshall,UAB,4,3,NA,280190276,2008-01-19
214,2,7:54,474,474,Mark Dorris made Two Point Jumper.,42,37,5,12,0.7760280291020559,0.7760280291020559,Marshall,UAB,4,3,NA,280190276,2008-01-19
215,2,7:42,462,462,Jeremy Mayfield missed Two Point Jumper.,42,37,5,0,0.7786565521495923,0.7786565521495923,Marshall,UAB,4,3,NA,280190276,2008-01-19
216,2,7:42,462,462,Jean Francois Bro-Grebe Defensive Rebound.,42,37,5,19,0.7786565521495923,0.7786565521495923,Marshall,UAB,4,3,NA,280190276,2008-01-19
217,2,7:23,443,443,Jean Francois Bro-Grebe made Two Point Jumper.  Assisted by Mark Dorris.,44,37,7,17,0.858390104259,0.858390104259,Marshall,UAB,4,3,NA,280190276,2008-01-19
218,2,7:06,426,426,Robert Vaden missed Three Point Jumper.,44,37,7,0,0.8639426899449909,0.8639426899449909,Marshall,UAB,4,3,NA,280190276,2008-01-19
219,2,7:06,426,426,Tirrell Baines Defensive Rebound.,44,37,7,20,0.8639426899449909,0.8639426899449909,Marshall,UAB,4,3,NA,280190276,2008-01-19
220,2,6:46,406,406,Darryl Merthie made Two Point Jumper.,46,37,9,9,0.9202420523483424,0.9202420523483424,Marshall,UAB,4,3,NA,280190276,2008-01-19
221,2,6:37,397,397,UAB 30 Second Timeout.,46,37,9,9,0.92238387186612,0.92238387186612,Marshall,UAB,4,2,NA,280190276,2008-01-19
222,2,6:28,388,388,Robert Vaden made Three Point Jumper.  Assisted by Ed Berrios.,46,40,6,17,0.8415495955241161,0.8415495955241161,Marshall,UAB,4,2,NA,280190276,2008-01-19
223,2,6:11,371,371,Mark Dorris missed Three Point Jumper.,46,40,6,0,0.8466396686204448,0.8466396686204448,Marshall,UAB,4,2,NA,280190276,2008-01-19
224,2,6:11,371,371,Lawrence Kinnard Defensive Rebound.,46,40,6,17,0.8466396686204448,0.8466396686204448,Marshall,UAB,4,2,NA,280190276,2008-01-19
225,2,5:54,354,354,Robert Vaden missed Two Point Jumper.,46,40,6,0,0.8521603151974103,0.8521603151974103,Marshall,UAB,4,2,NA,280190276,2008-01-19
226,2,5:54,354,354,Channing Toney Offensive Rebound.,46,40,6,3,0.8521603151974103,0.8521603151974103,Marshall,UAB,4,2,NA,280190276,2008-01-19
227,2,5:51,351,351,Channing Toney made Two Point Layup.,46,42,4,22,0.7637411897891152,0.7637411897891152,Marshall,UAB,4,2,NA,280190276,2008-01-19
228,2,5:29,329,329,Tirrell Baines missed Two Point Jumper.,46,42,4,0,0.7720049745406273,0.7720049745406273,Marshall,UAB,4,2,NA,280190276,2008-01-19
229,2,5:29,329,329,Tyler Wilkerson Offensive Rebound.,46,42,4,0,0.7720049745406273,0.7720049745406273,Marshall,UAB,4,2,NA,280190276,2008-01-19
230,2,5:29,329,329,Foul on Howard Crawford,46,42,4,0,0.7720049745406273,0.7720049745406273,Marshall,UAB,4,2,NA,280190276,2008-01-19
231,2,5:29,329,329,Official TV Timeout.,46,42,4,20,0.7720049745406273,0.7720049745406273,Marshall,UAB,4,2,NA,280190276,2008-01-19
232,2,5:09,309,309,Mark Dorris missed Two Point Jumper.,46,42,4,2,0.7812648999067139,0.7812648999067139,Marshall,UAB,4,2,NA,280190276,2008-01-19
233,2,5:07,307,307,Lawrence Kinnard Defensive Rebound.,46,42,4,4,0.7821599008441784,0.7821599008441784,Marshall,UAB,4,2,NA,280190276,2008-01-19
234,2,5:03,303,303,Robert Vaden made Three Point Jumper.  Assisted by Ed Berrios.,46,45,1,10,0.5797410540470757,0.5797410540470757,Marshall,UAB,4,2,NA,280190276,2008-01-19
235,2,4:53,293,293,Marshall 30 Second Timeout.,46,45,1,10,0.58043402601877,0.58043402601877,Marshall,UAB,3,2,NA,280190276,2008-01-19
236,2,4:43,283,283,Tyler Wilkerson missed Two Point Layup.,46,45,1,0,0.5804376497623287,0.5804376497623287,Marshall,UAB,3,2,NA,280190276,2008-01-19
237,2,4:43,283,283,Tyler Wilkerson Offensive Rebound.,46,45,1,2,0.5804376497623287,0.5804376497623287,Marshall,UAB,3,2,NA,280190276,2008-01-19
238,2,4:41,281,281,Tyler Wilkerson made Two Point Layup.,48,45,3,1,0.7257057603324032,0.7257057603324032,Marshall,UAB,3,2,NA,280190276,2008-01-19
239,2,4:40,280,280,Foul on Howard Crawford,48,45,3,0,0.7256136095249436,0.7256136095249436,Marshall,UAB,3,2,NA,280190276,2008-01-19
240,2,4:40,280,280,Tyler Wilkerson made Free Throw.,49,45,4,3,0.785269037869395,0.785269037869395,Marshall,UAB,3,2,NA,280190276,2008-01-19
241,2,4:37,277,277,Ed Berrios missed Three Point Jumper.,49,45,4,0,0.7848928393666811,0.7848928393666811,Marshall,UAB,3,2,NA,280190276,2008-01-19
242,2,4:37,277,277,Darryl Merthie Defensive Rebound.,49,45,4,25,0.7848928393666811,0.7848928393666811,Marshall,UAB,3,2,NA,280190276,2008-01-19
243,2,4:12,252,252,Foul on Lawrence Kinnard,49,45,4,0,0.7800921424479167,0.7800921424479167,Marshall,UAB,3,2,NA,280190276,2008-01-19
244,2,4:12,252,252,Tyler Wilkerson missed Free Throw.,49,45,4,0,0.7800921424479167,0.7800921424479167,Marshall,UAB,3,2,NA,280190276,2008-01-19
245,2,4:12,252,252,null,49,45,4,0,0.7800921424479167,0.7800921424479167,Marshall,UAB,3,2,NA,280190276,2008-01-19
246,2,4:12,252,252,Tyler Wilkerson made Free Throw.,50,45,5,19,0.8295942359398817,0.8295942359398817,Marshall,UAB,3,2,NA,280190276,2008-01-19
247,2,3:53,233,233,Foul on Mark Dorris,50,45,5,0,0.8280183795278303,0.8280183795278303,Marshall,UAB,3,2,NA,280190276,2008-01-19
248,2,3:53,233,233,Official TV Timeout.,50,45,5,0,0.8280183795278303,0.8280183795278303,Marshall,UAB,3,2,NA,280190276,2008-01-19
249,2,3:53,233,233,Frank Holmes made Free Throw.,50,46,4,0,0.7785641037881587,0.7785641037881587,Marshall,UAB,3,2,NA,280190276,2008-01-19
250,2,3:53,233,233,Frank Holmes missed Free Throw.,50,46,4,0,0.7785641037881587,0.7785641037881587,Marshall,UAB,3,2,NA,280190276,2008-01-19
251,2,3:53,233,233,null,50,46,4,0,0.7785641037881587,0.7785641037881587,Marshall,UAB,3,2,NA,280190276,2008-01-19
252,2,3:53,233,233,Foul on Frank Holmes,50,46,4,0,0.7785641037881587,0.7785641037881587,Marshall,UAB,3,2,NA,280190276,2008-01-19
253,2,3:53,233,233,Matt Walls missed Free Throw.,50,46,4,0,0.7785641037881587,0.7785641037881587,Marshall,UAB,3,2,NA,280190276,2008-01-19
254,2,3:53,233,233,Lawrence Kinnard Defensive Rebound.,50,46,4,28,0.7785641037881587,0.7785641037881587,Marshall,UAB,3,2,NA,280190276,2008-01-19
255,2,3:25,205,205,Lawrence Kinnard missed Three Point Jumper.,50,46,4,0,0.7895110628510629,0.7895110628510629,Marshall,UAB,3,2,NA,280190276,2008-01-19
256,2,3:25,205,205,Tirrell Baines Defensive Rebound.,50,46,4,23,0.7895110628510629,0.7895110628510629,Marshall,UAB,3,2,NA,280190276,2008-01-19
257,2,3:02,182,182,Foul on Frank Holmes,50,46,4,0,0.8154977246452715,0.8154977246452715,Marshall,UAB,3,2,NA,280190276,2008-01-19
258,2,3:02,182,182,Tyler Wilkerson missed Free Throw.,50,46,4,0,0.8154977246452715,0.8154977246452715,Marshall,UAB,3,2,NA,280190276,2008-01-19
259,2,3:02,182,182,null,50,46,4,0,0.8154977246452715,0.8154977246452715,Marshall,UAB,3,2,NA,280190276,2008-01-19
260,2,3:02,182,182,Tyler Wilkerson made Free Throw.,51,46,5,20,0.8650252583615992,0.8650252583615992,Marshall,UAB,3,2,NA,280190276,2008-01-19
261,2,2:42,162,162,Jeremy Mayfield made Two Point Layup.  Assisted by Ed Berrios.,51,48,3,22,0.7765703958326977,0.7765703958326977,Marshall,UAB,3,2,NA,280190276,2008-01-19
262,2,2:20,140,140,Matt Walls made Three Point Jumper.  Assisted by Adam Williams.,54,48,6,24,0.9438609698671054,0.9438609698671054,Marshall,UAB,3,2,NA,280190276,2008-01-19
263,2,1:56,116,116,Lawrence Kinnard missed Three Point Jumper.,54,48,6,0,0.9633637244391814,0.9633637244391814,Marshall,UAB,3,2,NA,280190276,2008-01-19
264,2,1:56,116,116,Adam Williams Defensive Rebound.,54,48,6,23,0.9633637244391814,0.9633637244391814,Marshall,UAB,3,2,NA,280190276,2008-01-19
265,2,1:33,93,93,UAB 30 Second Timeout.,54,48,6,11,0.9785362147726001,0.9785362147726001,Marshall,UAB,3,1,NA,280190276,2008-01-19
266,2,1:22,82,82,Jeremy Mayfield made Two Point Jumper.  Assisted by Ed Berrios.,54,50,4,0,0.9396487036118716,0.9396487036118716,Marshall,UAB,3,1,NA,280190276,2008-01-19
267,2,1:22,82,82,Foul on Matt Walls,54,50,4,0,0.9396487036118716,0.9396487036118716,Marshall,UAB,3,1,NA,280190276,2008-01-19
268,2,1:22,82,82,Jeremy Mayfield made Free Throw.,54,51,3,7,0.8868531364565443,0.8868531364565443,Marshall,UAB,3,1,NA,280190276,2008-01-19
269,2,1:15,75,75,Marshall 30 Second Timeout.,54,51,3,10,0.8965010328225849,0.8965010328225849,Marshall,UAB,2,1,NA,280190276,2008-01-19
270,2,1:05,65,65,Matt Walls made Three Point Jumper.  Assisted by Darryl Merthie.,57,51,6,11,0.9902655965403562,0.9902655965403562,Marshall,UAB,2,1,NA,280190276,2008-01-19
271,2,0:54,54,54,Robert Vaden made Two Point Jumper.,57,53,4,6,0.9650143806869779,0.9650143806869779,Marshall,UAB,2,1,NA,280190276,2008-01-19
272,2,0:48,48,48,Foul on Aaron Johnson,57,53,4,0,0.9692875630820613,0.9692875630820613,Marshall,UAB,2,1,NA,280190276,2008-01-19
273,2,0:48,48,48,Mark Dorris made Free Throw.,58,53,5,0,0.9868080280146234,0.9868080280146234,Marshall,UAB,2,1,NA,280190276,2008-01-19
274,2,0:48,48,48,Mark Dorris missed Free Throw.,58,53,5,0,0.9868080280146234,0.9868080280146234,Marshall,UAB,2,1,NA,280190276,2008-01-19
275,2,0:48,48,48,Tyler Wilkerson Offensive Rebound.,58,53,5,6,0.9868080280146234,0.9868080280146234,Marshall,UAB,2,1,NA,280190276,2008-01-19
276,2,0:42,42,42,Foul on Robert Vaden,58,53,5,1,0.9888987592382676,0.9888987592382676,Marshall,UAB,2,1,NA,280190276,2008-01-19
277,2,0:41,41,41,Pierre-Marie Altidor-Cespedes missed Free Throw.,58,53,5,0,0.9892205771948825,0.9892205771948825,Marshall,UAB,2,1,NA,280190276,2008-01-19
278,2,0:41,41,41,null,58,53,5,0,0.9892205771948825,0.9892205771948825,Marshall,UAB,2,1,NA,280190276,2008-01-19
279,2,0:41,41,41,Pierre-Marie Altidor-Cespedes missed Free Throw.,58,53,5,0,0.9892205771948825,0.9892205771948825,Marshall,UAB,2,1,NA,280190276,2008-01-19
280,2,0:41,41,41,UAB Defensive Rebound.,58,53,5,5,0.9892205771948825,0.9892205771948825,Marshall,UAB,2,1,NA,280190276,2008-01-19
281,2,0:36,36,36,Robert Vaden missed Three Point Jumper.,58,53,5,0,0.9907190582980734,0.9907190582980734,Marshall,UAB,2,1,NA,280190276,2008-01-19
282,2,0:36,36,36,Tyler Wilkerson Defensive Rebound.,58,53,5,8,0.9907190582980734,0.9907190582980734,Marshall,UAB,2,1,NA,280190276,2008-01-19
283,2,0:28,28,28,Foul on Ed Berrios,58,53,5,0,0.9927535175249017,0.9927535175249017,Marshall,UAB,2,1,NA,280190276,2008-01-19
284,2,0:28,28,28,Darryl Merthie made Free Throw.,59,53,6,0,0.99727880563173,0.99727880563173,Marshall,UAB,2,1,NA,280190276,2008-01-19
285,2,0:28,28,28,Darryl Merthie missed Free Throw.,59,53,6,0,0.99727880563173,0.99727880563173,Marshall,UAB,2,1,NA,280190276,2008-01-19
286,2,0:28,28,28,Lawrence Kinnard Defensive Rebound.,59,53,6,7,0.99727880563173,0.99727880563173,Marshall,UAB,2,1,NA,280190276,2008-01-19
287,2,0:21,21,21,Robert Vaden made Two Point Layup.,59,55,4,0,0.9839507435320222,0.9839507435320222,Marshall,UAB,2,1,NA,280190276,2008-01-19
288,2,0:21,21,21,UAB Full Timeout.,59,55,4,2,0.9839507435320222,0.9839507435320222,Marshall,UAB,2,0,NA,280190276,2008-01-19
289,2,0:19,19,19,Foul on Robert Vaden,59,55,4,0,0.9847646583833194,0.9847646583833194,Marshall,UAB,2,0,NA,280190276,2008-01-19
290,2,0:19,19,19,Matt Walls made Free Throw.,60,55,5,0,0.9945732917863148,0.9945732917863148,Marshall,UAB,2,0,NA,280190276,2008-01-19
291,2,0:19,19,19,Matt Walls made Free Throw.,61,55,6,1,0.998079365653707,0.998079365653707,Marshall,UAB,2,0,NA,280190276,2008-01-19
292,2,0:18,18,18,Foul on Adam Williams,61,55,6,0,0.998154735048266,0.998154735048266,Marshall,UAB,2,0,NA,280190276,2008-01-19
293,2,0:18,18,18,Robert Vaden made Free Throw.,61,56,5,0,0.9947507371379145,0.9947507371379145,Marshall,UAB,2,0,NA,280190276,2008-01-19
294,2,0:18,18,18,Robert Vaden made Free Throw.,61,57,4,5,0.9851606695394957,0.9851606695394957,Marshall,UAB,2,0,NA,280190276,2008-01-19
295,2,0:13,13,13,Foul on Lawrence Kinnard,61,57,4,0,0.9870293270859739,0.9870293270859739,Marshall,UAB,2,0,NA,280190276,2008-01-19
296,2,0:13,13,13,Pierre-Marie Altidor-Cespedes made Free Throw.,62,57,5,0,0.9955704200149512,0.9955704200149512,Marshall,UAB,2,0,NA,280190276,2008-01-19
297,2,0:13,13,13,Pierre-Marie Altidor-Cespedes missed Free Throw.,62,57,5,0,0.9955704200149512,0.9955704200149512,Marshall,UAB,2,0,NA,280190276,2008-01-19
298,2,0:13,13,13,Lawrence Kinnard Defensive Rebound.,62,57,5,6,0.9955704200149512,0.9955704200149512,Marshall,UAB,2,0,NA,280190276,2008-01-19
299,2,0:07,7,7,Robert Vaden missed Two Point Jumper.,62,57,5,0,0.9964115169478466,0.9964115169478466,Marshall,UAB,2,0,NA,280190276,2008-01-19
300,2,0:07,7,7,Darryl Merthie Defensive Rebound.,62,57,5,7,0.9964115169478466,0.9964115169478466,Marshall,UAB,2,0,NA,280190276,2008-01-19
301,2,0:00,0,0,End Game,62,57,5,0,1,1,Marshall,UAB,2,0,NA,280190276,2008-01-19
