play_id,half,time_remaining_half,secs_remaining,secs_remaining_absolute,description,home_score,away_score,score_diff,play_length,win_prob,naive_win_prob,home,away,home_time_out_remaining,away_time_out_remaining,home_favored_by,game_id,date
1,1,20:00,2400,2400,PLAY,0,0,0,14,0.5,0.5,Marshall,UAB,4,4,NA,280190276,2008-01-19
2,1,19:46,2386,2386,Mark Dorris missed Two Point Jumper.,0,0,0,0,0.5,0.5,Marshall,UAB,4,4,NA,280190276,2008-01-19
3,1,19:46,2386,2386,Tirrell Baines Offensive Rebound.,0,0,0,7,0.5,0.5,Marshall,UAB,4,4,NA,280190276,2008-01-19
4,1,19:39,2379,2379,Lawrence Kinnard Steal.,0,0,0,15,0.5,0.5,Marshall,UAB,4,4,NA,280190276,2008-01-19
5,1,19:24,2364,2364,Robert Vaden missed Three Point Jumper.,0,0,0,0,0.5,0.5,Marshall,UAB,4,4,NA,280190276,2008-01-19
6,1,19:24,2364,2364,Robbie Jackson Defensive Rebound.,0,0,0,15,0.5,0.5,Marshall,UAB,4,4,NA,280190276,2008-01-19
7,1,19:09,2349,2349,Adam Williams missed Three Point Jumper.,0,0,0,0,0.5,0.5,Marshall,UAB,4,4,NA,280190276,2008-01-19
8,1,19:09,2349,2349,Reggie Huffman Defensive Rebound.,0,0,0,14,0.5,0.5,Marshall,UAB,4,4,NA,280190276,2008-01-19
9,1,18:55,2335,2335,Foul on Robbie Jackson,0,0,0,0,0.5,0.5,Marshall,UAB,4,4,NA,280190276,2008-01-19
10,1,18:55,2335,2335,Frank Holmes made Free Throw.,0,1,-1,0,0.4772446260183281,0.4772446260183281,Marshall,UAB,4,4,NA,280190276,2008-01-19
11,1,18:55,2335,2335,Frank Holmes made Free Throw.,0,2,-2,6,0.45458332034341126,0.45458332034341126,Marshall,UAB,4,4,NA,280190276,2008-01-19
12,1,18:49,2329,2329,Robbie Jackson missed Two Point Dunk Shot.,0,2,-2,0,0.4544521819541921,0.4544521819541921,Marshall,UAB,4,4,NA,280190276,2008-01-19
13,1,18:49,2329,2329,Aaron Johnson Defensive Rebound.,0,2,-2,18,0.4544521819541921,0.4544521819541921,Marshall,UAB,4,4,NA,280190276,2008-01-19
14,1,18:31,2311,2311,Mark Dorris Steal.,0,2,-2,3,0.45405627147729344,0.45405627147729344,Marshall,UAB,4,4,NA,280190276,2008-01-19
15,1,18:28,2308,2308,Mark Dorris made Two Point Jumper.,2,2,0,13,0.5,0.5,Marshall,UAB,4,4,NA,280190276,2008-01-19
16,1,18:15,2295,2295,Lawrence Kinnard made Two Point Jumper.  Assisted by Aaron Johnson.,2,4,-2,14,0.4537013997188336,0.4537013997188336,Marshall,UAB,4,4,NA,280190276,2008-01-19
17,1,18:01,2281,2281,Frank Holmes Steal.,2,4,-2,11,0.4533887851355005,0.4533887851355005,Marshall,UAB,4,4,NA,280190276,2008-01-19
18,1,17:50,2270,2270,Lawrence Kinnard missed Three Point Jumper.,2,4,-2,0,0.45314188206327277,0.45314188206327277,Marshall,UAB,4,4,NA,280190276,2008-01-19
19,1,17:50,2270,2270,Reggie Huffman Offensive Rebound.,2,4,-2,8,0.45314188206327277,0.45314188206327277,Marshall,UAB,4,4,NA,280190276,2008-01-19
20,1,17:42,2262,2262,Mark Dorris Steal.,2,4,-2,6,0.452961654138631,0.452961654138631,Marshall,UAB,4,4,NA,280190276,2008-01-19
21,1,17:36,2256,2256,Tyler Wilkerson missed Two Point Jumper.,2,4,-2,0,0.4528261357226131,0.4528261357226131,Marshall,UAB,4,4,NA,280190276,2008-01-19
22,1,17:36,2256,2256,Lawrence Kinnard Defensive Rebound.,2,4,-2,17,0.4528261357226131,0.4528261357226131,Marshall,UAB,4,4,NA,280190276,2008-01-19
23,1,17:19,2239,2239,Darryl Merthie Steal.,2,4,-2,3,0.4524406556427031,0.4524406556427031,Marshall,UAB,4,4,NA,280190276,2008-01-19
24,1,17:16,2236,2236,Mark Dorris made Two Point Jumper.  Assisted by Darryl Merthie.,4,4,0,14,0.5,0.5,Marshall,UAB,4,4,NA,280190276,2008-01-19
25,1,17:02,2222,2222,Lawrence Kinnard missed Two Point Jumper.,4,4,0,0,0.5,0.5,Marshall,UAB,4,4,NA,280190276,2008-01-19
26,1,17:02,2222,2222,Darryl Merthie Defensive Rebound.,4,4,0,6,0.5,0.5,Marshall,UAB,4,4,NA,280190276,2008-01-19
27,1,16:56,2216,2216,Mark Dorris missed Three Point Jumper.,4,4,0,0,0.5,0.5,Marshall,UAB,4,4,NA,280190276,2008-01-19
28,1,16:56,2216,2216,Reggie Huffman Defensive Rebound.,4,4,0,15,0.5,0.5,Marshall,UAB,4,4,NA,280190276,2008-01-19
29,1,16:41,2201,2201,Foul on Darryl Merthie,4,4,0,7,0.5,0.5,Marshall,UAB,4,4,NA,280190276,2008-01-19
30,1,16:34,2194,2194,Foul on Mark Dorris,4,4,0,2,0.5,0.5,Marshall,UAB,4,4,NA,280190276,2008-01-19
31,1,16:32,2192,2192,Ed Berrios made Three Point Jumper.  Assisted by Robert Vaden.,4,7,-3,22,0.4273344834071913,0.4273344834071913,Marshall,UAB,4,4,NA,280190276,2008-01-19
32,1,16:10,2170,2170,Tyler Wilkerson missed Two Point Jumper.,4,7,-3,0,0.4265826865164205,0.4265826865164205,Marshall,UAB,4,4,NA,280190276,2008-01-19
33,1,16:10,2170,2170,Marshall Offensive Rebound.,4,7,-3,14,0.4265826865164205,0.4265826865164205,Marshall,UAB,4,4,NA,280190276,2008-01-19
34,1,15:56,2156,2156,Matt Walls missed Three Point Jumper.,4,7,-3,0,0.42610243240420215,0.42610243240420215,Marshall,UAB,4,4,NA,280190276,2008-01-19
35,1,15:56,2156,2156,Tirrell Baines Offensive Rebound.,4,7,-3,4,0.42610243240420215,0.42610243240420215,Marshall,UAB,4,4,NA,280190276,2008-01-19
36,1,15:52,2152,2152,Official TV Timeout.,4,7,-3,29,0.4259648273179891,0.4259648273179891,Marshall,UAB,4,4,NA,280190276,2008-01-19
37,1,15:23,2123,2123,Robert Vaden made Three Point Jumper.,4,10,-6,46,0.35322901126962186,0.35322901126962186,Marshall,UAB,4,4,NA,280190276,2008-01-19
38,1,14:37,2077,2077,Robert Vaden Steal.,4,10,-6,10,0.35021652231930794,0.35021652231930794,Marshall,UAB,4,4,NA,280190276,2008-01-19
39,1,14:27,2067,2067,Pierre-Marie Altidor-Cespedes Steal.,4,10,-6,19,0.34955535390045367,0.34955535390045367,Marshall,UAB,4,4,NA,280190276,2008-01-19
40,1,14:08,2048,2048,Pierre-Marie Altidor-Cespedes missed Three Point Jumper.,4,10,-6,0,0.3482923763984685,0.3482923763984685,Marshall,UAB,4,4,NA,280190276,2008-01-19
41,1,14:08,2048,2048,Marshall Offensive Rebound.,4,10,-6,12,0.3482923763984685,0.3482923763984685,Marshall,UAB,4,4,NA,280190276,2008-01-19
42,1,13:56,2036,2036,Mark Dorris missed Two Point Jumper.,4,10,-6,0,0.34748993276167606,0.34748993276167606,Marshall,UAB,4,4,NA,280190276,2008-01-19
43,1,13:56,2036,2036,Robert Vaden Defensive Rebound.,4,10,-6,29,0.34748993276167606,0.34748993276167606,Marshall,UAB,4,4,NA,280190276,2008-01-19
44,1,13:27,2007,2007,Ed Berrios missed Two Point Layup.,4,10,-6,0,0.3455344563511391,0.3455344563511391,Marshall,UAB,4,4,NA,280190276,2008-01-19
45,1,13:27,2007,2007,Matt Walls Defensive Rebound.,4,10,-6,18,0.3455344563511391,0.3455344563511391,Marshall,UAB,4,4,NA,280190276,2008-01-19
46,1,13:09,1989,1989,Foul on Channing Toney,4,10,-6,4,0.34430848041341555,0.34430848041341555,Marshall,UAB,4,4,NA,280190276,2008-01-19
47,1,13:05,1985,1985,Matt Walls missed Two Point Jumper.,4,10,-6,0,0.3440347084823246,0.3440347084823246,Marshall,UAB,4,4,NA,280190276,2008-01-19
48,1,13:05,1985,1985,Jeremy Mayfield Defensive Rebound.,4,10,-6,17,0.3440347084823246,0.3440347084823246,Marshall,UAB,4,4,NA,280190276,2008-01-19
49,1,12:48,1968,1968,Mike Davis Jr. missed Two Point Jumper.,4,10,-6,0,0.34286558491675684,0.34286558491675684,Marshall,UAB,4,4,NA,280190276,2008-01-19
50,1,12:48,1968,1968,Tirrell Baines Defensive Rebound.,4,10,-6,33,0.34286558491675684,0.34286558491675684,Marshall,UAB,4,4,NA,280190276,2008-01-19
51,1,12:15,1935,1935,Foul on Matt Walls,4,10,-6,0,0.34056908425786936,0.34056908425786936,Marshall,UAB,4,4,NA,280190276,2008-01-19
52,1,12:15,1935,1935,Ed Berrios missed Free Throw.,4,10,-6,0,0.34056908425786936,0.34056908425786936,Marshall,UAB,4,4,NA,280190276,2008-01-19
53,1,12:15,1935,1935,null,4,10,-6,0,0.34056908425786936,0.34056908425786936,Marshall,UAB,4,4,NA,280190276,2008-01-19
54,1,12:15,1935,1935,Ed Berrios missed Free Throw.,4,10,-6,0,0.34056908425786936,0.34056908425786936,Marshall,UAB,4,4,NA,280190276,2008-01-19
55,1,12:15,1935,1935,Mark Dorris Defensive Rebound.,4,10,-6,2,0.34056908425786936,0.34056908425786936,Marshall,UAB,4,4,NA,280190276,2008-01-19
56,1,12:13,1933,1933,Foul on Frank Holmes,4,10,-6,13,0.3404287082321785,0.3404287082321785,Marshall,UAB,4,4,NA,280190276,2008-01-19
57,1,12:00,1920,1920,Matt Walls missed Three Point Jumper.,4,10,-6,0,0.3395155821984521,0.3395155821984521,Marshall,UAB,4,4,NA,280190276,2008-01-19
58,1,12:00,1920,1920,Tirrell Baines Offensive Rebound.,4,10,-6,5,0.3395155821984521,0.3395155821984521,Marshall,UAB,4,4,NA,280190276,2008-01-19
59,1,11:55,1915,1915,Foul on Mike Davis Jr.,4,10,-6,0,0.33916509464592076,0.33916509464592076,Marshall,UAB,4,4,NA,280190276,2008-01-19
60,1,11:55,1915,1915,Official TV Timeout.,4,10,-6,11,0.33916509464592076,0.33916509464592076,Marshall,UAB,4,4,NA,280190276,2008-01-19
61,1,11:44,1904,1904,Mark Dorris missed Two Point Layup.,4,10,-6,0,0.3383952551260644,0.3383952551260644,Marshall,UAB,4,4,NA,280190276,2008-01-19
62,1,11:44,1904,1904,UAB Defensive Rebound.,4,10,-6,13,0.3383952551260644,0.3383952551260644,Marshall,UAB,4,4,NA,280190276,2008-01-19
63,1,11:31,1891,1891,Mark Dorris Steal.,4,10,-6,19,0.33748700057882164,0.33748700057882164,Marshall,UAB,4,4,NA,280190276,2008-01-19
64,1,11:12,1872,1872,Darryl Merthie missed Two Point Layup.,4,10,-6,0,0.3361607714042521,0.3361607714042521,Marshall,UAB,4,4,NA,280190276,2008-01-19
65,1,11:12,1872,1872,Darryl Merthie Offensive Rebound.,4,10,-6,2,0.3361607714042521,0.3361607714042521,Marshall,UAB,4,4,NA,280190276,2008-01-19
66,1,11:10,1870,1870,Darryl Merthie made Two Point Layup.,6,10,-4,16,0.3883980889590534,0.3883980889590534,Marshall,UAB,4,4,NA,280190276,2008-01-19
67,1,10:54,1854,1854,Mark Dorris Steal.,6,10,-4,6,0.3876043442500068,0.3876043442500068,Marshall,UAB,4,4,NA,280190276,2008-01-19
68,1,10:48,1848,1848,Darryl Merthie made Three Point Jumper.  Assisted by Mark Dorris.,9,10,-1,17,0.4713657276360611,0.4713657276360611,Marshall,UAB,4,4,NA,280190276,2008-01-19
69,1,10:31,1831,1831,Foul on Darryl Merthie,9,10,-1,0,0.47114312804382774,0.47114312804382774,Marshall,UAB,4,4,NA,280190276,2008-01-19
70,1,10:31,1831,1831,Frank Holmes made Free Throw.,9,11,-2,0,0.4424778552327264,0.4424778552327264,Marshall,UAB,4,4,NA,280190276,2008-01-19
71,1,10:31,1831,1831,Frank Holmes missed Free Throw.,9,11,-2,0,0.4424778552327264,0.4424778552327264,Marshall,UAB,4,4,NA,280190276,2008-01-19
72,1,10:31,1831,1831,Tirrell Baines Defensive Rebound.,9,11,-2,35,0.4424778552327264,0.4424778552327264,Marshall,UAB,4,4,NA,280190276,2008-01-19
73,1,9:56,1796,1796,Pierre-Marie Altidor-Cespedes missed Three Point Jumper.,9,11,-2,0,0.44156060989361645,0.44156060989361645,Marshall,UAB,4,4,NA,280190276,2008-01-19
74,1,9:56,1796,1796,Channing Toney Defensive Rebound.,9,11,-2,17,0.44156060989361645,0.44156060989361645,Marshall,UAB,4,4,NA,280190276,2008-01-19
75,1,9:39,1779,1779,Lawrence Kinnard missed Three Point Jumper.,9,11,-2,0,0.44110882382112104,0.44110882382112104,Marshall,UAB,4,4,NA,280190276,2008-01-19
76,1,9:39,1779,1779,Channing Toney Offensive Rebound.,9,11,-2,6,0.44110882382112104,0.44110882382112104,Marshall,UAB,4,4,NA,280190276,2008-01-19
77,1,9:33,1773,1773,Channing Toney made Two Point Jumper.,9,13,-4,27,0.3835210773927785,0.3835210773927785,Marshall,UAB,4,4,NA,280190276,2008-01-19
78,1,9:06,1746,1746,Foul on Frank Holmes,9,13,-4,0,0.38211837576384733,0.38211837576384733,Marshall,UAB,4,4,NA,280190276,2008-01-19
79,1,9:06,1746,1746,Tyler Wilkerson missed Free Throw.,9,13,-4,0,0.38211837576384733,0.38211837576384733,Marshall,UAB,4,4,NA,280190276,2008-01-19
80,1,9:06,1746,1746,null,9,13,-4,0,0.38211837576384733,0.38211837576384733,Marshall,UAB,4,4,NA,280190276,2008-01-19
81,1,9:06,1746,1746,Tyler Wilkerson made Free Throw.,10,13,-3,9,0.4108567290597538,0.4108567290597538,Marshall,UAB,4,4,NA,280190276,2008-01-19
82,1,8:57,1737,1737,Robert Vaden missed Three Point Jumper.,10,13,-3,0,0.4104922231725536,0.4104922231725536,Marshall,UAB,4,4,NA,280190276,2008-01-19
83,1,8:57,1737,1737,Matt Walls Defensive Rebound.,10,13,-3,24,0.4104922231725536,0.4104922231725536,Marshall,UAB,4,4,NA,280190276,2008-01-19
84,1,8:33,1713,1713,Matt Walls missed Two Point Jumper.,10,13,-3,0,0.40950597167956254,0.40950597167956254,Marshall,UAB,4,4,NA,280190276,2008-01-19
85,1,8:33,1713,1713,Lawrence Kinnard Defensive Rebound.,10,13,-3,2,0.40950597167956254,0.40950597167956254,Marshall,UAB,4,4,NA,280190276,2008-01-19
86,1,8:31,1711,1711,Foul on Tyler Wilkerson,10,13,-3,12,0.4094227819985265,0.4094227819985265,Marshall,UAB,4,4,NA,280190276,2008-01-19
87,1,8:19,1699,1699,Foul on Tyler Wilkerson,10,13,-3,0,0.40892017056853674,0.40892017056853674,Marshall,UAB,4,4,NA,280190276,2008-01-19
88,1,8:19,1699,1699,Lawrence Kinnard made Free Throw.,10,14,-4,0,0.37960114453955135,0.37960114453955135,Marshall,UAB,4,4,NA,280190276,2008-01-19
89,1,8:19,1699,1699,Lawrence Kinnard made Free Throw.,10,15,-5,10,0.3511354641256455,0.3511354641256455,Marshall,UAB,4,4,NA,280190276,2008-01-19
90,1,8:09,1689,1689,Foul on Aaron Johnson,10,15,-5,12,0.35047025935868686,0.35047025935868686,Marshall,UAB,4,4,NA,280190276,2008-01-19
91,1,7:57,1677,1677,Official TV Timeout.,10,15,-5,24,0.3496779059014259,0.3496779059014259,Marshall,UAB,4,4,NA,280190276,2008-01-19
92,1,7:33,1653,1653,Channing Toney made Three Point Jumper.  Assisted by Aaron Johnson.,10,18,-8,29,0.2682329858051057,0.2682329858051057,Marshall,UAB,4,4,NA,280190276,2008-01-19
93,1,7:04,1624,1624,Pierre-Marie Altidor-Cespedes made Two Point Jumper.,12,18,-6,20,0.3181433467676124,0.3181433467676124,Marshall,UAB,4,4,NA,280190276,2008-01-19
94,1,6:44,1604,1604,Mark Dorris Steal.,12,18,-6,5,0.3167237281964848,0.3167237281964848,Marshall,UAB,4,4,NA,280190276,2008-01-19
95,1,6:39,1599,1599,Tirrell Baines made Two Point Dunk Shot.  Assisted by Pierre-Marie Altidor-Cespedes.,14,18,-4,10,0.3743335917243207,0.3743335917243207,Marshall,UAB,4,4,NA,280190276,2008-01-19
96,1,6:29,1589,1589,Lawrence Kinnard made Two Point Jumper.  Assisted by Aaron Johnson.,14,20,-6,34,0.3156622070514507,0.3156622070514507,Marshall,UAB,4,4,NA,280190276,2008-01-19
97,1,5:55,1555,1555,Matt Walls missed Two Point Jumper.,14,20,-6,0,0.3132389694614022,0.3132389694614022,Marshall,UAB,4,4,NA,280190276,2008-01-19
98,1,5:55,1555,1555,Lawrence Kinnard Defensive Rebound.,14,20,-6,22,0.3132389694614022,0.3132389694614022,Marshall,UAB,4,4,NA,280190276,2008-01-19
99,1,5:33,1533,1533,Channing Toney missed Three Point Jumper.,14,20,-6,0,0.3116378254122213,0.3116378254122213,Marshall,UAB,4,4,NA,280190276,2008-01-19
100,1,5:33,1533,1533,Channing Toney Offensive Rebound.,14,20,-6,6,0.3116378254122213,0.3116378254122213,Marshall,UAB,4,4,NA,280190276,2008-01-19
101,1,5:27,1527,1527,Robert Vaden missed Three Point Jumper.,14,20,-6,0,0.3111942100377493,0.3111942100377493,Marshall,UAB,4,4,NA,280190276,2008-01-19
102,1,5:27,1527,1527,Marshall Defensive Rebound.,14,20,-6,28,0.3111942100377493,0.3111942100377493,Marshall,UAB,4,4,NA,280190276,2008-01-19
103,1,4:59,1499,1499,Pierre-Marie Altidor-Cespedes missed Three Point Jumper.,14,20,-6,0,0.3090724662425412,0.3090724662425412,Marshall,UAB,4,4,NA,280190276,2008-01-19
104,1,4:59,1499,1499,Matt Walls Offensive Rebound.,14,20,-6,23,0.3090724662425412,0.3090724662425412,Marshall,UAB,4,4,NA,280190276,2008-01-19
105,1,4:36,1476,1476,Matt Walls missed Two Point Layup.,14,20,-6,0,0.3072509731892345,0.3072509731892345,Marshall,UAB,4,4,NA,280190276,2008-01-19
106,1,4:36,1476,1476,Matt Walls Offensive Rebound.,14,20,-6,9,0.3072509731892345,0.3072509731892345,Marshall,UAB,4,4,NA,280190276,2008-01-19
107,1,4:27,1467,1467,Mark Dorris missed Three Point Jumper.,14,20,-6,0,0.30651504292458676,0.30651504292458676,Marshall,UAB,4,4,NA,280190276,2008-01-19
108,1,4:27,1467,1467,Marshall Offensive Rebound.,14,20,-6,11,0.30651504292458676,0.30651504292458676,Marshall,UAB,4,4,NA,280190276,2008-01-19
109,1,4:16,1456,1456,Jean Francois Bro-Grebe missed Two Point Jumper.,14,20,-6,0,0.3055957831170316,0.3055957831170316,Marshall,UAB,4,4,NA,280190276,2008-01-19
110,1,4:16,1456,1456,null,14,20,-6,2,0.3055957831170316,0.3055957831170316,Marshall,UAB,4,4,NA,280190276,2008-01-19
111,1,4:14,1454,1454,Foul on Jean Francois Bro-Grebe,14,20,-6,0,0.3054261810778663,0.3054261810778663,Marshall,UAB,4,4,NA,280190276,2008-01-19
112,1,4:14,1454,1454,Howard Crawford made Free Throw.,14,21,-7,0,0.2771742020768957,0.2771742020768957,Marshall,UAB,4,4,NA,280190276,2008-01-19
113,1,4:14,1454,1454,Howard Crawford made Free Throw.,14,22,-8,15,0.25059268888409675,0.25059268888409675,Marshall,UAB,4,4,NA,280190276,2008-01-19
114,1,3:59,1439,1439,Mark Dorris made Three Point Jumper.  Assisted by Pierre-Marie Altidor-Cespedes.,17,22,-5,22,0.33410768748560465,0.33410768748560465,Marshall,UAB,4,4,NA,280190276,2008-01-19
115,1,3:37,1417,1417,Pierre-Marie Altidor-Cespedes Steal.,17,22,-5,13,0.33253134316659233,0.33253134316659233,Marshall,UAB,4,4,NA,280190276,2008-01-19
116,1,3:24,1404,1404,Foul on Reggie Huffman,17,22,-5,0,0.3316265150138883,0.3316265150138883,Marshall,UAB,4,4,NA,280190276,2008-01-19
117,1,3:24,1404,1404,Official TV Timeout.,17,22,-5,15,0.3316265150138883,0.3316265150138883,Marshall,UAB,4,4,NA,280190276,2008-01-19
118,1,3:09,1389,1389,Howard Crawford made Two Point Jumper.  Assisted by Robert Vaden.,17,24,-7,16,0.2713733762800328,0.2713733762800328,Marshall,UAB,4,4,NA,280190276,2008-01-19
119,1,2:53,1373,1373,Pierre-Marie Altidor-Cespedes made Three Point Jumper.  Assisted by Mark Dorris.,20,24,-4,12,0.3616288897924611,0.3616288897924611,Marshall,UAB,4,4,NA,280190276,2008-01-19
120,1,2:41,1361,1361,Howard Crawford missed Two Point Jumper.,20,24,-4,0,0.3609516882260673,0.3609516882260673,Marshall,UAB,4,4,NA,280190276,2008-01-19
121,1,2:41,1361,1361,Tirrell Baines Defensive Rebound.,20,24,-4,9,0.3609516882260673,0.3609516882260673,Marshall,UAB,4,4,NA,280190276,2008-01-19
122,1,2:32,1352,1352,Tirrell Baines made Two Point Dunk Shot.  Assisted by Mark Dorris.,22,24,-2,24,0.42880671685963717,0.42880671685963717,Marshall,UAB,4,4,NA,280190276,2008-01-19
123,1,2:08,1328,1328,Foul on Jean Francois Bro-Grebe,22,24,-2,0,0.4280774644759598,0.4280774644759598,Marshall,UAB,4,4,NA,280190276,2008-01-19
124,1,2:08,1328,1328,Robert Vaden made Free Throw.,22,25,-3,0,0.39304057908468726,0.39304057908468726,Marshall,UAB,4,4,NA,280190276,2008-01-19
125,1,2:08,1328,1328,Robert Vaden made Free Throw.,22,26,-4,31,0.35907094894807906,0.35907094894807906,Marshall,UAB,4,4,NA,280190276,2008-01-19
126,1,1:37,1297,1297,Mark Dorris missed Two Point Jumper.,22,26,-4,0,0.35723432665229116,0.35723432665229116,Marshall,UAB,4,4,NA,280190276,2008-01-19
127,1,1:37,1297,1297,Reggie Huffman Defensive Rebound.,22,26,-4,24,0.35723432665229116,0.35723432665229116,Marshall,UAB,4,4,NA,280190276,2008-01-19
128,1,1:13,1273,1273,Reggie Huffman missed Two Point Jumper.,22,26,-4,0,0.3557313593653764,0.3557313593653764,Marshall,UAB,4,4,NA,280190276,2008-01-19
129,1,1:13,1273,1273,Matt Walls Defensive Rebound.,22,26,-4,19,0.3557313593653764,0.3557313593653764,Marshall,UAB,4,4,NA,280190276,2008-01-19
130,1,0:54,1254,1254,Matt Walls made Two Point Jumper.,24,26,-2,25,0.4256268303025821,0.4256268303025821,Marshall,UAB,4,4,NA,280190276,2008-01-19
131,1,0:29,1229,1229,Foul on Jesse Oglesby,24,26,-2,0,0.4246813332238164,0.4246813332238164,Marshall,UAB,4,4,NA,280190276,2008-01-19
132,1,0:29,1229,1229,Reggie Huffman made Free Throw.,24,27,-3,0,0.38808297810989856,0.38808297810989856,Marshall,UAB,4,4,NA,280190276,2008-01-19
133,1,0:29,1229,1229,Reggie Huffman missed Free Throw.,24,27,-3,0,0.38808297810989856,0.38808297810989856,Marshall,UAB,4,4,NA,280190276,2008-01-19
134,1,0:29,1229,1229,Tirrell Baines Defensive Rebound.,24,27,-3,5,0.38808297810989856,0.38808297810989856,Marshall,UAB,4,4,NA,280190276,2008-01-19
135,1,0:24,1224,1224,Marshall 30 Second Timeout.,24,27,-3,22,0.38779329767761245,0.38779329767761245,Marshall,UAB,3,4,NA,280190276,2008-01-19
136,1,0:02,1202,1202,Mark Dorris made Two Point Jumper.,26,27,-1,2,0.4615607977793232,0.4615607977793232,Marshall,UAB,3,4,NA,280190276,2008-01-19
137,1,0:00,1200,1200,End of the 1st Half.,26,27,-1,0,0.4615187446422248,0.4615187446422248,Marshall,UAB,3,4,NA,280190276,2008-01-19
138,2,20:00,1200,1200,PLAY,26,27,-1,14,0.4615187446422248,0.4615187446422248,Marshall,UAB,4,4,NA,280190276,2008-01-19
139,2,19:46,1186,1186,Robert Vaden missed Two Point Jumper.,26,27,-1,0,0.4612287581741608,0.4612287581741608,Marshall,UAB,4,4,NA,280190276,2008-01-19
140,2,19:46,1186,1186,Robbie Jackson Defensive Rebound.,26,27,-1,28,0.4612287581741608,0.4612287581741608,Marshall,UAB,4,4,NA,280190276,2008-01-19
141,2,19:18,1158,1158,Darryl Merthie missed Three Point Jumper.,26,27,-1,0,0.4606659502849381,0.4606659502849381,Marshall,UAB,4,4,NA,280190276,2008-01-19
142,2,19:18,1158,1158,Reggie Huffman Defensive Rebound.,26,27,-1,15,0.4606659502849381,0.4606659502849381,Marshall,UAB,4,4,NA,280190276,2008-01-19
143,2,19:03,1143,1143,Robbie Jackson Steal.,26,27,-1,7,0.46036969936837513,0.46036969936837513,Marshall,UAB,4,4,NA,280190276,2008-01-19
144,2,18:56,1136,1136,Frank Holmes Steal.,26,27,-1,10,0.4602318320570893,0.4602318320570893,Marshall,UAB,4,4,NA,280190276,2008-01-19
145,2,18:46,1126,1126,Frank Holmes made Two Point Layup.  Assisted by Lawrence Kinnard.,26,29,-3,34,0.3821083209792706,0.3821083209792706,Marshall,UAB,4,4,NA,280190276,2008-01-19
146,2,18:12,1092,1092,Darryl Merthie made Two Point Layup.,28,29,-1,37,0.45935407383572313,0.45935407383572313,Marshall,UAB,4,4,NA,280190276,2008-01-19
147,2,17:35,1055,1055,Aaron Johnson missed Two Point Jumper.,28,29,-1,0,0.45857124879001704,0.45857124879001704,Marshall,UAB,4,4,NA,280190276,2008-01-19
148,2,17:35,1055,1055,Tirrell Baines Defensive Rebound.,28,29,-1,30,0.45857124879001704,0.45857124879001704,Marshall,UAB,4,4,NA,280190276,2008-01-19
149,2,17:05,1025,1025,Foul on Robbie Jackson,28,29,-1,10,0.4578813522351488,0.4578813522351488,Marshall,UAB,4,4,NA,280190276,2008-01-19
150,2,16:55,1015,1015,Robert Vaden missed Two Point Jumper.,28,29,-1,0,0.4576369333988189,0.4576369333988189,Marshall,UAB,4,4,NA,280190276,2008-01-19
151,2,16:55,1015,1015,Tyler Wilkerson Defensive Rebound.,28,29,-1,15,0.4576369333988189,0.4576369333988189,Marshall,UAB,4,4,NA,280190276,2008-01-19
152,2,16:40,1000,1000,Tyler Wilkerson made Two Point Jumper.,30,29,1,25,0.5427455686498812,0.5427455686498812,Marshall,UAB,4,4,NA,280190276,2008-01-19
153,2,16:15,975,975,Robert Vaden missed Two Point Jumper.,30,29,1,0,0.5434310301525326,0.5434310301525326,Marshall,UAB,4,4,NA,280190276,2008-01-19
154,2,16:15,975,975,Darryl Merthie Defensive Rebound.,30,29,1,11,0.5434310301525326,0.5434310301525326,Marshall,UAB,4,4,NA,280190276,2008-01-19
155,2,16:04,964,964,Mark Dorris made Three Point Jumper.  Assisted by Darryl Merthie.,33,29,4,19,0.668581061021867,0.668581061021867,Marshall,UAB,4,4,NA,280190276,2008-01-19
156,2,15:45,945,945,UAB 30 Second Timeout.,33,29,4,6,0.6704009859344976,0.6704009859344976,Marshall,UAB,4,3,NA,280190276,2008-01-19
157,2,15:39,939,939,Lawrence Kinnard missed Three Point Jumper.,33,29,4,0,0.6709389552810788,0.6709389552810788,Marshall,UAB,4,3,NA,280190276,2008-01-19
158,2,15:39,939,939,Darryl Merthie Defensive Rebound.,33,29,4,13,0.6709389552810788,0.6709389552810788,Marshall,UAB,4,3,NA,280190276,2008-01-19
159,2,15:26,926,926,Foul on Lawrence Kinnard,33,29,4,0,0.6720554350973298,0.6720554350973298,Marshall,UAB,4,3,NA,280190276,2008-01-19
160,2,15:26,926,926,Official TV Timeout.,33,29,4,0,0.6720554350973298,0.6720554350973298,Marshall,UAB,4,3,NA,280190276,2008-01-19
161,2,15:26,926,926,Darryl Merthie made Free Throw.,34,29,5,0,0.7103059252714538,0.7103059252714538,Marshall,UAB,4,3,NA,280190276,2008-01-19
162,2,15:26,926,926,Darryl Merthie made Free Throw.,35,29,6,11,0.7457826070874598,0.7457826070874598,Marshall,UAB,4,3,NA,280190276,2008-01-19
163,2,15:15,915,915,Robert Vaden made Three Point Jumper.  Assisted by Ed Berrios.,35,32,3,28,0.6320898843223866,0.6320898843223866,Marshall,UAB,4,3,NA,280190276,2008-01-19
164,2,14:47,887,887,Lawrence Kinnard Steal.,35,32,3,0,0.6338230808452237,0.6338230808452237,Marshall,UAB,4,3,NA,280190276,2008-01-19
165,2,14:47,887,887,Foul on Mark Dorris,35,32,3,14,0.6338230808452237,0.6338230808452237,Marshall,UAB,4,3,NA,280190276,2008-01-19
166,2,14:33,873,873,Robert Vaden missed Two Point Jumper.,35,32,3,0,0.6346729435704266,0.6346729435704266,Marshall,UAB,4,3,NA,280190276,2008-01-19
167,2,14:33,873,873,Tyler Wilkerson Defensive Rebound.,35,32,3,7,0.6346729435704266,0.6346729435704266,Marshall,UAB,4,3,NA,280190276,2008-01-19
168,2,14:26,866,866,Mark Dorris missed Two Point Jumper.,35,32,3,0,0.635100408213449,0.635100408213449,Marshall,UAB,4,3,NA,280190276,2008-01-19
169,2,14:26,866,866,Ed Berrios Defensive Rebound.,35,32,3,25,0.635100408213449,0.635100408213449,Marshall,UAB,4,3,NA,280190276,2008-01-19
170,2,14:01,841,841,Channing Toney missed Three Point Jumper.,35,32,3,0,0.6366749904098186,0.6366749904098186,Marshall,UAB,4,3,NA,280190276,2008-01-19
171,2,14:01,841,841,Howard Crawford Offensive Rebound.,35,32,3,3,0.6366749904098186,0.6366749904098186,Marshall,UAB,4,3,NA,280190276,2008-01-19
172,2,13:58,838,838,Foul on Mark Dorris,35,32,3,1,0.6368716891785073,0.6368716891785073,Marshall,UAB,4,3,NA,280190276,2008-01-19
173,2,13:57,837,837,Lawrence Kinnard missed Two Point Layup.,35,32,3,0,0.6369377313183482,0.6369377313183482,Marshall,UAB,4,3,NA,280190276,2008-01-19
174,2,13:57,837,837,Lawrence Kinnard Offensive Rebound.,35,32,3,3,0.6369377313183482,0.6369377313183482,Marshall,UAB,4,3,NA,280190276,2008-01-19
175,2,13:54,834,834,Lawrence Kinnard missed Two Point Jumper.,35,32,3,0,0.6371373625758671,0.6371373625758671,Marshall,UAB,4,3,NA,280190276,2008-01-19
176,2,13:54,834,834,UAB Offensive Rebound.,35,32,3,19,0.6371373625758671,0.6371373625758671,Marshall,UAB,4,3,NA,280190276,2008-01-19
177,2,13:35,815,815,Channing Toney missed Two Point Jumper.,35,32,3,0,0.6384629247566561,0.6384629247566561,Marshall,UAB,4,3,NA,280190276,2008-01-19
178,2,13:35,815,815,Tyler Wilkerson Defensive Rebound.,35,32,3,15,0.6384629247566561,0.6384629247566561,Marshall,UAB,4,3,NA,280190276,2008-01-19
179,2,13:20,800,800,Matt Walls missed Three Point Jumper.,35,32,3,0,0.639601356924071,0.639601356924071,Marshall,UAB,4,3,NA,280190276,2008-01-19
180,2,13:20,800,800,Lawrence Kinnard Defensive Rebound.,35,32,3,28,0.639601356924071,0.639601356924071,Marshall,UAB,4,3,NA,280190276,2008-01-19
