play_id,half,time_remaining_half,secs_remaining,secs_remaining_absolute,description,home_score,away_score,score_diff,play_length,win_prob,naive_win_prob,home,away,home_time_out_remaining,away_time_out_remaining,home_favored_by,game_id,date
1,1,20:00,2400,2400,PLAY,0,0,0,15,0.5,0.5,Niagara,Akron,4,4,NA,283380315,2008-12-03
2,1,19:45,2385,2385,Foul on Anthony (Humpty Hitchens,0,0,0,0,0.5,0.5,Niagara,Akron,4,4,NA,283380315,2008-12-03
3,1,19:45,2385,2385,Anthony Nelson made Free Throw.,1,0,1,0,0.5222146906615953,0.5222146906615953,Niagara,Akron,4,4,NA,283380315,2008-12-03
4,1,19:45,2385,2385,Anthony Nelson missed Free Throw.,1,0,1,0,0.5222146906615953,0.5222146906615953,Niagara,Akron,4,4,NA,283380315,2008-12-03
5,1,19:45,2385,2385,Akron Defensive Rebound.,1,0,1,16,0.5222146906615953,0.5222146906615953,Niagara,Akron,4,4,NA,283380315,2008-12-03
6,1,19:29,2369,2369,Darryl Roberts made Two Point Jumper.,1,2,-1,41,0.477614162257752,0.477614162257752,Niagara,Akron,4,4,NA,283380315,2008-12-03
7,1,18:48,2328,2328,Anthony (Humpty Hitchens missed Three Point Jumper.,1,2,-1,0,0.477167629491024,0.477167629491024,Niagara,Akron,4,4,NA,283380315,2008-12-03
8,1,18:48,2328,2328,Mike Bardo Offensive Rebound.,1,2,-1,30,0.477167629491024,0.477167629491024,Niagara,Akron,4,4,NA,283380315,2008-12-03
9,1,18:18,2298,2298,Nate Linhart made Three Point Jumper.  Assisted by Anthony (Humpty Hitchens.,1,5,-4,15,0.4083200992703067,0.4083200992703067,Niagara,Akron,4,4,NA,283380315,2008-12-03
10,1,18:03,2283,2283,Tyrone Lewis missed Two Point Layup.,1,5,-4,0,0.40766798050937575,0.40766798050937575,Niagara,Akron,4,4,NA,283380315,2008-12-03
11,1,18:03,2283,2283,Tyrone Lewis Offensive Rebound.,1,5,-4,4,0.40766798050937575,0.40766798050937575,Niagara,Akron,4,4,NA,283380315,2008-12-03
12,1,17:59,2279,2279,Jimmy Conyers Steal.,1,5,-4,4,0.407493417154684,0.407493417154684,Niagara,Akron,4,4,NA,283380315,2008-12-03
13,1,17:55,2275,2275,Anthony Nelson Steal.,1,5,-4,3,0.407318586592522,0.407318586592522,Niagara,Akron,4,4,NA,283380315,2008-12-03
14,1,17:52,2272,2272,Tyrone Lewis missed Two Point Layup.,1,5,-4,2,0.4071872923306549,0.4071872923306549,Niagara,Akron,4,4,NA,283380315,2008-12-03
15,1,17:50,2270,2270,Darryl Roberts Defensive Rebound.,1,5,-4,15,0.40709968279574404,0.40709968279574404,Niagara,Akron,4,4,NA,283380315,2008-12-03
16,1,17:35,2255,2255,Jimmy Conyers missed Three Point Jumper.,1,5,-4,0,0.4064406591398661,0.4064406591398661,Niagara,Akron,4,4,NA,283380315,2008-12-03
17,1,17:35,2255,2255,Nate Linhart Offensive Rebound.,1,5,-4,23,0.4064406591398661,0.4064406591398661,Niagara,Akron,4,4,NA,283380315,2008-12-03
18,1,17:12,2232,2232,Anthony (Humpty Hitchens made Three Point Jumper.,1,8,-7,18,0.33847424144957017,0.33847424144957017,Niagara,Akron,4,4,NA,283380315,2008-12-03
19,1,16:54,2214,2214,Benson Egemonye made Two Point Dunk Shot.  Assisted by Rob Garrison.,3,8,-5,49,0.38159274137171784,0.38159274137171784,Niagara,Akron,4,4,NA,283380315,2008-12-03
20,1,16:05,2165,2165,Foul on Mike Bardo,3,8,-5,0,0.37890944732500126,0.37890944732500126,Niagara,Akron,4,4,NA,283380315,2008-12-03
21,1,16:05,2165,2165,Benson Egemonye missed Free Throw.,3,8,-5,0,0.37890944732500126,0.37890944732500126,Niagara,Akron,4,4,NA,283380315,2008-12-03
22,1,16:05,2165,2165,null,3,8,-5,0,0.37890944732500126,0.37890944732500126,Niagara,Akron,4,4,NA,283380315,2008-12-03
23,1,16:05,2165,2165,Benson Egemonye missed Free Throw.,3,8,-5,0,0.37890944732500126,0.37890944732500126,Niagara,Akron,4,4,NA,283380315,2008-12-03
24,1,16:05,2165,2165,Nate Linhart Defensive Rebound.,3,8,-5,15,0.37890944732500126,0.37890944732500126,Niagara,Akron,4,4,NA,283380315,2008-12-03
25,1,15:50,2150,2150,Foul on Bilal Benn,3,8,-5,0,0.378083072565422,0.378083072565422,Niagara,Akron,4,4,NA,283380315,2008-12-03
26,1,15:50,2150,2150,Official TV Timeout.,3,8,-5,8,0.378083072565422,0.378083072565422,Niagara,Akron,4,4,NA,283380315,2008-12-03
27,1,15:42,2142,2142,Tyrone Lewis Steal.,3,8,-5,2,0.37764087677205194,0.37764087677205194,Niagara,Akron,4,4,NA,283380315,2008-12-03
28,1,15:40,2140,2140,Tyrone Lewis missed Two Point Layup.,3,8,-5,0,0.37753016251001736,0.37753016251001736,Niagara,Akron,4,4,NA,283380315,2008-12-03
29,1,15:40,2140,2140,Bilal Benn Offensive Rebound.,3,8,-5,4,0.37753016251001736,0.37753016251001736,Niagara,Akron,4,4,NA,283380315,2008-12-03
30,1,15:36,2136,2136,Bilal Benn missed Two Point Tip Shot.,3,8,-5,0,0.3773085313601949,0.3773085313601949,Niagara,Akron,4,4,NA,283380315,2008-12-03
31,1,15:36,2136,2136,Bilal Benn Offensive Rebound.,3,8,-5,3,0.3773085313601949,0.3773085313601949,Niagara,Akron,4,4,NA,283380315,2008-12-03
32,1,15:33,2133,2133,Bilal Benn made Two Point Layup.,5,8,-3,26,0.425308705660547,0.425308705660547,Niagara,Akron,4,4,NA,283380315,2008-12-03
33,1,15:07,2107,2107,Nate Linhart made Three Point Jumper.  Assisted by Darryl Roberts.,5,11,-6,16,0.35218630061526435,0.35218630061526435,Niagara,Akron,4,4,NA,283380315,2008-12-03
34,1,14:51,2091,2091,Bilal Benn missed Two Point Jumper.,5,11,-6,0,0.3511382390001378,0.3511382390001378,Niagara,Akron,4,4,NA,283380315,2008-12-03
35,1,14:51,2091,2091,Chris McKnight Defensive Rebound.,5,11,-6,10,0.3511382390001378,0.3511382390001378,Niagara,Akron,4,4,NA,283380315,2008-12-03
36,1,14:41,2081,2081,Nate Linhart made Two Point Jumper.,5,13,-8,22,0.30521809828576235,0.30521809828576235,Niagara,Akron,4,4,NA,283380315,2008-12-03
37,1,14:19,2059,2059,Anthony Nelson missed Two Point Jumper.,5,13,-8,1,0.3034113713418689,0.3034113713418689,Niagara,Akron,4,4,NA,283380315,2008-12-03
38,1,14:18,2058,2058,Darryl Roberts Defensive Rebound.,5,13,-8,6,0.30332896085192995,0.30332896085192995,Niagara,Akron,4,4,NA,283380315,2008-12-03
39,1,14:12,2052,2052,Foul on Anthony Nelson,5,13,-8,8,0.30283395532334895,0.30283395532334895,Niagara,Akron,4,4,NA,283380315,2008-12-03
40,1,14:04,2044,2044,Steve McNees missed Three Point Jumper.,5,13,-8,0,0.3021724745861079,0.3021724745861079,Niagara,Akron,4,4,NA,283380315,2008-12-03
41,1,14:04,2044,2044,Chris McKnight Offensive Rebound.,5,13,-8,17,0.3021724745861079,0.3021724745861079,Niagara,Akron,4,4,NA,283380315,2008-12-03
42,1,13:47,2027,2027,Chris McKnight missed Two Point Jumper.,5,13,-8,0,0.30076103113003855,0.30076103113003855,Niagara,Akron,4,4,NA,283380315,2008-12-03
43,1,13:47,2027,2027,Kamau Gordon Defensive Rebound.,5,13,-8,9,0.30076103113003855,0.30076103113003855,Niagara,Akron,4,4,NA,283380315,2008-12-03
44,1,13:38,2018,2018,Foul on Kamau Gordon,5,13,-8,10,0.3000104814356509,0.3000104814356509,Niagara,Akron,4,4,NA,283380315,2008-12-03
45,1,13:28,2008,2008,Chris McKnight missed Three Point Jumper.,5,13,-8,0,0.2991737409084151,0.2991737409084151,Niagara,Akron,4,4,NA,283380315,2008-12-03
46,1,13:28,2008,2008,Darryl Roberts Offensive Rebound.,5,13,-8,4,0.2991737409084151,0.2991737409084151,Niagara,Akron,4,4,NA,283380315,2008-12-03
47,1,13:24,2004,2004,Darryl Roberts made Two Point Jumper.,5,15,-10,24,0.2561558528132272,0.2561558528132272,Niagara,Akron,4,4,NA,283380315,2008-12-03
48,1,13:00,1980,1980,Demetrius Williamson missed Three Point Jumper.,5,15,-10,0,0.2538577904175036,0.2538577904175036,Niagara,Akron,4,4,NA,283380315,2008-12-03
49,1,13:00,1980,1980,Bilal Benn Offensive Rebound.,5,15,-10,8,0.2538577904175036,0.2538577904175036,Niagara,Akron,4,4,NA,283380315,2008-12-03
50,1,12:52,1972,1972,Foul on Brett McKnight,5,15,-10,0,0.25308810843445373,0.25308810843445373,Niagara,Akron,4,4,NA,283380315,2008-12-03
51,1,12:52,1972,1972,Kamau Gordon made Free Throw.,6,15,-9,0,0.27408620565585934,0.27408620565585934,Niagara,Akron,4,4,NA,283380315,2008-12-03
52,1,12:52,1972,1972,Kamau Gordon made Free Throw.,7,15,-8,19,0.29613573129403054,0.29613573129403054,Niagara,Akron,4,4,NA,283380315,2008-12-03
53,1,12:33,1953,1953,Chris McKnight missed Two Point Layup.,7,15,-8,0,0.2945150895670896,0.2945150895670896,Niagara,Akron,4,4,NA,283380315,2008-12-03
54,1,12:33,1953,1953,Chris McKnight Offensive Rebound.,7,15,-8,4,0.2945150895670896,0.2945150895670896,Niagara,Akron,4,4,NA,283380315,2008-12-03
55,1,12:29,1949,1949,Brett McKnight made Two Point Jumper.  Assisted by Steve McNees.,7,17,-10,14,0.25086451272956084,0.25086451272956084,Niagara,Akron,4,4,NA,283380315,2008-12-03
56,1,12:15,1935,1935,Tyrone Lewis missed Three Point Jumper.,7,17,-10,0,0.24950287834241605,0.24950287834241605,Niagara,Akron,4,4,NA,283380315,2008-12-03
57,1,12:15,1935,1935,Kamau Gordon Offensive Rebound.,7,17,-10,8,0.24950287834241605,0.24950287834241605,Niagara,Akron,4,4,NA,283380315,2008-12-03
58,1,12:07,1927,1927,Demetrius Williamson made Two Point Layup.  Assisted by Bilal Benn.,9,17,-8,20,0.29227700505469395,0.29227700505469395,Niagara,Akron,4,4,NA,283380315,2008-12-03
59,1,11:47,1907,1907,Chris McKnight missed Two Point Jumper.,9,17,-8,0,0.2905552338718042,0.2905552338718042,Niagara,Akron,4,4,NA,283380315,2008-12-03
60,1,11:47,1907,1907,Brett McKnight Offensive Rebound.,9,17,-8,2,0.2905552338718042,0.2905552338718042,Niagara,Akron,4,4,NA,283380315,2008-12-03
61,1,11:45,1905,1905,Chris McKnight missed Two Point Layup.,9,17,-8,0,0.29038357435365314,0.29038357435365314,Niagara,Akron,4,4,NA,283380315,2008-12-03
62,1,11:45,1905,1905,Bilal Benn Defensive Rebound.,9,17,-8,6,0.29038357435365314,0.29038357435365314,Niagara,Akron,4,4,NA,283380315,2008-12-03
63,1,11:39,1899,1899,Demetrius Williamson made Two Point Layup.  Assisted by Bilal Benn.,11,17,-6,39,0.33804577147245934,0.33804577147245934,Niagara,Akron,4,4,NA,283380315,2008-12-03
64,1,11:00,1860,1860,Chris McKnight missed Three Point Jumper.,11,17,-6,0,0.335322771193598,0.335322771193598,Niagara,Akron,4,4,NA,283380315,2008-12-03
65,1,11:00,1860,1860,Tyrone Lewis Defensive Rebound.,11,17,-6,7,0.335322771193598,0.335322771193598,Niagara,Akron,4,4,NA,283380315,2008-12-03
66,1,10:53,1853,1853,Demetrius Williamson made Three Point Jumper.  Assisted by Tyrone Lewis.,14,17,-3,30,0.4150318595916069,0.4150318595916069,Niagara,Akron,4,4,NA,283380315,2008-12-03
67,1,10:23,1823,1823,Official TV Timeout.,14,17,-3,28,0.41388333014826767,0.41388333014826767,Niagara,Akron,4,4,NA,283380315,2008-12-03
68,1,9:55,1795,1795,Bilal Benn missed Three Point Jumper.,14,17,-3,0,0.4127988323161505,0.4127988323161505,Niagara,Akron,4,4,NA,283380315,2008-12-03
69,1,9:55,1795,1795,Brett McKnight Defensive Rebound.,14,17,-3,29,0.4127988323161505,0.4127988323161505,Niagara,Akron,4,4,NA,283380315,2008-12-03
70,1,9:26,1766,1766,Anthony (Humpty Hitchens missed Three Point Jumper.,14,17,-3,0,0.41165745737907367,0.41165745737907367,Niagara,Akron,4,4,NA,283380315,2008-12-03
71,1,9:26,1766,1766,Benson Egemonye Defensive Rebound.,14,17,-3,11,0.41165745737907367,0.41165745737907367,Niagara,Akron,4,4,NA,283380315,2008-12-03
72,1,9:15,1755,1755,Demetrius Williamson made Two Point Layup.,16,17,-1,0,0.47012478463845353,0.47012478463845353,Niagara,Akron,4,4,NA,283380315,2008-12-03
73,1,9:15,1755,1755,Foul on Steve McNees,16,17,-1,0,0.47012478463845353,0.47012478463845353,Niagara,Akron,4,4,NA,283380315,2008-12-03
74,1,9:15,1755,1755,Demetrius Williamson missed Free Throw.,16,17,-1,0,0.47012478463845353,0.47012478463845353,Niagara,Akron,4,4,NA,283380315,2008-12-03
75,1,9:15,1755,1755,Nikola Cvetinovic Defensive Rebound.,16,17,-1,10,0.47012478463845353,0.47012478463845353,Niagara,Akron,4,4,NA,283380315,2008-12-03
76,1,9:05,1745,1745,Brett McKnight made Two Point Layup.  Assisted by Steve McNees.,16,19,-3,16,0.4108163627112983,0.4108163627112983,Niagara,Akron,4,4,NA,283380315,2008-12-03
77,1,8:49,1729,1729,Tyrone Lewis missed Two Point Jumper.,16,19,-3,3,0.4101658540280961,0.4101658540280961,Niagara,Akron,4,4,NA,283380315,2008-12-03
78,1,8:46,1726,1726,Anthony (Humpty Hitchens Defensive Rebound.,16,19,-3,4,0.4100428675384056,0.4100428675384056,Niagara,Akron,4,4,NA,283380315,2008-12-03
79,1,8:42,1722,1722,Nikola Cvetinovic made Two Point Layup.  Assisted by Nate Linhart.,16,21,-5,17,0.35264177554111925,0.35264177554111925,Niagara,Akron,4,4,NA,283380315,2008-12-03
80,1,8:25,1705,1705,Demetrius Williamson made Three Point Jumper.  Assisted by Anthony Nelson.,19,21,-2,23,0.4390728765312243,0.4390728765312243,Niagara,Akron,4,4,NA,283380315,2008-12-03
81,1,8:02,1682,1682,Rob Garrison Steal.,19,21,-2,10,0.4384131339867359,0.4384131339867359,Niagara,Akron,4,4,NA,283380315,2008-12-03
82,1,7:52,1672,1672,Foul on Nikola Cvetinovic,19,21,-2,0,0.43812986123546277,0.43812986123546277,Niagara,Akron,4,4,NA,283380315,2008-12-03
83,1,7:52,1672,1672,Official TV Timeout.,19,21,-2,23,0.43812986123546277,0.43812986123546277,Niagara,Akron,4,4,NA,283380315,2008-12-03
84,1,7:29,1649,1649,Rob Garrison missed Two Point Layup.,19,21,-2,0,0.4374917851954577,0.4374917851954577,Niagara,Akron,4,4,NA,283380315,2008-12-03
85,1,7:29,1649,1649,Jimmy Conyers Defensive Rebound.,19,21,-2,24,0.4374917851954577,0.4374917851954577,Niagara,Akron,4,4,NA,283380315,2008-12-03
86,1,7:05,1625,1625,Steve McNees missed Two Point Jumper.,19,21,-2,0,0.4368401289001044,0.4368401289001044,Niagara,Akron,4,4,NA,283380315,2008-12-03
87,1,7:05,1625,1625,Steve McNees Offensive Rebound.,19,21,-2,3,0.4368401289001044,0.4368401289001044,Niagara,Akron,4,4,NA,283380315,2008-12-03
88,1,7:02,1622,1622,Steve McNees made Two Point Tip Shot.,19,23,-4,8,0.37551017412741217,0.37551017412741217,Niagara,Akron,4,4,NA,283380315,2008-12-03
89,1,6:54,1614,1614,Tyrone Lewis made Three Point Jumper.  Assisted by Anthony Nelson.,22,23,-1,37,0.4681433364954899,0.4681433364954899,Niagara,Akron,4,4,NA,283380315,2008-12-03
90,1,6:17,1577,1577,Steve McNees missed Three Point Jumper.,22,23,-1,0,0.4676402664860902,0.4676402664860902,Niagara,Akron,4,4,NA,283380315,2008-12-03
91,1,6:17,1577,1577,Mike Bardo Offensive Rebound.,22,23,-1,7,0.4676402664860902,0.4676402664860902,Niagara,Akron,4,4,NA,283380315,2008-12-03
92,1,6:10,1570,1570,Steve McNees made Two Point Layup.  Assisted by Mike Bardo.,22,25,-3,30,0.4037135981053401,0.4037135981053401,Niagara,Akron,4,4,NA,283380315,2008-12-03
93,1,5:40,1540,1540,Foul on Kashief Edwards,22,25,-3,0,0.4025045084621831,0.4025045084621831,Niagara,Akron,4,4,NA,283380315,2008-12-03
94,1,5:40,1540,1540,Anthony (Humpty Hitchens Steal.,22,25,-3,13,0.4025045084621831,0.4025045084621831,Niagara,Akron,4,4,NA,283380315,2008-12-03
95,1,5:27,1527,1527,Bilal Benn Steal.,22,25,-3,6,0.40196816700300636,0.40196816700300636,Niagara,Akron,4,4,NA,283380315,2008-12-03
96,1,5:21,1521,1521,Rob Garrison missed Three Point Jumper.,22,25,-3,0,0.4017173598922115,0.4017173598922115,Niagara,Akron,4,4,NA,283380315,2008-12-03
97,1,5:21,1521,1521,Nate Linhart Defensive Rebound.,22,25,-3,7,0.4017173598922115,0.4017173598922115,Niagara,Akron,4,4,NA,283380315,2008-12-03
98,1,5:14,1514,1514,Tyrone Lewis Steal.,22,25,-3,18,0.4014218345030141,0.4014218345030141,Niagara,Akron,4,4,NA,283380315,2008-12-03
99,1,4:56,1496,1496,Tyrone Lewis Steal.,22,25,-3,1,0.4006456570168192,0.4006456570168192,Niagara,Akron,4,4,NA,283380315,2008-12-03
100,1,4:55,1495,1495,Tyrone Lewis made Two Point Dunk Shot.,24,25,-1,18,0.46647053743223055,0.46647053743223055,Niagara,Akron,4,4,NA,283380315,2008-12-03
101,1,4:37,1477,1477,Jimmy Conyers missed Two Point Jumper.,24,25,-1,0,0.4661923822038113,0.4661923822038113,Niagara,Akron,4,4,NA,283380315,2008-12-03
102,1,4:37,1477,1477,Bilal Benn Defensive Rebound.,24,25,-1,7,0.4661923822038113,0.4661923822038113,Niagara,Akron,4,4,NA,283380315,2008-12-03
103,1,4:30,1470,1470,Nate Linhart Steal.,24,25,-1,0,0.4660812760896584,0.4660812760896584,Niagara,Akron,4,4,NA,283380315,2008-12-03
104,1,4:30,1470,1470,Foul on Benson Egemonye,24,25,-1,15,0.4660812760896584,0.4660812760896584,Niagara,Akron,4,4,NA,283380315,2008-12-03
105,1,4:15,1455,1455,Chris McKnight made Two Point Jumper.  Assisted by Darryl Roberts.,24,27,-3,27,0.3987694402089925,0.3987694402089925,Niagara,Akron,4,4,NA,283380315,2008-12-03
106,1,3:48,1428,1428,Tyrone Lewis Steal.,24,27,-3,7,0.39748684697140607,0.39748684697140607,Niagara,Akron,4,4,NA,283380315,2008-12-03
107,1,3:41,1421,1421,Tyrone Lewis missed Two Point Layup.,24,27,-3,0,0.3971646936869728,0.3971646936869728,Niagara,Akron,4,4,NA,283380315,2008-12-03
108,1,3:41,1421,1421,Jimmy Conyers Defensive Rebound.,24,27,-3,7,0.3971646936869728,0.3971646936869728,Niagara,Akron,4,4,NA,283380315,2008-12-03
109,1,3:34,1414,1414,Anthony (Humpty Hitchens missed Three Point Jumper.,24,27,-3,0,0.3968461725613409,0.3968461725613409,Niagara,Akron,4,4,NA,283380315,2008-12-03
110,1,3:34,1414,1414,Benson Egemonye Defensive Rebound.,24,27,-3,17,0.3968461725613409,0.3968461725613409,Niagara,Akron,4,4,NA,283380315,2008-12-03
111,1,3:17,1397,1397,Foul on Jimmy Conyers,24,27,-3,0,0.3960847498136795,0.3960847498136795,Niagara,Akron,4,4,NA,283380315,2008-12-03
112,1,3:17,1397,1397,Official TV Timeout.,24,27,-3,0,0.3960847498136795,0.3960847498136795,Niagara,Akron,4,4,NA,283380315,2008-12-03
113,1,3:17,1397,1397,Anthony Nelson made Free Throw.,25,27,-2,0,0.4301586779675893,0.4301586779675893,Niagara,Akron,4,4,NA,283380315,2008-12-03
114,1,3:17,1397,1397,Anthony Nelson missed Free Throw.,25,27,-2,0,0.4301586779675893,0.4301586779675893,Niagara,Akron,4,4,NA,283380315,2008-12-03
115,1,3:17,1397,1397,Mike Bardo Defensive Rebound.,25,27,-2,19,0.4301586779675893,0.4301586779675893,Niagara,Akron,4,4,NA,283380315,2008-12-03
116,1,2:58,1378,1378,Brett McKnight made Two Point Jumper.,25,29,-4,16,0.3619112843602141,0.3619112843602141,Niagara,Akron,4,4,NA,283380315,2008-12-03
117,1,2:42,1362,1362,Tyrone Lewis missed Two Point Jumper.,25,29,-4,0,0.36100814551409993,0.36100814551409993,Niagara,Akron,4,4,NA,283380315,2008-12-03
118,1,2:42,1362,1362,Bilal Benn Offensive Rebound.,25,29,-4,8,0.36100814551409993,0.36100814551409993,Niagara,Akron,4,4,NA,283380315,2008-12-03
119,1,2:34,1354,1354,Demetrius Williamson made Three Point Jumper.  Assisted by Bilal Benn.,28,29,-1,39,0.4642516270003991,0.4642516270003991,Niagara,Akron,4,4,NA,283380315,2008-12-03
120,1,1:55,1315,1315,Brett McKnight missed Two Point Jumper.,28,29,-1,0,0.4636456929129441,0.4636456929129441,Niagara,Akron,4,4,NA,283380315,2008-12-03
121,1,1:55,1315,1315,Demetrius Williamson Defensive Rebound.,28,29,-1,14,0.4636456929129441,0.4636456929129441,Niagara,Akron,4,4,NA,283380315,2008-12-03
122,1,1:41,1301,1301,Tyrone Lewis missed Two Point Jumper.,28,29,-1,2,0.46341976354906605,0.46341976354906605,Niagara,Akron,4,4,NA,283380315,2008-12-03
123,1,1:39,1299,1299,Mike Bardo Defensive Rebound.,28,29,-1,4,0.46338698160409236,0.46338698160409236,Niagara,Akron,4,4,NA,283380315,2008-12-03
124,1,1:35,1295,1295,Nate Linhart made Two Point Layup.  Assisted by Brett McKnight.,28,31,-3,26,0.3915169827425266,0.3915169827425266,Niagara,Akron,4,4,NA,283380315,2008-12-03
125,1,1:09,1269,1269,Foul on Mike Bardo,28,31,-3,0,0.39023994751417723,0.39023994751417723,Niagara,Akron,4,4,NA,283380315,2008-12-03
126,1,1:09,1269,1269,Tyrone Lewis made Free Throw.,29,31,-2,0,0.42615998379199177,0.42615998379199177,Niagara,Akron,4,4,NA,283380315,2008-12-03
127,1,1:09,1269,1269,Tyrone Lewis missed Free Throw.,29,31,-2,0,0.42615998379199177,0.42615998379199177,Niagara,Akron,4,4,NA,283380315,2008-12-03
128,1,1:09,1269,1269,Chris McKnight Defensive Rebound.,29,31,-2,14,0.42615998379199177,0.42615998379199177,Niagara,Akron,4,4,NA,283380315,2008-12-03
129,1,0:55,1255,1255,Nikola Cvetinovic missed Two Point Layup.,29,31,-2,0,0.42566311269812496,0.42566311269812496,Niagara,Akron,4,4,NA,283380315,2008-12-03
130,1,0:55,1255,1255,Nate Linhart Offensive Rebound.,29,31,-2,3,0.42566311269812496,0.42566311269812496,Niagara,Akron,4,4,NA,283380315,2008-12-03
131,1,0:52,1252,1252,Nate Linhart missed Two Point Layup.,29,31,-2,0,0.4255539326393351,0.4255539326393351,Niagara,Akron,4,4,NA,283380315,2008-12-03
132,1,0:52,1252,1252,Nikola Cvetinovic Offensive Rebound.,29,31,-2,3,0.4255539326393351,0.4255539326393351,Niagara,Akron,4,4,NA,283380315,2008-12-03
133,1,0:49,1249,1249,Nikola Cvetinovic missed Two Point Tip Shot.,29,31,-2,0,0.42544373965115917,0.42544373965115917,Niagara,Akron,4,4,NA,283380315,2008-12-03
134,1,0:49,1249,1249,Benson Egemonye Defensive Rebound.,29,31,-2,10,0.42544373965115917,0.42544373965115917,Niagara,Akron,4,4,NA,283380315,2008-12-03
135,1,0:39,1239,1239,Niagara 30 Second Timeout.,29,31,-2,24,0.42506878345590104,0.42506878345590104,Niagara,Akron,3,4,NA,283380315,2008-12-03
136,1,0:15,1215,1215,Bilal Benn made Two Point Jumper.,31,31,0,0,0.5,0.5,Niagara,Akron,3,4,NA,283380315,2008-12-03
137,1,0:15,1215,1215,Foul on Chris McKnight,31,31,0,0,0.5,0.5,Niagara,Akron,3,4,NA,283380315,2008-12-03
138,1,0:15,1215,1215,Bilal Benn missed Free Throw.,31,31,0,0,0.5,0.5,Niagara,Akron,3,4,NA,283380315,2008-12-03
139,1,0:15,1215,1215,Nikola Cvetinovic Defensive Rebound.,31,31,0,10,0.5,0.5,Niagara,Akron,3,4,NA,283380315,2008-12-03
140,1,0:05,1205,1205,Foul on Rob Garrison,31,31,0,0,0.5,0.5,Niagara,Akron,3,4,NA,283380315,2008-12-03
141,1,0:05,1205,1205,Nikola Cvetinovic made Free Throw.,31,32,-1,0,0.46162420343577754,0.46162420343577754,Niagara,Akron,3,4,NA,283380315,2008-12-03
142,1,0:05,1205,1205,Nikola Cvetinovic made Free Throw.,31,33,-2,5,0.42369788789132345,0.42369788789132345,Niagara,Akron,3,4,NA,283380315,2008-12-03
143,1,0:00,1200,1200,End of the 1st Half.,31,33,-2,0,0.4234906714856242,0.4234906714856242,Niagara,Akron,3,4,NA,283380315,2008-12-03
144,2,20:00,1200,1200,PLAY,31,33,-2,23,0.4234906714856242,0.4234906714856242,Niagara,Akron,4,4,NA,283380315,2008-12-03
145,2,19:37,1177,1177,Mike Bardo Steal.,31,33,-2,21,0.42256163885114173,0.42256163885114173,Niagara,Akron,4,4,NA,283380315,2008-12-03
146,2,19:16,1156,1156,Foul on Rob Garrison,31,33,-2,14,0.4217379675010065,0.4217379675010065,Niagara,Akron,4,4,NA,283380315,2008-12-03
147,2,19:02,1142,1142,Darryl Roberts missed Three Point Jumper.,31,33,-2,0,0.42119556086785487,0.42119556086785487,Niagara,Akron,4,4,NA,283380315,2008-12-03
148,2,19:02,1142,1142,Niagara Defensive Rebound.,31,33,-2,23,0.42119556086785487,0.42119556086785487,Niagara,Akron,4,4,NA,283380315,2008-12-03
149,2,18:39,1119,1119,Foul on Jimmy Conyers,31,33,-2,2,0.4203051508414351,0.4203051508414351,Niagara,Akron,4,4,NA,283380315,2008-12-03
150,2,18:37,1117,1117,Tyrone Lewis made Two Point Layup.,33,33,0,0,0.5,0.5,Niagara,Akron,4,4,NA,283380315,2008-12-03
151,2,18:37,1117,1117,Foul on Mike Bardo,33,33,0,0,0.5,0.5,Niagara,Akron,4,4,NA,283380315,2008-12-03
152,2,18:37,1117,1117,Tyrone Lewis made Free Throw.,34,33,1,25,0.5401434407631966,0.5401434407631966,Niagara,Akron,4,4,NA,283380315,2008-12-03
153,2,18:12,1092,1092,Tyrone Lewis Steal.,34,33,1,35,0.5406459261642769,0.5406459261642769,Niagara,Akron,4,4,NA,283380315,2008-12-03
154,2,17:37,1057,1057,Nate Linhart missed Three Point Jumper.,34,33,1,0,0.5413847675952427,0.5413847675952427,Niagara,Akron,4,4,NA,283380315,2008-12-03
155,2,17:37,1057,1057,null,34,33,1,28,0.5413847675952427,0.5413847675952427,Niagara,Akron,4,4,NA,283380315,2008-12-03
156,2,17:09,1029,1029,Bilal Benn missed Two Point Layup.,34,33,1,0,0.5420230677951058,0.5420230677951058,Niagara,Akron,4,4,NA,283380315,2008-12-03
157,2,17:09,1029,1029,Jimmy Conyers Defensive Rebound.,34,33,1,46,0.5420230677951058,0.5420230677951058,Niagara,Akron,4,4,NA,283380315,2008-12-03
158,2,16:23,983,983,Chris McKnight missed Two Point Jumper.,34,33,1,0,0.5432046705935241,0.5432046705935241,Niagara,Akron,4,4,NA,283380315,2008-12-03
159,2,16:23,983,983,Tyrone Lewis Defensive Rebound.,34,33,1,4,0.5432046705935241,0.5432046705935241,Niagara,Akron,4,4,NA,283380315,2008-12-03
160,2,16:19,979,979,Anthony Nelson made Two Point Dunk Shot.  Assisted by Tyrone Lewis.,36,33,3,22,0.6274073299186723,0.6274073299186723,Niagara,Akron,4,4,NA,283380315,2008-12-03
161,2,15:57,957,957,Foul on Bilal Benn,36,33,3,0,0.6291745858613803,0.6291745858613803,Niagara,Akron,4,4,NA,283380315,2008-12-03
162,2,15:57,957,957,Official TV Timeout.,36,33,3,7,0.6291745858613803,0.6291745858613803,Niagara,Akron,4,4,NA,283380315,2008-12-03
163,2,15:50,950,950,Steve McNees missed Three Point Jumper.,36,33,3,0,0.6297013367018819,0.6297013367018819,Niagara,Akron,4,4,NA,283380315,2008-12-03
164,2,15:50,950,950,Anthony Nelson Defensive Rebound.,36,33,3,21,0.6297013367018819,0.6297013367018819,Niagara,Akron,4,4,NA,283380315,2008-12-03
165,2,15:29,929,929,Tyrone Lewis made Two Point Layup.,38,33,5,12,0.7100114921161615,0.7100114921161615,Niagara,Akron,4,4,NA,283380315,2008-12-03
166,2,15:17,917,917,Anthony (Humpty Hitchens made Two Point Jumper.,38,35,3,29,0.631961906050482,0.631961906050482,Niagara,Akron,4,4,NA,283380315,2008-12-03
167,2,14:48,888,888,Anthony (Humpty Hitchens made Three Point Jumper.,38,38,0,16,0.5,0.5,Niagara,Akron,4,4,NA,283380315,2008-12-03
168,2,14:32,872,872,Tyrone Lewis made Two Point Layup.,40,38,2,0,0.5910689851622392,0.5910689851622392,Niagara,Akron,4,4,NA,283380315,2008-12-03
169,2,14:32,872,872,Foul on Steve McNees,40,38,2,0,0.5910689851622392,0.5910689851622392,Niagara,Akron,4,4,NA,283380315,2008-12-03
170,2,14:32,872,872,Tyrone Lewis made Free Throw.,41,38,3,10,0.6347338228734681,0.6347338228734681,Niagara,Akron,4,4,NA,283380315,2008-12-03
171,2,14:22,862,862,Bilal Benn Steal.,41,38,3,3,0.6353464539475331,0.6353464539475331,Niagara,Akron,4,4,NA,283380315,2008-12-03
172,2,14:19,859,859,Foul on Anthony (Humpty Hitchens,41,38,3,0,0.63553211048734215,0.63553211048734215,Niagara,Akron,4,4,NA,283380315,2008-12-03
173,2,14:19,859,859,Tyrone Lewis made Free Throw.,42,38,4,0,0.6772943927519329,0.6772943927519329,Niagara,Akron,4,4,NA,283380315,2008-12-03
174,2,14:19,859,859,Tyrone Lewis made Free Throw.,43,38,5,32,0.71640671780035,0.71640671780035,Niagara,Akron,4,4,NA,283380315,2008-12-03
175,2,13:47,827,827,Demetrius Williamson missed Three Point Jumper.,43,38,5,0,0.7194420186047851,0.7194420186047851,Niagara,Akron,4,4,NA,283380315,2008-12-03
176,2,13:47,827,827,Anthony (Humpty Hitchens Defensive Rebound.,43,38,5,14,0.7194420186047851,0.7194420186047851,Niagara,Akron,4,4,NA,283380315,2008-12-03
