play_id,half,time_remaining_half,secs_remaining,secs_remaining_absolute,description,home_score,away_score,score_diff,play_length,win_prob,naive_win_prob,home,away,home_time_out_remaining,away_time_out_remaining,home_favored_by,game_id,date
1,1,20:00,2400,2400,PLAY,0,0,0,14,0.5,0.5,Oregon,North Carolina,4,4,NA,283302483,2008-11-25
2,1,19:46,2386,2386,Michael Dunigan made Two Point Dunk Shot.,2,0,2,28,0.5443207085263143,0.5443207085263143,Oregon,North Carolina,4,4,NA,283302483,2008-11-25
3,1,19:18,2358,2358,Tajuan Porter missed Three Point Jumper.,2,0,2,0,0.5449181103473372,0.5449181103473372,Oregon,North Carolina,4,4,NA,283302483,2008-11-25
4,1,19:18,2358,2358,Joevan Catron Offensive Rebound.,2,0,2,6,0.5449181103473372,0.5449181103473372,Oregon,North Carolina,4,4,NA,283302483,2008-11-25
5,1,19:12,2352,2352,LeKendric Longmire missed Two Point Jumper.,2,0,2,0,0.5450475200660853,0.5450475200660853,Oregon,North Carolina,4,4,NA,283302483,2008-11-25
6,1,19:12,2352,2352,Michael Dunigan Offensive Rebound.,2,0,2,3,0.5450475200660853,0.5450475200660853,Oregon,North Carolina,4,4,NA,283302483,2008-11-25
7,1,19:09,2349,2349,Michael Dunigan missed Two Point Layup.,2,0,2,2,0.5451124007901187,0.5451124007901187,Oregon,North Carolina,4,4,NA,283302483,2008-11-25
8,1,19:07,2347,2347,Danny Green Defensive Rebound.,2,0,2,11,0.5451557187753678,0.5451557187753678,Oregon,North Carolina,4,4,NA,283302483,2008-11-25
9,1,18:56,2336,2336,Wayne Ellington missed Two Point Layup.,2,0,2,0,0.5453948652273468,0.5453948652273468,Oregon,North Carolina,4,4,NA,283302483,2008-11-25
10,1,18:56,2336,2336,Tyler Hansbrough Offensive Rebound.,2,0,2,2,0.5453948652273468,0.5453948652273468,Oregon,North Carolina,4,4,NA,283302483,2008-11-25
11,1,18:54,2334,2334,Tyler Hansbrough made Two Point Tip Shot.,2,2,0,17,0.5,0.5,Oregon,North Carolina,4,4,NA,283302483,2008-11-25
12,1,18:37,2317,2317,Danny Green made Three Point Jumper.  Assisted by Wayne Ellington.,2,5,-3,25,0.43152272424912347,0.43152272424912347,Oregon,North Carolina,4,4,NA,283302483,2008-11-25
13,1,18:12,2292,2292,Michael Dunigan missed Two Point Jumper.,2,5,-3,0,0.4307004005860406,0.4307004005860406,Oregon,North Carolina,4,4,NA,283302483,2008-11-25
14,1,18:12,2292,2292,Danny Green Defensive Rebound.,2,5,-3,8,0.4307004005860406,0.4307004005860406,Oregon,North Carolina,4,4,NA,283302483,2008-11-25
15,1,18:04,2284,2284,Deon Thompson made Two Point Dunk Shot.  Assisted by Wayne Ellington.,2,7,-5,8,0.3853757837685456,0.3853757837685456,Oregon,North Carolina,4,4,NA,283302483,2008-11-25
16,1,17:56,2276,2276,Oregon 30 Second Timeout.,2,7,-5,16,0.38494759579722115,0.38494759579722115,Oregon,North Carolina,3,4,NA,283302483,2008-11-25
17,1,17:40,2260,2260,Foul on Michael Dunigan,2,7,-5,5,0.38408761963594046,0.38408761963594046,Oregon,North Carolina,3,4,NA,283302483,2008-11-25
18,1,17:35,2255,2255,Deon Thompson made Two Point Jumper.,2,9,-7,12,0.3401280365163923,0.3401280365163923,Oregon,North Carolina,3,4,NA,283302483,2008-11-25
19,1,17:23,2243,2243,Michael Dunigan made Two Point Layup.  Assisted by Tajuan Porter.,4,9,-5,17,0.3831691304405542,0.3831691304405542,Oregon,North Carolina,3,4,NA,283302483,2008-11-25
20,1,17:06,2226,2226,Ty Lawson made Two Point Jumper.,4,11,-7,8,0.33804149397115996,0.33804149397115996,Oregon,North Carolina,3,4,NA,283302483,2008-11-25
21,1,16:58,2218,2218,LeKendric Longmire missed Two Point Jumper.,4,11,-7,2,0.33746376657857474,0.33746376657857474,Oregon,North Carolina,3,4,NA,283302483,2008-11-25
22,1,16:56,2216,2216,Tyler Hansbrough Defensive Rebound.,4,11,-7,3,0.3373192135200411,0.3373192135200411,Oregon,North Carolina,3,4,NA,283302483,2008-11-25
23,1,16:53,2213,2213,Wayne Ellington missed Three Point Jumper.,4,11,-7,0,0.33710229867040853,0.33710229867040853,Oregon,North Carolina,3,4,NA,283302483,2008-11-25
24,1,16:53,2213,2213,Michael Dunigan Defensive Rebound.,4,11,-7,20,0.33710229867040853,0.33710229867040853,Oregon,North Carolina,3,4,NA,283302483,2008-11-25
25,1,16:33,2193,2193,Joevan Catron made Two Point Layup.,6,11,-5,15,0.38044520173969204,0.38044520173969204,Oregon,North Carolina,3,4,NA,283302483,2008-11-25
26,1,16:18,2178,2178,Joevan Catron missed Two Point Layup.,6,11,-5,0,0.3796231837512359,0.3796231837512359,Oregon,North Carolina,3,4,NA,283302483,2008-11-25
27,1,16:18,2178,2178,Oregon Offensive Rebound.,6,11,-5,27,0.3796231837512359,0.3796231837512359,Oregon,North Carolina,3,4,NA,283302483,2008-11-25
28,1,15:51,2151,2151,Kamyron Brown missed Two Point Layup.,6,11,-5,3,0.37813827390183374,0.37813827390183374,Oregon,North Carolina,3,4,NA,283302483,2008-11-25
29,1,15:48,2148,2148,Larry Drew II Defensive Rebound.,6,11,-5,3,0.3779726215901391,0.3779726215901391,Oregon,North Carolina,3,4,NA,283302483,2008-11-25
30,1,15:45,2145,2145,Wayne Ellington missed Three Point Jumper.,6,11,-5,0,0.37780682323070147,0.37780682323070147,Oregon,North Carolina,3,4,NA,283302483,2008-11-25
31,1,15:45,2145,2145,Ed Davis Offensive Rebound.,6,11,-5,6,0.37780682323070147,0.37780682323070147,Oregon,North Carolina,3,4,NA,283302483,2008-11-25
32,1,15:39,2139,2139,Danny Green made Three Point Jumper.  Assisted by Larry Drew II.,6,14,-8,17,0.30992956464143895,0.30992956464143895,Oregon,North Carolina,3,4,NA,283302483,2008-11-25
33,1,15:22,2122,2122,Official TV Timeout.,6,14,-8,5,0.30855566691301567,0.30855566691301567,Oregon,North Carolina,3,4,NA,283302483,2008-11-25
34,1,15:17,2117,2117,Tajuan Porter missed Three Point Jumper.,6,14,-8,0,0.3081505325534369,0.3081505325534369,Oregon,North Carolina,3,4,NA,283302483,2008-11-25
35,1,15:17,2117,2117,Will Graves Defensive Rebound.,6,14,-8,21,0.3081505325534369,0.3081505325534369,Oregon,North Carolina,3,4,NA,283302483,2008-11-25
36,1,14:56,2096,2096,Foul on Frantz Dorsainvil,6,14,-8,0,0.3064433815189352,0.3064433815189352,Oregon,North Carolina,3,4,NA,283302483,2008-11-25
37,1,14:56,2096,2096,Ed Davis missed Free Throw.,6,14,-8,0,0.3064433815189352,0.3064433815189352,Oregon,North Carolina,3,4,NA,283302483,2008-11-25
38,1,14:56,2096,2096,null,6,14,-8,0,0.3064433815189352,0.3064433815189352,Oregon,North Carolina,3,4,NA,283302483,2008-11-25
39,1,14:56,2096,2096,Ed Davis made Free Throw.,6,15,-9,3,0.285182110704089,0.285182110704089,Oregon,North Carolina,3,4,NA,283302483,2008-11-25
40,1,14:53,2093,2093,Foul on Bobby Frasor,6,15,-9,21,0.28491813802831034,0.28491813802831034,Oregon,North Carolina,3,4,NA,283302483,2008-11-25
41,1,14:32,2072,2072,Tajuan Porter made Two Point Jumper.,8,15,-7,13,0.32677761355575285,0.32677761355575285,Oregon,North Carolina,3,4,NA,283302483,2008-11-25
42,1,14:19,2059,2059,Tyler Hansbrough missed Two Point Jumper.,8,15,-7,0,0.3258056681597658,0.3258056681597658,Oregon,North Carolina,3,4,NA,283302483,2008-11-25
43,1,14:19,2059,2059,Josh Crittle Defensive Rebound.,8,15,-7,22,0.3258056681597658,0.3258056681597658,Oregon,North Carolina,3,4,NA,283302483,2008-11-25
44,1,13:57,2037,2037,Danny Green made Three Point Jumper.  Assisted by Larry Drew II.,8,18,-10,22,0.2592906116753534,0.2592906116753534,Oregon,North Carolina,3,4,NA,283302483,2008-11-25
45,1,13:35,2015,2015,Tajuan Porter made Three Point Jumper.,11,18,-7,27,0.3224824356043462,0.3224824356043462,Oregon,North Carolina,3,4,NA,283302483,2008-11-25
46,1,13:08,1988,1988,Foul on Frantz Dorsainvil,11,18,-7,3,0.3204151400002262,0.3204151400002262,Oregon,North Carolina,3,4,NA,283302483,2008-11-25
47,1,13:05,1985,1985,Foul on Matthew Humphrey,11,18,-7,0,0.32018402728019857,0.32018402728019857,Oregon,North Carolina,3,4,NA,283302483,2008-11-25
48,1,13:05,1985,1985,Wayne Ellington made Free Throw.,11,19,-8,0,0.2972375853723203,0.2972375853723203,Oregon,North Carolina,3,4,NA,283302483,2008-11-25
49,1,13:05,1985,1985,Wayne Ellington made Free Throw.,11,20,-9,16,0.275269749364992,0.275269749364992,Oregon,North Carolina,3,4,NA,283302483,2008-11-25
50,1,12:49,1969,1969,Matthew Humphrey missed Two Point Jumper.,11,20,-9,0,0.27381231332756256,0.27381231332756256,Oregon,North Carolina,3,4,NA,283302483,2008-11-25
51,1,12:49,1969,1969,Tyler Hansbrough Defensive Rebound.,11,20,-9,2,0.27381231332756256,0.27381231332756256,Oregon,North Carolina,3,4,NA,283302483,2008-11-25
52,1,12:47,1967,1967,Foul on Matthew Humphrey,11,20,-9,9,0.27362955605765477,0.27362955605765477,Oregon,North Carolina,3,4,NA,283302483,2008-11-25
53,1,12:38,1958,1958,Deon Thompson missed Two Point Dunk Shot.,11,20,-9,1,0.2728055207423001,0.2728055207423001,Oregon,North Carolina,3,4,NA,283302483,2008-11-25
54,1,12:37,1957,1957,Michael Dunigan Defensive Rebound.,11,20,-9,10,0.27271379513708566,0.27271379513708566,Oregon,North Carolina,3,4,NA,283302483,2008-11-25
55,1,12:27,1947,1947,Danny Green missed Three Point Jumper.,11,20,-9,0,0.27179468039884586,0.27179468039884586,Oregon,North Carolina,3,4,NA,283302483,2008-11-25
56,1,12:27,1947,1947,Wayne Ellington Offensive Rebound.,11,20,-9,5,0.27179468039884586,0.27179468039884586,Oregon,North Carolina,3,4,NA,283302483,2008-11-25
57,1,12:22,1942,1942,Deon Thompson made Two Point Jumper.  Assisted by Wayne Ellington.,11,22,-11,27,0.23016292615476597,0.23016292615476597,Oregon,North Carolina,3,4,NA,283302483,2008-11-25
58,1,11:55,1915,1915,LeKendric Longmire missed Three Point Jumper.,11,22,-11,0,0.22743272857118957,0.22743272857118957,Oregon,North Carolina,3,4,NA,283302483,2008-11-25
59,1,11:55,1915,1915,Deon Thompson Defensive Rebound.,11,22,-11,4,0.22743272857118957,0.22743272857118957,Oregon,North Carolina,3,4,NA,283302483,2008-11-25
60,1,11:51,1911,1911,Foul on Tajuan Porter,11,22,-11,0,0.22703030164810437,0.22703030164810437,Oregon,North Carolina,3,4,NA,283302483,2008-11-25
61,1,11:51,1911,1911,Official TV Timeout.,11,22,-11,8,0.22703030164810437,0.22703030164810437,Oregon,North Carolina,3,4,NA,283302483,2008-11-25
62,1,11:43,1903,1903,Foul on Michael Dunigan,11,22,-11,0,0.2262273402838648,0.2262273402838648,Oregon,North Carolina,3,4,NA,283302483,2008-11-25
63,1,11:43,1903,1903,Ty Lawson missed Free Throw.,11,22,-11,0,0.2262273402838648,0.2262273402838648,Oregon,North Carolina,3,4,NA,283302483,2008-11-25
64,1,11:43,1903,1903,null,11,22,-11,0,0.2262273402838648,0.2262273402838648,Oregon,North Carolina,3,4,NA,283302483,2008-11-25
65,1,11:43,1903,1903,Ty Lawson missed Free Throw.,11,22,-11,0,0.2262273402838648,0.2262273402838648,Oregon,North Carolina,3,4,NA,283302483,2008-11-25
66,1,11:43,1903,1903,Michael Dunigan Defensive Rebound.,11,22,-11,13,0.2262273402838648,0.2262273402838648,Oregon,North Carolina,3,4,NA,283302483,2008-11-25
67,1,11:30,1890,1890,Foul on Deon Thompson,11,22,-11,0,0.22492722332576287,0.22492722332576287,Oregon,North Carolina,3,4,NA,283302483,2008-11-25
68,1,11:30,1890,1890,Michael Dunigan made Free Throw.,12,22,-10,0,0.24513883520426882,0.24513883520426882,Oregon,North Carolina,3,4,NA,283302483,2008-11-25
69,1,11:30,1890,1890,Michael Dunigan missed Free Throw.,12,22,-10,0,0.24513883520426882,0.24513883520426882,Oregon,North Carolina,3,4,NA,283302483,2008-11-25
70,1,11:30,1890,1890,Ed Davis Defensive Rebound.,12,22,-10,15,0.24513883520426882,0.24513883520426882,Oregon,North Carolina,3,4,NA,283302483,2008-11-25
71,1,11:15,1875,1875,Garrett Sim missed Three Point Jumper.,12,22,-10,0,0.24369627209811484,0.24369627209811484,Oregon,North Carolina,3,4,NA,283302483,2008-11-25
72,1,11:15,1875,1875,LeKendric Longmire Offensive Rebound.,12,22,-10,9,0.24369627209811484,0.24369627209811484,Oregon,North Carolina,3,4,NA,283302483,2008-11-25
73,1,11:06,1866,1866,LeKendric Longmire missed Two Point Jumper.,12,22,-10,0,0.24283230142393541,0.24283230142393541,Oregon,North Carolina,3,4,NA,283302483,2008-11-25
74,1,11:06,1866,1866,Ed Davis Defensive Rebound.,12,22,-10,8,0.24283230142393541,0.24283230142393541,Oregon,North Carolina,3,4,NA,283302483,2008-11-25
75,1,10:58,1858,1858,Danny Green made Three Point Jumper.,12,25,-13,41,0.18485272122326568,0.18485272122326568,Oregon,North Carolina,3,4,NA,283302483,2008-11-25
76,1,10:17,1817,1817,Ty Lawson missed Two Point Layup.,12,25,-13,1,0.18066516263965252,0.18066516263965252,Oregon,North Carolina,3,4,NA,283302483,2008-11-25
77,1,10:16,1816,1816,Ed Davis Offensive Rebound.,12,25,-13,1,0.18056312551411463,0.18056312551411463,Oregon,North Carolina,3,4,NA,283302483,2008-11-25
78,1,10:15,1815,1815,Ed Davis made Two Point Layup.,12,27,-15,12,0.14854852546998226,0.14854852546998226,Oregon,North Carolina,3,4,NA,283302483,2008-11-25
79,1,10:03,1803,1803,Foul on Wayne Ellington,12,27,-15,15,0.1473406423748694,0.1473406423748694,Oregon,North Carolina,3,4,NA,283302483,2008-11-25
80,1,9:48,1788,1788,Tajuan Porter missed Three Point Jumper.,12,27,-15,0,0.14583109669821648,0.14583109669821648,Oregon,North Carolina,3,4,NA,283302483,2008-11-25
81,1,9:48,1788,1788,Deon Thompson Defensive Rebound.,12,27,-15,22,0.14583109669821648,0.14583109669821648,Oregon,North Carolina,3,4,NA,283302483,2008-11-25
82,1,9:26,1766,1766,Ed Davis missed Two Point Jumper.,12,27,-15,0,0.14361441108165082,0.14361441108165082,Oregon,North Carolina,3,4,NA,283302483,2008-11-25
83,1,9:26,1766,1766,Joevan Catron Defensive Rebound.,12,27,-15,10,0.14361441108165082,0.14361441108165082,Oregon,North Carolina,3,4,NA,283302483,2008-11-25
84,1,9:16,1756,1756,Kamyron Brown missed Two Point Jumper.,12,27,-15,0,0.14260457385964473,0.14260457385964473,Oregon,North Carolina,3,4,NA,283302483,2008-11-25
85,1,9:16,1756,1756,Oregon Offensive Rebound.,12,27,-15,0,0.14260457385964473,0.14260457385964473,Oregon,North Carolina,3,4,NA,283302483,2008-11-25
86,1,9:16,1756,1756,Tajuan Porter missed Three Point Jumper.,12,27,-15,0,0.14260457385964473,0.14260457385964473,Oregon,North Carolina,3,4,NA,283302483,2008-11-25
87,1,9:16,1756,1756,North Carolina Defensive Rebound.,12,27,-15,23,0.14260457385964473,0.14260457385964473,Oregon,North Carolina,3,4,NA,283302483,2008-11-25
88,1,8:53,1733,1733,Foul on Kamyron Brown,12,27,-15,0,0.14027344507835185,0.14027344507835185,Oregon,North Carolina,3,4,NA,283302483,2008-11-25
89,1,8:53,1733,1733,Tyler Hansbrough missed Free Throw.,12,27,-15,0,0.14027344507835185,0.14027344507835185,Oregon,North Carolina,3,4,NA,283302483,2008-11-25
90,1,8:53,1733,1733,null,12,27,-15,0,0.14027344507835185,0.14027344507835185,Oregon,North Carolina,3,4,NA,283302483,2008-11-25
91,1,8:53,1733,1733,Tyler Hansbrough made Free Throw.,12,28,-16,12,0.12632078114349385,0.12632078114349385,Oregon,North Carolina,3,4,NA,283302483,2008-11-25
92,1,8:41,1721,1721,Foul on Teondre Williams,12,28,-16,1,0.12512809055277782,0.12512809055277782,Oregon,North Carolina,3,4,NA,283302483,2008-11-25
93,1,8:40,1720,1720,Tyler Hansbrough made Free Throw.,12,29,-17,0,0.11232069223114705,0.11232069223114705,Oregon,North Carolina,3,4,NA,283302483,2008-11-25
94,1,8:40,1720,1720,Tyler Hansbrough made Free Throw.,12,30,-18,19,0.10075574077758377,0.10075574077758377,Oregon,North Carolina,3,4,NA,283302483,2008-11-25
95,1,8:21,1701,1701,Josh Crittle missed Two Point Jumper.,12,30,-18,0,0.09899005484085739,0.09899005484085739,Oregon,North Carolina,3,4,NA,283302483,2008-11-25
96,1,8:21,1701,1701,Ed Davis Defensive Rebound.,12,30,-18,13,0.09899005484085739,0.09899005484085739,Oregon,North Carolina,3,4,NA,283302483,2008-11-25
97,1,8:08,1688,1688,Tyler Hansbrough missed Two Point Layup.,12,30,-18,3,0.09777847239803633,0.09777847239803633,Oregon,North Carolina,3,4,NA,283302483,2008-11-25
98,1,8:05,1685,1685,Tajuan Porter Defensive Rebound.,12,30,-18,4,0.09750085345096832,0.09750085345096832,Oregon,North Carolina,3,4,NA,283302483,2008-11-25
99,1,8:01,1681,1681,Teondre Williams missed Two Point Jumper.,12,30,-18,0,0.09713377636126609,0.09713377636126609,Oregon,North Carolina,3,4,NA,283302483,2008-11-25
100,1,8:01,1681,1681,Ed Davis Defensive Rebound.,12,30,-18,0,0.09713377636126609,0.09713377636126609,Oregon,North Carolina,3,4,NA,283302483,2008-11-25
101,1,8:01,1681,1681,Foul on Teondre Williams,12,30,-18,1,0.09713377636126609,0.09713377636126609,Oregon,North Carolina,3,4,NA,283302483,2008-11-25
102,1,8:00,1680,1680,Ed Davis made Free Throw.,12,31,-19,0,0.08671318107216455,0.08671318107216455,Oregon,North Carolina,3,4,NA,283302483,2008-11-25
103,1,8:00,1680,1680,Ed Davis made Free Throw.,12,32,-20,6,0.07738906102444001,0.07738906102444001,Oregon,North Carolina,3,4,NA,283302483,2008-11-25
104,1,7:54,1674,1674,Official TV Timeout.,12,32,-20,27,0.07689759280550038,0.07689759280550038,Oregon,North Carolina,3,4,NA,283302483,2008-11-25
105,1,7:27,1647,1647,Teondre Williams missed Two Point Jumper.,12,32,-20,2,0.07476463351624987,0.07476463351624987,Oregon,North Carolina,3,4,NA,283302483,2008-11-25
106,1,7:25,1645,1645,Danny Green Defensive Rebound.,12,32,-20,8,0.0746111250733212,0.0746111250733212,Oregon,North Carolina,3,4,NA,283302483,2008-11-25
107,1,7:17,1637,1637,Danny Green missed Two Point Jumper.,12,32,-20,6,0.07400239669184266,0.07400239669184266,Oregon,North Carolina,3,4,NA,283302483,2008-11-25
108,1,7:11,1631,1631,Joevan Catron Defensive Rebound.,12,32,-20,4,0.07355103394027779,0.07355103394027779,Oregon,North Carolina,3,4,NA,283302483,2008-11-25
109,1,7:07,1627,1627,Tajuan Porter missed Three Point Jumper.,12,32,-20,0,0.07325239001548524,0.07325239001548524,Oregon,North Carolina,3,4,NA,283302483,2008-11-25
110,1,7:07,1627,1627,Bobby Frasor Defensive Rebound.,12,32,-20,3,0.07325239001548524,0.07325239001548524,Oregon,North Carolina,3,4,NA,283302483,2008-11-25
111,1,7:04,1624,1624,Larry Drew II made Three Point Jumper.  Assisted by Bobby Frasor.,12,35,-23,23,0.051066177536557,0.051066177536557,Oregon,North Carolina,3,4,NA,283302483,2008-11-25
112,1,6:41,1601,1601,Foul on Larry Drew II,12,35,-23,0,0.04968481392089356,0.04968481392089356,Oregon,North Carolina,3,4,NA,283302483,2008-11-25
113,1,6:41,1601,1601,Michael Dunigan made Two Point Dunk Shot.,14,35,-21,22,0.06330001542601506,0.06330001542601506,Oregon,North Carolina,3,4,NA,283302483,2008-11-25
114,1,6:19,1579,1579,Joevan Catron missed Three Point Jumper.,14,35,-21,0,0.0618198156622804,0.0618198156622804,Oregon,North Carolina,3,4,NA,283302483,2008-11-25
115,1,6:19,1579,1579,Deon Thompson Defensive Rebound.,14,35,-21,12,0.0618198156622804,0.0618198156622804,Oregon,North Carolina,3,4,NA,283302483,2008-11-25
116,1,6:07,1567,1567,Tyler Hansbrough made Two Point Layup.,14,37,-23,13,0.047701070353498645,0.047701070353498645,Oregon,North Carolina,3,4,NA,283302483,2008-11-25
117,1,5:54,1554,1554,Churchill Odia missed Three Point Jumper.,14,37,-23,0,0.04695254868531451,0.04695254868531451,Oregon,North Carolina,3,4,NA,283302483,2008-11-25
118,1,5:54,1554,1554,Wayne Ellington Defensive Rebound.,14,37,-23,22,0.04695254868531451,0.04695254868531451,Oregon,North Carolina,3,4,NA,283302483,2008-11-25
119,1,5:32,1532,1532,Larry Drew II missed Three Point Jumper.,14,37,-23,0,0.0456890071922308,0.0456890071922308,Oregon,North Carolina,3,4,NA,283302483,2008-11-25
120,1,5:32,1532,1532,Joevan Catron Defensive Rebound.,14,37,-23,13,0.0456890071922308,0.0456890071922308,Oregon,North Carolina,3,4,NA,283302483,2008-11-25
121,1,5:19,1519,1519,Michael Dunigan missed Two Point Jumper.,14,37,-23,0,0.04494078192105157,0.04494078192105157,Oregon,North Carolina,3,4,NA,283302483,2008-11-25
122,1,5:19,1519,1519,Wayne Ellington Defensive Rebound.,14,37,-23,12,0.04494078192105157,0.04494078192105157,Oregon,North Carolina,3,4,NA,283302483,2008-11-25
123,1,5:07,1507,1507,Foul on Michael Dunigan,14,37,-23,0,0.04424700631748105,0.04424700631748105,Oregon,North Carolina,3,4,NA,283302483,2008-11-25
124,1,5:07,1507,1507,Tyler Hansbrough made Free Throw.,14,38,-24,0,0.03892903214407294,0.03892903214407294,Oregon,North Carolina,3,4,NA,283302483,2008-11-25
125,1,5:07,1507,1507,Tyler Hansbrough made Free Throw.,14,39,-25,12,0.034227326973686974,0.034227326973686974,Oregon,North Carolina,3,4,NA,283302483,2008-11-25
126,1,4:55,1495,1495,Foul on Deon Thompson,14,39,-25,16,0.03363462955411429,0.03363462955411429,Oregon,North Carolina,3,4,NA,283302483,2008-11-25
127,1,4:39,1479,1479,Garrett Sim missed Two Point Jumper.,14,39,-25,0,0.03283828500259429,0.03283828500259429,Oregon,North Carolina,3,4,NA,283302483,2008-11-25
128,1,4:39,1479,1479,Garrett Sim Offensive Rebound.,14,39,-25,2,0.03283828500259429,0.03283828500259429,Oregon,North Carolina,3,4,NA,283302483,2008-11-25
129,1,4:37,1477,1477,Garrett Sim made Two Point Jumper.,16,39,-23,32,0.04249055400229865,0.04249055400229865,Oregon,North Carolina,3,4,NA,283302483,2008-11-25
130,1,4:05,1445,1445,Ed Davis missed Two Point Jumper.,16,39,-23,0,0.0405698197734509,0.0405698197734509,Oregon,North Carolina,3,4,NA,283302483,2008-11-25
131,1,4:05,1445,1445,Oregon Defensive Rebound.,16,39,-23,1,0.0405698197734509,0.0405698197734509,Oregon,North Carolina,3,4,NA,283302483,2008-11-25
132,1,4:04,1444,1444,Foul on Deon Thompson,16,39,-23,10,0.04051023337339556,0.04051023337339556,Oregon,North Carolina,3,4,NA,283302483,2008-11-25
133,1,3:54,1434,1434,Michael Dunigan made Two Point Jumper.,18,39,-21,10,0.05198237935063393,0.05198237935063393,Oregon,North Carolina,3,4,NA,283302483,2008-11-25
134,1,3:44,1424,1424,Ed Davis made Two Point Dunk Shot.,18,41,-23,6,0.03936033927295572,0.03936033927295572,Oregon,North Carolina,3,4,NA,283302483,2008-11-25
135,1,3:38,1418,1418,Official TV Timeout.,18,41,-23,0,0.039029307722763494,0.039029307722763494,Oregon,North Carolina,3,4,NA,283302483,2008-11-25
136,1,3:38,1418,1418,Foul on Danny Green,18,41,-23,33,0.039029307722763494,0.039029307722763494,Oregon,North Carolina,3,4,NA,283302483,2008-11-25
137,1,3:05,1385,1385,Foul on Churchill Odia,18,41,-23,0,0.03729681060219257,0.03729681060219257,Oregon,North Carolina,3,4,NA,283302483,2008-11-25
138,1,3:05,1385,1385,Tyler Hansbrough made Free Throw.,18,42,-24,0,0.03254081510600868,0.03254081510600868,Oregon,North Carolina,3,4,NA,283302483,2008-11-25
139,1,3:05,1385,1385,Tyler Hansbrough made Free Throw.,18,43,-25,12,0.02837341783883268,0.02837341783883268,Oregon,North Carolina,3,4,NA,283302483,2008-11-25
140,1,2:53,1373,1373,Michael Dunigan missed Two Point Layup.,18,43,-25,0,0.027871510456592773,0.027871510456592773,Oregon,North Carolina,3,4,NA,283302483,2008-11-25
141,1,2:53,1373,1373,Ed Davis Defensive Rebound.,18,43,-25,9,0.027871510456592773,0.027871510456592773,Oregon,North Carolina,3,4,NA,283302483,2008-11-25
142,1,2:44,1364,1364,Danny Green missed Three Point Jumper.,18,43,-25,0,0.02750126849925919,0.02750126849925919,Oregon,North Carolina,3,4,NA,283302483,2008-11-25
143,1,2:44,1364,1364,Oregon Defensive Rebound.,18,43,-25,32,0.02750126849925919,0.02750126849925919,Oregon,North Carolina,3,4,NA,283302483,2008-11-25
144,1,2:12,1332,1332,Drew Wiley missed Three Point Jumper.,18,43,-25,0,0.026212054256590168,0.026212054256590168,Oregon,North Carolina,3,4,NA,283302483,2008-11-25
145,1,2:12,1332,1332,Tyler Hansbrough Defensive Rebound.,18,43,-25,10,0.026212054256590168,0.026212054256590168,Oregon,North Carolina,3,4,NA,283302483,2008-11-25
146,1,2:02,1322,1322,Ed Davis made Two Point Dunk Shot.,18,45,-27,17,0.01943289609272688,0.01943289609272688,Oregon,North Carolina,3,4,NA,283302483,2008-11-25
147,1,1:45,1305,1305,Foul on Ed Davis,18,45,-27,0,0.01887870987689012,0.01887870987689012,Oregon,North Carolina,3,4,NA,283302483,2008-11-25
148,1,1:45,1305,1305,Michael Dunigan made Free Throw.,19,45,-26,0,0.021788566470619268,0.021788566470619268,Oregon,North Carolina,3,4,NA,283302483,2008-11-25
149,1,1:45,1305,1305,Michael Dunigan made Free Throw.,20,45,-25,8,0.02513544136472672,0.02513544136472672,Oregon,North Carolina,3,4,NA,283302483,2008-11-25
150,1,1:37,1297,1297,Foul on Joevan Catron,20,45,-25,0,0.024815050662253778,0.024815050662253778,Oregon,North Carolina,3,4,NA,283302483,2008-11-25
151,1,1:37,1297,1297,Tyler Hansbrough made Free Throw.,20,46,-26,0,0.021498821621806212,0.021498821621806212,Oregon,North Carolina,3,4,NA,283302483,2008-11-25
152,1,1:37,1297,1297,Tyler Hansbrough missed Free Throw.,20,46,-26,0,0.021498821621806212,0.021498821621806212,Oregon,North Carolina,3,4,NA,283302483,2008-11-25
153,1,1:37,1297,1297,Ty Lawson Offensive Rebound.,20,46,-26,6,0.021498821621806212,0.021498821621806212,Oregon,North Carolina,3,4,NA,283302483,2008-11-25
154,1,1:31,1291,1291,Wayne Ellington missed Three Point Jumper.,20,46,-26,0,0.021280759359389143,0.021280759359389143,Oregon,North Carolina,3,4,NA,283302483,2008-11-25
155,1,1:31,1291,1291,Garrett Sim Defensive Rebound.,20,46,-26,0,0.021280759359389143,0.021280759359389143,Oregon,North Carolina,3,4,NA,283302483,2008-11-25
156,1,1:31,1291,1291,Foul on Will Graves,20,46,-26,0,0.021280759359389143,0.021280759359389143,Oregon,North Carolina,3,4,NA,283302483,2008-11-25
157,1,1:31,1291,1291,Garrett Sim made Free Throw.,21,46,-25,0,0.02457379871194294,0.02457379871194294,Oregon,North Carolina,3,4,NA,283302483,2008-11-25
158,1,1:31,1291,1291,Garrett Sim missed Free Throw.,21,46,-25,0,0.02457379871194294,0.02457379871194294,Oregon,North Carolina,3,4,NA,283302483,2008-11-25
159,1,1:31,1291,1291,Danny Green Defensive Rebound.,21,46,-25,10,0.02457379871194294,0.02457379871194294,Oregon,North Carolina,3,4,NA,283302483,2008-11-25
160,1,1:21,1281,1281,Danny Green made Three Point Jumper.  Assisted by Ty Lawson.,21,49,-28,20,0.01564263848425376,0.01564263848425376,Oregon,North Carolina,3,4,NA,283302483,2008-11-25
161,1,1:01,1261,1261,Drew Wiley missed Three Point Jumper.,21,49,-28,0,0.01504403741319948,0.01504403741319948,Oregon,North Carolina,3,4,NA,283302483,2008-11-25
162,1,1:01,1261,1261,Joevan Catron Offensive Rebound.,21,49,-28,10,0.01504403741319948,0.01504403741319948,Oregon,North Carolina,3,4,NA,283302483,2008-11-25
163,1,0:51,1251,1251,Tajuan Porter missed Three Point Jumper.,21,49,-28,0,0.014740584786031087,0.014740584786031087,Oregon,North Carolina,3,4,NA,283302483,2008-11-25
164,1,0:51,1251,1251,Michael Dunigan Offensive Rebound.,21,49,-28,8,0.014740584786031087,0.014740584786031087,Oregon,North Carolina,3,4,NA,283302483,2008-11-25
165,1,0:43,1243,1243,Joevan Catron missed Two Point Layup.,21,49,-28,0,0.014495472811120102,0.014495472811120102,Oregon,North Carolina,3,4,NA,283302483,2008-11-25
