play_id,half,time_remaining_half,secs_remaining,secs_remaining_absolute,description,home_score,away_score,score_diff,play_length,win_prob,naive_win_prob,home,away,home_time_out_remaining,away_time_out_remaining,home_favored_by,game_id,date
1,1,20:00,2400,2400,PLAY,0,0,0,8,0.5,0.5,Duke,Marquette,6,6,NA,263250150,2006-11-21
2,1,19:52,2392,2392,Dominic James missed Two Point Jumper.,0,0,0,0,0.5,0.5,Duke,Marquette,6,6,NA,263250150,2006-11-21
3,1,19:52,2392,2392,Josh McRoberts Defensive Rebound.,0,0,0,11,0.5,0.5,Duke,Marquette,6,6,NA,263250150,2006-11-21
4,1,19:41,2381,2381,Foul on Jamil Lott,0,0,0,9,0.5,0.5,Duke,Marquette,6,6,NA,263250150,2006-11-21
5,1,19:32,2372,2372,Josh McRoberts missed Two Point Jumper.,0,0,0,0,0.5,0.5,Duke,Marquette,6,6,NA,263250150,2006-11-21
6,1,19:32,2372,2372,Josh McRoberts Offensive Rebound.,0,0,0,10,0.5,0.5,Duke,Marquette,6,6,NA,263250150,2006-11-21
7,1,19:22,2362,2362,Wesley Matthews Steal.,0,0,0,5,0.5,0.5,Duke,Marquette,6,6,NA,263250150,2006-11-21
8,1,19:17,2357,2357,Jerel McNeal missed Two Point Jumper.,0,0,0,0,0.5,0.5,Duke,Marquette,6,6,NA,263250150,2006-11-21
9,1,19:17,2357,2357,Lance Thomas Defensive Rebound.,0,0,0,17,0.5,0.5,Duke,Marquette,6,6,NA,263250150,2006-11-21
10,1,19:00,2340,2340,Lance Thomas missed Two Point Layup.,0,0,0,0,0.5,0.5,Duke,Marquette,6,6,NA,263250150,2006-11-21
11,1,19:00,2340,2340,Marquette Defensive Rebound.,0,0,0,23,0.5,0.5,Duke,Marquette,6,6,NA,263250150,2006-11-21
12,1,18:37,2317,2317,Jerel McNeal made Two Point Jumper.,0,2,-2,20,0.4541886461494085,0.4541886461494085,Duke,Marquette,6,6,NA,263250150,2006-11-21
13,1,18:17,2297,2297,Foul on Jerel McNeal,0,2,-2,8,0.45374590273656884,0.45374590273656884,Duke,Marquette,6,6,NA,263250150,2006-11-21
14,1,18:09,2289,2289,Wesley Matthews Steal.,0,2,-2,2,0.4535676529863345,0.4535676529863345,Duke,Marquette,6,6,NA,263250150,2006-11-21
15,1,18:07,2287,2287,Wesley Matthews made Two Point Layup.,0,4,-4,33,0.4078422699801557,0.4078422699801557,Duke,Marquette,6,6,NA,263250150,2006-11-21
16,1,17:34,2254,2254,Foul on Dan Fitzgerald,0,4,-4,5,0.4063966067392015,0.4063966067392015,Duke,Marquette,6,6,NA,263250150,2006-11-21
17,1,17:29,2249,2249,Josh McRoberts missed Two Point Layup.,0,4,-4,0,0.4061761353658107,0.4061761353658107,Duke,Marquette,6,6,NA,263250150,2006-11-21
18,1,17:29,2249,2249,Dominic James Defensive Rebound.,0,4,-4,14,0.4061761353658107,0.4061761353658107,Duke,Marquette,6,6,NA,263250150,2006-11-21
19,1,17:15,2235,2235,DeMarcus Nelson missed Two Point Jumper.,0,4,-4,0,0.40555705126070135,0.40555705126070135,Duke,Marquette,6,6,NA,263250150,2006-11-21
20,1,17:15,2235,2235,DeMarcus Nelson Offensive Rebound.,0,4,-4,11,0.40555705126070135,0.40555705126070135,Duke,Marquette,6,6,NA,263250150,2006-11-21
21,1,17:04,2224,2224,DeMarcus Nelson made Three Point Jumper.,3,4,-1,13,0.4759942065312282,0.4759942065312282,Duke,Marquette,6,6,NA,263250150,2006-11-21
22,1,16:51,2211,2211,Ousmane Barro missed Two Point Jumper.,3,4,-1,0,0.47584447325397483,0.47584447325397483,Duke,Marquette,6,6,NA,263250150,2006-11-21
23,1,16:51,2211,2211,Lance Thomas Defensive Rebound.,3,4,-1,10,0.47584447325397483,0.47584447325397483,Duke,Marquette,6,6,NA,263250150,2006-11-21
24,1,16:41,2201,2201,Greg Paulus missed Two Point Layup.,3,4,-1,0,0.47572895999777826,0.47572895999777826,Duke,Marquette,6,6,NA,263250150,2006-11-21
25,1,16:41,2201,2201,Ousmane Barro Defensive Rebound.,3,4,-1,4,0.47572895999777826,0.47572895999777826,Duke,Marquette,6,6,NA,263250150,2006-11-21
26,1,16:37,2197,2197,Foul on Josh McRoberts,3,4,-1,0,0.47568268005444203,0.47568268005444203,Duke,Marquette,6,6,NA,263250150,2006-11-21
27,1,16:37,2197,2197,Wesley Matthews made Free Throw.,3,5,-2,0,0.45148012553608485,0.45148012553608485,Duke,Marquette,6,6,NA,263250150,2006-11-21
28,1,16:37,2197,2197,Wesley Matthews made Free Throw.,3,6,-3,17,0.4275049455104304,0.4275049455104304,Duke,Marquette,6,6,NA,263250150,2006-11-21
29,1,16:20,2180,2180,DeMarcus Nelson made Three Point Jumper.  Assisted by Jon Scheyer.,6,6,0,20,0.5,0.5,Duke,Marquette,6,6,NA,263250150,2006-11-21
30,1,16:00,2160,2160,Dan Fitzgerald missed Three Point Jumper.,6,6,0,0,0.5,0.5,Duke,Marquette,6,6,NA,263250150,2006-11-21
31,1,16:00,2160,2160,Duke Defensive Rebound.,6,6,0,22,0.5,0.5,Duke,Marquette,6,6,NA,263250150,2006-11-21
32,1,15:38,2138,2138,Brian Zoubek made Two Point Layup.,8,6,2,8,0.549885098381004,0.549885098381004,Duke,Marquette,6,6,NA,263250150,2006-11-21
33,1,15:30,2130,2130,Greg Paulus Steal.,8,6,2,1,0.5500721316261907,0.5500721316261907,Duke,Marquette,6,6,NA,263250150,2006-11-21
34,1,15:29,2129,2129,Greg Paulus made Two Point Layup.,10,6,4,18,0.599195349539166,0.599195349539166,Duke,Marquette,6,6,NA,263250150,2006-11-21
35,1,15:11,2111,2111,Dominic James made Two Point Jumper.,10,8,2,27,0.5505185617369068,0.5505185617369068,Duke,Marquette,6,6,NA,263250150,2006-11-21
36,1,14:44,2084,2084,DeMarcus Nelson made Two Point Dunk Shot.  Assisted by Josh McRoberts.,12,8,4,12,0.6012574047381553,0.6012574047381553,Duke,Marquette,6,6,NA,263250150,2006-11-21
37,1,14:32,2072,2072,Wesley Matthews missed Two Point Layup.,12,8,4,0,0.6018132833172037,0.6018132833172037,Duke,Marquette,6,6,NA,263250150,2006-11-21
38,1,14:32,2072,2072,Jon Scheyer Defensive Rebound.,12,8,4,5,0.6018132833172037,0.6018132833172037,Duke,Marquette,6,6,NA,263250150,2006-11-21
39,1,14:27,2067,2067,Official TV Timeout.,12,8,4,12,0.6020456997338557,0.6020456997338557,Duke,Marquette,6,6,NA,263250150,2006-11-21
40,1,14:15,2055,2055,DeMarcus Nelson made Three Point Jumper.  Assisted by Greg Paulus.,15,8,7,8,0.6744942615159314,0.6744942615159314,Duke,Marquette,6,6,NA,263250150,2006-11-21
41,1,14:07,2047,2047,Foul on Greg Paulus,15,8,7,12,0.6750953845595119,0.6750953845595119,Duke,Marquette,6,6,NA,263250150,2006-11-21
42,1,13:55,2035,2035,Jerel McNeal missed Two Point Jumper.,15,8,7,0,0.6760003144092598,0.6760003144092598,Duke,Marquette,6,6,NA,263250150,2006-11-21
43,1,13:55,2035,2035,Jerel McNeal Offensive Rebound.,15,8,7,3,0.6760003144092598,0.6760003144092598,Duke,Marquette,6,6,NA,263250150,2006-11-21
44,1,13:52,2032,2032,Jerel McNeal missed Two Point Jumper.,15,8,7,0,0.6762271707517198,0.6762271707517198,Duke,Marquette,6,6,NA,263250150,2006-11-21
45,1,13:52,2032,2032,Ousmane Barro Offensive Rebound.,15,8,7,2,0.6762271707517198,0.6762271707517198,Duke,Marquette,6,6,NA,263250150,2006-11-21
46,1,13:50,2030,2030,Ousmane Barro made Two Point Layup.,15,10,5,20,0.6286795016727604,0.6286795016727604,Duke,Marquette,6,6,NA,263250150,2006-11-21
47,1,13:30,2010,2010,Dan Fitzgerald Steal.,15,10,5,3,0.6298381936211821,0.6298381936211821,Duke,Marquette,6,6,NA,263250150,2006-11-21
48,1,13:27,2007,2007,Jerel McNeal made Two Point Layup.,15,12,3,39,0.5791690721718554,0.5791690721718554,Duke,Marquette,6,6,NA,263250150,2006-11-21
49,1,12:48,1968,1968,Foul on Dan Fitzgerald,15,12,3,11,0.5806092812137804,0.5806092812137804,Duke,Marquette,6,6,NA,263250150,2006-11-21
50,1,12:37,1957,1957,Foul on DeMarcus Nelson,15,12,3,15,0.5810209106794497,0.5810209106794497,Duke,Marquette,6,6,NA,263250150,2006-11-21
51,1,12:22,1942,1942,Dominic James missed Two Point Jumper.,15,12,3,0,0.5815862678210438,0.5815862678210438,Duke,Marquette,6,6,NA,263250150,2006-11-21
52,1,12:22,1942,1942,Marquette Defensive Rebound.,15,12,3,21,0.5815862678210438,0.5815862678210438,Duke,Marquette,6,6,NA,263250150,2006-11-21
53,1,12:01,1921,1921,Jerel McNeal missed Three Point Jumper.,15,12,3,0,0.5823846741247521,0.5823846741247521,Duke,Marquette,6,6,NA,263250150,2006-11-21
54,1,12:01,1921,1921,Lazar Hayward Offensive Rebound.,15,12,3,3,0.5823846741247521,0.5823846741247521,Duke,Marquette,6,6,NA,263250150,2006-11-21
55,1,11:58,1918,1918,Lazar Hayward made Two Point Layup.,15,14,1,27,0.5277248306378863,0.5277248306378863,Duke,Marquette,6,6,NA,263250150,2006-11-21
56,1,11:31,1891,1891,Gerald Henderson missed Two Point Jumper.,15,14,1,0,0.5280751545178447,0.5280751545178447,Duke,Marquette,6,6,NA,263250150,2006-11-21
57,1,11:31,1891,1891,Martynas Pocius Offensive Rebound.,15,14,1,0,0.5280751545178447,0.5280751545178447,Duke,Marquette,6,6,NA,263250150,2006-11-21
58,1,11:31,1891,1891,Official TV Timeout.,15,14,1,4,0.5280751545178447,0.5280751545178447,Duke,Marquette,6,6,NA,263250150,2006-11-21
59,1,11:27,1887,1887,Jerel McNeal Steal.,15,14,1,17,0.5281270409839967,0.5281270409839967,Duke,Marquette,6,6,NA,263250150,2006-11-21
60,1,11:10,1870,1870,Foul on Lazar Hayward,15,14,1,17,0.5283477417471951,0.5283477417471951,Duke,Marquette,6,6,NA,263250150,2006-11-21
61,1,10:53,1853,1853,Gerald Henderson missed Two Point Jumper.,15,14,1,0,0.5285690234491967,0.5285690234491967,Duke,Marquette,6,6,NA,263250150,2006-11-21
62,1,10:53,1853,1853,Dwight Burke Defensive Rebound.,15,14,1,23,0.5285690234491967,0.5285690234491967,Duke,Marquette,6,6,NA,263250150,2006-11-21
63,1,10:30,1830,1830,Josh McRoberts missed Two Point Jumper.,15,14,1,0,0.5288700076585847,0.5288700076585847,Duke,Marquette,6,6,NA,263250150,2006-11-21
64,1,10:30,1830,1830,Lance Thomas Offensive Rebound.,15,14,1,8,0.5288700076585847,0.5288700076585847,Duke,Marquette,6,6,NA,263250150,2006-11-21
65,1,10:22,1822,1822,Lance Thomas made Two Point Layup.,17,14,3,12,0.5861551620920435,0.5861551620920435,Duke,Marquette,6,6,NA,263250150,2006-11-21
66,1,10:10,1810,1810,Jerel McNeal made Two Point Layup.,17,16,1,19,0.529133898970281,0.529133898970281,Duke,Marquette,6,6,NA,263250150,2006-11-21
67,1,9:51,1791,1791,Josh McRoberts made Two Point Layup.,19,16,3,17,0.5873573814285875,0.5873573814285875,Duke,Marquette,6,6,NA,263250150,2006-11-21
68,1,9:34,1774,1774,Jerel McNeal missed Two Point Jumper.,19,16,3,0,0.588025528980471,0.588025528980471,Duke,Marquette,6,6,NA,263250150,2006-11-21
69,1,9:34,1774,1774,Lance Thomas Defensive Rebound.,19,16,3,19,0.588025528980471,0.588025528980471,Duke,Marquette,6,6,NA,263250150,2006-11-21
70,1,9:15,1755,1755,Wesley Matthews missed Two Point Jumper.,19,16,3,2,0.5887814245953087,0.5887814245953087,Duke,Marquette,6,6,NA,263250150,2006-11-21
71,1,9:13,1753,1753,Josh McRoberts Defensive Rebound.,19,16,3,11,0.588861613376298,0.588861613376298,Duke,Marquette,6,6,NA,263250150,2006-11-21
72,1,9:02,1742,1742,Foul on Dwight Burke,19,16,3,21,0.5893049355659337,0.5893049355659337,Duke,Marquette,6,6,NA,263250150,2006-11-21
73,1,8:41,1721,1721,Josh McRoberts made Two Point Dunk Shot.  Assisted by DeMarcus Nelson.,21,16,5,9,0.6474230638492782,0.6474230638492782,Duke,Marquette,6,6,NA,263250150,2006-11-21
74,1,8:32,1712,1712,Dominic James made Two Point Layup.,21,18,3,19,0.5905356029662491,0.5905356029662491,Duke,Marquette,6,6,NA,263250150,2006-11-21
75,1,8:13,1693,1693,Jon Scheyer missed Three Point Jumper.,21,18,3,0,0.5913334476957056,0.5913334476957056,Duke,Marquette,6,6,NA,263250150,2006-11-21
76,1,8:13,1693,1693,Marquette Defensive Rebound.,21,18,3,14,0.5913334476957056,0.5913334476957056,Duke,Marquette,6,6,NA,263250150,2006-11-21
77,1,7:59,1679,1679,Marquette 20 Second Timeout.,21,18,3,8,0.591924655459778,0.591924655459778,Duke,Marquette,6,5,NA,263250150,2006-11-21
78,1,7:51,1671,1671,Official TV Timeout.,21,18,3,26,0.5922571926971131,0.5922571926971131,Duke,Marquette,6,5,NA,263250150,2006-11-21
79,1,7:25,1645,1645,Brian Zoubek made Two Point Layup.  Assisted by Josh McRoberts.,23,18,5,20,0.6523717955141202,0.6523717955141202,Duke,Marquette,6,5,NA,263250150,2006-11-21
80,1,7:05,1625,1625,Josh McRoberts Steal.,23,18,5,6,0.6536202142266724,0.6536202142266724,Duke,Marquette,6,5,NA,263250150,2006-11-21
81,1,6:59,1619,1619,Jon Scheyer missed Two Point Layup.,23,18,5,0,0.6539917441205468,0.6539917441205468,Duke,Marquette,6,5,NA,263250150,2006-11-21
82,1,6:59,1619,1619,Dominic James Defensive Rebound.,23,18,5,10,0.6539917441205468,0.6539917441205468,Duke,Marquette,6,5,NA,263250150,2006-11-21
83,1,6:49,1609,1609,Dominic James made Three Point Jumper.,23,21,2,24,0.5635899247872772,0.5635899247872772,Duke,Marquette,6,5,NA,263250150,2006-11-21
84,1,6:25,1585,1585,Jon Scheyer missed Two Point Jumper.,23,21,2,0,0.5642339869763727,0.5642339869763727,Duke,Marquette,6,5,NA,263250150,2006-11-21
85,1,6:25,1585,1585,Ousmane Barro Defensive Rebound.,23,21,2,7,0.5642339869763727,0.5642339869763727,Duke,Marquette,6,5,NA,263250150,2006-11-21
86,1,6:18,1578,1578,Jerel McNeal missed Two Point Layup.,23,21,2,0,0.5644225298813833,0.5644225298813833,Duke,Marquette,6,5,NA,263250150,2006-11-21
87,1,6:18,1578,1578,Duke Defensive Rebound.,23,21,2,39,0.5644225298813833,0.5644225298813833,Duke,Marquette,6,5,NA,263250150,2006-11-21
88,1,5:39,1539,1539,Gerald Henderson missed Two Point Layup.,23,21,2,0,0.5654900334456341,0.5654900334456341,Duke,Marquette,6,5,NA,263250150,2006-11-21
89,1,5:39,1539,1539,Gerald Henderson Offensive Rebound.,23,21,2,0,0.5654900334456341,0.5654900334456341,Duke,Marquette,6,5,NA,263250150,2006-11-21
90,1,5:39,1539,1539,Gerald Henderson missed Two Point Layup.,23,21,2,0,0.5654900334456341,0.5654900334456341,Duke,Marquette,6,5,NA,263250150,2006-11-21
91,1,5:39,1539,1539,Duke Defensive Rebound.,23,21,2,17,0.5654900334456341,0.5654900334456341,Duke,Marquette,6,5,NA,263250150,2006-11-21
92,1,5:22,1522,1522,DeMarcus Nelson missed Three Point Jumper.,23,21,2,0,0.5659698093040033,0.5659698093040033,Duke,Marquette,6,5,NA,263250150,2006-11-21
93,1,5:22,1522,1522,Jerel McNeal Defensive Rebound.,23,21,2,12,0.5659698093040033,0.5659698093040033,Duke,Marquette,6,5,NA,263250150,2006-11-21
94,1,5:10,1510,1510,Jamil Lott missed Two Point Layup.,23,21,2,0,0.5663158885499159,0.5663158885499159,Duke,Marquette,6,5,NA,263250150,2006-11-21
95,1,5:10,1510,1510,Duke Defensive Rebound.,23,21,2,0,0.5663158885499159,0.5663158885499159,Duke,Marquette,6,5,NA,263250150,2006-11-21
96,1,5:10,1510,1510,Foul on Wesley Matthews,23,21,2,0,0.5663158885499159,0.5663158885499159,Duke,Marquette,6,5,NA,263250150,2006-11-21
97,1,5:10,1510,1510,Greg Paulus made Free Throw.,24,21,3,0,0.5987485457847855,0.5987485457847855,Duke,Marquette,6,5,NA,263250150,2006-11-21
98,1,5:10,1510,1510,Greg Paulus made Free Throw.,25,21,4,21,0.6303389599136008,0.6303389599136008,Duke,Marquette,6,5,NA,263250150,2006-11-21
99,1,4:49,1489,1489,Ousmane Barro made Two Point Layup.  Assisted by Dominic James.,25,23,2,23,0.5669394058414631,0.5669394058414631,Duke,Marquette,6,5,NA,263250150,2006-11-21
100,1,4:26,1466,1466,Gerald Henderson missed Two Point Jumper.,25,23,2,0,0.567653501260949,0.567653501260949,Duke,Marquette,6,5,NA,263250150,2006-11-21
101,1,4:26,1466,1466,Josh McRoberts Offensive Rebound.,25,23,2,0,0.567653501260949,0.567653501260949,Duke,Marquette,6,5,NA,263250150,2006-11-21
102,1,4:26,1466,1466,Josh McRoberts missed Two Point Layup.,25,23,2,0,0.567653501260949,0.567653501260949,Duke,Marquette,6,5,NA,263250150,2006-11-21
103,1,4:26,1466,1466,Josh McRoberts Offensive Rebound.,25,23,2,0,0.567653501260949,0.567653501260949,Duke,Marquette,6,5,NA,263250150,2006-11-21
104,1,4:26,1466,1466,Foul on Jamil Lott,25,23,2,0,0.567653501260949,0.567653501260949,Duke,Marquette,6,5,NA,263250150,2006-11-21
105,1,4:26,1466,1466,Josh McRoberts missed Free Throw.,25,23,2,0,0.567653501260949,0.567653501260949,Duke,Marquette,6,5,NA,263250150,2006-11-21
106,1,4:26,1466,1466,Duke Defensive Rebound.,25,23,2,0,0.567653501260949,0.567653501260949,Duke,Marquette,6,5,NA,263250150,2006-11-21
107,1,4:26,1466,1466,Josh McRoberts made Free Throw.,26,23,3,22,0.6007103500951145,0.6007103500951145,Duke,Marquette,6,5,NA,263250150,2006-11-21
108,1,4:04,1444,1444,Foul on Gerald Henderson,26,23,3,13,0.601760546031911,0.601760546031911,Duke,Marquette,6,5,NA,263250150,2006-11-21
109,1,3:51,1431,1431,Jerel McNeal made Two Point Jumper.,26,25,1,15,0.5345586474277225,0.5345586474277225,Duke,Marquette,6,5,NA,263250150,2006-11-21
110,1,3:36,1416,1416,Official TV Timeout.,26,25,1,14,0.5347973877733021,0.5347973877733021,Duke,Marquette,6,5,NA,263250150,2006-11-21
111,1,3:22,1402,1402,Dominic James missed Two Point Jumper.,26,25,1,0,0.5350155762619505,0.5350155762619505,Duke,Marquette,6,5,NA,263250150,2006-11-21
112,1,3:22,1402,1402,Dan Fitzgerald Offensive Rebound.,26,25,1,5,0.5350155762619505,0.5350155762619505,Duke,Marquette,6,5,NA,263250150,2006-11-21
113,1,3:17,1397,1397,Foul on Jon Scheyer,26,25,1,6,0.5350926796567569,0.5350926796567569,Duke,Marquette,6,5,NA,263250150,2006-11-21
114,1,3:11,1391,1391,Jerel McNeal missed Three Point Jumper.,26,25,1,0,0.5351847679765457,0.5351847679765457,Duke,Marquette,6,5,NA,263250150,2006-11-21
115,1,3:11,1391,1391,Dan Fitzgerald Offensive Rebound.,26,25,1,23,0.5351847679765457,0.5351847679765457,Duke,Marquette,6,5,NA,263250150,2006-11-21
116,1,2:48,1368,1368,Dan Fitzgerald made Three Point Jumper.  Assisted by Dominic James.,26,28,-2,19,0.4292867332288323,0.4292867332288323,Duke,Marquette,6,5,NA,263250150,2006-11-21
117,1,2:29,1349,1349,Foul on Jerel McNeal,26,28,-2,0,0.42871635793598994,0.42871635793598994,Duke,Marquette,6,5,NA,263250150,2006-11-21
118,1,2:29,1349,1349,Brian Zoubek made Free Throw.,27,28,-1,0,0.4641752058521849,0.4641752058521849,Duke,Marquette,6,5,NA,263250150,2006-11-21
119,1,2:29,1349,1349,Brian Zoubek made Free Throw.,28,28,0,18,0.5,0.5,Duke,Marquette,6,5,NA,263250150,2006-11-21
120,1,2:11,1331,1331,David Cubillan missed Three Point Jumper.,28,28,0,0,0.5,0.5,Duke,Marquette,6,5,NA,263250150,2006-11-21
121,1,2:11,1331,1331,Dominic James Offensive Rebound.,28,28,0,0,0.5,0.5,Duke,Marquette,6,5,NA,263250150,2006-11-21
122,1,2:11,1331,1331,Dan Fitzgerald made Two Point Layup.  Assisted by Dominic James.,28,30,-2,0,0.42816960046610647,0.42816960046610647,Duke,Marquette,6,5,NA,263250150,2006-11-21
123,1,2:11,1331,1331,Foul on Greg Paulus,28,30,-2,0,0.42816960046610647,0.42816960046610647,Duke,Marquette,6,5,NA,263250150,2006-11-21
124,1,2:11,1331,1331,Dan Fitzgerald missed Free Throw.,28,30,-2,0,0.42816960046610647,0.42816960046610647,Duke,Marquette,6,5,NA,263250150,2006-11-21
125,1,2:11,1331,1331,Martynas Pocius Defensive Rebound.,28,30,-2,32,0.42816960046610647,0.42816960046610647,Duke,Marquette,6,5,NA,263250150,2006-11-21
126,1,1:39,1299,1299,Jerel McNeal made Two Point Layup.,28,32,-4,24,0.35735593376168917,0.35735593376168917,Duke,Marquette,6,5,NA,263250150,2006-11-21
127,1,1:15,1275,1275,Foul on Ousmane Barro,28,32,-4,0,0.3558599980503011,0.3558599980503011,Duke,Marquette,6,5,NA,263250150,2006-11-21
128,1,1:15,1275,1275,Josh McRoberts made Free Throw.,29,32,-3,0,0.3905421164589737,0.3905421164589737,Duke,Marquette,6,5,NA,263250150,2006-11-21
129,1,1:15,1275,1275,Josh McRoberts made Free Throw.,30,32,-2,26,0.4263669969843164,0.4263669969843164,Duke,Marquette,6,5,NA,263250150,2006-11-21
130,1,0:49,1249,1249,Dominic James missed Three Point Jumper.,30,32,-2,0,0.42544373965115917,0.42544373965115917,Duke,Marquette,6,5,NA,263250150,2006-11-21
131,1,0:49,1249,1249,Duke Defensive Rebound.,30,32,-2,0,0.42544373965115917,0.42544373965115917,Duke,Marquette,6,5,NA,263250150,2006-11-21
132,1,0:49,1249,1249,Duke 20 Second Timeout.,30,32,-2,13,0.42544373965115917,0.42544373965115917,Duke,Marquette,6,4,NA,263250150,2006-11-21
133,1,0:36,1236,1236,Josh McRoberts made Two Point Layup.,32,32,0,16,0.5,0.5,Duke,Marquette,6,4,NA,263250150,2006-11-21
134,1,0:20,1220,1220,Dominic James made Two Point Jumper.,32,34,-2,19,0.4243211588473973,0.4243211588473973,Duke,Marquette,6,4,NA,263250150,2006-11-21
135,1,0:01,1201,1201,Martynas Pocius missed Three Point Jumper.,32,34,-2,0,0.4235319432624558,0.4235319432624558,Duke,Marquette,6,4,NA,263250150,2006-11-21
136,1,0:01,1201,1201,Ousmane Barro Defensive Rebound.,32,34,-2,1,0.4235319432624558,0.4235319432624558,Duke,Marquette,6,4,NA,263250150,2006-11-21
137,1,0:00,1200,1200,End of the 1st Half.,32,34,-2,0,0.4234906714856242,0.4234906714856242,Duke,Marquette,6,4,NA,263250150,2006-11-21
138,2,20:00,1200,1200,PLAY,32,34,-2,11,0.4234906714856242,0.4234906714856242,Duke,Marquette,6,4,NA,263250150,2006-11-21
139,2,19:49,1189,1189,Greg Paulus made Three Point Jumper.  Assisted by Josh McRoberts.,35,34,1,10,0.5387096993613577,0.5387096993613577,Duke,Marquette,6,4,NA,263250150,2006-11-21
140,2,19:39,1179,1179,Dominic James made Two Point Layup.,35,36,-1,31,0.461086260048513,0.461086260048513,Duke,Marquette,6,4,NA,263250150,2006-11-21
141,2,19:08,1148,1148,Josh McRoberts missed Three Point Jumper.,35,36,-1,0,0.4604682574188011,0.4604682574188011,Duke,Marquette,6,4,NA,263250150,2006-11-21
142,2,19:08,1148,1148,DeMarcus Nelson Offensive Rebound.,35,36,-1,0,0.4604682574188011,0.4604682574188011,Duke,Marquette,6,4,NA,263250150,2006-11-21
143,2,19:08,1148,1148,DeMarcus Nelson missed Two Point Layup.,35,36,-1,0,0.4604682574188011,0.4604682574188011,Duke,Marquette,6,4,NA,263250150,2006-11-21
144,2,19:08,1148,1148,Duke Defensive Rebound.,35,36,-1,30,0.4604682574188011,0.4604682574188011,Duke,Marquette,6,4,NA,263250150,2006-11-21
145,2,18:38,1118,1118,Wesley Matthews made Three Point Jumper.  Assisted by Dominic James.,35,39,-4,15,0.3444871813524882,0.3444871813524882,Duke,Marquette,6,4,NA,263250150,2006-11-21
146,2,18:23,1103,1103,Lance Thomas made Two Point Layup.,37,39,-2,0,0.4196789067496167,0.4196789067496167,Duke,Marquette,6,4,NA,263250150,2006-11-21
147,2,18:23,1103,1103,Foul on Jamil Lott,37,39,-2,0,0.4196789067496167,0.4196789067496167,Duke,Marquette,6,4,NA,263250150,2006-11-21
148,2,18:23,1103,1103,Lance Thomas made Free Throw.,38,39,-1,5,0.45957696048811814,0.45957696048811814,Duke,Marquette,6,4,NA,263250150,2006-11-21
149,2,18:18,1098,1098,Dominic James missed Two Point Layup.,38,39,-1,0,0.4594760620737479,0.4594760620737479,Duke,Marquette,6,4,NA,263250150,2006-11-21
150,2,18:18,1098,1098,Duke Defensive Rebound.,38,39,-1,14,0.4594760620737479,0.4594760620737479,Duke,Marquette,6,4,NA,263250150,2006-11-21
151,2,18:04,1084,1084,Josh McRoberts missed Two Point Layup.,38,39,-1,0,0.4591896380002988,0.4591896380002988,Duke,Marquette,6,4,NA,263250150,2006-11-21
152,2,18:04,1084,1084,Marquette Defensive Rebound.,38,39,-1,14,0.4591896380002988,0.4591896380002988,Duke,Marquette,6,4,NA,263250150,2006-11-21
153,2,17:50,1070,1070,Greg Paulus Steal.,38,39,-1,3,0.4588959930529921,0.4588959930529921,Duke,Marquette,6,4,NA,263250150,2006-11-21
154,2,17:47,1067,1067,Greg Paulus missed Three Point Jumper.,38,39,-1,0,0.4588319511798032,0.4588319511798032,Duke,Marquette,6,4,NA,263250150,2006-11-21
155,2,17:47,1067,1067,Jerel McNeal Defensive Rebound.,38,39,-1,29,0.4588319511798032,0.4588319511798032,Duke,Marquette,6,4,NA,263250150,2006-11-21
156,2,17:18,1038,1038,Ousmane Barro made Two Point Layup.  Assisted by Dominic James.,38,41,-3,33,0.3768542628946792,0.3768542628946792,Duke,Marquette,6,4,NA,263250150,2006-11-21
157,2,16:45,1005,1005,David McClure made Three Point Jumper.  Assisted by Josh McRoberts.,41,41,0,22,0.5,0.5,Duke,Marquette,6,4,NA,263250150,2006-11-21
158,2,16:23,983,983,Jerel McNeal missed Two Point Jumper.,41,41,0,0,0.5,0.5,Duke,Marquette,6,4,NA,263250150,2006-11-21
159,2,16:23,983,983,Wesley Matthews Offensive Rebound.,41,41,0,3,0.5,0.5,Duke,Marquette,6,4,NA,263250150,2006-11-21
160,2,16:20,980,980,Wesley Matthews missed Two Point Layup.,41,41,0,0,0.5,0.5,Duke,Marquette,6,4,NA,263250150,2006-11-21
161,2,16:20,980,980,Marquette Defensive Rebound.,41,41,0,10,0.5,0.5,Duke,Marquette,6,4,NA,263250150,2006-11-21
162,2,16:10,970,970,Ousmane Barro made Two Point Layup.  Assisted by Dominic James.,41,43,-2,31,0.41350482316685694,0.41350482316685694,Duke,Marquette,6,4,NA,263250150,2006-11-21
163,2,15:39,939,939,Josh McRoberts made Two Point Dunk Shot.  Assisted by DeMarcus Nelson.,43,43,0,24,0.5,0.5,Duke,Marquette,6,4,NA,263250150,2006-11-21
164,2,15:15,915,915,Josh McRoberts Steal.,43,43,0,7,0.5,0.5,Duke,Marquette,6,4,NA,263250150,2006-11-21
165,2,15:08,908,908,David McClure made Two Point Layup.,45,43,2,25,0.5895398725267599,0.5895398725267599,Duke,Marquette,6,4,NA,263250150,2006-11-21
166,2,14:43,883,883,Dominic James missed Three Point Jumper.,45,43,2,0,0.5906048255469906,0.5906048255469906,Duke,Marquette,6,4,NA,263250150,2006-11-21
167,2,14:43,883,883,Dan Fitzgerald Offensive Rebound.,45,43,2,3,0.5906048255469906,0.5906048255469906,Duke,Marquette,6,4,NA,263250150,2006-11-21
168,2,14:40,880,880,Dan Fitzgerald made Two Point Layup.,45,45,0,18,0.5,0.5,Duke,Marquette,6,4,NA,263250150,2006-11-21
169,2,14:22,862,862,Foul on Jerel McNeal,45,45,0,0,0.5,0.5,Duke,Marquette,6,4,NA,263250150,2006-11-21
170,2,14:22,862,862,Official TV Timeout.,45,45,0,0,0.5,0.5,Duke,Marquette,6,4,NA,263250150,2006-11-21
171,2,14:22,862,862,Josh McRoberts made Free Throw.,46,45,1,0,0.5461369441507579,0.5461369441507579,Duke,Marquette,6,4,NA,263250150,2006-11-21
172,2,14:22,862,862,Josh McRoberts made Free Throw.,47,45,2,14,0.5914948580353234,0.5914948580353234,Duke,Marquette,6,4,NA,263250150,2006-11-21
173,2,14:08,848,848,Dan Fitzgerald missed Three Point Jumper.,47,45,2,0,0.5921049334321793,0.5921049334321793,Duke,Marquette,6,4,NA,263250150,2006-11-21
174,2,14:08,848,848,Brian Zoubek Defensive Rebound.,47,45,2,32,0.5921049334321793,0.5921049334321793,Duke,Marquette,6,4,NA,263250150,2006-11-21
175,2,13:36,816,816,Greg Paulus missed Two Point Layup.,47,45,2,0,0.5936132145769233,0.5936132145769233,Duke,Marquette,6,4,NA,263250150,2006-11-21
176,2,13:36,816,816,Ousmane Barro Defensive Rebound.,47,45,2,17,0.5936132145769233,0.5936132145769233,Duke,Marquette,6,4,NA,263250150,2006-11-21
177,2,13:19,799,799,Jerel McNeal missed Two Point Layup.,47,45,2,2,0.5945126261240116,0.5945126261240116,Duke,Marquette,6,4,NA,263250150,2006-11-21
178,2,13:17,797,797,Josh McRoberts Defensive Rebound.,47,45,2,6,0.5946241576951435,0.5946241576951435,Duke,Marquette,6,4,NA,263250150,2006-11-21
179,2,13:11,791,791,Foul on Wesley Matthews,47,45,2,0,0.5949667420790963,0.5949667420790963,Duke,Marquette,6,4,NA,263250150,2006-11-21
180,2,13:11,791,791,Jon Scheyer made Free Throw.,48,45,3,0,0.6403317884076982,0.6403317884076982,Duke,Marquette,6,4,NA,263250150,2006-11-21
181,2,13:11,791,791,Jon Scheyer made Free Throw.,49,45,4,0,0.683320255721984,0.683320255721984,Duke,Marquette,6,4,NA,263250150,2006-11-21
