play_id,half,time_remaining_half,secs_remaining,secs_remaining_absolute,description,home_score,away_score,score_diff,play_length,win_prob,naive_win_prob,home,away,home_time_out_remaining,away_time_out_remaining,home_favored_by,game_id,date
1,1,20:00,2400,2400,PLAY,0,0,0,27,0.5,0.5,Illinois,Ohio State,4,4,NA,290200356,2009-01-20
2,1,19:33,2373,2373,Demetri McCamey made Three Point Jumper.  Assisted by Trent Meacham.,3,0,3,26,0.5666738417586205,0.5666738417586205,Illinois,Ohio State,4,4,NA,290200356,2009-01-20
3,1,19:07,2347,2347,Demetri McCamey missed Three Point Jumper.,3,0,3,0,0.5675039540011753,0.5675039540011753,Illinois,Ohio State,4,4,NA,290200356,2009-01-20
4,1,19:07,2347,2347,Evan Turner Defensive Rebound.,3,0,3,15,0.5675039540011753,0.5675039540011753,Illinois,Ohio State,4,4,NA,290200356,2009-01-20
5,1,18:52,2332,2332,Dallas Lauderdale made Two Point Dunk Shot.  Assisted by Jeremie Simmons.,3,2,1,17,0.5227883361633022,0.5227883361633022,Illinois,Ohio State,4,4,NA,290200356,2009-01-20
6,1,18:35,2315,2315,Mike Davis made Two Point Jumper.  Assisted by Chester Frazier.,5,2,3,20,0.5685427055409771,0.5685427055409771,Illinois,Ohio State,4,4,NA,290200356,2009-01-20
7,1,18:15,2295,2295,William Buford made Three Point Jumper.  Assisted by Evan Turner.,5,5,0,25,0.5,0.5,Illinois,Ohio State,4,4,NA,290200356,2009-01-20
8,1,17:50,2270,2270,Trent Meacham missed Three Point Jumper.,5,5,0,0,0.5,0.5,Illinois,Ohio State,4,4,NA,290200356,2009-01-20
9,1,17:50,2270,2270,Dallas Lauderdale Defensive Rebound.,5,5,0,15,0.5,0.5,Illinois,Ohio State,4,4,NA,290200356,2009-01-20
10,1,17:35,2255,2255,William Buford missed Three Point Jumper.,5,5,0,0,0.5,0.5,Illinois,Ohio State,4,4,NA,290200356,2009-01-20
11,1,17:35,2255,2255,Demetri McCamey Defensive Rebound.,5,5,0,9,0.5,0.5,Illinois,Ohio State,4,4,NA,290200356,2009-01-20
12,1,17:26,2246,2246,Mike Davis made Two Point Jumper.  Assisted by Demetri McCamey.,7,5,2,22,0.5474003565203939,0.5474003565203939,Illinois,Ohio State,4,4,NA,290200356,2009-01-20
13,1,17:04,2224,2224,Jon Diebler missed Two Point Jumper.,7,5,2,0,0.547901169354246,0.547901169354246,Illinois,Ohio State,4,4,NA,290200356,2009-01-20
14,1,17:04,2224,2224,Evan Turner Offensive Rebound.,7,5,2,5,0.547901169354246,0.547901169354246,Illinois,Ohio State,4,4,NA,290200356,2009-01-20
15,1,16:59,2219,2219,Evan Turner made Two Point Layup.,7,7,0,14,0.5,0.5,Illinois,Ohio State,4,4,NA,290200356,2009-01-20
16,1,16:45,2205,2205,Mike Davis missed Two Point Jumper.,7,7,0,0,0.5,0.5,Illinois,Ohio State,4,4,NA,290200356,2009-01-20
17,1,16:45,2205,2205,Dallas Lauderdale Defensive Rebound.,7,7,0,12,0.5,0.5,Illinois,Ohio State,4,4,NA,290200356,2009-01-20
18,1,16:33,2193,2193,Jeremie Simmons missed Three Point Jumper.,7,7,0,0,0.5,0.5,Illinois,Ohio State,4,4,NA,290200356,2009-01-20
19,1,16:33,2193,2193,Illinois Defensive Rebound.,7,7,0,17,0.5,0.5,Illinois,Ohio State,4,4,NA,290200356,2009-01-20
20,1,16:16,2176,2176,Mike Tisdale missed Two Point Layup.,7,7,0,1,0.5,0.5,Illinois,Ohio State,4,4,NA,290200356,2009-01-20
21,1,16:15,2175,2175,Dallas Lauderdale Block.,7,7,0,1,0.5,0.5,Illinois,Ohio State,4,4,NA,290200356,2009-01-20
22,1,16:14,2174,2174,Evan Turner Defensive Rebound.,7,7,0,22,0.5,0.5,Illinois,Ohio State,4,4,NA,290200356,2009-01-20
23,1,15:52,2152,2152,Mike Tisdale missed Two Point Jumper.,7,7,0,0,0.5,0.5,Illinois,Ohio State,4,4,NA,290200356,2009-01-20
24,1,15:52,2152,2152,Dallas Lauderdale Defensive Rebound.,7,7,0,12,0.5,0.5,Illinois,Ohio State,4,4,NA,290200356,2009-01-20
25,1,15:40,2140,2140,William Buford missed Two Point Layup.,7,7,0,0,0.5,0.5,Illinois,Ohio State,4,4,NA,290200356,2009-01-20
26,1,15:40,2140,2140,Mike Davis Block.,7,7,0,0,0.5,0.5,Illinois,Ohio State,4,4,NA,290200356,2009-01-20
27,1,15:40,2140,2140,Mike Davis Defensive Rebound.,7,7,0,4,0.5,0.5,Illinois,Ohio State,4,4,NA,290200356,2009-01-20
28,1,15:36,2136,2136,Demetri McCamey made Three Point Jumper.,10,7,3,19,0.5745874139872303,0.5745874139872303,Illinois,Ohio State,4,4,NA,290200356,2009-01-20
29,1,15:17,2117,2117,Foul on William Buford,10,7,3,0,0.5752471972723344,0.5752471972723344,Illinois,Ohio State,4,4,NA,290200356,2009-01-20
30,1,15:17,2117,2117,Official TV Timeout.,10,7,3,19,0.5752471972723344,0.5752471972723344,Illinois,Ohio State,4,4,NA,290200356,2009-01-20
31,1,14:58,2098,2098,Evan Turner missed Two Point Jumper.,10,7,3,0,0.5759116389021492,0.5759116389021492,Illinois,Ohio State,4,4,NA,290200356,2009-01-20
32,1,14:58,2098,2098,Mike Davis Defensive Rebound.,10,7,3,21,0.5759116389021492,0.5759116389021492,Illinois,Ohio State,4,4,NA,290200356,2009-01-20
33,1,14:37,2077,2077,Chester Frazier made Three Point Jumper.  Assisted by Mike Davis.,13,7,6,18,0.649783477680692,0.649783477680692,Illinois,Ohio State,4,4,NA,290200356,2009-01-20
34,1,14:19,2059,2059,William Buford made Two Point Jumper.,13,9,4,35,0.6024185723153839,0.6024185723153839,Illinois,Ohio State,4,4,NA,290200356,2009-01-20
35,1,13:44,2024,2024,Dominique Keller made Two Point Jumper.  Assisted by Demetri McCamey.,15,9,6,18,0.6533163770840418,0.6533163770840418,Illinois,Ohio State,4,4,NA,290200356,2009-01-20
36,1,13:26,2006,2006,William Buford missed Two Point Layup.,15,9,6,0,0.6545334007343265,0.6545334007343265,Illinois,Ohio State,4,4,NA,290200356,2009-01-20
37,1,13:26,2006,2006,Dominique Keller Defensive Rebound.,15,9,6,8,0.6545334007343265,0.6545334007343265,Illinois,Ohio State,4,4,NA,290200356,2009-01-20
38,1,13:18,1998,1998,Trent Meacham missed Three Point Jumper.,15,9,6,0,0.6550773189182073,0.6550773189182073,Illinois,Ohio State,4,4,NA,290200356,2009-01-20
39,1,13:18,1998,1998,William Buford Defensive Rebound.,15,9,6,17,0.6550773189182073,0.6550773189182073,Illinois,Ohio State,4,4,NA,290200356,2009-01-20
40,1,13:01,1981,1981,Dominique Keller made Two Point Layup.,17,9,8,5,0.7031008549938805,0.7031008549938805,Illinois,Ohio State,4,4,NA,290200356,2009-01-20
41,1,12:56,1976,1976,Ohio State 30 Second Timeout.,17,9,8,38,0.703524642393787,0.703524642393787,Illinois,Ohio State,3,4,NA,290200356,2009-01-20
42,1,12:18,1938,1938,Dominique Keller made Two Point Jumper.,19,9,10,15,0.7502048089160647,0.7502048089160647,Illinois,Ohio State,3,4,NA,290200356,2009-01-20
43,1,12:03,1923,1923,Foul on Dominique Keller,19,9,10,0,0.751667455849466,0.751667455849466,Illinois,Ohio State,3,4,NA,290200356,2009-01-20
44,1,12:03,1923,1923,B.J. Mullens made Free Throw.,19,10,9,0,0.7304235869144904,0.7304235869144904,Illinois,Ohio State,3,4,NA,290200356,2009-01-20
45,1,12:03,1923,1923,B.J. Mullens missed Free Throw.,19,10,9,0,0.7304235869144904,0.7304235869144904,Illinois,Ohio State,3,4,NA,290200356,2009-01-20
46,1,12:03,1923,1923,Alex Legion Defensive Rebound.,19,10,9,32,0.7304235869144904,0.7304235869144904,Illinois,Ohio State,3,4,NA,290200356,2009-01-20
47,1,11:31,1891,1891,Calvin Brock missed Three Point Jumper.,19,10,9,0,0.7333663551710436,0.7333663551710436,Illinois,Ohio State,3,4,NA,290200356,2009-01-20
48,1,11:31,1891,1891,P.J. Hill Defensive Rebound.,19,10,9,18,0.7333663551710436,0.7333663551710436,Illinois,Ohio State,3,4,NA,290200356,2009-01-20
49,1,11:13,1873,1873,William Buford missed Three Point Jumper.,19,10,9,0,0.7350128240615954,0.7350128240615954,Illinois,Ohio State,3,4,NA,290200356,2009-01-20
50,1,11:13,1873,1873,Chester Frazier Defensive Rebound.,19,10,9,20,0.7350128240615954,0.7350128240615954,Illinois,Ohio State,3,4,NA,290200356,2009-01-20
51,1,10:53,1853,1853,Alex Legion missed Three Point Jumper.,19,10,9,0,0.7368395603172849,0.7368395603172849,Illinois,Ohio State,3,4,NA,290200356,2009-01-20
52,1,10:53,1853,1853,Jon Diebler Defensive Rebound.,19,10,9,18,0.7368395603172849,0.7368395603172849,Illinois,Ohio State,3,4,NA,290200356,2009-01-20
53,1,10:35,1835,1835,Calvin Brock missed Two Point Layup.,19,10,9,0,0.7384845979536,0.7384845979536,Illinois,Ohio State,3,4,NA,290200356,2009-01-20
54,1,10:35,1835,1835,Evan Turner Defensive Rebound.,19,10,9,6,0.7384845979536,0.7384845979536,Illinois,Ohio State,3,4,NA,290200356,2009-01-20
55,1,10:29,1829,1829,Foul on Jeff Jordan,19,10,9,0,0.739033700426961,0.739033700426961,Illinois,Ohio State,3,4,NA,290200356,2009-01-20
56,1,10:29,1829,1829,Official TV Timeout.,19,10,9,51,0.739033700426961,0.739033700426961,Illinois,Ohio State,3,4,NA,290200356,2009-01-20
57,1,9:38,1778,1778,Foul on Calvin Brock,19,10,9,15,0.7437348850815992,0.7437348850815992,Illinois,Ohio State,3,4,NA,290200356,2009-01-20
58,1,9:23,1763,1763,Jon Diebler missed Three Point Jumper.,19,10,9,0,0.7451350253533222,0.7451350253533222,Illinois,Ohio State,3,4,NA,290200356,2009-01-20
59,1,9:23,1763,1763,Ohio State Offensive Rebound.,19,10,9,12,0.7451350253533222,0.7451350253533222,Illinois,Ohio State,3,4,NA,290200356,2009-01-20
60,1,9:11,1751,1751,Jeremie Simmons missed Two Point Jumper.,19,10,9,0,0.746262897785954,0.746262897785954,Illinois,Ohio State,3,4,NA,290200356,2009-01-20
61,1,9:11,1751,1751,null,19,10,9,3,0.746262897785954,0.746262897785954,Illinois,Ohio State,3,4,NA,290200356,2009-01-20
62,1,9:08,1748,1748,Foul on B.J. Mullens,19,10,9,17,0.7465460508587644,0.7465460508587644,Illinois,Ohio State,3,4,NA,290200356,2009-01-20
63,1,8:51,1731,1731,Mike Tisdale made Two Point Layup.  Assisted by Mike Davis.,21,10,11,19,0.7909706290506332,0.7909706290506332,Illinois,Ohio State,3,4,NA,290200356,2009-01-20
64,1,8:32,1712,1712,Jeremie Simmons missed Three Point Jumper.,21,10,11,0,0.7929270189281958,0.7929270189281958,Illinois,Ohio State,3,4,NA,290200356,2009-01-20
65,1,8:32,1712,1712,Mike Davis Defensive Rebound.,21,10,11,11,0.7929270189281958,0.7929270189281958,Illinois,Ohio State,3,4,NA,290200356,2009-01-20
66,1,8:21,1701,1701,Demetri McCamey missed Three Point Jumper.,21,10,11,0,0.7940702755486859,0.7940702755486859,Illinois,Ohio State,3,4,NA,290200356,2009-01-20
67,1,8:21,1701,1701,Evan Turner Defensive Rebound.,21,10,11,13,0.7940702755486859,0.7940702755486859,Illinois,Ohio State,3,4,NA,290200356,2009-01-20
68,1,8:08,1688,1688,B.J. Mullens made Two Point Dunk Shot.  Assisted by Evan Turner.,21,12,9,25,0.752329996888106,0.752329996888106,Illinois,Ohio State,3,4,NA,290200356,2009-01-20
69,1,7:43,1663,1663,Mike Tisdale made Two Point Layup.,23,12,11,18,0.7979899432756671,0.7979899432756671,Illinois,Ohio State,3,4,NA,290200356,2009-01-20
70,1,7:25,1645,1645,Foul on Trent Meacham,23,12,11,0,0.7997701529758513,0.7997701529758513,Illinois,Ohio State,3,4,NA,290200356,2009-01-20
71,1,7:25,1645,1645,Official TV Timeout.,23,12,11,4,0.7997701529758513,0.7997701529758513,Illinois,Ohio State,3,4,NA,290200356,2009-01-20
72,1,7:21,1641,1641,Jeremie Simmons missed Two Point Jumper.,23,12,11,0,0.8001601805930382,0.8001601805930382,Illinois,Ohio State,3,4,NA,290200356,2009-01-20
73,1,7:21,1641,1641,Dallas Lauderdale Offensive Rebound.,23,12,11,2,0.8001601805930382,0.8001601805930382,Illinois,Ohio State,3,4,NA,290200356,2009-01-20
74,1,7:19,1639,1639,Foul on Trent Meacham,23,12,11,0,0.800354532124145,0.800354532124145,Illinois,Ohio State,3,4,NA,290200356,2009-01-20
75,1,7:19,1639,1639,Dallas Lauderdale missed Free Throw.,23,12,11,0,0.800354532124145,0.800354532124145,Illinois,Ohio State,3,4,NA,290200356,2009-01-20
76,1,7:19,1639,1639,null,23,12,11,0,0.800354532124145,0.800354532124145,Illinois,Ohio State,3,4,NA,290200356,2009-01-20
77,1,7:19,1639,1639,Dallas Lauderdale made Free Throw.,23,13,10,30,0.7794189196936872,0.7794189196936872,Illinois,Ohio State,3,4,NA,290200356,2009-01-20
78,1,6:49,1609,1609,Alex Legion missed Three Point Jumper.,23,13,10,0,0.7822322924594404,0.7822322924594404,Illinois,Ohio State,3,4,NA,290200356,2009-01-20
79,1,6:49,1609,1609,Mike Davis Offensive Rebound.,23,13,10,10,0.7822322924594404,0.7822322924594404,Illinois,Ohio State,3,4,NA,290200356,2009-01-20
80,1,6:39,1599,1599,Dominique Keller made Two Point Jumper.  Assisted by Demetri McCamey.,25,13,12,27,0.8236114922043499,0.8236114922043499,Illinois,Ohio State,3,4,NA,290200356,2009-01-20
81,1,6:12,1572,1572,William Buford made Two Point Jumper.,25,15,10,24,0.7856581439881336,0.7856581439881336,Illinois,Ohio State,3,4,NA,290200356,2009-01-20
82,1,5:48,1548,1548,Mike Davis made Two Point Jumper.,27,15,12,13,0.8284587026137513,0.8284587026137513,Illinois,Ohio State,3,4,NA,290200356,2009-01-20
83,1,5:35,1535,1535,William Buford made Two Point Jumper.  Assisted by Jeremie Simmons.,27,17,10,35,0.7891228085070737,0.7891228085070737,Illinois,Ohio State,3,4,NA,290200356,2009-01-20
84,1,5:00,1500,1500,Chester Frazier missed Two Point Layup.,27,17,10,5,0.7925164065235787,0.7925164065235787,Illinois,Ohio State,3,4,NA,290200356,2009-01-20
85,1,4:55,1495,1495,Alex Legion Offensive Rebound.,27,17,10,6,0.7930147564144804,0.7930147564144804,Illinois,Ohio State,3,4,NA,290200356,2009-01-20
86,1,4:49,1489,1489,Dominique Keller Offensive Rebound.,27,17,10,0,0.7936180721882823,0.7936180721882823,Illinois,Ohio State,3,4,NA,290200356,2009-01-20
87,1,4:49,1489,1489,Foul on Dallas Lauderdale,27,17,10,1,0.7936180721882823,0.7936180721882823,Illinois,Ohio State,3,4,NA,290200356,2009-01-20
88,1,4:48,1488,1488,Dominique Keller missed Two Point Layup.,27,17,10,3,0.7937192088344324,0.7937192088344324,Illinois,Ohio State,3,4,NA,290200356,2009-01-20
89,1,4:45,1485,1485,Dominique Keller made Two Point Jumper.,29,17,12,17,0.8346878448246057,0.8346878448246057,Illinois,Ohio State,3,4,NA,290200356,2009-01-20
90,1,4:28,1468,1468,Evan Turner missed Two Point Layup.,29,17,12,0,0.8364638920306572,0.8364638920306572,Illinois,Ohio State,3,4,NA,290200356,2009-01-20
91,1,4:28,1468,1468,Evan Turner Offensive Rebound.,29,17,12,7,0.8364638920306572,0.8364638920306572,Illinois,Ohio State,3,4,NA,290200356,2009-01-20
92,1,4:21,1461,1461,Technical Foul on Demetri McCamey,29,17,12,0,0.8372106974860405,0.8372106974860405,Illinois,Ohio State,3,4,NA,290200356,2009-01-20
93,1,4:21,1461,1461,Foul on P.J. Hill,29,17,12,0,0.8372106974860405,0.8372106974860405,Illinois,Ohio State,3,4,NA,290200356,2009-01-20
94,1,4:21,1461,1461,William Buford made Free Throw.,29,18,11,0,0.8177460473277068,0.8177460473277068,Illinois,Ohio State,3,4,NA,290200356,2009-01-20
95,1,4:21,1461,1461,William Buford made Free Throw.,29,19,10,0,0.7965196763107683,0.7965196763107683,Illinois,Ohio State,3,4,NA,290200356,2009-01-20
96,1,4:21,1461,1461,Foul on Demetri McCamey,29,19,10,32,0.7965196763107683,0.7965196763107683,Illinois,Ohio State,3,4,NA,290200356,2009-01-20
97,1,3:49,1429,1429,Foul on P.J. Hill,29,19,10,0,0.7999284304093773,0.7999284304093773,Illinois,Ohio State,3,4,NA,290200356,2009-01-20
98,1,3:49,1429,1429,Official TV Timeout.,29,19,10,11,0.7999284304093773,0.7999284304093773,Illinois,Ohio State,3,4,NA,290200356,2009-01-20
99,1,3:38,1418,1418,William Buford missed Three Point Jumper.,29,19,10,0,0.8010521104452251,0.8010521104452251,Illinois,Ohio State,3,4,NA,290200356,2009-01-20
100,1,3:38,1418,1418,Dominique Keller Defensive Rebound.,29,19,10,23,0.8010521104452251,0.8010521104452251,Illinois,Ohio State,3,4,NA,290200356,2009-01-20
101,1,3:15,1395,1395,Dominique Keller missed Two Point Jumper.,29,19,10,0,0.8033325876962948,0.8033325876962948,Illinois,Ohio State,3,4,NA,290200356,2009-01-20
102,1,3:15,1395,1395,Calvin Brock Offensive Rebound.,29,19,10,3,0.8033325876962948,0.8033325876962948,Illinois,Ohio State,3,4,NA,290200356,2009-01-20
103,1,3:12,1392,1392,Calvin Brock made Two Point Layup.,31,19,12,17,0.844345884155474,0.844345884155474,Illinois,Ohio State,3,4,NA,290200356,2009-01-20
104,1,2:55,1375,1375,Jeremie Simmons made Three Point Jumper.  Assisted by Evan Turner.,31,22,9,27,0.7820371147482509,0.7820371147482509,Illinois,Ohio State,3,4,NA,290200356,2009-01-20
105,1,2:28,1348,1348,Calvin Brock made Two Point Jumper.,33,22,11,19,0.8291583291489081,0.8291583291489081,Illinois,Ohio State,3,4,NA,290200356,2009-01-20
106,1,2:09,1329,1329,Evan Turner made Two Point Layup.  Assisted by William Buford.,33,24,9,35,0.7863532265477792,0.7863532265477792,Illinois,Ohio State,3,4,NA,290200356,2009-01-20
107,1,1:34,1294,1294,Foul on Jeremie Simmons,33,24,9,0,0.789750250548442,0.789750250548442,Illinois,Ohio State,3,4,NA,290200356,2009-01-20
108,1,1:34,1294,1294,Chester Frazier missed Free Throw.,33,24,9,0,0.789750250548442,0.789750250548442,Illinois,Ohio State,3,4,NA,290200356,2009-01-20
109,1,1:34,1294,1294,null,33,24,9,0,0.789750250548442,0.789750250548442,Illinois,Ohio State,3,4,NA,290200356,2009-01-20
110,1,1:34,1294,1294,Chester Frazier made Free Throw.,34,24,10,0,0.8131284164035032,0.8131284164035032,Illinois,Ohio State,3,4,NA,290200356,2009-01-20
111,1,1:34,1294,1294,Chester Frazier made Free Throw.,35,24,11,0,0.8344520122220275,0.8344520122220275,Illinois,Ohio State,3,4,NA,290200356,2009-01-20
112,1,1:34,1294,1294,Illinois 30 Second Timeout.,35,24,11,16,0.8344520122220275,0.8344520122220275,Illinois,Ohio State,3,3,NA,290200356,2009-01-20
113,1,1:18,1278,1278,Jon Diebler missed Three Point Jumper.,35,24,11,0,0.8360999918097771,0.8360999918097771,Illinois,Ohio State,3,3,NA,290200356,2009-01-20
114,1,1:18,1278,1278,Demetri McCamey Defensive Rebound.,35,24,11,23,0.8360999918097771,0.8360999918097771,Illinois,Ohio State,3,3,NA,290200356,2009-01-20
115,1,0:55,1255,1255,Demetri McCamey made Three Point Jumper.  Assisted by Chester Frazier.,38,24,14,18,0.8906088582557051,0.8906088582557051,Illinois,Ohio State,3,3,NA,290200356,2009-01-20
116,1,0:37,1237,1237,Evan Turner missed Two Point Layup.,38,24,14,0,0.8924664467038973,0.8924664467038973,Illinois,Ohio State,3,3,NA,290200356,2009-01-20
117,1,0:37,1237,1237,B.J. Mullens Offensive Rebound.,38,24,14,3,0.8924664467038973,0.8924664467038973,Illinois,Ohio State,3,3,NA,290200356,2009-01-20
118,1,0:34,1234,1234,B.J. Mullens made Two Point Dunk Shot.,38,26,12,33,0.8601712648116048,0.8601712648116048,Illinois,Ohio State,3,3,NA,290200356,2009-01-20
119,1,0:01,1201,1201,Calvin Brock missed Two Point Jumper.,38,26,12,0,0.8640972714819471,0.8640972714819471,Illinois,Ohio State,3,3,NA,290200356,2009-01-20
120,1,0:01,1201,1201,null,38,26,12,1,0.8640972714819471,0.8640972714819471,Illinois,Ohio State,3,3,NA,290200356,2009-01-20
121,1,0:00,1200,1200,End of the 1st Half.,38,26,12,0,0.8642163350891481,0.8642163350891481,Illinois,Ohio State,3,3,NA,290200356,2009-01-20
122,2,20:00,1200,1200,PLAY,38,26,12,12,0.8642163350891481,0.8642163350891481,Illinois,Ohio State,4,4,NA,290200356,2009-01-20
123,2,19:48,1188,1188,William Buford missed Two Point Jumper.,38,26,12,0,0.8656210558853666,0.8656210558853666,Illinois,Ohio State,4,4,NA,290200356,2009-01-20
124,2,19:48,1188,1188,Trent Meacham Defensive Rebound.,38,26,12,41,0.8656210558853666,0.8656210558853666,Illinois,Ohio State,4,4,NA,290200356,2009-01-20
125,2,19:07,1147,1147,Evan Turner missed Two Point Jumper.,38,26,12,0,0.8701679992593714,0.8701679992593714,Illinois,Ohio State,4,4,NA,290200356,2009-01-20
126,2,19:07,1147,1147,null,38,26,12,2,0.8701679992593714,0.8701679992593714,Illinois,Ohio State,4,4,NA,290200356,2009-01-20
127,2,19:05,1145,1145,Foul on Dallas Lauderdale,38,26,12,18,0.8703830015658692,0.8703830015658692,Illinois,Ohio State,4,4,NA,290200356,2009-01-20
128,2,18:47,1127,1127,Jeremie Simmons missed Three Point Jumper.,38,26,12,0,0.8723036580362141,0.8723036580362141,Illinois,Ohio State,4,4,NA,290200356,2009-01-20
129,2,18:47,1127,1127,Illinois Defensive Rebound.,38,26,12,30,0.8723036580362141,0.8723036580362141,Illinois,Ohio State,4,4,NA,290200356,2009-01-20
130,2,18:17,1097,1097,Foul on Demetri McCamey,38,26,12,0,0.8754906679973249,0.8754906679973249,Illinois,Ohio State,4,4,NA,290200356,2009-01-20
131,2,18:17,1097,1097,Jeremie Simmons made Free Throw.,38,27,11,0,0.8566659547965035,0.8566659547965035,Illinois,Ohio State,4,4,NA,290200356,2009-01-20
132,2,18:17,1097,1097,Jeremie Simmons made Free Throw.,38,28,10,25,0.8355297867861505,0.8355297867861505,Illinois,Ohio State,4,4,NA,290200356,2009-01-20
133,2,17:52,1072,1072,Demetri McCamey missed Three Point Jumper.,38,28,10,0,0.8383726321744807,0.8383726321744807,Illinois,Ohio State,4,4,NA,290200356,2009-01-20
134,2,17:52,1072,1072,Dallas Lauderdale Defensive Rebound.,38,28,10,14,0.8383726321744807,0.8383726321744807,Illinois,Ohio State,4,4,NA,290200356,2009-01-20
135,2,17:38,1058,1058,Dallas Lauderdale made Two Point Jumper.  Assisted by William Buford.,38,30,8,26,0.7902848616564067,0.7902848616564067,Illinois,Ohio State,4,4,NA,290200356,2009-01-20
136,2,17:12,1032,1032,Mike Davis made Two Point Jumper.  Assisted by Trent Meacham.,40,30,10,32,0.8431746183935681,0.8431746183935681,Illinois,Ohio State,4,4,NA,290200356,2009-01-20
137,2,16:40,1000,1000,Evan Turner missed Two Point Layup.,40,30,10,0,0.8473552440079997,0.8473552440079997,Illinois,Ohio State,4,4,NA,290200356,2009-01-20
138,2,16:40,1000,1000,Trent Meacham Defensive Rebound.,40,30,10,2,0.8473552440079997,0.8473552440079997,Illinois,Ohio State,4,4,NA,290200356,2009-01-20
139,2,16:38,998,998,Foul on Evan Turner,40,30,10,15,0.8476288914501676,0.8476288914501676,Illinois,Ohio State,4,4,NA,290200356,2009-01-20
140,2,16:23,983,983,Mike Tisdale made Two Point Jumper.,42,30,12,0,0.8888461506340339,0.8888461506340339,Illinois,Ohio State,4,4,NA,290200356,2009-01-20
141,2,16:23,983,983,Foul on William Buford,42,30,12,0,0.8888461506340339,0.8888461506340339,Illinois,Ohio State,4,4,NA,290200356,2009-01-20
142,2,16:23,983,983,Mike Tisdale made Free Throw.,43,30,13,20,0.9048452680400841,0.9048452680400841,Illinois,Ohio State,4,4,NA,290200356,2009-01-20
143,2,16:03,963,963,William Buford made Two Point Jumper.,43,32,11,21,0.8733744109988381,0.8733744109988381,Illinois,Ohio State,4,4,NA,290200356,2009-01-20
144,2,15:42,942,942,Mike Tisdale made Two Point Jumper.  Assisted by Demetri McCamey.,45,32,13,23,0.9098236400965132,0.9098236400965132,Illinois,Ohio State,4,4,NA,290200356,2009-01-20
145,2,15:19,919,919,William Buford missed Two Point Jumper.,45,32,13,0,0.912167002639741,0.912167002639741,Illinois,Ohio State,4,4,NA,290200356,2009-01-20
146,2,15:19,919,919,William Buford Offensive Rebound.,45,32,13,1,0.912167002639741,0.912167002639741,Illinois,Ohio State,4,4,NA,290200356,2009-01-20
147,2,15:18,918,918,Foul on Mike Tisdale,45,32,13,0,0.9122632088342203,0.9122632088342203,Illinois,Ohio State,4,4,NA,290200356,2009-01-20
148,2,15:18,918,918,Official TV Timeout.,45,32,13,2,0.9122632088342203,0.9122632088342203,Illinois,Ohio State,4,4,NA,290200356,2009-01-20
149,2,15:16,916,916,B.J. Mullens made Two Point Dunk Shot.  Assisted by Evan Turner.,45,34,11,25,0.8790396063069019,0.8790396063069019,Illinois,Ohio State,4,4,NA,290200356,2009-01-20
150,2,14:51,891,891,Foul on Evan Turner,45,34,11,0,0.8816225910452448,0.8816225910452448,Illinois,Ohio State,4,4,NA,290200356,2009-01-20
151,2,14:51,891,891,Mike Tisdale made Free Throw.,46,34,12,0,0.8993860336568348,0.8993860336568348,Illinois,Ohio State,4,4,NA,290200356,2009-01-20
152,2,14:51,891,891,Mike Tisdale made Free Throw.,47,34,13,19,0.9147417089387966,0.9147417089387966,Illinois,Ohio State,4,4,NA,290200356,2009-01-20
153,2,14:32,872,872,Demetri McCamey made Two Point Layup.,49,34,15,21,0.9406376031968253,0.9406376031968253,Illinois,Ohio State,4,4,NA,290200356,2009-01-20
154,2,14:11,851,851,Foul on Mike Tisdale,49,34,15,16,0.9421842051340239,0.9421842051340239,Illinois,Ohio State,4,4,NA,290200356,2009-01-20
155,2,13:55,835,835,Foul on Evan Turner,49,34,15,0,0.9433935165693376,0.9433935165693376,Illinois,Ohio State,4,4,NA,290200356,2009-01-20
156,2,13:55,835,835,Dominique Keller missed Free Throw.,49,34,15,0,0.9433935165693376,0.9433935165693376,Illinois,Ohio State,4,4,NA,290200356,2009-01-20
157,2,13:55,835,835,null,49,34,15,0,0.9433935165693376,0.9433935165693376,Illinois,Ohio State,4,4,NA,290200356,2009-01-20
158,2,13:55,835,835,Dominique Keller missed Free Throw.,49,34,15,0,0.9433935165693376,0.9433935165693376,Illinois,Ohio State,4,4,NA,290200356,2009-01-20
159,2,13:55,835,835,Evan Turner Defensive Rebound.,49,34,15,14,0.9433935165693376,0.9433935165693376,Illinois,Ohio State,4,4,NA,290200356,2009-01-20
160,2,13:41,821,821,Jeremie Simmons missed Three Point Jumper.,49,34,15,0,0.9444939842500936,0.9444939842500936,Illinois,Ohio State,4,4,NA,290200356,2009-01-20
161,2,13:41,821,821,B.J. Mullens Offensive Rebound.,49,34,15,5,0.9444939842500936,0.9444939842500936,Illinois,Ohio State,4,4,NA,290200356,2009-01-20
162,2,13:36,816,816,B.J. Mullens missed Two Point Layup.,49,34,15,0,0.9448994750843702,0.9448994750843702,Illinois,Ohio State,4,4,NA,290200356,2009-01-20
163,2,13:36,816,816,B.J. Mullens Offensive Rebound.,49,34,15,1,0.9448994750843702,0.9448994750843702,Illinois,Ohio State,4,4,NA,290200356,2009-01-20
164,2,13:35,815,815,B.J. Mullens made Two Point Layup.,49,36,13,0,0.9216054204270917,0.9216054204270917,Illinois,Ohio State,4,4,NA,290200356,2009-01-20
165,2,13:35,815,815,Foul on Trent Meacham,49,36,13,0,0.9216054204270917,0.9216054204270917,Illinois,Ohio State,4,4,NA,290200356,2009-01-20
166,2,13:35,815,815,B.J. Mullens missed Free Throw.,49,36,13,0,0.9216054204270917,0.9216054204270917,Illinois,Ohio State,4,4,NA,290200356,2009-01-20
167,2,13:35,815,815,Calvin Brock Defensive Rebound.,49,36,13,13,0.9216054204270917,0.9216054204270917,Illinois,Ohio State,4,4,NA,290200356,2009-01-20
168,2,13:22,802,802,Mike Davis missed Two Point Jumper.,49,36,13,2,0.9229267270770066,0.9229267270770066,Illinois,Ohio State,4,4,NA,290200356,2009-01-20
169,2,13:20,800,800,Evan Turner Defensive Rebound.,49,36,13,16,0.9231367004502187,0.9231367004502187,Illinois,Ohio State,4,4,NA,290200356,2009-01-20
170,2,13:04,784,784,P.J. Hill missed Three Point Jumper.,49,36,13,0,0.9248885771240295,0.9248885771240295,Illinois,Ohio State,4,4,NA,290200356,2009-01-20
171,2,13:04,784,784,null,49,36,13,3,0.9248885771240295,0.9248885771240295,Illinois,Ohio State,4,4,NA,290200356,2009-01-20
172,2,13:01,781,781,Foul on Dallas Lauderdale,49,36,13,13,0.925232288933691,0.925232288933691,Illinois,Ohio State,4,4,NA,290200356,2009-01-20
173,2,12:48,768,768,Chester Frazier made Three Point Jumper.  Assisted by Demetri McCamey.,52,36,16,34,0.9578734257554489,0.9578734257554489,Illinois,Ohio State,4,4,NA,290200356,2009-01-20
