play_id,half,time_remaining_half,secs_remaining,secs_remaining_absolute,description,home_score,away_score,score_diff,play_length,win_prob,naive_win_prob,home,away,home_time_out_remaining,away_time_out_remaining,home_favored_by,game_id,date
174,2,12:14,734,734,Jon Diebler made Three Point Jumper.  Assisted by B.J. Mullens.,52,39,13,26,0.93134676901890745,0.93134676901890745,Illinois,Ohio State,4,4,NA,290200356,2009-01-20
175,2,11:48,708,708,Dominique Keller missed Two Point Layup.,52,39,13,0,0.9348900138656041,0.9348900138656041,Illinois,Ohio State,4,4,NA,290200356,2009-01-20
176,2,11:48,708,708,B.J. Mullens Block.,52,39,13,4,0.9348900138656041,0.9348900138656041,Illinois,Ohio State,4,4,NA,290200356,2009-01-20
177,2,11:44,704,704,B.J. Mullens Defensive Rebound.,52,39,13,7,0.9353697479220383,0.9353697479220383,Illinois,Ohio State,4,4,NA,290200356,2009-01-20
178,2,11:37,697,697,Dominique Keller missed Two Point Dunk Shot.,52,39,13,0,0.9361761074159914,0.9361761074159914,Illinois,Ohio State,4,4,NA,290200356,2009-01-20
179,2,11:37,697,697,B.J. Mullens Defensive Rebound.,52,39,13,25,0.9361761074159914,0.9361761074159914,Illinois,Ohio State,4,4,NA,290200356,2009-01-20
180,2,11:12,672,672,Foul on Dallas Lauderdale,52,39,13,0,0.9388068204861372,0.9388068204861372,Illinois,Ohio State,4,4,NA,290200356,2009-01-20
181,2,11:12,672,672,Official TV Timeout.,52,39,13,8,0.9388068204861372,0.9388068204861372,Illinois,Ohio State,4,4,NA,290200356,2009-01-20
182,2,11:04,664,664,Illinois Full Timeout.,52,39,13,15,0.9395991059483793,0.9395991059483793,Illinois,Ohio State,4,3,NA,290200356,2009-01-20
183,2,10:49,649,649,Alex Legion made Three Point Jumper.  Assisted by Chester Frazier.,55,39,16,22,0.9680151684313734,0.9680151684313734,Illinois,Ohio State,4,3,NA,290200356,2009-01-20
184,2,10:27,627,627,B.J. Mullens missed Two Point Jumper.,55,39,16,0,0.9695219905086808,0.9695219905086808,Illinois,Ohio State,4,3,NA,290200356,2009-01-20
185,2,10:27,627,627,Mike Davis Defensive Rebound.,55,39,16,32,0.9695219905086808,0.9695219905086808,Illinois,Ohio State,4,3,NA,290200356,2009-01-20
186,2,9:55,595,595,Ohio State 30 Second Timeout.,55,39,16,8,0.9719342851302354,0.9719342851302354,Illinois,Ohio State,3,3,NA,290200356,2009-01-20
187,2,9:47,587,587,Jon Diebler made Three Point Jumper.  Assisted by Jeremie Simmons.,55,42,13,39,0.9478553830747269,0.9478553830747269,Illinois,Ohio State,3,3,NA,290200356,2009-01-20
188,2,9:08,548,548,Alex Legion missed Three Point Jumper.,55,42,13,0,0.9535147495542166,0.9535147495542166,Illinois,Ohio State,3,3,NA,290200356,2009-01-20
189,2,9:08,548,548,Jon Diebler Defensive Rebound.,55,42,13,11,0.9535147495542166,0.9535147495542166,Illinois,Ohio State,3,3,NA,290200356,2009-01-20
190,2,8:57,537,537,Foul on Alex Legion,55,42,13,49,0.9551002287562532,0.9551002287562532,Illinois,Ohio State,3,3,NA,290200356,2009-01-20
191,2,8:08,488,488,Mike Tisdale made Two Point Layup.,57,42,15,0,0.9754297108525218,0.9754297108525218,Illinois,Ohio State,3,3,NA,290200356,2009-01-20
192,2,8:08,488,488,Alex Legion missed Three Point Jumper.,57,42,15,1,0.9754297108525218,0.9754297108525218,Illinois,Ohio State,3,3,NA,290200356,2009-01-20
193,2,8:07,487,487,B.J. Mullens Block.,57,42,15,1,0.9755054480506631,0.9755054480506631,Illinois,Ohio State,3,3,NA,290200356,2009-01-20
194,2,8:06,486,486,Mike Tisdale Offensive Rebound.,57,42,15,1,0.9755814621847985,0.9755814621847985,Illinois,Ohio State,3,3,NA,290200356,2009-01-20
195,2,8:05,485,485,Alex Legion missed Two Point Layup.,57,42,15,0,0.9756577772131335,0.9756577772131335,Illinois,Ohio State,3,3,NA,290200356,2009-01-20
196,2,8:05,485,485,Jon Diebler Block.,57,42,15,2,0.9756577772131335,0.9756577772131335,Illinois,Ohio State,3,3,NA,290200356,2009-01-20
197,2,8:03,483,483,Chester Frazier Offensive Rebound.,57,42,15,2,0.9758114040420305,0.9758114040420305,Illinois,Ohio State,3,3,NA,290200356,2009-01-20
198,2,8:01,481,481,Chester Frazier made Two Point Layup.,59,42,17,34,0.9851945554463686,0.9851945554463686,Illinois,Ohio State,3,3,NA,290200356,2009-01-20
199,2,7:27,447,447,Foul on Mike Tisdale,59,42,17,0,0.987296805785437,0.987296805785437,Illinois,Ohio State,3,3,NA,290200356,2009-01-20
200,2,7:27,447,447,B.J. Mullens made Free Throw.,59,43,16,0,0.9836501490769861,0.9836501490769861,Illinois,Ohio State,3,3,NA,290200356,2009-01-20
201,2,7:27,447,447,B.J. Mullens missed Free Throw.,59,43,16,0,0.9836501490769861,0.9836501490769861,Illinois,Ohio State,3,3,NA,290200356,2009-01-20
202,2,7:27,447,447,Chester Frazier Defensive Rebound.,59,43,16,21,0.9836501490769861,0.9836501490769861,Illinois,Ohio State,3,3,NA,290200356,2009-01-20
203,2,7:06,426,426,Foul on Evan Turner,59,43,16,0,0.9855852467171381,0.9855852467171381,Illinois,Ohio State,3,3,NA,290200356,2009-01-20
204,2,7:06,426,426,Mike Tisdale made Free Throw.,60,43,17,0,0.9888933764656064,0.9888933764656064,Illinois,Ohio State,3,3,NA,290200356,2009-01-20
205,2,7:06,426,426,Mike Tisdale made Free Throw.,61,43,18,12,0.9914488902953017,0.9914488902953017,Illinois,Ohio State,3,3,NA,290200356,2009-01-20
206,2,6:54,414,414,William Buford missed Two Point Jumper.,61,43,18,0,0.9921365847781181,0.9921365847781181,Illinois,Ohio State,3,3,NA,290200356,2009-01-20
207,2,6:54,414,414,Chester Frazier Defensive Rebound.,61,43,18,22,0.9921365847781181,0.9921365847781181,Illinois,Ohio State,3,3,NA,290200356,2009-01-20
208,2,6:32,392,392,Trent Meacham missed Three Point Jumper.,61,43,18,0,0.9931938084924864,0.9931938084924864,Illinois,Ohio State,3,3,NA,290200356,2009-01-20
209,2,6:32,392,392,Mike Davis Offensive Rebound.,61,43,18,5,0.9931938084924864,0.9931938084924864,Illinois,Ohio State,3,3,NA,290200356,2009-01-20
210,2,6:27,387,387,Trent Meacham missed Three Point Jumper.,61,43,18,0,0.9934128381498646,0.9934128381498646,Illinois,Ohio State,3,3,NA,290200356,2009-01-20
211,2,6:27,387,387,Jon Diebler Defensive Rebound.,61,43,18,48,0.9934128381498646,0.9934128381498646,Illinois,Ohio State,3,3,NA,290200356,2009-01-20
212,2,5:39,339,339,Demetri McCamey missed Two Point Jumper.,61,43,18,0,0.9954472541311571,0.9954472541311571,Illinois,Ohio State,3,3,NA,290200356,2009-01-20
213,2,5:39,339,339,B.J. Mullens Defensive Rebound.,61,43,18,12,0.9954472541311571,0.9954472541311571,Illinois,Ohio State,3,3,NA,290200356,2009-01-20
214,2,5:27,327,327,Jeremie Simmons made Two Point Layup.,61,45,16,31,0.9925929525589593,0.9925929525589593,Illinois,Ohio State,3,3,NA,290200356,2009-01-20
215,2,4:56,296,296,Demetri McCamey missed Three Point Jumper.,61,45,16,0,0.9944293271966013,0.9944293271966013,Illinois,Ohio State,3,3,NA,290200356,2009-01-20
216,2,4:56,296,296,William Buford Defensive Rebound.,61,45,16,17,0.9944293271966013,0.9944293271966013,Illinois,Ohio State,3,3,NA,290200356,2009-01-20
217,2,4:39,279,279,B.J. Mullens made Two Point Layup.  Assisted by William Buford.,61,47,14,0,0.9893958851818461,0.9893958851818461,Illinois,Ohio State,3,3,NA,290200356,2009-01-20
218,2,4:39,279,279,Foul on Mike Tisdale,61,47,14,0,0.9893958851818461,0.9893958851818461,Illinois,Ohio State,3,3,NA,290200356,2009-01-20
219,2,4:39,279,279,B.J. Mullens missed Free Throw.,61,47,14,0,0.9893958851818461,0.9893958851818461,Illinois,Ohio State,3,3,NA,290200356,2009-01-20
220,2,4:39,279,279,Dominique Keller Defensive Rebound.,61,47,14,30,0.9893958851818461,0.9893958851818461,Illinois,Ohio State,3,3,NA,290200356,2009-01-20
221,2,4:09,249,249,Demetri McCamey made Two Point Jumper.,63,47,16,25,0.9936506199109203,0.9936506199109203,Illinois,Ohio State,3,3,NA,290200356,2009-01-20
222,2,3:44,224,224,B.J. Mullens made Two Point Jumper.,63,49,14,35,0.9881994557624065,0.9881994557624065,Illinois,Ohio State,3,3,NA,290200356,2009-01-20
223,2,3:09,189,189,Trent Meacham missed Three Point Jumper.,63,49,14,0,0.9932831829254486,0.9932831829254486,Illinois,Ohio State,3,3,NA,290200356,2009-01-20
224,2,3:09,189,189,Calvin Brock Offensive Rebound.,63,49,14,5,0.9932831829254486,0.9932831829254486,Illinois,Ohio State,3,3,NA,290200356,2009-01-20
225,2,3:04,184,184,Calvin Brock made Two Point Layup.,65,49,16,17,0.99720554845468,0.99720554845468,Illinois,Ohio State,3,3,NA,290200356,2009-01-20
226,2,2:47,167,167,Dominique Keller made Two Point Layup.  Assisted by Chester Frazier.,67,49,18,0,0.9993049218635287,0.9993049218635287,Illinois,Ohio State,3,3,NA,290200356,2009-01-20
227,2,2:47,167,167,Foul on Walter Offutt,67,49,18,0,0.9993049218635287,0.9993049218635287,Illinois,Ohio State,3,3,NA,290200356,2009-01-20
228,2,2:47,167,167,Official TV Timeout.,67,49,18,0,0.9993049218635287,0.9993049218635287,Illinois,Ohio State,3,3,NA,290200356,2009-01-20
229,2,2:47,167,167,Dominique Keller missed Free Throw.,67,49,18,0,0.9993049218635287,0.9993049218635287,Illinois,Ohio State,3,3,NA,290200356,2009-01-20
230,2,2:47,167,167,William Buford Defensive Rebound.,67,49,18,10,0.9993049218635287,0.9993049218635287,Illinois,Ohio State,3,3,NA,290200356,2009-01-20
231,2,2:37,157,157,Foul on Dominique Keller,67,49,18,0,0.9995407056549357,0.9995407056549357,Illinois,Ohio State,3,3,NA,290200356,2009-01-20
232,2,2:37,157,157,B.J. Mullens missed Free Throw.,67,49,18,0,0.9995407056549357,0.9995407056549357,Illinois,Ohio State,3,3,NA,290200356,2009-01-20
233,2,2:37,157,157,Dominique Keller Defensive Rebound.,67,49,18,31,0.9995407056549357,0.9995407056549357,Illinois,Ohio State,3,3,NA,290200356,2009-01-20
234,2,2:06,126,126,Calvin Brock missed Three Point Jumper.,67,49,18,0,0.9998998348307792,0.9998998348307792,Illinois,Ohio State,3,3,NA,290200356,2009-01-20
235,2,2:06,126,126,Evan Turner Defensive Rebound.,67,49,18,8,0.9998998348307792,0.9998998348307792,Illinois,Ohio State,3,3,NA,290200356,2009-01-20
236,2,1:58,118,118,William Buford missed Three Point Jumper.,67,49,18,0,0.9999376757733425,0.9999376757733425,Illinois,Ohio State,3,3,NA,290200356,2009-01-20
237,2,1:58,118,118,B.J. Mullens Offensive Rebound.,67,49,18,4,0.9999376757733425,0.9999376757733425,Illinois,Ohio State,3,3,NA,290200356,2009-01-20
238,2,1:54,114,114,B.J. Mullens missed Free Throw.,67,49,18,1,0.9999516008432829,0.9999516008432829,Illinois,Ohio State,3,3,NA,290200356,2009-01-20
239,2,1:53,113,113,null,67,49,18,1,0.9999546441384547,0.9999546441384547,Illinois,Ohio State,3,3,NA,290200356,2009-01-20
240,2,1:52,112,112,B.J. Mullens missed Free Throw.,67,49,18,0,0.99995752617423,0.99995752617423,Illinois,Ohio State,3,3,NA,290200356,2009-01-20
241,2,1:52,112,112,Dominique Keller Defensive Rebound.,67,49,18,30,0.99995752617423,0.99995752617423,Illinois,Ohio State,3,3,NA,290200356,2009-01-20
242,2,1:22,82,82,Demetri McCamey missed Three Point Jumper.,67,49,18,0,0.9999956873619772,0.9999956873619772,Illinois,Ohio State,3,3,NA,290200356,2009-01-20
243,2,1:22,82,82,Evan Turner Defensive Rebound.,67,49,18,9,0.9999956873619772,0.9999956873619772,Illinois,Ohio State,3,3,NA,290200356,2009-01-20
244,2,1:13,73,73,Walter Offutt missed Two Point Layup.,67,49,18,0,0.9999980176153731,0.9999980176153731,Illinois,Ohio State,3,3,NA,290200356,2009-01-20
245,2,1:13,73,73,Demetri McCamey Defensive Rebound.,67,49,18,34,0.9999980176153731,0.9999980176153731,Illinois,Ohio State,3,3,NA,290200356,2009-01-20
246,2,0:39,39,39,Richard Semrau missed Two Point Jumper.,67,49,18,0,0.9999999307385831,0.9999999307385831,Illinois,Ohio State,3,3,NA,290200356,2009-01-20
247,2,0:39,39,39,Walter Offutt Defensive Rebound.,67,49,18,19,0.9999999307385831,0.9999999307385831,Illinois,Ohio State,3,3,NA,290200356,2009-01-20
248,2,0:20,20,20,Foul on Dominique Keller,67,49,18,20,0.9999999919702097,0.9999999919702097,Illinois,Ohio State,3,3,NA,290200356,2009-01-20
249,2,0:00,0,0,End Game,67,49,18,0,1,1,Illinois,Ohio State,3,3,NA,290200356,2009-01-20
