play_id,half,time_remaining_half,secs_remaining,secs_remaining_absolute,description,home_score,away_score,score_diff,play_length,win_prob,naive_win_prob,home,away,home_time_out_remaining,away_time_out_remaining,home_favored_by,game_id,date
1,1,20:00,2400,2400,PLAY,0,0,0,34,0.5,0.5,Georgia,South Carolina,6,6,NA,260540061,2006-02-23
2,1,19:26,2366,2366,Renaldo Balkman missed Two Point Jumper.,0,0,0,0,0.5,0.5,Georgia,South Carolina,6,6,NA,260540061,2006-02-23
3,1,19:26,2366,2366,Levi Stukes Defensive Rebound.,0,0,0,16,0.5,0.5,Georgia,South Carolina,6,6,NA,260540061,2006-02-23
4,1,19:10,2350,2350,Foul on Rocky Trice,0,0,0,20,0.5,0.5,Georgia,South Carolina,6,6,NA,260540061,2006-02-23
5,1,18:50,2330,2330,Younes Idrissi missed Two Point Layup.,0,0,0,1,0.5,0.5,Georgia,South Carolina,6,6,NA,260540061,2006-02-23
6,1,18:49,2329,2329,South Carolin Defensive Rebound.,0,0,0,16,0.5,0.5,Georgia,South Carolina,6,6,NA,260540061,2006-02-23
7,1,18:33,2313,2313,Foul on Dave Bliss,0,0,0,0,0.5,0.5,Georgia,South Carolina,6,6,NA,260540061,2006-02-23
8,1,18:33,2313,2313,Tarence Kinsey made Free Throw.,0,1,-1,0,0.4770016653934843,0.4770016653934843,Georgia,South Carolina,6,6,NA,260540061,2006-02-23
9,1,18:33,2313,2313,Tarence Kinsey made Free Throw.,0,2,-2,2,0.4541004401909216,0.4541004401909216,Georgia,South Carolina,6,6,NA,260540061,2006-02-23
10,1,18:31,2311,2311,Foul on Renaldo Balkman,0,2,-2,23,0.45405627147729344,0.45405627147729344,Georgia,South Carolina,6,6,NA,260540061,2006-02-23
11,1,18:08,2288,2288,Levi Stukes missed Two Point Jumper.,0,2,-2,0,0.4535453277550481,0.4535453277550481,Georgia,South Carolina,6,6,NA,260540061,2006-02-23
12,1,18:08,2288,2288,Tre Kelley Defensive Rebound.,0,2,-2,50,0.4535453277550481,0.4535453277550481,Georgia,South Carolina,6,6,NA,260540061,2006-02-23
13,1,17:18,2238,2238,Tre Kelley missed Three Point Jumper.,0,2,-2,0,0.45241791455597086,0.45241791455597086,Georgia,South Carolina,6,6,NA,260540061,2006-02-23
14,1,17:18,2238,2238,Tarence Kinsey Offensive Rebound.,0,2,-2,9,0.45241791455597086,0.45241791455597086,Georgia,South Carolina,6,6,NA,260540061,2006-02-23
15,1,17:09,2229,2229,Tre Kelley missed Two Point Layup.,0,2,-2,0,0.4522129371098579,0.4522129371098579,Georgia,South Carolina,6,6,NA,260540061,2006-02-23
16,1,17:09,2229,2229,Mike Mercer Defensive Rebound.,0,2,-2,11,0.4522129371098579,0.4522129371098579,Georgia,South Carolina,6,6,NA,260540061,2006-02-23
17,1,16:58,2218,2218,Younes Idrissi made Two Point Jumper.,2,2,0,24,0.5,0.5,Georgia,South Carolina,6,6,NA,260540061,2006-02-23
18,1,16:34,2194,2194,Tarence Kinsey missed Two Point Jumper.,2,2,0,0,0.5,0.5,Georgia,South Carolina,6,6,NA,260540061,2006-02-23
19,1,16:34,2194,2194,Younes Idrissi Defensive Rebound.,2,2,0,7,0.5,0.5,Georgia,South Carolina,6,6,NA,260540061,2006-02-23
20,1,16:27,2187,2187,Foul on Mike Mercer,2,2,0,2,0.5,0.5,Georgia,South Carolina,6,6,NA,260540061,2006-02-23
21,1,16:25,2185,2185,Tarence Kinsey made Free Throw.,2,3,-1,0,0.4755436062176915,0.4755436062176915,Georgia,South Carolina,6,6,NA,260540061,2006-02-23
22,1,16:25,2185,2185,Tarence Kinsey made Free Throw.,2,4,-2,1,0.4512039550594804,0.4512039550594804,Georgia,South Carolina,6,6,NA,260540061,2006-02-23
23,1,16:24,2184,2184,Tarence Kinsey made Free Throw.,2,5,-3,7,0.42706141630147587,0.42706141630147587,Georgia,South Carolina,6,6,NA,260540061,2006-02-23
24,1,16:17,2177,2177,Mike Mercer missed Two Point Jumper.,2,5,-3,0,0.42682217903564085,0.42682217903564085,Georgia,South Carolina,6,6,NA,260540061,2006-02-23
25,1,16:17,2177,2177,Tre Kelley Defensive Rebound.,2,5,-3,20,0.42682217903564085,0.42682217903564085,Georgia,South Carolina,6,6,NA,260540061,2006-02-23
26,1,15:57,2157,2157,Tarence Kinsey made Two Point Jumper.,2,7,-5,61,0.37846914859676306,0.37846914859676306,Georgia,South Carolina,6,6,NA,260540061,2006-02-23
27,1,14:56,2096,2096,Mike Mercer missed Three Point Jumper.,2,7,-5,0,0.375076340860444,0.375076340860444,Georgia,South Carolina,6,6,NA,260540061,2006-02-23
28,1,14:56,2096,2096,Brandon Wallace Defensive Rebound.,2,7,-5,15,0.375076340860444,0.375076340860444,Georgia,South Carolina,6,6,NA,260540061,2006-02-23
29,1,14:41,2081,2081,Mike Mercer made Two Point Dunk Shot.,4,7,-3,0,0.42348963717215105,0.42348963717215105,Georgia,South Carolina,6,6,NA,260540061,2006-02-23
30,1,14:41,2081,2081,Foul on Renaldo Balkman,4,7,-3,0,0.42348963717215105,0.42348963717215105,Georgia,South Carolina,6,6,NA,260540061,2006-02-23
31,1,14:41,2081,2081,Mike Mercer made Free Throw.,5,7,-2,32,0.4487697008644929,0.4487697008644929,Georgia,South Carolina,6,6,NA,260540061,2006-02-23
32,1,14:09,2049,2049,Brandon Wallace missed Two Point Jumper.,5,7,-2,0,0.4480003742149476,0.4480003742149476,Georgia,South Carolina,6,6,NA,260540061,2006-02-23
33,1,14:09,2049,2049,Brandon Wallace Offensive Rebound.,5,7,-2,0,0.4480003742149476,0.4480003742149476,Georgia,South Carolina,6,6,NA,260540061,2006-02-23
34,1,14:09,2049,2049,Brandon Wallace missed Two Point Tip Shot.,5,7,-2,0,0.4480003742149476,0.4480003742149476,Georgia,South Carolina,6,6,NA,260540061,2006-02-23
35,1,14:09,2049,2049,Brandon Wallace Offensive Rebound.,5,7,-2,0,0.4480003742149476,0.4480003742149476,Georgia,South Carolina,6,6,NA,260540061,2006-02-23
36,1,14:09,2049,2049,Brandon Wallace missed Two Point Tip Shot.,5,7,-2,0,0.4480003742149476,0.4480003742149476,Georgia,South Carolina,6,6,NA,260540061,2006-02-23
37,1,14:09,2049,2049,Steve Newman Defensive Rebound.,5,7,-2,13,0.4480003742149476,0.4480003742149476,Georgia,South Carolina,6,6,NA,260540061,2006-02-23
38,1,13:56,2036,2036,Dave Bliss missed Two Point Jumper.,5,7,-2,0,0.44768460051119835,0.44768460051119835,Georgia,South Carolina,6,6,NA,260540061,2006-02-23
39,1,13:56,2036,2036,Brandon Wallace Defensive Rebound.,5,7,-2,15,0.44768460051119835,0.44768460051119835,Georgia,South Carolina,6,6,NA,260540061,2006-02-23
40,1,13:41,2021,2021,Tarence Kinsey missed Two Point Jumper.,5,7,-2,0,0.4473177833885138,0.4473177833885138,Georgia,South Carolina,6,6,NA,260540061,2006-02-23
41,1,13:41,2021,2021,Dave Bliss Defensive Rebound.,5,7,-2,25,0.4473177833885138,0.4473177833885138,Georgia,South Carolina,6,6,NA,260540061,2006-02-23
42,1,13:16,1996,1996,Steve Newman missed Two Point Jumper.,5,7,-2,0,0.4467002625316585,0.4467002625316585,Georgia,South Carolina,6,6,NA,260540061,2006-02-23
43,1,13:16,1996,1996,Brandon Wallace Defensive Rebound.,5,7,-2,14,0.4467002625316585,0.4467002625316585,Georgia,South Carolina,6,6,NA,260540061,2006-02-23
44,1,13:02,1982,1982,Sundiata Gaines made Two Point Layup.,7,7,0,0,0.5,0.5,Georgia,South Carolina,6,6,NA,260540061,2006-02-23
45,1,13:02,1982,1982,Foul on Tarence Kinsey,7,7,0,0,0.5,0.5,Georgia,South Carolina,6,6,NA,260540061,2006-02-23
46,1,13:02,1982,1982,Sundiata Gaines missed Free Throw.,7,7,0,0,0.5,0.5,Georgia,South Carolina,6,6,NA,260540061,2006-02-23
47,1,13:02,1982,1982,South Carolin Defensive Rebound.,7,7,0,16,0.5,0.5,Georgia,South Carolina,6,6,NA,260540061,2006-02-23
48,1,12:46,1966,1966,Georgia Full Timeout.,7,7,0,14,0.5,0.5,Georgia,South Carolina,5,6,NA,260540061,2006-02-23
49,1,12:32,1952,1952,Foul on Antoine Tisby,7,7,0,7,0.5,0.5,Georgia,South Carolina,5,6,NA,260540061,2006-02-23
50,1,12:25,1945,1945,Sundiata Gaines made Two Point Jumper.,9,7,2,38,0.5545853127900813,0.5545853127900813,Georgia,South Carolina,5,6,NA,260540061,2006-02-23
51,1,11:47,1907,1907,Tre Kelley missed Two Point Jumper.,9,7,2,0,0.5555626387093998,0.5555626387093998,Georgia,South Carolina,5,6,NA,260540061,2006-02-23
52,1,11:47,1907,1907,Younes Idrissi Defensive Rebound.,9,7,2,5,0.5555626387093998,0.5555626387093998,Georgia,South Carolina,5,6,NA,260540061,2006-02-23
53,1,11:42,1902,1902,Foul on Sundiata Gaines,9,7,2,0,0.555691160002145,0.555691160002145,Georgia,South Carolina,5,6,NA,260540061,2006-02-23
54,1,11:42,1902,1902,South Carolin Full Timeout.,9,7,2,7,0.555691160002145,0.555691160002145,Georgia,South Carolina,5,5,NA,260540061,2006-02-23
55,1,11:35,1895,1895,Foul on Sundiata Gaines,9,7,2,30,0.5558710452580202,0.5558710452580202,Georgia,South Carolina,5,5,NA,260540061,2006-02-23
56,1,11:05,1865,1865,Bryce Sheldon missed Three Point Jumper.,9,7,2,0,0.5566425877689026,0.5566425877689026,Georgia,South Carolina,5,5,NA,260540061,2006-02-23
57,1,11:05,1865,1865,Levi Stukes Defensive Rebound.,9,7,2,40,0.5566425877689026,0.5566425877689026,Georgia,South Carolina,5,5,NA,260540061,2006-02-23
58,1,10:25,1825,1825,Stephen McDowell missed Two Point Layup.,9,7,2,0,0.557678357497728,0.557678357497728,Georgia,South Carolina,5,5,NA,260540061,2006-02-23
59,1,10:25,1825,1825,Antoine Tisby Offensive Rebound.,9,7,2,4,0.557678357497728,0.557678357497728,Georgia,South Carolina,5,5,NA,260540061,2006-02-23
60,1,10:21,1821,1821,Foul on Younes Idrissi,9,7,2,4,0.5577827104178722,0.5577827104178722,Georgia,South Carolina,5,5,NA,260540061,2006-02-23
61,1,10:17,1817,1817,Bryce Sheldon missed Two Point Jumper.,9,7,2,0,0.5578872436572678,0.5578872436572678,Georgia,South Carolina,5,5,NA,260540061,2006-02-23
62,1,10:17,1817,1817,Kevin Brophy Defensive Rebound.,9,7,2,16,0.5578872436572678,0.5578872436572678,Georgia,South Carolina,5,5,NA,260540061,2006-02-23
63,1,10:01,1801,1801,Levi Stukes made Two Point Layup.,11,7,4,33,0.6150501841763585,0.6150501841763585,Georgia,South Carolina,5,5,NA,260540061,2006-02-23
64,1,9:28,1768,1768,Brandon Wallace made Two Point Layup.,11,9,2,0,0.5591861864946767,0.5591861864946767,Georgia,South Carolina,5,5,NA,260540061,2006-02-23
65,1,9:28,1768,1768,Foul on Younes Idrissi,11,9,2,0,0.5591861864946767,0.5591861864946767,Georgia,South Carolina,5,5,NA,260540061,2006-02-23
66,1,9:28,1768,1768,Brandon Wallace missed Free Throw.,11,9,2,0,0.5591861864946767,0.5591861864946767,Georgia,South Carolina,5,5,NA,260540061,2006-02-23
67,1,9:28,1768,1768,Steve Newman Defensive Rebound.,11,9,2,27,0.5591861864946767,0.5591861864946767,Georgia,South Carolina,5,5,NA,260540061,2006-02-23
68,1,9:01,1741,1741,Levi Stukes missed Three Point Jumper.,11,9,2,0,0.559920660776407,0.559920660776407,Georgia,South Carolina,5,5,NA,260540061,2006-02-23
69,1,9:01,1741,1741,South Carolin Defensive Rebound.,11,9,2,30,0.559920660776407,0.559920660776407,Georgia,South Carolina,5,5,NA,260540061,2006-02-23
70,1,8:31,1711,1711,Levi Stukes missed Three Point Jumper.,11,9,2,0,0.560756963282836,0.560756963282836,Georgia,South Carolina,5,5,NA,260540061,2006-02-23
71,1,8:31,1711,1711,Brandon Wallace Defensive Rebound.,11,9,2,21,0.560756963282836,0.560756963282836,Georgia,South Carolina,5,5,NA,260540061,2006-02-23
72,1,8:10,1690,1690,Tre Kelley missed Two Point Layup.,11,9,2,0,0.5613571600748621,0.5613571600748621,Georgia,South Carolina,5,5,NA,260540061,2006-02-23
73,1,8:10,1690,1690,Antoine Tisby Offensive Rebound.,11,9,2,7,0.5613571600748621,0.5613571600748621,Georgia,South Carolina,5,5,NA,260540061,2006-02-23
74,1,8:03,1683,1683,Antoine Tisby missed Two Point Layup.,11,9,2,0,0.56155830985955,0.56155830985955,Georgia,South Carolina,5,5,NA,260540061,2006-02-23
75,1,8:03,1683,1683,Dave Bliss Defensive Rebound.,11,9,2,11,0.56155830985955,0.56155830985955,Georgia,South Carolina,5,5,NA,260540061,2006-02-23
76,1,7:52,1672,1672,Mike Mercer made Two Point Layup.,13,9,4,35,0.6218741819453586,0.6218741819453586,Georgia,South Carolina,5,5,NA,260540061,2006-02-23
77,1,7:17,1637,1637,Brandon Wallace missed Three Point Jumper.,13,9,4,0,0.623716909221895,0.623716909221895,Georgia,South Carolina,5,5,NA,260540061,2006-02-23
78,1,7:17,1637,1637,Georgia Defensive Rebound.,13,9,4,9,0.623716909221895,0.623716909221895,Georgia,South Carolina,5,5,NA,260540061,2006-02-23
79,1,7:08,1628,1628,Georgia Full Timeout.,13,9,4,19,0.6241814584114307,0.6241814584114307,Georgia,South Carolina,4,5,NA,260540061,2006-02-23
80,1,6:49,1609,1609,Billy Humphrey missed Three Point Jumper.,13,9,4,0,0.6251554952166496,0.6251554952166496,Georgia,South Carolina,4,5,NA,260540061,2006-02-23
81,1,6:49,1609,1609,Rocky Trice Defensive Rebound.,13,9,4,28,0.6251554952166496,0.6251554952166496,Georgia,South Carolina,4,5,NA,260540061,2006-02-23
82,1,6:21,1581,1581,Steve Newman missed Three Point Jumper.,13,9,4,0,0.6265871084181751,0.6265871084181751,Georgia,South Carolina,4,5,NA,260540061,2006-02-23
83,1,6:21,1581,1581,Brandon Wallace Defensive Rebound.,13,9,4,15,0.6265871084181751,0.6265871084181751,Georgia,South Carolina,4,5,NA,260540061,2006-02-23
84,1,6:06,1566,1566,Steve Newman made Two Point Layup.,15,9,6,19,0.6859721784160182,0.6859721784160182,Georgia,South Carolina,4,5,NA,260540061,2006-02-23
85,1,5:47,1547,1547,Foul on Billy Humphrey,15,9,6,47,0.6873391550549203,0.6873391550549203,Georgia,South Carolina,4,5,NA,260540061,2006-02-23
86,1,5:00,1500,1500,Billy Humphrey made Three Point Jumper.,18,9,9,20,0.7696161130762753,0.7696161130762753,Georgia,South Carolina,4,5,NA,260540061,2006-02-23
87,1,4:40,1480,1480,Foul on Steve Newman,18,9,9,0,0.7715758826971392,0.7715758826971392,Georgia,South Carolina,4,5,NA,260540061,2006-02-23
88,1,4:40,1480,1480,Tarence Kinsey made Free Throw.,18,10,8,0,0.7468690784529353,0.7468690784529353,Georgia,South Carolina,4,5,NA,260540061,2006-02-23
89,1,4:40,1480,1480,Tarence Kinsey made Free Throw.,18,11,7,18,0.7204581247953952,0.7204581247953952,Georgia,South Carolina,4,5,NA,260540061,2006-02-23
90,1,4:22,1462,1462,Kevin Brophy missed Three Point Jumper.,18,11,7,0,0.7220832333623407,0.7220832333623407,Georgia,South Carolina,4,5,NA,260540061,2006-02-23
91,1,4:22,1462,1462,Brandon Wallace Defensive Rebound.,18,11,7,41,0.7220832333623407,0.7220832333623407,Georgia,South Carolina,4,5,NA,260540061,2006-02-23
92,1,3:41,1421,1421,Tarence Kinsey made Two Point Jumper.,18,13,5,13,0.6671867179563414,0.6671867179563414,Georgia,South Carolina,4,5,NA,260540061,2006-02-23
93,1,3:28,1408,1408,Channing Toney missed Three Point Jumper.,18,13,5,0,0.6680967728814589,0.6680967728814589,Georgia,South Carolina,4,5,NA,260540061,2006-02-23
94,1,3:28,1408,1408,Rashaad Singleton Offensive Rebound.,18,13,5,7,0.6680967728814589,0.6680967728814589,Georgia,South Carolina,4,5,NA,260540061,2006-02-23
95,1,3:21,1401,1401,Mike Mercer missed Three Point Jumper.,18,13,5,0,0.6685801529032822,0.6685801529032822,Georgia,South Carolina,4,5,NA,260540061,2006-02-23
96,1,3:21,1401,1401,South Carolin Defensive Rebound.,18,13,5,0,0.6685801529032822,0.6685801529032822,Georgia,South Carolina,4,5,NA,260540061,2006-02-23
97,1,3:21,1401,1401,Foul on Rashaad Singleton,18,13,5,0,0.6685801529032822,0.6685801529032822,Georgia,South Carolina,4,5,NA,260540061,2006-02-23
98,1,3:21,1401,1401,South Carolin Full Timeout.,18,13,5,0,0.6685801529032822,0.6685801529032822,Georgia,South Carolina,4,4,NA,260540061,2006-02-23
99,1,3:21,1401,1401,Brandon Wallace made Free Throw.,18,14,4,0,0.6367801669927631,0.6367801669927631,Georgia,South Carolina,4,4,NA,260540061,2006-02-23
100,1,3:21,1401,1401,Brandon Wallace missed Free Throw.,18,14,4,0,0.6367801669927631,0.6367801669927631,Georgia,South Carolina,4,4,NA,260540061,2006-02-23
101,1,3:21,1401,1401,Billy Humphrey Defensive Rebound.,18,14,4,16,0.6367801669927631,0.6367801669927631,Georgia,South Carolina,4,4,NA,260540061,2006-02-23
102,1,3:05,1385,1385,Dave Bliss missed Two Point Layup.,18,14,4,0,0.6376925279632414,0.6376925279632414,Georgia,South Carolina,4,4,NA,260540061,2006-02-23
103,1,3:05,1385,1385,Renaldo Balkman Defensive Rebound.,18,14,4,35,0.6376925279632414,0.6376925279632414,Georgia,South Carolina,4,4,NA,260540061,2006-02-23
104,1,2:30,1350,1350,Tarence Kinsey missed Three Point Jumper.,18,14,4,0,0.6396705443452474,0.6396705443452474,Georgia,South Carolina,4,4,NA,260540061,2006-02-23
105,1,2:30,1350,1350,Levi Stukes Defensive Rebound.,18,14,4,31,0.6396705443452474,0.6396705443452474,Georgia,South Carolina,4,4,NA,260540061,2006-02-23
106,1,1:59,1319,1319,Steve Newman missed Two Point Jumper.,18,14,4,0,0.6414528063743987,0.6414528063743987,Georgia,South Carolina,4,4,NA,260540061,2006-02-23
107,1,1:59,1319,1319,South Carolin Defensive Rebound.,18,14,4,19,0.6414528063743987,0.6414528063743987,Georgia,South Carolina,4,4,NA,260540061,2006-02-23
108,1,1:40,1300,1300,Renaldo Balkman made Two Point Layup.,18,16,2,30,0.5728031960130557,0.5728031960130557,Georgia,South Carolina,4,4,NA,260540061,2006-02-23
109,1,1:10,1270,1270,Rashaad Singleton missed Two Point Layup.,18,16,2,0,0.5738052788085366,0.5738052788085366,Georgia,South Carolina,4,4,NA,260540061,2006-02-23
110,1,1:10,1270,1270,Georgia Defensive Rebound.,18,16,2,5,0.5738052788085366,0.5738052788085366,Georgia,South Carolina,4,4,NA,260540061,2006-02-23
111,1,1:05,1265,1265,Steve Newman made Two Point Layup.,20,16,4,10,0.6447901136618193,0.6447901136618193,Georgia,South Carolina,4,4,NA,260540061,2006-02-23
112,1,0:55,1255,1255,South Carolin Full Timeout.,20,16,4,21,0.6454585740997525,0.6454585740997525,Georgia,South Carolina,4,3,NA,260540061,2006-02-23
113,1,0:34,1234,1234,Renaldo Balkman missed Two Point Layup.,20,16,4,2,0.6469298387857294,0.6469298387857294,Georgia,South Carolina,4,3,NA,260540061,2006-02-23
114,1,0:32,1232,1232,Mike Mercer Defensive Rebound.,20,16,4,31,0.6470751684268068,0.6470751684268068,Georgia,South Carolina,4,3,NA,260540061,2006-02-23
115,1,0:01,1201,1201,Mike Mercer missed Two Point Jumper.,20,16,4,0,0.649440775217143,0.649440775217143,Georgia,South Carolina,4,3,NA,260540061,2006-02-23
116,1,0:01,1201,1201,Renaldo Balkman Defensive Rebound.,20,16,4,1,0.649440775217143,0.649440775217143,Georgia,South Carolina,4,3,NA,260540061,2006-02-23
117,1,0:00,1200,1200,End of the 1st Half.,20,16,4,0,0.6495177425372646,0.6495177425372646,Georgia,South Carolina,4,3,NA,260540061,2006-02-23
118,2,20:00,1200,1200,PLAY,20,16,4,17,0.6495177425372646,0.6495177425372646,Georgia,South Carolina,4,3,NA,260540061,2006-02-23
119,2,19:43,1183,1183,Channing Toney made Two Point Jumper.,22,16,6,40,0.7178578400931109,0.7178578400931109,Georgia,South Carolina,4,3,NA,260540061,2006-02-23
120,2,19:03,1143,1143,Dwayne Day missed Three Point Jumper.,22,16,6,0,0.7217435063298618,0.7217435063298618,Georgia,South Carolina,4,3,NA,260540061,2006-02-23
121,2,19:03,1143,1143,Sundiata Gaines Defensive Rebound.,22,16,6,9,0.7217435063298618,0.7217435063298618,Georgia,South Carolina,4,3,NA,260540061,2006-02-23
122,2,18:54,1134,1134,Levi Stukes missed Three Point Jumper.,22,16,6,0,0.7226025034143473,0.7226025034143473,Georgia,South Carolina,4,3,NA,260540061,2006-02-23
123,2,18:54,1134,1134,Channing Toney Offensive Rebound.,22,16,6,7,0.7226025034143473,0.7226025034143473,Georgia,South Carolina,4,3,NA,260540061,2006-02-23
124,2,18:47,1127,1127,Dave Bliss made Two Point Layup.,24,16,8,21,0.782617963151233,0.782617963151233,Georgia,South Carolina,4,3,NA,260540061,2006-02-23
125,2,18:26,1106,1106,Dwayne Day made Three Point Jumper.,24,19,5,9,0.6918998408414302,0.6918998408414302,Georgia,South Carolina,4,3,NA,260540061,2006-02-23
126,2,18:17,1097,1097,Sundiata Gaines made Two Point Layup.,26,19,7,35,0.7572636432381752,0.7572636432381752,Georgia,South Carolina,4,3,NA,260540061,2006-02-23
127,2,17:42,1062,1062,Foul on Renaldo Balkman,26,19,7,1,0.7610341224802509,0.7610341224802509,Georgia,South Carolina,4,3,NA,260540061,2006-02-23
128,2,17:41,1061,1061,Steve Newman made Three Point Jumper.,29,19,10,29,0.8396559064564095,0.8396559064564095,Georgia,South Carolina,4,3,NA,260540061,2006-02-23
129,2,17:12,1032,1032,Brandon Wallace made Two Point Jumper.,29,21,8,38,0.7934147415027376,0.7934147415027376,Georgia,South Carolina,4,3,NA,260540061,2006-02-23
130,2,16:34,994,994,Dwayne Day missed Three Point Jumper.,29,21,8,0,0.7983999126313365,0.7983999126313365,Georgia,South Carolina,4,3,NA,260540061,2006-02-23
131,2,16:34,994,994,Tarence Kinsey Offensive Rebound.,29,21,8,19,0.7983999126313365,0.7983999126313365,Georgia,South Carolina,4,3,NA,260540061,2006-02-23
132,2,16:15,975,975,Levi Stukes missed Two Point Jumper.,29,21,8,0,0.8011192178152654,0.8011192178152654,Georgia,South Carolina,4,3,NA,260540061,2006-02-23
133,2,16:15,975,975,Tarence Kinsey Defensive Rebound.,29,21,8,33,0.8011192178152654,0.8011192178152654,Georgia,South Carolina,4,3,NA,260540061,2006-02-23
134,2,15:42,942,942,Tre Kelley missed Three Point Jumper.,29,21,8,0,0.8057224257825787,0.8057224257825787,Georgia,South Carolina,4,3,NA,260540061,2006-02-23
135,2,15:42,942,942,Brandon Wallace Offensive Rebound.,29,21,8,4,0.8057224257825787,0.8057224257825787,Georgia,South Carolina,4,3,NA,260540061,2006-02-23
136,2,15:38,938,938,Brandon Wallace made Two Point Tip Shot.,29,23,6,18,0.7444545227388728,0.7444545227388728,Georgia,South Carolina,4,3,NA,260540061,2006-02-23
137,2,15:20,920,920,Steve Newman made Two Point Layup.,31,23,8,22,0.8083765542702981,0.8083765542702981,Georgia,South Carolina,4,3,NA,260540061,2006-02-23
138,2,14:58,898,898,Tarence Kinsey made Two Point Layup.,31,25,6,9,0.7486687366627759,0.7486687366627759,Georgia,South Carolina,4,3,NA,260540061,2006-02-23
139,2,14:49,889,889,Foul on Mike Mercer,31,25,6,0,0.7495585413940131,0.7495585413940131,Georgia,South Carolina,4,3,NA,260540061,2006-02-23
140,2,14:49,889,889,South Carolin Full Timeout.,31,25,6,0,0.7495585413940131,0.7495585413940131,Georgia,South Carolina,4,2,NA,260540061,2006-02-23
141,2,14:49,889,889,Rocky Trice made Free Throw.,31,26,5,0,0.7137259212473803,0.7137259212473803,Georgia,South Carolina,4,2,NA,260540061,2006-02-23
142,2,14:49,889,889,Rocky Trice missed Free Throw.,31,26,5,0,0.7137259212473803,0.7137259212473803,Georgia,South Carolina,4,2,NA,260540061,2006-02-23
143,2,14:49,889,889,Rocky Trice Offensive Rebound.,31,26,5,5,0.7137259212473803,0.7137259212473803,Georgia,South Carolina,4,2,NA,260540061,2006-02-23
144,2,14:44,884,884,Rocky Trice made Two Point Layup.,31,28,3,32,0.6340051783186426,0.6340051783186426,Georgia,South Carolina,4,2,NA,260540061,2006-02-23
145,2,14:12,852,852,Mike Mercer missed Two Point Layup.,31,28,3,0,0.6359699570674832,0.6359699570674832,Georgia,South Carolina,4,2,NA,260540061,2006-02-23
146,2,14:12,852,852,Tre Kelley Defensive Rebound.,31,28,3,1,0.6359699570674832,0.6359699570674832,Georgia,South Carolina,4,2,NA,260540061,2006-02-23
147,2,14:11,851,851,Dwayne Day made Two Point Layup.,31,30,1,17,0.5463819146846853,0.5463819146846853,Georgia,South Carolina,4,2,NA,260540061,2006-02-23
148,2,13:54,834,834,Billy Humphrey missed Three Point Jumper.,31,30,1,0,0.5467762259933318,0.5467762259933318,Georgia,South Carolina,4,2,NA,260540061,2006-02-23
149,2,13:54,834,834,Dwayne Day Defensive Rebound.,31,30,1,14,0.5467762259933318,0.5467762259933318,Georgia,South Carolina,4,2,NA,260540061,2006-02-23
150,2,13:40,820,820,Dwayne Day missed Three Point Jumper.,31,30,1,0,0.5471213286580703,0.5471213286580703,Georgia,South Carolina,4,2,NA,260540061,2006-02-23
151,2,13:40,820,820,Brandon Wallace Offensive Rebound.,31,30,1,12,0.5471213286580703,0.5471213286580703,Georgia,South Carolina,4,2,NA,260540061,2006-02-23
152,2,13:28,808,808,Tre Kelley missed Two Point Layup.,31,30,1,0,0.547436223570716,0.547436223570716,Georgia,South Carolina,4,2,NA,260540061,2006-02-23
153,2,13:28,808,808,Georgia Defensive Rebound.,31,30,1,11,0.547436223570716,0.547436223570716,Georgia,South Carolina,4,2,NA,260540061,2006-02-23
154,2,13:17,797,797,South Carolin Full Timeout.,31,30,1,18,0.5477434586189996,0.5477434586189996,Georgia,South Carolina,4,1,NA,260540061,2006-02-23
155,2,12:59,779,779,Rocky Trice made Two Point Layup.,31,32,-1,18,0.45170837512706297,0.45170837512706297,Georgia,South Carolina,4,1,NA,260540061,2006-02-23
156,2,12:41,761,761,Mike Mercer made Two Point Jumper.,33,32,1,17,0.5489062372784966,0.5489062372784966,Georgia,South Carolina,4,1,NA,260540061,2006-02-23
157,2,12:24,744,744,Mike Mercer made Two Point Layup.,35,32,3,23,0.6448909923487225,0.6448909923487225,Georgia,South Carolina,4,1,NA,260540061,2006-02-23
158,2,12:01,721,721,Tarence Kinsey missed Three Point Jumper.,35,32,3,0,0.6476169041921742,0.6476169041921742,Georgia,South Carolina,4,1,NA,260540061,2006-02-23
159,2,12:01,721,721,Mike Mercer Defensive Rebound.,35,32,3,11,0.6476169041921742,0.6476169041921742,Georgia,South Carolina,4,1,NA,260540061,2006-02-23
160,2,11:50,710,710,Georgia Full Timeout.,35,32,3,27,0.6488346676792194,0.6488346676792194,Georgia,South Carolina,3,1,NA,260540061,2006-02-23
161,2,11:23,683,683,Dave Bliss made Two Point Layup.,37,32,5,35,0.7393873543094602,0.7393873543094602,Georgia,South Carolina,3,1,NA,260540061,2006-02-23
162,2,10:48,648,648,Tre Kelley made Three Point Jumper.,37,35,2,15,0.605042484415825,0.605042484415825,Georgia,South Carolina,3,1,NA,260540061,2006-02-23
163,2,10:33,633,633,Foul on Tre Kelley,37,35,2,21,0.6060447879572949,0.6060447879572949,Georgia,South Carolina,3,1,NA,260540061,2006-02-23
164,2,10:12,612,612,Tarence Kinsey made Two Point Layup.,37,37,0,7,0.5,0.5,Georgia,South Carolina,3,1,NA,260540061,2006-02-23
165,2,10:05,605,605,Billy Humphrey made Three Point Jumper.,40,37,3,33,0.659093422923362,0.659093422923362,Georgia,South Carolina,3,1,NA,260540061,2006-02-23
166,2,9:32,572,572,Bryce Sheldon missed Three Point Jumper.,40,37,3,0,0.6634871950436529,0.6634871950436529,Georgia,South Carolina,3,1,NA,260540061,2006-02-23
167,2,9:32,572,572,Rashaad Singleton Defensive Rebound.,40,37,3,16,0.6634871950436529,0.6634871950436529,Georgia,South Carolina,3,1,NA,260540061,2006-02-23
168,2,9:16,556,556,Foul on Billy Humphrey,40,37,3,24,0.6661090496856525,0.6661090496856525,Georgia,South Carolina,3,1,NA,260540061,2006-02-23
169,2,8:52,532,532,Tarence Kinsey missed Two Point Jumper.,40,37,3,0,0.6701901811621449,0.6701901811621449,Georgia,South Carolina,3,1,NA,260540061,2006-02-23
170,2,8:52,532,532,Brandon Wallace Offensive Rebound.,40,37,3,8,0.6701901811621449,0.6701901811621449,Georgia,South Carolina,3,1,NA,260540061,2006-02-23
171,2,8:44,524,524,Foul on Levi Stukes,40,37,3,31,0.6713551681176607,0.6713551681176607,Georgia,South Carolina,3,1,NA,260540061,2006-02-23
172,2,8:13,493,493,Foul on Younes Idrissi,40,37,3,18,0.6754979950040835,0.6754979950040835,Georgia,South Carolina,3,1,NA,260540061,2006-02-23
