play_id,half,time_remaining_half,secs_remaining,secs_remaining_absolute,description,home_score,away_score,score_diff,play_length,win_prob,naive_win_prob,home,away,home_time_out_remaining,away_time_out_remaining,home_favored_by,game_id,date
1,1,20:00,2400,2400,PLAY,0,0,0,15,0.5,0.5,Northwestern,Illinois,6,6,NA,300230077,2010-01-23
2,1,19:45,2385,2385,Drew Crawford missed Three Point Jumper.,0,0,0,0,0.5,0.5,Northwestern,Illinois,6,6,NA,300230077,2010-01-23
3,1,19:45,2385,2385,Luka Mirkovic Offensive Rebound.,0,0,0,25,0.5,0.5,Northwestern,Illinois,6,6,NA,300230077,2010-01-23
4,1,19:20,2360,2360,John Shurna missed Three Point Jumper.,0,0,0,0,0.5,0.5,Northwestern,Illinois,6,6,NA,300230077,2010-01-23
5,1,19:20,2360,2360,Mike Tisdale Defensive Rebound.,0,0,0,18,0.5,0.5,Northwestern,Illinois,6,6,NA,300230077,2010-01-23
6,1,19:02,2342,2342,Demetri McCamey missed Two Point Jumper.,0,0,0,0,0.5,0.5,Northwestern,Illinois,6,6,NA,300230077,2010-01-23
7,1,19:02,2342,2342,Drew Crawford Defensive Rebound.,0,0,0,10,0.5,0.5,Northwestern,Illinois,6,6,NA,300230077,2010-01-23
8,1,18:52,2332,2332,Drew Crawford made Three Point Jumper.  Assisted by John Shurna.,3,0,3,14,0.5679886602964822,0.5679886602964822,Northwestern,Illinois,6,6,NA,300230077,2010-01-23
9,1,18:38,2318,2318,Foul on Jeremy Nash,3,0,3,12,0.5684445851038439,0.5684445851038439,Northwestern,Illinois,6,6,NA,300230077,2010-01-23
10,1,18:26,2306,2306,D.J. Richardson Turnover.,3,0,3,20,0.5688379241829442,0.5688379241829442,Northwestern,Illinois,6,6,NA,300230077,2010-01-23
11,1,18:06,2286,2286,Jeremy Nash Turnover.,3,0,3,12,0.5694983262126054,0.5694983262126054,Northwestern,Illinois,6,6,NA,300230077,2010-01-23
12,1,17:54,2274,2274,Mike Davis Turnover.,3,0,3,10,0.5698972479600887,0.5698972479600887,Northwestern,Illinois,6,6,NA,300230077,2010-01-23
13,1,17:44,2264,2264,Foul on Mike Davis,3,0,3,0,0.5702310973753852,0.5702310973753852,Northwestern,Illinois,6,6,NA,300230077,2010-01-23
14,1,17:44,2264,2264,Luka Mirkovic made Free Throw.,4,0,4,0,0.5931635207693176,0.5931635207693176,Northwestern,Illinois,6,6,NA,300230077,2010-01-23
15,1,17:44,2264,2264,Luka Mirkovic missed Free Throw.,4,0,4,0,0.5931635207693176,0.5931635207693176,Northwestern,Illinois,6,6,NA,300230077,2010-01-23
16,1,17:44,2264,2264,Bill Cole Defensive Rebound.,4,0,4,13,0.5931635207693176,0.5931635207693176,Northwestern,Illinois,6,6,NA,300230077,2010-01-23
17,1,17:31,2251,2251,Mike Davis missed Two Point Jumper.,4,0,4,0,0.593735634626751,0.593735634626751,Northwestern,Illinois,6,6,NA,300230077,2010-01-23
18,1,17:31,2251,2251,John Shurna Defensive Rebound.,4,0,4,31,0.593735634626751,0.593735634626751,Northwestern,Illinois,6,6,NA,300230077,2010-01-23
19,1,17:00,2220,2220,Drew Crawford missed Two Point Jumper.,4,0,4,0,0.5951088823675076,0.5951088823675076,Northwestern,Illinois,6,6,NA,300230077,2010-01-23
20,1,17:00,2220,2220,Mike Davis Defensive Rebound.,4,0,4,11,0.5951088823675076,0.5951088823675076,Northwestern,Illinois,6,6,NA,300230077,2010-01-23
21,1,16:49,2209,2209,Foul on Michael Thompson,4,0,4,9,0.5955987646459386,0.5955987646459386,Northwestern,Illinois,6,6,NA,300230077,2010-01-23
22,1,16:40,2200,2200,Mike Tisdale made Two Point Dunk Shot.  Assisted by Mike Davis.,4,2,2,13,0.5484509368654422,0.5484509368654422,Northwestern,Illinois,6,6,NA,300230077,2010-01-23
23,1,16:27,2187,2187,Michael Thompson missed Three Point Jumper.,4,2,2,0,0.5487499721246489,0.5487499721246489,Northwestern,Illinois,6,6,NA,300230077,2010-01-23
24,1,16:27,2187,2187,Drew Crawford Offensive Rebound.,4,2,2,10,0.5487499721246489,0.5487499721246489,Northwestern,Illinois,6,6,NA,300230077,2010-01-23
25,1,16:17,2177,2177,Drew Crawford made Two Point Layup.  Assisted by Jeremy Nash.,6,2,4,0,0.5970298663841688,0.5970298663841688,Northwestern,Illinois,6,6,NA,300230077,2010-01-23
26,1,16:17,2177,2177,Foul on Mike Tisdale,6,2,4,0,0.5970298663841688,0.5970298663841688,Northwestern,Illinois,6,6,NA,300230077,2010-01-23
27,1,16:17,2177,2177,Drew Crawford made Free Throw.,7,2,5,9,0.6204316744197328,0.6204316744197328,Northwestern,Illinois,6,6,NA,300230077,2010-01-23
28,1,16:08,2168,2168,D.J. Richardson Turnover.,7,2,5,17,0.6209256891317544,0.6209256891317544,Northwestern,Illinois,6,6,NA,300230077,2010-01-23
29,1,15:51,2151,2151,Foul on Jeff Jordan,7,2,5,0,0.6218617260981661,0.6218617260981661,Northwestern,Illinois,6,6,NA,300230077,2010-01-23
30,1,15:51,2151,2151,Official TV Timeout.,7,2,5,15,0.6218617260981661,0.6218617260981661,Northwestern,Illinois,6,6,NA,300230077,2010-01-23
31,1,15:36,2136,2136,Jeremy Nash missed Three Point Jumper.,7,2,5,0,0.6226914686398052,0.6226914686398052,Northwestern,Illinois,6,6,NA,300230077,2010-01-23
32,1,15:36,2136,2136,Mike Tisdale Defensive Rebound.,7,2,5,23,0.6226914686398052,0.6226914686398052,Northwestern,Illinois,6,6,NA,300230077,2010-01-23
33,1,15:13,2113,2113,Jeff Jordan Turnover.,7,2,5,1,0.6239713178266638,0.6239713178266638,Northwestern,Illinois,6,6,NA,300230077,2010-01-23
34,1,15:12,2112,2112,Jeremy Nash Steal.,7,2,5,2,0.6240271833037359,0.6240271833037359,Northwestern,Illinois,6,6,NA,300230077,2010-01-23
35,1,15:10,2110,2110,Drew Crawford made Two Point Layup.  Assisted by Jeremy Nash.,9,2,7,2,0.6704044778121339,0.6704044778121339,Northwestern,Illinois,6,6,NA,300230077,2010-01-23
36,1,15:08,2108,2108,Foul on D.J. Richardson,9,2,7,0,0.6705519823435689,0.6705519823435689,Northwestern,Illinois,6,6,NA,300230077,2010-01-23
37,1,15:08,2108,2108,Drew Crawford missed Free Throw.,9,2,7,0,0.6705519823435689,0.6705519823435689,Northwestern,Illinois,6,6,NA,300230077,2010-01-23
38,1,15:08,2108,2108,Mike Tisdale Defensive Rebound.,9,2,7,19,0.6705519823435689,0.6705519823435689,Northwestern,Illinois,6,6,NA,300230077,2010-01-23
39,1,14:49,2089,2089,Foul on Michael Thompson,9,2,7,21,0.6719576399916065,0.6719576399916065,Northwestern,Illinois,6,6,NA,300230077,2010-01-23
40,1,14:28,2068,2068,Mike Davis missed Two Point Jumper.,9,2,7,0,0.673520993276257,0.673520993276257,Northwestern,Illinois,6,6,NA,300230077,2010-01-23
41,1,14:28,2068,2068,Alex Marcotullio Defensive Rebound.,9,2,7,10,0.673520993276257,0.673520993276257,Northwestern,Illinois,6,6,NA,300230077,2010-01-23
42,1,14:18,2058,2058,Luka Mirkovic made Two Point Layup.  Assisted by Drew Crawford.,11,2,9,14,0.7181760940011661,0.7181760940011661,Northwestern,Illinois,6,6,NA,300230077,2010-01-23
43,1,14:04,2044,2044,Foul on Alex Marcotullio,11,2,9,9,0.7194218814139034,0.7194218814139034,Northwestern,Illinois,6,6,NA,300230077,2010-01-23
44,1,13:55,2035,2035,Demetri McCamey Turnover.,11,2,9,1,0.720225382286153,0.720225382286153,Northwestern,Illinois,6,6,NA,300230077,2010-01-23
45,1,13:54,2034,2034,Jeremy Nash Steal.,11,2,9,3,0.7203147914092828,0.7203147914092828,Northwestern,Illinois,6,6,NA,300230077,2010-01-23
46,1,13:51,2031,2031,Drew Crawford missed Two Point Layup.,11,2,9,0,0.7205831787469349,0.7205831787469349,Northwestern,Illinois,6,6,NA,300230077,2010-01-23
47,1,13:51,2031,2031,Demetri McCamey Block.,11,2,9,2,0.7205831787469349,0.7205831787469349,Northwestern,Illinois,6,6,NA,300230077,2010-01-23
48,1,13:49,2029,2029,Jeremy Nash Offensive Rebound.,11,2,9,1,0.7207622378912957,0.7207622378912957,Northwestern,Illinois,6,6,NA,300230077,2010-01-23
49,1,13:48,2028,2028,Foul on Jeff Jordan,11,2,9,0,0.7208518080223547,0.7208518080223547,Northwestern,Illinois,6,6,NA,300230077,2010-01-23
50,1,13:48,2028,2028,Jeremy Nash made Free Throw.,12,2,10,0,0.7415616012388568,0.7415616012388568,Northwestern,Illinois,6,6,NA,300230077,2010-01-23
51,1,13:48,2028,2028,Jeremy Nash made Free Throw.,13,2,11,6,0.7612438421765092,0.7612438421765092,Northwestern,Illinois,6,6,NA,300230077,2010-01-23
52,1,13:42,2022,2022,Demetri McCamey made Two Point Layup.,13,4,9,17,0.7213898025560439,0.7213898025560439,Northwestern,Illinois,6,6,NA,300230077,2010-01-23
53,1,13:25,2005,2005,John Shurna missed Two Point Jumper.,13,4,9,0,0.7229196075600822,0.7229196075600822,Northwestern,Illinois,6,6,NA,300230077,2010-01-23
54,1,13:25,2005,2005,D.J. Richardson Defensive Rebound.,13,4,9,18,0.7229196075600822,0.7229196075600822,Northwestern,Illinois,6,6,NA,300230077,2010-01-23
55,1,13:07,1987,1987,Brandon Paul made Two Point Jumper.,13,6,7,13,0.6796618653657669,0.6796618653657669,Northwestern,Illinois,6,6,NA,300230077,2010-01-23
56,1,12:54,1974,1974,Drew Crawford missed Three Point Jumper.,13,6,7,0,0.6806658944528873,0.6806658944528873,Northwestern,Illinois,6,6,NA,300230077,2010-01-23
57,1,12:54,1974,1974,D.J. Richardson Defensive Rebound.,13,6,7,9,0.6806658944528873,0.6806658944528873,Northwestern,Illinois,6,6,NA,300230077,2010-01-23
58,1,12:45,1965,1965,Brandon Paul missed Two Point Jumper.,13,6,7,0,0.6813642754758032,0.6813642754758032,Northwestern,Illinois,6,6,NA,300230077,2010-01-23
59,1,12:45,1965,1965,Mike Tisdale Offensive Rebound.,13,6,7,3,0.6813642754758032,0.6813642754758032,Northwestern,Illinois,6,6,NA,300230077,2010-01-23
60,1,12:42,1962,1962,Foul on Luka Mirkovic,13,6,7,2,0.6815976789067042,0.6815976789067042,Northwestern,Illinois,6,6,NA,300230077,2010-01-23
61,1,12:40,1960,1960,D.J. Richardson missed Three Point Jumper.,13,6,7,0,0.6817534525308078,0.6817534525308078,Northwestern,Illinois,6,6,NA,300230077,2010-01-23
62,1,12:40,1960,1960,Tyler Griffey Offensive Rebound.,13,6,7,3,0.6817534525308078,0.6817534525308078,Northwestern,Illinois,6,6,NA,300230077,2010-01-23
63,1,12:37,1957,1957,D.J. Richardson made Two Point Jumper.  Assisted by Tyler Griffey.,13,8,5,11,0.6329615091190671,0.6329615091190671,Northwestern,Illinois,6,6,NA,300230077,2010-01-23
64,1,12:26,1946,1946,Foul on Tyler Griffey,13,8,5,12,0.6336200571896707,0.6336200571896707,Northwestern,Illinois,6,6,NA,300230077,2010-01-23
65,1,12:14,1934,1934,Jeremy Nash Turnover.,13,8,5,1,0.6343427652127168,0.6343427652127168,Northwestern,Illinois,6,6,NA,300230077,2010-01-23
66,1,12:13,1933,1933,Demetri McCamey Steal.,13,8,5,3,0.6344031967090716,0.6344031967090716,Northwestern,Illinois,6,6,NA,300230077,2010-01-23
67,1,12:10,1930,1930,Dominique Keller made Two Point Dunk Shot.  Assisted by Demetri McCamey.,13,10,3,33,0.5820420118260582,0.5820420118260582,Northwestern,Illinois,6,6,NA,300230077,2010-01-23
68,1,11:37,1897,1897,Foul on Tyler Griffey,13,10,3,0,0.5832962846408858,0.5832962846408858,Northwestern,Illinois,6,6,NA,300230077,2010-01-23
69,1,11:37,1897,1897,Official TV Timeout.,13,10,3,0,0.5832962846408858,0.5832962846408858,Northwestern,Illinois,6,6,NA,300230077,2010-01-23
70,1,11:37,1897,1897,John Shurna made Free Throw.,14,10,4,0,0.6102650344383029,0.6102650344383029,Northwestern,Illinois,6,6,NA,300230077,2010-01-23
71,1,11:37,1897,1897,John Shurna made Free Throw.,15,10,5,16,0.6365758609465011,0.6365758609465011,Northwestern,Illinois,6,6,NA,300230077,2010-01-23
72,1,11:21,1881,1881,Brandon Paul made Two Point Layup.,15,12,3,24,0.583903469991917,0.583903469991917,Northwestern,Illinois,6,6,NA,300230077,2010-01-23
73,1,10:57,1857,1857,Alex Marcotullio missed Three Point Jumper.,15,12,3,0,0.5848157365062421,0.5848157365062421,Northwestern,Illinois,6,6,NA,300230077,2010-01-23
74,1,10:57,1857,1857,Dominique Keller Defensive Rebound.,15,12,3,16,0.5848157365062421,0.5848157365062421,Northwestern,Illinois,6,6,NA,300230077,2010-01-23
75,1,10:41,1841,1841,Mike Tisdale made Two Point Layup.  Assisted by Dominique Keller.,15,14,1,0,0.5287257791662856,0.5287257791662856,Northwestern,Illinois,6,6,NA,300230077,2010-01-23
76,1,10:41,1841,1841,Foul on Alex Marcotullio,15,14,1,0,0.5287257791662856,0.5287257791662856,Northwestern,Illinois,6,6,NA,300230077,2010-01-23
77,1,10:41,1841,1841,Mike Tisdale made Free Throw.,15,15,0,22,0.5,0.5,Northwestern,Illinois,6,6,NA,300230077,2010-01-23
78,1,10:19,1819,1819,Foul on Drew Crawford,15,15,0,0,0.5,0.5,Northwestern,Illinois,6,6,NA,300230077,2010-01-23
79,1,10:19,1819,1819,Drew Crawford Turnover.,15,15,0,18,0.5,0.5,Northwestern,Illinois,6,6,NA,300230077,2010-01-23
80,1,10:01,1801,1801,D.J. Richardson made Three Point Jumper.  Assisted by Demetri McCamey.,15,18,-3,16,0.4130325009831776,0.4130325009831776,Northwestern,Illinois,6,6,NA,300230077,2010-01-23
81,1,9:45,1785,1785,Jeremy Nash missed Three Point Jumper.,15,18,-3,0,0.4124076101339598,0.4124076101339598,Northwestern,Illinois,6,6,NA,300230077,2010-01-23
82,1,9:45,1785,1785,Brandon Paul Defensive Rebound.,15,18,-3,9,0.4124076101339598,0.4124076101339598,Northwestern,Illinois,6,6,NA,300230077,2010-01-23
83,1,9:36,1776,1776,D.J. Richardson made Three Point Jumper.  Assisted by Mike Tisdale.,15,21,-6,4,0.32938544609109915,0.32938544609109915,Northwestern,Illinois,6,6,NA,300230077,2010-01-23
84,1,9:32,1772,1772,Foul on John Shurna,15,21,-6,0,0.3290972417148808,0.3290972417148808,Northwestern,Illinois,6,6,NA,300230077,2010-01-23
85,1,9:32,1772,1772,D.J. Richardson made Free Throw.,15,22,-7,16,0.3034373122994261,0.3034373122994261,Northwestern,Illinois,6,6,NA,300230077,2010-01-23
86,1,9:16,1756,1756,Luka Mirkovic made Two Point Layup.  Assisted by Michael Thompson.,17,22,-5,23,0.35481485304178273,0.35481485304178273,Northwestern,Illinois,6,6,NA,300230077,2010-01-23
87,1,8:53,1733,1733,Brandon Paul missed Three Point Jumper.,17,22,-5,0,0.3533513470211079,0.3533513470211079,Northwestern,Illinois,6,6,NA,300230077,2010-01-23
88,1,8:53,1733,1733,Drew Crawford Defensive Rebound.,17,22,-5,17,0.3533513470211079,0.3533513470211079,Northwestern,Illinois,6,6,NA,300230077,2010-01-23
89,1,8:36,1716,1716,John Shurna made Three Point Jumper.  Assisted by Luka Mirkovic.,20,22,-2,22,0.43938406363819593,0.43938406363819593,Northwestern,Illinois,6,6,NA,300230077,2010-01-23
90,1,8:14,1694,1694,Mike Tisdale made Two Point Layup.  Assisted by D.J. Richardson.,20,24,-4,17,0.3793267351509305,0.3793267351509305,Northwestern,Illinois,6,6,NA,300230077,2010-01-23
91,1,7:57,1677,1677,Michael Thompson missed Three Point Jumper.,20,24,-4,0,0.37839546410380065,0.37839546410380065,Northwestern,Illinois,6,6,NA,300230077,2010-01-23
92,1,7:57,1677,1677,Demetri McCamey Defensive Rebound.,20,24,-4,7,0.37839546410380065,0.37839546410380065,Northwestern,Illinois,6,6,NA,300230077,2010-01-23
93,1,7:50,1670,1670,Demetri McCamey made Two Point Layup.,20,26,-6,14,0.32148604806858794,0.32148604806858794,Northwestern,Illinois,6,6,NA,300230077,2010-01-23
94,1,7:36,1656,1656,Luka Mirkovic made Two Point Layup.  Assisted by Drew Crawford.,22,26,-4,25,0.377274813827014,0.377274813827014,Northwestern,Illinois,6,6,NA,300230077,2010-01-23
95,1,7:11,1631,1631,Demetri McCamey made Two Point Layup.  Assisted by D.J. Richardson.,22,28,-6,15,0.3186432620275869,0.3186432620275869,Northwestern,Illinois,6,6,NA,300230077,2010-01-23
96,1,6:56,1616,1616,Drew Crawford missed Three Point Jumper.,22,28,-6,0,0.31757429642426555,0.31757429642426555,Northwestern,Illinois,6,6,NA,300230077,2010-01-23
97,1,6:56,1616,1616,Jeremy Nash Offensive Rebound.,22,28,-6,4,0.31757429642426555,0.31757429642426555,Northwestern,Illinois,6,6,NA,300230077,2010-01-23
98,1,6:52,1612,1612,Foul on Brandon Paul,22,28,-6,0,0.3172904646789545,0.3172904646789545,Northwestern,Illinois,6,6,NA,300230077,2010-01-23
99,1,6:52,1612,1612,Official TV Timeout.,22,28,-6,0,0.3172904646789545,0.3172904646789545,Northwestern,Illinois,6,6,NA,300230077,2010-01-23
100,1,6:52,1612,1612,Jeremy Nash made Free Throw.,23,28,-5,0,0.34557592433864637,0.34557592433864637,Northwestern,Illinois,6,6,NA,300230077,2010-01-23
101,1,6:52,1612,1612,Jeremy Nash made Free Throw.,24,28,-4,16,0.3749979048381483,0.3749979048381483,Northwestern,Illinois,6,6,NA,300230077,2010-01-23
102,1,6:36,1596,1596,Foul on Michael Thompson,24,28,-4,0,0.37418033655168453,0.37418033655168453,Northwestern,Illinois,6,6,NA,300230077,2010-01-23
103,1,6:36,1596,1596,Mike Tisdale missed Free Throw.,24,28,-4,0,0.37418033655168453,0.37418033655168453,Northwestern,Illinois,6,6,NA,300230077,2010-01-23
104,1,6:36,1596,1596,null,24,28,-4,0,0.37418033655168453,0.37418033655168453,Northwestern,Illinois,6,6,NA,300230077,2010-01-23
105,1,6:36,1596,1596,Mike Tisdale missed Free Throw.,24,28,-4,0,0.37418033655168453,0.37418033655168453,Northwestern,Illinois,6,6,NA,300230077,2010-01-23
106,1,6:36,1596,1596,Mike Capocci Defensive Rebound.,24,28,-4,30,0.37418033655168453,0.37418033655168453,Northwestern,Illinois,6,6,NA,300230077,2010-01-23
107,1,6:06,1566,1566,Kyle Rowley made Two Point Layup.  Assisted by Mike Capocci.,26,28,-2,17,0.4352526420380632,0.4352526420380632,Northwestern,Illinois,6,6,NA,300230077,2010-01-23
108,1,5:49,1549,1549,Foul on John Shurna,26,28,-2,0,0.43478738299338093,0.43478738299338093,Northwestern,Illinois,6,6,NA,300230077,2010-01-23
109,1,5:49,1549,1549,Brandon Paul made Free Throw.,26,29,-3,0,0.40287088064197357,0.40287088064197357,Northwestern,Illinois,6,6,NA,300230077,2010-01-23
110,1,5:49,1549,1549,Brandon Paul made Free Throw.,26,30,-4,15,0.37175628666477645,0.37175628666477645,Northwestern,Illinois,6,6,NA,300230077,2010-01-23
111,1,5:34,1534,1534,Foul on Mike Davis,26,30,-4,0,0.37096320822783174,0.37096320822783174,Northwestern,Illinois,6,6,NA,300230077,2010-01-23
112,1,5:34,1534,1534,Jeremy Nash made Free Throw.,27,30,-3,0,0.40225809730575945,0.40225809730575945,Northwestern,Illinois,6,6,NA,300230077,2010-01-23
113,1,5:34,1534,1534,Jeremy Nash missed Free Throw.,27,30,-3,0,0.40225809730575945,0.40225809730575945,Northwestern,Illinois,6,6,NA,300230077,2010-01-23
114,1,5:34,1534,1534,D.J. Richardson Defensive Rebound.,27,30,-3,22,0.40225809730575945,0.40225809730575945,Northwestern,Illinois,6,6,NA,300230077,2010-01-23
115,1,5:12,1512,1512,Demetri McCamey made Three Point Jumper.  Assisted by Mike Tisdale.,27,33,-6,14,0.31006905040580707,0.31006905040580707,Northwestern,Illinois,6,6,NA,300230077,2010-01-23
116,1,4:58,1498,1498,Drew Crawford missed Three Point Jumper.,27,33,-6,0,0.30899488918981555,0.30899488918981555,Northwestern,Illinois,6,6,NA,300230077,2010-01-23
117,1,4:58,1498,1498,Kyle Rowley Offensive Rebound.,27,33,-6,8,0.30899488918981555,0.30899488918981555,Northwestern,Illinois,6,6,NA,300230077,2010-01-23
118,1,4:50,1490,1490,Kyle Rowley made Two Point Layup.,29,33,-4,15,0.3685358893831622,0.3685358893831622,Northwestern,Illinois,6,6,NA,300230077,2010-01-23
119,1,4:35,1475,1475,Foul on Mike Capocci,29,33,-4,0,0.3676629604500523,0.3676629604500523,Northwestern,Illinois,6,6,NA,300230077,2010-01-23
120,1,4:35,1475,1475,Dominique Keller made Free Throw.,29,34,-5,0,0.33674805963210314,0.33674805963210314,Northwestern,Illinois,6,6,NA,300230077,2010-01-23
121,1,4:35,1475,1475,Dominique Keller missed Free Throw.,29,34,-5,0,0.33674805963210314,0.33674805963210314,Northwestern,Illinois,6,6,NA,300230077,2010-01-23
122,1,4:35,1475,1475,Kyle Rowley Defensive Rebound.,29,34,-5,13,0.33674805963210314,0.33674805963210314,Northwestern,Illinois,6,6,NA,300230077,2010-01-23
123,1,4:22,1462,1462,Foul on Demetri McCamey,29,34,-5,0,0.33581208311226945,0.33581208311226945,Northwestern,Illinois,6,6,NA,300230077,2010-01-23
124,1,4:22,1462,1462,Drew Crawford missed Free Throw.,29,34,-5,0,0.33581208311226945,0.33581208311226945,Northwestern,Illinois,6,6,NA,300230077,2010-01-23
125,1,4:22,1462,1462,null,29,34,-5,0,0.33581208311226945,0.33581208311226945,Northwestern,Illinois,6,6,NA,300230077,2010-01-23
126,1,4:22,1462,1462,Drew Crawford made Free Throw.,30,34,-4,25,0.3668833556806381,0.3668833556806381,Northwestern,Illinois,6,6,NA,300230077,2010-01-23
127,1,3:57,1437,1437,D.J. Richardson missed Three Point Jumper.,30,34,-4,0,0.36534087531580206,0.36534087531580206,Northwestern,Illinois,6,6,NA,300230077,2010-01-23
128,1,3:57,1437,1437,Kyle Rowley Defensive Rebound.,30,34,-4,21,0.36534087531580206,0.36534087531580206,Northwestern,Illinois,6,6,NA,300230077,2010-01-23
129,1,3:36,1416,1416,Drew Crawford made Two Point Layup.  Assisted by Jeremy Nash.,32,34,-2,17,0.430740677327383,0.430740677327383,Northwestern,Illinois,6,6,NA,300230077,2010-01-23
130,1,3:19,1399,1399,Dominique Keller made Three Point Jumper.  Assisted by D.J. Richardson.,32,37,-5,17,0.33128244792602496,0.33128244792602496,Northwestern,Illinois,6,6,NA,300230077,2010-01-23
131,1,3:02,1382,1382,Foul on D.J. Richardson,32,37,-5,0,0.33012421109253104,0.33012421109253104,Northwestern,Illinois,6,6,NA,300230077,2010-01-23
132,1,3:02,1382,1382,Official TV Timeout.,32,37,-5,0,0.33012421109253104,0.33012421109253104,Northwestern,Illinois,6,6,NA,300230077,2010-01-23
133,1,3:02,1382,1382,Drew Crawford made Free Throw.,33,37,-4,0,0.3621375252295142,0.3621375252295142,Northwestern,Illinois,6,6,NA,300230077,2010-01-23
134,1,3:02,1382,1382,Drew Crawford missed Free Throw.,33,37,-4,0,0.3621375252295142,0.3621375252295142,Northwestern,Illinois,6,6,NA,300230077,2010-01-23
135,1,3:02,1382,1382,Dominique Keller Defensive Rebound.,33,37,-4,19,0.3621375252295142,0.3621375252295142,Northwestern,Illinois,6,6,NA,300230077,2010-01-23
136,1,2:43,1363,1363,Mike Tisdale Turnover.,33,37,-4,27,0.36106459242745037,0.36106459242745037,Northwestern,Illinois,6,6,NA,300230077,2010-01-23
137,1,2:16,1336,1336,Nick Fruendt missed Two Point Jumper.,33,37,-4,0,0.3595315950149979,0.3595315950149979,Northwestern,Illinois,6,6,NA,300230077,2010-01-23
138,1,2:16,1336,1336,Bill Cole Defensive Rebound.,33,37,-4,25,0.3595315950149979,0.3595315950149979,Northwestern,Illinois,6,6,NA,300230077,2010-01-23
139,1,1:51,1311,1311,Dominique Keller missed Two Point Jumper.,33,37,-4,0,0.3580757039456849,0.3580757039456849,Northwestern,Illinois,6,6,NA,300230077,2010-01-23
140,1,1:51,1311,1311,Jeremy Nash Defensive Rebound.,33,37,-4,29,0.3580757039456849,0.3580757039456849,Northwestern,Illinois,6,6,NA,300230077,2010-01-23
141,1,1:22,1282,1282,Drew Crawford missed Three Point Jumper.,33,37,-4,0,0.35630509946474964,0.35630509946474964,Northwestern,Illinois,6,6,NA,300230077,2010-01-23
142,1,1:22,1282,1282,Dominique Keller Defensive Rebound.,33,37,-4,5,0.35630509946474964,0.35630509946474964,Northwestern,Illinois,6,6,NA,300230077,2010-01-23
143,1,1:17,1277,1277,Illinois 30 Second Timeout.,33,37,-4,14,0.35598797305274665,0.35598797305274665,Northwestern,Illinois,6,5,NA,300230077,2010-01-23
144,1,1:03,1263,1263,Brandon Paul missed Two Point Jumper.,33,37,-4,0,0.35507771824785417,0.35507771824785417,Northwestern,Illinois,6,5,NA,300230077,2010-01-23
145,1,1:03,1263,1263,Illinois Offensive Rebound.,33,37,-4,10,0.35507771824785417,0.35507771824785417,Northwestern,Illinois,6,5,NA,300230077,2010-01-23
146,1,0:53,1253,1253,Foul on Dominique Keller,33,37,-4,0,0.35440537786555626,0.35440537786555626,Northwestern,Illinois,6,5,NA,300230077,2010-01-23
147,1,0:53,1253,1253,Dominique Keller Turnover.,33,37,-4,21,0.35440537786555626,0.35440537786555626,Northwestern,Illinois,6,5,NA,300230077,2010-01-23
148,1,0:32,1232,1232,Jeremy Nash missed Two Point Jumper.,33,37,-4,0,0.3529248315731932,0.3529248315731932,Northwestern,Illinois,6,5,NA,300230077,2010-01-23
149,1,0:32,1232,1232,Mike Capocci Offensive Rebound.,33,37,-4,0,0.3529248315731932,0.3529248315731932,Northwestern,Illinois,6,5,NA,300230077,2010-01-23
150,1,0:32,1232,1232,Jeremy Nash made Three Point Jumper.  Assisted by Mike Capocci.,36,37,-1,28,0.4621843903160427,0.4621843903160427,Northwestern,Illinois,6,5,NA,300230077,2010-01-23
151,1,0:04,1204,1204,Foul on Jeremy Nash,36,37,-1,0,0.4616030238506507,0.4616030238506507,Northwestern,Illinois,6,5,NA,300230077,2010-01-23
152,1,0:04,1204,1204,Demetri McCamey made Free Throw.,36,38,-2,0,0.4236562704258714,0.4236562704258714,Northwestern,Illinois,6,5,NA,300230077,2010-01-23
153,1,0:04,1204,1204,Demetri McCamey made Free Throw.,36,39,-3,4,0.38658909088084287,0.38658909088084287,Northwestern,Illinois,6,5,NA,300230077,2010-01-23
154,1,0:00,1200,1200,End of the 1st Half.,36,39,-3,0,0.38634786325026177,0.38634786325026177,Northwestern,Illinois,6,5,NA,300230077,2010-01-23
155,2,20:00,1200,1200,PLAY,36,39,-3,29,0.38634786325026177,0.38634786325026177,Northwestern,Illinois,6,5,NA,300230077,2010-01-23
156,2,19:31,1171,1171,Jeremy Nash missed Three Point Jumper.,36,39,-3,0,0.3846499659524689,0.3846499659524689,Northwestern,Illinois,6,5,NA,300230077,2010-01-23
157,2,19:31,1171,1171,Luka Mirkovic Offensive Rebound.,36,39,-3,5,0.3846499659524689,0.3846499659524689,Northwestern,Illinois,6,5,NA,300230077,2010-01-23
158,2,19:26,1166,1166,Luka Mirkovic missed Two Point Layup.,36,39,-3,0,0.3843641800971132,0.3843641800971132,Northwestern,Illinois,6,5,NA,300230077,2010-01-23
159,2,19:26,1166,1166,Demetri McCamey Block.,36,39,-3,2,0.3843641800971132,0.3843641800971132,Northwestern,Illinois,6,5,NA,300230077,2010-01-23
160,2,19:24,1164,1164,Drew Crawford Offensive Rebound.,36,39,-3,3,0.3842502746657269,0.3842502746657269,Northwestern,Illinois,6,5,NA,300230077,2010-01-23
161,2,19:21,1161,1161,John Shurna missed Three Point Jumper.,36,39,-3,0,0.38407980597633296,0.38407980597633296,Northwestern,Illinois,6,5,NA,300230077,2010-01-23
162,2,19:21,1161,1161,Mike Tisdale Defensive Rebound.,36,39,-3,9,0.38407980597633296,0.38407980597633296,Northwestern,Illinois,6,5,NA,300230077,2010-01-23
163,2,19:12,1152,1152,Dominique Keller made Two Point Layup.  Assisted by Demetri McCamey.,36,41,-5,26,0.31201852204188807,0.31201852204188807,Northwestern,Illinois,6,5,NA,300230077,2010-01-23
164,2,18:46,1126,1126,John Shurna missed Two Point Jumper.,36,41,-5,0,0.3098084302020007,0.3098084302020007,Northwestern,Illinois,6,5,NA,300230077,2010-01-23
165,2,18:46,1126,1126,Dominique Keller Defensive Rebound.,36,41,-5,8,0.3098084302020007,0.3098084302020007,Northwestern,Illinois,6,5,NA,300230077,2010-01-23
166,2,18:38,1118,1118,Demetri McCamey Turnover.,36,41,-5,11,0.309127554596414,0.309127554596414,Northwestern,Illinois,6,5,NA,300230077,2010-01-23
167,2,18:27,1107,1107,Jeremy Nash made Three Point Jumper.  Assisted by Luka Mirkovic.,39,41,-2,20,0.41983636501260124,0.41983636501260124,Northwestern,Illinois,6,5,NA,300230077,2010-01-23
168,2,18:07,1087,1087,Dominique Keller missed Three Point Jumper.,39,41,-2,0,0.41904082814422655,0.41904082814422655,Northwestern,Illinois,6,5,NA,300230077,2010-01-23
