play_id,half,time_remaining_half,secs_remaining,secs_remaining_absolute,description,home_score,away_score,score_diff,play_length,win_prob,naive_win_prob,home,away,home_time_out_remaining,away_time_out_remaining,home_favored_by,game_id,date
179,2,10:18,618,618,Rahmon Fletcher Steal.,58,53,5,13,0.7480175555418114,0.7480175555418114,Green Bay,UIC,6,4,NA,280592739,2008-02-28
180,2,10:05,605,605,Ryan Tillema missed Three Point Jumper.,58,53,5,0,0.750027950115316,0.750027950115316,Green Bay,UIC,6,4,NA,280592739,2008-02-28
181,2,10:05,605,605,Karl White Jr. Defensive Rebound.,58,53,5,17,0.750027950115316,0.750027950115316,Green Bay,UIC,6,4,NA,280592739,2008-02-28
182,2,9:48,588,588,Karl White Jr. missed Two Point Layup.,58,53,5,1,0.7529596654734051,0.7529596654734051,Green Bay,UIC,6,4,NA,280592739,2008-02-28
183,2,9:47,587,587,Illinois-Chicago Offensive Rebou.,58,53,5,11,0.7531445488690564,0.7531445488690564,Green Bay,UIC,6,4,NA,280592739,2008-02-28
184,2,9:36,576,576,Robert Kreps missed Three Point Jumper.,58,53,5,0,0.7552810069202037,0.7552810069202037,Green Bay,UIC,6,4,NA,280592739,2008-02-28
185,2,9:36,576,576,Terry Evans Defensive Rebound.,58,53,5,12,0.7552810069202037,0.7552810069202037,Green Bay,UIC,6,4,NA,280592739,2008-02-28
186,2,9:24,564,564,Foul on Jermaine Dailey,58,53,5,0,0.7578458184072355,0.7578458184072355,Green Bay,UIC,6,4,NA,280592739,2008-02-28
187,2,9:24,564,564,Troy Cotton made Free Throw.,59,53,6,0,0.7972325054141061,0.7972325054141061,Green Bay,UIC,6,4,NA,280592739,2008-02-28
188,2,9:24,564,564,Troy Cotton made Free Throw.,60,53,7,33,0.8316361270988438,0.8316361270988438,Green Bay,UIC,6,4,NA,280592739,2008-02-28
189,2,8:51,531,531,Josh Mayo missed Two Point Layup.,60,53,7,2,0.8397035151614752,0.8397035151614752,Green Bay,UIC,6,4,NA,280592739,2008-02-28
190,2,8:49,529,529,Scott VanderMeer Offensive Rebound.,60,53,7,2,0.8401239770759822,0.8401239770759822,Green Bay,UIC,6,4,NA,280592739,2008-02-28
191,2,8:47,527,527,Scott VanderMeer made Two Point Tip Shot.,60,55,5,16,0.7662585085945398,0.7662585085945398,Green Bay,UIC,6,4,NA,280592739,2008-02-28
192,2,8:31,511,511,Scott VanderMeer Steal.,60,55,5,3,0.7692174065823691,0.7692174065823691,Green Bay,UIC,6,4,NA,280592739,2008-02-28
193,2,8:28,508,508,Karl White Jr. missed Two Point Layup.,60,55,5,0,0.7697489092055502,0.7697489092055502,Green Bay,UIC,6,4,NA,280592739,2008-02-28
194,2,8:28,508,508,Troy Cotton Defensive Rebound.,60,55,5,7,0.7697489092055502,0.7697489092055502,Green Bay,UIC,6,4,NA,280592739,2008-02-28
195,2,8:21,501,501,Mike Schachtner made Two Point Jumper.  Assisted by Troy Cotton.,62,55,7,19,0.8454574753437278,0.8454574753437278,Green Bay,UIC,6,4,NA,280592739,2008-02-28
196,2,8:02,482,482,Spencer Stewart missed Two Point Jumper.,62,55,7,0,0.8490256699117849,0.8490256699117849,Green Bay,UIC,6,4,NA,280592739,2008-02-28
197,2,8:02,482,482,Jermaine Dailey Offensive Rebound.,62,55,7,2,0.8490256699117849,0.8490256699117849,Green Bay,UIC,6,4,NA,280592739,2008-02-28
198,2,8:00,480,480,Jermaine Dailey made Two Point Layup.,62,57,5,9,0.7748273242911953,0.7748273242911953,Green Bay,UIC,6,4,NA,280592739,2008-02-28
199,2,7:51,471,471,D'Angalo Jackson missed Three Point Jumper.,62,57,5,0,0.7766542047022409,0.7766542047022409,Green Bay,UIC,6,4,NA,280592739,2008-02-28
200,2,7:51,471,471,Spencer Stewart Defensive Rebound.,62,57,5,5,0.7766542047022409,0.7766542047022409,Green Bay,UIC,6,4,NA,280592739,2008-02-28
201,2,7:46,466,466,Foul on D'Angalo Jackson,62,57,5,0,0.7777420228596228,0.7777420228596228,Green Bay,UIC,6,4,NA,280592739,2008-02-28
202,2,7:46,466,466,Official TV Timeout.,62,57,5,0,0.7777420228596228,0.7777420228596228,Green Bay,UIC,6,4,NA,280592739,2008-02-28
203,2,7:46,466,466,Karl White Jr. made Free Throw.,62,58,4,0,0.7314604384137452,0.7314604384137452,Green Bay,UIC,6,4,NA,280592739,2008-02-28
204,2,7:46,466,466,Karl White Jr. missed Free Throw.,62,58,4,0,0.7314604384137452,0.7314604384137452,Green Bay,UIC,6,4,NA,280592739,2008-02-28
205,2,7:46,466,466,Terry Evans Defensive Rebound.,62,58,4,23,0.7314604384137452,0.7314604384137452,Green Bay,UIC,6,4,NA,280592739,2008-02-28
206,2,7:23,443,443,Mike Schachtner made Three Point Jumper.,65,58,7,25,0.858390104259,0.858390104259,Green Bay,UIC,6,4,NA,280592739,2008-02-28
207,2,6:58,418,418,Spencer Stewart missed Two Point Jumper.,65,58,7,0,0.8665279897689229,0.8665279897689229,Green Bay,UIC,6,4,NA,280592739,2008-02-28
208,2,6:58,418,418,Ryan Tillema Defensive Rebound.,65,58,7,8,0.8665279897689229,0.8665279897689229,Green Bay,UIC,6,4,NA,280592739,2008-02-28
209,2,6:50,410,410,Mike Schachtner missed Two Point Jumper.,65,58,7,1,0.868961767790064,0.868961767790064,Green Bay,UIC,6,4,NA,280592739,2008-02-28
210,2,6:49,409,409,Scott VanderMeer Defensive Rebound.,65,58,7,28,0.8692576595710232,0.8692576595710232,Green Bay,UIC,6,4,NA,280592739,2008-02-28
211,2,6:21,381,381,Foul on Jermaine Dailey,65,58,7,18,0.8772105046412088,0.8772105046412088,Green Bay,UIC,6,4,NA,280592739,2008-02-28
212,2,6:03,363,363,Ryan Tillema missed Two Point Jumper.,65,58,7,0,0.8824736224829055,0.8824736224829055,Green Bay,UIC,6,4,NA,280592739,2008-02-28
213,2,6:03,363,363,Spencer Stewart Defensive Rebound.,65,58,7,21,0.8824736224829055,0.8824736224829055,Green Bay,UIC,6,4,NA,280592739,2008-02-28
214,2,5:42,342,342,Josh Mayo missed Three Point Jumper.,65,58,7,0,0.8893541426130296,0.8893541426130296,Green Bay,UIC,6,4,NA,280592739,2008-02-28
215,2,5:42,342,342,Jermaine Dailey Offensive Rebound.,65,58,7,30,0.8893541426130296,0.8893541426130296,Green Bay,UIC,6,4,NA,280592739,2008-02-28
216,2,5:12,312,312,Spencer Stewart missed Three Point Jumper.,65,58,7,0,0.9013704887408247,0.9013704887408247,Green Bay,UIC,6,4,NA,280592739,2008-02-28
217,2,5:12,312,312,Scott VanderMeer Offensive Rebound.,65,58,7,4,0.9013704887408247,0.9013704887408247,Green Bay,UIC,6,4,NA,280592739,2008-02-28
218,2,5:08,308,308,Scott VanderMeer missed Two Point Jumper.,65,58,7,0,0.9031372199949226,0.9031372199949226,Green Bay,UIC,6,4,NA,280592739,2008-02-28
219,2,5:08,308,308,Jermaine Dailey Offensive Rebound.,65,58,7,1,0.9031372199949226,0.9031372199949226,Green Bay,UIC,6,4,NA,280592739,2008-02-28
220,2,5:07,307,307,Foul on Terry Evans,65,58,7,0,0.9035251255341156,0.9035251255341156,Green Bay,UIC,6,4,NA,280592739,2008-02-28
221,2,5:07,307,307,Jermaine Dailey made Free Throw.,65,59,6,0,0.8718534524956478,0.8718534524956478,Green Bay,UIC,6,4,NA,280592739,2008-02-28
222,2,5:07,307,307,Jermaine Dailey missed Free Throw.,65,59,6,0,0.8718534524956478,0.8718534524956478,Green Bay,UIC,6,4,NA,280592739,2008-02-28
223,2,5:07,307,307,Randy Berry Defensive Rebound.,65,59,6,17,0.8718534524956478,0.8718534524956478,Green Bay,UIC,6,4,NA,280592739,2008-02-28
224,2,4:50,290,290,Rahmon Fletcher missed Two Point Jumper.,65,59,6,0,0.875325688836894,0.875325688836894,Green Bay,UIC,6,4,NA,280592739,2008-02-28
225,2,4:50,290,290,Randy Berry Offensive Rebound.,65,59,6,39,0.875325688836894,0.875325688836894,Green Bay,UIC,6,4,NA,280592739,2008-02-28
226,2,4:11,251,251,Karl White Jr. missed Two Point Layup.,65,59,6,0,0.8696387628635677,0.8696387628635677,Green Bay,UIC,6,4,NA,280592739,2008-02-28
227,2,4:11,251,251,Karl White Jr. Offensive Rebound.,65,59,6,2,0.8696387628635677,0.8696387628635677,Green Bay,UIC,6,4,NA,280592739,2008-02-28
228,2,4:09,249,249,Karl White Jr. made Two Point Tip Shot.,65,61,4,33,0.779586292879404,0.779586292879404,Green Bay,UIC,6,4,NA,280592739,2008-02-28
229,2,3:36,216,216,Ryan Tillema made Two Point Jumper.  Assisted by D'Angalo Jackson.,67,61,6,10,0.8723737638140947,0.8723737638140947,Green Bay,UIC,6,4,NA,280592739,2008-02-28
230,2,3:26,206,206,Illinois-Chicago 30 Second Timeout.,67,61,6,10,0.8782513084189559,0.8782513084189559,Green Bay,UIC,6,3,NA,280592739,2008-02-28
231,2,3:16,196,196,Foul on Cordero Barkley,67,61,6,0,0.8870325940244305,0.8870325940244305,Green Bay,UIC,6,3,NA,280592739,2008-02-28
232,2,3:16,196,196,Official TV Timeout.,67,61,6,13,0.8870325940244305,0.8870325940244305,Green Bay,UIC,6,3,NA,280592739,2008-02-28
233,2,3:03,183,183,Foul on Josh Mayo,67,61,6,14,0.9017292147404238,0.9017292147404238,Green Bay,UIC,6,3,NA,280592739,2008-02-28
234,2,2:49,169,169,Josh Mayo Steal.,67,61,6,7,0.9165937038619373,0.9165937038619373,Green Bay,UIC,6,3,NA,280592739,2008-02-28
235,2,2:42,162,162,Jovan Ignjatovic missed Two Point Jumper.,67,61,6,0,0.9235495619980796,0.9235495619980796,Green Bay,UIC,6,3,NA,280592739,2008-02-28
236,2,2:42,162,162,Terry Evans Defensive Rebound.,67,61,6,29,0.9235495619980796,0.9235495619980796,Green Bay,UIC,6,3,NA,280592739,2008-02-28
237,2,2:13,133,133,Foul on D'Angalo Jackson,67,61,6,9,0.9498615226481447,0.9498615226481447,Green Bay,UIC,6,3,NA,280592739,2008-02-28
238,2,2:04,124,124,Jermaine Dailey made Two Point Layup.  Assisted by Spencer Stewart.,67,63,4,8,0.8881405407349326,0.8881405407349326,Green Bay,UIC,6,3,NA,280592739,2008-02-28
239,2,1:56,116,116,Wisconsin-Green Bay 30 Second Timeout.,67,63,4,15,0.8984020903732534,0.8984020903732534,Green Bay,UIC,6,2,NA,280592739,2008-02-28
240,2,1:41,101,101,Ryan Tillema made Three Point Jumper.  Assisted by Cordero Barkley.,70,63,7,19,0.9854401022550683,0.9854401022550683,Green Bay,UIC,6,2,NA,280592739,2008-02-28
241,2,1:22,82,82,Josh Mayo missed Three Point Jumper.,70,63,7,0,0.991872300096383,0.991872300096383,Green Bay,UIC,6,2,NA,280592739,2008-02-28
242,2,1:22,82,82,Cordero Barkley Defensive Rebound.,70,63,7,11,0.991872300096383,0.991872300096383,Green Bay,UIC,6,2,NA,280592739,2008-02-28
243,2,1:11,71,71,Wisconsin-Green Bay 30 Second Timeout.,70,63,7,6,0.9943862330099739,0.9943862330099739,Green Bay,UIC,6,1,NA,280592739,2008-02-28
244,2,1:05,65,65,Foul on Spencer Stewart,70,63,7,0,0.9954708939197109,0.9954708939197109,Green Bay,UIC,6,1,NA,280592739,2008-02-28
245,2,1:05,65,65,Terry Evans missed Free Throw.,70,63,7,0,0.9954708939197109,0.9954708939197109,Green Bay,UIC,6,1,NA,280592739,2008-02-28
246,2,1:05,65,65,Karl White Jr. Defensive Rebound.,70,63,7,15,0.9954708939197109,0.9954708939197109,Green Bay,UIC,6,1,NA,280592739,2008-02-28
247,2,0:50,50,50,Foul on Spencer Stewart,70,63,7,0,0.9974301184537856,0.9974301184537856,Green Bay,UIC,6,1,NA,280592739,2008-02-28
248,2,0:50,50,50,D'Angalo Jackson missed Free Throw.,70,63,7,0,0.9974301184537856,0.9974301184537856,Green Bay,UIC,6,1,NA,280592739,2008-02-28
249,2,0:50,50,50,Spencer Stewart Defensive Rebound.,70,63,7,6,0.9974301184537856,0.9974301184537856,Green Bay,UIC,6,1,NA,280592739,2008-02-28
250,2,0:44,44,44,Spencer Stewart made Two Point Layup.,70,65,5,3,0.9882324895102231,0.9882324895102231,Green Bay,UIC,6,1,NA,280592739,2008-02-28
251,2,0:41,41,41,Foul on Jermaine Dailey,70,65,5,0,0.9892205771948825,0.9892205771948825,Green Bay,UIC,6,1,NA,280592739,2008-02-28
252,2,0:41,41,41,Ryan Tillema missed Free Throw.,70,65,5,0,0.9892205771948825,0.9892205771948825,Green Bay,UIC,6,1,NA,280592739,2008-02-28
253,2,0:41,41,41,Jermaine Dailey Defensive Rebound.,70,65,5,7,0.9892205771948825,0.9892205771948825,Green Bay,UIC,6,1,NA,280592739,2008-02-28
254,2,0:34,34,34,Spencer Stewart made Three Point Jumper.,70,68,2,0,0.869075491061388,0.869075491061388,Green Bay,UIC,6,1,NA,280592739,2008-02-28
255,2,0:34,34,34,Illinois-Chicago 30 Second Timeout.,70,68,2,7,0.869075491061388,0.869075491061388,Green Bay,UIC,6,0,NA,280592739,2008-02-28
256,2,0:27,27,27,Wisconsin-Green Bay 30 Second Timeout.,70,68,2,3,0.8787547382590568,0.8787547382590568,Green Bay,UIC,6,-1,NA,280592739,2008-02-28
257,2,0:24,24,24,Foul on Karl White Jr.,70,68,2,0,0.8827846648962041,0.8827846648962041,Green Bay,UIC,6,-1,NA,280592739,2008-02-28
258,2,0:24,24,24,Mike Schachtner missed Free Throw.,70,68,2,0,0.8827846648962041,0.8827846648962041,Green Bay,UIC,6,-1,NA,280592739,2008-02-28
259,2,0:24,24,24,null,70,68,2,0,0.8827846648962041,0.8827846648962041,Green Bay,UIC,6,-1,NA,280592739,2008-02-28
260,2,0:24,24,24,Mike Schachtner made Free Throw.,71,68,3,6,0.9538497102658992,0.9538497102658992,Green Bay,UIC,6,-1,NA,280592739,2008-02-28
261,2,0:18,18,18,Karl White Jr. made Two Point Jumper.,71,70,1,0,0.7405599445514794,0.7405599445514794,Green Bay,UIC,6,-1,NA,280592739,2008-02-28
262,2,0:18,18,18,Illinois-Chicago Full Timeout.,71,70,1,4,0.7405599445514794,0.7405599445514794,Green Bay,UIC,6,-2,NA,280592739,2008-02-28
263,2,0:14,14,14,Foul on Spencer Stewart,71,70,1,0,0.7457533168601033,0.7457533168601033,Green Bay,UIC,6,-2,NA,280592739,2008-02-28
264,2,0:14,14,14,Mike Schachtner made Free Throw.,72,70,2,0,0.8958722919593005,0.8958722919593005,Green Bay,UIC,6,-2,NA,280592739,2008-02-28
265,2,0:14,14,14,Mike Schachtner made Free Throw.,73,70,3,5,0.9618843639125265,0.9618843639125265,Green Bay,UIC,6,-2,NA,280592739,2008-02-28
266,2,0:09,9,9,Karl White Jr. made Three Point Jumper.,73,73,0,0,0.5,0.5,Green Bay,UIC,6,-2,NA,280592739,2008-02-28
267,2,0:09,9,9,Wisconsin-Green Bay Full Timeout.,73,73,0,6,0.5,0.5,Green Bay,UIC,6,-3,NA,280592739,2008-02-28
268,2,0:03,3,3,Troy Cotton made Three Point Jumper.  Assisted by Rahmon Fletcher.,76,73,3,3,0.9695991517630681,0.9695991517630681,Green Bay,UIC,6,-3,NA,280592739,2008-02-28
269,2,0:00,0,0,Josh Mayo missed Three Point Jumper.,76,73,3,0,1,1,Green Bay,UIC,6,-3,NA,280592739,2008-02-28
270,2,0:00,0,0,null,76,73,3,0,1,1,Green Bay,UIC,6,-3,NA,280592739,2008-02-28
271,2,0:00,0,0,End Game,76,73,3,0,1,1,Green Bay,UIC,6,-3,NA,280592739,2008-02-28
