play_id,half,time_remaining_half,secs_remaining,secs_remaining_absolute,description,home_score,away_score,score_diff,play_length,win_prob,naive_win_prob,home,away,home_time_out_remaining,away_time_out_remaining,home_favored_by,game_id,date
1,1,20:00,2400,2400,PLAY,0,0,0,19,0.5,0.5,Green Bay,UIC,6,6,NA,280592739,2008-02-28
2,1,19:41,2381,2381,Scott VanderMeer missed Two Point Layup.,0,0,0,0,0.5,0.5,Green Bay,UIC,6,6,NA,280592739,2008-02-28
3,1,19:41,2381,2381,Scott VanderMeer Offensive Rebound.,0,0,0,3,0.5,0.5,Green Bay,UIC,6,6,NA,280592739,2008-02-28
4,1,19:38,2378,2378,Scott VanderMeer made Two Point Jumper.,0,2,-2,18,0.4555097359296437,0.4555097359296437,Green Bay,UIC,6,6,NA,280592739,2008-02-28
5,1,19:20,2360,2360,Ryan Tillema made Three Point Jumper.  Assisted by D'Angalo Jackson.,3,2,1,18,0.5224829067768547,0.5224829067768547,Green Bay,UIC,6,6,NA,280592739,2008-02-28
6,1,19:02,2342,2342,Josh Mayo missed Two Point Jumper.,3,2,1,0,0.5226786784543114,0.5226786784543114,Green Bay,UIC,6,6,NA,280592739,2008-02-28
7,1,19:02,2342,2342,D'Angalo Jackson Defensive Rebound.,3,2,1,9,0.5226786784543114,0.5226786784543114,Green Bay,UIC,6,6,NA,280592739,2008-02-28
8,1,18:53,2333,2333,Robert Bush Steal.,3,2,1,2,0.522777342670492,0.522777342670492,Green Bay,UIC,6,6,NA,280592739,2008-02-28
9,1,18:51,2331,2331,Josh Mayo missed Three Point Jumper.,3,2,1,0,0.5227993357199084,0.5227993357199084,Green Bay,UIC,6,6,NA,280592739,2008-02-28
10,1,18:51,2331,2331,Jermaine Dailey Offensive Rebound.,3,2,1,22,0.5227993357199084,0.5227993357199084,Green Bay,UIC,6,6,NA,280592739,2008-02-28
11,1,18:29,2309,2309,Josh Mayo missed Two Point Jumper.,3,2,1,0,0.5230428067692577,0.5230428067692577,Green Bay,UIC,6,6,NA,280592739,2008-02-28
12,1,18:29,2309,2309,Terry Evans Defensive Rebound.,3,2,1,16,0.5230428067692577,0.5230428067692577,Green Bay,UIC,6,6,NA,280592739,2008-02-28
13,1,18:13,2293,2293,D'Angalo Jackson missed Two Point Jumper.,3,2,1,0,0.5232215517927618,0.5232215517927618,Green Bay,UIC,6,6,NA,280592739,2008-02-28
14,1,18:13,2293,2293,Jermaine Dailey Defensive Rebound.,3,2,1,13,0.5232215517927618,0.5232215517927618,Green Bay,UIC,6,6,NA,280592739,2008-02-28
15,1,18:00,2280,2280,Scott VanderMeer missed Two Point Jumper.,3,2,1,0,0.5233677364068907,0.5233677364068907,Green Bay,UIC,6,6,NA,280592739,2008-02-28
16,1,18:00,2280,2280,Ryan Tillema Defensive Rebound.,3,2,1,8,0.5233677364068907,0.5233677364068907,Green Bay,UIC,6,6,NA,280592739,2008-02-28
17,1,17:52,2272,2272,D'Angalo Jackson missed Two Point Layup.,3,2,1,1,0.5234580941259385,0.5234580941259385,Green Bay,UIC,6,6,NA,280592739,2008-02-28
18,1,17:51,2271,2271,Rahmon Fletcher Offensive Rebound.,3,2,1,3,0.5234694092905685,0.5234694092905685,Green Bay,UIC,6,6,NA,280592739,2008-02-28
19,1,17:48,2268,2268,Mike Schachtner missed Three Point Jumper.,3,2,1,0,0.523503381418564,0.523503381418564,Green Bay,UIC,6,6,NA,280592739,2008-02-28
20,1,17:48,2268,2268,Ryan Tillema Offensive Rebound.,3,2,1,20,0.523503381418564,0.523503381418564,Green Bay,UIC,6,6,NA,280592739,2008-02-28
21,1,17:28,2248,2248,Josh Mayo Steal.,3,2,1,4,0.5237308347779365,0.5237308347779365,Green Bay,UIC,6,6,NA,280592739,2008-02-28
22,1,17:24,2244,2244,Robert Bush made Three Point Jumper.  Assisted by Josh Mayo.,3,5,-2,9,0.4525542545819073,0.4525542545819073,Green Bay,UIC,6,6,NA,280592739,2008-02-28
23,1,17:15,2235,2235,Ryan Tillema made Two Point Jumper.  Assisted by Rahmon Fletcher.,5,5,0,12,0.5,0.5,Green Bay,UIC,6,6,NA,280592739,2008-02-28
24,1,17:03,2223,2223,Jermaine Dailey made Two Point Dunk Shot.  Assisted by Spencer Stewart.,5,7,-2,23,0.45207599041727337,0.45207599041727337,Green Bay,UIC,6,6,NA,280592739,2008-02-28
25,1,16:40,2200,2200,Robert Bush Steal.,5,7,-2,5,0.4515490631345577,0.4515490631345577,Green Bay,UIC,6,6,NA,280592739,2008-02-28
26,1,16:35,2195,2195,Josh Mayo made Two Point Layup.  Assisted by Robert Bush.,5,9,-4,0,0.40377611680144293,0.40377611680144293,Green Bay,UIC,6,6,NA,280592739,2008-02-28
27,1,16:35,2195,2195,Foul on Terry Evans,5,9,-4,0,0.40377611680144293,0.40377611680144293,Green Bay,UIC,6,6,NA,280592739,2008-02-28
28,1,16:35,2195,2195,Josh Mayo made Free Throw.,5,10,-5,13,0.38055467009761923,0.38055467009761923,Green Bay,UIC,6,6,NA,280592739,2008-02-28
29,1,16:22,2182,2182,Mike Schachtner missed Two Point Jumper.,5,10,-5,1,0.379842549881732,0.379842549881732,Green Bay,UIC,6,6,NA,280592739,2008-02-28
30,1,16:21,2181,2181,Jermaine Dailey Defensive Rebound.,5,10,-5,6,0.37978771858620874,0.37978771858620874,Green Bay,UIC,6,6,NA,280592739,2008-02-28
31,1,16:15,2175,2175,Rahmon Fletcher Steal.,5,10,-5,3,0.37945859016136585,0.37945859016136585,Green Bay,UIC,6,6,NA,280592739,2008-02-28
32,1,16:12,2172,2172,Rahmon Fletcher made Two Point Layup.,7,10,-3,14,0.4266511374356508,0.4266511374356508,Green Bay,UIC,6,6,NA,280592739,2008-02-28
33,1,15:58,2158,2158,Mike Schachtner Steal.,7,10,-3,5,0.42617116882724937,0.42617116882724937,Green Bay,UIC,6,6,NA,280592739,2008-02-28
34,1,15:53,2153,2153,Scott VanderMeer Steal.,7,10,-3,14,0.4259992452426769,0.4259992452426769,Green Bay,UIC,6,6,NA,280592739,2008-02-28
35,1,15:39,2139,2139,Scott VanderMeer made Two Point Dunk Shot.  Assisted by Spencer Stewart.,7,12,-5,25,0.3774747801645104,0.3774747801645104,Green Bay,UIC,6,6,NA,280592739,2008-02-28
36,1,15:14,2114,2114,Rahmon Fletcher made Three Point Jumper.  Assisted by Troy Cotton.,10,12,-2,12,0.449552141969799,0.449552141969799,Green Bay,UIC,6,6,NA,280592739,2008-02-28
37,1,15:02,2102,2102,Jermaine Dailey made Two Point Dunk Shot.  Assisted by Scott VanderMeer.,10,14,-4,11,0.39957152585317496,0.39957152585317496,Green Bay,UIC,6,6,NA,280592739,2008-02-28
38,1,14:51,2091,2091,Ryan Tillema made Three Point Jumper.  Assisted by Rahmon Fletcher.,13,14,-1,20,0.4744373193566554,0.4744373193566554,Green Bay,UIC,6,6,NA,280592739,2008-02-28
39,1,14:31,2071,2071,Josh Mayo made Three Point Jumper.  Assisted by Spencer Stewart.,13,17,-4,8,0.3981402716044274,0.3981402716044274,Green Bay,UIC,6,6,NA,280592739,2008-02-28
40,1,14:23,2063,2063,Ryan Tillema made Three Point Jumper.  Assisted by Rahmon Fletcher.,16,17,-1,25,0.4740998438623287,0.4740998438623287,Green Bay,UIC,6,6,NA,280592739,2008-02-28
41,1,13:58,2038,2038,Jermaine Dailey made Two Point Layup.  Assisted by Scott VanderMeer.,16,19,-3,16,0.42195575292330906,0.42195575292330906,Green Bay,UIC,6,6,NA,280592739,2008-02-28
42,1,13:42,2022,2022,Ryan Tillema made Three Point Jumper.  Assisted by Rahmon Fletcher.,19,19,0,22,0.5,0.5,Green Bay,UIC,6,6,NA,280592739,2008-02-28
43,1,13:20,2000,2000,Scott VanderMeer missed Two Point Jumper.,19,19,0,0,0.5,0.5,Green Bay,UIC,6,6,NA,280592739,2008-02-28
44,1,13:20,2000,2000,Ryan Tillema Defensive Rebound.,19,19,0,8,0.5,0.5,Green Bay,UIC,6,6,NA,280592739,2008-02-28
45,1,13:12,1992,1992,Troy Cotton missed Three Point Jumper.,19,19,0,0,0.5,0.5,Green Bay,UIC,6,6,NA,280592739,2008-02-28
46,1,13:12,1992,1992,Jermaine Dailey Defensive Rebound.,19,19,0,23,0.5,0.5,Green Bay,UIC,6,6,NA,280592739,2008-02-28
47,1,12:49,1969,1969,Official TV Timeout.,19,19,0,2,0.5,0.5,Green Bay,UIC,6,6,NA,280592739,2008-02-28
48,1,12:47,1967,1967,Karl White Jr. missed Two Point Layup.,19,19,0,0,0.5,0.5,Green Bay,UIC,6,6,NA,280592739,2008-02-28
49,1,12:47,1967,1967,Troy Cotton Defensive Rebound.,19,19,0,34,0.5,0.5,Green Bay,UIC,6,6,NA,280592739,2008-02-28
50,1,12:13,1933,1933,Foul on Jeremy Buttell,19,19,0,19,0.5,0.5,Green Bay,UIC,6,6,NA,280592739,2008-02-28
51,1,11:54,1914,1914,Foul on Spencer Stewart,19,19,0,0,0.5,0.5,Green Bay,UIC,6,6,NA,280592739,2008-02-28
52,1,11:54,1914,1914,Official TV Timeout.,19,19,0,0,0.5,0.5,Green Bay,UIC,6,6,NA,280592739,2008-02-28
53,1,11:54,1914,1914,Troy Cotton made Free Throw.,20,19,1,0,0.5277767725413577,0.5277767725413577,Green Bay,UIC,6,6,NA,280592739,2008-02-28
54,1,11:54,1914,1914,Troy Cotton made Free Throw.,21,19,2,21,0.5553826234312512,0.5553826234312512,Green Bay,UIC,6,6,NA,280592739,2008-02-28
55,1,11:33,1893,1893,Foul on Robert Kreps,21,19,2,19,0.5559224379567264,0.5559224379567264,Green Bay,UIC,6,6,NA,280592739,2008-02-28
56,1,11:14,1874,1874,D'Angalo Jackson made Two Point Layup.,23,19,4,19,0.6114037420503021,0.6114037420503021,Green Bay,UIC,6,6,NA,280592739,2008-02-28
57,1,10:55,1855,1855,Spencer Stewart missed Three Point Jumper.,23,19,4,0,0.6123459826550677,0.6123459826550677,Green Bay,UIC,6,6,NA,280592739,2008-02-28
58,1,10:55,1855,1855,Jeremy Buttell Offensive Rebound.,23,19,4,33,0.6123459826550677,0.6123459826550677,Green Bay,UIC,6,6,NA,280592739,2008-02-28
59,1,10:22,1822,1822,Robert Kreps made Three Point Jumper.  Assisted by Karl White Jr..,23,22,1,14,0.5289752839222898,0.5289752839222898,Green Bay,UIC,6,6,NA,280592739,2008-02-28
60,1,10:08,1808,1808,Foul on Bryquis Perine,23,22,1,37,0.529160424519145,0.529160424519145,Green Bay,UIC,6,6,NA,280592739,2008-02-28
61,1,9:31,1771,1771,Rahmon Fletcher missed Two Point Layup.,23,22,1,0,0.5296567216656624,0.5296567216656624,Green Bay,UIC,6,6,NA,280592739,2008-02-28
62,1,9:31,1771,1771,Illinois-Chicago Defensive Rebou.,23,22,1,16,0.5296567216656624,0.5296567216656624,Green Bay,UIC,6,6,NA,280592739,2008-02-28
63,1,9:15,1755,1755,Josh Mayo missed Two Point Jumper.,23,22,1,0,0.5298752153615465,0.5298752153615465,Green Bay,UIC,6,6,NA,280592739,2008-02-28
64,1,9:15,1755,1755,Illinois-Chicago Offensive Rebou.,23,22,1,10,0.5298752153615465,0.5298752153615465,Green Bay,UIC,6,6,NA,280592739,2008-02-28
65,1,9:05,1745,1745,Jovan Ignjatovic missed Two Point Layup.,23,22,1,0,0.5300131747966011,0.5300131747966011,Green Bay,UIC,6,6,NA,280592739,2008-02-28
66,1,9:05,1745,1745,D'Angalo Jackson Defensive Rebound.,23,22,1,8,0.5300131747966011,0.5300131747966011,Green Bay,UIC,6,6,NA,280592739,2008-02-28
67,1,8:57,1737,1737,D'Angalo Jackson missed Two Point Layup.,23,22,1,0,0.5301243814583058,0.5301243814583058,Green Bay,UIC,6,6,NA,280592739,2008-02-28
68,1,8:57,1737,1737,Rahmon Fletcher Offensive Rebound.,23,22,1,2,0.5301243814583058,0.5301243814583058,Green Bay,UIC,6,6,NA,280592739,2008-02-28
69,1,8:55,1735,1735,Ryan Tillema missed Three Point Jumper.,23,22,1,0,0.53015230483358,0.53015230483358,Green Bay,UIC,6,6,NA,280592739,2008-02-28
70,1,8:55,1735,1735,Jeremy Buttell Defensive Rebound.,23,22,1,6,0.53015230483358,0.53015230483358,Green Bay,UIC,6,6,NA,280592739,2008-02-28
71,1,8:49,1729,1729,Karl White Jr. missed Two Point Layup.,23,22,1,1,0.5302363769812525,0.5302363769812525,Green Bay,UIC,6,6,NA,280592739,2008-02-28
72,1,8:48,1728,1728,Rahmon Fletcher Defensive Rebound.,23,22,1,4,0.5302504338642642,0.5302504338642642,Green Bay,UIC,6,6,NA,280592739,2008-02-28
73,1,8:44,1724,1724,Terry Evans made Two Point Layup.  Assisted by Rahmon Fletcher.,25,22,3,0,0.5900393094999604,0.5900393094999604,Green Bay,UIC,6,6,NA,280592739,2008-02-28
74,1,8:44,1724,1724,Foul on Robert Kreps,25,22,3,0,0.5900393094999604,0.5900393094999604,Green Bay,UIC,6,6,NA,280592739,2008-02-28
75,1,8:44,1724,1724,Terry Evans made Free Throw.,26,22,4,17,0.6190466822901606,0.6190466822901606,Green Bay,UIC,6,6,NA,280592739,2008-02-28
76,1,8:27,1707,1707,Jovan Ignjatovic missed Two Point Layup.,26,22,4,0,0.6199626397229718,0.6199626397229718,Green Bay,UIC,6,6,NA,280592739,2008-02-28
77,1,8:27,1707,1707,Jeremy Buttell Offensive Rebound.,26,22,4,2,0.6199626397229718,0.6199626397229718,Green Bay,UIC,6,6,NA,280592739,2008-02-28
78,1,8:25,1705,1705,Jeremy Buttell made Two Point Layup.,26,24,2,25,0.5609271234687757,0.5609271234687757,Green Bay,UIC,6,6,NA,280592739,2008-02-28
79,1,8:00,1680,1680,Josh Mayo Steal.,26,24,2,2,0.5616438491209147,0.5616438491209147,Green Bay,UIC,6,6,NA,280592739,2008-02-28
80,1,7:58,1678,1678,Karl White Jr. made Two Point Layup.  Assisted by Spencer Stewart.,26,26,0,19,0.5,0.5,Green Bay,UIC,6,6,NA,280592739,2008-02-28
81,1,7:39,1659,1659,Ryan Tillema missed Three Point Jumper.,26,26,0,0,0.5,0.5,Green Bay,UIC,6,6,NA,280592739,2008-02-28
82,1,7:39,1659,1659,Jovan Ignjatovic Defensive Rebound.,26,26,0,27,0.5,0.5,Green Bay,UIC,6,6,NA,280592739,2008-02-28
83,1,7:12,1632,1632,Spencer Stewart made Two Point Jumper.,26,28,-2,10,0.4370291324690872,0.4370291324690872,Green Bay,UIC,6,6,NA,280592739,2008-02-28
84,1,7:02,1622,1622,Terry Evans missed Two Point Layup.,26,28,-2,1,0.4367593219887009,0.4367593219887009,Green Bay,UIC,6,6,NA,280592739,2008-02-28
85,1,7:01,1621,1621,Josh Mayo Defensive Rebound.,26,28,-2,7,0.4367324083189744,0.4367324083189744,Green Bay,UIC,6,6,NA,280592739,2008-02-28
86,1,6:54,1614,1614,Josh Mayo made Two Point Layup.,26,30,-4,39,0.37510022972494195,0.37510022972494195,Green Bay,UIC,6,6,NA,280592739,2008-02-28
87,1,6:15,1575,1575,Terry Evans missed Two Point Layup.,26,30,-4,0,0.3731048494396937,0.3731048494396937,Green Bay,UIC,6,6,NA,280592739,2008-02-28
88,1,6:15,1575,1575,Jeremy Buttell Defensive Rebound.,26,30,-4,14,0.3731048494396937,0.3731048494396937,Green Bay,UIC,6,6,NA,280592739,2008-02-28
89,1,6:01,1561,1561,Foul on Rahmon Fletcher,26,30,-4,0,0.3723820427110241,0.3723820427110241,Green Bay,UIC,6,6,NA,280592739,2008-02-28
90,1,6:01,1561,1561,Official TV Timeout.,26,30,-4,11,0.3723820427110241,0.3723820427110241,Green Bay,UIC,6,6,NA,280592739,2008-02-28
91,1,5:50,1550,1550,Spencer Stewart missed Three Point Jumper.,26,30,-4,0,0.37180869869593247,0.37180869869593247,Green Bay,UIC,6,6,NA,280592739,2008-02-28
92,1,5:50,1550,1550,Troy Cotton Defensive Rebound.,26,30,-4,22,0.37180869869593247,0.37180869869593247,Green Bay,UIC,6,6,NA,280592739,2008-02-28
93,1,5:28,1528,1528,Karl White Jr. Steal.,26,30,-4,15,0.3706418854156987,0.3706418854156987,Green Bay,UIC,6,6,NA,280592739,2008-02-28
94,1,5:13,1513,1513,Foul on Ryan Tillema,26,30,-4,0,0.36982643173143404,0.36982643173143404,Green Bay,UIC,6,6,NA,280592739,2008-02-28
95,1,5:13,1513,1513,Jermaine Dailey made Free Throw.,26,31,-5,0,0.3393478270504655,0.3393478270504655,Green Bay,UIC,6,6,NA,280592739,2008-02-28
96,1,5:13,1513,1513,Jermaine Dailey missed Free Throw.,26,31,-5,0,0.3393478270504655,0.3393478270504655,Green Bay,UIC,6,6,NA,280592739,2008-02-28
97,1,5:13,1513,1513,Ryan Tillema Defensive Rebound.,26,31,-5,8,0.3393478270504655,0.3393478270504655,Green Bay,UIC,6,6,NA,280592739,2008-02-28
98,1,5:05,1505,1505,Troy Cotton made Two Point Jumper.,28,31,-3,26,0.4010368415168001,0.4010368415168001,Green Bay,UIC,6,6,NA,280592739,2008-02-28
99,1,4:39,1479,1479,Karl White Jr. missed Three Point Jumper.,28,31,-3,0,0.39988783633252234,0.39988783633252234,Green Bay,UIC,6,6,NA,280592739,2008-02-28
100,1,4:39,1479,1479,Mike Schachtner Defensive Rebound.,28,31,-3,10,0.39988783633252234,0.39988783633252234,Green Bay,UIC,6,6,NA,280592739,2008-02-28
101,1,4:29,1469,1469,Rahmon Fletcher missed Two Point Jumper.,28,31,-3,0,0.3994292351256575,0.3994292351256575,Green Bay,UIC,6,6,NA,280592739,2008-02-28
102,1,4:29,1469,1469,Jermaine Dailey Defensive Rebound.,28,31,-3,31,0.3994292351256575,0.3994292351256575,Green Bay,UIC,6,6,NA,280592739,2008-02-28
103,1,3:58,1438,1438,D'Angalo Jackson missed Two Point Jumper.,28,31,-3,0,0.3979543337328069,0.3979543337328069,Green Bay,UIC,6,6,NA,280592739,2008-02-28
104,1,3:58,1438,1438,Jermaine Dailey Defensive Rebound.,28,31,-3,20,0.3979543337328069,0.3979543337328069,Green Bay,UIC,6,6,NA,280592739,2008-02-28
105,1,3:38,1418,1418,Scott VanderMeer missed Two Point Layup.,28,31,-3,0,0.3970277683000566,0.3970277683000566,Green Bay,UIC,6,6,NA,280592739,2008-02-28
106,1,3:38,1418,1418,Jermaine Dailey Offensive Rebound.,28,31,-3,2,0.3970277683000566,0.3970277683000566,Green Bay,UIC,6,6,NA,280592739,2008-02-28
107,1,3:36,1416,1416,Jermaine Dailey made Two Point Tip Shot.,28,33,-5,13,0.33246114014073375,0.33246114014073375,Green Bay,UIC,6,6,NA,280592739,2008-02-28
108,1,3:23,1403,1403,Official TV Timeout.,28,33,-5,34,0.33155754688670597,0.33155754688670597,Green Bay,UIC,6,6,NA,280592739,2008-02-28
109,1,2:49,1369,1369,Spencer Stewart missed Three Point Jumper.,28,33,-5,0,0.3292456102381068,0.3292456102381068,Green Bay,UIC,6,6,NA,280592739,2008-02-28
110,1,2:49,1369,1369,D'Angalo Jackson Defensive Rebound.,28,33,-5,9,0.3292456102381068,0.3292456102381068,Green Bay,UIC,6,6,NA,280592739,2008-02-28
111,1,2:40,1360,1360,Mike Schachtner missed Three Point Jumper.,28,33,-5,0,0.3286381546081323,0.3286381546081323,Green Bay,UIC,6,6,NA,280592739,2008-02-28
112,1,2:40,1360,1360,Illinois-Chicago Defensive Rebou.,28,33,-5,15,0.3286381546081323,0.3286381546081323,Green Bay,UIC,6,6,NA,280592739,2008-02-28
113,1,2:25,1345,1345,Josh Mayo made Two Point Jumper.,28,35,-7,33,0.2676571734089132,0.2676571734089132,Green Bay,UIC,6,6,NA,280592739,2008-02-28
114,1,1:52,1312,1312,Jermaine Dailey Steal.,28,35,-7,8,0.26481919616351574,0.26481919616351574,Green Bay,UIC,6,6,NA,280592739,2008-02-28
115,1,1:44,1304,1304,Illinois-Chicago 30 Second Timeout.,28,35,-7,7,0.26411237623759054,0.26411237623759054,Green Bay,UIC,6,5,NA,280592739,2008-02-28
116,1,1:37,1297,1297,Robert Bush missed Three Point Jumper.,28,35,-7,0,0.26348571018667316,0.26348571018667316,Green Bay,UIC,6,5,NA,280592739,2008-02-28
117,1,1:37,1297,1297,D'Angalo Jackson Defensive Rebound.,28,35,-7,15,0.26348571018667316,0.26348571018667316,Green Bay,UIC,6,5,NA,280592739,2008-02-28
118,1,1:22,1282,1282,D'Angalo Jackson made Three Point Jumper.,31,35,-4,31,0.35630509946474964,0.35630509946474964,Green Bay,UIC,6,5,NA,280592739,2008-02-28
119,1,0:51,1251,1251,Josh Mayo missed Three Point Jumper.,31,35,-4,0,0.35426851191667724,0.35426851191667724,Green Bay,UIC,6,5,NA,280592739,2008-02-28
120,1,0:51,1251,1251,Terry Evans Defensive Rebound.,31,35,-4,10,0.35426851191667724,0.35426851191667724,Green Bay,UIC,6,5,NA,280592739,2008-02-28
121,1,0:41,1241,1241,Terry Evans made Two Point Dunk Shot.,33,35,-2,35,0.4251447437343249,0.4251447437343249,Green Bay,UIC,6,5,NA,280592739,2008-02-28
122,1,0:06,1206,1206,Foul on D'Angalo Jackson,33,35,-2,2,0.4237395951292993,0.4237395951292993,Green Bay,UIC,6,5,NA,280592739,2008-02-28
123,1,0:04,1204,1204,Foul on Ryan Tillema,33,35,-2,1,0.4236562704258714,0.4236562704258714,Green Bay,UIC,6,5,NA,280592739,2008-02-28
124,1,0:03,1203,1203,Josh Mayo made Three Point Jumper.  Assisted by Scott VanderMeer.,33,38,-5,3,0.3165051325909943,0.3165051325909943,Green Bay,UIC,6,5,NA,280592739,2008-02-28
125,1,0:00,1200,1200,End of the 1st Half.,33,38,-5,0,0.3162303721963287,0.3162303721963287,Green Bay,UIC,6,5,NA,280592739,2008-02-28
126,2,20:00,1200,1200,PLAY,33,38,-5,9,0.3162303721963287,0.3162303721963287,Green Bay,UIC,6,5,NA,280592739,2008-02-28
127,2,19:51,1191,1191,Rahmon Fletcher missed Two Point Layup.,33,38,-5,0,0.3154163339380173,0.3154163339380173,Green Bay,UIC,6,5,NA,280592739,2008-02-28
128,2,19:51,1191,1191,Randy Berry Offensive Rebound.,33,38,-5,16,0.3154163339380173,0.3154163339380173,Green Bay,UIC,6,5,NA,280592739,2008-02-28
129,2,19:35,1175,1175,Ryan Tillema made Three Point Jumper.,36,38,-2,33,0.42248239486955,0.42248239486955,Green Bay,UIC,6,5,NA,280592739,2008-02-28
130,2,19:02,1142,1142,Scott VanderMeer made Two Point Jumper.,36,40,-4,14,0.3462113184769104,0.3462113184769104,Green Bay,UIC,6,5,NA,280592739,2008-02-28
131,2,18:48,1128,1128,Randy Berry made Two Point Jumper.  Assisted by Rahmon Fletcher.,38,40,-2,24,0.42065425313375693,0.42065425313375693,Green Bay,UIC,6,5,NA,280592739,2008-02-28
132,2,18:24,1104,1104,Josh Mayo made Three Point Jumper.  Assisted by Robert Bush.,38,43,-5,20,0.3079279215917185,0.3079279215917185,Green Bay,UIC,6,5,NA,280592739,2008-02-28
133,2,18:04,1084,1084,Rahmon Fletcher missed Three Point Jumper.,38,43,-5,0,0.3061826274792827,0.3061826274792827,Green Bay,UIC,6,5,NA,280592739,2008-02-28
134,2,18:04,1084,1084,Ryan Tillema Offensive Rebound.,38,43,-5,4,0.3061826274792827,0.3061826274792827,Green Bay,UIC,6,5,NA,280592739,2008-02-28
135,2,18:00,1080,1080,Ryan Tillema made Two Point Jumper.,40,43,-3,14,0.37946494376219425,0.37946494376219425,Green Bay,UIC,6,5,NA,280592739,2008-02-28
136,2,17:46,1066,1066,Robert Bush made Three Point Jumper.  Assisted by Josh Mayo.,40,46,-6,11,0.27075544438826943,0.27075544438826943,Green Bay,UIC,6,5,NA,280592739,2008-02-28
137,2,17:35,1055,1055,Ryan Tillema made Three Point Jumper.  Assisted by Rahmon Fletcher.,43,46,-3,64,0.3779432162154039,0.3779432162154039,Green Bay,UIC,6,5,NA,280592739,2008-02-28
138,2,16:31,991,991,Mike Schachtner missed Two Point Jumper.,43,46,-3,1,0.3735313187452203,0.3735313187452203,Green Bay,UIC,6,5,NA,280592739,2008-02-28
139,2,16:30,990,990,Scott VanderMeer Defensive Rebound.,43,46,-3,3,0.37345466297098745,0.37345466297098745,Green Bay,UIC,6,5,NA,280592739,2008-02-28
140,2,16:27,987,987,Terry Evans Steal.,43,46,-3,12,0.3732230178718783,0.3732230178718783,Green Bay,UIC,6,5,NA,280592739,2008-02-28
141,2,16:15,975,975,Foul on Scott VanderMeer,43,46,-3,0,0.3722703881371238,0.3722703881371238,Green Bay,UIC,6,5,NA,280592739,2008-02-28
142,2,16:15,975,975,Terry Evans made Free Throw.,44,46,-2,0,0.4137884076695332,0.4137884076695332,Green Bay,UIC,6,5,NA,280592739,2008-02-28
143,2,16:15,975,975,Terry Evans made Free Throw.,45,46,-1,18,0.45656896984746737,0.45656896984746737,Green Bay,UIC,6,5,NA,280592739,2008-02-28
144,2,15:57,957,957,Spencer Stewart missed Three Point Jumper.,45,46,-1,0,0.4560572126441647,0.4560572126441647,Green Bay,UIC,6,5,NA,280592739,2008-02-28
145,2,15:57,957,957,Terry Evans Defensive Rebound.,45,46,-1,10,0.4560572126441647,0.4560572126441647,Green Bay,UIC,6,5,NA,280592739,2008-02-28
146,2,15:47,947,947,Official TV Timeout.,45,46,-1,46,0.45579251511888463,0.45579251511888463,Green Bay,UIC,6,5,NA,280592739,2008-02-28
147,2,15:01,901,901,Terry Evans made Two Point Jumper.,47,46,1,13,0.5452894726886692,0.5452894726886692,Green Bay,UIC,6,5,NA,280592739,2008-02-28
148,2,14:48,888,888,Karl White Jr. made Two Point Jumper.,47,48,-1,13,0.45442753678013637,0.45442753678013637,Green Bay,UIC,6,5,NA,280592739,2008-02-28
149,2,14:35,875,875,Ryan Tillema missed Three Point Jumper.,47,48,-1,0,0.45414650486735314,0.45414650486735314,Green Bay,UIC,6,5,NA,280592739,2008-02-28
150,2,14:35,875,875,Jeremy Buttell Defensive Rebound.,47,48,-1,19,0.45414650486735314,0.45414650486735314,Green Bay,UIC,6,5,NA,280592739,2008-02-28
151,2,14:16,856,856,Foul on D'Angalo Jackson,47,48,-1,0,0.45373020748758297,0.45373020748758297,Green Bay,UIC,6,5,NA,280592739,2008-02-28
152,2,14:16,856,856,Josh Mayo made Free Throw.,47,49,-2,0,0.4082461558821419,0.4082461558821419,Green Bay,UIC,6,5,NA,280592739,2008-02-28
153,2,14:16,856,856,Josh Mayo made Free Throw.,47,50,-3,12,0.3642811043757061,0.3642811043757061,Green Bay,UIC,6,5,NA,280592739,2008-02-28
154,2,14:04,844,844,Troy Cotton made Three Point Jumper.  Assisted by D'Angalo Jackson.,50,50,0,26,0.5,0.5,Green Bay,UIC,6,5,NA,280592739,2008-02-28
155,2,13:38,818,818,Scott VanderMeer missed Two Point Jumper.,50,50,0,0,0.5,0.5,Green Bay,UIC,6,5,NA,280592739,2008-02-28
156,2,13:38,818,818,Ryan Tillema Defensive Rebound.,50,50,0,7,0.5,0.5,Green Bay,UIC,6,5,NA,280592739,2008-02-28
157,2,13:31,811,811,Foul on Scott VanderMeer,50,50,0,0,0.5,0.5,Green Bay,UIC,6,5,NA,280592739,2008-02-28
158,2,13:31,811,811,Ryan Tillema made Free Throw.,51,50,1,0,0.5473556419586071,0.5473556419586071,Green Bay,UIC,6,5,NA,280592739,2008-02-28
159,2,13:31,811,811,Ryan Tillema made Free Throw.,52,50,2,22,0.5938692553600357,0.5938692553600357,Green Bay,UIC,6,5,NA,280592739,2008-02-28
160,2,13:09,789,789,Josh Mayo missed Three Point Jumper.,52,50,2,0,0.5950837021047259,0.5950837021047259,Green Bay,UIC,6,5,NA,280592739,2008-02-28
161,2,13:09,789,789,D'Angalo Jackson Defensive Rebound.,52,50,2,7,0.5950837021047259,0.5950837021047259,Green Bay,UIC,6,5,NA,280592739,2008-02-28
162,2,13:02,782,782,Troy Cotton made Three Point Jumper.  Assisted by Terry Evans.,55,50,5,37,0.7245054374349844,0.7245054374349844,Green Bay,UIC,6,5,NA,280592739,2008-02-28
163,2,12:25,745,745,Scott VanderMeer missed Two Point Jumper.,55,50,5,0,0.7298004824760755,0.7298004824760755,Green Bay,UIC,6,5,NA,280592739,2008-02-28
164,2,12:25,745,745,Terry Evans Defensive Rebound.,55,50,5,18,0.7298004824760755,0.7298004824760755,Green Bay,UIC,6,5,NA,280592739,2008-02-28
165,2,12:07,727,727,Foul on Karl White Jr.,55,50,5,9,0.7328515195122575,0.7328515195122575,Green Bay,UIC,6,5,NA,280592739,2008-02-28
166,2,11:58,718,718,Randy Berry missed Two Point Layup.,55,50,5,1,0.7343481166030459,0.7343481166030459,Green Bay,UIC,6,5,NA,280592739,2008-02-28
167,2,11:57,717,717,Rahmon Fletcher Offensive Rebound.,55,50,5,4,0.7345080569457826,0.7345080569457826,Green Bay,UIC,6,5,NA,280592739,2008-02-28
168,2,11:53,713,713,Ryan Tillema made Three Point Jumper.  Assisted by Cordero Barkley.,58,50,8,11,0.8366272168996759,0.8366272168996759,Green Bay,UIC,6,5,NA,280592739,2008-02-28
169,2,11:42,702,702,Illinois-Chicago 30 Second Timeout.,58,50,8,16,0.8384659856668929,0.8384659856668929,Green Bay,UIC,6,4,NA,280592739,2008-02-28
170,2,11:26,686,686,Robert Bush made Two Point Jumper.,58,52,6,12,0.7771037808397008,0.7771037808397008,Green Bay,UIC,6,4,NA,280592739,2008-02-28
171,2,11:14,674,674,Ryan Tillema missed Two Point Layup.,58,52,6,0,0.778794804910226,0.778794804910226,Green Bay,UIC,6,4,NA,280592739,2008-02-28
172,2,11:14,674,674,Jermaine Dailey Defensive Rebound.,58,52,6,23,0.778794804910226,0.778794804910226,Green Bay,UIC,6,4,NA,280592739,2008-02-28
173,2,10:51,651,651,Foul on Ryan Tillema,58,52,6,0,0.7819587052183863,0.7819587052183863,Green Bay,UIC,6,4,NA,280592739,2008-02-28
174,2,10:51,651,651,Official TV Timeout.,58,52,6,0,0.7819587052183863,0.7819587052183863,Green Bay,UIC,6,4,NA,280592739,2008-02-28
175,2,10:51,651,651,Karl White Jr. missed Free Throw.,58,52,6,0,0.7819587052183863,0.7819587052183863,Green Bay,UIC,6,4,NA,280592739,2008-02-28
176,2,10:51,651,651,null,58,52,6,0,0.7819587052183863,0.7819587052183863,Green Bay,UIC,6,4,NA,280592739,2008-02-28
177,2,10:51,651,651,Karl White Jr. made Free Throw.,58,53,5,7,0.743504662859933,0.743504662859933,Green Bay,UIC,6,4,NA,280592739,2008-02-28
178,2,10:44,644,644,Jermaine Dailey Steal.,58,53,5,26,0.7444148609412894,0.7444148609412894,Green Bay,UIC,6,4,NA,280592739,2008-02-28
