play_id,half,time_remaining_half,secs_remaining,secs_remaining_absolute,description,home_score,away_score,score_diff,play_length,win_prob,naive_win_prob,home,away,home_time_out_remaining,away_time_out_remaining,home_favored_by,game_id,date
1,1,20:00,2400,2400,PLAY,0,0,0,19,0.5,0.5,Georgetown,Villanova,6,6,NA,280420046,2008-02-11
2,1,19:41,2381,2381,Roy Hibbert made Two Point Dunk Shot.,2,0,2,21,0.5444265717083462,0.5444265717083462,Georgetown,Villanova,6,6,NA,280420046,2008-02-11
3,1,19:20,2360,2360,Dwayne Anderson made Two Point Jumper.  Assisted by Corey Fisher.,2,2,0,31,0.5,0.5,Georgetown,Villanova,6,6,NA,280420046,2008-02-11
4,1,18:49,2329,2329,Corey Fisher missed Three Point Jumper.,2,2,0,0,0.5,0.5,Georgetown,Villanova,6,6,NA,280420046,2008-02-11
5,1,18:49,2329,2329,Dante Cunningham Offensive Rebound.,2,2,0,4,0.5,0.5,Georgetown,Villanova,6,6,NA,280420046,2008-02-11
6,1,18:45,2325,2325,Foul on DaJuan Summers,2,2,0,5,0.5,0.5,Georgetown,Villanova,6,6,NA,280420046,2008-02-11
7,1,18:40,2320,2320,Dwayne Anderson missed Three Point Jumper.,2,2,0,0,0.5,0.5,Georgetown,Villanova,6,6,NA,280420046,2008-02-11
8,1,18:40,2320,2320,Austin Freeman Defensive Rebound.,2,2,0,14,0.5,0.5,Georgetown,Villanova,6,6,NA,280420046,2008-02-11
9,1,18:26,2306,2306,Jonathan Wallace missed Three Point Jumper.,2,2,0,0,0.5,0.5,Georgetown,Villanova,6,6,NA,280420046,2008-02-11
10,1,18:26,2306,2306,Dante Cunningham Defensive Rebound.,2,2,0,14,0.5,0.5,Georgetown,Villanova,6,6,NA,280420046,2008-02-11
11,1,18:12,2292,2292,Dante Cunningham missed Two Point Layup.,2,2,0,0,0.5,0.5,Georgetown,Villanova,6,6,NA,280420046,2008-02-11
12,1,18:12,2292,2292,Roy Hibbert Defensive Rebound.,2,2,0,11,0.5,0.5,Georgetown,Villanova,6,6,NA,280420046,2008-02-11
13,1,18:01,2281,2281,DaJuan Summers made Two Point Layup.,4,2,2,20,0.5466112148644995,0.5466112148644995,Georgetown,Villanova,6,6,NA,280420046,2008-02-11
14,1,17:41,2261,2261,Foul on Dante Cunningham,4,2,2,18,0.5470609119753659,0.5470609119753659,Georgetown,Villanova,6,6,NA,280420046,2008-02-11
15,1,17:23,2243,2243,Casiem Drummond missed Two Point Layup.,4,2,2,2,0.5474684508315749,0.5474684508315749,Georgetown,Villanova,6,6,NA,280420046,2008-02-11
16,1,17:21,2241,2241,Roy Hibbert Defensive Rebound.,4,2,2,9,0.5475138833251382,0.5475138833251382,Georgetown,Villanova,6,6,NA,280420046,2008-02-11
17,1,17:12,2232,2232,DaJuan Summers missed Three Point Jumper.,4,2,2,0,0.5477186766445648,0.5477186766445648,Georgetown,Villanova,6,6,NA,280420046,2008-02-11
18,1,17:12,2232,2232,Villanova Defensive Rebound.,4,2,2,28,0.5477186766445648,0.5477186766445648,Georgetown,Villanova,6,6,NA,280420046,2008-02-11
19,1,16:44,2204,2204,Scottie Reynolds missed Two Point Jumper.,4,2,2,0,0.5483590900647362,0.5483590900647362,Georgetown,Villanova,6,6,NA,280420046,2008-02-11
20,1,16:44,2204,2204,Roy Hibbert Defensive Rebound.,4,2,2,19,0.5483590900647362,0.5483590900647362,Georgetown,Villanova,6,6,NA,280420046,2008-02-11
21,1,16:25,2185,2185,Jonathan Wallace made Three Point Jumper.  Assisted by Jessie Sapp.,7,2,5,19,0.6199929989595001,0.6199929989595001,Georgetown,Villanova,6,6,NA,280420046,2008-02-11
22,1,16:06,2166,2166,Corey Fisher missed Three Point Jumper.,7,2,5,0,0.6210355833302809,0.6210355833302809,Georgetown,Villanova,6,6,NA,280420046,2008-02-11
23,1,16:06,2166,2166,DaJuan Summers Defensive Rebound.,7,2,5,10,0.6210355833302809,0.6210355833302809,Georgetown,Villanova,6,6,NA,280420046,2008-02-11
24,1,15:56,2156,2156,Jessie Sapp made Three Point Jumper.  Assisted by Jonathan Wallace.,10,2,8,4,0.6887016584202823,0.6887016584202823,Georgetown,Villanova,6,6,NA,280420046,2008-02-11
25,1,15:52,2152,2152,Villanova Full Timeout.,10,2,8,19,0.6890232893342941,0.6890232893342941,Georgetown,Villanova,5,6,NA,280420046,2008-02-11
26,1,15:33,2133,2133,Dwayne Anderson missed Three Point Jumper.,10,2,8,0,0.6905547300698838,0.6905547300698838,Georgetown,Villanova,5,6,NA,280420046,2008-02-11
27,1,15:33,2133,2133,Jessie Sapp Defensive Rebound.,10,2,8,4,0.6905547300698838,0.6905547300698838,Georgetown,Villanova,5,6,NA,280420046,2008-02-11
28,1,15:29,2129,2129,Foul on Dwayne Anderson,10,2,8,0,0.690877958425888,0.690877958425888,Georgetown,Villanova,5,6,NA,280420046,2008-02-11
29,1,15:29,2129,2129,Official TV Timeout.,10,2,8,14,0.690877958425888,0.690877958425888,Georgetown,Villanova,5,6,NA,280420046,2008-02-11
30,1,15:15,2115,2115,Jessie Sapp missed Three Point Jumper.,10,2,8,0,0.6920116600326757,0.6920116600326757,Georgetown,Villanova,5,6,NA,280420046,2008-02-11
31,1,15:15,2115,2115,Dwayne Anderson Defensive Rebound.,10,2,8,12,0.6920116600326757,0.6920116600326757,Georgetown,Villanova,5,6,NA,280420046,2008-02-11
32,1,15:03,2103,2103,Corey Fisher made Two Point Jumper.,10,4,6,30,0.648075199514949,0.648075199514949,Georgetown,Villanova,5,6,NA,280420046,2008-02-11
33,1,14:33,2073,2073,Roy Hibbert missed Two Point Jumper.,10,4,6,0,0.6500476590651177,0.6500476590651177,Georgetown,Villanova,5,6,NA,280420046,2008-02-11
34,1,14:33,2073,2073,Scottie Reynolds Defensive Rebound.,10,4,6,14,0.6500476590651177,0.6500476590651177,Georgetown,Villanova,5,6,NA,280420046,2008-02-11
35,1,14:19,2059,2059,Corey Fisher missed Two Point Jumper.,10,4,6,2,0.6509753248433197,0.6509753248433197,Georgetown,Villanova,5,6,NA,280420046,2008-02-11
36,1,14:17,2057,2057,Austin Freeman Defensive Rebound.,10,4,6,4,0.6511082423190997,0.6511082423190997,Georgetown,Villanova,5,6,NA,280420046,2008-02-11
37,1,14:13,2053,2053,Jonathan Wallace missed Three Point Jumper.,10,4,6,0,0.6513743792803292,0.6513743792803292,Georgetown,Villanova,5,6,NA,280420046,2008-02-11
38,1,14:13,2053,2053,Jessie Sapp Offensive Rebound.,10,4,6,4,0.6513743792803292,0.6513743792803292,Georgetown,Villanova,5,6,NA,280420046,2008-02-11
39,1,14:09,2049,2049,Jessie Sapp made Two Point Layup.,12,4,8,26,0.6974139005057979,0.6974139005057979,Georgetown,Villanova,5,6,NA,280420046,2008-02-11
40,1,13:43,2023,2023,Foul on Jessie Sapp,12,4,8,5,0.699572256725247,0.699572256725247,Georgetown,Villanova,5,6,NA,280420046,2008-02-11
41,1,13:38,2018,2018,Scottie Reynolds made Three Point Jumper.  Assisted by Corey Fisher.,12,7,5,25,0.6293734778663188,0.6293734778663188,Georgetown,Villanova,5,6,NA,280420046,2008-02-11
42,1,13:13,1993,1993,Foul on Casiem Drummond,12,7,5,2,0.6308313901106217,0.6308313901106217,Georgetown,Villanova,5,6,NA,280420046,2008-02-11
43,1,13:11,1991,1991,Roy Hibbert missed Free Throw.,12,7,5,0,0.6309487565942278,0.6309487565942278,Georgetown,Villanova,5,6,NA,280420046,2008-02-11
44,1,13:11,1991,1991,null,12,7,5,0,0.6309487565942278,0.6309487565942278,Georgetown,Villanova,5,6,NA,280420046,2008-02-11
45,1,13:11,1991,1991,Roy Hibbert made Free Throw.,13,7,6,10,0.6555548179418867,0.6555548179418867,Georgetown,Villanova,5,6,NA,280420046,2008-02-11
46,1,13:01,1981,1981,Scottie Reynolds made Two Point Jumper.  Assisted by Corey Fisher.,13,9,4,28,0.6061253070777269,0.6061253070777269,Georgetown,Villanova,5,6,NA,280420046,2008-02-11
47,1,12:33,1953,1953,DaJuan Summers made Two Point Jumper.  Assisted by Patrick Ewing Jr..,15,9,6,21,0.6581737432465339,0.6581737432465339,Georgetown,Villanova,5,6,NA,280420046,2008-02-11
48,1,12:12,1932,1932,Scottie Reynolds made Three Point Jumper.  Assisted by Dwayne Anderson.,15,12,3,41,0.5819658370238904,0.5819658370238904,Georgetown,Villanova,5,6,NA,280420046,2008-02-11
49,1,11:31,1891,1891,Patrick Ewing Jr. missed Two Point Layup.,15,12,3,0,0.5835239631200413,0.5835239631200413,Georgetown,Villanova,5,6,NA,280420046,2008-02-11
50,1,11:31,1891,1891,Georgetown Offensive Rebound.,15,12,3,0,0.5835239631200413,0.5835239631200413,Georgetown,Villanova,5,6,NA,280420046,2008-02-11
51,1,11:31,1891,1891,Official TV Timeout.,15,12,3,19,0.5835239631200413,0.5835239631200413,Georgetown,Villanova,5,6,NA,280420046,2008-02-11
52,1,11:12,1872,1872,Reggie Redding missed Two Point Layup.,15,12,3,1,0.5842452332858721,0.5842452332858721,Georgetown,Villanova,5,6,NA,280420046,2008-02-11
53,1,11:11,1871,1871,Villanova Offensive Rebound.,15,12,3,14,0.5842832266439791,0.5842832266439791,Georgetown,Villanova,5,6,NA,280420046,2008-02-11
54,1,10:57,1857,1857,Reggie Redding missed Three Point Jumper.,15,12,3,2,0.5848157365062421,0.5848157365062421,Georgetown,Villanova,5,6,NA,280420046,2008-02-11
55,1,10:55,1855,1855,DaJuan Summers Defensive Rebound.,15,12,3,11,0.58489192170143,0.58489192170143,Georgetown,Villanova,5,6,NA,280420046,2008-02-11
56,1,10:44,1844,1844,Jonathan Wallace missed Three Point Jumper.,15,12,3,0,0.5853115877240561,0.5853115877240561,Georgetown,Villanova,5,6,NA,280420046,2008-02-11
57,1,10:44,1844,1844,Corey Fisher Defensive Rebound.,15,12,3,13,0.5853115877240561,0.5853115877240561,Georgetown,Villanova,5,6,NA,280420046,2008-02-11
58,1,10:31,1831,1831,Scottie Reynolds missed Two Point Jumper.,15,12,3,0,0.5858092743194963,0.5858092743194963,Georgetown,Villanova,5,6,NA,280420046,2008-02-11
59,1,10:31,1831,1831,DaJuan Summers Defensive Rebound.,15,12,3,3,0.5858092743194963,0.5858092743194963,Georgetown,Villanova,5,6,NA,280420046,2008-02-11
60,1,10:28,1828,1828,Foul on Dante Cunningham,15,12,3,18,0.5859244380224486,0.5859244380224486,Georgetown,Villanova,5,6,NA,280420046,2008-02-11
61,1,10:10,1810,1810,Jeremiah Rivers missed Two Point Jumper.,15,12,3,0,0.5866183669881162,0.5866183669881162,Georgetown,Villanova,5,6,NA,280420046,2008-02-11
62,1,10:10,1810,1810,Dwayne Anderson Defensive Rebound.,15,12,3,13,0.5866183669881162,0.5866183669881162,Georgetown,Villanova,5,6,NA,280420046,2008-02-11
63,1,9:57,1797,1797,Foul on Jeremiah Rivers,15,12,3,0,0.5871231929956874,0.5871231929956874,Georgetown,Villanova,5,6,NA,280420046,2008-02-11
64,1,9:57,1797,1797,Casiem Drummond made Free Throw.,15,13,2,0,0.5584129576696049,0.5584129576696049,Georgetown,Villanova,5,6,NA,280420046,2008-02-11
65,1,9:57,1797,1797,Casiem Drummond missed Free Throw.,15,13,2,0,0.5584129576696049,0.5584129576696049,Georgetown,Villanova,5,6,NA,280420046,2008-02-11
66,1,9:57,1797,1797,Villanova Offensive Rebound.,15,13,2,28,0.5584129576696049,0.5584129576696049,Georgetown,Villanova,5,6,NA,280420046,2008-02-11
67,1,9:29,1769,1769,Scottie Reynolds made Two Point Dunk Shot.,15,15,0,15,0.5,0.5,Georgetown,Villanova,5,6,NA,280420046,2008-02-11
68,1,9:14,1754,1754,Foul on Jonathan Wallace,15,15,0,13,0.5,0.5,Georgetown,Villanova,5,6,NA,280420046,2008-02-11
69,1,9:01,1741,1741,Foul on Jeremiah Rivers,15,15,0,0,0.5,0.5,Georgetown,Villanova,5,6,NA,280420046,2008-02-11
70,1,9:01,1741,1741,Scottie Reynolds made Free Throw.,15,16,-1,0,0.46993131800058685,0.46993131800058685,Georgetown,Villanova,5,6,NA,280420046,2008-02-11
71,1,9:01,1741,1741,Scottie Reynolds made Free Throw.,15,17,-2,24,0.440079339223593,0.440079339223593,Georgetown,Villanova,5,6,NA,280420046,2008-02-11
72,1,8:37,1717,1717,DaJuan Summers missed Three Point Jumper.,15,17,-2,1,0.4394121864957256,0.4394121864957256,Georgetown,Villanova,5,6,NA,280420046,2008-02-11
73,1,8:36,1716,1716,Patrick Ewing Jr. Offensive Rebound.,15,17,-2,1,0.43938406363819593,0.43938406363819593,Georgetown,Villanova,5,6,NA,280420046,2008-02-11
74,1,8:35,1715,1715,Patrick Ewing Jr. missed Two Point Layup.,15,17,-2,4,0.4393559134747114,0.4393559134747114,Georgetown,Villanova,5,6,NA,280420046,2008-02-11
75,1,8:31,1711,1711,Malcolm Grant Defensive Rebound.,15,17,-2,1,0.439243036717164,0.439243036717164,Georgetown,Villanova,5,6,NA,280420046,2008-02-11
76,1,8:30,1710,1710,Foul on Patrick Ewing Jr.,15,17,-2,12,0.4392147477409531,0.4392147477409531,Georgetown,Villanova,5,6,NA,280420046,2008-02-11
77,1,8:18,1698,1698,Corey Stokes made Two Point Jumper.,15,19,-4,19,0.3795463735611663,0.3795463735611663,Georgetown,Villanova,5,6,NA,280420046,2008-02-11
78,1,7:59,1679,1679,Official TV Timeout.,15,19,-4,22,0.37850387305593297,0.37850387305593297,Georgetown,Villanova,5,6,NA,280420046,2008-02-11
79,1,7:37,1657,1657,Foul on Corey Stokes,15,19,-4,11,0.3773275243156414,0.3773275243156414,Georgetown,Villanova,5,6,NA,280420046,2008-02-11
80,1,7:26,1646,1646,Foul on Casiem Drummond,15,19,-4,0,0.3767507109577273,0.3767507109577273,Georgetown,Villanova,5,6,NA,280420046,2008-02-11
81,1,7:26,1646,1646,Roy Hibbert made Free Throw.,16,19,-3,0,0.40672466482613245,0.40672466482613245,Georgetown,Villanova,5,6,NA,280420046,2008-02-11
82,1,7:26,1646,1646,Roy Hibbert missed Free Throw.,16,19,-3,0,0.40672466482613245,0.40672466482613245,Georgetown,Villanova,5,6,NA,280420046,2008-02-11
83,1,7:26,1646,1646,Dwayne Anderson Defensive Rebound.,16,19,-3,14,0.40672466482613245,0.40672466482613245,Georgetown,Villanova,5,6,NA,280420046,2008-02-11
84,1,7:12,1632,1632,Antonio Pena missed Two Point Jumper.,16,19,-3,0,0.40616499656247984,0.40616499656247984,Georgetown,Villanova,5,6,NA,280420046,2008-02-11
85,1,7:12,1632,1632,null,16,19,-3,15,0.40616499656247984,0.40616499656247984,Georgetown,Villanova,5,6,NA,280420046,2008-02-11
86,1,6:57,1617,1617,Foul on Roy Hibbert,16,19,-3,18,0.40557057631804844,0.40557057631804844,Georgetown,Villanova,5,6,NA,280420046,2008-02-11
87,1,6:39,1599,1599,Corey Fisher missed Two Point Layup.,16,19,-3,0,0.4048606890420764,0.4048606890420764,Georgetown,Villanova,5,6,NA,280420046,2008-02-11
88,1,6:39,1599,1599,Roy Hibbert Defensive Rebound.,16,19,-3,25,0.4048606890420764,0.4048606890420764,Georgetown,Villanova,5,6,NA,280420046,2008-02-11
89,1,6:14,1574,1574,Foul on Antonio Pena,16,19,-3,0,0.4038726359005002,0.4038726359005002,Georgetown,Villanova,5,6,NA,280420046,2008-02-11
90,1,6:14,1574,1574,Jessie Sapp made Free Throw.,17,19,-2,0,0.4354694520569261,0.4354694520569261,Georgetown,Villanova,5,6,NA,280420046,2008-02-11
91,1,6:14,1574,1574,Jessie Sapp missed Free Throw.,17,19,-2,0,0.4354694520569261,0.4354694520569261,Georgetown,Villanova,5,6,NA,280420046,2008-02-11
92,1,6:14,1574,1574,Shane Clark Defensive Rebound.,17,19,-2,7,0.4354694520569261,0.4354694520569261,Georgetown,Villanova,5,6,NA,280420046,2008-02-11
93,1,6:07,1567,1567,Corey Stokes made Two Point Layup.,17,21,-4,21,0.37269262469034836,0.37269262469034836,Georgetown,Villanova,5,6,NA,280420046,2008-02-11
94,1,5:46,1546,1546,Foul on Antonio Pena,17,21,-4,0,0.3715987301167735,0.3715987301167735,Georgetown,Villanova,5,6,NA,280420046,2008-02-11
95,1,5:46,1546,1546,Jonathan Wallace made Free Throw.,18,21,-3,0,0.4027491607345781,0.4027491607345781,Georgetown,Villanova,5,6,NA,280420046,2008-02-11
96,1,5:46,1546,1546,Jonathan Wallace made Free Throw.,19,21,-2,18,0.43470448637739734,0.43470448637739734,Georgetown,Villanova,5,6,NA,280420046,2008-02-11
97,1,5:28,1528,1528,Austin Freeman missed Two Point Layup.,19,21,-2,0,0.43420082257963133,0.43420082257963133,Georgetown,Villanova,5,6,NA,280420046,2008-02-11
98,1,5:28,1528,1528,Shane Clark Defensive Rebound.,19,21,-2,18,0.43420082257963133,0.43420082257963133,Georgetown,Villanova,5,6,NA,280420046,2008-02-11
99,1,5:10,1510,1510,Tyler Crawford missed Three Point Jumper.,19,21,-2,0,0.4336841114500841,0.4336841114500841,Georgetown,Villanova,5,6,NA,280420046,2008-02-11
100,1,5:10,1510,1510,Dwayne Anderson Defensive Rebound.,19,21,-2,23,0.4336841114500841,0.4336841114500841,Georgetown,Villanova,5,6,NA,280420046,2008-02-11
101,1,4:47,1487,1487,Corey Stokes missed Three Point Jumper.,19,21,-2,0,0.43299988023118985,0.43299988023118985,Georgetown,Villanova,5,6,NA,280420046,2008-02-11
102,1,4:47,1487,1487,Jessie Sapp Defensive Rebound.,19,21,-2,25,0.43299988023118985,0.43299988023118985,Georgetown,Villanova,5,6,NA,280420046,2008-02-11
103,1,4:22,1462,1462,Corey Stokes made Three Point Jumper.  Assisted by Shane Clark.,19,24,-5,31,0.33581208311226945,0.33581208311226945,Georgetown,Villanova,5,6,NA,280420046,2008-02-11
104,1,3:51,1431,1431,Tyler Crawford missed Three Point Jumper.,19,24,-5,3,0.33352679306556604,0.33352679306556604,Georgetown,Villanova,5,6,NA,280420046,2008-02-11
105,1,3:48,1428,1428,Georgetown Offensive Rebound.,19,24,-5,0,0.33331135466728395,0.33331135466728395,Georgetown,Villanova,5,6,NA,280420046,2008-02-11
106,1,3:48,1428,1428,Foul on Corey Stokes,19,24,-5,1,0.33331135466728395,0.33331135466728395,Georgetown,Villanova,5,6,NA,280420046,2008-02-11
107,1,3:47,1427,1427,Official TV Timeout.,19,24,-5,0,0.3332398145895112,0.3332398145895112,Georgetown,Villanova,5,6,NA,280420046,2008-02-11
108,1,3:47,1427,1427,Jonathan Wallace missed Free Throw.,19,24,-5,0,0.3332398145895112,0.3332398145895112,Georgetown,Villanova,5,6,NA,280420046,2008-02-11
109,1,3:47,1427,1427,Corey Stokes Defensive Rebound.,19,24,-5,11,0.3332398145895112,0.3332398145895112,Georgetown,Villanova,5,6,NA,280420046,2008-02-11
110,1,3:36,1416,1416,Foul on Antonio Pena,19,24,-5,19,0.33246114014073375,0.33246114014073375,Georgetown,Villanova,5,6,NA,280420046,2008-02-11
111,1,3:17,1397,1397,DaJuan Summers missed Two Point Layup.,19,24,-5,5,0.33114533178764954,0.33114533178764954,Georgetown,Villanova,5,6,NA,280420046,2008-02-11
112,1,3:12,1392,1392,Patrick Ewing Jr. Offensive Rebound.,19,24,-5,2,0.3308036644257961,0.3308036644257961,Georgetown,Villanova,5,6,NA,280420046,2008-02-11
113,1,3:10,1390,1390,Patrick Ewing Jr. made Two Point Layup.,21,24,-3,20,0.395774986304259,0.395774986304259,Georgetown,Villanova,5,6,NA,280420046,2008-02-11
114,1,2:50,1370,1370,Reggie Redding missed Three Point Jumper.,21,24,-3,0,0.3948964414431408,0.3948964414431408,Georgetown,Villanova,5,6,NA,280420046,2008-02-11
115,1,2:50,1370,1370,Roy Hibbert Defensive Rebound.,21,24,-3,8,0.3948964414431408,0.3948964414431408,Georgetown,Villanova,5,6,NA,280420046,2008-02-11
116,1,2:42,1362,1362,Jessie Sapp missed Three Point Jumper.,21,24,-3,0,0.39454587199966873,0.39454587199966873,Georgetown,Villanova,5,6,NA,280420046,2008-02-11
117,1,2:42,1362,1362,Dwayne Anderson Defensive Rebound.,21,24,-3,20,0.39454587199966873,0.39454587199966873,Georgetown,Villanova,5,6,NA,280420046,2008-02-11
118,1,2:22,1342,1342,Foul on Shane Clark,21,24,-3,14,0.3936652566511799,0.3936652566511799,Georgetown,Villanova,5,6,NA,280420046,2008-02-11
119,1,2:08,1328,1328,DaJuan Summers made Three Point Jumper.  Assisted by Jessie Sapp.,24,24,0,33,0.5,0.5,Georgetown,Villanova,5,6,NA,280420046,2008-02-11
120,1,1:35,1295,1295,Corey Fisher missed Two Point Layup.,24,24,0,0,0.5,0.5,Georgetown,Villanova,5,6,NA,280420046,2008-02-11
121,1,1:35,1295,1295,Corey Fisher Offensive Rebound.,24,24,0,2,0.5,0.5,Georgetown,Villanova,5,6,NA,280420046,2008-02-11
122,1,1:33,1293,1293,Foul on Roy Hibbert,24,24,0,0,0.5,0.5,Georgetown,Villanova,5,6,NA,280420046,2008-02-11
123,1,1:33,1293,1293,Corey Fisher made Free Throw.,24,25,-1,0,0.4632877902567029,0.4632877902567029,Georgetown,Villanova,5,6,NA,280420046,2008-02-11
124,1,1:33,1293,1293,Corey Fisher made Free Throw.,24,26,-2,17,0.42696929963604796,0.42696929963604796,Georgetown,Villanova,5,6,NA,280420046,2008-02-11
125,1,1:16,1276,1276,DaJuan Summers missed Two Point Jumper.,24,26,-2,0,0.4264011765964848,0.4264011765964848,Georgetown,Villanova,5,6,NA,280420046,2008-02-11
126,1,1:16,1276,1276,Vernon Macklin Offensive Rebound.,24,26,-2,3,0.4264011765964848,0.4264011765964848,Georgetown,Villanova,5,6,NA,280420046,2008-02-11
127,1,1:13,1273,1273,Vernon Macklin made Two Point Layup.,26,26,0,16,0.5,0.5,Georgetown,Villanova,5,6,NA,280420046,2008-02-11
128,1,0:57,1257,1257,Foul on Vernon Macklin,26,26,0,0,0.5,0.5,Georgetown,Villanova,5,6,NA,280420046,2008-02-11
129,1,0:57,1257,1257,Scottie Reynolds missed Free Throw.,26,26,0,0,0.5,0.5,Georgetown,Villanova,5,6,NA,280420046,2008-02-11
130,1,0:57,1257,1257,Casiem Drummond Offensive Rebound.,26,26,0,9,0.5,0.5,Georgetown,Villanova,5,6,NA,280420046,2008-02-11
131,1,0:48,1248,1248,Casiem Drummond missed Two Point Tip Shot.,26,26,0,0,0.5,0.5,Georgetown,Villanova,5,6,NA,280420046,2008-02-11
132,1,0:48,1248,1248,Georgetown Defensive Rebound.,26,26,0,20,0.5,0.5,Georgetown,Villanova,5,6,NA,280420046,2008-02-11
133,1,0:28,1228,1228,Jonathan Wallace missed Two Point Jumper.,26,26,0,1,0.5,0.5,Georgetown,Villanova,5,6,NA,280420046,2008-02-11
134,1,0:27,1227,1227,Dwayne Anderson Defensive Rebound.,26,26,0,9,0.5,0.5,Georgetown,Villanova,5,6,NA,280420046,2008-02-11
135,1,0:18,1218,1218,Scottie Reynolds made Two Point Layup.,26,28,-2,9,0.4242395713141537,0.4242395713141537,Georgetown,Villanova,5,6,NA,280420046,2008-02-11
136,1,0:09,1209,1209,Georgetown Full Timeout.,26,28,-2,0,0.4238652688835001,0.4238652688835001,Georgetown,Villanova,5,5,NA,280420046,2008-02-11
137,1,0:09,1209,1209,Foul on Shane Clark,26,28,-2,2,0.4238652688835001,0.4238652688835001,Georgetown,Villanova,5,5,NA,280420046,2008-02-11
138,1,0:07,1207,1207,DaJuan Summers made Free Throw.,27,28,-1,0,0.4616666991033746,0.4616666991033746,Georgetown,Villanova,5,5,NA,280420046,2008-02-11
139,1,0:07,1207,1207,DaJuan Summers made Free Throw.,28,28,0,3,0.5,0.5,Georgetown,Villanova,5,5,NA,280420046,2008-02-11
140,1,0:04,1204,1204,Foul on Vernon Macklin,28,28,0,0,0.5,0.5,Georgetown,Villanova,5,5,NA,280420046,2008-02-11
141,1,0:04,1204,1204,Scottie Reynolds made Free Throw.,28,29,-1,0,0.4616030238506507,0.4616030238506507,Georgetown,Villanova,5,5,NA,280420046,2008-02-11
142,1,0:04,1204,1204,Scottie Reynolds missed Free Throw.,28,29,-1,0,0.4616030238506507,0.4616030238506507,Georgetown,Villanova,5,5,NA,280420046,2008-02-11
143,1,0:04,1204,1204,Tyler Crawford Defensive Rebound.,28,29,-1,4,0.4616030238506507,0.4616030238506507,Georgetown,Villanova,5,5,NA,280420046,2008-02-11
144,1,0:00,1200,1200,End of the 1st Half.,28,29,-1,0,0.4615187446422248,0.4615187446422248,Georgetown,Villanova,5,5,NA,280420046,2008-02-11
145,2,20:00,1200,1200,PLAY,28,29,-1,2,0.4615187446422248,0.4615187446422248,Georgetown,Villanova,5,5,NA,280420046,2008-02-11
146,2,19:58,1198,1198,Corey Fisher missed Two Point Layup.,28,29,-1,0,0.46147685900240754,0.46147685900240754,Georgetown,Villanova,5,5,NA,280420046,2008-02-11
147,2,19:58,1198,1198,Dwayne Anderson Offensive Rebound.,28,29,-1,3,0.46147685900240754,0.46147685900240754,Georgetown,Villanova,5,5,NA,280420046,2008-02-11
148,2,19:55,1195,1195,Dwayne Anderson made Two Point Dunk Shot.,28,31,-3,23,0.3860490794886083,0.3860490794886083,Georgetown,Villanova,5,5,NA,280420046,2008-02-11
149,2,19:32,1172,1172,Foul on Scottie Reynolds,28,31,-3,1,0.3847073139520436,0.3847073139520436,Georgetown,Villanova,5,5,NA,280420046,2008-02-11
150,2,19:31,1171,1171,Roy Hibbert missed Two Point Jumper.,28,31,-3,0,0.3846499659524689,0.3846499659524689,Georgetown,Villanova,5,5,NA,280420046,2008-02-11
151,2,19:31,1171,1171,Casiem Drummond Defensive Rebound.,28,31,-3,6,0.3846499659524689,0.3846499659524689,Georgetown,Villanova,5,5,NA,280420046,2008-02-11
152,2,19:25,1165,1165,Dwayne Anderson missed Three Point Jumper.,28,31,-3,0,0.3843072001203803,0.3843072001203803,Georgetown,Villanova,5,5,NA,280420046,2008-02-11
153,2,19:25,1165,1165,Dante Cunningham Offensive Rebound.,28,31,-3,6,0.3843072001203803,0.3843072001203803,Georgetown,Villanova,5,5,NA,280420046,2008-02-11
154,2,19:19,1159,1159,Corey Fisher missed Two Point Layup.,28,31,-3,0,0.3839663971285067,0.3839663971285067,Georgetown,Villanova,5,5,NA,280420046,2008-02-11
155,2,19:19,1159,1159,Jonathan Wallace Defensive Rebound.,28,31,-3,9,0.3839663971285067,0.3839663971285067,Georgetown,Villanova,5,5,NA,280420046,2008-02-11
156,2,19:10,1150,1150,DaJuan Summers missed Two Point Layup.,28,31,-3,0,0.3834579541386981,0.3834579541386981,Georgetown,Villanova,5,5,NA,280420046,2008-02-11
157,2,19:10,1150,1150,Dwayne Anderson Defensive Rebound.,28,31,-3,5,0.3834579541386981,0.3834579541386981,Georgetown,Villanova,5,5,NA,280420046,2008-02-11
158,2,19:05,1145,1145,Scottie Reynolds missed Three Point Jumper.,28,31,-3,0,0.3831764646085074,0.3831764646085074,Georgetown,Villanova,5,5,NA,280420046,2008-02-11
159,2,19:05,1145,1145,Dante Cunningham Offensive Rebound.,28,31,-3,17,0.3831764646085074,0.3831764646085074,Georgetown,Villanova,5,5,NA,280420046,2008-02-11
160,2,18:48,1128,1128,Dwayne Anderson missed Two Point Jumper.,28,31,-3,0,0.38222088521408826,0.38222088521408826,Georgetown,Villanova,5,5,NA,280420046,2008-02-11
161,2,18:48,1128,1128,Dwayne Anderson Offensive Rebound.,28,31,-3,25,0.38222088521408826,0.38222088521408826,Georgetown,Villanova,5,5,NA,280420046,2008-02-11
162,2,18:23,1103,1103,Dwayne Anderson missed Two Point Jumper.,28,31,-3,0,0.38080390164178146,0.38080390164178146,Georgetown,Villanova,5,5,NA,280420046,2008-02-11
163,2,18:23,1103,1103,Jessie Sapp Defensive Rebound.,28,31,-3,10,0.38080390164178146,0.38080390164178146,Georgetown,Villanova,5,5,NA,280420046,2008-02-11
164,2,18:13,1093,1093,Roy Hibbert missed Two Point Layup.,28,31,-3,0,0.380227361074514,0.380227361074514,Georgetown,Villanova,5,5,NA,280420046,2008-02-11
165,2,18:13,1093,1093,Dante Cunningham Defensive Rebound.,28,31,-3,9,0.380227361074514,0.380227361074514,Georgetown,Villanova,5,5,NA,280420046,2008-02-11
166,2,18:04,1084,1084,Corey Fisher missed Three Point Jumper.,28,31,-3,0,0.37970130667667296,0.37970130667667296,Georgetown,Villanova,5,5,NA,280420046,2008-02-11
167,2,18:04,1084,1084,Jessie Sapp Defensive Rebound.,28,31,-3,18,0.37970130667667296,0.37970130667667296,Georgetown,Villanova,5,5,NA,280420046,2008-02-11
168,2,17:46,1066,1066,Foul on Dwayne Anderson,28,31,-3,1,0.3786230991971889,0.3786230991971889,Georgetown,Villanova,5,5,NA,280420046,2008-02-11
169,2,17:45,1065,1065,Foul on Roy Hibbert,28,31,-3,31,0.3785620094726315,0.3785620094726315,Georgetown,Villanova,5,5,NA,280420046,2008-02-11
170,2,17:14,1034,1034,Foul on DaJuan Summers,28,31,-3,20,0.37659044665038155,0.37659044665038155,Georgetown,Villanova,5,5,NA,280420046,2008-02-11
171,2,16:54,1014,1014,Corey Fisher missed Two Point Jumper.,28,31,-3,0,0.3752218151136823,0.3752218151136823,Georgetown,Villanova,5,5,NA,280420046,2008-02-11
172,2,16:54,1014,1014,Villanova Offensive Rebound.,28,31,-3,21,0.3752218151136823,0.3752218151136823,Georgetown,Villanova,5,5,NA,280420046,2008-02-11
173,2,16:33,993,993,Reggie Redding missed Three Point Jumper.,28,31,-3,0,0.3736838024659837,0.3736838024659837,Georgetown,Villanova,5,5,NA,280420046,2008-02-11
