play_id,half,time_remaining_half,secs_remaining,secs_remaining_absolute,description,home_score,away_score,score_diff,play_length,win_prob,naive_win_prob,home,away,home_time_out_remaining,away_time_out_remaining,home_favored_by,game_id,date
1,1,20:00,2400,2400,PLAY,0,0,0,30,0.5,0.5,Kentucky,Marquette,6,6,NA,234000061,2003-03-29
2,1,19:30,2370,2370,Foul on Todd Townsend,0,0,0,0,0.5,0.5,Kentucky,Marquette,6,6,NA,234000061,2003-03-29
3,1,19:30,2370,2370,Keith Bogans missed Free Throw.,0,0,0,0,0.5,0.5,Kentucky,Marquette,6,6,NA,234000061,2003-03-29
4,1,19:30,2370,2370,Kentucky Defensive Rebound.,0,0,0,0,0.5,0.5,Kentucky,Marquette,6,6,NA,234000061,2003-03-29
5,1,19:30,2370,2370,Keith Bogans made Free Throw.,1,0,1,15,0.5223750871372936,0.5223750871372936,Kentucky,Marquette,6,6,NA,234000061,2003-03-29
6,1,19:15,2355,2355,Travis Diener made Two Point Jumper.,1,2,-1,17,0.4774629266909198,0.4774629266909198,Kentucky,Marquette,6,6,NA,234000061,2003-03-29
7,1,18:58,2338,2338,Gerald Fitch made Two Point Layup.,3,2,1,20,0.5227224670857408,0.5227224670857408,Kentucky,Marquette,6,6,NA,234000061,2003-03-29
8,1,18:38,2318,2318,Scott Merritt missed Two Point Jumper.,3,2,1,3,0.5229428697709193,0.5229428697709193,Kentucky,Marquette,6,6,NA,234000061,2003-03-29
9,1,18:35,2315,2315,Chuck Hayes Defensive Rebound.,3,2,1,15,0.5229761317984666,0.5229761317984666,Kentucky,Marquette,6,6,NA,234000061,2003-03-29
10,1,18:20,2300,2300,Gerald Fitch missed Two Point Layup.,3,2,1,0,0.5231431858431752,0.5231431858431752,Kentucky,Marquette,6,6,NA,234000061,2003-03-29
11,1,18:20,2300,2300,Marquis Estill Offensive Rebound.,3,2,1,4,0.5231431858431752,0.5231431858431752,Kentucky,Marquette,6,6,NA,234000061,2003-03-29
12,1,18:16,2296,2296,Marquis Estill made Two Point Layup.,5,2,3,31,0.5691673982971774,0.5691673982971774,Kentucky,Marquette,6,6,NA,234000061,2003-03-29
13,1,17:45,2265,2265,Todd Townsend made Three Point Jumper.,5,5,0,45,0.5,0.5,Kentucky,Marquette,6,6,NA,234000061,2003-03-29
14,1,17:00,2220,2220,Marquis Estill missed Two Point Layup.,5,5,0,0,0.5,0.5,Kentucky,Marquette,6,6,NA,234000061,2003-03-29
15,1,17:00,2220,2220,Kentucky Offensive Rebound.,5,5,0,11,0.5,0.5,Kentucky,Marquette,6,6,NA,234000061,2003-03-29
16,1,16:49,2209,2209,Erik Daniels missed Two Point Layup.,5,5,0,2,0.5,0.5,Kentucky,Marquette,6,6,NA,234000061,2003-03-29
17,1,16:47,2207,2207,Marquis Estill Offensive Rebound.,5,5,0,3,0.5,0.5,Kentucky,Marquette,6,6,NA,234000061,2003-03-29
18,1,16:44,2204,2204,Marquis Estill missed Two Point Layup.,5,5,0,0,0.5,0.5,Kentucky,Marquette,6,6,NA,234000061,2003-03-29
19,1,16:44,2204,2204,Chuck Hayes Offensive Rebound.,5,5,0,1,0.5,0.5,Kentucky,Marquette,6,6,NA,234000061,2003-03-29
20,1,16:43,2203,2203,Foul on Todd Townsend,5,5,0,0,0.5,0.5,Kentucky,Marquette,6,6,NA,234000061,2003-03-29
21,1,16:43,2203,2203,Chuck Hayes missed Free Throw.,5,5,0,0,0.5,0.5,Kentucky,Marquette,6,6,NA,234000061,2003-03-29
22,1,16:43,2203,2203,Kentucky Defensive Rebound.,5,5,0,0,0.5,0.5,Kentucky,Marquette,6,6,NA,234000061,2003-03-29
23,1,16:43,2203,2203,Chuck Hayes missed Free Throw.,5,5,0,0,0.5,0.5,Kentucky,Marquette,6,6,NA,234000061,2003-03-29
24,1,16:43,2203,2203,Erik Daniels Offensive Rebound.,5,5,0,3,0.5,0.5,Kentucky,Marquette,6,6,NA,234000061,2003-03-29
25,1,16:40,2200,2200,Erik Daniels missed Two Point Jumper.,5,5,0,0,0.5,0.5,Kentucky,Marquette,6,6,NA,234000061,2003-03-29
26,1,16:40,2200,2200,Robert Jackson Defensive Rebound.,5,5,0,15,0.5,0.5,Kentucky,Marquette,6,6,NA,234000061,2003-03-29
27,1,16:25,2185,2185,Dwyane Wade missed Two Point Layup.,5,5,0,0,0.5,0.5,Kentucky,Marquette,6,6,NA,234000061,2003-03-29
28,1,16:25,2185,2185,Chuck Hayes Defensive Rebound.,5,5,0,5,0.5,0.5,Kentucky,Marquette,6,6,NA,234000061,2003-03-29
29,1,16:20,2180,2180,Keith Bogans made Two Point Layup.,7,5,2,8,0.548911299485386,0.548911299485386,Kentucky,Marquette,6,6,NA,234000061,2003-03-29
30,1,16:12,2172,2172,Foul on Erik Daniels,7,5,2,0,0.5490959085697926,0.5490959085697926,Kentucky,Marquette,6,6,NA,234000061,2003-03-29
31,1,16:12,2172,2172,Robert Jackson missed Free Throw.,7,5,2,0,0.5490959085697926,0.5490959085697926,Kentucky,Marquette,6,6,NA,234000061,2003-03-29
32,1,16:12,2172,2172,Marquette Defensive Rebound.,7,5,2,0,0.5490959085697926,0.5490959085697926,Kentucky,Marquette,6,6,NA,234000061,2003-03-29
33,1,16:12,2172,2172,Robert Jackson made Free Throw.,7,6,1,28,0.5246074118573106,0.5246074118573106,Kentucky,Marquette,6,6,NA,234000061,2003-03-29
34,1,15:44,2144,2144,Dwyane Wade missed Two Point Layup.,7,6,1,0,0.5249344419963612,0.5249344419963612,Kentucky,Marquette,6,6,NA,234000061,2003-03-29
35,1,15:44,2144,2144,Robert Jackson Offensive Rebound.,7,6,1,3,0.5249344419963612,0.5249344419963612,Kentucky,Marquette,6,6,NA,234000061,2003-03-29
36,1,15:41,2141,2141,Robert Jackson made Two Point Layup.,7,8,-1,11,0.47503033285106394,0.47503033285106394,Kentucky,Marquette,6,6,NA,234000061,2003-03-29
37,1,15:30,2130,2130,Gerald Fitch missed Two Point Jumper.,7,8,-1,0,0.47490084655538,0.47490084655538,Kentucky,Marquette,6,6,NA,234000061,2003-03-29
38,1,15:30,2130,2130,Kentucky Offensive Rebound.,7,8,-1,1,0.47490084655538,0.47490084655538,Kentucky,Marquette,6,6,NA,234000061,2003-03-29
39,1,15:29,2129,2129,Kentucky Official TV Timeout.,7,8,-1,16,0.4748890490503926,0.4748890490503926,Kentucky,Marquette,5,6,NA,234000061,2003-03-29
40,1,15:13,2113,2113,Gerald Fitch missed Three Point Jumper.,7,8,-1,3,0.47469967745685804,0.47469967745685804,Kentucky,Marquette,5,6,NA,234000061,2003-03-29
41,1,15:10,2110,2110,Chuck Hayes Offensive Rebound.,7,8,-1,2,0.4746640388951447,0.4746640388951447,Kentucky,Marquette,5,6,NA,234000061,2003-03-29
42,1,15:08,2108,2108,Gerald Fitch made Two Point Layup.,9,8,1,5,0.5253597437932811,0.5253597437932811,Kentucky,Marquette,5,6,NA,234000061,2003-03-29
43,1,15:03,2103,2103,Dwyane Wade missed Two Point Layup.,9,8,1,0,0.5254192842743747,0.5254192842743747,Kentucky,Marquette,5,6,NA,234000061,2003-03-29
44,1,15:03,2103,2103,Kentucky Defensive Rebound.,9,8,1,41,0.5254192842743747,0.5254192842743747,Kentucky,Marquette,5,6,NA,234000061,2003-03-29
45,1,14:22,2062,2062,Robert Jackson missed Two Point Layup.,9,8,1,1,0.5259122868853792,0.5259122868853792,Kentucky,Marquette,5,6,NA,234000061,2003-03-29
46,1,14:21,2061,2061,Keith Bogans Defensive Rebound.,9,8,1,18,0.5259244231863538,0.5259244231863538,Kentucky,Marquette,5,6,NA,234000061,2003-03-29
47,1,14:03,2043,2043,Keith Bogans missed Three Point Jumper.,9,8,1,0,0.5261438456356039,0.5261438456356039,Kentucky,Marquette,5,6,NA,234000061,2003-03-29
48,1,14:03,2043,2043,Dwyane Wade Defensive Rebound.,9,8,1,10,0.5261438456356039,0.5261438456356039,Kentucky,Marquette,5,6,NA,234000061,2003-03-29
49,1,13:53,2033,2033,Robert Jackson missed Two Point Jumper.,9,8,1,0,0.526266563411049,0.526266563411049,Kentucky,Marquette,5,6,NA,234000061,2003-03-29
50,1,13:53,2033,2033,Scott Merritt Offensive Rebound.,9,8,1,5,0.526266563411049,0.526266563411049,Kentucky,Marquette,5,6,NA,234000061,2003-03-29
51,1,13:48,2028,2028,Scott Merritt missed Two Point Jumper.,9,8,1,0,0.5263281480078289,0.5263281480078289,Kentucky,Marquette,5,6,NA,234000061,2003-03-29
52,1,13:48,2028,2028,Dwyane Wade Offensive Rebound.,9,8,1,4,0.5263281480078289,0.5263281480078289,Kentucky,Marquette,5,6,NA,234000061,2003-03-29
53,1,13:44,2024,2024,Dwyane Wade made Two Point Dunk Shot.,9,10,-1,25,0.4736224740327764,0.4736224740327764,Kentucky,Marquette,5,6,NA,234000061,2003-03-29
54,1,13:19,1999,1999,Foul on Steve Novak,9,10,-1,17,0.47331157086917647,0.47331157086917647,Kentucky,Marquette,5,6,NA,234000061,2003-03-29
55,1,13:02,1982,1982,Chuck Hayes missed Two Point Layup.,9,10,-1,0,0.4730978073599999,0.4730978073599999,Kentucky,Marquette,5,6,NA,234000061,2003-03-29
56,1,13:02,1982,1982,Chuck Hayes Offensive Rebound.,9,10,-1,3,0.4730978073599999,0.4730978073599999,Kentucky,Marquette,5,6,NA,234000061,2003-03-29
57,1,12:59,1979,1979,Chuck Hayes missed Two Point Layup.,9,10,-1,0,0.47305987930257315,0.47305987930257315,Kentucky,Marquette,5,6,NA,234000061,2003-03-29
58,1,12:59,1979,1979,Cliff Hawkins Offensive Rebound.,9,10,-1,4,0.47305987930257315,0.47305987930257315,Kentucky,Marquette,5,6,NA,234000061,2003-03-29
59,1,12:55,1975,1975,Keith Bogans missed Three Point Jumper.,9,10,-1,0,0.47300921094673154,0.47300921094673154,Kentucky,Marquette,5,6,NA,234000061,2003-03-29
60,1,12:55,1975,1975,Chuck Hayes Offensive Rebound.,9,10,-1,7,0.47300921094673154,0.47300921094673154,Kentucky,Marquette,5,6,NA,234000061,2003-03-29
61,1,12:48,1968,1968,Cliff Hawkins made Two Point Jumper.,11,10,1,13,0.5270797301680951,0.5270797301680951,Kentucky,Marquette,5,6,NA,234000061,2003-03-29
62,1,12:35,1955,1955,Foul on Cliff Hawkins,11,10,1,5,0.5272458409468128,0.5272458409468128,Kentucky,Marquette,5,6,NA,234000061,2003-03-29
63,1,12:30,1950,1950,Travis Diener missed Three Point Jumper.,11,10,1,0,0.5273100595418571,0.5273100595418571,Kentucky,Marquette,5,6,NA,234000061,2003-03-29
64,1,12:30,1950,1950,Chuck Hayes Defensive Rebound.,11,10,1,17,0.5273100595418571,0.5273100595418571,Kentucky,Marquette,5,6,NA,234000061,2003-03-29
65,1,12:13,1933,1933,Foul on Scott Merritt,11,10,1,10,0.5275298105195108,0.5275298105195108,Kentucky,Marquette,5,6,NA,234000061,2003-03-29
66,1,12:03,1923,1923,Erik Daniels made Two Point Jumper.,13,10,3,0,0.5823085788430995,0.5823085788430995,Kentucky,Marquette,5,6,NA,234000061,2003-03-29
67,1,12:03,1923,1923,Foul on Scott Merritt,13,10,3,0,0.5823085788430995,0.5823085788430995,Kentucky,Marquette,5,6,NA,234000061,2003-03-29
68,1,12:03,1923,1923,Erik Daniels made Free Throw.,14,10,4,27,0.6089760442114043,0.6089760442114043,Kentucky,Marquette,5,6,NA,234000061,2003-03-29
69,1,11:36,1896,1896,Foul on Chuck Hayes,14,10,4,0,0.6103145445116247,0.6103145445116247,Kentucky,Marquette,5,6,NA,234000061,2003-03-29
70,1,11:36,1896,1896,Marquette Official TV Timeout.,14,10,4,20,0.6103145445116247,0.6103145445116247,Kentucky,Marquette,5,5,NA,234000061,2003-03-29
71,1,11:16,1876,1876,Karon Bradley missed Two Point Jumper.,14,10,4,0,0.6113046846949624,0.6113046846949624,Kentucky,Marquette,5,5,NA,234000061,2003-03-29
72,1,11:16,1876,1876,Dwyane Wade Offensive Rebound.,14,10,4,4,0.6113046846949624,0.6113046846949624,Kentucky,Marquette,5,5,NA,234000061,2003-03-29
73,1,11:12,1872,1872,Dwyane Wade made Three Point Jumper.,14,13,1,33,0.5283217541739113,0.5283217541739113,Kentucky,Marquette,5,5,NA,234000061,2003-03-29
74,1,10:39,1839,1839,Antwain Barbour missed Three Point Jumper.,14,13,1,0,0.5287519611525135,0.5287519611525135,Kentucky,Marquette,5,5,NA,234000061,2003-03-29
75,1,10:39,1839,1839,Terry Sanders Defensive Rebound.,14,13,1,12,0.5287519611525135,0.5287519611525135,Kentucky,Marquette,5,5,NA,234000061,2003-03-29
76,1,10:27,1827,1827,Robert Jackson missed Two Point Layup.,14,13,1,0,0.5289094457640003,0.5289094457640003,Kentucky,Marquette,5,5,NA,234000061,2003-03-29
77,1,10:27,1827,1827,Robert Jackson Offensive Rebound.,14,13,1,6,0.5289094457640003,0.5289094457640003,Kentucky,Marquette,5,5,NA,234000061,2003-03-29
78,1,10:21,1821,1821,Robert Jackson made Two Point Tip Shot.,14,15,-1,12,0.47101153155038505,0.47101153155038505,Kentucky,Marquette,5,5,NA,234000061,2003-03-29
79,1,10:09,1809,1809,Foul on Terry Sanders,14,15,-1,20,0.4708528416272028,0.4708528416272028,Kentucky,Marquette,5,5,NA,234000061,2003-03-29
80,1,9:49,1789,1789,Gerald Fitch missed Three Point Jumper.,14,15,-1,0,0.47058613421136253,0.47058613421136253,Kentucky,Marquette,5,5,NA,234000061,2003-03-29
81,1,9:49,1789,1789,Robert Jackson Defensive Rebound.,14,15,-1,8,0.47058613421136253,0.47058613421136253,Kentucky,Marquette,5,5,NA,234000061,2003-03-29
82,1,9:41,1781,1781,Karon Bradley made Three Point Jumper.,14,18,-4,19,0.3839317117299906,0.3839317117299906,Kentucky,Marquette,5,5,NA,234000061,2003-03-29
83,1,9:22,1762,1762,Foul on Gerald Fitch,14,18,-4,40,0.3829528975834532,0.3829528975834532,Kentucky,Marquette,5,5,NA,234000061,2003-03-29
84,1,8:42,1722,1722,Foul on Terry Sanders,14,18,-4,0,0.38084630191862134,0.38084630191862134,Kentucky,Marquette,5,5,NA,234000061,2003-03-29
85,1,8:42,1722,1722,Keith Bogans made Free Throw.,15,18,-3,0,0.4098783625526043,0.4098783625526043,Kentucky,Marquette,5,5,NA,234000061,2003-03-29
86,1,8:42,1722,1722,Keith Bogans missed Free Throw.,15,18,-3,0,0.4098783625526043,0.4098783625526043,Kentucky,Marquette,5,5,NA,234000061,2003-03-29
87,1,8:42,1722,1722,Robert Jackson Defensive Rebound.,15,18,-3,15,0.4098783625526043,0.4098783625526043,Kentucky,Marquette,5,5,NA,234000061,2003-03-29
88,1,8:27,1707,1707,Robert Jackson made Two Point Layup.,15,20,-5,11,0.3516630514394655,0.3516630514394655,Kentucky,Marquette,5,5,NA,234000061,2003-03-29
89,1,8:16,1696,1696,Foul on Robert Jackson,15,20,-5,0,0.350936566303155,0.350936566303155,Kentucky,Marquette,5,5,NA,234000061,2003-03-29
90,1,8:16,1696,1696,Marquis Estill made Free Throw.,16,20,-4,0,0.3794366658202934,0.3794366658202934,Kentucky,Marquette,5,5,NA,234000061,2003-03-29
91,1,8:16,1696,1696,Marquis Estill missed Free Throw.,16,20,-4,0,0.3794366658202934,0.3794366658202934,Kentucky,Marquette,5,5,NA,234000061,2003-03-29
92,1,8:16,1696,1696,Todd Townsend Defensive Rebound.,16,20,-4,19,0.3794366658202934,0.3794366658202934,Kentucky,Marquette,5,5,NA,234000061,2003-03-29
93,1,7:57,1677,1677,Dwyane Wade made Two Point Jumper.,16,22,-6,8,0.3220107790669396,0.3220107790669396,Kentucky,Marquette,5,5,NA,234000061,2003-03-29
94,1,7:49,1669,1669,Keith Bogans made Three Point Jumper.,19,22,-3,13,0.40766024453565963,0.40766024453565963,Kentucky,Marquette,5,5,NA,234000061,2003-03-29
95,1,7:36,1656,1656,Todd Townsend missed Three Point Jumper.,19,22,-3,0,0.4071285585956243,0.4071285585956243,Kentucky,Marquette,5,5,NA,234000061,2003-03-29
96,1,7:36,1656,1656,Dwyane Wade Offensive Rebound.,19,22,-3,6,0.4071285585956243,0.4071285585956243,Kentucky,Marquette,5,5,NA,234000061,2003-03-29
97,1,7:30,1650,1650,Robert Jackson made Two Point Jumper.,19,24,-5,20,0.3479435218667655,0.3479435218667655,Kentucky,Marquette,5,5,NA,234000061,2003-03-29
98,1,7:10,1630,1630,Foul on Terry Sanders,19,24,-5,0,0.34669027755208887,0.34669027755208887,Kentucky,Marquette,5,5,NA,234000061,2003-03-29
99,1,7:10,1630,1630,Marquis Estill missed Free Throw.,19,24,-5,3,0.34669027755208887,0.34669027755208887,Kentucky,Marquette,5,5,NA,234000061,2003-03-29
100,1,7:07,1627,1627,Robert Jackson Defensive Rebound.,20,24,-4,16,0.37576708166277667,0.37576708166277667,Kentucky,Marquette,5,5,NA,234000061,2003-03-29
101,1,6:51,1611,1611,Steve Novak missed Three Point Jumper.,20,24,-4,0,0.374946760884135,0.374946760884135,Kentucky,Marquette,5,5,NA,234000061,2003-03-29
102,1,6:51,1611,1611,Robert Jackson Offensive Rebound.,20,24,-4,11,0.374946760884135,0.374946760884135,Kentucky,Marquette,5,5,NA,234000061,2003-03-29
103,1,6:40,1600,1600,Keith Bogans missed Three Point Jumper.,20,24,-4,1,0.3743846725128115,0.3743846725128115,Kentucky,Marquette,5,5,NA,234000061,2003-03-29
104,1,6:39,1599,1599,Marquis Estill Offensive Rebound.,20,24,-4,1,0.3743335917243207,0.3743335917243207,Kentucky,Marquette,5,5,NA,234000061,2003-03-29
105,1,6:38,1598,1598,Marquis Estill missed Two Point Layup.,20,24,-4,4,0.3742825094888457,0.3742825094888457,Kentucky,Marquette,5,5,NA,234000061,2003-03-29
106,1,6:34,1594,1594,Steve Novak Defensive Rebound.,20,24,-4,5,0.37407814545308254,0.37407814545308254,Kentucky,Marquette,5,5,NA,234000061,2003-03-29
107,1,6:29,1589,1589,Dwyane Wade made Two Point Layup.,20,26,-6,0,0.3156622070514507,0.3156622070514507,Kentucky,Marquette,5,5,NA,234000061,2003-03-29
108,1,6:29,1589,1589,Kentucky Official TV Timeout.,20,26,-6,19,0.3156622070514507,0.3156622070514507,Kentucky,Marquette,4,5,NA,234000061,2003-03-29
109,1,6:10,1570,1570,Keith Bogans missed Two Point Jumper.,20,26,-6,0,0.3143132562904294,0.3143132562904294,Kentucky,Marquette,4,5,NA,234000061,2003-03-29
110,1,6:10,1570,1570,Marquette Defensive Rebound.,20,26,-6,3,0.3143132562904294,0.3143132562904294,Kentucky,Marquette,4,5,NA,234000061,2003-03-29
111,1,6:07,1567,1567,Foul on Erik Daniels,20,26,-6,24,0.3140992428765979,0.3140992428765979,Kentucky,Marquette,4,5,NA,234000061,2003-03-29
112,1,5:43,1543,1543,Cliff Hawkins missed Two Point Jumper.,20,26,-6,0,0.3123701323872681,0.3123701323872681,Kentucky,Marquette,4,5,NA,234000061,2003-03-29
113,1,5:43,1543,1543,Travis Diener Defensive Rebound.,20,26,-6,6,0.3123701323872681,0.3123701323872681,Kentucky,Marquette,4,5,NA,234000061,2003-03-29
114,1,5:37,1537,1537,Foul on Chuck Hayes,20,26,-6,0,0.311931750801346,0.311931750801346,Kentucky,Marquette,4,5,NA,234000061,2003-03-29
115,1,5:37,1537,1537,Dwyane Wade made Free Throw.,20,27,-7,0,0.2843563344847235,0.2843563344847235,Kentucky,Marquette,4,5,NA,234000061,2003-03-29
116,1,5:37,1537,1537,Dwyane Wade made Free Throw.,20,28,-8,11,0.2583035111863332,0.2583035111863332,Kentucky,Marquette,4,5,NA,234000061,2003-03-29
117,1,5:26,1526,1526,Marquis Estill missed Two Point Jumper.,20,28,-8,0,0.2573378180929273,0.2573378180929273,Kentucky,Marquette,4,5,NA,234000061,2003-03-29
118,1,5:26,1526,1526,Robert Jackson Defensive Rebound.,20,28,-8,2,0.2573378180929273,0.2573378180929273,Kentucky,Marquette,4,5,NA,234000061,2003-03-29
119,1,5:24,1524,1524,Foul on Marquis Estill,20,28,-8,0,0.2571608674657768,0.2571608674657768,Kentucky,Marquette,4,5,NA,234000061,2003-03-29
120,1,5:24,1524,1524,Robert Jackson made Free Throw.,20,29,-9,0,0.2326558832278035,0.2326558832278035,Kentucky,Marquette,4,5,NA,234000061,2003-03-29
121,1,5:24,1524,1524,Robert Jackson missed Free Throw.,20,29,-9,0,0.2326558832278035,0.2326558832278035,Kentucky,Marquette,4,5,NA,234000061,2003-03-29
122,1,5:24,1524,1524,Gerald Fitch Defensive Rebound.,20,29,-9,29,0.2326558832278035,0.2326558832278035,Kentucky,Marquette,4,5,NA,234000061,2003-03-29
123,1,4:55,1495,1495,Travis Diener made Three Point Jumper.,20,32,-12,16,0.16633425460826012,0.16633425460826012,Kentucky,Marquette,4,5,NA,234000061,2003-03-29
124,1,4:39,1479,1479,Foul on Chuck Hayes,20,32,-12,11,0.1646911115812554,0.1646911115812554,Kentucky,Marquette,4,5,NA,234000061,2003-03-29
125,1,4:28,1468,1468,Steve Novak missed Three Point Jumper.,20,32,-12,0,0.16353610796934287,0.16353610796934287,Kentucky,Marquette,4,5,NA,234000061,2003-03-29
126,1,4:28,1468,1468,Scott Merritt Offensive Rebound.,20,32,-12,7,0.16353610796934287,0.16353610796934287,Kentucky,Marquette,4,5,NA,234000061,2003-03-29
127,1,4:21,1461,1461,Marquette Full Timeout.,20,32,-12,6,0.16278930251395946,0.16278930251395946,Kentucky,Marquette,4,4,NA,234000061,2003-03-29
128,1,4:15,1455,1455,Cliff Hawkins missed Two Point Jumper.,20,32,-12,0,0.16214143105998946,0.16214143105998946,Kentucky,Marquette,4,4,NA,234000061,2003-03-29
129,1,4:15,1455,1455,Dwyane Wade Defensive Rebound.,20,32,-12,7,0.16214143105998946,0.16214143105998946,Kentucky,Marquette,4,4,NA,234000061,2003-03-29
130,1,4:08,1448,1448,Dwyane Wade missed Two Point Jumper.,20,32,-12,0,0.16137717283904093,0.16137717283904093,Kentucky,Marquette,4,4,NA,234000061,2003-03-29
131,1,4:08,1448,1448,Jules Camara Defensive Rebound.,20,32,-12,11,0.16137717283904093,0.16137717283904093,Kentucky,Marquette,4,4,NA,234000061,2003-03-29
132,1,3:57,1437,1437,Foul on Scott Merritt,20,32,-12,0,0.16019583913215277,0.16019583913215277,Kentucky,Marquette,4,4,NA,234000061,2003-03-29
133,1,3:57,1437,1437,Marquis Estill made Free Throw.,21,32,-11,0,0.17965194662741604,0.17965194662741604,Kentucky,Marquette,4,4,NA,234000061,2003-03-29
134,1,3:57,1437,1437,Marquis Estill made Free Throw.,22,32,-10,0,0.2009057427595053,0.2009057427595053,Kentucky,Marquette,4,4,NA,234000061,2003-03-29
135,1,3:57,1437,1437,Kentucky Official TV Timeout.,22,32,-10,14,0.2009057427595053,0.2009057427595053,Kentucky,Marquette,3,4,NA,234000061,2003-03-29
136,1,3:43,1423,1423,Steve Novak made Three Point Jumper.,22,35,-13,22,0.1410482267602058,0.1410482267602058,Kentucky,Marquette,3,4,NA,234000061,2003-03-29
137,1,3:21,1401,1401,Keith Bogans missed Two Point Jumper.,22,35,-13,0,0.13888249280845263,0.13888249280845263,Kentucky,Marquette,3,4,NA,234000061,2003-03-29
138,1,3:21,1401,1401,Travis Diener Defensive Rebound.,22,35,-13,9,0.13888249280845263,0.13888249280845263,Kentucky,Marquette,3,4,NA,234000061,2003-03-29
139,1,3:12,1392,1392,Steve Novak made Three Point Jumper.,22,38,-16,36,0.09495617928739913,0.09495617928739913,Kentucky,Marquette,3,4,NA,234000061,2003-03-29
140,1,2:36,1356,1356,Foul on Steve Novak,22,38,-16,0,0.09196761526898303,0.09196761526898303,Kentucky,Marquette,3,4,NA,234000061,2003-03-29
141,1,2:36,1356,1356,Keith Bogans made Free Throw.,23,38,-15,0,0.10463734564244297,0.10463734564244297,Kentucky,Marquette,3,4,NA,234000061,2003-03-29
142,1,2:36,1356,1356,Keith Bogans made Free Throw.,24,38,-14,6,0.11882409187978173,0.11882409187978173,Kentucky,Marquette,3,4,NA,234000061,2003-03-29
143,1,2:30,1350,1350,Robert Jackson made Two Point Layup.,24,40,-16,15,0.09147655305719837,0.09147655305719837,Kentucky,Marquette,3,4,NA,234000061,2003-03-29
144,1,2:15,1335,1335,Antwain Barbour missed Two Point Layup.,24,40,-16,0,0.09024990568869154,0.09024990568869154,Kentucky,Marquette,3,4,NA,234000061,2003-03-29
145,1,2:15,1335,1335,Kentucky Defensive Rebound.,24,40,-16,1,0.09024990568869154,0.09024990568869154,Kentucky,Marquette,3,4,NA,234000061,2003-03-29
146,1,2:14,1334,1334,Foul on Robert Jackson,24,40,-16,0,0.09016803497120715,0.09016803497120715,Kentucky,Marquette,3,4,NA,234000061,2003-03-29
147,1,2:14,1334,1334,Cliff Hawkins made Free Throw.,25,40,-15,0,0.10274306657817649,0.10274306657817649,Kentucky,Marquette,3,4,NA,234000061,2003-03-29
148,1,2:14,1334,1334,Cliff Hawkins missed Free Throw.,25,40,-15,0,0.10274306657817649,0.10274306657817649,Kentucky,Marquette,3,4,NA,234000061,2003-03-29
149,1,2:14,1334,1334,Dwyane Wade Defensive Rebound.,25,40,-15,9,0.10274306657817649,0.10274306657817649,Kentucky,Marquette,3,4,NA,234000061,2003-03-29
150,1,2:05,1325,1325,Travis Diener missed Three Point Jumper.,25,40,-15,0,0.10196504860066435,0.10196504860066435,Kentucky,Marquette,3,4,NA,234000061,2003-03-29
151,1,2:05,1325,1325,Dwyane Wade Offensive Rebound.,25,40,-15,2,0.10196504860066435,0.10196504860066435,Kentucky,Marquette,3,4,NA,234000061,2003-03-29
152,1,2:03,1323,1323,Dwyane Wade missed Two Point Jumper.,25,40,-15,0,0.10179160491197199,0.10179160491197199,Kentucky,Marquette,3,4,NA,234000061,2003-03-29
153,1,2:03,1323,1323,Kelenna Azubuike Defensive Rebound.,25,40,-15,11,0.10179160491197199,0.10179160491197199,Kentucky,Marquette,3,4,NA,234000061,2003-03-29
154,1,1:52,1312,1312,Gerald Fitch missed Three Point Jumper.,25,40,-15,0,0.10083279900747726,0.10083279900747726,Kentucky,Marquette,3,4,NA,234000061,2003-03-29
155,1,1:52,1312,1312,Robert Jackson Defensive Rebound.,25,40,-15,35,0.10083279900747726,0.10083279900747726,Kentucky,Marquette,3,4,NA,234000061,2003-03-29
156,1,1:17,1277,1277,Steve Novak made Three Point Jumper.,25,43,-18,11,0.0649069070034157,0.0649069070034157,Kentucky,Marquette,3,4,NA,234000061,2003-03-29
157,1,1:06,1266,1266,Cliff Hawkins missed Three Point Jumper.,25,43,-18,0,0.06406312223885695,0.06406312223885695,Kentucky,Marquette,3,4,NA,234000061,2003-03-29
158,1,1:06,1266,1266,Todd Townsend Defensive Rebound.,25,43,-18,29,0.06406312223885695,0.06406312223885695,Kentucky,Marquette,3,4,NA,234000061,2003-03-29
159,1,0:37,1237,1237,Robert Jackson made Two Point Layup.,25,45,-20,18,0.046392124049064405,0.046392124049064405,Kentucky,Marquette,3,4,NA,234000061,2003-03-29
160,1,0:19,1219,1219,Kentucky Full Timeout.,25,45,-20,5,0.04511999122258273,0.04511999122258273,Kentucky,Marquette,2,4,NA,234000061,2003-03-29
161,1,0:14,1214,1214,Cliff Hawkins made Two Point Jumper.,27,45,-18,9,0.0598264301915274,0.0598264301915274,Kentucky,Marquette,2,4,NA,234000061,2003-03-29
162,1,0:05,1205,1205,Travis Diener missed Three Point Jumper.,27,45,-18,0,0.05905018360671501,0.05905018360671501,Kentucky,Marquette,2,4,NA,234000061,2003-03-29
163,1,0:05,1205,1205,Marquis Estill Defensive Rebound.,27,45,-18,5,0.05905018360671501,0.05905018360671501,Kentucky,Marquette,2,4,NA,234000061,2003-03-29
164,1,0:00,1200,1200,End of the 1st Half.,27,45,-18,0,0.05862720964835187,0.05862720964835187,Kentucky,Marquette,2,4,NA,234000061,2003-03-29
165,2,20:00,1200,1200,PLAY,27,45,-18,6,0.05862720964835187,0.05862720964835187,Kentucky,Marquette,2,4,NA,234000061,2003-03-29
166,2,19:54,1194,1194,Cliff Hawkins made Two Point Jumper.,29,45,-16,23,0.07757653283376745,0.07757653283376745,Kentucky,Marquette,2,4,NA,234000061,2003-03-29
167,2,19:31,1171,1171,Foul on Gerald Fitch,29,45,-16,22,0.07544512721053881,0.07544512721053881,Kentucky,Marquette,2,4,NA,234000061,2003-03-29
168,2,19:09,1149,1149,Foul on Travis Diener,29,45,-16,2,0.07350517890566254,0.07350517890566254,Kentucky,Marquette,2,4,NA,234000061,2003-03-29
169,2,19:07,1147,1147,Keith Bogans made Three Point Jumper.,32,45,-13,19,0.1129473993146145,0.1129473993146145,Kentucky,Marquette,2,4,NA,234000061,2003-03-29
170,2,18:48,1128,1128,Travis Diener missed Three Point Jumper.,32,45,-13,0,0.11099938208826673,0.11099938208826673,Kentucky,Marquette,2,4,NA,234000061,2003-03-29
171,2,18:48,1128,1128,Erik Daniels Defensive Rebound.,32,45,-13,10,0.11099938208826673,0.11099938208826673,Kentucky,Marquette,2,4,NA,234000061,2003-03-29
172,2,18:38,1118,1118,Cliff Hawkins missed Two Point Jumper.,32,45,-13,0,0.1099821754155058,0.1099821754155058,Kentucky,Marquette,2,4,NA,234000061,2003-03-29
173,2,18:38,1118,1118,Robert Jackson Defensive Rebound.,32,45,-13,9,0.1099821754155058,0.1099821754155058,Kentucky,Marquette,2,4,NA,234000061,2003-03-29
174,2,18:29,1109,1109,Dwyane Wade made Two Point Dunk Shot.,32,47,-15,14,0.0814039753449062,0.0814039753449062,Kentucky,Marquette,2,4,NA,234000061,2003-03-29
175,2,18:15,1095,1095,Erik Daniels made Two Point Layup.,34,47,-13,41,0.10764139283918735,0.10764139283918735,Kentucky,Marquette,2,4,NA,234000061,2003-03-29
176,2,17:34,1054,1054,Foul on Keith Bogans,34,47,-13,0,0.10336324588307409,0.10336324588307409,Kentucky,Marquette,2,4,NA,234000061,2003-03-29
