play_id,half,time_remaining_half,secs_remaining,secs_remaining_absolute,description,home_score,away_score,score_diff,play_length,win_prob,naive_win_prob,home,away,home_time_out_remaining,away_time_out_remaining,home_favored_by,game_id,date
190,2,17:37,1057,1357,Jonah Mathews made Three Point Jumper. Assisted by Bennie Boatwright.,45,46,-1,11,0.5785038848226833,0.4586152324047573,UCLA,USC,3,4,4,401087158,2019-02-28
191,2,17:26,1046,1346,Chris Smith Turnover.,45,46,-1,0,0.5778574612486675,0.458370448552782,UCLA,USC,3,4,4,401087158,2019-02-28
192,2,17:26,1046,1346,Kevin Porter Jr. Steal.,45,46,-1,6,0.5778574612486675,0.458370448552782,UCLA,USC,3,4,4,401087158,2019-02-28
193,2,17:20,1040,1340,Kevin Porter Jr. made Dunk. Assisted by Shaqquan Aaron.,45,48,-3,16,0.49440311775881823,0.3769850299066314,UCLA,USC,3,4,4,401087158,2019-02-28
194,2,17:04,1024,1324,Chris Smith missed Jumper.,45,48,-3,0,0.4926535148860609,0.3759168913516254,UCLA,USC,3,4,4,401087158,2019-02-28
195,2,17:04,1024,1324,Bennie Boatwright Defensive Rebound.,45,48,-3,23,0.4926535148860609,0.3759168913516254,UCLA,USC,3,4,4,401087158,2019-02-28
196,2,16:41,1001,1301,Jonah Mathews missed Three Point Jumper.,45,48,-3,0,0.4900190278088021,0.37428297050489623,UCLA,USC,3,4,4,401087158,2019-02-28
197,2,16:41,1001,1301,Chris Smith Defensive Rebound.,45,48,-3,9,0.4900190278088021,0.37428297050489623,UCLA,USC,3,4,4,401087158,2019-02-28
198,2,16:32,992,1292,Chris Smith made Layup.,47,48,-1,0,0.5745120644449265,0.4570419578989788,UCLA,USC,3,4,4,401087158,2019-02-28
199,2,16:32,992,1292,Foul on Kevin Porter Jr..,47,48,-1,0,0.5745120644449265,0.4570419578989788,UCLA,USC,3,4,4,401087158,2019-02-28
200,2,16:32,992,1292,Chris Smith made Free Throw.,48,48,0,27,0.6159850834566715,0.5,UCLA,USC,3,4,4,401087158,2019-02-28
201,2,16:05,965,1265,Foul on Jules Bernard.,48,48,0,12,0.6149650573630047,0.5,UCLA,USC,3,4,4,401087158,2019-02-28
202,2,15:53,953,1253,Jonah Mathews made Three Point Jumper. Assisted by Shaqquan Aaron.,48,51,-3,22,0.48410257794113526,0.37052197891901506,UCLA,USC,3,4,4,401087158,2019-02-28
203,2,15:31,931,1231,Jules Bernard made Three Point Jumper. Assisted by Jalen Hill.,51,51,0,14,0.6137542861041784,0.5,UCLA,USC,3,4,4,401087158,2019-02-28
204,2,15:17,917,1217,Bennie Boatwright missed Three Point Jumper.,51,51,0,0,0.6132864667065445,0.5,UCLA,USC,3,4,4,401087158,2019-02-28
205,2,15:17,917,1217,Shaqquan Aaron Offensive Rebound.,51,51,0,5,0.6132864667065445,0.5,UCLA,USC,3,4,4,401087158,2019-02-28
206,2,15:12,912,1212,Foul on Jules Bernard.,51,51,0,0,0.6131226040773932,0.5,UCLA,USC,3,4,4,401087158,2019-02-28
207,2,15:12,912,1212,Official TV Timeout,51,51,0,8,0.6131226040773932,0.5,UCLA,USC,3,4,4,401087158,2019-02-28
208,2,15:04,904,1204,Jonah Mathews missed Three Point Jumper.,51,51,0,0,0.6128633131921232,0.5,UCLA,USC,3,4,4,401087158,2019-02-28
209,2,15:04,904,1204,Nick Rakocevic Offensive Rebound.,51,51,0,16,0.6128633131921232,0.5,UCLA,USC,3,4,4,401087158,2019-02-28
210,2,14:48,888,1188,Foul on Jalen Hill.,51,51,0,0,0.6123528934551788,0.5,UCLA,USC,3,4,4,401087158,2019-02-28
211,2,14:48,888,1188,Bennie Boatwright missed Free Throw.,51,51,0,0,0.6123528934551788,0.5,UCLA,USC,3,4,4,401087158,2019-02-28
212,2,14:48,888,1188,USC Deadball Team Rebound.,51,51,0,0,0.6123528934551788,0.5,UCLA,USC,3,4,4,401087158,2019-02-28
213,2,14:48,888,1188,Bennie Boatwright missed Free Throw.,51,51,0,0,0.6123528934551788,0.5,UCLA,USC,3,4,4,401087158,2019-02-28
214,2,14:48,888,1188,Jalen Hill Defensive Rebound.,51,51,0,6,0.6123528934551788,0.5,UCLA,USC,3,4,4,401087158,2019-02-28
215,2,14:42,882,1182,Kris Wilkes made Layup. Assisted by Jaylen Hands.,53,51,2,0,0.6948845863934828,0.5906469650673569,UCLA,USC,3,4,4,401087158,2019-02-28
216,2,14:42,882,1182,Foul on Bennie Boatwright.,53,51,2,0,0.6948845863934828,0.5906469650673569,UCLA,USC,3,4,4,401087158,2019-02-28
217,2,14:42,882,1182,Kris Wilkes made Free Throw.,54,51,3,11,0.7323103137232044,0.6341264976315992,UCLA,USC,3,4,4,401087158,2019-02-28
218,2,14:31,871,1171,Shaqquan Aaron missed Jumper.,54,51,3,0,0.732589360210655,0.634794755248063,UCLA,USC,3,4,4,401087158,2019-02-28
219,2,14:31,871,1171,Moses Brown Defensive Rebound.,54,51,3,14,0.732589360210655,0.634794755248063,UCLA,USC,3,4,4,401087158,2019-02-28
220,2,14:17,857,1157,Chris Smith Turnover.,54,51,3,23,0.7329545204239626,0.6356564992587657,UCLA,USC,3,4,4,401087158,2019-02-28
221,2,13:54,834,1134,Derryck Thornton missed Jumper.,54,51,3,0,0.7336031601898652,0.6371373625758671,UCLA,USC,3,4,4,401087158,2019-02-28
222,2,13:54,834,1134,Chris Smith Defensive Rebound.,54,51,3,8,0.7336031601898652,0.6371373625758671,UCLA,USC,3,4,4,401087158,2019-02-28
223,2,13:46,826,1126,Foul on Jonah Mathews.,54,51,3,0,0.7338496139252387,0.6376817170704719,UCLA,USC,3,4,4,401087158,2019-02-28
224,2,13:46,826,1126,Moses Brown made Free Throw.,55,51,4,0,0.7690014377460265,0.6799963358601988,UCLA,USC,3,4,4,401087158,2019-02-28
225,2,13:46,826,1126,Moses Brown made Free Throw.,56,51,5,7,0.8007709994979466,0.7195425624348354,UCLA,USC,3,4,4,401087158,2019-02-28
226,2,13:39,819,1119,J'Raan Brooks missed Three Point Jumper.,56,51,5,0,0.8011827319962505,0.7202589590035492,UCLA,USC,3,4,4,401087158,2019-02-28
227,2,13:39,819,1119,Alex Olesinski Defensive Rebound.,56,51,5,23,0.8011827319962505,0.7202589590035492,UCLA,USC,3,4,4,401087158,2019-02-28
228,2,13:16,796,1096,Kris Wilkes missed Three Point Jumper.,56,51,5,0,0.8026643460731643,0.7227954744188415,UCLA,USC,3,4,4,401087158,2019-02-28
229,2,13:16,796,1096,Jules Bernard Offensive Rebound.,56,51,5,3,0.8026643460731643,0.7227954744188415,UCLA,USC,3,4,4,401087158,2019-02-28
230,2,13:13,793,1093,Foul on Elijah Weaver.,56,51,5,24,0.8028743762818139,0.7231502456090781,UCLA,USC,3,4,4,401087158,2019-02-28
231,2,12:49,769,1069,Jaylen Hands made Three Point Jumper. Assisted by Alex Olesinski.,59,51,8,21,0.8809448021159263,0.8264832259463697,UCLA,USC,3,4,4,401087158,2019-02-28
232,2,12:28,748,1048,J'Raan Brooks made Layup. Assisted by Derryck Thornton.,59,53,6,8,0.8356782404794465,0.7666393146751568,UCLA,USC,3,4,4,401087158,2019-02-28
233,2,12:20,740,1040,Jules Bernard made Layup. Assisted by Kris Wilkes.,61,53,8,0,0.884113166630065,0.8315149031839145,UCLA,USC,3,4,4,401087158,2019-02-28
234,2,12:20,740,1040,Foul on Elijah Weaver.,61,53,8,0,0.884113166630065,0.8315149031839145,UCLA,USC,3,4,4,401087158,2019-02-28
235,2,12:20,740,1040,Jules Bernard made Free Throw.,62,53,9,14,0.90304462684061,0.8576554797833256,UCLA,USC,3,4,4,401087158,2019-02-28
236,2,12:06,726,1026,Jonah Mathews missed Three Point Jumper.,62,53,9,0,0.9047377969881587,0.8603293000265579,UCLA,USC,3,4,4,401087158,2019-02-28
237,2,12:06,726,1026,Moses Brown Defensive Rebound.,62,53,9,14,0.9047377969881587,0.8603293000265579,UCLA,USC,3,4,4,401087158,2019-02-28
238,2,11:52,712,1012,Moses Brown missed Layup.,62,53,9,0,0.9063080943147348,0.8628230706322891,UCLA,USC,3,4,4,401087158,2019-02-28
239,2,11:52,712,1012,Moses Brown Offensive Rebound.,62,53,9,4,0.9063080943147348,0.8628230706322891,UCLA,USC,3,4,4,401087158,2019-02-28
240,2,11:48,708,1008,Foul on Elijah Weaver.,62,53,9,0,0.9067230714045453,0.8634860177807242,UCLA,USC,3,4,4,401087158,2019-02-28
241,2,11:48,708,1008,Official TV Timeout,62,53,9,0,0.9067230714045453,0.8634860177807242,UCLA,USC,3,4,4,401087158,2019-02-28
242,2,11:48,708,1008,Moses Brown missed Free Throw.,62,53,9,0,0.9067230714045453,0.8634860177807242,UCLA,USC,3,4,4,401087158,2019-02-28
243,2,11:48,708,1008,Bennie Boatwright Defensive Rebound.,62,53,9,15,0.9067230714045453,0.8634860177807242,UCLA,USC,3,4,4,401087158,2019-02-28
244,2,11:33,693,993,Nick Rakocevic missed Jumper.,62,53,9,0,0.9081745926185355,0.8658178519291224,UCLA,USC,3,4,4,401087158,2019-02-28
245,2,11:33,693,993,Kris Wilkes Defensive Rebound.,62,53,9,5,0.9081745926185355,0.8658178519291224,UCLA,USC,3,4,4,401087158,2019-02-28
246,2,11:28,688,988,Jules Bernard missed Three Point Jumper.,62,53,9,0,0.9086287389073218,0.8665512949026802,UCLA,USC,3,4,4,401087158,2019-02-28
247,2,11:28,688,988,USC Defensive Rebound.,62,53,9,15,0.9086287389073218,0.8665512949026802,UCLA,USC,3,4,4,401087158,2019-02-28
248,2,11:13,673,973,Bennie Boatwright missed Jumper.,62,53,9,0,0.9099316843724413,0.8686633928468586,UCLA,USC,3,4,4,401087158,2019-02-28
249,2,11:13,673,973,Kris Wilkes Defensive Rebound.,62,53,9,11,0.9099316843724413,0.8686633928468586,UCLA,USC,3,4,4,401087158,2019-02-28
250,2,11:02,662,962,Kris Wilkes Turnover.,62,53,9,13,0.910854436647943,0.870163174461866,UCLA,USC,3,4,4,401087158,2019-02-28
251,2,10:49,649,949,Kevin Porter Jr. missed Three Point Jumper.,62,53,9,0,0.9119409435365771,0.8719283202544527,UCLA,USC,3,4,4,401087158,2019-02-28
252,2,10:49,649,949,Shaqquan Aaron Offensive Rebound.,62,53,9,9,0.9119409435365771,0.8719283202544527,UCLA,USC,3,4,4,401087158,2019-02-28
253,2,10:40,640,940,Bennie Boatwright made Three Point Jumper. Assisted by Shaqquan Aaron.,62,56,6,11,0.8460630912635699,0.7835008057311627,UCLA,USC,3,4,4,401087158,2019-02-28
254,2,10:29,629,929,Jaylen Hands made Layup.,64,56,8,22,0.8950528374243725,0.8490962226175942,UCLA,USC,3,4,4,401087158,2019-02-28
255,2,10:07,607,907,Shaqquan Aaron made Layup. Assisted by Bennie Boatwright.,64,58,6,11,0.8491894382540711,0.7885921054791856,UCLA,USC,3,4,4,401087158,2019-02-28
256,2,9:56,596,896,Alex Olesinski missed Layup.,64,58,6,0,0.850408400107132,0.7905363906979639,UCLA,USC,3,4,4,401087158,2019-02-28
257,2,9:56,596,896,Alex Olesinski Offensive Rebound.,64,58,6,5,0.850408400107132,0.7905363906979639,UCLA,USC,3,4,4,401087158,2019-02-28
258,2,9:51,591,891,Foul on Nick Rakocevic.,64,58,6,0,0.8510010224725048,0.7914739955450083,UCLA,USC,3,4,4,401087158,2019-02-28
259,2,9:51,591,891,Alex Olesinski made Free Throw.,65,58,7,0,0.8770492663644095,0.8257985995552156,UCLA,USC,3,4,4,401087158,2019-02-28
260,2,9:51,591,891,Alex Olesinski made Free Throw.,66,58,8,18,0.8990837274806979,0.8555046694226017,UCLA,USC,3,4,4,401087158,2019-02-28
261,2,9:33,573,873,Bennie Boatwright missed Three Point Jumper.,66,58,8,0,0.9014439031680761,0.8591822250913058,UCLA,USC,3,4,4,401087158,2019-02-28
262,2,9:33,573,873,Nick Rakocevic Offensive Rebound.,66,58,8,9,0.9014439031680761,0.8591822250913058,UCLA,USC,3,4,4,401087158,2019-02-28
263,2,9:24,564,864,Derryck Thornton made Three Point Jumper. Assisted by Shaqquan Aaron.,66,61,5,23,0.8240111791359954,0.7578458184072355,UCLA,USC,3,4,4,401087158,2019-02-28
264,2,9:01,541,841,Alex Olesinski missed Three Point Jumper.,66,61,5,0,0.8275672845838942,0.763331775597358,UCLA,USC,3,4,4,401087158,2019-02-28
265,2,9:01,541,841,Jonah Mathews Defensive Rebound.,66,61,5,9,0.8275672845838942,0.763331775597358,UCLA,USC,3,4,4,401087158,2019-02-28
266,2,8:52,532,832,Jonah Mathews missed Three Point Jumper.,66,61,5,0,0.8287959550041384,0.7652609181814243,UCLA,USC,3,4,4,401087158,2019-02-28
267,2,8:52,532,832,Moses Brown Defensive Rebound.,66,61,5,5,0.8287959550041384,0.7652609181814243,UCLA,USC,3,4,4,401087158,2019-02-28
268,2,8:47,527,827,Jump Ball won by UCLA,66,61,5,20,0.8294235108018848,0.7662585085945398,UCLA,USC,3,4,4,401087158,2019-02-28
269,2,8:27,507,807,Jules Bernard missed Three Point Jumper.,66,61,5,0,0.8316932694699379,0.7699253823271995,UCLA,USC,3,4,4,401087158,2019-02-28
270,2,8:27,507,807,Moses Brown Offensive Rebound.,66,61,5,6,0.8316932694699379,0.7699253823271995,UCLA,USC,3,4,4,401087158,2019-02-28
271,2,8:21,501,801,Foul on Nick Rakocevic.,66,61,5,0,0.8323415835126453,0.770981795605804,UCLA,USC,3,4,4,401087158,2019-02-28
272,2,8:21,501,801,Moses Brown missed Free Throw.,66,61,5,0,0.8323415835126453,0.770981795605804,UCLA,USC,3,4,4,401087158,2019-02-28
273,2,8:21,501,801,Shaqquan Aaron Defensive Rebound.,66,61,5,22,0.8323415835126453,0.770981795605804,UCLA,USC,3,4,4,401087158,2019-02-28
274,2,7:59,479,779,Derryck Thornton missed Layup.,66,61,5,0,0.834842050148507,0.7750230884475767,UCLA,USC,3,4,4,401087158,2019-02-28
275,2,7:59,479,779,Moses Brown Defensive Rebound.,66,61,5,24,0.834842050148507,0.7750230884475767,UCLA,USC,3,4,4,401087158,2019-02-28
276,2,7:35,455,755,Foul on Jalen Hill.,66,61,5,0,0.8382599451083924,0.7803642570494889,UCLA,USC,3,4,4,401087158,2019-02-28
277,2,7:35,455,755,Jalen Hill Turnover.,66,61,5,0,0.8382599451083924,0.7803642570494889,UCLA,USC,3,4,4,401087158,2019-02-28
278,2,7:35,455,755,Official TV Timeout,66,61,5,19,0.8382599451083924,0.7803642570494889,UCLA,USC,3,4,4,401087158,2019-02-28
279,2,7:16,436,736,Bennie Boatwright made Three Point Jumper. Assisted by Elijah Weaver.,66,64,2,17,0.7093706921423061,0.6271462346325406,UCLA,USC,3,4,4,401087158,2019-02-28
280,2,6:59,419,719,Moses Brown made Dunk. Assisted by Jaylen Hands.,68,64,4,9,0.8076079713856414,0.7440957609050409,UCLA,USC,3,4,4,401087158,2019-02-28
281,2,6:50,410,710,Bennie Boatwright made Three Point Jumper. Assisted by Elijah Weaver.,68,67,1,6,0.6535239983519131,0.5671563827412811,UCLA,USC,3,4,4,401087158,2019-02-28
282,2,6:44,404,704,Jaylen Hands missed Jumper.,68,67,1,0,0.6535810682106751,0.56769952135583,UCLA,USC,3,4,4,401087158,2019-02-28
283,2,6:44,404,704,Bennie Boatwright Defensive Rebound.,68,67,1,12,0.6535810682106751,0.56769952135583,UCLA,USC,3,4,4,401087158,2019-02-28
284,2,6:32,392,692,Elijah Weaver made Three Point Jumper. Assisted by Shaqquan Aaron.,68,70,-2,15,0.45131277658686,0.3650117356674068,UCLA,USC,3,4,4,401087158,2019-02-28
285,2,6:17,377,677,UCLA  Timeout,68,70,-2,10,0.44725272065028554,0.3624318553768429,UCLA,USC,3,3,4,401087158,2019-02-28
286,2,6:07,367,667,Chris Smith made Jumper. Assisted by Jules Bernard.,70,70,0,15,0.5864742454345292,0.5,UCLA,USC,3,3,4,401087158,2019-02-28
287,2,5:52,352,652,Jonah Mathews missed Three Point Jumper.,70,70,0,0,0.585102881480241,0.5,UCLA,USC,3,3,4,401087158,2019-02-28
288,2,5:52,352,652,Chris Smith Defensive Rebound.,70,70,0,23,0.585102881480241,0.5,UCLA,USC,3,3,4,401087158,2019-02-28
289,2,5:29,329,629,Jalen Hill made Layup. Assisted by Jaylen Hands.,72,70,2,0,0.7200037083721571,0.6479028411351853,UCLA,USC,3,3,4,401087158,2019-02-28
290,2,5:29,329,629,Foul on Bennie Boatwright.,72,70,2,0,0.7200037083721571,0.6479028411351853,UCLA,USC,3,3,4,401087158,2019-02-28
291,2,5:29,329,629,Jalen Hill missed Free Throw.,72,70,2,0,0.7200037083721571,0.6479028411351853,UCLA,USC,3,3,4,401087158,2019-02-28
292,2,5:29,329,629,Nick Rakocevic Defensive Rebound.,72,70,2,23,0.7200037083721571,0.6479028411351853,UCLA,USC,3,3,4,401087158,2019-02-28
293,2,5:06,306,606,Foul on Chris Smith.,72,70,2,6,0.7241933190437828,0.6548293701067865,UCLA,USC,3,3,4,401087158,2019-02-28
294,2,5:00,300,600,Bennie Boatwright Turnover.,72,70,2,0,0.7247849629232999,0.6560704769189987,UCLA,USC,3,3,4,401087158,2019-02-28
295,2,5:00,300,600,Kris Wilkes Steal.,72,70,2,9,0.7247849629232999,0.6560704769189987,UCLA,USC,3,3,4,401087158,2019-02-28
296,2,4:51,291,591,Foul on Jonah Mathews.,72,70,2,0,0.724766864791235,0.6569001951928126,UCLA,USC,3,3,4,401087158,2019-02-28
297,2,4:51,291,591,Jalen Hill made Free Throw.,73,70,3,0,0.7846523226251145,0.7259689997244143,UCLA,USC,3,3,4,401087158,2019-02-28
298,2,4:51,291,591,Jalen Hill made Free Throw.,74,70,4,21,0.8344835231565476,0.7856702456141216,UCLA,USC,3,3,4,401087158,2019-02-28
299,2,4:30,270,570,Jonah Mathews made Three Point Jumper. Assisted by Shaqquan Aaron.,74,73,1,18,0.6528972714720606,0.5797795817773203,UCLA,USC,3,3,4,401087158,2019-02-28
300,2,4:12,252,552,Chris Smith missed Jumper.,74,73,1,0,0.6499394822732227,0.5784834395473435,UCLA,USC,3,3,4,401087158,2019-02-28
301,2,4:12,252,552,Moses Brown Offensive Rebound.,74,73,1,4,0.6499394822732227,0.5784834395473435,UCLA,USC,3,3,4,401087158,2019-02-28
302,2,4:08,248,548,Moses Brown made Layup.,76,73,3,0,0.7768221858630486,0.7204661785491073,UCLA,USC,3,3,4,401087158,2019-02-28
303,2,4:08,248,548,Foul on Bennie Boatwright.,76,73,3,0,0.7768221858630486,0.7204661785491073,UCLA,USC,3,3,4,401087158,2019-02-28
304,2,4:08,248,548,Moses Brown missed Free Throw.,76,73,3,0,0.7768221858630486,0.7204661785491073,UCLA,USC,3,3,4,401087158,2019-02-28
305,2,4:08,248,548,Shaqquan Aaron Defensive Rebound.,76,73,3,18,0.7768221858630486,0.7204661785491073,UCLA,USC,3,3,4,401087158,2019-02-28
306,2,3:50,230,530,Elijah Weaver missed Three Point Jumper.,76,73,3,0,0.7749368500117979,0.7199278429754207,UCLA,USC,3,3,4,401087158,2019-02-28
307,2,3:50,230,530,Nick Rakocevic Offensive Rebound.,76,73,3,0,0.7749368500117979,0.7199278429754207,UCLA,USC,3,3,4,401087158,2019-02-28
308,2,3:50,230,530,Nick Rakocevic made Two Point Tip Shot.,76,75,1,22,0.6472557097399216,0.5780323633635677,UCLA,USC,3,3,4,401087158,2019-02-28
309,2,3:28,208,508,Kris Wilkes missed Dunk.,76,75,1,0,0.6476317197613347,0.5810658457421368,UCLA,USC,3,3,4,401087158,2019-02-28
310,2,3:28,208,508,Nick Rakocevic Block.,76,75,1,0,0.6476317197613347,0.5810658457421368,UCLA,USC,3,3,4,401087158,2019-02-28
311,2,3:28,208,508,Jonah Mathews Defensive Rebound.,76,75,1,17,0.6476317197613347,0.5810658457421368,UCLA,USC,3,3,4,401087158,2019-02-28
312,2,3:11,191,491,Elijah Weaver made Layup. Assisted by Jonah Mathews.,76,77,-1,15,0.47990566833245174,0.41271517560359106,UCLA,USC,3,3,4,401087158,2019-02-28
313,2,2:56,176,476,Foul on Shaqquan Aaron.,76,77,-1,0,0.46990313201751005,0.40509746317915823,UCLA,USC,3,3,4,401087158,2019-02-28
314,2,2:56,176,476,Official TV Timeout,76,77,-1,0,0.46990313201751005,0.40509746317915823,UCLA,USC,3,3,4,401087158,2019-02-28
315,2,2:56,176,476,Kris Wilkes made Free Throw.,77,77,0,0,0.5655546355637848,0.5,UCLA,USC,3,3,4,401087158,2019-02-28
316,2,2:56,176,476,Kris Wilkes missed Free Throw.,77,77,0,0,0.5655546355637848,0.5,UCLA,USC,3,3,4,401087158,2019-02-28
317,2,2:56,176,476,Nick Rakocevic Defensive Rebound.,77,77,0,13,0.5655546355637848,0.5,UCLA,USC,3,3,4,401087158,2019-02-28
318,2,2:43,163,463,Jonah Mathews made Layup.,77,79,-2,11,0.3612705878889929,0.3045042714980945,UCLA,USC,3,3,4,401087158,2019-02-28
319,2,2:32,152,452,Jaylen Hands made Three Point Jumper. Assisted by Chris Smith.,80,79,1,19,0.6656427975893896,0.608044049140897,UCLA,USC,3,3,4,401087158,2019-02-28
320,2,2:13,133,433,Jonah Mathews missed Three Point Jumper.,80,79,1,0,0.6743263347265516,0.6201664032082799,UCLA,USC,3,3,4,401087158,2019-02-28
321,2,2:13,133,433,Nick Rakocevic Offensive Rebound.,80,79,1,7,0.6743263347265516,0.6201664032082799,UCLA,USC,3,3,4,401087158,2019-02-28
322,2,2:06,126,426,Foul on Kris Wilkes.,80,79,1,0,0.6780073105383758,0.6251787413403298,UCLA,USC,3,3,4,401087158,2019-02-28
323,2,2:06,126,426,Nick Rakocevic missed Free Throw.,80,79,1,0,0.6780073105383758,0.6251787413403298,UCLA,USC,3,3,4,401087158,2019-02-28
324,2,2:06,126,426,Chris Smith Defensive Rebound.,80,79,1,23,0.6780073105383758,0.6251787413403298,UCLA,USC,3,3,4,401087158,2019-02-28
325,2,1:43,103,403,Kris Wilkes missed Three Point Jumper.,80,79,1,0,0.6924277293268087,0.644267487194147,UCLA,USC,3,3,4,401087158,2019-02-28
326,2,1:43,103,403,Bennie Boatwright Defensive Rebound.,80,79,1,21,0.6924277293268087,0.644267487194147,UCLA,USC,3,3,4,401087158,2019-02-28
327,2,1:22,82,382,Bennie Boatwright made Three Point Jumper. Assisted by Elijah Weaver.,80,82,-2,20,0.23684085256533355,0.20219012836907763,UCLA,USC,3,3,4,401087158,2019-02-28
328,2,1:02,62,362,Chris Smith made Jumper. Assisted by Jaylen Hands.,82,82,0,2,0.5467737849260162,0.5,UCLA,USC,3,3,4,401087158,2019-02-28
329,2,1:00,60,360,UCLA  Timeout,82,82,0,7,0.5463943830902616,0.5,UCLA,USC,3,2,4,401087158,2019-02-28
330,2,0:53,53,353,Bennie Boatwright missed Three Point Jumper.,82,82,0,0,0.5450529598429897,0.5,UCLA,USC,3,2,4,401087158,2019-02-28
331,2,0:53,53,353,Moses Brown Defensive Rebound.,82,82,0,16,0.5450529598429897,0.5,UCLA,USC,3,2,4,401087158,2019-02-28
332,2,0:37,37,337,UCLA  Timeout,82,82,0,12,0.5418991422097755,0.5,UCLA,USC,3,1,4,401087158,2019-02-28
333,2,0:25,25,325,Jaylen Hands missed Three Point Jumper.,82,82,0,0,0.5394571557710408,0.5,UCLA,USC,3,1,4,401087158,2019-02-28
334,2,0:25,25,325,Elijah Weaver Defensive Rebound.,82,82,0,6,0.5394571557710408,0.5,UCLA,USC,3,1,4,401087158,2019-02-28
335,2,0:19,19,319,USC  Timeout,82,82,0,17,0.5382132628818217,0.5,UCLA,USC,2,1,4,401087158,2019-02-28
336,2,0:02,2,302,Bennie Boatwright missed Three Point Jumper.,82,82,0,0,0.5345790629159767,0.5,UCLA,USC,2,1,4,401087158,2019-02-28
337,2,0:02,2,302,Jules Bernard Defensive Rebound.,82,82,0,2,0.5345790629159767,0.5,UCLA,USC,2,1,4,401087158,2019-02-28
338,2,0:00,300,300,End of 2nd half,82,82,0,0,0.5799311606756355,0.5,UCLA,USC,2,1,4,401087158,2019-02-28
339,3,5:00,300,300,PLAY,82,82,0,0,0.5799311606756355,0.5,UCLA,USC,3,2,4,401087158,2019-02-28
340,3,5:00,300,300,Jump Ball won by USC,82,82,0,14,0.5799311606756355,0.5,UCLA,USC,3,2,4,401087158,2019-02-28
341,3,4:46,286,286,Nick Rakocevic missed Layup.,82,82,0,0,0.5785034857011432,0.5,UCLA,USC,3,2,4,401087158,2019-02-28
342,3,4:46,286,286,Moses Brown Defensive Rebound.,82,82,0,21,0.5785034857011432,0.5,UCLA,USC,3,2,4,401087158,2019-02-28
343,3,4:25,265,265,Moses Brown missed Jumper.,82,82,0,0,0.5763516842879918,0.5,UCLA,USC,3,2,4,401087158,2019-02-28
344,3,4:25,265,265,Bennie Boatwright Defensive Rebound.,82,82,0,26,0.5763516842879918,0.5,UCLA,USC,3,2,4,401087158,2019-02-28
345,3,3:59,239,239,Foul on Jules Bernard.,82,82,0,0,0.573572933268052,0.5,UCLA,USC,3,2,4,401087158,2019-02-28
346,3,3:59,239,239,Shaqquan Aaron missed Free Throw.,82,82,0,0,0.573572933268052,0.5,UCLA,USC,3,2,4,401087158,2019-02-28
347,3,3:59,239,239,Jalen Hill Defensive Rebound.,82,82,0,19,0.573572933268052,0.5,UCLA,USC,3,2,4,401087158,2019-02-28
348,3,3:40,220,220,Jules Bernard made Jumper.,84,82,2,23,0.7157578794382632,0.653848578058123,UCLA,USC,3,2,4,401087158,2019-02-28
349,3,3:17,197,197,Nick Rakocevic missed Jumper.,84,82,2,0,0.722970143395951,0.6645381331561045,UCLA,USC,3,2,4,401087158,2019-02-28
350,3,3:17,197,197,Moses Brown Block.,84,82,2,0,0.722970143395951,0.6645381331561045,UCLA,USC,3,2,4,401087158,2019-02-28
351,3,3:17,197,197,Shaqquan Aaron Offensive Rebound.,84,82,2,12,0.722970143395951,0.6645381331561045,UCLA,USC,3,2,4,401087158,2019-02-28
352,3,3:05,185,185,Bennie Boatwright missed Three Point Jumper.,84,82,2,0,0.7309399906760415,0.6749095707957317,UCLA,USC,3,2,4,401087158,2019-02-28
353,3,3:05,185,185,Jules Bernard Defensive Rebound.,84,82,2,18,0.7309399906760415,0.6749095707957317,UCLA,USC,3,2,4,401087158,2019-02-28
354,3,2:47,167,167,David Singleton made Three Point Jumper. Assisted by Kris Wilkes.,87,82,5,5,0.9070491627513536,0.8828462779807486,UCLA,USC,3,2,4,401087158,2019-02-28
355,3,2:42,162,162,USC  Timeout,87,82,5,17,0.9114772590880932,0.8885800328482713,UCLA,USC,2,2,4,401087158,2019-02-28
356,3,2:25,145,145,Shaqquan Aaron missed Three Point Jumper.,87,82,5,0,0.926203678003794,0.9075980504750205,UCLA,USC,2,2,4,401087158,2019-02-28
357,3,2:25,145,145,Jules Bernard Defensive Rebound.,87,82,5,26,0.926203678003794,0.9075980504750205,UCLA,USC,2,2,4,401087158,2019-02-28
358,3,1:59,119,119,Jaylen Hands missed Three Point Jumper.,87,82,5,0,0.9479001992938897,0.9353936658755523,UCLA,USC,2,2,4,401087158,2019-02-28
359,3,1:59,119,119,Bennie Boatwright Defensive Rebound.,87,82,5,12,0.9479001992938897,0.9353936658755523,UCLA,USC,2,2,4,401087158,2019-02-28
360,3,1:47,107,107,Elijah Weaver made Three Point Jumper. Assisted by Nick Rakocevic.,87,85,2,24,0.7984319883683367,0.760641368588266,UCLA,USC,2,2,4,401087158,2019-02-28
361,3,1:23,83,83,Jaylen Hands missed Jumper.,87,85,2,0,0.8273147902884953,0.7963123821824353,UCLA,USC,2,2,4,401087158,2019-02-28
362,3,1:23,83,83,Moses Brown Offensive Rebound.,87,85,2,0,0.8273147902884953,0.7963123821824353,UCLA,USC,2,2,4,401087158,2019-02-28
363,3,1:23,83,83,Moses Brown made Two Point Tip Shot.,89,85,4,28,0.9493153981376272,0.9385901133603047,UCLA,USC,2,2,4,401087158,2019-02-28
364,3,0:55,55,55,Bennie Boatwright made Three Point Jumper. Assisted by Shaqquan Aaron.,89,88,1,27,0.7322480265956077,0.6950427154887114,UCLA,USC,2,2,4,401087158,2019-02-28
365,3,0:28,28,28,Jaylen Hands missed Jumper.,89,88,1,0,0.758528686900122,0.7278998449677002,UCLA,USC,2,2,4,401087158,2019-02-28
366,3,0:28,28,28,Bennie Boatwright Block.,89,88,1,0,0.758528686900122,0.7278998449677002,UCLA,USC,2,2,4,401087158,2019-02-28
367,3,0:28,28,28,UCLA Offensive Rebound.,89,88,1,0,0.758528686900122,0.7278998449677002,UCLA,USC,2,2,4,401087158,2019-02-28
368,3,0:28,28,28,UCLA  Timeout,89,88,1,5,0.758528686900122,0.7278998449677002,UCLA,USC,2,1,4,401087158,2019-02-28
369,3,0:23,23,23,Jaylen Hands made Three Point Jumper. Assisted by Kris Wilkes.,92,88,4,11,0.9855198021078779,0.983108178118838,UCLA,USC,2,1,4,401087158,2019-02-28
370,3,0:12,12,12,Jonah Mathews missed Three Point Jumper.,92,88,4,0,0.9890891516956749,0.9873806270068883,UCLA,USC,2,1,4,401087158,2019-02-28
371,3,0:12,12,12,Jalen Hill Defensive Rebound.,92,88,4,4,0.9890891516956749,0.9873806270068883,UCLA,USC,2,1,4,401087158,2019-02-28
372,3,0:08,8,8,Foul on Shaqquan Aaron.,92,88,4,0,0.9902080934427498,0.9887112925767356,UCLA,USC,2,1,4,401087158,2019-02-28
373,3,0:08,8,8,Jules Bernard missed Free Throw.,92,88,4,0,0.9902080934427498,0.9887112925767356,UCLA,USC,2,1,4,401087158,2019-02-28
374,3,0:08,8,8,UCLA Deadball Team Rebound.,92,88,4,0,0.9902080934427498,0.9887112925767356,UCLA,USC,2,1,4,401087158,2019-02-28
375,3,0:08,8,8,Jules Bernard made Free Throw.,93,88,5,6,0.9967779454436002,0.9962816477111814,UCLA,USC,2,1,4,401087158,2019-02-28
376,3,0:02,2,2,Elijah Weaver missed Layup.,93,88,5,0,0.9973895892723951,0.9970028640030048,UCLA,USC,2,1,4,401087158,2019-02-28
377,3,0:02,2,2,Chris Smith Defensive Rebound.,93,88,5,2,0.9973895892723951,0.9970028640030048,UCLA,USC,2,1,4,401087158,2019-02-28
378,3,0:00,0,0,End of Game,93,88,5,0,1,1,UCLA,USC,2,1,4,401087158,2019-02-28
