play_id,half,time_remaining_half,secs_remaining,secs_remaining_absolute,description,home_score,away_score,score_diff,play_length,win_prob,naive_win_prob,home,away,home_time_out_remaining,away_time_out_remaining,home_favored_by,game_id,date
1,1,20:00,2400,2700,PLAY,0,0,0,0,0.6551430901604922,0.5,UCLA,USC,4,4,4,401087158,2019-02-28
2,1,20:00,2400,2700,Jump Ball won by UCLA,0,0,0,4,0.6551430901604922,0.5,UCLA,USC,4,4,4,401087158,2019-02-28
3,1,19:56,2396,2696,Kris Wilkes missed Dunk.,0,0,0,0,0.6550854221695976,0.5,UCLA,USC,4,4,4,401087158,2019-02-28
4,1,19:56,2396,2696,Moses Brown Offensive Rebound.,0,0,0,3,0.6550854221695976,0.5,UCLA,USC,4,4,4,401087158,2019-02-28
5,1,19:53,2393,2693,Foul on Kevin Porter Jr..,0,0,0,8,0.6550419877219624,0.5,UCLA,USC,4,4,4,401087158,2019-02-28
6,1,19:45,2385,2685,Jaylen Hands missed Jumper.,0,0,0,0,0.6549253881541102,0.5,UCLA,USC,4,4,4,401087158,2019-02-28
7,1,19:45,2385,2685,Kevin Porter Jr. Defensive Rebound.,0,0,0,23,0.6549253881541102,0.5,UCLA,USC,4,4,4,401087158,2019-02-28
8,1,19:22,2362,2662,Jonah Mathews missed Three Point Jumper.,0,0,0,0,0.6545837870125758,0.5,UCLA,USC,4,4,4,401087158,2019-02-28
9,1,19:22,2362,2662,Bennie Boatwright Offensive Rebound.,0,0,0,6,0.6545837870125758,0.5,UCLA,USC,4,4,4,401087158,2019-02-28
10,1,19:16,2356,2656,Bennie Boatwright made Layup.,0,2,-2,21,0.6126621891968616,0.4550388056795149,UCLA,USC,4,4,4,401087158,2019-02-28
11,1,18:55,2335,2635,Kris Wilkes made Jumper. Assisted by Jaylen Hands.,2,2,0,36,0.654170368058045,0.5,UCLA,USC,4,4,4,401087158,2019-02-28
12,1,18:19,2299,2599,Nick Rakocevic missed Jumper.,2,2,0,0,0.6535974615165187,0.5,UCLA,USC,4,4,4,401087158,2019-02-28
13,1,18:19,2299,2599,Nick Rakocevic Offensive Rebound.,2,2,0,0,0.6535974615165187,0.5,UCLA,USC,4,4,4,401087158,2019-02-28
14,1,18:19,2299,2599,Nick Rakocevic missed Layup.,2,2,0,0,0.6535974615165187,0.5,UCLA,USC,4,4,4,401087158,2019-02-28
15,1,18:19,2299,2599,Nick Rakocevic Offensive Rebound.,2,2,0,10,0.6535974615165187,0.5,UCLA,USC,4,4,4,401087158,2019-02-28
16,1,18:09,2289,2589,Nick Rakocevic made Layup.,2,4,-2,11,0.6101401129150705,0.4535676529863345,UCLA,USC,4,4,4,401087158,2019-02-28
17,1,17:58,2278,2578,Moses Brown Turnover.,2,4,-2,0,0.6097122703343848,0.45332155583379324,UCLA,USC,4,4,4,401087158,2019-02-28
18,1,17:58,2278,2578,Bennie Boatwright Steal.,2,4,-2,0,0.6097122703343848,0.45332155583379324,UCLA,USC,4,4,4,401087158,2019-02-28
19,1,17:58,2278,2578,Jump Ball won by USC,2,4,-2,4,0.6097122703343848,0.45332155583379324,UCLA,USC,4,4,4,401087158,2019-02-28
20,1,17:54,2274,2574,Nick Rakocevic missed Layup.,2,4,-2,0,0.6095557458951135,0.4532317899002051,UCLA,USC,4,4,4,401087158,2019-02-28
21,1,17:54,2274,2574,Chris Smith Defensive Rebound.,2,4,-2,11,0.6095557458951135,0.4532317899002051,UCLA,USC,4,4,4,401087158,2019-02-28
22,1,17:43,2263,2563,Chris Smith missed Three Point Jumper.,2,4,-2,0,0.6091227194941251,0.45298421201451977,UCLA,USC,4,4,4,401087158,2019-02-28
23,1,17:43,2263,2563,Bennie Boatwright Defensive Rebound.,2,4,-2,17,0.6091227194941251,0.45298421201451977,UCLA,USC,4,4,4,401087158,2019-02-28
24,1,17:26,2246,2546,Shaqquan Aaron made Three Point Jumper. Assisted by Bennie Boatwright.,2,7,-5,12,0.5388034106085962,0.383331546391362,UCLA,USC,4,4,4,401087158,2019-02-28
25,1,17:14,2234,2534,Chris Smith missed Jumper.,2,7,-5,0,0.5378892372981462,0.38268109522381877,UCLA,USC,4,4,4,401087158,2019-02-28
26,1,17:14,2234,2534,Moses Brown Offensive Rebound.,2,7,-5,8,0.5378892372981462,0.38268109522381877,UCLA,USC,4,4,4,401087158,2019-02-28
27,1,17:06,2226,2526,Moses Brown made Layup.,4,7,-3,7,0.5845287255641495,0.4284899787725355,UCLA,USC,4,4,4,401087158,2019-02-28
28,1,16:59,2219,2519,Bennie Boatwright missed Jumper.,4,7,-3,0,0.5841595344445577,0.4282528359497078,UCLA,USC,4,4,4,401087158,2019-02-28
29,1,16:59,2219,2519,Jaylen Hands Block.,4,7,-3,0,0.5841595344445577,0.4282528359497078,UCLA,USC,4,4,4,401087158,2019-02-28
30,1,16:59,2219,2519,Jaylen Hands Defensive Rebound.,4,7,-3,13,0.5841595344445577,0.4282528359497078,UCLA,USC,4,4,4,401087158,2019-02-28
31,1,16:46,2206,2506,Kris Wilkes missed Three Point Jumper.,4,7,-3,0,0.5834694631746049,0.42781134411298344,UCLA,USC,4,4,4,401087158,2019-02-28
32,1,16:46,2206,2506,Kevin Porter Jr. Defensive Rebound.,4,7,-3,5,0.5834694631746049,0.42781134411298344,UCLA,USC,4,4,4,401087158,2019-02-28
33,1,16:41,2201,2501,Nick Rakocevic made Layup. Assisted by Kevin Porter Jr..,4,9,-5,6,0.5353442220642493,0.38088286250190306,UCLA,USC,4,4,4,401087158,2019-02-28
34,1,16:35,2195,2495,Jaylen Hands missed Three Point Jumper.,4,9,-5,0,0.5348768101064273,0.38055467009761923,UCLA,USC,4,4,4,401087158,2019-02-28
35,1,16:35,2195,2495,Shaqquan Aaron Defensive Rebound.,4,9,-5,21,0.5348768101064273,0.38055467009761923,UCLA,USC,4,4,4,401087158,2019-02-28
36,1,16:14,2174,2474,Shaqquan Aaron missed Three Point Jumper.,4,9,-5,0,0.5332301214386002,0.37940371316734106,UCLA,USC,4,4,4,401087158,2019-02-28
37,1,16:14,2174,2474,Bennie Boatwright Offensive Rebound.,4,9,-5,7,0.5332301214386002,0.37940371316734106,UCLA,USC,4,4,4,401087158,2019-02-28
38,1,16:07,2167,2467,Bennie Boatwright missed Three Point Jumper.,4,9,-5,0,0.5326775908972706,0.3790193711586626,UCLA,USC,4,4,4,401087158,2019-02-28
39,1,16:07,2167,2467,Kris Wilkes Defensive Rebound.,4,9,-5,0,0.5326775908972706,0.3790193711586626,UCLA,USC,4,4,4,401087158,2019-02-28
40,1,16:07,2167,2467,Foul on Nick Rakocevic.,4,9,-5,11,0.5326775908972706,0.3790193711586626,UCLA,USC,4,4,4,401087158,2019-02-28
41,1,15:56,2156,2456,Chris Smith missed Jumper.,4,9,-5,0,0.5318050627207489,0.3784140421149803,UCLA,USC,4,4,4,401087158,2019-02-28
42,1,15:56,2156,2456,Bennie Boatwright Defensive Rebound.,4,9,-5,9,0.5318050627207489,0.3784140421149803,UCLA,USC,4,4,4,401087158,2019-02-28
43,1,15:47,2147,2447,Kevin Porter Jr. missed Three Point Jumper.,4,9,-5,0,0.5310871579553786,0.37791737179919743,UCLA,USC,4,4,4,401087158,2019-02-28
44,1,15:47,2147,2447,Shaqquan Aaron Offensive Rebound.,4,9,-5,5,0.5310871579553786,0.37791737179919743,UCLA,USC,4,4,4,401087158,2019-02-28
45,1,15:42,2142,2442,Shaqquan Aaron made Jumper.,4,11,-7,17,0.4807774752958501,0.3319445910829035,UCLA,USC,4,4,4,401087158,2019-02-28
46,1,15:25,2125,2425,Foul on Victor Uyaelunmo.,4,11,-7,0,0.47900387752153817,0.330699159335894,UCLA,USC,4,4,4,401087158,2019-02-28
47,1,15:25,2125,2425,Official TV Timeout,4,11,-7,0,0.47900387752153817,0.330699159335894,UCLA,USC,4,4,4,401087158,2019-02-28
48,1,15:25,2125,2425,Chris Smith made Free Throw.,5,11,-6,0,0.504170875404854,0.3533589912717731,UCLA,USC,4,4,4,401087158,2019-02-28
49,1,15:25,2125,2425,Chris Smith made Free Throw.,6,11,-5,29,0.5293167556336765,0.3766976172370818,UCLA,USC,4,4,4,401087158,2019-02-28
50,1,14:56,2096,2396,Jonah Mathews made Three Point Jumper. Assisted by Bennie Boatwright.,6,14,-8,25,0.4505616671832363,0.3064433815189352,UCLA,USC,4,4,4,401087158,2019-02-28
51,1,14:31,2071,2371,Kris Wilkes missed Jumper.,6,14,-8,0,0.44760897111896364,0.30439832886364065,UCLA,USC,4,4,4,401087158,2019-02-28
52,1,14:31,2071,2371,Jalen Hill Offensive Rebound.,6,14,-8,6,0.44760897111896364,0.30439832886364065,UCLA,USC,4,4,4,401087158,2019-02-28
53,1,14:25,2065,2365,Jalen Hill Turnover.,6,14,-8,19,0.44689495031372223,0.3039053003338001,UCLA,USC,4,4,4,401087158,2019-02-28
54,1,14:06,2046,2346,Shaqquan Aaron missed Three Point Jumper.,6,14,-8,0,0.4446197986349581,0.302338004892455,UCLA,USC,4,4,4,401087158,2019-02-28
55,1,14:06,2046,2346,Bennie Boatwright Offensive Rebound.,6,14,-8,6,0.4446197986349581,0.302338004892455,UCLA,USC,4,4,4,401087158,2019-02-28
56,1,14:00,2040,2340,Bennie Boatwright made Dunk.,6,16,-10,21,0.39293342834385037,0.2595742493627567,UCLA,USC,4,4,4,401087158,2019-02-28
57,1,13:39,2019,2319,Jules Bernard made Jumper. Assisted by Jaylen Hands.,8,16,-8,24,0.44134888665613553,0.3000939922499867,UCLA,USC,4,4,4,401087158,2019-02-28
58,1,13:15,1995,2295,Bennie Boatwright missed Three Point Jumper.,8,16,-8,0,0.4384028876732537,0.29808143269283216,UCLA,USC,4,4,4,401087158,2019-02-28
59,1,13:15,1995,2295,UCLA Defensive Rebound.,8,16,-8,0,0.4384028876732537,0.29808143269283216,UCLA,USC,4,4,4,401087158,2019-02-28
60,1,13:15,1995,2295,Jump Ball won by UCLA,8,16,-8,7,0.4384028876732537,0.29808143269283216,UCLA,USC,4,4,4,401087158,2019-02-28
61,1,13:08,1988,2288,Jaylen Hands made Three Point Jumper.,11,16,-5,21,0.5177580533196681,0.3688749845109464,UCLA,USC,4,4,4,401087158,2019-02-28
62,1,12:47,1967,2267,Jonah Mathews missed Jumper.,11,16,-5,0,0.5158987876072059,0.3676339871770814,UCLA,USC,4,4,4,401087158,2019-02-28
63,1,12:47,1967,2267,Alex Olesinski Defensive Rebound.,11,16,-5,18,0.5158987876072059,0.3676339871770814,UCLA,USC,4,4,4,401087158,2019-02-28
64,1,12:29,1949,2249,Jaylen Hands made Three Point Jumper.,14,16,-2,2,0.5951649857255057,0.44551684476573233,UCLA,USC,4,4,4,401087158,2019-02-28
65,1,12:27,1947,2247,USC  Timeout,14,16,-2,22,0.5950656517075085,0.4454657953323223,UCLA,USC,3,4,4,401087158,2019-02-28
66,1,12:05,1925,2225,Derryck Thornton missed Three Point Jumper.,14,16,-2,0,0.5939639104946767,0.44490057596560917,UCLA,USC,3,4,4,401087158,2019-02-28
67,1,12:05,1925,2225,Jaylen Hands Defensive Rebound.,14,16,-2,11,0.5939639104946767,0.44490057596560917,UCLA,USC,3,4,4,401087158,2019-02-28
68,1,11:54,1914,2214,Foul on Nick Rakocevic.,14,16,-2,0,0.5934078031927446,0.4446173765687488,UCLA,USC,3,4,4,401087158,2019-02-28
69,1,11:54,1914,2214,Kris Wilkes made Free Throw.,15,16,-1,0,0.6199398081162968,0.4722232274586423,UCLA,USC,3,4,4,401087158,2019-02-28
70,1,11:54,1914,2214,Kris Wilkes made Free Throw.,16,16,0,22,0.6457739729224286,0.5,UCLA,USC,3,4,4,401087158,2019-02-28
71,1,11:32,1892,2192,Bennie Boatwright missed Three Point Jumper.,16,16,0,0,0.6452347562374738,0.5,UCLA,USC,3,4,4,401087158,2019-02-28
72,1,11:32,1892,2192,Jules Bernard Defensive Rebound.,16,16,0,11,0.6452347562374738,0.5,UCLA,USC,3,4,4,401087158,2019-02-28
73,1,11:21,1881,2181,Kris Wilkes made Jumper. Assisted by Jules Bernard.,18,16,2,18,0.6948388076088841,0.556230855714162,UCLA,USC,3,4,4,401087158,2019-02-28
74,1,11:03,1863,2163,J'Raan Brooks made Three Point Jumper. Assisted by Elijah Weaver.,18,19,-1,16,0.6180071160143058,0.4715612343497867,UCLA,USC,3,4,4,401087158,2019-02-28
75,1,10:47,1847,2147,Jules Bernard missed Three Point Jumper.,18,19,-1,0,0.6173867057633101,0.47135266701007056,UCLA,USC,3,4,4,401087158,2019-02-28
76,1,10:47,1847,2147,Kris Wilkes Offensive Rebound.,18,19,-1,3,0.6173867057633101,0.47135266701007056,UCLA,USC,3,4,4,401087158,2019-02-28
77,1,10:44,1844,2144,Foul on J'Raan Brooks.,18,19,-1,0,0.6172696235376575,0.4713134620490476,UCLA,USC,3,4,4,401087158,2019-02-28
78,1,10:44,1844,2144,Kris Wilkes made Free Throw.,19,19,0,0,0.6440182180664535,0.5,UCLA,USC,3,4,4,401087158,2019-02-28
79,1,10:44,1844,2144,Kris Wilkes missed Free Throw.,19,19,0,0,0.6440182180664535,0.5,UCLA,USC,3,4,4,401087158,2019-02-28
80,1,10:44,1844,2144,Shaqquan Aaron Defensive Rebound.,19,19,0,13,0.6440182180664535,0.5,UCLA,USC,3,4,4,401087158,2019-02-28
81,1,10:31,1831,2131,Derryck Thornton missed Jumper.,19,19,0,0,0.6436799599068922,0.5,UCLA,USC,3,4,4,401087158,2019-02-28
82,1,10:31,1831,2131,Cody Riley Defensive Rebound.,19,19,0,7,0.6436799599068922,0.5,UCLA,USC,3,4,4,401087158,2019-02-28
83,1,10:24,1824,2124,Jaylen Hands missed Jumper.,19,19,0,0,0.6434963691477349,0.5,UCLA,USC,3,4,4,401087158,2019-02-28
84,1,10:24,1824,2124,Elijah Weaver Defensive Rebound.,19,19,0,11,0.6434963691477349,0.5,UCLA,USC,3,4,4,401087158,2019-02-28
85,1,10:13,1813,2113,Foul on Jules Bernard.,19,19,0,1,0.6432058796236982,0.5,UCLA,USC,3,4,4,401087158,2019-02-28
86,1,10:12,1812,2112,Shaqquan Aaron missed Jumper.,19,19,0,0,0.6431793532521034,0.5,UCLA,USC,3,4,4,401087158,2019-02-28
87,1,10:12,1812,2112,Moses Brown Block.,19,19,0,0,0.6431793532521034,0.5,UCLA,USC,3,4,4,401087158,2019-02-28
88,1,10:12,1812,2112,Moses Brown Defensive Rebound.,19,19,0,12,0.6431793532521034,0.5,UCLA,USC,3,4,4,401087158,2019-02-28
89,1,10:00,1800,2100,Kris Wilkes made Three Point Jumper. Assisted by Jaylen Hands.,22,19,3,21,0.7189785835078991,0.5870063911476985,UCLA,USC,3,4,4,401087158,2019-02-28
90,1,9:39,1779,2079,Elijah Weaver missed Three Point Jumper.,22,19,3,0,0.719165722450345,0.5878282667021548,UCLA,USC,3,4,4,401087158,2019-02-28
91,1,9:39,1779,2079,UCLA Defensive Rebound.,22,19,3,17,0.719165722450345,0.5878282667021548,UCLA,USC,3,4,4,401087158,2019-02-28
92,1,9:22,1762,2062,Jaylen Hands missed Three Point Jumper.,22,19,3,0,0.7193195370695651,0.5885017232232406,UCLA,USC,3,4,4,401087158,2019-02-28
93,1,9:22,1762,2062,Kris Wilkes Offensive Rebound.,22,19,3,8,0.7193195370695651,0.5885017232232406,UCLA,USC,3,4,4,401087158,2019-02-28
94,1,9:14,1754,2054,Kris Wilkes Turnover.,22,19,3,7,0.7193930138896336,0.5888215034603875,UCLA,USC,3,4,4,401087158,2019-02-28
95,1,9:07,1747,2047,Bennie Boatwright made Three Point Jumper. Assisted by Kevin Porter Jr..,22,22,0,20,0.6414162967872226,0.5,UCLA,USC,3,4,4,401087158,2019-02-28
96,1,8:47,1727,2027,Foul on Cody Riley.,22,22,0,0,0.6408599468877167,0.5,UCLA,USC,3,4,4,401087158,2019-02-28
97,1,8:47,1727,2027,Cody Riley Turnover.,22,22,0,10,0.6408599468877167,0.5,UCLA,USC,3,4,4,401087158,2019-02-28
98,1,8:37,1717,2017,Kevin Porter Jr. made Three Point Jumper. Assisted by Jonah Mathews.,22,25,-3,16,0.5529405090168978,0.4096718708022683,UCLA,USC,3,4,4,401087158,2019-02-28
99,1,8:21,1701,2001,Cody Riley missed Jumper.,22,25,-3,0,0.5517733424180407,0.40900436149034386,UCLA,USC,3,4,4,401087158,2019-02-28
100,1,8:21,1701,2001,J'Raan Brooks Defensive Rebound.,22,25,-3,10,0.5517733424180407,0.40900436149034386,UCLA,USC,3,4,4,401087158,2019-02-28
101,1,8:11,1691,1991,Bennie Boatwright missed Three Point Jumper.,22,25,-3,0,0.5510361321753376,0.40858165848846084,UCLA,USC,3,4,4,401087158,2019-02-28
102,1,8:11,1691,1991,Cody Riley Defensive Rebound.,22,25,-3,10,0.5510361321753376,0.40858165848846084,UCLA,USC,3,4,4,401087158,2019-02-28
103,1,8:01,1681,1981,Jaylen Hands made Jumper.,24,25,-1,0,0.6105410526883926,0.46907445395022607,UCLA,USC,3,4,4,401087158,2019-02-28
104,1,8:01,1681,1981,Foul on Moses Brown.,24,25,-1,10,0.6105410526883926,0.46907445395022607,UCLA,USC,3,4,4,401087158,2019-02-28
105,1,7:51,1671,1971,Jonah Mathews missed Jumper.,24,25,-1,0,0.6101042663808235,0.4689313797248332,UCLA,USC,3,4,4,401087158,2019-02-28
106,1,7:51,1671,1971,Jules Bernard Defensive Rebound.,24,25,-1,7,0.6101042663808235,0.4689313797248332,UCLA,USC,3,4,4,401087158,2019-02-28
107,1,7:44,1664,1964,Foul on Jonah Mathews.,24,25,-1,0,0.6097968386892499,0.46883235651561483,UCLA,USC,3,4,4,401087158,2019-02-28
108,1,7:44,1664,1964,Official TV Timeout,24,25,-1,0,0.6097968386892499,0.46883235651561483,UCLA,USC,3,4,4,401087158,2019-02-28
109,1,7:44,1664,1964,Jaylen Hands made Free Throw.,25,25,0,0,0.639060955339901,0.5,UCLA,USC,3,4,4,401087158,2019-02-28
110,1,7:44,1664,1964,Jaylen Hands made Free Throw.,26,25,1,11,0.6673276709337296,0.5311676434843852,UCLA,USC,3,4,4,401087158,2019-02-28
111,1,7:33,1653,1953,Kevin Porter Jr. missed Layup.,26,25,1,0,0.6671489612509516,0.5313216272177975,UCLA,USC,3,4,4,401087158,2019-02-28
112,1,7:33,1653,1953,Jaylen Hands Defensive Rebound.,26,25,1,8,0.6671489612509516,0.5313216272177975,UCLA,USC,3,4,4,401087158,2019-02-28
113,1,7:25,1645,1945,David Singleton made Three Point Jumper. Assisted by Jaylen Hands.,29,25,4,18,0.745053939513041,0.623301422078101,UCLA,USC,3,4,4,401087158,2019-02-28
114,1,7:07,1627,1927,Foul on Moses Brown.,29,25,4,0,0.7453531433630071,0.6242329183372235,UCLA,USC,3,4,4,401087158,2019-02-28
115,1,7:07,1627,1927,Victor Uyaelunmo missed Free Throw.,29,25,4,0,0.7453531433630071,0.6242329183372235,UCLA,USC,3,4,4,401087158,2019-02-28
116,1,7:07,1627,1927,USC Deadball Team Rebound.,29,25,4,0,0.7453531433630071,0.6242329183372235,UCLA,USC,3,4,4,401087158,2019-02-28
117,1,7:07,1627,1927,Victor Uyaelunmo made Free Throw.,29,26,3,11,0.7205299587630175,0.594033617428088,UCLA,USC,3,4,4,401087158,2019-02-28
118,1,6:56,1616,1916,David Singleton made Three Point Jumper. Assisted by Chris Smith.,32,26,6,8,0.7908213271103326,0.6824257035757345,UCLA,USC,3,4,4,401087158,2019-02-28
119,1,6:48,1608,1908,USC  Timeout,32,26,6,4,0.791074226797885,0.6829930274655981,UCLA,USC,2,4,4,401087158,2019-02-28
120,1,6:44,1604,1904,J'Raan Brooks made Jumper. Assisted by Elijah Weaver.,32,28,4,23,0.7457142592530721,0.625410998167702,UCLA,USC,2,4,4,401087158,2019-02-28
121,1,6:21,1581,1881,Cody Riley missed Three Point Jumper.,32,28,4,0,0.746063450034468,0.6265871084181751,UCLA,USC,2,4,4,401087158,2019-02-28
122,1,6:21,1581,1881,Elijah Weaver Defensive Rebound.,32,28,4,15,0.746063450034468,0.6265871084181751,UCLA,USC,2,4,4,401087158,2019-02-28
123,1,6:06,1566,1866,Kevin Porter Jr. made Three Point Jumper. Assisted by Elijah Weaver.,32,31,1,8,0.6655772990122178,0.5325105465611225,UCLA,USC,2,4,4,401087158,2019-02-28
124,1,5:58,1558,1858,Jaylen Hands missed Three Point Jumper.,32,31,1,0,0.665425241986679,0.5326209784847286,UCLA,USC,2,4,4,401087158,2019-02-28
125,1,5:58,1558,1858,USC Defensive Rebound.,32,31,1,27,0.665425241986679,0.5326209784847286,UCLA,USC,2,4,4,401087158,2019-02-28
126,1,5:31,1531,1831,J'Raan Brooks made Layup. Assisted by Bennie Boatwright.,32,33,-1,15,0.6036926091355782,0.4669996648941544,UCLA,USC,2,4,4,401087158,2019-02-28
127,1,5:16,1516,1816,Foul on J'Raan Brooks.,32,33,-1,0,0.602972714218206,0.4667830384933974,UCLA,USC,2,4,4,401087158,2019-02-28
128,1,5:16,1516,1816,Cody Riley missed Free Throw.,32,33,-1,0,0.602972714218206,0.4667830384933974,UCLA,USC,2,4,4,401087158,2019-02-28
129,1,5:16,1516,1816,Bennie Boatwright Defensive Rebound.,32,33,-1,19,0.602972714218206,0.4667830384933974,UCLA,USC,2,4,4,401087158,2019-02-28
130,1,4:57,1497,1797,J'Raan Brooks made Jumper. Assisted by Elijah Weaver.,32,35,-3,7,0.5363422011701596,0.40068944552028324,UCLA,USC,2,4,4,401087158,2019-02-28
131,1,4:50,1490,1790,UCLA  Timeout,32,35,-3,5,0.5357744383875416,0.4003811449176373,UCLA,USC,2,3,4,401087158,2019-02-28
132,1,4:45,1485,1785,Kris Wilkes made Jumper. Assisted by Jalen Hill.,34,35,-1,17,0.6014646745346485,0.46631729349779,UCLA,USC,2,3,4,401087158,2019-02-28
133,1,4:28,1468,1768,Bennie Boatwright made Three Point Jumper. Assisted by J'Raan Brooks.,34,38,-4,31,0.5000092704436034,0.36724598831922495,UCLA,USC,2,3,4,401087158,2019-02-28
134,1,3:57,1437,1737,David Singleton Turnover.,34,38,-4,0,0.49685823289686504,0.36534087531580206,UCLA,USC,2,3,4,401087158,2019-02-28
135,1,3:57,1437,1737,Jonah Mathews Steal.,34,38,-4,9,0.49685823289686504,0.36534087531580206,UCLA,USC,2,3,4,401087158,2019-02-28
136,1,3:48,1428,1728,Kevin Porter Jr. missed Three Point Jumper.,34,38,-4,0,0.4959504390404598,0.3647985593416411,UCLA,USC,2,3,4,401087158,2019-02-28
137,1,3:48,1428,1728,USC Offensive Rebound.,34,38,-4,7,0.4959504390404598,0.3647985593416411,UCLA,USC,2,3,4,401087158,2019-02-28
138,1,3:41,1421,1721,Official TV Timeout,34,38,-4,19,0.4952491485070686,0.3643830018445816,UCLA,USC,2,3,4,401087158,2019-02-28
139,1,3:22,1402,1702,Jonah Mathews missed Three Point Jumper.,34,38,-4,0,0.49336160850121147,0.3632772933674441,UCLA,USC,2,3,4,401087158,2019-02-28
140,1,3:22,1402,1702,Jalen Hill Defensive Rebound.,34,38,-4,13,0.49336160850121147,0.3632772933674441,UCLA,USC,2,3,4,401087158,2019-02-28
141,1,3:09,1389,1689,Jalen Hill made Dunk. Assisted by Kris Wilkes.,36,38,-2,27,0.5623002534857208,0.42991689574346065,UCLA,USC,2,3,4,401087158,2019-02-28
142,1,2:42,1362,1662,Foul on David Singleton.,36,38,-2,10,0.5604928626615907,0.4291069764539114,UCLA,USC,2,3,4,401087158,2019-02-28
143,1,2:32,1352,1652,J'Raan Brooks missed Jumper.,36,38,-2,0,0.5598192161554023,0.42880671685963717,UCLA,USC,2,3,4,401087158,2019-02-28
144,1,2:32,1352,1652,Kris Wilkes Defensive Rebound.,36,38,-2,7,0.5598192161554023,0.42880671685963717,UCLA,USC,2,3,4,401087158,2019-02-28
145,1,2:25,1345,1645,Alex Olesinski missed Three Point Jumper.,36,38,-2,0,0.5593456222295028,0.42859560120973195,UCLA,USC,2,3,4,401087158,2019-02-28
146,1,2:25,1345,1645,Bennie Boatwright Defensive Rebound.,36,38,-2,10,0.5593456222295028,0.42859560120973195,UCLA,USC,2,3,4,401087158,2019-02-28
147,1,2:15,1335,1635,Bennie Boatwright missed Three Point Jumper.,36,38,-2,0,0.5586655488540196,0.42829193684653155,UCLA,USC,2,3,4,401087158,2019-02-28
148,1,2:15,1335,1635,Jalen Hill Defensive Rebound.,36,38,-2,7,0.5586655488540196,0.42829193684653155,UCLA,USC,2,3,4,401087158,2019-02-28
149,1,2:08,1328,1628,Kris Wilkes missed Three Point Jumper.,36,38,-2,0,0.5581866698350861,0.4280774644759598,UCLA,USC,2,3,4,401087158,2019-02-28
150,1,2:08,1328,1628,Alex Olesinski Offensive Rebound.,36,38,-2,8,0.5581866698350861,0.4280774644759598,UCLA,USC,2,3,4,401087158,2019-02-28
151,1,2:00,1320,1620,Jules Bernard made Jumper.,38,38,0,32,0.6276817678157379,0.5,UCLA,USC,2,3,4,401087158,2019-02-28
152,1,1:28,1288,1588,Bennie Boatwright missed Jumper.,38,38,0,0,0.626534914580415,0.5,UCLA,USC,2,3,4,401087158,2019-02-28
153,1,1:28,1288,1588,Bennie Boatwright Offensive Rebound.,38,38,0,10,0.626534914580415,0.5,UCLA,USC,2,3,4,401087158,2019-02-28
154,1,1:18,1278,1578,Jonah Mathews missed Layup.,38,38,0,0,0.6261753152439754,0.5,UCLA,USC,2,3,4,401087158,2019-02-28
155,1,1:18,1278,1578,Jalen Hill Defensive Rebound.,38,38,0,7,0.6261753152439754,0.5,UCLA,USC,2,3,4,401087158,2019-02-28
156,1,1:11,1271,1571,Jules Bernard Turnover.,38,38,0,23,0.6259234325006794,0.5,UCLA,USC,2,3,4,401087158,2019-02-28
157,1,0:48,1248,1548,Shaqquan Aaron Turnover.,38,38,0,12,0.6250957209627347,0.5,UCLA,USC,2,3,4,401087158,2019-02-28
158,1,0:36,1236,1536,Jules Bernard made Three Point Jumper. Assisted by Kris Wilkes.,41,38,3,27,0.7237416589283447,0.6115195923097898,UCLA,USC,2,3,4,401087158,2019-02-28
159,1,0:09,1209,1509,Kevin Porter Jr. missed Three Point Jumper.,41,38,3,0,0.7242533924090439,0.6131064177089345,UCLA,USC,2,3,4,401087158,2019-02-28
160,1,0:09,1209,1509,Kris Wilkes Defensive Rebound.,41,38,3,9,0.7242533924090439,0.6131064177089345,UCLA,USC,2,3,4,401087158,2019-02-28
161,1,0:00,1200,1500,End of 1st half,41,38,3,0,0.724440206283866,0.6136521367497382,UCLA,USC,2,3,4,401087158,2019-02-28
162,2,20:00,1200,1500,PLAY,41,38,3,0,0.724440206283866,0.6136521367497382,UCLA,USC,3,4,4,401087158,2019-02-28
163,2,20:00,1200,1500,Jump Ball won by USC,41,38,3,11,0.724440206283866,0.6136521367497382,UCLA,USC,3,4,4,401087158,2019-02-28
164,2,19:49,1189,1489,Kevin Porter Jr. made Layup. Assisted by Jonah Mathews.,41,40,1,13,0.6586746171171817,0.5387096993613577,UCLA,USC,3,4,4,401087158,2019-02-28
165,2,19:36,1176,1476,Foul on Moses Brown.,41,40,1,0,0.6584752572741572,0.5389743828911827,UCLA,USC,3,4,4,401087158,2019-02-28
166,2,19:36,1176,1476,Kevin Porter Jr. missed Free Throw.,41,40,1,0,0.6584752572741572,0.5389743828911827,UCLA,USC,3,4,4,401087158,2019-02-28
167,2,19:36,1176,1476,Moses Brown Defensive Rebound.,41,40,1,1,0.6584752572741572,0.5389743828911827,UCLA,USC,3,4,4,401087158,2019-02-28
168,2,19:35,1175,1475,Kris Wilkes missed Three Point Jumper.,41,40,1,0,0.6584598328618342,0.5389945451606561,UCLA,USC,3,4,4,401087158,2019-02-28
169,2,19:35,1175,1475,Shaqquan Aaron Defensive Rebound.,41,40,1,10,0.6584598328618342,0.5389945451606561,UCLA,USC,3,4,4,401087158,2019-02-28
170,2,19:25,1165,1465,Bennie Boatwright Turnover.,41,40,1,0,0.6583050534139778,0.5391949109632185,UCLA,USC,3,4,4,401087158,2019-02-28
171,2,19:25,1165,1465,David Singleton Steal.,41,40,1,12,0.6583050534139778,0.5391949109632185,UCLA,USC,3,4,4,401087158,2019-02-28
172,2,19:13,1153,1453,David Singleton missed Three Point Jumper.,41,40,1,0,0.6581184114211126,0.5394330205564491,UCLA,USC,3,4,4,401087158,2019-02-28
173,2,19:13,1153,1453,Kevin Porter Jr. Block.,41,40,1,0,0.6581184114211126,0.5394330205564491,UCLA,USC,3,4,4,401087158,2019-02-28
174,2,19:13,1153,1453,UCLA Offensive Rebound.,41,40,1,7,0.6581184114211126,0.5394330205564491,UCLA,USC,3,4,4,401087158,2019-02-28
175,2,19:06,1146,1446,Chris Smith made Jumper. Assisted by Jaylen Hands.,43,40,3,18,0.725451940072957,0.6167672766053179,UCLA,USC,3,4,4,401087158,2019-02-28
176,2,18:48,1128,1428,Jonah Mathews made Three Point Jumper. Assisted by Bennie Boatwright.,43,43,0,9,0.6208473981766051,0.5,UCLA,USC,3,4,4,401087158,2019-02-28
177,2,18:39,1119,1419,Foul on Jonah Mathews.,43,43,0,0,0.6205329536423344,0.5,UCLA,USC,3,4,4,401087158,2019-02-28
178,2,18:39,1119,1419,Moses Brown missed Free Throw.,43,43,0,0,0.6205329536423344,0.5,UCLA,USC,3,4,4,401087158,2019-02-28
179,2,18:39,1119,1419,UCLA Deadball Team Rebound.,43,43,0,0,0.6205329536423344,0.5,UCLA,USC,3,4,4,401087158,2019-02-28
180,2,18:39,1119,1419,Moses Brown missed Free Throw.,43,43,0,0,0.6205329536423344,0.5,UCLA,USC,3,4,4,401087158,2019-02-28
181,2,18:39,1119,1419,Nick Rakocevic Defensive Rebound.,43,43,0,6,0.6205329536423344,0.5,UCLA,USC,3,4,4,401087158,2019-02-28
182,2,18:33,1113,1413,Kevin Porter Jr. missed Three Point Jumper.,43,43,0,0,0.6203232054309143,0.5,UCLA,USC,3,4,4,401087158,2019-02-28
183,2,18:33,1113,1413,Chris Smith Defensive Rebound.,43,43,0,8,0.6203232054309143,0.5,UCLA,USC,3,4,4,401087158,2019-02-28
184,2,18:25,1105,1405,Jump Ball won by UCLA,43,43,0,4,0.6200432856664917,0.5,UCLA,USC,3,4,4,401087158,2019-02-28
185,2,18:21,1101,1401,Kris Wilkes missed Three Point Jumper.,43,43,0,0,0.6199031800372113,0.5,UCLA,USC,3,4,4,401087158,2019-02-28
186,2,18:21,1101,1401,Bennie Boatwright Defensive Rebound.,43,43,0,8,0.6199031800372113,0.5,UCLA,USC,3,4,4,401087158,2019-02-28
187,2,18:13,1093,1393,Nick Rakocevic missed Jumper.,43,43,0,0,0.6196225966446013,0.5,UCLA,USC,3,4,4,401087158,2019-02-28
188,2,18:13,1093,1393,Kris Wilkes Defensive Rebound.,43,43,0,18,0.6196225966446013,0.5,UCLA,USC,3,4,4,401087158,2019-02-28
189,2,17:55,1075,1375,Chris Smith made Jumper. Assisted by Jaylen Hands.,45,43,2,18,0.6929574558008177,0.5814487628445203,UCLA,USC,3,4,4,401087158,2019-02-28
