play_id,half,time_remaining_half,secs_remaining,secs_remaining_absolute,description,home_score,away_score,score_diff,play_length,win_prob,naive_win_prob,home,away,home_time_out_remaining,away_time_out_remaining,home_favored_by,game_id,date
164,2,17:09,1029,1029,Armondo Surratt missed Three Point Jumper.,49,36,13,0,0.8993810938432069,0.8993810938432069,Ohio State,San Francisco,3,4,NA,263240194,2006-11-20
165,2,17:09,1029,1029,Ron Lewis Defensive Rebound.,49,36,13,6,0.8993810938432069,0.8993810938432069,Ohio State,San Francisco,3,4,NA,263240194,2006-11-20
166,2,17:03,1023,1023,Ron Lewis missed Two Point Layup.,49,36,13,1,0.9000606924464106,0.9000606924464106,Ohio State,San Francisco,3,4,NA,263240194,2006-11-20
167,2,17:02,1022,1022,Alan Wiggins Jr. Defensive Rebound.,49,36,13,6,0.9001748329546719,0.9001748329546719,Ohio State,San Francisco,3,4,NA,263240194,2006-11-20
168,2,16:56,1016,1016,Alan Wiggins Jr. missed Two Point Layup.,49,36,13,0,0.9008651159466038,0.9008651159466038,Ohio State,San Francisco,3,4,NA,263240194,2006-11-20
169,2,16:56,1016,1016,Jay Watkins Offensive Rebound.,49,36,13,3,0.9008651159466038,0.9008651159466038,Ohio State,San Francisco,3,4,NA,263240194,2006-11-20
170,2,16:53,1013,1013,Armondo Surratt made Two Point Layup.,49,38,11,24,0.8665351302075793,0.8665351302075793,Ohio State,San Francisco,3,4,NA,263240194,2006-11-20
171,2,16:29,989,989,Alan Wiggins Jr. Steal.,49,38,11,20,0.8697136045608528,0.8697136045608528,Ohio State,San Francisco,3,4,NA,263240194,2006-11-20
172,2,16:09,969,969,Jay Watkins missed Two Point Layup.,49,38,11,0,0.8725303084182181,0.8725303084182181,Ohio State,San Francisco,3,4,NA,263240194,2006-11-20
173,2,16:09,969,969,Othello Hunter Defensive Rebound.,49,38,11,7,0.8725303084182181,0.8725303084182181,Ohio State,San Francisco,3,4,NA,263240194,2006-11-20
174,2,16:02,962,962,Foul on Mike Jr.,49,38,11,5,0.8735118131548529,0.8735118131548529,Ohio State,San Francisco,3,4,NA,263240194,2006-11-20
175,2,15:57,957,957,Alan Wiggins Jr. missed Two Point Layup.,49,38,11,0,0.8741854821653017,0.8741854821653017,Ohio State,San Francisco,3,4,NA,263240194,2006-11-20
176,2,15:57,957,957,Ohio State Defensive Rebound.,49,38,11,2,0.8741854821653017,0.8741854821653017,Ohio State,San Francisco,3,4,NA,263240194,2006-11-20
177,2,15:55,955,955,Official TV Timeout.,49,38,11,27,0.874448945024024,0.874448945024024,Ohio State,San Francisco,3,4,NA,263240194,2006-11-20
178,2,15:28,928,928,Armondo Surratt missed Two Point Jumper.,49,38,11,0,0.8777207042516683,0.8777207042516683,Ohio State,San Francisco,3,4,NA,263240194,2006-11-20
179,2,15:28,928,928,Daequan Cook Defensive Rebound.,49,38,11,9,0.8777207042516683,0.8777207042516683,Ohio State,San Francisco,3,4,NA,263240194,2006-11-20
180,2,15:19,919,919,Daequan Cook made Three Point Jumper.  Assisted by Mike Jr..,52,38,14,23,0.9255606881427584,0.9255606881427584,Ohio State,San Francisco,3,4,NA,263240194,2006-11-20
181,2,14:56,896,896,Alan Wiggins Jr. missed Three Point Jumper.,52,38,14,0,0.9275302066232006,0.9275302066232006,Ohio State,San Francisco,3,4,NA,263240194,2006-11-20
182,2,14:56,896,896,Jamar Butler Defensive Rebound.,52,38,14,4,0.9275302066232006,0.9275302066232006,Ohio State,San Francisco,3,4,NA,263240194,2006-11-20
183,2,14:52,892,892,Daequan Cook made Two Point Dunk Shot.  Assisted by Jamar Butler.,54,38,16,2,0.948785592107247,0.948785592107247,Ohio State,San Francisco,3,4,NA,263240194,2006-11-20
184,2,14:50,890,890,San Francisco Full Timeout.,54,38,16,7,0.9489213981757925,0.9489213981757925,Ohio State,San Francisco,2,4,NA,263240194,2006-11-20
185,2,14:43,883,883,Matt Terwilliger Steal.,54,38,16,7,0.9493928607753918,0.9493928607753918,Ohio State,San Francisco,2,4,NA,263240194,2006-11-20
186,2,14:36,876,876,Daequan Cook made Three Point Jumper.  Assisted by Mike Jr..,57,38,19,37,0.9704886702057633,0.9704886702057633,Ohio State,San Francisco,2,4,NA,263240194,2006-11-20
187,2,13:59,839,839,Armondo Surratt missed Two Point Jumper.,57,38,19,0,0.9722490118108337,0.9722490118108337,Ohio State,San Francisco,2,4,NA,263240194,2006-11-20
188,2,13:59,839,839,Daequan Cook Defensive Rebound.,57,38,19,11,0.9722490118108337,0.9722490118108337,Ohio State,San Francisco,2,4,NA,263240194,2006-11-20
189,2,13:48,828,828,Ivan Harris made Three Point Jumper.  Assisted by Jamar Butler.,60,38,22,7,0.9843464178378353,0.9843464178378353,Ohio State,San Francisco,2,4,NA,263240194,2006-11-20
190,2,13:41,821,821,San Francisco Full Timeout.,60,38,22,7,0.9845832661123857,0.9845832661123857,Ohio State,San Francisco,1,4,NA,263240194,2006-11-20
191,2,13:34,814,814,Foul on Jamar Butler,60,38,22,3,0.9848245186970349,0.9848245186970349,Ohio State,San Francisco,1,4,NA,263240194,2006-11-20
192,2,13:31,811,811,Manny Quezada missed Three Point Jumper.,60,38,22,0,0.9849294057026957,0.9849294057026957,Ohio State,San Francisco,1,4,NA,263240194,2006-11-20
193,2,13:31,811,811,Ohio State Defensive Rebound.,60,38,22,24,0.9849294057026957,0.9849294057026957,Ohio State,San Francisco,1,4,NA,263240194,2006-11-20
194,2,13:07,787,787,Ohio State Full Timeout.,60,38,22,14,0.9858060484176053,0.9858060484176053,Ohio State,San Francisco,1,3,NA,263240194,2006-11-20
195,2,12:53,773,773,Daequan Cook missed Three Point Jumper.,60,38,22,0,0.9863523201233231,0.9863523201233231,Ohio State,San Francisco,1,3,NA,263240194,2006-11-20
196,2,12:53,773,773,David Lightly Offensive Rebound.,60,38,22,5,0.9863523201233231,0.9863523201233231,Ohio State,San Francisco,1,3,NA,263240194,2006-11-20
197,2,12:48,768,768,David Lightly missed Two Point Layup.,60,38,22,0,0.9865541899669954,0.9865541899669954,Ohio State,San Francisco,1,3,NA,263240194,2006-11-20
198,2,12:48,768,768,Ohio State Defensive Rebound.,60,38,22,6,0.9865541899669954,0.9865541899669954,Ohio State,San Francisco,1,3,NA,263240194,2006-11-20
199,2,12:42,762,762,Foul on Jesse Byrd,60,38,22,10,0.9868012582309249,0.9868012582309249,Ohio State,San Francisco,1,3,NA,263240194,2006-11-20
200,2,12:32,752,752,Ivan Harris made Free Throw.,61,38,23,0,0.9894914600144014,0.9894914600144014,Ohio State,San Francisco,1,3,NA,263240194,2006-11-20
201,2,12:32,752,752,Ivan Harris made Free Throw.,62,38,24,6,0.9913594564393192,0.9913594564393192,Ohio State,San Francisco,1,3,NA,263240194,2006-11-20
202,2,12:26,746,746,David Lightly missed Three Point Jumper.,62,38,24,0,0.991552788198835,0.991552788198835,Ohio State,San Francisco,1,3,NA,263240194,2006-11-20
203,2,12:26,746,746,Ivan Harris Offensive Rebound.,62,38,24,3,0.991552788198835,0.991552788198835,Ohio State,San Francisco,1,3,NA,263240194,2006-11-20
204,2,12:23,743,743,Ivan Harris made Two Point Layup.,64,38,26,15,0.9943772730369932,0.9943772730369932,Ohio State,San Francisco,1,3,NA,263240194,2006-11-20
205,2,12:08,728,728,Alan Wiggins Jr. made Two Point Layup.,64,40,24,17,0.9921520402916941,0.9921520402916941,Ohio State,San Francisco,1,3,NA,263240194,2006-11-20
206,2,11:51,711,711,David Lightly missed Three Point Jumper.,64,40,24,0,0.9926641047661878,0.9926641047661878,Ohio State,San Francisco,1,3,NA,263240194,2006-11-20
207,2,11:51,711,711,Armondo Surratt Defensive Rebound.,64,40,24,7,0.9926641047661878,0.9926641047661878,Ohio State,San Francisco,1,3,NA,263240194,2006-11-20
208,2,11:44,704,704,Jay Watkins missed Two Point Layup.,64,40,24,1,0.9928495353861629,0.9928495353861629,Ohio State,San Francisco,1,3,NA,263240194,2006-11-20
209,2,11:43,703,703,Jared Casey Offensive Rebound.,64,40,24,3,0.9928750240929004,0.9928750240929004,Ohio State,San Francisco,1,3,NA,263240194,2006-11-20
210,2,11:40,700,700,Foul on Othello Hunter,64,40,24,0,0.9929501133103781,0.9929501133103781,Ohio State,San Francisco,1,3,NA,263240194,2006-11-20
211,2,11:40,700,700,Official TV Timeout.,64,40,24,0,0.9929501133103781,0.9929501133103781,Ohio State,San Francisco,1,3,NA,263240194,2006-11-20
212,2,11:40,700,700,Jared Casey made Free Throw.,64,41,23,0,0.9913500658612148,0.9913500658612148,Ohio State,San Francisco,1,3,NA,263240194,2006-11-20
213,2,11:40,700,700,San Francisco Defensive Rebound.,64,41,23,0,0.9913500658612148,0.9913500658612148,Ohio State,San Francisco,1,3,NA,263240194,2006-11-20
214,2,11:40,700,700,Jared Casey missed Free Throw.,64,41,23,0,0.9913500658612148,0.9913500658612148,Ohio State,San Francisco,1,3,NA,263240194,2006-11-20
215,2,11:40,700,700,San Francisco Defensive Rebound.,64,41,23,33,0.9913500658612148,0.9913500658612148,Ohio State,San Francisco,1,3,NA,263240194,2006-11-20
216,2,11:07,667,667,Ivan Harris made Two Point Layup.  Assisted by Othello Hunter.,66,41,25,17,0.9948714646140114,0.9948714646140114,Ohio State,San Francisco,1,3,NA,263240194,2006-11-20
217,2,10:50,650,650,Antonio Kellogg missed Three Point Jumper.,66,41,25,0,0.995153831265124,0.995153831265124,Ohio State,San Francisco,1,3,NA,263240194,2006-11-20
218,2,10:50,650,650,Ohio State Defensive Rebound.,66,41,25,17,0.995153831265124,0.995153831265124,Ohio State,San Francisco,1,3,NA,263240194,2006-11-20
219,2,10:33,633,633,Daequan Cook made Two Point Jumper.,68,41,27,23,0.9970254245597594,0.9970254245597594,Ohio State,San Francisco,1,3,NA,263240194,2006-11-20
220,2,10:10,610,610,Jay Watkins missed Two Point Layup.,68,41,27,0,0.9972963937405678,0.9972963937405678,Ohio State,San Francisco,1,3,NA,263240194,2006-11-20
221,2,10:10,610,610,Jay Watkins Offensive Rebound.,68,41,27,9,0.9972963937405678,0.9972963937405678,Ohio State,San Francisco,1,3,NA,263240194,2006-11-20
222,2,10:01,601,601,Ron Lewis Steal.,68,41,27,10,0.9974066980308514,0.9974066980308514,Ohio State,San Francisco,1,3,NA,263240194,2006-11-20
223,2,9:51,591,591,Ron Lewis made Two Point Layup.,70,41,29,0,0.9984170182651259,0.9984170182651259,Ohio State,San Francisco,1,3,NA,263240194,2006-11-20
224,2,9:51,591,591,Foul on Christian Hernandez,70,41,29,0,0.9984170182651259,0.9984170182651259,Ohio State,San Francisco,1,3,NA,263240194,2006-11-20
225,2,9:51,591,591,Ron Lewis made Free Throw.,71,41,30,27,0.9987321528784506,0.9987321528784506,Ohio State,San Francisco,1,3,NA,263240194,2006-11-20
226,2,9:24,564,564,Armondo Surratt missed Two Point Layup.,71,41,30,0,0.9989368251135554,0.9989368251135554,Ohio State,San Francisco,1,3,NA,263240194,2006-11-20
227,2,9:24,564,564,San Francisco Defensive Rebound.,71,41,30,6,0.9989368251135554,0.9989368251135554,Ohio State,San Francisco,1,3,NA,263240194,2006-11-20
228,2,9:18,558,558,Jared Casey made Two Point Layup.  Assisted by Manny Quezada.,71,43,28,30,0.9983923135754224,0.9983923135754224,Ohio State,San Francisco,1,3,NA,263240194,2006-11-20
229,2,8:48,528,528,Foul on Othello Hunter,71,43,28,6,0.9986982946436027,0.9986982946436027,Ohio State,San Francisco,1,3,NA,263240194,2006-11-20
230,2,8:42,522,522,Alan Wiggins Jr. made Two Point Jumper.,71,45,26,30,0.9979782789603316,0.9979782789603316,Ohio State,San Francisco,1,3,NA,263240194,2006-11-20
231,2,8:12,492,492,Mike Jr. missed Three Point Jumper.,71,45,26,0,0.9982725376987124,0.9982725376987124,Ohio State,San Francisco,1,3,NA,263240194,2006-11-20
232,2,8:12,492,492,Alan Wiggins Jr. Defensive Rebound.,71,45,26,13,0.9982725376987124,0.9982725376987124,Ohio State,San Francisco,1,3,NA,263240194,2006-11-20
233,2,7:59,479,479,Official TV Timeout.,71,45,26,20,0.9983931224161612,0.9983931224161612,Ohio State,San Francisco,1,3,NA,263240194,2006-11-20
234,2,7:39,459,459,Jamar Butler missed Two Point Jumper.,71,45,26,0,0.9985895286270271,0.9985895286270271,Ohio State,San Francisco,1,3,NA,263240194,2006-11-20
235,2,7:39,459,459,Jay Watkins Defensive Rebound.,71,45,26,11,0.9985895286270271,0.9985895286270271,Ohio State,San Francisco,1,3,NA,263240194,2006-11-20
236,2,7:28,448,448,Alan Wiggins Jr. missed Two Point Layup.,71,45,26,0,0.9987065743244139,0.9987065743244139,Ohio State,San Francisco,1,3,NA,263240194,2006-11-20
237,2,7:28,448,448,Ivan Harris Defensive Rebound.,71,45,26,10,0.9987065743244139,0.9987065743244139,Ohio State,San Francisco,1,3,NA,263240194,2006-11-20
238,2,7:18,438,438,Ron Lewis missed Three Point Jumper.,71,45,26,0,0.9988189227768276,0.9988189227768276,Ohio State,San Francisco,1,3,NA,263240194,2006-11-20
239,2,7:18,438,438,Alan Wiggins Jr. Defensive Rebound.,71,45,26,20,0.9988189227768276,0.9988189227768276,Ohio State,San Francisco,1,3,NA,263240194,2006-11-20
240,2,6:58,418,418,Manny Quezada made Three Point Jumper.,71,48,23,15,0.9978631124242551,0.9978631124242551,Ohio State,San Francisco,1,3,NA,263240194,2006-11-20
241,2,6:43,403,403,Matt Terwilliger missed Two Point Jumper.,71,48,23,0,0.99812121705774,0.99812121705774,Ohio State,San Francisco,1,3,NA,263240194,2006-11-20
242,2,6:43,403,403,Jay Watkins Defensive Rebound.,71,48,23,8,0.99812121705774,0.99812121705774,Ohio State,San Francisco,1,3,NA,263240194,2006-11-20
243,2,6:35,395,395,Mike Jr. Steal.,71,48,23,15,0.9982426443476349,0.9982426443476349,Ohio State,San Francisco,1,3,NA,263240194,2006-11-20
244,2,6:20,380,380,Ivan Harris missed Three Point Jumper.,71,48,23,0,0.9984520513437589,0.9984520513437589,Ohio State,San Francisco,1,3,NA,263240194,2006-11-20
245,2,6:20,380,380,Alan Wiggins Jr. Defensive Rebound.,71,48,23,32,0.9984520513437589,0.9984520513437589,Ohio State,San Francisco,1,3,NA,263240194,2006-11-20
246,2,5:48,348,348,Ivan Harris Steal.,71,48,23,20,0.9988641881745414,0.9988641881745414,Ohio State,San Francisco,1,3,NA,263240194,2006-11-20
247,2,5:28,328,328,Ron Lewis missed Two Point Layup.,71,48,23,0,0.9991130380727563,0.9991130380727563,Ohio State,San Francisco,1,3,NA,263240194,2006-11-20
248,2,5:28,328,328,Matt Terwilliger Offensive Rebound.,71,48,23,2,0.9991130380727563,0.9991130380727563,Ohio State,San Francisco,1,3,NA,263240194,2006-11-20
249,2,5:26,326,326,Matt Terwilliger missed Two Point Layup.,71,48,23,0,0.9991374637420686,0.9991374637420686,Ohio State,San Francisco,1,3,NA,263240194,2006-11-20
250,2,5:26,326,326,Jay Watkins Defensive Rebound.,71,48,23,6,0.9991374637420686,0.9991374637420686,Ohio State,San Francisco,1,3,NA,263240194,2006-11-20
251,2,5:20,320,320,Alan Wiggins Jr. made Two Point Layup.  Assisted by Jay Watkins.,71,50,21,12,0.9985307381923675,0.9985307381923675,Ohio State,San Francisco,1,3,NA,263240194,2006-11-20
252,2,5:08,308,308,Ivan Harris missed Two Point Jumper.,71,50,21,0,0.9987678201373515,0.9987678201373515,Ohio State,San Francisco,1,3,NA,263240194,2006-11-20
253,2,5:08,308,308,Jared Casey Defensive Rebound.,71,50,21,36,0.9987678201373515,0.9987678201373515,Ohio State,San Francisco,1,3,NA,263240194,2006-11-20
254,2,4:32,272,272,Antonio Kellogg made Two Point Jumper.,71,52,19,13,0.9978191590610679,0.9978191590610679,Ohio State,San Francisco,1,3,NA,263240194,2006-11-20
255,2,4:19,259,259,Mike Jr. made Two Point Jumper.,73,52,21,16,0.9987577995242993,0.9987577995242993,Ohio State,San Francisco,1,3,NA,263240194,2006-11-20
256,2,4:03,243,243,Jared Casey made Two Point Layup.  Assisted by Antonio Kellogg.,73,54,19,33,0.997475435219693,0.997475435219693,Ohio State,San Francisco,1,3,NA,263240194,2006-11-20
257,2,3:30,210,210,Foul on Jared Casey,73,54,19,0,0.9979302229175121,0.9979302229175121,Ohio State,San Francisco,1,3,NA,263240194,2006-11-20
258,2,3:30,210,210,Official TV Timeout.,73,54,19,14,0.9979302229175121,0.9979302229175121,Ohio State,San Francisco,1,3,NA,263240194,2006-11-20
259,2,3:16,196,196,Daequan Cook missed Three Point Jumper.,73,54,19,0,0.9985370128954065,0.9985370128954065,Ohio State,San Francisco,1,3,NA,263240194,2006-11-20
260,2,3:16,196,196,Jamar Butler Offensive Rebound.,73,54,19,9,0.9985370128954065,0.9985370128954065,Ohio State,San Francisco,1,3,NA,263240194,2006-11-20
261,2,3:07,187,187,Daequan Cook missed Two Point Layup.,73,54,19,0,0.9989522757418323,0.9989522757418323,Ohio State,San Francisco,1,3,NA,263240194,2006-11-20
262,2,3:07,187,187,Othello Hunter Offensive Rebound.,73,54,19,3,0.9989522757418323,0.9989522757418323,Ohio State,San Francisco,1,3,NA,263240194,2006-11-20
263,2,3:04,184,184,Othello Hunter made Two Point Layup.,75,54,21,15,0.9995536603392049,0.9995536603392049,Ohio State,San Francisco,1,3,NA,263240194,2006-11-20
264,2,2:49,169,169,Antonio Kellogg made Three Point Jumper.  Assisted by Jared Casey.,75,57,18,11,0.9992470974061345,0.9992470974061345,Ohio State,San Francisco,1,3,NA,263240194,2006-11-20
265,2,2:38,158,158,Jamar Butler made Three Point Jumper.  Assisted by Mike Jr..,78,57,21,12,0.999865850974941,0.999865850974941,Ohio State,San Francisco,1,3,NA,263240194,2006-11-20
266,2,2:26,146,146,Antonio Kellogg made Three Point Jumper.,78,60,18,22,0.999719234475229,0.999719234475229,Ohio State,San Francisco,1,3,NA,263240194,2006-11-20
267,2,2:04,124,124,David Lightly made Two Point Jumper.,80,60,20,9,0.9999683086061228,0.9999683086061228,Ohio State,San Francisco,1,3,NA,263240194,2006-11-20
268,2,1:55,115,115,Foul on Jamar Butler,80,60,20,9,0.9999827657083334,0.9999827657083334,Ohio State,San Francisco,1,3,NA,263240194,2006-11-20
269,2,1:46,106,106,Alan Wiggins Jr. missed Two Point Layup.,80,60,20,0,0.9999911922650552,0.9999911922650552,Ohio State,San Francisco,1,3,NA,263240194,2006-11-20
270,2,1:46,106,106,Othello Hunter Defensive Rebound.,80,60,20,28,0.9999911922650552,0.9999911922650552,Ohio State,San Francisco,1,3,NA,263240194,2006-11-20
271,2,1:18,78,78,Othello Hunter missed Two Point Layup.,80,60,20,0,0.9999992499251177,0.9999992499251177,Ohio State,San Francisco,1,3,NA,263240194,2006-11-20
272,2,1:18,78,78,Armondo Surratt Defensive Rebound.,80,60,20,7,0.9999992499251177,0.9999992499251177,Ohio State,San Francisco,1,3,NA,263240194,2006-11-20
273,2,1:11,71,71,Armondo Surratt missed Two Point Jumper.,80,60,20,1,0.9999996230502219,0.9999996230502219,Ohio State,San Francisco,1,3,NA,263240194,2006-11-20
274,2,1:10,70,70,Jamar Butler Defensive Rebound.,80,60,20,2,0.9999996594757998,0.9999996594757998,Ohio State,San Francisco,1,3,NA,263240194,2006-11-20
275,2,1:08,68,68,Foul on Antonio Kellogg,80,60,20,0,0.9999997224744355,0.9999997224744355,Ohio State,San Francisco,1,3,NA,263240194,2006-11-20
276,2,1:08,68,68,Daequan Cook made Free Throw.,81,60,21,0,0.9999998695427516,0.9999998695427516,Ohio State,San Francisco,1,3,NA,263240194,2006-11-20
277,2,1:08,68,68,Daequan Cook made Free Throw.,82,60,22,22,0.9999999386755869,0.9999999386755869,Ohio State,San Francisco,1,3,NA,263240194,2006-11-20
278,2,0:46,46,46,Christian Hernandez missed Three Point Jumper.,82,60,22,0,0.9999999955852785,0.9999999955852785,Ohio State,San Francisco,1,3,NA,263240194,2006-11-20
279,2,0:46,46,46,Daequan Cook Defensive Rebound.,82,60,22,9,0.9999999955852785,0.9999999955852785,Ohio State,San Francisco,1,3,NA,263240194,2006-11-20
280,2,0:37,37,37,Danny Peters missed Two Point Jumper.,82,60,22,0,0.9999999986397813,0.9999999986397813,Ohio State,San Francisco,1,3,NA,263240194,2006-11-20
281,2,0:37,37,37,David Lightly Offensive Rebound.,82,60,22,0,0.9999999986397813,0.9999999986397813,Ohio State,San Francisco,1,3,NA,263240194,2006-11-20
282,2,0:37,37,37,Mark Titus missed Three Point Jumper.,82,60,22,0,0.9999999986397813,0.9999999986397813,Ohio State,San Francisco,1,3,NA,263240194,2006-11-20
283,2,0:37,37,37,Jesse Byrd Defensive Rebound.,82,60,22,37,0.9999999986397813,0.9999999986397813,Ohio State,San Francisco,1,3,NA,263240194,2006-11-20
284,2,0:00,0,0,End Game,82,60,22,0,1,1,Ohio State,San Francisco,1,3,NA,263240194,2006-11-20
