play_id,half,time_remaining_half,secs_remaining,secs_remaining_absolute,description,home_score,away_score,score_diff,play_length,win_prob,naive_win_prob,home,away,home_time_out_remaining,away_time_out_remaining,home_favored_by,game_id,date
1,1,20:00,2400,2400,PLAY,0,0,0,41,0.5,0.5,Ohio State,San Francisco,4,4,NA,263240194,2006-11-20
2,1,19:19,2359,2359,Alan Wiggins Jr. missed Three Point Jumper.,0,0,0,0,0.5,0.5,Ohio State,San Francisco,4,4,NA,263240194,2006-11-20
3,1,19:19,2359,2359,David Lightly Defensive Rebound.,0,0,0,14,0.5,0.5,Ohio State,San Francisco,4,4,NA,263240194,2006-11-20
4,1,19:05,2345,2345,Ron Lewis made Three Point Jumper.  Assisted by Mike Jr..,3,0,3,14,0.5675683460752833,0.5675683460752833,Ohio State,San Francisco,4,4,NA,263240194,2006-11-20
5,1,18:51,2331,2331,Mike Jr. Steal.,3,0,3,14,0.5680211159857175,0.5680211159857175,Ohio State,San Francisco,4,4,NA,263240194,2006-11-20
6,1,18:37,2317,2317,Jamar Butler missed Three Point Jumper.,3,0,3,0,0.5684772757508765,0.5684772757508765,Ohio State,San Francisco,4,4,NA,263240194,2006-11-20
7,1,18:37,2317,2317,Jay Watkins Defensive Rebound.,3,0,3,9,0.5684772757508765,0.5684772757508765,Ohio State,San Francisco,4,4,NA,263240194,2006-11-20
8,1,18:28,2308,2308,Armondo Surratt missed Two Point Jumper.,3,0,3,0,0.5687722107427648,0.5687722107427648,Ohio State,San Francisco,4,4,NA,263240194,2006-11-20
9,1,18:28,2308,2308,Jamar Butler Defensive Rebound.,3,0,3,10,0.5687722107427648,0.5687722107427648,Ohio State,San Francisco,4,4,NA,263240194,2006-11-20
10,1,18:18,2298,2298,Jamar Butler missed Two Point Layup.,3,0,3,0,0.5691013846518673,0.5691013846518673,Ohio State,San Francisco,4,4,NA,263240194,2006-11-20
11,1,18:18,2298,2298,Ohio State Defensive Rebound.,3,0,3,20,0.5691013846518673,0.5691013846518673,Ohio State,San Francisco,4,4,NA,263240194,2006-11-20
12,1,17:58,2278,2278,Jamar Butler missed Three Point Jumper.,3,0,3,0,0.5697640624117907,0.5697640624117907,Ohio State,San Francisco,4,4,NA,263240194,2006-11-20
13,1,17:58,2278,2278,David Lightly Offensive Rebound.,3,0,3,2,0.5697640624117907,0.5697640624117907,Ohio State,San Francisco,4,4,NA,263240194,2006-11-20
14,1,17:56,2276,2276,David Lightly missed Two Point Layup.,3,0,3,0,0.5698306292559723,0.5698306292559723,Ohio State,San Francisco,4,4,NA,263240194,2006-11-20
15,1,17:56,2276,2276,Jay Watkins Defensive Rebound.,3,0,3,11,0.5698306292559723,0.5698306292559723,Ohio State,San Francisco,4,4,NA,263240194,2006-11-20
16,1,17:45,2265,2265,Ron Lewis Steal.,3,0,3,4,0.5701976570381696,0.5701976570381696,Ohio State,San Francisco,4,4,NA,263240194,2006-11-20
17,1,17:41,2261,2261,Jamar Butler missed Three Point Jumper.,3,0,3,0,0.5703314902055913,0.5703314902055913,Ohio State,San Francisco,4,4,NA,263240194,2006-11-20
18,1,17:41,2261,2261,San Francisco Defensive Rebound.,3,0,3,22,0.5703314902055913,0.5703314902055913,Ohio State,San Francisco,4,4,NA,263240194,2006-11-20
19,1,17:19,2239,2239,Antonio Kellogg missed Three Point Jumper.,3,0,3,0,0.5710708088675566,0.5710708088675566,Ohio State,San Francisco,4,4,NA,263240194,2006-11-20
20,1,17:19,2239,2239,Jay Watkins Offensive Rebound.,3,0,3,7,0.5710708088675566,0.5710708088675566,Ohio State,San Francisco,4,4,NA,263240194,2006-11-20
21,1,17:12,2232,2232,Manny Quezada missed Three Point Jumper.,3,0,3,0,0.5713071075419746,0.5713071075419746,Ohio State,San Francisco,4,4,NA,263240194,2006-11-20
22,1,17:12,2232,2232,Othello Hunter Defensive Rebound.,3,0,3,12,0.5713071075419746,0.5713071075419746,Ohio State,San Francisco,4,4,NA,263240194,2006-11-20
23,1,17:00,2220,2220,Foul on Alan Wiggins Jr.,3,0,3,0,0.571713260398693,0.571713260398693,Ohio State,San Francisco,4,4,NA,263240194,2006-11-20
24,1,17:00,2220,2220,Ron Lewis made Free Throw.,4,0,4,0,0.5951088823675076,0.5951088823675076,Ohio State,San Francisco,4,4,NA,263240194,2006-11-20
25,1,17:00,2220,2220,Ron Lewis made Free Throw.,5,0,5,32,0.6180802389217519,0.6180802389217519,Ohio State,San Francisco,4,4,NA,263240194,2006-11-20
26,1,16:28,2188,2188,Othello Hunter missed Two Point Jumper.,5,0,5,0,0.6198286145629189,0.6198286145629189,Ohio State,San Francisco,4,4,NA,263240194,2006-11-20
27,1,16:28,2188,2188,Jay Watkins Defensive Rebound.,5,0,5,31,0.6198286145629189,0.6198286145629189,Ohio State,San Francisco,4,4,NA,263240194,2006-11-20
28,1,15:57,2157,2157,Foul on Ron Lewis,5,0,5,0,0.621530851403237,0.621530851403237,Ohio State,San Francisco,4,4,NA,263240194,2006-11-20
29,1,15:57,2157,2157,Official TV Timeout.,5,0,5,7,0.621530851403237,0.621530851403237,Ohio State,San Francisco,4,4,NA,263240194,2006-11-20
30,1,15:50,2150,2150,Armondo Surratt made Two Point Layup.,5,2,3,11,0.5741040421330821,0.5741040421330821,Ohio State,San Francisco,4,4,NA,263240194,2006-11-20
31,1,15:39,2139,2139,Daequan Cook made Two Point Jumper.,7,2,5,20,0.6225252198354896,0.6225252198354896,Ohio State,San Francisco,4,4,NA,263240194,2006-11-20
32,1,15:19,2119,2119,Armondo Surratt made Three Point Jumper.  Assisted by Alan Wiggins Jr..,7,5,2,11,0.5503301999323245,0.5503301999323245,Ohio State,San Francisco,4,4,NA,263240194,2006-11-20
33,1,15:08,2108,2108,Mike Jr. made Two Point Layup.,9,5,4,0,0.6001534130055126,0.6001534130055126,Ohio State,San Francisco,4,4,NA,263240194,2006-11-20
34,1,15:08,2108,2108,Foul on Jay Watkins,9,5,4,0,0.6001534130055126,0.6001534130055126,Ohio State,San Francisco,4,4,NA,263240194,2006-11-20
35,1,15:08,2108,2108,Mike Jr. made Free Throw.,10,5,5,22,0.6242508354587445,0.6242508354587445,Ohio State,San Francisco,4,4,NA,263240194,2006-11-20
36,1,14:46,2086,2086,Armondo Surratt missed Two Point Jumper.,10,5,5,0,0.6254865564887664,0.6254865564887664,Ohio State,San Francisco,4,4,NA,263240194,2006-11-20
37,1,14:46,2086,2086,Mike Jr. Defensive Rebound.,10,5,5,24,0.6254865564887664,0.6254865564887664,Ohio State,San Francisco,4,4,NA,263240194,2006-11-20
38,1,14:22,2062,2062,Ivan Harris missed Three Point Jumper.,10,5,5,0,0.6268461775951617,0.6268461775951617,Ohio State,San Francisco,4,4,NA,263240194,2006-11-20
39,1,14:22,2062,2062,Manny Quezada Defensive Rebound.,10,5,5,17,0.6268461775951617,0.6268461775951617,Ohio State,San Francisco,4,4,NA,263240194,2006-11-20
40,1,14:05,2045,2045,Manny Quezada missed Three Point Jumper.,10,5,5,0,0.6278170858277525,0.6278170858277525,Ohio State,San Francisco,4,4,NA,263240194,2006-11-20
41,1,14:05,2045,2045,Antonio Kellogg Offensive Rebound.,10,5,5,15,0.6278170858277525,0.6278170858277525,Ohio State,San Francisco,4,4,NA,263240194,2006-11-20
42,1,13:50,2030,2030,Armondo Surratt missed Three Point Jumper.,10,5,5,0,0.6286795016727604,0.6286795016727604,Ohio State,San Francisco,4,4,NA,263240194,2006-11-20
43,1,13:50,2030,2030,Ivan Harris Defensive Rebound.,10,5,5,11,0.6286795016727604,0.6286795016727604,Ohio State,San Francisco,4,4,NA,263240194,2006-11-20
44,1,13:39,2019,2019,Ivan Harris missed Two Point Layup.,10,5,5,0,0.6293155057529783,0.6293155057529783,Ohio State,San Francisco,4,4,NA,263240194,2006-11-20
45,1,13:39,2019,2019,Alan Wiggins Jr. Defensive Rebound.,10,5,5,5,0.6293155057529783,0.6293155057529783,Ohio State,San Francisco,4,4,NA,263240194,2006-11-20
46,1,13:34,2014,2014,Armondo Surratt made Two Point Layup.,10,7,3,0,0.5789135967179166,0.5789135967179166,Ohio State,San Francisco,4,4,NA,263240194,2006-11-20
47,1,13:34,2014,2014,Foul on Mike Jr.,10,7,3,0,0.5789135967179166,0.5789135967179166,Ohio State,San Francisco,4,4,NA,263240194,2006-11-20
48,1,13:34,2014,2014,Armondo Surratt made Free Throw.,10,8,2,20,0.5528543309949765,0.5528543309949765,Ohio State,San Francisco,4,4,NA,263240194,2006-11-20
49,1,13:14,1994,1994,Matt Terwilliger missed Two Point Layup.,10,8,2,0,0.553349484338157,0.553349484338157,Ohio State,San Francisco,4,4,NA,263240194,2006-11-20
50,1,13:14,1994,1994,San Francisco Defensive Rebound.,10,8,2,9,0.553349484338157,0.553349484338157,Ohio State,San Francisco,4,4,NA,263240194,2006-11-20
51,1,13:05,1985,1985,Manny Quezada missed Two Point Jumper.,10,8,2,0,0.5535739979311768,0.5535739979311768,Ohio State,San Francisco,4,4,NA,263240194,2006-11-20
52,1,13:05,1985,1985,Alan Wiggins Jr. Offensive Rebound.,10,8,2,3,0.5535739979311768,0.5535739979311768,Ohio State,San Francisco,4,4,NA,263240194,2006-11-20
53,1,13:02,1982,1982,Mike Jr. Steal.,10,8,2,8,0.5536490759329797,0.5536490759329797,Ohio State,San Francisco,4,4,NA,263240194,2006-11-20
54,1,12:54,1974,1974,Daequan Cook missed Three Point Jumper.,10,8,2,0,0.5538498807138023,0.5538498807138023,Ohio State,San Francisco,4,4,NA,263240194,2006-11-20
55,1,12:54,1974,1974,Ivan Harris Offensive Rebound.,10,8,2,3,0.5538498807138023,0.5538498807138023,Ohio State,San Francisco,4,4,NA,263240194,2006-11-20
56,1,12:51,1971,1971,Ivan Harris missed Two Point Jumper.,10,8,2,0,0.5539254088621718,0.5539254088621718,Ohio State,San Francisco,4,4,NA,263240194,2006-11-20
57,1,12:51,1971,1971,Jesse Byrd Defensive Rebound.,10,8,2,7,0.5539254088621718,0.5539254088621718,Ohio State,San Francisco,4,4,NA,263240194,2006-11-20
58,1,12:44,1964,1964,Jay Watkins missed Two Point Layup.,10,8,2,1,0.5541021283483936,0.5541021283483936,Ohio State,San Francisco,4,4,NA,263240194,2006-11-20
59,1,12:43,1963,1963,Mike Jr. Defensive Rebound.,10,8,2,5,0.5541274301505975,0.5541274301505975,Ohio State,San Francisco,4,4,NA,263240194,2006-11-20
60,1,12:38,1958,1958,Foul on Christian Hernandez,10,8,2,3,0.554254151929457,0.554254151929457,Ohio State,San Francisco,4,4,NA,263240194,2006-11-20
61,1,12:35,1955,1955,Daequan Cook missed Two Point Layup.,10,8,2,1,0.5543303564086433,0.5543303564086433,Ohio State,San Francisco,4,4,NA,263240194,2006-11-20
62,1,12:34,1954,1954,Christian Hernandez Defensive Rebound.,10,8,2,7,0.5543557866699169,0.5543557866699169,Ohio State,San Francisco,4,4,NA,263240194,2006-11-20
63,1,12:27,1947,1947,Jesse Byrd missed Two Point Layup.,10,8,2,1,0.5545342046676778,0.5545342046676778,Ohio State,San Francisco,4,4,NA,263240194,2006-11-20
64,1,12:26,1946,1946,Othello Hunter Defensive Rebound.,10,8,2,4,0.554559751376137,0.554559751376137,Ohio State,San Francisco,4,4,NA,263240194,2006-11-20
65,1,12:22,1942,1942,Ron Lewis made Three Point Jumper.  Assisted by Jamar Butler.,13,8,5,24,0.633860456593886,0.633860456593886,Ohio State,San Francisco,4,4,NA,263240194,2006-11-20
66,1,11:58,1918,1918,Official TV Timeout.,13,8,5,14,0.6353101319377064,0.6353101319377064,Ohio State,San Francisco,4,4,NA,263240194,2006-11-20
67,1,11:44,1904,1904,Manny Quezada made Three Point Jumper.  Assisted by Armondo Surratt.,13,11,2,15,0.5556397560516335,0.5556397560516335,Ohio State,San Francisco,4,4,NA,263240194,2006-11-20
68,1,11:29,1889,1889,Daequan Cook made Two Point Jumper.  Assisted by Jamar Butler.,15,11,4,29,0.6106610710351568,0.6106610710351568,Ohio State,San Francisco,4,4,NA,263240194,2006-11-20
69,1,11:00,1860,1860,Armondo Surratt made Three Point Jumper.  Assisted by Christian Hernandez.,15,14,1,20,0.5284778126455524,0.5284778126455524,Ohio State,San Francisco,4,4,NA,263240194,2006-11-20
70,1,10:40,1840,1840,Othello Hunter made Two Point Layup.  Assisted by Daequan Cook.,17,14,3,25,0.5854645035731838,0.5854645035731838,Ohio State,San Francisco,4,4,NA,263240194,2006-11-20
71,1,10:15,1815,1815,Manny Quezada made Two Point Jumper.,17,16,1,21,0.5290677004001753,0.5290677004001753,Ohio State,San Francisco,4,4,NA,263240194,2006-11-20
72,1,9:54,1794,1794,Othello Hunter missed Two Point Jumper.,17,16,1,0,0.5293469021072449,0.5293469021072449,Ohio State,San Francisco,4,4,NA,263240194,2006-11-20
73,1,9:54,1794,1794,David Lightly Offensive Rebound.,17,16,1,2,0.5293469021072449,0.5293469021072449,Ohio State,San Francisco,4,4,NA,263240194,2006-11-20
74,1,9:52,1792,1792,David Lightly made Two Point Layup.,19,16,3,30,0.5873182943858248,0.5873182943858248,Ohio State,San Francisco,4,4,NA,263240194,2006-11-20
75,1,9:22,1762,1762,Christian Hernandez missed Three Point Jumper.,19,16,3,0,0.5885017232232406,0.5885017232232406,Ohio State,San Francisco,4,4,NA,263240194,2006-11-20
76,1,9:22,1762,1762,Ohio State Defensive Rebound.,19,16,3,30,0.5885017232232406,0.5885017232232406,Ohio State,San Francisco,4,4,NA,263240194,2006-11-20
77,1,8:52,1732,1732,Ivan Harris missed Three Point Jumper.,19,16,3,0,0.5897114890313557,0.5897114890313557,Ohio State,San Francisco,4,4,NA,263240194,2006-11-20
78,1,8:52,1732,1732,San Francisco Defensive Rebound.,19,16,3,1,0.5897114890313557,0.5897114890313557,Ohio State,San Francisco,4,4,NA,263240194,2006-11-20
79,1,8:51,1731,1731,Foul on Othello Hunter,19,16,3,20,0.5897523384320297,0.5897523384320297,Ohio State,San Francisco,4,4,NA,263240194,2006-11-20
80,1,8:31,1711,1711,Antonio Kellogg missed Three Point Jumper.,19,16,3,0,0.5905772180014734,0.5905772180014734,Ohio State,San Francisco,4,4,NA,263240194,2006-11-20
81,1,8:31,1711,1711,David Lightly Defensive Rebound.,19,16,3,11,0.5905772180014734,0.5905772180014734,Ohio State,San Francisco,4,4,NA,263240194,2006-11-20
82,1,8:20,1700,1700,Foul on Antonio Kellogg,19,16,3,3,0.5910377124473295,0.5910377124473295,Ohio State,San Francisco,4,4,NA,263240194,2006-11-20
83,1,8:17,1697,1697,Mike Jr. made Two Point Jumper.,21,16,5,10,0.6489970695135515,0.6489970695135515,Ohio State,San Francisco,4,4,NA,263240194,2006-11-20
84,1,8:07,1687,1687,Alan Wiggins Jr. missed Three Point Jumper.,21,16,5,0,0.6496628763501076,0.6496628763501076,Ohio State,San Francisco,4,4,NA,263240194,2006-11-20
85,1,8:07,1687,1687,David Lightly Defensive Rebound.,21,16,5,10,0.6496628763501076,0.6496628763501076,Ohio State,San Francisco,4,4,NA,263240194,2006-11-20
86,1,7:57,1677,1677,Antonio Kellogg Steal.,21,16,5,4,0.6503220940985741,0.6503220940985741,Ohio State,San Francisco,4,4,NA,263240194,2006-11-20
87,1,7:53,1673,1673,Alan Wiggins Jr. made Two Point Jumper.  Assisted by Antonio Kellogg.,21,18,3,19,0.592174407743181,0.592174407743181,Ohio State,San Francisco,4,4,NA,263240194,2006-11-20
88,1,7:34,1654,1654,Matt Terwilliger made Two Point Layup.  Assisted by David Lightly.,23,18,5,0,0.6518030794820814,0.6518030794820814,Ohio State,San Francisco,4,4,NA,263240194,2006-11-20
89,1,7:34,1654,1654,Foul on Jesse Byrd,23,18,5,0,0.6518030794820814,0.6518030794820814,Ohio State,San Francisco,4,4,NA,263240194,2006-11-20
90,1,7:34,1654,1654,Official TV Timeout.,23,18,5,0,0.6518030794820814,0.6518030794820814,Ohio State,San Francisco,4,4,NA,263240194,2006-11-20
91,1,7:34,1654,1654,Matt Terwilliger made Free Throw.,24,18,6,23,0.6796947099971712,0.6796947099971712,Ohio State,San Francisco,4,4,NA,263240194,2006-11-20
92,1,7:11,1631,1631,Christian Hernandez made Three Point Jumper.  Assisted by Antonio Kellogg.,24,21,3,16,0.5938747716069446,0.5938747716069446,Ohio State,San Francisco,4,4,NA,263240194,2006-11-20
93,1,6:55,1615,1615,Mike Jr. missed Three Point Jumper.,24,21,3,0,0.5945084117707827,0.5945084117707827,Ohio State,San Francisco,4,4,NA,263240194,2006-11-20
94,1,6:55,1615,1615,Ivan Harris Offensive Rebound.,24,21,3,28,0.5945084117707827,0.5945084117707827,Ohio State,San Francisco,4,4,NA,263240194,2006-11-20
95,1,6:27,1587,1587,Jamar Butler Steal.,24,21,3,1,0.5956126511053937,0.5956126511053937,Ohio State,San Francisco,4,4,NA,263240194,2006-11-20
96,1,6:26,1586,1586,Mike Jr. made Two Point Layup.  Assisted by Jamar Butler.,26,21,5,31,0.656026276239117,0.656026276239117,Ohio State,San Francisco,4,4,NA,263240194,2006-11-20
97,1,5:55,1555,1555,Antonio Kellogg missed Three Point Jumper.,26,21,5,0,0.6579525484026556,0.6579525484026556,Ohio State,San Francisco,4,4,NA,263240194,2006-11-20
98,1,5:55,1555,1555,Mike Jr. Defensive Rebound.,26,21,5,7,0.6579525484026556,0.6579525484026556,Ohio State,San Francisco,4,4,NA,263240194,2006-11-20
99,1,5:48,1548,1548,Jamar Butler made Three Point Jumper.  Assisted by Mike Jr..,29,21,8,6,0.7407419908423832,0.7407419908423832,Ohio State,San Francisco,4,4,NA,263240194,2006-11-20
100,1,5:42,1542,1542,San Francisco Full Timeout.,29,21,8,21,0.7412613675323606,0.7412613675323606,Ohio State,San Francisco,3,4,NA,263240194,2006-11-20
101,1,5:21,1521,1521,Daequan Cook made Two Point Jumper.,31,21,10,13,0.7904624333313208,0.7904624333313208,Ohio State,San Francisco,3,4,NA,263240194,2006-11-20
102,1,5:08,1508,1508,Daequan Cook Steal.,31,21,10,0,0.7917268615822456,0.7917268615822456,Ohio State,San Francisco,3,4,NA,263240194,2006-11-20
103,1,5:08,1508,1508,Foul on Alan Wiggins Jr.,31,21,10,8,0.7917268615822456,0.7917268615822456,Ohio State,San Francisco,3,4,NA,263240194,2006-11-20
104,1,5:00,1500,1500,Mike Jr. made Two Point Layup.  Assisted by Jamar Butler.,33,21,12,0,0.833160374665518,0.833160374665518,Ohio State,San Francisco,3,4,NA,263240194,2006-11-20
105,1,5:00,1500,1500,Foul on Armondo Surratt,33,21,12,0,0.833160374665518,0.833160374665518,Ohio State,San Francisco,3,4,NA,263240194,2006-11-20
106,1,5:00,1500,1500,Mike Jr. made Free Throw.,34,21,13,18,0.8509674601708622,0.8509674601708622,Ohio State,San Francisco,3,4,NA,263240194,2006-11-20
107,1,4:42,1482,1482,Foul on Matt Terwilliger,34,21,13,6,0.8527822293736983,0.8527822293736983,Ohio State,San Francisco,3,4,NA,263240194,2006-11-20
108,1,4:36,1476,1476,Manny Quezada made Two Point Jumper.,34,23,11,21,0.8161540955712457,0.8161540955712457,Ohio State,San Francisco,3,4,NA,263240194,2006-11-20
109,1,4:15,1455,1455,Daequan Cook made Two Point Layup.,36,23,13,23,0.8556036576336434,0.8556036576336434,Ohio State,San Francisco,3,4,NA,263240194,2006-11-20
110,1,3:52,1432,1432,Armondo Surratt missed Three Point Jumper.,36,23,13,0,0.858036459120521,0.858036459120521,Ohio State,San Francisco,3,4,NA,263240194,2006-11-20
111,1,3:52,1432,1432,Mike Jr. Defensive Rebound.,36,23,13,11,0.858036459120521,0.858036459120521,Ohio State,San Francisco,3,4,NA,263240194,2006-11-20
112,1,3:41,1421,1421,Matt Terwilliger made Two Point Layup.  Assisted by Mike Jr..,38,23,15,5,0.889580669156207,0.889580669156207,Ohio State,San Francisco,3,4,NA,263240194,2006-11-20
113,1,3:36,1416,1416,San Francisco Full Timeout.,38,23,15,13,0.890047254806901,0.890047254806901,Ohio State,San Francisco,2,4,NA,263240194,2006-11-20
114,1,3:23,1403,1403,Official TV Timeout.,38,23,15,13,0.8912377343098352,0.8912377343098352,Ohio State,San Francisco,2,4,NA,263240194,2006-11-20
115,1,3:10,1390,1390,Manny Quezada missed Two Point Jumper.,38,23,15,0,0.8924009945316901,0.8924009945316901,Ohio State,San Francisco,2,4,NA,263240194,2006-11-20
116,1,3:10,1390,1390,Othello Hunter Defensive Rebound.,38,23,15,16,0.8924009945316901,0.8924009945316901,Ohio State,San Francisco,2,4,NA,263240194,2006-11-20
117,1,2:54,1374,1374,Ron Lewis missed Two Point Jumper.,38,23,15,0,0.893805206829595,0.893805206829595,Ohio State,San Francisco,2,4,NA,263240194,2006-11-20
118,1,2:54,1374,1374,Manny Quezada Defensive Rebound.,38,23,15,13,0.893805206829595,0.893805206829595,Ohio State,San Francisco,2,4,NA,263240194,2006-11-20
119,1,2:41,1361,1361,Armondo Surratt made Two Point Layup.,38,25,13,24,0.8648904346043876,0.8648904346043876,Ohio State,San Francisco,2,4,NA,263240194,2006-11-20
120,1,2:17,1337,1337,Ron Lewis missed Two Point Jumper.,38,25,13,0,0.8671203412295202,0.8671203412295202,Ohio State,San Francisco,2,4,NA,263240194,2006-11-20
121,1,2:17,1337,1337,Ohio State Defensive Rebound.,38,25,13,0,0.8671203412295202,0.8671203412295202,Ohio State,San Francisco,2,4,NA,263240194,2006-11-20
122,1,2:17,1337,1337,Ohio State Full Timeout.,38,25,13,9,0.8671203412295202,0.8671203412295202,Ohio State,San Francisco,2,3,NA,263240194,2006-11-20
123,1,2:08,1328,1328,Othello Hunter missed Two Point Layup.,38,25,13,0,0.8679606041121324,0.8679606041121324,Ohio State,San Francisco,2,3,NA,263240194,2006-11-20
124,1,2:08,1328,1328,Othello Hunter Offensive Rebound.,38,25,13,1,0.8679606041121324,0.8679606041121324,Ohio State,San Francisco,2,3,NA,263240194,2006-11-20
125,1,2:07,1327,1327,Othello Hunter made Two Point Tip Shot.,40,25,15,12,0.8978617311722241,0.8978617311722241,Ohio State,San Francisco,2,3,NA,263240194,2006-11-20
126,1,1:55,1315,1315,Antonio Kellogg made Three Point Jumper.  Assisted by Manny Quezada.,40,28,12,11,0.8517119287242929,0.8517119287242929,Ohio State,San Francisco,2,3,NA,263240194,2006-11-20
127,1,1:44,1304,1304,David Lightly made Two Point Layup.  Assisted by Mike Jr..,42,28,14,12,0.885887532365726,0.885887532365726,Ohio State,San Francisco,2,3,NA,263240194,2006-11-20
128,1,1:32,1292,1292,Foul on David Lightly,42,28,14,0,0.8870071301654284,0.8870071301654284,Ohio State,San Francisco,2,3,NA,263240194,2006-11-20
129,1,1:32,1292,1292,Manny Quezada missed Free Throw.,42,28,14,0,0.8870071301654284,0.8870071301654284,Ohio State,San Francisco,2,3,NA,263240194,2006-11-20
130,1,1:32,1292,1292,San Francisco Defensive Rebound.,42,28,14,0,0.8870071301654284,0.8870071301654284,Ohio State,San Francisco,2,3,NA,263240194,2006-11-20
131,1,1:32,1292,1292,Manny Quezada made Free Throw.,42,29,13,17,0.8713947787083501,0.8713947787083501,Ohio State,San Francisco,2,3,NA,263240194,2006-11-20
132,1,1:15,1275,1275,Jamar Butler missed Three Point Jumper.,42,29,13,0,0.8730811718776909,0.8730811718776909,Ohio State,San Francisco,2,3,NA,263240194,2006-11-20
133,1,1:15,1275,1275,Othello Hunter Offensive Rebound.,42,29,13,6,0.8730811718776909,0.8730811718776909,Ohio State,San Francisco,2,3,NA,263240194,2006-11-20
134,1,1:09,1269,1269,Foul on James Morgan,42,29,13,0,0.873689600708919,0.873689600708919,Ohio State,San Francisco,2,3,NA,263240194,2006-11-20
135,1,1:09,1269,1269,Othello Hunter made Free Throw.,43,29,14,0,0.8892152998152496,0.8892152998152496,Ohio State,San Francisco,2,3,NA,263240194,2006-11-20
136,1,1:09,1269,1269,Othello Hunter missed Free Throw.,43,29,14,0,0.8892152998152496,0.8892152998152496,Ohio State,San Francisco,2,3,NA,263240194,2006-11-20
137,1,1:09,1269,1269,Antonio Kellogg Defensive Rebound.,43,29,14,38,0.8892152998152496,0.8892152998152496,Ohio State,San Francisco,2,3,NA,263240194,2006-11-20
138,1,0:31,1231,1231,David Lightly missed Two Point Layup.,43,29,14,0,0.8931038492843723,0.8931038492843723,Ohio State,San Francisco,2,3,NA,263240194,2006-11-20
139,1,0:31,1231,1231,Othello Hunter Offensive Rebound.,43,29,14,3,0.8931038492843723,0.8931038492843723,Ohio State,San Francisco,2,3,NA,263240194,2006-11-20
140,1,0:28,1228,1228,Othello Hunter made Two Point Dunk Shot.,45,29,16,23,0.9190844801753222,0.9190844801753222,Ohio State,San Francisco,2,3,NA,263240194,2006-11-20
141,1,0:05,1205,1205,Mike Jr. missed Three Point Jumper.,45,29,16,0,0.9213542353649586,0.9213542353649586,Ohio State,San Francisco,2,3,NA,263240194,2006-11-20
142,1,0:05,1205,1205,Ron Lewis Offensive Rebound.,45,29,16,2,0.9213542353649586,0.9213542353649586,Ohio State,San Francisco,2,3,NA,263240194,2006-11-20
143,1,0:03,1203,1203,Ron Lewis missed Two Point Jumper.,45,29,16,0,0.9215514059921698,0.9215514059921698,Ohio State,San Francisco,2,3,NA,263240194,2006-11-20
144,1,0:03,1203,1203,San Francisco Defensive Rebound.,45,29,16,3,0.9215514059921698,0.9215514059921698,Ohio State,San Francisco,2,3,NA,263240194,2006-11-20
145,1,0:00,1200,1200,End of the 1st Half.,45,29,16,0,0.9218447990893213,0.9218447990893213,Ohio State,San Francisco,2,3,NA,263240194,2006-11-20
146,2,20:00,1200,1200,PLAY,45,29,16,18,0.9218447990893213,0.9218447990893213,Ohio State,San Francisco,3,4,NA,263240194,2006-11-20
147,2,19:42,1182,1182,Manny Quezada missed Two Point Layup.,45,29,16,5,0.9235512226529299,0.9235512226529299,Ohio State,San Francisco,3,4,NA,263240194,2006-11-20
148,2,19:37,1177,1177,David Lightly Defensive Rebound.,45,29,16,0,0.9240106926891796,0.9240106926891796,Ohio State,San Francisco,3,4,NA,263240194,2006-11-20
149,2,19:37,1177,1177,Ron Lewis made Two Point Dunk Shot.  Assisted by David Lightly.,47,29,18,28,0.9432350998481821,0.9432350998481821,Ohio State,San Francisco,3,4,NA,263240194,2006-11-20
150,2,19:09,1149,1149,Foul on Othello Hunter,47,29,18,0,0.9453604944714654,0.9453604944714654,Ohio State,San Francisco,3,4,NA,263240194,2006-11-20
151,2,19:09,1149,1149,Alan Wiggins Jr. made Free Throw.,47,30,17,0,0.9365785271698842,0.9365785271698842,Ohio State,San Francisco,3,4,NA,263240194,2006-11-20
152,2,19:09,1149,1149,Alan Wiggins Jr. made Free Throw.,47,31,16,24,0.9264948210943375,0.9264948210943375,Ohio State,San Francisco,3,4,NA,263240194,2006-11-20
153,2,18:45,1125,1125,Othello Hunter missed Two Point Layup.,47,31,16,0,0.9285429637985867,0.9285429637985867,Ohio State,San Francisco,3,4,NA,263240194,2006-11-20
154,2,18:45,1125,1125,Jay Watkins Defensive Rebound.,47,31,16,5,0.9285429637985867,0.9285429637985867,Ohio State,San Francisco,3,4,NA,263240194,2006-11-20
155,2,18:40,1120,1120,Manny Quezada missed Three Point Jumper.,47,31,16,0,0.9289644802749918,0.9289644802749918,Ohio State,San Francisco,3,4,NA,263240194,2006-11-20
156,2,18:40,1120,1120,San Francisco Defensive Rebound.,47,31,16,17,0.9289644802749918,0.9289644802749918,Ohio State,San Francisco,3,4,NA,263240194,2006-11-20
157,2,18:23,1103,1103,Alan Wiggins Jr. made Three Point Jumper.  Assisted by Manny Quezada.,47,34,13,7,0.8915425963270427,0.8915425963270427,Ohio State,San Francisco,3,4,NA,263240194,2006-11-20
158,2,18:16,1096,1096,David Lightly missed Two Point Layup.,47,34,13,0,0.8922564177119927,0.8922564177119927,Ohio State,San Francisco,3,4,NA,263240194,2006-11-20
159,2,18:16,1096,1096,Othello Hunter Offensive Rebound.,47,34,13,1,0.8922564177119927,0.8922564177119927,Ohio State,San Francisco,3,4,NA,263240194,2006-11-20
160,2,18:15,1095,1095,Foul on Jay Watkins,47,34,13,47,0.8923586071608126,0.8923586071608126,Ohio State,San Francisco,3,4,NA,263240194,2006-11-20
161,2,17:28,1048,1048,Othello Hunter made Two Point Dunk Shot.,49,34,15,4,0.9242012030338822,0.9242012030338822,Ohio State,San Francisco,3,4,NA,263240194,2006-11-20
162,2,17:24,1044,1044,Jay Watkins made Two Point Layup.,49,36,13,3,0.8977188306328403,0.8977188306328403,Ohio State,San Francisco,3,4,NA,263240194,2006-11-20
163,2,17:21,1041,1041,Alan Wiggins Jr. Steal.,49,36,13,12,0.8980473356735367,0.8980473356735367,Ohio State,San Francisco,3,4,NA,263240194,2006-11-20
