play_id,half,time_remaining_half,secs_remaining,secs_remaining_absolute,description,home_score,away_score,score_diff,play_length,win_prob,naive_win_prob,home,away,home_time_out_remaining,away_time_out_remaining,home_favored_by,game_id,date
1,1,20:00,2400,2400,PLAY,0,0,0,36,0.5,0.5,Missouri,UMKC,4,4,NA,253330142,2005-11-29
2,1,19:24,2364,2364,Quinton Day missed Two Point Jumper.,0,0,0,0,0.5,0.5,Missouri,UMKC,4,4,NA,253330142,2005-11-29
3,1,19:24,2364,2364,Thomas Gardner Defensive Rebound.,0,0,0,20,0.5,0.5,Missouri,UMKC,4,4,NA,253330142,2005-11-29
4,1,19:04,2344,2344,Jason Horton made Three Point Jumper.,3,0,3,25,0.5676005697509393,0.5676005697509393,Missouri,UMKC,4,4,NA,253330142,2005-11-29
5,1,18:39,2319,2319,Quinton Day missed Three Point Jumper.,3,0,3,0,0.568411910727213,0.568411910727213,Missouri,UMKC,4,4,NA,253330142,2005-11-29
6,1,18:39,2319,2319,Jason Horton Defensive Rebound.,3,0,3,16,0.568411910727213,0.568411910727213,Missouri,UMKC,4,4,NA,253330142,2005-11-29
7,1,18:23,2303,2303,Thomas Gardner missed Three Point Jumper.,3,0,3,0,0.5689366090851553,0.5689366090851553,Missouri,UMKC,4,4,NA,253330142,2005-11-29
8,1,18:23,2303,2303,Kevin Young Offensive Rebound.,3,0,3,5,0.5689366090851553,0.5689366090851553,Missouri,UMKC,4,4,NA,253330142,2005-11-29
9,1,18:18,2298,2298,Foul on Brian Gettinger,3,0,3,0,0.5691013846518673,0.5691013846518673,Missouri,UMKC,4,4,NA,253330142,2005-11-29
10,1,18:18,2298,2298,Kevin Young missed Free Throw.,3,0,3,0,0.5691013846518673,0.5691013846518673,Missouri,UMKC,4,4,NA,253330142,2005-11-29
11,1,18:18,2298,2298,Missouri Defensive Rebound.,3,0,3,0,0.5691013846518673,0.5691013846518673,Missouri,UMKC,4,4,NA,253330142,2005-11-29
12,1,18:18,2298,2298,Kevin Young missed Free Throw.,3,0,3,0,0.5691013846518673,0.5691013846518673,Missouri,UMKC,4,4,NA,253330142,2005-11-29
13,1,18:18,2298,2298,Brian Gettinger Defensive Rebound.,3,0,3,9,0.5691013846518673,0.5691013846518673,Missouri,UMKC,4,4,NA,253330142,2005-11-29
14,1,18:09,2289,2289,Foul on Jason Horton,3,0,3,10,0.5693988998708198,0.5693988998708198,Missouri,UMKC,4,4,NA,253330142,2005-11-29
15,1,17:59,2279,2279,Foul on Tim Blackwell,3,0,3,34,0.5697307986336886,0.5697307986336886,Missouri,UMKC,4,4,NA,253330142,2005-11-29
16,1,17:25,2245,2245,Foul on Tim Blackwell,3,0,3,22,0.5708686584745194,0.5708686584745194,Missouri,UMKC,4,4,NA,253330142,2005-11-29
17,1,17:03,2223,2223,Thomas Gardner missed Three Point Jumper.,3,0,3,0,0.5716116011849327,0.5716116011849327,Missouri,UMKC,4,4,NA,253330142,2005-11-29
18,1,17:03,2223,2223,Dee Ayuba Defensive Rebound.,3,0,3,55,0.5716116011849327,0.5716116011849327,Missouri,UMKC,4,4,NA,253330142,2005-11-29
19,1,16:08,2168,2168,Jason Horton missed Two Point Jumper.,3,0,3,0,0.5734857944927388,0.5734857944927388,Missouri,UMKC,4,4,NA,253330142,2005-11-29
20,1,16:08,2168,2168,Blake Crawford Defensive Rebound.,3,0,3,15,0.5734857944927388,0.5734857944927388,Missouri,UMKC,4,4,NA,253330142,2005-11-29
21,1,15:53,2153,2153,Brian Gettinger missed Three Point Jumper.,3,0,3,0,0.574000754757323,0.574000754757323,Missouri,UMKC,4,4,NA,253330142,2005-11-29
22,1,15:53,2153,2153,Kevin Young Defensive Rebound.,3,0,3,61,0.574000754757323,0.574000754757323,Missouri,UMKC,4,4,NA,253330142,2005-11-29
23,1,14:52,2092,2092,Brian Gettinger made Three Point Jumper.,3,3,0,20,0.5,0.5,Missouri,UMKC,4,4,NA,253330142,2005-11-29
24,1,14:32,2072,2072,Jimmy McKinney missed Three Point Jumper.,3,3,0,0,0.5,0.5,Missouri,UMKC,4,4,NA,253330142,2005-11-29
25,1,14:32,2072,2072,Tim Blackwell Defensive Rebound.,3,3,0,5,0.5,0.5,Missouri,UMKC,4,4,NA,253330142,2005-11-29
26,1,14:27,2067,2067,Quinton Day missed Two Point Jumper.,3,3,0,8,0.5,0.5,Missouri,UMKC,4,4,NA,253330142,2005-11-29
27,1,14:19,2059,2059,Missouri Defensive Rebound.,3,3,0,0,0.5,0.5,Missouri,UMKC,4,4,NA,253330142,2005-11-29
28,1,14:19,2059,2059,Foul on Jimmy McKinney,3,3,0,5,0.5,0.5,Missouri,UMKC,4,4,NA,253330142,2005-11-29
29,1,14:14,2054,2054,Foul on Kalen Grimes,3,3,0,11,0.5,0.5,Missouri,UMKC,4,4,NA,253330142,2005-11-29
30,1,14:03,2043,2043,Kyle Spears made Two Point Layup.,3,5,-2,22,0.44785487364287885,0.44785487364287885,Missouri,UMKC,4,4,NA,253330142,2005-11-29
31,1,13:41,2021,2021,Foul on Dane Brumagin,3,5,-2,25,0.4473177833885138,0.4473177833885138,Missouri,UMKC,4,4,NA,253330142,2005-11-29
32,1,13:16,1996,1996,Dee Ayuba missed Three Point Jumper.,3,5,-2,0,0.4467002625316585,0.4467002625316585,Missouri,UMKC,4,4,NA,253330142,2005-11-29
33,1,13:16,1996,1996,James Douglas Defensive Rebound.,3,5,-2,42,0.4467002625316585,0.4467002625316585,Missouri,UMKC,4,4,NA,253330142,2005-11-29
34,1,12:34,1954,1954,Thomas Gardner made Two Point Jumper.,5,5,0,1,0.5,0.5,Missouri,UMKC,4,4,NA,253330142,2005-11-29
35,1,12:33,1953,1953,Dane Brumagin missed Two Point Jumper.,5,5,0,0,0.5,0.5,Missouri,UMKC,4,4,NA,253330142,2005-11-29
36,1,12:33,1953,1953,Thomas Gardner Defensive Rebound.,5,5,0,16,0.5,0.5,Missouri,UMKC,4,4,NA,253330142,2005-11-29
37,1,12:17,1937,1937,Blake Crawford made Two Point Jumper.,5,7,-2,15,0.44520966251330507,0.44520966251330507,Missouri,UMKC,4,4,NA,253330142,2005-11-29
38,1,12:02,1922,1922,Jimmy McKinney missed Three Point Jumper.,5,7,-2,0,0.44482329195717357,0.44482329195717357,Missouri,UMKC,4,4,NA,253330142,2005-11-29
39,1,12:02,1922,1922,Missouri Defensive Rebound.,5,7,-2,35,0.44482329195717357,0.44482329195717357,Missouri,UMKC,4,4,NA,253330142,2005-11-29
40,1,11:27,1887,1887,Foul on Brent Stephens,5,7,-2,0,0.44392337373482016,0.44392337373482016,Missouri,UMKC,4,4,NA,253330142,2005-11-29
41,1,11:27,1887,1887,Thomas Gardner made Free Throw.,6,7,-1,0,0.4718729590160034,0.4718729590160034,Missouri,UMKC,4,4,NA,253330142,2005-11-29
42,1,11:27,1887,1887,Thomas Gardner made Free Throw.,7,7,0,0,0.5,0.5,Missouri,UMKC,4,4,NA,253330142,2005-11-29
43,1,11:27,1887,1887,Thomas Gardner made Free Throw.,8,7,1,8,0.5281270409839967,0.5281270409839967,Missouri,UMKC,4,4,NA,253330142,2005-11-29
44,1,11:19,1879,1879,Dee Ayuba missed Two Point Jumper.,8,7,1,0,0.5282308520218978,0.5282308520218978,Missouri,UMKC,4,4,NA,253330142,2005-11-29
45,1,11:19,1879,1879,Quinton Day Offensive Rebound.,8,7,1,15,0.5282308520218978,0.5282308520218978,Missouri,UMKC,4,4,NA,253330142,2005-11-29
46,1,11:04,1864,1864,Foul on James Douglas,8,7,1,14,0.5284257551957583,0.5284257551957583,Missouri,UMKC,4,4,NA,253330142,2005-11-29
47,1,10:50,1850,1850,Blake Crawford missed Two Point Jumper.,8,7,1,0,0.5286081621878321,0.5286081621878321,Missouri,UMKC,4,4,NA,253330142,2005-11-29
48,1,10:50,1850,1850,Jimmy McKinney Defensive Rebound.,8,7,1,8,0.5286081621878321,0.5286081621878321,Missouri,UMKC,4,4,NA,253330142,2005-11-29
49,1,10:42,1842,1842,Foul on Kevin Young,8,7,1,14,0.5287126946035764,0.5287126946035764,Missouri,UMKC,4,4,NA,253330142,2005-11-29
50,1,10:28,1828,1828,Brent Stephens missed Three Point Jumper.,8,7,1,0,0.5288962944849083,0.5288962944849083,Missouri,UMKC,4,4,NA,253330142,2005-11-29
51,1,10:28,1828,1828,Kevin Young Defensive Rebound.,8,7,1,21,0.5288962944849083,0.5288962944849083,Missouri,UMKC,4,4,NA,253330142,2005-11-29
52,1,10:07,1807,1807,Jason Horton missed Three Point Jumper.,8,7,1,0,0.529173697486894,0.529173697486894,Missouri,UMKC,4,4,NA,253330142,2005-11-29
53,1,10:07,1807,1807,Quinton Day Defensive Rebound.,8,7,1,9,0.529173697486894,0.529173697486894,Missouri,UMKC,4,4,NA,253330142,2005-11-29
54,1,9:58,1798,1798,Dee Ayuba missed Two Point Jumper.,8,7,1,0,0.5292934739580989,0.5292934739580989,Missouri,UMKC,4,4,NA,253330142,2005-11-29
55,1,9:58,1798,1798,Jason Horton Defensive Rebound.,8,7,1,6,0.5292934739580989,0.5292934739580989,Missouri,UMKC,4,4,NA,253330142,2005-11-29
56,1,9:52,1792,1792,Foul on Dee Ayuba,8,7,1,0,0.529373663315156,0.529373663315156,Missouri,UMKC,4,4,NA,253330142,2005-11-29
57,1,9:52,1792,1792,Thomas Gardner missed Free Throw.,8,7,1,0,0.529373663315156,0.529373663315156,Missouri,UMKC,4,4,NA,253330142,2005-11-29
58,1,9:52,1792,1792,Missouri Defensive Rebound.,8,7,1,0,0.529373663315156,0.529373663315156,Missouri,UMKC,4,4,NA,253330142,2005-11-29
59,1,9:52,1792,1792,Thomas Gardner missed Free Throw.,8,7,1,0,0.529373663315156,0.529373663315156,Missouri,UMKC,4,4,NA,253330142,2005-11-29
60,1,9:52,1792,1792,Brian Gettinger Defensive Rebound.,8,7,1,35,0.529373663315156,0.529373663315156,Missouri,UMKC,4,4,NA,253330142,2005-11-29
61,1,9:17,1757,1757,Foul on Blake Crawford,8,7,1,0,0.5298477571267254,0.5298477571267254,Missouri,UMKC,4,4,NA,253330142,2005-11-29
62,1,9:17,1757,1757,Marshall Brown missed Free Throw.,8,7,1,0,0.5298477571267254,0.5298477571267254,Missouri,UMKC,4,4,NA,253330142,2005-11-29
63,1,9:17,1757,1757,Missouri Defensive Rebound.,8,7,1,0,0.5298477571267254,0.5298477571267254,Missouri,UMKC,4,4,NA,253330142,2005-11-29
64,1,9:17,1757,1757,Marshall Brown made Free Throw.,9,7,2,8,0.5594835414164011,0.5594835414164011,Missouri,UMKC,4,4,NA,253330142,2005-11-29
65,1,9:09,1749,1749,Blake Crawford missed Two Point Jumper.,9,7,2,0,0.5597013882278581,0.5597013882278581,Missouri,UMKC,4,4,NA,253330142,2005-11-29
66,1,9:09,1749,1749,UMKC Defensive Rebound.,9,7,2,7,0.5597013882278581,0.5597013882278581,Missouri,UMKC,4,4,NA,253330142,2005-11-29
67,1,9:02,1742,1742,Quinton Day missed Three Point Jumper.,9,7,2,0,0.5598931710684891,0.5598931710684891,Missouri,UMKC,4,4,NA,253330142,2005-11-29
68,1,9:02,1742,1742,Thomas Gardner Defensive Rebound.,9,7,2,8,0.5598931710684891,0.5598931710684891,Missouri,UMKC,4,4,NA,253330142,2005-11-29
69,1,8:54,1734,1734,Matt Lawrence missed Two Point Layup.,9,7,2,0,0.5601137551935602,0.5601137551935602,Missouri,UMKC,4,4,NA,253330142,2005-11-29
70,1,8:54,1734,1734,Blake Crawford Defensive Rebound.,9,7,2,34,0.5601137551935602,0.5601137551935602,Missouri,UMKC,4,4,NA,253330142,2005-11-29
71,1,8:20,1700,1700,Dee Ayuba made Two Point Jumper.,9,9,0,24,0.5,0.5,Missouri,UMKC,4,4,NA,253330142,2005-11-29
72,1,7:56,1676,1676,Foul on Blake Crawford,9,9,0,5,0.5,0.5,Missouri,UMKC,4,4,NA,253330142,2005-11-29
73,1,7:51,1671,1671,Leo Lyons missed Free Throw.,9,9,0,0,0.5,0.5,Missouri,UMKC,4,4,NA,253330142,2005-11-29
74,1,7:51,1671,1671,Missouri Defensive Rebound.,9,9,0,0,0.5,0.5,Missouri,UMKC,4,4,NA,253330142,2005-11-29
75,1,7:51,1671,1671,Leo Lyons missed Free Throw.,9,9,0,0,0.5,0.5,Missouri,UMKC,4,4,NA,253330142,2005-11-29
76,1,7:51,1671,1671,Dee Ayuba Defensive Rebound.,9,9,0,8,0.5,0.5,Missouri,UMKC,4,4,NA,253330142,2005-11-29
77,1,7:43,1663,1663,Tim Blackwell missed Three Point Jumper.,9,9,0,4,0.5,0.5,Missouri,UMKC,4,4,NA,253330142,2005-11-29
78,1,7:39,1659,1659,Foul on Dee Ayuba,9,9,0,0,0.5,0.5,Missouri,UMKC,4,4,NA,253330142,2005-11-29
79,1,7:39,1659,1659,Leo Lyons made Free Throw.,10,9,1,0,0.5312378656894079,0.5312378656894079,Missouri,UMKC,4,4,NA,253330142,2005-11-29
80,1,7:39,1659,1659,Leo Lyons missed Free Throw.,10,9,1,0,0.5312378656894079,0.5312378656894079,Missouri,UMKC,4,4,NA,253330142,2005-11-29
81,1,7:39,1659,1659,Kyle Spears Defensive Rebound.,10,9,1,15,0.5312378656894079,0.5312378656894079,Missouri,UMKC,4,4,NA,253330142,2005-11-29
82,1,7:24,1644,1644,Kyle Spears missed Two Point Jumper.,10,9,1,0,0.5314463599555308,0.5314463599555308,Missouri,UMKC,4,4,NA,253330142,2005-11-29
83,1,7:24,1644,1644,Jason Horton Defensive Rebound.,10,9,1,12,0.5314463599555308,0.5314463599555308,Missouri,UMKC,4,4,NA,253330142,2005-11-29
84,1,7:12,1632,1632,Jason Horton made Three Point Jumper.,13,9,4,19,0.6239753227179412,0.6239753227179412,Missouri,UMKC,4,4,NA,253330142,2005-11-29
85,1,6:53,1613,1613,Tim Blackwell missed Two Point Jumper.,13,9,4,0,0.6249509392264259,0.6249509392264259,Missouri,UMKC,4,4,NA,253330142,2005-11-29
86,1,6:53,1613,1613,Dane Brumagin Offensive Rebound.,13,9,4,5,0.6249509392264259,0.6249509392264259,Missouri,UMKC,4,4,NA,253330142,2005-11-29
87,1,6:48,1608,1608,Leo Lyons Defensive Rebound.,13,9,4,30,0.6252066094313566,0.6252066094313566,Missouri,UMKC,4,4,NA,253330142,2005-11-29
88,1,6:18,1578,1578,Brian Gettinger missed Three Point Jumper.,13,9,4,0,0.6267410257304066,0.6267410257304066,Missouri,UMKC,4,4,NA,253330142,2005-11-29
89,1,6:18,1578,1578,Kyle Spears Offensive Rebound.,13,9,4,0,0.6267410257304066,0.6267410257304066,Missouri,UMKC,4,4,NA,253330142,2005-11-29
90,1,6:18,1578,1578,Kyle Spears missed Two Point Tip Shot.,13,9,4,0,0.6267410257304066,0.6267410257304066,Missouri,UMKC,4,4,NA,253330142,2005-11-29
91,1,6:18,1578,1578,Marcus Watkins Defensive Rebound.,13,9,4,20,0.6267410257304066,0.6267410257304066,Missouri,UMKC,4,4,NA,253330142,2005-11-29
92,1,5:58,1558,1558,Foul on Brian Gettinger,13,9,4,0,0.6277737808975987,0.6277737808975987,Missouri,UMKC,4,4,NA,253330142,2005-11-29
93,1,5:58,1558,1558,Marshall Brown made Free Throw.,14,9,5,0,0.6577644438355619,0.6577644438355619,Missouri,UMKC,4,4,NA,253330142,2005-11-29
94,1,5:58,1558,1558,Marshall Brown missed Free Throw.,14,9,5,0,0.6577644438355619,0.6577644438355619,Missouri,UMKC,4,4,NA,253330142,2005-11-29
95,1,5:58,1558,1558,Dee Ayuba Defensive Rebound.,14,9,5,5,0.6577644438355619,0.6577644438355619,Missouri,UMKC,4,4,NA,253330142,2005-11-29
96,1,5:53,1553,1553,Dee Ayuba made Two Point Layup.,14,11,3,61,0.5969674068455617,0.5969674068455617,Missouri,UMKC,4,4,NA,253330142,2005-11-29
97,1,4:52,1492,1492,Thomas Gardner missed Three Point Jumper.,14,11,3,0,0.5995303399013193,0.5995303399013193,Missouri,UMKC,4,4,NA,253330142,2005-11-29
98,1,4:52,1492,1492,Marshall Brown Offensive Rebound.,14,11,3,5,0.5995303399013193,0.5995303399013193,Missouri,UMKC,4,4,NA,253330142,2005-11-29
99,1,4:47,1487,1487,Marshall Brown missed Two Point Layup.,14,11,3,0,0.5997522913938103,0.5997522913938103,Missouri,UMKC,4,4,NA,253330142,2005-11-29
100,1,4:47,1487,1487,Marshall Brown Offensive Rebound.,14,11,3,0,0.5997522913938103,0.5997522913938103,Missouri,UMKC,4,4,NA,253330142,2005-11-29
101,1,4:47,1487,1487,Marshall Brown made Two Point Tip Shot.,16,11,5,16,0.6624105815883153,0.6624105815883153,Missouri,UMKC,4,4,NA,253330142,2005-11-29
102,1,4:31,1471,1471,Dane Brumagin missed Three Point Jumper.,16,11,5,0,0.663537105596615,0.663537105596615,Missouri,UMKC,4,4,NA,253330142,2005-11-29
103,1,4:31,1471,1471,Missouri Defensive Rebound.,16,11,5,16,0.663537105596615,0.663537105596615,Missouri,UMKC,4,4,NA,253330142,2005-11-29
104,1,4:15,1455,1455,Jimmy McKinney missed Two Point Jumper.,16,11,5,0,0.6647033384862623,0.6647033384862623,Missouri,UMKC,4,4,NA,253330142,2005-11-29
105,1,4:15,1455,1455,UMKC Defensive Rebound.,16,11,5,3,0.6647033384862623,0.6647033384862623,Missouri,UMKC,4,4,NA,253330142,2005-11-29
106,1,4:12,1452,1452,Foul on Thomas Gardner,16,11,5,4,0.6649268182617423,0.6649268182617423,Missouri,UMKC,4,4,NA,253330142,2005-11-29
107,1,4:08,1448,1448,Brent Stephens missed Free Throw.,16,11,5,0,0.665226553848288,0.665226553848288,Missouri,UMKC,4,4,NA,253330142,2005-11-29
108,1,4:08,1448,1448,Jason Horton Defensive Rebound.,16,11,5,6,0.665226553848288,0.665226553848288,Missouri,UMKC,4,4,NA,253330142,2005-11-29
109,1,4:02,1442,1442,Foul on Kyle Spears,16,11,5,3,0.6656719082430862,0.6656719082430862,Missouri,UMKC,4,4,NA,253330142,2005-11-29
110,1,3:59,1439,1439,Jimmy McKinney made Free Throw.,17,11,6,0,0.6958467000548512,0.6958467000548512,Missouri,UMKC,4,4,NA,253330142,2005-11-29
111,1,3:59,1439,1439,Jimmy McKinney made Free Throw.,18,11,7,15,0.7242277255229256,0.7242277255229256,Missouri,UMKC,4,4,NA,253330142,2005-11-29
112,1,3:44,1424,1424,Foul on Jimmy McKinney,18,11,7,0,0.7255862245121494,0.7255862245121494,Missouri,UMKC,4,4,NA,253330142,2005-11-29
113,1,3:44,1424,1424,Quinton Day made Free Throw.,18,12,6,0,0.6970811112493553,0.6970811112493553,Missouri,UMKC,4,4,NA,253330142,2005-11-29
114,1,3:44,1424,1424,Quinton Day made Free Throw.,18,13,5,43,0.6669740186204388,0.6669740186204388,Missouri,UMKC,4,4,NA,253330142,2005-11-29
115,1,3:01,1381,1381,Tim Blackwell missed Two Point Jumper.,18,13,5,0,0.6699435137704726,0.6699435137704726,Missouri,UMKC,4,4,NA,253330142,2005-11-29
116,1,3:01,1381,1381,Jason Horton Defensive Rebound.,18,13,5,19,0.6699435137704726,0.6699435137704726,Missouri,UMKC,4,4,NA,253330142,2005-11-29
117,1,2:42,1362,1362,Thomas Gardner made Three Point Jumper.,21,13,8,34,0.7580434186454148,0.7580434186454148,Missouri,UMKC,4,4,NA,253330142,2005-11-29
118,1,2:08,1328,1328,Marshall Brown missed Three Point Jumper.,21,13,8,0,0.7611141520891153,0.7611141520891153,Missouri,UMKC,4,4,NA,253330142,2005-11-29
119,1,2:08,1328,1328,Thomas Gardner Offensive Rebound.,21,13,8,10,0.7611141520891153,0.7611141520891153,Missouri,UMKC,4,4,NA,253330142,2005-11-29
120,1,1:58,1318,1318,Thomas Gardner missed Two Point Jumper.,21,13,8,0,0.7620334495770422,0.7620334495770422,Missouri,UMKC,4,4,NA,253330142,2005-11-29
121,1,1:58,1318,1318,Thomas Gardner Offensive Rebound.,21,13,8,11,0.7620334495770422,0.7620334495770422,Missouri,UMKC,4,4,NA,253330142,2005-11-29
122,1,1:47,1307,1307,Kevin Young missed Two Point Layup.,21,13,8,0,0.7630590114740744,0.7630590114740744,Missouri,UMKC,4,4,NA,253330142,2005-11-29
123,1,1:47,1307,1307,Brent Stephens Offensive Rebound.,21,13,8,0,0.7630590114740744,0.7630590114740744,Missouri,UMKC,4,4,NA,253330142,2005-11-29
124,1,1:47,1307,1307,Brent Stephens missed Two Point Layup.,21,13,8,4,0.7630590114740744,0.7630590114740744,Missouri,UMKC,4,4,NA,253330142,2005-11-29
125,1,1:43,1303,1303,Foul on Kevin Young,21,13,8,10,0.7634363465309542,0.7634363465309542,Missouri,UMKC,4,4,NA,253330142,2005-11-29
126,1,1:33,1293,1293,Dee Ayuba made Free Throw.,21,14,7,0,0.7368761760851413,0.7368761760851413,Missouri,UMKC,4,4,NA,253330142,2005-11-29
127,1,1:33,1293,1293,Dee Ayuba made Free Throw.,21,15,6,12,0.7073775941799324,0.7073775941799324,Missouri,UMKC,4,4,NA,253330142,2005-11-29
128,1,1:21,1281,1281,Thomas Gardner made Three Point Jumper.,24,15,9,15,0.7910644268981721,0.7910644268981721,Missouri,UMKC,4,4,NA,253330142,2005-11-29
129,1,1:06,1266,1266,Quinton Day missed Three Point Jumper.,24,15,9,0,0.7926279756357272,0.7926279756357272,Missouri,UMKC,4,4,NA,253330142,2005-11-29
130,1,1:06,1266,1266,Kevin Young Defensive Rebound.,24,15,9,12,0.7926279756357272,0.7926279756357272,Missouri,UMKC,4,4,NA,253330142,2005-11-29
131,1,0:54,1254,1254,Marcus Watkins missed Three Point Jumper.,24,15,9,0,0.7939208547761201,0.7939208547761201,Missouri,UMKC,4,4,NA,253330142,2005-11-29
132,1,0:54,1254,1254,Dee Ayuba Defensive Rebound.,24,15,9,18,0.7939208547761201,0.7939208547761201,Missouri,UMKC,4,4,NA,253330142,2005-11-29
133,1,0:36,1236,1236,Dee Ayuba missed Two Point Jumper.,24,15,9,0,0.7959404923893517,0.7959404923893517,Missouri,UMKC,4,4,NA,253330142,2005-11-29
134,1,0:36,1236,1236,Thomas Gardner Defensive Rebound.,24,15,9,25,0.7959404923893517,0.7959404923893517,Missouri,UMKC,4,4,NA,253330142,2005-11-29
135,1,0:11,1211,1211,Thomas Gardner missed Three Point Jumper.,24,15,9,0,0.7989293652779765,0.7989293652779765,Missouri,UMKC,4,4,NA,253330142,2005-11-29
136,1,0:11,1211,1211,Kyle Spears Defensive Rebound.,24,15,9,11,0.7989293652779765,0.7989293652779765,Missouri,UMKC,4,4,NA,253330142,2005-11-29
137,1,0:00,1200,1200,End of the 1st Half.,24,15,9,0,0.8002839754918194,0.8002839754918194,Missouri,UMKC,4,4,NA,253330142,2005-11-29
138,2,20:00,1200,1200,PLAY,24,15,9,33,0.8002839754918194,0.8002839754918194,Missouri,UMKC,4,4,NA,253330142,2005-11-29
139,2,19:27,1167,1167,Brian Gettinger missed Three Point Jumper.,24,15,9,0,0.804155581854185,0.804155581854185,Missouri,UMKC,4,4,NA,253330142,2005-11-29
140,2,19:27,1167,1167,Dee Ayuba Offensive Rebound.,24,15,9,5,0.804155581854185,0.804155581854185,Missouri,UMKC,4,4,NA,253330142,2005-11-29
141,2,19:22,1162,1162,Dee Ayuba made Two Point Jumper.,24,17,7,29,0.7505216684219997,0.7505216684219997,Missouri,UMKC,4,4,NA,253330142,2005-11-29
142,2,18:53,1133,1133,Quinton Day missed Three Point Jumper.,24,17,7,0,0.7535304417115476,0.7535304417115476,Missouri,UMKC,4,4,NA,253330142,2005-11-29
143,2,18:53,1133,1133,Jason Horton Defensive Rebound.,24,17,7,26,0.7535304417115476,0.7535304417115476,Missouri,UMKC,4,4,NA,253330142,2005-11-29
144,2,18:27,1107,1107,Thomas Gardner missed Two Point Jumper.,24,17,7,0,0.7562185098587828,0.7562185098587828,Missouri,UMKC,4,4,NA,253330142,2005-11-29
145,2,18:27,1107,1107,Dee Ayuba Defensive Rebound.,24,17,7,19,0.7562185098587828,0.7562185098587828,Missouri,UMKC,4,4,NA,253330142,2005-11-29
146,2,18:08,1088,1088,Brian Gettinger missed Three Point Jumper.,24,17,7,0,0.7582140005351233,0.7582140005351233,Missouri,UMKC,4,4,NA,253330142,2005-11-29
147,2,18:08,1088,1088,Thomas Gardner Defensive Rebound.,24,17,7,9,0.7582140005351233,0.7582140005351233,Missouri,UMKC,4,4,NA,253330142,2005-11-29
148,2,17:59,1079,1079,Thomas Gardner missed Two Point Layup.,24,17,7,0,0.7591761256583887,0.7591761256583887,Missouri,UMKC,4,4,NA,253330142,2005-11-29
149,2,17:59,1079,1079,Tim Blackwell Defensive Rebound.,24,17,7,20,0.7591761256583887,0.7591761256583887,Missouri,UMKC,4,4,NA,253330142,2005-11-29
150,2,17:39,1059,1059,Foul on Kevin Young,24,17,7,0,0.7613684700743552,0.7613684700743552,Missouri,UMKC,4,4,NA,253330142,2005-11-29
151,2,17:39,1059,1059,Dee Ayuba missed Free Throw.,24,17,7,0,0.7613684700743552,0.7613684700743552,Missouri,UMKC,4,4,NA,253330142,2005-11-29
152,2,17:39,1059,1059,UMKC Defensive Rebound.,24,17,7,0,0.7613684700743552,0.7613684700743552,Missouri,UMKC,4,4,NA,253330142,2005-11-29
153,2,17:39,1059,1059,Dee Ayuba made Free Throw.,24,18,6,11,0.7299668490580603,0.7299668490580603,Missouri,UMKC,4,4,NA,253330142,2005-11-29
154,2,17:28,1048,1048,Foul on Dee Ayuba,24,18,6,10,0.7311252153222176,0.7311252153222176,Missouri,UMKC,4,4,NA,253330142,2005-11-29
155,2,17:18,1038,1038,Kevin Young made Two Point Layup.,26,18,8,18,0.792674887379898,0.792674887379898,Missouri,UMKC,4,4,NA,253330142,2005-11-29
156,2,17:00,1020,1020,Tim Blackwell missed Two Point Layup.,26,18,8,0,0.7949303401689005,0.7949303401689005,Missouri,UMKC,4,4,NA,253330142,2005-11-29
157,2,17:00,1020,1020,Jason Horton Defensive Rebound.,26,18,8,5,0.7949303401689005,0.7949303401689005,Missouri,UMKC,4,4,NA,253330142,2005-11-29
158,2,16:55,1015,1015,Jason Horton missed Two Point Layup.,26,18,8,0,0.7955769495355225,0.7955769495355225,Missouri,UMKC,4,4,NA,253330142,2005-11-29
159,2,16:55,1015,1015,Kevin Young Offensive Rebound.,26,18,8,0,0.7955769495355225,0.7955769495355225,Missouri,UMKC,4,4,NA,253330142,2005-11-29
160,2,16:55,1015,1015,Kevin Young missed Two Point Tip Shot.,26,18,8,0,0.7955769495355225,0.7955769495355225,Missouri,UMKC,4,4,NA,253330142,2005-11-29
161,2,16:55,1015,1015,Kevin Young Offensive Rebound.,26,18,8,0,0.7955769495355225,0.7955769495355225,Missouri,UMKC,4,4,NA,253330142,2005-11-29
162,2,16:55,1015,1015,Foul on Tim Blackwell,26,18,8,0,0.7955769495355225,0.7955769495355225,Missouri,UMKC,4,4,NA,253330142,2005-11-29
163,2,16:55,1015,1015,Kevin Young made Free Throw.,27,18,9,0,0.8218212193315161,0.8218212193315161,Missouri,UMKC,4,4,NA,253330142,2005-11-29
164,2,16:55,1015,1015,Kevin Young made Free Throw.,28,18,10,18,0.84535113670462,0.84535113670462,Missouri,UMKC,4,4,NA,253330142,2005-11-29
165,2,16:37,997,997,Quinton Day missed Two Point Layup.,28,18,10,0,0.8477663055188225,0.8477663055188225,Missouri,UMKC,4,4,NA,253330142,2005-11-29
166,2,16:37,997,997,UMKC Defensive Rebound.,28,18,10,17,0.8477663055188225,0.8477663055188225,Missouri,UMKC,4,4,NA,253330142,2005-11-29
167,2,16:20,980,980,Foul on Quinton Day,28,18,10,17,0.8501650136590096,0.8501650136590096,Missouri,UMKC,4,4,NA,253330142,2005-11-29
168,2,16:03,963,963,Matt Lawrence made Three Point Jumper.,31,18,13,14,0.9073957985574262,0.9073957985574262,Missouri,UMKC,4,4,NA,253330142,2005-11-29
169,2,15:49,949,949,Foul on Dane Brumagin,31,18,13,13,0.9090500271118445,0.9090500271118445,Missouri,UMKC,4,4,NA,253330142,2005-11-29
170,2,15:36,936,936,Kevin Young missed Two Point Layup.,31,18,13,0,0.9104620697527763,0.9104620697527763,Missouri,UMKC,4,4,NA,253330142,2005-11-29
171,2,15:36,936,936,Leo Lyons Offensive Rebound.,31,18,13,11,0.9104620697527763,0.9104620697527763,Missouri,UMKC,4,4,NA,253330142,2005-11-29
172,2,15:25,925,925,Leo Lyons made Two Point Tip Shot.,33,18,15,9,0.9365547505637866,0.9365547505637866,Missouri,UMKC,4,4,NA,253330142,2005-11-29
173,2,15:16,916,916,Dee Ayuba missed Two Point Layup.,33,18,15,0,0.9372970097969383,0.9372970097969383,Missouri,UMKC,4,4,NA,253330142,2005-11-29
174,2,15:16,916,916,Leo Lyons Defensive Rebound.,33,18,15,4,0.9372970097969383,0.9372970097969383,Missouri,UMKC,4,4,NA,253330142,2005-11-29
175,2,15:12,912,912,Foul on Brian Gettinger,33,18,15,7,0.9376178080820396,0.9376178080820396,Missouri,UMKC,4,4,NA,253330142,2005-11-29
176,2,15:05,905,905,Foul,33,18,15,0,0.9381677883672969,0.9381677883672969,Missouri,UMKC,4,4,NA,253330142,2005-11-29
177,2,15:05,905,905,Jason Horton missed Free Throw.,33,18,15,0,0.9381677883672969,0.9381677883672969,Missouri,UMKC,4,4,NA,253330142,2005-11-29
178,2,15:05,905,905,Missouri Defensive Rebound.,33,18,15,0,0.9381677883672969,0.9381677883672969,Missouri,UMKC,4,4,NA,253330142,2005-11-29
179,2,15:05,905,905,Jason Horton missed Free Throw.,33,18,15,0,0.9381677883672969,0.9381677883672969,Missouri,UMKC,4,4,NA,253330142,2005-11-29
180,2,15:05,905,905,Missouri Defensive Rebound.,33,18,15,22,0.9381677883672969,0.9381677883672969,Missouri,UMKC,4,4,NA,253330142,2005-11-29
181,2,14:43,883,883,Marcus Watkins missed Two Point Jumper.,33,18,15,0,0.9398284043338528,0.9398284043338528,Missouri,UMKC,4,4,NA,253330142,2005-11-29
182,2,14:43,883,883,Quinton Day Defensive Rebound.,33,18,15,7,0.9398284043338528,0.9398284043338528,Missouri,UMKC,4,4,NA,253330142,2005-11-29
183,2,14:36,876,876,Foul on Matt Lawrence,33,18,15,3,0.9403440368880337,0.9403440368880337,Missouri,UMKC,4,4,NA,253330142,2005-11-29
184,2,14:33,873,873,Leo Lyons missed Three Point Jumper.,33,18,15,0,0.9405642518271025,0.9405642518271025,Missouri,UMKC,4,4,NA,253330142,2005-11-29
185,2,14:33,873,873,Tim Blackwell Defensive Rebound.,33,18,15,38,0.9405642518271025,0.9405642518271025,Missouri,UMKC,4,4,NA,253330142,2005-11-29
186,2,13:55,835,835,Kyle Spears missed Two Point Layup.,33,18,15,0,0.9433935165693376,0.9433935165693376,Missouri,UMKC,4,4,NA,253330142,2005-11-29
