play_id,half,time_remaining_half,secs_remaining,secs_remaining_absolute,description,home_score,away_score,score_diff,play_length,win_prob,naive_win_prob,home,away,home_time_out_remaining,away_time_out_remaining,home_favored_by,game_id,date
1,1,20:00,2400,2400,PLAY,0,0,0,15,0.5,0.5,Arizona,California,6,6,NA,290650012,2009-03-05
2,1,19:45,2385,2385,Chase Budinger missed Two Point Jumper.,0,0,0,0,0.5,0.5,Arizona,California,6,6,NA,290650012,2009-03-05
3,1,19:45,2385,2385,Jamelle Horne Offensive Rebound.,0,0,0,11,0.5,0.5,Arizona,California,6,6,NA,290650012,2009-03-05
4,1,19:34,2374,2374,Jordan Hill made Two Point Layup.,2,0,2,15,0.5445753877960263,0.5445753877960263,Arizona,California,6,6,NA,290650012,2009-03-05
5,1,19:19,2359,2359,Jerome Randle made Three Point Jumper.  Assisted by Theo Robertson.,2,3,-1,37,0.47750627341474455,0.47750627341474455,Arizona,California,6,6,NA,290650012,2009-03-05
6,1,18:42,2322,2322,Jordan Hill missed Two Point Jumper.,2,3,-1,0,0.4771013997479743,0.4771013997479743,Arizona,California,6,6,NA,290650012,2009-03-05
7,1,18:42,2322,2322,Jordan Hill Offensive Rebound.,2,3,-1,11,0.4771013997479743,0.4771013997479743,Arizona,California,6,6,NA,290650012,2009-03-05
8,1,18:31,2311,2311,Kyle Fogg missed Two Point Layup.,2,3,-1,0,0.4769794403329548,0.4769794403329548,Arizona,California,6,6,NA,290650012,2009-03-05
9,1,18:31,2311,2311,Patrick Christopher Defensive Rebound.,2,3,-1,20,0.4769794403329548,0.4769794403329548,Arizona,California,6,6,NA,290650012,2009-03-05
10,1,18:11,2291,2291,Jerome Randle missed Three Point Jumper.,2,3,-1,0,0.47675601221531133,0.47675601221531133,Arizona,California,6,6,NA,290650012,2009-03-05
11,1,18:11,2291,2291,Jordan Wilkes Offensive Rebound.,2,3,-1,27,0.47675601221531133,0.47675601221531133,Arizona,California,6,6,NA,290650012,2009-03-05
12,1,17:44,2264,2264,Nic Wise made Three Point Jumper.,5,3,2,33,0.5469932384002621,0.5469932384002621,Arizona,California,6,6,NA,290650012,2009-03-05
13,1,17:11,2231,2231,Patrick Christopher missed Two Point Jumper.,5,3,2,0,0.5477414654678265,0.5477414654678265,Arizona,California,6,6,NA,290650012,2009-03-05
14,1,17:11,2231,2231,Jamal Boykin Offensive Rebound.,5,3,2,4,0.5477414654678265,0.5477414654678265,Arizona,California,6,6,NA,290650012,2009-03-05
15,1,17:07,2227,2227,Jamal Boykin made Two Point Layup.,5,5,0,19,0.5,0.5,Arizona,California,6,6,NA,290650012,2009-03-05
16,1,16:48,2208,2208,Jamelle Horne missed Three Point Jumper.,5,5,0,0,0.5,0.5,Arizona,California,6,6,NA,290650012,2009-03-05
17,1,16:48,2208,2208,Patrick Christopher Defensive Rebound.,5,5,0,8,0.5,0.5,Arizona,California,6,6,NA,290650012,2009-03-05
18,1,16:40,2200,2200,Jerome Randle made Two Point Jumper.,5,7,-2,23,0.4515490631345577,0.4515490631345577,Arizona,California,6,6,NA,290650012,2009-03-05
19,1,16:17,2177,2177,Chase Budinger missed Two Point Jumper.,5,7,-2,0,0.45101950016707304,0.45101950016707304,Arizona,California,6,6,NA,290650012,2009-03-05
20,1,16:17,2177,2177,Jamal Boykin Defensive Rebound.,5,7,-2,4,0.45101950016707304,0.45101950016707304,Arizona,California,6,6,NA,290650012,2009-03-05
21,1,16:13,2173,2173,Theo Robertson missed Three Point Jumper.,5,7,-2,0,0.4509271804153904,0.4509271804153904,Arizona,California,6,6,NA,290650012,2009-03-05
22,1,16:13,2173,2173,Jamelle Horne Defensive Rebound.,5,7,-2,28,0.4509271804153904,0.4509271804153904,Arizona,California,6,6,NA,290650012,2009-03-05
23,1,15:45,2145,2145,Jordan Hill missed Two Point Jumper.,5,7,-2,0,0.4502781200489009,0.4502781200489009,Arizona,California,6,6,NA,290650012,2009-03-05
24,1,15:45,2145,2145,Jamelle Horne Offensive Rebound.,5,7,-2,2,0.4502781200489009,0.4502781200489009,Arizona,California,6,6,NA,290650012,2009-03-05
25,1,15:43,2143,2143,Jamelle Horne missed Two Point Layup.,5,7,-2,0,0.45023152697512836,0.45023152697512836,Arizona,California,6,6,NA,290650012,2009-03-05
26,1,15:43,2143,2143,Jordan Wilkes Defensive Rebound.,5,7,-2,2,0.45023152697512836,0.45023152697512836,Arizona,California,6,6,NA,290650012,2009-03-05
27,1,15:41,2141,2141,Foul on Theo Robertson,5,7,-2,0,0.450184901425108,0.450184901425108,Arizona,California,6,6,NA,290650012,2009-03-05
28,1,15:41,2141,2141,Official TV Timeout.,5,7,-2,22,0.450184901425108,0.450184901425108,Arizona,California,6,6,NA,290650012,2009-03-05
29,1,15:19,2119,2119,Jordan Hill made Two Point Jumper.,7,7,0,27,0.5,0.5,Arizona,California,6,6,NA,290650012,2009-03-05
30,1,14:52,2092,2092,Patrick Christopher missed Three Point Jumper.,7,7,0,0,0.5,0.5,Arizona,California,6,6,NA,290650012,2009-03-05
31,1,14:52,2092,2092,Arizona Defensive Rebound.,7,7,0,16,0.5,0.5,Arizona,California,6,6,NA,290650012,2009-03-05
32,1,14:36,2076,2076,Nic Wise made Three Point Jumper.,10,7,3,20,0.5766872539992671,0.5766872539992671,Arizona,California,6,6,NA,290650012,2009-03-05
33,1,14:16,2056,2056,Jamal Boykin made Two Point Jumper.,10,9,1,18,0.5259851885865764,0.5259851885865764,Arizona,California,6,6,NA,290650012,2009-03-05
34,1,13:58,2038,2038,Foul on Chase Budinger,10,9,1,28,0.5262051299966672,0.5262051299966672,Arizona,California,6,6,NA,290650012,2009-03-05
35,1,13:30,2010,2010,Jordan Hill missed Two Point Jumper.,10,9,1,0,0.5265511372496339,0.5265511372496339,Arizona,California,6,6,NA,290650012,2009-03-05
36,1,13:30,2010,2010,Jamelle Horne Offensive Rebound.,10,9,1,20,0.5265511372496339,0.5265511372496339,Arizona,California,6,6,NA,290650012,2009-03-05
37,1,13:10,1990,1990,Nic Wise missed Two Point Layup.,10,9,1,0,0.5268013541918746,0.5268013541918746,Arizona,California,6,6,NA,290650012,2009-03-05
38,1,13:10,1990,1990,Jordan Wilkes Defensive Rebound.,10,9,1,12,0.5268013541918746,0.5268013541918746,Arizona,California,6,6,NA,290650012,2009-03-05
39,1,12:58,1978,1978,Jordan Hill made Two Point Jumper.  Assisted by Nic Wise.,12,9,3,22,0.5802371896999723,0.5802371896999723,Arizona,California,6,6,NA,290650012,2009-03-05
40,1,12:36,1956,1956,Foul on Nic Wise,12,9,3,36,0.581058454632982,0.581058454632982,Arizona,California,6,6,NA,290650012,2009-03-05
41,1,12:00,1920,1920,Foul on Jordan Wilkes,12,9,3,0,0.5824227117823739,0.5824227117823739,Arizona,California,6,6,NA,290650012,2009-03-05
42,1,12:00,1920,1920,Jamelle Horne made Free Throw.,13,9,4,0,0.609125025499484,0.609125025499484,Arizona,California,6,6,NA,290650012,2009-03-05
43,1,12:00,1920,1920,Jamelle Horne made Free Throw.,14,9,5,14,0.6351893613636804,0.6351893613636804,Arizona,California,6,6,NA,290650012,2009-03-05
44,1,11:46,1906,1906,Jerome Randle missed Three Point Jumper.,14,9,5,0,0.636033843008791,0.636033843008791,Arizona,California,6,6,NA,290650012,2009-03-05
45,1,11:46,1906,1906,Kyle Fogg Defensive Rebound.,14,9,5,13,0.636033843008791,0.636033843008791,Arizona,California,6,6,NA,290650012,2009-03-05
46,1,11:33,1893,1893,Jordan Hill missed Two Point Jumper.,14,9,5,0,0.6368166251530565,0.6368166251530565,Arizona,California,6,6,NA,290650012,2009-03-05
47,1,11:33,1893,1893,Harper Kamp Defensive Rebound.,14,9,5,10,0.6368166251530565,0.6368166251530565,Arizona,California,6,6,NA,290650012,2009-03-05
48,1,11:23,1883,1883,Jerome Randle missed Two Point Layup.,14,9,5,0,0.637418371051662,0.637418371051662,Arizona,California,6,6,NA,290650012,2009-03-05
49,1,11:23,1883,1883,Jordan Hill Defensive Rebound.,14,9,5,5,0.637418371051662,0.637418371051662,Arizona,California,6,6,NA,290650012,2009-03-05
50,1,11:18,1878,1878,Foul on Harper Kamp,14,9,5,0,0.6377192408456538,0.6377192408456538,Arizona,California,6,6,NA,290650012,2009-03-05
51,1,11:18,1878,1878,Official TV Timeout.,14,9,5,0,0.6377192408456538,0.6377192408456538,Arizona,California,6,6,NA,290650012,2009-03-05
52,1,11:18,1878,1878,Chase Budinger made Free Throw.,15,9,6,0,0.6634204358363001,0.6634204358363001,Arizona,California,6,6,NA,290650012,2009-03-05
53,1,11:18,1878,1878,Chase Budinger made Free Throw.,16,9,7,37,0.6881898188746299,0.6881898188746299,Arizona,California,6,6,NA,290650012,2009-03-05
54,1,10:41,1841,1841,Jamelle Horne made Two Point Dunk Shot.  Assisted by Jordan Hill.,18,9,9,27,0.7379359483917649,0.7379359483917649,Arizona,California,6,6,NA,290650012,2009-03-05
55,1,10:14,1814,1814,Jorge Gutierrez made Two Point Layup.  Assisted by Jamal Boykin.,18,11,7,15,0.693213506601928,0.693213506601928,Arizona,California,6,6,NA,290650012,2009-03-05
56,1,9:59,1799,1799,Jamelle Horne made Two Point Dunk Shot.  Assisted by Nic Wise.,20,11,9,20,0.7417898725605767,0.7417898725605767,Arizona,California,6,6,NA,290650012,2009-03-05
57,1,9:39,1779,1779,Patrick Christopher missed Three Point Jumper.,20,11,9,0,0.7436418897324124,0.7436418897324124,Arizona,California,6,6,NA,290650012,2009-03-05
58,1,9:39,1779,1779,Zane Johnson Defensive Rebound.,20,11,9,9,0.7436418897324124,0.7436418897324124,Arizona,California,6,6,NA,290650012,2009-03-05
59,1,9:30,1770,1770,Zane Johnson missed Three Point Jumper.,20,11,9,0,0.744480370292847,0.744480370292847,Arizona,California,6,6,NA,290650012,2009-03-05
60,1,9:30,1770,1770,Jamal Boykin Defensive Rebound.,20,11,9,6,0.744480370292847,0.744480370292847,Arizona,California,6,6,NA,290650012,2009-03-05
61,1,9:24,1764,1764,Foul on Jamelle Horne,20,11,9,8,0.74504136186543235,0.74504136186543235,Arizona,California,6,6,NA,290650012,2009-03-05
62,1,9:16,1756,1756,Jorge Gutierrez missed Two Point Jumper.,20,11,9,0,0.7457920513796512,0.7457920513796512,Arizona,California,6,6,NA,290650012,2009-03-05
63,1,9:16,1756,1756,Jordan Hill Defensive Rebound.,20,11,9,3,0.7457920513796512,0.7457920513796512,Arizona,California,6,6,NA,290650012,2009-03-05
64,1,9:13,1753,1753,Foul on Patrick Christopher,20,11,9,22,0.7460744002747169,0.7460744002747169,Arizona,California,6,6,NA,290650012,2009-03-05
65,1,8:51,1731,1731,Chase Budinger made Three Point Jumper.  Assisted by Jordan Hill.,23,11,12,12,0.8102701686889336,0.8102701686889336,Arizona,California,6,6,NA,290650012,2009-03-05
66,1,8:39,1719,1719,Foul on Nic Wise,23,11,12,4,0.8115204421924331,0.8115204421924331,Arizona,California,6,6,NA,290650012,2009-03-05
67,1,8:35,1715,1715,Theo Robertson made Three Point Jumper.  Assisted by Jorge Gutierrez.,23,14,9,24,0.7496964577784596,0.7496964577784596,Arizona,California,6,6,NA,290650012,2009-03-05
68,1,8:11,1691,1691,Foul on Jamal Boykin,23,14,9,1,0.7520350420699208,0.7520350420699208,Arizona,California,6,6,NA,290650012,2009-03-05
69,1,8:10,1690,1690,Jordan Hill missed Free Throw.,23,14,9,0,0.752133456945712,0.752133456945712,Arizona,California,6,6,NA,290650012,2009-03-05
70,1,8:10,1690,1690,null,23,14,9,0,0.752133456945712,0.752133456945712,Arizona,California,6,6,NA,290650012,2009-03-05
71,1,8:10,1690,1690,Jordan Hill made Free Throw.,24,14,10,8,0.774405977631662,0.774405977631662,Arizona,California,6,6,NA,290650012,2009-03-05
72,1,8:02,1682,1682,Patrick Christopher missed Two Point Jumper.,24,14,10,0,0.77521985085928935,0.77521985085928935,Arizona,California,6,6,NA,290650012,2009-03-05
73,1,8:02,1682,1682,Jordan Hill Defensive Rebound.,24,14,10,28,0.77521985085928935,0.77521985085928935,Arizona,California,6,6,NA,290650012,2009-03-05
74,1,7:34,1654,1654,Chase Budinger missed Three Point Jumper.,24,14,10,0,0.7779826369035417,0.7779826369035417,Arizona,California,6,6,NA,290650012,2009-03-05
75,1,7:34,1654,1654,Jorge Gutierrez Defensive Rebound.,24,14,10,4,0.7779826369035417,0.7779826369035417,Arizona,California,6,6,NA,290650012,2009-03-05
76,1,7:30,1650,1650,Jerome Randle made Three Point Jumper.,24,17,7,34,0.706682824772696,0.706682824772696,Arizona,California,6,6,NA,290650012,2009-03-05
77,1,6:56,1616,1616,Jordan Hill missed Two Point Jumper.,24,17,7,0,0.7093918335099042,0.7093918335099042,Arizona,California,6,6,NA,290650012,2009-03-05
78,1,6:56,1616,1616,Jorge Gutierrez Defensive Rebound.,24,17,7,6,0.7093918335099042,0.7093918335099042,Arizona,California,6,6,NA,290650012,2009-03-05
79,1,6:50,1610,1610,Jerome Randle missed Two Point Layup.,24,17,7,0,0.7098641180159633,0.7098641180159633,Arizona,California,6,6,NA,290650012,2009-03-05
80,1,6:50,1610,1610,Jamelle Horne Defensive Rebound.,24,17,7,6,0.7098641180159633,0.7098641180159633,Arizona,California,6,6,NA,290650012,2009-03-05
81,1,6:44,1604,1604,Foul on Brendon Lavender,24,17,7,0,0.7103355544415711,0.7103355544415711,Arizona,California,6,6,NA,290650012,2009-03-05
82,1,6:44,1604,1604,Official TV Timeout.,24,17,7,18,0.7103355544415711,0.7103355544415711,Arizona,California,6,6,NA,290650012,2009-03-05
83,1,6:26,1586,1586,Theo Robertson made Two Point Jumper.,24,19,5,33,0.656026276239117,0.656026276239117,Arizona,California,6,6,NA,290650012,2009-03-05
84,1,5:53,1553,1553,Jordan Hill made Two Point Layup.,26,19,7,16,0.7143566871229897,0.7143566871229897,Arizona,California,6,6,NA,290650012,2009-03-05
85,1,5:37,1537,1537,Theo Robertson made Three Point Jumper.  Assisted by Jorge Gutierrez.,26,22,4,9,0.628877061992019,0.628877061992019,Arizona,California,6,6,NA,290650012,2009-03-05
86,1,5:28,1528,1528,Chase Budinger made Two Point Layup.,28,22,6,0,0.6887316164651959,0.6887316164651959,Arizona,California,6,6,NA,290650012,2009-03-05
87,1,5:28,1528,1528,Foul on Theo Robertson,28,22,6,0,0.6887316164651959,0.6887316164651959,Arizona,California,6,6,NA,290650012,2009-03-05
88,1,5:28,1528,1528,Chase Budinger made Free Throw.,29,22,7,16,0.7163773073559414,0.7163773073559414,Arizona,California,6,6,NA,290650012,2009-03-05
89,1,5:12,1512,1512,Theo Robertson missed Three Point Jumper.,29,22,7,0,0.7177029583937335,0.7177029583937335,Arizona,California,6,6,NA,290650012,2009-03-05
90,1,5:12,1512,1512,Jamelle Horne Defensive Rebound.,29,22,7,27,0.7177029583937335,0.7177029583937335,Arizona,California,6,6,NA,290650012,2009-03-05
91,1,4:45,1485,1485,Kyle Fogg made Two Point Jumper.,31,22,9,18,0.7710795019099459,0.7710795019099459,Arizona,California,6,6,NA,290650012,2009-03-05
92,1,4:27,1467,1467,Jorge Gutierrez missed Two Point Layup.,31,22,9,0,0.7728885636936176,0.7728885636936176,Arizona,California,6,6,NA,290650012,2009-03-05
93,1,4:27,1467,1467,Jamelle Horne Defensive Rebound.,31,22,9,14,0.7728885636936176,0.7728885636936176,Arizona,California,6,6,NA,290650012,2009-03-05
94,1,4:13,1453,1453,Nic Wise missed Three Point Jumper.,31,22,9,0,0.7743409811053223,0.7743409811053223,Arizona,California,6,6,NA,290650012,2009-03-05
95,1,4:13,1453,1453,California Defensive Rebound.,31,22,9,0,0.7743409811053223,0.7743409811053223,Arizona,California,6,6,NA,290650012,2009-03-05
96,1,4:13,1453,1453,Foul on Jamelle Horne,31,22,9,11,0.7743409811053223,0.7743409811053223,Arizona,California,6,6,NA,290650012,2009-03-05
97,1,4:02,1442,1442,Nikola Knezevic made Three Point Jumper.  Assisted by Theo Robertson.,31,25,6,15,0.6955950792117197,0.6955950792117197,Arizona,California,6,6,NA,290650012,2009-03-05
98,1,3:47,1427,1427,Kyle Fogg missed Three Point Jumper.,31,25,6,0,0.6968371571663571,0.6968371571663571,Arizona,California,6,6,NA,290650012,2009-03-05
99,1,3:47,1427,1427,Jordan Wilkes Defensive Rebound.,31,25,6,6,0.6968371571663571,0.6968371571663571,Arizona,California,6,6,NA,290650012,2009-03-05
100,1,3:41,1421,1421,Foul on Kyle Fogg,31,25,6,0,0.6973237393450701,0.6973237393450701,Arizona,California,6,6,NA,290650012,2009-03-05
101,1,3:41,1421,1421,Official TV Timeout.,31,25,6,0,0.6973237393450701,0.6973237393450701,Arizona,California,6,6,NA,290650012,2009-03-05
102,1,3:41,1421,1421,Nikola Knezevic missed Free Throw.,31,25,6,0,0.6973237393450701,0.6973237393450701,Arizona,California,6,6,NA,290650012,2009-03-05
103,1,3:41,1421,1421,Alex Jacobson Defensive Rebound.,31,25,6,7,0.6973237393450701,0.6973237393450701,Arizona,California,6,6,NA,290650012,2009-03-05
104,1,3:34,1414,1414,Nic Wise missed Two Point Layup.,31,25,6,0,0.6978851012980826,0.6978851012980826,Arizona,California,6,6,NA,290650012,2009-03-05
105,1,3:34,1414,1414,Jordan Hill Offensive Rebound.,31,25,6,4,0.6978851012980826,0.6978851012980826,Arizona,California,6,6,NA,290650012,2009-03-05
106,1,3:30,1410,1410,Jordan Hill missed Two Point Jumper.,31,25,6,0,0.698203141950388,0.698203141950388,Arizona,California,6,6,NA,290650012,2009-03-05
107,1,3:30,1410,1410,Jorge Gutierrez Defensive Rebound.,31,25,6,13,0.698203141950388,0.698203141950388,Arizona,California,6,6,NA,290650012,2009-03-05
108,1,3:17,1397,1397,Theo Robertson missed Two Point Jumper.,31,25,6,0,0.6992252607102077,0.6992252607102077,Arizona,California,6,6,NA,290650012,2009-03-05
109,1,3:17,1397,1397,Harper Kamp Offensive Rebound.,31,25,6,11,0.6992252607102077,0.6992252607102077,Arizona,California,6,6,NA,290650012,2009-03-05
110,1,3:06,1386,1386,Nic Wise made Two Point Layup.,33,25,8,23,0.7558822911456291,0.7558822911456291,Arizona,California,6,6,NA,290650012,2009-03-05
111,1,2:43,1363,1363,Theo Robertson missed Three Point Jumper.,33,25,8,0,0.757953649009922,0.757953649009922,Arizona,California,6,6,NA,290650012,2009-03-05
112,1,2:43,1363,1363,Patrick Christopher Offensive Rebound.,33,25,8,36,0.757953649009922,0.757953649009922,Arizona,California,6,6,NA,290650012,2009-03-05
113,1,2:07,1327,1327,Chase Budinger made Three Point Jumper.  Assisted by Nic Wise.,36,25,11,18,0.8311835072359499,0.8311835072359499,Arizona,California,6,6,NA,290650012,2009-03-05
114,1,1:49,1309,1309,Foul on Jordan Hill,36,25,11,0,0.8329483336921004,0.8329483336921004,Arizona,California,6,6,NA,290650012,2009-03-05
115,1,1:49,1309,1309,Patrick Christopher made Free Throw.,36,26,10,0,0.8116256036272829,0.8116256036272829,Arizona,California,6,6,NA,290650012,2009-03-05
116,1,1:49,1309,1309,Patrick Christopher missed Free Throw.,36,26,10,0,0.8116256036272829,0.8116256036272829,Arizona,California,6,6,NA,290650012,2009-03-05
117,1,1:49,1309,1309,Zane Johnson Defensive Rebound.,36,26,10,18,0.8116256036272829,0.8116256036272829,Arizona,California,6,6,NA,290650012,2009-03-05
118,1,1:31,1291,1291,Foul on Nic Wise,36,26,10,7,0.8134336601362532,0.8134336601362532,Arizona,California,6,6,NA,290650012,2009-03-05
119,1,1:24,1284,1284,Jerome Randle made Free Throw.,36,27,9,0,0.7907580228438555,0.7907580228438555,Arizona,California,6,6,NA,290650012,2009-03-05
120,1,1:24,1284,1284,Jerome Randle made Free Throw.,36,28,8,27,0.7652674046074133,0.7652674046074133,Arizona,California,6,6,NA,290650012,2009-03-05
121,1,0:57,1257,1257,Chase Budinger missed Two Point Jumper.,36,28,8,0,0.7680066678655059,0.7680066678655059,Arizona,California,6,6,NA,290650012,2009-03-05
122,1,0:57,1257,1257,Omondi Amoke Defensive Rebound.,36,28,8,7,0.7680066678655059,0.7680066678655059,Arizona,California,6,6,NA,290650012,2009-03-05
123,1,0:50,1250,1250,Nikola Knezevic made Three Point Jumper.,36,31,5,10,0.6793500352185985,0.6793500352185985,Arizona,California,6,6,NA,290650012,2009-03-05
124,1,0:40,1240,1240,Foul on D.J. Seeley,36,31,5,0,0.6801822273590818,0.6801822273590818,Arizona,California,6,6,NA,290650012,2009-03-05
125,1,0:40,1240,1240,Chase Budinger made Free Throw.,37,31,6,0,0.71208484748175,0.71208484748175,Arizona,California,6,6,NA,290650012,2009-03-05
126,1,0:40,1240,1240,Chase Budinger made Free Throw.,38,31,7,24,0.7420121484524033,0.7420121484524033,Arizona,California,6,6,NA,290650012,2009-03-05
127,1,0:16,1216,1216,California Full Timeout.,38,31,7,9,0.7446071953503208,0.7446071953503208,Arizona,California,5,6,NA,290650012,2009-03-05
128,1,0:07,1207,1207,Theo Robertson made Three Point Jumper.,38,34,4,7,0.6489754549123071,0.6489754549123071,Arizona,California,5,6,NA,290650012,2009-03-05
129,1,0:00,1200,1200,End of the 1st Half.,38,34,4,0,0.6495177425372646,0.6495177425372646,Arizona,California,5,6,NA,290650012,2009-03-05
130,2,20:00,1200,1200,PLAY,38,34,4,13,0.6495177425372646,0.6495177425372646,Arizona,California,5,6,NA,290650012,2009-03-05
131,2,19:47,1187,1187,Jordan Wilkes made Two Point Layup.,38,36,2,16,0.5770387894748226,0.5770387894748226,Arizona,California,5,6,NA,290650012,2009-03-05
132,2,19:31,1171,1171,Jordan Hill missed Two Point Jumper.,38,36,2,0,0.5776755082767817,0.5776755082767817,Arizona,California,5,6,NA,290650012,2009-03-05
133,2,19:31,1171,1171,Theo Robertson Defensive Rebound.,38,36,2,5,0.5776755082767817,0.5776755082767817,Arizona,California,5,6,NA,290650012,2009-03-05
134,2,19:26,1166,1166,Patrick Christopher missed Three Point Jumper.,38,36,2,0,0.577871900881324,0.577871900881324,Arizona,California,5,6,NA,290650012,2009-03-05
135,2,19:26,1166,1166,Theo Robertson Offensive Rebound.,38,36,2,5,0.577871900881324,0.577871900881324,Arizona,California,5,6,NA,290650012,2009-03-05
136,2,19:21,1161,1161,Theo Robertson made Two Point Layup.,38,38,0,5,0.5,0.5,Arizona,California,5,6,NA,290650012,2009-03-05
137,2,19:16,1156,1156,Foul on Jamal Boykin,38,38,0,0,0.5,0.5,Arizona,California,5,6,NA,290650012,2009-03-05
138,2,19:16,1156,1156,Chase Budinger missed Free Throw.,38,38,0,0,0.5,0.5,Arizona,California,5,6,NA,290650012,2009-03-05
139,2,19:16,1156,1156,null,38,38,0,0,0.5,0.5,Arizona,California,5,6,NA,290650012,2009-03-05
140,2,19:16,1156,1156,Chase Budinger made Free Throw.,39,38,1,12,0.539373673339962,0.539373673339962,Arizona,California,5,6,NA,290650012,2009-03-05
141,2,19:04,1144,1144,Jordan Wilkes missed Two Point Jumper.,39,38,1,0,0.5396105980674106,0.5396105980674106,Arizona,California,5,6,NA,290650012,2009-03-05
142,2,19:04,1144,1144,Nic Wise Defensive Rebound.,39,38,1,16,0.5396105980674106,0.5396105980674106,Arizona,California,5,6,NA,290650012,2009-03-05
143,2,18:48,1128,1128,Jamelle Horne missed Two Point Jumper.,39,38,1,0,0.539925839200829,0.539925839200829,Arizona,California,5,6,NA,290650012,2009-03-05
144,2,18:48,1128,1128,Jordan Wilkes Defensive Rebound.,39,38,1,0,0.539925839200829,0.539925839200829,Arizona,California,5,6,NA,290650012,2009-03-05
145,2,18:48,1128,1128,Foul on Kyle Fogg,39,38,1,22,0.539925839200829,0.539925839200829,Arizona,California,5,6,NA,290650012,2009-03-05
146,2,18:26,1106,1106,Jerome Randle missed Two Point Jumper.,39,38,1,0,0.5403627934644206,0.5403627934644206,Arizona,California,5,6,NA,290650012,2009-03-05
147,2,18:26,1106,1106,Jordan Hill Defensive Rebound.,39,38,1,11,0.5403627934644206,0.5403627934644206,Arizona,California,5,6,NA,290650012,2009-03-05
148,2,18:15,1095,1095,Nic Wise missed Two Point Layup.,39,38,1,0,0.5405847998016919,0.5405847998016919,Arizona,California,5,6,NA,290650012,2009-03-05
149,2,18:15,1095,1095,Patrick Christopher Defensive Rebound.,39,38,1,8,0.5405847998016919,0.5405847998016919,Arizona,California,5,6,NA,290650012,2009-03-05
150,2,18:07,1087,1087,Theo Robertson missed Three Point Jumper.,39,38,1,0,0.5407484408832675,0.5407484408832675,Arizona,California,5,6,NA,290650012,2009-03-05
151,2,18:07,1087,1087,Patrick Christopher Offensive Rebound.,39,38,1,5,0.5407484408832675,0.5407484408832675,Arizona,California,5,6,NA,290650012,2009-03-05
152,2,18:02,1082,1082,Foul on Chase Budinger,39,38,1,0,0.5408518258223588,0.5408518258223588,Arizona,California,5,6,NA,290650012,2009-03-05
153,2,18:02,1082,1082,Patrick Christopher made Free Throw.,39,39,0,0,0.5,0.5,Arizona,California,5,6,NA,290650012,2009-03-05
154,2,18:02,1082,1082,Patrick Christopher missed Free Throw.,39,39,0,0,0.5,0.5,Arizona,California,5,6,NA,290650012,2009-03-05
155,2,18:02,1082,1082,Jordan Hill Defensive Rebound.,39,39,0,18,0.5,0.5,Arizona,California,5,6,NA,290650012,2009-03-05
156,2,17:44,1064,1064,Foul on Jordan Wilkes,39,39,0,3,0.5,0.5,Arizona,California,5,6,NA,290650012,2009-03-05
157,2,17:41,1061,1061,Jordan Hill made Two Point Jumper.,41,39,2,30,0.5820352748936806,0.5820352748936806,Arizona,California,5,6,NA,290650012,2009-03-05
158,2,17:11,1031,1031,Patrick Christopher made Two Point Layup.,41,41,0,19,0.5,0.5,Arizona,California,5,6,NA,290650012,2009-03-05
159,2,16:52,1012,1012,Chase Budinger missed Three Point Jumper.,41,41,0,0,0.5,0.5,Arizona,California,5,6,NA,290650012,2009-03-05
160,2,16:52,1012,1012,Patrick Christopher Defensive Rebound.,41,41,0,18,0.5,0.5,Arizona,California,5,6,NA,290650012,2009-03-05
161,2,16:34,994,994,Jordan Wilkes missed Two Point Jumper.,41,41,0,0,0.5,0.5,Arizona,California,5,6,NA,290650012,2009-03-05
162,2,16:34,994,994,Jordan Hill Defensive Rebound.,41,41,0,10,0.5,0.5,Arizona,California,5,6,NA,290650012,2009-03-05
163,2,16:24,984,984,Jamelle Horne made Three Point Jumper.,44,41,3,26,0.6270111825572628,0.6270111825572628,Arizona,California,5,6,NA,290650012,2009-03-05
164,2,15:58,958,958,Theo Robertson missed Two Point Jumper.,44,41,3,6,0.629097674438671,0.629097674438671,Arizona,California,5,6,NA,290650012,2009-03-05
165,2,15:52,952,952,Jamal Boykin Offensive Rebound.,44,41,3,2,0.6295528558812014,0.6295528558812014,Arizona,California,5,6,NA,290650012,2009-03-05
166,2,15:50,950,950,Theo Robertson missed Three Point Jumper.,44,41,3,0,0.6297013367018819,0.6297013367018819,Arizona,California,5,6,NA,290650012,2009-03-05
167,2,15:50,950,950,Kyle Fogg Defensive Rebound.,44,41,3,3,0.6297013367018819,0.6297013367018819,Arizona,California,5,6,NA,290650012,2009-03-05
168,2,15:47,947,947,Foul on Jordan Wilkes,44,41,3,0,0.6299211716679175,0.6299211716679175,Arizona,California,5,6,NA,290650012,2009-03-05
169,2,15:47,947,947,Official TV Timeout.,44,41,3,8,0.6299211716679175,0.6299211716679175,Arizona,California,5,6,NA,290650012,2009-03-05
170,2,15:39,939,939,Foul on Harper Kamp,44,41,3,17,0.6304915531634911,0.6304915531634911,Arizona,California,5,6,NA,290650012,2009-03-05
171,2,15:22,922,922,Foul on Harper Kamp,44,41,3,0,0.6316383723485597,0.6316383723485597,Arizona,California,5,6,NA,290650012,2009-03-05
172,2,15:22,922,922,Jamelle Horne missed Free Throw.,44,41,3,0,0.6316383723485597,0.6316383723485597,Arizona,California,5,6,NA,290650012,2009-03-05
173,2,15:22,922,922,null,44,41,3,0,0.6316383723485597,0.6316383723485597,Arizona,California,5,6,NA,290650012,2009-03-05
174,2,15:22,922,922,Jamelle Horne made Free Throw.,45,41,4,21,0.6723873289049204,0.6723873289049204,Arizona,California,5,6,NA,290650012,2009-03-05
175,2,15:01,901,901,Harper Kamp missed Two Point Jumper.,45,41,4,0,0.674063805541245,0.674063805541245,Arizona,California,5,6,NA,290650012,2009-03-05
176,2,15:01,901,901,Kyle Fogg Defensive Rebound.,45,41,4,24,0.674063805541245,0.674063805541245,Arizona,California,5,6,NA,290650012,2009-03-05
