play_id,half,time_remaining_half,secs_remaining,secs_remaining_absolute,description,home_score,away_score,score_diff,play_length,win_prob,naive_win_prob,home,away,home_time_out_remaining,away_time_out_remaining,home_favored_by,game_id,date
1,1,20:00,2400,2400,PLAY,0,0,0,27,0.5,0.5,Charlotte,Xavier,6,6,NA,260682429,2006-03-09
2,1,19:33,2373,2373,Josh Duncan missed Two Point Jumper.,0,0,0,0,0.5,0.5,Charlotte,Xavier,6,6,NA,260682429,2006-03-09
3,1,19:33,2373,2373,Chris Nance Defensive Rebound.,0,0,0,14,0.5,0.5,Charlotte,Xavier,6,6,NA,260682429,2006-03-09
4,1,19:19,2359,2359,Chris Nance made Two Point Jumper.,2,0,2,21,0.5448965882700816,0.5448965882700816,Charlotte,Xavier,6,6,NA,260682429,2006-03-09
5,1,18:58,2338,2338,Josh Duncan missed Three Point Jumper.,2,0,2,0,0.5453512728162102,0.5453512728162102,Charlotte,Xavier,6,6,NA,260682429,2006-03-09
6,1,18:58,2338,2338,Leemire Goldwire Defensive Rebound.,2,0,2,8,0.5453512728162102,0.5453512728162102,Charlotte,Xavier,6,6,NA,260682429,2006-03-09
7,1,18:50,2330,2330,Leemire Goldwire missed Three Point Jumper.,2,0,2,0,0.5455259319330696,0.5455259319330696,Charlotte,Xavier,6,6,NA,260682429,2006-03-09
8,1,18:50,2330,2330,Chris Nance Offensive Rebound.,2,0,2,4,0.5455259319330696,0.5455259319330696,Charlotte,Xavier,6,6,NA,260682429,2006-03-09
9,1,18:46,2326,2326,Foul on Justin Doellman,2,0,2,2,0.5456135467511029,0.5456135467511029,Charlotte,Xavier,6,6,NA,260682429,2006-03-09
10,1,18:44,2324,2324,Curtis Withers missed Two Point Jumper.,2,0,2,0,0.5456574240006768,0.5456574240006768,Charlotte,Xavier,6,6,NA,260682429,2006-03-09
11,1,18:44,2324,2324,Justin Cage Defensive Rebound.,2,0,2,15,0.5456574240006768,0.5456574240006768,Charlotte,Xavier,6,6,NA,260682429,2006-03-09
12,1,18:29,2309,2309,Johnny Wolf made Three Point Jumper.,2,3,-1,22,0.4769571932307422,0.4769571932307422,Charlotte,Xavier,6,6,NA,260682429,2006-03-09
13,1,18:07,2287,2287,De'Angelo Alexander made Three Point Jumper.,5,3,2,20,0.5464770070814524,0.5464770070814524,Charlotte,Xavier,6,6,NA,260682429,2006-03-09
14,1,17:47,2267,2267,Johnny Wolf missed Three Point Jumper.,5,3,2,0,0.546925639914279,0.546925639914279,Charlotte,Xavier,6,6,NA,260682429,2006-03-09
15,1,17:47,2267,2267,Xavier Defensive Rebound.,5,3,2,3,0.546925639914279,0.546925639914279,Charlotte,Xavier,6,6,NA,260682429,2006-03-09
16,1,17:44,2264,2264,Foul on Mitchell Baldwin,5,3,2,12,0.5469932384002621,0.5469932384002621,Charlotte,Xavier,6,6,NA,260682429,2006-03-09
17,1,17:32,2252,2252,Justin Doellman missed Two Point Jumper.,5,3,2,0,0.5472643690441272,0.5472643690441272,Charlotte,Xavier,6,6,NA,260682429,2006-03-09
18,1,17:32,2252,2252,Xavier Defensive Rebound.,5,3,2,3,0.5472643690441272,0.5472643690441272,Charlotte,Xavier,6,6,NA,260682429,2006-03-09
19,1,17:29,2249,2249,Foul on De'Angelo Alexander,5,3,2,7,0.5473323287850554,0.5473323287850554,Charlotte,Xavier,6,6,NA,260682429,2006-03-09
20,1,17:22,2242,2242,Justin Doellman missed Two Point Jumper.,5,3,2,0,0.5474911634847673,0.5474911634847673,Charlotte,Xavier,6,6,NA,260682429,2006-03-09
21,1,17:22,2242,2242,Curtis Withers Defensive Rebound.,5,3,2,20,0.5474911634847673,0.5474911634847673,Charlotte,Xavier,6,6,NA,260682429,2006-03-09
22,1,17:02,2222,2222,Mitchell Baldwin missed Two Point Layup.,5,3,2,0,0.5479468560005873,0.5479468560005873,Charlotte,Xavier,6,6,NA,260682429,2006-03-09
23,1,17:02,2222,2222,Justin Cage Defensive Rebound.,5,3,2,10,0.5479468560005873,0.5479468560005873,Charlotte,Xavier,6,6,NA,260682429,2006-03-09
24,1,16:52,2212,2212,Foul on Stanley Burrell,5,3,2,30,0.5481756490460405,0.5481756490460405,Charlotte,Xavier,6,6,NA,260682429,2006-03-09
25,1,16:22,2182,2182,Curtis Withers missed Two Point Jumper.,5,3,2,0,0.5488651855001424,0.5488651855001424,Charlotte,Xavier,6,6,NA,260682429,2006-03-09
26,1,16:22,2182,2182,Justin Cage Defensive Rebound.,5,3,2,9,0.5488651855001424,0.5488651855001424,Charlotte,Xavier,6,6,NA,260682429,2006-03-09
27,1,16:13,2173,2173,Justin Doellman made Three Point Jumper.,5,6,-1,10,0.47540421675266,0.47540421675266,Charlotte,Xavier,6,6,NA,260682429,2006-03-09
28,1,16:03,2163,2163,Chris Nance missed Two Point Jumper.,5,6,-1,0,0.47528780118465236,0.47528780118465236,Charlotte,Xavier,6,6,NA,260682429,2006-03-09
29,1,16:03,2163,2163,Johnny Wolf Defensive Rebound.,5,6,-1,8,0.47528780118465236,0.47528780118465236,Charlotte,Xavier,6,6,NA,260682429,2006-03-09
30,1,15:55,2155,2155,Johnny Wolf missed Three Point Jumper.,5,6,-1,0,0.4751944004378896,0.4751944004378896,Charlotte,Xavier,6,6,NA,260682429,2006-03-09
31,1,15:55,2155,2155,Chris Nance Defensive Rebound.,5,6,-1,8,0.4751944004378896,0.4751944004378896,Charlotte,Xavier,6,6,NA,260682429,2006-03-09
32,1,15:47,2147,2147,Leemire Goldwire made Three Point Jumper.,8,6,2,18,0.5496753190846927,0.5496753190846927,Charlotte,Xavier,6,6,NA,260682429,2006-03-09
33,1,15:29,2129,2129,Stanley Burrell missed Two Point Jumper.,8,6,2,0,0.5500955489304163,0.5500955489304163,Charlotte,Xavier,6,6,NA,260682429,2006-03-09
34,1,15:29,2129,2129,Mitchell Baldwin Defensive Rebound.,8,6,2,7,0.5500955489304163,0.5500955489304163,Charlotte,Xavier,6,6,NA,260682429,2006-03-09
35,1,15:22,2122,2122,De'Angelo Alexander missed Three Point Jumper.,8,6,2,0,0.5502597124446706,0.5502597124446706,Charlotte,Xavier,6,6,NA,260682429,2006-03-09
36,1,15:22,2122,2122,Charlotte Defensive Rebound.,8,6,2,2,0.5502597124446706,0.5502597124446706,Charlotte,Xavier,6,6,NA,260682429,2006-03-09
37,1,15:20,2120,2120,Official TV Timeout.,8,6,2,13,0.5503066952226568,0.5503066952226568,Charlotte,Xavier,6,6,NA,260682429,2006-03-09
38,1,15:07,2107,2107,Leemire Goldwire missed Three Point Jumper.,8,6,2,0,0.5506129622145127,0.5506129622145127,Charlotte,Xavier,6,6,NA,260682429,2006-03-09
39,1,15:07,2107,2107,Justin Cage Defensive Rebound.,8,6,2,4,0.5506129622145127,0.5506129622145127,Charlotte,Xavier,6,6,NA,260682429,2006-03-09
40,1,15:03,2103,2103,Justin Doellman made Three Point Jumper.,8,9,-1,18,0.47458071572562543,0.47458071572562543,Charlotte,Xavier,6,6,NA,260682429,2006-03-09
41,1,14:45,2085,2085,De'Angelo Alexander made Two Point Jumper.,10,9,1,32,0.5256346501751078,0.5256346501751078,Charlotte,Xavier,6,6,NA,260682429,2006-03-09
42,1,14:13,2053,2053,Justin Doellman missed Three Point Jumper.,10,9,1,0,0.5260217155563577,0.5260217155563577,Charlotte,Xavier,6,6,NA,260682429,2006-03-09
43,1,14:13,2053,2053,Antwon Coleman Defensive Rebound.,10,9,1,16,0.5260217155563577,0.5260217155563577,Charlotte,Xavier,6,6,NA,260682429,2006-03-09
44,1,13:57,2037,2037,Antwon Coleman missed Two Point Jumper.,10,9,1,0,0.5262174046871455,0.5262174046871455,Charlotte,Xavier,6,6,NA,260682429,2006-03-09
45,1,13:57,2037,2037,Stanley Burrell Defensive Rebound.,10,9,1,12,0.5262174046871455,0.5262174046871455,Charlotte,Xavier,6,6,NA,260682429,2006-03-09
46,1,13:45,2025,2025,Justin Cage made Two Point Layup.,10,11,-1,38,0.473634827780912,0.473634827780912,Charlotte,Xavier,6,6,NA,260682429,2006-03-09
47,1,13:07,1987,1987,Foul on Justin Cage,10,11,-1,29,0.4731608827039501,0.4731608827039501,Charlotte,Xavier,6,6,NA,260682429,2006-03-09
48,1,12:38,1958,1958,De'Angelo Alexander missed Two Point Jumper.,10,11,-1,0,0.4727926015739934,0.4727926015739934,Charlotte,Xavier,6,6,NA,260682429,2006-03-09
49,1,12:38,1958,1958,Brandon Cole Defensive Rebound.,10,11,-1,10,0.4727926015739934,0.4727926015739934,Charlotte,Xavier,6,6,NA,260682429,2006-03-09
50,1,12:28,1948,1948,Justin Doellman missed Two Point Jumper.,10,11,-1,0,0.4726642009187456,0.4726642009187456,Charlotte,Xavier,6,6,NA,260682429,2006-03-09
51,1,12:28,1948,1948,Brandon Cole Offensive Rebound.,10,11,-1,5,0.4726642009187456,0.4726642009187456,Charlotte,Xavier,6,6,NA,260682429,2006-03-09
52,1,12:23,1943,1943,Brandon Cole made Two Point Layup.,10,13,-3,5,0.41845157063326655,0.41845157063326655,Charlotte,Xavier,6,6,NA,260682429,2006-03-09
53,1,12:18,1938,1938,Curtis Withers missed Three Point Jumper.,10,13,-3,0,0.41826216392717774,0.41826216392717774,Charlotte,Xavier,6,6,NA,260682429,2006-03-09
54,1,12:18,1938,1938,Stanley Burrell Defensive Rebound.,10,13,-3,17,0.41826216392717774,0.41826216392717774,Charlotte,Xavier,6,6,NA,260682429,2006-03-09
55,1,12:01,1921,1921,Stanley Burrell missed Two Point Layup.,10,13,-3,0,0.41761532587524786,0.41761532587524786,Charlotte,Xavier,6,6,NA,260682429,2006-03-09
56,1,12:01,1921,1921,De'Angelo Alexander Defensive Rebound.,10,13,-3,37,0.41761532587524786,0.41761532587524786,Charlotte,Xavier,6,6,NA,260682429,2006-03-09
57,1,11:24,1884,1884,Mitchell Baldwin missed Three Point Jumper.,10,13,-3,0,0.41621039799145243,0.41621039799145243,Charlotte,Xavier,6,6,NA,260682429,2006-03-09
58,1,11:24,1884,1884,BJ Raymond Defensive Rebound.,10,13,-3,25,0.41621039799145243,0.41621039799145243,Charlotte,Xavier,6,6,NA,260682429,2006-03-09
59,1,10:59,1859,1859,Official TV Timeout.,10,13,-3,24,0.4152604169840238,0.4152604169840238,Charlotte,Xavier,6,6,NA,260682429,2006-03-09
60,1,10:35,1835,1835,Foul on Marcus Bennett,10,13,-3,27,0.4143440852671358,0.4143440852671358,Charlotte,Xavier,6,6,NA,260682429,2006-03-09
61,1,10:08,1808,1808,De'Angelo Alexander made Three Point Jumper.,13,13,0,32,0.5,0.5,Charlotte,Xavier,6,6,NA,260682429,2006-03-09
62,1,9:36,1776,1776,BJ Raymond missed Two Point Jumper.,13,13,0,0,0.5,0.5,Charlotte,Xavier,6,6,NA,260682429,2006-03-09
63,1,9:36,1776,1776,Courtney Williams Defensive Rebound.,13,13,0,23,0.5,0.5,Charlotte,Xavier,6,6,NA,260682429,2006-03-09
64,1,9:13,1753,1753,Foul on Chris Nance,13,13,0,15,0.5,0.5,Charlotte,Xavier,6,6,NA,260682429,2006-03-09
65,1,8:58,1738,1738,Josh Duncan made Two Point Jumper.,13,15,-2,12,0.43999672850621896,0.43999672850621896,Charlotte,Xavier,6,6,NA,260682429,2006-03-09
66,1,8:46,1726,1726,Marcus Bennett made Three Point Jumper.,16,15,1,26,0.5302785867776377,0.5302785867776377,Charlotte,Xavier,6,6,NA,260682429,2006-03-09
67,1,8:20,1700,1700,Josh Duncan missed Three Point Jumper.,16,15,1,0,0.5306495971050212,0.5306495971050212,Charlotte,Xavier,6,6,NA,260682429,2006-03-09
68,1,8:20,1700,1700,Curtis Withers Defensive Rebound.,16,15,1,21,0.5306495971050212,0.5306495971050212,Charlotte,Xavier,6,6,NA,260682429,2006-03-09
69,1,7:59,1679,1679,Marcus Bennett missed Three Point Jumper.,16,15,1,0,0.5309543236525619,0.5309543236525619,Charlotte,Xavier,6,6,NA,260682429,2006-03-09
70,1,7:59,1679,1679,Curtis Withers Offensive Rebound.,16,15,1,8,0.5309543236525619,0.5309543236525619,Charlotte,Xavier,6,6,NA,260682429,2006-03-09
71,1,7:51,1671,1671,Foul on Brandon Cole,16,15,1,0,0.5310686202751668,0.5310686202751668,Charlotte,Xavier,6,6,NA,260682429,2006-03-09
72,1,7:51,1671,1671,Official TV Timeout.,16,15,1,0,0.5310686202751668,0.5310686202751668,Charlotte,Xavier,6,6,NA,260682429,2006-03-09
73,1,7:51,1671,1671,Leemire Goldwire missed Free Throw.,16,15,1,0,0.5310686202751668,0.5310686202751668,Charlotte,Xavier,6,6,NA,260682429,2006-03-09
74,1,7:51,1671,1671,Charlotte Defensive Rebound.,16,15,1,0,0.5310686202751668,0.5310686202751668,Charlotte,Xavier,6,6,NA,260682429,2006-03-09
75,1,7:51,1671,1671,Leemire Goldwire missed Free Throw.,16,15,1,0,0.5310686202751668,0.5310686202751668,Charlotte,Xavier,6,6,NA,260682429,2006-03-09
76,1,7:51,1671,1671,Justin Doellman Defensive Rebound.,16,15,1,22,0.5310686202751668,0.5310686202751668,Charlotte,Xavier,6,6,NA,260682429,2006-03-09
77,1,7:29,1649,1649,Stanley Burrell missed Three Point Jumper.,16,15,1,0,0.5313771895809314,0.5313771895809314,Charlotte,Xavier,6,6,NA,260682429,2006-03-09
78,1,7:29,1649,1649,Justin Doellman Offensive Rebound.,16,15,1,6,0.5313771895809314,0.5313771895809314,Charlotte,Xavier,6,6,NA,260682429,2006-03-09
79,1,7:23,1643,1643,Foul on Justin Doellman,16,15,1,24,0.5314601591004722,0.5314601591004722,Charlotte,Xavier,6,6,NA,260682429,2006-03-09
80,1,6:59,1619,1619,Foul on Josh Duncan,16,15,1,0,0.5317886696630236,0.5317886696630236,Charlotte,Xavier,6,6,NA,260682429,2006-03-09
81,1,6:59,1619,1619,Curtis Withers missed Free Throw.,16,15,1,0,0.5317886696630236,0.5317886696630236,Charlotte,Xavier,6,6,NA,260682429,2006-03-09
82,1,6:59,1619,1619,Charlotte Defensive Rebound.,16,15,1,0,0.5317886696630236,0.5317886696630236,Charlotte,Xavier,6,6,NA,260682429,2006-03-09
83,1,6:59,1619,1619,Curtis Withers made Free Throw.,17,15,2,7,0.5633213893265225,0.5633213893265225,Charlotte,Xavier,6,6,NA,260682429,2006-03-09
84,1,6:52,1612,1612,Justin Cage missed Two Point Layup.,17,15,2,0,0.5635094262892736,0.5635094262892736,Charlotte,Xavier,6,6,NA,260682429,2006-03-09
85,1,6:52,1612,1612,Curtis Withers Defensive Rebound.,17,15,2,13,0.5635094262892736,0.5635094262892736,Charlotte,Xavier,6,6,NA,260682429,2006-03-09
86,1,6:39,1599,1599,Johnny Wolf missed Three Point Jumper.,17,15,2,0,0.5638581035199477,0.5638581035199477,Charlotte,Xavier,6,6,NA,260682429,2006-03-09
87,1,6:39,1599,1599,Chris Nance Defensive Rebound.,17,15,2,9,0.5638581035199477,0.5638581035199477,Charlotte,Xavier,6,6,NA,260682429,2006-03-09
88,1,6:30,1590,1590,Foul on BJ Raymond,17,15,2,0,0.5640996076167397,0.5640996076167397,Charlotte,Xavier,6,6,NA,260682429,2006-03-09
89,1,6:30,1590,1590,De'Angelo Alexander missed Free Throw.,17,15,2,0,0.5640996076167397,0.5640996076167397,Charlotte,Xavier,6,6,NA,260682429,2006-03-09
90,1,6:30,1590,1590,Josh Duncan Defensive Rebound.,17,15,2,10,0.5640996076167397,0.5640996076167397,Charlotte,Xavier,6,6,NA,260682429,2006-03-09
91,1,6:20,1580,1580,Josh Duncan made Two Point Jumper.,17,17,0,15,0.5,0.5,Charlotte,Xavier,6,6,NA,260682429,2006-03-09
92,1,6:05,1565,1565,Marcus Bennett made Two Point Jumper.,19,17,2,24,0.5647745423223485,0.5647745423223485,Charlotte,Xavier,6,6,NA,260682429,2006-03-09
93,1,5:41,1541,1541,Foul on Johnny Wolf,19,17,2,16,0.5654342928071666,0.5654342928071666,Charlotte,Xavier,6,6,NA,260682429,2006-03-09
94,1,5:25,1525,1525,Foul on Curtis Withers,19,17,2,15,0.5658843048578295,0.5658843048578295,Charlotte,Xavier,6,6,NA,260682429,2006-03-09
95,1,5:10,1510,1510,Justin Cage made Two Point Layup.,19,19,0,18,0.5,0.5,Charlotte,Xavier,6,6,NA,260682429,2006-03-09
96,1,4:52,1492,1492,Mitchell Baldwin missed Three Point Jumper.,19,19,0,0,0.5,0.5,Charlotte,Xavier,6,6,NA,260682429,2006-03-09
97,1,4:52,1492,1492,BJ Raymond Defensive Rebound.,19,19,0,43,0.5,0.5,Charlotte,Xavier,6,6,NA,260682429,2006-03-09
98,1,4:09,1449,1449,Marcus Bennett made Two Point Layup.,21,19,2,20,0.5682059099619238,0.5682059099619238,Charlotte,Xavier,6,6,NA,260682429,2006-03-09
99,1,3:49,1429,1429,Justin Cage made Two Point Layup.,21,21,0,24,0.5,0.5,Charlotte,Xavier,6,6,NA,260682429,2006-03-09
100,1,3:25,1405,1405,Leemire Goldwire missed Three Point Jumper.,21,21,0,0,0.5,0.5,Charlotte,Xavier,6,6,NA,260682429,2006-03-09
101,1,3:25,1405,1405,BJ Raymond Defensive Rebound.,21,21,0,14,0.5,0.5,Charlotte,Xavier,6,6,NA,260682429,2006-03-09
102,1,3:11,1391,1391,Brandon Cole made Two Point Jumper.,21,23,-2,2,0.42997720792167154,0.42997720792167154,Charlotte,Xavier,6,6,NA,260682429,2006-03-09
103,1,3:09,1389,1389,Charlotte Full Timeout.,21,23,-2,21,0.42991689574346065,0.42991689574346065,Charlotte,Xavier,5,6,NA,260682429,2006-03-09
104,1,2:48,1368,1368,De'Angelo Alexander missed Two Point Layup.,21,23,-2,0,0.4292867332288323,0.4292867332288323,Charlotte,Xavier,5,6,NA,260682429,2006-03-09
105,1,2:48,1368,1368,Courtney Williams Offensive Rebound.,21,23,-2,2,0.4292867332288323,0.4292867332288323,Charlotte,Xavier,5,6,NA,260682429,2006-03-09
106,1,2:46,1366,1366,Courtney Williams made Two Point Layup.,23,23,0,0,0.5,0.5,Charlotte,Xavier,5,6,NA,260682429,2006-03-09
107,1,2:46,1366,1366,Foul on BJ Raymond,23,23,0,0,0.5,0.5,Charlotte,Xavier,5,6,NA,260682429,2006-03-09
108,1,2:46,1366,1366,Official TV Timeout.,23,23,0,0,0.5,0.5,Charlotte,Xavier,5,6,NA,260682429,2006-03-09
109,1,2:46,1366,1366,Courtney Williams made Free Throw.,24,23,1,16,0.535565629161728,0.535565629161728,Charlotte,Xavier,5,6,NA,260682429,2006-03-09
110,1,2:30,1350,1350,Johnny Wolf made Three Point Jumper.,24,26,-2,35,0.4287464958414888,0.4287464958414888,Charlotte,Xavier,5,6,NA,260682429,2006-03-09
111,1,1:55,1315,1315,De'Angelo Alexander missed Two Point Layup.,24,26,-2,0,0.4276737416698498,0.4276737416698498,Charlotte,Xavier,5,6,NA,260682429,2006-03-09
112,1,1:55,1315,1315,De'Angelo Alexander Offensive Rebound.,24,26,-2,0,0.4276737416698498,0.4276737416698498,Charlotte,Xavier,5,6,NA,260682429,2006-03-09
113,1,1:55,1315,1315,De'Angelo Alexander made Two Point Layup.,26,26,0,31,0.5,0.5,Charlotte,Xavier,5,6,NA,260682429,2006-03-09
114,1,1:24,1284,1284,Stanley Burrell missed Three Point Jumper.,26,26,0,0,0.5,0.5,Charlotte,Xavier,5,6,NA,260682429,2006-03-09
115,1,1:24,1284,1284,Leemire Goldwire Defensive Rebound.,26,26,0,7,0.5,0.5,Charlotte,Xavier,5,6,NA,260682429,2006-03-09
116,1,1:17,1277,1277,De'Angelo Alexander missed Three Point Jumper.,26,26,0,0,0.5,0.5,Charlotte,Xavier,5,6,NA,260682429,2006-03-09
117,1,1:17,1277,1277,BJ Raymond Defensive Rebound.,26,26,0,11,0.5,0.5,Charlotte,Xavier,5,6,NA,260682429,2006-03-09
118,1,1:06,1266,1266,BJ Raymond made Three Point Jumper.,26,29,-3,12,0.3900870017298635,0.3900870017298635,Charlotte,Xavier,5,6,NA,260682429,2006-03-09
119,1,0:54,1254,1254,Foul on Johnny Wolf,26,29,-3,0,0.3894619386733619,0.3894619386733619,Charlotte,Xavier,5,6,NA,260682429,2006-03-09
120,1,0:54,1254,1254,Leemire Goldwire missed Free Throw.,26,29,-3,0,0.3894619386733619,0.3894619386733619,Charlotte,Xavier,5,6,NA,260682429,2006-03-09
121,1,0:54,1254,1254,Charlotte Defensive Rebound.,26,29,-3,0,0.3894619386733619,0.3894619386733619,Charlotte,Xavier,5,6,NA,260682429,2006-03-09
122,1,0:54,1254,1254,Leemire Goldwire made Free Throw.,27,29,-2,34,0.4256268303025821,0.4256268303025821,Charlotte,Xavier,5,6,NA,260682429,2006-03-09
123,1,0:20,1220,1220,Johnny Wolf missed Two Point Jumper.,27,29,-2,0,0.4243211588473973,0.4243211588473973,Charlotte,Xavier,5,6,NA,260682429,2006-03-09
124,1,0:20,1220,1220,Curtis Withers Defensive Rebound.,27,29,-2,18,0.4243211588473973,0.4243211588473973,Charlotte,Xavier,5,6,NA,260682429,2006-03-09
125,1,0:02,1202,1202,Curtis Withers missed Two Point Jumper.,27,29,-2,0,0.4235732994515121,0.4235732994515121,Charlotte,Xavier,5,6,NA,260682429,2006-03-09
126,1,0:02,1202,1202,Brandon Cole Defensive Rebound.,27,29,-2,2,0.4235732994515121,0.4235732994515121,Charlotte,Xavier,5,6,NA,260682429,2006-03-09
127,1,0:00,1200,1200,End of the 1st Half.,27,29,-2,0,0.4234906714856242,0.4234906714856242,Charlotte,Xavier,5,6,NA,260682429,2006-03-09
128,2,20:00,1200,1200,PLAY,27,29,-2,13,0.4234906714856242,0.4234906714856242,Charlotte,Xavier,5,6,NA,260682429,2006-03-09
129,2,19:47,1187,1187,Curtis Withers missed Two Point Jumper.,27,29,-2,0,0.4229612105251774,0.4229612105251774,Charlotte,Xavier,5,6,NA,260682429,2006-03-09
130,2,19:47,1187,1187,Curtis Withers Offensive Rebound.,27,29,-2,2,0.4229612105251774,0.4229612105251774,Charlotte,Xavier,5,6,NA,260682429,2006-03-09
131,2,19:45,1185,1185,Mitchell Baldwin missed Three Point Jumper.,27,29,-2,0,0.4228808136353794,0.4228808136353794,Charlotte,Xavier,5,6,NA,260682429,2006-03-09
132,2,19:45,1185,1185,Johnny Wolf Defensive Rebound.,27,29,-2,2,0.4228808136353794,0.4228808136353794,Charlotte,Xavier,5,6,NA,260682429,2006-03-09
133,2,19:43,1183,1183,Foul on Curtis Withers,27,29,-2,26,0.4228006687211183,0.4228006687211183,Charlotte,Xavier,5,6,NA,260682429,2006-03-09
134,2,19:17,1157,1157,Justin Doellman missed Three Point Jumper.,27,29,-2,0,0.4217768494716882,0.4217768494716882,Charlotte,Xavier,5,6,NA,260682429,2006-03-09
135,2,19:17,1157,1157,Curtis Withers Defensive Rebound.,27,29,-2,13,0.4217768494716882,0.4217768494716882,Charlotte,Xavier,5,6,NA,260682429,2006-03-09
136,2,19:04,1144,1144,De'Angelo Alexander made Two Point Jumper.,29,29,0,25,0.5,0.5,Charlotte,Xavier,5,6,NA,260682429,2006-03-09
137,2,18:39,1119,1119,Foul on Leemire Goldwire,29,29,0,7,0.5,0.5,Charlotte,Xavier,5,6,NA,260682429,2006-03-09
138,2,18:32,1112,1112,Johnny Wolf made Three Point Jumper.,29,32,-3,43,0.38131714967142194,0.38131714967142194,Charlotte,Xavier,5,6,NA,260682429,2006-03-09
139,2,17:49,1069,1069,Josh Duncan missed Three Point Jumper.,29,32,-3,0,0.3788055601482241,0.3788055601482241,Charlotte,Xavier,5,6,NA,260682429,2006-03-09
140,2,17:49,1069,1069,Mitchell Baldwin Defensive Rebound.,29,32,-3,8,0.3788055601482241,0.3788055601482241,Charlotte,Xavier,5,6,NA,260682429,2006-03-09
141,2,17:41,1061,1061,Leemire Goldwire missed Three Point Jumper.,29,32,-3,0,0.3783162528845221,0.3783162528845221,Charlotte,Xavier,5,6,NA,260682429,2006-03-09
142,2,17:41,1061,1061,Johnny Wolf Defensive Rebound.,29,32,-3,8,0.3783162528845221,0.3783162528845221,Charlotte,Xavier,5,6,NA,260682429,2006-03-09
143,2,17:33,1053,1053,Justin Doellman missed Two Point Jumper.,29,32,-3,0,0.37781763619281267,0.37781763619281267,Charlotte,Xavier,5,6,NA,260682429,2006-03-09
144,2,17:33,1053,1053,Xavier Defensive Rebound.,29,32,-3,1,0.37781763619281267,0.37781763619281267,Charlotte,Xavier,5,6,NA,260682429,2006-03-09
145,2,17:32,1052,1052,Foul on Chris Nance,29,32,-3,0,0.377754606198089,0.377754606198089,Charlotte,Xavier,5,6,NA,260682429,2006-03-09
146,2,17:32,1052,1052,Justin Doellman made Free Throw.,29,33,-4,0,0.3395157384718554,0.3395157384718554,Charlotte,Xavier,5,6,NA,260682429,2006-03-09
147,2,17:32,1052,1052,Justin Doellman made Free Throw.,29,34,-5,17,0.3032611728350201,0.3032611728350201,Charlotte,Xavier,5,6,NA,260682429,2006-03-09
148,2,17:15,1035,1035,Foul on Justin Cage,29,34,-5,20,0.3016178811548102,0.3016178811548102,Charlotte,Xavier,5,6,NA,260682429,2006-03-09
149,2,16:55,1015,1015,Curtis Withers made Two Point Dunk Shot.,31,34,-3,23,0.3752923444927443,0.3752923444927443,Charlotte,Xavier,5,6,NA,260682429,2006-03-09
150,2,16:32,992,992,Justin Cage missed Two Point Jumper.,31,34,-3,0,0.3736076979620096,0.3736076979620096,Charlotte,Xavier,5,6,NA,260682429,2006-03-09
151,2,16:32,992,992,De'Angelo Alexander Defensive Rebound.,31,34,-3,8,0.3736076979620096,0.3736076979620096,Charlotte,Xavier,5,6,NA,260682429,2006-03-09
152,2,16:24,984,984,Leemire Goldwire made Two Point Jumper.,33,34,-1,29,0.45682314413801656,0.45682314413801656,Charlotte,Xavier,5,6,NA,260682429,2006-03-09
153,2,15:55,955,955,Stanley Burrell made Three Point Jumper.,33,37,-4,30,0.33053306808202226,0.33053306808202226,Charlotte,Xavier,5,6,NA,260682429,2006-03-09
154,2,15:25,925,925,De'Angelo Alexander missed Two Point Jumper.,33,37,-4,0,0.3278611284510028,0.3278611284510028,Charlotte,Xavier,5,6,NA,260682429,2006-03-09
155,2,15:25,925,925,Chris Nance Offensive Rebound.,33,37,-4,3,0.3278611284510028,0.3278611284510028,Charlotte,Xavier,5,6,NA,260682429,2006-03-09
156,2,15:22,922,922,Chris Nance made Two Point Layup.,35,37,-2,9,0.41108030134441625,0.41108030134441625,Charlotte,Xavier,5,6,NA,260682429,2006-03-09
157,2,15:13,913,913,Stanley Burrell missed Three Point Jumper.,35,37,-2,0,0.41067877984369017,0.41067877984369017,Charlotte,Xavier,5,6,NA,260682429,2006-03-09
158,2,15:13,913,913,Stanley Burrell Offensive Rebound.,35,37,-2,6,0.41067877984369017,0.41067877984369017,Charlotte,Xavier,5,6,NA,260682429,2006-03-09
159,2,15:07,907,907,Josh Duncan missed Three Point Jumper.,35,37,-2,0,0.41041671694314114,0.41041671694314114,Charlotte,Xavier,5,6,NA,260682429,2006-03-09
160,2,15:07,907,907,Chris Nance Defensive Rebound.,35,37,-2,19,0.41041671694314114,0.41041671694314114,Charlotte,Xavier,5,6,NA,260682429,2006-03-09
161,2,14:48,888,888,Mitchell Baldwin missed Three Point Jumper.,35,37,-2,0,0.40960601235768634,0.40960601235768634,Charlotte,Xavier,5,6,NA,260682429,2006-03-09
162,2,14:48,888,888,Justin Doellman Defensive Rebound.,35,37,-2,4,0.40960601235768634,0.40960601235768634,Charlotte,Xavier,5,6,NA,260682429,2006-03-09
163,2,14:44,884,884,Foul on De'Angelo Alexander,35,37,-2,0,0.40943731814613776,0.40943731814613776,Charlotte,Xavier,5,6,NA,260682429,2006-03-09
164,2,14:44,884,884,Official TV Timeout.,35,37,-2,54,0.40943731814613776,0.40943731814613776,Charlotte,Xavier,5,6,NA,260682429,2006-03-09
165,2,13:50,830,830,De'Angelo Alexander missed Two Point Jumper.,35,37,-2,0,0.4070713337724004,0.4070713337724004,Charlotte,Xavier,5,6,NA,260682429,2006-03-09
166,2,13:50,830,830,De'Angelo Alexander Offensive Rebound.,35,37,-2,33,0.4070713337724004,0.4070713337724004,Charlotte,Xavier,5,6,NA,260682429,2006-03-09
167,2,13:17,797,797,Leemire Goldwire missed Three Point Jumper.,35,37,-2,0,0.4053758423048565,0.4053758423048565,Charlotte,Xavier,5,6,NA,260682429,2006-03-09
168,2,13:17,797,797,BJ Raymond Defensive Rebound.,35,37,-2,13,0.4053758423048565,0.4053758423048565,Charlotte,Xavier,5,6,NA,260682429,2006-03-09
169,2,13:04,784,784,Stanley Burrell made Two Point Layup.,35,39,-4,18,0.3159335254786994,0.3159335254786994,Charlotte,Xavier,5,6,NA,260682429,2006-03-09
170,2,12:46,766,766,E.J. Drayton missed Three Point Jumper.,35,39,-4,0,0.31386027871764316,0.31386027871764316,Charlotte,Xavier,5,6,NA,260682429,2006-03-09
171,2,12:46,766,766,Marcus Bennett Offensive Rebound.,35,39,-4,0,0.31386027871764316,0.31386027871764316,Charlotte,Xavier,5,6,NA,260682429,2006-03-09
172,2,12:46,766,766,Foul on BJ Raymond,35,39,-4,0,0.31386027871764316,0.31386027871764316,Charlotte,Xavier,5,6,NA,260682429,2006-03-09
173,2,12:46,766,766,Marcus Bennett missed Free Throw.,35,39,-4,0,0.31386027871764316,0.31386027871764316,Charlotte,Xavier,5,6,NA,260682429,2006-03-09
174,2,12:46,766,766,Charlotte Defensive Rebound.,35,39,-4,0,0.31386027871764316,0.31386027871764316,Charlotte,Xavier,5,6,NA,260682429,2006-03-09
175,2,12:46,766,766,Marcus Bennett made Free Throw.,36,39,-3,5,0.35741534596270264,0.35741534596270264,Charlotte,Xavier,5,6,NA,260682429,2006-03-09
176,2,12:41,761,761,Xavier Full Timeout.,36,39,-3,24,0.3569200464993685,0.3569200464993685,Charlotte,Xavier,5,5,NA,260682429,2006-03-09
177,2,12:17,737,737,Johnny Wolf missed Two Point Jumper.,36,39,-3,5,0.3543019844430286,0.3543019844430286,Charlotte,Xavier,5,5,NA,260682429,2006-03-09
178,2,12:12,732,732,De'Angelo Alexander Defensive Rebound.,36,39,-3,6,0.35370214388473203,0.35370214388473203,Charlotte,Xavier,5,5,NA,260682429,2006-03-09
