play_id,half,time_remaining_half,secs_remaining,secs_remaining_absolute,description,home_score,away_score,score_diff,play_length,win_prob,naive_win_prob,home,away,home_time_out_remaining,away_time_out_remaining,home_favored_by,game_id,date
1,1,20:00,2400,2400,PLAY,0,0,0,0,0.9945025873973982,0.5,Duke,Elon,4,4,32.4,400986320,2017-11-10
2,1,20:00,2400,2400,Jump Ball won by Duke,0,0,0,22,0.9945025873973982,0.5,Duke,Elon,4,4,32.4,400986320,2017-11-10
3,1,19:38,2378,2378,Grayson Allen made Three Point Jumper. Assisted by Gary Trent Jr..,3,0,3,23,0.9957395925889329,0.5665157592421339,Duke,Elon,4,4,32.4,400986320,2017-11-10
4,1,19:15,2355,2355,Foul on Trevon Duval.,3,0,3,9,0.9956996806527209,0.5672471343089989,Duke,Elon,4,4,32.4,400986320,2017-11-10
5,1,19:06,2346,2346,Tyler Seibring made Three Point Jumper. Assisted by Dmitri Thompson.,3,3,0,14,0.9943430915326126,0.5,Duke,Elon,4,4,32.4,400986320,2017-11-10
6,1,18:52,2332,2332,Grayson Allen made Jumper.,5,3,2,23,0.9952453808995138,0.5454821952070623,Duke,Elon,4,4,32.4,400986320,2017-11-10
7,1,18:29,2309,2309,Dainan Swoope missed Jumper.,5,3,2,0,0.9951930238964299,0.5459879404978363,Duke,Elon,4,4,32.4,400986320,2017-11-10
8,1,18:29,2309,2309,Marvin Bagley III Defensive Rebound.,5,3,2,11,0.9951930238964299,0.5459879404978363,Duke,Elon,4,4,32.4,400986320,2017-11-10
9,1,18:18,2298,2298,Foul on Wendell Carter Jr..,5,3,2,0,0.9951672015569575,0.546231860846261,Duke,Elon,4,4,32.4,400986320,2017-11-10
10,1,18:18,2298,2298,Wendell Carter Jr. Turnover.,5,3,2,18,0.9951672015569575,0.546231860846261,Duke,Elon,4,4,32.4,400986320,2017-11-10
11,1,18:00,2280,2280,Tyler Seibring missed Three Point Jumper.,5,3,2,0,0.9951238086571157,0.5466336154648032,Duke,Elon,4,4,32.4,400986320,2017-11-10
12,1,18:00,2280,2280,Duke Defensive Rebound.,5,3,2,14,0.9951238086571157,0.5466336154648032,Duke,Elon,4,4,32.4,400986320,2017-11-10
13,1,17:46,2266,2266,Grayson Allen made Three Point Jumper.,8,3,5,16,0.9962932477785367,0.6155893500432424,Duke,Elon,4,4,32.4,400986320,2017-11-10
14,1,17:30,2250,2250,Brian Dawkins missed Jumper.,8,3,5,0,0.9962705152471726,0.6164521127449056,Duke,Elon,4,4,32.4,400986320,2017-11-10
15,1,17:30,2250,2250,Marvin Bagley III Defensive Rebound.,8,3,5,6,0.9962705152471726,0.6164521127449056,Duke,Elon,4,4,32.4,400986320,2017-11-10
16,1,17:24,2244,2244,Marvin Bagley III missed Three Point Jumper.,8,3,5,0,0.9962617922697278,0.6167767158996416,Duke,Elon,4,4,32.4,400986320,2017-11-10
17,1,17:24,2244,2244,Wendell Carter Jr. Offensive Rebound.,8,3,5,6,0.9962617922697278,0.6167767158996416,Duke,Elon,4,4,32.4,400986320,2017-11-10
18,1,17:18,2238,2238,Wendell Carter Jr. missed Layup.,8,3,5,0,0.9962529583488334,0.6171018578559682,Duke,Elon,4,4,32.4,400986320,2017-11-10
19,1,17:18,2238,2238,Wendell Carter Jr. Offensive Rebound.,8,3,5,6,0.9962529583488334,0.6171018578559682,Duke,Elon,4,4,32.4,400986320,2017-11-10
20,1,17:12,2232,2232,Wendell Carter Jr. made Layup.,10,3,7,8,0.9968964434580043,0.6615257585504299,Duke,Elon,4,4,32.4,400986320,2017-11-10
21,1,17:04,2224,2224,Foul on Wendell Carter Jr..,10,3,7,5,0.9968887183015827,0.6621028623683558,Duke,Elon,4,4,32.4,400986320,2017-11-10
22,1,16:59,2219,2219,Dainan Swoope missed Three Point Jumper.,10,3,7,0,0.9968838122213163,0.6624639744653497,Duke,Elon,4,4,32.4,400986320,2017-11-10
23,1,16:59,2219,2219,Elon Offensive Rebound.,10,3,7,11,0.9968838122213163,0.6624639744653497,Duke,Elon,4,4,32.4,400986320,2017-11-10
24,1,16:48,2208,2208,Dmitri Thompson missed Jumper.,10,3,7,0,0.9968728030226481,0.6632594418819413,Duke,Elon,4,4,32.4,400986320,2017-11-10
25,1,16:48,2208,2208,Javin DeLaurier Defensive Rebound.,10,3,7,5,0.9968728030226481,0.6632594418819413,Duke,Elon,4,4,32.4,400986320,2017-11-10
26,1,16:43,2203,2203,Gary Trent Jr. made Three Point Jumper. Assisted by Trevon Duval.,13,3,10,22,0.9976571779812415,0.7252546296241166,Duke,Elon,4,4,32.4,400986320,2017-11-10
27,1,16:21,2181,2181,Tyler Seibring missed Jumper.,13,3,10,0,0.9976469979686707,0.7272865006681771,Duke,Elon,4,4,32.4,400986320,2017-11-10
28,1,16:21,2181,2181,Javin DeLaurier Defensive Rebound.,13,3,10,12,0.9976469979686707,0.7272865006681771,Duke,Elon,4,4,32.4,400986320,2017-11-10
29,1,16:09,2169,2169,Javin DeLaurier missed Three Point Jumper.,13,3,10,0,0.9976410840167411,0.728394395809115,Duke,Elon,4,4,32.4,400986320,2017-11-10
30,1,16:09,2169,2169,Steven Santa Ana Defensive Rebound.,13,3,10,21,0.9976410840167411,0.728394395809115,Duke,Elon,4,4,32.4,400986320,2017-11-10
31,1,15:48,2148,2148,Dainan Swoope missed Jumper.,13,3,10,0,0.997630171036227,0.730335355535361,Duke,Elon,4,4,32.4,400986320,2017-11-10
32,1,15:48,2148,2148,Marvin Bagley III Defensive Rebound.,13,3,10,8,0.997630171036227,0.730335355535361,Duke,Elon,4,4,32.4,400986320,2017-11-10
33,1,15:40,2140,2140,Javin DeLaurier made Dunk. Assisted by Trevon Duval.,15,3,12,30,0.9980553985397321,0.7685438705163049,Duke,Elon,4,4,32.4,400986320,2017-11-10
34,1,15:10,2110,2110,Brian Dawkins missed Three Point Jumper.,15,3,12,0,0.9980469493951003,0.7715648916589817,Duke,Elon,4,4,32.4,400986320,2017-11-10
35,1,15:10,2110,2110,Elon Offensive Rebound.,15,3,12,6,0.9980469493951003,0.7715648916589817,Duke,Elon,4,4,32.4,400986320,2017-11-10
36,1,15:04,2104,2104,Official TV Timeout,15,3,12,10,0.9980451484731746,0.772169984464453,Duke,Elon,4,4,32.4,400986320,2017-11-10
37,1,14:54,2094,2094,Tyler Seibring missed Three Point Jumper.,15,3,12,0,0.9980420677065318,0.773179260499241,Duke,Elon,4,4,32.4,400986320,2017-11-10
38,1,14:54,2094,2094,Javin DeLaurier Block.,15,3,12,0,0.9980420677065318,0.773179260499241,Duke,Elon,4,4,32.4,400986320,2017-11-10
39,1,14:54,2094,2094,Grayson Allen Defensive Rebound.,15,3,12,8,0.9980420677065318,0.773179260499241,Duke,Elon,4,4,32.4,400986320,2017-11-10
40,1,14:46,2086,2086,Grayson Allen missed Three Point Jumper.,15,3,12,0,0.9980395332255942,0.7739874500396217,Duke,Elon,4,4,32.4,400986320,2017-11-10
41,1,14:46,2086,2086,Dmitri Thompson Defensive Rebound.,15,3,12,7,0.9980395332255942,0.7739874500396217,Duke,Elon,4,4,32.4,400986320,2017-11-10
42,1,14:39,2079,2079,Dmitri Thompson missed Layup.,15,3,12,0,0.9980372657044725,0.7746952209440282,Duke,Elon,4,4,32.4,400986320,2017-11-10
43,1,14:39,2079,2079,Antonio Vrankovic Defensive Rebound.,15,3,12,23,0.9980372657044725,0.7746952209440282,Duke,Elon,4,4,32.4,400986320,2017-11-10
44,1,14:16,2056,2056,Gary Trent Jr. made Three Point Jumper. Assisted by Javin DeLaurier.,18,3,15,21,0.9985570163281127,0.826427565714428,Duke,Elon,4,4,32.4,400986320,2017-11-10
45,1,13:55,2035,2035,Steven Santa Ana Turnover.,18,3,15,5,0.998555986441743,0.8286325058303459,Duke,Elon,4,4,32.4,400986320,2017-11-10
46,1,13:50,2030,2030,Gary Trent Jr. missed Three Point Jumper.,18,3,15,0,0.9985557113530806,0.8291575037323857,Duke,Elon,4,4,32.4,400986320,2017-11-10
47,1,13:50,2030,2030,Marvin Bagley III Offensive Rebound.,18,3,15,8,0.9985557113530806,0.8291575037323857,Duke,Elon,4,4,32.4,400986320,2017-11-10
48,1,13:42,2022,2022,Marvin Bagley III made Jumper.,20,3,17,11,0.9988302408619804,0.8577863566395016,Duke,Elon,4,4,32.4,400986320,2017-11-10
49,1,13:31,2011,2011,Foul on Jordan Goldwire.,20,3,17,0,0.9988309695960584,0.8589175927015694,Duke,Elon,4,4,32.4,400986320,2017-11-10
50,1,13:31,2011,2011,Dainan Swoope made Free Throw.,20,4,16,0,0.9987000857753809,0.8455444228256516,Duke,Elon,4,4,32.4,400986320,2017-11-10
51,1,13:31,2011,2011,Dainan Swoope made Free Throw.,20,5,15,9,0.9985545694999595,0.831152807523099,Duke,Elon,4,4,32.4,400986320,2017-11-10
52,1,13:22,2002,2002,Grayson Allen missed Layup.,20,5,15,0,0.998553978642253,0.8320982275853768,Duke,Elon,4,4,32.4,400986320,2017-11-10
53,1,13:22,2002,2002,Tyler Seibring Defensive Rebound.,20,5,15,9,0.998553978642253,0.8320982275853768,Duke,Elon,4,4,32.4,400986320,2017-11-10
54,1,13:13,1993,1993,Sheldon Eberhardt missed Three Point Jumper.,20,5,15,0,0.9985533580760441,0.8330438971223513,Duke,Elon,4,4,32.4,400986320,2017-11-10
55,1,13:13,1993,1993,Marvin Bagley III Defensive Rebound.,20,5,15,8,0.9985533580760441,0.8330438971223513,Duke,Elon,4,4,32.4,400986320,2017-11-10
56,1,13:05,1985,1985,Jack White missed Three Point Jumper.,20,5,15,0,0.998552782950738,0.8338847422843272,Duke,Elon,4,4,32.4,400986320,2017-11-10
57,1,13:05,1985,1985,Dainan Swoope Defensive Rebound.,20,5,15,14,0.998552782950738,0.8338847422843272,Duke,Elon,4,4,32.4,400986320,2017-11-10
58,1,12:51,1971,1971,Karolis Kundrotas made Three Point Jumper.,20,8,12,15,0.9979970284232312,0.7857109417963185,Duke,Elon,4,4,32.4,400986320,2017-11-10
59,1,12:36,1956,1956,Marvin Bagley III missed Three Point Jumper.,20,8,12,0,0.9979907623076321,0.7872586681614123,Duke,Elon,4,4,32.4,400986320,2017-11-10
60,1,12:36,1956,1956,Grayson Allen Offensive Rebound.,20,8,12,0,0.9979907623076321,0.7872586681614123,Duke,Elon,4,4,32.4,400986320,2017-11-10
61,1,12:36,1956,1956,Grayson Allen missed Two Point Tip Shot.,20,8,12,0,0.9979907623076321,0.7872586681614123,Duke,Elon,4,4,32.4,400986320,2017-11-10
62,1,12:36,1956,1956,Sheldon Eberhardt Defensive Rebound.,20,8,12,8,0.9979907623076321,0.7872586681614123,Duke,Elon,4,4,32.4,400986320,2017-11-10
63,1,12:28,1948,1948,Sheldon Eberhardt Turnover.,20,8,12,0,0.9979873633259978,0.7880862198726615,Duke,Elon,4,4,32.4,400986320,2017-11-10
64,1,12:28,1948,1948,Javin DeLaurier Steal.,20,8,12,12,0.9979873633259978,0.7880862198726615,Duke,Elon,4,4,32.4,400986320,2017-11-10
65,1,12:16,1936,1936,Jack White missed Three Point Jumper.,20,8,12,0,0.9979821941924706,0.7893303863865717,Duke,Elon,4,4,32.4,400986320,2017-11-10
66,1,12:16,1936,1936,Sheldon Eberhardt Defensive Rebound.,20,8,12,13,0.9979821941924706,0.7893303863865717,Duke,Elon,4,4,32.4,400986320,2017-11-10
67,1,12:03,1923,1923,Dainan Swoope missed Three Point Jumper.,20,8,12,0,0.9979764632079364,0.7906801920616684,Duke,Elon,4,4,32.4,400986320,2017-11-10
68,1,12:03,1923,1923,Gary Trent Jr. Defensive Rebound.,20,8,12,11,0.9979764632079364,0.7906801920616684,Duke,Elon,4,4,32.4,400986320,2017-11-10
69,1,11:52,1912,1912,Foul on Dainan Swoope.,20,8,12,0,0.9979713573783011,0.7918164170972086,Duke,Elon,4,4,32.4,400986320,2017-11-10
70,1,11:52,1912,1912,Official TV Timeout,20,8,12,0,0.9979713573783011,0.7918164170972086,Duke,Elon,4,4,32.4,400986320,2017-11-10
71,1,11:52,1912,1912,Marvin Bagley III missed Free Throw.,20,8,12,0,0.9979713573783011,0.7918164170972086,Duke,Elon,4,4,32.4,400986320,2017-11-10
72,1,11:52,1912,1912,Duke Deadball Team Rebound.,20,8,12,0,0.9979713573783011,0.7918164170972086,Duke,Elon,4,4,32.4,400986320,2017-11-10
73,1,11:52,1912,1912,Marvin Bagley III missed Free Throw.,20,8,12,0,0.9979713573783011,0.7918164170972086,Duke,Elon,4,4,32.4,400986320,2017-11-10
74,1,11:52,1912,1912,Karolis Kundrotas Defensive Rebound.,20,8,12,16,0.9979713573783011,0.7918164170972086,Duke,Elon,4,4,32.4,400986320,2017-11-10
75,1,11:36,1896,1896,Simon Wright missed Layup.,20,8,12,0,0.9979635000991532,0.7934591337537362,Duke,Elon,4,4,32.4,400986320,2017-11-10
76,1,11:36,1896,1896,Marvin Bagley III Defensive Rebound.,20,8,12,8,0.9979635000991532,0.7934591337537362,Duke,Elon,4,4,32.4,400986320,2017-11-10
77,1,11:28,1888,1888,Grayson Allen missed Layup.,20,8,12,0,0.9979593921896862,0.7942767546586641,Duke,Elon,4,4,32.4,400986320,2017-11-10
78,1,11:28,1888,1888,Karolis Kundrotas Block.,20,8,12,0,0.9979593921896862,0.7942767546586641,Duke,Elon,4,4,32.4,400986320,2017-11-10
79,1,11:28,1888,1888,Gary Trent Jr. Offensive Rebound.,20,8,12,6,0.9979593921896862,0.7942767546586641,Duke,Elon,4,4,32.4,400986320,2017-11-10
80,1,11:22,1882,1882,Foul on Simon Wright.,20,8,12,1,0.9979562373992052,0.7948885922554423,Duke,Elon,4,4,32.4,400986320,2017-11-10
81,1,11:21,1881,1881,Wendell Carter Jr. made Layup. Assisted by Trevon Duval.,22,8,14,13,0.9983683575387585,0.8293676838172646,Duke,Elon,4,4,32.4,400986320,2017-11-10
82,1,11:08,1868,1868,Brian Dawkins missed Three Point Jumper.,22,8,14,0,0.998364932823138,0.8307058732948736,Duke,Elon,4,4,32.4,400986320,2017-11-10
83,1,11:08,1868,1868,Gary Trent Jr. Defensive Rebound.,22,8,14,7,0.998364932823138,0.8307058732948736,Duke,Elon,4,4,32.4,400986320,2017-11-10
84,1,11:01,1861,1861,Marvin Bagley III made Dunk. Assisted by Trevon Duval.,24,8,16,3,0.9986962709328993,0.8610117496957669,Duke,Elon,4,4,32.4,400986320,2017-11-10
85,1,10:58,1858,1858,Elon  Timeout,24,8,16,24,0.9986960097934938,0.8613116359413246,Duke,Elon,3,4,32.4,400986320,2017-11-10
86,1,10:34,1834,1834,Brian Dawkins made Three Point Jumper. Assisted by Tyler Seibring.,24,11,13,14,0.9981543127131416,0.8176001709786451,Duke,Elon,3,4,32.4,400986320,2017-11-10
87,1,10:20,1820,1820,Gary Trent Jr. missed Jumper.,24,11,13,0,0.9981481086359134,0.8190287399255037,Duke,Elon,3,4,32.4,400986320,2017-11-10
88,1,10:20,1820,1820,Steven Santa Ana Defensive Rebound.,24,11,13,6,0.9981481086359134,0.8190287399255037,Duke,Elon,3,4,32.4,400986320,2017-11-10
89,1,10:14,1814,1814,Foul on Wendell Carter Jr..,24,11,13,10,0.9981454011312934,0.8196409589600314,Duke,Elon,3,4,32.4,400986320,2017-11-10
90,1,10:04,1804,1804,Dainan Swoope made Three Point Jumper. Assisted by Dmitri Thompson.,24,14,10,25,0.9973612382991541,0.7631223752986436,Duke,Elon,3,4,32.4,400986320,2017-11-10
91,1,9:39,1779,1779,Marvin Bagley III missed Jumper.,24,14,10,0,0.997334003324403,0.7655434761116233,Duke,Elon,3,4,32.4,400986320,2017-11-10
92,1,9:39,1779,1779,Brian Dawkins Defensive Rebound.,24,14,10,22,0.997334003324403,0.7655434761116233,Duke,Elon,3,4,32.4,400986320,2017-11-10
93,1,9:17,1757,1757,Steven Santa Ana missed Jumper.,24,14,10,0,0.997309499325335,0.7676932447362222,Duke,Elon,3,4,32.4,400986320,2017-11-10
94,1,9:17,1757,1757,Grayson Allen Defensive Rebound.,24,14,10,23,0.997309499325335,0.7676932447362222,Duke,Elon,3,4,32.4,400986320,2017-11-10
95,1,8:54,1734,1734,Marvin Bagley III missed Jumper.,24,14,10,0,0.9972835082970581,0.7699659040284182,Duke,Elon,3,4,32.4,400986320,2017-11-10
96,1,8:54,1734,1734,Javin DeLaurier Offensive Rebound.,24,14,10,2,0.9972835082970581,0.7699659040284182,Duke,Elon,3,4,32.4,400986320,2017-11-10
97,1,8:52,1732,1732,Javin DeLaurier missed Layup.,24,14,10,0,0.9972812356794941,0.7701649309124807,Duke,Elon,3,4,32.4,400986320,2017-11-10
98,1,8:52,1732,1732,Marvin Bagley III Offensive Rebound.,24,14,10,0,0.9972812356794941,0.7701649309124807,Duke,Elon,3,4,32.4,400986320,2017-11-10
99,1,8:52,1732,1732,Marvin Bagley III made Layup.,26,14,12,0,0.9978640464669656,0.8101663250784418,Duke,Elon,3,4,32.4,400986320,2017-11-10
100,1,8:52,1732,1732,Foul on Tyler Seibring.,26,14,12,0,0.9978640464669656,0.8101663250784418,Duke,Elon,3,4,32.4,400986320,2017-11-10
101,1,8:52,1732,1732,Marvin Bagley III missed Free Throw.,26,14,12,0,0.9978640464669656,0.8101663250784418,Duke,Elon,3,4,32.4,400986320,2017-11-10
102,1,8:52,1732,1732,Javin DeLaurier Offensive Rebound.,26,14,12,3,0.9978640464669656,0.8101663250784418,Duke,Elon,3,4,32.4,400986320,2017-11-10
103,1,8:49,1729,1729,Javin DeLaurier missed Layup.,26,14,12,0,0.997862085716446,0.8104780109755825,Duke,Elon,3,4,32.4,400986320,2017-11-10
104,1,8:49,1729,1729,Tyler Seibring Defensive Rebound.,26,14,12,16,0.997862085716446,0.8104780109755825,Duke,Elon,3,4,32.4,400986320,2017-11-10
105,1,8:33,1713,1713,Dainan Swoope missed Layup.,26,14,12,0,0.9978516579564052,0.8121486065440834,Duke,Elon,3,4,32.4,400986320,2017-11-10
106,1,8:33,1713,1713,Javin DeLaurier Defensive Rebound.,26,14,12,5,0.9978516579564052,0.8121486065440834,Duke,Elon,3,4,32.4,400986320,2017-11-10
107,1,8:28,1708,1708,Grayson Allen made Three Point Jumper. Assisted by Jordan Goldwire.,29,14,15,10,0.9985081808190566,0.8622787854190216,Duke,Elon,3,4,32.4,400986320,2017-11-10
108,1,8:18,1698,1698,Foul on Jordan Goldwire.,29,14,15,23,0.9985062951935937,0.8633064067216074,Duke,Elon,3,4,32.4,400986320,2017-11-10
109,1,7:55,1675,1675,Karolis Kundrotas Turnover.,29,14,15,0,0.9985016599604644,0.8656566255241094,Duke,Elon,3,4,32.4,400986320,2017-11-10
110,1,7:55,1675,1675,Official TV Timeout,29,14,15,11,0.9985016599604644,0.8656566255241094,Duke,Elon,3,4,32.4,400986320,2017-11-10
111,1,7:44,1664,1664,Marvin Bagley III missed Jumper.,29,14,15,0,0.9984987300421342,0.8667457156840821,Duke,Elon,3,4,32.4,400986320,2017-11-10
112,1,7:44,1664,1664,Alex O'Connell Offensive Rebound.,29,14,15,15,0.9984987300421342,0.8667457156840821,Duke,Elon,3,4,32.4,400986320,2017-11-10
113,1,7:29,1649,1649,Grayson Allen made Three Point Jumper. Assisted by Javin DeLaurier.,32,14,18,25,0.9989665557219026,0.9056917447458886,Duke,Elon,3,4,32.4,400986320,2017-11-10
114,1,7:04,1624,1624,Dmitri Thompson made Jumper.,32,16,16,13,0.9986651921205502,0.8842028325159542,Duke,Elon,3,4,32.4,400986320,2017-11-10
115,1,6:51,1611,1611,Grayson Allen made Three Point Jumper. Assisted by Jordan Goldwire.,35,16,19,16,0.9990871427132644,0.9189004755703926,Duke,Elon,3,4,32.4,400986320,2017-11-10
116,1,6:35,1595,1595,Dmitri Thompson missed Three Point Jumper.,35,16,19,0,0.9990860407933846,0.9201272519099943,Duke,Elon,3,4,32.4,400986320,2017-11-10
117,1,6:35,1595,1595,Alex O'Connell Defensive Rebound.,35,16,19,9,0.9990860407933846,0.9201272519099943,Duke,Elon,3,4,32.4,400986320,2017-11-10
118,1,6:26,1586,1586,Grayson Allen missed Three Point Jumper.,35,16,19,0,0.9990853459635037,0.9208108377953269,Duke,Elon,3,4,32.4,400986320,2017-11-10
119,1,6:26,1586,1586,Sheldon Eberhardt Defensive Rebound.,35,16,19,17,0.9990853459635037,0.9208108377953269,Duke,Elon,3,4,32.4,400986320,2017-11-10
120,1,6:09,1569,1569,Sheldon Eberhardt made Jumper.,35,18,17,21,0.9988121536998353,0.9012351576727331,Duke,Elon,3,4,32.4,400986320,2017-11-10
121,1,5:48,1548,1548,Grayson Allen missed Jumper.,35,18,17,0,0.9988072444199505,0.9029889868240183,Duke,Elon,3,4,32.4,400986320,2017-11-10
122,1,5:48,1548,1548,Karolis Kundrotas Defensive Rebound.,35,18,17,14,0.9988072444199505,0.9029889868240183,Duke,Elon,3,4,32.4,400986320,2017-11-10
123,1,5:34,1534,1534,Karolis Kundrotas made Layup. Assisted by Tyler Seibring.,35,20,15,19,0.998443313684641,0.8787158798913649,Duke,Elon,3,4,32.4,400986320,2017-11-10
124,1,5:15,1515,1515,Jordan Goldwire missed Three Point Jumper.,35,20,15,0,0.9984348736475127,0.8804647672802166,Duke,Elon,3,4,32.4,400986320,2017-11-10
125,1,5:15,1515,1515,Karolis Kundrotas Defensive Rebound.,35,20,15,8,0.9984348736475127,0.8804647672802166,Duke,Elon,3,4,32.4,400986320,2017-11-10
126,1,5:07,1507,1507,Dainan Swoope missed Three Point Jumper.,35,20,15,0,0.9984315190289796,0.8812103911544515,Duke,Elon,3,4,32.4,400986320,2017-11-10
127,1,5:07,1507,1507,Alex O'Connell Defensive Rebound.,35,20,15,8,0.9984315190289796,0.8812103911544515,Duke,Elon,3,4,32.4,400986320,2017-11-10
128,1,4:59,1499,1499,Duke  Timeout,35,20,15,17,0.9984283134480171,0.8819625811304199,Duke,Elon,3,3,32.4,400986320,2017-11-10
129,1,4:42,1482,1482,Trevon Duval missed Three Point Jumper.,35,20,15,0,0.9984220946401564,0.8835860289873287,Duke,Elon,3,3,32.4,400986320,2017-11-10
130,1,4:42,1482,1482,Brian Dawkins Defensive Rebound.,35,20,15,3,0.9984220946401564,0.8835860289873287,Duke,Elon,3,3,32.4,400986320,2017-11-10
131,1,4:39,1479,1479,Foul on Marvin Bagley III.,35,20,15,0,0.9984210927523991,0.8838764308017188,Duke,Elon,3,3,32.4,400986320,2017-11-10
132,1,4:39,1479,1479,Brian Dawkins missed Free Throw.,35,20,15,0,0.9984210927523991,0.8838764308017188,Duke,Elon,3,3,32.4,400986320,2017-11-10
133,1,4:39,1479,1479,Antonio Vrankovic Defensive Rebound.,35,20,15,23,0.9984210927523991,0.8838764308017188,Duke,Elon,3,3,32.4,400986320,2017-11-10
134,1,4:16,1456,1456,Gary Trent Jr. missed Jumper.,35,20,15,0,0.998414545700712,0.8861472759743919,Duke,Elon,3,3,32.4,400986320,2017-11-10
135,1,4:16,1456,1456,Sheldon Eberhardt Defensive Rebound.,35,20,15,7,0.998414545700712,0.8861472759743919,Duke,Elon,3,3,32.4,400986320,2017-11-10
136,1,4:09,1449,1449,Dainan Swoope Turnover.,35,20,15,0,0.9984129952707202,0.8868551485859814,Duke,Elon,3,3,32.4,400986320,2017-11-10
137,1,4:09,1449,1449,Trevon Duval Steal.,35,20,15,6,0.9984129952707202,0.8868551485859814,Duke,Elon,3,3,32.4,400986320,2017-11-10
138,1,4:03,1443,1443,Trevon Duval made Layup.,37,20,17,15,0.9987934483436046,0.9121652988943179,Duke,Elon,3,3,32.4,400986320,2017-11-10
139,1,3:48,1428,1428,Brian Dawkins made Layup.,37,22,15,20,0.9984073534810608,0.8889181908786797,Duke,Elon,3,3,32.4,400986320,2017-11-10
140,1,3:28,1408,1408,Marvin Bagley III Turnover.,37,22,15,0,0.9984001776830875,0.890783452388263,Duke,Elon,3,3,32.4,400986320,2017-11-10
141,1,3:28,1408,1408,Official TV Timeout,37,22,15,9,0.9984001776830875,0.890783452388263,Duke,Elon,3,3,32.4,400986320,2017-11-10
142,1,3:19,1399,1399,Steven Santa Ana missed Layup.,37,22,15,0,0.9983964936238336,0.8915982440880218,Duke,Elon,3,3,32.4,400986320,2017-11-10
143,1,3:19,1399,1399,Gary Trent Jr. Defensive Rebound.,37,22,15,6,0.9983964936238336,0.8915982440880218,Duke,Elon,3,3,32.4,400986320,2017-11-10
144,1,3:13,1393,1393,Grayson Allen missed Three Point Jumper.,37,22,15,0,0.9983939095828496,0.8921346115215646,Duke,Elon,3,3,32.4,400986320,2017-11-10
145,1,3:13,1393,1393,Javin DeLaurier Offensive Rebound.,37,22,15,19,0.9983939095828496,0.8921346115215646,Duke,Elon,3,3,32.4,400986320,2017-11-10
146,1,2:54,1374,1374,Trevon Duval made Layup.,39,22,17,3,0.9987839820564304,0.9179068362262787,Duke,Elon,3,3,32.4,400986320,2017-11-10
147,1,2:51,1371,1371,Dainan Swoope Turnover.,39,22,17,0,0.9987833498879041,0.9181414439476184,Duke,Elon,3,3,32.4,400986320,2017-11-10
148,1,2:51,1371,1371,Grayson Allen Steal.,39,22,17,5,0.9987833498879041,0.9181414439476184,Duke,Elon,3,3,32.4,400986320,2017-11-10
149,1,2:46,1366,1366,Grayson Allen made Layup.,41,22,19,13,0.9990839862812615,0.9374712966348722,Duke,Elon,3,3,32.4,400986320,2017-11-10
150,1,2:33,1353,1353,Sheldon Eberhardt missed Three Point Jumper.,41,22,19,0,0.9990833094702223,0.9383521071991067,Duke,Elon,3,3,32.4,400986320,2017-11-10
151,1,2:33,1353,1353,Marvin Bagley III Defensive Rebound.,41,22,19,21,0.9990833094702223,0.9383521071991067,Duke,Elon,3,3,32.4,400986320,2017-11-10
152,1,2:12,1332,1332,Gary Trent Jr. missed Jumper.,41,22,19,0,0.9990822895399438,0.9397652324809695,Duke,Elon,3,3,32.4,400986320,2017-11-10
153,1,2:12,1332,1332,Sheldon Eberhardt Defensive Rebound.,41,22,19,7,0.9990822895399438,0.9397652324809695,Duke,Elon,3,3,32.4,400986320,2017-11-10
154,1,2:05,1325,1325,Foul on Grayson Allen.,41,22,19,0,0.9990820235112182,0.9402363277452395,Duke,Elon,3,3,32.4,400986320,2017-11-10
155,1,2:05,1325,1325,Sheldon Eberhardt missed Free Throw.,41,22,19,0,0.9990820235112182,0.9402363277452395,Duke,Elon,3,3,32.4,400986320,2017-11-10
156,1,2:05,1325,1325,Elon Deadball Team Rebound.,41,22,19,0,0.9990820235112182,0.9402363277452395,Duke,Elon,3,3,32.4,400986320,2017-11-10
157,1,2:05,1325,1325,Sheldon Eberhardt missed Free Throw.,41,22,19,0,0.9990820235112182,0.9402363277452395,Duke,Elon,3,3,32.4,400986320,2017-11-10
158,1,2:05,1325,1325,Grayson Allen Defensive Rebound.,41,22,19,18,0.9990820235112182,0.9402363277452395,Duke,Elon,3,3,32.4,400986320,2017-11-10
159,1,1:47,1307,1307,Foul on Brian Dawkins.,41,22,19,21,0.9990816480888784,0.9414544069078107,Duke,Elon,3,3,32.4,400986320,2017-11-10
160,1,1:26,1286,1286,Duke  Turnover.,41,22,19,12,0.9990820243563429,0.9428987011362026,Duke,Elon,3,3,32.4,400986320,2017-11-10
161,1,1:14,1274,1274,Tyler Seibring missed Jumper.,41,22,19,0,0.9990827677543852,0.9437406959270415,Duke,Elon,3,3,32.4,400986320,2017-11-10
162,1,1:14,1274,1274,Javin DeLaurier Defensive Rebound.,41,22,19,12,0.9990827677543852,0.9437406959270415,Duke,Elon,3,3,32.4,400986320,2017-11-10
163,1,1:02,1262,1262,Marvin Bagley III made Jumper.,43,22,21,17,0.9993202451628271,0.9583010260656903,Duke,Elon,3,3,32.4,400986320,2017-11-10
164,1,0:45,1245,1245,Dmitri Thompson made Three Point Jumper. Assisted by Tyler Seibring.,43,25,18,35,0.9989384086177061,0.9375940928006254,Duke,Elon,3,3,32.4,400986320,2017-11-10
165,1,0:10,1210,1210,Marvin Bagley III made Dunk. Assisted by Trevon Duval.,45,25,20,9,0.999224677867611,0.9555335910360512,Duke,Elon,3,3,32.4,400986320,2017-11-10
166,1,0:01,1201,1201,Tyler Seibring missed Three Point Jumper.,45,25,20,0,0.9992280071405386,0.9561822652880921,Duke,Elon,3,3,32.4,400986320,2017-11-10
167,1,0:01,1201,1201,Duke Defensive Rebound.,45,25,20,1,0.9992280071405386,0.9561822652880921,Duke,Elon,3,3,32.4,400986320,2017-11-10
168,1,0:00,1200,1200,End of 1st half,45,25,20,0,0.9992283650631666,0.9562530359229152,Duke,Elon,3,3,32.4,400986320,2017-11-10
169,2,20:00,1200,1200,PLAY,45,25,20,0,0.9992283650631666,0.9562530359229152,Duke,Elon,4,4,32.4,400986320,2017-11-10
170,2,20:00,1200,1200,Jump Ball won by Elon,45,25,20,5,0.9992283650631666,0.9562530359229152,Duke,Elon,4,4,32.4,400986320,2017-11-10
171,2,19:55,1195,1195,Dainan Swoope missed Three Point Jumper.,45,25,20,0,0.9992301215785795,0.9566032096871918,Duke,Elon,4,4,32.4,400986320,2017-11-10
172,2,19:55,1195,1195,Wendell Carter Jr. Defensive Rebound.,45,25,20,8,0.9992301215785795,0.9566032096871918,Duke,Elon,4,4,32.4,400986320,2017-11-10
173,2,19:47,1187,1187,Gary Trent Jr. made Three Point Jumper. Assisted by Trevon Duval.,48,25,23,15,0.9995184282512258,0.9726746203256581,Duke,Elon,4,4,32.4,400986320,2017-11-10
174,2,19:32,1172,1172,Dmitri Thompson missed Jumper.,48,25,23,0,0.9995231840967227,0.973412934484018,Duke,Elon,4,4,32.4,400986320,2017-11-10
175,2,19:32,1172,1172,Wendell Carter Jr. Defensive Rebound.,48,25,23,14,0.9995231840967227,0.973412934484018,Duke,Elon,4,4,32.4,400986320,2017-11-10
176,2,19:18,1158,1158,Trevon Duval missed Jumper.,48,25,23,0,0.9995274156929786,0.9740736088979329,Duke,Elon,4,4,32.4,400986320,2017-11-10
177,2,19:18,1158,1158,Tyler Seibring Defensive Rebound.,48,25,23,13,0.9995274156929786,0.9740736088979329,Duke,Elon,4,4,32.4,400986320,2017-11-10
178,2,19:05,1145,1145,Brian Dawkins missed Layup.,48,25,23,0,0.9995312324130392,0.9746673717488934,Duke,Elon,4,4,32.4,400986320,2017-11-10
179,2,19:05,1145,1145,Wendell Carter Jr. Block.,48,25,23,0,0.9995312324130392,0.9746673717488934,Duke,Elon,4,4,32.4,400986320,2017-11-10
