play_id,half,time_remaining_half,secs_remaining,secs_remaining_absolute,description,home_score,away_score,score_diff,play_length,win_prob,naive_win_prob,home,away,home_time_out_remaining,away_time_out_remaining,home_favored_by,game_id,date
173,2,13:32,812,812,Jordan Miller Defensive Rebound.,56,24,32,6,0.9977086323719122,0.9977086323719122,Davidson,Furman,4,2,NA,280472166,2008-02-16
174,2,13:26,806,806,Jason Richards missed Two Point Jumper.,56,24,32,0,0.9977558603835753,0.9977558603835753,Davidson,Furman,4,2,NA,280472166,2008-02-16
175,2,13:26,806,806,Tony Anderson Defensive Rebound.,56,24,32,14,0.9977558603835753,0.9977558603835753,Davidson,Furman,4,2,NA,280472166,2008-02-16
176,2,13:12,792,792,Jason Richards Steal.,56,24,32,2,0.9978683681861834,0.9978683681861834,Davidson,Furman,4,2,NA,280472166,2008-02-16
177,2,13:10,790,790,Jason Richards missed Two Point Layup.,56,24,32,3,0.9978847237200897,0.9978847237200897,Davidson,Furman,4,2,NA,280472166,2008-02-16
178,2,13:07,787,787,Jordan Miller Defensive Rebound.,56,24,32,13,0.9979093950658062,0.9979093950658062,Davidson,Furman,4,2,NA,280472166,2008-02-16
179,2,12:54,774,774,Foul on Jason Richards,56,24,32,17,0.9980182497149166,0.9980182497149166,Davidson,Furman,4,2,NA,280472166,2008-02-16
180,2,12:37,757,757,Alex Opacic made Two Point Jumper.  Assisted by Jordan Miller.,56,26,30,10,0.9972825907439598,0.9972825907439598,Davidson,Furman,4,2,NA,280472166,2008-02-16
181,2,12:27,747,747,William Archambault made Two Point Layup.,58,26,32,11,0.9982541323819615,0.9982541323819615,Davidson,Furman,4,2,NA,280472166,2008-02-16
182,2,12:16,736,736,Foul on Stephen Rossiter,58,26,32,0,0.9983535149490275,0.9983535149490275,Davidson,Furman,4,2,NA,280472166,2008-02-16
183,2,12:16,736,736,Bobby Austin missed Three Point Jumper.,58,26,32,0,0.9983535149490275,0.9983535149490275,Davidson,Furman,4,2,NA,280472166,2008-02-16
184,2,12:16,736,736,Davidson Defensive Rebound.,58,26,32,25,0.9983535149490275,0.9983535149490275,Davidson,Furman,4,2,NA,280472166,2008-02-16
185,2,11:51,711,711,William Archambault made Three Point Jumper.  Assisted by Stephen Curry.,61,26,35,12,0.9992211675358456,0.9992211675358456,Davidson,Furman,4,2,NA,280472166,2008-02-16
186,2,11:39,699,699,Foul on Connor Nolte,61,26,35,0,0.9992690847890175,0.9992690847890175,Davidson,Furman,4,2,NA,280472166,2008-02-16
187,2,11:39,699,699,Official TV Timeout.,61,26,35,21,0.9992690847890175,0.9992690847890175,Davidson,Furman,4,2,NA,280472166,2008-02-16
188,2,11:18,678,678,Bryant Barr missed Three Point Jumper.,61,26,35,0,0.9993404621678201,0.9993404621678201,Davidson,Furman,4,2,NA,280472166,2008-02-16
189,2,11:18,678,678,William Archambault Offensive Rebound.,61,26,35,4,0.9993404621678201,0.9993404621678201,Davidson,Furman,4,2,NA,280472166,2008-02-16
190,2,11:14,674,674,William Archambault made Two Point Layup.,63,26,37,24,0.999574456277959,0.999574456277959,Davidson,Furman,4,2,NA,280472166,2008-02-16
191,2,10:50,650,650,Justin Dehm made Three Point Jumper.  Assisted by Alex Opacic.,63,29,34,20,0.9992843504698063,0.9992843504698063,Davidson,Furman,4,2,NA,280472166,2008-02-16
192,2,10:30,630,630,Andrew Lovedale made Two Point Layup.  Assisted by Stephen Rossiter.,65,29,36,15,0.999577373352069,0.999577373352069,Davidson,Furman,4,2,NA,280472166,2008-02-16
193,2,10:15,615,615,Andrew Lovedale Steal.,65,29,36,19,0.9996108797399517,0.9996108797399517,Davidson,Furman,4,2,NA,280472166,2008-02-16
194,2,9:56,596,596,Boris Meno missed Two Point Jumper.,65,29,36,0,0.9996540844850533,0.9996540844850533,Davidson,Furman,4,2,NA,280472166,2008-02-16
195,2,9:56,596,596,Darryl Evans Defensive Rebound.,65,29,36,6,0.9996540844850533,0.9996540844850533,Davidson,Furman,4,2,NA,280472166,2008-02-16
196,2,9:50,590,590,Connor Nolte made Two Point Jumper.  Assisted by Darryl Evans.,65,31,34,10,0.9994819801887549,0.9994819801887549,Davidson,Furman,4,2,NA,280472166,2008-02-16
197,2,9:40,580,580,Andrew Lovedale made Two Point Dunk Shot.  Assisted by Jason Richards.,67,31,36,12,0.9996913972203028,0.9996913972203028,Davidson,Furman,4,2,NA,280472166,2008-02-16
198,2,9:28,568,568,George Brozos made Three Point Jumper.  Assisted by Darryl Evans.,67,34,33,13,0.9994462418663755,0.9994462418663755,Davidson,Furman,4,2,NA,280472166,2008-02-16
199,2,9:15,555,555,Max Paulhus Gosselin missed Three Point Jumper.,67,34,33,0,0.999502669398444,0.999502669398444,Davidson,Furman,4,2,NA,280472166,2008-02-16
200,2,9:15,555,555,Max Paulhus Gosselin Offensive Rebou.,67,34,33,8,0.999502669398444,0.999502669398444,Davidson,Furman,4,2,NA,280472166,2008-02-16
201,2,9:07,547,547,Bryant Barr missed Two Point Jumper.,67,34,33,0,0.9995371467829238,0.9995371467829238,Davidson,Furman,4,2,NA,280472166,2008-02-16
202,2,9:07,547,547,Andrew Lovedale Offensive Rebound.,67,34,33,4,0.9995371467829238,0.9995371467829238,Davidson,Furman,4,2,NA,280472166,2008-02-16
203,2,9:03,543,543,Foul on Noah States,67,34,33,0,0.9995528455261024,0.9995528455261024,Davidson,Furman,4,2,NA,280472166,2008-02-16
204,2,9:03,543,543,Andrew Lovedale made Free Throw.,68,34,34,0,0.9996460004957225,0.9996460004957225,Davidson,Furman,4,2,NA,280472166,2008-02-16
205,2,9:03,543,543,Andrew Lovedale made Free Throw.,69,34,35,18,0.9997197540820358,0.9997197540820358,Davidson,Furman,4,2,NA,280472166,2008-02-16
206,2,8:45,525,525,Connor Nolte made Three Point Jumper.  Assisted by Alex Opacic.,69,37,32,19,0.9995060486222694,0.9995060486222694,Davidson,Furman,4,2,NA,280472166,2008-02-16
207,2,8:26,506,506,Darryl Evans Steal.,69,37,32,12,0.9995637526284595,0.9995637526284595,Davidson,Furman,4,2,NA,280472166,2008-02-16
208,2,8:14,494,494,Alex Opacic made Two Point Layup.  Assisted by George Brozos.,69,39,30,11,0.9993418766409337,0.9993418766409337,Davidson,Furman,4,2,NA,280472166,2008-02-16
209,2,8:03,483,483,Jason Richards missed Two Point Layup.,69,39,30,0,0.9993859230872002,0.9993859230872002,Davidson,Furman,4,2,NA,280472166,2008-02-16
210,2,8:03,483,483,Furman Defensive Rebound.,69,39,30,16,0.9993859230872002,0.9993859230872002,Davidson,Furman,4,2,NA,280472166,2008-02-16
211,2,7:47,467,467,Justin Dehm missed Three Point Jumper.,69,39,30,0,0.9994514175074488,0.9994514175074488,Davidson,Furman,4,2,NA,280472166,2008-02-16
212,2,7:47,467,467,Jason Richards Defensive Rebound.,69,39,30,10,0.9994514175074488,0.9994514175074488,Davidson,Furman,4,2,NA,280472166,2008-02-16
213,2,7:37,457,457,Stephen Curry made Three Point Jumper.,72,39,33,1,0.9997632034832237,0.9997632034832237,Davidson,Furman,4,2,NA,280472166,2008-02-16
214,2,7:36,456,456,Foul on Alex Opacic,72,39,33,0,0.9997654673227127,0.9997654673227127,Davidson,Furman,4,2,NA,280472166,2008-02-16
215,2,7:36,456,456,Official TV Timeout.,72,39,33,0,0.9997654673227127,0.9997654673227127,Davidson,Furman,4,2,NA,280472166,2008-02-16
216,2,7:36,456,456,Boris Meno made Free Throw.,73,39,34,0,0.9998179312543587,0.9998179312543587,Davidson,Furman,4,2,NA,280472166,2008-02-16
217,2,7:36,456,456,Boris Meno made Free Throw.,74,39,35,54,0.9998586608936514,0.9998586608936514,Davidson,Furman,4,2,NA,280472166,2008-02-16
218,2,6:42,402,402,George Brozos made Two Point Layup.  Assisted by Darryl Evans.,74,41,33,0,0.9998785230234244,0.9998785230234244,Davidson,Furman,4,2,NA,280472166,2008-02-16
219,2,6:42,402,402,Foul on Boris Meno,74,41,33,0,0.9998785230234244,0.9998785230234244,Davidson,Furman,4,2,NA,280472166,2008-02-16
220,2,6:42,402,402,George Brozos made Free Throw.,74,42,32,30,0.9998403652269383,0.9998403652269383,Davidson,Furman,4,2,NA,280472166,2008-02-16
221,2,6:12,372,372,Boris Meno made Two Point Layup.  Assisted by Stephen Curry.,76,42,34,27,0.9999367266153264,0.9999367266153264,Davidson,Furman,4,2,NA,280472166,2008-02-16
222,2,5:45,345,345,Connor Nolte made Two Point Jumper.,76,44,32,9,0.9999235702148079,0.9999235702148079,Davidson,Furman,4,2,NA,280472166,2008-02-16
223,2,5:36,336,336,Stephen Curry missed Two Point Jumper.,76,44,32,0,0.9999342443594283,0.9999342443594283,Davidson,Furman,4,2,NA,280472166,2008-02-16
224,2,5:36,336,336,Justin Dehm Defensive Rebound.,76,44,32,9,0.9999342443594283,0.9999342443594283,Davidson,Furman,4,2,NA,280472166,2008-02-16
225,2,5:27,327,327,Connor Nolte missed Three Point Jumper.,76,44,32,0,0.9999443168629693,0.9999443168629693,Davidson,Furman,4,2,NA,280472166,2008-02-16
226,2,5:27,327,327,Boris Meno Defensive Rebound.,76,44,32,24,0.9999443168629693,0.9999443168629693,Davidson,Furman,4,2,NA,280472166,2008-02-16
227,2,5:03,303,303,Stephen Rossiter made Two Point Layup.,78,44,34,21,0.9999822331161626,0.9999822331161626,Davidson,Furman,4,2,NA,280472166,2008-02-16
228,2,4:42,282,282,Foul on Stephen Rossiter,78,44,34,11,0.9999838140145116,0.9999838140145116,Davidson,Furman,4,2,NA,280472166,2008-02-16
229,2,4:31,271,271,Connor Nolte made Three Point Jumper.,78,47,31,34,0.999953985248868,0.999953985248868,Davidson,Furman,4,2,NA,280472166,2008-02-16
230,2,3:57,237,237,Jordan Miller Defensive Rebound.,78,47,31,0,0.9999411433033554,0.9999411433033554,Davidson,Furman,4,2,NA,280472166,2008-02-16
231,2,3:57,237,237,Dan Nelms missed Two Point Layup.,78,47,31,39,0.9999411433033554,0.9999411433033554,Davidson,Furman,4,2,NA,280472166,2008-02-16
232,2,3:18,198,198,William Archambault made Two Point Layup.,80,47,33,17,0.9999866761653563,0.9999866761653563,Davidson,Furman,4,2,NA,280472166,2008-02-16
233,2,3:01,181,181,Foul on William Archambault,80,47,33,0,0.9999955836137633,0.9999955836137633,Davidson,Furman,4,2,NA,280472166,2008-02-16
234,2,3:01,181,181,Jordan Miller missed Free Throw.,80,47,33,0,0.9999955836137633,0.9999955836137633,Davidson,Furman,4,2,NA,280472166,2008-02-16
235,2,3:01,181,181,null,80,47,33,0,0.9999955836137633,0.9999955836137633,Davidson,Furman,4,2,NA,280472166,2008-02-16
236,2,3:01,181,181,Jordan Miller made Free Throw.,80,48,32,38,0.9999935829294163,0.9999935829294163,Davidson,Furman,4,2,NA,280472166,2008-02-16
237,2,2:23,143,143,George Brozos made Three Point Jumper.  Assisted by Noah States.,80,51,29,22,0.9999984918359752,0.9999984918359752,Davidson,Furman,4,2,NA,280472166,2008-02-16
238,2,2:01,121,121,Brendan McKillop missed Three Point Jumper.,80,51,29,0,0.9999997747941942,0.9999997747941942,Davidson,Furman,4,2,NA,280472166,2008-02-16
239,2,2:01,121,121,George Brozos Defensive Rebound.,80,51,29,1,0.9999997747941942,0.9999997747941942,Davidson,Furman,4,2,NA,280472166,2008-02-16
240,2,2:00,120,120,Foul on Dan Nelms,80,51,29,0,0.9999997956242288,0.9999997956242288,Davidson,Furman,4,2,NA,280472166,2008-02-16
241,2,2:00,120,120,George Brozos missed Free Throw.,80,51,29,0,0.9999997956242288,0.9999997956242288,Davidson,Furman,4,2,NA,280472166,2008-02-16
242,2,2:00,120,120,Stephen Rossiter Defensive Rebound.,80,51,29,6,0.9999997956242288,0.9999997956242288,Davidson,Furman,4,2,NA,280472166,2008-02-16
243,2,1:54,114,114,Foul on George Brozos,80,51,29,0,0.9999998883578884,0.9999998883578884,Davidson,Furman,4,2,NA,280472166,2008-02-16
244,2,1:54,114,114,Dan Nelms missed Free Throw.,80,51,29,0,0.9999998883578884,0.9999998883578884,Davidson,Furman,4,2,NA,280472166,2008-02-16
245,2,1:54,114,114,Dan Nelms made Free Throw.,81,51,30,11,0.9999999357167246,0.9999999357167246,Davidson,Furman,4,2,NA,280472166,2008-02-16
246,2,1:43,103,103,Can Civi Steal.,81,51,30,21,0.9999999817307661,0.9999999817307661,Davidson,Furman,4,2,NA,280472166,2008-02-16
247,2,1:22,82,82,Brendan McKillop made Three Point Jumper.  Assisted by Stephen Rossiter.,84,51,33,11,0.9999999998542196,0.9999999998542196,Davidson,Furman,4,2,NA,280472166,2008-02-16
248,2,1:11,71,71,Jordan Miller missed Two Point Jumper.,84,51,33,0,0.9999999999748309,0.9999999999748309,Davidson,Furman,4,2,NA,280472166,2008-02-16
249,2,1:11,71,71,Stephen Rossiter Defensive Rebound.,84,51,33,30,0.9999999999748309,0.9999999999748309,Davidson,Furman,4,2,NA,280472166,2008-02-16
250,2,0:41,41,41,Can Civi made Two Point Layup.,86,51,35,17,0.9999999999999818,0.9999999999999818,Davidson,Furman,4,2,NA,280472166,2008-02-16
251,2,0:24,24,24,Noah States missed Two Point Layup.,86,51,35,0,0.9999999999999996,0.9999999999999996,Davidson,Furman,4,2,NA,280472166,2008-02-16
252,2,0:24,24,24,Stephen Rossiter Defensive Rebound.,86,51,35,24,0.9999999999999996,0.9999999999999996,Davidson,Furman,4,2,NA,280472166,2008-02-16
253,2,0:00,0,0,End Game,86,51,35,0,1,1,Davidson,Furman,4,2,NA,280472166,2008-02-16
