play_id,half,time_remaining_half,secs_remaining,secs_remaining_absolute,description,home_score,away_score,score_diff,play_length,win_prob,naive_win_prob,home,away,home_time_out_remaining,away_time_out_remaining,home_favored_by,game_id,date
1,1,20:00,2400,2400,PLAY,0,0,0,19,0.5,0.5,Davidson,Furman,4,4,NA,280472166,2008-02-16
2,1,19:41,2381,2381,Stephen Curry missed Three Point Jumper.,0,0,0,0,0.5,0.5,Davidson,Furman,4,4,NA,280472166,2008-02-16
3,1,19:41,2381,2381,Justin Dehm Defensive Rebound.,0,0,0,21,0.5,0.5,Davidson,Furman,4,4,NA,280472166,2008-02-16
4,1,19:20,2360,2360,Stephen Curry made Two Point Layup.  Assisted by Andrew Lovedale.,2,0,2,78,0.5448750795359576,0.5448750795359576,Davidson,Furman,4,4,NA,280472166,2008-02-16
5,1,18:02,2282,2282,Stephen Curry made Three Point Jumper.  Assisted by Max Paulhus Gosselin.,5,0,5,31,0.6147311450243945,0.6147311450243945,Davidson,Furman,4,4,NA,280472166,2008-02-16
6,1,17:31,2251,2251,Connor Nolte missed Three Point Jumper.,5,0,5,0,0.6163980665546902,0.6163980665546902,Davidson,Furman,4,4,NA,280472166,2008-02-16
7,1,17:31,2251,2251,Jason Richards Defensive Rebound.,5,0,5,20,0.6163980665546902,0.6163980665546902,Davidson,Furman,4,4,NA,280472166,2008-02-16
8,1,17:11,2231,2231,Andrew Lovedale made Two Point Jumper.  Assisted by Stephen Curry.,7,0,7,17,0.6615978486192693,0.6615978486192693,Davidson,Furman,4,4,NA,280472166,2008-02-16
9,1,16:54,2214,2214,Foul on Connor Nolte,7,0,7,0,0.6628253852428388,0.6628253852428388,Davidson,Furman,4,4,NA,280472166,2008-02-16
10,1,16:54,2214,2214,Furman 30 Second Timeout.,7,0,7,5,0.6628253852428388,0.6628253852428388,Davidson,Furman,4,3,NA,280472166,2008-02-16
11,1,16:49,2209,2209,Jason Richards missed Three Point Jumper.,7,0,7,0,0.6631870729998225,0.6631870729998225,Davidson,Furman,4,3,NA,280472166,2008-02-16
12,1,16:49,2209,2209,Noah States Defensive Rebound.,7,0,7,30,0.6631870729998225,0.6631870729998225,Davidson,Furman,4,3,NA,280472166,2008-02-16
13,1,16:19,2179,2179,Furman 30 Second Timeout.,7,0,7,16,0.6653618060402517,0.6653618060402517,Davidson,Furman,4,2,NA,280472166,2008-02-16
14,1,16:03,2163,2163,Justin Dehm missed Three Point Jumper.,7,0,7,0,0.666524125162981,0.666524125162981,Davidson,Furman,4,2,NA,280472166,2008-02-16
15,1,16:03,2163,2163,William Archambault Defensive Rebound.,7,0,7,19,0.666524125162981,0.666524125162981,Davidson,Furman,4,2,NA,280472166,2008-02-16
16,1,15:44,2144,2144,Official TV Timeout.,7,0,7,35,0.6679092414034875,0.6679092414034875,Davidson,Furman,4,2,NA,280472166,2008-02-16
17,1,15:09,2109,2109,William Archambault made Three Point Jumper.  Assisted by Thomas Sander.,10,0,10,21,0.7339553315513319,0.7339553315513319,Davidson,Furman,4,2,NA,280472166,2008-02-16
18,1,14:48,2088,2088,Noah States missed Three Point Jumper.,10,0,10,0,0.7359146398372904,0.7359146398372904,Davidson,Furman,4,2,NA,280472166,2008-02-16
19,1,14:48,2088,2088,William Archambault Defensive Rebound.,10,0,10,25,0.7359146398372904,0.7359146398372904,Davidson,Furman,4,2,NA,280472166,2008-02-16
20,1,14:23,2063,2063,William Archambault made Two Point Layup.,12,0,12,20,0.7763152933858614,0.7763152933858614,Davidson,Furman,4,2,NA,280472166,2008-02-16
21,1,14:03,2043,2043,Justin Dehm missed Three Point Jumper.,12,0,12,0,0.7783454064851407,0.7783454064851407,Davidson,Furman,4,2,NA,280472166,2008-02-16
22,1,14:03,2043,2043,Davidson Defensive Rebound.,12,0,12,0,0.7783454064851407,0.7783454064851407,Davidson,Furman,4,2,NA,280472166,2008-02-16
23,1,14:03,2043,2043,Foul on Bobby Austin,12,0,12,17,0.7783454064851407,0.7783454064851407,Davidson,Furman,4,2,NA,280472166,2008-02-16
24,1,13:46,2026,2026,Stephen Curry made Three Point Jumper.  Assisted by Bryant Barr.,15,0,15,12,0.8295775197718261,0.8295775197718261,Davidson,Furman,4,2,NA,280472166,2008-02-16
25,1,13:34,2014,2014,Jordan Miller missed Two Point Jumper.,15,0,15,0,0.8308377140082125,0.8308377140082125,Davidson,Furman,4,2,NA,280472166,2008-02-16
26,1,13:34,2014,2014,William Archambault Defensive Rebound.,15,0,15,12,0.8308377140082125,0.8308377140082125,Davidson,Furman,4,2,NA,280472166,2008-02-16
27,1,13:22,2002,2002,Thomas Sander made Two Point Layup.,17,0,17,13,0.8598423131455447,0.8598423131455447,Davidson,Furman,4,2,NA,280472166,2008-02-16
28,1,13:09,1989,1989,Foul on Alex Opacic,17,0,17,0,0.8611767898323635,0.8611767898323635,Davidson,Furman,4,2,NA,280472166,2008-02-16
29,1,13:09,1989,1989,Furman 30 Second Timeout.,17,0,17,10,0.8611767898323635,0.8611767898323635,Davidson,Furman,4,1,NA,280472166,2008-02-16
30,1,12:59,1979,1979,Bryant Barr missed Three Point Jumper.,17,0,17,4,0.8622023931871026,0.8622023931871026,Davidson,Furman,4,1,NA,280472166,2008-02-16
31,1,12:55,1975,1975,Jordan Miller Defensive Rebound.,17,0,17,15,0.8626124254013521,0.8626124254013521,Davidson,Furman,4,1,NA,280472166,2008-02-16
32,1,12:40,1960,1960,George Brozos missed Two Point Layup.,17,0,17,0,0.864149054916317,0.864149054916317,Davidson,Furman,4,1,NA,280472166,2008-02-16
33,1,12:40,1960,1960,Furman Offensive Rebound.,17,0,17,17,0.864149054916317,0.864149054916317,Davidson,Furman,4,1,NA,280472166,2008-02-16
34,1,12:23,1943,1943,Bobby Austin missed Two Point Jumper.,17,0,17,0,0.8658888375299315,0.8658888375299315,Davidson,Furman,4,1,NA,280472166,2008-02-16
35,1,12:23,1943,1943,Max Paulhus Gosselin Defensive Rebou.,17,0,17,4,0.8658888375299315,0.8658888375299315,Davidson,Furman,4,1,NA,280472166,2008-02-16
36,1,12:19,1939,1939,Stephen Curry made Two Point Layup.,19,0,19,13,0.8897757164140031,0.8897757164140031,Davidson,Furman,4,1,NA,280472166,2008-02-16
37,1,12:06,1926,1926,Bobby Austin made Two Point Jumper.,19,2,17,13,0.8676263450730733,0.8676263450730733,Davidson,Furman,4,1,NA,280472166,2008-02-16
38,1,11:53,1913,1913,Stephen Curry missed Three Point Jumper.,19,2,17,0,0.8689438581956556,0.8689438581956556,Davidson,Furman,4,1,NA,280472166,2008-02-16
39,1,11:53,1913,1913,Furman Defensive Rebound.,19,2,17,11,0.8689438581956556,0.8689438581956556,Davidson,Furman,4,1,NA,280472166,2008-02-16
40,1,11:42,1902,1902,Official TV Timeout.,19,2,17,15,0.87004859706527915,0.87004859706527915,Davidson,Furman,4,1,NA,280472166,2008-02-16
41,1,11:27,1887,1887,Jordan Miller made Two Point Layup.,19,4,15,20,0.8441460296753109,0.8441460296753109,Davidson,Furman,4,1,NA,280472166,2008-02-16
42,1,11:07,1867,1867,Bryant Barr missed Two Point Jumper.,19,4,15,0,0.84619155427500925,0.84619155427500925,Davidson,Furman,4,1,NA,280472166,2008-02-16
43,1,11:07,1867,1867,Andrew Lovedale Offensive Rebound.,19,4,15,6,0.84619155427500925,0.84619155427500925,Davidson,Furman,4,1,NA,280472166,2008-02-16
44,1,11:01,1861,1861,Andrew Lovedale made Two Point Layup.,21,4,17,13,0.8740993759059291,0.8740993759059291,Davidson,Furman,4,1,NA,280472166,2008-02-16
45,1,10:48,1848,1848,Bobby Austin made Two Point Layup.,21,6,15,15,0.8481208856136492,0.8481208856136492,Davidson,Furman,4,1,NA,280472166,2008-02-16
46,1,10:33,1833,1833,Foul on Max Paulhus Gosselin,21,6,15,8,0.8496371367711396,0.8496371367711396,Davidson,Furman,4,1,NA,280472166,2008-02-16
47,1,10:25,1825,1825,Foul on Max Paulhus Gosselin,21,6,15,22,0.8504440372099685,0.8504440372099685,Davidson,Furman,4,1,NA,280472166,2008-02-16
48,1,10:03,1803,1803,Stephen Curry Steal.,21,6,15,1,0.8526593576251307,0.8526593576251307,Davidson,Furman,4,1,NA,280472166,2008-02-16
49,1,10:02,1802,1802,Stephen Curry made Two Point Layup.,23,6,17,15,0.8798068864633084,0.8798068864633084,Davidson,Furman,4,1,NA,280472166,2008-02-16
50,1,9:47,1787,1787,George Brozos made Free Throw.,23,7,16,0,0.8683430786269354,0.8683430786269354,Davidson,Furman,4,1,NA,280472166,2008-02-16
51,1,9:47,1787,1787,Foul on Stephen Rossiter,23,7,16,0,0.8683430786269354,0.8683430786269354,Davidson,Furman,4,1,NA,280472166,2008-02-16
52,1,9:47,1787,1787,George Brozos made Free Throw.,23,8,15,18,0.8542695651396284,0.8542695651396284,Davidson,Furman,4,1,NA,280472166,2008-02-16
53,1,9:29,1769,1769,Andrew Lovedale made Two Point Jumper.,25,8,17,10,0.8829720816695386,0.8829720816695386,Davidson,Furman,4,1,NA,280472166,2008-02-16
54,1,9:19,1759,1759,Jordan Miller made Two Point Layup.,25,10,15,11,0.8570922801432416,0.8570922801432416,Davidson,Furman,4,1,NA,280472166,2008-02-16
55,1,9:08,1748,1748,Jordan Miller Steal.,25,10,15,2,0.8582047505535093,0.8582047505535093,Davidson,Furman,4,1,NA,280472166,2008-02-16
56,1,9:06,1746,1746,Foul on Jason Richards,25,10,15,19,0.8584073133584886,0.8584073133584886,Davidson,Furman,4,1,NA,280472166,2008-02-16
57,1,8:47,1727,1727,Jordan Miller made Three Point Jumper.  Assisted by Noah States.,25,13,12,21,0.8106860630680579,0.8106860630680579,Davidson,Furman,4,1,NA,280472166,2008-02-16
58,1,8:26,1706,1706,Andrew Lovedale missed Two Point Jumper.,25,13,12,0,0.8128841845618123,0.8128841845618123,Davidson,Furman,4,1,NA,280472166,2008-02-16
59,1,8:26,1706,1706,Jason Richards Offensive Rebound.,25,13,12,4,0.8128841845618123,0.8128841845618123,Davidson,Furman,4,1,NA,280472166,2008-02-16
60,1,8:22,1702,1702,Foul on Jordan Miller,25,13,12,15,0.8133058842924398,0.8133058842924398,Davidson,Furman,4,1,NA,280472166,2008-02-16
61,1,8:07,1687,1687,William Archambault missed Three Point Jumper.,25,13,12,0,0.8148953592520465,0.8148953592520465,Davidson,Furman,4,1,NA,280472166,2008-02-16
62,1,8:07,1687,1687,Alex Opacic Defensive Rebound.,25,13,12,2,0.8148953592520465,0.8148953592520465,Davidson,Furman,4,1,NA,280472166,2008-02-16
63,1,8:05,1685,1685,Foul on Andrew Lovedale,25,13,12,26,0.8151063411917111,0.8151063411917111,Davidson,Furman,4,1,NA,280472166,2008-02-16
64,1,7:39,1659,1659,Noah States missed Two Point Layup.,25,13,12,0,0.8177791628028704,0.8177791628028704,Davidson,Furman,4,1,NA,280472166,2008-02-16
65,1,7:39,1659,1659,Jason Richards Defensive Rebound.,25,13,12,7,0.8177791628028704,0.8177791628028704,Davidson,Furman,4,1,NA,280472166,2008-02-16
66,1,7:32,1652,1652,Stephen Curry made Three Point Jumper.  Assisted by Jason Richards.,28,13,15,20,0.8679094355868525,0.8679094355868525,Davidson,Furman,4,1,NA,280472166,2008-02-16
67,1,7:12,1632,1632,Jordan Miller missed Two Point Jumper.,28,13,15,0,0.8698021076369321,0.8698021076369321,Davidson,Furman,4,1,NA,280472166,2008-02-16
68,1,7:12,1632,1632,Davidson Defensive Rebound.,28,13,15,0,0.8698021076369321,0.8698021076369321,Davidson,Furman,4,1,NA,280472166,2008-02-16
69,1,7:12,1632,1632,Official TV Timeout.,28,13,15,17,0.8698021076369321,0.8698021076369321,Davidson,Furman,4,1,NA,280472166,2008-02-16
70,1,6:55,1615,1615,Boris Meno made Two Point Jumper.  Assisted by Jason Richards.,30,13,17,12,0.8973631413036496,0.8973631413036496,Davidson,Furman,4,1,NA,280472166,2008-02-16
71,1,6:43,1603,1603,Foul on Thomas Sander,30,13,17,5,0.8983834059129518,0.8983834059129518,Davidson,Furman,4,1,NA,280472166,2008-02-16
72,1,6:38,1598,1598,Bobby Austin missed Two Point Jumper.,30,13,17,0,0.8988056941224613,0.8988056941224613,Davidson,Furman,4,1,NA,280472166,2008-02-16
73,1,6:38,1598,1598,Jason Richards Defensive Rebound.,30,13,17,8,0.8988056941224613,0.8988056941224613,Davidson,Furman,4,1,NA,280472166,2008-02-16
74,1,6:30,1590,1590,Jason Richards missed Two Point Jumper.,30,13,17,0,0.8994786548694077,0.8994786548694077,Davidson,Furman,4,1,NA,280472166,2008-02-16
75,1,6:30,1590,1590,Alex Opacic Defensive Rebound.,30,13,17,15,0.8994786548694077,0.8994786548694077,Davidson,Furman,4,1,NA,280472166,2008-02-16
76,1,6:15,1575,1575,Tony Anderson missed Two Point Jumper.,30,13,17,0,0.9007342132174,0.9007342132174,Davidson,Furman,4,1,NA,280472166,2008-02-16
77,1,6:15,1575,1575,Boris Meno Defensive Rebound.,30,13,17,14,0.9007342132174,0.9007342132174,Davidson,Furman,4,1,NA,280472166,2008-02-16
78,1,6:01,1561,1561,William Archambault made Two Point Dunk Shot.  Assisted by Stephen Curry.,32,13,19,11,0.9226959714889648,0.9226959714889648,Davidson,Furman,4,1,NA,280472166,2008-02-16
79,1,5:50,1550,1550,Connor Nolte made Three Point Jumper.  Assisted by Bobby Austin.,32,16,16,10,0.8906951127558485,0.8906951127558485,Davidson,Furman,4,1,NA,280472166,2008-02-16
80,1,5:40,1540,1540,Foul on Bobby Austin,32,16,16,0,0.8915703091717744,0.8915703091717744,Davidson,Furman,4,1,NA,280472166,2008-02-16
81,1,5:40,1540,1540,Stephen Curry made Free Throw.,33,16,17,0,0.9036593829899491,0.9036593829899491,Davidson,Furman,4,1,NA,280472166,2008-02-16
82,1,5:40,1540,1540,Stephen Curry made Free Throw.,34,16,18,0,0.914529828569528,0.914529828569528,Davidson,Furman,4,1,NA,280472166,2008-02-16
83,1,5:40,1540,1540,Stephen Curry made Free Throw.,35,16,19,17,0.92427650471719,0.92427650471719,Davidson,Furman,4,1,NA,280472166,2008-02-16
84,1,5:23,1523,1523,Noah States missed Three Point Jumper.,35,16,19,2,0.9255630087044531,0.9255630087044531,Davidson,Furman,4,1,NA,280472166,2008-02-16
85,1,5:21,1521,1521,Davidson Defensive Rebound.,35,16,19,21,0.9257150903092967,0.9257150903092967,Davidson,Furman,4,1,NA,280472166,2008-02-16
86,1,5:00,1500,1500,William Archambault made Three Point Jumper.  Assisted by Jason Richards.,38,16,22,24,0.9501856393012794,0.9501856393012794,Davidson,Furman,4,1,NA,280472166,2008-02-16
87,1,4:36,1476,1476,George Brozos missed Two Point Layup.,38,16,22,3,0.9517088340874927,0.9517088340874927,Davidson,Furman,4,1,NA,280472166,2008-02-16
88,1,4:33,1473,1473,Boris Meno Defensive Rebound.,38,16,22,10,0.9519015001888425,0.9519015001888425,Davidson,Furman,4,1,NA,280472166,2008-02-16
89,1,4:23,1463,1463,Stephen Curry missed Two Point Jumper.,38,16,22,0,0.9525479041667901,0.9525479041667901,Davidson,Furman,4,1,NA,280472166,2008-02-16
90,1,4:23,1463,1463,Connor Nolte Defensive Rebound.,38,16,22,10,0.9525479041667901,0.9525479041667901,Davidson,Furman,4,1,NA,280472166,2008-02-16
91,1,4:13,1453,1453,Connor Nolte missed Three Point Jumper.,38,16,22,0,0.953201214885876,0.953201214885876,Davidson,Furman,4,1,NA,280472166,2008-02-16
92,1,4:13,1453,1453,Stephen Curry Defensive Rebound.,38,16,22,16,0.953201214885876,0.953201214885876,Davidson,Furman,4,1,NA,280472166,2008-02-16
93,1,3:57,1437,1437,Official TV Timeout.,38,16,22,33,0.954236063245191,0.954236063245191,Davidson,Furman,4,1,NA,280472166,2008-02-16
94,1,3:24,1404,1404,George Brozos missed Two Point Layup.,38,16,22,0,0.956214773522588,0.956214773522588,Davidson,Furman,4,1,NA,280472166,2008-02-16
95,1,3:24,1404,1404,Darryl Evans Offensive Rebound.,38,16,22,11,0.956214773522588,0.956214773522588,Davidson,Furman,4,1,NA,280472166,2008-02-16
96,1,3:13,1393,1393,Alex Opacic missed Two Point Jumper.,38,16,22,0,0.9568380588069763,0.9568380588069763,Davidson,Furman,4,1,NA,280472166,2008-02-16
97,1,3:13,1393,1393,William Archambault Defensive Rebound.,38,16,22,13,0.9568380588069763,0.9568380588069763,Davidson,Furman,4,1,NA,280472166,2008-02-16
98,1,3:00,1380,1380,Andrew Lovedale made Two Point Dunk Shot.  Assisted by Stephen Curry.,40,16,24,14,0.9676898930046137,0.9676898930046137,Davidson,Furman,4,1,NA,280472166,2008-02-16
99,1,2:46,1366,1366,George Brozos made Three Point Jumper.  Assisted by Justin Dehm.,40,19,21,9,0.9522371875978572,0.9522371875978572,Davidson,Furman,4,1,NA,280472166,2008-02-16
100,1,2:37,1357,1357,William Archambault made Three Point Jumper.  Assisted by Jason Richards.,43,19,24,15,0.9687290150393428,0.9687290150393428,Davidson,Furman,4,1,NA,280472166,2008-02-16
101,1,2:22,1342,1342,Foul on William Archambault,43,19,24,0,0.9693932609475382,0.9693932609475382,Davidson,Furman,4,1,NA,280472166,2008-02-16
102,1,2:22,1342,1342,Darryl Evans made Free Throw.,43,20,23,0,0.9648203139805472,0.9648203139805472,Davidson,Furman,4,1,NA,280472166,2008-02-16
103,1,2:22,1342,1342,Darryl Evans missed Free Throw.,43,20,23,0,0.9648203139805472,0.9648203139805472,Davidson,Furman,4,1,NA,280472166,2008-02-16
104,1,2:22,1342,1342,Thomas Sander Defensive Rebound.,43,20,23,21,0.9648203139805472,0.9648203139805472,Davidson,Furman,4,1,NA,280472166,2008-02-16
105,1,2:01,1321,1321,William Archambault made Three Point Jumper.  Assisted by Jason Richards.,46,20,26,19,0.9776338014572825,0.9776338014572825,Davidson,Furman,4,1,NA,280472166,2008-02-16
106,1,1:42,1302,1302,Foul on George Brozos,46,20,26,4,0.978319975118403,0.978319975118403,Davidson,Furman,4,1,NA,280472166,2008-02-16
107,1,1:38,1298,1298,Thomas Sander missed Two Point Layup.,46,20,26,0,0.9784649039018583,0.9784649039018583,Davidson,Furman,4,1,NA,280472166,2008-02-16
108,1,1:38,1298,1298,Noah States Defensive Rebound.,46,20,26,23,0.9784649039018583,0.9784649039018583,Davidson,Furman,4,1,NA,280472166,2008-02-16
109,1,1:15,1275,1275,Alex Opacic made Two Point Layup.,46,22,24,0,0.9723548967489162,0.9723548967489162,Davidson,Furman,4,1,NA,280472166,2008-02-16
110,1,1:15,1275,1275,William Archambault missed Three Point Jumper.,46,22,24,0,0.9723548967489162,0.9723548967489162,Davidson,Furman,4,1,NA,280472166,2008-02-16
111,1,1:15,1275,1275,Boris Meno Offensive Rebound.,46,22,24,41,0.9723548967489162,0.9723548967489162,Davidson,Furman,4,1,NA,280472166,2008-02-16
112,1,0:34,1234,1234,William Archambault missed Three Point Jumper.,46,22,24,0,0.974254841453,0.974254841453,Davidson,Furman,4,1,NA,280472166,2008-02-16
113,1,0:34,1234,1234,Jason Richards Offensive Rebound.,46,22,24,23,0.974254841453,0.974254841453,Davidson,Furman,4,1,NA,280472166,2008-02-16
114,1,0:11,1211,1211,Stephen Curry missed Three Point Jumper.,46,22,24,0,0.9753730041719832,0.9753730041719832,Davidson,Furman,4,1,NA,280472166,2008-02-16
115,1,0:11,1211,1211,Furman Defensive Rebound.,46,22,24,11,0.9753730041719832,0.9753730041719832,Davidson,Furman,4,1,NA,280472166,2008-02-16
116,1,0:00,1200,1200,End of the 1st Half.,46,22,24,0,0.9759087506193534,0.9759087506193534,Davidson,Furman,4,1,NA,280472166,2008-02-16
117,2,20:00,1200,1200,PLAY,46,22,24,21,0.9759087506193534,0.9759087506193534,Davidson,Furman,4,2,NA,280472166,2008-02-16
118,2,19:39,1179,1179,Thomas Sander Steal.,46,22,24,19,0.9768714917115825,0.9768714917115825,Davidson,Furman,4,2,NA,280472166,2008-02-16
119,2,19:20,1160,1160,Andrew Lovedale missed Two Point Jumper.,46,22,24,0,0.9776877557018162,0.9776877557018162,Davidson,Furman,4,2,NA,280472166,2008-02-16
120,2,19:20,1160,1160,George Brozos Defensive Rebound.,46,22,24,12,0.9776877557018162,0.9776877557018162,Davidson,Furman,4,2,NA,280472166,2008-02-16
121,2,19:08,1148,1148,Justin Dehm missed Three Point Jumper.,46,22,24,0,0.978182518759503,0.978182518759503,Davidson,Furman,4,2,NA,280472166,2008-02-16
122,2,19:08,1148,1148,Andrew Lovedale Defensive Rebound.,46,22,24,37,0.978182518759503,0.978182518759503,Davidson,Furman,4,2,NA,280472166,2008-02-16
123,2,18:31,1111,1111,Justin Dehm missed Two Point Layup.,46,22,24,0,0.9796400851760596,0.9796400851760596,Davidson,Furman,4,2,NA,280472166,2008-02-16
124,2,18:31,1111,1111,Andrew Lovedale Defensive Rebound.,46,22,24,6,0.9796400851760596,0.9796400851760596,Davidson,Furman,4,2,NA,280472166,2008-02-16
125,2,18:25,1105,1105,Thomas Sander missed Two Point Layup.,46,22,24,0,0.9798701541163971,0.9798701541163971,Davidson,Furman,4,2,NA,280472166,2008-02-16
126,2,18:25,1105,1105,Noah States Defensive Rebound.,46,22,24,9,0.9798701541163971,0.9798701541163971,Davidson,Furman,4,2,NA,280472166,2008-02-16
127,2,18:16,1096,1096,Connor Nolte missed Two Point Jumper.,46,22,24,0,0.9802134531543426,0.9802134531543426,Davidson,Furman,4,2,NA,280472166,2008-02-16
128,2,18:16,1096,1096,Thomas Sander Defensive Rebound.,46,22,24,12,0.9802134531543426,0.9802134531543426,Davidson,Furman,4,2,NA,280472166,2008-02-16
129,2,18:04,1084,1084,Jason Richards missed Two Point Layup.,46,22,24,0,0.9806690903914476,0.9806690903914476,Davidson,Furman,4,2,NA,280472166,2008-02-16
130,2,18:04,1084,1084,Noah States Defensive Rebound.,46,22,24,0,0.9806690903914476,0.9806690903914476,Davidson,Furman,4,2,NA,280472166,2008-02-16
131,2,18:04,1084,1084,Foul on George Brozos,46,22,24,12,0.9806690903914476,0.9806690903914476,Davidson,Furman,4,2,NA,280472166,2008-02-16
132,2,17:52,1072,1072,Stephen Curry missed Two Point Jumper.,46,22,24,0,0.9811239714773486,0.9811239714773486,Davidson,Furman,4,2,NA,280472166,2008-02-16
133,2,17:52,1072,1072,Boris Meno Offensive Rebound.,46,22,24,4,0.9811239714773486,0.9811239714773486,Davidson,Furman,4,2,NA,280472166,2008-02-16
134,2,17:48,1068,1068,Boris Meno missed Two Point Jumper.,46,22,24,0,0.9812757142961032,0.9812757142961032,Davidson,Furman,4,2,NA,280472166,2008-02-16
135,2,17:48,1068,1068,Noah States Defensive Rebound.,46,22,24,0,0.9812757142961032,0.9812757142961032,Davidson,Furman,4,2,NA,280472166,2008-02-16
136,2,17:48,1068,1068,Foul on Andrew Lovedale,46,22,24,15,0.9812757142961032,0.9812757142961032,Davidson,Furman,4,2,NA,280472166,2008-02-16
137,2,17:33,1053,1053,Justin Dehm missed Three Point Jumper.,46,22,24,0,0.9818465218925554,0.9818465218925554,Davidson,Furman,4,2,NA,280472166,2008-02-16
138,2,17:33,1053,1053,Max Paulhus Gosselin Defensive Rebou.,46,22,24,9,0.9818465218925554,0.9818465218925554,Davidson,Furman,4,2,NA,280472166,2008-02-16
139,2,17:24,1044,1044,Stephen Curry missed Two Point Layup.,46,22,24,0,0.9821911183449196,0.9821911183449196,Davidson,Furman,4,2,NA,280472166,2008-02-16
140,2,17:24,1044,1044,Andrew Lovedale Offensive Rebound.,46,22,24,5,0.9821911183449196,0.9821911183449196,Davidson,Furman,4,2,NA,280472166,2008-02-16
141,2,17:19,1039,1039,Foul on Jason Richards,46,22,24,19,0.9823834779417578,0.9823834779417578,Davidson,Furman,4,2,NA,280472166,2008-02-16
142,2,17:00,1020,1020,Max Paulhus Gosselin missed Two Point Jumper.,46,22,24,0,0.9831218683357016,0.9831218683357016,Davidson,Furman,4,2,NA,280472166,2008-02-16
143,2,17:00,1020,1020,Jason Richards Offensive Rebound.,46,22,24,5,0.9831218683357016,0.9831218683357016,Davidson,Furman,4,2,NA,280472166,2008-02-16
144,2,16:55,1015,1015,Stephen Curry made Three Point Jumper.  Assisted by Jason Richards.,49,22,27,17,0.9899113696729765,0.9899113696729765,Davidson,Furman,4,2,NA,280472166,2008-02-16
145,2,16:38,998,998,Bobby Austin missed Three Point Jumper.,49,22,27,0,0.9903732330301849,0.9903732330301849,Davidson,Furman,4,2,NA,280472166,2008-02-16
146,2,16:38,998,998,Stephen Curry Defensive Rebound.,49,22,27,9,0.9903732330301849,0.9903732330301849,Davidson,Furman,4,2,NA,280472166,2008-02-16
147,2,16:29,989,989,Boris Meno made Two Point Layup.  Assisted by Jason Richards.,51,22,29,11,0.9933399695388868,0.9933399695388868,Davidson,Furman,4,2,NA,280472166,2008-02-16
148,2,16:18,978,978,Noah States missed Two Point Layup.,51,22,29,0,0.9935724381506349,0.9935724381506349,Davidson,Furman,4,2,NA,280472166,2008-02-16
149,2,16:18,978,978,Boris Meno Defensive Rebound.,51,22,29,23,0.9935724381506349,0.9935724381506349,Davidson,Furman,4,2,NA,280472166,2008-02-16
150,2,15:55,955,955,Stephen Curry missed Three Point Jumper.,51,22,29,0,0.9940409611009262,0.9940409611009262,Davidson,Furman,4,2,NA,280472166,2008-02-16
151,2,15:55,955,955,Furman Defensive Rebound.,51,22,29,1,0.9940409611009262,0.9940409611009262,Davidson,Furman,4,2,NA,280472166,2008-02-16
152,2,15:54,954,954,Official TV Timeout.,51,22,29,18,0.9940595021720708,0.9940595021720708,Davidson,Furman,4,2,NA,280472166,2008-02-16
153,2,15:36,936,936,Noah States missed Two Point Layup.,51,22,29,0,0.9943688837169836,0.9943688837169836,Davidson,Furman,4,2,NA,280472166,2008-02-16
154,2,15:36,936,936,Stephen Rossiter Defensive Rebound.,51,22,29,0,0.9943688837169836,0.9943688837169836,Davidson,Furman,4,2,NA,280472166,2008-02-16
155,2,15:36,936,936,Foul on Alex Opacic,51,22,29,17,0.9943688837169836,0.9943688837169836,Davidson,Furman,4,2,NA,280472166,2008-02-16
156,2,15:19,919,919,Boris Meno missed Two Point Jumper.,51,22,29,0,0.994626355087594,0.994626355087594,Davidson,Furman,4,2,NA,280472166,2008-02-16
157,2,15:19,919,919,Tony Anderson Defensive Rebound.,51,22,29,7,0.994626355087594,0.994626355087594,Davidson,Furman,4,2,NA,280472166,2008-02-16
158,2,15:12,912,912,Max Paulhus Gosselin Steal.,51,22,29,6,0.994724825009859,0.994724825009859,Davidson,Furman,4,2,NA,280472166,2008-02-16
159,2,15:06,906,906,Jason Richards missed Three Point Jumper.,51,22,29,0,0.9948063865661493,0.9948063865661493,Davidson,Furman,4,2,NA,280472166,2008-02-16
160,2,15:06,906,906,Tony Anderson Defensive Rebound.,51,22,29,10,0.9948063865661493,0.9948063865661493,Davidson,Furman,4,2,NA,280472166,2008-02-16
161,2,14:56,896,896,Alex Opacic missed Two Point Layup.,51,22,29,2,0.9949374415438873,0.9949374415438873,Davidson,Furman,4,2,NA,280472166,2008-02-16
162,2,14:54,894,894,Stephen Rossiter Defensive Rebound.,51,22,29,11,0.9949630252496295,0.9949630252496295,Davidson,Furman,4,2,NA,280472166,2008-02-16
163,2,14:43,883,883,Foul on Alex Opacic,51,22,29,0,0.9951007442508853,0.9951007442508853,Davidson,Furman,4,2,NA,280472166,2008-02-16
164,2,14:43,883,883,Stephen Curry made Free Throw.,52,22,30,0,0.9959176582664752,0.9959176582664752,Davidson,Furman,4,2,NA,280472166,2008-02-16
165,2,14:43,883,883,Stephen Curry made Free Throw.,53,22,31,15,0.9965988235892052,0.9965988235892052,Davidson,Furman,4,2,NA,280472166,2008-02-16
166,2,14:28,868,868,Alex Opacic made Two Point Layup.  Assisted by Tony Anderson.,53,24,29,14,0.9952826518613597,0.9952826518613597,Davidson,Furman,4,2,NA,280472166,2008-02-16
167,2,14:14,854,854,William Archambault made Two Point Layup.  Assisted by Jason Richards.,55,24,31,0,0.9968572353423015,0.9968572353423015,Davidson,Furman,4,2,NA,280472166,2008-02-16
168,2,14:14,854,854,Foul on Bobby Austin,55,24,31,0,0.9968572353423015,0.9968572353423015,Davidson,Furman,4,2,NA,280472166,2008-02-16
169,2,14:14,854,854,William Archambault made Free Throw.,56,24,32,27,0.9973887072418921,0.9973887072418921,Davidson,Furman,4,2,NA,280472166,2008-02-16
170,2,13:47,827,827,Tony Anderson missed Three Point Jumper.,56,24,32,5,0.9975927290109512,0.9975927290109512,Davidson,Furman,4,2,NA,280472166,2008-02-16
171,2,13:42,822,822,Stephen Rossiter Defensive Rebound.,56,24,32,8,0.9976310585101219,0.9976310585101219,Davidson,Furman,4,2,NA,280472166,2008-02-16
172,2,13:34,814,814,Bryant Barr missed Two Point Layup.,56,24,32,2,0.9976930093561835,0.9976930093561835,Davidson,Furman,4,2,NA,280472166,2008-02-16
