play_id,half,time_remaining_half,secs_remaining,secs_remaining_absolute,description,home_score,away_score,score_diff,play_length,win_prob,naive_win_prob,home,away,home_time_out_remaining,away_time_out_remaining,home_favored_by,game_id,date
1,1,20:00,2400,3300,PLAY,0,0,0,6,0.5,0.5,Rice,Utah,6,6,NA,253370242,2005-12-03
2,1,19:54,2394,3294,Jamaal Moore missed Three Point Jumper.,0,0,0,0,0.5,0.5,Rice,Utah,6,6,NA,253370242,2005-12-03
3,1,19:54,2394,3294,Utah Defensive Rebound.,0,0,0,0,0.5,0.5,Rice,Utah,6,6,NA,253370242,2005-12-03
4,1,19:54,2394,3294,Foul on Tim Drisdom,0,0,0,0,0.5,0.5,Rice,Utah,6,6,NA,253370242,2005-12-03
5,1,19:54,2394,3294,Jamaal Moore missed Free Throw.,0,0,0,0,0.5,0.5,Rice,Utah,6,6,NA,253370242,2005-12-03
6,1,19:54,2394,3294,Rice Defensive Rebound.,0,0,0,0,0.5,0.5,Rice,Utah,6,6,NA,253370242,2005-12-03
7,1,19:54,2394,3294,Jamaal Moore made Free Throw.,1,0,1,34,0.5221192528386708,0.5221192528386708,Rice,Utah,6,6,NA,253370242,2005-12-03
8,1,19:20,2360,3260,Bryant Markson missed Two Point Layup.,1,0,1,0,0.5224829067768547,0.5224829067768547,Rice,Utah,6,6,NA,253370242,2005-12-03
9,1,19:20,2360,3260,Jamaal Moore Defensive Rebound.,1,0,1,19,0.5224829067768547,0.5224829067768547,Rice,Utah,6,6,NA,253370242,2005-12-03
10,1,19:01,2341,3241,JR Harrison missed Three Point Jumper.,1,0,1,0,0.5226896161870556,0.5226896161870556,Rice,Utah,6,6,NA,253370242,2005-12-03
11,1,19:01,2341,3241,Bryant Markson Defensive Rebound.,1,0,1,67,0.5226896161870556,0.5226896161870556,Rice,Utah,6,6,NA,253370242,2005-12-03
12,1,17:54,2274,3174,Chris Jackson made Two Point Layup.,1,2,-1,10,0.476564522728214,0.476564522728214,Rice,Utah,6,6,NA,253370242,2005-12-03
13,1,17:44,2264,3164,Lorenzo Williams missed Two Point Layup.,1,2,-1,0,0.47645126124796555,0.47645126124796555,Rice,Utah,6,6,NA,253370242,2005-12-03
14,1,17:44,2264,3164,Johnnie Bryant Defensive Rebound.,1,2,-1,27,0.47645126124796555,0.47645126124796555,Rice,Utah,6,6,NA,253370242,2005-12-03
15,1,17:17,2237,3137,Tim Drisdom missed Three Point Jumper.,1,2,-1,0,0.47614339584835497,0.47614339584835497,Rice,Utah,6,6,NA,253370242,2005-12-03
16,1,17:17,2237,3137,JR Harrison Defensive Rebound.,1,2,-1,9,0.47614339584835497,0.47614339584835497,Rice,Utah,6,6,NA,253370242,2005-12-03
17,1,17:08,2228,3128,Cory Pfleiger missed Two Point Layup.,1,2,-1,0,0.47604017155909156,0.47604017155909156,Rice,Utah,6,6,NA,253370242,2005-12-03
18,1,17:08,2228,3128,Bryant Markson Defensive Rebound.,1,2,-1,19,0.47604017155909156,0.47604017155909156,Rice,Utah,6,6,NA,253370242,2005-12-03
19,1,16:49,2209,3109,Jamaal Moore missed Two Point Jumper.,1,2,-1,0,0.4758213927712275,0.4758213927712275,Rice,Utah,6,6,NA,253370242,2005-12-03
20,1,16:49,2209,3109,Bryant Markson Defensive Rebound.,1,2,-1,6,0.4758213927712275,0.4758213927712275,Rice,Utah,6,6,NA,253370242,2005-12-03
21,1,16:43,2203,3103,Johnnie Bryant missed Two Point Layup.,1,2,-1,0,0.47575208439623795,0.47575208439623795,Rice,Utah,6,6,NA,253370242,2005-12-03
22,1,16:43,2203,3103,Tim Drisdom Offensive Rebound.,1,2,-1,14,0.47575208439623795,0.47575208439623795,Rice,Utah,6,6,NA,253370242,2005-12-03
23,1,16:29,2189,3089,Shaun Green made Three Point Jumper.,1,5,-4,11,0.40350771338457503,0.40350771338457503,Rice,Utah,6,6,NA,253370242,2005-12-03
24,1,16:18,2178,3078,JR Harrison made Two Point Layup.,3,5,-2,11,0.45104257079564314,0.45104257079564314,Rice,Utah,6,6,NA,253370242,2005-12-03
25,1,16:07,2167,3067,Shaun Green made Three Point Jumper.,3,8,-5,22,0.3790193711586626,0.3790193711586626,Rice,Utah,6,6,NA,253370242,2005-12-03
26,1,15:45,2145,3045,Official TV Timeout.,3,8,-5,20,0.37780682323070147,0.37780682323070147,Rice,Utah,6,6,NA,253370242,2005-12-03
27,1,15:25,2125,3025,JR Harrison missed Two Point Jumper.,3,8,-5,0,0.3766976172370818,0.3766976172370818,Rice,Utah,6,6,NA,253370242,2005-12-03
28,1,15:25,2125,3025,Utah Defensive Rebound.,3,8,-5,24,0.3766976172370818,0.3766976172370818,Rice,Utah,6,6,NA,253370242,2005-12-03
29,1,15:01,2101,3001,Johnnie Bryant missed Two Point Jumper.,3,8,-5,0,0.3753570292521996,0.3753570292521996,Rice,Utah,6,6,NA,253370242,2005-12-03
30,1,15:01,2101,3001,Jamaal Moore Defensive Rebound.,3,8,-5,14,0.3753570292521996,0.3753570292521996,Rice,Utah,6,6,NA,253370242,2005-12-03
31,1,14:47,2087,2987,Cory Pfleiger missed Two Point Layup.,3,8,-5,0,0.3745698260495475,0.3745698260495475,Rice,Utah,6,6,NA,253370242,2005-12-03
32,1,14:47,2087,2987,Patrick Britton Offensive Rebound.,3,8,-5,5,0.3745698260495475,0.3745698260495475,Rice,Utah,6,6,NA,253370242,2005-12-03
33,1,14:42,2082,2982,Patrick Britton made Two Point Tip Shot.,5,8,-3,20,0.42352497121186555,0.42352497121186555,Rice,Utah,6,6,NA,253370242,2005-12-03
34,1,14:22,2062,2962,Shaun Green missed Two Point Jumper.,5,8,-3,0,0.42281544814470834,0.42281544814470834,Rice,Utah,6,6,NA,253370242,2005-12-03
35,1,14:22,2062,2962,Rice Defensive Rebound.,5,8,-3,15,0.42281544814470834,0.42281544814470834,Rice,Utah,6,6,NA,253370242,2005-12-03
36,1,14:07,2047,2947,JR Harrison missed Two Point Jumper.,5,8,-3,0,0.42227923391959604,0.42227923391959604,Rice,Utah,6,6,NA,253370242,2005-12-03
37,1,14:07,2047,2947,Utah Defensive Rebound.,5,8,-3,0,0.42227923391959604,0.42227923391959604,Rice,Utah,6,6,NA,253370242,2005-12-03
38,1,14:07,2047,2947,Foul on Morris Almond,5,8,-3,6,0.42227923391959604,0.42227923391959604,Rice,Utah,6,6,NA,253370242,2005-12-03
39,1,14:01,2041,2941,Foul on Shaun Green,5,8,-3,0,0.4220637290252552,0.4220637290252552,Rice,Utah,6,6,NA,253370242,2005-12-03
40,1,14:01,2041,2941,Rodney Foster missed Free Throw.,5,8,-3,0,0.4220637290252552,0.4220637290252552,Rice,Utah,6,6,NA,253370242,2005-12-03
41,1,14:01,2041,2941,Rice Defensive Rebound.,5,8,-3,0,0.4220637290252552,0.4220637290252552,Rice,Utah,6,6,NA,253370242,2005-12-03
42,1,14:01,2041,2941,Rodney Foster made Free Throw.,6,8,-2,14,0.44780628203614325,0.44780628203614325,Rice,Utah,6,6,NA,253370242,2005-12-03
43,1,13:47,2027,2927,Bryant Markson made Two Point Layup.,6,10,-4,33,0.39607695404435833,0.39607695404435833,Rice,Utah,6,6,NA,253370242,2005-12-03
44,1,13:14,1994,2894,Shaun Green missed Three Point Jumper.,6,10,-4,0,0.39450209020360794,0.39450209020360794,Rice,Utah,6,6,NA,253370242,2005-12-03
45,1,13:14,1994,2894,Morris Almond Defensive Rebound.,6,10,-4,35,0.39450209020360794,0.39450209020360794,Rice,Utah,6,6,NA,253370242,2005-12-03
46,1,12:39,1959,2859,Morris Almond missed Three Point Jumper.,6,10,-4,0,0.39280339991386426,0.39280339991386426,Rice,Utah,6,6,NA,253370242,2005-12-03
47,1,12:39,1959,2859,Bryant Markson Defensive Rebound.,6,10,-4,11,0.39280339991386426,0.39280339991386426,Rice,Utah,6,6,NA,253370242,2005-12-03
48,1,12:28,1948,2848,Foul on Patrick Britton,6,10,-4,32,0.39226308444526226,0.39226308444526226,Rice,Utah,6,6,NA,253370242,2005-12-03
49,1,11:56,1916,2816,Morris Almond made Two Point Jumper.,8,10,-2,23,0.44466883428171733,0.44466883428171733,Rice,Utah,6,6,NA,253370242,2005-12-03
50,1,11:33,1893,2793,Foul on Patrick Britton,8,10,-2,0,0.44407756204327364,0.44407756204327364,Rice,Utah,6,6,NA,253370242,2005-12-03
51,1,11:33,1893,2793,Official TV Timeout.,8,10,-2,0,0.44407756204327364,0.44407756204327364,Rice,Utah,6,6,NA,253370242,2005-12-03
52,1,11:33,1893,2793,Lawrence Borha made Free Throw.,8,11,-3,0,0.4165519282162206,0.4165519282162206,Rice,Utah,6,6,NA,253370242,2005-12-03
53,1,11:33,1893,2793,Lawrence Borha missed Free Throw.,8,11,-3,0,0.4165519282162206,0.4165519282162206,Rice,Utah,6,6,NA,253370242,2005-12-03
54,1,11:33,1893,2793,Patrick Britton Defensive Rebound.,8,11,-3,19,0.4165519282162206,0.4165519282162206,Rice,Utah,6,6,NA,253370242,2005-12-03
55,1,11:14,1874,2774,Foul on Luke Nevill,8,11,-3,0,0.4158307400508965,0.4158307400508965,Rice,Utah,6,6,NA,253370242,2005-12-03
56,1,11:14,1874,2774,Paulius Packevicius made Free Throw.,9,11,-2,0,0.44358911365063813,0.44358911365063813,Rice,Utah,6,6,NA,253370242,2005-12-03
57,1,11:14,1874,2774,Paulius Packevicius made Free Throw.,10,11,-1,37,0.47170422597965794,0.47170422597965794,Rice,Utah,6,6,NA,253370242,2005-12-03
58,1,10:37,1837,2737,Lawrence Borha made Two Point Jumper.,10,13,-3,9,0.4144206868220977,0.4144206868220977,Rice,Utah,6,6,NA,253370242,2005-12-03
59,1,10:28,1828,2728,Foul on Ricky Johns,10,13,-3,7,0.41407556197755135,0.41407556197755135,Rice,Utah,6,6,NA,253370242,2005-12-03
60,1,10:21,1821,2721,JR Harrison made Three Point Jumper.,13,13,0,18,0.5,0.5,Rice,Utah,6,6,NA,253370242,2005-12-03
61,1,10:03,1803,2703,Lawrence Borha missed Three Point Jumper.,13,13,0,0,0.5,0.5,Rice,Utah,6,6,NA,253370242,2005-12-03
62,1,10:03,1803,2703,Chris Jackson Offensive Rebound.,13,13,0,8,0.5,0.5,Rice,Utah,6,6,NA,253370242,2005-12-03
63,1,9:55,1795,2695,Chris Jackson made Two Point Layup.,13,15,-2,7,0.44153416235979903,0.44153416235979903,Rice,Utah,6,6,NA,253370242,2005-12-03
64,1,9:48,1788,2688,JR Harrison made Two Point Layup.,15,15,0,21,0.5,0.5,Rice,Utah,6,6,NA,253370242,2005-12-03
65,1,9:27,1767,2667,Chris Jackson made Two Point Layup.,15,17,-2,20,0.4407868811788135,0.4407868811788135,Rice,Utah,6,6,NA,253370242,2005-12-03
66,1,9:07,1747,2647,Foul on Chris Jackson,15,17,-2,0,0.44024393034878806,0.44024393034878806,Rice,Utah,6,6,NA,253370242,2005-12-03
67,1,9:07,1747,2647,JR Harrison missed Free Throw.,15,17,-2,0,0.44024393034878806,0.44024393034878806,Rice,Utah,6,6,NA,253370242,2005-12-03
68,1,9:07,1747,2647,Rice Defensive Rebound.,15,17,-2,0,0.44024393034878806,0.44024393034878806,Rice,Utah,6,6,NA,253370242,2005-12-03
69,1,9:07,1747,2647,JR Harrison made Free Throw.,16,17,-1,31,0.47001450825864743,0.47001450825864743,Rice,Utah,6,6,NA,253370242,2005-12-03
70,1,8:36,1716,2616,Johnnie Bryant missed Three Point Jumper.,16,17,-1,0,0.46957984556608334,0.46957984556608334,Rice,Utah,6,6,NA,253370242,2005-12-03
71,1,8:36,1716,2616,Ricky Johns Offensive Rebound.,16,17,-1,6,0.46957984556608334,0.46957984556608334,Rice,Utah,6,6,NA,253370242,2005-12-03
72,1,8:30,1710,2610,Foul on JR Harrison,16,17,-1,19,0.46949424019101954,0.46949424019101954,Rice,Utah,6,6,NA,253370242,2005-12-03
73,1,8:11,1691,2591,Shaun Green missed Three Point Jumper.,16,17,-1,0,0.4692196526147364,0.4692196526147364,Rice,Utah,6,6,NA,253370242,2005-12-03
74,1,8:11,1691,2591,Lawrence Borha Offensive Rebound.,16,17,-1,12,0.4692196526147364,0.4692196526147364,Rice,Utah,6,6,NA,253370242,2005-12-03
75,1,7:59,1679,2579,Johnnie Bryant missed Three Point Jumper.,16,17,-1,0,0.46904567634743816,0.46904567634743816,Rice,Utah,6,6,NA,253370242,2005-12-03
76,1,7:59,1679,2579,Lorenzo Williams Defensive Rebound.,16,17,-1,5,0.46904567634743816,0.46904567634743816,Rice,Utah,6,6,NA,253370242,2005-12-03
77,1,7:54,1674,2574,JR Harrison made Two Point Jumper.,18,17,1,39,0.5310259068173436,0.5310259068173436,Rice,Utah,6,6,NA,253370242,2005-12-03
78,1,7:15,1635,2535,Ricky Johns missed Two Point Jumper.,18,17,1,0,0.5315701792514003,0.5315701792514003,Rice,Utah,6,6,NA,253370242,2005-12-03
79,1,7:15,1635,2535,Utah Defensive Rebound.,18,17,1,0,0.5315701792514003,0.5315701792514003,Rice,Utah,6,6,NA,253370242,2005-12-03
80,1,7:15,1635,2535,Official TV Timeout.,18,17,1,5,0.5315701792514003,0.5315701792514003,Rice,Utah,6,6,NA,253370242,2005-12-03
81,1,7:10,1630,2530,Morris Almond made Two Point Jumper.,20,17,3,22,0.5939145162912608,0.5939145162912608,Rice,Utah,6,6,NA,253370242,2005-12-03
82,1,6:48,1608,2508,Chris Jackson made Two Point Dunk Shot.,20,19,1,22,0.531938158902778,0.531938158902778,Rice,Utah,6,6,NA,253370242,2005-12-03
83,1,6:26,1586,2486,Foul on Bryant Markson,20,19,1,0,0.5322369983066569,0.5322369983066569,Rice,Utah,6,6,NA,253370242,2005-12-03
84,1,6:26,1586,2486,Morris Almond made Free Throw.,21,19,2,0,0.5642070943841324,0.5642070943841324,Rice,Utah,6,6,NA,253370242,2005-12-03
85,1,6:26,1586,2486,Morris Almond made Free Throw.,22,19,3,27,0.595652152557261,0.595652152557261,Rice,Utah,6,6,NA,253370242,2005-12-03
86,1,5:59,1559,2459,Foul on Jamaal Moore,22,19,3,0,0.5967259795359117,0.5967259795359117,Rice,Utah,6,6,NA,253370242,2005-12-03
87,1,5:59,1559,2459,Bryant Markson missed Free Throw.,22,19,3,0,0.5967259795359117,0.5967259795359117,Rice,Utah,6,6,NA,253370242,2005-12-03
88,1,5:59,1559,2459,Utah Defensive Rebound.,22,19,3,0,0.5967259795359117,0.5967259795359117,Rice,Utah,6,6,NA,253370242,2005-12-03
89,1,5:59,1559,2459,Bryant Markson missed Free Throw.,22,19,3,0,0.5967259795359117,0.5967259795359117,Rice,Utah,6,6,NA,253370242,2005-12-03
90,1,5:59,1559,2459,Shaun Green Offensive Rebound.,22,19,3,0,0.5967259795359117,0.5967259795359117,Rice,Utah,6,6,NA,253370242,2005-12-03
91,1,5:59,1559,2459,Shaun Green missed Two Point Layup.,22,19,3,0,0.5967259795359117,0.5967259795359117,Rice,Utah,6,6,NA,253370242,2005-12-03
92,1,5:59,1559,2459,Chris Jackson Offensive Rebound.,22,19,3,9,0.5967259795359117,0.5967259795359117,Rice,Utah,6,6,NA,253370242,2005-12-03
93,1,5:50,1550,2450,Chris Jackson made Two Point Layup.,22,21,1,20,0.532732199794286,0.532732199794286,Rice,Utah,6,6,NA,253370242,2005-12-03
94,1,5:30,1530,2430,Foul on Johnnie Bryant,22,21,1,0,0.5330146284419034,0.5330146284419034,Rice,Utah,6,6,NA,253370242,2005-12-03
95,1,5:30,1530,2430,Lorenzo Williams made Free Throw.,23,21,2,0,0.5657426280477328,0.5657426280477328,Rice,Utah,6,6,NA,253370242,2005-12-03
96,1,5:30,1530,2430,Lorenzo Williams made Free Throw.,24,21,3,24,0.5979072382081879,0.5979072382081879,Rice,Utah,6,6,NA,253370242,2005-12-03
97,1,5:06,1506,2406,Johnnie Bryant missed Three Point Jumper.,24,21,3,15,0.5989200862087086,0.5989200862087086,Rice,Utah,6,6,NA,253370242,2005-12-03
98,1,4:51,1491,2391,Morris Almond made Three Point Jumper.,27,21,6,14,0.6915520816894423,0.6915520816894423,Rice,Utah,6,6,NA,253370242,2005-12-03
99,1,4:37,1477,2377,Utah 20 Second Timeout.,27,21,6,15,0.6926681101414529,0.6926681101414529,Rice,Utah,5,6,NA,253370242,2005-12-03
100,1,4:22,1462,2362,Shaun Green made Two Point Layup.,27,23,4,17,0.633116644319362,0.633116644319362,Rice,Utah,5,6,NA,253370242,2005-12-03
101,1,4:05,1445,2345,JR Harrison missed Three Point Jumper.,27,23,4,0,0.634168479430647,0.634168479430647,Rice,Utah,5,6,NA,253370242,2005-12-03
102,1,4:05,1445,2345,Johnnie Bryant Defensive Rebound.,27,23,4,6,0.634168479430647,0.634168479430647,Rice,Utah,5,6,NA,253370242,2005-12-03
103,1,3:59,1439,2339,Foul on JR Harrison,27,23,4,0,0.6345372617031436,0.6345372617031436,Rice,Utah,5,6,NA,253370242,2005-12-03
104,1,3:59,1439,2339,Lawrence Borha missed Free Throw.,27,23,4,0,0.6345372617031436,0.6345372617031436,Rice,Utah,5,6,NA,253370242,2005-12-03
105,1,3:59,1439,2339,Shaun Green Offensive Rebound.,27,23,4,3,0.6345372617031436,0.6345372617031436,Rice,Utah,5,6,NA,253370242,2005-12-03
106,1,3:56,1436,2336,Shaun Green made Two Point Layup.,27,25,2,33,0.5686289764534042,0.5686289764534042,Rice,Utah,5,6,NA,253370242,2005-12-03
107,1,3:23,1403,2303,Morris Almond made Three Point Jumper.,30,25,5,19,0.668442453113294,0.668442453113294,Rice,Utah,5,6,NA,253370242,2005-12-03
108,1,3:04,1384,2284,Shaun Green made Two Point Jumper.,30,27,3,11,0.60448933006471,0.60448933006471,Rice,Utah,5,6,NA,253370242,2005-12-03
109,1,2:53,1373,2273,Lorenzo Williams missed Two Point Layup.,30,27,3,0,0.6049721019268962,0.6049721019268962,Rice,Utah,5,6,NA,253370242,2005-12-03
110,1,2:53,1373,2273,JR Harrison Offensive Rebound.,30,27,3,33,0.6049721019268962,0.6049721019268962,Rice,Utah,5,6,NA,253370242,2005-12-03
111,1,2:20,1340,2240,Lorenzo Williams made Three Point Jumper.,33,27,6,49,0.7036220358204506,0.7036220358204506,Rice,Utah,5,6,NA,253370242,2005-12-03
112,1,1:31,1291,2191,Tim Drisdom made Two Point Layup.,33,29,4,11,0.6431335997642977,0.6431335997642977,Rice,Utah,5,6,NA,253370242,2005-12-03
113,1,1:20,1280,2180,Foul on Shaun Green,33,29,4,0,0.643821278015546,0.643821278015546,Rice,Utah,5,6,NA,253370242,2005-12-03
114,1,1:20,1280,2180,Lorenzo Williams made Free Throw.,34,29,5,0,0.6769927226692155,0.6769927226692155,Rice,Utah,5,6,NA,253370242,2005-12-03
115,1,1:20,1280,2180,Lorenzo Williams made Free Throw.,35,29,6,3,0.7084737187999415,0.7084737187999415,Rice,Utah,5,6,NA,253370242,2005-12-03
116,1,1:17,1277,2177,Lawrence Borha missed Two Point Jumper.,35,29,6,0,0.7087313868046582,0.7087313868046582,Rice,Utah,5,6,NA,253370242,2005-12-03
117,1,1:17,1277,2177,Tim Drisdom Offensive Rebound.,35,29,6,19,0.7087313868046582,0.7087313868046582,Rice,Utah,5,6,NA,253370242,2005-12-03
118,1,0:58,1258,2158,Foul on Shaun Green,35,29,6,0,0.7104099993513779,0.7104099993513779,Rice,Utah,5,6,NA,253370242,2005-12-03
119,1,0:58,1258,2158,Rodney Foster made Free Throw.,36,29,7,0,0.7401866363832517,0.7401866363832517,Rice,Utah,5,6,NA,253370242,2005-12-03
120,1,0:58,1258,2158,Rodney Foster made Free Throw.,37,29,8,15,0.76790183770405,0.76790183770405,Rice,Utah,5,6,NA,253370242,2005-12-03
121,1,0:43,1243,2143,Chris Jackson missed Two Point Layup.,37,29,8,0,0.7695051701193694,0.7695051701193694,Rice,Utah,5,6,NA,253370242,2005-12-03
122,1,0:43,1243,2143,Chris Jackson Offensive Rebound.,37,29,8,25,0.7695051701193694,0.7695051701193694,Rice,Utah,5,6,NA,253370242,2005-12-03
123,1,0:18,1218,2118,Bryant Markson missed Two Point Jumper.,37,29,8,0,0.7723403055845683,0.7723403055845683,Rice,Utah,5,6,NA,253370242,2005-12-03
124,1,0:18,1218,2118,Lawrence Borha Offensive Rebound.,37,29,8,7,0.7723403055845683,0.7723403055845683,Rice,Utah,5,6,NA,253370242,2005-12-03
125,1,0:11,1211,2111,Tim Drisdom made Two Point Jumper.,37,31,6,0,0.7149899784377088,0.7149899784377088,Rice,Utah,5,6,NA,253370242,2005-12-03
126,1,0:11,1211,2111,Rice 20 Second Timeout.,37,31,6,7,0.7149899784377088,0.7149899784377088,Rice,Utah,5,5,NA,253370242,2005-12-03
127,1,0:04,1204,2104,Lorenzo Williams missed Three Point Jumper.,37,31,6,0,0.7157232584348834,0.7157232584348834,Rice,Utah,5,5,NA,253370242,2005-12-03
128,1,0:04,1204,2104,Utah Defensive Rebound.,37,31,6,4,0.7157232584348834,0.7157232584348834,Rice,Utah,5,5,NA,253370242,2005-12-03
129,1,0:00,1200,2100,End of the 1st Half.,37,31,6,0,0.7161370692370593,0.7161370692370593,Rice,Utah,5,5,NA,253370242,2005-12-03
130,2,20:00,1200,2100,PLAY,37,31,6,4,0.7161370692370593,0.7161370692370593,Rice,Utah,5,5,NA,253370242,2005-12-03
131,2,19:56,1196,2096,Cory Pfleiger missed Three Point Jumper.,37,31,6,0,0.7165472415666718,0.7165472415666718,Rice,Utah,5,5,NA,253370242,2005-12-03
132,2,19:56,1196,2096,Shaun Green Defensive Rebound.,37,31,6,47,0.7165472415666718,0.7165472415666718,Rice,Utah,5,5,NA,253370242,2005-12-03
133,2,19:09,1149,2049,Jamaal Moore missed Two Point Jumper.,37,31,6,0,0.7211694179792126,0.7211694179792126,Rice,Utah,5,5,NA,253370242,2005-12-03
134,2,19:09,1149,2049,Chris Jackson Defensive Rebound.,37,31,6,20,0.7211694179792126,0.7211694179792126,Rice,Utah,5,5,NA,253370242,2005-12-03
135,2,18:49,1129,2029,Chris Jackson missed Three Point Jumper.,37,31,6,0,0.7230793831725605,0.7230793831725605,Rice,Utah,5,5,NA,253370242,2005-12-03
136,2,18:49,1129,2029,Cory Pfleiger Defensive Rebound.,37,31,6,21,0.7230793831725605,0.7230793831725605,Rice,Utah,5,5,NA,253370242,2005-12-03
137,2,18:28,1108,2008,Lorenzo Williams missed Three Point Jumper.,37,31,6,0,0.725089990122813,0.725089990122813,Rice,Utah,5,5,NA,253370242,2005-12-03
138,2,18:28,1108,2008,Johnnie Bryant Defensive Rebound.,37,31,6,10,0.725089990122813,0.725089990122813,Rice,Utah,5,5,NA,253370242,2005-12-03
139,2,18:18,1098,1998,Tim Drisdom made Three Point Jumper.,37,34,3,23,0.619483432405467,0.619483432405467,Rice,Utah,5,5,NA,253370242,2005-12-03
140,2,17:55,1075,1975,Patrick Britton made Two Point Jumper.,39,34,5,27,0.6946201754462424,0.6946201754462424,Rice,Utah,5,5,NA,253370242,2005-12-03
141,2,17:28,1048,1948,Johnnie Bryant made Two Point Layup.,39,36,3,27,0.6224991578067698,0.6224991578067698,Rice,Utah,5,5,NA,253370242,2005-12-03
142,2,17:01,1021,1921,JR Harrison made Two Point Jumper.,41,36,5,30,0.6997954472127222,0.6997954472127222,Rice,Utah,5,5,NA,253370242,2005-12-03
143,2,16:31,991,1891,Shaun Green made Two Point Jumper.,41,38,3,14,0.6264686812547797,0.6264686812547797,Rice,Utah,5,5,NA,253370242,2005-12-03
144,2,16:17,977,1877,Jamaal Moore missed Two Point Layup.,41,38,3,0,0.6275678663365505,0.6275678663365505,Rice,Utah,5,5,NA,253370242,2005-12-03
145,2,16:17,977,1877,Chris Jackson Defensive Rebound.,41,38,3,20,0.6275678663365505,0.6275678663365505,Rice,Utah,5,5,NA,253370242,2005-12-03
146,2,15:57,957,1857,Shaun Green missed Two Point Jumper.,41,38,3,0,0.6291745858613803,0.6291745858613803,Rice,Utah,5,5,NA,253370242,2005-12-03
147,2,15:57,957,1857,Lorenzo Williams Defensive Rebound.,41,38,3,6,0.6291745858613803,0.6291745858613803,Rice,Utah,5,5,NA,253370242,2005-12-03
148,2,15:51,951,1851,Foul on Tim Drisdom,41,38,3,0,0.6296272925166525,0.6296272925166525,Rice,Utah,5,5,NA,253370242,2005-12-03
149,2,15:51,951,1851,Official TV Timeout.,41,38,3,25,0.6296272925166525,0.6296272925166525,Rice,Utah,5,5,NA,253370242,2005-12-03
150,2,15:26,926,1826,Jamaal Moore missed Two Point Jumper.,41,38,3,0,0.631375481824851,0.631375481824851,Rice,Utah,5,5,NA,253370242,2005-12-03
151,2,15:26,926,1826,Johnnie Bryant Defensive Rebound.,41,38,3,7,0.631375481824851,0.631375481824851,Rice,Utah,5,5,NA,253370242,2005-12-03
152,2,15:19,919,1819,Johnnie Bryant made Two Point Layup.,41,40,1,31,0.5448862525095779,0.5448862525095779,Rice,Utah,5,5,NA,253370242,2005-12-03
153,2,14:48,888,1788,Foul on Tim Drisdom,41,40,1,12,0.5455724632198637,0.5455724632198637,Rice,Utah,5,5,NA,253370242,2005-12-03
154,2,14:36,876,1776,JR Harrison made Free Throw.,42,40,2,0,0.590899932071054,0.590899932071054,Rice,Utah,5,5,NA,253370242,2005-12-03
155,2,14:36,876,1776,JR Harrison made Free Throw.,43,40,3,10,0.63449056833075,0.63449056833075,Rice,Utah,5,5,NA,253370242,2005-12-03
156,2,14:26,866,1766,Foul on Lorenzo Williams,43,40,3,0,0.635100408213449,0.635100408213449,Rice,Utah,5,5,NA,253370242,2005-12-03
157,2,14:26,866,1766,Bryant Markson missed Two Point Layup.,43,40,3,0,0.635100408213449,0.635100408213449,Rice,Utah,5,5,NA,253370242,2005-12-03
158,2,14:26,866,1766,Luke Nevill Offensive Rebound.,43,40,3,6,0.635100408213449,0.635100408213449,Rice,Utah,5,5,NA,253370242,2005-12-03
159,2,14:20,860,1760,Foul on Jamaal Moore,43,40,3,0,0.6354701069789175,0.6354701069789175,Rice,Utah,5,5,NA,253370242,2005-12-03
160,2,14:20,860,1760,Luke Nevill made Free Throw.,43,41,2,0,0.5915808362054731,0.5915808362054731,Rice,Utah,5,5,NA,253370242,2005-12-03
161,2,14:20,860,1760,Luke Nevill made Free Throw.,43,42,1,25,0.5461810449710707,0.5461810449710707,Rice,Utah,5,5,NA,253370242,2005-12-03
162,2,13:55,835,1735,Paulius Packevicius made Two Point Layup.,45,42,3,0,0.6370705625066904,0.6370705625066904,Rice,Utah,5,5,NA,253370242,2005-12-03
163,2,13:55,835,1735,Foul on Luke Nevill,45,42,3,0,0.6370705625066904,0.6370705625066904,Rice,Utah,5,5,NA,253370242,2005-12-03
164,2,13:55,835,1735,Paulius Packevicius missed Two Point Layup.,45,42,3,4,0.6370705625066904,0.6370705625066904,Rice,Utah,5,5,NA,253370242,2005-12-03
165,2,13:51,831,1731,Paulius Packevicius missed Two Point Layup.,45,42,3,0,0.637339366764226,0.637339366764226,Rice,Utah,5,5,NA,253370242,2005-12-03
166,2,13:51,831,1731,Shaun Green Defensive Rebound.,45,42,3,24,0.637339366764226,0.637339366764226,Rice,Utah,5,5,NA,253370242,2005-12-03
167,2,13:27,807,1707,Lawrence Borha made Three Point Jumper.,45,45,0,8,0.5,0.5,Rice,Utah,5,5,NA,253370242,2005-12-03
168,2,13:19,799,1699,JR Harrison made Two Point Dunk Shot.,47,45,2,46,0.5945126261240116,0.5945126261240116,Rice,Utah,5,5,NA,253370242,2005-12-03
169,2,12:33,753,1653,Lorenzo Williams made Two Point Layup.,49,45,4,36,0.6877918468464281,0.6877918468464281,Rice,Utah,5,5,NA,253370242,2005-12-03
170,2,11:57,717,1617,Foul on Paulius Packevicius,49,45,4,7,0.6929810489101655,0.6929810489101655,Rice,Utah,5,5,NA,253370242,2005-12-03
171,2,11:50,710,1610,Official TV Timeout.,49,45,4,15,0.6939308063536163,0.6939308063536163,Rice,Utah,5,5,NA,253370242,2005-12-03
172,2,11:35,695,1595,Luke Nevill missed Two Point Layup.,49,45,4,0,0.6958290963609033,0.6958290963609033,Rice,Utah,5,5,NA,253370242,2005-12-03
173,2,11:35,695,1595,Utah Defensive Rebound.,49,45,4,7,0.6958290963609033,0.6958290963609033,Rice,Utah,5,5,NA,253370242,2005-12-03
174,2,11:28,688,1588,Jonas Langvad made Three Point Jumper.,49,48,1,16,0.5517804681873376,0.5517804681873376,Rice,Utah,5,5,NA,253370242,2005-12-03
175,2,11:12,672,1572,Rodney Foster missed Two Point Layup.,49,48,1,0,0.5523188270408762,0.5523188270408762,Rice,Utah,5,5,NA,253370242,2005-12-03
176,2,11:12,672,1572,Patrick Britton Offensive Rebound.,49,48,1,4,0.5523188270408762,0.5523188270408762,Rice,Utah,5,5,NA,253370242,2005-12-03
177,2,11:08,668,1568,Morris Almond made Three Point Jumper.,52,48,4,45,0.6989522729340473,0.6989522729340473,Rice,Utah,5,5,NA,253370242,2005-12-03
178,2,10:23,623,1523,Lorenzo Williams made Two Point Layup.,54,48,6,0,0.786009639073949,0.786009639073949,Rice,Utah,5,5,NA,253370242,2005-12-03
179,2,10:23,623,1523,Utah 20 Second Timeout.,54,48,6,25,0.786009639073949,0.786009639073949,Rice,Utah,4,5,NA,253370242,2005-12-03
180,2,9:58,598,1498,Luke Nevill made Two Point Layup.,54,50,4,26,0.7076445720836724,0.7076445720836724,Rice,Utah,4,5,NA,253370242,2005-12-03
181,2,9:32,572,1472,Morris Almond missed Two Point Jumper.,54,50,4,0,0.7120096455469013,0.7120096455469013,Rice,Utah,4,5,NA,253370242,2005-12-03
182,2,9:32,572,1472,Bryant Markson Defensive Rebound.,54,50,4,17,0.7120096455469013,0.7120096455469013,Rice,Utah,4,5,NA,253370242,2005-12-03
183,2,9:15,555,1455,Bryant Markson made Two Point Layup.,54,52,2,0,0.6132407129066141,0.6132407129066141,Rice,Utah,4,5,NA,253370242,2005-12-03
184,2,9:15,555,1455,Foul on Patrick Britton,54,52,2,0,0.6132407129066141,0.6132407129066141,Rice,Utah,4,5,NA,253370242,2005-12-03
185,2,9:15,555,1455,Bryant Markson made Free Throw.,54,53,1,7,0.5573656659758498,0.5573656659758498,Rice,Utah,4,5,NA,253370242,2005-12-03
186,2,9:08,548,1448,Foul on Johnnie Bryant,54,53,1,17,0.5578364888920876,0.5578364888920876,Rice,Utah,4,5,NA,253370242,2005-12-03
