play_id,half,time_remaining_half,secs_remaining,secs_remaining_absolute,description,home_score,away_score,score_diff,play_length,win_prob,naive_win_prob,home,away,home_time_out_remaining,away_time_out_remaining,home_favored_by,game_id,date
164,2,19:21,1161,1161,Foul on Ruben Boykin Jr.,50,42,8,7,0.7789191489573057,0.7789191489573057,Arizona,Northern Arizona,6,4,NA,263190012,2006-11-15
165,2,19:14,1154,1154,Chase Budinger made Two Point Jumper.  Assisted by Mustafa Shakur.,52,42,10,9,0.8291772544020691,0.8291772544020691,Arizona,Northern Arizona,6,4,NA,263190012,2006-11-15
166,2,19:05,1145,1145,Deveric Taylor missed Two Point Jumper.,52,42,10,0,0.8301876621623027,0.8301876621623027,Arizona,Northern Arizona,6,4,NA,263190012,2006-11-15
167,2,19:05,1145,1145,Mustafa Shakur Defensive Rebound.,52,42,10,10,0.8301876621623027,0.8301876621623027,Arizona,Northern Arizona,6,4,NA,263190012,2006-11-15
168,2,18:55,1135,1135,Mustafa Shakur made Two Point Layup.,54,42,12,6,0.8714526309854461,0.8714526309854461,Arizona,Northern Arizona,6,4,NA,263190012,2006-11-15
169,2,18:49,1129,1129,Northern Arizona Full Timeout.,54,42,12,5,0.8720911736687397,0.8720911736687397,Arizona,Northern Arizona,6,3,NA,263190012,2006-11-15
170,2,18:44,1124,1124,Tyrone Bazy made Two Point Layup.  Assisted by Ruben Boykin Jr..,54,44,10,15,0.8325238056687315,0.8325238056687315,Arizona,Northern Arizona,6,3,NA,263190012,2006-11-15
171,2,18:29,1109,1109,Marcus Williams missed Two Point Layup.,54,44,10,0,0.834189481386568,0.834189481386568,Arizona,Northern Arizona,6,3,NA,263190012,2006-11-15
172,2,18:29,1109,1109,Ruben Boykin Jr. Defensive Rebound.,54,44,10,7,0.834189481386568,0.834189481386568,Arizona,Northern Arizona,6,3,NA,263190012,2006-11-15
173,2,18:22,1102,1102,Foul on Marcus Williams,54,44,10,4,0.8349700251226577,0.8349700251226577,Arizona,Northern Arizona,6,3,NA,263190012,2006-11-15
174,2,18:18,1098,1098,Ryan McCurdy missed Two Point Jumper.,54,44,10,0,0.8354176597360773,0.8354176597360773,Arizona,Northern Arizona,6,3,NA,263190012,2006-11-15
175,2,18:18,1098,1098,Chase Budinger Defensive Rebound.,54,44,10,8,0.8354176597360773,0.8354176597360773,Arizona,Northern Arizona,6,3,NA,263190012,2006-11-15
176,2,18:10,1090,1090,Tyrone Bazy Steal.,54,44,10,2,0.8363175151470482,0.8363175151470482,Arizona,Northern Arizona,6,3,NA,263190012,2006-11-15
177,2,18:08,1088,1088,Foul on Chase Budinger,54,44,10,0,0.8365435972992059,0.8365435972992059,Arizona,Northern Arizona,6,3,NA,263190012,2006-11-15
178,2,18:08,1088,1088,Tyrone Bazy made Free Throw.,54,45,9,0,0.8129751579492595,0.8129751579492595,Arizona,Northern Arizona,6,3,NA,263190012,2006-11-15
179,2,18:08,1088,1088,Tyrone Bazy made Free Throw.,54,46,8,6,0.7868742134320473,0.7868742134320473,Arizona,Northern Arizona,6,3,NA,263190012,2006-11-15
180,2,18:02,1082,1082,Marcus Williams missed Two Point Jumper.,54,46,8,0,0.7875431066893874,0.7875431066893874,Arizona,Northern Arizona,6,3,NA,263190012,2006-11-15
181,2,18:02,1082,1082,Marcus Williams Offensive Rebound.,54,46,8,0,0.7875431066893874,0.7875431066893874,Arizona,Northern Arizona,6,3,NA,263190012,2006-11-15
182,2,18:02,1082,1082,Foul on Ryan McCurdy,54,46,8,0,0.7875431066893874,0.7875431066893874,Arizona,Northern Arizona,6,3,NA,263190012,2006-11-15
183,2,18:02,1082,1082,Foul on Stephen Sir,54,46,8,0,0.7875431066893874,0.7875431066893874,Arizona,Northern Arizona,6,3,NA,263190012,2006-11-15
184,2,18:02,1082,1082,Foul on Marques Green,54,46,8,9,0.7875431066893874,0.7875431066893874,Arizona,Northern Arizona,6,3,NA,263190012,2006-11-15
185,2,17:53,1073,1073,Ruben Boykin Jr. Steal.,54,46,8,8,0.7885577163409561,0.7885577163409561,Arizona,Northern Arizona,6,3,NA,263190012,2006-11-15
186,2,17:45,1065,1065,Nathan Geiser missed Three Point Jumper.,54,46,8,0,0.7894727105191516,0.7894727105191516,Arizona,Northern Arizona,6,3,NA,263190012,2006-11-15
187,2,17:45,1065,1065,Arizona Defensive Rebound.,54,46,8,14,0.7894727105191516,0.7894727105191516,Arizona,Northern Arizona,6,3,NA,263190012,2006-11-15
188,2,17:31,1051,1051,Jordan Hill made Two Point Layup.  Assisted by Ivan Radenovic.,56,46,10,18,0.8408449831950381,0.8408449831950381,Arizona,Northern Arizona,6,3,NA,263190012,2006-11-15
189,2,17:13,1033,1033,Josh Wilson missed Two Point Layup.,56,46,10,2,0.8430494531248773,0.8430494531248773,Arizona,Northern Arizona,6,3,NA,263190012,2006-11-15
190,2,17:11,1031,1031,Mustafa Shakur Defensive Rebound.,56,46,10,3,0.8433000868953453,0.8433000868953453,Arizona,Northern Arizona,6,3,NA,263190012,2006-11-15
191,2,17:08,1028,1028,Mustafa Shakur made Two Point Layup.,58,46,12,21,0.8831936041270402,0.8831936041270402,Arizona,Northern Arizona,6,3,NA,263190012,2006-11-15
192,2,16:47,1007,1007,Nathan Geiser missed Three Point Jumper.,58,46,12,0,0.8857511442470443,0.8857511442470443,Arizona,Northern Arizona,6,3,NA,263190012,2006-11-15
193,2,16:47,1007,1007,Northern Arizona Defensive Rebou.,58,46,12,15,0.8857511442470443,0.8857511442470443,Arizona,Northern Arizona,6,3,NA,263190012,2006-11-15
194,2,16:32,992,992,Foul on Ruben Boykin Jr.,58,46,12,12,0.8876623312274923,0.8876623312274923,Arizona,Northern Arizona,6,3,NA,263190012,2006-11-15
195,2,16:20,980,980,Foul on Ryan McCurdy,58,46,12,0,0.889247246181437,0.889247246181437,Arizona,Northern Arizona,6,3,NA,263190012,2006-11-15
196,2,16:20,980,980,Ivan Radenovic made Free Throw.,59,46,13,0,0.9052238638194074,0.9052238638194074,Arizona,Northern Arizona,6,3,NA,263190012,2006-11-15
197,2,16:20,980,980,Ivan Radenovic made Free Throw.,60,46,14,20,0.9191054357417342,0.9191054357417342,Arizona,Northern Arizona,6,3,NA,263190012,2006-11-15
198,2,16:00,960,960,Ruben Boykin Jr. missed Two Point Jumper.,60,46,14,0,0.9214722576193891,0.9214722576193891,Arizona,Northern Arizona,6,3,NA,263190012,2006-11-15
199,2,16:00,960,960,Chase Budinger Defensive Rebound.,60,46,14,11,0.9214722576193891,0.9214722576193891,Arizona,Northern Arizona,6,3,NA,263190012,2006-11-15
200,2,15:49,949,949,Jawann McClellan missed Three Point Jumper.,60,46,14,0,0.9226689115621386,0.9226689115621386,Arizona,Northern Arizona,6,3,NA,263190012,2006-11-15
201,2,15:49,949,949,Ruben Boykin Jr. Defensive Rebound.,60,46,14,7,0.9226689115621386,0.9226689115621386,Arizona,Northern Arizona,6,3,NA,263190012,2006-11-15
202,2,15:42,942,942,Deveric Taylor missed Three Point Jumper.,60,46,14,0,0.9233875826186504,0.9233875826186504,Arizona,Northern Arizona,6,3,NA,263190012,2006-11-15
203,2,15:42,942,942,Chase Budinger Defensive Rebound.,60,46,14,7,0.9233875826186504,0.9233875826186504,Arizona,Northern Arizona,6,3,NA,263190012,2006-11-15
204,2,15:35,935,935,Mustafa Shakur made Two Point Layup.,62,46,16,19,0.945632478229848,0.945632478229848,Arizona,Northern Arizona,6,3,NA,263190012,2006-11-15
205,2,15:16,916,916,Foul on Ivan Radenovic,62,46,16,0,0.9470947792028399,0.9470947792028399,Arizona,Northern Arizona,6,3,NA,263190012,2006-11-15
206,2,15:16,916,916,Official TV Timeout.,62,46,16,0,0.9470947792028399,0.9470947792028399,Arizona,Northern Arizona,6,3,NA,263190012,2006-11-15
207,2,15:16,916,916,Kyle Landry made Free Throw.,62,47,15,0,0.9372970097969383,0.9372970097969383,Arizona,Northern Arizona,6,3,NA,263190012,2006-11-15
208,2,15:16,916,916,Kyle Landry made Free Throw.,62,48,14,8,0.9258268498268246,0.9258268498268246,Arizona,Northern Arizona,6,3,NA,263190012,2006-11-15
209,2,15:08,908,908,Jawann McClellan made Two Point Jumper.  Assisted by Mustafa Shakur.,64,48,16,17,0.9476735696849601,0.9476735696849601,Arizona,Northern Arizona,6,3,NA,263190012,2006-11-15
210,2,14:51,891,891,Ruben Boykin Jr. missed Two Point Jumper.,64,48,16,0,0.9488535650223772,0.9488535650223772,Arizona,Northern Arizona,6,3,NA,263190012,2006-11-15
211,2,14:51,891,891,Jordan Hill Defensive Rebound.,64,48,16,18,0.9488535650223772,0.9488535650223772,Arizona,Northern Arizona,6,3,NA,263190012,2006-11-15
212,2,14:33,873,873,Foul on Tyrone Bazy,64,48,16,0,0.9500593759598112,0.9500593759598112,Arizona,Northern Arizona,6,3,NA,263190012,2006-11-15
213,2,14:33,873,873,Jawann McClellan missed Free Throw.,64,48,16,0,0.9500593759598112,0.9500593759598112,Arizona,Northern Arizona,6,3,NA,263190012,2006-11-15
214,2,14:33,873,873,Arizona Defensive Rebound.,64,48,16,0,0.9500593759598112,0.9500593759598112,Arizona,Northern Arizona,6,3,NA,263190012,2006-11-15
215,2,14:33,873,873,Jawann McClellan made Free Throw.,65,48,17,23,0.9581051775091988,0.9581051775091988,Arizona,Northern Arizona,6,3,NA,263190012,2006-11-15
216,2,14:10,850,850,Kyle Landry missed Two Point Jumper.,65,48,17,2,0.9594807195667185,0.9594807195667185,Arizona,Northern Arizona,6,3,NA,263190012,2006-11-15
217,2,14:08,848,848,Jordan Hill Defensive Rebound.,65,48,17,10,0.9596016117217099,0.9596016117217099,Arizona,Northern Arizona,6,3,NA,263190012,2006-11-15
218,2,13:58,838,838,Jawann McClellan missed Three Point Jumper.,65,48,17,0,0.9602124727489816,0.9602124727489816,Arizona,Northern Arizona,6,3,NA,263190012,2006-11-15
219,2,13:58,838,838,Ivan Radenovic Offensive Rebound.,65,48,17,5,0.9602124727489816,0.9602124727489816,Arizona,Northern Arizona,6,3,NA,263190012,2006-11-15
220,2,13:53,833,833,Ivan Radenovic made Two Point Tip Shot.,67,48,19,13,0.9725420181125342,0.9725420181125342,Arizona,Northern Arizona,6,3,NA,263190012,2006-11-15
221,2,13:40,820,820,Marques Green missed Three Point Jumper.,67,48,19,0,0.9731919795696893,0.9731919795696893,Arizona,Northern Arizona,6,3,NA,263190012,2006-11-15
222,2,13:40,820,820,Mustafa Shakur Defensive Rebound.,67,48,19,5,0.9731919795696893,0.9731919795696893,Arizona,Northern Arizona,6,3,NA,263190012,2006-11-15
223,2,13:35,815,815,Mustafa Shakur made Two Point Layup.,69,48,21,0,0.9816731836189829,0.9816731836189829,Arizona,Northern Arizona,6,3,NA,263190012,2006-11-15
224,2,13:35,815,815,Foul on Ruben Boykin Jr.,69,48,21,0,0.9816731836189829,0.9816731836189829,Arizona,Northern Arizona,6,3,NA,263190012,2006-11-15
225,2,13:35,815,815,Northern Arizona Full Timeout.,69,48,21,0,0.9816731836189829,0.9816731836189829,Arizona,Northern Arizona,6,2,NA,263190012,2006-11-15
226,2,13:35,815,815,Mustafa Shakur made Free Throw.,70,48,22,20,0.9847897619257385,0.9847897619257385,Arizona,Northern Arizona,6,2,NA,263190012,2006-11-15
227,2,13:15,795,795,Riley Van Patten made Three Point Jumper.  Assisted by Deveric Taylor.,70,51,19,12,0.9745196970793224,0.9745196970793224,Arizona,Northern Arizona,6,2,NA,263190012,2006-11-15
228,2,13:03,783,783,Foul on Nick Larson,70,51,19,0,0.9752021009623928,0.9752021009623928,Arizona,Northern Arizona,6,2,NA,263190012,2006-11-15
229,2,13:03,783,783,Chase Budinger made Free Throw.,71,51,20,0,0.9794703733819573,0.9794703733819573,Arizona,Northern Arizona,6,2,NA,263190012,2006-11-15
230,2,13:03,783,783,Chase Budinger made Free Throw.,72,51,21,13,0.9830167750153751,0.9830167750153751,Arizona,Northern Arizona,6,2,NA,263190012,2006-11-15
231,2,12:50,770,770,Foul on Jordan Hill,72,51,21,19,0.9836086406252135,0.9836086406252135,Arizona,Northern Arizona,6,2,NA,263190012,2006-11-15
232,2,12:31,751,751,Kyle Landry missed Two Point Layup.,72,51,21,0,0.9845268942658194,0.9845268942658194,Arizona,Northern Arizona,6,2,NA,263190012,2006-11-15
233,2,12:31,751,751,Jordan Hill Defensive Rebound.,72,51,21,6,0.9845268942658194,0.9845268942658194,Arizona,Northern Arizona,6,2,NA,263190012,2006-11-15
234,2,12:25,745,745,Foul on Riley Van Patten,72,51,21,0,0.9848302247806822,0.9848302247806822,Arizona,Northern Arizona,6,2,NA,263190012,2006-11-15
235,2,12:25,745,745,Mustafa Shakur made Free Throw.,73,51,22,0,0.9875300650518886,0.9875300650518886,Arizona,Northern Arizona,6,2,NA,263190012,2006-11-15
236,2,12:25,745,745,Mustafa Shakur made Free Throw.,74,51,23,11,0.989754400218583,0.989754400218583,Arizona,Northern Arizona,6,2,NA,263190012,2006-11-15
237,2,12:14,734,734,Mustafa Shakur Steal.,74,51,23,10,0.9901791824291508,0.9901791824291508,Arizona,Northern Arizona,6,2,NA,263190012,2006-11-15
238,2,12:04,724,724,Jawann McClellan made Two Point Layup.  Assisted by Mustafa Shakur.,76,51,25,0,0.9936865846351767,0.9936865846351767,Arizona,Northern Arizona,6,2,NA,263190012,2006-11-15
239,2,12:04,724,724,Foul on Marques Green,76,51,25,0,0.9936865846351767,0.9936865846351767,Arizona,Northern Arizona,6,2,NA,263190012,2006-11-15
240,2,12:04,724,724,Jawann McClellan made Free Throw.,77,51,26,23,0.9948371734046766,0.9948371734046766,Arizona,Northern Arizona,6,2,NA,263190012,2006-11-15
241,2,11:41,701,701,Nick Larson missed Three Point Jumper.,77,51,26,0,0.9953030898480054,0.9953030898480054,Arizona,Northern Arizona,6,2,NA,263190012,2006-11-15
242,2,11:41,701,701,Mustafa Shakur Defensive Rebound.,77,51,26,0,0.9953030898480054,0.9953030898480054,Arizona,Northern Arizona,6,2,NA,263190012,2006-11-15
243,2,11:41,701,701,Foul on Jawann McClellan,77,51,26,3,0.9953030898480054,0.9953030898480054,Arizona,Northern Arizona,6,2,NA,263190012,2006-11-15
244,2,11:38,698,698,Official TV Timeout.,77,51,26,10,0.9953562515997398,0.9953562515997398,Arizona,Northern Arizona,6,2,NA,263190012,2006-11-15
245,2,11:28,688,688,Mustafa Shakur Steal.,77,51,26,4,0.9955240259824985,0.9955240259824985,Arizona,Northern Arizona,6,2,NA,263190012,2006-11-15
246,2,11:24,684,684,Mustafa Shakur made Two Point Layup.,79,51,28,0,0.9970873227368107,0.9970873227368107,Arizona,Northern Arizona,6,2,NA,263190012,2006-11-15
247,2,11:24,684,684,Foul on Ryan McCurdy,79,51,28,0,0.9970873227368107,0.9970873227368107,Arizona,Northern Arizona,6,2,NA,263190012,2006-11-15
248,2,11:24,684,684,Mustafa Shakur made Free Throw.,80,51,29,14,0.9976340003876188,0.9976340003876188,Arizona,Northern Arizona,6,2,NA,263190012,2006-11-15
249,2,11:10,670,670,Stephen Sir missed Three Point Jumper.,80,51,29,0,0.9977599935618086,0.9977599935618086,Arizona,Northern Arizona,6,2,NA,263190012,2006-11-15
250,2,11:10,670,670,Mustafa Shakur Defensive Rebound.,80,51,29,7,0.9977599935618086,0.9977599935618086,Arizona,Northern Arizona,6,2,NA,263190012,2006-11-15
251,2,11:03,663,663,Jawann McClellan made Two Point Layup.  Assisted by Mustafa Shakur.,82,51,31,11,0.9985699103550012,0.9985699103550012,Arizona,Northern Arizona,6,2,NA,263190012,2006-11-15
252,2,10:52,652,652,Ryan McCurdy made Two Point Jumper.,82,53,29,14,0.997910659357657,0.997910659357657,Arizona,Northern Arizona,6,2,NA,263190012,2006-11-15
253,2,10:38,638,638,Foul on Ruben Boykin Jr.,82,53,29,0,0.9980240157860412,0.9980240157860412,Arizona,Northern Arizona,6,2,NA,263190012,2006-11-15
254,2,10:38,638,638,Bret Brielmaier made Free Throw.,83,53,30,0,0.9984051125153469,0.9984051125153469,Arizona,Northern Arizona,6,2,NA,263190012,2006-11-15
255,2,10:38,638,638,Bret Brielmaier missed Free Throw.,83,53,30,0,0.9984051125153469,0.9984051125153469,Arizona,Northern Arizona,6,2,NA,263190012,2006-11-15
256,2,10:38,638,638,Ivan Radenovic Offensive Rebound.,83,53,30,18,0.9984051125153469,0.9984051125153469,Arizona,Northern Arizona,6,2,NA,263190012,2006-11-15
257,2,10:20,620,620,Stephen Sir made Three Point Jumper.  Assisted by Josh Wilson.,83,56,27,14,0.9971769956622742,0.9971769956622742,Arizona,Northern Arizona,6,2,NA,263190012,2006-11-15
258,2,10:06,606,606,Chase Budinger made Three Point Jumper.  Assisted by J.P. Prince.,86,56,30,5,0.9986242975807401,0.9986242975807401,Arizona,Northern Arizona,6,2,NA,263190012,2006-11-15
259,2,10:01,601,601,Foul on J.P. Prince,86,56,30,0,0.9986597864108068,0.9986597864108068,Arizona,Northern Arizona,6,2,NA,263190012,2006-11-15
260,2,10:01,601,601,Tyrone Bazy made Three Point Jumper.  Assisted by Josh Wilson.,86,59,27,5,0.9974066980308514,0.9974066980308514,Arizona,Northern Arizona,6,2,NA,263190012,2006-11-15
261,2,9:56,596,596,Chase Budinger missed Three Point Jumper.,86,59,27,0,0.997469305258933,0.997469305258933,Arizona,Northern Arizona,6,2,NA,263190012,2006-11-15
262,2,9:56,596,596,Tyrone Bazy Defensive Rebound.,86,59,27,16,0.997469305258933,0.997469305258933,Arizona,Northern Arizona,6,2,NA,263190012,2006-11-15
263,2,9:40,580,580,Josh Wilson missed Three Point Jumper.,86,59,27,0,0.9976765134779672,0.9976765134779672,Arizona,Northern Arizona,6,2,NA,263190012,2006-11-15
264,2,9:40,580,580,Chase Budinger Defensive Rebound.,86,59,27,2,0.9976765134779672,0.9976765134779672,Arizona,Northern Arizona,6,2,NA,263190012,2006-11-15
265,2,9:38,578,578,Foul on Tyrone Bazy,86,59,27,0,0.9977031589245547,0.9977031589245547,Arizona,Northern Arizona,6,2,NA,263190012,2006-11-15
266,2,9:38,578,578,Chase Budinger made Free Throw.,87,59,28,0,0.9981650128035146,0.9981650128035146,Arizona,Northern Arizona,6,2,NA,263190012,2006-11-15
267,2,9:38,578,578,Chase Budinger made Free Throw.,88,59,29,11,0.9985341325332902,0.9985341325332902,Arizona,Northern Arizona,6,2,NA,263190012,2006-11-15
268,2,9:27,567,567,Stephen Sir made Three Point Jumper.  Assisted by Josh Wilson.,88,62,26,20,0.9973055521120993,0.9973055521120993,Arizona,Northern Arizona,6,2,NA,263190012,2006-11-15
269,2,9:07,547,547,Bret Brielmaier missed Two Point Jumper.,88,62,26,0,0.9976454488141816,0.9976454488141816,Arizona,Northern Arizona,6,2,NA,263190012,2006-11-15
270,2,9:07,547,547,Kyle Landry Defensive Rebound.,88,62,26,15,0.9976454488141816,0.9976454488141816,Arizona,Northern Arizona,6,2,NA,263190012,2006-11-15
271,2,8:52,532,532,Kyle Landry missed Two Point Jumper.,88,62,26,0,0.9978605390848555,0.9978605390848555,Arizona,Northern Arizona,6,2,NA,263190012,2006-11-15
272,2,8:52,532,532,Josh Wilson Offensive Rebound.,88,62,26,10,0.9978605390848555,0.9978605390848555,Arizona,Northern Arizona,6,2,NA,263190012,2006-11-15
273,2,8:42,522,522,Ryan McCurdy made Two Point Layup.  Assisted by Josh Wilson.,88,64,24,11,0.9967463607019804,0.9967463607019804,Arizona,Northern Arizona,6,2,NA,263190012,2006-11-15
274,2,8:31,511,511,Foul on Bret Brielmaier,88,64,24,34,0.9969168271855462,0.9969168271855462,Arizona,Northern Arizona,6,2,NA,263190012,2006-11-15
275,2,7:57,477,477,Ivan Radenovic missed Two Point Layup.,88,64,24,0,0.9973957939714786,0.9973957939714786,Arizona,Northern Arizona,6,2,NA,263190012,2006-11-15
276,2,7:57,477,477,Bret Brielmaier Offensive Rebound.,88,64,24,8,0.9973957939714786,0.9973957939714786,Arizona,Northern Arizona,6,2,NA,263190012,2006-11-15
277,2,7:49,469,469,Bret Brielmaier made Two Point Tip Shot.,90,64,26,12,0.9984889970162224,0.9984889970162224,Arizona,Northern Arizona,6,2,NA,263190012,2006-11-15
278,2,7:37,457,457,Stephen Sir missed Two Point Jumper.,90,64,26,0,0.9986102896722524,0.9986102896722524,Arizona,Northern Arizona,6,2,NA,263190012,2006-11-15
279,2,7:37,457,457,Daniel Dillon Defensive Rebound.,90,64,26,0,0.9986102896722524,0.9986102896722524,Arizona,Northern Arizona,6,2,NA,263190012,2006-11-15
280,2,7:37,457,457,Bret Brielmaier made Two Point Layup.  Assisted by Daniel Dillon.,92,64,28,0,0.9991616306353247,0.9991616306353247,Arizona,Northern Arizona,6,2,NA,263190012,2006-11-15
281,2,7:37,457,457,Foul on Riley Van Patten,92,64,28,0,0.9991616306353247,0.9991616306353247,Arizona,Northern Arizona,6,2,NA,263190012,2006-11-15
282,2,7:37,457,457,Official TV Timeout.,92,64,28,0,0.9991616306353247,0.9991616306353247,Arizona,Northern Arizona,6,2,NA,263190012,2006-11-15
283,2,7:37,457,457,Bret Brielmaier missed Free Throw.,92,64,28,0,0.9991616306353247,0.9991616306353247,Arizona,Northern Arizona,6,2,NA,263190012,2006-11-15
284,2,7:37,457,457,Ryan McCurdy Defensive Rebound.,92,64,28,24,0.9991616306353247,0.9991616306353247,Arizona,Northern Arizona,6,2,NA,263190012,2006-11-15
285,2,7:13,433,433,Nick Larson made Three Point Jumper.  Assisted by Stephen Sir.,92,67,25,22,0.9985423169825467,0.9985423169825467,Arizona,Northern Arizona,6,2,NA,263190012,2006-11-15
286,2,6:51,411,411,Foul on Bret Brielmaier,92,67,25,0,0.9988271453387264,0.9988271453387264,Arizona,Northern Arizona,6,2,NA,263190012,2006-11-15
287,2,6:51,411,411,Nick Larson missed Free Throw.,92,67,25,0,0.9988271453387264,0.9988271453387264,Arizona,Northern Arizona,6,2,NA,263190012,2006-11-15
288,2,6:51,411,411,Northern Arizona Defensive Rebou.,92,67,25,0,0.9988271453387264,0.9988271453387264,Arizona,Northern Arizona,6,2,NA,263190012,2006-11-15
289,2,6:51,411,411,Nick Larson made Free Throw.,92,68,24,12,0.9984643357860794,0.9984643357860794,Arizona,Northern Arizona,6,2,NA,263190012,2006-11-15
290,2,6:39,399,399,Stephen Sir Steal.,92,68,24,5,0.9986182976785221,0.9986182976785221,Arizona,Northern Arizona,6,2,NA,263190012,2006-11-15
291,2,6:34,394,394,Foul on J.P. Prince,92,68,24,0,0.9986771677293999,0.9986771677293999,Arizona,Northern Arizona,6,2,NA,263190012,2006-11-15
292,2,6:34,394,394,Riley Van Patten made Free Throw.,92,69,23,0,0.9982572484409641,0.9982572484409641,Arizona,Northern Arizona,6,2,NA,263190012,2006-11-15
293,2,6:34,394,394,Riley Van Patten made Free Throw.,92,70,22,9,0.9977043365750737,0.9977043365750737,Arizona,Northern Arizona,6,2,NA,263190012,2006-11-15
294,2,6:25,385,385,Jordan Hill missed Two Point Layup.,92,70,22,0,0.9978645264049884,0.9978645264049884,Arizona,Northern Arizona,6,2,NA,263190012,2006-11-15
295,2,6:25,385,385,Riley Van Patten Defensive Rebound.,92,70,22,16,0.9978645264049884,0.9978645264049884,Arizona,Northern Arizona,6,2,NA,263190012,2006-11-15
296,2,6:09,369,369,Foul on Jordan Hill,92,70,22,0,0.9981338317719443,0.9981338317719443,Arizona,Northern Arizona,6,2,NA,263190012,2006-11-15
297,2,6:09,369,369,Ryan McCurdy made Free Throw.,92,71,21,0,0.9975186167737414,0.9975186167737414,Arizona,Northern Arizona,6,2,NA,263190012,2006-11-15
298,2,6:09,369,369,Ryan McCurdy missed Free Throw.,92,71,21,0,0.9975186167737414,0.9975186167737414,Arizona,Northern Arizona,6,2,NA,263190012,2006-11-15
299,2,6:09,369,369,Northern Arizona Defensive Rebou.,92,71,21,0,0.9975186167737414,0.9975186167737414,Arizona,Northern Arizona,6,2,NA,263190012,2006-11-15
300,2,6:09,369,369,Foul on J.P. Prince,92,71,21,0,0.9975186167737414,0.9975186167737414,Arizona,Northern Arizona,6,2,NA,263190012,2006-11-15
301,2,6:09,369,369,Bret Brielmaier missed Free Throw.,92,71,21,0,0.9975186167737414,0.9975186167737414,Arizona,Northern Arizona,6,2,NA,263190012,2006-11-15
302,2,6:09,369,369,Arizona Defensive Rebound.,92,71,21,0,0.9975186167737414,0.9975186167737414,Arizona,Northern Arizona,6,2,NA,263190012,2006-11-15
303,2,6:09,369,369,Bret Brielmaier missed Free Throw.,92,71,21,0,0.9975186167737414,0.9975186167737414,Arizona,Northern Arizona,6,2,NA,263190012,2006-11-15
304,2,6:09,369,369,Stephen Sir Defensive Rebound.,92,71,21,8,0.9975186167737414,0.9975186167737414,Arizona,Northern Arizona,6,2,NA,263190012,2006-11-15
305,2,6:01,361,361,Deveric Taylor missed Two Point Jumper.,92,71,21,0,0.9976849195884175,0.9976849195884175,Arizona,Northern Arizona,6,2,NA,263190012,2006-11-15
306,2,6:01,361,361,Nick Larson Offensive Rebound.,92,71,21,9,0.9976849195884175,0.9976849195884175,Arizona,Northern Arizona,6,2,NA,263190012,2006-11-15
307,2,5:52,352,352,Stephen Sir made Three Point Jumper.  Assisted by Riley Van Patten.,92,74,18,16,0.9948901850781493,0.9948901850781493,Arizona,Northern Arizona,6,2,NA,263190012,2006-11-15
308,2,5:36,336,336,Northern Arizona 20 Second Timeout.,92,74,18,14,0.9955773923802435,0.9955773923802435,Arizona,Northern Arizona,6,1,NA,263190012,2006-11-15
309,2,5:22,322,322,Riley Van Patten missed Three Point Jumper.,92,74,18,0,0.9961904361970068,0.9961904361970068,Arizona,Northern Arizona,6,1,NA,263190012,2006-11-15
310,2,5:22,322,322,Jordan Hill Defensive Rebound.,92,74,18,30,0.9961904361970068,0.9961904361970068,Arizona,Northern Arizona,6,1,NA,263190012,2006-11-15
311,2,4:52,292,292,Nic Wise missed Three Point Jumper.,92,74,18,0,0.997111262839609,0.997111262839609,Arizona,Northern Arizona,6,1,NA,263190012,2006-11-15
312,2,4:52,292,292,Nick Larson Defensive Rebound.,92,74,18,24,0.997111262839609,0.997111262839609,Arizona,Northern Arizona,6,1,NA,263190012,2006-11-15
313,2,4:28,268,268,Nick Larson made Three Point Jumper.  Assisted by Riley Van Patten.,92,77,15,15,0.9919931693566262,0.9919931693566262,Arizona,Northern Arizona,6,1,NA,263190012,2006-11-15
314,2,4:13,253,253,J.P. Prince missed Three Point Jumper.,92,77,15,0,0.9914415793128242,0.9914415793128242,Arizona,Northern Arizona,6,1,NA,263190012,2006-11-15
315,2,4:13,253,253,Deveric Taylor Defensive Rebound.,92,77,15,26,0.9914415793128242,0.9914415793128242,Arizona,Northern Arizona,6,1,NA,263190012,2006-11-15
316,2,3:47,227,227,Foul on Stephen Sir,92,77,15,0,0.9912514668985551,0.9912514668985551,Arizona,Northern Arizona,6,1,NA,263190012,2006-11-15
317,2,3:47,227,227,Official TV Timeout.,92,77,15,0,0.9912514668985551,0.9912514668985551,Arizona,Northern Arizona,6,1,NA,263190012,2006-11-15
318,2,3:47,227,227,Daniel Dillon missed Free Throw.,92,77,15,0,0.9912514668985551,0.9912514668985551,Arizona,Northern Arizona,6,1,NA,263190012,2006-11-15
319,2,3:47,227,227,Arizona Defensive Rebound.,92,77,15,0,0.9912514668985551,0.9912514668985551,Arizona,Northern Arizona,6,1,NA,263190012,2006-11-15
320,2,3:47,227,227,Daniel Dillon made Free Throw.,93,77,16,12,0.9936024433495798,0.9936024433495798,Arizona,Northern Arizona,6,1,NA,263190012,2006-11-15
321,2,3:35,215,215,Josh Wilson missed Three Point Jumper.,93,77,16,0,0.9941572869622921,0.9941572869622921,Arizona,Northern Arizona,6,1,NA,263190012,2006-11-15
322,2,3:35,215,215,Daniel Dillon Defensive Rebound.,93,77,16,18,0.9941572869622921,0.9941572869622921,Arizona,Northern Arizona,6,1,NA,263190012,2006-11-15
323,2,3:17,197,197,Foul on Ryan McCurdy,93,77,16,0,0.9958008776974779,0.9958008776974779,Arizona,Northern Arizona,6,1,NA,263190012,2006-11-15
324,2,3:17,197,197,Ivan Radenovic made Free Throw.,94,77,17,0,0.9970129091813064,0.9970129091813064,Arizona,Northern Arizona,6,1,NA,263190012,2006-11-15
325,2,3:17,197,197,Ivan Radenovic made Free Throw.,95,77,18,10,0.9978758470617426,0.9978758470617426,Arizona,Northern Arizona,6,1,NA,263190012,2006-11-15
326,2,3:07,187,187,Foul on Daniel Dillon,95,77,18,0,0.9984973621472747,0.9984973621472747,Arizona,Northern Arizona,6,1,NA,263190012,2006-11-15
327,2,3:07,187,187,Josh Wilson missed Free Throw.,95,77,18,0,0.9984973621472747,0.9984973621472747,Arizona,Northern Arizona,6,1,NA,263190012,2006-11-15
