play_id,half,time_remaining_half,secs_remaining,secs_remaining_absolute,description,home_score,away_score,score_diff,play_length,win_prob,naive_win_prob,home,away,home_time_out_remaining,away_time_out_remaining,home_favored_by,game_id,date
1,1,20:00,2400,2400,PLAY,0,0,0,10,0.5,0.5,Arizona,Northern Arizona,6,6,NA,263190012,2006-11-15
2,1,19:50,2390,2390,Foul on Stephen Sir,0,0,0,4,0.5,0.5,Arizona,Northern Arizona,6,6,NA,263190012,2006-11-15
3,1,19:46,2386,2386,Chase Budinger made Two Point Jumper.  Assisted by Jawann McClellan.,2,0,2,21,0.5443207085263143,0.5443207085263143,Arizona,Northern Arizona,6,6,NA,263190012,2006-11-15
4,1,19:25,2365,2365,Marcus Williams Steal.,2,0,2,4,0.5447677378565356,0.5447677378565356,Arizona,Northern Arizona,6,6,NA,263190012,2006-11-15
5,1,19:21,2361,2361,Ryan McCurdy Steal.,2,0,2,26,0.5448535841976563,0.5448535841976563,Arizona,Northern Arizona,6,6,NA,263190012,2006-11-15
6,1,18:55,2335,2335,Josh Wilson missed Three Point Jumper.,2,0,2,0,0.5454166796565887,0.5454166796565887,Arizona,Northern Arizona,6,6,NA,263190012,2006-11-15
7,1,18:55,2335,2335,Ivan Radenovic Defensive Rebound.,2,0,2,12,0.5454166796565887,0.5454166796565887,Arizona,Northern Arizona,6,6,NA,263190012,2006-11-15
8,1,18:43,2323,2323,Mustafa Shakur missed Two Point Jumper.,2,0,2,0,0.5456793799013266,0.5456793799013266,Arizona,Northern Arizona,6,6,NA,263190012,2006-11-15
9,1,18:43,2323,2323,Ryan McCurdy Defensive Rebound.,2,0,2,9,0.5456793799013266,0.5456793799013266,Arizona,Northern Arizona,6,6,NA,263190012,2006-11-15
10,1,18:34,2314,2314,Ruben Boykin Jr. Steal.,2,0,2,12,0.5458774918069081,0.5458774918069081,Arizona,Northern Arizona,6,6,NA,263190012,2006-11-15
11,1,18:22,2302,2302,Stephen Sir made Three Point Jumper.  Assisted by Ruben Boykin Jr..,2,3,-1,18,0.4768791578380667,0.4768791578380667,Arizona,Northern Arizona,6,6,NA,263190012,2006-11-15
12,1,18:04,2284,2284,Chase Budinger made Three Point Jumper.  Assisted by Mustafa Shakur.,5,3,2,25,0.5465440686962537,0.5465440686962537,Arizona,Northern Arizona,6,6,NA,263190012,2006-11-15
13,1,17:39,2259,2259,Foul on Stephen Sir,5,3,2,9,0.5471060687074408,0.5471060687074408,Arizona,Northern Arizona,6,6,NA,263190012,2006-11-15
14,1,17:30,2250,2250,Foul on Josh Wilson,5,3,2,10,0.5473096679130885,0.5473096679130885,Arizona,Northern Arizona,6,6,NA,263190012,2006-11-15
15,1,17:20,2240,2240,Ivan Radenovic made Two Point Layup.  Assisted by Mustafa Shakur.,7,3,4,12,0.5942215597164868,0.5942215597164868,Arizona,Northern Arizona,6,6,NA,263190012,2006-11-15
16,1,17:08,2228,2228,Ryan McCurdy made Two Point Layup.  Assisted by Josh Wilson.,7,5,2,9,0.5478098713841724,0.5478098713841724,Arizona,Northern Arizona,6,6,NA,263190012,2006-11-15
17,1,16:59,2219,2219,Foul on Ruben Boykin Jr.,7,5,2,0,0.5480154318654642,0.5480154318654642,Arizona,Northern Arizona,6,6,NA,263190012,2006-11-15
18,1,16:59,2219,2219,Jawann McClellan made Free Throw.,8,5,3,0,0.5717471640502922,0.5717471640502922,Arizona,Northern Arizona,6,6,NA,263190012,2006-11-15
19,1,16:59,2219,2219,Jawann McClellan made Free Throw.,9,5,4,9,0.5951533663527055,0.5951533663527055,Arizona,Northern Arizona,6,6,NA,263190012,2006-11-15
20,1,16:50,2210,2210,Marcus Williams Steal.,9,5,4,2,0.5955541806785867,0.5955541806785867,Arizona,Northern Arizona,6,6,NA,263190012,2006-11-15
21,1,16:48,2208,2208,Marcus Williams made Two Point Dunk Shot.,11,5,6,18,0.6413014407038973,0.6413014407038973,Arizona,Northern Arizona,6,6,NA,263190012,2006-11-15
22,1,16:30,2190,2190,Josh Wilson made Two Point Jumper.  Assisted by Ryan McCurdy.,11,7,4,12,0.5964475337031395,0.5964475337031395,Arizona,Northern Arizona,6,6,NA,263190012,2006-11-15
23,1,16:18,2178,2178,Tyrone Bazy Steal.,11,7,4,5,0.5969850319212389,0.5969850319212389,Arizona,Northern Arizona,6,6,NA,263190012,2006-11-15
24,1,16:13,2173,2173,Tyrone Bazy missed Two Point Layup.,11,7,4,0,0.5972092644660071,0.5972092644660071,Arizona,Northern Arizona,6,6,NA,263190012,2006-11-15
25,1,16:13,2173,2173,Mustafa Shakur Defensive Rebound.,11,7,4,11,0.5972092644660071,0.5972092644660071,Arizona,Northern Arizona,6,6,NA,263190012,2006-11-15
26,1,16:02,2162,2162,Chase Budinger made Three Point Jumper.  Assisted by Jawann McClellan.,14,7,7,14,0.6665968749844235,0.6665968749844235,Arizona,Northern Arizona,6,6,NA,263190012,2006-11-15
27,1,15:48,2148,2148,Official TV Timeout.,14,7,7,18,0.6676171211357483,0.6676171211357483,Arizona,Northern Arizona,6,6,NA,263190012,2006-11-15
28,1,15:30,2130,2130,Tyrone Bazy missed Two Point Layup.,14,7,7,0,0.6689339652096435,0.6689339652096435,Arizona,Northern Arizona,6,6,NA,263190012,2006-11-15
29,1,15:30,2130,2130,Kyle Landry Offensive Rebound.,14,7,7,4,0.6689339652096435,0.6689339652096435,Arizona,Northern Arizona,6,6,NA,263190012,2006-11-15
30,1,15:26,2126,2126,Mustafa Shakur Steal.,14,7,7,2,0.6692274264322882,0.6692274264322882,Arizona,Northern Arizona,6,6,NA,263190012,2006-11-15
31,1,15:24,2124,2124,Mustafa Shakur made Two Point Layup.,16,7,9,4,0.7123626732895354,0.7123626732895354,Arizona,Northern Arizona,6,6,NA,263190012,2006-11-15
32,1,15:20,2120,2120,Foul on Josh Wilson,16,7,9,0,0.7127125196173028,0.7127125196173028,Arizona,Northern Arizona,6,6,NA,263190012,2006-11-15
33,1,15:20,2120,2120,Mustafa Shakur made Free Throw.,17,7,10,9,0.7329320204704511,0.7329320204704511,Arizona,Northern Arizona,6,6,NA,263190012,2006-11-15
34,1,15:11,2111,2111,Tyrone Bazy missed Three Point Jumper.,17,7,10,0,0.7337691291664873,0.7337691291664873,Arizona,Northern Arizona,6,6,NA,263190012,2006-11-15
35,1,15:11,2111,2111,Chase Budinger Defensive Rebound.,17,7,10,7,0.7337691291664873,0.7337691291664873,Arizona,Northern Arizona,6,6,NA,263190012,2006-11-15
36,1,15:04,2104,2104,Marcus Williams made Two Point Dunk Shot.  Assisted by Chase Budinger.,19,7,12,10,0.772169984464453,0.772169984464453,Arizona,Northern Arizona,6,6,NA,263190012,2006-11-15
37,1,14:54,2094,2094,Nathan Geiser missed Three Point Jumper.,19,7,12,0,0.773179260499241,0.773179260499241,Arizona,Northern Arizona,6,6,NA,263190012,2006-11-15
38,1,14:54,2094,2094,Kyle Landry Offensive Rebound.,19,7,12,6,0.773179260499241,0.773179260499241,Arizona,Northern Arizona,6,6,NA,263190012,2006-11-15
39,1,14:48,2088,2088,Foul on Ivan Radenovic,19,7,12,10,0.7737853353237641,0.7737853353237641,Arizona,Northern Arizona,6,6,NA,263190012,2006-11-15
40,1,14:38,2078,2078,Tyrone Bazy missed Two Point Layup.,19,7,12,0,0.7747963793178217,0.7747963793178217,Arizona,Northern Arizona,6,6,NA,263190012,2006-11-15
41,1,14:38,2078,2078,Kyle Landry Offensive Rebound.,19,7,12,0,0.7747963793178217,0.7747963793178217,Arizona,Northern Arizona,6,6,NA,263190012,2006-11-15
42,1,14:38,2078,2078,Kyle Landry missed Two Point Layup.,19,7,12,0,0.7747963793178217,0.7747963793178217,Arizona,Northern Arizona,6,6,NA,263190012,2006-11-15
43,1,14:38,2078,2078,Northern Arizona Defensive Rebou.,19,7,12,3,0.7747963793178217,0.7747963793178217,Arizona,Northern Arizona,6,6,NA,263190012,2006-11-15
44,1,14:35,2075,2075,Ruben Boykin Jr. made Two Point Jumper.  Assisted by Riley Van Patten.,19,9,10,12,0.7371316473912409,0.7371316473912409,Arizona,Northern Arizona,6,6,NA,263190012,2006-11-15
45,1,14:23,2063,2063,Foul on Riley Van Patten,19,9,10,13,0.7382580575735008,0.7382580575735008,Arizona,Northern Arizona,6,6,NA,263190012,2006-11-15
46,1,14:10,2050,2050,Marcus Williams missed Three Point Jumper.,19,9,10,0,0.7394818107898522,0.7394818107898522,Arizona,Northern Arizona,6,6,NA,263190012,2006-11-15
47,1,14:10,2050,2050,Ruben Boykin Jr. Defensive Rebound.,19,9,10,6,0.7394818107898522,0.7394818107898522,Arizona,Northern Arizona,6,6,NA,263190012,2006-11-15
48,1,14:04,2044,2044,Foul on Ivan Radenovic,19,9,10,0,0.7400478969374439,0.7400478969374439,Arizona,Northern Arizona,6,6,NA,263190012,2006-11-15
49,1,14:04,2044,2044,Marques Green missed Three Point Jumper.,19,9,10,0,0.7400478969374439,0.7400478969374439,Arizona,Northern Arizona,6,6,NA,263190012,2006-11-15
50,1,14:04,2044,2044,Marcus Williams Defensive Rebound.,19,9,10,18,0.7400478969374439,0.7400478969374439,Arizona,Northern Arizona,6,6,NA,263190012,2006-11-15
51,1,13:46,2026,2026,Tyrone Bazy missed Two Point Jumper.,19,9,10,0,0.7417512515294795,0.7417512515294795,Arizona,Northern Arizona,6,6,NA,263190012,2006-11-15
52,1,13:46,2026,2026,Chase Budinger Defensive Rebound.,19,9,10,8,0.7417512515294795,0.7417512515294795,Arizona,Northern Arizona,6,6,NA,263190012,2006-11-15
53,1,13:38,2018,2018,Riley Van Patten Steal.,19,9,10,11,0.7425108569856204,0.7425108569856204,Arizona,Northern Arizona,6,6,NA,263190012,2006-11-15
54,1,13:27,2007,2007,Foul on Jordan Hill,19,9,10,0,0.7435580060462864,0.7435580060462864,Arizona,Northern Arizona,6,6,NA,263190012,2006-11-15
55,1,13:27,2007,2007,Ruben Boykin Jr. made Free Throw.,19,10,9,0,0.7227391997683368,0.7227391997683368,Arizona,Northern Arizona,6,6,NA,263190012,2006-11-15
56,1,13:27,2007,2007,Ruben Boykin Jr. made Free Throw.,19,11,8,10,0.7009100983830228,0.7009100983830228,Arizona,Northern Arizona,6,6,NA,263190012,2006-11-15
57,1,13:17,1997,1997,Chase Budinger made Three Point Jumper.  Assisted by Marcus Williams.,22,11,11,13,0.7643202995334908,0.7643202995334908,Arizona,Northern Arizona,6,6,NA,263190012,2006-11-15
58,1,13:04,1984,1984,Marques Green missed Three Point Jumper.,22,11,11,0,0.7656171659990433,0.7656171659990433,Arizona,Northern Arizona,6,6,NA,263190012,2006-11-15
59,1,13:04,1984,1984,Kyle Landry Offensive Rebound.,22,11,11,5,0.7656171659990433,0.7656171659990433,Arizona,Northern Arizona,6,6,NA,263190012,2006-11-15
60,1,12:59,1979,1979,Kyle Landry made Two Point Tip Shot.,22,13,9,9,0.7252758367235291,0.7252758367235291,Arizona,Northern Arizona,6,6,NA,263190012,2006-11-15
61,1,12:50,1970,1970,Mustafa Shakur made Two Point Jumper.,24,13,11,3,0.76701856037910765,0.76701856037910765,Arizona,Northern Arizona,6,6,NA,263190012,2006-11-15
62,1,12:47,1967,1967,Northern Arizona Full Timeout.,24,13,11,18,0.7673195239071879,0.7673195239071879,Arizona,Northern Arizona,6,5,NA,263190012,2006-11-15
63,1,12:29,1949,1949,Josh Wilson made Two Point Layup.,24,15,9,12,0.7280212242642323,0.7280212242642323,Arizona,Northern Arizona,6,5,NA,263190012,2006-11-15
64,1,12:17,1937,1937,Marcus Williams missed Two Point Jumper.,24,15,9,0,0.7291278728463954,0.7291278728463954,Arizona,Northern Arizona,6,5,NA,263190012,2006-11-15
65,1,12:17,1937,1937,Nick Larson Defensive Rebound.,24,15,9,7,0.7291278728463954,0.7291278728463954,Arizona,Northern Arizona,6,5,NA,263190012,2006-11-15
66,1,12:10,1930,1930,Jordan Hill made Two Point Dunk Shot.  Assisted by Mustafa Shakur.,26,15,11,13,0.7710517686621788,0.7710517686621788,Arizona,Northern Arizona,6,5,NA,263190012,2006-11-15
67,1,11:57,1917,1917,Kyle Landry made Two Point Jumper.,26,17,9,0,0.730977514607642,0.730977514607642,Arizona,Northern Arizona,6,5,NA,263190012,2006-11-15
68,1,11:57,1917,1917,Foul on Jordan Hill,26,17,9,0,0.730977514607642,0.730977514607642,Arizona,Northern Arizona,6,5,NA,263190012,2006-11-15
69,1,11:57,1917,1917,Kyle Landry made Free Throw.,26,18,8,20,0.7085851600524468,0.7085851600524468,Arizona,Northern Arizona,6,5,NA,263190012,2006-11-15
70,1,11:37,1897,1897,Foul on Marques Green,26,18,8,0,0.7103023282249372,0.7103023282249372,Arizona,Northern Arizona,6,5,NA,263190012,2006-11-15
71,1,11:37,1897,1897,Mustafa Shakur missed Free Throw.,26,18,8,0,0.7103023282249372,0.7103023282249372,Arizona,Northern Arizona,6,5,NA,263190012,2006-11-15
72,1,11:37,1897,1897,Kyle Landry Defensive Rebound.,26,18,8,14,0.7103023282249372,0.7103023282249372,Arizona,Northern Arizona,6,5,NA,263190012,2006-11-15
73,1,11:23,1883,1883,Ruben Boykin Jr. missed Two Point Layup.,26,18,8,7,0.7115004545236011,0.7115004545236011,Arizona,Northern Arizona,6,5,NA,263190012,2006-11-15
74,1,11:16,1876,1876,Marcus Williams Defensive Rebound.,26,18,8,8,0.7120988266004088,0.7120988266004088,Arizona,Northern Arizona,6,5,NA,263190012,2006-11-15
75,1,11:08,1868,1868,Chase Budinger made Two Point Layup.,28,18,10,27,0.756975777837697,0.756975777837697,Arizona,Northern Arizona,6,5,NA,263190012,2006-11-15
76,1,10:41,1841,1841,Chase Budinger made Two Point Layup.,30,18,12,36,0.7990484014795723,0.7990484014795723,Arizona,Northern Arizona,6,5,NA,263190012,2006-11-15
77,1,10:05,1805,1805,J.P. Prince missed Three Point Jumper.,30,18,12,0,0.8026926791184215,0.8026926791184215,Arizona,Northern Arizona,6,5,NA,263190012,2006-11-15
78,1,10:05,1805,1805,Northern Arizona Defensive Rebou.,30,18,12,22,0.8026926791184215,0.8026926791184215,Arizona,Northern Arizona,6,5,NA,263190012,2006-11-15
79,1,9:43,1783,1783,Bret Brielmaier Steal.,30,18,12,3,0.804927573621192,0.804927573621192,Arizona,Northern Arizona,6,5,NA,263190012,2006-11-15
80,1,9:40,1780,1780,J.P. Prince made Two Point Layup.  Assisted by Bret Brielmaier.,32,18,14,5,0.8396846750761022,0.8396846750761022,Arizona,Northern Arizona,6,5,NA,263190012,2006-11-15
81,1,9:35,1775,1775,Northern Arizona Full Timeout.,32,18,14,33,0.8401951640920506,0.8401951640920506,Arizona,Northern Arizona,6,4,NA,263190012,2006-11-15
82,1,9:02,1742,1742,Ruben Boykin Jr. missed Three Point Jumper.,32,18,14,0,0.8435786172035794,0.8435786172035794,Arizona,Northern Arizona,6,4,NA,263190012,2006-11-15
83,1,9:02,1742,1742,Bret Brielmaier Defensive Rebound.,32,18,14,8,0.8435786172035794,0.8435786172035794,Arizona,Northern Arizona,6,4,NA,263190012,2006-11-15
84,1,8:54,1734,1734,Bret Brielmaier missed Two Point Layup.,32,18,14,0,0.844403739901749,0.844403739901749,Arizona,Northern Arizona,6,4,NA,263190012,2006-11-15
85,1,8:54,1734,1734,Arizona Defensive Rebound.,32,18,14,6,0.844403739901749,0.844403739901749,Arizona,Northern Arizona,6,4,NA,263190012,2006-11-15
86,1,8:48,1728,1728,Chase Budinger missed Three Point Jumper.,32,18,14,0,0.8450241302610196,0.8450241302610196,Arizona,Northern Arizona,6,4,NA,263190012,2006-11-15
87,1,8:48,1728,1728,Chase Budinger Offensive Rebound.,32,18,14,6,0.8450241302610196,0.8450241302610196,Arizona,Northern Arizona,6,4,NA,263190012,2006-11-15
88,1,8:42,1722,1722,Chase Budinger missed Two Point Layup.,32,18,14,0,0.8456459515285566,0.8456459515285566,Arizona,Northern Arizona,6,4,NA,263190012,2006-11-15
89,1,8:42,1722,1722,Fendi Onobun Offensive Rebound.,32,18,14,0,0.8456459515285566,0.8456459515285566,Arizona,Northern Arizona,6,4,NA,263190012,2006-11-15
90,1,8:42,1722,1722,Foul on Tyrone Bazy,32,18,14,0,0.8456459515285566,0.8456459515285566,Arizona,Northern Arizona,6,4,NA,263190012,2006-11-15
91,1,8:42,1722,1722,J.P. Prince made Free Throw.,33,18,15,0,0.8608468164940748,0.8608468164940748,Arizona,Northern Arizona,6,4,NA,263190012,2006-11-15
92,1,8:42,1722,1722,J.P. Prince missed Free Throw.,33,18,15,0,0.8608468164940748,0.8608468164940748,Arizona,Northern Arizona,6,4,NA,263190012,2006-11-15
93,1,8:42,1722,1722,Nick Larson Defensive Rebound.,33,18,15,14,0.8608468164940748,0.8608468164940748,Arizona,Northern Arizona,6,4,NA,263190012,2006-11-15
94,1,8:28,1708,1708,Foul on Fendi Onobun,33,18,15,3,0.8622787854190216,0.8622787854190216,Arizona,Northern Arizona,6,4,NA,263190012,2006-11-15
95,1,8:25,1705,1705,Marcus Williams Steal.,33,18,15,11,0.8625866303228683,0.8625866303228683,Arizona,Northern Arizona,6,4,NA,263190012,2006-11-15
96,1,8:14,1694,1694,Jawann McClellan Steal.,33,18,15,5,0.8637186706418453,0.8637186706418453,Arizona,Northern Arizona,6,4,NA,263190012,2006-11-15
97,1,8:09,1689,1689,J.P. Prince missed Two Point Layup.,33,18,15,0,0.8642348885627757,0.8642348885627757,Arizona,Northern Arizona,6,4,NA,263190012,2006-11-15
98,1,8:09,1689,1689,Josh Wilson Defensive Rebound.,33,18,15,15,0.8642348885627757,0.8642348885627757,Arizona,Northern Arizona,6,4,NA,263190012,2006-11-15
99,1,7:54,1674,1674,Tyrone Bazy missed Two Point Layup.,33,18,15,0,0.8657565962439819,0.8657565962439819,Arizona,Northern Arizona,6,4,NA,263190012,2006-11-15
100,1,7:54,1674,1674,Nick Larson Offensive Rebound.,33,18,15,6,0.8657565962439819,0.8657565962439819,Arizona,Northern Arizona,6,4,NA,263190012,2006-11-15
101,1,7:48,1668,1668,Kyle Landry made Two Point Tip Shot.,33,20,13,14,0.8347776525067916,0.8347776525067916,Arizona,Northern Arizona,6,4,NA,263190012,2006-11-15
102,1,7:34,1654,1654,Official TV Timeout.,33,20,13,12,0.8361878850205501,0.8361878850205501,Arizona,Northern Arizona,6,4,NA,263190012,2006-11-15
103,1,7:22,1642,1642,Stephen Sir made Three Point Jumper.  Assisted by Deveric Taylor.,33,23,10,11,0.7791336279343294,0.7791336279343294,Arizona,Northern Arizona,6,4,NA,263190012,2006-11-15
104,1,7:11,1631,1631,Chase Budinger missed Two Point Layup.,33,23,10,0,0.7801755574363958,0.7801755574363958,Arizona,Northern Arizona,6,4,NA,263190012,2006-11-15
105,1,7:11,1631,1631,Bret Brielmaier Offensive Rebound.,33,23,10,13,0.7801755574363958,0.7801755574363958,Arizona,Northern Arizona,6,4,NA,263190012,2006-11-15
106,1,6:58,1618,1618,Stephen Sir made Two Point Jumper.  Assisted by Deveric Taylor.,33,25,8,18,0.7347872218058359,0.7347872218058359,Arizona,Northern Arizona,6,4,NA,263190012,2006-11-15
107,1,6:40,1600,1600,Mustafa Shakur missed Two Point Layup.,33,25,8,0,0.7363151866750764,0.7363151866750764,Arizona,Northern Arizona,6,4,NA,263190012,2006-11-15
108,1,6:40,1600,1600,Stephen Sir Defensive Rebound.,33,25,8,10,0.7363151866750764,0.7363151866750764,Arizona,Northern Arizona,6,4,NA,263190012,2006-11-15
109,1,6:30,1590,1590,Mustafa Shakur Steal.,33,25,8,2,0.7371617166734473,0.7371617166734473,Arizona,Northern Arizona,6,4,NA,263190012,2006-11-15
110,1,6:28,1588,1588,Chase Budinger made Two Point Dunk Shot.  Assisted by Mustafa Shakur.,35,25,10,9,0.7841773082841049,0.7841773082841049,Arizona,Northern Arizona,6,4,NA,263190012,2006-11-15
111,1,6:19,1579,1579,Foul on Kyle Landry,35,25,10,18,0.7850098146345558,0.7850098146345558,Arizona,Northern Arizona,6,4,NA,263190012,2006-11-15
112,1,6:01,1561,1561,Foul on Stephen Sir,35,25,10,0,0.7866800168754858,0.7866800168754858,Arizona,Northern Arizona,6,4,NA,263190012,2006-11-15
113,1,6:01,1561,1561,Mustafa Shakur missed Free Throw.,35,25,10,0,0.7866800168754858,0.7866800168754858,Arizona,Northern Arizona,6,4,NA,263190012,2006-11-15
114,1,6:01,1561,1561,Arizona Defensive Rebound.,35,25,10,0,0.7866800168754858,0.7866800168754858,Arizona,Northern Arizona,6,4,NA,263190012,2006-11-15
115,1,6:01,1561,1561,Mustafa Shakur made Free Throw.,36,25,11,14,0.8077616626551462,0.8077616626551462,Arizona,Northern Arizona,6,4,NA,263190012,2006-11-15
116,1,5:47,1547,1547,Josh Wilson made Two Point Layup.  Assisted by Deveric Taylor.,36,27,9,24,0.7652287562940832,0.7652287562940832,Arizona,Northern Arizona,6,4,NA,263190012,2006-11-15
117,1,5:23,1523,1523,Marcus Williams missed Two Point Jumper.,36,27,9,0,0.7674373128455941,0.7674373128455941,Arizona,Northern Arizona,6,4,NA,263190012,2006-11-15
118,1,5:23,1523,1523,Northern Arizona Defensive Rebou.,36,27,9,22,0.7674373128455941,0.7674373128455941,Arizona,Northern Arizona,6,4,NA,263190012,2006-11-15
119,1,5:01,1501,1501,Ruben Boykin Jr. missed Two Point Jumper.,36,27,9,0,0.7695198389806253,0.7695198389806253,Arizona,Northern Arizona,6,4,NA,263190012,2006-11-15
120,1,5:01,1501,1501,Kyle Landry Offensive Rebound.,36,27,9,3,0.7695198389806253,0.7695198389806253,Arizona,Northern Arizona,6,4,NA,263190012,2006-11-15
121,1,4:58,1498,1498,Kyle Landry missed Two Point Layup.,36,27,9,0,0.7698091225467747,0.7698091225467747,Arizona,Northern Arizona,6,4,NA,263190012,2006-11-15
122,1,4:58,1498,1498,Mustafa Shakur Defensive Rebound.,36,27,9,6,0.7698091225467747,0.7698091225467747,Arizona,Northern Arizona,6,4,NA,263190012,2006-11-15
123,1,4:52,1492,1492,Chase Budinger made Two Point Dunk Shot.  Assisted by Mustafa Shakur.,38,27,11,6,0.8145017963565816,0.8145017963565816,Arizona,Northern Arizona,6,4,NA,263190012,2006-11-15
124,1,4:46,1486,1486,Foul on Marcus Williams,38,27,11,3,0.8151162526599374,0.8151162526599374,Arizona,Northern Arizona,6,4,NA,263190012,2006-11-15
125,1,4:43,1483,1483,Kyle Landry made Two Point Layup.  Assisted by Josh Wilson.,38,29,9,18,0.7712775125200477,0.7712775125200477,Arizona,Northern Arizona,6,4,NA,263190012,2006-11-15
126,1,4:25,1465,1465,Jawann McClellan made Two Point Jumper.,40,29,11,11,0.8173171666498681,0.8173171666498681,Arizona,Northern Arizona,6,4,NA,263190012,2006-11-15
127,1,4:14,1454,1454,Josh Wilson made Two Point Layup.,40,31,9,17,0.7742358192130158,0.7742358192130158,Arizona,Northern Arizona,6,4,NA,263190012,2006-11-15
128,1,3:57,1437,1437,Deveric Taylor made Three Point Jumper.  Assisted by Tyrone Bazy.,40,34,6,31,0.6960135140855629,0.6960135140855629,Arizona,Northern Arizona,6,4,NA,263190012,2006-11-15
129,1,3:26,1406,1406,Chase Budinger made Three Point Jumper.  Assisted by Mustafa Shakur.,43,34,9,20,0.7790925284081375,0.7790925284081375,Arizona,Northern Arizona,6,4,NA,263190012,2006-11-15
130,1,3:06,1386,1386,Kyle Landry missed Two Point Jumper.,43,34,9,0,0.7810019010857296,0.7810019010857296,Arizona,Northern Arizona,6,4,NA,263190012,2006-11-15
131,1,3:06,1386,1386,Bret Brielmaier Defensive Rebound.,43,34,9,0,0.7810019010857296,0.7810019010857296,Arizona,Northern Arizona,6,4,NA,263190012,2006-11-15
132,1,3:06,1386,1386,Foul on Tyrone Bazy,43,34,9,0,0.7810019010857296,0.7810019010857296,Arizona,Northern Arizona,6,4,NA,263190012,2006-11-15
133,1,3:06,1386,1386,Official TV Timeout.,43,34,9,0,0.7810019010857296,0.7810019010857296,Arizona,Northern Arizona,6,4,NA,263190012,2006-11-15
134,1,3:06,1386,1386,Chase Budinger made Free Throw.,44,34,10,0,0.8042062454160309,0.8042062454160309,Arizona,Northern Arizona,6,4,NA,263190012,2006-11-15
135,1,3:06,1386,1386,Chase Budinger missed Free Throw.,44,34,10,0,0.8042062454160309,0.8042062454160309,Arizona,Northern Arizona,6,4,NA,263190012,2006-11-15
136,1,3:06,1386,1386,Ruben Boykin Jr. Defensive Rebound.,44,34,10,20,0.8042062454160309,0.8042062454160309,Arizona,Northern Arizona,6,4,NA,263190012,2006-11-15
137,1,2:46,1366,1366,Ryan McCurdy made Two Point Layup.  Assisted by Ruben Boykin Jr..,44,36,8,17,0.757684310969961,0.757684310969961,Arizona,Northern Arizona,6,4,NA,263190012,2006-11-15
138,1,2:29,1349,1349,Marcus Williams made Two Point Layup.,46,36,10,23,0.8077493037412243,0.8077493037412243,Arizona,Northern Arizona,6,4,NA,263190012,2006-11-15
139,1,2:06,1326,1326,Josh Wilson missed Two Point Layup.,46,36,10,0,0.809960787549596,0.809960787549596,Arizona,Northern Arizona,6,4,NA,263190012,2006-11-15
140,1,2:06,1326,1326,Northern Arizona Defensive Rebou.,46,36,10,30,0.809960787549596,0.809960787549596,Arizona,Northern Arizona,6,4,NA,263190012,2006-11-15
141,1,1:36,1296,1296,Foul on Tyrone Bazy,46,36,10,0,0.8129258465913569,0.8129258465913569,Arizona,Northern Arizona,6,4,NA,263190012,2006-11-15
142,1,1:36,1296,1296,Jawann McClellan missed Free Throw.,46,36,10,0,0.8129258465913569,0.8129258465913569,Arizona,Northern Arizona,6,4,NA,263190012,2006-11-15
143,1,1:36,1296,1296,Arizona Defensive Rebound.,46,36,10,0,0.8129258465913569,0.8129258465913569,Arizona,Northern Arizona,6,4,NA,263190012,2006-11-15
144,1,1:36,1296,1296,Jawann McClellan made Free Throw.,47,36,11,10,0.8342494203694925,0.8342494203694925,Arizona,Northern Arizona,6,4,NA,263190012,2006-11-15
145,1,1:26,1286,1286,Foul on Josh Wilson,47,36,11,0,0.8352696671860874,0.8352696671860874,Arizona,Northern Arizona,6,4,NA,263190012,2006-11-15
146,1,1:26,1286,1286,Ruben Boykin Jr. made Two Point Layup.,47,38,9,20,0.790554833289498,0.790554833289498,Arizona,Northern Arizona,6,4,NA,263190012,2006-11-15
147,1,1:06,1266,1266,Nic Wise missed Three Point Jumper.,47,38,9,0,0.7926279756357272,0.7926279756357272,Arizona,Northern Arizona,6,4,NA,263190012,2006-11-15
148,1,1:06,1266,1266,Jordan Hill Offensive Rebound.,47,38,9,0,0.7926279756357272,0.7926279756357272,Arizona,Northern Arizona,6,4,NA,263190012,2006-11-15
149,1,1:06,1266,1266,Foul on Marques Green,47,38,9,0,0.7926279756357272,0.7926279756357272,Arizona,Northern Arizona,6,4,NA,263190012,2006-11-15
150,1,1:06,1266,1266,Jordan Hill made Free Throw.,48,38,10,0,0.8160515170268027,0.8160515170268027,Arizona,Northern Arizona,6,4,NA,263190012,2006-11-15
151,1,1:06,1266,1266,Jordan Hill missed Free Throw.,48,38,10,0,0.8160515170268027,0.8160515170268027,Arizona,Northern Arizona,6,4,NA,263190012,2006-11-15
152,1,1:06,1266,1266,Ruben Boykin Jr. Defensive Rebound.,48,38,10,7,0.8160515170268027,0.8160515170268027,Arizona,Northern Arizona,6,4,NA,263190012,2006-11-15
153,1,0:59,1259,1259,Ruben Boykin Jr. missed Two Point Layup.,48,38,10,3,0.8168116624654147,0.8168116624654147,Arizona,Northern Arizona,6,4,NA,263190012,2006-11-15
154,1,0:56,1256,1256,Northern Arizona Defensive Rebou.,48,38,10,17,0.8171415216591027,0.8171415216591027,Arizona,Northern Arizona,6,4,NA,263190012,2006-11-15
155,1,0:39,1239,1239,Ryan McCurdy made Two Point Layup.  Assisted by Ruben Boykin Jr..,48,40,8,31,0.7699444634715304,0.7699444634715304,Arizona,Northern Arizona,6,4,NA,263190012,2006-11-15
156,1,0:08,1208,1208,Jawann McClellan missed Three Point Jumper.,48,40,8,0,0.7735368906533824,0.7735368906533824,Arizona,Northern Arizona,6,4,NA,263190012,2006-11-15
157,1,0:08,1208,1208,Ryan McCurdy Defensive Rebound.,48,40,8,0,0.7735368906533824,0.7735368906533824,Arizona,Northern Arizona,6,4,NA,263190012,2006-11-15
158,1,0:08,1208,1208,Ryan McCurdy missed Three Point Jumper.,48,40,8,0,0.7735368906533824,0.7735368906533824,Arizona,Northern Arizona,6,4,NA,263190012,2006-11-15
159,1,0:08,1208,1208,Arizona Defensive Rebound.,48,40,8,8,0.7735368906533824,0.7735368906533824,Arizona,Northern Arizona,6,4,NA,263190012,2006-11-15
160,1,0:00,1200,1200,End of the 1st Half.,48,40,8,0,0.774489981219977,0.774489981219977,Arizona,Northern Arizona,6,4,NA,263190012,2006-11-15
161,2,20:00,1200,1200,PLAY,48,40,8,8,0.774489981219977,0.774489981219977,Arizona,Northern Arizona,6,4,NA,263190012,2006-11-15
162,2,19:52,1192,1192,Ivan Radenovic made Two Point Layup.,50,40,10,23,0.824769792555616,0.824769792555616,Arizona,Northern Arizona,6,4,NA,263190012,2006-11-15
163,2,19:29,1169,1169,Ruben Boykin Jr. made Two Point Jumper.,50,42,8,8,0.7780335592287098,0.7780335592287098,Arizona,Northern Arizona,6,4,NA,263190012,2006-11-15
