play_id,half,time_remaining_half,secs_remaining,secs_remaining_absolute,description,home_score,away_score,score_diff,play_length,win_prob,naive_win_prob,home,away,home_time_out_remaining,away_time_out_remaining,home_favored_by,game_id,date
1,1,20:00,2400,2400,PLAY,0,0,0,33,0.5,0.5,Duke,Kent State,6,6,NA,263530150,2006-12-19
2,1,19:27,2367,2367,Lance Thomas missed Two Point Layup.,0,0,0,0,0.5,0.5,Duke,Kent State,6,6,NA,263530150,2006-12-19
3,1,19:27,2367,2367,Omni Smith Defensive Rebound.,0,0,0,6,0.5,0.5,Duke,Kent State,6,6,NA,263530150,2006-12-19
4,1,19:21,2361,2361,Jon Scheyer Steal.,0,0,0,3,0.5,0.5,Duke,Kent State,6,6,NA,263530150,2006-12-19
5,1,19:18,2358,2358,DeMarcus Nelson made Two Point Dunk Shot.  Assisted by Jon Scheyer.,2,0,2,18,0.5449181103473372,0.5449181103473372,Duke,Kent State,6,6,NA,263530150,2006-12-19
6,1,19:00,2340,2340,Omni Smith made Two Point Layup.,2,2,0,5,0.5,0.5,Duke,Kent State,6,6,NA,263530150,2006-12-19
7,1,18:55,2335,2335,Foul on Armon Gates,2,2,0,4,0.5,0.5,Duke,Kent State,6,6,NA,263530150,2006-12-19
8,1,18:51,2331,2331,Greg Paulus missed Three Point Jumper.,2,2,0,0,0.5,0.5,Duke,Kent State,6,6,NA,263530150,2006-12-19
9,1,18:51,2331,2331,Jon Scheyer Offensive Rebound.,2,2,0,8,0.5,0.5,Duke,Kent State,6,6,NA,263530150,2006-12-19
10,1,18:43,2323,2323,Lance Thomas missed Two Point Layup.,2,2,0,0,0.5,0.5,Duke,Kent State,6,6,NA,263530150,2006-12-19
11,1,18:43,2323,2323,Mike Scott Defensive Rebound.,2,2,0,7,0.5,0.5,Duke,Kent State,6,6,NA,263530150,2006-12-19
12,1,18:36,2316,2316,Mike Scott made Two Point Layup.  Assisted by Haminn Quaintance.,2,4,-2,19,0.4541666112249718,0.4541666112249718,Duke,Kent State,6,6,NA,263530150,2006-12-19
13,1,18:17,2297,2297,Lance Thomas made Two Point Dunk Shot.  Assisted by Josh McRoberts.,4,4,0,6,0.5,0.5,Duke,Kent State,6,6,NA,263530150,2006-12-19
14,1,18:11,2291,2291,Foul on Greg Paulus,4,4,0,21,0.5,0.5,Duke,Kent State,6,6,NA,263530150,2006-12-19
15,1,17:50,2270,2270,Jon Scheyer made Three Point Jumper.  Assisted by DeMarcus Nelson.,7,4,3,27,0.5700306384331116,0.5700306384331116,Duke,Kent State,6,6,NA,263530150,2006-12-19
16,1,17:23,2243,2243,David McClure Steal.,7,4,3,11,0.5709360006525587,0.5709360006525587,Duke,Kent State,6,6,NA,263530150,2006-12-19
17,1,17:12,2232,2232,Haminn Quaintance Steal.,7,4,3,5,0.5713071075419746,0.5713071075419746,Duke,Kent State,6,6,NA,263530150,2006-12-19
18,1,17:07,2227,2227,David McClure Steal.,7,4,3,23,0.5714761792196995,0.5714761792196995,Duke,Kent State,6,6,NA,263530150,2006-12-19
19,1,16:44,2204,2204,Jon Scheyer made Three Point Jumper.  Assisted by Josh McRoberts.,10,4,6,23,0.6415570930562644,0.6415570930562644,Duke,Kent State,6,6,NA,263530150,2006-12-19
20,1,16:21,2181,2181,Mike McKee missed Two Point Layup.,10,4,6,0,0.6430299040910135,0.6430299040910135,Duke,Kent State,6,6,NA,263530150,2006-12-19
21,1,16:21,2181,2181,Greg Paulus Defensive Rebound.,10,4,6,8,0.6430299040910135,0.6430299040910135,Duke,Kent State,6,6,NA,263530150,2006-12-19
22,1,16:13,2173,2173,Jon Scheyer made Three Point Jumper.  Assisted by Greg Paulus.,13,4,9,0,0.7080978074591385,0.7080978074591385,Duke,Kent State,6,6,NA,263530150,2006-12-19
23,1,16:13,2173,2173,Foul on Mike McKee,13,4,9,0,0.7080978074591385,0.7080978074591385,Duke,Kent State,6,6,NA,263530150,2006-12-19
24,1,16:13,2173,2173,Jon Scheyer made Free Throw.,14,4,10,18,0.7280251599463318,0.7280251599463318,Duke,Kent State,6,6,NA,263530150,2006-12-19
25,1,15:55,2155,2155,Haminn Quaintance missed Two Point Jumper.,14,4,10,0,0.729687809207816,0.729687809207816,Duke,Kent State,6,6,NA,263530150,2006-12-19
26,1,15:55,2155,2155,DeMarcus Nelson Defensive Rebound.,14,4,10,13,0.729687809207816,0.729687809207816,Duke,Kent State,6,6,NA,263530150,2006-12-19
27,1,15:42,2142,2142,Foul on Haminn Quaintance,14,4,10,0,0.730890879691706,0.730890879691706,Duke,Kent State,6,6,NA,263530150,2006-12-19
28,1,15:42,2142,2142,Official TV Timeout.,14,4,10,0,0.730890879691706,0.730890879691706,Duke,Kent State,6,6,NA,263530150,2006-12-19
29,1,15:42,2142,2142,Brian Zoubek made Free Throw.,15,4,11,0,0.7500843013813518,0.7500843013813518,Duke,Kent State,6,6,NA,263530150,2006-12-19
30,1,15:42,2142,2142,Brian Zoubek made Free Throw.,16,4,12,14,0.7683426885816294,0.7683426885816294,Duke,Kent State,6,6,NA,263530150,2006-12-19
31,1,15:28,2128,2128,Omni Smith made Two Point Layup.  Assisted by Haminn Quaintance.,16,6,10,42,0.7321889798842494,0.7321889798842494,Duke,Kent State,6,6,NA,263530150,2006-12-19
32,1,14:46,2086,2086,Omni Smith made Three Point Jumper.  Assisted by Chris Singletary.,16,9,7,18,0.6721803323511845,0.6721803323511845,Duke,Kent State,6,6,NA,263530150,2006-12-19
33,1,14:28,2068,2068,Foul on Jordan Mincy,16,9,7,13,0.673520993276257,0.673520993276257,Duke,Kent State,6,6,NA,263530150,2006-12-19
34,1,14:15,2055,2055,Foul on Chris Singletary,16,9,7,0,0.6744942615159314,0.6744942615159314,Duke,Kent State,6,6,NA,263530150,2006-12-19
35,1,14:15,2055,2055,Lance Thomas missed Free Throw.,16,9,7,0,0.6744942615159314,0.6744942615159314,Duke,Kent State,6,6,NA,263530150,2006-12-19
36,1,14:15,2055,2055,Duke Defensive Rebound.,16,9,7,0,0.6744942615159314,0.6744942615159314,Duke,Kent State,6,6,NA,263530150,2006-12-19
37,1,14:15,2055,2055,Lance Thomas made Free Throw.,17,9,8,19,0.6969184250748345,0.6969184250748345,Duke,Kent State,6,6,NA,263530150,2006-12-19
38,1,13:56,2036,2036,Chris Singletary made Two Point Layup.,17,11,6,0,0.6525100672383239,0.6525100672383239,Duke,Kent State,6,6,NA,263530150,2006-12-19
39,1,13:56,2036,2036,Foul on Lance Thomas,17,11,6,0,0.6525100672383239,0.6525100672383239,Duke,Kent State,6,6,NA,263530150,2006-12-19
40,1,13:56,2036,2036,Chris Singletary missed Free Throw.,17,11,6,0,0.6525100672383239,0.6525100672383239,Duke,Kent State,6,6,NA,263530150,2006-12-19
41,1,13:56,2036,2036,Lance Thomas Defensive Rebound.,17,11,6,16,0.6525100672383239,0.6525100672383239,Duke,Kent State,6,6,NA,263530150,2006-12-19
42,1,13:40,2020,2020,DeMarcus Nelson missed Three Point Jumper.,17,11,6,0,0.6535860307094367,0.6535860307094367,Duke,Kent State,6,6,NA,263530150,2006-12-19
43,1,13:40,2020,2020,Chris Singletary Defensive Rebound.,17,11,6,2,0.6535860307094367,0.6535860307094367,Duke,Kent State,6,6,NA,263530150,2006-12-19
44,1,13:38,2018,2018,Foul on Lance Thomas,17,11,6,24,0.6537210261551547,0.6537210261551547,Duke,Kent State,6,6,NA,263530150,2006-12-19
45,1,13:14,1994,1994,Jon Scheyer Steal.,17,11,6,4,0.6553499940717292,0.6553499940717292,Duke,Kent State,6,6,NA,263530150,2006-12-19
46,1,13:10,1990,1990,Jon Scheyer made Two Point Layup.,19,11,8,14,0.7023400918608192,0.7023400918608192,Duke,Kent State,6,6,NA,263530150,2006-12-19
47,1,12:56,1976,1976,Omni Smith made Three Point Jumper.  Assisted by Mike Scott.,19,14,5,16,0.6318325977918307,0.6318325977918307,Duke,Kent State,6,6,NA,263530150,2006-12-19
48,1,12:40,1960,1960,Foul on David McClure,19,14,5,13,0.6327825453354079,0.6327825453354079,Duke,Kent State,6,6,NA,263530150,2006-12-19
49,1,12:27,1947,1947,Josh McRoberts Steal.,19,14,5,1,0.6335600352098876,0.6335600352098876,Duke,Kent State,6,6,NA,263530150,2006-12-19
50,1,12:26,1946,1946,Foul on Jordan Mincy,19,14,5,5,0.6336200571896707,0.6336200571896707,Duke,Kent State,6,6,NA,263530150,2006-12-19
51,1,12:21,1941,1941,Foul on Isaac Knight,19,14,5,0,0.6339206346694195,0.6339206346694195,Duke,Kent State,6,6,NA,263530150,2006-12-19
52,1,12:21,1941,1941,David McClure made Free Throw.,20,14,6,0,0.6590106233625621,0.6590106233625621,Duke,Kent State,6,6,NA,263530150,2006-12-19
53,1,12:21,1941,1941,David McClure missed Free Throw.,20,14,6,0,0.6590106233625621,0.6590106233625621,Duke,Kent State,6,6,NA,263530150,2006-12-19
54,1,12:21,1941,1941,Chris Singletary Defensive Rebound.,20,14,6,19,0.6590106233625621,0.6590106233625621,Duke,Kent State,6,6,NA,263530150,2006-12-19
55,1,12:02,1922,1922,Isaac Knight missed Two Point Layup.,20,14,6,0,0.6603441070886137,0.6603441070886137,Duke,Kent State,6,6,NA,263530150,2006-12-19
56,1,12:02,1922,1922,David McClure Defensive Rebound.,20,14,6,1,0.6603441070886137,0.6603441070886137,Duke,Kent State,6,6,NA,263530150,2006-12-19
57,1,12:01,1921,1921,Foul on Omni Smith,20,14,6,0,0.6604142711286558,0.6604142711286558,Duke,Kent State,6,6,NA,263530150,2006-12-19
58,1,12:01,1921,1921,Greg Paulus made Free Throw.,21,14,7,0,0.6848168877407425,0.6848168877407425,Duke,Kent State,6,6,NA,263530150,2006-12-19
59,1,12:01,1921,1921,Greg Paulus made Free Throw.,22,14,8,18,0.7082406300548159,0.7082406300548159,Duke,Kent State,6,6,NA,263530150,2006-12-19
60,1,11:43,1903,1903,Official TV Timeout.,22,14,8,43,0.7097880075201256,0.7097880075201256,Duke,Kent State,6,6,NA,263530150,2006-12-19
61,1,11:00,1860,1860,Mike Scott made Two Point Layup.  Assisted by Haminn Quaintance.,22,16,6,10,0.6646772288064021,0.6646772288064021,Duke,Kent State,6,6,NA,263530150,2006-12-19
62,1,10:50,1850,1850,Josh McRoberts made Two Point Dunk Shot.  Assisted by Greg Paulus.,24,16,8,14,0.714320694450662,0.714320694450662,Duke,Kent State,6,6,NA,263530150,2006-12-19
63,1,10:36,1836,1836,Omni Smith made Three Point Jumper.  Assisted by Haminn Quaintance.,24,19,5,7,0.6402531484761286,0.6402531484761286,Duke,Kent State,6,6,NA,263530150,2006-12-19
64,1,10:29,1829,1829,Duke Full Timeout.,24,19,5,13,0.6406777085698265,0.6406777085698265,Duke,Kent State,5,6,NA,263530150,2006-12-19
65,1,10:16,1816,1816,Josh McRoberts made Two Point Layup.,26,19,7,24,0.6930554629207412,0.6930554629207412,Duke,Kent State,5,6,NA,263530150,2006-12-19
66,1,9:52,1792,1792,Haminn Quaintance missed Two Point Layup.,26,19,7,0,0.6949598594000573,0.6949598594000573,Duke,Kent State,5,6,NA,263530150,2006-12-19
67,1,9:52,1792,1792,Kent State Defensive Rebound.,26,19,7,0,0.6949598594000573,0.6949598594000573,Duke,Kent State,5,6,NA,263530150,2006-12-19
68,1,9:52,1792,1792,Foul on David McClure,26,19,7,11,0.6949598594000573,0.6949598594000573,Duke,Kent State,5,6,NA,263530150,2006-12-19
69,1,9:41,1781,1781,Omni Smith missed Two Point Layup.,26,19,7,2,0.6958393812081037,0.6958393812081037,Duke,Kent State,5,6,NA,263530150,2006-12-19
70,1,9:39,1779,1779,Mike Scott Offensive Rebound.,26,19,7,5,0.6959998151896163,0.6959998151896163,Duke,Kent State,5,6,NA,263530150,2006-12-19
71,1,9:34,1774,1774,Haminn Quaintance made Two Point Layup.,26,21,5,6,0.6440566195276203,0.6440566195276203,Duke,Kent State,5,6,NA,263530150,2006-12-19
72,1,9:28,1768,1768,Mike Scott Steal.,26,21,5,7,0.6444312979850999,0.6444312979850999,Duke,Kent State,5,6,NA,263530150,2006-12-19
73,1,9:21,1761,1761,Omni Smith missed Three Point Jumper.,26,21,5,0,0.6448702892483151,0.6448702892483151,Duke,Kent State,5,6,NA,263530150,2006-12-19
74,1,9:21,1761,1761,Jon Scheyer Defensive Rebound.,26,21,5,12,0.6448702892483151,0.6448702892483151,Duke,Kent State,5,6,NA,263530150,2006-12-19
75,1,9:09,1749,1749,Greg Paulus missed Two Point Jumper.,26,21,5,0,0.6456278485873567,0.6456278485873567,Duke,Kent State,5,6,NA,263530150,2006-12-19
76,1,9:09,1749,1749,Haminn Quaintance Defensive Rebound.,26,21,5,37,0.6456278485873567,0.6456278485873567,Duke,Kent State,5,6,NA,263530150,2006-12-19
77,1,8:32,1712,1712,Foul on Josh McRoberts,26,21,5,0,0.6480092215997563,0.6480092215997563,Duke,Kent State,5,6,NA,263530150,2006-12-19
78,1,8:32,1712,1712,Haminn Quaintance made Free Throw.,26,22,4,0,0.6196917242601563,0.6196917242601563,Duke,Kent State,5,6,NA,263530150,2006-12-19
79,1,8:32,1712,1712,Haminn Quaintance made Free Throw.,26,23,3,12,0.5905356029662491,0.5905356029662491,Duke,Kent State,5,6,NA,263530150,2006-12-19
80,1,8:20,1700,1700,DeMarcus Nelson made Two Point Layup.,28,23,5,18,0.6487983657491412,0.6487983657491412,Duke,Kent State,5,6,NA,263530150,2006-12-19
81,1,8:02,1682,1682,Julian Sullinger missed Two Point Layup.,28,23,5,0,0.6499937939172042,0.6499937939172042,Duke,Kent State,5,6,NA,263530150,2006-12-19
82,1,8:02,1682,1682,Josh McRoberts Defensive Rebound.,28,23,5,6,0.6499937939172042,0.6499937939172042,Duke,Kent State,5,6,NA,263530150,2006-12-19
83,1,7:56,1676,1676,Official TV Timeout.,28,23,5,2,0.6503874541020207,0.6503874541020207,Duke,Kent State,5,6,NA,263530150,2006-12-19
84,1,7:54,1674,1674,Foul on Isaac Knight,28,23,5,0,0.6505178842850148,0.6505178842850148,Duke,Kent State,5,6,NA,263530150,2006-12-19
85,1,7:54,1674,1674,Josh McRoberts missed Free Throw.,28,23,5,0,0.6505178842850148,0.6505178842850148,Duke,Kent State,5,6,NA,263530150,2006-12-19
86,1,7:54,1674,1674,Duke Defensive Rebound.,28,23,5,0,0.6505178842850148,0.6505178842850148,Duke,Kent State,5,6,NA,263530150,2006-12-19
87,1,7:54,1674,1674,Foul on Isaac Knight,28,23,5,0,0.6505178842850148,0.6505178842850148,Duke,Kent State,5,6,NA,263530150,2006-12-19
88,1,7:54,1674,1674,Gerald Henderson made Free Throw.,29,23,6,0,0.6782147720572289,0.6782147720572289,Duke,Kent State,5,6,NA,263530150,2006-12-19
89,1,7:54,1674,1674,Gerald Henderson made Free Throw.,30,23,7,23,0.7047130205992904,0.7047130205992904,Duke,Kent State,5,6,NA,263530150,2006-12-19
90,1,7:31,1651,1651,Josh McRoberts missed Two Point Layup.,30,23,7,0,0.7066019195593829,0.7066019195593829,Duke,Kent State,5,6,NA,263530150,2006-12-19
91,1,7:31,1651,1651,Gerald Henderson Offensive Rebound.,30,23,7,3,0.7066019195593829,0.7066019195593829,Duke,Kent State,5,6,NA,263530150,2006-12-19
92,1,7:28,1648,1648,Foul on Chris Singletary,30,23,7,0,0.7068443726205045,0.7068443726205045,Duke,Kent State,5,6,NA,263530150,2006-12-19
93,1,7:28,1648,1648,Gerald Henderson made Free Throw.,31,23,8,0,0.7322045467745883,0.7322045467745883,Duke,Kent State,5,6,NA,263530150,2006-12-19
94,1,7:28,1648,1648,Gerald Henderson missed Free Throw.,31,23,8,0,0.7322045467745883,0.7322045467745883,Duke,Kent State,5,6,NA,263530150,2006-12-19
95,1,7:28,1648,1648,Armon Gates Defensive Rebound.,31,23,8,24,0.7322045467745883,0.7322045467745883,Duke,Kent State,5,6,NA,263530150,2006-12-19
96,1,7:04,1624,1624,Mike Scott missed Two Point Jumper.,31,23,8,0,0.7342752949735284,0.7342752949735284,Duke,Kent State,5,6,NA,263530150,2006-12-19
97,1,7:04,1624,1624,DeMarcus Nelson Defensive Rebound.,31,23,8,5,0.7342752949735284,0.7342752949735284,Duke,Kent State,5,6,NA,263530150,2006-12-19
98,1,6:59,1619,1619,DeMarcus Nelson missed Two Point Layup.,31,23,8,0,0.7347020184930225,0.7347020184930225,Duke,Kent State,5,6,NA,263530150,2006-12-19
99,1,6:59,1619,1619,Chris Singletary Defensive Rebound.,31,23,8,9,0.7347020184930225,0.7347020184930225,Duke,Kent State,5,6,NA,263530150,2006-12-19
100,1,6:50,1610,1610,Armon Gates missed Two Point Layup.,31,23,8,0,0.7354674425867476,0.7354674425867476,Duke,Kent State,5,6,NA,263530150,2006-12-19
101,1,6:50,1610,1610,Haminn Quaintance Offensive Rebound.,31,23,8,3,0.7354674425867476,0.7354674425867476,Duke,Kent State,5,6,NA,263530150,2006-12-19
102,1,6:47,1607,1607,Haminn Quaintance made Two Point Tip Shot.,31,25,6,18,0.6830638582000854,0.6830638582000854,Duke,Kent State,5,6,NA,263530150,2006-12-19
103,1,6:29,1589,1589,Chris Singletary Steal.,31,25,6,4,0.6843377929485492,0.6843377929485492,Duke,Kent State,5,6,NA,263530150,2006-12-19
104,1,6:25,1585,1585,Omni Smith made Two Point Layup.  Assisted by Chris Singletary.,31,27,4,19,0.62638216021108,0.62638216021108,Duke,Kent State,5,6,NA,263530150,2006-12-19
105,1,6:06,1566,1566,Josh McRoberts made Two Point Jumper.,33,27,6,9,0.6859721784160182,0.6859721784160182,Duke,Kent State,5,6,NA,263530150,2006-12-19
106,1,5:57,1557,1557,Haminn Quaintance missed Two Point Layup.,33,27,6,0,0.6866171220735683,0.6866171220735683,Duke,Kent State,5,6,NA,263530150,2006-12-19
107,1,5:57,1557,1557,DeMarcus Nelson Defensive Rebound.,33,27,6,23,0.6866171220735683,0.6866171220735683,Duke,Kent State,5,6,NA,263530150,2006-12-19
108,1,5:34,1534,1534,Gerald Henderson missed Two Point Jumper.,33,27,6,0,0.688288561699507,0.688288561699507,Duke,Kent State,5,6,NA,263530150,2006-12-19
109,1,5:34,1534,1534,Josh McRoberts Offensive Rebound.,33,27,6,0,0.688288561699507,0.688288561699507,Duke,Kent State,5,6,NA,263530150,2006-12-19
110,1,5:34,1534,1534,Josh McRoberts missed Two Point Layup.,33,27,6,0,0.688288561699507,0.688288561699507,Duke,Kent State,5,6,NA,263530150,2006-12-19
111,1,5:34,1534,1534,Omni Smith Defensive Rebound.,33,27,6,11,0.688288561699507,0.688288561699507,Duke,Kent State,5,6,NA,263530150,2006-12-19
112,1,5:23,1523,1523,Foul on Greg Paulus,33,27,6,0,0.6891034801586782,0.6891034801586782,Duke,Kent State,5,6,NA,263530150,2006-12-19
113,1,5:23,1523,1523,Omni Smith missed Free Throw.,33,27,6,0,0.6891034801586782,0.6891034801586782,Duke,Kent State,5,6,NA,263530150,2006-12-19
114,1,5:23,1523,1523,Brian Zoubek Defensive Rebound.,33,27,6,23,0.6891034801586782,0.6891034801586782,Duke,Kent State,5,6,NA,263530150,2006-12-19
115,1,5:00,1500,1500,Omni Smith made Two Point Layup.  Assisted by Haminn Quaintance.,33,29,4,15,0.6308964171719894,0.6308964171719894,Duke,Kent State,5,6,NA,263530150,2006-12-19
116,1,4:45,1485,1485,Jon Scheyer made Three Point Jumper.  Assisted by DeMarcus Nelson.,36,29,7,25,0.7200170794987923,0.7200170794987923,Duke,Kent State,5,6,NA,263530150,2006-12-19
117,1,4:20,1460,1460,Haminn Quaintance made Two Point Layup.  Assisted by Omni Smith.,36,31,5,17,0.66433433417184,0.66433433417184,Duke,Kent State,5,6,NA,263530150,2006-12-19
118,1,4:03,1443,1443,Martynas Pocius missed Three Point Jumper.,36,31,5,0,0.6655981108897443,0.6655981108897443,Duke,Kent State,5,6,NA,263530150,2006-12-19
119,1,4:03,1443,1443,Armon Gates Defensive Rebound.,36,31,5,10,0.6655981108897443,0.6655981108897443,Duke,Kent State,5,6,NA,263530150,2006-12-19
120,1,3:53,1433,1433,Rodriguez Sherman missed Two Point Layup.,36,31,5,0,0.6663288772652467,0.6663288772652467,Duke,Kent State,5,6,NA,263530150,2006-12-19
121,1,3:53,1433,1433,David McClure Defensive Rebound.,36,31,5,21,0.6663288772652467,0.6663288772652467,Duke,Kent State,5,6,NA,263530150,2006-12-19
122,1,3:32,1412,1412,Foul on Rodriguez Sherman,36,31,5,0,0.6678186116021697,0.6678186116021697,Duke,Kent State,5,6,NA,263530150,2006-12-19
123,1,3:32,1412,1412,Official TV Timeout.,36,31,5,0,0.6678186116021697,0.6678186116021697,Duke,Kent State,5,6,NA,263530150,2006-12-19
124,1,3:32,1412,1412,DeMarcus Nelson missed Free Throw.,36,31,5,0,0.6678186116021697,0.6678186116021697,Duke,Kent State,5,6,NA,263530150,2006-12-19
125,1,3:32,1412,1412,Duke Defensive Rebound.,36,31,5,0,0.6678186116021697,0.6678186116021697,Duke,Kent State,5,6,NA,263530150,2006-12-19
126,1,3:32,1412,1412,DeMarcus Nelson made Free Throw.,37,31,6,10,0.6980443552808615,0.6980443552808615,Duke,Kent State,5,6,NA,263530150,2006-12-19
127,1,3:22,1402,1402,Omni Smith made Two Point Layup.  Assisted by Haminn Quaintance.,37,33,4,0,0.6367227066325559,0.6367227066325559,Duke,Kent State,5,6,NA,263530150,2006-12-19
128,1,3:22,1402,1402,Foul on Jon Scheyer,37,33,4,0,0.6367227066325559,0.6367227066325559,Duke,Kent State,5,6,NA,263530150,2006-12-19
129,1,3:22,1402,1402,Omni Smith missed Free Throw.,37,33,4,0,0.6367227066325559,0.6367227066325559,Duke,Kent State,5,6,NA,263530150,2006-12-19
130,1,3:22,1402,1402,Josh McRoberts Defensive Rebound.,37,33,4,31,0.6367227066325559,0.6367227066325559,Duke,Kent State,5,6,NA,263530150,2006-12-19
131,1,2:51,1371,1371,Foul on Lance Thomas,37,33,4,0,0.6384839882353766,0.6384839882353766,Duke,Kent State,5,6,NA,263530150,2006-12-19
132,1,2:51,1371,1371,Mike Scott made Free Throw.,37,34,3,0,0.6050597434907705,0.6050597434907705,Duke,Kent State,5,6,NA,263530150,2006-12-19
133,1,2:51,1371,1371,Mike Scott made Free Throw.,37,35,2,22,0.57062341820926,0.57062341820926,Duke,Kent State,5,6,NA,263530150,2006-12-19
134,1,2:29,1349,1349,Armon Gates Steal.,37,35,2,23,0.5712836420640102,0.5712836420640102,Duke,Kent State,5,6,NA,263530150,2006-12-19
135,1,2:06,1326,1326,Haminn Quaintance missed Two Point Dunk Shot.,37,35,2,2,0.5719841566532281,0.5719841566532281,Duke,Kent State,5,6,NA,263530150,2006-12-19
136,1,2:04,1324,1324,Chris Singletary Offensive Rebound.,37,35,2,3,0.5720459444610492,0.5720459444610492,Duke,Kent State,5,6,NA,263530150,2006-12-19
137,1,2:01,1321,1321,Chris Singletary missed Two Point Layup.,37,35,2,0,0.5721389555107412,0.5721389555107412,Duke,Kent State,5,6,NA,263530150,2006-12-19
138,1,2:01,1321,1321,Chris Singletary Offensive Rebound.,37,35,2,6,0.5721389555107412,0.5721389555107412,Duke,Kent State,5,6,NA,263530150,2006-12-19
139,1,1:55,1315,1315,Chris Singletary missed Two Point Layup.,37,35,2,0,0.5723262583301502,0.5723262583301502,Duke,Kent State,5,6,NA,263530150,2006-12-19
140,1,1:55,1315,1315,Gerald Henderson Defensive Rebound.,37,35,2,8,0.5723262583301502,0.5723262583301502,Duke,Kent State,5,6,NA,263530150,2006-12-19
141,1,1:47,1307,1307,Josh McRoberts missed Two Point Layup.,37,35,2,0,0.5725789564572262,0.5725789564572262,Duke,Kent State,5,6,NA,263530150,2006-12-19
142,1,1:47,1307,1307,Armon Gates Defensive Rebound.,37,35,2,19,0.5725789564572262,0.5725789564572262,Duke,Kent State,5,6,NA,263530150,2006-12-19
143,1,1:28,1288,1288,DeMarcus Nelson missed Three Point Jumper.,37,35,2,0,0.573195384468774,0.573195384468774,Duke,Kent State,5,6,NA,263530150,2006-12-19
144,1,1:28,1288,1288,Armon Gates Defensive Rebound.,37,35,2,10,0.573195384468774,0.573195384468774,Duke,Kent State,5,6,NA,263530150,2006-12-19
145,1,1:18,1278,1278,Chris Singletary made Three Point Jumper.  Assisted by Haminn Quaintance.,37,38,-1,26,0.4630336731015302,0.4630336731015302,Duke,Kent State,5,6,NA,263530150,2006-12-19
146,1,0:52,1252,1252,Jon Scheyer missed Three Point Jumper.,37,38,-1,0,0.4625683493102502,0.4625683493102502,Duke,Kent State,5,6,NA,263530150,2006-12-19
147,1,0:52,1252,1252,Kent State Defensive Rebound.,37,38,-1,12,0.4625683493102502,0.4625683493102502,Duke,Kent State,5,6,NA,263530150,2006-12-19
148,1,0:40,1240,1240,Kent State Full Timeout.,37,38,-1,37,0.4623409855902041,0.4623409855902041,Duke,Kent State,5,5,NA,263530150,2006-12-19
149,1,0:03,1203,1203,Josh McRoberts made Two Point Dunk Shot.  Assisted by Jon Scheyer.,39,38,1,3,0.5384181111416124,0.5384181111416124,Duke,Kent State,5,5,NA,263530150,2006-12-19
150,1,0:00,1200,1200,End of the 1st Half.,39,38,1,0,0.5384812553577752,0.5384812553577752,Duke,Kent State,5,5,NA,263530150,2006-12-19
151,2,20:00,1200,1200,PLAY,39,38,1,23,0.5384812553577752,0.5384812553577752,Duke,Kent State,5,5,NA,263530150,2006-12-19
152,2,19:37,1177,1177,David McClure made Two Point Dunk Shot.  Assisted by Josh McRoberts.,41,38,3,20,0.6150048847102236,0.6150048847102236,Duke,Kent State,5,5,NA,263530150,2006-12-19
153,2,19:17,1157,1157,Haminn Quaintance missed Two Point Layup.,41,38,3,2,0.6161468403088822,0.6161468403088822,Duke,Kent State,5,5,NA,263530150,2006-12-19
154,2,19:15,1155,1155,Haminn Quaintance Offensive Rebound.,41,38,3,7,0.6162599218815095,0.6162599218815095,Duke,Kent State,5,5,NA,263530150,2006-12-19
155,2,19:08,1148,1148,Chris Singletary made Two Point Layup.,41,40,1,14,0.5395317425811988,0.5395317425811988,Duke,Kent State,5,5,NA,263530150,2006-12-19
156,2,18:54,1134,1134,DeMarcus Nelson made Three Point Jumper.  Assisted by Greg Paulus.,44,40,4,15,0.6543627092846436,0.6543627092846436,Duke,Kent State,5,5,NA,263530150,2006-12-19
157,2,18:39,1119,1119,Mike Scott missed Three Point Jumper.,44,40,4,0,0.6554407151462831,0.6554407151462831,Duke,Kent State,5,5,NA,263530150,2006-12-19
158,2,18:39,1119,1119,David McClure Defensive Rebound.,44,40,4,12,0.6554407151462831,0.6554407151462831,Duke,Kent State,5,5,NA,263530150,2006-12-19
159,2,18:27,1107,1107,DeMarcus Nelson missed Two Point Layup.,44,40,4,0,0.6563093638041018,0.6563093638041018,Duke,Kent State,5,5,NA,263530150,2006-12-19
160,2,18:27,1107,1107,Mike Scott Defensive Rebound.,44,40,4,17,0.6563093638041018,0.6563093638041018,Duke,Kent State,5,5,NA,263530150,2006-12-19
161,2,18:10,1090,1090,Haminn Quaintance made Two Point Jumper.,44,42,2,11,0.5808383807264902,0.5808383807264902,Duke,Kent State,5,5,NA,263530150,2006-12-19
162,2,17:59,1079,1079,David McClure made Two Point Jumper.  Assisted by Greg Paulus.,46,42,4,20,0.6583828575297254,0.6583828575297254,Duke,Kent State,5,5,NA,263530150,2006-12-19
163,2,17:39,1059,1059,Armon Gates made Two Point Layup.,46,44,2,28,0.582120606673542,0.582120606673542,Duke,Kent State,5,5,NA,263530150,2006-12-19
164,2,17:11,1031,1031,Foul on Haminn Quaintance,46,44,2,0,0.5833639138585995,0.5833639138585995,Duke,Kent State,5,5,NA,263530150,2006-12-19
165,2,17:11,1031,1031,Josh McRoberts made Free Throw.,47,44,3,0,0.6236094717235604,0.6236094717235604,Duke,Kent State,5,5,NA,263530150,2006-12-19
166,2,17:11,1031,1031,Josh McRoberts missed Free Throw.,47,44,3,0,0.6236094717235604,0.6236094717235604,Duke,Kent State,5,5,NA,263530150,2006-12-19
167,2,17:11,1031,1031,Armon Gates Defensive Rebound.,47,44,3,15,0.6236094717235604,0.6236094717235604,Duke,Kent State,5,5,NA,263530150,2006-12-19
168,2,16:56,1016,1016,Mike Scott made Two Point Jumper.,47,46,1,30,0.542338259963646,0.542338259963646,Duke,Kent State,5,5,NA,263530150,2006-12-19
169,2,16:26,986,986,Foul on Jordan Mincy,47,46,1,24,0.5431215391213763,0.5431215391213763,Duke,Kent State,5,5,NA,263530150,2006-12-19
170,2,16:02,962,962,Omni Smith made Three Point Jumper.  Assisted by Jordan Mincy.,47,49,-2,20,0.4130573918079103,0.4130573918079103,Duke,Kent State,5,5,NA,263530150,2006-12-19
171,2,15:42,942,942,Greg Paulus made Three Point Jumper.  Assisted by Josh McRoberts.,50,49,1,22,0.544334862371342,0.544334862371342,Duke,Kent State,5,5,NA,263530150,2006-12-19
172,2,15:20,920,920,Omni Smith made Two Point Jumper.,50,51,-1,17,0.45513673833519336,0.45513673833519336,Duke,Kent State,5,5,NA,263530150,2006-12-19
173,2,15:03,903,903,Mike Scott Steal.,50,51,-1,8,0.45475451708460474,0.45475451708460474,Duke,Kent State,5,5,NA,263530150,2006-12-19
174,2,14:55,895,895,Chris Singletary missed Three Point Jumper.,50,51,-1,0,0.45457939400950875,0.45457939400950875,Duke,Kent State,5,5,NA,263530150,2006-12-19
175,2,14:55,895,895,DeMarcus Nelson Defensive Rebound.,50,51,-1,23,0.45457939400950875,0.45457939400950875,Duke,Kent State,5,5,NA,263530150,2006-12-19
