play_id,half,time_remaining_half,secs_remaining,secs_remaining_absolute,description,home_score,away_score,score_diff,play_length,win_prob,naive_win_prob,home,away,home_time_out_remaining,away_time_out_remaining,home_favored_by,game_id,date
1,1,20:00,2400,2400,PLAY,0,0,0,0,0.5,0.5,Xavier,Georgetown,4,4,NA,400840264,2016-01-19
2,1,20:00,2400,2400,Jump Ball won by Georgetown,0,0,0,20,0.5,0.5,Xavier,Georgetown,4,4,NA,400840264,2016-01-19
3,1,19:40,2380,2380,Foul on James Farr.,0,0,0,8,0.5,0.5,Xavier,Georgetown,4,4,NA,400840264,2016-01-19
4,1,19:32,2372,2372,Tre Campbell made Three Point Jumper. Assisted by D'Vauntes Smith-Rivera.,0,3,-3,18,0.4332944795908188,0.4332944795908188,Xavier,Georgetown,4,4,NA,400840264,2016-01-19
5,1,19:14,2354,2354,James Farr missed Layup.,0,3,-3,0,0.43272082956111063,0.43272082956111063,Xavier,Georgetown,4,4,NA,400840264,2016-01-19
6,1,19:14,2354,2354,Bradley Hayes Defensive Rebound.,0,3,-3,11,0.43272082956111063,0.43272082956111063,Xavier,Georgetown,4,4,NA,400840264,2016-01-19
7,1,19:03,2343,2343,Bradley Hayes made Jumper. Assisted by D'Vauntes Smith-Rivera.,0,5,-5,18,0.3884895152902961,0.3884895152902961,Xavier,Georgetown,4,4,NA,400840264,2016-01-19
8,1,18:45,2325,2325,Remy Abell made Three Point Jumper. Assisted by Edmond Sumner.,3,5,-2,20,0.4543645204002807,0.4543645204002807,Xavier,Georgetown,4,4,NA,400840264,2016-01-19
9,1,18:25,2305,2305,Isaac Copeland missed Jumper.,3,5,-2,0,0.4539235074515363,0.4539235074515363,Xavier,Georgetown,4,4,NA,400840264,2016-01-19
10,1,18:25,2305,2305,James Farr Defensive Rebound.,3,5,-2,8,0.4539235074515363,0.4539235074515363,Xavier,Georgetown,4,4,NA,400840264,2016-01-19
11,1,18:17,2297,2297,Edmond Sumner made Three Point Jumper.,6,5,1,22,0.5231767404535681,0.5231767404535681,Xavier,Georgetown,4,4,NA,400840264,2016-01-19
12,1,17:55,2275,2275,Tre Campbell missed Three Point Jumper.,6,5,1,0,0.5234241756349494,0.5234241756349494,Xavier,Georgetown,4,4,NA,400840264,2016-01-19
13,1,17:55,2275,2275,Trevon Bluiett Defensive Rebound.,6,5,1,20,0.5234241756349494,0.5234241756349494,Xavier,Georgetown,4,4,NA,400840264,2016-01-19
14,1,17:35,2255,2255,Trevon Bluiett missed Layup.,6,5,1,0,0.5236510401070434,0.5236510401070434,Xavier,Georgetown,4,4,NA,400840264,2016-01-19
15,1,17:35,2255,2255,Bradley Hayes Block.,6,5,1,0,0.5236510401070434,0.5236510401070434,Xavier,Georgetown,4,4,NA,400840264,2016-01-19
16,1,17:35,2255,2255,James Farr Offensive Rebound.,6,5,1,0,0.5236510401070434,0.5236510401070434,Xavier,Georgetown,4,4,NA,400840264,2016-01-19
17,1,17:35,2255,2255,James Farr made Two Point Tip Shot.,8,5,3,28,0.5705325919819826,0.5705325919819826,Xavier,Georgetown,4,4,NA,400840264,2016-01-19
18,1,17:07,2227,2227,D'Vauntes Smith-Rivera made Three Point Jumper. Assisted by Reggie Cameron.,8,8,0,21,0.5,0.5,Xavier,Georgetown,4,4,NA,400840264,2016-01-19
19,1,16:46,2206,2206,James Farr missed Jumper.,8,8,0,0,0.5,0.5,Xavier,Georgetown,4,4,NA,400840264,2016-01-19
20,1,16:46,2206,2206,Reggie Cameron Defensive Rebound.,8,8,0,15,0.5,0.5,Xavier,Georgetown,4,4,NA,400840264,2016-01-19
21,1,16:31,2191,2191,Tre Campbell missed Jumper.,8,8,0,0,0.5,0.5,Xavier,Georgetown,4,4,NA,400840264,2016-01-19
22,1,16:31,2191,2191,James Farr Defensive Rebound.,8,8,0,5,0.5,0.5,Xavier,Georgetown,4,4,NA,400840264,2016-01-19
23,1,16:26,2186,2186,Foul on Bradley Hayes.,8,8,0,9,0.5,0.5,Xavier,Georgetown,4,4,NA,400840264,2016-01-19
24,1,16:17,2177,2177,Trevon Bluiett missed Jumper.,8,8,0,0,0.5,0.5,Xavier,Georgetown,4,4,NA,400840264,2016-01-19
25,1,16:17,2177,2177,Reggie Cameron Defensive Rebound.,8,8,0,8,0.5,0.5,Xavier,Georgetown,4,4,NA,400840264,2016-01-19
26,1,16:09,2169,2169,D'Vauntes Smith-Rivera missed Three Point Jumper.,8,8,0,0,0.5,0.5,Xavier,Georgetown,4,4,NA,400840264,2016-01-19
27,1,16:09,2169,2169,Trevon Bluiett Defensive Rebound.,8,8,0,13,0.5,0.5,Xavier,Georgetown,4,4,NA,400840264,2016-01-19
28,1,15:56,2156,2156,Sean O'Mara made Layup. Assisted by J.P. Macura.,10,8,2,20,0.5494661865413782,0.5494661865413782,Xavier,Georgetown,4,4,NA,400840264,2016-01-19
29,1,15:36,2136,2136,Bradley Hayes made Jumper. Assisted by D'Vauntes Smith-Rivera.,10,10,0,29,0.5,0.5,Xavier,Georgetown,4,4,NA,400840264,2016-01-19
30,1,15:07,2107,2107,Trevon Bluiett missed Three Point Jumper.,10,10,0,0,0.5,0.5,Xavier,Georgetown,4,4,NA,400840264,2016-01-19
31,1,15:07,2107,2107,Sean O'Mara Offensive Rebound.,10,10,0,5,0.5,0.5,Xavier,Georgetown,4,4,NA,400840264,2016-01-19
32,1,15:02,2102,2102,Sean O'Mara made Layup.,12,10,2,16,0.5507311729416302,0.5507311729416302,Xavier,Georgetown,4,4,NA,400840264,2016-01-19
33,1,14:46,2086,2086,Reggie Cameron missed Three Point Jumper.,12,10,2,0,0.5511110631973942,0.5511110631973942,Xavier,Georgetown,4,4,NA,400840264,2016-01-19
34,1,14:46,2086,2086,Edmond Sumner Defensive Rebound.,12,10,2,9,0.5511110631973942,0.5511110631973942,Xavier,Georgetown,4,4,NA,400840264,2016-01-19
35,1,14:37,2077,2077,Myles Davis made Three Point Jumper. Assisted by Edmond Sumner.,15,10,5,23,0.6259949486257689,0.6259949486257689,Xavier,Georgetown,4,4,NA,400840264,2016-01-19
36,1,14:14,2054,2054,Bradley Hayes made Jumper.,15,12,3,19,0.5774700857011189,0.5774700857011189,Xavier,Georgetown,4,4,NA,400840264,2016-01-19
37,1,13:55,2035,2035,Edmond Sumner missed Jumper.,15,12,3,0,0.5781523740316055,0.5781523740316055,Xavier,Georgetown,4,4,NA,400840264,2016-01-19
38,1,13:55,2035,2035,Tre Campbell Defensive Rebound.,15,12,3,9,0.5781523740316055,0.5781523740316055,Xavier,Georgetown,4,4,NA,400840264,2016-01-19
39,1,13:46,2026,2026,Isaac Copeland missed Three Point Jumper.,15,12,3,0,0.5784776731286738,0.5784776731286738,Xavier,Georgetown,4,4,NA,400840264,2016-01-19
40,1,13:46,2026,2026,Trevon Bluiett Defensive Rebound.,15,12,3,15,0.5784776731286738,0.5784776731286738,Xavier,Georgetown,4,4,NA,400840264,2016-01-19
41,1,13:31,2011,2011,Edmond Sumner missed Jumper.,15,12,3,0,0.5790229776748573,0.5790229776748573,Xavier,Georgetown,4,4,NA,400840264,2016-01-19
42,1,13:31,2011,2011,Edmond Sumner Offensive Rebound.,15,12,3,3,0.5790229776748573,0.5790229776748573,Xavier,Georgetown,4,4,NA,400840264,2016-01-19
43,1,13:28,2008,2008,Edmond Sumner missed Jumper.,15,12,3,0,0.5791325212715424,0.5791325212715424,Xavier,Georgetown,4,4,NA,400840264,2016-01-19
44,1,13:28,2008,2008,Sean O'Mara Offensive Rebound.,15,12,3,0,0.5791325212715424,0.5791325212715424,Xavier,Georgetown,4,4,NA,400840264,2016-01-19
45,1,13:28,2008,2008,Sean O'Mara missed Two Point Tip Shot.,15,12,3,0,0.5791325212715424,0.5791325212715424,Xavier,Georgetown,4,4,NA,400840264,2016-01-19
46,1,13:28,2008,2008,Bradley Hayes Defensive Rebound.,15,12,3,8,0.5791325212715424,0.5791325212715424,Xavier,Georgetown,4,4,NA,400840264,2016-01-19
47,1,13:20,2000,2000,Foul on Myles Davis.,15,12,3,0,0.5794254425950851,0.5794254425950851,Xavier,Georgetown,4,4,NA,400840264,2016-01-19
48,1,13:20,2000,2000,Official TV Timeout,15,12,3,0,0.5794254425950851,0.5794254425950851,Xavier,Georgetown,4,4,NA,400840264,2016-01-19
49,1,13:20,2000,2000,Tre Campbell made Free Throw.,15,13,2,0,0.5532003999535374,0.5532003999535374,Xavier,Georgetown,4,4,NA,400840264,2016-01-19
50,1,13:20,2000,2000,Tre Campbell made Free Throw.,15,14,1,13,0.5266759152599936,0.5266759152599936,Xavier,Georgetown,4,4,NA,400840264,2016-01-19
51,1,13:07,1987,1987,Foul on Marcus Derrickson.,15,14,1,23,0.5268391172960498,0.5268391172960498,Xavier,Georgetown,4,4,NA,400840264,2016-01-19
52,1,12:44,1964,1964,Remy Abell missed Three Point Jumper.,15,14,1,0,0.5271307106723907,0.5271307106723907,Xavier,Georgetown,4,4,NA,400840264,2016-01-19
53,1,12:44,1964,1964,Marcus Derrickson Defensive Rebound.,15,14,1,15,0.5271307106723907,0.5271307106723907,Xavier,Georgetown,4,4,NA,400840264,2016-01-19
54,1,12:29,1949,1949,Jessie Govan missed Layup.,15,14,1,0,0.5273229255730185,0.5273229255730185,Xavier,Georgetown,4,4,NA,400840264,2016-01-19
55,1,12:29,1949,1949,Sean O'Mara Block.,15,14,1,0,0.5273229255730185,0.5273229255730185,Xavier,Georgetown,4,4,NA,400840264,2016-01-19
56,1,12:29,1949,1949,Remy Abell Defensive Rebound.,15,14,1,4,0.5273229255730185,0.5273229255730185,Xavier,Georgetown,4,4,NA,400840264,2016-01-19
57,1,12:25,1945,1945,Remy Abell missed Layup.,15,14,1,0,0.5273744646385023,0.5273744646385023,Xavier,Georgetown,4,4,NA,400840264,2016-01-19
58,1,12:25,1945,1945,Georgetown Defensive Rebound.,15,14,1,13,0.5273744646385023,0.5273744646385023,Xavier,Georgetown,4,4,NA,400840264,2016-01-19
59,1,12:12,1932,1932,D'Vauntes Smith-Rivera Turnover.,15,14,1,13,0.527542805974035,0.527542805974035,Xavier,Georgetown,4,4,NA,400840264,2016-01-19
60,1,11:59,1919,1919,Kaiser Gates missed Layup.,15,14,1,0,0.527711841063402,0.527711841063402,Xavier,Georgetown,4,4,NA,400840264,2016-01-19
61,1,11:59,1919,1919,Isaac Copeland Block.,15,14,1,0,0.527711841063402,0.527711841063402,Xavier,Georgetown,4,4,NA,400840264,2016-01-19
62,1,11:59,1919,1919,L.J. Peak Defensive Rebound.,15,14,1,8,0.527711841063402,0.527711841063402,Xavier,Georgetown,4,4,NA,400840264,2016-01-19
63,1,11:51,1911,1911,L.J. Peak Turnover.,15,14,1,0,0.52781571392958,0.52781571392958,Xavier,Georgetown,4,4,NA,400840264,2016-01-19
64,1,11:51,1911,1911,Larry Austin Jr. Steal.,15,14,1,8,0.52781571392958,0.52781571392958,Xavier,Georgetown,4,4,NA,400840264,2016-01-19
65,1,11:43,1903,1903,Myles Davis missed Layup.,15,14,1,0,0.5279195116963304,0.5279195116963304,Xavier,Georgetown,4,4,NA,400840264,2016-01-19
66,1,11:43,1903,1903,L.J. Peak Block.,15,14,1,0,0.5279195116963304,0.5279195116963304,Xavier,Georgetown,4,4,NA,400840264,2016-01-19
67,1,11:43,1903,1903,Xavier Offensive Rebound.,15,14,1,5,0.5279195116963304,0.5279195116963304,Xavier,Georgetown,4,4,NA,400840264,2016-01-19
68,1,11:38,1898,1898,Official TV Timeout,15,14,1,9,0.5279843648328633,0.5279843648328633,Xavier,Georgetown,4,4,NA,400840264,2016-01-19
69,1,11:29,1889,1889,Remy Abell missed Jumper.,15,14,1,0,0.5281010966808245,0.5281010966808245,Xavier,Georgetown,4,4,NA,400840264,2016-01-19
70,1,11:29,1889,1889,L.J. Peak Defensive Rebound.,15,14,1,20,0.5281010966808245,0.5281010966808245,Xavier,Georgetown,4,4,NA,400840264,2016-01-19
71,1,11:09,1869,1869,L.J. Peak missed Jumper.,15,14,1,0,0.5283607385103087,0.5283607385103087,Xavier,Georgetown,4,4,NA,400840264,2016-01-19
72,1,11:09,1869,1869,Trevon Bluiett Defensive Rebound.,15,14,1,9,0.5283607385103087,0.5283607385103087,Xavier,Georgetown,4,4,NA,400840264,2016-01-19
73,1,11:00,1860,1860,Edmond Sumner made Three Point Jumper. Assisted by Trevon Bluiett.,18,14,4,18,0.6120977599592489,0.6120977599592489,Xavier,Georgetown,4,4,NA,400840264,2016-01-19
74,1,10:42,1842,1842,Foul on Edmond Sumner.,18,14,4,18,0.6129926125339111,0.6129926125339111,Xavier,Georgetown,4,4,NA,400840264,2016-01-19
75,1,10:24,1824,1824,L.J. Peak made Layup. Assisted by D'Vauntes Smith-Rivera.,18,16,2,20,0.5577044293590058,0.5577044293590058,Xavier,Georgetown,4,4,NA,400840264,2016-01-19
76,1,10:04,1804,1804,Jalen Reynolds made Layup. Assisted by Kaiser Gates.,20,16,4,29,0.6148984104962276,0.6148984104962276,Xavier,Georgetown,4,4,NA,400840264,2016-01-19
77,1,9:35,1775,1775,L.J. Peak missed Layup.,20,16,4,0,0.6163760672517774,0.6163760672517774,Xavier,Georgetown,4,4,NA,400840264,2016-01-19
78,1,9:35,1775,1775,L.J. Peak Offensive Rebound.,20,16,4,3,0.6163760672517774,0.6163760672517774,Xavier,Georgetown,4,4,NA,400840264,2016-01-19
79,1,9:32,1772,1772,L.J. Peak made Layup.,20,18,2,15,0.5590786494312441,0.5590786494312441,Xavier,Georgetown,4,4,NA,400840264,2016-01-19
80,1,9:17,1757,1757,Edmond Sumner missed Three Point Jumper.,20,18,2,0,0.5594835414164011,0.5594835414164011,Xavier,Georgetown,4,4,NA,400840264,2016-01-19
81,1,9:17,1757,1757,Marcus Derrickson Defensive Rebound.,20,18,2,11,0.5594835414164011,0.5594835414164011,Xavier,Georgetown,4,4,NA,400840264,2016-01-19
82,1,9:06,1746,1746,Marcus Derrickson missed Three Point Jumper.,20,18,2,0,0.559783444160035,0.559783444160035,Xavier,Georgetown,4,4,NA,400840264,2016-01-19
83,1,9:06,1746,1746,Trevon Bluiett Defensive Rebound.,20,18,2,12,0.559783444160035,0.559783444160035,Xavier,Georgetown,4,4,NA,400840264,2016-01-19
84,1,8:54,1734,1734,Trevon Bluiett made Layup. Assisted by Edmond Sumner.,22,18,4,0,0.6185144253446655,0.6185144253446655,Xavier,Georgetown,4,4,NA,400840264,2016-01-19
85,1,8:54,1734,1734,Foul on Bradley Hayes.,22,18,4,0,0.6185144253446655,0.6185144253446655,Xavier,Georgetown,4,4,NA,400840264,2016-01-19
86,1,8:54,1734,1734,Trevon Bluiett made Free Throw.,23,18,5,18,0.6465844705582183,0.6465844705582183,Xavier,Georgetown,4,4,NA,400840264,2016-01-19
87,1,8:36,1716,1716,D'Vauntes Smith-Rivera made Layup. Assisted by Bradley Hayes.,23,20,3,20,0.5903695445027735,0.5903695445027735,Xavier,Georgetown,4,4,NA,400840264,2016-01-19
88,1,8:16,1696,1696,Myles Davis made Jumper. Assisted by Trevon Bluiett.,25,20,5,27,0.6490634336968449,0.6490634336968449,Xavier,Georgetown,4,4,NA,400840264,2016-01-19
89,1,7:49,1669,1669,D'Vauntes Smith-Rivera missed Three Point Jumper.,25,20,5,0,0.6508423285871119,0.6508423285871119,Xavier,Georgetown,4,4,NA,400840264,2016-01-19
90,1,7:49,1669,1669,James Farr Defensive Rebound.,25,20,5,7,0.6508423285871119,0.6508423285871119,Xavier,Georgetown,4,4,NA,400840264,2016-01-19
91,1,7:42,1662,1662,Foul on Bradley Hayes.,25,20,5,0,0.6512928853432018,0.6512928853432018,Xavier,Georgetown,4,4,NA,400840264,2016-01-19
92,1,7:42,1662,1662,Official TV Timeout,25,20,5,21,0.6512928853432018,0.6512928853432018,Xavier,Georgetown,4,4,NA,400840264,2016-01-19
93,1,7:21,1641,1641,J.P. Macura missed Layup.,25,20,5,0,0.6526230031957734,0.6526230031957734,Xavier,Georgetown,4,4,NA,400840264,2016-01-19
94,1,7:21,1641,1641,Jessie Govan Block.,25,20,5,0,0.6526230031957734,0.6526230031957734,Xavier,Georgetown,4,4,NA,400840264,2016-01-19
95,1,7:21,1641,1641,Jessie Govan Defensive Rebound.,25,20,5,16,0.6526230031957734,0.6526230031957734,Xavier,Georgetown,4,4,NA,400840264,2016-01-19
96,1,7:05,1625,1625,Foul on Myles Davis.,25,20,5,6,0.6536202142266724,0.6536202142266724,Xavier,Georgetown,4,4,NA,400840264,2016-01-19
97,1,6:59,1619,1619,Jessie Govan missed Three Point Jumper.,25,20,5,0,0.6539917441205468,0.6539917441205468,Xavier,Georgetown,4,4,NA,400840264,2016-01-19
98,1,6:59,1619,1619,Remy Abell Defensive Rebound.,25,20,5,16,0.6539917441205468,0.6539917441205468,Xavier,Georgetown,4,4,NA,400840264,2016-01-19
99,1,6:43,1603,1603,Trevon Bluiett missed Three Point Jumper.,25,20,5,0,0.6549788178493885,0.6549788178493885,Xavier,Georgetown,4,4,NA,400840264,2016-01-19
100,1,6:43,1603,1603,L.J. Peak Defensive Rebound.,25,20,5,5,0.6549788178493885,0.6549788178493885,Xavier,Georgetown,4,4,NA,400840264,2016-01-19
101,1,6:38,1598,1598,Foul on J.P. Macura.,25,20,5,8,0.6552867724825838,0.6552867724825838,Xavier,Georgetown,4,4,NA,400840264,2016-01-19
102,1,6:30,1590,1590,L.J. Peak Turnover.,25,20,5,0,0.6557796242350777,0.6557796242350777,Xavier,Georgetown,4,4,NA,400840264,2016-01-19
103,1,6:30,1590,1590,Remy Abell Steal.,25,20,5,14,0.6557796242350777,0.6557796242350777,Xavier,Georgetown,4,4,NA,400840264,2016-01-19
104,1,6:16,1576,1576,Foul on Jessie Govan.,25,20,5,0,0.6566442012234069,0.6566442012234069,Xavier,Georgetown,4,4,NA,400840264,2016-01-19
105,1,6:16,1576,1576,Edmond Sumner made Free Throw.,26,20,6,0,0.6852597174092341,0.6852597174092341,Xavier,Georgetown,4,4,NA,400840264,2016-01-19
106,1,6:16,1576,1576,Edmond Sumner made Free Throw.,27,20,7,9,0.7125344298198673,0.7125344298198673,Xavier,Georgetown,4,4,NA,400840264,2016-01-19
107,1,6:07,1567,1567,Tre Campbell made Three Point Jumper. Assisted by Isaac Copeland.,27,23,4,15,0.6273073753096516,0.6273073753096516,Xavier,Georgetown,4,4,NA,400840264,2016-01-19
108,1,5:52,1552,1552,Foul on Tre Campbell.,27,23,4,1,0.6280866313511098,0.6280866313511098,Xavier,Georgetown,4,4,NA,400840264,2016-01-19
109,1,5:51,1551,1551,Trevon Bluiett missed Three Point Jumper.,27,23,4,0,0.628138940982686,0.628138940982686,Xavier,Georgetown,4,4,NA,400840264,2016-01-19
110,1,5:51,1551,1551,Reggie Cameron Defensive Rebound.,27,23,4,7,0.628138940982686,0.628138940982686,Xavier,Georgetown,4,4,NA,400840264,2016-01-19
111,1,5:44,1544,1544,Tre Campbell made Three Point Jumper. Assisted by Reggie Cameron.,27,26,1,15,0.5328162183149334,0.5328162183149334,Xavier,Georgetown,4,4,NA,400840264,2016-01-19
112,1,5:29,1529,1529,James Farr missed Jumper.,27,26,1,0,0.5330289417930258,0.5330289417930258,Xavier,Georgetown,4,4,NA,400840264,2016-01-19
113,1,5:29,1529,1529,Reggie Cameron Defensive Rebound.,27,26,1,11,0.5330289417930258,0.5330289417930258,Xavier,Georgetown,4,4,NA,400840264,2016-01-19
114,1,5:18,1518,1518,Jessie Govan made Dunk. Assisted by Tre Campbell.,27,28,-1,17,0.4668122119177271,0.4668122119177271,Xavier,Georgetown,4,4,NA,400840264,2016-01-19
115,1,5:01,1501,1501,James Farr Turnover.,27,28,-1,0,0.4665610449286985,0.4665610449286985,Xavier,Georgetown,4,4,NA,400840264,2016-01-19
116,1,5:01,1501,1501,Isaac Copeland Steal.,27,28,-1,19,0.4665610449286985,0.4665610449286985,Xavier,Georgetown,4,4,NA,400840264,2016-01-19
117,1,4:42,1482,1482,Isaac Copeland missed Three Point Jumper.,27,28,-1,0,0.46627070193339,0.46627070193339,Xavier,Georgetown,4,4,NA,400840264,2016-01-19
118,1,4:42,1482,1482,Trevon Bluiett Defensive Rebound.,27,28,-1,9,0.46627070193339,0.46627070193339,Xavier,Georgetown,4,4,NA,400840264,2016-01-19
119,1,4:33,1473,1473,Sean O'Mara made Dunk. Assisted by Trevon Bluiett.,29,28,1,11,0.5338708937168383,0.5338708937168383,Xavier,Georgetown,4,4,NA,400840264,2016-01-19
120,1,4:22,1462,1462,Georgetown  Timeout,29,28,1,23,0.53404789546587506,0.53404789546587506,Xavier,Georgetown,3,4,NA,400840264,2016-01-19
121,1,3:59,1439,1439,Tre Campbell made Three Point Jumper. Assisted by Jessie Govan.,29,31,-2,25,0.4314676099318083,0.4314676099318083,Xavier,Georgetown,3,4,NA,400840264,2016-01-19
122,1,3:34,1414,1414,Sean O'Mara missed Jumper.,29,31,-2,0,0.4306787625981809,0.4306787625981809,Xavier,Georgetown,3,4,NA,400840264,2016-01-19
123,1,3:34,1414,1414,Jessie Govan Defensive Rebound.,29,31,-2,9,0.4306787625981809,0.4306787625981809,Xavier,Georgetown,3,4,NA,400840264,2016-01-19
124,1,3:25,1405,1405,Reggie Cameron missed Three Point Jumper.,29,31,-2,0,0.4304021713246262,0.4304021713246262,Xavier,Georgetown,3,4,NA,400840264,2016-01-19
125,1,3:25,1405,1405,Jalen Reynolds Defensive Rebound.,29,31,-2,23,0.4304021713246262,0.4304021713246262,Xavier,Georgetown,3,4,NA,400840264,2016-01-19
126,1,3:02,1382,1382,Foul on D'Vauntes Smith-Rivera.,29,31,-2,0,0.4297063513084754,0.4297063513084754,Xavier,Georgetown,3,4,NA,400840264,2016-01-19
127,1,3:02,1382,1382,Larry Austin Jr. made Free Throw.,30,31,-1,0,0.4646777705214998,0.4646777705214998,Xavier,Georgetown,3,4,NA,400840264,2016-01-19
128,1,3:02,1382,1382,Larry Austin Jr. made Free Throw.,31,31,0,23,0.5,0.5,Xavier,Georgetown,3,4,NA,400840264,2016-01-19
129,1,2:39,1359,1359,Tre Campbell made Three Point Jumper. Assisted by Reggie Cameron.,31,34,-3,32,0.39441429304191866,0.39441429304191866,Xavier,Georgetown,3,4,NA,400840264,2016-01-19
130,1,2:07,1327,1327,Jalen Reynolds missed Three Point Jumper.,31,34,-3,0,0.3929955765939615,0.3929955765939615,Xavier,Georgetown,3,4,NA,400840264,2016-01-19
131,1,2:07,1327,1327,Jessie Govan Defensive Rebound.,31,34,-3,36,0.3929955765939615,0.3929955765939615,Xavier,Georgetown,3,4,NA,400840264,2016-01-19
132,1,1:31,1291,1291,Foul on Jalen Reynolds.,31,34,-3,0,0.39132566693702214,0.39132566693702214,Xavier,Georgetown,3,4,NA,400840264,2016-01-19
133,1,1:31,1291,1291,Jessie Govan made Free Throw.,31,35,-4,0,0.35686640023570215,0.35686640023570215,Xavier,Georgetown,3,4,NA,400840264,2016-01-19
134,1,1:31,1291,1291,Jessie Govan made Free Throw.,31,36,-5,10,0.32382717371423814,0.32382717371423814,Xavier,Georgetown,3,4,NA,400840264,2016-01-19
135,1,1:21,1281,1281,Jalen Reynolds made Layup. Assisted by J.P. Macura.,33,36,-3,19,0.3908395712192175,0.3908395712192175,Xavier,Georgetown,3,4,NA,400840264,2016-01-19
136,1,1:02,1262,1262,Jessie Govan made Dunk. Assisted by D'Vauntes Smith-Rivera.,33,38,-5,19,0.3216163356258334,0.3216163356258334,Xavier,Georgetown,3,4,NA,400840264,2016-01-19
137,1,0:43,1243,1243,Kaiser Gates missed Three Point Jumper.,33,38,-5,0,0.3200701316392726,0.3200701316392726,Xavier,Georgetown,3,4,NA,400840264,2016-01-19
138,1,0:43,1243,1243,D'Vauntes Smith-Rivera Defensive Rebound.,33,38,-5,30,0.3200701316392726,0.3200701316392726,Xavier,Georgetown,3,4,NA,400840264,2016-01-19
139,1,0:13,1213,1213,Reggie Cameron missed Three Point Jumper.,33,38,-5,0,0.3174322884686968,0.3174322884686968,Xavier,Georgetown,3,4,NA,400840264,2016-01-19
140,1,0:13,1213,1213,Jessie Govan Offensive Rebound.,33,38,-5,7,0.3174322884686968,0.3174322884686968,Xavier,Georgetown,3,4,NA,400840264,2016-01-19
141,1,0:06,1206,1206,Foul on Edmond Sumner.,33,38,-5,0,0.3167817366240917,0.3167817366240917,Xavier,Georgetown,3,4,NA,400840264,2016-01-19
142,1,0:06,1206,1206,Jessie Govan made Free Throw.,33,39,-6,0,0.28448508069842743,0.28448508069842743,Xavier,Georgetown,3,4,NA,400840264,2016-01-19
143,1,0:06,1206,1206,Jessie Govan missed Free Throw.,33,39,-6,0,0.28448508069842743,0.28448508069842743,Xavier,Georgetown,3,4,NA,400840264,2016-01-19
144,1,0:06,1206,1206,Jalen Reynolds Defensive Rebound.,33,39,-6,2,0.28448508069842743,0.28448508069842743,Xavier,Georgetown,3,4,NA,400840264,2016-01-19
145,1,0:04,1204,1204,Edmond Sumner missed Three Point Jumper.,33,39,-6,0,0.28427674156511656,0.28427674156511656,Xavier,Georgetown,3,4,NA,400840264,2016-01-19
146,1,0:04,1204,1204,Isaac Copeland Defensive Rebound.,33,39,-6,4,0.28427674156511656,0.28427674156511656,Xavier,Georgetown,3,4,NA,400840264,2016-01-19
147,1,0:00,1200,1200,End of 1st half,33,39,-6,0,0.28386293076294067,0.28386293076294067,Xavier,Georgetown,3,4,NA,400840264,2016-01-19
148,2,20:00,1200,1200,PLAY,33,39,-6,0,0.28386293076294067,0.28386293076294067,Xavier,Georgetown,4,4,NA,400840264,2016-01-19
149,2,20:00,1200,1200,Jump Ball won by Xavier,33,39,-6,14,0.28386293076294067,0.28386293076294067,Xavier,Georgetown,4,4,NA,400840264,2016-01-19
150,2,19:46,1186,1186,James Farr Turnover.,33,39,-6,25,0.28244179701139616,0.28244179701139616,Xavier,Georgetown,4,4,NA,400840264,2016-01-19
151,2,19:21,1161,1161,D'Vauntes Smith-Rivera missed Three Point Jumper.,33,39,-6,0,0.27998538967378295,0.27998538967378295,Xavier,Georgetown,4,4,NA,400840264,2016-01-19
152,2,19:21,1161,1161,Tre Campbell Offensive Rebound.,33,39,-6,8,0.27998538967378295,0.27998538967378295,Xavier,Georgetown,4,4,NA,400840264,2016-01-19
153,2,19:13,1153,1153,Tre Campbell made Layup.,33,41,-8,8,0.22020319387320078,0.22020319387320078,Xavier,Georgetown,4,4,NA,400840264,2016-01-19
154,2,19:05,1145,1145,Remy Abell missed Layup.,33,41,-8,0,0.21933150793748313,0.21933150793748313,Xavier,Georgetown,4,4,NA,400840264,2016-01-19
155,2,19:05,1145,1145,James Farr Offensive Rebound.,33,41,-8,5,0.21933150793748313,0.21933150793748313,Xavier,Georgetown,4,4,NA,400840264,2016-01-19
156,2,19:00,1140,1140,Foul on D'Vauntes Smith-Rivera.,33,41,-8,0,0.21878887385154205,0.21878887385154205,Xavier,Georgetown,4,4,NA,400840264,2016-01-19
157,2,19:00,1140,1140,James Farr made Free Throw.,34,41,-7,0,0.2471917967283756,0.2471917967283756,Xavier,Georgetown,4,4,NA,400840264,2016-01-19
158,2,19:00,1140,1140,James Farr made Free Throw.,35,41,-6,14,0.27796996547500685,0.27796996547500685,Xavier,Georgetown,4,4,NA,400840264,2016-01-19
159,2,18:46,1126,1126,Jessie Govan Turnover.,35,41,-6,0,0.2766343835629063,0.2766343835629063,Xavier,Georgetown,4,4,NA,400840264,2016-01-19
160,2,18:46,1126,1126,Edmond Sumner Steal.,35,41,-6,11,0.2766343835629063,0.2766343835629063,Xavier,Georgetown,4,4,NA,400840264,2016-01-19
161,2,18:35,1115,1115,Edmond Sumner Turnover.,35,41,-6,0,0.27558260074118573,0.27558260074118573,Xavier,Georgetown,4,4,NA,400840264,2016-01-19
162,2,18:35,1115,1115,Tre Campbell Steal.,35,41,-6,7,0.27558260074118573,0.27558260074118573,Xavier,Georgetown,4,4,NA,400840264,2016-01-19
163,2,18:28,1108,1108,D'Vauntes Smith-Rivera made Layup. Assisted by Reggie Cameron.,35,43,-8,16,0.2153224913634856,0.2153224913634856,Xavier,Georgetown,4,4,NA,400840264,2016-01-19
164,2,18:12,1092,1092,Edmond Sumner missed Three Point Jumper.,35,43,-8,0,0.2135688104408922,0.2135688104408922,Xavier,Georgetown,4,4,NA,400840264,2016-01-19
165,2,18:12,1092,1092,James Farr Offensive Rebound.,35,43,-8,7,0.2135688104408922,0.2135688104408922,Xavier,Georgetown,4,4,NA,400840264,2016-01-19
166,2,18:05,1085,1085,Foul on Jessie Govan.,35,43,-8,8,0.21279202974045733,0.21279202974045733,Xavier,Georgetown,4,4,NA,400840264,2016-01-19
167,2,17:57,1077,1077,Foul on Jessie Govan.,35,43,-8,0,0.2118950157426004,0.2118950157426004,Xavier,Georgetown,4,4,NA,400840264,2016-01-19
168,2,17:57,1077,1077,Myles Davis missed Free Throw.,35,43,-8,0,0.2118950157426004,0.2118950157426004,Xavier,Georgetown,4,4,NA,400840264,2016-01-19
169,2,17:57,1077,1077,Xavier Deadball Team Rebound.,35,43,-8,0,0.2118950157426004,0.2118950157426004,Xavier,Georgetown,4,4,NA,400840264,2016-01-19
170,2,17:57,1077,1077,Myles Davis made Free Throw.,36,43,-7,10,0.2406082264291307,0.2406082264291307,Xavier,Georgetown,4,4,NA,400840264,2016-01-19
171,2,17:47,1067,1067,Trey Mourning missed Layup.,36,43,-7,0,0.23951855355463797,0.23951855355463797,Xavier,Georgetown,4,4,NA,400840264,2016-01-19
172,2,17:47,1067,1067,Trey Mourning Offensive Rebound.,36,43,-7,5,0.23951855355463797,0.23951855355463797,Xavier,Georgetown,4,4,NA,400840264,2016-01-19
173,2,17:42,1062,1062,Foul on Myles Davis.,36,43,-7,0,0.2389658775197491,0.2389658775197491,Xavier,Georgetown,4,4,NA,400840264,2016-01-19
174,2,17:42,1062,1062,Trey Mourning made Free Throw.,36,44,-8,0,0.21018061532431662,0.21018061532431662,Xavier,Georgetown,4,4,NA,400840264,2016-01-19
175,2,17:42,1062,1062,Trey Mourning missed Free Throw.,36,44,-8,0,0.21018061532431662,0.21018061532431662,Xavier,Georgetown,4,4,NA,400840264,2016-01-19
176,2,17:42,1062,1062,Trevon Bluiett Defensive Rebound.,36,44,-8,18,0.21018061532431662,0.21018061532431662,Xavier,Georgetown,4,4,NA,400840264,2016-01-19
