play_id,half,time_remaining_half,secs_remaining,secs_remaining_absolute,description,home_score,away_score,score_diff,play_length,win_prob,naive_win_prob,home,away,home_time_out_remaining,away_time_out_remaining,home_favored_by,game_id,date
1,1,20:00,2400,2400,PLAY,0,0,0,12,0.5,0.5,West Virginia,UConn,4,4,NA,290060277,2009-01-06
2,1,19:48,2388,2388,A.J. Price missed Two Point Jumper.,0,0,0,0,0.5,0.5,West Virginia,UConn,4,4,NA,290060277,2009-01-06
3,1,19:48,2388,2388,Stanley Robinson Offensive Rebound.,0,0,0,7,0.5,0.5,West Virginia,UConn,4,4,NA,290060277,2009-01-06
4,1,19:41,2381,2381,Stanley Robinson missed Two Point Tip Shot.,0,0,0,0,0.5,0.5,West Virginia,UConn,4,4,NA,290060277,2009-01-06
5,1,19:41,2381,2381,Wellington Smith Block.,0,0,0,4,0.5,0.5,West Virginia,UConn,4,4,NA,290060277,2009-01-06
6,1,19:37,2377,2377,Hasheem Thabeet Offensive Rebound.,0,0,0,4,0.5,0.5,West Virginia,UConn,4,4,NA,290060277,2009-01-06
7,1,19:33,2373,2373,Hasheem Thabeet made Two Point Dunk Shot.,0,2,-2,18,0.4554032958067534,0.4554032958067534,West Virginia,UConn,4,4,NA,290060277,2009-01-06
8,1,19:15,2355,2355,Da'Sean Butler missed Two Point Jumper.,0,2,-2,0,0.45501724388899867,0.45501724388899867,West Virginia,UConn,4,4,NA,290060277,2009-01-06
9,1,19:15,2355,2355,Wellington Smith Offensive Rebound.,0,2,-2,15,0.45501724388899867,0.45501724388899867,West Virginia,UConn,4,4,NA,290060277,2009-01-06
10,1,19:00,2340,2340,Darryl Bryant made Three Point Jumper.,3,2,1,9,0.522700560220778,0.522700560220778,West Virginia,UConn,4,4,NA,290060277,2009-01-06
11,1,18:51,2331,2331,Jerome Dyson missed Three Point Jumper.,3,2,1,0,0.5227993357199084,0.5227993357199084,West Virginia,UConn,4,4,NA,290060277,2009-01-06
12,1,18:51,2331,2331,Jerome Dyson Offensive Rebound.,3,2,1,3,0.5227993357199084,0.5227993357199084,West Virginia,UConn,4,4,NA,290060277,2009-01-06
13,1,18:48,2328,2328,Jerome Dyson made Two Point Jumper.,3,4,-1,6,0.477167629491024,0.477167629491024,West Virginia,UConn,4,4,NA,290060277,2009-01-06
14,1,18:42,2322,2322,West Virginia 30 Second Timeout.,3,4,-1,12,0.4771013997479743,0.4771013997479743,West Virginia,UConn,3,4,NA,290060277,2009-01-06
15,1,18:30,2310,2310,Devin Ebanks missed Two Point Layup.,3,4,-1,0,0.4769683195238842,0.4769683195238842,West Virginia,UConn,3,4,NA,290060277,2009-01-06
16,1,18:30,2310,2310,Alex Ruoff Offensive Rebound.,3,4,-1,23,0.4769683195238842,0.4769683195238842,West Virginia,UConn,3,4,NA,290060277,2009-01-06
17,1,18:07,2287,2287,Devin Ebanks missed Two Point Jumper.,3,4,-1,0,0.4767110806406472,0.4767110806406472,West Virginia,UConn,3,4,NA,290060277,2009-01-06
18,1,18:07,2287,2287,Stanley Robinson Defensive Rebound.,3,4,-1,16,0.4767110806406472,0.4767110806406472,West Virginia,UConn,3,4,NA,290060277,2009-01-06
19,1,17:51,2271,2271,Foul on Alex Ruoff,3,4,-1,0,0.4765305907094315,0.4765305907094315,West Virginia,UConn,3,4,NA,290060277,2009-01-06
20,1,17:51,2271,2271,Jerome Dyson missed Two Point Layup.,3,4,-1,0,0.4765305907094315,0.4765305907094315,West Virginia,UConn,3,4,NA,290060277,2009-01-06
21,1,17:51,2271,2271,Hasheem Thabeet Offensive Rebound.,3,4,-1,3,0.4765305907094315,0.4765305907094315,West Virginia,UConn,3,4,NA,290060277,2009-01-06
22,1,17:48,2268,2268,Hasheem Thabeet missed Two Point Tip Shot.,3,4,-1,0,0.476496618581436,0.476496618581436,West Virginia,UConn,3,4,NA,290060277,2009-01-06
23,1,17:48,2268,2268,West Virginia Defensive Rebound.,3,4,-1,10,0.476496618581436,0.476496618581436,West Virginia,UConn,3,4,NA,290060277,2009-01-06
24,1,17:38,2258,2258,Darryl Bryant made Two Point Jumper.,5,4,1,14,0.5236169023910233,0.5236169023910233,West Virginia,UConn,3,4,NA,290060277,2009-01-06
25,1,17:24,2244,2244,Hasheem Thabeet made Two Point Dunk Shot.  Assisted by Jeff Adrien.,5,6,-1,21,0.4762234829712621,0.4762234829712621,West Virginia,UConn,3,4,NA,290060277,2009-01-06
26,1,17:03,2223,2223,Wellington Smith missed Three Point Jumper.,5,6,-1,0,0.4759827071616885,0.4759827071616885,West Virginia,UConn,3,4,NA,290060277,2009-01-06
27,1,17:03,2223,2223,Jeff Adrien Defensive Rebound.,5,6,-1,18,0.4759827071616885,0.4759827071616885,West Virginia,UConn,3,4,NA,290060277,2009-01-06
28,1,16:45,2205,2205,Hasheem Thabeet made Two Point Layup.,5,8,-3,27,0.42777732868292595,0.42777732868292595,West Virginia,UConn,3,4,NA,290060277,2009-01-06
29,1,16:18,2178,2178,Da'Sean Butler missed Two Point Jumper.,5,8,-3,0,0.42685637204017157,0.42685637204017157,West Virginia,UConn,3,4,NA,290060277,2009-01-06
30,1,16:18,2178,2178,Hasheem Thabeet Defensive Rebound.,5,8,-3,29,0.42685637204017157,0.42685637204017157,West Virginia,UConn,3,4,NA,290060277,2009-01-06
31,1,15:49,2149,2149,A.J. Price missed Three Point Jumper.,5,8,-3,0,0.42586150624207686,0.42586150624207686,West Virginia,UConn,3,4,NA,290060277,2009-01-06
32,1,15:49,2149,2149,Jeff Adrien Offensive Rebound.,5,8,-3,6,0.42586150624207686,0.42586150624207686,West Virginia,UConn,3,4,NA,290060277,2009-01-06
33,1,15:43,2143,2143,Jeff Adrien missed Two Point Layup.,5,8,-3,0,0.4256545568021406,0.4256545568021406,West Virginia,UConn,3,4,NA,290060277,2009-01-06
34,1,15:43,2143,2143,Devin Ebanks Defensive Rebound.,5,8,-3,24,0.4256545568021406,0.4256545568021406,West Virginia,UConn,3,4,NA,290060277,2009-01-06
35,1,15:19,2119,2119,Da'Sean Butler missed Two Point Layup.,5,8,-3,0,0.424822467130512,0.424822467130512,West Virginia,UConn,3,4,NA,290060277,2009-01-06
36,1,15:19,2119,2119,Stanley Robinson Defensive Rebound.,5,8,-3,21,0.424822467130512,0.424822467130512,West Virginia,UConn,3,4,NA,290060277,2009-01-06
37,1,14:58,2098,2098,Hasheem Thabeet missed Two Point Layup.,5,8,-3,0,0.4240883610978508,0.4240883610978508,West Virginia,UConn,3,4,NA,290060277,2009-01-06
38,1,14:58,2098,2098,West Virginia Defensive Rebound.,5,8,-3,2,0.4240883610978508,0.4240883610978508,West Virginia,UConn,3,4,NA,290060277,2009-01-06
39,1,14:56,2096,2096,Official TV Timeout.,5,8,-3,32,0.424018135163551,0.424018135163551,West Virginia,UConn,3,4,NA,290060277,2009-01-06
40,1,14:24,2064,2064,Darryl Bryant missed Three Point Jumper.,5,8,-3,0,0.42288667469681623,0.42288667469681623,West Virginia,UConn,3,4,NA,290060277,2009-01-06
41,1,14:24,2064,2064,Jeff Adrien Defensive Rebound.,5,8,-3,4,0.42288667469681623,0.42288667469681623,West Virginia,UConn,3,4,NA,290060277,2009-01-06
42,1,14:20,2060,2060,Foul on John Flowers,5,8,-3,48,0.4227441592186674,0.4227441592186674,West Virginia,UConn,3,4,NA,290060277,2009-01-06
43,1,13:32,2012,2012,Foul on Craig Austrie,5,8,-3,0,0.42101350065064624,0.42101350065064624,West Virginia,UConn,3,4,NA,290060277,2009-01-06
44,1,13:32,2012,2012,Alex Ruoff missed Free Throw.,5,8,-3,0,0.42101350065064624,0.42101350065064624,West Virginia,UConn,3,4,NA,290060277,2009-01-06
45,1,13:32,2012,2012,null,5,8,-3,0,0.42101350065064624,0.42101350065064624,West Virginia,UConn,3,4,NA,290060277,2009-01-06
46,1,13:32,2012,2012,Alex Ruoff made Free Throw.,6,8,-2,14,0.447096382003624,0.447096382003624,West Virginia,UConn,3,4,NA,290060277,2009-01-06
47,1,13:18,1998,1998,Foul on Da'Sean Butler,6,8,-2,0,0.4467499572376093,0.4467499572376093,West Virginia,UConn,3,4,NA,290060277,2009-01-06
48,1,13:18,1998,1998,Stanley Robinson missed Free Throw.,6,8,-2,0,0.4467499572376093,0.4467499572376093,West Virginia,UConn,3,4,NA,290060277,2009-01-06
49,1,13:18,1998,1998,null,6,8,-2,0,0.4467499572376093,0.4467499572376093,West Virginia,UConn,3,4,NA,290060277,2009-01-06
50,1,13:18,1998,1998,Stanley Robinson made Free Throw.,6,9,-3,32,0.4205011420083783,0.4205011420083783,West Virginia,UConn,3,4,NA,290060277,2009-01-06
51,1,12:46,1966,1966,Alex Ruoff missed Three Point Jumper.,6,9,-3,0,0.41931606026238355,0.41931606026238355,West Virginia,UConn,3,4,NA,290060277,2009-01-06
52,1,12:46,1966,1966,Wellington Smith Offensive Rebound.,6,9,-3,9,0.41931606026238355,0.41931606026238355,West Virginia,UConn,3,4,NA,290060277,2009-01-06
53,1,12:37,1957,1957,Da'Sean Butler missed Two Point Jumper.,6,9,-3,0,0.41897908932055017,0.41897908932055017,West Virginia,UConn,3,4,NA,290060277,2009-01-06
54,1,12:37,1957,1957,Stanley Robinson Defensive Rebound.,6,9,-3,7,0.41897908932055017,0.41897908932055017,West Virginia,UConn,3,4,NA,290060277,2009-01-06
55,1,12:30,1950,1950,Stanley Robinson missed Two Point Dunk Shot.,6,9,-3,0,0.41871584476614715,0.41871584476614715,West Virginia,UConn,3,4,NA,290060277,2009-01-06
56,1,12:30,1950,1950,Gavin Edwards Offensive Rebound.,6,9,-3,18,0.41871584476614715,0.41871584476614715,West Virginia,UConn,3,4,NA,290060277,2009-01-06
57,1,12:12,1932,1932,Hasheem Thabeet missed Two Point Layup.,6,9,-3,0,0.4180341629761097,0.4180341629761097,West Virginia,UConn,3,4,NA,290060277,2009-01-06
58,1,12:12,1932,1932,Wellington Smith Defensive Rebound.,6,9,-3,10,0.4180341629761097,0.4180341629761097,West Virginia,UConn,3,4,NA,290060277,2009-01-06
59,1,12:02,1922,1922,Wellington Smith missed Two Point Layup.,6,9,-3,0,0.41765337011253256,0.41765337011253256,West Virginia,UConn,3,4,NA,290060277,2009-01-06
60,1,12:02,1922,1922,Hasheem Thabeet Defensive Rebound.,6,9,-3,6,0.41765337011253256,0.41765337011253256,West Virginia,UConn,3,4,NA,290060277,2009-01-06
61,1,11:56,1916,1916,Official TV Timeout.,6,9,-3,29,0.41742519883617285,0.41742519883617285,West Virginia,UConn,3,4,NA,290060277,2009-01-06
62,1,11:27,1887,1887,Da'Sean Butler made Two Point Dunk Shot.,8,9,-1,18,0.4718729590160034,0.4718729590160034,West Virginia,UConn,3,4,NA,290060277,2009-01-06
63,1,11:09,1869,1869,Kemba Walker made Three Point Jumper.,8,12,-4,24,0.38834853368657213,0.38834853368657213,West Virginia,UConn,3,4,NA,290060277,2009-01-06
64,1,10:45,1845,1845,Alex Ruoff made Two Point Layup.,10,12,-2,23,0.4428410455580461,0.4428410455580461,West Virginia,UConn,3,4,NA,290060277,2009-01-06
65,1,10:22,1822,1822,A.J. Price missed Three Point Jumper.,10,12,-2,0,0.4422433943341241,0.4422433943341241,West Virginia,UConn,3,4,NA,290060277,2009-01-06
66,1,10:22,1822,1822,West Virginia Defensive Rebound.,10,12,-2,17,0.4422433943341241,0.4422433943341241,West Virginia,UConn,3,4,NA,290060277,2009-01-06
67,1,10:05,1805,1805,Darryl Bryant missed Two Point Jumper.,10,12,-2,1,0.44179797669091775,0.44179797669091775,West Virginia,UConn,3,4,NA,290060277,2009-01-06
68,1,10:04,1804,1804,Jerome Dyson Block.,10,12,-2,1,0.441771659522365,0.441771659522365,West Virginia,UConn,3,4,NA,290060277,2009-01-06
69,1,10:03,1803,1803,Jeff Adrien Defensive Rebound.,10,12,-2,10,0.4417453284808711,0.4417453284808711,West Virginia,UConn,3,4,NA,290060277,2009-01-06
70,1,9:53,1793,1793,Stanley Robinson missed Two Point Jumper.,10,12,-2,0,0.44148122138916107,0.44148122138916107,West Virginia,UConn,3,4,NA,290060277,2009-01-06
71,1,9:53,1793,1793,Hasheem Thabeet Offensive Rebound.,10,12,-2,4,0.44148122138916107,0.44148122138916107,West Virginia,UConn,3,4,NA,290060277,2009-01-06
72,1,9:49,1789,1789,Foul on Da'Sean Butler,10,12,-2,0,0.441375151553143,0.441375151553143,West Virginia,UConn,3,4,NA,290060277,2009-01-06
73,1,9:49,1789,1789,Hasheem Thabeet made Free Throw.,10,13,-3,0,0.4125643759278075,0.4125643759278075,West Virginia,UConn,3,4,NA,290060277,2009-01-06
74,1,9:49,1789,1789,Hasheem Thabeet made Free Throw.,10,14,-4,20,0.3843403333809641,0.3843403333809641,West Virginia,UConn,3,4,NA,290060277,2009-01-06
75,1,9:29,1769,1769,Foul on Jerome Dyson,10,14,-4,0,0.38331495930117715,0.38331495930117715,West Virginia,UConn,3,4,NA,290060277,2009-01-06
76,1,9:29,1769,1769,Alex Ruoff made Three Point Jumper.  Assisted by Cam Thoroughman.,13,14,-1,16,0.47031610880414665,0.47031610880414665,West Virginia,UConn,3,4,NA,290060277,2009-01-06
77,1,9:13,1753,1753,Jeff Adrien missed Two Point Jumper.,13,14,-1,0,0.4700972826796332,0.4700972826796332,West Virginia,UConn,3,4,NA,290060277,2009-01-06
78,1,9:13,1753,1753,Hasheem Thabeet Offensive Rebound.,13,14,-1,2,0.4700972826796332,0.4700972826796332,West Virginia,UConn,3,4,NA,290060277,2009-01-06
79,1,9:11,1751,1751,Hasheem Thabeet missed Two Point Tip Shot.,13,14,-1,0,0.4700697363767509,0.4700697363767509,West Virginia,UConn,3,4,NA,290060277,2009-01-06
80,1,9:11,1751,1751,Stanley Robinson Offensive Rebound.,13,14,-1,4,0.4700697363767509,0.4700697363767509,West Virginia,UConn,3,4,NA,290060277,2009-01-06
81,1,9:07,1747,1747,Stanley Robinson missed Two Point Jumper.,13,14,-1,0,0.47001450825864743,0.47001450825864743,West Virginia,UConn,3,4,NA,290060277,2009-01-06
82,1,9:07,1747,1747,John Flowers Block.,13,14,-1,1,0.47001450825864743,0.47001450825864743,West Virginia,UConn,3,4,NA,290060277,2009-01-06
83,1,9:06,1746,1746,Alex Ruoff Defensive Rebound.,13,14,-1,9,0.4700006725452892,0.4700006725452892,West Virginia,UConn,3,4,NA,290060277,2009-01-06
84,1,8:57,1737,1737,John Flowers made Two Point Layup.  Assisted by Darryl Bryant.,15,14,1,0,0.5301243814583058,0.5301243814583058,West Virginia,UConn,3,4,NA,290060277,2009-01-06
85,1,8:57,1737,1737,Foul on Jerome Dyson,15,14,1,0,0.5301243814583058,0.5301243814583058,West Virginia,UConn,3,4,NA,290060277,2009-01-06
86,1,8:57,1737,1737,John Flowers made Free Throw.,16,14,2,50,0.5600308561056404,0.5600308561056404,West Virginia,UConn,3,4,NA,290060277,2009-01-06
87,1,8:07,1687,1687,John Flowers missed Three Point Jumper.,16,14,2,0,0.5614436418683096,0.5614436418683096,West Virginia,UConn,3,4,NA,290060277,2009-01-06
88,1,8:07,1687,1687,A.J. Price Defensive Rebound.,16,14,2,10,0.5614436418683096,0.5614436418683096,West Virginia,UConn,3,4,NA,290060277,2009-01-06
89,1,7:57,1677,1677,Foul on Darryl Bryant,16,14,2,0,0.5617290089527549,0.5617290089527549,West Virginia,UConn,3,4,NA,290060277,2009-01-06
90,1,7:57,1677,1677,Official TV Timeout.,16,14,2,0,0.5617290089527549,0.5617290089527549,West Virginia,UConn,3,4,NA,290060277,2009-01-06
91,1,7:57,1677,1677,A.J. Price made Free Throw.,16,15,1,0,0.5309830176777515,0.5309830176777515,West Virginia,UConn,3,4,NA,290060277,2009-01-06
92,1,7:57,1677,1677,A.J. Price missed Free Throw.,16,15,1,0,0.5309830176777515,0.5309830176777515,West Virginia,UConn,3,4,NA,290060277,2009-01-06
93,1,7:57,1677,1677,John Flowers Defensive Rebound.,16,15,1,14,0.5309830176777515,0.5309830176777515,West Virginia,UConn,3,4,NA,290060277,2009-01-06
94,1,7:43,1663,1663,Alex Ruoff made Three Point Jumper.  Assisted by Devin Ebanks.,19,15,4,19,0.6223549422630585,0.6223549422630585,West Virginia,UConn,3,4,NA,290060277,2009-01-06
95,1,7:24,1644,1644,Foul on John Flowers,19,15,4,0,0.6233535088745045,0.6233535088745045,West Virginia,UConn,3,4,NA,290060277,2009-01-06
96,1,7:24,1644,1644,Jeff Adrien made Free Throw.,19,16,3,0,0.5933556624129448,0.5933556624129448,West Virginia,UConn,3,4,NA,290060277,2009-01-06
97,1,7:24,1644,1644,Jeff Adrien made Free Throw.,19,17,2,7,0.5626449282595558,0.5626449282595558,West Virginia,UConn,3,4,NA,290060277,2009-01-06
98,1,7:17,1637,1637,Alex Ruoff missed Three Point Jumper.,19,17,2,0,0.5628353942839522,0.5628353942839522,West Virginia,UConn,3,4,NA,290060277,2009-01-06
99,1,7:17,1637,1637,Wellington Smith Offensive Rebound.,19,17,2,7,0.5628353942839522,0.5628353942839522,West Virginia,UConn,3,4,NA,290060277,2009-01-06
100,1,7:10,1630,1630,Darryl Bryant missed Three Point Jumper.,19,17,2,0,0.5630249406636559,0.5630249406636559,West Virginia,UConn,3,4,NA,290060277,2009-01-06
101,1,7:10,1630,1630,Hasheem Thabeet Defensive Rebound.,19,17,2,8,0.5630249406636559,0.5630249406636559,West Virginia,UConn,3,4,NA,290060277,2009-01-06
102,1,7:02,1622,1622,Foul on Wellington Smith,19,17,2,0,0.5632406780112991,0.5632406780112991,West Virginia,UConn,3,4,NA,290060277,2009-01-06
103,1,7:02,1622,1622,Kemba Walker made Free Throw.,19,18,1,0,0.5317478226305178,0.5317478226305178,West Virginia,UConn,3,4,NA,290060277,2009-01-06
104,1,7:02,1622,1622,Kemba Walker made Free Throw.,19,19,0,18,0.5,0.5,West Virginia,UConn,3,4,NA,290060277,2009-01-06
105,1,6:44,1604,1604,Wellington Smith missed Three Point Jumper.,19,19,0,0,0.5,0.5,West Virginia,UConn,3,4,NA,290060277,2009-01-06
106,1,6:44,1604,1604,Connecticut Defensive Rebound.,19,19,0,26,0.5,0.5,West Virginia,UConn,3,4,NA,290060277,2009-01-06
107,1,6:18,1578,1578,Jeff Adrien missed Two Point Layup.,19,19,0,0,0.5,0.5,West Virginia,UConn,3,4,NA,290060277,2009-01-06
108,1,6:18,1578,1578,Stanley Robinson Offensive Rebound.,19,19,0,3,0.5,0.5,West Virginia,UConn,3,4,NA,290060277,2009-01-06
109,1,6:15,1575,1575,Stanley Robinson made Two Point Tip Shot.,19,21,-2,11,0.43549647832037314,0.43549647832037314,West Virginia,UConn,3,4,NA,290060277,2009-01-06
110,1,6:04,1564,1564,Darryl Bryant made Two Point Jumper.,21,21,0,9,0.5,0.5,West Virginia,UConn,3,4,NA,290060277,2009-01-06
111,1,5:55,1555,1555,Foul on Darryl Bryant,21,21,0,0,0.5,0.5,West Virginia,UConn,3,4,NA,290060277,2009-01-06
112,1,5:55,1555,1555,Kemba Walker made Free Throw.,21,22,-1,0,0.46733741357567177,0.46733741357567177,West Virginia,UConn,3,4,NA,290060277,2009-01-06
113,1,5:55,1555,1555,Kemba Walker missed Free Throw.,21,22,-1,0,0.46733741357567177,0.46733741357567177,West Virginia,UConn,3,4,NA,290060277,2009-01-06
114,1,5:55,1555,1555,Alex Ruoff Defensive Rebound.,21,22,-1,18,0.46733741357567177,0.46733741357567177,West Virginia,UConn,3,4,NA,290060277,2009-01-06
115,1,5:37,1537,1537,Craig Austrie missed Three Point Jumper.,21,22,-1,0,0.46708501995283763,0.46708501995283763,West Virginia,UConn,3,4,NA,290060277,2009-01-06
116,1,5:37,1537,1537,Wellington Smith Defensive Rebound.,21,22,-1,16,0.46708501995283763,0.46708501995283763,West Virginia,UConn,3,4,NA,290060277,2009-01-06
117,1,5:21,1521,1521,Alex Ruoff missed Three Point Jumper.,21,22,-1,0,0.4668557979464423,0.4668557979464423,West Virginia,UConn,3,4,NA,290060277,2009-01-06
118,1,5:21,1521,1521,Gavin Edwards Defensive Rebound.,21,22,-1,21,0.4668557979464423,0.4668557979464423,West Virginia,UConn,3,4,NA,290060277,2009-01-06
119,1,5:00,1500,1500,Craig Austrie made Two Point Jumper.,21,24,-3,27,0.4008203178416517,0.4008203178416517,West Virginia,UConn,3,4,NA,290060277,2009-01-06
120,1,4:33,1473,1473,Wellington Smith missed Two Point Layup.,21,24,-3,0,0.3996138875017199,0.3996138875017199,West Virginia,UConn,3,4,NA,290060277,2009-01-06
121,1,4:33,1473,1473,Kemba Walker Defensive Rebound.,21,24,-3,8,0.3996138875017199,0.3996138875017199,West Virginia,UConn,3,4,NA,290060277,2009-01-06
122,1,4:25,1465,1465,Kemba Walker missed Two Point Layup.,21,24,-3,1,0.3992429085858029,0.3992429085858029,West Virginia,UConn,3,4,NA,290060277,2009-01-06
123,1,4:24,1464,1464,Wellington Smith Block.,21,24,-3,1,0.3991960595106533,0.3991960595106533,West Virginia,UConn,3,4,NA,290060277,2009-01-06
124,1,4:23,1463,1463,Gavin Edwards Offensive Rebound.,21,24,-3,8,0.39914910189969244,0.39914910189969244,West Virginia,UConn,3,4,NA,290060277,2009-01-06
125,1,4:15,1455,1455,Foul on Cam Thoroughman,21,24,-3,0,0.3987694402089925,0.3987694402089925,West Virginia,UConn,3,4,NA,290060277,2009-01-06
126,1,4:15,1455,1455,Hasheem Thabeet made Free Throw.,21,25,-4,0,0.3664538835096488,0.3664538835096488,West Virginia,UConn,3,4,NA,290060277,2009-01-06
127,1,4:15,1455,1455,Hasheem Thabeet missed Free Throw.,21,25,-4,0,0.3664538835096488,0.3664538835096488,West Virginia,UConn,3,4,NA,290060277,2009-01-06
128,1,4:15,1455,1455,Da'Sean Butler Defensive Rebound.,21,25,-4,56,0.3664538835096488,0.3664538835096488,West Virginia,UConn,3,4,NA,290060277,2009-01-06
129,1,3:19,1399,1399,Official TV Timeout.,21,25,-4,30,0.3631050924051297,0.3631050924051297,West Virginia,UConn,3,4,NA,290060277,2009-01-06
130,1,2:49,1369,1369,A.J. Price missed Two Point Jumper.,21,25,-4,0,0.36140315753421975,0.36140315753421975,West Virginia,UConn,3,4,NA,290060277,2009-01-06
131,1,2:49,1369,1369,Stanley Robinson Offensive Rebound.,21,25,-4,18,0.36140315753421975,0.36140315753421975,West Virginia,UConn,3,4,NA,290060277,2009-01-06
132,1,2:31,1351,1351,Da'Sean Butler made Two Point Jumper.  Assisted by Devin Ebanks.,23,25,-2,14,0.4287766151617924,0.4287766151617924,West Virginia,UConn,3,4,NA,290060277,2009-01-06
133,1,2:17,1337,1337,A.J. Price missed Three Point Jumper.,23,25,-2,0,0.4283529030834783,0.4283529030834783,West Virginia,UConn,3,4,NA,290060277,2009-01-06
134,1,2:17,1337,1337,Craig Austrie Offensive Rebound.,23,25,-2,24,0.4283529030834783,0.4283529030834783,West Virginia,UConn,3,4,NA,290060277,2009-01-06
135,1,1:53,1313,1313,A.J. Price missed Two Point Jumper.,23,25,-2,0,0.4276108997526822,0.4276108997526822,West Virginia,UConn,3,4,NA,290060277,2009-01-06
136,1,1:53,1313,1313,Wellington Smith Defensive Rebound.,23,25,-2,8,0.4276108997526822,0.4276108997526822,West Virginia,UConn,3,4,NA,290060277,2009-01-06
137,1,1:45,1305,1305,Devin Ebanks made Two Point Layup.,25,25,0,14,0.5,0.5,West Virginia,UConn,3,4,NA,290060277,2009-01-06
138,1,1:31,1291,1291,Jeff Adrien made Two Point Layup.,25,27,-2,21,0.42690365271849967,0.42690365271849967,West Virginia,UConn,3,4,NA,290060277,2009-01-06
139,1,1:10,1270,1270,Foul on Stanley Robinson,25,27,-2,0,0.42619472119146345,0.42619472119146345,West Virginia,UConn,3,4,NA,290060277,2009-01-06
140,1,1:10,1270,1270,Devin Ebanks missed Two Point Jumper.,25,27,-2,0,0.42619472119146345,0.42619472119146345,West Virginia,UConn,3,4,NA,290060277,2009-01-06
141,1,1:10,1270,1270,Stanley Robinson Defensive Rebound.,25,27,-2,8,0.42619472119146345,0.42619472119146345,West Virginia,UConn,3,4,NA,290060277,2009-01-06
142,1,1:02,1262,1262,Kemba Walker missed Two Point Layup.,25,27,-2,0,0.42591407175281365,0.42591407175281365,West Virginia,UConn,3,4,NA,290060277,2009-01-06
143,1,1:02,1262,1262,Stanley Robinson Offensive Rebound.,25,27,-2,3,0.42591407175281365,0.42591407175281365,West Virginia,UConn,3,4,NA,290060277,2009-01-06
144,1,0:59,1259,1259,Stanley Robinson made Two Point Tip Shot.,25,29,-4,4,0.3548111240710498,0.3548111240710498,West Virginia,UConn,3,4,NA,290060277,2009-01-06
145,1,0:55,1255,1255,Alex Ruoff missed Three Point Jumper.,25,29,-4,0,0.3545414259002475,0.3545414259002475,West Virginia,UConn,3,4,NA,290060277,2009-01-06
146,1,0:55,1255,1255,Da'Sean Butler Offensive Rebound.,25,29,-4,6,0.3545414259002475,0.3545414259002475,West Virginia,UConn,3,4,NA,290060277,2009-01-06
147,1,0:49,1249,1249,Foul on Hasheem Thabeet,25,29,-4,0,0.3541308141092794,0.3541308141092794,West Virginia,UConn,3,4,NA,290060277,2009-01-06
148,1,0:49,1249,1249,Da'Sean Butler missed Free Throw.,25,29,-4,0,0.3541308141092794,0.3541308141092794,West Virginia,UConn,3,4,NA,290060277,2009-01-06
149,1,0:49,1249,1249,null,25,29,-4,0,0.3541308141092794,0.3541308141092794,West Virginia,UConn,3,4,NA,290060277,2009-01-06
150,1,0:49,1249,1249,Da'Sean Butler made Free Throw.,26,29,-3,36,0.38919483350713374,0.38919483350713374,West Virginia,UConn,3,4,NA,290060277,2009-01-06
151,1,0:13,1213,1213,Kemba Walker missed Two Point Jumper.,26,29,-3,0,0.38713805890724134,0.38713805890724134,West Virginia,UConn,3,4,NA,290060277,2009-01-06
152,1,0:13,1213,1213,Wellington Smith Block.,26,29,-3,0,0.38713805890724134,0.38713805890724134,West Virginia,UConn,3,4,NA,290060277,2009-01-06
153,1,0:13,1213,1213,Kemba Walker Offensive Rebound.,26,29,-3,1,0.38713805890724134,0.38713805890724134,West Virginia,UConn,3,4,NA,290060277,2009-01-06
154,1,0:12,1212,1212,Foul on Jeff Adrien,26,29,-3,9,0.3870772220630928,0.3870772220630928,West Virginia,UConn,3,4,NA,290060277,2009-01-06
155,1,0:03,1203,1203,Wellington Smith made Three Point Jumper.,29,29,0,3,0.5,0.5,West Virginia,UConn,3,4,NA,290060277,2009-01-06
156,1,0:00,1200,1200,End of the 1st Half.,29,29,0,0,0.5,0.5,West Virginia,UConn,3,4,NA,290060277,2009-01-06
157,2,20:00,1200,1200,PLAY,29,29,0,15,0.5,0.5,West Virginia,UConn,4,4,NA,290060277,2009-01-06
158,2,19:45,1185,1185,Alex Ruoff missed Two Point Layup.,29,29,0,1,0.5,0.5,West Virginia,UConn,4,4,NA,290060277,2009-01-06
159,2,19:44,1184,1184,Hasheem Thabeet Block.,29,29,0,1,0.5,0.5,West Virginia,UConn,4,4,NA,290060277,2009-01-06
160,2,19:43,1183,1183,Jeff Adrien Defensive Rebound.,29,29,0,15,0.5,0.5,West Virginia,UConn,4,4,NA,290060277,2009-01-06
161,2,19:28,1168,1168,Jeff Adrien made Two Point Layup.  Assisted by Stanley Robinson.,29,31,-2,22,0.4222065339985064,0.4222065339985064,West Virginia,UConn,4,4,NA,290060277,2009-01-06
162,2,19:06,1146,1146,Devin Ebanks made Two Point Jumper.,31,31,0,42,0.5,0.5,West Virginia,UConn,4,4,NA,290060277,2009-01-06
163,2,18:24,1104,1104,Stanley Robinson made Two Point Dunk Shot.  Assisted by A.J. Price.,31,33,-2,23,0.41971833734652647,0.41971833734652647,West Virginia,UConn,4,4,NA,290060277,2009-01-06
164,2,18:01,1081,1081,Da'Sean Butler made Two Point Jumper.,33,33,0,17,0.5,0.5,West Virginia,UConn,4,4,NA,290060277,2009-01-06
165,2,17:44,1064,1064,Jeff Adrien missed Two Point Layup.,33,33,0,0,0.5,0.5,West Virginia,UConn,4,4,NA,290060277,2009-01-06
166,2,17:44,1064,1064,Alex Ruoff Defensive Rebound.,33,33,0,9,0.5,0.5,West Virginia,UConn,4,4,NA,290060277,2009-01-06
167,2,17:35,1055,1055,Da'Sean Butler made Three Point Jumper.  Assisted by Darryl Bryant.,36,33,3,23,0.6220567837845962,0.6220567837845962,West Virginia,UConn,4,4,NA,290060277,2009-01-06
168,2,17:12,1032,1032,Foul on Hasheem Thabeet,36,33,3,19,0.6235426326789147,0.6235426326789147,West Virginia,UConn,4,4,NA,290060277,2009-01-06
169,2,16:53,1013,1013,Devin Ebanks missed Two Point Layup.,36,33,3,0,0.6248489481661141,0.6248489481661141,West Virginia,UConn,4,4,NA,290060277,2009-01-06
170,2,16:53,1013,1013,Stanley Robinson Block.,36,33,3,2,0.6248489481661141,0.6248489481661141,West Virginia,UConn,4,4,NA,290060277,2009-01-06
171,2,16:51,1011,1011,Devin Ebanks Offensive Rebound.,36,33,3,13,0.6249911838836429,0.6249911838836429,West Virginia,UConn,4,4,NA,290060277,2009-01-06
172,2,16:38,998,998,Jerome Dyson made Two Point Layup.,36,35,1,23,0.5427981115082156,0.5427981115082156,West Virginia,UConn,4,4,NA,290060277,2009-01-06
173,2,16:15,975,975,Da'Sean Butler missed Two Point Jumper.,36,35,1,0,0.5434310301525326,0.5434310301525326,West Virginia,UConn,4,4,NA,290060277,2009-01-06
174,2,16:15,975,975,Gavin Edwards Defensive Rebound.,36,35,1,9,0.5434310301525326,0.5434310301525326,West Virginia,UConn,4,4,NA,290060277,2009-01-06
