play_id,half,time_remaining_half,secs_remaining,secs_remaining_absolute,description,home_score,away_score,score_diff,play_length,win_prob,naive_win_prob,home,away,home_time_out_remaining,away_time_out_remaining,home_favored_by,game_id,date
1,1,20:00,2400,2400,PLAY,0,0,0,15,0.5,0.5,Towson,VCU,6,6,NA,310240119,2011-01-24
2,1,19:45,2385,2385,Braxton Dupree missed Two Point Layup.,0,0,0,0,0.5,0.5,Towson,VCU,6,6,NA,310240119,2011-01-24
3,1,19:45,2385,2385,Braxton Dupree Offensive Rebound.,0,0,0,10,0.5,0.5,Towson,VCU,6,6,NA,310240119,2011-01-24
4,1,19:35,2375,2375,RaShawn Polk missed Two Point Jumper.,0,0,0,0,0.5,0.5,Towson,VCU,6,6,NA,310240119,2011-01-24
5,1,19:35,2375,2375,Jamie Skeen Block.,0,0,0,3,0.5,0.5,Towson,VCU,6,6,NA,310240119,2011-01-24
6,1,19:32,2372,2372,RaShawn Polk Offensive Rebound.,0,0,0,18,0.5,0.5,Towson,VCU,6,6,NA,310240119,2011-01-24
7,1,19:14,2354,2354,Foul on Jamie Skeen,0,0,0,0,0.5,0.5,Towson,VCU,6,6,NA,310240119,2011-01-24
8,1,19:14,2354,2354,Braxton Dupree made Free Throw.,1,0,1,0,0.5225479267308089,0.5225479267308089,Towson,VCU,6,6,NA,310240119,2011-01-24
9,1,19:14,2354,2354,Braxton Dupree made Free Throw.,2,0,2,14,0.5450043310338967,0.5450043310338967,Towson,VCU,6,6,NA,310240119,2011-01-24
10,1,19:00,2340,2340,Juvonte Reddic missed Two Point Jumper.,2,0,2,0,0.5453077293526352,0.5453077293526352,Towson,VCU,6,6,NA,310240119,2011-01-24
11,1,19:00,2340,2340,Isaiah Philmore Defensive Rebound.,2,0,2,22,0.5453077293526352,0.5453077293526352,Towson,VCU,6,6,NA,310240119,2011-01-24
12,1,18:38,2318,2318,Foul on Ed Nixon,2,0,2,5,0.5457893300573414,0.5457893300573414,Towson,VCU,6,6,NA,310240119,2011-01-24
13,1,18:33,2313,2313,Brian Morris Turnover.,2,0,2,1,0.5458995598090786,0.5458995598090786,Towson,VCU,6,6,NA,310240119,2011-01-24
14,1,18:32,2312,2312,Juvonte Reddic Steal.,2,0,2,6,0.545921638731889,0.545921638731889,Towson,VCU,6,6,NA,310240119,2011-01-24
15,1,18:26,2306,2306,Foul on Brian Morris,2,0,2,0,0.5460543386548282,0.5460543386548282,Towson,VCU,6,6,NA,310240119,2011-01-24
16,1,18:26,2306,2306,Bradford Burgess made Free Throw.,2,1,1,0,0.52307621828962,0.52307621828962,Towson,VCU,6,6,NA,310240119,2011-01-24
17,1,18:26,2306,2306,Bradford Burgess missed Free Throw.,2,1,1,0,0.52307621828962,0.52307621828962,Towson,VCU,6,6,NA,310240119,2011-01-24
18,1,18:26,2306,2306,null,2,1,1,0,0.52307621828962,0.52307621828962,Towson,VCU,6,6,NA,310240119,2011-01-24
19,1,18:26,2306,2306,Bradford Burgess made Free Throw.,2,2,0,10,0.5,0.5,Towson,VCU,6,6,NA,310240119,2011-01-24
20,1,18:16,2296,2296,Josh Brown missed Two Point Jumper.,2,2,0,0,0.5,0.5,Towson,VCU,6,6,NA,310240119,2011-01-24
21,1,18:16,2296,2296,Josh Brown Offensive Rebound.,2,2,0,6,0.5,0.5,Towson,VCU,6,6,NA,310240119,2011-01-24
22,1,18:10,2290,2290,RaShawn Polk missed Three Point Jumper.,2,2,0,0,0.5,0.5,Towson,VCU,6,6,NA,310240119,2011-01-24
23,1,18:10,2290,2290,Bradford Burgess Defensive Rebound.,2,2,0,12,0.5,0.5,Towson,VCU,6,6,NA,310240119,2011-01-24
24,1,17:58,2278,2278,Jamie Skeen missed Three Point Jumper.,2,2,0,0,0.5,0.5,Towson,VCU,6,6,NA,310240119,2011-01-24
25,1,17:58,2278,2278,Ed Nixon Offensive Rebound.,2,2,0,6,0.5,0.5,Towson,VCU,6,6,NA,310240119,2011-01-24
26,1,17:52,2272,2272,Ed Nixon missed Two Point Layup.,2,2,0,0,0.5,0.5,Towson,VCU,6,6,NA,310240119,2011-01-24
27,1,17:52,2272,2272,Isaiah Philmore Defensive Rebound.,2,2,0,8,0.5,0.5,Towson,VCU,6,6,NA,310240119,2011-01-24
28,1,17:44,2264,2264,Brian Morris missed Two Point Layup.,2,2,0,0,0.5,0.5,Towson,VCU,6,6,NA,310240119,2011-01-24
29,1,17:44,2264,2264,Braxton Dupree Offensive Rebound.,2,2,0,4,0.5,0.5,Towson,VCU,6,6,NA,310240119,2011-01-24
30,1,17:40,2260,2260,Braxton Dupree made Two Point Layup.,4,2,2,8,0.5470834862749095,0.5470834862749095,Towson,VCU,6,6,NA,310240119,2011-01-24
31,1,17:32,2252,2252,Jamie Skeen made Two Point Jumper.,4,4,0,17,0.5,0.5,Towson,VCU,6,6,NA,310240119,2011-01-24
32,1,17:15,2235,2235,Foul on Joey Rodriguez,4,4,0,0,0.5,0.5,Towson,VCU,6,6,NA,310240119,2011-01-24
33,1,17:15,2235,2235,Braxton Dupree made Free Throw.,5,4,1,0,0.523879518631216,0.523879518631216,Towson,VCU,6,6,NA,310240119,2011-01-24
34,1,17:15,2235,2235,Braxton Dupree made Free Throw.,6,4,2,2,0.5476503503565374,0.5476503503565374,Towson,VCU,6,6,NA,310240119,2011-01-24
35,1,17:13,2233,2233,Joey Rodriguez Turnover.,6,4,2,1,0.5476958944832517,0.5476958944832517,Towson,VCU,6,6,NA,310240119,2011-01-24
36,1,17:12,2232,2232,Josh Brown Steal.,6,4,2,2,0.5477186766445648,0.5477186766445648,Towson,VCU,6,6,NA,310240119,2011-01-24
37,1,17:10,2230,2230,Josh Brown made Two Point Layup.,8,4,4,19,0.5946646408323303,0.5946646408323303,Towson,VCU,6,6,NA,310240119,2011-01-24
38,1,16:51,2211,2211,Ed Nixon missed Two Point Layup.,8,4,4,0,0.5955096062437427,0.5955096062437427,Towson,VCU,6,6,NA,310240119,2011-01-24
39,1,16:51,2211,2211,Braxton Dupree Block.,8,4,4,2,0.5955096062437427,0.5955096062437427,Towson,VCU,6,6,NA,310240119,2011-01-24
40,1,16:49,2209,2209,Virginia Commonwealt Offensive Rebound.,8,4,4,9,0.5955987646459386,0.5955987646459386,Towson,VCU,6,6,NA,310240119,2011-01-24
41,1,16:40,2200,2200,Ed Nixon made Two Point Dunk Shot.  Assisted by Joey Rodriguez.,8,6,2,19,0.5484509368654422,0.5484509368654422,Towson,VCU,6,6,NA,310240119,2011-01-24
42,1,16:21,2181,2181,Foul on D.J. Haley,8,6,2,11,0.5488882404998348,0.5488882404998348,Towson,VCU,6,6,NA,310240119,2011-01-24
43,1,16:10,2170,2170,Foul on D.J. Haley,8,6,2,20,0.5491420970299754,0.5491420970299754,Towson,VCU,6,6,NA,310240119,2011-01-24
44,1,15:50,2150,2150,Isaiah Philmore Turnover.,8,6,2,1,0.5496055375856544,0.5496055375856544,Towson,VCU,6,6,NA,310240119,2011-01-24
45,1,15:49,2149,2149,Ed Nixon Steal.,8,6,2,3,0.5496287901567458,0.5496287901567458,Towson,VCU,6,6,NA,310240119,2011-01-24
46,1,15:46,2146,2146,Ed Nixon missed Two Point Layup.,8,6,2,0,0.5496985955087812,0.5496985955087812,Towson,VCU,6,6,NA,310240119,2011-01-24
47,1,15:46,2146,2146,Jamie Skeen Offensive Rebound.,8,6,2,3,0.5496985955087812,0.5496985955087812,Towson,VCU,6,6,NA,310240119,2011-01-24
48,1,15:43,2143,2143,Jamie Skeen made Two Point Layup.,8,8,0,8,0.5,0.5,Towson,VCU,6,6,NA,310240119,2011-01-24
49,1,15:35,2135,2135,Dre Conner missed Two Point Layup.,8,8,0,0,0.5,0.5,Towson,VCU,6,6,NA,310240119,2011-01-24
50,1,15:35,2135,2135,David Hinton Block.,8,8,0,2,0.5,0.5,Towson,VCU,6,6,NA,310240119,2011-01-24
51,1,15:33,2133,2133,Joey Rodriguez Defensive Rebound.,8,8,0,6,0.5,0.5,Towson,VCU,6,6,NA,310240119,2011-01-24
52,1,15:27,2127,2127,Foul on Isaiah Philmore,8,8,0,0,0.5,0.5,Towson,VCU,6,6,NA,310240119,2011-01-24
53,1,15:27,2127,2127,Official TV Timeout.,8,8,0,0,0.5,0.5,Towson,VCU,6,6,NA,310240119,2011-01-24
54,1,15:27,2127,2127,Joey Rodriguez made Free Throw.,8,9,-1,0,0.47486544078988047,0.47486544078988047,Towson,VCU,6,6,NA,310240119,2011-01-24
55,1,15:27,2127,2127,Joey Rodriguez made Free Throw.,8,10,-2,13,0.44985759065926184,0.44985759065926184,Towson,VCU,6,6,NA,310240119,2011-01-24
56,1,15:14,2114,2114,Isaiah Philmore made Two Point Jumper.,10,10,0,21,0.5,0.5,Towson,VCU,6,6,NA,310240119,2011-01-24
57,1,14:53,2093,2093,Foul on Darius Theus,10,10,0,0,0.5,0.5,Towson,VCU,6,6,NA,310240119,2011-01-24
58,1,14:53,2093,2093,Dre Conner Steal.,10,10,0,0,0.5,0.5,Towson,VCU,6,6,NA,310240119,2011-01-24
59,1,14:53,2093,2093,Foul on Darius Theus,10,10,0,32,0.5,0.5,Towson,VCU,6,6,NA,310240119,2011-01-24
60,1,14:21,2061,2061,Dre Conner missed Three Point Jumper.,10,10,0,0,0.5,0.5,Towson,VCU,6,6,NA,310240119,2011-01-24
61,1,14:21,2061,2061,Rob Brandenberg Defensive Rebound.,10,10,0,6,0.5,0.5,Towson,VCU,6,6,NA,310240119,2011-01-24
62,1,14:15,2055,2055,Joey Rodriguez made Three Point Jumper.  Assisted by Rob Brandenberg.,10,13,-3,17,0.4225656614594239,0.4225656614594239,Towson,VCU,6,6,NA,310240119,2011-01-24
63,1,13:58,2038,2038,Isaiah Philmore missed Two Point Jumper.,10,13,-3,0,0.42195575292330906,0.42195575292330906,Towson,VCU,6,6,NA,310240119,2011-01-24
64,1,13:58,2038,2038,Bradford Burgess Defensive Rebound.,10,13,-3,7,0.42195575292330906,0.42195575292330906,Towson,VCU,6,6,NA,310240119,2011-01-24
65,1,13:51,2031,2031,Rob Brandenberg missed Three Point Jumper.,10,13,-3,0,0.42170321976792846,0.42170321976792846,Towson,VCU,6,6,NA,310240119,2011-01-24
66,1,13:51,2031,2031,Darius Theus Offensive Rebound.,10,13,-3,8,0.42170321976792846,0.42170321976792846,Towson,VCU,6,6,NA,310240119,2011-01-24
67,1,13:43,2023,2023,Joey Rodriguez made Three Point Jumper.,10,16,-6,12,0.346616251463806,0.346616251463806,Towson,VCU,6,6,NA,310240119,2011-01-24
68,1,13:31,2011,2011,Josh Brown Turnover.,10,16,-6,2,0.3458055933381254,0.3458055933381254,Towson,VCU,6,6,NA,310240119,2011-01-24
69,1,13:29,2009,2009,Joey Rodriguez Steal.,10,16,-6,1,0.3456700829535285,0.3456700829535285,Towson,VCU,6,6,NA,310240119,2011-01-24
70,1,13:28,2008,2008,Joey Rodriguez Turnover.,10,16,-6,3,0.3456022842200891,0.3456022842200891,Towson,VCU,6,6,NA,310240119,2011-01-24
71,1,13:25,2005,2005,Josh Brown Steal.,10,16,-6,3,0.3453987128827322,0.3453987128827322,Towson,VCU,6,6,NA,310240119,2011-01-24
72,1,13:22,2002,2002,RaShawn Polk made Three Point Jumper.  Assisted by Josh Brown.,13,16,-3,26,0.42064789838832606,0.42064789838832606,Towson,VCU,6,6,NA,310240119,2011-01-24
73,1,12:56,1976,1976,David Hinton missed Two Point Jumper.,13,16,-3,0,0.41968855086061685,0.41968855086061685,Towson,VCU,6,6,NA,310240119,2011-01-24
74,1,12:56,1976,1976,Isaiah Philmore Block.,13,16,-3,2,0.41968855086061685,0.41968855086061685,Towson,VCU,6,6,NA,310240119,2011-01-24
75,1,12:54,1974,1974,Dre Conner Defensive Rebound.,13,16,-3,24,0.41961421237485375,0.41961421237485375,Towson,VCU,6,6,NA,310240119,2011-01-24
76,1,12:30,1950,1950,Josh Brown made Three Point Jumper.  Assisted by RaShawn Polk.,16,16,0,10,0.5,0.5,Towson,VCU,6,6,NA,310240119,2011-01-24
77,1,12:20,1940,1940,Joey Rodriguez missed Three Point Jumper.,16,16,0,0,0.5,0.5,Towson,VCU,6,6,NA,310240119,2011-01-24
78,1,12:20,1940,1940,Towson Defensive Rebound.,16,16,0,9,0.5,0.5,Towson,VCU,6,6,NA,310240119,2011-01-24
79,1,12:11,1931,1931,Erique Gumbs made Two Point Layup.  Assisted by Josh Brown.,18,16,2,19,0.5549447352680729,0.5549447352680729,Towson,VCU,6,6,NA,310240119,2011-01-24
80,1,11:52,1912,1912,Bradford Burgess missed Three Point Jumper.,18,16,2,0,0.5554340691067196,0.5554340691067196,Towson,VCU,6,6,NA,310240119,2011-01-24
81,1,11:52,1912,1912,Jamie Skeen Offensive Rebound.,18,16,2,5,0.5554340691067196,0.5554340691067196,Towson,VCU,6,6,NA,310240119,2011-01-24
82,1,11:47,1907,1907,Jamie Skeen made Two Point Layup.,18,18,0,0,0.5,0.5,Towson,VCU,6,6,NA,310240119,2011-01-24
83,1,11:47,1907,1907,Foul on Erique Gumbs,18,18,0,0,0.5,0.5,Towson,VCU,6,6,NA,310240119,2011-01-24
84,1,11:47,1907,1907,Official TV Timeout.,18,18,0,0,0.5,0.5,Towson,VCU,6,6,NA,310240119,2011-01-24
85,1,11:47,1907,1907,Jamie Skeen made Free Throw.,18,19,-1,29,0.4721323802849542,0.4721323802849542,Towson,VCU,6,6,NA,310240119,2011-01-24
86,1,11:18,1878,1878,Josh Brown made Three Point Jumper.  Assisted by Brian Morris.,21,19,2,32,0.5563079962391981,0.5563079962391981,Towson,VCU,6,6,NA,310240119,2011-01-24
87,1,10:46,1846,1846,Troy Daniels made Three Point Jumper.  Assisted by Brandon Rozzell.,21,22,-1,12,0.47133960258864316,0.47133960258864316,Towson,VCU,6,6,NA,310240119,2011-01-24
88,1,10:34,1834,1834,Towson Turnover.,21,22,-1,10,0.4711825052391752,0.4711825052391752,Towson,VCU,6,6,NA,310240119,2011-01-24
89,1,10:24,1824,1824,Troy Daniels missed Three Point Jumper.,21,22,-1,0,0.4710510680039387,0.4710510680039387,Towson,VCU,6,6,NA,310240119,2011-01-24
90,1,10:24,1824,1824,Josh Brown Defensive Rebound.,21,22,-1,16,0.4710510680039387,0.4710510680039387,Towson,VCU,6,6,NA,310240119,2011-01-24
91,1,10:08,1808,1808,Brian Morris missed Two Point Jumper.,21,22,-1,0,0.4708395754808549,0.4708395754808549,Towson,VCU,6,6,NA,310240119,2011-01-24
92,1,10:08,1808,1808,Troy Daniels Defensive Rebound.,21,22,-1,3,0.4708395754808549,0.4708395754808549,Towson,VCU,6,6,NA,310240119,2011-01-24
93,1,10:05,1805,1805,Juvonte Reddic made Two Point Layup.,21,24,-3,26,0.4131878663985901,0.4131878663985901,Towson,VCU,6,6,NA,310240119,2011-01-24
94,1,9:39,1779,1779,Isaiah Philmore made Two Point Layup.,23,24,-1,6,0.4704515750294142,0.4704515750294142,Towson,VCU,6,6,NA,310240119,2011-01-24
95,1,9:33,1773,1773,Joey Rodriguez Turnover.,23,24,-1,1,0.4703704091017177,0.4703704091017177,Towson,VCU,6,6,NA,310240119,2011-01-24
96,1,9:32,1772,1772,Josh Brown Steal.,23,24,-1,2,0.47035684852461485,0.47035684852461485,Towson,VCU,6,6,NA,310240119,2011-01-24
97,1,9:30,1770,1770,Brian Morris missed Three Point Jumper.,23,24,-1,0,0.4703296984533573,0.4703296984533573,Towson,VCU,6,6,NA,310240119,2011-01-24
98,1,9:30,1770,1770,Troy Daniels Defensive Rebound.,23,24,-1,11,0.4703296984533573,0.4703296984533573,Towson,VCU,6,6,NA,310240119,2011-01-24
99,1,9:19,1759,1759,Troy Daniels missed Two Point Jumper.,23,24,-1,0,0.4701796580041783,0.4701796580041783,Towson,VCU,6,6,NA,310240119,2011-01-24
100,1,9:19,1759,1759,Josh Brown Defensive Rebound.,23,24,-1,7,0.4701796580041783,0.4701796580041783,Towson,VCU,6,6,NA,310240119,2011-01-24
101,1,9:12,1752,1752,Josh Brown made Two Point Jumper.,25,24,1,19,0.5299164848900471,0.5299164848900471,Towson,VCU,6,6,NA,310240119,2011-01-24
102,1,8:53,1733,1733,Bradford Burgess missed Three Point Jumper.,25,24,1,0,0.5301802781325905,0.5301802781325905,Towson,VCU,6,6,NA,310240119,2011-01-24
103,1,8:53,1733,1733,Brian Morris Block.,25,24,1,2,0.5301802781325905,0.5301802781325905,Towson,VCU,6,6,NA,310240119,2011-01-24
104,1,8:51,1731,1731,Isaiah Philmore Defensive Rebound.,25,24,1,16,0.5302083019752006,0.5302083019752006,Towson,VCU,6,6,NA,310240119,2011-01-24
105,1,8:35,1715,1715,Dre Conner Turnover.,25,24,1,2,0.5304343866623507,0.5304343866623507,Towson,VCU,6,6,NA,310240119,2011-01-24
106,1,8:33,1713,1713,Jamie Skeen Steal.,25,24,1,1,0.5304628932877434,0.5304628932877434,Towson,VCU,6,6,NA,310240119,2011-01-24
107,1,8:32,1712,1712,Jamie Skeen made Two Point Layup.,25,26,-1,8,0.46952283216038493,0.46952283216038493,Towson,VCU,6,6,NA,310240119,2011-01-24
108,1,8:24,1704,1704,Josh Brown missed Two Point Layup.,25,26,-1,0,0.46940811578150954,0.46940811578150954,Towson,VCU,6,6,NA,310240119,2011-01-24
109,1,8:24,1704,1704,Troy Daniels Defensive Rebound.,25,26,-1,20,0.46940811578150954,0.46940811578150954,Towson,VCU,6,6,NA,310240119,2011-01-24
110,1,8:04,1684,1684,Bradford Burgess Turnover.,25,26,-1,2,0.4691177818723857,0.4691177818723857,Towson,VCU,6,6,NA,310240119,2011-01-24
111,1,8:02,1682,1682,Isaiah Philmore Steal.,25,26,-1,20,0.4690888747803543,0.4690888747803543,Towson,VCU,6,6,NA,310240119,2011-01-24
112,1,7:42,1662,1662,Isaiah Philmore made Two Point Jumper.  Assisted by Brian Morris.,27,26,1,16,0.5311957807591429,0.5311957807591429,Towson,VCU,6,6,NA,310240119,2011-01-24
113,1,7:26,1646,1646,Joey Rodriguez missed Two Point Jumper.,27,26,1,0,0.5314187275598287,0.5314187275598287,Towson,VCU,6,6,NA,310240119,2011-01-24
114,1,7:26,1646,1646,Isaiah Philmore Defensive Rebound.,27,26,1,2,0.5314187275598287,0.5314187275598287,Towson,VCU,6,6,NA,310240119,2011-01-24
115,1,7:24,1644,1644,Foul on Jamie Skeen,27,26,1,0,0.5314463599555308,0.5314463599555308,Towson,VCU,6,6,NA,310240119,2011-01-24
116,1,7:24,1644,1644,Official TV Timeout.,27,26,1,0,0.5314463599555308,0.5314463599555308,Towson,VCU,6,6,NA,310240119,2011-01-24
117,1,7:24,1644,1644,Isaiah Philmore made Free Throw.,28,26,2,0,0.5626449282595558,0.5626449282595558,Towson,VCU,6,6,NA,310240119,2011-01-24
118,1,7:24,1644,1644,Isaiah Philmore made Free Throw.,29,26,3,29,0.5933556624129448,0.5933556624129448,Towson,VCU,6,6,NA,310240119,2011-01-24
119,1,6:55,1615,1615,Joey Rodriguez made Two Point Layup.,29,28,1,29,0.5318430719092864,0.5318430719092864,Towson,VCU,6,6,NA,310240119,2011-01-24
120,1,6:26,1586,1586,RaShawn Polk made Two Point Jumper.  Assisted by Josh Brown.,31,28,3,23,0.595652152557261,0.595652152557261,Towson,VCU,6,6,NA,310240119,2011-01-24
121,1,6:03,1563,1563,Foul on RaShawn Polk,31,28,3,0,0.5965657150536677,0.5965657150536677,Towson,VCU,6,6,NA,310240119,2011-01-24
122,1,6:03,1563,1563,Bradford Burgess made Free Throw.,31,29,2,0,0.5648289724015181,0.5648289724015181,Towson,VCU,6,6,NA,310240119,2011-01-24
123,1,6:03,1563,1563,Bradford Burgess missed Free Throw.,31,29,2,0,0.5648289724015181,0.5648289724015181,Towson,VCU,6,6,NA,310240119,2011-01-24
124,1,6:03,1563,1563,Braxton Dupree Defensive Rebound.,31,29,2,16,0.5648289724015181,0.5648289724015181,Towson,VCU,6,6,NA,310240119,2011-01-24
125,1,5:47,1547,1547,Braxton Dupree made Two Point Jumper.  Assisted by RaShawn Polk.,33,29,4,0,0.6283486966054687,0.6283486966054687,Towson,VCU,6,6,NA,310240119,2011-01-24
126,1,5:47,1547,1547,Foul on David Hinton,33,29,4,0,0.6283486966054687,0.6283486966054687,Towson,VCU,6,6,NA,310240119,2011-01-24
127,1,5:47,1547,1547,Braxton Dupree missed Free Throw.,33,29,4,0,0.6283486966054687,0.6283486966054687,Towson,VCU,6,6,NA,310240119,2011-01-24
128,1,5:47,1547,1547,Virginia Commonwealt Defensive Rebound.,33,29,4,27,0.6283486966054687,0.6283486966054687,Towson,VCU,6,6,NA,310240119,2011-01-24
129,1,5:20,1520,1520,Darius Theus made Three Point Jumper.  Assisted by Bradford Burgess.,33,32,1,16,0.5331587078810258,0.5331587078810258,Towson,VCU,6,6,NA,310240119,2011-01-24
130,1,5:04,1504,1504,RaShawn Polk missed Three Point Jumper.,33,32,1,0,0.53339408256951,0.53339408256951,Towson,VCU,6,6,NA,310240119,2011-01-24
131,1,5:04,1504,1504,Bradford Burgess Defensive Rebound.,33,32,1,13,0.53339408256951,0.53339408256951,Towson,VCU,6,6,NA,310240119,2011-01-24
132,1,4:51,1491,1491,Ed Nixon missed Two Point Jumper.,33,32,1,0,0.5335903894628868,0.5335903894628868,Towson,VCU,6,6,NA,310240119,2011-01-24
133,1,4:51,1491,1491,Braxton Dupree Block.,33,32,1,2,0.5335903894628868,0.5335903894628868,Towson,VCU,6,6,NA,310240119,2011-01-24
134,1,4:49,1489,1489,Jamie Skeen Offensive Rebound.,33,32,1,0,0.5336210360573875,0.5336210360573875,Towson,VCU,6,6,NA,310240119,2011-01-24
135,1,4:49,1489,1489,Jamie Skeen made Two Point Layup.,33,34,-1,0,0.46637896394261247,0.46637896394261247,Towson,VCU,6,6,NA,310240119,2011-01-24
136,1,4:49,1489,1489,Foul on Danny Quinn,33,34,-1,0,0.46637896394261247,0.46637896394261247,Towson,VCU,6,6,NA,310240119,2011-01-24
137,1,4:49,1489,1489,Jamie Skeen missed Free Throw.,33,34,-1,0,0.46637896394261247,0.46637896394261247,Towson,VCU,6,6,NA,310240119,2011-01-24
138,1,4:49,1489,1489,Braxton Dupree Defensive Rebound.,33,34,-1,32,0.46637896394261247,0.46637896394261247,Towson,VCU,6,6,NA,310240119,2011-01-24
139,1,4:17,1457,1457,Isaiah Philmore made Two Point Jumper.,35,34,1,7,0.534129874984894,0.534129874984894,Towson,VCU,6,6,NA,310240119,2011-01-24
140,1,4:10,1450,1450,Foul on Braxton Dupree,35,34,1,0,0.5342463348840679,0.5342463348840679,Towson,VCU,6,6,NA,310240119,2011-01-24
141,1,4:10,1450,1450,Bradford Burgess made Free Throw.,35,35,0,0,0.5,0.5,Towson,VCU,6,6,NA,310240119,2011-01-24
142,1,4:10,1450,1450,Bradford Burgess made Free Throw.,35,36,-1,15,0.46575366511593214,0.46575366511593214,Towson,VCU,6,6,NA,310240119,2011-01-24
143,1,3:55,1435,1435,Foul on Isaiah Philmore,35,36,-1,0,0.465506089226042,0.465506089226042,Towson,VCU,6,6,NA,310240119,2011-01-24
144,1,3:55,1435,1435,Isaiah Philmore Turnover.,35,36,-1,0,0.465506089226042,0.465506089226042,Towson,VCU,6,6,NA,310240119,2011-01-24
145,1,3:55,1435,1435,Official TV Timeout.,35,36,-1,21,0.465506089226042,0.465506089226042,Towson,VCU,6,6,NA,310240119,2011-01-24
146,1,3:34,1414,1414,Bradford Burgess made Two Point Layup.  Assisted by Ed Nixon.,35,38,-3,26,0.3968461725613409,0.3968461725613409,Towson,VCU,6,6,NA,310240119,2011-01-24
147,1,3:08,1388,1388,Foul on Rob Brandenberg,35,38,-3,0,0.39568677523390006,0.39568677523390006,Towson,VCU,6,6,NA,310240119,2011-01-24
148,1,3:08,1388,1388,Josh Brown missed Free Throw.,35,38,-3,0,0.39568677523390006,0.39568677523390006,Towson,VCU,6,6,NA,310240119,2011-01-24
149,1,3:08,1388,1388,Bradford Burgess Defensive Rebound.,35,38,-3,22,0.39568677523390006,0.39568677523390006,Towson,VCU,6,6,NA,310240119,2011-01-24
150,1,2:46,1366,1366,David Hinton Turnover.,35,38,-3,3,0.3947211863837584,0.3947211863837584,Towson,VCU,6,6,NA,310240119,2011-01-24
151,1,2:43,1363,1363,Isaiah Philmore Steal.,35,38,-3,26,0.3945897110888617,0.3945897110888617,Towson,VCU,6,6,NA,310240119,2011-01-24
152,1,2:17,1337,1337,Braxton Dupree made Two Point Jumper.,37,38,-1,25,0.46399064574443627,0.46399064574443627,Towson,VCU,6,6,NA,310240119,2011-01-24
153,1,1:52,1312,1312,Foul on Isaiah Philmore,37,38,-1,0,0.46359776666857505,0.46359776666857505,Towson,VCU,6,6,NA,310240119,2011-01-24
154,1,1:52,1312,1312,Ed Nixon made Free Throw.,37,39,-2,0,0.42757939804014256,0.42757939804014256,Towson,VCU,6,6,NA,310240119,2011-01-24
155,1,1:52,1312,1312,Ed Nixon made Free Throw.,37,40,-3,17,0.3923127362311123,0.3923127362311123,Towson,VCU,6,6,NA,310240119,2011-01-24
156,1,1:35,1295,1295,Josh Brown made Two Point Jumper.,39,40,-1,19,0.4633209988679359,0.4633209988679359,Towson,VCU,6,6,NA,310240119,2011-01-24
157,1,1:16,1276,1276,Rob Brandenberg made Three Point Jumper.,39,43,-4,13,0.3559240676312582,0.3559240676312582,Towson,VCU,6,6,NA,310240119,2011-01-24
158,1,1:03,1263,1263,Foul on Joey Rodriguez,39,43,-4,0,0.35507771824785417,0.35507771824785417,Towson,VCU,6,6,NA,310240119,2011-01-24
159,1,1:03,1263,1263,Dre Conner missed Free Throw.,39,43,-4,0,0.35507771824785417,0.35507771824785417,Towson,VCU,6,6,NA,310240119,2011-01-24
160,1,1:03,1263,1263,null,39,43,-4,0,0.35507771824785417,0.35507771824785417,Towson,VCU,6,6,NA,310240119,2011-01-24
161,1,1:03,1263,1263,Dre Conner made Free Throw.,40,43,-3,17,0.38993276526181136,0.38993276526181136,Towson,VCU,6,6,NA,310240119,2011-01-24
162,1,0:46,1246,1246,Bradford Burgess missed Three Point Jumper.,40,43,-3,0,0.3890325790325191,0.3890325790325191,Towson,VCU,6,6,NA,310240119,2011-01-24
163,1,0:46,1246,1246,Josh Brown Defensive Rebound.,40,43,-3,6,0.3890325790325191,0.3890325790325191,Towson,VCU,6,6,NA,310240119,2011-01-24
164,1,0:40,1240,1240,Towson 30 Second Timeout.,40,43,-3,26,0.3887034161158233,0.3887034161158233,Towson,VCU,5,6,NA,310240119,2011-01-24
165,1,0:14,1214,1214,David Hinton Block.,40,43,-3,0,0.38719867959670484,0.38719867959670484,Towson,VCU,5,6,NA,310240119,2011-01-24
166,1,0:14,1214,1214,Erique Gumbs missed Two Point Dunk Shot.,40,43,-3,0,0.38719867959670484,0.38719867959670484,Towson,VCU,5,6,NA,310240119,2011-01-24
167,1,0:14,1214,1214,Dre Conner Offensive Rebound.,40,43,-3,8,0.38719867959670484,0.38719867959670484,Towson,VCU,5,6,NA,310240119,2011-01-24
168,1,0:06,1206,1206,Josh Brown made Two Point Jumper.,42,43,-1,4,0.46164542829345145,0.46164542829345145,Towson,VCU,5,6,NA,310240119,2011-01-24
169,1,0:02,1202,1202,Virginia Commonwealt 30 Second Timeout.,42,43,-1,2,0.4615607977793232,0.4615607977793232,Towson,VCU,5,5,NA,310240119,2011-01-24
170,1,0:00,1200,1200,Jamie Skeen missed Three Point Jumper.,42,43,-1,0,0.4615187446422248,0.4615187446422248,Towson,VCU,5,5,NA,310240119,2011-01-24
171,1,0:00,1200,1200,Towson Defensive Rebound.,42,43,-1,0,0.4615187446422248,0.4615187446422248,Towson,VCU,5,5,NA,310240119,2011-01-24
172,1,0:00,1200,1200,End of the 1st Half.,42,43,-1,0,0.4615187446422248,0.4615187446422248,Towson,VCU,5,5,NA,310240119,2011-01-24
173,2,20:00,1200,1200,PLAY,42,43,-1,17,0.4615187446422248,0.4615187446422248,Towson,VCU,5,5,NA,310240119,2011-01-24
174,2,19:43,1183,1183,Joey Rodriguez made Three Point Jumper.  Assisted by Ed Nixon.,42,46,-4,16,0.3491963379492148,0.3491963379492148,Towson,VCU,5,5,NA,310240119,2011-01-24
175,2,19:27,1167,1167,Erique Gumbs made Two Point Jumper.,44,46,-2,10,0.4221672970884116,0.4221672970884116,Towson,VCU,5,5,NA,310240119,2011-01-24
176,2,19:17,1157,1157,Joey Rodriguez Turnover.,44,46,-2,1,0.4217768494716882,0.4217768494716882,Towson,VCU,5,5,NA,310240119,2011-01-24
177,2,19:16,1156,1156,Josh Brown Steal.,44,46,-2,20,0.4217379675010065,0.4217379675010065,Towson,VCU,5,5,NA,310240119,2011-01-24
178,2,18:56,1136,1136,Josh Brown made Three Point Jumper.,47,46,1,31,0.5397681679429107,0.5397681679429107,Towson,VCU,5,5,NA,310240119,2011-01-24
179,2,18:25,1105,1105,Jamie Skeen missed Two Point Layup.,47,46,1,0,0.5403828526452518,0.5403828526452518,Towson,VCU,5,5,NA,310240119,2011-01-24
180,2,18:25,1105,1105,Erique Gumbs Defensive Rebound.,47,46,1,20,0.5403828526452518,0.5403828526452518,Towson,VCU,5,5,NA,310240119,2011-01-24
181,2,18:05,1085,1085,Foul on Jamie Skeen,47,46,1,0,0.5407896856894234,0.5407896856894234,Towson,VCU,5,5,NA,310240119,2011-01-24
182,2,18:05,1085,1085,Erique Gumbs missed Free Throw.,47,46,1,0,0.5407896856894234,0.5407896856894234,Towson,VCU,5,5,NA,310240119,2011-01-24
183,2,18:05,1085,1085,null,47,46,1,0,0.5407896856894234,0.5407896856894234,Towson,VCU,5,5,NA,310240119,2011-01-24
184,2,18:05,1085,1085,Erique Gumbs made Free Throw.,48,46,2,14,0.5810400342426023,0.5810400342426023,Towson,VCU,5,5,NA,310240119,2011-01-24
185,2,17:51,1071,1071,Foul on Josh Brown,48,46,2,0,0.5816145129297713,0.5816145129297713,Towson,VCU,5,5,NA,310240119,2011-01-24
186,2,17:51,1071,1071,Foul on Erique Gumbs,48,46,2,0,0.5816145129297713,0.5816145129297713,Towson,VCU,5,5,NA,310240119,2011-01-24
187,2,17:51,1071,1071,Bradford Burgess made Free Throw.,48,47,1,0,0.5410827532086655,0.5410827532086655,Towson,VCU,5,5,NA,310240119,2011-01-24
188,2,17:51,1071,1071,Bradford Burgess made Free Throw.,48,48,0,11,0.5,0.5,Towson,VCU,5,5,NA,310240119,2011-01-24
189,2,17:40,1060,1060,Braxton Dupree made Two Point Layup.  Assisted by Erique Gumbs.,50,48,2,20,0.5820778892226893,0.5820778892226893,Towson,VCU,5,5,NA,310240119,2011-01-24
190,2,17:20,1040,1040,Joey Rodriguez made Three Point Jumper.  Assisted by Ed Nixon.,50,51,-1,16,0.45823379645767426,0.45823379645767426,Towson,VCU,5,5,NA,310240119,2011-01-24
191,2,17:04,1024,1024,Foul on Darius Theus,50,51,-1,14,0.4578572669945048,0.4578572669945048,Towson,VCU,5,5,NA,310240119,2011-01-24
