play_id,half,time_remaining_half,secs_remaining,secs_remaining_absolute,description,home_score,away_score,score_diff,play_length,win_prob,naive_win_prob,home,away,home_time_out_remaining,away_time_out_remaining,home_favored_by,game_id,date
1,1,20:00,2400,2700,PLAY,0,0,0,6,0.5,0.5,Austin Peay,UT Martin,6,6,NA,290362046,2009-02-05
2,1,19:54,2394,2694,Marquis Weddle made Three Point Jumper.  Assisted by Delrico Lane.,0,3,-3,28,0.43398652718916036,0.43398652718916036,Austin Peay,UT Martin,6,6,NA,290362046,2009-02-05
3,1,19:26,2366,2666,Lester Hudson made Three Point Jumper.  Assisted by Delrico Lane.,0,6,-6,28,0.3685607617437214,0.3685607617437214,Austin Peay,UT Martin,6,6,NA,290362046,2009-02-05
4,1,18:58,2338,2638,Wes Channels missed Three Point Jumper.,0,6,-6,0,0.36685910986743697,0.36685910986743697,Austin Peay,UT Martin,6,6,NA,290362046,2009-02-05
5,1,18:58,2338,2638,Olajide Hay Defensive Rebound.,0,6,-6,23,0.36685910986743697,0.36685910986743697,Austin Peay,UT Martin,6,6,NA,290362046,2009-02-05
6,1,18:35,2315,2615,Marquis Weddle missed Three Point Jumper.,0,6,-6,0,0.3654432348085807,0.3654432348085807,Austin Peay,UT Martin,6,6,NA,290362046,2009-02-05
7,1,18:35,2315,2615,Drake Reed Defensive Rebound.,0,6,-6,7,0.3654432348085807,0.3654432348085807,Austin Peay,UT Martin,6,6,NA,290362046,2009-02-05
8,1,18:28,2308,2608,Drake Reed made Three Point Jumper.  Assisted by Caleb Brown.,3,6,-3,40,0.43122778925723515,0.43122778925723515,Austin Peay,UT Martin,6,6,NA,290362046,2009-02-05
9,1,17:48,2268,2568,Foul on Caleb Brown,3,6,-3,0,0.42990259105529255,0.42990259105529255,Austin Peay,UT Martin,6,6,NA,290362046,2009-02-05
10,1,17:48,2268,2568,Delrico Lane missed Free Throw.,3,6,-3,0,0.42990259105529255,0.42990259105529255,Austin Peay,UT Martin,6,6,NA,290362046,2009-02-05
11,1,17:48,2268,2568,null,3,6,-3,0,0.42990259105529255,0.42990259105529255,Austin Peay,UT Martin,6,6,NA,290362046,2009-02-05
12,1,17:48,2268,2568,Delrico Lane made Free Throw.,3,7,-4,7,0.40701201021184025,0.40701201021184025,Austin Peay,UT Martin,6,6,NA,290362046,2009-02-05
13,1,17:41,2261,2561,Kyle Duncan made Two Point Layup.,5,7,-2,17,0.4529390880246341,0.4529390880246341,Austin Peay,UT Martin,6,6,NA,290362046,2009-02-05
14,1,17:24,2244,2544,Marquis Weddle made Two Point Jumper.,5,9,-4,9,0.405955324572128,0.405955324572128,Austin Peay,UT Martin,6,6,NA,290362046,2009-02-05
15,1,17:15,2235,2535,Drake Reed made Two Point Layup.,7,9,-2,16,0.4523496496434625,0.4523496496434625,Austin Peay,UT Martin,6,6,NA,290362046,2009-02-05
16,1,16:59,2219,2519,Delrico Lane made Three Point Jumper.,7,12,-5,14,0.381865286760713,0.381865286760713,Austin Peay,UT Martin,6,6,NA,290362046,2009-02-05
17,1,16:45,2205,2505,Foul on Olajide Hay,7,12,-5,4,0.3811014700100432,0.3811014700100432,Austin Peay,UT Martin,6,6,NA,290362046,2009-02-05
18,1,16:41,2201,2501,Kyle Duncan missed Three Point Jumper.,7,12,-5,0,0.38088286250190306,0.38088286250190306,Austin Peay,UT Martin,6,6,NA,290362046,2009-02-05
19,1,16:41,2201,2501,Djero Riedewald Defensive Rebound.,7,12,-5,9,0.38088286250190306,0.38088286250190306,Austin Peay,UT Martin,6,6,NA,290362046,2009-02-05
20,1,16:32,2192,2492,Lester Hudson missed Two Point Jumper.,7,12,-5,0,0.38039045484245276,0.38039045484245276,Austin Peay,UT Martin,6,6,NA,290362046,2009-02-05
21,1,16:32,2192,2492,Drake Reed Defensive Rebound.,7,12,-5,6,0.38039045484245276,0.38039045484245276,Austin Peay,UT Martin,6,6,NA,290362046,2009-02-05
22,1,16:26,2186,2486,Wes Channels missed Three Point Jumper.,7,12,-5,0,0.38006180342697937,0.38006180342697937,Austin Peay,UT Martin,6,6,NA,290362046,2009-02-05
23,1,16:26,2186,2486,Kyle Duncan Offensive Rebound.,7,12,-5,4,0.38006180342697937,0.38006180342697937,Austin Peay,UT Martin,6,6,NA,290362046,2009-02-05
24,1,16:22,2182,2482,Foul on Olajide Hay,7,12,-5,0,0.379842549881732,0.379842549881732,Austin Peay,UT Martin,6,6,NA,290362046,2009-02-05
25,1,16:22,2182,2482,Kyle Duncan made Free Throw.,8,12,-4,0,0.40319424261009873,0.40319424261009873,Austin Peay,UT Martin,6,6,NA,290362046,2009-02-05
26,1,16:22,2182,2482,Kyle Duncan made Free Throw.,9,12,-3,26,0.4269930904046104,0.4269930904046104,Austin Peay,UT Martin,6,6,NA,290362046,2009-02-05
27,1,15:56,2156,2456,Ernest Fields missed Two Point Jumper.,9,12,-3,0,0.42610243240420215,0.42610243240420215,Austin Peay,UT Martin,6,6,NA,290362046,2009-02-05
28,1,15:56,2156,2456,Tennessee-Martin Defensive Rebou.,9,12,-3,4,0.42610243240420215,0.42610243240420215,Austin Peay,UT Martin,6,6,NA,290362046,2009-02-05
29,1,15:52,2152,2452,Official TV Timeout.,9,12,-3,32,0.4259648273179891,0.4259648273179891,Austin Peay,UT Martin,6,6,NA,290362046,2009-02-05
30,1,15:20,2120,2420,Caleb Brown missed Three Point Jumper.,9,12,-3,0,0.4248572800983273,0.4248572800983273,Austin Peay,UT Martin,6,6,NA,290362046,2009-02-05
31,1,15:20,2120,2420,Lester Hudson Defensive Rebound.,9,12,-3,6,0.4248572800983273,0.4248572800983273,Austin Peay,UT Martin,6,6,NA,290362046,2009-02-05
32,1,15:14,2114,2414,Delrico Lane made Three Point Jumper.  Assisted by Djero Riedewald.,9,15,-6,25,0.35264312436080414,0.35264312436080414,Austin Peay,UT Martin,6,6,NA,290362046,2009-02-05
33,1,14:49,2089,2389,Marquis Weddle made Two Point Jumper.,9,17,-8,1,0.3058722190811563,0.3058722190811563,Austin Peay,UT Martin,6,6,NA,290362046,2009-02-05
34,1,14:48,2088,2388,Austin Peay 30 Second Timeout.,9,17,-8,30,0.3057905344420311,0.3057905344420311,Austin Peay,UT Martin,6,5,NA,290362046,2009-02-05
35,1,14:18,2058,2358,Wes Channels missed Two Point Jumper.,9,17,-8,0,0.30332896085192995,0.30332896085192995,Austin Peay,UT Martin,6,5,NA,290362046,2009-02-05
36,1,14:18,2058,2358,Delrico Lane Defensive Rebound.,9,17,-8,5,0.30332896085192995,0.30332896085192995,Austin Peay,UT Martin,6,5,NA,290362046,2009-02-05
37,1,14:13,2053,2353,Marquis Weddle missed Three Point Jumper.,9,17,-8,0,0.30291652131220775,0.30291652131220775,Austin Peay,UT Martin,6,5,NA,290362046,2009-02-05
38,1,14:13,2053,2353,Eric Massey Offensive Rebound.,9,17,-8,9,0.30291652131220775,0.30291652131220775,Austin Peay,UT Martin,6,5,NA,290362046,2009-02-05
39,1,14:04,2044,2344,Eric Massey made Two Point Layup.,9,19,-10,18,0.2599521030625561,0.2599521030625561,Austin Peay,UT Martin,6,5,NA,290362046,2009-02-05
40,1,13:46,2026,2326,Wes Channels made Two Point Jumper.,11,19,-8,9,0.30067775226669696,0.30067775226669696,Austin Peay,UT Martin,6,5,NA,290362046,2009-02-05
41,1,13:37,2017,2317,Lester Hudson missed Two Point Layup.,11,19,-8,0,0.29992694121506736,0.29992694121506736,Austin Peay,UT Martin,6,5,NA,290362046,2009-02-05
42,1,13:37,2017,2317,Tennessee-Martin Offensive Rebou.,11,19,-8,8,0.29992694121506736,0.29992694121506736,Austin Peay,UT Martin,6,5,NA,290362046,2009-02-05
43,1,13:29,2009,2309,Lester Hudson missed Two Point Jumper.,11,19,-8,0,0.2992575498843676,0.2992575498843676,Austin Peay,UT Martin,6,5,NA,290362046,2009-02-05
44,1,13:29,2009,2309,Drake Reed Defensive Rebound.,11,19,-8,8,0.2992575498843676,0.2992575498843676,Austin Peay,UT Martin,6,5,NA,290362046,2009-02-05
45,1,13:21,2001,2301,Drake Reed made Three Point Jumper.  Assisted by Tyrone Caldwell.,14,19,-5,39,0.36963697275486823,0.36963697275486823,Austin Peay,UT Martin,6,5,NA,290362046,2009-02-05
46,1,12:42,1962,2262,Lester Hudson missed Two Point Jumper.,14,19,-5,0,0.36733661331059025,0.36733661331059025,Austin Peay,UT Martin,6,5,NA,290362046,2009-02-05
47,1,12:42,1962,2262,Eric Massey Offensive Rebound.,14,19,-5,0,0.36733661331059025,0.36733661331059025,Austin Peay,UT Martin,6,5,NA,290362046,2009-02-05
48,1,12:42,1962,2262,Eric Massey missed Two Point Layup.,14,19,-5,0,0.36733661331059025,0.36733661331059025,Austin Peay,UT Martin,6,5,NA,290362046,2009-02-05
49,1,12:42,1962,2262,Ernest Fields Defensive Rebound.,14,19,-5,19,0.36733661331059025,0.36733661331059025,Austin Peay,UT Martin,6,5,NA,290362046,2009-02-05
50,1,12:23,1943,2243,Drake Reed made Two Point Jumper.,16,19,-3,21,0.41845157063326655,0.41845157063326655,Austin Peay,UT Martin,6,5,NA,290362046,2009-02-05
51,1,12:02,1922,2222,Foul on Lester Hudson,16,19,-3,13,0.41765337011253256,0.41765337011253256,Austin Peay,UT Martin,6,5,NA,290362046,2009-02-05
52,1,11:49,1909,2209,Anthony Campbell missed Three Point Jumper.,16,19,-3,0,0.41715924322250364,0.41715924322250364,Austin Peay,UT Martin,6,5,NA,290362046,2009-02-05
53,1,11:49,1909,2209,Tennessee-Martin Defensive Rebou.,16,19,-3,2,0.41715924322250364,0.41715924322250364,Austin Peay,UT Martin,6,5,NA,290362046,2009-02-05
54,1,11:47,1907,2207,Official TV Timeout.,16,19,-3,22,0.4170832939837657,0.4170832939837657,Austin Peay,UT Martin,6,5,NA,290362046,2009-02-05
55,1,11:25,1885,2185,Reuben (Ookie) Clayton made Three Point Jumper.,16,22,-6,20,0.3370681372849355,0.3370681372849355,Austin Peay,UT Martin,6,5,NA,290362046,2009-02-05
56,1,11:05,1865,2165,Marcel Williams made Two Point Layup.  Assisted by Wes Channels.,18,22,-4,7,0.3881502516742981,0.3881502516742981,Austin Peay,UT Martin,6,5,NA,290362046,2009-02-05
57,1,10:58,1858,2158,Reuben (Ookie) Clayton made Two Point Layup.,18,24,-6,16,0.33518301237618925,0.33518301237618925,Austin Peay,UT Martin,6,5,NA,290362046,2009-02-05
58,1,10:42,1842,2142,Wes Channels missed Three Point Jumper.,18,24,-6,0,0.33406340479499064,0.33406340479499064,Austin Peay,UT Martin,6,5,NA,290362046,2009-02-05
59,1,10:42,1842,2142,Drake Reed Offensive Rebound.,18,24,-6,0,0.33406340479499064,0.33406340479499064,Austin Peay,UT Martin,6,5,NA,290362046,2009-02-05
60,1,10:42,1842,2142,Foul on Eric Massey,18,24,-6,7,0.33406340479499064,0.33406340479499064,Austin Peay,UT Martin,6,5,NA,290362046,2009-02-05
61,1,10:35,1835,2135,Anthony Campbell made Two Point Layup.,20,24,-4,21,0.3866582829180913,0.3866582829180913,Austin Peay,UT Martin,6,5,NA,290362046,2009-02-05
62,1,10:14,1814,2114,Lester Hudson missed Three Point Jumper.,20,24,-4,0,0.38560593444079877,0.38560593444079877,Austin Peay,UT Martin,6,5,NA,290362046,2009-02-05
63,1,10:14,1814,2114,Benzor Simmons Offensive Rebound.,20,24,-4,25,0.38560593444079877,0.38560593444079877,Austin Peay,UT Martin,6,5,NA,290362046,2009-02-05
64,1,9:49,1789,2089,Benzor Simmons missed Two Point Layup.,20,24,-4,0,0.3843403333809641,0.3843403333809641,Austin Peay,UT Martin,6,5,NA,290362046,2009-02-05
65,1,9:49,1789,2089,Wes Channels Block.,20,24,-4,0,0.3843403333809641,0.3843403333809641,Austin Peay,UT Martin,6,5,NA,290362046,2009-02-05
66,1,9:49,1789,2089,Wes Channels Defensive Rebound.,20,24,-4,1,0.3843403333809641,0.3843403333809641,Austin Peay,UT Martin,6,5,NA,290362046,2009-02-05
67,1,9:48,1788,2088,Foul on Wes Channels,20,24,-4,24,0.3842893606884637,0.3842893606884637,Austin Peay,UT Martin,6,5,NA,290362046,2009-02-05
68,1,9:24,1764,2064,Lester Hudson missed Two Point Layup.,20,24,-4,0,0.38305652408684,0.38305652408684,Austin Peay,UT Martin,6,5,NA,290362046,2009-02-05
69,1,9:24,1764,2064,Djero Riedewald Offensive Rebound.,20,24,-4,0,0.38305652408684,0.38305652408684,Austin Peay,UT Martin,6,5,NA,290362046,2009-02-05
70,1,9:24,1764,2064,Djero Riedewald missed Two Point Layup.,20,24,-4,0,0.38305652408684,0.38305652408684,Austin Peay,UT Martin,6,5,NA,290362046,2009-02-05
71,1,9:24,1764,2064,Wes Channels Defensive Rebound.,20,24,-4,0,0.38305652408684,0.38305652408684,Austin Peay,UT Martin,6,5,NA,290362046,2009-02-05
72,1,9:24,1764,2064,Foul on Djero Riedewald,20,24,-4,20,0.38305652408684,0.38305652408684,Austin Peay,UT Martin,6,5,NA,290362046,2009-02-05
73,1,9:04,1744,2044,Marquis Weddle missed Two Point Layup.,20,24,-4,0,0.38201333738697846,0.38201333738697846,Austin Peay,UT Martin,6,5,NA,290362046,2009-02-05
74,1,9:04,1744,2044,Reuben (Ookie) Clayton Offensive Rebound.,20,24,-4,2,0.38201333738697846,0.38201333738697846,Austin Peay,UT Martin,6,5,NA,290362046,2009-02-05
75,1,9:02,1742,2042,Reuben (Ookie) Clayton made Two Point Layup.,20,26,-6,22,0.3269118965872987,0.3269118965872987,Austin Peay,UT Martin,6,5,NA,290362046,2009-02-05
76,1,8:40,1720,2020,Anthony Campbell missed Three Point Jumper.,20,26,-6,0,0.3252784491614159,0.3252784491614159,Austin Peay,UT Martin,6,5,NA,290362046,2009-02-05
77,1,8:40,1720,2020,Marquis Weddle Defensive Rebound.,20,26,-6,9,0.3252784491614159,0.3252784491614159,Austin Peay,UT Martin,6,5,NA,290362046,2009-02-05
78,1,8:31,1711,2011,Marquis Weddle made Three Point Jumper.  Assisted by Lester Hudson.,20,29,-9,13,0.24991677102264576,0.24991677102264576,Austin Peay,UT Martin,6,5,NA,290362046,2009-02-05
79,1,8:18,1698,1998,Foul on Benzor Simmons,20,29,-9,4,0.24865161094798224,0.24865161094798224,Austin Peay,UT Martin,6,5,NA,290362046,2009-02-05
80,1,8:14,1694,1994,Drake Reed made Two Point Jumper.  Assisted by Anthony Campbell.,22,29,-7,19,0.2969817798966246,0.2969817798966246,Austin Peay,UT Martin,6,5,NA,290362046,2009-02-05
81,1,7:55,1675,1975,Foul on Tyrone Caldwell,22,29,-7,0,0.2953704909450707,0.2953704909450707,Austin Peay,UT Martin,6,5,NA,290362046,2009-02-05
82,1,7:55,1675,1975,Official TV Timeout.,22,29,-7,26,0.2953704909450707,0.2953704909450707,Austin Peay,UT Martin,6,5,NA,290362046,2009-02-05
83,1,7:29,1649,1949,Anthony Campbell made Three Point Jumper.  Assisted by Drake Reed.,25,29,-4,27,0.3769073979224373,0.3769073979224373,Austin Peay,UT Martin,6,5,NA,290362046,2009-02-05
84,1,7:02,1622,1922,Marquis Weddle missed Three Point Jumper.,25,29,-4,0,0.37551017412741217,0.37551017412741217,Austin Peay,UT Martin,6,5,NA,290362046,2009-02-05
85,1,7:02,1622,1922,Austin Peay Defensive Rebound.,25,29,-4,27,0.37551017412741217,0.37551017412741217,Austin Peay,UT Martin,6,5,NA,290362046,2009-02-05
86,1,6:35,1595,1895,Drake Reed missed Three Point Jumper.,25,29,-4,0,0.3741292437879368,0.3741292437879368,Austin Peay,UT Martin,6,5,NA,290362046,2009-02-05
87,1,6:35,1595,1895,Marquis Weddle Defensive Rebound.,25,29,-4,9,0.3741292437879368,0.3741292437879368,Austin Peay,UT Martin,6,5,NA,290362046,2009-02-05
88,1,6:26,1586,1886,Foul on Benzor Simmons,25,29,-4,12,0.37366903460704465,0.37366903460704465,Austin Peay,UT Martin,6,5,NA,290362046,2009-02-05
89,1,6:14,1574,1874,Drake Reed made Two Point Layup.  Assisted by Caleb Brown.,27,29,-2,21,0.4354694520569261,0.4354694520569261,Austin Peay,UT Martin,6,5,NA,290362046,2009-02-05
90,1,5:53,1553,1853,Lester Hudson missed Two Point Jumper.,27,29,-2,0,0.43489750937340615,0.43489750937340615,Austin Peay,UT Martin,6,5,NA,290362046,2009-02-05
91,1,5:53,1553,1853,Delrico Lane Offensive Rebound.,27,29,-2,9,0.43489750937340615,0.43489750937340615,Austin Peay,UT Martin,6,5,NA,290362046,2009-02-05
92,1,5:44,1544,1844,Lester Hudson missed Two Point Jumper.,27,29,-2,0,0.4346490701294855,0.4346490701294855,Austin Peay,UT Martin,6,5,NA,290362046,2009-02-05
93,1,5:44,1544,1844,Lester Hudson Offensive Rebound.,27,29,-2,2,0.4346490701294855,0.4346490701294855,Austin Peay,UT Martin,6,5,NA,290362046,2009-02-05
94,1,5:42,1542,1842,Lester Hudson made Two Point Layup.,27,31,-4,15,0.3713878689489837,0.3713878689489837,Austin Peay,UT Martin,6,5,NA,290362046,2009-02-05
95,1,5:27,1527,1827,Drake Reed made Two Point Layup.,29,31,-2,15,0.43417248775742967,0.43417248775742967,Austin Peay,UT Martin,6,5,NA,290362046,2009-02-05
96,1,5:12,1512,1812,Benzor Simmons made Two Point Layup.  Assisted by Delrico Lane.,29,33,-4,15,0.36977139179168356,0.36977139179168356,Austin Peay,UT Martin,6,5,NA,290362046,2009-02-05
97,1,4:57,1497,1797,Foul on Benzor Simmons,29,33,-4,0,0.36893439534950084,0.36893439534950084,Austin Peay,UT Martin,6,5,NA,290362046,2009-02-05
98,1,4:57,1497,1797,Ernest Fields made Free Throw.,30,33,-3,0,0.40068944552028324,0.40068944552028324,Austin Peay,UT Martin,6,5,NA,290362046,2009-02-05
99,1,4:57,1497,1797,Ernest Fields made Free Throw.,31,33,-2,24,0.4333010411665468,0.4333010411665468,Austin Peay,UT Martin,6,5,NA,290362046,2009-02-05
100,1,4:33,1473,1773,Eric Massey missed Two Point Layup.,31,33,-2,0,0.4325676562045175,0.4325676562045175,Austin Peay,UT Martin,6,5,NA,290362046,2009-02-05
101,1,4:33,1473,1773,Austin Peay Defensive Rebound.,31,33,-2,18,0.4325676562045175,0.4325676562045175,Austin Peay,UT Martin,6,5,NA,290362046,2009-02-05
102,1,4:15,1455,1755,Kyle Duncan missed Three Point Jumper.,31,33,-2,0,0.4319916022045996,0.4319916022045996,Austin Peay,UT Martin,6,5,NA,290362046,2009-02-05
103,1,4:15,1455,1755,Delrico Lane Defensive Rebound.,31,33,-2,8,0.4319916022045996,0.4319916022045996,Austin Peay,UT Martin,6,5,NA,290362046,2009-02-05
104,1,4:07,1447,1747,Marquis Weddle missed Two Point Jumper.,31,33,-2,0,0.4317282086081378,0.4317282086081378,Austin Peay,UT Martin,6,5,NA,290362046,2009-02-05
105,1,4:07,1447,1747,Delrico Lane Offensive Rebound.,31,33,-2,6,0.4317282086081378,0.4317282086081378,Austin Peay,UT Martin,6,5,NA,290362046,2009-02-05
106,1,4:01,1441,1741,Eric Massey missed Two Point Jumper.,31,33,-2,0,0.4315323360506565,0.4315323360506565,Austin Peay,UT Martin,6,5,NA,290362046,2009-02-05
107,1,4:01,1441,1741,Drake Reed Defensive Rebound.,31,33,-2,5,0.4315323360506565,0.4315323360506565,Austin Peay,UT Martin,6,5,NA,290362046,2009-02-05
108,1,3:56,1436,1736,Foul on Eric Massey,31,33,-2,0,0.4313710235465958,0.4313710235465958,Austin Peay,UT Martin,6,5,NA,290362046,2009-02-05
109,1,3:56,1436,1736,Official TV Timeout.,31,33,-2,0,0.4313710235465958,0.4313710235465958,Austin Peay,UT Martin,6,5,NA,290362046,2009-02-05
110,1,3:56,1436,1736,Drake Reed made Free Throw.,32,33,-1,0,0.46552235211869186,0.46552235211869186,Austin Peay,UT Martin,6,5,NA,290362046,2009-02-05
111,1,3:56,1436,1736,Drake Reed made Free Throw.,33,33,0,35,0.5,0.5,Austin Peay,UT Martin,6,5,NA,290362046,2009-02-05
112,1,3:21,1401,1701,Marquis Weddle missed Two Point Jumper.,33,33,0,0,0.5,0.5,Austin Peay,UT Martin,6,5,NA,290362046,2009-02-05
113,1,3:21,1401,1701,Olajide Hay Offensive Rebound.,33,33,0,4,0.5,0.5,Austin Peay,UT Martin,6,5,NA,290362046,2009-02-05
114,1,3:17,1397,1697,Olajide Hay missed Two Point Layup.,33,33,0,0,0.5,0.5,Austin Peay,UT Martin,6,5,NA,290362046,2009-02-05
115,1,3:17,1397,1697,Drake Reed Block.,33,33,0,1,0.5,0.5,Austin Peay,UT Martin,6,5,NA,290362046,2009-02-05
116,1,3:16,1396,1696,Anthony Campbell Defensive Rebound.,33,33,0,25,0.5,0.5,Austin Peay,UT Martin,6,5,NA,290362046,2009-02-05
117,1,2:51,1371,1671,Anthony Campbell made Two Point Dunk Shot.,35,33,2,18,0.57062341820926,0.57062341820926,Austin Peay,UT Martin,6,5,NA,290362046,2009-02-05
118,1,2:33,1353,1653,Foul on Caleb Brown,35,33,2,3,0.5711631981021713,0.5711631981021713,Austin Peay,UT Martin,6,5,NA,290362046,2009-02-05
119,1,2:30,1350,1650,Olajide Hay missed Two Point Layup.,35,33,2,0,0.5712535041585113,0.5712535041585113,Austin Peay,UT Martin,6,5,NA,290362046,2009-02-05
120,1,2:30,1350,1650,Drake Reed Block.,35,33,2,1,0.5712535041585113,0.5712535041585113,Austin Peay,UT Martin,6,5,NA,290362046,2009-02-05
121,1,2:29,1349,1649,Reuben (Ookie) Clayton Offensive Rebound.,35,33,2,1,0.5712836420640102,0.5712836420640102,Austin Peay,UT Martin,6,5,NA,290362046,2009-02-05
122,1,2:28,1348,1648,Tennessee-Martin 30 Second Timeout.,35,33,2,32,0.5713137995173716,0.5713137995173716,Austin Peay,UT Martin,6,4,NA,290362046,2009-02-05
123,1,1:56,1316,1616,Lester Hudson missed Three Point Jumper.,35,33,2,0,0.5722949162054078,0.5722949162054078,Austin Peay,UT Martin,6,4,NA,290362046,2009-02-05
124,1,1:56,1316,1616,Drake Reed Defensive Rebound.,35,33,2,12,0.5722949162054078,0.5722949162054078,Austin Peay,UT Martin,6,4,NA,290362046,2009-02-05
125,1,1:44,1304,1604,Ernest Fields made Two Point Dunk Shot.  Assisted by Kyle Duncan.,37,33,4,29,0.642342177888995,0.642342177888995,Austin Peay,UT Martin,6,4,NA,290362046,2009-02-05
126,1,1:15,1275,1575,Reuben (Ookie) Clayton missed Three Point Jumper.,37,33,4,0,0.6441400019496988,0.6441400019496988,Austin Peay,UT Martin,6,4,NA,290362046,2009-02-05
127,1,1:15,1275,1575,Drake Reed Defensive Rebound.,37,33,4,27,0.6441400019496988,0.6441400019496988,Austin Peay,UT Martin,6,4,NA,290362046,2009-02-05
128,1,0:48,1248,1548,Lester Hudson missed Three Point Jumper.,37,33,4,0,0.6459383510952668,0.6459383510952668,Austin Peay,UT Martin,6,4,NA,290362046,2009-02-05
129,1,0:48,1248,1548,Lester Hudson Offensive Rebound.,37,33,4,9,0.6459383510952668,0.6459383510952668,Austin Peay,UT Martin,6,4,NA,290362046,2009-02-05
130,1,0:39,1239,1539,Lester Hudson made Two Point Jumper.,37,35,2,21,0.574931216544099,0.574931216544099,Austin Peay,UT Martin,6,4,NA,290362046,2009-02-05
131,1,0:18,1218,1518,Tyrone Caldwell made Two Point Layup.,39,35,4,14,0.6481202287002746,0.6481202287002746,Austin Peay,UT Martin,6,4,NA,290362046,2009-02-05
132,1,0:04,1204,1504,Lester Hudson missed Three Point Jumper.,39,35,4,0,0.6492088837776333,0.6492088837776333,Austin Peay,UT Martin,6,4,NA,290362046,2009-02-05
133,1,0:04,1204,1504,Djero Riedewald Offensive Rebound.,39,35,4,2,0.6492088837776333,0.6492088837776333,Austin Peay,UT Martin,6,4,NA,290362046,2009-02-05
134,1,0:02,1202,1502,null,39,35,4,0,0.649363644672055,0.649363644672055,Austin Peay,UT Martin,6,4,NA,290362046,2009-02-05
135,1,0:02,1202,1502,null,39,35,4,2,0.649363644672055,0.649363644672055,Austin Peay,UT Martin,6,4,NA,290362046,2009-02-05
136,1,0:00,1200,1500,End of the 1st Half.,39,35,4,0,0.6495177425372646,0.6495177425372646,Austin Peay,UT Martin,6,4,NA,290362046,2009-02-05
137,2,20:00,1200,1500,PLAY,39,35,4,10,0.6495177425372646,0.6495177425372646,Austin Peay,UT Martin,6,4,NA,290362046,2009-02-05
138,2,19:50,1190,1490,Wes Channels missed Two Point Jumper.,39,35,4,0,0.6502789946668872,0.6502789946668872,Austin Peay,UT Martin,6,4,NA,290362046,2009-02-05
139,2,19:50,1190,1490,Lester Hudson Defensive Rebound.,39,35,4,14,0.6502789946668872,0.6502789946668872,Austin Peay,UT Martin,6,4,NA,290362046,2009-02-05
140,2,19:36,1176,1476,Lester Hudson missed Two Point Layup.,39,35,4,0,0.6513225557765601,0.6513225557765601,Austin Peay,UT Martin,6,4,NA,290362046,2009-02-05
141,2,19:36,1176,1476,Kyle Duncan Block.,39,35,4,0,0.6513225557765601,0.6513225557765601,Austin Peay,UT Martin,6,4,NA,290362046,2009-02-05
142,2,19:36,1176,1476,Tennessee-Martin Offensive Rebou.,39,35,4,9,0.6513225557765601,0.6513225557765601,Austin Peay,UT Martin,6,4,NA,290362046,2009-02-05
143,2,19:27,1167,1467,Foul on Wes Channels,39,35,4,0,0.6519826060849762,0.6519826060849762,Austin Peay,UT Martin,6,4,NA,290362046,2009-02-05
144,2,19:27,1167,1467,Marquis Weddle made Free Throw.,39,36,3,0,0.6155787834576356,0.6155787834576356,Austin Peay,UT Martin,6,4,NA,290362046,2009-02-05
145,2,19:27,1167,1467,Marquis Weddle missed Free Throw.,39,36,3,0,0.6155787834576356,0.6155787834576356,Austin Peay,UT Martin,6,4,NA,290362046,2009-02-05
146,2,19:27,1167,1467,Wes Channels Defensive Rebound.,39,36,3,18,0.6155787834576356,0.6155787834576356,Austin Peay,UT Martin,6,4,NA,290362046,2009-02-05
147,2,19:09,1149,1449,Drake Reed made Two Point Jumper.  Assisted by Ernest Fields.,41,36,5,30,0.688237313927099,0.688237313927099,Austin Peay,UT Martin,6,4,NA,290362046,2009-02-05
148,2,18:39,1119,1419,Lester Hudson missed Two Point Layup.,41,36,5,0,0.690787202306434,0.690787202306434,Austin Peay,UT Martin,6,4,NA,290362046,2009-02-05
149,2,18:39,1119,1419,Wes Channels Defensive Rebound.,41,36,5,26,0.690787202306434,0.690787202306434,Austin Peay,UT Martin,6,4,NA,290362046,2009-02-05
150,2,18:13,1093,1393,Delrico Lane missed Three Point Jumper.,41,36,5,0,0.6930262230628348,0.6930262230628348,Austin Peay,UT Martin,6,4,NA,290362046,2009-02-05
151,2,18:13,1093,1393,Delrico Lane Offensive Rebound.,41,36,5,15,0.6930262230628348,0.6930262230628348,Austin Peay,UT Martin,6,4,NA,290362046,2009-02-05
152,2,17:58,1078,1378,Foul on Ernest Fields,41,36,5,0,0.6943511528560034,0.6943511528560034,Austin Peay,UT Martin,6,4,NA,290362046,2009-02-05
153,2,17:58,1078,1378,Olajide Hay made Free Throw.,41,37,4,0,0.6584585995389034,0.6584585995389034,Austin Peay,UT Martin,6,4,NA,290362046,2009-02-05
154,2,17:58,1078,1378,Olajide Hay made Free Throw.,41,38,3,7,0.6206538859700262,0.6206538859700262,Austin Peay,UT Martin,6,4,NA,290362046,2009-02-05
155,2,17:51,1071,1371,Caleb Brown missed Two Point Layup.,41,38,3,0,0.621073453727872,0.621073453727872,Austin Peay,UT Martin,6,4,NA,290362046,2009-02-05
156,2,17:51,1071,1371,Olajide Hay Block.,41,38,3,0,0.621073453727872,0.621073453727872,Austin Peay,UT Martin,6,4,NA,290362046,2009-02-05
157,2,17:51,1071,1371,Austin Peay Offensive Rebound.,41,38,3,15,0.621073453727872,0.621073453727872,Austin Peay,UT Martin,6,4,NA,290362046,2009-02-05
158,2,17:36,1056,1356,Foul on Lester Hudson,41,38,3,8,0.6219942299711317,0.6219942299711317,Austin Peay,UT Martin,6,4,NA,290362046,2009-02-05
159,2,17:28,1048,1348,Drake Reed missed Two Point Jumper.,41,38,3,0,0.6224991578067698,0.6224991578067698,Austin Peay,UT Martin,6,4,NA,290362046,2009-02-05
160,2,17:28,1048,1348,Marcel Williams Offensive Rebound.,41,38,3,3,0.6224991578067698,0.6224991578067698,Austin Peay,UT Martin,6,4,NA,290362046,2009-02-05
161,2,17:25,1045,1345,Foul on Olajide Hay,41,38,3,3,0.6226912599574962,0.6226912599574962,Austin Peay,UT Martin,6,4,NA,290362046,2009-02-05
162,2,17:22,1042,1342,Caleb Brown missed Two Point Jumper.,41,38,3,0,0.6228849437385835,0.6228849437385835,Austin Peay,UT Martin,6,4,NA,290362046,2009-02-05
163,2,17:22,1042,1342,Marcel Williams Offensive Rebound.,41,38,3,14,0.6228849437385835,0.6228849437385835,Austin Peay,UT Martin,6,4,NA,290362046,2009-02-05
164,2,17:08,1028,1328,Foul on Wes Channels,41,38,3,19,0.6238112089100524,0.6238112089100524,Austin Peay,UT Martin,6,4,NA,290362046,2009-02-05
165,2,16:49,1009,1309,Marquis Weddle missed Two Point Jumper.,41,38,3,0,0.6251343775630821,0.6251343775630821,Austin Peay,UT Martin,6,4,NA,290362046,2009-02-05
166,2,16:49,1009,1309,Drake Reed Defensive Rebound.,41,38,3,25,0.6251343775630821,0.6251343775630821,Austin Peay,UT Martin,6,4,NA,290362046,2009-02-05
167,2,16:24,984,1284,Lester Hudson made Two Point Jumper.,41,40,1,22,0.5431768558619834,0.5431768558619834,Austin Peay,UT Martin,6,4,NA,290362046,2009-02-05
168,2,16:02,962,1262,Caleb Brown missed Two Point Jumper.,41,40,1,0,0.5438049681311442,0.5438049681311442,Austin Peay,UT Martin,6,4,NA,290362046,2009-02-05
