play_id,half,time_remaining_half,secs_remaining,secs_remaining_absolute,description,home_score,away_score,score_diff,play_length,win_prob,naive_win_prob,home,away,home_time_out_remaining,away_time_out_remaining,home_favored_by,game_id,date
1,1,20:00,2400,2400,PLAY,0,0,0,34,0.5,0.5,Texas,UTSA,4,4,NA,273160251,2007-11-12
2,1,19:26,2366,2366,Devin Gibson missed Two Point Layup.,0,0,0,0,0.5,0.5,Texas,UTSA,4,4,NA,273160251,2007-11-12
3,1,19:26,2366,2366,Travis Gabbidon Offensive Rebound.,0,0,0,1,0.5,0.5,Texas,UTSA,4,4,NA,273160251,2007-11-12
4,1,19:25,2365,2365,Travis Gabbidon missed Two Point Layup.,0,0,0,1,0.5,0.5,Texas,UTSA,4,4,NA,273160251,2007-11-12
5,1,19:24,2364,2364,Devin Gibson Offensive Rebound.,0,0,0,7,0.5,0.5,Texas,UTSA,4,4,NA,273160251,2007-11-12
6,1,19:17,2357,2357,Foul on Connor Atchley,0,0,0,0,0.5,0.5,Texas,UTSA,4,4,NA,273160251,2007-11-12
7,1,19:17,2357,2357,Devin Gibson missed Free Throw.,0,0,0,0,0.5,0.5,Texas,UTSA,4,4,NA,273160251,2007-11-12
8,1,19:17,2357,2357,null,0,0,0,1,0.5,0.5,Texas,UTSA,4,4,NA,273160251,2007-11-12
9,1,19:16,2356,2356,Devin Gibson made Free Throw.,0,1,-1,13,0.47747377344269587,0.47747377344269587,Texas,UTSA,4,4,NA,273160251,2007-11-12
10,1,19:03,2343,2343,Damion James missed Two Point Jumper.,0,1,-1,0,0.4773322529511003,0.4773322529511003,Texas,UTSA,4,4,NA,273160251,2007-11-12
11,1,19:03,2343,2343,Texas-San Antonio Defensive Rebo.,0,1,-1,24,0.4773322529511003,0.4773322529511003,Texas,UTSA,4,4,NA,273160251,2007-11-12
12,1,18:39,2319,2319,Devin Gibson made Two Point Layup.,0,3,-3,0,0.43158808927278697,0.43158808927278697,Texas,UTSA,4,4,NA,273160251,2007-11-12
13,1,18:39,2319,2319,Foul on Damion James,0,3,-3,0,0.43158808927278697,0.43158808927278697,Texas,UTSA,4,4,NA,273160251,2007-11-12
14,1,18:39,2319,2319,Devin Gibson made Free Throw.,0,4,-4,17,0.4092259238153655,0.4092259238153655,Texas,UTSA,4,4,NA,273160251,2007-11-12
15,1,18:22,2302,2302,D.J. Augustin missed Three Point Jumper.,0,4,-4,0,0.4084933021655256,0.4084933021655256,Texas,UTSA,4,4,NA,273160251,2007-11-12
16,1,18:22,2302,2302,null,0,4,-4,6,0.4084933021655256,0.4084933021655256,Texas,UTSA,4,4,NA,273160251,2007-11-12
17,1,18:16,2296,2296,Foul on Isaiah Allen,0,4,-4,11,0.4082333852999432,0.4082333852999432,Texas,UTSA,4,4,NA,273160251,2007-11-12
18,1,18:05,2285,2285,Foul on Travis Gabbidon,0,4,-4,0,0.4077551598976451,0.4077551598976451,Texas,UTSA,4,4,NA,273160251,2007-11-12
19,1,18:05,2285,2285,Harrison Smith made Free Throw.,1,4,-3,1,0.43046850406611475,0.43046850406611475,Texas,UTSA,4,4,NA,273160251,2007-11-12
20,1,18:04,2284,2284,Connor Atchley missed Free Throw.,1,4,-3,0,0.43043532067224205,0.43043532067224205,Texas,UTSA,4,4,NA,273160251,2007-11-12
21,1,18:04,2284,2284,Travis Gabbidon Defensive Rebound.,1,4,-3,19,0.43043532067224205,0.43043532067224205,Texas,UTSA,4,4,NA,273160251,2007-11-12
22,1,17:45,2265,2265,Damion James made Two Point Dunk Shot.,3,4,-1,12,0.47646260705546617,0.47646260705546617,Texas,UTSA,4,4,NA,273160251,2007-11-12
23,1,17:33,2253,2253,Texas-San Antonio 20 Second Timeout.,3,4,-1,23,0.4763261811960912,0.4763261811960912,Texas,UTSA,4,3,NA,273160251,2007-11-12
24,1,17:10,2230,2230,Travis Gabbidon missed Three Point Jumper.,3,4,-1,0,0.476063134234174,0.476063134234174,Texas,UTSA,4,3,NA,273160251,2007-11-12
25,1,17:10,2230,2230,D.J. Augustin Defensive Rebound.,3,4,-1,8,0.476063134234174,0.476063134234174,Texas,UTSA,4,3,NA,273160251,2007-11-12
26,1,17:02,2222,2222,AJ Abrams missed Three Point Jumper.,3,4,-1,0,0.47597120459978587,0.47597120459978587,Texas,UTSA,4,3,NA,273160251,2007-11-12
27,1,17:02,2222,2222,Devin Gibson Defensive Rebound.,3,4,-1,20,0.47597120459978587,0.47597120459978587,Texas,UTSA,4,3,NA,273160251,2007-11-12
28,1,16:42,2202,2202,Devin Gibson missed Two Point Layup.,3,4,-1,0,0.47574052351671575,0.47574052351671575,Texas,UTSA,4,3,NA,273160251,2007-11-12
29,1,16:42,2202,2202,Connor Atchley Defensive Rebound.,3,4,-1,19,0.47574052351671575,0.47574052351671575,Texas,UTSA,4,3,NA,273160251,2007-11-12
30,1,16:23,2183,2183,Foul on Devin Gibson,3,4,-1,11,0.4755203953303274,0.4755203953303274,Texas,UTSA,4,3,NA,273160251,2007-11-12
31,1,16:12,2172,2172,Justin Mason missed Three Point Jumper.,3,4,-1,0,0.4753925881426893,0.4753925881426893,Texas,UTSA,4,3,NA,273160251,2007-11-12
32,1,16:12,2172,2172,AJ Abrams Offensive Rebound.,3,4,-1,13,0.4753925881426893,0.4753925881426893,Texas,UTSA,4,3,NA,273160251,2007-11-12
33,1,15:59,2159,2159,D.J. Augustin made Three Point Jumper.,6,4,2,38,0.5493966151804348,0.5493966151804348,Texas,UTSA,4,3,NA,273160251,2007-11-12
34,1,15:21,2121,2121,Travis Gabbidon missed Two Point Layup.,6,4,2,0,0.5502831994046297,0.5502831994046297,Texas,UTSA,4,3,NA,273160251,2007-11-12
35,1,15:21,2121,2121,Damion James Defensive Rebound.,6,4,2,9,0.5502831994046297,0.5502831994046297,Texas,UTSA,4,3,NA,273160251,2007-11-12
36,1,15:12,2112,2112,Foul on Travis Gabbidon,6,4,2,0,0.5504949846856952,0.5504949846856952,Texas,UTSA,4,3,NA,273160251,2007-11-12
37,1,15:12,2112,2112,Official TV Timeout.,6,4,2,12,0.5504949846856952,0.5504949846856952,Texas,UTSA,4,3,NA,273160251,2007-11-12
38,1,15:00,2100,2100,AJ Abrams missed Two Point Jumper.,6,4,2,5,0.5507785234673286,0.5507785234673286,Texas,UTSA,4,3,NA,273160251,2007-11-12
39,1,14:55,2095,2095,Antoine Dade Defensive Rebound.,6,4,2,34,0.5508970677165204,0.5508970677165204,Texas,UTSA,4,3,NA,273160251,2007-11-12
40,1,14:21,2061,2061,Orrin Greer missed Two Point Jumper.,6,4,2,0,0.5517098346757323,0.5517098346757323,Texas,UTSA,4,3,NA,273160251,2007-11-12
41,1,14:21,2061,2061,Antoine Dade Offensive Rebound.,6,4,2,36,0.5517098346757323,0.5517098346757323,Texas,UTSA,4,3,NA,273160251,2007-11-12
42,1,13:45,2025,2025,D.J. Augustin missed Two Point Layup.,6,4,2,0,0.5525841348179314,0.5525841348179314,Texas,UTSA,4,3,NA,273160251,2007-11-12
43,1,13:45,2025,2025,Justin Mason Offensive Rebound.,6,4,2,5,0.5525841348179314,0.5525841348179314,Texas,UTSA,4,3,NA,273160251,2007-11-12
44,1,13:40,2020,2020,D.J. Augustin made Three Point Jumper.,9,4,5,40,0.6292575594761398,0.6292575594761398,Texas,UTSA,4,3,NA,273160251,2007-11-12
45,1,13:00,1980,1980,Isaiah Allen missed Two Point Jumper.,9,4,5,0,0.631596280058351,0.631596280058351,Texas,UTSA,4,3,NA,273160251,2007-11-12
46,1,13:00,1980,1980,Antoine Dade Offensive Rebound.,9,4,5,42,0.631596280058351,0.631596280058351,Texas,UTSA,4,3,NA,273160251,2007-11-12
47,1,12:18,1938,1938,Devin Gibson missed Two Point Layup.,9,4,5,0,0.6341013577639057,0.6341013577639057,Texas,UTSA,4,3,NA,273160251,2007-11-12
48,1,12:18,1938,1938,Damion James Defensive Rebound.,9,4,5,41,0.6341013577639057,0.6341013577639057,Texas,UTSA,4,3,NA,273160251,2007-11-12
49,1,11:37,1897,1897,Joey Shank made Three Point Jumper.,9,7,2,15,0.555819652211619,0.555819652211619,Texas,UTSA,4,3,NA,273160251,2007-11-12
50,1,11:22,1882,1882,AJ Abrams missed Three Point Jumper.,9,7,2,0,0.5562051465402925,0.5562051465402925,Texas,UTSA,4,3,NA,273160251,2007-11-12
51,1,11:22,1882,1882,Dexter Pittman Offensive Rebound.,9,7,2,6,0.5562051465402925,0.5562051465402925,Texas,UTSA,4,3,NA,273160251,2007-11-12
52,1,11:16,1876,1876,Official TV Timeout.,9,7,2,6,0.5563594356283966,0.5563594356283966,Texas,UTSA,4,3,NA,273160251,2007-11-12
53,1,11:10,1870,1870,AJ Abrams missed Two Point Layup.,9,7,2,0,0.556513826701697,0.556513826701697,Texas,UTSA,4,3,NA,273160251,2007-11-12
54,1,11:10,1870,1870,Dexter Pittman Offensive Rebound.,9,7,2,8,0.556513826701697,0.556513826701697,Texas,UTSA,4,3,NA,273160251,2007-11-12
55,1,11:02,1862,1862,Justin Mason missed Three Point Jumper.,9,7,2,0,0.5567198974471086,0.5567198974471086,Texas,UTSA,4,3,NA,273160251,2007-11-12
56,1,11:02,1862,1862,Devin Gibson Defensive Rebound.,9,7,2,32,0.5567198974471086,0.5567198974471086,Texas,UTSA,4,3,NA,273160251,2007-11-12
57,1,10:30,1830,1830,Orrin Greer made Three Point Jumper.,9,10,-1,12,0.4711299923414153,0.4711299923414153,Texas,UTSA,4,3,NA,273160251,2007-11-12
58,1,10:18,1818,1818,Orrin Greer missed Two Point Layup.,9,10,-1,0,0.47097194278057414,0.47097194278057414,Texas,UTSA,4,3,NA,273160251,2007-11-12
59,1,10:18,1818,1818,Devin Gibson Offensive Rebound.,9,10,-1,4,0.47097194278057414,0.47097194278057414,Texas,UTSA,4,3,NA,273160251,2007-11-12
60,1,10:14,1814,1814,Devin Gibson made Two Point Layup.,9,12,-3,11,0.4135363116959603,0.4135363116959603,Texas,UTSA,4,3,NA,273160251,2007-11-12
61,1,10:03,1803,1803,Justin Mason made Three Point Jumper.,12,12,0,34,0.5,0.5,Texas,UTSA,4,3,NA,273160251,2007-11-12
62,1,9:29,1769,1769,Joey Shank missed Three Point Jumper.,12,12,0,0,0.5,0.5,Texas,UTSA,4,3,NA,273160251,2007-11-12
63,1,9:29,1769,1769,Melvin Smith Offensive Rebound.,12,12,0,37,0.5,0.5,Texas,UTSA,4,3,NA,273160251,2007-11-12
64,1,8:52,1732,1732,Foul on Joey Shank,12,12,0,10,0.5,0.5,Texas,UTSA,4,3,NA,273160251,2007-11-12
65,1,8:42,1722,1722,D.J. Augustin missed Two Point Jumper.,12,12,0,0,0.5,0.5,Texas,UTSA,4,3,NA,273160251,2007-11-12
66,1,8:42,1722,1722,Devin Gibson Defensive Rebound.,12,12,0,33,0.5,0.5,Texas,UTSA,4,3,NA,273160251,2007-11-12
67,1,8:09,1689,1689,Antoine Dade missed Two Point Jumper.,12,12,0,0,0.5,0.5,Texas,UTSA,4,3,NA,273160251,2007-11-12
68,1,8:09,1689,1689,null,12,12,0,1,0.5,0.5,Texas,UTSA,4,3,NA,273160251,2007-11-12
69,1,8:08,1688,1688,Foul on Connor Atchley,12,12,0,4,0.5,0.5,Texas,UTSA,4,3,NA,273160251,2007-11-12
70,1,8:04,1684,1684,Antoine Dade missed Two Point Layup.,12,12,0,0,0.5,0.5,Texas,UTSA,4,3,NA,273160251,2007-11-12
71,1,8:04,1684,1684,Orrin Greer Offensive Rebound.,12,12,0,27,0.5,0.5,Texas,UTSA,4,3,NA,273160251,2007-11-12
72,1,7:37,1657,1657,Foul on Melvin Smith,12,12,0,0,0.5,0.5,Texas,UTSA,4,3,NA,273160251,2007-11-12
73,1,7:37,1657,1657,Official TV Timeout.,12,12,0,8,0.5,0.5,Texas,UTSA,4,3,NA,273160251,2007-11-12
74,1,7:29,1649,1649,Foul on Joey Shank,12,12,0,0,0.5,0.5,Texas,UTSA,4,3,NA,273160251,2007-11-12
75,1,7:29,1649,1649,Clint Chapman made Free Throw.,13,12,1,0,0.5313771895809314,0.5313771895809314,Texas,UTSA,4,3,NA,273160251,2007-11-12
76,1,7:29,1649,1649,Clint Chapman made Free Throw.,14,12,2,30,0.5625082148045423,0.5625082148045423,Texas,UTSA,4,3,NA,273160251,2007-11-12
77,1,6:59,1619,1619,D.J. Augustin made Two Point Layup.,16,12,4,16,0.6246436940548385,0.6246436940548385,Texas,UTSA,4,3,NA,273160251,2007-11-12
78,1,6:43,1603,1603,Texas-San Antonio 20 Second Timeout.,16,12,4,20,0.6254620834865046,0.6254620834865046,Texas,UTSA,4,2,NA,273160251,2007-11-12
79,1,6:23,1583,1583,Orrin Greer missed Two Point Jumper.,16,12,4,0,0.6264845984717283,0.6264845984717283,Texas,UTSA,4,2,NA,273160251,2007-11-12
80,1,6:23,1583,1583,Alexis Wangmene Defensive Rebound.,16,12,4,10,0.6264845984717283,0.6264845984717283,Texas,UTSA,4,2,NA,273160251,2007-11-12
81,1,6:13,1573,1573,Justin Mason missed Two Point Jumper.,16,12,4,0,0.6269980294192325,0.6269980294192325,Texas,UTSA,4,2,NA,273160251,2007-11-12
82,1,6:13,1573,1573,Justin Mason Offensive Rebound.,16,12,4,49,0.6269980294192325,0.6269980294192325,Texas,UTSA,4,2,NA,273160251,2007-11-12
83,1,5:24,1524,1524,D.J. Augustin missed Three Point Jumper.,16,12,4,0,0.6295737979277718,0.6295737979277718,Texas,UTSA,4,2,NA,273160251,2007-11-12
84,1,5:24,1524,1524,Devin Gibson Defensive Rebound.,16,12,4,33,0.6295737979277718,0.6295737979277718,Texas,UTSA,4,2,NA,273160251,2007-11-12
85,1,4:51,1491,1491,Isaiah Allen missed Three Point Jumper.,16,12,4,0,0.6314068519975058,0.6314068519975058,Texas,UTSA,4,2,NA,273160251,2007-11-12
86,1,4:51,1491,1491,Orrin Greer Offensive Rebound.,16,12,4,28,0.6314068519975058,0.6314068519975058,Texas,UTSA,4,2,NA,273160251,2007-11-12
87,1,4:23,1463,1463,Damion James made Two Point Jumper.,18,12,6,35,0.6938166349241238,0.6938166349241238,Texas,UTSA,4,2,NA,273160251,2007-11-12
88,1,3:48,1428,1428,Devin Gibson made Two Point Jumper.,18,14,4,23,0.6352014406583589,0.6352014406583589,Texas,UTSA,4,2,NA,273160251,2007-11-12
89,1,3:25,1405,1405,Justin Mason missed Two Point Layup.,18,14,4,0,0.6365499433420149,0.6365499433420149,Texas,UTSA,4,2,NA,273160251,2007-11-12
90,1,3:25,1405,1405,Orrin Greer Defensive Rebound.,18,14,4,32,0.6365499433420149,0.6365499433420149,Texas,UTSA,4,2,NA,273160251,2007-11-12
91,1,2:53,1373,1373,Devin Gibson made Three Point Jumper.,18,17,1,45,0.5354592030530729,0.5354592030530729,Texas,UTSA,4,2,NA,273160251,2007-11-12
92,1,2:08,1328,1328,Orrin Greer missed Two Point Jumper.,18,17,1,0,0.5361492398317138,0.5361492398317138,Texas,UTSA,4,2,NA,273160251,2007-11-12
93,1,2:08,1328,1328,Texas Defensive Rebound.,18,17,1,18,0.5361492398317138,0.5361492398317138,Texas,UTSA,4,2,NA,273160251,2007-11-12
94,1,1:50,1310,1310,Damion James made Two Point Jumper.,20,17,3,32,0.6077795572062716,0.6077795572062716,Texas,UTSA,4,2,NA,273160251,2007-11-12
95,1,1:18,1278,1278,Foul on Isaiah Allen,20,17,3,24,0.6093085855995282,0.6093085855995282,Texas,UTSA,4,2,NA,273160251,2007-11-12
96,1,0:54,1254,1254,AJ Abrams missed Three Point Jumper.,20,17,3,0,0.6105380613266381,0.6105380613266381,Texas,UTSA,4,2,NA,273160251,2007-11-12
97,1,0:54,1254,1254,Damion James Offensive Rebound.,20,17,3,2,0.6105380613266381,0.6105380613266381,Texas,UTSA,4,2,NA,273160251,2007-11-12
98,1,0:52,1252,1252,Damion James missed Two Point Layup.,20,17,3,0,0.610644413812268,0.610644413812268,Texas,UTSA,4,2,NA,273160251,2007-11-12
99,1,0:52,1252,1252,Damion James Offensive Rebound.,20,17,3,6,0.610644413812268,0.610644413812268,Texas,UTSA,4,2,NA,273160251,2007-11-12
100,1,0:46,1246,1246,Damion James missed Two Point Layup.,20,17,3,0,0.6109674209674808,0.6109674209674808,Texas,UTSA,4,2,NA,273160251,2007-11-12
101,1,0:46,1246,1246,Isaiah Allen Defensive Rebound.,20,17,3,30,0.6109674209674808,0.6109674209674808,Texas,UTSA,4,2,NA,273160251,2007-11-12
102,1,0:16,1216,1216,Foul on A.J. Abrams,20,17,3,0,0.6126807220433428,0.6126807220433428,Texas,UTSA,4,2,NA,273160251,2007-11-12
103,1,0:16,1216,1216,Orrin Greer made Free Throw.,20,18,2,0,0.5758425958806035,0.5758425958806035,Texas,UTSA,4,2,NA,273160251,2007-11-12
104,1,0:16,1216,1216,Orrin Greer made Free Throw.,20,19,1,14,0.5381419710675935,0.5381419710675935,Texas,UTSA,4,2,NA,273160251,2007-11-12
105,1,0:02,1202,1202,D.J. Augustin made Two Point Layup.,22,19,3,2,0.6135317766038629,0.6135317766038629,Texas,UTSA,4,2,NA,273160251,2007-11-12
106,1,0:00,1200,1200,End of the 1st Half.,22,19,3,0,0.6136521367497382,0.6136521367497382,Texas,UTSA,4,2,NA,273160251,2007-11-12
107,2,20:00,1200,1200,PLAY,22,19,3,28,0.6136521367497382,0.6136521367497382,Texas,UTSA,4,3,NA,273160251,2007-11-12
108,2,19:32,1172,1172,Melvin Smith missed Three Point Jumper.,22,19,3,0,0.6152926860479564,0.6152926860479564,Texas,UTSA,4,3,NA,273160251,2007-11-12
109,2,19:32,1172,1172,Damion James Defensive Rebound.,22,19,3,24,0.6152926860479564,0.6152926860479564,Texas,UTSA,4,3,NA,273160251,2007-11-12
110,2,19:08,1148,1148,Foul on A.J. Abrams,22,19,3,0,0.6166547042303746,0.6166547042303746,Texas,UTSA,4,3,NA,273160251,2007-11-12
111,2,19:08,1148,1148,Travis Gabbidon made Free Throw.,22,20,2,0,0.5785723268220714,0.5785723268220714,Texas,UTSA,4,3,NA,273160251,2007-11-12
112,2,19:08,1148,1148,Travis Gabbidon missed Free Throw.,22,20,2,0,0.5785723268220714,0.5785723268220714,Texas,UTSA,4,3,NA,273160251,2007-11-12
113,2,19:08,1148,1148,Damion James Defensive Rebound.,22,20,2,35,0.5785723268220714,0.5785723268220714,Texas,UTSA,4,3,NA,273160251,2007-11-12
114,2,18:33,1113,1113,A.J. Abrams missed Two Point Jumper.,22,20,2,0,0.5799286487915525,0.5799286487915525,Texas,UTSA,4,3,NA,273160251,2007-11-12
115,2,18:33,1113,1113,null,22,20,2,54,0.5799286487915525,0.5799286487915525,Texas,UTSA,4,3,NA,273160251,2007-11-12
116,2,17:39,1059,1059,D.J. Augustin made Two Point Layup.,24,20,4,42,0.6599271502948385,0.6599271502948385,Texas,UTSA,4,3,NA,273160251,2007-11-12
117,2,16:57,1017,1017,Melvin Smith missed Two Point Jumper.,24,20,4,0,0.6634350395668908,0.6634350395668908,Texas,UTSA,4,3,NA,273160251,2007-11-12
118,2,16:57,1017,1017,Joey Shank Offensive Rebound.,24,20,4,4,0.6634350395668908,0.6634350395668908,Texas,UTSA,4,3,NA,273160251,2007-11-12
119,2,16:53,1013,1013,Foul on A.J. Abrams,24,20,4,3,0.6637926142681091,0.6637926142681091,Texas,UTSA,4,3,NA,273160251,2007-11-12
120,2,16:50,1010,1010,Travis Gabbidon made Two Point Layup.,24,22,2,37,0.5843675110386959,0.5843675110386959,Texas,UTSA,4,3,NA,273160251,2007-11-12
121,2,16:13,973,973,Justin Mason missed Two Point Jumper.,24,22,2,0,0.5863243736965277,0.5863243736965277,Texas,UTSA,4,3,NA,273160251,2007-11-12
122,2,16:13,973,973,Connor Atchley Offensive Rebound.,24,22,2,3,0.5863243736965277,0.5863243736965277,Texas,UTSA,4,3,NA,273160251,2007-11-12
123,2,16:10,970,970,Connor Atchley made Two Point Layup.,26,22,4,30,0.6679639220298952,0.6679639220298952,Texas,UTSA,4,3,NA,273160251,2007-11-12
124,2,15:40,940,940,Devin Gibson missed Three Point Jumper.,26,22,4,0,0.6708503726406552,0.6708503726406552,Texas,UTSA,4,3,NA,273160251,2007-11-12
125,2,15:40,940,940,Damion James Defensive Rebound.,26,22,4,8,0.6708503726406552,0.6708503726406552,Texas,UTSA,4,3,NA,273160251,2007-11-12
126,2,15:32,932,932,D.J. Augustin made Two Point Layup.,28,22,6,27,0.7451273293208119,0.7451273293208119,Texas,UTSA,4,3,NA,273160251,2007-11-12
127,2,15:05,905,905,Official TV Timeout.,28,22,6,10,0.7479675496468834,0.7479675496468834,Texas,UTSA,4,3,NA,273160251,2007-11-12
128,2,14:55,895,895,Isaiah Allen missed Three Point Jumper.,28,22,6,0,0.7489665283883059,0.7489665283883059,Texas,UTSA,4,3,NA,273160251,2007-11-12
129,2,14:55,895,895,Connor Atchley Defensive Rebound.,28,22,6,22,0.7489665283883059,0.7489665283883059,Texas,UTSA,4,3,NA,273160251,2007-11-12
130,2,14:33,873,873,Damion James missed Two Point Jumper.,28,22,6,0,0.7511273027453983,0.7511273027453983,Texas,UTSA,4,3,NA,273160251,2007-11-12
131,2,14:33,873,873,Devin Gibson Defensive Rebound.,28,22,6,35,0.7511273027453983,0.7511273027453983,Texas,UTSA,4,3,NA,273160251,2007-11-12
132,2,13:58,838,838,Joey Shank made Three Point Jumper.,28,25,3,21,0.6368716891785073,0.6368716891785073,Texas,UTSA,4,3,NA,273160251,2007-11-12
133,2,13:37,817,817,D.J. Augustin missed Three Point Jumper.,28,25,3,0,0.6383177894057825,0.6383177894057825,Texas,UTSA,4,3,NA,273160251,2007-11-12
134,2,13:37,817,817,null,28,25,3,0,0.6383177894057825,0.6383177894057825,Texas,UTSA,4,3,NA,273160251,2007-11-12
135,2,13:37,817,817,Foul on Travis Gabbidon,28,25,3,13,0.6383177894057825,0.6383177894057825,Texas,UTSA,4,3,NA,273160251,2007-11-12
136,2,13:24,804,804,Justin Mason missed Two Point Jumper.,28,25,3,0,0.6392886426232456,0.6392886426232456,Texas,UTSA,4,3,NA,273160251,2007-11-12
137,2,13:24,804,804,Damion James Offensive Rebound.,28,25,3,11,0.6392886426232456,0.6392886426232456,Texas,UTSA,4,3,NA,273160251,2007-11-12
138,2,13:13,793,793,Connor Atchley missed Three Point Jumper.,28,25,3,0,0.6401661216495779,0.6401661216495779,Texas,UTSA,4,3,NA,273160251,2007-11-12
139,2,13:13,793,793,Justin Mason Offensive Rebound.,28,25,3,2,0.6401661216495779,0.6401661216495779,Texas,UTSA,4,3,NA,273160251,2007-11-12
140,2,13:11,791,791,Justin Mason made Two Point Layup.,30,25,5,0,0.7233901784273471,0.7233901784273471,Texas,UTSA,4,3,NA,273160251,2007-11-12
141,2,13:11,791,791,Foul on Orrin Greer,30,25,5,0,0.7233901784273471,0.7233901784273471,Texas,UTSA,4,3,NA,273160251,2007-11-12
142,2,13:11,791,791,Justin Mason made Free Throw.,31,25,6,32,0.7601694941441172,0.7601694941441172,Texas,UTSA,4,3,NA,273160251,2007-11-12
143,2,12:39,759,759,Joey Shank missed Three Point Jumper.,31,25,6,0,0.7648184832994604,0.7648184832994604,Texas,UTSA,4,3,NA,273160251,2007-11-12
144,2,12:39,759,759,Damion James Defensive Rebound.,31,25,6,23,0.7648184832994604,0.7648184832994604,Texas,UTSA,4,3,NA,273160251,2007-11-12
145,2,12:16,736,736,Justin Mason made Two Point Jumper.,33,25,8,20,0.8322790470173294,0.8322790470173294,Texas,UTSA,4,3,NA,273160251,2007-11-12
146,2,11:56,716,716,Isaiah Allen missed Three Point Jumper.,33,25,8,0,0.8360996473279,0.8360996473279,Texas,UTSA,4,3,NA,273160251,2007-11-12
147,2,11:56,716,716,Justin Mason Defensive Rebound.,33,25,8,6,0.8360996473279,0.8360996473279,Texas,UTSA,4,3,NA,273160251,2007-11-12
148,2,11:50,710,710,Foul on Devin Gibson,33,25,8,25,0.8371429615388288,0.8371429615388288,Texas,UTSA,4,3,NA,273160251,2007-11-12
149,2,11:25,685,685,Foul on Devin Gibson,33,25,8,0,0.8410766815703167,0.8410766815703167,Texas,UTSA,4,3,NA,273160251,2007-11-12
150,2,11:25,685,685,D.J. Augustin made Free Throw.,34,25,9,0,0.8669831408933181,0.8669831408933181,Texas,UTSA,4,3,NA,273160251,2007-11-12
151,2,11:25,685,685,D.J. Augustin made Free Throw.,35,25,10,0,0.8892227441392485,0.8892227441392485,Texas,UTSA,4,3,NA,273160251,2007-11-12
152,2,11:25,685,685,D.J. Augustin made Free Throw.,36,25,11,27,0.9081380006761358,0.9081380006761358,Texas,UTSA,4,3,NA,273160251,2007-11-12
153,2,10:58,658,658,Alexis Wangmene made Two Point Layup.,38,25,13,1,0.9401870044487008,0.9401870044487008,Texas,UTSA,4,3,NA,273160251,2007-11-12
154,2,10:57,657,657,Foul on Isaiah Allen,38,25,13,0,0.9402847461742369,0.9402847461742369,Texas,UTSA,4,3,NA,273160251,2007-11-12
155,2,10:57,657,657,Alexis Wangmene made Free Throw.,39,25,14,28,0.9511371578667968,0.9511371578667968,Texas,UTSA,4,3,NA,273160251,2007-11-12
156,2,10:29,629,629,Orrin Greer missed Three Point Jumper.,39,25,14,0,0.9536103027322097,0.9536103027322097,Texas,UTSA,4,3,NA,273160251,2007-11-12
157,2,10:29,629,629,Clint Chapman Defensive Rebound.,39,25,14,19,0.9536103027322097,0.9536103027322097,Texas,UTSA,4,3,NA,273160251,2007-11-12
158,2,10:10,610,610,Foul on D.J. Augustin,39,25,14,29,0.95541224847421935,0.95541224847421935,Texas,UTSA,4,3,NA,273160251,2007-11-12
159,2,9:41,581,581,Devin Gibson missed Two Point Layup.,39,25,14,0,0.9585322868590771,0.9585322868590771,Texas,UTSA,4,3,NA,273160251,2007-11-12
160,2,9:41,581,581,Clint Chapman Defensive Rebound.,39,25,14,3,0.9585322868590771,0.9585322868590771,Texas,UTSA,4,3,NA,273160251,2007-11-12
161,2,9:38,578,578,Justin Mason missed Two Point Layup.,39,25,14,0,0.9588866722913805,0.9588866722913805,Texas,UTSA,4,3,NA,273160251,2007-11-12
162,2,9:38,578,578,null,39,25,14,22,0.9588866722913805,0.9588866722913805,Texas,UTSA,4,3,NA,273160251,2007-11-12
163,2,9:16,556,556,Melvin Smith missed Two Point Layup.,39,25,14,0,0.9616900213826358,0.9616900213826358,Texas,UTSA,4,3,NA,273160251,2007-11-12
164,2,9:16,556,556,D.J. Augustin Defensive Rebound.,39,25,14,6,0.9616900213826358,0.9616900213826358,Texas,UTSA,4,3,NA,273160251,2007-11-12
165,2,9:10,550,550,Clint Chapman made Two Point Layup.,41,25,16,3,0.9760930823888233,0.9760930823888233,Texas,UTSA,4,3,NA,273160251,2007-11-12
166,2,9:07,547,547,Texas-San Antonio Full Timeout.,41,25,16,32,0.976396896837992,0.976396896837992,Texas,UTSA,4,2,NA,273160251,2007-11-12
167,2,8:35,515,515,Travis Gabbidon made Three Point Jumper.,41,28,13,26,0.9576963023055569,0.9576963023055569,Texas,UTSA,4,2,NA,273160251,2007-11-12
168,2,8:09,489,489,D.J. Augustin missed Two Point Layup.,41,28,13,0,0.960371409053031,0.960371409053031,Texas,UTSA,4,2,NA,273160251,2007-11-12
169,2,8:09,489,489,D.J. Augustin Offensive Rebound.,41,28,13,13,0.960371409053031,0.960371409053031,Texas,UTSA,4,2,NA,273160251,2007-11-12
170,2,7:56,476,476,A.J. Abrams made Three Point Jumper.,44,28,16,6,0.9814587102870815,0.9814587102870815,Texas,UTSA,4,2,NA,273160251,2007-11-12
171,2,7:50,470,470,Official TV Timeout.,44,28,16,27,0.981872067632244,0.981872067632244,Texas,UTSA,4,2,NA,273160251,2007-11-12
172,2,7:23,443,443,Orrin Greer missed Two Point Jumper.,44,28,16,0,0.983996539016119,0.983996539016119,Texas,UTSA,4,2,NA,273160251,2007-11-12
173,2,7:23,443,443,Orrin Greer Offensive Rebound.,44,28,16,28,0.983996539016119,0.983996539016119,Texas,UTSA,4,2,NA,273160251,2007-11-12
174,2,6:55,415,415,Antoine Dade missed Two Point Layup.,44,28,16,0,0.9865343348880371,0.9865343348880371,Texas,UTSA,4,2,NA,273160251,2007-11-12
175,2,6:55,415,415,Devin Gibson Offensive Rebound.,44,28,16,9,0.9865343348880371,0.9865343348880371,Texas,UTSA,4,2,NA,273160251,2007-11-12
176,2,6:46,406,406,Travis Gabbidon missed Three Point Jumper.,44,28,16,0,0.9872300085840228,0.9872300085840228,Texas,UTSA,4,2,NA,273160251,2007-11-12
177,2,6:46,406,406,Devin Gibson Offensive Rebound.,44,28,16,26,0.9872300085840228,0.9872300085840228,Texas,UTSA,4,2,NA,273160251,2007-11-12
178,2,6:20,380,380,Orrin Greer missed Two Point Layup.,44,28,16,0,0.9890170291578776,0.9890170291578776,Texas,UTSA,4,2,NA,273160251,2007-11-12
179,2,6:20,380,380,Antoine Dade Offensive Rebound.,44,28,16,24,0.9890170291578776,0.9890170291578776,Texas,UTSA,4,2,NA,273160251,2007-11-12
180,2,5:56,356,356,Orrin Greer missed Three Point Jumper.,44,28,16,0,0.9905910243798076,0.9905910243798076,Texas,UTSA,4,2,NA,273160251,2007-11-12
181,2,5:56,356,356,Connor Atchley Defensive Rebound.,44,28,16,14,0.9905910243798076,0.9905910243798076,Texas,UTSA,4,2,NA,273160251,2007-11-12
182,2,5:42,342,342,A.J. Abrams made Three Point Jumper.,47,28,19,36,0.9965192065048909,0.9965192065048909,Texas,UTSA,4,2,NA,273160251,2007-11-12
183,2,5:06,306,306,Devin Gibson missed Two Point Layup.,47,28,19,0,0.9977243023580923,0.9977243023580923,Texas,UTSA,4,2,NA,273160251,2007-11-12
184,2,5:06,306,306,Clint Chapman Defensive Rebound.,47,28,19,6,0.9977243023580923,0.9977243023580923,Texas,UTSA,4,2,NA,273160251,2007-11-12
185,2,5:00,300,300,A.J. Abrams missed Three Point Jumper.,47,28,19,0,0.9978398148698903,0.9978398148698903,Texas,UTSA,4,2,NA,273160251,2007-11-12
186,2,5:00,300,300,Devin Gibson Defensive Rebound.,47,28,19,10,0.9978398148698903,0.9978398148698903,Texas,UTSA,4,2,NA,273160251,2007-11-12
187,2,4:50,290,290,Orrin Greer missed Three Point Jumper.,47,28,19,0,0.9979162263380746,0.9979162263380746,Texas,UTSA,4,2,NA,273160251,2007-11-12
188,2,4:50,290,290,Antoine Dade Offensive Rebound.,47,28,19,10,0.9979162263380746,0.9979162263380746,Texas,UTSA,4,2,NA,273160251,2007-11-12
189,2,4:40,280,280,Foul on Connor Atchley,47,28,19,0,0.9978901835172852,0.9978901835172852,Texas,UTSA,4,2,NA,273160251,2007-11-12
