play_id,half,time_remaining_half,secs_remaining,secs_remaining_absolute,description,home_score,away_score,score_diff,play_length,win_prob,naive_win_prob,home,away,home_time_out_remaining,away_time_out_remaining,home_favored_by,game_id,date
1,1,20:00,2400,2400,PLAY,0,0,0,43,0.5,0.5,Illinois,Purdue,6,6,NA,290390356,2009-02-08
2,1,19:17,2357,2357,JaJuan Johnson missed Two Point Layup.,0,0,0,0,0.5,0.5,Illinois,Purdue,6,6,NA,290390356,2009-02-08
3,1,19:17,2357,2357,Mike Davis Defensive Rebound.,0,0,0,14,0.5,0.5,Illinois,Purdue,6,6,NA,290390356,2009-02-08
4,1,19:03,2343,2343,Demetri McCamey missed Two Point Jumper.,0,0,0,0,0.5,0.5,Illinois,Purdue,6,6,NA,290390356,2009-02-08
5,1,19:03,2343,2343,Lewis Jackson Defensive Rebound.,0,0,0,7,0.5,0.5,Illinois,Purdue,6,6,NA,290390356,2009-02-08
6,1,18:56,2336,2336,JaJuan Johnson missed Two Point Jumper.,0,0,0,0,0.5,0.5,Illinois,Purdue,6,6,NA,290390356,2009-02-08
7,1,18:56,2336,2336,Mike Davis Defensive Rebound.,0,0,0,14,0.5,0.5,Illinois,Purdue,6,6,NA,290390356,2009-02-08
8,1,18:42,2322,2322,Mike Davis made Two Point Jumper.  Assisted by Demetri McCamey.,2,0,2,17,0.5457013472490212,0.5457013472490212,Illinois,Purdue,6,6,NA,290390356,2009-02-08
9,1,18:25,2305,2305,JaJuan Johnson missed Two Point Layup.,2,0,2,1,0.5460764925484636,0.5460764925484636,Illinois,Purdue,6,6,NA,290390356,2009-02-08
10,1,18:24,2304,2304,Mike Tisdale Block.,2,0,2,1,0.5460986569417104,0.5460986569417104,Illinois,Purdue,6,6,NA,290390356,2009-02-08
11,1,18:23,2303,2303,Mike Davis Defensive Rebound.,2,0,2,5,0.5461208317819461,0.5461208317819461,Illinois,Purdue,6,6,NA,290390356,2009-02-08
12,1,18:18,2298,2298,Demetri McCamey made Free Throw.,3,0,3,0,0.5691013846518673,0.5691013846518673,Illinois,Purdue,6,6,NA,290390356,2009-02-08
13,1,18:18,2298,2298,Foul on Lewis Jackson,3,0,3,0,0.5691013846518673,0.5691013846518673,Illinois,Purdue,6,6,NA,290390356,2009-02-08
14,1,18:18,2298,2298,Demetri McCamey made Free Throw.,4,0,4,8,0.5916799007296933,0.5916799007296933,Illinois,Purdue,6,6,NA,290390356,2009-02-08
15,1,18:10,2290,2290,Lewis Jackson missed Three Point Jumper.,4,0,4,0,0.5920271966709986,0.5920271966709986,Illinois,Purdue,6,6,NA,290390356,2009-02-08
16,1,18:10,2290,2290,JaJuan Johnson Offensive Rebound.,4,0,4,7,0.5920271966709986,0.5920271966709986,Illinois,Purdue,6,6,NA,290390356,2009-02-08
17,1,18:03,2283,2283,JaJuan Johnson made Free Throw.,4,1,3,0,0.5695978763155807,0.5695978763155807,Illinois,Purdue,6,6,NA,290390356,2009-02-08
18,1,18:03,2283,2283,Foul on Mike Tisdale,4,1,3,0,0.5695978763155807,0.5695978763155807,Illinois,Purdue,6,6,NA,290390356,2009-02-08
19,1,18:03,2283,2283,JaJuan Johnson made Free Throw.,4,2,2,9,0.5465664414276336,0.5465664414276336,Illinois,Purdue,6,6,NA,290390356,2009-02-08
20,1,17:54,2274,2274,Trent Meacham made Three Point Jumper.  Assisted by Mike Davis.,7,2,5,28,0.6151596447430283,0.6151596447430283,Illinois,Purdue,6,6,NA,290390356,2009-02-08
21,1,17:26,2246,2246,Keaton Grant made Three Point Jumper.  Assisted by Chris Kramer.,7,5,2,8,0.5474003565203939,0.5474003565203939,Illinois,Purdue,6,6,NA,290390356,2009-02-08
22,1,17:18,2238,2238,E'Twaun Moore missed Three Point Jumper.,7,5,2,0,0.5475820854440291,0.5475820854440291,Illinois,Purdue,6,6,NA,290390356,2009-02-08
23,1,17:18,2238,2238,Mike Davis Defensive Rebound.,7,5,2,16,0.5475820854440291,0.5475820854440291,Illinois,Purdue,6,6,NA,290390356,2009-02-08
24,1,17:02,2222,2222,Dominique Keller made Two Point Jumper.,9,5,4,25,0.595019946203655,0.595019946203655,Illinois,Purdue,6,6,NA,290390356,2009-02-08
25,1,16:37,2197,2197,Foul on Dominique Keller,9,5,4,3,0.5961344781499945,0.5961344781499945,Illinois,Purdue,6,6,NA,290390356,2009-02-08
26,1,16:34,2194,2194,Nemanja Calasan missed Two Point Jumper.,9,5,4,0,0.5962685977478669,0.5962685977478669,Illinois,Purdue,6,6,NA,290390356,2009-02-08
27,1,16:34,2194,2194,Mike Davis Defensive Rebound.,9,5,4,6,0.5962685977478669,0.5962685977478669,Illinois,Purdue,6,6,NA,290390356,2009-02-08
28,1,16:28,2188,2188,Dominique Keller missed Two Point Layup.,9,5,4,0,0.5965370468907285,0.5965370468907285,Illinois,Purdue,6,6,NA,290390356,2009-02-08
29,1,16:28,2188,2188,Marcus Green Defensive Rebound.,9,5,4,20,0.5965370468907285,0.5965370468907285,Illinois,Purdue,6,6,NA,290390356,2009-02-08
30,1,16:08,2168,2168,Nemanja Calasan made Two Point Layup.  Assisted by Lewis Jackson.,9,7,2,22,0.5491883068455469,0.5491883068455469,Illinois,Purdue,6,6,NA,290390356,2009-02-08
31,1,15:46,2146,2146,Dominique Keller made Two Point Dunk Shot.,11,7,4,15,0.5984247737818268,0.5984247737818268,Illinois,Purdue,6,6,NA,290390356,2009-02-08
32,1,15:31,2131,2131,Official TV Timeout.,11,7,4,17,0.5991044686659226,0.5991044686659226,Illinois,Purdue,6,6,NA,290390356,2009-02-08
33,1,15:14,2114,2114,Mike Davis made Two Point Jumper.  Assisted by Dominique Keller.,13,7,6,25,0.6473568756391959,0.6473568756391959,Illinois,Purdue,6,6,NA,290390356,2009-02-08
34,1,14:49,2089,2089,JaJuan Johnson made Two Point Jumper.  Assisted by Lewis Jackson.,13,9,4,19,0.6010265695027724,0.6010265695027724,Illinois,Purdue,6,6,NA,290390356,2009-02-08
35,1,14:30,2070,2070,Demetri McCamey missed Three Point Jumper.,13,9,4,0,0.601906192513953,0.601906192513953,Illinois,Purdue,6,6,NA,290390356,2009-02-08
36,1,14:30,2070,2070,Dominique Keller Offensive Rebound.,13,9,4,4,0.601906192513953,0.601906192513953,Illinois,Purdue,6,6,NA,290390356,2009-02-08
37,1,14:26,2066,2066,Mike Davis missed Two Point Jumper.,13,9,4,0,0.6020922406369075,0.6020922406369075,Illinois,Purdue,6,6,NA,290390356,2009-02-08
38,1,14:26,2066,2066,Lewis Jackson Defensive Rebound.,13,9,4,9,0.6020922406369075,0.6020922406369075,Illinois,Purdue,6,6,NA,290390356,2009-02-08
39,1,14:17,2057,2057,Chris Kramer missed Three Point Jumper.,13,9,4,0,0.602511987102092,0.602511987102092,Illinois,Purdue,6,6,NA,290390356,2009-02-08
40,1,14:17,2057,2057,Marcus Green Offensive Rebound.,13,9,4,11,0.602511987102092,0.602511987102092,Illinois,Purdue,6,6,NA,290390356,2009-02-08
41,1,14:06,2046,2046,JaJuan Johnson made Two Point Dunk Shot.  Assisted by Marcus Green.,13,11,2,18,0.5520723249003605,0.5520723249003605,Illinois,Purdue,6,6,NA,290390356,2009-02-08
42,1,13:48,2028,2028,Chester Frazier made Three Point Jumper.  Assisted by Trent Meacham.,16,11,5,22,0.6287949106266261,0.6287949106266261,Illinois,Purdue,6,6,NA,290390356,2009-02-08
43,1,13:26,2006,2006,Lewis Jackson made Two Point Layup.,16,13,3,41,0.5792056413368747,0.5792056413368747,Illinois,Purdue,6,6,NA,290390356,2009-02-08
44,1,12:45,1965,1965,Trent Meacham made Three Point Jumper.,19,13,6,5,0.657341690079042,0.657341690079042,Illinois,Purdue,6,6,NA,290390356,2009-02-08
45,1,12:40,1960,1960,Purdue 30 Second Timeout.,19,13,6,17,0.6576878009899739,0.6576878009899739,Illinois,Purdue,6,5,NA,290390356,2009-02-08
46,1,12:23,1943,1943,Nemanja Calasan missed Three Point Jumper.,19,13,6,0,0.658870802398035,0.658870802398035,Illinois,Purdue,6,5,NA,290390356,2009-02-08
47,1,12:23,1943,1943,Illinois Defensive Rebound.,19,13,6,21,0.658870802398035,0.658870802398035,Illinois,Purdue,6,5,NA,290390356,2009-02-08
48,1,12:02,1922,1922,Chester Frazier missed Three Point Jumper.,19,13,6,0,0.6603441070886137,0.6603441070886137,Illinois,Purdue,6,5,NA,290390356,2009-02-08
49,1,12:02,1922,1922,Calvin Brock Offensive Rebound.,19,13,6,11,0.6603441070886137,0.6603441070886137,Illinois,Purdue,6,5,NA,290390356,2009-02-08
50,1,11:51,1911,1911,Calvin Brock missed Two Point Layup.,19,13,6,0,0.6611150255864098,0.6611150255864098,Illinois,Purdue,6,5,NA,290390356,2009-02-08
51,1,11:51,1911,1911,JaJuan Johnson Defensive Rebound.,19,13,6,14,0.6611150255864098,0.6611150255864098,Illinois,Purdue,6,5,NA,290390356,2009-02-08
52,1,11:37,1897,1897,JaJuan Johnson made Two Point Layup.,19,15,4,21,0.6102650344383029,0.6102650344383029,Illinois,Purdue,6,5,NA,290390356,2009-02-08
53,1,11:16,1876,1876,Dominique Keller made Two Point Jumper.  Assisted by Calvin Brock.,21,15,6,20,0.6635600268482817,0.6635600268482817,Illinois,Purdue,6,5,NA,290390356,2009-02-08
54,1,10:56,1856,1856,Nemanja Calasan missed Three Point Jumper.,21,15,6,0,0.6649567815074039,0.6649567815074039,Illinois,Purdue,6,5,NA,290390356,2009-02-08
55,1,10:56,1856,1856,Mike Tisdale Defensive Rebound.,21,15,6,14,0.6649567815074039,0.6649567815074039,Illinois,Purdue,6,5,NA,290390356,2009-02-08
56,1,10:42,1842,1842,Official TV Timeout.,21,15,6,35,0.6659365952050095,0.6659365952050095,Illinois,Purdue,6,5,NA,290390356,2009-02-08
57,1,10:07,1807,1807,Foul on Trent Meacham,21,15,6,14,0.668401673166083,0.668401673166083,Illinois,Purdue,6,5,NA,290390356,2009-02-08
58,1,9:53,1793,1793,Mike Davis missed Two Point Jumper.,21,15,6,0,0.6693968273592321,0.6693968273592321,Illinois,Purdue,6,5,NA,290390356,2009-02-08
59,1,9:53,1793,1793,null,21,15,6,0,0.6693968273592321,0.6693968273592321,Illinois,Purdue,6,5,NA,290390356,2009-02-08
60,1,9:53,1793,1793,Foul on E'Twaun Moore,21,15,6,2,0.6693968273592321,0.6693968273592321,Illinois,Purdue,6,5,NA,290390356,2009-02-08
61,1,9:51,1791,1791,Trent Meacham missed Three Point Jumper.,21,15,6,0,0.6695395266978458,0.6695395266978458,Illinois,Purdue,6,5,NA,290390356,2009-02-08
62,1,9:51,1791,1791,JaJuan Johnson Defensive Rebound.,21,15,6,13,0.6695395266978458,0.6695395266978458,Illinois,Purdue,6,5,NA,290390356,2009-02-08
63,1,9:38,1778,1778,Keaton Grant missed Three Point Jumper.,21,15,6,0,0.6704707036322993,0.6704707036322993,Illinois,Purdue,6,5,NA,290390356,2009-02-08
64,1,9:38,1778,1778,E'Twaun Moore Offensive Rebound.,21,15,6,5,0.6704707036322993,0.6704707036322993,Illinois,Purdue,6,5,NA,290390356,2009-02-08
65,1,9:33,1773,1773,E'Twaun Moore missed Two Point Jumper.,21,15,6,0,0.6708306432288391,0.6708306432288391,Illinois,Purdue,6,5,NA,290390356,2009-02-08
66,1,9:33,1773,1773,Keaton Grant Offensive Rebound.,21,15,6,13,0.6708306432288391,0.6708306432288391,Illinois,Purdue,6,5,NA,290390356,2009-02-08
67,1,9:20,1760,1760,E'Twaun Moore made Two Point Jumper.,21,17,4,27,0.6171508766093694,0.6171508766093694,Illinois,Purdue,6,5,NA,290390356,2009-02-08
68,1,8:53,1733,1733,Mike Tisdale made Two Point Jumper.  Assisted by Mike Davis.,23,17,6,38,0.6737528815884292,0.6737528815884292,Illinois,Purdue,6,5,NA,290390356,2009-02-08
69,1,8:15,1695,1695,Nemanja Calasan missed Two Point Layup.,23,17,6,0,0.6766152367311364,0.6766152367311364,Illinois,Purdue,6,5,NA,290390356,2009-02-08
70,1,8:15,1695,1695,Mike Davis Block.,23,17,6,3,0.6766152367311364,0.6766152367311364,Illinois,Purdue,6,5,NA,290390356,2009-02-08
71,1,8:12,1692,1692,Mike Davis Defensive Rebound.,23,17,6,10,0.6768454254889056,0.6768454254889056,Illinois,Purdue,6,5,NA,290390356,2009-02-08
72,1,8:02,1682,1682,Demetri McCamey missed Three Point Jumper.,23,17,6,0,0.6776109626030262,0.6776109626030262,Illinois,Purdue,6,5,NA,290390356,2009-02-08
73,1,8:02,1682,1682,Nemanja Calasan Defensive Rebound.,23,17,6,0,0.6776109626030262,0.6776109626030262,Illinois,Purdue,6,5,NA,290390356,2009-02-08
74,1,8:02,1682,1682,Purdue 30 Second Timeout.,23,17,6,25,0.6776109626030262,0.6776109626030262,Illinois,Purdue,6,4,NA,290390356,2009-02-08
75,1,7:37,1657,1657,JaJuan Johnson missed Two Point Jumper.,23,17,6,0,0.6794751005541638,0.6794751005541638,Illinois,Purdue,6,4,NA,290390356,2009-02-08
76,1,7:37,1657,1657,JaJuan Johnson Offensive Rebound.,23,17,6,5,0.6794751005541638,0.6794751005541638,Illinois,Purdue,6,4,NA,290390356,2009-02-08
77,1,7:32,1652,1652,JaJuan Johnson made Two Point Dunk Shot.,23,19,4,18,0.6229354614340316,0.6229354614340316,Illinois,Purdue,6,4,NA,290390356,2009-02-08
78,1,7:14,1634,1634,Official TV Timeout.,23,19,4,24,0.6238720627378512,0.6238720627378512,Illinois,Purdue,6,4,NA,290390356,2009-02-08
79,1,6:50,1610,1610,JaJuan Johnson missed Two Point Jumper.,23,19,4,6,0.6251043721227707,0.6251043721227707,Illinois,Purdue,6,4,NA,290390356,2009-02-08
80,1,6:44,1604,1604,Trent Meacham Defensive Rebound.,23,19,4,21,0.625410998167702,0.625410998167702,Illinois,Purdue,6,4,NA,290390356,2009-02-08
81,1,6:23,1583,1583,Foul on E'Twaun Moore,23,19,4,0,0.6264845984717283,0.6264845984717283,Illinois,Purdue,6,4,NA,290390356,2009-02-08
82,1,6:23,1583,1583,Demetri McCamey made Free Throw.,24,19,5,0,0.6562114292001092,0.6562114292001092,Illinois,Purdue,6,4,NA,290390356,2009-02-08
83,1,6:23,1583,1583,Demetri McCamey made Free Throw.,25,19,6,23,0.6847628641488995,0.6847628641488995,Illinois,Purdue,6,4,NA,290390356,2009-02-08
84,1,6:00,1560,1560,Nemanja Calasan missed Two Point Jumper.,25,19,6,0,0.6864016810293472,0.6864016810293472,Illinois,Purdue,6,4,NA,290390356,2009-02-08
85,1,6:00,1560,1560,Mike Davis Defensive Rebound.,25,19,6,9,0.6864016810293472,0.6864016810293472,Illinois,Purdue,6,4,NA,290390356,2009-02-08
86,1,5:51,1551,1551,Demetri McCamey made Two Point Layup.  Assisted by Trent Meacham.,27,19,8,11,0.7404833327952175,0.7404833327952175,Illinois,Purdue,6,4,NA,290390356,2009-02-08
87,1,5:40,1540,1540,Lewis Jackson missed Two Point Jumper.,27,19,8,0,0.7414351513611351,0.7414351513611351,Illinois,Purdue,6,4,NA,290390356,2009-02-08
88,1,5:40,1540,1540,null,27,19,8,4,0.7414351513611351,0.7414351513611351,Illinois,Purdue,6,4,NA,290390356,2009-02-08
89,1,5:36,1536,1536,Foul on Nemanja Calasan,27,19,8,17,0.7417837842198802,0.7417837842198802,Illinois,Purdue,6,4,NA,290390356,2009-02-08
90,1,5:19,1519,1519,Mike Tisdale missed Two Point Jumper.,27,19,8,0,0.7432835210680208,0.7432835210680208,Illinois,Purdue,6,4,NA,290390356,2009-02-08
91,1,5:19,1519,1519,JaJuan Johnson Defensive Rebound.,27,19,8,28,0.7432835210680208,0.7432835210680208,Illinois,Purdue,6,4,NA,290390356,2009-02-08
92,1,4:51,1491,1491,Marcus Green missed Three Point Jumper.,27,19,8,0,0.7458337130296295,0.7458337130296295,Illinois,Purdue,6,4,NA,290390356,2009-02-08
93,1,4:51,1491,1491,Trent Meacham Defensive Rebound.,27,19,8,14,0.7458337130296295,0.7458337130296295,Illinois,Purdue,6,4,NA,290390356,2009-02-08
94,1,4:37,1477,1477,Mike Davis missed Two Point Dunk Shot.,27,19,8,0,0.7471551821630227,0.7471551821630227,Illinois,Purdue,6,4,NA,290390356,2009-02-08
95,1,4:37,1477,1477,Mike Davis Offensive Rebound.,27,19,8,4,0.7471551821630227,0.7471551821630227,Illinois,Purdue,6,4,NA,290390356,2009-02-08
96,1,4:33,1473,1473,Mike Davis missed Two Point Layup.,27,19,8,0,0.7475392683504012,0.7475392683504012,Illinois,Purdue,6,4,NA,290390356,2009-02-08
97,1,4:33,1473,1473,Chris Kramer Defensive Rebound.,27,19,8,3,0.7475392683504012,0.7475392683504012,Illinois,Purdue,6,4,NA,290390356,2009-02-08
98,1,4:30,1470,1470,Chris Kramer missed Two Point Layup.,27,19,8,0,0.7478293464741566,0.7478293464741566,Illinois,Purdue,6,4,NA,290390356,2009-02-08
99,1,4:30,1470,1470,Trent Meacham Defensive Rebound.,27,19,8,5,0.7478293464741566,0.7478293464741566,Illinois,Purdue,6,4,NA,290390356,2009-02-08
100,1,4:25,1465,1465,Foul on Marcus Green,27,19,8,11,0.7483167647133098,0.7483167647133098,Illinois,Purdue,6,4,NA,290390356,2009-02-08
101,1,4:14,1454,1454,Mike Tisdale made Two Point Jumper.  Assisted by Trent Meacham.,29,19,10,27,0.7972698175223626,0.7972698175223626,Illinois,Purdue,6,4,NA,290390356,2009-02-08
102,1,3:47,1427,1427,Lewis Jackson missed Three Point Jumper.,29,19,10,0,0.8001346424315395,0.8001346424315395,Illinois,Purdue,6,4,NA,290390356,2009-02-08
103,1,3:47,1427,1427,Mike Davis Defensive Rebound.,29,19,10,36,0.8001346424315395,0.8001346424315395,Illinois,Purdue,6,4,NA,290390356,2009-02-08
104,1,3:11,1391,1391,Chester Frazier missed Two Point Layup.,29,19,10,0,0.8037218898588688,0.8037218898588688,Illinois,Purdue,6,4,NA,290390356,2009-02-08
105,1,3:11,1391,1391,Keaton Grant Defensive Rebound.,29,19,10,8,0.8037218898588688,0.8037218898588688,Illinois,Purdue,6,4,NA,290390356,2009-02-08
106,1,3:03,1383,1383,Keaton Grant missed Two Point Layup.,29,19,10,0,0.80449579907294555,0.80449579907294555,Illinois,Purdue,6,4,NA,290390356,2009-02-08
107,1,3:03,1383,1383,JaJuan Johnson Offensive Rebound.,29,19,10,2,0.80449579907294555,0.80449579907294555,Illinois,Purdue,6,4,NA,290390356,2009-02-08
108,1,3:01,1381,1381,JaJuan Johnson made Two Point Tip Shot.,29,21,8,4,0.7563344981167439,0.7563344981167439,Illinois,Purdue,6,4,NA,290390356,2009-02-08
109,1,2:57,1377,1377,Illinois 30 Second Timeout.,29,21,8,17,0.7566952544573149,0.7566952544573149,Illinois,Purdue,6,3,NA,290390356,2009-02-08
110,1,2:40,1360,1360,Mike Davis missed Two Point Jumper.,29,21,8,0,0.7582229605713092,0.7582229605713092,Illinois,Purdue,6,3,NA,290390356,2009-02-08
111,1,2:40,1360,1360,Marcus Green Defensive Rebound.,29,21,8,31,0.7582229605713092,0.7582229605713092,Illinois,Purdue,6,3,NA,290390356,2009-02-08
112,1,2:09,1329,1329,JaJuan Johnson missed Two Point Jumper.,29,21,8,0,0.761022794351818,0.761022794351818,Illinois,Purdue,6,3,NA,290390356,2009-02-08
113,1,2:09,1329,1329,Lewis Jackson Offensive Rebound.,29,21,8,6,0.761022794351818,0.761022794351818,Illinois,Purdue,6,3,NA,290390356,2009-02-08
114,1,2:03,1323,1323,Foul on Demetri McCamey,29,21,8,0,0.7615724319366822,0.7615724319366822,Illinois,Purdue,6,3,NA,290390356,2009-02-08
115,1,2:03,1323,1323,Official TV Timeout.,29,21,8,8,0.7615724319366822,0.7615724319366822,Illinois,Purdue,6,3,NA,290390356,2009-02-08
116,1,1:55,1315,1315,Foul on Marcus Green,29,21,8,0,0.7623115169697059,0.7623115169697059,Illinois,Purdue,6,3,NA,290390356,2009-02-08
117,1,1:55,1315,1315,Chester Frazier missed Free Throw.,29,21,8,0,0.7623115169697059,0.7623115169697059,Illinois,Purdue,6,3,NA,290390356,2009-02-08
118,1,1:55,1315,1315,null,29,21,8,0,0.7623115169697059,0.7623115169697059,Illinois,Purdue,6,3,NA,290390356,2009-02-08
119,1,1:55,1315,1315,Chester Frazier missed Free Throw.,29,21,8,0,0.7623115169697059,0.7623115169697059,Illinois,Purdue,6,3,NA,290390356,2009-02-08
120,1,1:55,1315,1315,E'Twaun Moore Defensive Rebound.,29,21,8,14,0.7623115169697059,0.7623115169697059,Illinois,Purdue,6,3,NA,290390356,2009-02-08
121,1,1:41,1301,1301,Chris Kramer made Two Point Layup.  Assisted by JaJuan Johnson.,29,23,6,25,0.7067179922378034,0.7067179922378034,Illinois,Purdue,6,3,NA,290390356,2009-02-08
122,1,1:16,1276,1276,Trent Meacham missed Two Point Jumper.,29,23,6,0,0.7088176954979095,0.7088176954979095,Illinois,Purdue,6,3,NA,290390356,2009-02-08
123,1,1:16,1276,1276,JaJuan Johnson Defensive Rebound.,29,23,6,11,0.7088176954979095,0.7088176954979095,Illinois,Purdue,6,3,NA,290390356,2009-02-08
124,1,1:05,1265,1265,Lewis Jackson made Two Point Layup.,29,25,4,0,0.6447901136618193,0.6447901136618193,Illinois,Purdue,6,3,NA,290390356,2009-02-08
125,1,1:05,1265,1265,Foul on Demetri McCamey,29,25,4,0,0.6447901136618193,0.6447901136618193,Illinois,Purdue,6,3,NA,290390356,2009-02-08
126,1,1:05,1265,1265,Lewis Jackson made Free Throw.,29,26,3,7,0.6099642651731945,0.6099642651731945,Illinois,Purdue,6,3,NA,290390356,2009-02-08
127,1,0:58,1258,1258,Demetri McCamey missed Two Point Layup.,29,26,3,0,0.6103272650609919,0.6103272650609919,Illinois,Purdue,6,3,NA,290390356,2009-02-08
128,1,0:58,1258,1258,Marcus Green Defensive Rebound.,29,26,3,7,0.6103272650609919,0.6103272650609919,Illinois,Purdue,6,3,NA,290390356,2009-02-08
129,1,0:51,1251,1251,Keaton Grant missed Three Point Jumper.,29,26,3,0,0.6106978334678951,0.6106978334678951,Illinois,Purdue,6,3,NA,290390356,2009-02-08
130,1,0:51,1251,1251,Chester Frazier Defensive Rebound.,29,26,3,8,0.6106978334678951,0.6106978334678951,Illinois,Purdue,6,3,NA,290390356,2009-02-08
131,1,0:43,1243,1243,Demetri McCamey made Two Point Layup.,31,26,5,0,0.6799298683607274,0.6799298683607274,Illinois,Purdue,6,3,NA,290390356,2009-02-08
132,1,0:43,1243,1243,Foul on Chris Kramer,31,26,5,0,0.6799298683607274,0.6799298683607274,Illinois,Purdue,6,3,NA,290390356,2009-02-08
133,1,0:43,1243,1243,Demetri McCamey made Free Throw.,32,26,6,10,0.7117994133811086,0.7117994133811086,Illinois,Purdue,6,3,NA,290390356,2009-02-08
134,1,0:33,1233,1233,Lewis Jackson made Two Point Layup.,32,28,4,31,0.6470023840156016,0.6470023840156016,Illinois,Purdue,6,3,NA,290390356,2009-02-08
135,1,0:02,1202,1202,Trent Meacham missed Two Point Layup.,32,28,4,0,0.649363644672055,0.649363644672055,Illinois,Purdue,6,3,NA,290390356,2009-02-08
136,1,0:02,1202,1202,JaJuan Johnson Defensive Rebound.,32,28,4,2,0.649363644672055,0.649363644672055,Illinois,Purdue,6,3,NA,290390356,2009-02-08
137,1,0:00,1200,1200,End of the 1st Half.,32,28,4,0,0.6495177425372646,0.6495177425372646,Illinois,Purdue,6,3,NA,290390356,2009-02-08
138,2,20:00,1200,1200,PLAY,32,28,4,15,0.6495177425372646,0.6495177425372646,Illinois,Purdue,6,3,NA,290390356,2009-02-08
139,2,19:45,1185,1185,Chester Frazier missed Two Point Layup.,32,28,4,0,0.6506543839352416,0.6506543839352416,Illinois,Purdue,6,3,NA,290390356,2009-02-08
140,2,19:45,1185,1185,JaJuan Johnson Defensive Rebound.,32,28,4,14,0.6506543839352416,0.6506543839352416,Illinois,Purdue,6,3,NA,290390356,2009-02-08
141,2,19:31,1171,1171,Chris Kramer missed Two Point Jumper.,32,28,4,0,0.6516901361600497,0.6516901361600497,Illinois,Purdue,6,3,NA,290390356,2009-02-08
142,2,19:31,1171,1171,Chester Frazier Defensive Rebound.,32,28,4,11,0.6516901361600497,0.6516901361600497,Illinois,Purdue,6,3,NA,290390356,2009-02-08
143,2,19:20,1160,1160,Illinois 30 Second Timeout.,32,28,4,13,0.6524915313092159,0.6524915313092159,Illinois,Purdue,6,2,NA,290390356,2009-02-08
144,2,19:07,1147,1147,Trent Meacham missed Two Point Jumper.,32,28,4,0,0.6534294869025121,0.6534294869025121,Illinois,Purdue,6,2,NA,290390356,2009-02-08
145,2,19:07,1147,1147,E'Twaun Moore Defensive Rebound.,32,28,4,19,0.6534294869025121,0.6534294869025121,Illinois,Purdue,6,2,NA,290390356,2009-02-08
146,2,18:48,1128,1128,Chris Kramer missed Two Point Layup.,32,28,4,0,0.6547933347042283,0.6547933347042283,Illinois,Purdue,6,2,NA,290390356,2009-02-08
147,2,18:48,1128,1128,Lewis Jackson Offensive Rebound.,32,28,4,9,0.6547933347042283,0.6547933347042283,Illinois,Purdue,6,2,NA,290390356,2009-02-08
148,2,18:39,1119,1119,E'Twaun Moore missed Two Point Jumper.,32,28,4,0,0.6554407151462831,0.6554407151462831,Illinois,Purdue,6,2,NA,290390356,2009-02-08
149,2,18:39,1119,1119,Mike Davis Defensive Rebound.,32,28,4,12,0.6554407151462831,0.6554407151462831,Illinois,Purdue,6,2,NA,290390356,2009-02-08
150,2,18:27,1107,1107,Mike Davis made Two Point Dunk Shot.  Assisted by Mike Tisdale.,34,28,6,21,0.7251863638834635,0.7251863638834635,Illinois,Purdue,6,2,NA,290390356,2009-02-08
151,2,18:06,1086,1086,JaJuan Johnson made Two Point Jumper.  Assisted by Chris Kramer.,34,30,4,12,0.6578563981476865,0.6578563981476865,Illinois,Purdue,6,2,NA,290390356,2009-02-08
152,2,17:54,1074,1074,Demetri McCamey missed Two Point Jumper.,34,30,4,0,0.6587629977126661,0.6587629977126661,Illinois,Purdue,6,2,NA,290390356,2009-02-08
153,2,17:54,1074,1074,Chris Kramer Defensive Rebound.,34,30,4,9,0.6587629977126661,0.6587629977126661,Illinois,Purdue,6,2,NA,290390356,2009-02-08
154,2,17:45,1065,1065,Foul on Mike Davis,34,30,4,24,0.6594569156002289,0.6594569156002289,Illinois,Purdue,6,2,NA,290390356,2009-02-08
155,2,17:21,1041,1041,Mike Davis made Two Point Jumper.  Assisted by Demetri McCamey.,36,30,6,22,0.7318787905101527,0.7318787905101527,Illinois,Purdue,6,2,NA,290390356,2009-02-08
156,2,16:59,1019,1019,Lewis Jackson made Two Point Jumper.,36,32,4,18,0.6632579710389936,0.6632579710389936,Illinois,Purdue,6,2,NA,290390356,2009-02-08
157,2,16:41,1001,1001,Foul on Chris Kramer,36,32,4,5,0.6648941708376659,0.6648941708376659,Illinois,Purdue,6,2,NA,290390356,2009-02-08
158,2,16:36,996,996,Mike Davis missed Two Point Jumper.,36,32,4,0,0.6653666015585541,0.6653666015585541,Illinois,Purdue,6,2,NA,290390356,2009-02-08
159,2,16:36,996,996,Lewis Jackson Defensive Rebound.,36,32,4,27,0.6653666015585541,0.6653666015585541,Illinois,Purdue,6,2,NA,290390356,2009-02-08
160,2,16:09,969,969,Mike Tisdale made Two Point Jumper.  Assisted by Trent Meacham.,38,32,6,14,0.740619721403676,0.740619721403676,Illinois,Purdue,6,2,NA,290390356,2009-02-08
161,2,15:55,955,955,E'Twaun Moore missed Two Point Jumper.,38,32,6,0,0.7424348823463164,0.7424348823463164,Illinois,Purdue,6,2,NA,290390356,2009-02-08
162,2,15:55,955,955,Demetri McCamey Defensive Rebound.,38,32,6,7,0.7424348823463164,0.7424348823463164,Illinois,Purdue,6,2,NA,290390356,2009-02-08
163,2,15:48,948,948,Trent Meacham made Three Point Jumper.,41,32,9,4,0.8312760309681618,0.8312760309681618,Illinois,Purdue,6,2,NA,290390356,2009-02-08
164,2,15:44,944,944,Purdue 30 Second Timeout.,41,32,9,18,0.8317977953250657,0.8317977953250657,Illinois,Purdue,6,1,NA,290390356,2009-02-08
165,2,15:26,926,926,E'Twaun Moore missed Three Point Jumper.,41,32,9,0,0.8340167424123083,0.8340167424123083,Illinois,Purdue,6,1,NA,290390356,2009-02-08
166,2,15:26,926,926,Demetri McCamey Defensive Rebound.,41,32,9,9,0.8340167424123083,0.8340167424123083,Illinois,Purdue,6,1,NA,290390356,2009-02-08
167,2,15:17,917,917,Calvin Brock missed Two Point Jumper.,41,32,9,0,0.835060853567401,0.835060853567401,Illinois,Purdue,6,1,NA,290390356,2009-02-08
168,2,15:17,917,917,Keaton Grant Defensive Rebound.,41,32,9,16,0.835060853567401,0.835060853567401,Illinois,Purdue,6,1,NA,290390356,2009-02-08
169,2,15:01,901,901,Lewis Jackson made Two Point Layup.,41,34,7,0,0.7810148909715512,0.7810148909715512,Illinois,Purdue,6,1,NA,290390356,2009-02-08
170,2,15:01,901,901,Foul on Demetri McCamey,41,34,7,0,0.7810148909715512,0.7810148909715512,Illinois,Purdue,6,1,NA,290390356,2009-02-08
171,2,15:01,901,901,Official TV Timeout.,41,34,7,0,0.7810148909715512,0.7810148909715512,Illinois,Purdue,6,1,NA,290390356,2009-02-08
172,2,15:01,901,901,Lewis Jackson made Free Throw.,41,35,6,30,0.7483694250997712,0.7483694250997712,Illinois,Purdue,6,1,NA,290390356,2009-02-08
173,2,14:31,871,871,Trent Meacham missed Two Point Jumper.,41,35,6,0,0.7513236812784274,0.7513236812784274,Illinois,Purdue,6,1,NA,290390356,2009-02-08
174,2,14:31,871,871,E'Twaun Moore Defensive Rebound.,41,35,6,15,0.7513236812784274,0.7513236812784274,Illinois,Purdue,6,1,NA,290390356,2009-02-08
175,2,14:16,856,856,JaJuan Johnson made Two Point Dunk Shot.,41,37,4,7,0.677529373852734,0.677529373852734,Illinois,Purdue,6,1,NA,290390356,2009-02-08
