play_id,half,time_remaining_half,secs_remaining,secs_remaining_absolute,description,home_score,away_score,score_diff,play_length,win_prob,naive_win_prob,home,away,home_time_out_remaining,away_time_out_remaining,home_favored_by,game_id,date
177,2,10:09,609,609,Foul on A.J. Abrams,50,46,4,0,0.7060530291194658,0.7060530291194658,Texas,Nebraska,6,2,NA,280640251,2008-03-04
178,2,10:09,609,609,Chris Balham made Free Throw.,50,47,3,0,0.6586352247501689,0.6586352247501689,Texas,Nebraska,6,2,NA,280640251,2008-03-04
179,2,10:09,609,609,Chris Balham made Free Throw.,50,48,2,15,0.6078170479574797,0.6078170479574797,Texas,Nebraska,6,2,NA,280640251,2008-03-04
180,2,9:54,594,594,D.J. Augustin missed Three Point Jumper.,50,48,2,0,0.6090849277444494,0.6090849277444494,Texas,Nebraska,6,2,NA,280640251,2008-03-04
181,2,9:54,594,594,Nebraska Defensive Rebound.,50,48,2,14,0.6090849277444494,0.6090849277444494,Texas,Nebraska,6,2,NA,280640251,2008-03-04
182,2,9:40,580,580,Sek Henry missed Two Point Jumper.,50,48,2,0,0.6104166019471698,0.6104166019471698,Texas,Nebraska,6,2,NA,280640251,2008-03-04
183,2,9:40,580,580,Sek Henry Offensive Rebound.,50,48,2,1,0.6104166019471698,0.6104166019471698,Texas,Nebraska,6,2,NA,280640251,2008-03-04
184,2,9:39,579,579,Sek Henry made Two Point Layup.,50,50,0,16,0.5,0.5,Texas,Nebraska,6,2,NA,280640251,2008-03-04
185,2,9:23,563,563,A.J. Abrams made Two Point Jumper.,52,50,2,31,0.6122676205740424,0.6122676205740424,Texas,Nebraska,6,2,NA,280640251,2008-03-04
186,2,8:52,532,532,Steve Harley made Two Point Jumper.,52,52,0,38,0.5,0.5,Texas,Nebraska,6,2,NA,280640251,2008-03-04
187,2,8:14,494,494,D.J. Augustin missed Two Point Layup.,52,52,0,0,0.5,0.5,Texas,Nebraska,6,2,NA,280640251,2008-03-04
188,2,8:14,494,494,Steve Harley Defensive Rebound.,52,52,0,4,0.5,0.5,Texas,Nebraska,6,2,NA,280640251,2008-03-04
189,2,8:10,490,490,Foul on Damion James,52,52,0,20,0.5,0.5,Texas,Nebraska,6,2,NA,280640251,2008-03-04
190,2,7:50,470,470,Jay-R Strowbridge missed Two Point Layup.,52,52,0,2,0.5,0.5,Texas,Nebraska,6,2,NA,280640251,2008-03-04
191,2,7:48,468,468,Damion James Defensive Rebound.,52,52,0,7,0.5,0.5,Texas,Nebraska,6,2,NA,280640251,2008-03-04
192,2,7:41,461,461,Foul on Jay-R Strowbridge,52,52,0,0,0.5,0.5,Texas,Nebraska,6,2,NA,280640251,2008-03-04
193,2,7:41,461,461,Official TV Timeout.,52,52,0,4,0.5,0.5,Texas,Nebraska,6,2,NA,280640251,2008-03-04
194,2,7:37,457,457,A.J. Abrams missed Two Point Jumper.,52,52,0,0,0.5,0.5,Texas,Nebraska,6,2,NA,280640251,2008-03-04
195,2,7:37,457,457,Justin Mason Offensive Rebound.,52,52,0,4,0.5,0.5,Texas,Nebraska,6,2,NA,280640251,2008-03-04
196,2,7:33,453,453,D.J. Augustin made Three Point Jumper.  Assisted by Justin Mason.,55,52,3,17,0.6818918693815291,0.6818918693815291,Texas,Nebraska,6,2,NA,280640251,2008-03-04
197,2,7:16,436,436,Ade Dagunduro missed Two Point Layup.,55,52,3,0,0.6856779963247364,0.6856779963247364,Texas,Nebraska,6,2,NA,280640251,2008-03-04
198,2,7:16,436,436,Aleks Maric Offensive Rebound.,55,52,3,0,0.6856779963247364,0.6856779963247364,Texas,Nebraska,6,2,NA,280640251,2008-03-04
199,2,7:16,436,436,Foul on Damion James,55,52,3,0,0.6856779963247364,0.6856779963247364,Texas,Nebraska,6,2,NA,280640251,2008-03-04
200,2,7:16,436,436,Aleks Maric missed Free Throw.,55,52,3,0,0.6856779963247364,0.6856779963247364,Texas,Nebraska,6,2,NA,280640251,2008-03-04
201,2,7:16,436,436,null,55,52,3,0,0.6856779963247364,0.6856779963247364,Texas,Nebraska,6,2,NA,280640251,2008-03-04
202,2,7:16,436,436,Aleks Maric missed Free Throw.,55,52,3,0,0.6856779963247364,0.6856779963247364,Texas,Nebraska,6,2,NA,280640251,2008-03-04
203,2,7:16,436,436,Justin Mason Defensive Rebound.,55,52,3,14,0.6856779963247364,0.6856779963247364,Texas,Nebraska,6,2,NA,280640251,2008-03-04
204,2,7:02,422,422,Ade Dagunduro missed Two Point Layup.,55,52,3,0,0.6893317408351559,0.6893317408351559,Texas,Nebraska,6,2,NA,280640251,2008-03-04
205,2,7:02,422,422,Gary Johnson Defensive Rebound.,55,52,3,32,0.6893317408351559,0.6893317408351559,Texas,Nebraska,6,2,NA,280640251,2008-03-04
206,2,6:30,390,390,Justin Mason made Three Point Jumper.  Assisted by D.J. Augustin.,58,52,6,5,0.840962781857234,0.840962781857234,Texas,Nebraska,6,2,NA,280640251,2008-03-04
207,2,6:25,385,385,Nebraska 30 Second Timeout.,58,52,6,27,0.8424319159417751,0.8424319159417751,Texas,Nebraska,6,1,NA,280640251,2008-03-04
208,2,5:58,358,358,Steve Harley missed Two Point Jumper.,58,52,6,0,0.8508051982169619,0.8508051982169619,Texas,Nebraska,6,1,NA,280640251,2008-03-04
209,2,5:58,358,358,A.J. Abrams Defensive Rebound.,58,52,6,14,0.8508051982169619,0.8508051982169619,Texas,Nebraska,6,1,NA,280640251,2008-03-04
210,2,5:44,344,344,Foul on Aleks Maric,58,52,6,2,0.8557370186852965,0.8557370186852965,Texas,Nebraska,6,1,NA,280640251,2008-03-04
211,2,5:42,342,342,Foul on Connor Atchley,58,52,6,25,0.8564882419206986,0.8564882419206986,Texas,Nebraska,6,1,NA,280640251,2008-03-04
212,2,5:17,317,317,Ryan Anderson made Two Point Jumper.  Assisted by Aleks Maric.,58,54,4,34,0.7773424703264044,0.7773424703264044,Texas,Nebraska,6,1,NA,280640251,2008-03-04
213,2,4:43,283,283,Connor Atchley made Three Point Jumper.  Assisted by D.J. Augustin.,61,54,7,20,0.9065306867484763,0.9065306867484763,Texas,Nebraska,6,1,NA,280640251,2008-03-04
214,2,4:23,263,263,Ryan Anderson made Three Point Jumper.,61,57,4,34,0.7823016929504202,0.7823016929504202,Texas,Nebraska,6,1,NA,280640251,2008-03-04
215,2,3:49,229,229,Gary Johnson missed Two Point Layup.,61,57,4,0,0.7789455313960615,0.7789455313960615,Texas,Nebraska,6,1,NA,280640251,2008-03-04
216,2,3:49,229,229,Steve Harley Defensive Rebound.,61,57,4,25,0.7789455313960615,0.7789455313960615,Texas,Nebraska,6,1,NA,280640251,2008-03-04
217,2,3:24,204,204,Aleks Maric made Two Point Dunk Shot.  Assisted by Ryan Anderson.,61,59,2,12,0.660029979777004,0.660029979777004,Texas,Nebraska,6,1,NA,280640251,2008-03-04
218,2,3:12,192,192,Texas 30 Second Timeout.,61,59,2,15,0.6685280093731106,0.6685280093731106,Texas,Nebraska,6,0,NA,280640251,2008-03-04
219,2,2:57,177,177,Connor Atchley missed Three Point Jumper.,61,59,2,0,0.6822782321043375,0.6822782321043375,Texas,Nebraska,6,0,NA,280640251,2008-03-04
220,2,2:57,177,177,Ryan Anderson Defensive Rebound.,61,59,2,6,0.6822782321043375,0.6822782321043375,Texas,Nebraska,6,0,NA,280640251,2008-03-04
221,2,2:51,171,171,Nebraska 30 Second Timeout.,61,59,2,24,0.6878710560488744,0.6878710560488744,Texas,Nebraska,6,-1,NA,280640251,2008-03-04
222,2,2:27,147,147,Steve Harley missed Two Point Layup.,61,59,2,2,0.7116585941809387,0.7116585941809387,Texas,Nebraska,6,-1,NA,280640251,2008-03-04
223,2,2:25,145,145,A.J. Abrams Defensive Rebound.,61,59,2,30,0.7137896765558924,0.7137896765558924,Texas,Nebraska,6,-1,NA,280640251,2008-03-04
224,2,1:55,115,115,Connor Atchley missed Three Point Jumper.,61,59,2,0,0.7496711560178642,0.7496711560178642,Texas,Nebraska,6,-1,NA,280640251,2008-03-04
225,2,1:55,115,115,Sek Henry Defensive Rebound.,61,59,2,16,0.7496711560178642,0.7496711560178642,Texas,Nebraska,6,-1,NA,280640251,2008-03-04
226,2,1:39,99,99,Aleks Maric made Two Point Layup.  Assisted by Sek Henry.,61,61,0,23,0.5,0.5,Texas,Nebraska,6,-1,NA,280640251,2008-03-04
227,2,1:16,76,76,D.J. Augustin missed Two Point Jumper.,61,61,0,0,0.5,0.5,Texas,Nebraska,6,-1,NA,280640251,2008-03-04
228,2,1:16,76,76,null,61,61,0,2,0.5,0.5,Texas,Nebraska,6,-1,NA,280640251,2008-03-04
229,2,1:14,74,74,Foul on Aleks Maric,61,61,0,0,0.5,0.5,Texas,Nebraska,6,-1,NA,280640251,2008-03-04
230,2,1:14,74,74,Official TV Timeout.,61,61,0,18,0.5,0.5,Texas,Nebraska,6,-1,NA,280640251,2008-03-04
231,2,0:56,56,56,D.J. Augustin missed Two Point Jumper.,61,61,0,0,0.5,0.5,Texas,Nebraska,6,-1,NA,280640251,2008-03-04
232,2,0:56,56,56,Damion James Offensive Rebound.,61,61,0,16,0.5,0.5,Texas,Nebraska,6,-1,NA,280640251,2008-03-04
233,2,0:40,40,40,A.J. Abrams made Three Point Jumper.  Assisted by D.J. Augustin.,64,61,3,11,0.9387459605508862,0.9387459605508862,Texas,Nebraska,6,-1,NA,280640251,2008-03-04
234,2,0:29,29,29,Paul Velander missed Three Point Jumper.,64,61,3,0,0.9494535830121873,0.9494535830121873,Texas,Nebraska,6,-1,NA,280640251,2008-03-04
235,2,0:29,29,29,D.J. Augustin Defensive Rebound.,64,61,3,5,0.9494535830121873,0.9494535830121873,Texas,Nebraska,6,-1,NA,280640251,2008-03-04
236,2,0:24,24,24,Foul on Steve Harley,64,61,3,1,0.9538497102658992,0.9538497102658992,Texas,Nebraska,6,-1,NA,280640251,2008-03-04
237,2,0:23,23,23,Foul on Ryan Anderson,64,61,3,0,0.954692519920652,0.954692519920652,Texas,Nebraska,6,-1,NA,280640251,2008-03-04
238,2,0:23,23,23,A.J. Abrams made Free Throw.,65,61,4,0,0.983108178118838,0.983108178118838,Texas,Nebraska,6,-1,NA,280640251,2008-03-04
239,2,0:23,23,23,A.J. Abrams made Free Throw.,66,61,5,5,0.9938176910562189,0.9938176910562189,Texas,Nebraska,6,-1,NA,280640251,2008-03-04
240,2,0:18,18,18,Sek Henry made Three Point Jumper.,66,64,2,1,0.8906854484093576,0.8906854484093576,Texas,Nebraska,6,-1,NA,280640251,2008-03-04
241,2,0:17,17,17,Foul on Steve Harley,66,64,2,0,0.891989722174498,0.891989722174498,Texas,Nebraska,6,-1,NA,280640251,2008-03-04
242,2,0:17,17,17,A.J. Abrams made Free Throw.,67,64,3,0,0.9595672512616573,0.9595672512616573,Texas,Nebraska,6,-1,NA,280640251,2008-03-04
243,2,0:17,17,17,A.J. Abrams made Free Throw.,68,64,4,7,0.9855493021485758,0.9855493021485758,Texas,Nebraska,6,-1,NA,280640251,2008-03-04
244,2,0:10,10,10,Sek Henry made Two Point Layup.,68,66,2,4,0.9009619731336145,0.9009619731336145,Texas,Nebraska,6,-1,NA,280640251,2008-03-04
245,2,0:06,6,6,Foul on Sek Henry,68,66,2,0,0.9059288265680565,0.9059288265680565,Texas,Nebraska,6,-1,NA,280640251,2008-03-04
246,2,0:06,6,6,Justin Mason made Free Throw.,69,66,3,0,0.9676220404903904,0.9676220404903904,Texas,Nebraska,6,-1,NA,280640251,2008-03-04
247,2,0:06,6,6,Justin Mason made Free Throw.,70,66,4,1,0.9893323884792611,0.9893323884792611,Texas,Nebraska,6,-1,NA,280640251,2008-03-04
248,2,0:05,5,5,Sek Henry missed Three Point Jumper.,70,66,4,0,0.989632052843119,0.989632052843119,Texas,Nebraska,6,-1,NA,280640251,2008-03-04
249,2,0:05,5,5,Ryan Anderson Offensive Rebound.,70,66,4,0,0.989632052843119,0.989632052843119,Texas,Nebraska,6,-1,NA,280640251,2008-03-04
250,2,0:05,5,5,Ryan Anderson missed Two Point Jumper.,70,66,4,0,0.989632052843119,0.989632052843119,Texas,Nebraska,6,-1,NA,280640251,2008-03-04
251,2,0:05,5,5,Aleks Maric Offensive Rebound.,70,66,4,0,0.989632052843119,0.989632052843119,Texas,Nebraska,6,-1,NA,280640251,2008-03-04
252,2,0:05,5,5,Aleks Maric missed Two Point Layup.,70,66,4,0,0.989632052843119,0.989632052843119,Texas,Nebraska,6,-1,NA,280640251,2008-03-04
253,2,0:05,5,5,Connor Atchley Defensive Rebound.,70,66,4,5,0.989632052843119,0.989632052843119,Texas,Nebraska,6,-1,NA,280640251,2008-03-04
254,2,0:00,0,0,End Game,70,66,4,0,1,1,Texas,Nebraska,6,-1,NA,280640251,2008-03-04
