play_id,half,time_remaining_half,secs_remaining,secs_remaining_absolute,description,home_score,away_score,score_diff,play_length,win_prob,naive_win_prob,home,away,home_time_out_remaining,away_time_out_remaining,home_favored_by,game_id,date
1,1,20:00,2400,2400,PLAY,0,0,0,23,0.5,0.5,Texas,Nebraska,6,6,NA,280640251,2008-03-04
2,1,19:37,2377,2377,Ade Dagunduro made Three Point Jumper.  Assisted by Sek Henry.,0,3,-3,18,0.433452665949487,0.433452665949487,Texas,Nebraska,6,6,NA,280640251,2008-03-04
3,1,19:19,2359,2359,Connor Atchley missed Three Point Jumper.,0,3,-3,0,0.4328808175338899,0.4328808175338899,Texas,Nebraska,6,6,NA,280640251,2008-03-04
4,1,19:19,2359,2359,Steve Harley Defensive Rebound.,0,3,-3,10,0.4328808175338899,0.4328808175338899,Texas,Nebraska,6,6,NA,280640251,2008-03-04
5,1,19:09,2349,2349,Aleks Maric made Two Point Layup.  Assisted by Ryan Anderson.,0,5,-5,17,0.38880119200837177,0.38880119200837177,Texas,Nebraska,6,6,NA,280640251,2008-03-04
6,1,18:52,2332,2332,Damion James missed Three Point Jumper.,0,5,-5,0,0.38791552787681716,0.38791552787681716,Texas,Nebraska,6,6,NA,280640251,2008-03-04
7,1,18:52,2332,2332,Aleks Maric Defensive Rebound.,0,5,-5,18,0.38791552787681716,0.38791552787681716,Texas,Nebraska,6,6,NA,280640251,2008-03-04
8,1,18:34,2314,2314,Ade Dagunduro missed Two Point Jumper.,0,5,-5,0,0.3869694712155948,0.3869694712155948,Texas,Nebraska,6,6,NA,280640251,2008-03-04
9,1,18:34,2314,2314,Connor Atchley Defensive Rebound.,0,5,-5,11,0.3869694712155948,0.3869694712155948,Texas,Nebraska,6,6,NA,280640251,2008-03-04
10,1,18:23,2303,2303,A.J. Abrams missed Two Point Jumper.,0,5,-5,0,0.38638744441900696,0.38638744441900696,Texas,Nebraska,6,6,NA,280640251,2008-03-04
11,1,18:23,2303,2303,Ade Dagunduro Defensive Rebound.,0,5,-5,26,0.38638744441900696,0.38638744441900696,Texas,Nebraska,6,6,NA,280640251,2008-03-04
12,1,17:57,2277,2277,Aleks Maric missed Two Point Jumper.,0,5,-5,0,0.38500118748826473,0.38500118748826473,Texas,Nebraska,6,6,NA,280640251,2008-03-04
13,1,17:57,2277,2277,Ade Dagunduro Offensive Rebound.,0,5,-5,14,0.38500118748826473,0.38500118748826473,Texas,Nebraska,6,6,NA,280640251,2008-03-04
14,1,17:43,2263,2263,Sek Henry missed Three Point Jumper.,0,5,-5,0,0.384249213166358,0.384249213166358,Texas,Nebraska,6,6,NA,280640251,2008-03-04
15,1,17:43,2263,2263,Justin Mason Defensive Rebound.,0,5,-5,25,0.384249213166358,0.384249213166358,Texas,Nebraska,6,6,NA,280640251,2008-03-04
16,1,17:18,2238,2238,D.J. Augustin made Three Point Jumper.,3,5,-2,30,0.45241791455597086,0.45241791455597086,Texas,Nebraska,6,6,NA,280640251,2008-03-04
17,1,16:48,2208,2208,Connor Atchley missed Three Point Jumper.,3,5,-2,0,0.45173267366113046,0.45173267366113046,Texas,Nebraska,6,6,NA,280640251,2008-03-04
18,1,16:48,2208,2208,Ryan Anderson Defensive Rebound.,3,5,-2,25,0.45173267366113046,0.45173267366113046,Texas,Nebraska,6,6,NA,280640251,2008-03-04
19,1,16:23,2183,2183,Ade Dagunduro missed Two Point Jumper.,3,5,-2,2,0.45115786546126196,0.45115786546126196,Texas,Nebraska,6,6,NA,280640251,2008-03-04
20,1,16:21,2181,2181,Justin Mason Defensive Rebound.,3,5,-2,3,0.4511117595001653,0.4511117595001653,Texas,Nebraska,6,6,NA,280640251,2008-03-04
21,1,16:18,2178,2178,Foul on Ade Dagunduro,3,5,-2,18,0.45104257079564314,0.45104257079564314,Texas,Nebraska,6,6,NA,280640251,2008-03-04
22,1,16:00,2160,2160,Clint Chapman missed Two Point Jumper.,3,5,-2,0,0.45062656006611934,0.45062656006611934,Texas,Nebraska,6,6,NA,280640251,2008-03-04
23,1,16:00,2160,2160,Aleks Maric Defensive Rebound.,3,5,-2,20,0.45062656006611934,0.45062656006611934,Texas,Nebraska,6,6,NA,280640251,2008-03-04
24,1,15:40,2140,2140,Steve Harley made Two Point Jumper.,3,7,-4,18,0.40130374681978,0.40130374681978,Texas,Nebraska,6,6,NA,280640251,2008-03-04
25,1,15:22,2122,2122,Official TV Timeout.,3,7,-4,31,0.4004860791695032,0.4004860791695032,Texas,Nebraska,6,6,NA,280640251,2008-03-04
26,1,14:51,2091,2091,Steve Harley missed Two Point Jumper.,3,7,-4,0,0.3990656387602772,0.3990656387602772,Texas,Nebraska,6,6,NA,280640251,2008-03-04
27,1,14:51,2091,2091,Nebraska Offensive Rebound.,3,7,-4,25,0.3990656387602772,0.3990656387602772,Texas,Nebraska,6,6,NA,280640251,2008-03-04
28,1,14:26,2066,2066,Paul Velander made Three Point Jumper.  Assisted by Jay-R Strowbridge.,3,10,-7,0,0.32632955348106696,0.32632955348106696,Texas,Nebraska,6,6,NA,280640251,2008-03-04
29,1,14:26,2066,2066,Foul on J.D. Lewis,3,10,-7,0,0.32632955348106696,0.32632955348106696,Texas,Nebraska,6,6,NA,280640251,2008-03-04
30,1,14:26,2066,2066,Paul Velander missed Free Throw.,3,10,-7,0,0.32632955348106696,0.32632955348106696,Texas,Nebraska,6,6,NA,280640251,2008-03-04
31,1,14:26,2066,2066,Clint Chapman Defensive Rebound.,3,10,-7,20,0.32632955348106696,0.32632955348106696,Texas,Nebraska,6,6,NA,280640251,2008-03-04
32,1,14:06,2046,2046,D.J. Augustin made Two Point Jumper.,5,10,-5,17,0.3722402143529424,0.3722402143529424,Texas,Nebraska,6,6,NA,280640251,2008-03-04
33,1,13:49,2029,2029,Foul on D.J. Augustin,5,10,-5,9,0.3712628064036471,0.3712628064036471,Texas,Nebraska,6,6,NA,280640251,2008-03-04
34,1,13:40,2020,2020,Aleks Maric missed Two Point Jumper.,5,10,-5,0,0.37074244052386013,0.37074244052386013,Texas,Nebraska,6,6,NA,280640251,2008-03-04
35,1,13:40,2020,2020,Gary Johnson Defensive Rebound.,5,10,-5,20,0.37074244052386013,0.37074244052386013,Texas,Nebraska,6,6,NA,280640251,2008-03-04
36,1,13:20,2000,2000,Connor Atchley missed Two Point Jumper.,5,10,-5,0,0.3695785231570212,0.3695785231570212,Texas,Nebraska,6,6,NA,280640251,2008-03-04
37,1,13:20,2000,2000,Aleks Maric Defensive Rebound.,5,10,-5,14,0.3695785231570212,0.3695785231570212,Texas,Nebraska,6,6,NA,280640251,2008-03-04
38,1,13:06,1986,1986,Aleks Maric missed Two Point Layup.,5,10,-5,2,0.36875733829461205,0.36875733829461205,Texas,Nebraska,6,6,NA,280640251,2008-03-04
39,1,13:04,1984,1984,Aleks Maric Offensive Rebound.,5,10,-5,2,0.3686395791775881,0.3686395791775881,Texas,Nebraska,6,6,NA,280640251,2008-03-04
40,1,13:02,1982,1982,Aleks Maric made Two Point Layup.,5,12,-7,24,0.31995262341248787,0.31995262341248787,Texas,Nebraska,6,6,NA,280640251,2008-03-04
41,1,12:38,1958,1958,Foul on Steve Harley,5,12,-7,8,0.3180906359943153,0.3180906359943153,Texas,Nebraska,6,6,NA,280640251,2008-03-04
42,1,12:30,1950,1950,D.J. Augustin missed Three Point Jumper.,5,12,-7,0,0.3174655982369925,0.3174655982369925,Texas,Nebraska,6,6,NA,280640251,2008-03-04
43,1,12:30,1950,1950,Justin Mason Offensive Rebound.,5,12,-7,6,0.3174655982369925,0.3174655982369925,Texas,Nebraska,6,6,NA,280640251,2008-03-04
44,1,12:24,1944,1944,Justin Mason made Two Point Jumper.  Assisted by D.J. Augustin.,7,12,-5,32,0.366259805546569,0.366259805546569,Texas,Nebraska,6,6,NA,280640251,2008-03-04
45,1,11:52,1912,1912,Jay-R Strowbridge missed Two Point Jumper.,7,12,-5,0,0.3643278343318931,0.3643278343318931,Texas,Nebraska,6,6,NA,280640251,2008-03-04
46,1,11:52,1912,1912,Damion James Defensive Rebound.,7,12,-5,8,0.3643278343318931,0.3643278343318931,Texas,Nebraska,6,6,NA,280640251,2008-03-04
47,1,11:44,1904,1904,Foul on Chris Balham,7,12,-5,0,0.36384566362422455,0.36384566362422455,Texas,Nebraska,6,6,NA,280640251,2008-03-04
48,1,11:44,1904,1904,Official TV Timeout.,7,12,-5,0,0.36384566362422455,0.36384566362422455,Texas,Nebraska,6,6,NA,280640251,2008-03-04
49,1,11:44,1904,1904,Damion James made Free Throw.,8,12,-4,0,0.3900816214472891,0.3900816214472891,Texas,Nebraska,6,6,NA,280640251,2008-03-04
50,1,11:44,1904,1904,Damion James missed Free Throw.,8,12,-4,0,0.3900816214472891,0.3900816214472891,Texas,Nebraska,6,6,NA,280640251,2008-03-04
51,1,11:44,1904,1904,Justin Mason Offensive Rebound.,8,12,-4,0,0.3900816214472891,0.3900816214472891,Texas,Nebraska,6,6,NA,280640251,2008-03-04
52,1,11:44,1904,1904,Damion James made Two Point Dunk Shot.  Assisted by Justin Mason.,10,12,-2,19,0.4443602439483665,0.4443602439483665,Texas,Nebraska,6,6,NA,280640251,2008-03-04
53,1,11:25,1885,1885,Foul on Damion James,10,12,-2,8,0.44387197012896384,0.44387197012896384,Texas,Nebraska,6,6,NA,280640251,2008-03-04
54,1,11:17,1877,1877,Steve Harley missed Two Point Jumper.,10,12,-2,2,0.4436662854058685,0.4436662854058685,Texas,Nebraska,6,6,NA,280640251,2008-03-04
55,1,11:15,1875,1875,Aleks Maric Offensive Rebound.,10,12,-2,11,0.4436148405043947,0.4436148405043947,Texas,Nebraska,6,6,NA,280640251,2008-03-04
56,1,11:04,1864,1864,Aleks Maric made Two Point Layup.  Assisted by Sek Henry.,10,14,-4,15,0.3881006644708327,0.3881006644708327,Texas,Nebraska,6,6,NA,280640251,2008-03-04
57,1,10:49,1849,1849,Damion James made Two Point Jumper.  Assisted by D.J. Augustin.,12,14,-2,34,0.4429445225373313,0.4429445225373313,Texas,Nebraska,6,6,NA,280640251,2008-03-04
58,1,10:15,1815,1815,Steve Harley missed Three Point Jumper.,12,14,-2,0,0.44206041903984117,0.44206041903984117,Texas,Nebraska,6,6,NA,280640251,2008-03-04
59,1,10:15,1815,1815,Damion James Defensive Rebound.,12,14,-2,3,0.44206041903984117,0.44206041903984117,Texas,Nebraska,6,6,NA,280640251,2008-03-04
60,1,10:12,1812,1812,Foul on Sek Henry,12,14,-2,8,0.4419818212856992,0.4419818212856992,Texas,Nebraska,6,6,NA,280640251,2008-03-04
61,1,10:04,1804,1804,D.J. Augustin made Two Point Jumper.,14,14,0,20,0.5,0.5,Texas,Nebraska,6,6,NA,280640251,2008-03-04
62,1,9:44,1784,1784,Foul on Sek Henry,14,14,0,20,0.5,0.5,Texas,Nebraska,6,6,NA,280640251,2008-03-04
63,1,9:24,1764,1764,D.J. Augustin missed Three Point Jumper.,14,14,0,0,0.5,0.5,Texas,Nebraska,6,6,NA,280640251,2008-03-04
64,1,9:24,1764,1764,Damion James Offensive Rebound.,14,14,0,10,0.5,0.5,Texas,Nebraska,6,6,NA,280640251,2008-03-04
65,1,9:14,1754,1754,A.J. Abrams made Two Point Jumper.,16,14,2,8,0.5595650718504439,0.5595650718504439,Texas,Nebraska,6,6,NA,280640251,2008-03-04
66,1,9:06,1746,1746,Nebraska 30 Second Timeout.,16,14,2,21,0.559783444160035,0.559783444160035,Texas,Nebraska,6,5,NA,280640251,2008-03-04
67,1,8:45,1725,1725,Ryan Anderson made Three Point Jumper.  Assisted by Steve Harley.,16,17,-1,15,0.4697073170370531,0.4697073170370531,Texas,Nebraska,6,5,NA,280640251,2008-03-04
68,1,8:30,1710,1710,Damion James made Two Point Jumper.,18,17,1,22,0.5305057598089804,0.5305057598089804,Texas,Nebraska,6,5,NA,280640251,2008-03-04
69,1,8:08,1688,1688,Ryan Anderson made Three Point Jumper.  Assisted by Aleks Maric.,18,20,-2,12,0.43858513869758936,0.43858513869758936,Texas,Nebraska,6,5,NA,280640251,2008-03-04
70,1,7:56,1676,1676,D.J. Augustin made Three Point Jumper.,21,20,1,36,0.530997334035867,0.530997334035867,Texas,Nebraska,6,5,NA,280640251,2008-03-04
71,1,7:20,1640,1640,Paul Velander missed Three Point Jumper.,21,20,1,0,0.53150149162019,0.53150149162019,Texas,Nebraska,6,5,NA,280640251,2008-03-04
72,1,7:20,1640,1640,Damion James Defensive Rebound.,21,20,1,5,0.53150149162019,0.53150149162019,Texas,Nebraska,6,5,NA,280640251,2008-03-04
73,1,7:15,1635,1635,Foul on Steve Harley,21,20,1,0,0.5315701792514003,0.5315701792514003,Texas,Nebraska,6,5,NA,280640251,2008-03-04
74,1,7:15,1635,1635,Official TV Timeout.,21,20,1,0,0.5315701792514003,0.5315701792514003,Texas,Nebraska,6,5,NA,280640251,2008-03-04
75,1,7:15,1635,1635,A.J. Abrams made Free Throw.,22,20,2,0,0.5628896360842337,0.5628896360842337,Texas,Nebraska,6,5,NA,280640251,2008-03-04
76,1,7:15,1635,1635,A.J. Abrams made Free Throw.,23,20,3,0,0.5937155500221006,0.5937155500221006,Texas,Nebraska,6,5,NA,280640251,2008-03-04
77,1,7:15,1635,1635,A.J. Abrams missed Free Throw.,23,20,3,0,0.5937155500221006,0.5937155500221006,Texas,Nebraska,6,5,NA,280640251,2008-03-04
78,1,7:15,1635,1635,Paul Velander Defensive Rebound.,23,20,3,37,0.5937155500221006,0.5937155500221006,Texas,Nebraska,6,5,NA,280640251,2008-03-04
79,1,6:38,1598,1598,Gary Johnson made Two Point Jumper.,25,20,5,27,0.6552867724825838,0.6552867724825838,Texas,Nebraska,6,5,NA,280640251,2008-03-04
80,1,6:11,1571,1571,Paul Velander missed Three Point Jumper.,25,20,5,0,0.6569541507530707,0.6569541507530707,Texas,Nebraska,6,5,NA,280640251,2008-03-04
81,1,6:11,1571,1571,A.J. Abrams Defensive Rebound.,25,20,5,0,0.6569541507530707,0.6569541507530707,Texas,Nebraska,6,5,NA,280640251,2008-03-04
82,1,6:11,1571,1571,Foul on Ade Dagunduro,25,20,5,0,0.6569541507530707,0.6569541507530707,Texas,Nebraska,6,5,NA,280640251,2008-03-04
83,1,6:11,1571,1571,A.J. Abrams missed Free Throw.,25,20,5,0,0.6569541507530707,0.6569541507530707,Texas,Nebraska,6,5,NA,280640251,2008-03-04
84,1,6:11,1571,1571,Paul Velander Defensive Rebound.,25,20,5,37,0.6569541507530707,0.6569541507530707,Texas,Nebraska,6,5,NA,280640251,2008-03-04
85,1,5:34,1534,1534,Paul Velander missed Three Point Jumper.,25,20,5,0,0.6592847776111121,0.6592847776111121,Texas,Nebraska,6,5,NA,280640251,2008-03-04
86,1,5:34,1534,1534,D.J. Augustin Defensive Rebound.,25,20,5,25,0.6592847776111121,0.6592847776111121,Texas,Nebraska,6,5,NA,280640251,2008-03-04
87,1,5:09,1509,1509,Damion James missed Two Point Jumper.,25,20,5,0,0.6609175441371675,0.6609175441371675,Texas,Nebraska,6,5,NA,280640251,2008-03-04
88,1,5:09,1509,1509,null,25,20,5,0,0.6609175441371675,0.6609175441371675,Texas,Nebraska,6,5,NA,280640251,2008-03-04
89,1,5:09,1509,1509,Foul on Ade Dagunduro,25,20,5,0,0.6609175441371675,0.6609175441371675,Texas,Nebraska,6,5,NA,280640251,2008-03-04
90,1,5:09,1509,1509,Gary Johnson made Free Throw.,26,20,6,0,0.6901590405999216,0.6901590405999216,Texas,Nebraska,6,5,NA,280640251,2008-03-04
91,1,5:09,1509,1509,Gary Johnson made Free Throw.,27,20,7,27,0.7179549652122187,0.7179549652122187,Texas,Nebraska,6,5,NA,280640251,2008-03-04
92,1,4:42,1482,1482,Ryan Anderson missed Three Point Jumper.,27,20,7,0,0.7202811941489777,0.7202811941489777,Texas,Nebraska,6,5,NA,280640251,2008-03-04
93,1,4:42,1482,1482,A.J. Abrams Defensive Rebound.,27,20,7,7,0.7202811941489777,0.7202811941489777,Texas,Nebraska,6,5,NA,280640251,2008-03-04
94,1,4:35,1475,1475,A.J. Abrams missed Three Point Jumper.,27,20,7,0,0.7209035251850643,0.7209035251850643,Texas,Nebraska,6,5,NA,280640251,2008-03-04
95,1,4:35,1475,1475,Paul Velander Defensive Rebound.,27,20,7,22,0.7209035251850643,0.7209035251850643,Texas,Nebraska,6,5,NA,280640251,2008-03-04
96,1,4:13,1453,1453,Paul Velander missed Three Point Jumper.,27,20,7,0,0.7229195537894483,0.7229195537894483,Texas,Nebraska,6,5,NA,280640251,2008-03-04
97,1,4:13,1453,1453,Damion James Defensive Rebound.,27,20,7,8,0.7229195537894483,0.7229195537894483,Texas,Nebraska,6,5,NA,280640251,2008-03-04
98,1,4:05,1445,1445,D.J. Augustin made Two Point Jumper.,29,20,9,3,0.7751841439259055,0.7751841439259055,Texas,Nebraska,6,5,NA,280640251,2008-03-04
99,1,4:02,1442,1442,Nebraska 30 Second Timeout.,29,20,9,11,0.7754967094832845,0.7754967094832845,Texas,Nebraska,6,4,NA,280640251,2008-03-04
100,1,3:51,1431,1431,Foul on Dexter Pittman,29,20,9,0,0.7766236977814414,0.7766236977814414,Texas,Nebraska,6,4,NA,280640251,2008-03-04
101,1,3:51,1431,1431,Official TV Timeout.,29,20,9,8,0.7766236977814414,0.7766236977814414,Texas,Nebraska,6,4,NA,280640251,2008-03-04
102,1,3:43,1423,1423,Damion James made Two Point Dunk Shot.,31,20,11,36,0.8218117489808014,0.8218117489808014,Texas,Nebraska,6,4,NA,280640251,2008-03-04
103,1,3:07,1387,1387,D.J. Augustin made Two Point Layup.,33,20,13,3,0.8624552567085991,0.8624552567085991,Texas,Nebraska,6,4,NA,280640251,2008-03-04
104,1,3:04,1384,1384,Nebraska 30 Second Timeout.,33,20,13,25,0.8627388947261797,0.8627388947261797,Texas,Nebraska,6,3,NA,280640251,2008-03-04
105,1,2:39,1359,1359,Jay-R Strowbridge made Two Point Layup.,33,22,11,38,0.8281034922503536,0.8281034922503536,Texas,Nebraska,6,3,NA,280640251,2008-03-04
106,1,2:01,1321,1321,Ryan Anderson missed Two Point Jumper.,33,22,11,0,0.831767885515274,0.831767885515274,Texas,Nebraska,6,3,NA,280640251,2008-03-04
107,1,2:01,1321,1321,Gary Johnson Defensive Rebound.,33,22,11,4,0.831767885515274,0.831767885515274,Texas,Nebraska,6,3,NA,280640251,2008-03-04
108,1,1:57,1317,1317,Foul on D.J. Augustin,33,22,11,0,0.8321594859479704,0.8321594859479704,Texas,Nebraska,6,3,NA,280640251,2008-03-04
109,1,1:57,1317,1317,Nebraska 30 Second Timeout.,33,22,11,36,0.8321594859479704,0.8321594859479704,Texas,Nebraska,6,2,NA,280640251,2008-03-04
110,1,1:21,1281,1281,Damion James made Three Point Jumper.  Assisted by Justin Mason.,36,22,14,16,0.8880518477610754,0.8880518477610754,Texas,Nebraska,6,2,NA,280640251,2008-03-04
111,1,1:05,1265,1265,Damion James made Free Throw.,37,22,15,0,0.9034194916919295,0.9034194916919295,Texas,Nebraska,6,2,NA,280640251,2008-03-04
112,1,1:05,1265,1265,Foul on Ryan Anderson,37,22,15,0,0.9034194916919295,0.9034194916919295,Texas,Nebraska,6,2,NA,280640251,2008-03-04
113,1,1:05,1265,1265,Damion James made Free Throw.,38,22,16,12,0.9156658065519034,0.9156658065519034,Texas,Nebraska,6,2,NA,280640251,2008-03-04
114,1,0:53,1253,1253,Aleks Maric made Two Point Layup.  Assisted by Jay-R Strowbridge.,38,24,14,26,0.8908114299063696,0.8908114299063696,Texas,Nebraska,6,2,NA,280640251,2008-03-04
115,1,0:27,1227,1227,Gary Johnson missed Two Point Jumper.,38,24,14,0,0.8935341766003493,0.8935341766003493,Texas,Nebraska,6,2,NA,280640251,2008-03-04
116,1,0:27,1227,1227,Ryan Anderson Defensive Rebound.,38,24,14,18,0.8935341766003493,0.8935341766003493,Texas,Nebraska,6,2,NA,280640251,2008-03-04
117,1,0:09,1209,1209,Foul on Connor Atchley,38,24,14,0,0.8955267740623751,0.8955267740623751,Texas,Nebraska,6,2,NA,280640251,2008-03-04
118,1,0:09,1209,1209,Aleks Maric missed Free Throw.,38,24,14,0,0.8955267740623751,0.8955267740623751,Texas,Nebraska,6,2,NA,280640251,2008-03-04
119,1,0:09,1209,1209,null,38,24,14,0,0.8955267740623751,0.8955267740623751,Texas,Nebraska,6,2,NA,280640251,2008-03-04
120,1,0:09,1209,1209,Aleks Maric made Free Throw.,38,25,13,6,0.8802730428970013,0.8802730428970013,Texas,Nebraska,6,2,NA,280640251,2008-03-04
121,1,0:03,1203,1203,A.J. Abrams missed Three Point Jumper.,38,25,13,0,0.8809741083872257,0.8809741083872257,Texas,Nebraska,6,2,NA,280640251,2008-03-04
122,1,0:03,1203,1203,Damion James Offensive Rebound.,38,25,13,3,0.8809741083872257,0.8809741083872257,Texas,Nebraska,6,2,NA,280640251,2008-03-04
123,1,0:00,1200,1200,End of the 1st Half.,38,25,13,0,0.881320024494264,0.881320024494264,Texas,Nebraska,6,2,NA,280640251,2008-03-04
124,2,20:00,1200,1200,PLAY,38,25,13,12,0.881320024494264,0.881320024494264,Texas,Nebraska,6,2,NA,280640251,2008-03-04
125,2,19:48,1188,1188,Connor Atchley made Three Point Jumper.  Assisted by Damion James.,41,25,16,14,0.9229920039897161,0.9229920039897161,Texas,Nebraska,6,2,NA,280640251,2008-03-04
126,2,19:34,1174,1174,Foul on Justin Mason,41,25,16,0,0.9242837199547819,0.9242837199547819,Texas,Nebraska,6,2,NA,280640251,2008-03-04
127,2,19:34,1174,1174,Sek Henry missed Free Throw.,41,25,16,0,0.9242837199547819,0.9242837199547819,Texas,Nebraska,6,2,NA,280640251,2008-03-04
128,2,19:34,1174,1174,null,41,25,16,0,0.9242837199547819,0.9242837199547819,Texas,Nebraska,6,2,NA,280640251,2008-03-04
129,2,19:34,1174,1174,Sek Henry made Free Throw.,41,26,15,20,0.912587786173853,0.912587786173853,Texas,Nebraska,6,2,NA,280640251,2008-03-04
130,2,19:14,1154,1154,Damion James made Two Point Jumper.,43,26,17,13,0.9361759140985331,0.9361759140985331,Texas,Nebraska,6,2,NA,280640251,2008-03-04
131,2,19:01,1141,1141,Foul on A.J. Abrams,43,26,17,11,0.9372164385956021,0.9372164385956021,Texas,Nebraska,6,2,NA,280640251,2008-03-04
132,2,18:50,1130,1130,Ade Dagunduro missed Two Point Jumper.,43,26,17,2,0.9380833773380832,0.9380833773380832,Texas,Nebraska,6,2,NA,280640251,2008-03-04
133,2,18:48,1128,1128,Ade Dagunduro Offensive Rebound.,43,26,17,2,0.9382399896124729,0.9382399896124729,Texas,Nebraska,6,2,NA,280640251,2008-03-04
134,2,18:46,1126,1126,Ade Dagunduro made Two Point Layup.,43,28,15,3,0.9170592184840938,0.9170592184840938,Texas,Nebraska,6,2,NA,280640251,2008-03-04
135,2,18:43,1123,1123,Steve Harley made Two Point Layup.,43,30,13,22,0.8895095694606283,0.8895095694606283,Texas,Nebraska,6,2,NA,280640251,2008-03-04
136,2,18:21,1101,1101,Foul on Aleks Maric,43,30,13,0,0.8917463078984739,0.8917463078984739,Texas,Nebraska,6,2,NA,280640251,2008-03-04
137,2,18:21,1101,1101,Damion James missed Free Throw.,43,30,13,0,0.8917463078984739,0.8917463078984739,Texas,Nebraska,6,2,NA,280640251,2008-03-04
138,2,18:21,1101,1101,null,43,30,13,0,0.8917463078984739,0.8917463078984739,Texas,Nebraska,6,2,NA,280640251,2008-03-04
139,2,18:21,1101,1101,Damion James missed Free Throw.,43,30,13,0,0.8917463078984739,0.8917463078984739,Texas,Nebraska,6,2,NA,280640251,2008-03-04
140,2,18:21,1101,1101,Aleks Maric Defensive Rebound.,43,30,13,19,0.8917463078984739,0.8917463078984739,Texas,Nebraska,6,2,NA,280640251,2008-03-04
141,2,18:02,1082,1082,Ryan Anderson made Three Point Jumper.  Assisted by Steve Harley.,43,33,10,35,0.837224968846611,0.837224968846611,Texas,Nebraska,6,2,NA,280640251,2008-03-04
142,2,17:27,1047,1047,D.J. Augustin made Two Point Jumper.,45,33,12,34,0.880982264072459,0.880982264072459,Texas,Nebraska,6,2,NA,280640251,2008-03-04
143,2,16:53,1013,1013,Ryan Anderson missed Three Point Jumper.,45,33,12,0,0.8850070461734968,0.8850070461734968,Texas,Nebraska,6,2,NA,280640251,2008-03-04
144,2,16:53,1013,1013,Justin Mason Defensive Rebound.,45,33,12,17,0.8850070461734968,0.8850070461734968,Texas,Nebraska,6,2,NA,280640251,2008-03-04
145,2,16:36,996,996,D.J. Augustin missed Three Point Jumper.,45,33,12,0,0.8871453080307886,0.8871453080307886,Texas,Nebraska,6,2,NA,280640251,2008-03-04
146,2,16:36,996,996,Aleks Maric Defensive Rebound.,45,33,12,22,0.8871453080307886,0.8871453080307886,Texas,Nebraska,6,2,NA,280640251,2008-03-04
147,2,16:14,974,974,Steve Harley missed Three Point Jumper.,45,33,12,0,0.890059452788824,0.890059452788824,Texas,Nebraska,6,2,NA,280640251,2008-03-04
148,2,16:14,974,974,Damion James Defensive Rebound.,45,33,12,16,0.890059452788824,0.890059452788824,Texas,Nebraska,6,2,NA,280640251,2008-03-04
149,2,15:58,958,958,Official TV Timeout.,45,33,12,27,0.8921979261062103,0.8921979261062103,Texas,Nebraska,6,2,NA,280640251,2008-03-04
150,2,15:31,931,931,Paul Velander made Three Point Jumper.  Assisted by Ryan Anderson.,45,36,9,14,0.8334195002426246,0.8334195002426246,Texas,Nebraska,6,2,NA,280640251,2008-03-04
151,2,15:17,917,917,A.J. Abrams missed Three Point Jumper.,45,36,9,0,0.835060853567401,0.835060853567401,Texas,Nebraska,6,2,NA,280640251,2008-03-04
152,2,15:17,917,917,D.J. Augustin Offensive Rebound.,45,36,9,32,0.835060853567401,0.835060853567401,Texas,Nebraska,6,2,NA,280640251,2008-03-04
153,2,14:45,885,885,Foul on Justin Mason,45,36,9,5,0.8385568563158706,0.8385568563158706,Texas,Nebraska,6,2,NA,280640251,2008-03-04
154,2,14:40,880,880,Steve Harley made Three Point Jumper.  Assisted by Aleks Maric.,45,39,6,18,0.7504413235086497,0.7504413235086497,Texas,Nebraska,6,2,NA,280640251,2008-03-04
155,2,14:22,862,862,A.J. Abrams made Two Point Jumper.  Assisted by Justin Mason.,47,39,8,24,0.8146622772708156,0.8146622772708156,Texas,Nebraska,6,2,NA,280640251,2008-03-04
156,2,13:58,838,838,Aleks Maric missed Two Point Layup.,47,39,8,2,0.8173006669048773,0.8173006669048773,Texas,Nebraska,6,2,NA,280640251,2008-03-04
157,2,13:56,836,836,A.J. Abrams Defensive Rebound.,47,39,8,28,0.817528418878588,0.817528418878588,Texas,Nebraska,6,2,NA,280640251,2008-03-04
158,2,13:28,808,808,Damion James missed Two Point Jumper.,47,39,8,0,0.8209119366747984,0.8209119366747984,Texas,Nebraska,6,2,NA,280640251,2008-03-04
159,2,13:28,808,808,Steve Harley Defensive Rebound.,47,39,8,26,0.8209119366747984,0.8209119366747984,Texas,Nebraska,6,2,NA,280640251,2008-03-04
160,2,13:02,782,782,A.J. Abrams missed Two Point Jumper.,47,39,8,0,0.8244907536315783,0.8244907536315783,Texas,Nebraska,6,2,NA,280640251,2008-03-04
161,2,13:02,782,782,Nebraska Defensive Rebound.,47,39,8,8,0.8244907536315783,0.8244907536315783,Texas,Nebraska,6,2,NA,280640251,2008-03-04
162,2,12:54,774,774,Aleks Maric made Two Point Dunk Shot.  Assisted by Ryan Anderson.,47,41,6,20,0.7625273352154933,0.7625273352154933,Texas,Nebraska,6,2,NA,280640251,2008-03-04
163,2,12:34,754,754,Connor Atchley missed Two Point Jumper.,47,41,6,0,0.7656306656239187,0.7656306656239187,Texas,Nebraska,6,2,NA,280640251,2008-03-04
164,2,12:34,754,754,Steve Harley Defensive Rebound.,47,41,6,17,0.7656306656239187,0.7656306656239187,Texas,Nebraska,6,2,NA,280640251,2008-03-04
165,2,12:17,737,737,Paul Velander made Three Point Jumper.  Assisted by Jay-R Strowbridge.,47,44,3,29,0.6456980155569714,0.6456980155569714,Texas,Nebraska,6,2,NA,280640251,2008-03-04
166,2,11:48,708,708,D.J. Augustin made Three Point Jumper.,50,44,6,25,0.7737661401658625,0.7737661401658625,Texas,Nebraska,6,2,NA,280640251,2008-03-04
167,2,11:23,683,683,Aleks Maric missed Two Point Layup.,50,44,6,2,0.777532445615878,0.777532445615878,Texas,Nebraska,6,2,NA,280640251,2008-03-04
168,2,11:21,681,681,Aleks Maric Offensive Rebound.,50,44,6,2,0.7778157612021708,0.7778157612021708,Texas,Nebraska,6,2,NA,280640251,2008-03-04
169,2,11:19,679,679,Aleks Maric made Two Point Layup.,50,46,4,14,0.6977082640110623,0.6977082640110623,Texas,Nebraska,6,2,NA,280640251,2008-03-04
170,2,11:05,665,665,Official TV Timeout.,50,46,4,10,0.6992887028224141,0.6992887028224141,Texas,Nebraska,6,2,NA,280640251,2008-03-04
171,2,10:55,655,655,D.J. Augustin missed Two Point Jumper.,50,46,4,0,0.7004109803916463,0.7004109803916463,Texas,Nebraska,6,2,NA,280640251,2008-03-04
172,2,10:55,655,655,Ryan Anderson Defensive Rebound.,50,46,4,20,0.7004109803916463,0.7004109803916463,Texas,Nebraska,6,2,NA,280640251,2008-03-04
173,2,10:35,635,635,Steve Harley missed Two Point Jumper.,50,46,4,2,0.702720102943087,0.702720102943087,Texas,Nebraska,6,2,NA,280640251,2008-03-04
174,2,10:33,633,633,null,50,46,4,10,0.7029600302274658,0.7029600302274658,Texas,Nebraska,6,2,NA,280640251,2008-03-04
175,2,10:23,623,623,Foul on Paul Velander,50,46,4,1,0.7041958060972962,0.7041958060972962,Texas,Nebraska,6,2,NA,280640251,2008-03-04
176,2,10:22,622,622,Foul on Connor Atchley,50,46,4,13,0.7043231228705029,0.7043231228705029,Texas,Nebraska,6,2,NA,280640251,2008-03-04
