play_id,half,time_remaining_half,secs_remaining,secs_remaining_absolute,description,home_score,away_score,score_diff,play_length,win_prob,naive_win_prob,home,away,home_time_out_remaining,away_time_out_remaining,home_favored_by,game_id,date
1,1,20:00,2400,2400,PLAY,0,0,0,15,0.5,0.5,West Virginia,Providence,4,4,NA,280720277,2008-03-12
2,1,19:45,2385,2385,Jamie Smalligan made Three Point Jumper.  Assisted by Darris Nichols.,3,0,3,56,0.5662953281641947,0.5662953281641947,West Virginia,Providence,4,4,NA,280720277,2008-03-12
3,1,18:49,2329,2329,Alex Ruoff missed Three Point Jumper.,3,0,3,0,0.5680860791706658,0.5680860791706658,West Virginia,Providence,4,4,NA,280720277,2008-03-12
4,1,18:49,2329,2329,Jamie Smalligan Offensive Rebound.,3,0,3,5,0.5680860791706658,0.5680860791706658,West Virginia,Providence,4,4,NA,280720277,2008-03-12
5,1,18:44,2324,2324,Alex Ruoff missed Three Point Jumper.,3,0,3,0,0.5682487856581603,0.5682487856581603,West Virginia,Providence,4,4,NA,280720277,2008-03-12
6,1,18:44,2324,2324,Brian McKenzie Defensive Rebound.,3,0,3,9,0.5682487856581603,0.5682487856581603,West Virginia,Providence,4,4,NA,280720277,2008-03-12
7,1,18:35,2315,2315,Weyinmi Efejuku missed Three Point Jumper.,3,0,3,0,0.5685427055409771,0.5685427055409771,West Virginia,Providence,4,4,NA,280720277,2008-03-12
8,1,18:35,2315,2315,Da'Sean Butler Defensive Rebound.,3,0,3,34,0.5685427055409771,0.5685427055409771,West Virginia,Providence,4,4,NA,280720277,2008-03-12
9,1,18:01,2281,2281,Darris Nichols made Two Point Jumper.,5,0,5,20,0.6147846392945955,0.6147846392945955,West Virginia,Providence,4,4,NA,280720277,2008-03-12
10,1,17:41,2261,2261,Foul on Jamie Smalligan,5,0,5,9,0.6158584986535243,0.6158584986535243,West Virginia,Providence,4,4,NA,280720277,2008-03-12
11,1,17:32,2252,2252,Foul on Alex Ruoff,5,0,5,0,0.6163440362323678,0.6163440362323678,West Virginia,Providence,4,4,NA,280720277,2008-03-12
12,1,17:32,2252,2252,Weyinmi Efejuku made Free Throw.,5,1,4,0,0.5936915402480989,0.5936915402480989,West Virginia,Providence,4,4,NA,280720277,2008-03-12
13,1,17:32,2252,2252,Weyinmi Efejuku missed Free Throw.,5,1,4,0,0.5936915402480989,0.5936915402480989,West Virginia,Providence,4,4,NA,280720277,2008-03-12
14,1,17:32,2252,2252,Alex Ruoff Defensive Rebound.,5,1,4,17,0.5936915402480989,0.5936915402480989,West Virginia,Providence,4,4,NA,280720277,2008-03-12
15,1,17:15,2235,2235,Alex Ruoff missed Three Point Jumper.,5,1,4,0,0.5944429487392987,0.5944429487392987,West Virginia,Providence,4,4,NA,280720277,2008-03-12
16,1,17:15,2235,2235,Jamie Smalligan Offensive Rebound.,5,1,4,14,0.5944429487392987,0.5944429487392987,West Virginia,Providence,4,4,NA,280720277,2008-03-12
17,1,17:01,2221,2221,Randall Hanke made Two Point Layup.,5,3,2,5,0.5479697085553288,0.5479697085553288,West Virginia,Providence,4,4,NA,280720277,2008-03-12
18,1,16:56,2216,2216,West Virginia Full Timeout.,5,3,2,17,0.548084061544881,0.548084061544881,West Virginia,Providence,3,4,NA,280720277,2008-03-12
19,1,16:39,2199,2199,Da'Sean Butler made Two Point Layup.,7,3,4,25,0.5960451058566135,0.5960451058566135,West Virginia,Providence,3,4,NA,280720277,2008-03-12
20,1,16:14,2174,2174,Weyinmi Efejuku made Three Point Jumper.,7,6,1,14,0.5245841565133473,0.5245841565133473,West Virginia,Providence,3,4,NA,280720277,2008-03-12
21,1,16:00,2160,2160,Da'Sean Butler made Two Point Layup.,9,6,3,28,0.5737601383043379,0.5737601383043379,West Virginia,Providence,3,4,NA,280720277,2008-03-12
22,1,15:32,2132,2132,Brian McKenzie missed Two Point Jumper.,9,6,3,3,0.5747259452953509,0.5747259452953509,West Virginia,Providence,3,4,NA,280720277,2008-03-12
23,1,15:29,2129,2129,Providence Offensive Rebound.,9,6,3,9,0.5748299713663794,0.5748299713663794,West Virginia,Providence,3,4,NA,280720277,2008-03-12
24,1,15:20,2120,2120,Weyinmi Efejuku missed Two Point Layup.,9,6,3,0,0.5751427199016728,0.5751427199016728,West Virginia,Providence,3,4,NA,280720277,2008-03-12
25,1,15:20,2120,2120,Darris Nichols Defensive Rebound.,9,6,3,36,0.5751427199016728,0.5751427199016728,West Virginia,Providence,3,4,NA,280720277,2008-03-12
26,1,14:44,2084,2084,Joe Alexander made Two Point Jumper.,11,6,5,23,0.6255993843299188,0.6255993843299188,West Virginia,Providence,3,4,NA,280720277,2008-03-12
27,1,14:21,2061,2061,Geoff McDermott made Two Point Layup.,11,8,3,28,0.5772201884972024,0.5772201884972024,West Virginia,Providence,3,4,NA,280720277,2008-03-12
28,1,13:53,2033,2033,Alex Ruoff missed Three Point Jumper.,11,8,3,0,0.5782245431231972,0.5782245431231972,West Virginia,Providence,3,4,NA,280720277,2008-03-12
29,1,13:53,2033,2033,Joe Alexander Offensive Rebound.,11,8,3,9,0.5782245431231972,0.5782245431231972,West Virginia,Providence,3,4,NA,280720277,2008-03-12
30,1,13:44,2024,2024,Brian McKenzie made Two Point Layup.  Assisted by Jeff Xavier.,11,10,1,17,0.5263775259672235,0.5263775259672235,West Virginia,Providence,3,4,NA,280720277,2008-03-12
31,1,13:27,2007,2007,Joe Alexander made Two Point Dunk Shot.  Assisted by Alex Ruoff.,13,10,3,18,0.5791690721718554,0.5791690721718554,West Virginia,Providence,3,4,NA,280720277,2008-03-12
32,1,13:09,1989,1989,Geoff McDermott missed Two Point Jumper.,13,10,3,0,0.5798301585044262,0.5798301585044262,West Virginia,Providence,3,4,NA,280720277,2008-03-12
33,1,13:09,1989,1989,Geoff McDermott Offensive Rebound.,13,10,3,6,0.5798301585044262,0.5798301585044262,West Virginia,Providence,3,4,NA,280720277,2008-03-12
34,1,13:03,1983,1983,Weyinmi Efejuku made Two Point Layup.,13,12,1,24,0.5268895638080849,0.5268895638080849,West Virginia,Providence,3,4,NA,280720277,2008-03-12
35,1,12:39,1959,1959,Alex Ruoff missed Three Point Jumper.,13,12,1,0,0.5271945989230387,0.5271945989230387,West Virginia,Providence,3,4,NA,280720277,2008-03-12
36,1,12:39,1959,1959,Providence Defensive Rebound.,13,12,1,11,0.5271945989230387,0.5271945989230387,West Virginia,Providence,3,4,NA,280720277,2008-03-12
37,1,12:28,1948,1948,Jamine Peterson made Two Point Layup.  Assisted by Geoff McDermott.,13,14,-1,24,0.4726642009187456,0.4726642009187456,West Virginia,Providence,3,4,NA,280720277,2008-03-12
38,1,12:04,1924,1924,Joe Alexander missed Two Point Jumper.,13,14,-1,0,0.4723531352844477,0.4723531352844477,West Virginia,Providence,3,4,NA,280720277,2008-03-12
39,1,12:04,1924,1924,Jeff Xavier Defensive Rebound.,13,14,-1,14,0.4723531352844477,0.4723531352844477,West Virginia,Providence,3,4,NA,280720277,2008-03-12
40,1,11:50,1910,1910,Geoff McDermott made Two Point Layup.,13,16,-3,20,0.41719722350695226,0.41719722350695226,West Virginia,Providence,3,4,NA,280720277,2008-03-12
41,1,11:30,1890,1890,Wellington Smith missed Two Point Jumper.,13,16,-3,9,0.41643809097700407,0.41643809097700407,West Virginia,Providence,3,4,NA,280720277,2008-03-12
42,1,11:21,1881,1881,Charles Burch Defensive Rebound.,13,16,-3,0,0.4160965300080829,0.4160965300080829,West Virginia,Providence,3,4,NA,280720277,2008-03-12
43,1,11:21,1881,1881,Official TV Timeout.,13,16,-3,24,0.4160965300080829,0.4160965300080829,West Virginia,Providence,3,4,NA,280720277,2008-03-12
44,1,10:57,1857,1857,Charles Burch missed Three Point Jumper.,13,16,-3,0,0.4151842634937579,0.4151842634937579,West Virginia,Providence,3,4,NA,280720277,2008-03-12
45,1,10:57,1857,1857,Joe Alexander Defensive Rebound.,13,16,-3,3,0.4151842634937579,0.4151842634937579,West Virginia,Providence,3,4,NA,280720277,2008-03-12
46,1,10:54,1854,1854,Foul on Geoff McDermott,13,16,-3,25,0.41506997324697303,0.41506997324697303,West Virginia,Providence,3,4,NA,280720277,2008-03-12
47,1,10:29,1829,1829,Weyinmi Efejuku missed Two Point Layup.,13,16,-3,0,0.41411396404448386,0.41411396404448386,West Virginia,Providence,3,4,NA,280720277,2008-03-12
48,1,10:29,1829,1829,Jamine Peterson Offensive Rebound.,13,16,-3,14,0.41411396404448386,0.41411396404448386,West Virginia,Providence,3,4,NA,280720277,2008-03-12
49,1,10:15,1815,1815,Jamine Peterson made Two Point Tip Shot.,13,18,-5,20,0.35847015997633075,0.35847015997633075,West Virginia,Providence,3,4,NA,280720277,2008-03-12
50,1,9:55,1795,1795,Jamine Peterson missed Two Point Layup.,13,18,-5,2,0.3572442354307768,0.3572442354307768,West Virginia,Providence,3,4,NA,280720277,2008-03-12
51,1,9:53,1793,1793,Joe Mazzulla Defensive Rebound.,13,18,-5,5,0.35712099467262365,0.35712099467262365,West Virginia,Providence,3,4,NA,280720277,2008-03-12
52,1,9:48,1788,1788,Foul on Marshon Brooks,13,18,-5,0,0.356812322248681,0.356812322248681,West Virginia,Providence,3,4,NA,280720277,2008-03-12
53,1,9:48,1788,1788,Joe Alexander missed Free Throw.,13,18,-5,0,0.356812322248681,0.356812322248681,West Virginia,Providence,3,4,NA,280720277,2008-03-12
54,1,9:48,1788,1788,null,13,18,-5,0,0.356812322248681,0.356812322248681,West Virginia,Providence,3,4,NA,280720277,2008-03-12
55,1,9:48,1788,1788,Joe Alexander made Free Throw.,14,18,-4,11,0.3842893606884637,0.3842893606884637,West Virginia,Providence,3,4,NA,280720277,2008-03-12
56,1,9:37,1777,1777,Jamine Peterson missed Two Point Layup.,14,18,-4,0,0.383726655384583,0.383726655384583,West Virginia,Providence,3,4,NA,280720277,2008-03-12
57,1,9:37,1777,1777,Da'Sean Butler Defensive Rebound.,14,18,-4,21,0.383726655384583,0.383726655384583,West Virginia,Providence,3,4,NA,280720277,2008-03-12
58,1,9:16,1756,1756,Joe Alexander missed Two Point Jumper.,14,18,-4,0,0.3826411227418525,0.3826411227418525,West Virginia,Providence,3,4,NA,280720277,2008-03-12
59,1,9:16,1756,1756,Jamine Peterson Defensive Rebound.,14,18,-4,22,0.3826411227418525,0.3826411227418525,West Virginia,Providence,3,4,NA,280720277,2008-03-12
60,1,8:54,1734,1734,Weyinmi Efejuku missed Two Point Jumper.,14,18,-4,0,0.3814855746553345,0.3814855746553345,West Virginia,Providence,3,4,NA,280720277,2008-03-12
61,1,8:54,1734,1734,Providence Offensive Rebound.,14,18,-4,1,0.3814855746553345,0.3814855746553345,West Virginia,Providence,3,4,NA,280720277,2008-03-12
62,1,8:53,1733,1733,Foul on John Flowers,14,18,-4,2,0.38143255590943487,0.38143255590943487,West Virginia,Providence,3,4,NA,280720277,2008-03-12
63,1,8:51,1731,1731,Randall Hanke made Two Point Layup.,14,20,-6,27,0.3260987566548157,0.3260987566548157,West Virginia,Providence,3,4,NA,280720277,2008-03-12
64,1,8:24,1704,1704,Foul on Randall Hanke,14,20,-6,0,0.324071432505575,0.324071432505575,West Virginia,Providence,3,4,NA,280720277,2008-03-12
65,1,8:24,1704,1704,Da'Sean Butler missed Free Throw.,14,20,-6,0,0.324071432505575,0.324071432505575,West Virginia,Providence,3,4,NA,280720277,2008-03-12
66,1,8:24,1704,1704,null,14,20,-6,0,0.324071432505575,0.324071432505575,West Virginia,Providence,3,4,NA,280720277,2008-03-12
67,1,8:24,1704,1704,Da'Sean Butler made Free Throw.,15,20,-5,22,0.351465677938289,0.351465677938289,West Virginia,Providence,3,4,NA,280720277,2008-03-12
68,1,8:02,1682,1682,Foul on Joe Alexander,15,20,-5,0,0.3500062060827957,0.3500062060827957,West Virginia,Providence,3,4,NA,280720277,2008-03-12
69,1,8:02,1682,1682,Geoff McDermott made Free Throw.,15,21,-6,0,0.3223890373969738,0.3223890373969738,West Virginia,Providence,3,4,NA,280720277,2008-03-12
70,1,8:02,1682,1682,Geoff McDermott made Free Throw.,15,22,-7,31,0.29595878355556327,0.29595878355556327,West Virginia,Providence,3,4,NA,280720277,2008-03-12
71,1,7:31,1651,1651,Randall Hanke missed Two Point Jumper.,15,22,-7,0,0.29339808044061705,0.29339808044061705,West Virginia,Providence,3,4,NA,280720277,2008-03-12
72,1,7:31,1651,1651,Randall Hanke Offensive Rebound.,15,22,-7,5,0.29339808044061705,0.29339808044061705,West Virginia,Providence,3,4,NA,280720277,2008-03-12
73,1,7:26,1646,1646,Randall Hanke missed Two Point Tip Shot.,15,22,-7,0,0.2929944187556099,0.2929944187556099,West Virginia,Providence,3,4,NA,280720277,2008-03-12
74,1,7:26,1646,1646,Da'Sean Butler Defensive Rebound.,15,22,-7,12,0.2929944187556099,0.2929944187556099,West Virginia,Providence,3,4,NA,280720277,2008-03-12
75,1,7:14,1634,1634,Official TV Timeout.,15,22,-7,32,0.29203356147935633,0.29203356147935633,West Virginia,Providence,3,4,NA,280720277,2008-03-12
76,1,6:42,1602,1602,Randall Hanke made Two Point Dunk Shot.,15,24,-9,24,0.23970720816494415,0.23970720816494415,West Virginia,Providence,3,4,NA,280720277,2008-03-12
77,1,6:18,1578,1578,Da'Sean Butler made Two Point Jumper.,17,24,-7,15,0.28762300583797284,0.28762300583797284,West Virginia,Providence,3,4,NA,280720277,2008-03-12
78,1,6:03,1563,1563,Charles Burch missed Three Point Jumper.,17,24,-7,0,0.28643875783031864,0.28643875783031864,West Virginia,Providence,3,4,NA,280720277,2008-03-12
79,1,6:03,1563,1563,Randall Hanke Offensive Rebound.,17,24,-7,4,0.28643875783031864,0.28643875783031864,West Virginia,Providence,3,4,NA,280720277,2008-03-12
80,1,5:59,1559,1559,Randall Hanke missed Two Point Layup.,17,24,-7,0,0.2861212680333814,0.2861212680333814,West Virginia,Providence,3,4,NA,280720277,2008-03-12
81,1,5:59,1559,1559,Alex Ruoff Defensive Rebound.,17,24,-7,16,0.2861212680333814,0.2861212680333814,West Virginia,Providence,3,4,NA,280720277,2008-03-12
82,1,5:43,1543,1543,Darris Nichols missed Two Point Jumper.,17,24,-7,0,0.28484131469992835,0.28484131469992835,West Virginia,Providence,3,4,NA,280720277,2008-03-12
83,1,5:43,1543,1543,Brian McKenzie Defensive Rebound.,17,24,-7,12,0.28484131469992835,0.28484131469992835,West Virginia,Providence,3,4,NA,280720277,2008-03-12
84,1,5:31,1531,1531,Charles Burch made Two Point Layup.  Assisted by Geoff McDermott.,17,26,-9,27,0.23330515089684373,0.23330515089684373,West Virginia,Providence,3,4,NA,280720277,2008-03-12
85,1,5:04,1504,1504,Joe Alexander made Two Point Jumper.,19,26,-7,31,0.2816223666140674,0.2816223666140674,West Virginia,Providence,3,4,NA,280720277,2008-03-12
86,1,4:33,1473,1473,Foul on Alex Ruoff,19,26,-7,20,0.278917054993723,0.278917054993723,West Virginia,Providence,3,4,NA,280720277,2008-03-12
87,1,4:13,1453,1453,Foul on Charles Burch,19,26,-7,0,0.2770804462105517,0.2770804462105517,West Virginia,Providence,3,4,NA,280720277,2008-03-12
88,1,4:13,1453,1453,Wellington Smith made Free Throw.,20,26,-6,0,0.30534108662003623,0.30534108662003623,West Virginia,Providence,3,4,NA,280720277,2008-03-12
89,1,4:13,1453,1453,Wellington Smith made Free Throw.,21,26,-5,13,0.3351478508169386,0.3351478508169386,West Virginia,Providence,3,4,NA,280720277,2008-03-12
90,1,4:00,1440,1440,Jamine Peterson missed Two Point Dunk Shot.,21,26,-5,0,0.3341809931825777,0.3341809931825777,West Virginia,Providence,3,4,NA,280720277,2008-03-12
91,1,4:00,1440,1440,Da'Sean Butler Defensive Rebound.,21,26,-5,6,0.3341809931825777,0.3341809931825777,West Virginia,Providence,3,4,NA,280720277,2008-03-12
92,1,3:54,1434,1434,Da'Sean Butler missed Two Point Jumper.,21,26,-5,0,0.33374350547552023,0.33374350547552023,West Virginia,Providence,3,4,NA,280720277,2008-03-12
93,1,3:54,1434,1434,Randall Hanke Defensive Rebound.,21,26,-5,2,0.33374350547552023,0.33374350547552023,West Virginia,Providence,3,4,NA,280720277,2008-03-12
94,1,3:52,1432,1432,Foul on Wellington Smith,21,26,-5,0,0.33359888600788673,0.33359888600788673,West Virginia,Providence,3,4,NA,280720277,2008-03-12
95,1,3:52,1432,1432,Official TV Timeout.,21,26,-5,50,0.33359888600788673,0.33359888600788673,West Virginia,Providence,3,4,NA,280720277,2008-03-12
96,1,3:02,1382,1382,Weyinmi Efejuku missed Two Point Jumper.,21,26,-5,0,0.33012421109253104,0.33012421109253104,West Virginia,Providence,3,4,NA,280720277,2008-03-12
97,1,3:02,1382,1382,Weyinmi Efejuku Offensive Rebound.,21,26,-5,0,0.33012421109253104,0.33012421109253104,West Virginia,Providence,3,4,NA,280720277,2008-03-12
98,1,3:02,1382,1382,Foul on Da'Sean Butler,21,26,-5,0,0.33012421109253104,0.33012421109253104,West Virginia,Providence,3,4,NA,280720277,2008-03-12
99,1,3:02,1382,1382,Weyinmi Efejuku missed Free Throw.,21,26,-5,0,0.33012421109253104,0.33012421109253104,West Virginia,Providence,3,4,NA,280720277,2008-03-12
100,1,3:02,1382,1382,West Virginia Defensive Rebound.,21,26,-5,36,0.33012421109253104,0.33012421109253104,West Virginia,Providence,3,4,NA,280720277,2008-03-12
101,1,2:26,1346,1346,Joe Alexander missed Two Point Jumper.,21,26,-5,0,0.327690350624863,0.327690350624863,West Virginia,Providence,3,4,NA,280720277,2008-03-12
102,1,2:26,1346,1346,Jamine Peterson Defensive Rebound.,21,26,-5,22,0.327690350624863,0.327690350624863,West Virginia,Providence,3,4,NA,280720277,2008-03-12
103,1,2:04,1324,1324,Foul on Geoff McDermott,21,26,-5,3,0.32618109178554733,0.32618109178554733,West Virginia,Providence,3,4,NA,280720277,2008-03-12
104,1,2:01,1321,1321,John Flowers made Two Point Layup.,23,26,-3,23,0.392724284262956,0.392724284262956,West Virginia,Providence,3,4,NA,280720277,2008-03-12
105,1,1:38,1298,1298,Brian McKenzie missed Three Point Jumper.,23,26,-3,0,0.39165938141763834,0.39165938141763834,West Virginia,Providence,3,4,NA,280720277,2008-03-12
106,1,1:38,1298,1298,Joe Alexander Defensive Rebound.,23,26,-3,7,0.39165938141763834,0.39165938141763834,West Virginia,Providence,3,4,NA,280720277,2008-03-12
107,1,1:31,1291,1291,John Flowers missed Two Point Jumper.,23,26,-3,2,0.39132566693702214,0.39132566693702214,West Virginia,Providence,3,4,NA,280720277,2008-03-12
108,1,1:29,1289,1289,Weyinmi Efejuku Defensive Rebound.,23,26,-3,11,0.39122936217308024,0.39122936217308024,West Virginia,Providence,3,4,NA,280720277,2008-03-12
109,1,1:18,1278,1278,Da'Sean Butler made Two Point Layup.  Assisted by Joe Alexander.,25,26,-1,22,0.4630336731015302,0.4630336731015302,West Virginia,Providence,3,4,NA,280720277,2008-03-12
110,1,0:56,1256,1256,West Virginia 30 Second Timeout.,25,26,-1,11,0.46264225437775996,0.46264225437775996,West Virginia,Providence,2,4,NA,280720277,2008-03-12
111,1,0:45,1245,1245,Foul on Joe Mazzulla,25,26,-1,0,0.4624367814721293,0.4624367814721293,West Virginia,Providence,2,4,NA,280720277,2008-03-12
112,1,0:45,1245,1245,Weyinmi Efejuku missed Free Throw.,25,26,-1,0,0.4624367814721293,0.4624367814721293,West Virginia,Providence,2,4,NA,280720277,2008-03-12
113,1,0:45,1245,1245,Joe Alexander Defensive Rebound.,25,26,-1,31,0.4624367814721293,0.4624367814721293,West Virginia,Providence,2,4,NA,280720277,2008-03-12
114,1,0:14,1214,1214,John Flowers missed Two Point Layup.,25,26,-1,0,0.46181592290649176,0.46181592290649176,West Virginia,Providence,2,4,NA,280720277,2008-03-12
115,1,0:14,1214,1214,Geoff McDermott Defensive Rebound.,25,26,-1,10,0.46181592290649176,0.46181592290649176,West Virginia,Providence,2,4,NA,280720277,2008-03-12
116,1,0:04,1204,1204,Foul on Joe Mazzulla,25,26,-1,0,0.4616030238506507,0.4616030238506507,West Virginia,Providence,2,4,NA,280720277,2008-03-12
117,1,0:04,1204,1204,Weyinmi Efejuku made Free Throw.,25,27,-2,0,0.4236562704258714,0.4236562704258714,West Virginia,Providence,2,4,NA,280720277,2008-03-12
118,1,0:04,1204,1204,Weyinmi Efejuku made Free Throw.,25,28,-3,2,0.38658909088084287,0.38658909088084287,West Virginia,Providence,2,4,NA,280720277,2008-03-12
119,1,0:02,1202,1202,Joe Alexander made Three Point Jumper.,28,28,0,2,0.5,0.5,West Virginia,Providence,2,4,NA,280720277,2008-03-12
120,1,0:00,1200,1200,End of the 1st Half.,28,28,0,0,0.5,0.5,West Virginia,Providence,2,4,NA,280720277,2008-03-12
121,2,20:00,1200,1200,PLAY,28,28,0,14,0.5,0.5,West Virginia,Providence,3,4,NA,280720277,2008-03-12
122,2,19:46,1186,1186,Weyinmi Efejuku missed Two Point Jumper.,28,28,0,0,0.5,0.5,West Virginia,Providence,3,4,NA,280720277,2008-03-12
123,2,19:46,1186,1186,Weyinmi Efejuku Offensive Rebound.,28,28,0,3,0.5,0.5,West Virginia,Providence,3,4,NA,280720277,2008-03-12
124,2,19:43,1183,1183,Weyinmi Efejuku made Two Point Layup.,28,30,-2,22,0.4228006687211183,0.4228006687211183,West Virginia,Providence,3,4,NA,280720277,2008-03-12
125,2,19:21,1161,1161,Joe Alexander made Two Point Jumper.,30,30,0,26,0.5,0.5,West Virginia,Providence,3,4,NA,280720277,2008-03-12
126,2,18:55,1135,1135,Geoff McDermott missed Two Point Layup.,30,30,0,0,0.5,0.5,West Virginia,Providence,3,4,NA,280720277,2008-03-12
127,2,18:55,1135,1135,Da'Sean Butler Defensive Rebound.,30,30,0,9,0.5,0.5,West Virginia,Providence,3,4,NA,280720277,2008-03-12
128,2,18:46,1126,1126,Da'Sean Butler missed Three Point Jumper.,30,30,0,0,0.5,0.5,West Virginia,Providence,3,4,NA,280720277,2008-03-12
129,2,18:46,1126,1126,Joe Alexander Offensive Rebound.,30,30,0,8,0.5,0.5,West Virginia,Providence,3,4,NA,280720277,2008-03-12
130,2,18:38,1118,1118,Joe Alexander made Two Point Jumper.,32,30,2,11,0.5797337455372664,0.5797337455372664,West Virginia,Providence,3,4,NA,280720277,2008-03-12
131,2,18:27,1107,1107,Foul on Brian McKenzie,32,30,2,17,0.5801636349873988,0.5801636349873988,West Virginia,Providence,3,4,NA,280720277,2008-03-12
132,2,18:10,1090,1090,Brian McKenzie missed Three Point Jumper.,32,30,2,0,0.5808383807264902,0.5808383807264902,West Virginia,Providence,3,4,NA,280720277,2008-03-12
133,2,18:10,1090,1090,Joe Alexander Defensive Rebound.,32,30,2,18,0.5808383807264902,0.5808383807264902,West Virginia,Providence,3,4,NA,280720277,2008-03-12
134,2,17:52,1072,1072,Foul on Darris Nichols,32,30,2,9,0.5815729458157011,0.5815729458157011,West Virginia,Providence,3,4,NA,280720277,2008-03-12
135,2,17:43,1063,1063,Foul on Wellington Smith,32,30,2,3,0.58195035032309,0.58195035032309,West Virginia,Providence,3,4,NA,280720277,2008-03-12
136,2,17:40,1060,1060,Jeff Xavier made Three Point Jumper.  Assisted by Geoff McDermott.,32,33,-1,38,0.4586807960671205,0.4586807960671205,West Virginia,Providence,3,4,NA,280720277,2008-03-12
137,2,17:02,1022,1022,Weyinmi Efejuku missed Two Point Layup.,32,33,-1,0,0.4578088634829192,0.4578088634829192,West Virginia,Providence,3,4,NA,280720277,2008-03-12
138,2,17:02,1022,1022,Darris Nichols Defensive Rebound.,32,33,-1,8,0.4578088634829192,0.4578088634829192,West Virginia,Providence,3,4,NA,280720277,2008-03-12
139,2,16:54,1014,1014,Foul on Randall Hanke,32,33,-1,0,0.45761204322681726,0.45761204322681726,West Virginia,Providence,3,4,NA,280720277,2008-03-12
140,2,16:54,1014,1014,Da'Sean Butler missed Free Throw.,32,33,-1,0,0.45761204322681726,0.45761204322681726,West Virginia,Providence,3,4,NA,280720277,2008-03-12
141,2,16:54,1014,1014,null,32,33,-1,0,0.45761204322681726,0.45761204322681726,West Virginia,Providence,3,4,NA,280720277,2008-03-12
142,2,16:54,1014,1014,Da'Sean Butler missed Free Throw.,32,33,-1,0,0.45761204322681726,0.45761204322681726,West Virginia,Providence,3,4,NA,280720277,2008-03-12
143,2,16:54,1014,1014,Weyinmi Efejuku Defensive Rebound.,32,33,-1,24,0.45761204322681726,0.45761204322681726,West Virginia,Providence,3,4,NA,280720277,2008-03-12
144,2,16:30,990,990,Weyinmi Efejuku missed Three Point Jumper.,32,33,-1,0,0.45698786236094535,0.45698786236094535,West Virginia,Providence,3,4,NA,280720277,2008-03-12
145,2,16:30,990,990,Da'Sean Butler Defensive Rebound.,32,33,-1,9,0.45698786236094535,0.45698786236094535,West Virginia,Providence,3,4,NA,280720277,2008-03-12
146,2,16:21,981,981,Darris Nichols missed Three Point Jumper.,32,33,-1,0,0.4567393838479903,0.4567393838479903,West Virginia,Providence,3,4,NA,280720277,2008-03-12
147,2,16:21,981,981,Randall Hanke Defensive Rebound.,32,33,-1,8,0.4567393838479903,0.4567393838479903,West Virginia,Providence,3,4,NA,280720277,2008-03-12
148,2,16:13,973,973,Jeff Xavier made Three Point Jumper.  Assisted by Geoff McDermott.,32,36,-4,20,0.33234853862650837,0.33234853862650837,West Virginia,Providence,3,4,NA,280720277,2008-03-12
149,2,15:53,953,953,Official TV Timeout.,32,36,-4,12,0.3303422409626104,0.3303422409626104,West Virginia,Providence,3,4,NA,280720277,2008-03-12
150,2,15:41,941,941,Joe Alexander made Two Point Jumper.,34,36,-2,26,0.41197293691143627,0.41197293691143627,West Virginia,Providence,3,4,NA,280720277,2008-03-12
151,2,15:15,915,915,Alex Ruoff made Two Point Layup.  Assisted by Da'Sean Butler.,36,36,0,26,0.5,0.5,West Virginia,Providence,3,4,NA,280720277,2008-03-12
152,2,14:49,889,889,Weyinmi Efejuku missed Two Point Layup.,36,36,0,0,0.5,0.5,West Virginia,Providence,3,4,NA,280720277,2008-03-12
153,2,14:49,889,889,Da'Sean Butler Defensive Rebound.,36,36,0,66,0.5,0.5,West Virginia,Providence,3,4,NA,280720277,2008-03-12
154,2,13:43,823,823,Jeff Xavier missed Three Point Jumper.,36,36,0,0,0.5,0.5,West Virginia,Providence,3,4,NA,280720277,2008-03-12
155,2,13:43,823,823,Da'Sean Butler Defensive Rebound.,36,36,0,20,0.5,0.5,West Virginia,Providence,3,4,NA,280720277,2008-03-12
156,2,13:23,803,803,Alex Ruoff made Three Point Jumper.  Assisted by Da'Sean Butler.,39,36,3,11,0.6393661659130186,0.6393661659130186,West Virginia,Providence,3,4,NA,280720277,2008-03-12
157,2,13:12,792,792,Foul on Brian McKenzie,39,36,3,0,0.6402487086361022,0.6402487086361022,West Virginia,Providence,3,4,NA,280720277,2008-03-12
158,2,13:12,792,792,Providence Full Timeout.,39,36,3,16,0.6402487086361022,0.6402487086361022,West Virginia,Providence,3,3,NA,280720277,2008-03-12
159,2,12:56,776,776,Wellington Smith missed Two Point Jumper.,39,36,3,0,0.6416407790771466,0.6416407790771466,West Virginia,Providence,3,3,NA,280720277,2008-03-12
160,2,12:56,776,776,Weyinmi Efejuku Defensive Rebound.,39,36,3,23,0.6416407790771466,0.6416407790771466,West Virginia,Providence,3,3,NA,280720277,2008-03-12
161,2,12:33,753,753,Jeff Xavier made Two Point Jumper.,39,38,1,28,0.549203747986818,0.549203747986818,West Virginia,Providence,3,3,NA,280720277,2008-03-12
162,2,12:05,725,725,Joe Alexander missed Two Point Jumper.,39,38,1,0,0.5503728083909338,0.5503728083909338,West Virginia,Providence,3,3,NA,280720277,2008-03-12
163,2,12:05,725,725,Providence Defensive Rebound.,39,38,1,25,0.5503728083909338,0.5503728083909338,West Virginia,Providence,3,3,NA,280720277,2008-03-12
164,2,11:40,700,700,Geoff McDermott made Two Point Dunk Shot.  Assisted by Weyinmi Efejuku.,39,40,-1,36,0.4486435370162313,0.4486435370162313,West Virginia,Providence,3,3,NA,280720277,2008-03-12
165,2,11:04,664,664,Da'Sean Butler made Two Point Jumper.  Assisted by Darris Nichols.,41,40,1,23,0.5525827253624076,0.5525827253624076,West Virginia,Providence,3,3,NA,280720277,2008-03-12
