play_id,half,time_remaining_half,secs_remaining,secs_remaining_absolute,description,home_score,away_score,score_diff,play_length,win_prob,naive_win_prob,home,away,home_time_out_remaining,away_time_out_remaining,home_favored_by,game_id,date
1,1,20:00,2400,2400,PLAY,0,0,0,10,0.5,0.5,VCU,Hofstra,6,6,NA,310272670,2011-01-27
2,1,19:50,2390,2390,Charles Jenkins missed Two Point Jumper.,0,0,0,1,0.5,0.5,VCU,Hofstra,6,6,NA,310272670,2011-01-27
3,1,19:49,2389,2389,Ed Nixon Block.,0,0,0,1,0.5,0.5,VCU,Hofstra,6,6,NA,310272670,2011-01-27
4,1,19:48,2388,2388,Jamie Skeen Defensive Rebound.,0,0,0,32,0.5,0.5,VCU,Hofstra,6,6,NA,310272670,2011-01-27
5,1,19:16,2356,2356,Joey Rodriguez missed Two Point Jumper.,0,0,0,0,0.5,0.5,VCU,Hofstra,6,6,NA,310272670,2011-01-27
6,1,19:16,2356,2356,Jamie Skeen Offensive Rebound.,0,0,0,4,0.5,0.5,VCU,Hofstra,6,6,NA,310272670,2011-01-27
7,1,19:12,2352,2352,Jamie Skeen missed Two Point Jumper.,0,0,0,0,0.5,0.5,VCU,Hofstra,6,6,NA,310272670,2011-01-27
8,1,19:12,2352,2352,Greg Washington Defensive Rebound.,0,0,0,14,0.5,0.5,VCU,Hofstra,6,6,NA,310272670,2011-01-27
9,1,18:58,2338,2338,Mike Moore missed Two Point Jumper.,0,0,0,0,0.5,0.5,VCU,Hofstra,6,6,NA,310272670,2011-01-27
10,1,18:58,2338,2338,Joey Rodriguez Defensive Rebound.,0,0,0,21,0.5,0.5,VCU,Hofstra,6,6,NA,310272670,2011-01-27
11,1,18:37,2317,2317,Juvonte Reddic made Two Point Jumper.,2,0,2,6,0.5458113538505914,0.5458113538505914,VCU,Hofstra,6,6,NA,310272670,2011-01-27
12,1,18:31,2311,2311,Mike Moore Turnover.,2,0,2,1,0.5459437285227066,0.5459437285227066,VCU,Hofstra,6,6,NA,310272670,2011-01-27
13,1,18:30,2310,2310,Bradford Burgess Steal.,2,0,2,15,0.5459658291288992,0.5459658291288992,VCU,Hofstra,6,6,NA,310272670,2011-01-27
14,1,18:15,2295,2295,Jamie Skeen missed Two Point Jumper.,2,0,2,0,0.5462986002811664,0.5462986002811664,VCU,Hofstra,6,6,NA,310272670,2011-01-27
15,1,18:15,2295,2295,Joey Rodriguez Offensive Rebound.,2,0,2,17,0.5462986002811664,0.5462986002811664,VCU,Hofstra,6,6,NA,310272670,2011-01-27
16,1,17:58,2278,2278,Ed Nixon missed Two Point Jumper.,2,0,2,0,0.5466784441662067,0.5466784441662067,VCU,Hofstra,6,6,NA,310272670,2011-01-27
17,1,17:58,2278,2278,Greg Washington Defensive Rebound.,2,0,2,14,0.5466784441662067,0.5466784441662067,VCU,Hofstra,6,6,NA,310272670,2011-01-27
18,1,17:44,2264,2264,Brad Kelleher missed Three Point Jumper.,2,0,2,0,0.5469932384002621,0.5469932384002621,VCU,Hofstra,6,6,NA,310272670,2011-01-27
19,1,17:44,2264,2264,Greg Washington Offensive Rebound.,2,0,2,12,0.5469932384002621,0.5469932384002621,VCU,Hofstra,6,6,NA,310272670,2011-01-27
20,1,17:32,2252,2252,Greg Washington made Two Point Jumper.,2,2,0,10,0.5,0.5,VCU,Hofstra,6,6,NA,310272670,2011-01-27
21,1,17:22,2242,2242,Foul on Mike Moore,2,2,0,6,0.5,0.5,VCU,Hofstra,6,6,NA,310272670,2011-01-27
22,1,17:16,2236,2236,Bradford Burgess missed Three Point Jumper.,2,2,0,0,0.5,0.5,VCU,Hofstra,6,6,NA,310272670,2011-01-27
23,1,17:16,2236,2236,Mike Moore Defensive Rebound.,2,2,0,13,0.5,0.5,VCU,Hofstra,6,6,NA,310272670,2011-01-27
24,1,17:03,2223,2223,Greg Washington made Two Point Dunk Shot.  Assisted by Brad Kelleher.,2,4,-2,6,0.45207599041727337,0.45207599041727337,VCU,Hofstra,6,6,NA,310272670,2011-01-27
25,1,16:57,2217,2217,Juvonte Reddic made Two Point Jumper.,4,4,0,6,0.5,0.5,VCU,Hofstra,6,6,NA,310272670,2011-01-27
26,1,16:51,2211,2211,David Imes made Two Point Jumper.,4,6,-2,4,0.45180143991751737,0.45180143991751737,VCU,Hofstra,6,6,NA,310272670,2011-01-27
27,1,16:47,2207,2207,Bradford Burgess made Two Point Jumper.  Assisted by Joey Rodriguez.,6,6,0,1,0.5,0.5,VCU,Hofstra,6,6,NA,310272670,2011-01-27
28,1,16:46,2206,2206,Foul on Greg Washington,6,6,0,0,0.5,0.5,VCU,Hofstra,6,6,NA,310272670,2011-01-27
29,1,16:46,2206,2206,Bradford Burgess made Free Throw.,7,6,1,10,0.5242132490649751,0.5242132490649751,VCU,Hofstra,6,6,NA,310272670,2011-01-27
30,1,16:36,2196,2196,Brad Kelleher missed Two Point Jumper.,7,6,1,0,0.5243288962666488,0.5243288962666488,VCU,Hofstra,6,6,NA,310272670,2011-01-27
31,1,16:36,2196,2196,Juvonte Reddic Defensive Rebound.,7,6,1,6,0.5243288962666488,0.5243288962666488,VCU,Hofstra,6,6,NA,310272670,2011-01-27
32,1,16:30,2190,2190,Ed Nixon made Three Point Jumper.,10,6,4,16,0.5964475337031395,0.5964475337031395,VCU,Hofstra,6,6,NA,310272670,2011-01-27
33,1,16:14,2174,2174,Charles Jenkins made Two Point Jumper.,10,8,2,8,0.5490497341659156,0.5490497341659156,VCU,Hofstra,6,6,NA,310272670,2011-01-27
34,1,16:06,2166,2166,Joey Rodriguez missed Three Point Jumper.,10,8,2,0,0.5492345457745712,0.5492345457745712,VCU,Hofstra,6,6,NA,310272670,2011-01-27
35,1,16:06,2166,2166,Rob Brandenberg Offensive Rebound.,10,8,2,5,0.5492345457745712,0.5492345457745712,VCU,Hofstra,6,6,NA,310272670,2011-01-27
36,1,16:01,2161,2161,Joey Rodriguez missed Two Point Jumper.,10,8,2,0,0.5493502722348179,0.5493502722348179,VCU,Hofstra,6,6,NA,310272670,2011-01-27
37,1,16:01,2161,2161,David Imes Defensive Rebound.,10,8,2,36,0.5493502722348179,0.5493502722348179,VCU,Hofstra,6,6,NA,310272670,2011-01-27
38,1,15:25,2125,2125,Greg Washington made Two Point Dunk Shot.  Assisted by Charles Jenkins.,10,10,0,19,0.5,0.5,VCU,Hofstra,6,6,NA,310272670,2011-01-27
39,1,15:06,2106,2106,Bradford Burgess missed Three Point Jumper.,10,10,0,0,0.5,0.5,VCU,Hofstra,6,6,NA,310272670,2011-01-27
40,1,15:06,2106,2106,Mike Moore Defensive Rebound.,10,10,0,8,0.5,0.5,VCU,Hofstra,6,6,NA,310272670,2011-01-27
41,1,14:58,2098,2098,Mike Moore Turnover.,10,10,0,1,0.5,0.5,VCU,Hofstra,6,6,NA,310272670,2011-01-27
42,1,14:57,2097,2097,Ed Nixon Steal.,10,10,0,7,0.5,0.5,VCU,Hofstra,6,6,NA,310272670,2011-01-27
43,1,14:50,2090,2090,Juvonte Reddic made Two Point Jumper.,12,10,2,24,0.5510158552260809,0.5510158552260809,VCU,Hofstra,6,6,NA,310272670,2011-01-27
44,1,14:26,2066,2066,Greg Washington missed Two Point Jumper.,12,10,2,0,0.5515895536493832,0.5515895536493832,VCU,Hofstra,6,6,NA,310272670,2011-01-27
45,1,14:26,2066,2066,Joey Rodriguez Defensive Rebound.,12,10,2,9,0.5515895536493832,0.5515895536493832,VCU,Hofstra,6,6,NA,310272670,2011-01-27
46,1,14:17,2057,2057,Juvonte Reddic made Two Point Dunk Shot.  Assisted by Joey Rodriguez.,14,10,4,14,0.602511987102092,0.602511987102092,VCU,Hofstra,6,6,NA,310272670,2011-01-27
47,1,14:03,2043,2043,Joey Rodriguez Steal.,14,10,4,1,0.6031681487995326,0.6031681487995326,VCU,Hofstra,6,6,NA,310272670,2011-01-27
48,1,14:02,2042,2042,Brad Kelleher Turnover.,14,10,4,0,0.6032151713537646,0.6032151713537646,VCU,Hofstra,6,6,NA,310272670,2011-01-27
49,1,14:02,2042,2042,Official TV Timeout.,14,10,4,4,0.6032151713537646,0.6032151713537646,VCU,Hofstra,6,6,NA,310272670,2011-01-27
50,1,13:58,2038,2038,Joey Rodriguez Turnover.,14,10,4,3,0.6034034706540315,0.6034034706540315,VCU,Hofstra,6,6,NA,310272670,2011-01-27
51,1,13:55,2035,2035,Charles Jenkins Steal.,14,10,4,5,0.6035449164040675,0.6035449164040675,VCU,Hofstra,6,6,NA,310272670,2011-01-27
52,1,13:50,2030,2030,Charles Jenkins missed Three Point Jumper.,14,10,4,0,0.6037810857567623,0.6037810857567623,VCU,Hofstra,6,6,NA,310272670,2011-01-27
53,1,13:50,2030,2030,Darius Theus Defensive Rebound.,14,10,4,27,0.6037810857567623,0.6037810857567623,VCU,Hofstra,6,6,NA,310272670,2011-01-27
54,1,13:23,2003,2003,Jamie Skeen Turnover.,14,10,4,0,0.6050659230523384,0.6050659230523384,VCU,Hofstra,6,6,NA,310272670,2011-01-27
55,1,13:23,2003,2003,Foul on Jamie Skeen,14,10,4,11,0.6050659230523384,0.6050659230523384,VCU,Hofstra,6,6,NA,310272670,2011-01-27
56,1,13:12,1992,1992,David Imes missed Two Point Jumper.,14,10,4,0,0.6055941671784295,0.6055941671784295,VCU,Hofstra,6,6,NA,310272670,2011-01-27
57,1,13:12,1992,1992,Hofstra Offensive Rebound.,14,10,4,9,0.6055941671784295,0.6055941671784295,VCU,Hofstra,6,6,NA,310272670,2011-01-27
58,1,13:03,1983,1983,Charles Jenkins made Two Point Jumper.,14,12,2,17,0.5536240364692246,0.5536240364692246,VCU,Hofstra,6,6,NA,310272670,2011-01-27
59,1,12:46,1966,1966,Jamie Skeen made Two Point Jumper.,16,12,4,6,0.6068544027811372,0.6068544027811372,VCU,Hofstra,6,6,NA,310272670,2011-01-27
60,1,12:40,1960,1960,Foul on Darius Theus,16,12,4,18,0.607147637400192,0.607147637400192,VCU,Hofstra,6,6,NA,310272670,2011-01-27
61,1,12:22,1942,1942,Greg Washington missed Two Point Jumper.,16,12,4,0,0.608032985325151,0.608032985325151,VCU,Hofstra,6,6,NA,310272670,2011-01-27
62,1,12:22,1942,1942,Bradford Burgess Defensive Rebound.,16,12,4,19,0.608032985325151,0.608032985325151,VCU,Hofstra,6,6,NA,310272670,2011-01-27
63,1,12:03,1923,1923,Ed Nixon made Two Point Jumper.,18,12,6,38,0.660273925261224,0.660273925261224,VCU,Hofstra,6,6,NA,310272670,2011-01-27
64,1,11:25,1885,1885,Charles Jenkins made Three Point Jumper.,18,15,3,13,0.5837516499530961,0.5837516499530961,VCU,Hofstra,6,6,NA,310272670,2011-01-27
65,1,11:12,1872,1872,Rob Brandenberg missed Three Point Jumper.,18,15,3,0,0.5842452332858721,0.5842452332858721,VCU,Hofstra,6,6,NA,310272670,2011-01-27
66,1,11:12,1872,1872,Mike Moore Defensive Rebound.,18,15,3,7,0.5842452332858721,0.5842452332858721,VCU,Hofstra,6,6,NA,310272670,2011-01-27
67,1,11:05,1865,1865,Charles Jenkins missed Three Point Jumper.,18,15,3,0,0.5845112947002189,0.5845112947002189,VCU,Hofstra,6,6,NA,310272670,2011-01-27
68,1,11:05,1865,1865,Ed Nixon Defensive Rebound.,18,15,3,11,0.5845112947002189,0.5845112947002189,VCU,Hofstra,6,6,NA,310272670,2011-01-27
69,1,10:54,1854,1854,Darius Theus Turnover.,18,15,3,1,0.584930026753027,0.584930026753027,VCU,Hofstra,6,6,NA,310272670,2011-01-27
70,1,10:53,1853,1853,Shemiye McLendon Steal.,18,15,3,1,0.5849681404083931,0.5849681404083931,VCU,Hofstra,6,6,NA,310272670,2011-01-27
71,1,10:52,1852,1852,Official TV Timeout.,18,15,3,8,0.5850062628933226,0.5850062628933226,VCU,Hofstra,6,6,NA,310272670,2011-01-27
72,1,10:44,1844,1844,Stephen Nwaukoni made Two Point Jumper.,18,17,1,21,0.5286865379509524,0.5286865379509524,VCU,Hofstra,6,6,NA,310272670,2011-01-27
73,1,10:23,1823,1823,Jamie Skeen made Three Point Jumper.,21,17,4,27,0.6139420345325227,0.6139420345325227,VCU,Hofstra,6,6,NA,310272670,2011-01-27
74,1,9:56,1796,1796,Shemiye McLendon missed Two Point Jumper.,21,17,4,0,0.615303657390299,0.615303657390299,VCU,Hofstra,6,6,NA,310272670,2011-01-27
75,1,9:56,1796,1796,Jamie Skeen Defensive Rebound.,21,17,4,10,0.615303657390299,0.615303657390299,VCU,Hofstra,6,6,NA,310272670,2011-01-27
76,1,9:46,1786,1786,Jamie Skeen made Two Point Jumper.,23,17,6,0,0.6698969083144077,0.6698969083144077,VCU,Hofstra,6,6,NA,310272670,2011-01-27
77,1,9:46,1786,1786,Foul on Greg Washington,23,17,6,1,0.6698969083144077,0.6698969083144077,VCU,Hofstra,6,6,NA,310272670,2011-01-27
78,1,9:45,1785,1785,Jamie Skeen made Free Throw.,24,17,7,14,0.6955190063043506,0.6955190063043506,VCU,Hofstra,6,6,NA,310272670,2011-01-27
79,1,9:31,1771,1771,Greg Washington made Two Point Jumper.  Assisted by Stephen Nwaukoni.,24,19,5,0,0.6442437793358639,0.6442437793358639,VCU,Hofstra,6,6,NA,310272670,2011-01-27
80,1,9:31,1771,1771,Foul on Joey Rodriguez,24,19,5,0,0.6442437793358639,0.6442437793358639,VCU,Hofstra,6,6,NA,310272670,2011-01-27
81,1,9:31,1771,1771,Greg Washington made Free Throw.,24,20,4,5,0.616581912987886,0.616581912987886,VCU,Hofstra,6,6,NA,310272670,2011-01-27
82,1,9:26,1766,1766,Ed Nixon missed Three Point Jumper.,24,20,4,0,0.6168399947991066,0.6168399947991066,VCU,Hofstra,6,6,NA,310272670,2011-01-27
83,1,9:26,1766,1766,Bradford Burgess Offensive Rebound.,24,20,4,7,0.6168399947991066,0.6168399947991066,VCU,Hofstra,6,6,NA,310272670,2011-01-27
84,1,9:19,1759,1759,Bradford Burgess made Two Point Tip Shot.,26,20,6,8,0.6718443369251405,0.6718443369251405,VCU,Hofstra,6,6,NA,310272670,2011-01-27
85,1,9:11,1751,1751,Mike Moore missed Three Point Jumper.,26,20,6,0,0.6724277799093138,0.6724277799093138,VCU,Hofstra,6,6,NA,310272670,2011-01-27
86,1,9:11,1751,1751,Stephen Nwaukoni Offensive Rebound.,26,20,6,4,0.6724277799093138,0.6724277799093138,VCU,Hofstra,6,6,NA,310272670,2011-01-27
87,1,9:07,1747,1747,Stephen Nwaukoni Turnover.,26,20,6,33,0.6727207251242981,0.6727207251242981,VCU,Hofstra,6,6,NA,310272670,2011-01-27
88,1,8:34,1714,1714,Bradford Burgess missed Three Point Jumper.,26,20,6,0,0.6751721947828667,0.6751721947828667,VCU,Hofstra,6,6,NA,310272670,2011-01-27
89,1,8:34,1714,1714,Shemiye McLendon Defensive Rebound.,26,20,6,8,0.6751721947828667,0.6751721947828667,VCU,Hofstra,6,6,NA,310272670,2011-01-27
90,1,8:26,1706,1706,Foul on Joey Rodriguez,26,20,6,22,0.6757767488333568,0.6757767488333568,VCU,Hofstra,6,6,NA,310272670,2011-01-27
91,1,8:04,1684,1684,Stephen Nwaukoni missed Two Point Jumper.,26,20,6,0,0.6774588057445805,0.6774588057445805,VCU,Hofstra,6,6,NA,310272670,2011-01-27
92,1,8:04,1684,1684,Bradford Burgess Defensive Rebound.,26,20,6,30,0.6774588057445805,0.6774588057445805,VCU,Hofstra,6,6,NA,310272670,2011-01-27
93,1,7:34,1654,1654,Jamie Skeen made Three Point Jumper.,29,20,9,27,0.7555719007423372,0.7555719007423372,VCU,Hofstra,6,6,NA,310272670,2011-01-27
94,1,7:07,1627,1627,Charles Jenkins made Two Point Jumper.,29,22,7,0,0.7085226312687589,0.7085226312687589,VCU,Hofstra,6,6,NA,310272670,2011-01-27
95,1,7:07,1627,1627,Foul on Darius Theus,29,22,7,0,0.7085226312687589,0.7085226312687589,VCU,Hofstra,6,6,NA,310272670,2011-01-27
96,1,7:07,1627,1627,Official TV Timeout.,29,22,7,0,0.7085226312687589,0.7085226312687589,VCU,Hofstra,6,6,NA,310272670,2011-01-27
97,1,7:07,1627,1627,Charles Jenkins made Free Throw.,29,23,6,24,0.6816426637455257,0.6816426637455257,VCU,Hofstra,6,6,NA,310272670,2011-01-27
98,1,6:43,1603,1603,Jamie Skeen made Two Point Dunk Shot.,31,23,8,23,0.7360610686449504,0.7360610686449504,VCU,Hofstra,6,6,NA,310272670,2011-01-27
99,1,6:20,1580,1580,Charles Jenkins made Two Point Jumper.,31,25,6,9,0.684975652249574,0.684975652249574,VCU,Hofstra,6,6,NA,310272670,2011-01-27
100,1,6:11,1571,1571,Foul on Shemiye McLendon,31,25,6,0,0.6856154847085296,0.6856154847085296,VCU,Hofstra,6,6,NA,310272670,2011-01-27
101,1,6:11,1571,1571,Darius Theus made Free Throw.,32,25,7,0,0.7129285711938463,0.7129285711938463,VCU,Hofstra,6,6,NA,310272670,2011-01-27
102,1,6:11,1571,1571,Darius Theus made Free Throw.,33,25,8,11,0.7387728557350548,0.7387728557350548,VCU,Hofstra,6,6,NA,310272670,2011-01-27
103,1,6:00,1560,1560,Charles Jenkins made Three Point Jumper.  Assisted by Greg Washington.,33,28,5,15,0.6576392953246581,0.6576392953246581,VCU,Hofstra,6,6,NA,310272670,2011-01-27
104,1,5:45,1545,1545,Foul on Greg Washington,33,28,5,0,0.6585832701176404,0.6585832701176404,VCU,Hofstra,6,6,NA,310272670,2011-01-27
105,1,5:45,1545,1545,Bradford Burgess missed Free Throw.,33,28,5,0,0.6585832701176404,0.6585832701176404,VCU,Hofstra,6,6,NA,310272670,2011-01-27
106,1,5:45,1545,1545,null,33,28,5,0,0.6585832701176404,0.6585832701176404,VCU,Hofstra,6,6,NA,310272670,2011-01-27
107,1,5:45,1545,1545,Bradford Burgess made Free Throw.,34,28,6,15,0.6874843645439608,0.6874843645439608,VCU,Hofstra,6,6,NA,310272670,2011-01-27
108,1,5:30,1530,1530,Shemiye McLendon missed Three Point Jumper.,34,28,6,1,0.6885835587192296,0.6885835587192296,VCU,Hofstra,6,6,NA,310272670,2011-01-27
109,1,5:29,1529,1529,Ed Nixon Defensive Rebound.,34,28,6,9,0.6886575398424248,0.6886575398424248,VCU,Hofstra,6,6,NA,310272670,2011-01-27
110,1,5:20,1520,1520,Darius Theus made Two Point Layup.,36,28,8,0,0.7431944070640354,0.7431944070640354,VCU,Hofstra,6,6,NA,310272670,2011-01-27
111,1,5:20,1520,1520,Foul on Brad Kelleher,36,28,8,0,0.7431944070640354,0.7431944070640354,VCU,Hofstra,6,6,NA,310272670,2011-01-27
112,1,5:20,1520,1520,Darius Theus made Free Throw.,37,28,9,12,0.7677176027759279,0.7677176027759279,VCU,Hofstra,6,6,NA,310272670,2011-01-27
113,1,5:08,1508,1508,Brad Kelleher missed Three Point Jumper.,37,28,9,0,0.768850076002686,0.768850076002686,VCU,Hofstra,6,6,NA,310272670,2011-01-27
114,1,5:08,1508,1508,Jamie Skeen Defensive Rebound.,37,28,9,10,0.768850076002686,0.768850076002686,VCU,Hofstra,6,6,NA,310272670,2011-01-27
115,1,4:58,1498,1498,Darius Theus missed Two Point Layup.,37,28,9,0,0.7698091225467747,0.7698091225467747,VCU,Hofstra,6,6,NA,310272670,2011-01-27
116,1,4:58,1498,1498,Charles Jenkins Defensive Rebound.,37,28,9,5,0.7698091225467747,0.7698091225467747,VCU,Hofstra,6,6,NA,310272670,2011-01-27
117,1,4:53,1493,1493,Charles Jenkins Turnover.,37,28,9,26,0.770294411393279,0.770294411393279,VCU,Hofstra,6,6,NA,310272670,2011-01-27
118,1,4:27,1467,1467,Troy Daniels missed Three Point Jumper.,37,28,9,0,0.7728885636936176,0.7728885636936176,VCU,Hofstra,6,6,NA,310272670,2011-01-27
119,1,4:27,1467,1467,Brad Kelleher Defensive Rebound.,37,28,9,1,0.7728885636936176,0.7728885636936176,VCU,Hofstra,6,6,NA,310272670,2011-01-27
120,1,4:26,1466,1466,Foul on Jamie Skeen,37,28,9,0,0.7729909288607719,0.7729909288607719,VCU,Hofstra,6,6,NA,310272670,2011-01-27
121,1,4:26,1466,1466,Foul on Troy Daniels,37,28,9,0,0.7729909288607719,0.7729909288607719,VCU,Hofstra,6,6,NA,310272670,2011-01-27
122,1,4:26,1466,1466,Shemiye McLendon made Free Throw.,37,29,8,0,0.7482188786522702,0.7482188786522702,VCU,Hofstra,6,6,NA,310272670,2011-01-27
123,1,4:26,1466,1466,Shemiye McLendon missed Free Throw.,37,29,8,0,0.7482188786522702,0.7482188786522702,VCU,Hofstra,6,6,NA,310272670,2011-01-27
124,1,4:26,1466,1466,Bradford Burgess Defensive Rebound.,37,29,8,13,0.7482188786522702,0.7482188786522702,VCU,Hofstra,6,6,NA,310272670,2011-01-27
125,1,4:13,1453,1453,Troy Daniels made Three Point Jumper.  Assisted by Ed Nixon.,40,29,11,9,0.8186138632522958,0.8186138632522958,VCU,Hofstra,6,6,NA,310272670,2011-01-27
126,1,4:04,1444,1444,Mike Moore missed Three Point Jumper.,40,29,11,0,0.8195974398360031,0.8195974398360031,VCU,Hofstra,6,6,NA,310272670,2011-01-27
127,1,4:04,1444,1444,Darius Theus Defensive Rebound.,40,29,11,7,0.8195974398360031,0.8195974398360031,VCU,Hofstra,6,6,NA,310272670,2011-01-27
128,1,3:57,1437,1437,Bradford Burgess made Two Point Layup.  Assisted by Darius Theus.,42,29,13,1,0.8575191573525264,0.8575191573525264,VCU,Hofstra,6,6,NA,310272670,2011-01-27
129,1,3:56,1436,1436,Foul on David Imes,42,29,13,0,0.857623150438115,0.857623150438115,VCU,Hofstra,6,6,NA,310272670,2011-01-27
130,1,3:56,1436,1436,Official TV Timeout.,42,29,13,0,0.857623150438115,0.857623150438115,VCU,Hofstra,6,6,NA,310272670,2011-01-27
131,1,3:56,1436,1436,Bradford Burgess made Free Throw.,43,29,14,25,0.8736713212020879,0.8736713212020879,VCU,Hofstra,6,6,NA,310272670,2011-01-27
132,1,3:31,1411,1411,Charles Jenkins missed Two Point Jumper.,43,29,14,0,0.8761231551439583,0.8761231551439583,VCU,Hofstra,6,6,NA,310272670,2011-01-27
133,1,3:31,1411,1411,Bradford Burgess Defensive Rebound.,43,29,14,20,0.8761231551439583,0.8761231551439583,VCU,Hofstra,6,6,NA,310272670,2011-01-27
134,1,3:11,1391,1391,Troy Daniels made Three Point Jumper.  Assisted by Ed Nixon.,46,29,17,16,0.9165619501932507,0.9165619501932507,VCU,Hofstra,6,6,NA,310272670,2011-01-27
135,1,2:55,1375,1375,Foul on Darius Theus,46,29,17,0,0.9178284800087819,0.9178284800087819,VCU,Hofstra,6,6,NA,310272670,2011-01-27
136,1,2:55,1375,1375,Brad Kelleher missed Free Throw.,46,29,17,0,0.9178284800087819,0.9178284800087819,VCU,Hofstra,6,6,NA,310272670,2011-01-27
137,1,2:55,1375,1375,Bradford Burgess Defensive Rebound.,46,29,17,33,0.9178284800087819,0.9178284800087819,VCU,Hofstra,6,6,NA,310272670,2011-01-27
138,1,2:22,1342,1342,Rob Brandenberg missed Two Point Jumper.,46,29,17,0,0.9203865376202924,0.9203865376202924,VCU,Hofstra,6,6,NA,310272670,2011-01-27
139,1,2:22,1342,1342,null,46,29,17,0,0.9203865376202924,0.9203865376202924,VCU,Hofstra,6,6,NA,310272670,2011-01-27
140,1,2:22,1342,1342,Virginia Commonwealt Turnover.,46,29,17,18,0.9203865376202924,0.9203865376202924,VCU,Hofstra,6,6,NA,310272670,2011-01-27
141,1,2:04,1324,1324,Hofstra 30 Second Timeout.,46,29,17,16,0.9217762694757013,0.9217762694757013,VCU,Hofstra,6,5,NA,310272670,2011-01-27
142,1,1:48,1308,1308,Charles Jenkins Turnover.,46,29,17,1,0.9230221157205133,0.9230221157205133,VCU,Hofstra,6,5,NA,310272670,2011-01-27
143,1,1:47,1307,1307,Rob Brandenberg Steal.,46,29,17,8,0.9231005212773538,0.9231005212773538,VCU,Hofstra,6,5,NA,310272670,2011-01-27
144,1,1:39,1299,1299,Juvonte Reddic missed Two Point Jumper.,46,29,17,0,0.9237306635564791,0.9237306635564791,VCU,Hofstra,6,5,NA,310272670,2011-01-27
145,1,1:39,1299,1299,Stephen Nwaukoni Block.,46,29,17,5,0.9237306635564791,0.9237306635564791,VCU,Hofstra,6,5,NA,310272670,2011-01-27
146,1,1:34,1294,1294,Juvonte Reddic Offensive Rebound.,46,29,17,0,0.9241274166609345,0.9241274166609345,VCU,Hofstra,6,5,NA,310272670,2011-01-27
147,1,1:34,1294,1294,Virginia Commonwealt 30 Second Timeout.,46,29,17,15,0.9241274166609345,0.9241274166609345,VCU,Hofstra,6,4,NA,310272670,2011-01-27
148,1,1:19,1279,1279,Rob Brandenberg missed Three Point Jumper.,46,29,17,0,0.9253337831255037,0.9253337831255037,VCU,Hofstra,6,4,NA,310272670,2011-01-27
149,1,1:19,1279,1279,Bradford Burgess Offensive Rebound.,46,29,17,4,0.9253337831255037,0.9253337831255037,VCU,Hofstra,6,4,NA,310272670,2011-01-27
150,1,1:15,1275,1275,Bradford Burgess missed Two Point Jumper.,46,29,17,0,0.9256601151878893,0.9256601151878893,VCU,Hofstra,6,4,NA,310272670,2011-01-27
151,1,1:15,1275,1275,Charles Jenkins Defensive Rebound.,46,29,17,5,0.9256601151878893,0.9256601151878893,VCU,Hofstra,6,4,NA,310272670,2011-01-27
152,1,1:10,1270,1270,Mike Moore made Two Point Dunk Shot.  Assisted by Charles Jenkins.,46,31,15,35,0.9029510865590077,0.9029510865590077,VCU,Hofstra,6,4,NA,310272670,2011-01-27
153,1,0:35,1235,1235,Foul on Stephen Nwaukoni,46,31,15,0,0.9063366951869211,0.9063366951869211,VCU,Hofstra,6,4,NA,310272670,2011-01-27
154,1,0:35,1235,1235,Rob Brandenberg made Free Throw.,47,31,16,0,0.9184160538976033,0.9184160538976033,VCU,Hofstra,6,4,NA,310272670,2011-01-27
155,1,0:35,1235,1235,Rob Brandenberg made Free Throw.,48,31,17,12,0.92905952244561,0.92905952244561,VCU,Hofstra,6,4,NA,310272670,2011-01-27
156,1,0:23,1223,1223,Brad Kelleher made Two Point Layup.  Assisted by David Imes.,48,33,15,19,0.9075617180375033,0.9075617180375033,VCU,Hofstra,6,4,NA,310272670,2011-01-27
157,1,0:04,1204,1204,Troy Daniels missed Three Point Jumper.,48,33,15,0,0.9095673308747129,0.9095673308747129,VCU,Hofstra,6,4,NA,310272670,2011-01-27
158,1,0:04,1204,1204,Bradford Burgess Offensive Rebound.,48,33,15,2,0.9095673308747129,0.9095673308747129,VCU,Hofstra,6,4,NA,310272670,2011-01-27
159,1,0:02,1202,1202,Bradford Burgess missed Two Point Tip Shot.,48,33,15,0,0.9097767471296827,0.9097767471296827,VCU,Hofstra,6,4,NA,310272670,2011-01-27
160,1,0:02,1202,1202,Virginia Commonwealt Offensive Rebound.,48,33,15,2,0.9097767471296827,0.9097767471296827,VCU,Hofstra,6,4,NA,310272670,2011-01-27
161,1,0:00,1200,1200,End of the 1st Half.,48,33,15,0,0.9099848741674551,0.9099848741674551,VCU,Hofstra,6,4,NA,310272670,2011-01-27
162,2,20:00,1200,1200,PLAY,48,33,15,35,0.9099848741674551,0.9099848741674551,VCU,Hofstra,6,4,NA,310272670,2011-01-27
163,2,19:25,1165,1165,Ed Nixon made Three Point Jumper.  Assisted by Joey Rodriguez.,51,33,18,27,0.9441615944254699,0.9441615944254699,VCU,Hofstra,6,4,NA,310272670,2011-01-27
164,2,18:58,1138,1138,Charles Jenkins missed Two Point Jumper.,51,33,18,0,0.9461661074565292,0.9461661074565292,VCU,Hofstra,6,4,NA,310272670,2011-01-27
165,2,18:58,1138,1138,Jamie Skeen Defensive Rebound.,51,33,18,27,0.9461661074565292,0.9461661074565292,VCU,Hofstra,6,4,NA,310272670,2011-01-27
166,2,18:31,1111,1111,Jamie Skeen missed Two Point Jumper.,51,33,18,0,0.9481035297194969,0.9481035297194969,VCU,Hofstra,6,4,NA,310272670,2011-01-27
167,2,18:31,1111,1111,Greg Washington Defensive Rebound.,51,33,18,12,0.9481035297194969,0.9481035297194969,VCU,Hofstra,6,4,NA,310272670,2011-01-27
168,2,18:19,1099,1099,Greg Washington made Two Point Jumper.,51,35,16,20,0.9307282320730482,0.9307282320730482,VCU,Hofstra,6,4,NA,310272670,2011-01-27
169,2,17:59,1079,1079,Juvonte Reddic missed Two Point Jumper.,51,35,16,0,0.9324144924650302,0.9324144924650302,VCU,Hofstra,6,4,NA,310272670,2011-01-27
170,2,17:59,1079,1079,Charles Jenkins Defensive Rebound.,51,35,16,7,0.9324144924650302,0.9324144924650302,VCU,Hofstra,6,4,NA,310272670,2011-01-27
171,2,17:52,1072,1072,Brad Kelleher made Two Point Layup.  Assisted by Charles Jenkins.,51,37,14,2,0.9092603340314228,0.9092603340314228,VCU,Hofstra,6,4,NA,310272670,2011-01-27
172,2,17:50,1070,1070,Foul on Juvonte Reddic,51,37,14,0,0.9094576619687458,0.9094576619687458,VCU,Hofstra,6,4,NA,310272670,2011-01-27
173,2,17:50,1070,1070,Brad Kelleher made Free Throw.,51,38,13,32,0.8949416829562414,0.8949416829562414,VCU,Hofstra,6,4,NA,310272670,2011-01-27
174,2,17:18,1038,1038,Ed Nixon made Two Point Jumper.,53,38,15,6,0.9251596671000646,0.9251596671000646,VCU,Hofstra,6,4,NA,310272670,2011-01-27
175,2,17:12,1032,1032,Greg Washington missed Two Point Jumper.,53,38,15,0,0.9257427974665282,0.9257427974665282,VCU,Hofstra,6,4,NA,310272670,2011-01-27
176,2,17:12,1032,1032,Jamie Skeen Defensive Rebound.,53,38,15,7,0.9257427974665282,0.9257427974665282,VCU,Hofstra,6,4,NA,310272670,2011-01-27
177,2,17:05,1025,1025,Joey Rodriguez missed Three Point Jumper.,53,38,15,0,0.9264314109647585,0.9264314109647585,VCU,Hofstra,6,4,NA,310272670,2011-01-27
178,2,17:05,1025,1025,Mike Moore Defensive Rebound.,53,38,15,8,0.9264314109647585,0.9264314109647585,VCU,Hofstra,6,4,NA,310272670,2011-01-27
179,2,16:57,1017,1017,Charles Jenkins missed Two Point Jumper.,53,38,15,0,0.9272300847416843,0.9272300847416843,VCU,Hofstra,6,4,NA,310272670,2011-01-27
180,2,16:57,1017,1017,Ed Nixon Block.,53,38,15,1,0.9272300847416843,0.9272300847416843,VCU,Hofstra,6,4,NA,310272670,2011-01-27
181,2,16:56,1016,1016,Greg Washington Offensive Rebound.,53,38,15,1,0.9273308362580164,0.9273308362580164,VCU,Hofstra,6,4,NA,310272670,2011-01-27
182,2,16:55,1015,1015,Greg Washington made Two Point Layup.,53,40,13,8,0.9009810893273625,0.9009810893273625,VCU,Hofstra,6,4,NA,310272670,2011-01-27
183,2,16:47,1007,1007,Juvonte Reddic made Two Point Jumper.,55,40,15,0,0.9282472052007551,0.9282472052007551,VCU,Hofstra,6,4,NA,310272670,2011-01-27
