play_id,half,time_remaining_half,secs_remaining,secs_remaining_absolute,description,home_score,away_score,score_diff,play_length,win_prob,naive_win_prob,home,away,home_time_out_remaining,away_time_out_remaining,home_favored_by,game_id,date
1,1,20:00,2400,2400,PLAY,0,0,0,11,0.5,0.5,Arkansas,Marist,6,6,NA,263280008,2006-11-24
2,1,19:49,2389,2389,Charles Thomas missed Two Point Jumper.,0,0,0,0,0.5,0.5,Arkansas,Marist,6,6,NA,263280008,2006-11-24
3,1,19:49,2389,2389,Ben Farmer Defensive Rebound.,0,0,0,21,0.5,0.5,Arkansas,Marist,6,6,NA,263280008,2006-11-24
4,1,19:28,2368,2368,Ryan Stilphen missed Two Point Jumper.,0,0,0,0,0.5,0.5,Arkansas,Marist,6,6,NA,263280008,2006-11-24
5,1,19:28,2368,2368,Patrick Beverley Defensive Rebound.,0,0,0,16,0.5,0.5,Arkansas,Marist,6,6,NA,263280008,2006-11-24
6,1,19:12,2352,2352,Steven Hill missed Two Point Jumper.,0,0,0,0,0.5,0.5,Arkansas,Marist,6,6,NA,263280008,2006-11-24
7,1,19:12,2352,2352,Ryan Stilphen Defensive Rebound.,0,0,0,10,0.5,0.5,Arkansas,Marist,6,6,NA,263280008,2006-11-24
8,1,19:02,2342,2342,Jared Jordan made Two Point Layup.,0,2,-2,26,0.4547357647420433,0.4547357647420433,Arkansas,Marist,6,6,NA,263280008,2006-11-24
9,1,18:36,2316,2316,Foul on Charles Thomas,0,2,-2,19,0.4541666112249718,0.4541666112249718,Arkansas,Marist,6,6,NA,263280008,2006-11-24
10,1,18:17,2297,2297,Patrick Beverley missed Three Point Jumper.,0,2,-2,0,0.45374590273656884,0.45374590273656884,Arkansas,Marist,6,6,NA,263280008,2006-11-24
11,1,18:17,2297,2297,Jared Jordan Defensive Rebound.,0,2,-2,11,0.45374590273656884,0.45374590273656884,Arkansas,Marist,6,6,NA,263280008,2006-11-24
12,1,18:06,2286,2286,Will Whittington missed Three Point Jumper.,0,2,-2,0,0.45350064852943234,0.45350064852943234,Arkansas,Marist,6,6,NA,263280008,2006-11-24
13,1,18:06,2286,2286,Arkansas Defensive Rebound.,0,2,-2,10,0.45350064852943234,0.45350064852943234,Arkansas,Marist,6,6,NA,263280008,2006-11-24
14,1,17:56,2276,2276,Charles Thomas missed Two Point Jumper.,0,2,-2,0,0.4532766908152387,0.4532766908152387,Arkansas,Marist,6,6,NA,263280008,2006-11-24
15,1,17:56,2276,2276,Arkansas Defensive Rebound.,0,2,-2,7,0.4532766908152387,0.4532766908152387,Arkansas,Marist,6,6,NA,263280008,2006-11-24
16,1,17:49,2269,2269,Foul on Steven Hill,0,2,-2,8,0.4531193833259757,0.4531193833259757,Arkansas,Marist,6,6,NA,263280008,2006-11-24
17,1,17:41,2261,2261,James Smith made Two Point Jumper.,0,4,-4,27,0.4067046716886604,0.4067046716886604,Arkansas,Marist,6,6,NA,263280008,2006-11-24
18,1,17:14,2234,2234,Patrick Beverley missed Two Point Jumper.,0,4,-4,0,0.4055127366726435,0.4055127366726435,Arkansas,Marist,6,6,NA,263280008,2006-11-24
19,1,17:14,2234,2234,Ryan Stilphen Defensive Rebound.,0,4,-4,9,0.4055127366726435,0.4055127366726435,Arkansas,Marist,6,6,NA,263280008,2006-11-24
20,1,17:05,2225,2225,Ben Farmer missed Three Point Jumper.,0,4,-4,0,0.40511337697178423,0.40511337697178423,Arkansas,Marist,6,6,NA,263280008,2006-11-24
21,1,17:05,2225,2225,Ryan Stilphen Offensive Rebound.,0,4,-4,3,0.40511337697178423,0.40511337697178423,Arkansas,Marist,6,6,NA,263280008,2006-11-24
22,1,17:02,2222,2222,Ryan Stilphen made Two Point Layup.,0,6,-6,24,0.35959194238658726,0.35959194238658726,Arkansas,Marist,6,6,NA,263280008,2006-11-24
23,1,16:38,2198,2198,Sonny Weems missed Two Point Jumper.,0,6,-6,1,0.3580591313077635,0.3580591313077635,Arkansas,Marist,6,6,NA,263280008,2006-11-24
24,1,16:37,2197,2197,James Smith Defensive Rebound.,0,6,-6,6,0.35799513597469457,0.35799513597469457,Arkansas,Marist,6,6,NA,263280008,2006-11-24
25,1,16:31,2191,2191,James Smith missed Three Point Jumper.,0,6,-6,0,0.35761098132125135,0.35761098132125135,Arkansas,Marist,6,6,NA,263280008,2006-11-24
26,1,16:31,2191,2191,Sonny Weems Defensive Rebound.,0,6,-6,7,0.35761098132125135,0.35761098132125135,Arkansas,Marist,6,6,NA,263280008,2006-11-24
27,1,16:24,2184,2184,Gary Ervin made Two Point Layup.,2,6,-4,57,0.40328384044088056,0.40328384044088056,Arkansas,Marist,6,6,NA,263280008,2006-11-24
28,1,15:27,2127,2127,Gary Ervin missed Three Point Jumper.,2,6,-4,0,0.40071370801084083,0.40071370801084083,Arkansas,Marist,6,6,NA,263280008,2006-11-24
29,1,15:27,2127,2127,Sonny Weems Offensive Rebound.,2,6,-4,9,0.40071370801084083,0.40071370801084083,Arkansas,Marist,6,6,NA,263280008,2006-11-24
30,1,15:18,2118,2118,Sonny Weems missed Two Point Jumper.,2,6,-4,0,0.4003036914195069,0.4003036914195069,Arkansas,Marist,6,6,NA,263280008,2006-11-24
31,1,15:18,2118,2118,Sonny Weems Offensive Rebound.,2,6,-4,2,0.4003036914195069,0.4003036914195069,Arkansas,Marist,6,6,NA,263280008,2006-11-24
32,1,15:16,2116,2116,Sonny Weems made Two Point Jumper.,4,6,-2,16,0.4495992322531265,0.4495992322531265,Arkansas,Marist,6,6,NA,263280008,2006-11-24
33,1,15:00,2100,2100,Will Whittington missed Two Point Jumper.,4,6,-2,0,0.4492214765326713,0.4492214765326713,Arkansas,Marist,6,6,NA,263280008,2006-11-24
34,1,15:00,2100,2100,Gary Ervin Defensive Rebound.,4,6,-2,8,0.4492214765326713,0.4492214765326713,Arkansas,Marist,6,6,NA,263280008,2006-11-24
35,1,14:52,2092,2092,Foul on Patrick Beverley,4,6,-2,0,0.44903168923721765,0.44903168923721765,Arkansas,Marist,6,6,NA,263280008,2006-11-24
36,1,14:52,2092,2092,Official TV Timeout.,4,6,-2,6,0.44903168923721765,0.44903168923721765,Arkansas,Marist,6,6,NA,263280008,2006-11-24
37,1,14:46,2086,2086,Jared Jordan missed Two Point Jumper.,4,6,-2,0,0.4488889368026057,0.4488889368026057,Arkansas,Marist,6,6,NA,263280008,2006-11-24
38,1,14:46,2086,2086,Darian Townes Defensive Rebound.,4,6,-2,20,0.4488889368026057,0.4488889368026057,Arkansas,Marist,6,6,NA,263280008,2006-11-24
39,1,14:26,2066,2066,Sonny Weems made Two Point Jumper.,6,6,0,37,0.5,0.5,Arkansas,Marist,6,6,NA,263280008,2006-11-24
40,1,13:49,2029,2029,Vincent Hunter missed Three Point Jumper.,6,6,0,0,0.5,0.5,Arkansas,Marist,6,6,NA,263280008,2006-11-24
41,1,13:49,2029,2029,Shea McNamara Defensive Rebound.,6,6,0,18,0.5,0.5,Arkansas,Marist,6,6,NA,263280008,2006-11-24
42,1,13:31,2011,2011,James Smith missed Two Point Jumper.,6,6,0,0,0.5,0.5,Arkansas,Marist,6,6,NA,263280008,2006-11-24
43,1,13:31,2011,2011,Sonny Weems Defensive Rebound.,6,6,0,31,0.5,0.5,Arkansas,Marist,6,6,NA,263280008,2006-11-24
44,1,13:00,1980,1980,Wilfred Benjamin missed Two Point Layup.,6,6,0,1,0.5,0.5,Arkansas,Marist,6,6,NA,263280008,2006-11-24
45,1,12:59,1979,1979,Ryan Stilphen Offensive Rebound.,6,6,0,15,0.5,0.5,Arkansas,Marist,6,6,NA,263280008,2006-11-24
46,1,12:44,1964,1964,Stefan Welsh made Three Point Jumper.,9,6,3,29,0.5807586792335678,0.5807586792335678,Arkansas,Marist,6,6,NA,263280008,2006-11-24
47,1,12:15,1935,1935,Gerald Carter missed Three Point Jumper.,9,6,3,0,0.5818517387594804,0.5818517387594804,Arkansas,Marist,6,6,NA,263280008,2006-11-24
48,1,12:15,1935,1935,Stefan Welsh Defensive Rebound.,9,6,3,14,0.5818517387594804,0.5818517387594804,Arkansas,Marist,6,6,NA,263280008,2006-11-24
49,1,12:01,1921,1921,Darian Townes missed Two Point Layup.,9,6,3,0,0.5823846741247521,0.5823846741247521,Arkansas,Marist,6,6,NA,263280008,2006-11-24
50,1,12:01,1921,1921,Jared Jordan Defensive Rebound.,9,6,3,5,0.5823846741247521,0.5823846741247521,Arkansas,Marist,6,6,NA,263280008,2006-11-24
51,1,11:56,1916,1916,Foul on Sean McCurdy,9,6,3,0,0.5825748011638271,0.5825748011638271,Arkansas,Marist,6,6,NA,263280008,2006-11-24
52,1,11:56,1916,1916,Official TV Timeout.,9,6,3,0,0.5825748011638271,0.5825748011638271,Arkansas,Marist,6,6,NA,263280008,2006-11-24
53,1,11:56,1916,1916,Gerald Carter missed Free Throw.,9,6,3,0,0.5825748011638271,0.5825748011638271,Arkansas,Marist,6,6,NA,263280008,2006-11-24
54,1,11:56,1916,1916,Marist Defensive Rebound.,9,6,3,0,0.5825748011638271,0.5825748011638271,Arkansas,Marist,6,6,NA,263280008,2006-11-24
55,1,11:56,1916,1916,Gerald Carter missed Free Throw.,9,6,3,0,0.5825748011638271,0.5825748011638271,Arkansas,Marist,6,6,NA,263280008,2006-11-24
56,1,11:56,1916,1916,Darian Townes Defensive Rebound.,9,6,3,19,0.5825748011638271,0.5825748011638271,Arkansas,Marist,6,6,NA,263280008,2006-11-24
57,1,11:37,1897,1897,Foul on Ryan Stilphen,9,6,3,13,0.5832962846408858,0.5832962846408858,Arkansas,Marist,6,6,NA,263280008,2006-11-24
58,1,11:24,1884,1884,Foul on Ryan Stilphen,9,6,3,0,0.5837896020085477,0.5837896020085477,Arkansas,Marist,6,6,NA,263280008,2006-11-24
59,1,11:24,1884,1884,Vincent Hunter made Free Throw.,10,6,4,0,0.6109085812400424,0.6109085812400424,Arkansas,Marist,6,6,NA,263280008,2006-11-24
60,1,11:24,1884,1884,Vincent Hunter missed Free Throw.,10,6,4,0,0.6109085812400424,0.6109085812400424,Arkansas,Marist,6,6,NA,263280008,2006-11-24
61,1,11:24,1884,1884,Wilfred Benjamin Defensive Rebound.,10,6,4,27,0.6109085812400424,0.6109085812400424,Arkansas,Marist,6,6,NA,263280008,2006-11-24
62,1,10:57,1857,1857,Gerald Carter missed Two Point Layup.,10,6,4,2,0.612246665901079,0.612246665901079,Arkansas,Marist,6,6,NA,263280008,2006-11-24
63,1,10:55,1855,1855,Vincent Hunter Defensive Rebound.,10,6,4,14,0.6123459826550677,0.6123459826550677,Arkansas,Marist,6,6,NA,263280008,2006-11-24
64,1,10:41,1841,1841,Stefan Welsh missed Three Point Jumper.,10,6,4,0,0.6130424411202632,0.6130424411202632,Arkansas,Marist,6,6,NA,263280008,2006-11-24
65,1,10:41,1841,1841,Ryan Stilphen Defensive Rebound.,10,6,4,31,0.6130424411202632,0.6130424411202632,Arkansas,Marist,6,6,NA,263280008,2006-11-24
66,1,10:10,1810,1810,Ryan Stilphen made Two Point Jumper.,10,8,2,11,0.558070640203388,0.558070640203388,Arkansas,Marist,6,6,NA,263280008,2006-11-24
67,1,9:59,1799,1799,Foul on Gerald Carter,10,8,2,8,0.5583601374752247,0.5583601374752247,Arkansas,Marist,6,6,NA,263280008,2006-11-24
68,1,9:51,1791,1791,Charles Thomas missed Two Point Jumper.,10,8,2,0,0.5585717818052074,0.5585717818052074,Arkansas,Marist,6,6,NA,263280008,2006-11-24
69,1,9:51,1791,1791,Jared Jordan Defensive Rebound.,10,8,2,8,0.5585717818052074,0.5585717818052074,Arkansas,Marist,6,6,NA,263280008,2006-11-24
70,1,9:43,1783,1783,Jared Jordan made Three Point Jumper.,10,11,-1,16,0.4705055032052506,0.4705055032052506,Arkansas,Marist,6,6,NA,263280008,2006-11-24
71,1,9:27,1767,1767,Darian Townes missed Two Point Layup.,10,11,-1,0,0.47028889989093037,0.47028889989093037,Arkansas,Marist,6,6,NA,263280008,2006-11-24
72,1,9:27,1767,1767,James Smith Defensive Rebound.,10,11,-1,3,0.47028889989093037,0.47028889989093037,Arkansas,Marist,6,6,NA,263280008,2006-11-24
73,1,9:24,1764,1764,Foul on Darian Townes,10,11,-1,48,0.4702480113212606,0.4702480113212606,Arkansas,Marist,6,6,NA,263280008,2006-11-24
74,1,8:36,1716,1716,Sonny Weems missed Three Point Jumper.,10,11,-1,0,0.46957984556608334,0.46957984556608334,Arkansas,Marist,6,6,NA,263280008,2006-11-24
75,1,8:36,1716,1716,Jared Jordan Defensive Rebound.,10,11,-1,9,0.46957984556608334,0.46957984556608334,Arkansas,Marist,6,6,NA,263280008,2006-11-24
76,1,8:27,1707,1707,Will Whittington missed Two Point Layup.,10,11,-1,0,0.46945124391114296,0.46945124391114296,Arkansas,Marist,6,6,NA,263280008,2006-11-24
77,1,8:27,1707,1707,Gary Ervin Defensive Rebound.,10,11,-1,34,0.46945124391114296,0.46945124391114296,Arkansas,Marist,6,6,NA,263280008,2006-11-24
78,1,7:53,1673,1673,Gary Ervin made Three Point Jumper.,13,11,2,9,0.5618419905853336,0.5618419905853336,Arkansas,Marist,6,6,NA,263280008,2006-11-24
79,1,7:44,1664,1664,Jared Jordan made Two Point Jumper.,13,13,0,9,0.5,0.5,Arkansas,Marist,6,6,NA,263280008,2006-11-24
80,1,7:35,1655,1655,Official TV Timeout.,13,13,0,41,0.5,0.5,Arkansas,Marist,6,6,NA,263280008,2006-11-24
81,1,6:54,1614,1614,Steven Hill missed Two Point Jumper.,13,13,0,1,0.5,0.5,Arkansas,Marist,6,6,NA,263280008,2006-11-24
82,1,6:53,1613,1613,James Smith Defensive Rebound.,13,13,0,7,0.5,0.5,Arkansas,Marist,6,6,NA,263280008,2006-11-24
83,1,6:46,1606,1606,Vincent Hunter missed Two Point Layup.,13,13,0,0,0.5,0.5,Arkansas,Marist,6,6,NA,263280008,2006-11-24
84,1,6:46,1606,1606,Steven Hill Offensive Rebound.,13,13,0,2,0.5,0.5,Arkansas,Marist,6,6,NA,263280008,2006-11-24
85,1,6:44,1604,1604,Steven Hill made Two Point Tip Shot.,15,13,2,19,0.5637240248420919,0.5637240248420919,Arkansas,Marist,6,6,NA,263280008,2006-11-24
86,1,6:25,1585,1585,Marist Full Timeout.,15,13,2,15,0.5642339869763727,0.5642339869763727,Arkansas,Marist,5,6,NA,263280008,2006-11-24
87,1,6:10,1570,1570,Jared Jordan missed Three Point Jumper.,15,13,2,0,0.5646388124213363,0.5646388124213363,Arkansas,Marist,5,6,NA,263280008,2006-11-24
88,1,6:10,1570,1570,Sonny Weems Defensive Rebound.,15,13,2,7,0.5646388124213363,0.5646388124213363,Arkansas,Marist,5,6,NA,263280008,2006-11-24
89,1,6:03,1563,1563,Patrick Beverley made Two Point Layup.,17,13,4,9,0.6275142789687397,0.6275142789687397,Arkansas,Marist,5,6,NA,263280008,2006-11-24
90,1,5:54,1554,1554,James Smith missed Three Point Jumper.,17,13,4,0,0.6279821600762361,0.6279821600762361,Arkansas,Marist,5,6,NA,263280008,2006-11-24
91,1,5:54,1554,1554,Foul on Miles Orman,17,13,4,12,0.6279821600762361,0.6279821600762361,Arkansas,Marist,5,6,NA,263280008,2006-11-24
92,1,5:42,1542,1542,Foul on Steven Hill,17,13,4,23,0.6286121310510163,0.6286121310510163,Arkansas,Marist,5,6,NA,263280008,2006-11-24
93,1,5:19,1519,1519,Marist Full Timeout.,17,13,4,12,0.6298451677848165,0.6298451677848165,Arkansas,Marist,4,6,NA,263280008,2006-11-24
94,1,5:07,1507,1507,Ben Farmer missed Three Point Jumper.,17,13,4,0,0.6305051821717169,0.6305051821717169,Arkansas,Marist,4,6,NA,263280008,2006-11-24
95,1,5:07,1507,1507,Arkansas Defensive Rebound.,17,13,4,15,0.6305051821717169,0.6305051821717169,Arkansas,Marist,4,6,NA,263280008,2006-11-24
96,1,4:52,1492,1492,Sonny Weems made Two Point Jumper.,19,13,6,19,0.6914735123425235,0.6914735123425235,Arkansas,Marist,4,6,NA,263280008,2006-11-24
97,1,4:33,1473,1473,James Smith missed Two Point Jumper.,19,13,6,0,0.6929927849690484,0.6929927849690484,Arkansas,Marist,4,6,NA,263280008,2006-11-24
98,1,4:33,1473,1473,Gary Ervin Defensive Rebound.,19,13,6,11,0.6929927849690484,0.6929927849690484,Arkansas,Marist,4,6,NA,263280008,2006-11-24
99,1,4:22,1462,1462,Patrick Beverley missed Three Point Jumper.,19,13,6,0,0.6939000118380868,0.6939000118380868,Arkansas,Marist,4,6,NA,263280008,2006-11-24
100,1,4:22,1462,1462,Ryan Stilphen Defensive Rebound.,19,13,6,11,0.6939000118380868,0.6939000118380868,Arkansas,Marist,4,6,NA,263280008,2006-11-24
101,1,4:11,1451,1451,James Smith made Three Point Jumper.,19,16,3,23,0.6014231388214079,0.6014231388214079,Arkansas,Marist,4,6,NA,263280008,2006-11-24
102,1,3:48,1428,1428,Darian Townes missed Two Point Jumper.,19,16,3,0,0.6025131530285939,0.6025131530285939,Arkansas,Marist,4,6,NA,263280008,2006-11-24
103,1,3:48,1428,1428,Vincent Hunter Offensive Rebound.,19,16,3,6,0.6025131530285939,0.6025131530285939,Arkansas,Marist,4,6,NA,263280008,2006-11-24
104,1,3:42,1422,1422,Foul on Vincent Hunter,19,16,3,0,0.6027895181625738,0.6027895181625738,Arkansas,Marist,4,6,NA,263280008,2006-11-24
105,1,3:42,1422,1422,Official TV Timeout.,19,16,3,15,0.6027895181625738,0.6027895181625738,Arkansas,Marist,4,6,NA,263280008,2006-11-24
106,1,3:27,1407,1407,Jared Jordan missed Two Point Jumper.,19,16,3,0,0.6034692036129541,0.6034692036129541,Arkansas,Marist,4,6,NA,263280008,2006-11-24
107,1,3:27,1407,1407,Charles Thomas Defensive Rebound.,19,16,3,20,0.6034692036129541,0.6034692036129541,Arkansas,Marist,4,6,NA,263280008,2006-11-24
108,1,3:07,1387,1387,Stefan Welsh missed Three Point Jumper.,19,16,3,0,0.604357288575371,0.604357288575371,Arkansas,Marist,4,6,NA,263280008,2006-11-24
109,1,3:07,1387,1387,Will Whittington Defensive Rebound.,19,16,3,54,0.604357288575371,0.604357288575371,Arkansas,Marist,4,6,NA,263280008,2006-11-24
110,1,2:13,1333,1333,Ben Farmer made Three Point Jumper.,19,19,0,29,0.5,0.5,Arkansas,Marist,4,6,NA,263280008,2006-11-24
111,1,1:44,1304,1304,Darian Townes missed Two Point Jumper.,19,19,0,0,0.5,0.5,Arkansas,Marist,4,6,NA,263280008,2006-11-24
112,1,1:44,1304,1304,Darian Townes Offensive Rebound.,19,19,0,11,0.5,0.5,Arkansas,Marist,4,6,NA,263280008,2006-11-24
113,1,1:33,1293,1293,Foul on James Smith,19,19,0,5,0.5,0.5,Arkansas,Marist,4,6,NA,263280008,2006-11-24
114,1,1:28,1288,1288,Vincent Hunter missed Two Point Layup.,19,19,0,0,0.5,0.5,Arkansas,Marist,4,6,NA,263280008,2006-11-24
115,1,1:28,1288,1288,James Smith Defensive Rebound.,19,19,0,13,0.5,0.5,Arkansas,Marist,4,6,NA,263280008,2006-11-24
116,1,1:15,1275,1275,James Smith missed Three Point Jumper.,19,19,0,0,0.5,0.5,Arkansas,Marist,4,6,NA,263280008,2006-11-24
117,1,1:15,1275,1275,Sonny Weems Defensive Rebound.,19,19,0,4,0.5,0.5,Arkansas,Marist,4,6,NA,263280008,2006-11-24
118,1,1:11,1271,1271,Foul on Ben Farmer,19,19,0,12,0.5,0.5,Arkansas,Marist,4,6,NA,263280008,2006-11-24
119,1,0:59,1259,1259,Stefan Welsh missed Two Point Layup.,19,19,0,3,0.5,0.5,Arkansas,Marist,4,6,NA,263280008,2006-11-24
120,1,0:56,1256,1256,Sonny Weems Offensive Rebound.,19,19,0,11,0.5,0.5,Arkansas,Marist,4,6,NA,263280008,2006-11-24
121,1,0:45,1245,1245,Stefan Welsh made Three Point Jumper.,22,19,3,26,0.6110218459469957,0.6110218459469957,Arkansas,Marist,4,6,NA,263280008,2006-11-24
122,1,0:19,1219,1219,James Smith missed Three Point Jumper.,22,19,3,0,0.6125014116189076,0.6125014116189076,Arkansas,Marist,4,6,NA,263280008,2006-11-24
123,1,0:19,1219,1219,Ben Farmer Offensive Rebound.,22,19,3,12,0.6125014116189076,0.6125014116189076,Arkansas,Marist,4,6,NA,263280008,2006-11-24
124,1,0:07,1207,1207,Jared Jordan missed Three Point Jumper.,22,19,3,0,0.6132286222722646,0.6132286222722646,Arkansas,Marist,4,6,NA,263280008,2006-11-24
125,1,0:07,1207,1207,Arkansas Defensive Rebound.,22,19,3,3,0.6132286222722646,0.6132286222722646,Arkansas,Marist,4,6,NA,263280008,2006-11-24
126,1,0:04,1204,1204,Arkansas Full Timeout.,22,19,3,3,0.6134109091191572,0.6134109091191572,Arkansas,Marist,4,5,NA,263280008,2006-11-24
127,1,0:01,1201,1201,Gary Ervin missed Three Point Jumper.,22,19,3,0,0.6135920191128087,0.6135920191128087,Arkansas,Marist,4,5,NA,263280008,2006-11-24
128,1,0:01,1201,1201,Marist Defensive Rebound.,22,19,3,1,0.6135920191128087,0.6135920191128087,Arkansas,Marist,4,5,NA,263280008,2006-11-24
129,1,0:00,1200,1200,End of the 1st Half.,22,19,3,0,0.6136521367497382,0.6136521367497382,Arkansas,Marist,4,5,NA,263280008,2006-11-24
130,2,20:00,1200,1200,PLAY,22,19,3,10,0.6136521367497382,0.6136521367497382,Arkansas,Marist,4,5,NA,263280008,2006-11-24
131,2,19:50,1190,1190,Charles Thomas missed Three Point Jumper.,22,19,3,0,0.6142468765901157,0.6142468765901157,Arkansas,Marist,4,5,NA,263280008,2006-11-24
132,2,19:50,1190,1190,Jared Jordan Defensive Rebound.,22,19,3,12,0.6142468765901157,0.6142468765901157,Arkansas,Marist,4,5,NA,263280008,2006-11-24
133,2,19:38,1178,1178,James Smith made Three Point Jumper.,22,22,0,20,0.5,0.5,Arkansas,Marist,4,5,NA,263280008,2006-11-24
134,2,19:18,1158,1158,Charles Thomas made Two Point Jumper.,24,22,2,11,0.5781842429615593,0.5781842429615593,Arkansas,Marist,4,5,NA,263280008,2006-11-24
135,2,19:07,1147,1147,Foul on Gary Ervin,24,22,2,0,0.5786110384287257,0.5786110384287257,Arkansas,Marist,4,5,NA,263280008,2006-11-24
136,2,19:07,1147,1147,Jared Jordan missed Free Throw.,24,22,2,0,0.5786110384287257,0.5786110384287257,Arkansas,Marist,4,5,NA,263280008,2006-11-24
137,2,19:07,1147,1147,Marist Defensive Rebound.,24,22,2,0,0.5786110384287257,0.5786110384287257,Arkansas,Marist,4,5,NA,263280008,2006-11-24
138,2,19:07,1147,1147,Jared Jordan made Free Throw.,24,23,1,12,0.5395514645944625,0.5395514645944625,Arkansas,Marist,4,5,NA,263280008,2006-11-24
139,2,18:55,1135,1135,Gary Ervin missed Three Point Jumper.,24,23,1,0,0.5397878641816826,0.5397878641816826,Arkansas,Marist,4,5,NA,263280008,2006-11-24
140,2,18:55,1135,1135,Ryan Stilphen Defensive Rebound.,24,23,1,19,0.5397878641816826,0.5397878641816826,Arkansas,Marist,4,5,NA,263280008,2006-11-24
141,2,18:36,1116,1116,Foul on Charles Thomas,24,23,1,0,0.5401632959936455,0.5401632959936455,Arkansas,Marist,4,5,NA,263280008,2006-11-24
142,2,18:36,1116,1116,Jared Jordan made Free Throw.,24,24,0,0,0.5,0.5,Arkansas,Marist,4,5,NA,263280008,2006-11-24
143,2,18:36,1116,1116,Jared Jordan made Free Throw.,24,25,-1,16,0.45983670400635435,0.45983670400635435,Arkansas,Marist,4,5,NA,263280008,2006-11-24
144,2,18:20,1100,1100,Patrick Beverley made Three Point Jumper.,27,25,2,20,0.5804396677363385,0.5804396677363385,Arkansas,Marist,4,5,NA,263280008,2006-11-24
145,2,18:00,1080,1080,Sonny Weems made Three Point Jumper.,30,25,5,22,0.6941726129867419,0.6941726129867419,Arkansas,Marist,4,5,NA,263280008,2006-11-24
146,2,17:38,1058,1058,Foul on Charles Thomas,30,25,5,3,0.6961756132160999,0.6961756132160999,Arkansas,Marist,4,5,NA,263280008,2006-11-24
147,2,17:35,1055,1055,Will Whittington made Two Point Layup.,30,27,3,31,0.6220567837845962,0.6220567837845962,Arkansas,Marist,4,5,NA,263280008,2006-11-24
148,2,17:04,1024,1024,Sonny Weems missed Two Point Jumper.,30,27,3,0,0.6240831086483746,0.6240831086483746,Arkansas,Marist,4,5,NA,263280008,2006-11-24
149,2,17:04,1024,1024,Will Whittington Defensive Rebound.,30,27,3,5,0.6240831086483746,0.6240831086483746,Arkansas,Marist,4,5,NA,263280008,2006-11-24
150,2,16:59,1019,1019,Jared Jordan missed Two Point Layup.,30,27,3,2,0.6244278396872737,0.6244278396872737,Arkansas,Marist,4,5,NA,263280008,2006-11-24
151,2,16:57,1017,1017,Sonny Weems Defensive Rebound.,30,27,3,16,0.6245672909907259,0.6245672909907259,Arkansas,Marist,4,5,NA,263280008,2006-11-24
152,2,16:41,1001,1001,Patrick Beverley missed Three Point Jumper.,30,27,3,0,0.6257170294951038,0.6257170294951038,Arkansas,Marist,4,5,NA,263280008,2006-11-24
153,2,16:41,1001,1001,Jared Jordan Defensive Rebound.,30,27,3,12,0.6257170294951038,0.6257170294951038,Arkansas,Marist,4,5,NA,263280008,2006-11-24
154,2,16:29,989,989,Foul on Vincent Hunter,30,27,3,0,0.6266222712043514,0.6266222712043514,Arkansas,Marist,4,5,NA,263280008,2006-11-24
155,2,16:29,989,989,Jared Jordan missed Free Throw.,30,27,3,0,0.6266222712043514,0.6266222712043514,Arkansas,Marist,4,5,NA,263280008,2006-11-24
156,2,16:29,989,989,Marist Defensive Rebound.,30,27,3,0,0.6266222712043514,0.6266222712043514,Arkansas,Marist,4,5,NA,263280008,2006-11-24
157,2,16:29,989,989,Jared Jordan made Free Throw.,30,28,2,17,0.5854455593029567,0.5854455593029567,Arkansas,Marist,4,5,NA,263280008,2006-11-24
158,2,16:12,972,972,Steven Hill made Two Point Dunk Shot.,32,28,4,27,0.6677552268679906,0.6677552268679906,Arkansas,Marist,4,5,NA,263280008,2006-11-24
159,2,15:45,945,945,Foul on Steven Hill,32,28,4,0,0.6704009859344976,0.6704009859344976,Arkansas,Marist,4,5,NA,263280008,2006-11-24
160,2,15:45,945,945,Official TV Timeout.,32,28,4,35,0.6704009859344976,0.6704009859344976,Arkansas,Marist,4,5,NA,263280008,2006-11-24
161,2,15:10,910,910,Jared Jordan made Two Point Jumper.,32,30,2,24,0.5894527432170011,0.5894527432170011,Arkansas,Marist,4,5,NA,263280008,2006-11-24
162,2,14:46,886,886,Foul on James Smith,32,30,2,14,0.5904783664080167,0.5904783664080167,Arkansas,Marist,4,5,NA,263280008,2006-11-24
163,2,14:32,872,872,Will Whittington made Two Point Layup.,32,32,0,19,0.5,0.5,Arkansas,Marist,4,5,NA,263280008,2006-11-24
164,2,14:13,853,853,Sean McCurdy missed Three Point Jumper.,32,32,0,0,0.5,0.5,Arkansas,Marist,4,5,NA,263280008,2006-11-24
165,2,14:13,853,853,Arkansas Defensive Rebound.,32,32,0,2,0.5,0.5,Arkansas,Marist,4,5,NA,263280008,2006-11-24
166,2,14:11,851,851,Foul on Shea McNamara,32,32,0,12,0.5,0.5,Arkansas,Marist,4,5,NA,263280008,2006-11-24
167,2,13:59,839,839,Foul on Shea McNamara,32,32,0,24,0.5,0.5,Arkansas,Marist,4,5,NA,263280008,2006-11-24
168,2,13:35,815,815,Vincent Hunter made Three Point Jumper.,35,32,3,14,0.6384629247566561,0.6384629247566561,Arkansas,Marist,4,5,NA,263280008,2006-11-24
169,2,13:21,801,801,Will Whittington made Three Point Jumper.,35,35,0,23,0.5,0.5,Arkansas,Marist,4,5,NA,263280008,2006-11-24
170,2,12:58,778,778,Vincent Hunter made Two Point Layup.,37,35,2,0,0.595753426184808,0.595753426184808,Arkansas,Marist,4,5,NA,263280008,2006-11-24
171,2,12:58,778,778,Foul on Gerald Carter,37,35,2,0,0.595753426184808,0.595753426184808,Arkansas,Marist,4,5,NA,263280008,2006-11-24
172,2,12:58,778,778,Vincent Hunter made Free Throw.,38,35,3,21,0.6414591185820087,0.6414591185820087,Arkansas,Marist,4,5,NA,263280008,2006-11-24
173,2,12:37,757,757,Darian Townes missed Two Point Jumper.,38,35,3,0,0.6434880099607001,0.6434880099607001,Arkansas,Marist,4,5,NA,263280008,2006-11-24
174,2,12:37,757,757,James Smith Defensive Rebound.,38,35,3,14,0.6434880099607001,0.6434880099607001,Arkansas,Marist,4,5,NA,263280008,2006-11-24
175,2,12:23,743,743,James Smith missed Three Point Jumper.,38,35,3,0,0.6450039985253034,0.6450039985253034,Arkansas,Marist,4,5,NA,263280008,2006-11-24
176,2,12:23,743,743,Patrick Beverley Defensive Rebound.,38,35,3,9,0.6450039985253034,0.6450039985253034,Arkansas,Marist,4,5,NA,263280008,2006-11-24
177,2,12:14,734,734,Stefan Welsh missed Three Point Jumper.,38,35,3,0,0.6460555289554031,0.6460555289554031,Arkansas,Marist,4,5,NA,263280008,2006-11-24
178,2,12:14,734,734,Arkansas Defensive Rebound.,38,35,3,8,0.6460555289554031,0.6460555289554031,Arkansas,Marist,4,5,NA,263280008,2006-11-24
179,2,12:06,726,726,Darian Townes made Two Point Jumper.,40,35,5,29,0.7330231623844677,0.7330231623844677,Arkansas,Marist,4,5,NA,263280008,2006-11-24
180,2,11:37,697,697,Ryan Stilphen missed Three Point Jumper.,40,35,5,0,0.7374878614535949,0.7374878614535949,Arkansas,Marist,4,5,NA,263280008,2006-11-24
181,2,11:37,697,697,Jared Jordan Offensive Rebound.,40,35,5,8,0.7374878614535949,0.7374878614535949,Arkansas,Marist,4,5,NA,263280008,2006-11-24
182,2,11:29,689,689,Foul on Sean McCurdy,40,35,5,0,0.738587146628762,0.738587146628762,Arkansas,Marist,4,5,NA,263280008,2006-11-24
183,2,11:29,689,689,Official TV Timeout.,40,35,5,0,0.738587146628762,0.738587146628762,Arkansas,Marist,4,5,NA,263280008,2006-11-24
184,2,11:29,689,689,Gerald Carter made Free Throw.,40,36,4,0,0.6965474164549059,0.6965474164549059,Arkansas,Marist,4,5,NA,263280008,2006-11-24
185,2,11:29,689,689,Gerald Carter missed Free Throw.,40,36,4,0,0.6965474164549059,0.6965474164549059,Arkansas,Marist,4,5,NA,263280008,2006-11-24
