play_id,half,time_remaining_half,secs_remaining,secs_remaining_absolute,description,home_score,away_score,score_diff,play_length,win_prob,naive_win_prob,home,away,home_time_out_remaining,away_time_out_remaining,home_favored_by,game_id,date
1,1,20:00,2400,2400,PLAY,0,0,0,11,0.5,0.5,Kentucky,South Carolina,6,6,NA,270380096,2007-02-07
2,1,19:49,2389,2389,Lukasz Obrzut made Two Point Jumper.,2,0,2,0,0.5442573673894345,0.5442573673894345,Kentucky,South Carolina,6,6,NA,270380096,2007-02-07
3,1,19:49,2389,2389,Lukasz Obrzut made Free Throw.,3,0,3,3,0.5661698401036358,0.5661698401036358,Kentucky,South Carolina,6,6,NA,270380096,2007-02-07
4,1,19:46,2386,2386,Foul on Brandon Wallace,3,0,3,23,0.5662639236131425,0.5662639236131425,Kentucky,South Carolina,6,6,NA,270380096,2007-02-07
5,1,19:23,2363,2363,Dominique Archie missed Two Point Jumper.,3,0,3,0,0.5669915426959111,0.5669915426959111,Kentucky,South Carolina,6,6,NA,270380096,2007-02-07
6,1,19:23,2363,2363,Joe Crawford Defensive Rebound.,3,0,3,22,0.5669915426959111,0.5669915426959111,Kentucky,South Carolina,6,6,NA,270380096,2007-02-07
7,1,19:01,2341,2341,Bobby Perry made Two Point Jumper.  Assisted by Ramel Bradley.,5,0,5,21,0.6116146008433824,0.6116146008433824,Kentucky,South Carolina,6,6,NA,270380096,2007-02-07
8,1,18:40,2320,2320,Tre Kelley made Two Point Layup.,5,2,3,0,0.5683792526997815,0.5683792526997815,Kentucky,South Carolina,6,6,NA,270380096,2007-02-07
9,1,18:40,2320,2320,Foul on Derrick Jasper,5,2,3,0,0.5683792526997815,0.5683792526997815,Kentucky,South Carolina,6,6,NA,270380096,2007-02-07
10,1,18:40,2320,2320,Tre Kelley made Free Throw.,5,3,2,10,0.545745316074961,0.545745316074961,Kentucky,South Carolina,6,6,NA,270380096,2007-02-07
11,1,18:30,2310,2310,Foul on Brandon Wallace,5,3,2,0,0.5459658291288992,0.5459658291288992,Kentucky,South Carolina,6,6,NA,270380096,2007-02-07
12,1,18:30,2310,2310,Joe Crawford made Free Throw.,6,3,3,0,0.5687065592332494,0.5687065592332494,Kentucky,South Carolina,6,6,NA,270380096,2007-02-07
13,1,18:30,2310,2310,Joe Crawford made Free Throw.,7,3,4,21,0.5911612156442078,0.5911612156442078,Kentucky,South Carolina,6,6,NA,270380096,2007-02-07
14,1,18:09,2289,2289,Bryce Sheldon made Two Point Jumper.  Assisted by Dominique Archie.,7,5,2,22,0.5464323470136655,0.5464323470136655,Kentucky,South Carolina,6,6,NA,270380096,2007-02-07
15,1,17:47,2267,2267,Bobby Perry made Three Point Jumper.  Assisted by Ramel Bradley.,10,5,5,42,0.615535573213502,0.615535573213502,Kentucky,South Carolina,6,6,NA,270380096,2007-02-07
16,1,17:05,2225,2225,Bobby Perry made Three Point Jumper.  Assisted by Ramel Bradley.,13,5,8,0,0.6831763539262857,0.6831763539262857,Kentucky,South Carolina,6,6,NA,270380096,2007-02-07
17,1,17:05,2225,2225,South Carolina 20 Second Timeout.,13,5,8,6,0.6831763539262857,0.6831763539262857,Kentucky,South Carolina,6,5,NA,270380096,2007-02-07
18,1,16:59,2219,2219,Ramel Bradley Steal.,13,5,8,3,0.6836553506874103,0.6836553506874103,Kentucky,South Carolina,6,5,NA,270380096,2007-02-07
19,1,16:56,2216,2216,Joe Crawford missed Two Point Layup.,13,5,8,0,0.6838949969290018,0.6838949969290018,Kentucky,South Carolina,6,5,NA,270380096,2007-02-07
20,1,16:56,2216,2216,Bobby Perry Offensive Rebound.,13,5,8,8,0.6838949969290018,0.6838949969290018,Kentucky,South Carolina,6,5,NA,270380096,2007-02-07
21,1,16:48,2208,2208,Bobby Perry made Two Point Tip Shot.,15,5,10,0,0.7247929041156268,0.7247929041156268,Kentucky,South Carolina,6,5,NA,270380096,2007-02-07
22,1,16:48,2208,2208,South Carolina 20 Second Timeout.,15,5,10,19,0.7247929041156268,0.7247929041156268,Kentucky,South Carolina,6,4,NA,270380096,2007-02-07
23,1,16:29,2189,2189,Foul on Tre Kelley,15,5,10,28,0.7265476660931253,0.7265476660931253,Kentucky,South Carolina,6,4,NA,270380096,2007-02-07
24,1,16:01,2161,2161,Ramel Bradley missed Three Point Jumper.,15,5,10,0,0.7291332266121306,0.7291332266121306,Kentucky,South Carolina,6,4,NA,270380096,2007-02-07
25,1,16:01,2161,2161,Evaldas Baniulis Defensive Rebound.,15,5,10,16,0.7291332266121306,0.7291332266121306,Kentucky,South Carolina,6,4,NA,270380096,2007-02-07
26,1,15:45,2145,2145,Evaldas Baniulis missed Three Point Jumper.,15,5,10,0,0.7306130600634273,0.7306130600634273,Kentucky,South Carolina,6,4,NA,270380096,2007-02-07
27,1,15:45,2145,2145,Bryce Sheldon Offensive Rebound.,15,5,10,15,0.7306130600634273,0.7306130600634273,Kentucky,South Carolina,6,4,NA,270380096,2007-02-07
28,1,15:30,2130,2130,Tre Kelley missed Three Point Jumper.,15,5,10,0,0.7320033682647233,0.7320033682647233,Kentucky,South Carolina,6,4,NA,270380096,2007-02-07
29,1,15:30,2130,2130,Derrick Jasper Defensive Rebound.,15,5,10,7,0.7320033682647233,0.7320033682647233,Kentucky,South Carolina,6,4,NA,270380096,2007-02-07
30,1,15:23,2123,2123,Joe Crawford made Three Point Jumper.  Assisted by Ramel Bradley.,18,5,13,30,0.7876075098928702,0.7876075098928702,Kentucky,South Carolina,6,4,NA,270380096,2007-02-07
31,1,14:53,2093,2093,Tre Kelley missed Three Point Jumper.,18,5,13,0,0.790703431586895,0.790703431586895,Kentucky,South Carolina,6,4,NA,270380096,2007-02-07
32,1,14:53,2093,2093,Kentucky Defensive Rebound.,18,5,13,6,0.790703431586895,0.790703431586895,Kentucky,South Carolina,6,4,NA,270380096,2007-02-07
33,1,14:47,2087,2087,Official TV Timeout.,18,5,13,24,0.7913231907144217,0.7913231907144217,Kentucky,South Carolina,6,4,NA,270380096,2007-02-07
34,1,14:23,2063,2063,Randolph Morris missed Two Point Jumper.,18,5,13,0,0.7938048631283897,0.7938048631283897,Kentucky,South Carolina,6,4,NA,270380096,2007-02-07
35,1,14:23,2063,2063,Tre Kelley Defensive Rebound.,18,5,13,10,0.7938048631283897,0.7938048631283897,Kentucky,South Carolina,6,4,NA,270380096,2007-02-07
36,1,14:13,2053,2053,Chad Gray missed Three Point Jumper.,18,5,13,0,0.7948403559301127,0.7948403559301127,Kentucky,South Carolina,6,4,NA,270380096,2007-02-07
37,1,14:13,2053,2053,Perry Stevenson Defensive Rebound.,18,5,13,32,0.7948403559301127,0.7948403559301127,Kentucky,South Carolina,6,4,NA,270380096,2007-02-07
38,1,13:41,2021,2021,Dwayne Day missed Three Point Jumper.,18,5,13,0,0.7981610761139467,0.7981610761139467,Kentucky,South Carolina,6,4,NA,270380096,2007-02-07
39,1,13:41,2021,2021,Sheray Thomas Defensive Rebound.,18,5,13,23,0.7981610761139467,0.7981610761139467,Kentucky,South Carolina,6,4,NA,270380096,2007-02-07
40,1,13:18,1998,1998,Foul on Chad Gray,18,5,13,5,0.8005557597466675,0.8005557597466675,Kentucky,South Carolina,6,4,NA,270380096,2007-02-07
41,1,13:13,1993,1993,Perry Stevenson made Free Throw.,19,5,14,0,0.8176040634527804,0.8176040634527804,Kentucky,South Carolina,6,4,NA,270380096,2007-02-07
42,1,13:13,1993,1993,Perry Stevenson made Free Throw.,20,5,15,37,0.8330438971223513,0.8330438971223513,Kentucky,South Carolina,6,4,NA,270380096,2007-02-07
43,1,12:36,1956,1956,Bryce Sheldon made Three Point Jumper.  Assisted by Tre Kelley.,20,8,12,13,0.7872586681614123,0.7872586681614123,Kentucky,South Carolina,6,4,NA,270380096,2007-02-07
44,1,12:23,1943,1943,Jodie Meeks missed Three Point Jumper.,20,8,12,0,0.7886042031175253,0.7886042031175253,Kentucky,South Carolina,6,4,NA,270380096,2007-02-07
45,1,12:23,1943,1943,Randolph Morris Offensive Rebound.,20,8,12,3,0.7886042031175253,0.7886042031175253,Kentucky,South Carolina,6,4,NA,270380096,2007-02-07
46,1,12:20,1940,1940,Randolph Morris made Two Point Jumper.,22,8,14,20,0.8231930953928763,0.8231930953928763,Kentucky,South Carolina,6,4,NA,270380096,2007-02-07
47,1,12:00,1920,1920,South Carolina 20 Second Timeout.,22,8,14,9,0.8253069975517504,0.8253069975517504,Kentucky,South Carolina,6,3,NA,270380096,2007-02-07
48,1,11:51,1911,1911,Bryce Sheldon missed Two Point Layup.,22,8,14,2,0.8262514349591191,0.8262514349591191,Kentucky,South Carolina,6,3,NA,270380096,2007-02-07
49,1,11:49,1909,1909,Sheray Thomas Defensive Rebound.,22,8,14,17,0.8264606448128546,0.8264606448128546,Kentucky,South Carolina,6,3,NA,270380096,2007-02-07
50,1,11:32,1892,1892,Michael Porter missed Three Point Jumper.,22,8,14,0,0.8282301335227966,0.8282301335227966,Kentucky,South Carolina,6,3,NA,270380096,2007-02-07
51,1,11:32,1892,1892,Bryce Sheldon Defensive Rebound.,22,8,14,12,0.8282301335227966,0.8282301335227966,Kentucky,South Carolina,6,3,NA,270380096,2007-02-07
52,1,11:20,1880,1880,Bryce Sheldon made Three Point Jumper.  Assisted by Tre Kelley.,22,11,11,33,0.7760696203868143,0.7760696203868143,Kentucky,South Carolina,6,3,NA,270380096,2007-02-07
53,1,10:47,1847,1847,Perry Stevenson made Two Point Layup.,24,11,13,13,0.8162724994558044,0.8162724994558044,Kentucky,South Carolina,6,3,NA,270380096,2007-02-07
54,1,10:34,1834,1834,Foul on Dominique Archie,24,11,13,0,0.8176001709786451,0.8176001709786451,Kentucky,South Carolina,6,3,NA,270380096,2007-02-07
55,1,10:34,1834,1834,Official TV Timeout.,24,11,13,17,0.8176001709786451,0.8176001709786451,Kentucky,South Carolina,6,3,NA,270380096,2007-02-07
56,1,10:17,1817,1817,Foul on Ramel Bradley,24,11,13,1,0.8193348373603475,0.8193348373603475,Kentucky,South Carolina,6,3,NA,270380096,2007-02-07
57,1,10:16,1816,1816,Chad Gray made Two Point Layup.  Assisted by Tre Kelley.,24,13,11,9,0.7824223583867437,0.7824223583867437,Kentucky,South Carolina,6,3,NA,270380096,2007-02-07
58,1,10:07,1807,1807,Joe Crawford missed Three Point Jumper.,24,13,11,0,0.7833170588332238,0.7833170588332238,Kentucky,South Carolina,6,3,NA,270380096,2007-02-07
59,1,10:07,1807,1807,Dwayne Day Defensive Rebound.,24,13,11,18,0.7833170588332238,0.7833170588332238,Kentucky,South Carolina,6,3,NA,270380096,2007-02-07
60,1,9:49,1789,1789,Tre Kelley missed Two Point Layup.,24,13,11,0,0.7851114500488104,0.7851114500488104,Kentucky,South Carolina,6,3,NA,270380096,2007-02-07
61,1,9:49,1789,1789,Bobby Perry Defensive Rebound.,24,13,11,7,0.7851114500488104,0.7851114500488104,Kentucky,South Carolina,6,3,NA,270380096,2007-02-07
62,1,9:42,1782,1782,Foul on Dwayne Day,24,13,11,0,0.7858115840951742,0.7858115840951742,Kentucky,South Carolina,6,3,NA,270380096,2007-02-07
63,1,9:42,1782,1782,Lukasz Obrzut missed Free Throw.,24,13,11,0,0.7858115840951742,0.7858115840951742,Kentucky,South Carolina,6,3,NA,270380096,2007-02-07
64,1,9:42,1782,1782,null,24,13,11,0,0.7858115840951742,0.7858115840951742,Kentucky,South Carolina,6,3,NA,270380096,2007-02-07
65,1,9:42,1782,1782,Lukasz Obrzut made Free Throw.,25,13,12,21,0.8050294206919043,0.8050294206919043,Kentucky,South Carolina,6,3,NA,270380096,2007-02-07
66,1,9:21,1761,1761,Foul on Lukasz Obrzut,25,13,12,12,0.8071751804377412,0.8071751804377412,Kentucky,South Carolina,6,3,NA,270380096,2007-02-07
67,1,9:09,1749,1749,Brandis Raley-Ross missed Two Point Jumper.,25,13,12,0,0.8084084193632316,0.8084084193632316,Kentucky,South Carolina,6,3,NA,270380096,2007-02-07
68,1,9:09,1749,1749,Brandon Wallace Offensive Rebound.,25,13,12,5,0.8084084193632316,0.8084084193632316,Kentucky,South Carolina,6,3,NA,270380096,2007-02-07
69,1,9:04,1744,1744,Chad Gray missed Two Point Layup.,25,13,12,0,0.8089240532272302,0.8089240532272302,Kentucky,South Carolina,6,3,NA,270380096,2007-02-07
70,1,9:04,1744,1744,Brandon Wallace Offensive Rebound.,25,13,12,5,0.8089240532272302,0.8089240532272302,Kentucky,South Carolina,6,3,NA,270380096,2007-02-07
71,1,8:59,1739,1739,Derrick Jasper Steal.,25,13,12,3,0.8094408240720649,0.8094408240720649,Kentucky,South Carolina,6,3,NA,270380096,2007-02-07
72,1,8:56,1736,1736,Ramel Bradley missed Two Point Layup.,25,13,12,0,0.8097514567869728,0.8097514567869728,Kentucky,South Carolina,6,3,NA,270380096,2007-02-07
73,1,8:56,1736,1736,Kentucky Offensive Rebound.,25,13,12,7,0.8097514567869728,0.8097514567869728,Kentucky,South Carolina,6,3,NA,270380096,2007-02-07
74,1,8:49,1729,1729,Bobby Perry made Two Point Jumper.  Assisted by Derrick Jasper.,27,13,14,26,0.8449206349967446,0.8449206349967446,Kentucky,South Carolina,6,3,NA,270380096,2007-02-07
75,1,8:23,1703,1703,Brandon Wallace missed Two Point Jumper.,27,13,14,0,0.847625522182192,0.847625522182192,Kentucky,South Carolina,6,3,NA,270380096,2007-02-07
76,1,8:23,1703,1703,Joe Crawford Defensive Rebound.,27,13,14,9,0.847625522182192,0.847625522182192,Kentucky,South Carolina,6,3,NA,270380096,2007-02-07
77,1,8:14,1694,1694,Joe Crawford made Three Point Jumper.,30,13,17,18,0.8901944834377404,0.8901944834377404,Kentucky,South Carolina,6,3,NA,270380096,2007-02-07
78,1,7:56,1676,1676,Chad Gray made Two Point Layup.,30,15,15,7,0.8655564535289006,0.8655564535289006,Kentucky,South Carolina,6,3,NA,270380096,2007-02-07
79,1,7:49,1669,1669,Ramel Bradley made Three Point Jumper.  Assisted by Derrick Jasper.,33,15,18,22,0.9039476182193894,0.9039476182193894,Kentucky,South Carolina,6,3,NA,270380096,2007-02-07
80,1,7:27,1647,1647,Brandon Wallace missed Two Point Jumper.,33,15,18,0,0.9058626558386749,0.9058626558386749,Kentucky,South Carolina,6,3,NA,270380096,2007-02-07
81,1,7:27,1647,1647,Dwayne Day Offensive Rebound.,33,15,18,4,0.9058626558386749,0.9058626558386749,Kentucky,South Carolina,6,3,NA,270380096,2007-02-07
82,1,7:23,1643,1643,Dwayne Day missed Two Point Jumper.,33,15,18,0,0.9062027703990232,0.9062027703990232,Kentucky,South Carolina,6,3,NA,270380096,2007-02-07
83,1,7:23,1643,1643,Derrick Jasper Defensive Rebound.,33,15,18,7,0.9062027703990232,0.9062027703990232,Kentucky,South Carolina,6,3,NA,270380096,2007-02-07
84,1,7:16,1636,1636,Ramel Bradley made Two Point Layup.  Assisted by Derrick Jasper.,35,15,20,19,0.9260731261404015,0.9260731261404015,Kentucky,South Carolina,6,3,NA,270380096,2007-02-07
85,1,6:57,1617,1617,Bryce Sheldon missed Three Point Jumper.,35,15,20,0,0.9274870669406297,0.9274870669406297,Kentucky,South Carolina,6,3,NA,270380096,2007-02-07
86,1,6:57,1617,1617,Derrick Jasper Defensive Rebound.,35,15,20,9,0.9274870669406297,0.9274870669406297,Kentucky,South Carolina,6,3,NA,270380096,2007-02-07
87,1,6:48,1608,1608,Foul on Bryce Sheldon,35,15,20,0,0.928144900073664,0.928144900073664,Kentucky,South Carolina,6,3,NA,270380096,2007-02-07
88,1,6:48,1608,1608,Official TV Timeout.,35,15,20,0,0.928144900073664,0.928144900073664,Kentucky,South Carolina,6,3,NA,270380096,2007-02-07
89,1,6:48,1608,1608,Joe Crawford made Free Throw.,36,15,21,0,0.9362231202658844,0.9362231202658844,Kentucky,South Carolina,6,3,NA,270380096,2007-02-07
90,1,6:48,1608,1608,Joe Crawford made Free Throw.,37,15,22,3,0.943448491894823,0.943448491894823,Kentucky,South Carolina,6,3,NA,270380096,2007-02-07
91,1,6:45,1605,1605,Randolph Morris made Two Point Jumper.  Assisted by Derrick Jasper.,39,15,24,32,0.9558145849558869,0.9558145849558869,Kentucky,South Carolina,6,3,NA,270380096,2007-02-07
92,1,6:13,1573,1573,Bryce Sheldon missed Two Point Jumper.,39,15,24,0,0.9575543549816861,0.9575543549816861,Kentucky,South Carolina,6,3,NA,270380096,2007-02-07
93,1,6:13,1573,1573,Brandon Wallace Offensive Rebound.,39,15,24,5,0.9575543549816861,0.9575543549816861,Kentucky,South Carolina,6,3,NA,270380096,2007-02-07
94,1,6:08,1568,1568,Brandon Wallace made Two Point Tip Shot.,39,17,22,8,0.9459632703521673,0.9459632703521673,Kentucky,South Carolina,6,3,NA,270380096,2007-02-07
95,1,6:00,1560,1560,Randolph Morris missed Two Point Jumper.,39,17,22,0,0.9464591849779533,0.9464591849779533,Kentucky,South Carolina,6,3,NA,270380096,2007-02-07
96,1,6:00,1560,1560,Dominique Archie Defensive Rebound.,39,17,22,19,0.9464591849779533,0.9464591849779533,Kentucky,South Carolina,6,3,NA,270380096,2007-02-07
97,1,5:41,1541,1541,Dominique Archie missed Two Point Jumper.,39,17,22,0,0.9476342723167901,0.9476342723167901,Kentucky,South Carolina,6,3,NA,270380096,2007-02-07
98,1,5:41,1541,1541,Randolph Morris Defensive Rebound.,39,17,22,7,0.9476342723167901,0.9476342723167901,Kentucky,South Carolina,6,3,NA,270380096,2007-02-07
99,1,5:34,1534,1534,Bobby Perry missed Two Point Layup.,39,17,22,0,0.9480673434588555,0.9480673434588555,Kentucky,South Carolina,6,3,NA,270380096,2007-02-07
100,1,5:34,1534,1534,Ramel Bradley Offensive Rebound.,39,17,22,4,0.9480673434588555,0.9480673434588555,Kentucky,South Carolina,6,3,NA,270380096,2007-02-07
101,1,5:30,1530,1530,Ramel Bradley made Two Point Tip Shot.,41,17,24,16,0.9598449084867097,0.9598449084867097,Kentucky,South Carolina,6,3,NA,270380096,2007-02-07
102,1,5:14,1514,1514,Tre Kelley made Two Point Layup.,41,19,22,24,0.9493092634271346,0.9493092634271346,Kentucky,South Carolina,6,3,NA,270380096,2007-02-07
103,1,4:50,1490,1490,Ramel Bradley missed Three Point Jumper.,41,19,22,0,0.9508166710231523,0.9508166710231523,Kentucky,South Carolina,6,3,NA,270380096,2007-02-07
104,1,4:50,1490,1490,Derrick Jasper Offensive Rebound.,41,19,22,12,0.9508166710231523,0.9508166710231523,Kentucky,South Carolina,6,3,NA,270380096,2007-02-07
105,1,4:38,1478,1478,Bobby Perry missed Three Point Jumper.,41,19,22,0,0.9515806956006749,0.9515806956006749,Kentucky,South Carolina,6,3,NA,270380096,2007-02-07
106,1,4:38,1478,1478,Randolph Morris Offensive Rebound.,41,19,22,3,0.9515806956006749,0.9515806956006749,Kentucky,South Carolina,6,3,NA,270380096,2007-02-07
107,1,4:35,1475,1475,Randolph Morris made Two Point Dunk Shot.,43,19,24,14,0.9627999430144135,0.9627999430144135,Kentucky,South Carolina,6,3,NA,270380096,2007-02-07
108,1,4:21,1461,1461,Foul on Randolph Morris,43,19,24,17,0.9635694919288565,0.9635694919288565,Kentucky,South Carolina,6,3,NA,270380096,2007-02-07
109,1,4:04,1444,1444,Dominique Archie missed Two Point Jumper.,43,19,24,0,0.9645127329667117,0.9645127329667117,Kentucky,South Carolina,6,3,NA,270380096,2007-02-07
110,1,4:04,1444,1444,Dwayne Day Offensive Rebound.,43,19,24,8,0.9645127329667117,0.9645127329667117,Kentucky,South Carolina,6,3,NA,270380096,2007-02-07
111,1,3:56,1436,1436,Tre Kelley made Two Point Jumper.,43,21,22,7,0.9542989429757617,0.9542989429757617,Kentucky,South Carolina,6,3,NA,270380096,2007-02-07
112,1,3:49,1429,1429,Official TV Timeout.,43,21,22,4,0.9547334414504726,0.9547334414504726,Kentucky,South Carolina,6,3,NA,270380096,2007-02-07
113,1,3:45,1425,1425,Jodie Meeks made Three Point Jumper.  Assisted by Derrick Jasper.,46,21,25,21,0.9698527753997453,0.9698527753997453,Kentucky,South Carolina,6,3,NA,270380096,2007-02-07
114,1,3:24,1404,1404,Bryce Sheldon missed Three Point Jumper.,46,21,25,0,0.9708067165453749,0.9708067165453749,Kentucky,South Carolina,6,3,NA,270380096,2007-02-07
115,1,3:24,1404,1404,South Carolina Offensive Rebound.,46,21,25,16,0.9708067165453749,0.9708067165453749,Kentucky,South Carolina,6,3,NA,270380096,2007-02-07
116,1,3:08,1388,1388,Tre Kelley made Two Point Jumper.,46,23,23,43,0.9625507891030646,0.9625507891030646,Kentucky,South Carolina,6,3,NA,270380096,2007-02-07
117,1,2:25,1345,1345,Derrick Jasper missed Three Point Jumper.,46,23,23,0,0.9646752864483733,0.9646752864483733,Kentucky,South Carolina,6,3,NA,270380096,2007-02-07
118,1,2:25,1345,1345,Bryce Sheldon Defensive Rebound.,46,23,23,8,0.9646752864483733,0.9646752864483733,Kentucky,South Carolina,6,3,NA,270380096,2007-02-07
119,1,2:17,1337,1337,Tre Kelley made Three Point Jumper.,46,26,20,23,0.9471372167525616,0.9471372167525616,Kentucky,South Carolina,6,3,NA,270380096,2007-02-07
120,1,1:54,1314,1314,Randolph Morris made Two Point Dunk Shot.  Assisted by Ramel Bradley.,48,26,22,18,0.9610686271062981,0.9610686271062981,Kentucky,South Carolina,6,3,NA,270380096,2007-02-07
121,1,1:36,1296,1296,Dominique Archie missed Three Point Jumper.,48,26,22,0,0.9620244229276861,0.9620244229276861,Kentucky,South Carolina,6,3,NA,270380096,2007-02-07
122,1,1:36,1296,1296,Derrick Jasper Defensive Rebound.,48,26,22,9,0.9620244229276861,0.9620244229276861,Kentucky,South Carolina,6,3,NA,270380096,2007-02-07
123,1,1:27,1287,1287,Jodie Meeks missed Three Point Jumper.,48,26,22,0,0.9625072764123204,0.9625072764123204,Kentucky,South Carolina,6,3,NA,270380096,2007-02-07
124,1,1:27,1287,1287,Chad Gray Defensive Rebound.,48,26,22,7,0.9625072764123204,0.9625072764123204,Kentucky,South Carolina,6,3,NA,270380096,2007-02-07
125,1,1:20,1280,1280,Tre Kelley missed Three Point Jumper.,48,26,22,0,0.9628858635039107,0.9628858635039107,Kentucky,South Carolina,6,3,NA,270380096,2007-02-07
126,1,1:20,1280,1280,Perry Stevenson Defensive Rebound.,48,26,22,11,0.9628858635039107,0.9628858635039107,Kentucky,South Carolina,6,3,NA,270380096,2007-02-07
127,1,1:09,1269,1269,Derrick Jasper made Two Point Layup.  Assisted by Ramel Bradley.,50,26,24,42,0.9726266340206425,0.9726266340206425,Kentucky,South Carolina,6,3,NA,270380096,2007-02-07
128,1,0:27,1227,1227,Ramel Bradley missed Two Point Layup.,50,26,24,0,0.9745907364927939,0.9745907364927939,Kentucky,South Carolina,6,3,NA,270380096,2007-02-07
129,1,0:27,1227,1227,Evaldas Baniulis Defensive Rebound.,50,26,24,9,0.9745907364927939,0.9745907364927939,Kentucky,South Carolina,6,3,NA,270380096,2007-02-07
130,1,0:18,1218,1218,Tre Kelley made Two Point Jumper.,50,28,22,6,0.966408923952003,0.966408923952003,Kentucky,South Carolina,6,3,NA,270380096,2007-02-07
131,1,0:12,1212,1212,Kentucky 20 Second Timeout.,50,28,22,10,0.966770018067367,0.966770018067367,Kentucky,South Carolina,6,2,NA,270380096,2007-02-07
132,1,0:02,1202,1202,Brandon Wallace Steal.,50,28,22,2,0.9673696444327738,0.9673696444327738,Kentucky,South Carolina,6,2,NA,270380096,2007-02-07
133,1,0:00,1200,1200,End of the 1st Half.,50,28,22,0,0.9674869495927977,0.9674869495927977,Kentucky,South Carolina,6,2,NA,270380096,2007-02-07
134,2,20:00,1200,1200,PLAY,50,28,22,20,0.9674869495927977,0.9674869495927977,Kentucky,South Carolina,6,2,NA,270380096,2007-02-07
135,2,19:40,1180,1180,Brandon Wallace Steal.,50,28,22,6,0.9686155083032694,0.9686155083032694,Kentucky,South Carolina,6,2,NA,270380096,2007-02-07
136,2,19:34,1174,1174,Ramel Bradley Steal.,50,28,22,2,0.9689401118606545,0.9689401118606545,Kentucky,South Carolina,6,2,NA,270380096,2007-02-07
137,2,19:32,1172,1172,Derrick Jasper made Two Point Layup.,52,28,24,44,0.9771775120183652,0.9771775120183652,Kentucky,South Carolina,6,2,NA,270380096,2007-02-07
138,2,18:48,1128,1128,Brandon Wallace missed Two Point Jumper.,52,28,24,2,0.9789804433487747,0.9789804433487747,Kentucky,South Carolina,6,2,NA,270380096,2007-02-07
139,2,18:46,1126,1126,South Carolina Offensive Rebound.,52,28,24,4,0.9790587811856527,0.9790587811856527,Kentucky,South Carolina,6,2,NA,270380096,2007-02-07
140,2,18:42,1122,1122,Brandis Raley-Ross missed Three Point Jumper.,52,28,24,0,0.9792148117553648,0.9792148117553648,Kentucky,South Carolina,6,2,NA,270380096,2007-02-07
141,2,18:42,1122,1122,Bobby Perry Defensive Rebound.,52,28,24,4,0.9792148117553648,0.9792148117553648,Kentucky,South Carolina,6,2,NA,270380096,2007-02-07
142,2,18:38,1118,1118,Ramel Bradley missed Two Point Layup.,52,28,24,0,0.9793700543196259,0.9793700543196259,Kentucky,South Carolina,6,2,NA,270380096,2007-02-07
143,2,18:38,1118,1118,Bryce Sheldon Defensive Rebound.,52,28,24,8,0.9793700543196259,0.9793700543196259,Kentucky,South Carolina,6,2,NA,270380096,2007-02-07
144,2,18:30,1110,1110,Tre Kelley made Three Point Jumper.,52,31,21,27,0.967425301838798,0.967425301838798,Kentucky,South Carolina,6,2,NA,270380096,2007-02-07
145,2,18:03,1083,1083,Bobby Perry made Three Point Jumper.  Assisted by Lukasz Obrzut.,55,31,24,27,0.9807070025731673,0.9807070025731673,Kentucky,South Carolina,6,2,NA,270380096,2007-02-07
146,2,17:36,1056,1056,Dominique Archie made Two Point Layup.,55,33,22,1,0.9747204910796802,0.9747204910796802,Kentucky,South Carolina,6,2,NA,270380096,2007-02-07
147,2,17:35,1055,1055,Foul on Lukasz Obrzut,55,33,22,0,0.9747685231214488,0.9747685231214488,Kentucky,South Carolina,6,2,NA,270380096,2007-02-07
148,2,17:35,1055,1055,Dominique Archie made Free Throw.,55,34,21,4,0.9703447408448546,0.9703447408448546,Kentucky,South Carolina,6,2,NA,270380096,2007-02-07
149,2,17:31,1051,1051,Ramel Bradley made Three Point Jumper.  Assisted by Joe Crawford.,58,34,24,23,0.9819229336321574,0.9819229336321574,Kentucky,South Carolina,6,2,NA,270380096,2007-02-07
150,2,17:08,1028,1028,Tre Kelley missed Three Point Jumper.,58,34,24,0,0.9828094123183968,0.9828094123183968,Kentucky,South Carolina,6,2,NA,270380096,2007-02-07
151,2,17:08,1028,1028,Dominique Archie Offensive Rebound.,58,34,24,5,0.9828094123183968,0.9828094123183968,Kentucky,South Carolina,6,2,NA,270380096,2007-02-07
152,2,17:03,1023,1023,Foul on Derrick Jasper,58,34,24,0,0.9830044134377406,0.9830044134377406,Kentucky,South Carolina,6,2,NA,270380096,2007-02-07
153,2,17:03,1023,1023,Dominique Archie made Free Throw.,58,35,23,0,0.9799366026438694,0.9799366026438694,Kentucky,South Carolina,6,2,NA,270380096,2007-02-07
154,2,17:03,1023,1023,Dominique Archie missed Free Throw.,58,35,23,0,0.9799366026438694,0.9799366026438694,Kentucky,South Carolina,6,2,NA,270380096,2007-02-07
155,2,17:03,1023,1023,Derrick Jasper Defensive Rebound.,58,35,23,13,0.9799366026438694,0.9799366026438694,Kentucky,South Carolina,6,2,NA,270380096,2007-02-07
156,2,16:50,1010,1010,Bobby Perry made Two Point Layup.,60,35,25,20,0.9860621082366243,0.9860621082366243,Kentucky,South Carolina,6,2,NA,270380096,2007-02-07
157,2,16:30,990,990,Dwayne Day Offensive Rebound.,60,35,25,0,0.9867689690303522,0.9867689690303522,Kentucky,South Carolina,6,2,NA,270380096,2007-02-07
158,2,16:30,990,990,Bryce Sheldon missed Three Point Jumper.,60,35,25,2,0.9867689690303522,0.9867689690303522,Kentucky,South Carolina,6,2,NA,270380096,2007-02-07
159,2,16:28,988,988,Bryce Sheldon missed Three Point Jumper.,60,35,25,3,0.9868404603165748,0.9868404603165748,Kentucky,South Carolina,6,2,NA,270380096,2007-02-07
160,2,16:25,985,985,Derrick Jasper Defensive Rebound.,60,35,25,2,0.9869479784874589,0.9869479784874589,Kentucky,South Carolina,6,2,NA,270380096,2007-02-07
161,2,16:23,983,983,Ramel Bradley made Two Point Layup.,62,35,27,0,0.9907859589254056,0.9907859589254056,Kentucky,South Carolina,6,2,NA,270380096,2007-02-07
162,2,16:23,983,983,Foul on Dwayne Day,62,35,27,0,0.9907859589254056,0.9907859589254056,Kentucky,South Carolina,6,2,NA,270380096,2007-02-07
163,2,16:23,983,983,Ramel Bradley made Free Throw.,63,35,28,17,0.9922402930729058,0.9922402930729058,Kentucky,South Carolina,6,2,NA,270380096,2007-02-07
