play_id,half,time_remaining_half,secs_remaining,secs_remaining_absolute,description,home_score,away_score,score_diff,play_length,win_prob,naive_win_prob,home,away,home_time_out_remaining,away_time_out_remaining,home_favored_by,game_id,date
1,1,20:00,2400,2400,PLAY,0,0,0,17,0.5,0.5,Maine,Brown,4,4,NA,303380311,2010-12-04
2,1,19:43,2383,2383,Terrance Mitchell missed Three Point Jumper.,0,0,0,0,0.5,0.5,Maine,Brown,4,4,NA,303380311,2010-12-04
3,1,19:43,2383,2383,Brown Defensive Rebound.,0,0,0,17,0.5,0.5,Maine,Brown,4,4,NA,303380311,2010-12-04
4,1,19:26,2366,2366,Andrew McCarthy missed Two Point Jumper.,0,0,0,0,0.5,0.5,Maine,Brown,4,4,NA,303380311,2010-12-04
5,1,19:26,2366,2366,Raheem Singleton Defensive Rebound.,0,0,0,10,0.5,0.5,Maine,Brown,4,4,NA,303380311,2010-12-04
6,1,19:16,2356,2356,Raheem Singleton missed Two Point Layup.,0,0,0,0,0.5,0.5,Maine,Brown,4,4,NA,303380311,2010-12-04
7,1,19:16,2356,2356,Andrew McCarthy Defensive Rebound.,0,0,0,36,0.5,0.5,Maine,Brown,4,4,NA,303380311,2010-12-04
8,1,18:40,2320,2320,Peter Sullivan missed Two Point Jumper.,0,0,0,0,0.5,0.5,Maine,Brown,4,4,NA,303380311,2010-12-04
9,1,18:40,2320,2320,Tucker Halpern Offensive Rebound.,0,0,0,11,0.5,0.5,Maine,Brown,4,4,NA,303380311,2010-12-04
10,1,18:29,2309,2309,Tucker Halpern missed Three Point Jumper.,0,0,0,0,0.5,0.5,Maine,Brown,4,4,NA,303380311,2010-12-04
11,1,18:29,2309,2309,Terrance Mitchell Defensive Rebound.,0,0,0,9,0.5,0.5,Maine,Brown,4,4,NA,303380311,2010-12-04
12,1,18:20,2300,2300,Foul on Sean McGonagill,0,0,0,5,0.5,0.5,Maine,Brown,4,4,NA,303380311,2010-12-04
13,1,18:15,2295,2295,Raheem Singleton missed Two Point Jumper.,0,0,0,0,0.5,0.5,Maine,Brown,4,4,NA,303380311,2010-12-04
14,1,18:15,2295,2295,Brown Defensive Rebound.,0,0,0,16,0.5,0.5,Maine,Brown,4,4,NA,303380311,2010-12-04
15,1,17:59,2279,2279,Peter Sullivan missed Two Point Jumper.,0,0,0,0,0.5,0.5,Maine,Brown,4,4,NA,303380311,2010-12-04
16,1,17:59,2279,2279,Tucker Halpern Offensive Rebound.,0,0,0,6,0.5,0.5,Maine,Brown,4,4,NA,303380311,2010-12-04
17,1,17:53,2273,2273,Sean McGonagill made Three Point Jumper.  Assisted by Tucker Halpern.,0,3,-3,19,0.4300694234368722,0.4300694234368722,Maine,Brown,4,4,NA,303380311,2010-12-04
18,1,17:34,2254,2254,Gerald McLemore missed Three Point Jumper.,0,3,-3,0,0.42943385099328796,0.42943385099328796,Maine,Brown,4,4,NA,303380311,2010-12-04
19,1,17:34,2254,2254,Sean McNally Offensive Rebound.,0,3,-3,4,0.42943385099328796,0.42943385099328796,Maine,Brown,4,4,NA,303380311,2010-12-04
20,1,17:30,2250,2250,Sean McNally missed Two Point Layup.,0,3,-3,0,0.42929951130972055,0.42929951130972055,Maine,Brown,4,4,NA,303380311,2010-12-04
21,1,17:30,2250,2250,Andrew McCarthy Block.,0,3,-3,1,0.42929951130972055,0.42929951130972055,Maine,Brown,4,4,NA,303380311,2010-12-04
22,1,17:29,2249,2249,Tucker Halpern Defensive Rebound.,0,3,-3,18,0.4292658988850709,0.4292658988850709,Maine,Brown,4,4,NA,303380311,2010-12-04
23,1,17:11,2231,2231,Foul on Raheem Singleton,0,3,-3,2,0.428659096831824,0.428659096831824,Maine,Brown,4,4,NA,303380311,2010-12-04
24,1,17:09,2229,2229,Tucker Halpern made Three Point Jumper.  Assisted by Sean McGonagill.,0,6,-6,16,0.36003772444216864,0.36003772444216864,Maine,Brown,4,4,NA,303380311,2010-12-04
25,1,16:53,2213,2213,Murphy Burnatowski missed Three Point Jumper.,0,6,-6,0,0.3590178849199583,0.3590178849199583,Maine,Brown,4,4,NA,303380311,2010-12-04
26,1,16:53,2213,2213,Alasdair Fraser Offensive Rebound.,0,6,-6,25,0.3590178849199583,0.3590178849199583,Maine,Brown,4,4,NA,303380311,2010-12-04
27,1,16:28,2188,2188,Troy Barnies missed Three Point Jumper.,0,6,-6,0,0.35741879334398535,0.35741879334398535,Maine,Brown,4,4,NA,303380311,2010-12-04
28,1,16:28,2188,2188,Peter Sullivan Defensive Rebound.,0,6,-6,32,0.35741879334398535,0.35741879334398535,Maine,Brown,4,4,NA,303380311,2010-12-04
29,1,15:56,2156,2156,Adrian Williams Turnover.,0,6,-6,1,0.35536420267106944,0.35536420267106944,Maine,Brown,4,4,NA,303380311,2010-12-04
30,1,15:55,2155,2155,Murphy Burnatowski Steal.,0,6,-6,6,0.35529978257451533,0.35529978257451533,Maine,Brown,4,4,NA,303380311,2010-12-04
31,1,15:49,2149,2149,Troy Barnies missed Two Point Layup.,0,6,-6,0,0.3549129067508746,0.3549129067508746,Maine,Brown,4,4,NA,303380311,2010-12-04
32,1,15:49,2149,2149,Troy Barnies Offensive Rebound.,0,6,-6,2,0.3549129067508746,0.3549129067508746,Maine,Brown,4,4,NA,303380311,2010-12-04
33,1,15:47,2147,2147,Foul on Andrew McCarthy,0,6,-6,0,0.35478381072781134,0.35478381072781134,Maine,Brown,4,4,NA,303380311,2010-12-04
34,1,15:47,2147,2147,Troy Barnies made Free Throw.,1,6,-5,0,0.37791737179919743,0.37791737179919743,Maine,Brown,4,4,NA,303380311,2010-12-04
35,1,15:47,2147,2147,Troy Barnies missed Free Throw.,1,6,-5,0,0.37791737179919743,0.37791737179919743,Maine,Brown,4,4,NA,303380311,2010-12-04
36,1,15:47,2147,2147,Brown Defensive Rebound.,1,6,-5,33,0.37791737179919743,0.37791737179919743,Maine,Brown,4,4,NA,303380311,2010-12-04
37,1,15:14,2114,2114,Tucker Halpern missed Three Point Jumper.,1,6,-5,0,0.37608452877612114,0.37608452877612114,Maine,Brown,4,4,NA,303380311,2010-12-04
38,1,15:14,2114,2114,Alasdair Fraser Defensive Rebound.,1,6,-5,17,0.37608452877612114,0.37608452877612114,Maine,Brown,4,4,NA,303380311,2010-12-04
39,1,14:57,2097,2097,Troy Barnies made Two Point Jumper.,3,6,-3,24,0.4240532550727402,0.4240532550727402,Maine,Brown,4,4,NA,303380311,2010-12-04
40,1,14:33,2073,2073,Peter Sullivan missed Three Point Jumper.,3,6,-3,0,0.4232064327616527,0.4232064327616527,Maine,Brown,4,4,NA,303380311,2010-12-04
41,1,14:33,2073,2073,Alasdair Fraser Defensive Rebound.,3,6,-3,15,0.4232064327616527,0.4232064327616527,Maine,Brown,4,4,NA,303380311,2010-12-04
42,1,14:18,2058,2058,Murphy Burnatowski made Two Point Jumper.,5,6,-1,40,0.47403913442073575,0.47403913442073575,Maine,Brown,4,4,NA,303380311,2010-12-04
43,1,13:38,2018,2018,Sean McGonagill Turnover.,5,6,-1,1,0.47354822073586317,0.47354822073586317,Maine,Brown,4,4,NA,303380311,2010-12-04
44,1,13:37,2017,2017,Troy Barnies Steal.,5,6,-1,8,0.47353582322608984,0.47353582322608984,Maine,Brown,4,4,NA,303380311,2010-12-04
45,1,13:29,2009,2009,Murphy Burnatowski made Two Point Jumper.  Assisted by Andrew Rogers.,7,6,1,25,0.5265635857943932,0.5265635857943932,Maine,Brown,4,4,NA,303380311,2010-12-04
46,1,13:04,1984,1984,Tucker Halpern Turnover.,7,6,1,7,0.5268769418747516,0.5268769418747516,Maine,Brown,4,4,NA,303380311,2010-12-04
47,1,12:57,1977,1977,Alasdair Fraser missed Two Point Layup.,7,6,1,0,0.5269654408739634,0.5269654408739634,Maine,Brown,4,4,NA,303380311,2010-12-04
48,1,12:57,1977,1977,Dockery Walker Defensive Rebound.,7,6,1,8,0.5269654408739634,0.5269654408739634,Maine,Brown,4,4,NA,303380311,2010-12-04
49,1,12:49,1969,1969,Foul on Mike Allison,7,6,1,6,0.5270670029691557,0.5270670029691557,Maine,Brown,4,4,NA,303380311,2010-12-04
50,1,12:43,1963,1963,Sean McGonagill made Free Throw.,7,7,0,0,0.5,0.5,Maine,Brown,4,4,NA,303380311,2010-12-04
51,1,12:43,1963,1963,Sean McGonagill made Free Throw.,7,8,-1,10,0.4728565261893283,0.4728565261893283,Maine,Brown,4,4,NA,303380311,2010-12-04
52,1,12:33,1953,1953,Murphy Burnatowski Turnover.,7,8,-1,0,0.4727284938592801,0.4727284938592801,Maine,Brown,4,4,NA,303380311,2010-12-04
53,1,12:33,1953,1953,Garrett Leffelman Steal.,7,8,-1,24,0.4727284938592801,0.4727284938592801,Maine,Brown,4,4,NA,303380311,2010-12-04
54,1,12:09,1929,1929,Matt Sullivan Turnover.,7,8,-1,1,0.4724181662118191,0.4724181662118191,Maine,Brown,4,4,NA,303380311,2010-12-04
55,1,12:08,1928,1928,Terrance Mitchell Steal.,7,8,-1,2,0.4724051551939024,0.4724051551939024,Maine,Brown,4,4,NA,303380311,2010-12-04
56,1,12:06,1926,1926,Terrance Mitchell made Two Point Layup.,9,8,1,14,0.527620859437904,0.527620859437904,Maine,Brown,4,4,NA,303380311,2010-12-04
57,1,11:52,1912,1912,Garrett Leffelman made Two Point Layup.  Assisted by Chris Taylor.,9,10,-1,11,0.472197265256179,0.472197265256179,Maine,Brown,4,4,NA,303380311,2010-12-04
58,1,11:41,1901,1901,Official TV Timeout.,9,10,-1,3,0.47205454593633916,0.47205454593633916,Maine,Brown,4,4,NA,303380311,2010-12-04
59,1,11:38,1898,1898,Murphy Burnatowski Turnover.,9,10,-1,17,0.4720156351671368,0.4720156351671368,Maine,Brown,4,4,NA,303380311,2010-12-04
60,1,11:21,1881,1881,Garrett Leffelman made Two Point Layup.,9,12,-3,25,0.4160965300080829,0.4160965300080829,Maine,Brown,4,4,NA,303380311,2010-12-04
61,1,10:56,1856,1856,Troy Barnies missed Two Point Layup.,9,12,-3,0,0.41514617497221684,0.41514617497221684,Maine,Brown,4,4,NA,303380311,2010-12-04
62,1,10:56,1856,1856,Dockery Walker Block.,9,12,-3,1,0.41514617497221684,0.41514617497221684,Maine,Brown,4,4,NA,303380311,2010-12-04
63,1,10:55,1855,1855,Maine Offensive Rebound.,9,12,-3,10,0.41510807829856994,0.41510807829856994,Maine,Brown,4,4,NA,303380311,2010-12-04
64,1,10:45,1845,1845,Terrance Mitchell missed Three Point Jumper.,9,12,-3,0,0.41472661352295626,0.41472661352295626,Maine,Brown,4,4,NA,303380311,2010-12-04
65,1,10:45,1845,1845,Troy Barnies Offensive Rebound.,9,12,-3,4,0.41472661352295626,0.41472661352295626,Maine,Brown,4,4,NA,303380311,2010-12-04
66,1,10:41,1841,1841,Foul on Dockery Walker,9,12,-3,0,0.41457374246929246,0.41457374246929246,Maine,Brown,4,4,NA,303380311,2010-12-04
67,1,10:41,1841,1841,Troy Barnies missed Two Point Jumper.,9,12,-3,0,0.41457374246929246,0.41457374246929246,Maine,Brown,4,4,NA,303380311,2010-12-04
68,1,10:41,1841,1841,Chris Taylor Defensive Rebound.,9,12,-3,7,0.41457374246929246,0.41457374246929246,Maine,Brown,4,4,NA,303380311,2010-12-04
69,1,10:34,1834,1834,Dockery Walker missed Two Point Layup.,9,12,-3,0,0.4143057652680227,0.4143057652680227,Maine,Brown,4,4,NA,303380311,2010-12-04
70,1,10:34,1834,1834,Sean McNally Block.,9,12,-3,2,0.4143057652680227,0.4143057652680227,Maine,Brown,4,4,NA,303380311,2010-12-04
71,1,10:32,1832,1832,Chris Taylor Offensive Rebound.,9,12,-3,2,0.41422908569997857,0.41422908569997857,Maine,Brown,4,4,NA,303380311,2010-12-04
72,1,10:30,1830,1830,Chris Taylor made Two Point Layup.,9,14,-5,11,0.35938299905282123,0.35938299905282123,Maine,Brown,4,4,NA,303380311,2010-12-04
73,1,10:19,1819,1819,Gerald McLemore made Three Point Jumper.  Assisted by Andrew Rogers.,12,14,-2,30,0.4421650461150637,0.4421650461150637,Maine,Brown,4,4,NA,303380311,2010-12-04
74,1,9:49,1789,1789,Garrett Leffelman missed Two Point Layup.,12,14,-2,0,0.441375151553143,0.441375151553143,Maine,Brown,4,4,NA,303380311,2010-12-04
75,1,9:49,1789,1789,Sean McNally Defensive Rebound.,12,14,-2,6,0.441375151553143,0.441375151553143,Maine,Brown,4,4,NA,303380311,2010-12-04
76,1,9:43,1783,1783,Terrance Mitchell missed Two Point Layup.,12,14,-2,0,0.44121555871107754,0.44121555871107754,Maine,Brown,4,4,NA,303380311,2010-12-04
77,1,9:43,1783,1783,Sean McGonagill Defensive Rebound.,12,14,-2,22,0.44121555871107754,0.44121555871107754,Maine,Brown,4,4,NA,303380311,2010-12-04
78,1,9:21,1761,1761,Foul on Andrew Rogers,12,14,-2,25,0.44062487175074977,0.44062487175074977,Maine,Brown,4,4,NA,303380311,2010-12-04
79,1,8:56,1736,1736,Tucker Halpern Turnover.,12,14,-2,19,0.4399415351753939,0.4399415351753939,Maine,Brown,4,4,NA,303380311,2010-12-04
80,1,8:37,1717,1717,Gerald McLemore missed Three Point Jumper.,12,14,-2,0,0.4394121864957256,0.4394121864957256,Maine,Brown,4,4,NA,303380311,2010-12-04
81,1,8:37,1717,1717,Matt Sullivan Defensive Rebound.,12,14,-2,3,0.4394121864957256,0.4394121864957256,Maine,Brown,4,4,NA,303380311,2010-12-04
82,1,8:34,1714,1714,Foul on Terrance Mitchell,12,14,-2,18,0.4393277358530611,0.4393277358530611,Maine,Brown,4,4,NA,303380311,2010-12-04
83,1,8:16,1696,1696,Garrett Leffelman missed Two Point Jumper.,12,14,-2,0,0.43881566986097503,0.43881566986097503,Maine,Brown,4,4,NA,303380311,2010-12-04
84,1,8:16,1696,1696,Raheem Singleton Defensive Rebound.,12,14,-2,21,0.43881566986097503,0.43881566986097503,Maine,Brown,4,4,NA,303380311,2010-12-04
85,1,7:55,1675,1675,Gerald McLemore missed Two Point Layup.,12,14,-2,0,0.4382144213588923,0.4382144213588923,Maine,Brown,4,4,NA,303380311,2010-12-04
86,1,7:55,1675,1675,Brown Defensive Rebound.,12,14,-2,2,0.4382144213588923,0.4382144213588923,Maine,Brown,4,4,NA,303380311,2010-12-04
87,1,7:53,1673,1673,Official TV Timeout.,12,14,-2,18,0.43815800941466637,0.43815800941466637,Maine,Brown,4,4,NA,303380311,2010-12-04
88,1,7:35,1655,1655,Matt Sullivan missed Three Point Jumper.,12,14,-2,0,0.4376566818971307,0.4376566818971307,Maine,Brown,4,4,NA,303380311,2010-12-04
89,1,7:35,1655,1655,Tucker Halpern Offensive Rebound.,12,14,-2,23,0.4376566818971307,0.4376566818971307,Maine,Brown,4,4,NA,303380311,2010-12-04
90,1,7:12,1632,1632,Peter Sullivan made Two Point Layup.,12,16,-4,0,0.3760246772820588,0.3760246772820588,Maine,Brown,4,4,NA,303380311,2010-12-04
91,1,7:12,1632,1632,Foul on Alasdair Fraser,12,16,-4,0,0.3760246772820588,0.3760246772820588,Maine,Brown,4,4,NA,303380311,2010-12-04
92,1,7:12,1632,1632,Peter Sullivan made Free Throw.,12,17,-5,29,0.3468147372093064,0.3468147372093064,Maine,Brown,4,4,NA,303380311,2010-12-04
93,1,6:43,1603,1603,Murphy Burnatowski made Two Point Jumper.,14,17,-3,14,0.40501833555380407,0.40501833555380407,Maine,Brown,4,4,NA,303380311,2010-12-04
94,1,6:29,1589,1589,Andrew McCarthy missed Two Point Layup.,14,17,-3,0,0.4044663177940487,0.4044663177940487,Maine,Brown,4,4,NA,303380311,2010-12-04
95,1,6:29,1589,1589,Andrew McCarthy Offensive Rebound.,14,17,-3,1,0.4044663177940487,0.4044663177940487,Maine,Brown,4,4,NA,303380311,2010-12-04
96,1,6:28,1588,1588,Andrew McCarthy made Two Point Layup.,14,19,-5,18,0.34409707686784946,0.34409707686784946,Maine,Brown,4,4,NA,303380311,2010-12-04
97,1,6:10,1570,1570,Gerald McLemore missed Three Point Jumper.,14,19,-5,0,0.3429837606535523,0.3429837606535523,Maine,Brown,4,4,NA,303380311,2010-12-04
98,1,6:10,1570,1570,Adrian Williams Defensive Rebound.,14,19,-5,9,0.3429837606535523,0.3429837606535523,Maine,Brown,4,4,NA,303380311,2010-12-04
99,1,6:01,1561,1561,Adrian Williams missed Three Point Jumper.,14,19,-5,0,0.3424232062458788,0.3424232062458788,Maine,Brown,4,4,NA,303380311,2010-12-04
100,1,6:01,1561,1561,Mike Allison Defensive Rebound.,14,19,-5,8,0.3424232062458788,0.3424232062458788,Maine,Brown,4,4,NA,303380311,2010-12-04
101,1,5:53,1553,1553,Alasdair Fraser made Two Point Layup.  Assisted by Raheem Singleton.,16,19,-3,27,0.40303259315443835,0.40303259315443835,Maine,Brown,4,4,NA,303380311,2010-12-04
102,1,5:26,1526,1526,Tucker Halpern missed Three Point Jumper.,16,19,-3,0,0.40192651821776454,0.40192651821776454,Maine,Brown,4,4,NA,303380311,2010-12-04
103,1,5:26,1526,1526,Raheem Singleton Defensive Rebound.,16,19,-3,7,0.40192651821776454,0.40192651821776454,Maine,Brown,4,4,NA,303380311,2010-12-04
104,1,5:19,1519,1519,Murphy Burnatowski made Two Point Layup.  Assisted by Raheem Singleton.,18,19,-1,0,0.4668267635341371,0.4668267635341371,Maine,Brown,4,4,NA,303380311,2010-12-04
105,1,5:19,1519,1519,Foul on Adrian Williams,18,19,-1,0,0.4668267635341371,0.4668267635341371,Maine,Brown,4,4,NA,303380311,2010-12-04
106,1,5:19,1519,1519,Murphy Burnatowski made Free Throw.,19,19,0,16,0.5,0.5,Maine,Brown,4,4,NA,303380311,2010-12-04
107,1,5:03,1503,1503,Foul on Alasdair Fraser,19,19,0,0,0.5,0.5,Maine,Brown,4,4,NA,303380311,2010-12-04
108,1,5:03,1503,1503,Peter Sullivan made Free Throw.,19,20,-1,0,0.4665909874394161,0.4665909874394161,Maine,Brown,4,4,NA,303380311,2010-12-04
109,1,5:03,1503,1503,Maine 30 Second Timeout.,19,20,-1,0,0.4665909874394161,0.4665909874394161,Maine,Brown,3,4,NA,303380311,2010-12-04
110,1,5:03,1503,1503,Peter Sullivan made Free Throw.,19,21,-2,17,0.4334789679037415,0.4334789679037415,Maine,Brown,3,4,NA,303380311,2010-12-04
111,1,4:46,1486,1486,Gerald McLemore missed Two Point Jumper.,19,21,-2,0,0.43296942998064725,0.43296942998064725,Maine,Brown,3,4,NA,303380311,2010-12-04
112,1,4:46,1486,1486,Sean McGonagill Defensive Rebound.,19,21,-2,32,0.43296942998064725,0.43296942998064725,Maine,Brown,3,4,NA,303380311,2010-12-04
113,1,4:14,1454,1454,Adrian Williams Turnover.,19,21,-2,11,0.4319588722140313,0.4319588722140313,Maine,Brown,3,4,NA,303380311,2010-12-04
114,1,4:03,1443,1443,Andrew Rogers Turnover.,19,21,-2,13,0.43159733936816913,0.43159733936816913,Maine,Brown,3,4,NA,303380311,2010-12-04
115,1,3:50,1430,1430,Foul on Terrance Mitchell,19,21,-2,0,0.4311795649411843,0.4311795649411843,Maine,Brown,3,4,NA,303380311,2010-12-04
116,1,3:50,1430,1430,Official TV Timeout.,19,21,-2,0,0.4311795649411843,0.4311795649411843,Maine,Brown,3,4,NA,303380311,2010-12-04
117,1,3:50,1430,1430,Peter Sullivan made Free Throw.,19,22,-3,0,0.3975796261417622,0.3975796261417622,Maine,Brown,3,4,NA,303380311,2010-12-04
118,1,3:50,1430,1430,Peter Sullivan made Free Throw.,19,23,-4,13,0.3649182547784468,0.3649182547784468,Maine,Brown,3,4,NA,303380311,2010-12-04
119,1,3:37,1417,1417,Raheem Singleton missed Three Point Jumper.,19,23,-4,0,0.364147722982871,0.364147722982871,Maine,Brown,3,4,NA,303380311,2010-12-04
120,1,3:37,1417,1417,Brown Defensive Rebound.,19,23,-4,2,0.364147722982871,0.364147722982871,Maine,Brown,3,4,NA,303380311,2010-12-04
121,1,3:35,1415,1415,Foul on Troy Barnies,19,23,-4,0,0.3640306309440788,0.3640306309440788,Maine,Brown,3,4,NA,303380311,2010-12-04
122,1,3:35,1415,1415,Peter Sullivan made Free Throw.,19,24,-5,0,0.33239104536327285,0.33239104536327285,Maine,Brown,3,4,NA,303380311,2010-12-04
123,1,3:35,1415,1415,Peter Sullivan made Free Throw.,19,25,-6,8,0.30219470727031916,0.30219470727031916,Maine,Brown,3,4,NA,303380311,2010-12-04
124,1,3:27,1407,1407,Foul on Garrett Leffelman,19,25,-6,13,0.3015595099691291,0.3015595099691291,Maine,Brown,3,4,NA,303380311,2010-12-04
125,1,3:14,1394,1394,Raheem Singleton missed Two Point Layup.,19,25,-6,0,0.30054096312930323,0.30054096312930323,Maine,Brown,3,4,NA,303380311,2010-12-04
126,1,3:14,1394,1394,Sean McNally Offensive Rebound.,19,25,-6,2,0.30054096312930323,0.30054096312930323,Maine,Brown,3,4,NA,303380311,2010-12-04
127,1,3:12,1392,1392,Sean McNally made Two Point Layup.,21,25,-4,16,0.36270519944304114,0.36270519944304114,Maine,Brown,3,4,NA,303380311,2010-12-04
128,1,2:56,1376,1376,Andrew McCarthy missed Two Point Layup.,21,25,-4,0,0.361798283244908,0.361798283244908,Maine,Brown,3,4,NA,303380311,2010-12-04
129,1,2:56,1376,1376,Murphy Burnatowski Defensive Rebound.,21,25,-4,7,0.361798283244908,0.361798283244908,Maine,Brown,3,4,NA,303380311,2010-12-04
130,1,2:49,1369,1369,Foul on Sean McGonagill,21,25,-4,11,0.36140315753421975,0.36140315753421975,Maine,Brown,3,4,NA,303380311,2010-12-04
131,1,2:38,1358,1358,Murphy Burnatowski made Three Point Jumper.  Assisted by Raheem Singleton.,24,25,-1,32,0.4643126227397397,0.4643126227397397,Maine,Brown,3,4,NA,303380311,2010-12-04
132,1,2:06,1326,1326,Adrian Williams missed Two Point Jumper.,24,25,-1,0,0.4638194626474903,0.4638194626474903,Maine,Brown,3,4,NA,303380311,2010-12-04
133,1,2:06,1326,1326,Andrew McCarthy Offensive Rebound.,24,25,-1,8,0.4638194626474903,0.4638194626474903,Maine,Brown,3,4,NA,303380311,2010-12-04
134,1,1:58,1318,1318,Andrew McCarthy made Two Point Layup.,24,27,-3,10,0.39258775394730683,0.39258775394730683,Maine,Brown,3,4,NA,303380311,2010-12-04
135,1,1:48,1308,1308,Murphy Burnatowski missed Two Point Jumper.,24,27,-3,0,0.3921278203038004,0.3921278203038004,Maine,Brown,3,4,NA,303380311,2010-12-04
136,1,1:48,1308,1308,Troy Barnies Offensive Rebound.,24,27,-3,3,0.3921278203038004,0.3921278203038004,Maine,Brown,3,4,NA,303380311,2010-12-04
137,1,1:45,1305,1305,Troy Barnies Turnover.,24,27,-3,16,0.3919882451716805,0.3919882451716805,Maine,Brown,3,4,NA,303380311,2010-12-04
138,1,1:29,1289,1289,Peter Sullivan missed Two Point Jumper.,24,27,-3,0,0.39122936217308024,0.39122936217308024,Maine,Brown,3,4,NA,303380311,2010-12-04
139,1,1:29,1289,1289,Raheem Singleton Defensive Rebound.,24,27,-3,14,0.39122936217308024,0.39122936217308024,Maine,Brown,3,4,NA,303380311,2010-12-04
140,1,1:15,1275,1275,Foul on Garrett Leffelman,24,27,-3,0,0.3905421164589737,0.3905421164589737,Maine,Brown,3,4,NA,303380311,2010-12-04
141,1,1:15,1275,1275,Raheem Singleton missed Free Throw.,24,27,-3,0,0.3905421164589737,0.3905421164589737,Maine,Brown,3,4,NA,303380311,2010-12-04
142,1,1:15,1275,1275,Brown Defensive Rebound.,24,27,-3,24,0.3905421164589737,0.3905421164589737,Maine,Brown,3,4,NA,303380311,2010-12-04
143,1,0:51,1251,1251,Peter Sullivan Turnover.,24,27,-3,0,0.38930216653210487,0.38930216653210487,Maine,Brown,3,4,NA,303380311,2010-12-04
144,1,0:51,1251,1251,Raheem Singleton Steal.,24,27,-3,0,0.38930216653210487,0.38930216653210487,Maine,Brown,3,4,NA,303380311,2010-12-04
145,1,0:51,1251,1251,Foul on Matt Sullivan,24,27,-3,0,0.38930216653210487,0.38930216653210487,Maine,Brown,3,4,NA,303380311,2010-12-04
146,1,0:51,1251,1251,Raheem Singleton made Free Throw.,25,27,-2,0,0.4255173154631278,0.4255173154631278,Maine,Brown,3,4,NA,303380311,2010-12-04
147,1,0:51,1251,1251,Raheem Singleton made Free Throw.,26,27,-1,24,0.46254973042118647,0.46254973042118647,Maine,Brown,3,4,NA,303380311,2010-12-04
148,1,0:27,1227,1227,Andrew McCarthy missed Two Point Jumper.,26,27,-1,0,0.46208434696053613,0.46208434696053613,Maine,Brown,3,4,NA,303380311,2010-12-04
149,1,0:27,1227,1227,Chris Taylor Offensive Rebound.,26,27,-1,2,0.46208434696053613,0.46208434696053613,Maine,Brown,3,4,NA,303380311,2010-12-04
150,1,0:25,1225,1225,Chris Taylor missed Two Point Layup.,26,27,-1,0,0.46204384487746236,0.46204384487746236,Maine,Brown,3,4,NA,303380311,2010-12-04
151,1,0:25,1225,1225,Troy Barnies Defensive Rebound.,26,27,-1,23,0.46204384487746236,0.46204384487746236,Maine,Brown,3,4,NA,303380311,2010-12-04
152,1,0:02,1202,1202,Mike Allison made Two Point Jumper.  Assisted by Raheem Singleton.,28,27,1,2,0.5384392022206768,0.5384392022206768,Maine,Brown,3,4,NA,303380311,2010-12-04
153,1,0:00,1200,1200,End of the 1st Half.,28,27,1,0,0.5384812553577752,0.5384812553577752,Maine,Brown,3,4,NA,303380311,2010-12-04
154,2,20:00,1200,1200,PLAY,28,27,1,17,0.5384812553577752,0.5384812553577752,Maine,Brown,4,4,NA,303380311,2010-12-04
155,2,19:43,1183,1183,Alasdair Fraser made Two Point Jumper.  Assisted by Terrance Mitchell.,30,27,3,20,0.6146569306381904,0.6146569306381904,Maine,Brown,4,4,NA,303380311,2010-12-04
156,2,19:23,1163,1163,Sean McGonagill Turnover.,30,27,3,14,0.6158065982128537,0.6158065982128537,Maine,Brown,4,4,NA,303380311,2010-12-04
157,2,19:09,1149,1149,Foul on Andrew McCarthy,30,27,3,0,0.6165983867646192,0.6165983867646192,Maine,Brown,4,4,NA,303380311,2010-12-04
158,2,19:09,1149,1149,Alasdair Fraser missed Free Throw.,30,27,3,0,0.6165983867646192,0.6165983867646192,Maine,Brown,4,4,NA,303380311,2010-12-04
159,2,19:09,1149,1149,null,30,27,3,0,0.6165983867646192,0.6165983867646192,Maine,Brown,4,4,NA,303380311,2010-12-04
160,2,19:09,1149,1149,Alasdair Fraser missed Free Throw.,30,27,3,0,0.6165983867646192,0.6165983867646192,Maine,Brown,4,4,NA,303380311,2010-12-04
161,2,19:09,1149,1149,Alasdair Fraser Offensive Rebound.,30,27,3,18,0.6165983867646192,0.6165983867646192,Maine,Brown,4,4,NA,303380311,2010-12-04
162,2,18:51,1131,1131,Troy Barnies made Two Point Layup.,32,27,5,19,0.6897668871162481,0.6897668871162481,Maine,Brown,4,4,NA,303380311,2010-12-04
163,2,18:32,1112,1112,Andrew McCarthy missed Two Point Jumper.,32,27,5,0,0.6913849887995693,0.6913849887995693,Maine,Brown,4,4,NA,303380311,2010-12-04
164,2,18:32,1112,1112,Raheem Singleton Defensive Rebound.,32,27,5,6,0.6913849887995693,0.6913849887995693,Maine,Brown,4,4,NA,303380311,2010-12-04
165,2,18:26,1106,1106,Foul on Terrance Mitchell,32,27,5,0,0.6918998408414302,0.6918998408414302,Maine,Brown,4,4,NA,303380311,2010-12-04
166,2,18:26,1106,1106,Terrance Mitchell Turnover.,32,27,5,29,0.6918998408414302,0.6918998408414302,Maine,Brown,4,4,NA,303380311,2010-12-04
167,2,17:57,1077,1077,Sean McGonagill missed Three Point Jumper.,32,27,5,0,0.6944406625408774,0.6944406625408774,Maine,Brown,4,4,NA,303380311,2010-12-04
168,2,17:57,1077,1077,Murphy Burnatowski Defensive Rebound.,32,27,5,14,0.6944406625408774,0.6944406625408774,Maine,Brown,4,4,NA,303380311,2010-12-04
169,2,17:43,1063,1063,Troy Barnies made Two Point Jumper.  Assisted by Murphy Burnatowski.,34,27,7,10,0.7609231388719989,0.7609231388719989,Maine,Brown,4,4,NA,303380311,2010-12-04
170,2,17:33,1053,1053,Brown 30 Second Timeout.,34,27,7,10,0.7620437391682947,0.7620437391682947,Maine,Brown,4,3,NA,303380311,2010-12-04
171,2,17:23,1043,1043,Peter Sullivan missed Two Point Jumper.,34,27,7,0,0.7631902764061186,0.7631902764061186,Maine,Brown,4,3,NA,303380311,2010-12-04
172,2,17:23,1043,1043,Andrew McCarthy Offensive Rebound.,34,27,7,3,0.7631902764061186,0.7631902764061186,Maine,Brown,4,3,NA,303380311,2010-12-04
173,2,17:20,1040,1040,Andrew McCarthy made Two Point Layup.,34,29,5,17,0.6978910136804309,0.6978910136804309,Maine,Brown,4,3,NA,303380311,2010-12-04
174,2,17:03,1023,1023,Murphy Burnatowski missed Two Point Jumper.,34,29,5,0,0.6995899105634457,0.6995899105634457,Maine,Brown,4,3,NA,303380311,2010-12-04
175,2,17:03,1023,1023,Tucker Halpern Defensive Rebound.,34,29,5,9,0.6995899105634457,0.6995899105634457,Maine,Brown,4,3,NA,303380311,2010-12-04
176,2,16:54,1014,1014,Brown 30 Second Timeout.,34,29,5,11,0.700524950035863,0.700524950035863,Maine,Brown,4,2,NA,303380311,2010-12-04
177,2,16:43,1003,1003,Sean McGonagill Turnover.,34,29,5,1,0.701704878428278,0.701704878428278,Maine,Brown,4,2,NA,303380311,2010-12-04
178,2,16:42,1002,1002,Troy Barnies Steal.,34,29,5,5,0.7018142789322488,0.7018142789322488,Maine,Brown,4,2,NA,303380311,2010-12-04
179,2,16:37,997,997,Raheem Singleton made Two Point Layup.,36,29,7,21,0.7688860228932132,0.7688860228932132,Maine,Brown,4,2,NA,303380311,2010-12-04
180,2,16:16,976,976,Tucker Halpern made Three Point Jumper.  Assisted by Adrian Williams.,36,32,4,14,0.66734246649983,0.66734246649983,Maine,Brown,4,2,NA,303380311,2010-12-04
181,2,16:02,962,962,Foul on Sean McGonagill,36,32,4,6,0.6687819148491266,0.6687819148491266,Maine,Brown,4,2,NA,303380311,2010-12-04
182,2,15:56,956,956,Gerald McLemore missed Three Point Jumper.,36,32,4,0,0.6693707250420735,0.6693707250420735,Maine,Brown,4,2,NA,303380311,2010-12-04
