play_id,half,time_remaining_half,secs_remaining,secs_remaining_absolute,description,home_score,away_score,score_diff,play_length,win_prob,naive_win_prob,home,away,home_time_out_remaining,away_time_out_remaining,home_favored_by,game_id,date
1,1,20:00,2400,2400,PLAY,0,0,0,19,0.5,0.5,Georgia,Georgia State,6,6,NA,253440061,2005-12-10
2,1,19:41,2381,2381,Steve Newman missed Three Point Jumper.,0,0,0,0,0.5,0.5,Georgia,Georgia State,6,6,NA,253440061,2005-12-10
3,1,19:41,2381,2381,Sundiata Gaines Offensive Rebound.,0,0,0,0,0.5,0.5,Georgia,Georgia State,6,6,NA,253440061,2005-12-10
4,1,19:41,2381,2381,Sundiata Gaines missed Two Point Layup.,0,0,0,0,0.5,0.5,Georgia,Georgia State,6,6,NA,253440061,2005-12-10
5,1,19:41,2381,2381,Rashad Chase Defensive Rebound.,0,0,0,19,0.5,0.5,Georgia,Georgia State,6,6,NA,253440061,2005-12-10
6,1,19:22,2362,2362,Channing Toney made Three Point Jumper.  Assisted by Sundiata Gaines.,3,0,3,32,0.5670234231052643,0.5670234231052643,Georgia,Georgia State,6,6,NA,253440061,2005-12-10
7,1,18:50,2330,2330,Channing Toney missed Three Point Jumper.,3,0,3,0,0.5680535889700615,0.5680535889700615,Georgia,Georgia State,6,6,NA,253440061,2005-12-10
8,1,18:50,2330,2330,Herman Favors Defensive Rebound.,3,0,3,66,0.5680535889700615,0.5680535889700615,Georgia,Georgia State,6,6,NA,253440061,2005-12-10
9,1,17:44,2264,2264,Boyd Copeland made Two Point Layup.,3,2,1,0,0.5235487387520344,0.5235487387520344,Georgia,Georgia State,6,6,NA,253440061,2005-12-10
10,1,17:44,2264,2264,Brandon Cartwright Defensive Rebound.,3,2,1,9,0.5235487387520344,0.5235487387520344,Georgia,Georgia State,6,6,NA,253440061,2005-12-10
11,1,17:35,2255,2255,Dave Bliss made Two Point Layup.  Assisted by Sundiata Gaines.,5,2,3,26,0.5705325919819826,0.5705325919819826,Georgia,Georgia State,6,6,NA,253440061,2005-12-10
12,1,17:09,2229,2229,Levi Stukes missed Three Point Jumper.,5,2,3,0,0.5714085226413206,0.5714085226413206,Georgia,Georgia State,6,6,NA,253440061,2005-12-10
13,1,17:09,2229,2229,Deven Dickerson Defensive Rebound.,5,2,3,0,0.5714085226413206,0.5714085226413206,Georgia,Georgia State,6,6,NA,253440061,2005-12-10
14,1,17:09,2229,2229,Foul on Dave Bliss,5,2,3,52,0.5714085226413206,0.5714085226413206,Georgia,Georgia State,6,6,NA,253440061,2005-12-10
15,1,16:17,2177,2177,Malcolm Manier Steal.,5,2,3,0,0.5731778209643592,0.5731778209643592,Georgia,Georgia State,6,6,NA,253440061,2005-12-10
16,1,16:17,2177,2177,Malcolm Manier missed Two Point Jumper.,5,2,3,0,0.5731778209643592,0.5731778209643592,Georgia,Georgia State,6,6,NA,253440061,2005-12-10
17,1,16:17,2177,2177,Herman Favors Offensive Rebound.,5,2,3,0,0.5731778209643592,0.5731778209643592,Georgia,Georgia State,6,6,NA,253440061,2005-12-10
18,1,16:17,2177,2177,Herman Favors missed Three Point Jumper.,5,2,3,0,0.5731778209643592,0.5731778209643592,Georgia,Georgia State,6,6,NA,253440061,2005-12-10
19,1,16:17,2177,2177,Levi Stukes Defensive Rebound.,5,2,3,28,0.5731778209643592,0.5731778209643592,Georgia,Georgia State,6,6,NA,253440061,2005-12-10
20,1,15:49,2149,2149,Steve Newman made Two Point Layup.  Assisted by Sundiata Gaines.,7,2,5,35,0.6219721448464608,0.6219721448464608,Georgia,Georgia State,6,6,NA,253440061,2005-12-10
21,1,15:14,2114,2114,Boyd Copeland made Two Point Layup.,7,4,3,22,0.5753517907804412,0.5753517907804412,Georgia,Georgia State,6,6,NA,253440061,2005-12-10
22,1,14:52,2092,2092,Levi Stukes made Two Point Jumper.,9,4,5,14,0.6251485720971559,0.6251485720971559,Georgia,Georgia State,6,6,NA,253440061,2005-12-10
23,1,14:38,2078,2078,Rashad Chase missed Two Point Jumper.,9,4,5,0,0.6259383753352543,0.6259383753352543,Georgia,Georgia State,6,6,NA,253440061,2005-12-10
24,1,14:38,2078,2078,Sundiata Gaines Defensive Rebound.,9,4,5,6,0.6259383753352543,0.6259383753352543,Georgia,Georgia State,6,6,NA,253440061,2005-12-10
25,1,14:32,2072,2072,Levi Stukes missed Two Point Jumper.,9,4,5,0,0.6262781400678504,0.6262781400678504,Georgia,Georgia State,6,6,NA,253440061,2005-12-10
26,1,14:32,2072,2072,Boyd Copeland Defensive Rebound.,9,4,5,0,0.6262781400678504,0.6262781400678504,Georgia,Georgia State,6,6,NA,253440061,2005-12-10
27,1,14:32,2072,2072,Malcolm Manier made Three Point Jumper.  Assisted by Herman Favors.,9,7,2,27,0.5514455692172431,0.5514455692172431,Georgia,Georgia State,6,6,NA,253440061,2005-12-10
28,1,14:05,2045,2045,Channing Toney missed Three Point Jumper.,9,7,2,0,0.5520965806367524,0.5520965806367524,Georgia,Georgia State,6,6,NA,253440061,2005-12-10
29,1,14:05,2045,2045,Georgia St Defensive Rebound.,9,7,2,0,0.5520965806367524,0.5520965806367524,Georgia,Georgia State,6,6,NA,253440061,2005-12-10
30,1,14:05,2045,2045,Official TV Timeout.,9,7,2,45,0.5520965806367524,0.5520965806367524,Georgia,Georgia State,6,6,NA,253440061,2005-12-10
31,1,13:20,2000,2000,Mike Mercer Steal.,9,7,2,0,0.5532003999535374,0.5532003999535374,Georgia,Georgia State,6,6,NA,253440061,2005-12-10
32,1,13:20,2000,2000,Mike Mercer missed Three Point Jumper.,9,7,2,0,0.5532003999535374,0.5532003999535374,Georgia,Georgia State,6,6,NA,253440061,2005-12-10
33,1,13:20,2000,2000,Kendrick Johnson Offensive Rebound.,9,7,2,0,0.5532003999535374,0.5532003999535374,Georgia,Georgia State,6,6,NA,253440061,2005-12-10
34,1,13:20,2000,2000,Kendrick Johnson missed Two Point Layup.,9,7,2,0,0.5532003999535374,0.5532003999535374,Georgia,Georgia State,6,6,NA,253440061,2005-12-10
35,1,13:20,2000,2000,Kendrick Johnson Offensive Rebound.,9,7,2,8,0.5532003999535374,0.5532003999535374,Georgia,Georgia State,6,6,NA,253440061,2005-12-10
36,1,13:12,1992,1992,Boyd Copeland made Two Point Layup.,9,9,0,0,0.5,0.5,Georgia,Georgia State,6,6,NA,253440061,2005-12-10
37,1,13:12,1992,1992,Mike Mercer missed Two Point Jumper.,9,9,0,0,0.5,0.5,Georgia,Georgia State,6,6,NA,253440061,2005-12-10
38,1,13:12,1992,1992,D'Andre McGrew Defensive Rebound.,9,9,0,64,0.5,0.5,Georgia,Georgia State,6,6,NA,253440061,2005-12-10
39,1,12:08,1928,1928,Younes Idrissi made Two Point Layup.  Assisted by Billy Humphrey.,11,9,2,12,0.5550220977035871,0.5550220977035871,Georgia,Georgia State,6,6,NA,253440061,2005-12-10
40,1,11:56,1916,1916,Rashad Chase missed Two Point Jumper.,11,9,2,0,0.5553311657182827,0.5553311657182827,Georgia,Georgia State,6,6,NA,253440061,2005-12-10
41,1,11:56,1916,1916,Georgia Defensive Rebound.,11,9,2,0,0.5553311657182827,0.5553311657182827,Georgia,Georgia State,6,6,NA,253440061,2005-12-10
42,1,11:56,1916,1916,Official TV Timeout.,11,9,2,0,0.5553311657182827,0.5553311657182827,Georgia,Georgia State,6,6,NA,253440061,2005-12-10
43,1,11:56,1916,1916,Foul on Malcolm Manier,11,9,2,33,0.5553311657182827,0.5553311657182827,Georgia,Georgia State,6,6,NA,253440061,2005-12-10
44,1,11:23,1883,1883,Billy Humphrey missed Two Point Jumper.,11,9,2,0,0.5561794392775864,0.5561794392775864,Georgia,Georgia State,6,6,NA,253440061,2005-12-10
45,1,11:23,1883,1883,Justin Billingslea Defensive Rebound.,11,9,2,28,0.5561794392775864,0.5561794392775864,Georgia,Georgia State,6,6,NA,253440061,2005-12-10
46,1,10:55,1855,1855,Malcolm Manier made Three Point Jumper.  Assisted by Boyd Copeland.,11,12,-1,0,0.4714570522650251,0.4714570522650251,Georgia,Georgia State,6,6,NA,253440061,2005-12-10
47,1,10:55,1855,1855,Levi Stukes missed Three Point Jumper.,11,12,-1,0,0.4714570522650251,0.4714570522650251,Georgia,Georgia State,6,6,NA,253440061,2005-12-10
48,1,10:55,1855,1855,Deven Dickerson Defensive Rebound.,11,12,-1,16,0.4714570522650251,0.4714570522650251,Georgia,Georgia State,6,6,NA,253440061,2005-12-10
49,1,10:39,1839,1839,Lance Perique missed Two Point Jumper.,11,12,-1,0,0.4712480388474865,0.4712480388474865,Georgia,Georgia State,6,6,NA,253440061,2005-12-10
50,1,10:39,1839,1839,Younes Idrissi Defensive Rebound.,11,12,-1,42,0.4712480388474865,0.4712480388474865,Georgia,Georgia State,6,6,NA,253440061,2005-12-10
51,1,9:57,1797,1797,Foul on Channing Toney,11,12,-1,0,0.47069318059406134,0.47069318059406134,Georgia,Georgia State,6,6,NA,253440061,2005-12-10
52,1,9:57,1797,1797,Malcolm Manier missed Two Point Jumper.,11,12,-1,0,0.47069318059406134,0.47069318059406134,Georgia,Georgia State,6,6,NA,253440061,2005-12-10
53,1,9:57,1797,1797,Georgia Defensive Rebound.,11,12,-1,22,0.47069318059406134,0.47069318059406134,Georgia,Georgia State,6,6,NA,253440061,2005-12-10
54,1,9:35,1775,1775,D'Andre McGrew Steal.,11,12,-1,0,0.4703975017265199,0.4703975017265199,Georgia,Georgia State,6,6,NA,253440061,2005-12-10
55,1,9:35,1775,1775,Boyd Copeland missed Two Point Layup.,11,12,-1,0,0.4703975017265199,0.4703975017265199,Georgia,Georgia State,6,6,NA,253440061,2005-12-10
56,1,9:35,1775,1775,Georgia St Defensive Rebound.,11,12,-1,0,0.4703975017265199,0.4703975017265199,Georgia,Georgia State,6,6,NA,253440061,2005-12-10
57,1,9:35,1775,1775,Foul on D'Andre McGrew,11,12,-1,0,0.4703975017265199,0.4703975017265199,Georgia,Georgia State,6,6,NA,253440061,2005-12-10
58,1,9:35,1775,1775,Dave Bliss made Free Throw.,12,12,0,0,0.5,0.5,Georgia,Georgia State,6,6,NA,253440061,2005-12-10
59,1,9:35,1775,1775,Dave Bliss made Free Throw.,13,12,1,48,0.52960249827348,0.52960249827348,Georgia,Georgia State,6,6,NA,253440061,2005-12-10
60,1,8:47,1727,1727,Justin Billingslea made Two Point Dunk Shot.  Assisted by Boyd Copeland.,13,14,-1,17,0.4697354962294323,0.4697354962294323,Georgia,Georgia State,6,6,NA,253440061,2005-12-10
61,1,8:30,1710,1710,Foul on Dave Bliss,13,14,-1,27,0.46949424019101954,0.46949424019101954,Georgia,Georgia State,6,6,NA,253440061,2005-12-10
62,1,8:03,1683,1683,D'Andre McGrew made Three Point Jumper.  Assisted by Boyd Copeland.,13,17,-4,8,0.37872168090696506,0.37872168090696506,Georgia,Georgia State,6,6,NA,253440061,2005-12-10
63,1,7:55,1675,1675,Sundiata Gaines made Two Point Layup.,15,17,-2,0,0.4382144213588923,0.4382144213588923,Georgia,Georgia State,6,6,NA,253440061,2005-12-10
64,1,7:55,1675,1675,Foul on Boyd Copeland,15,17,-2,18,0.4382144213588923,0.4382144213588923,Georgia,Georgia State,6,6,NA,253440061,2005-12-10
65,1,7:37,1657,1657,Official TV Timeout.,15,17,-2,18,0.4377118700852333,0.4377118700852333,Georgia,Georgia State,6,6,NA,253440061,2005-12-10
66,1,7:19,1639,1639,Younes Idrissi missed Two Point Jumper.,15,17,-2,0,0.4372189225889159,0.4372189225889159,Georgia,Georgia State,6,6,NA,253440061,2005-12-10
67,1,7:19,1639,1639,Sundiata Gaines Offensive Rebound.,15,17,-2,0,0.4372189225889159,0.4372189225889159,Georgia,Georgia State,6,6,NA,253440061,2005-12-10
68,1,7:19,1639,1639,Sundiata Gaines made Two Point Layup.,17,17,0,12,0.5,0.5,Georgia,Georgia State,6,6,NA,253440061,2005-12-10
69,1,7:07,1627,1627,Malcolm Manier missed Three Point Jumper.,17,17,0,0,0.5,0.5,Georgia,Georgia State,6,6,NA,253440061,2005-12-10
70,1,7:07,1627,1627,Mike Mercer Defensive Rebound.,17,17,0,7,0.5,0.5,Georgia,Georgia State,6,6,NA,253440061,2005-12-10
71,1,7:00,1620,1620,Billy Humphrey made Two Point Jumper.,19,17,2,0,0.5632944952718261,0.5632944952718261,Georgia,Georgia State,6,6,NA,253440061,2005-12-10
72,1,7:00,1620,1620,Foul on Justin Billingslea,19,17,2,29,0.5632944952718261,0.5632944952718261,Georgia,Georgia State,6,6,NA,253440061,2005-12-10
73,1,6:31,1591,1591,Mike Mercer missed Three Point Jumper.,19,17,2,0,0.5640727541160789,0.5640727541160789,Georgia,Georgia State,6,6,NA,253440061,2005-12-10
74,1,6:31,1591,1591,Steve Newman Offensive Rebound.,19,17,2,0,0.5640727541160789,0.5640727541160789,Georgia,Georgia State,6,6,NA,253440061,2005-12-10
75,1,6:31,1591,1591,Steve Newman made Two Point Layup.,21,17,4,29,0.6260751932815923,0.6260751932815923,Georgia,Georgia State,6,6,NA,253440061,2005-12-10
76,1,6:02,1562,1562,Georgia St Full Timeout.,21,17,4,17,0.6275660984020264,0.6275660984020264,Georgia,Georgia State,6,5,NA,253440061,2005-12-10
77,1,5:45,1545,1545,Sundiata Gaines made Two Point Layup.,23,17,6,0,0.6874843645439608,0.6874843645439608,Georgia,Georgia State,6,5,NA,253440061,2005-12-10
78,1,5:45,1545,1545,Mike Mercer Steal.,23,17,6,14,0.6874843645439608,0.6874843645439608,Georgia,Georgia State,6,5,NA,253440061,2005-12-10
79,1,5:31,1531,1531,Foul on D'Andre McGrew,23,17,6,0,0.6885096717200853,0.6885096717200853,Georgia,Georgia State,6,5,NA,253440061,2005-12-10
80,1,5:31,1531,1531,Mike Mercer missed Free Throw.,23,17,6,0,0.6885096717200853,0.6885096717200853,Georgia,Georgia State,6,5,NA,253440061,2005-12-10
81,1,5:31,1531,1531,Georgia St Defensive Rebound.,23,17,6,4,0.6885096717200853,0.6885096717200853,Georgia,Georgia State,6,5,NA,253440061,2005-12-10
82,1,5:27,1527,1527,Mike Mercer missed Free Throw.,23,17,6,0,0.6888057899622507,0.6888057899622507,Georgia,Georgia State,6,5,NA,253440061,2005-12-10
83,1,5:27,1527,1527,Georgia Defensive Rebound.,23,17,6,17,0.6888057899622507,0.6888057899622507,Georgia,Georgia State,6,5,NA,253440061,2005-12-10
84,1,5:10,1510,1510,Younes Idrissi made Two Point Jumper.  Assisted by Sundiata Gaines.,25,17,8,16,0.7440911961717152,0.7440911961717152,Georgia,Georgia State,6,5,NA,253440061,2005-12-10
85,1,4:54,1494,1494,D'Andre McGrew made Two Point Layup.  Assisted by Boyd Copeland.,25,19,6,15,0.6913168096747666,0.6913168096747666,Georgia,Georgia State,6,5,NA,253440061,2005-12-10
86,1,4:39,1479,1479,Billy Humphrey missed Two Point Layup.,25,19,6,0,0.6925067729182237,0.6925067729182237,Georgia,Georgia State,6,5,NA,253440061,2005-12-10
87,1,4:39,1479,1479,Mike Mercer Offensive Rebound.,25,19,6,30,0.6925067729182237,0.6925067729182237,Georgia,Georgia State,6,5,NA,253440061,2005-12-10
88,1,4:09,1449,1449,D'Andre McGrew Steal.,25,19,6,6,0.6950010703013401,0.6950010703013401,Georgia,Georgia State,6,5,NA,253440061,2005-12-10
89,1,4:03,1443,1443,Malcolm Manier missed Three Point Jumper.,25,19,6,0,0.6955108220075715,0.6955108220075715,Georgia,Georgia State,6,5,NA,253440061,2005-12-10
90,1,4:03,1443,1443,Billy Humphrey Defensive Rebound.,25,19,6,9,0.6955108220075715,0.6955108220075715,Georgia,Georgia State,6,5,NA,253440061,2005-12-10
91,1,3:54,1434,1434,Mike Mercer made Two Point Layup.  Assisted by Billy Humphrey.,27,19,8,15,0.7513981698966603,0.7513981698966603,Georgia,Georgia State,6,5,NA,253440061,2005-12-10
92,1,3:39,1419,1419,Foul on Younes Idrissi,27,19,8,2,0.7528366575407276,0.7528366575407276,Georgia,Georgia State,6,5,NA,253440061,2005-12-10
93,1,3:37,1417,1417,Official TV Timeout.,27,19,8,16,0.7530253698795969,0.7530253698795969,Georgia,Georgia State,6,5,NA,253440061,2005-12-10
94,1,3:21,1401,1401,D'Andre McGrew missed Free Throw.,27,19,8,0,0.7545137334995153,0.7545137334995153,Georgia,Georgia State,6,5,NA,253440061,2005-12-10
95,1,3:21,1401,1401,Georgia Defensive Rebound.,27,19,8,0,0.7545137334995153,0.7545137334995153,Georgia,Georgia State,6,5,NA,253440061,2005-12-10
96,1,3:21,1401,1401,D'Andre McGrew made Free Throw.,27,20,7,14,0.7275997113499851,0.7275997113499851,Georgia,Georgia State,6,5,NA,253440061,2005-12-10
97,1,3:07,1387,1387,Younes Idrissi made Two Point Jumper.,29,20,9,13,0.7809073821320887,0.7809073821320887,Georgia,Georgia State,6,5,NA,253440061,2005-12-10
98,1,2:54,1374,1374,Foul on Sundiata Gaines,29,20,9,6,0.782130895846509,0.782130895846509,Georgia,Georgia State,6,5,NA,253440061,2005-12-10
99,1,2:48,1368,1368,Foul on Younes Idrissi,29,20,9,0,0.7826928125884156,0.7826928125884156,Georgia,Georgia State,6,5,NA,253440061,2005-12-10
100,1,2:48,1368,1368,Ranard Robinson missed Free Throw.,29,20,9,0,0.7826928125884156,0.7826928125884156,Georgia,Georgia State,6,5,NA,253440061,2005-12-10
101,1,2:48,1368,1368,Georgia Defensive Rebound.,29,20,9,0,0.7826928125884156,0.7826928125884156,Georgia,Georgia State,6,5,NA,253440061,2005-12-10
102,1,2:48,1368,1368,Ranard Robinson made Free Throw.,29,21,8,35,0.7575046992377154,0.7575046992377154,Georgia,Georgia State,6,5,NA,253440061,2005-12-10
103,1,2:13,1333,1333,Boyd Copeland missed Two Point Layup.,29,21,8,0,0.7606582652881876,0.7606582652881876,Georgia,Georgia State,6,5,NA,253440061,2005-12-10
104,1,2:13,1333,1333,Rashad Chase Offensive Rebound.,29,21,8,2,0.7606582652881876,0.7606582652881876,Georgia,Georgia State,6,5,NA,253440061,2005-12-10
105,1,2:11,1331,1331,Rashad Chase made Two Point Tip Shot.,29,23,6,9,0.7043229529898387,0.7043229529898387,Georgia,Georgia State,6,5,NA,253440061,2005-12-10
106,1,2:02,1322,1322,Sundiata Gaines missed Three Point Jumper.,29,23,6,0,0.7050306299893409,0.7050306299893409,Georgia,Georgia State,6,5,NA,253440061,2005-12-10
107,1,2:02,1322,1322,Ranard Robinson Defensive Rebound.,29,23,6,20,0.7050306299893409,0.7050306299893409,Georgia,Georgia State,6,5,NA,253440061,2005-12-10
108,1,1:42,1302,1302,Herman Favors missed Two Point Layup.,29,23,6,0,0.7066362646465685,0.7066362646465685,Georgia,Georgia State,6,5,NA,253440061,2005-12-10
109,1,1:42,1302,1302,Sundiata Gaines Defensive Rebound.,29,23,6,17,0.7066362646465685,0.7066362646465685,Georgia,Georgia State,6,5,NA,253440061,2005-12-10
110,1,1:25,1285,1285,Steve Newman missed Three Point Jumper.,29,23,6,0,0.7080483264794263,0.7080483264794263,Georgia,Georgia State,6,5,NA,253440061,2005-12-10
111,1,1:25,1285,1285,Rashad Chase Defensive Rebound.,29,23,6,6,0.7080483264794263,0.7080483264794263,Georgia,Georgia State,6,5,NA,253440061,2005-12-10
112,1,1:19,1279,1279,Sundiata Gaines Steal.,29,23,6,14,0.7085594007731149,0.7085594007731149,Georgia,Georgia State,6,5,NA,253440061,2005-12-10
113,1,1:05,1265,1265,Kendrick Johnson missed Two Point Layup.,29,23,6,0,0.7097816922985415,0.7097816922985415,Georgia,Georgia State,6,5,NA,253440061,2005-12-10
114,1,1:05,1265,1265,Kendrick Johnson Offensive Rebound.,29,23,6,2,0.7097816922985415,0.7097816922985415,Georgia,Georgia State,6,5,NA,253440061,2005-12-10
115,1,1:03,1263,1263,Kendrick Johnson missed Two Point Layup.,29,23,6,0,0.7099599800344327,0.7099599800344327,Georgia,Georgia State,6,5,NA,253440061,2005-12-10
116,1,1:03,1263,1263,Georgia St Defensive Rebound.,29,23,6,12,0.7099599800344327,0.7099599800344327,Georgia,Georgia State,6,5,NA,253440061,2005-12-10
117,1,0:51,1251,1251,Boyd Copeland missed Two Point Jumper.,29,23,6,0,0.7110507925631111,0.7110507925631111,Georgia,Georgia State,6,5,NA,253440061,2005-12-10
118,1,0:51,1251,1251,Kendrick Johnson Defensive Rebound.,29,23,6,22,0.7110507925631111,0.7110507925631111,Georgia,Georgia State,6,5,NA,253440061,2005-12-10
119,1,0:29,1229,1229,Kendrick Johnson made Two Point Jumper.,31,23,8,22,0.7710659659096554,0.7710659659096554,Georgia,Georgia State,6,5,NA,253440061,2005-12-10
120,1,0:07,1207,1207,Herman Favors missed Two Point Layup.,31,23,8,0,0.7736570730396609,0.7736570730396609,Georgia,Georgia State,6,5,NA,253440061,2005-12-10
121,1,0:07,1207,1207,Sundiata Gaines Defensive Rebound.,31,23,8,7,0.7736570730396609,0.7736570730396609,Georgia,Georgia State,6,5,NA,253440061,2005-12-10
122,1,0:00,1200,1200,End of the 1st Half.,31,23,8,0,0.774489981219977,0.774489981219977,Georgia,Georgia State,6,5,NA,253440061,2005-12-10
123,2,20:00,1200,1200,PLAY,31,23,8,35,0.774489981219977,0.774489981219977,Georgia,Georgia State,6,5,NA,253440061,2005-12-10
124,2,19:25,1165,1165,Channing Toney made Two Point Layup.  Assisted by Steve Newman.,33,23,10,13,0.8279289234030652,0.8279289234030652,Georgia,Georgia State,6,5,NA,253440061,2005-12-10
125,2,19:12,1152,1152,Herman Favors made Two Point Jumper.,33,25,8,24,0.7799060534380687,0.7799060534380687,Georgia,Georgia State,6,5,NA,253440061,2005-12-10
126,2,18:48,1128,1128,Deven Dickerson missed Two Point Layup.,33,25,8,0,0.7825098243906752,0.7825098243906752,Georgia,Georgia State,6,5,NA,253440061,2005-12-10
127,2,18:48,1128,1128,Kendrick Johnson Defensive Rebound.,33,25,8,18,0.7825098243906752,0.7825098243906752,Georgia,Georgia State,6,5,NA,253440061,2005-12-10
128,2,18:30,1110,1110,Malcolm Manier made Two Point Layup.,33,27,6,15,0.7248974756320855,0.7248974756320855,Georgia,Georgia State,6,5,NA,253440061,2005-12-10
129,2,18:15,1095,1095,Foul on Justin Billingslea,33,27,6,6,0.7263501513928857,0.7263501513928857,Georgia,Georgia State,6,5,NA,253440061,2005-12-10
130,2,18:09,1089,1089,Younes Idrissi missed Two Point Jumper.,33,27,6,0,0.7269381858001617,0.7269381858001617,Georgia,Georgia State,6,5,NA,253440061,2005-12-10
131,2,18:09,1089,1089,Rashad Chase Defensive Rebound.,33,27,6,32,0.7269381858001617,0.7269381858001617,Georgia,Georgia State,6,5,NA,253440061,2005-12-10
132,2,17:37,1057,1057,Boyd Copeland missed Two Point Layup.,33,27,6,0,0.7301752579745123,0.7301752579745123,Georgia,Georgia State,6,5,NA,253440061,2005-12-10
133,2,17:37,1057,1057,Sundiata Gaines Defensive Rebound.,33,27,6,4,0.7301752579745123,0.7301752579745123,Georgia,Georgia State,6,5,NA,253440061,2005-12-10
134,2,17:33,1053,1053,Billy Humphrey made Two Point Layup.  Assisted by Sundiata Gaines.,35,27,8,6,0.7908722173637125,0.7908722173637125,Georgia,Georgia State,6,5,NA,253440061,2005-12-10
135,2,17:27,1047,1047,Foul on Billy Humphrey,35,27,8,17,0.7915856599384629,0.7915856599384629,Georgia,Georgia State,6,5,NA,253440061,2005-12-10
136,2,17:10,1030,1030,Foul on Billy Humphrey,35,27,8,12,0.7936639365537491,0.7936639365537491,Georgia,Georgia State,6,5,NA,253440061,2005-12-10
137,2,16:58,1018,1018,Justin Billingslea made Two Point Layup.  Assisted by Herman Favors.,35,29,6,17,0.7344588180416195,0.7344588180416195,Georgia,Georgia State,6,5,NA,253440061,2005-12-10
138,2,16:41,1001,1001,Billy Humphrey made Three Point Jumper.  Assisted by Sundiata Gaines.,38,29,9,23,0.8237056736953667,0.8237056736953667,Georgia,Georgia State,6,5,NA,253440061,2005-12-10
139,2,16:18,978,978,D'Andre McGrew made Two Point Layup.,38,31,7,14,0.771486434302484,0.771486434302484,Georgia,Georgia State,6,5,NA,253440061,2005-12-10
140,2,16:04,964,964,Channing Toney missed Two Point Jumper.,38,31,7,0,0.7734867665239482,0.7734867665239482,Georgia,Georgia State,6,5,NA,253440061,2005-12-10
141,2,16:04,964,964,Channing Toney Offensive Rebound.,38,31,7,3,0.7734867665239482,0.7734867665239482,Georgia,Georgia State,6,5,NA,253440061,2005-12-10
142,2,16:01,961,961,Channing Toney made Two Point Layup.,40,31,9,14,0.8294937294315302,0.8294937294315302,Georgia,Georgia State,6,5,NA,253440061,2005-12-10
143,2,15:47,947,947,D'Andre McGrew missed Two Point Layup.,40,31,9,0,0.8314075668703116,0.8314075668703116,Georgia,Georgia State,6,5,NA,253440061,2005-12-10
144,2,15:47,947,947,Billy Humphrey Defensive Rebound.,40,31,9,10,0.8314075668703116,0.8314075668703116,Georgia,Georgia State,6,5,NA,253440061,2005-12-10
145,2,15:37,937,937,Channing Toney made Two Point Layup.,42,31,11,6,0.8766830388996601,0.8766830388996601,Georgia,Georgia State,6,5,NA,253440061,2005-12-10
146,2,15:31,931,931,Georgia St Full Timeout.,42,31,11,10,0.8773799092004662,0.8773799092004662,Georgia,Georgia State,6,4,NA,253440061,2005-12-10
147,2,15:21,921,921,Mike Mercer Steal.,42,31,11,10,0.8784980652297828,0.8784980652297828,Georgia,Georgia State,6,4,NA,253440061,2005-12-10
148,2,15:11,911,911,Foul on Younes Idrissi,42,31,11,0,0.8795711703702109,0.8795711703702109,Georgia,Georgia State,6,4,NA,253440061,2005-12-10
149,2,15:11,911,911,Official TV Timeout.,42,31,11,43,0.8795711703702109,0.8795711703702109,Georgia,Georgia State,6,4,NA,253440061,2005-12-10
150,2,14:28,868,868,Justin Billingslea made Three Point Jumper.,42,34,8,10,0.8140211049113858,0.8140211049113858,Georgia,Georgia State,6,4,NA,253440061,2005-12-10
151,2,14:18,858,858,Sundiata Gaines missed Three Point Jumper.,42,34,8,0,0.8150925738552587,0.8150925738552587,Georgia,Georgia State,6,4,NA,253440061,2005-12-10
152,2,14:18,858,858,Herman Favors Defensive Rebound.,42,34,8,5,0.8150925738552587,0.8150925738552587,Georgia,Georgia State,6,4,NA,253440061,2005-12-10
153,2,14:13,853,853,Georgia St Full Timeout.,42,34,8,2,0.8156347081119434,0.8156347081119434,Georgia,Georgia State,6,3,NA,253440061,2005-12-10
154,2,14:11,851,851,Herman Favors made Two Point Layup.,42,36,6,20,0.7533157936163957,0.7533157936163957,Georgia,Georgia State,6,3,NA,253440061,2005-12-10
155,2,13:51,831,831,Sundiata Gaines missed Two Point Layup.,42,36,6,0,0.7554085643060805,0.7554085643060805,Georgia,Georgia State,6,3,NA,253440061,2005-12-10
156,2,13:51,831,831,Sundiata Gaines Offensive Rebound.,42,36,6,2,0.7554085643060805,0.7554085643060805,Georgia,Georgia State,6,3,NA,253440061,2005-12-10
157,2,13:49,829,829,Foul on D'Andre McGrew,42,36,6,0,0.7556260449291836,0.7556260449291836,Georgia,Georgia State,6,3,NA,253440061,2005-12-10
158,2,13:49,829,829,Sundiata Gaines made Free Throw.,43,36,7,0,0.7886801696748333,0.7886801696748333,Georgia,Georgia State,6,3,NA,253440061,2005-12-10
159,2,13:49,829,829,Sundiata Gaines made Free Throw.,44,36,8,13,0.818338242214095,0.818338242214095,Georgia,Georgia State,6,3,NA,253440061,2005-12-10
160,2,13:36,816,816,Foul on Levi Stukes,44,36,8,0,0.8199029777442649,0.8199029777442649,Georgia,Georgia State,6,3,NA,253440061,2005-12-10
161,2,13:36,816,816,Herman Favors made Free Throw.,44,37,7,0,0.7902161844174768,0.7902161844174768,Georgia,Georgia State,6,3,NA,253440061,2005-12-10
162,2,13:36,816,816,Herman Favors made Free Throw.,44,38,6,14,0.7570856945912738,0.7570856945912738,Georgia,Georgia State,6,3,NA,253440061,2005-12-10
163,2,13:22,802,802,Levi Stukes missed Three Point Jumper.,44,38,6,0,0.7587620789032492,0.7587620789032492,Georgia,Georgia State,6,3,NA,253440061,2005-12-10
164,2,13:22,802,802,Boyd Copeland Defensive Rebound.,44,38,6,14,0.7587620789032492,0.7587620789032492,Georgia,Georgia State,6,3,NA,253440061,2005-12-10
165,2,13:08,788,788,D'Andre McGrew missed Two Point Jumper.,44,38,6,5,0.7605686917954981,0.7605686917954981,Georgia,Georgia State,6,3,NA,253440061,2005-12-10
166,2,13:03,783,783,Ranard Robinson Offensive Rebound.,44,38,6,0,0.7612496445533792,0.7612496445533792,Georgia,Georgia State,6,3,NA,253440061,2005-12-10
167,2,13:03,783,783,Ranard Robinson missed Two Point Layup.,44,38,6,0,0.7612496445533792,0.7612496445533792,Georgia,Georgia State,6,3,NA,253440061,2005-12-10
168,2,13:03,783,783,Dave Bliss Defensive Rebound.,44,38,6,0,0.7612496445533792,0.7612496445533792,Georgia,Georgia State,6,3,NA,253440061,2005-12-10
169,2,13:03,783,783,Foul on D'Andre McGrew,44,38,6,7,0.7612496445533792,0.7612496445533792,Georgia,Georgia State,6,3,NA,253440061,2005-12-10
